smartctl 7.2 2020-12-30 r5155 [x86_64-linux-5.15.0-25-generic] (local build)
Copyright (C) 2002-20, Bruce Allen, Christian Franke, www.smartmontools.org

=== START OF INFORMATION SECTION ===
Device Model:     WDC WD161KFGX-68AFPN0
Serial Number:    3WJ5YP6P
LU WWN Device Id: 5 000cca 284dee44b
Firmware Version: 83.00A83
User Capacity:    16,000,900,661,248 bytes [16.0 TB]
Sector Sizes:     512 bytes logical, 4096 bytes physical
Rotation Rate:    7200 rpm
Form Factor:      3.5 inches
Device is:        Not in smartctl database [for details use: -P showall]
ATA Version is:   ACS-4 published, ANSI INCITS 529-2018
SATA Version is:  SATA 3.3, 6.0 Gb/s (current: 6.0 Gb/s)
Local Time is:    Wed May 11 17:38:00 2022 PDT
SMART support is: Available - device has SMART capability.
SMART support is: Enabled
AAM feature is:   Unavailable
APM level is:     254 (maximum performance)
Rd look-ahead is: Enabled
Write cache is:   Enabled
DSN feature is:   Unavailable
ATA Security is:  Disabled, frozen [SEC2]
Wt Cache Reorder: Enabled

=== START OF READ SMART DATA SECTION ===
SMART overall-health self-assessment test result: PASSED

General SMART Values:
Offline data collection status:  (0x80)	Offline data collection activity
					was never started.
					Auto Offline Data Collection: Enabled.
Self-test execution status:      (   0)	The previous self-test routine completed
					without error or no self-test has ever 
					been run.
Total time to complete Offline 
data collection: 		(  101) seconds.
Offline data collection
capabilities: 			 (0x5b) SMART execute Offline immediate.
					Auto Offline data collection on/off support.
					Suspend Offline collection upon new
					command.
					Offline surface scan supported.
					Self-test supported.
					No Conveyance Self-test supported.
					Selective Self-test supported.
SMART capabilities:            (0x0003)	Saves SMART data before entering
					power-saving mode.
					Supports SMART auto save timer.
Error logging capability:        (0x01)	Error logging supported.
					General Purpose Logging supported.
Short self-test routine 
recommended polling time: 	 (   2) minutes.
Extended self-test routine
recommended polling time: 	 (1888) minutes.
SCT capabilities: 	       (0x003d)	SCT Status supported.
					SCT Error Recovery Control supported.
					SCT Feature Control supported.
					SCT Data Table supported.

SMART Attributes Data Structure revision number: 16
Vendor Specific SMART Attributes with Thresholds:
ID# ATTRIBUTE_NAME          FLAGS    VALUE WORST THRESH FAIL RAW_VALUE
  1 Raw_Read_Error_Rate     PO-R--   100   100   001    -    0
  2 Throughput_Performance  --S---   100   100   054    -    0
  3 Spin_Up_Time            POS---   095   095   001    -    208
  4 Start_Stop_Count        -O--C-   100   100   000    -    3
  5 Reallocated_Sector_Ct   PO--CK   100   100   001    -    0
  7 Seek_Error_Rate         -O-R--   100   100   001    -    0
  8 Seek_Time_Performance   --S---   100   100   020    -    0
  9 Power_On_Hours          -O--C-   100   100   000    -    0
 10 Spin_Retry_Count        -O--C-   100   100   001    -    0
 12 Power_Cycle_Count       -O--CK   100   100   000    -    3
 22 Unknown_Attribute       PO---K   100   100   025    -    100
192 Power-Off_Retract_Count -O--CK   100   100   000    -    3
193 Load_Cycle_Count        -O--C-   100   100   000    -    3
194 Temperature_Celsius     -O----   060   060   000    -    34 (Min/Max 20/34)
196 Reallocated_Event_Count -O--CK   100   100   000    -    0
197 Current_Pending_Sector  -O---K   100   100   000    -    0
198 Offline_Uncorrectable   ---R--   100   100   000    -    0
199 UDMA_CRC_Error_Count    -O-R--   100   100   000    -    0
                            ||||||_ K auto-keep
                            |||||__ C event count
                            ||||___ R error rate
                            |||____ S speed/performance
                            ||_____ O updated online
                            |______ P prefailure warning

General Purpose Log Directory Version 1
SMART           Log Directory Version 1 [multi-sector log support]
Address    Access  R/W   Size  Description
0x00       GPL,SL  R/O      1  Log Directory
0x01           SL  R/O      1  Summary SMART error log
0x02           SL  R/O      1  Comprehensive SMART error log
0x03       GPL     R/O      1  Ext. Comprehensive SMART error log
0x04       GPL     R/O    256  Device Statistics log
0x04       SL      R/O    255  Device Statistics log
0x06           SL  R/O      1  SMART self-test log
0x07       GPL     R/O      1  Extended self-test log
0x08       GPL     R/O      2  Power Conditions log
0x09           SL  R/W      1  Selective self-test log
0x0c       GPL     R/O  30001  Pending Defects log
0x10       GPL     R/O      1  NCQ Command Error log
0x11       GPL     R/O      1  SATA Phy Event Counters log
0x12       GPL     R/O      1  SATA NCQ Non-Data log
0x13       GPL     R/O      1  SATA NCQ Send and Receive log
0x15       GPL     R/W      1  Rebuild Assist log
0x21       GPL     R/O      1  Write stream error log
0x22       GPL     R/O      1  Read stream error log
0x24       GPL     R/O    256  Current Device Internal Status Data log
0x25       GPL     R/O    256  Saved Device Internal Status Data log
0x2f       GPL     -        1  Set Sector Configuration
0x30       GPL,SL  R/O      9  IDENTIFY DEVICE data log
0x80-0x9f  GPL,SL  R/W     16  Host vendor specific log
0xe0       GPL,SL  R/W      1  SCT Command/Status
0xe1       GPL,SL  R/W      1  SCT Data Transfer

SMART Extended Comprehensive Error Log Version: 1 (1 sectors)
No Errors Logged

SMART Extended Self-test Log Version: 1 (1 sectors)
Num  Test_Description    Status                  Remaining  LifeTime(hours)  LBA_of_first_error
# 1  Short offline       Completed without error       00%         0         -

SMART Selective self-test log data structure revision number 1
 SPAN  MIN_LBA  MAX_LBA  CURRENT_TEST_STATUS
    1        0        0  Not_testing
    2        0        0  Not_testing
    3        0        0  Not_testing
    4        0        0  Not_testing
    5        0        0  Not_testing
Selective self-test flags (0x0):
  After scanning selected spans, do NOT read-scan remainder of disk.
If Selective self-test is pending on power-up, resume after 0 minute delay.

SCT Status Version:                  3
SCT Version (vendor specific):       256 (0x0100)
Device State:                        Active (0)
Current Temperature:                    34 Celsius
Power Cycle Min/Max Temperature:     25/34 Celsius
Lifetime    Min/Max Temperature:     20/34 Celsius
Under/Over Temperature Limit Count:   0/0
SMART Status:                        0xc24f (PASSED)
Minimum supported ERC Time Limit:    70 (7.0 seconds)

SCT Temperature History Version:     2
Temperature Sampling Period:         1 minute
Temperature Logging Interval:        1 minute
Min/Max recommended Temperature:      0/60 Celsius
Min/Max Temperature Limit:           -40/70 Celsius
Temperature History Size (Index):    128 (63)

Index    Estimated Time   Temperature Celsius
  64    2022-05-11 15:31     0  -
 ...    ..( 62 skipped).    ..  -
 127    2022-05-11 16:34     0  -
   0    2022-05-11 16:35    22  ***
   1    2022-05-11 16:36    22  ***
   2    2022-05-11 16:37    22  ***
   3    2022-05-11 16:38    23  ****
   4    2022-05-11 16:39    23  ****
   5    2022-05-11 16:40    23  ****
   6    2022-05-11 16:41    25  ******
   7    2022-05-11 16:42    25  ******
   8    2022-05-11 16:43    26  *******
 ...    ..(  2 skipped).    ..  *******
  11    2022-05-11 16:46    26  *******
  12    2022-05-11 16:47    27  ********
 ...    ..(  3 skipped).    ..  ********
  16    2022-05-11 16:51    27  ********
  17    2022-05-11 16:52    28  *********
  18    2022-05-11 16:53    28  *********
  19    2022-05-11 16:54    28  *********
  20    2022-05-11 16:55    29  **********
 ...    ..(  9 skipped).    ..  **********
  30    2022-05-11 17:05    29  **********
  31    2022-05-11 17:06    30  ***********
 ...    ..(  4 skipped).    ..  ***********
  36    2022-05-11 17:11    30  ***********
  37    2022-05-11 17:12    31  ************
 ...    ..(  3 skipped).    ..  ************
  41    2022-05-11 17:16    31  ************
  42    2022-05-11 17:17    32  *************
 ...    ..(  8 skipped).    ..  *************
  51    2022-05-11 17:26    32  *************
  52    2022-05-11 17:27    33  **************
 ...    ..(  6 skipped).    ..  **************
  59    2022-05-11 17:34    33  **************
  60    2022-05-11 17:35    34  ***************
  61    2022-05-11 17:36    34  ***************
  62    2022-05-11 17:37    34  ***************
  63    2022-05-11 17:38     0  -

SCT Error Recovery Control:
           Read:     70 (7.0 seconds)
          Write:     70 (7.0 seconds)

Device Statistics (GP Log 0x04)
Page  Offset Size        Value Flags Description
0x01  =====  =               =  ===  == General Statistics (rev 1) ==
0x01  0x008  4               3  ---  Lifetime Power-On Resets
0x01  0x010  4               0  ---  Power-on Hours
0x01  0x018  6               0  ---  Logical Sectors Written
0x01  0x020  6               0  ---  Number of Write Commands
0x01  0x028  6           84067  ---  Logical Sectors Read
0x01  0x030  6            1856  ---  Number of Read Commands
0x01  0x038  6         3549000  ---  Date and Time TimeStamp
0x03  =====  =               =  ===  == Rotating Media Statistics (rev 1) ==
0x03  0x008  4               0  ---  Spindle Motor Power-on Hours
0x03  0x010  4               0  ---  Head Flying Hours
0x03  0x018  4               3  ---  Head Load Events
0x03  0x020  4               0  ---  Number of Reallocated Logical Sectors
0x03  0x028  4               0  ---  Read Recovery Attempts
0x03  0x030  4               0  ---  Number of Mechanical Start Failures
0x04  =====  =               =  ===  == General Errors Statistics (rev 1) ==
0x04  0x008  4               0  ---  Number of Reported Uncorrectable Errors
0x04  0x010  4               0  ---  Resets Between Cmd Acceptance and Completion
0x05  =====  =               =  ===  == Temperature Statistics (rev 1) ==
0x05  0x008  1              34  ---  Current Temperature
0x05  0x010  1               -  N--  Average Short Term Temperature
0x05  0x018  1               -  N--  Average Long Term Temperature
0x05  0x020  1              34  ---  Highest Temperature
0x05  0x028  1              20  ---  Lowest Temperature
0x05  0x030  1               -  N--  Highest Average Short Term Temperature
0x05  0x038  1               -  N--  Lowest Average Short Term Temperature
0x05  0x040  1               -  N--  Highest Average Long Term Temperature
0x05  0x048  1               -  N--  Lowest Average Long Term Temperature
0x05  0x050  4               0  ---  Time in Over-Temperature
0x05  0x058  1              60  ---  Specified Maximum Operating Temperature
0x05  0x060  4               0  ---  Time in Under-Temperature
0x05  0x068  1               0  ---  Specified Minimum Operating Temperature
0x06  =====  =               =  ===  == Transport Statistics (rev 1) ==
0x06  0x008  4              16  ---  Number of Hardware Resets
0x06  0x010  4               5  ---  Number of ASR Events
0x06  0x018  4               0  ---  Number of Interface CRC Errors
0xff  =====  =               =  ===  == Vendor Specific Statistics (rev 1) ==
0xff  0x040  7               0  ---  Vendor Specific
0xff  0x048  7               0  ---  Vendor Specific
0xff  0x050  7               0  ---  Vendor Specific
0xff  0x058  7               0  ---  Vendor Specific
0xff  0x060  7               0  ---  Vendor Specific
0xff  0x068  7               0  ---  Vendor Specific
0xff  0x070  7               0  ---  Vendor Specific
0xff  0x078  7               0  ---  Vendor Specific
0xff  0x080  7               0  ---  Vendor Specific
                                |||_ C monitored condition met
                                ||__ D supports DSN
                                |___ N normalized value

Pending Defects log (GP Log 0x0c)
No Defects Logged

SATA Phy Event Counters (GP Log 0x11)
ID      Size     Value  Description
0x0001  2            0  Command failed due to ICRC error
0x0002  2            0  R_ERR response for data FIS
0x0003  2            0  R_ERR response for device-to-host data FIS
0x0004  2            0  R_ERR response for host-to-device data FIS
0x0005  2            0  R_ERR response for non-data FIS
0x0006  2            0  R_ERR response for device-to-host non-data FIS
0x0007  2            0  R_ERR response for host-to-device non-data FIS
0x0008  2            0  Device-to-host non-data FIS retries
0x0009  2           12  Transition from drive PhyRdy to drive PhyNRdy
0x000a  2           10  Device-to-host register FISes sent due to a COMRESET
0x000b  2            0  CRC errors within host-to-device FIS
0x000d  2            0  Non-CRC errors within host-to-device FIS

