smartctl 7.4 2023-08-01 r5530 [x86_64-linux-6.12.48+deb13-amd64] (local build)
Copyright (C) 2002-23, Bruce Allen, Christian Franke, www.smartmontools.org

=== START OF INFORMATION SECTION ===
Device Model:     TS2GSSD25H-S
Serial Number:    20140115B19471063903
Firmware Version: 20121012
User Capacity:    1,979,228,160 bytes [1.97 GB]
Sector Size:      512 bytes logical/physical
Rotation Rate:    Solid State Device
TRIM Command:     Unavailable
Device is:        Not in smartctl database 7.3/5894
ATA Version is:   ATA/ATAPI-7 (minor revision not indicated)
Local Time is:    Fri Oct 10 17:37:35 2025 CEST
SMART support is: Available - device has SMART capability.
SMART support is: Enabled
AAM feature is:   Unavailable
APM feature is:   Unavailable
Rd look-ahead is: Unavailable
Write cache is:   Enabled
DSN feature is:   Unavailable
ATA Security is:  Disabled, NOT FROZEN [SEC1]
Wt Cache Reorder: Unavailable

=== START OF READ SMART DATA SECTION ===
SMART Status command failed: scsi error unsupported scsi opcode
SMART overall-health self-assessment test result: PASSED
Warning: This result is based on an Attribute check.

General SMART Values:
Offline data collection status:  (0x30)	Offline data collection activity
					is in a Reserved state.
					Auto Offline Data Collection: Disabled.
Total time to complete Offline 
data collection: 		(   50) seconds.
Offline data collection
capabilities: 			 (0x00) 	Offline data collection not supported.
SMART capabilities:            (0x0002)	Does not save SMART data before
					entering power-saving mode.
					Supports SMART auto save timer.
Error logging capability:        (0x00)	Error logging NOT supported.
					No General Purpose Logging support.

SMART Attributes Data Structure revision number: 1
Vendor Specific SMART Attributes with Thresholds:
ID# ATTRIBUTE_NAME          FLAGS    VALUE WORST THRESH FAIL RAW_VALUE
  1 Raw_Read_Error_Rate     ------   100   100   000    -    0
  2 Throughput_Performance  ------   100   100   000    -    0
  5 Reallocated_Sector_Ct   ------   100   100   000    -    0
  7 Unknown_SSD_Attribute   ------   100   100   000    -    0
  8 Unknown_SSD_Attribute   ------   100   100   000    -    0
 12 Power_Cycle_Count       ------   100   100   000    -    725
195 Hardware_ECC_Recovered  ------   100   100   000    -    0
196 Reallocated_Event_Count ------   100   100   000    -    0
197 Current_Pending_Sector  ------   100   100   000    -    0
198 Offline_Uncorrectable   ------   100   100   000    -    0
199 UDMA_CRC_Error_Count    ------   100   100   000    -    0
200 Unknown_SSD_Attribute   ------   100   100   000    -    0
                            ||||||_ K auto-keep
                            |||||__ C event count
                            ||||___ R error rate
                            |||____ S speed/performance
                            ||_____ O updated online
                            |______ P prefailure warning

Read SMART Log Directory failed: scsi error unsupported scsi opcode

General Purpose Log Directory not supported

SMART Extended Comprehensive Error Log (GP Log 0x03) not supported

SMART Error Log not supported

SMART Extended Self-test Log (GP Log 0x07) not supported

Read SMART Self-test Log failed: scsi error unsupported scsi opcode

Selective Self-tests/Logging not supported

SCT Commands not supported

Device Statistics (GP/SMART Log 0x04) not supported

Pending Defects log (GP Log 0x0c) not supported

SATA Phy Event Counters (GP Log 0x11) not supported

