smartctl 7.2 2020-12-30 r5155 [x86_64-linux-6.1.0-0.deb11.13-amd64] (local build)
Copyright (C) 2002-20, Bruce Allen, Christian Franke, www.smartmontools.org

=== START OF INFORMATION SECTION ===
Model Family:     Hitachi/HGST Travelstar Z5K500
Device Model:     HGST HTS545050A7E680
Serial Number:    TEA55D4N05DTWW
LU WWN Device Id: 5 000cca 7adc275ea
Firmware Version: GG2OAF10
User Capacity:    500,107,862,016 bytes [500 GB]
Sector Sizes:     512 bytes logical, 4096 bytes physical
Rotation Rate:    5400 rpm
Form Factor:      2.5 inches
Device is:        In smartctl database [for details use: -P show]
ATA Version is:   ATA8-ACS T13/1699-D revision 6
SATA Version is:  SATA 2.6, 6.0 Gb/s (current: 3.0 Gb/s)
Local Time is:    Sun Feb 18 22:26:07 2024 +08
SMART support is: Available - device has SMART capability.
SMART support is: Enabled
AAM feature is:   Unavailable
APM level is:     254 (maximum performance)
Rd look-ahead is: Enabled
Write cache is:   Enabled
DSN feature is:   Unavailable
ATA Security is:  Disabled, NOT FROZEN [SEC1]
Wt Cache Reorder: Enabled

=== START OF READ SMART DATA SECTION ===
SMART overall-health self-assessment test result: PASSED

General SMART Values:
Offline data collection status:  (0x00) Offline data collection activity
                                        was never started.
                                        Auto Offline Data Collection: Disabled.
Self-test execution status:      (   0) The previous self-test routine completed
                                        without error or no self-test has ever
                                        been run.
Total time to complete Offline
data collection:                (   45) seconds.
Offline data collection
capabilities:                    (0x5b) SMART execute Offline immediate.
                                        Auto Offline data collection on/off support.
                                        Suspend Offline collection upon new
                                        command.
                                        Offline surface scan supported.
                                        Self-test supported.
                                        No Conveyance Self-test supported.
                                        Selective Self-test supported.
SMART capabilities:            (0x0003) Saves SMART data before entering
                                        power-saving mode.
                                        Supports SMART auto save timer.
Error logging capability:        (0x01) Error logging supported.
                                        General Purpose Logging supported.
Short self-test routine
recommended polling time:        (   2) minutes.
Extended self-test routine
recommended polling time:        ( 107) minutes.
SCT capabilities:              (0x003d) SCT Status supported.
                                        SCT Error Recovery Control supported.
                                        SCT Feature Control supported.
                                        SCT Data Table supported.

SMART Attributes Data Structure revision number: 16
Vendor Specific SMART Attributes with Thresholds:
ID# ATTRIBUTE_NAME          FLAGS    VALUE WORST THRESH FAIL RAW_VALUE
  1 Raw_Read_Error_Rate     PO-R--   100   100   062    -    0
  2 Throughput_Performance  P-S---   100   100   040    -    0
  3 Spin_Up_Time            POS---   253   253   033    -    1
  4 Start_Stop_Count        -O--C-   082   082   000    -    29107
  5 Reallocated_Sector_Ct   PO--CK   100   100   005    -    0
  7 Seek_Error_Rate         PO-R--   100   100   067    -    0
  8 Seek_Time_Performance   P-S---   100   100   040    -    0
  9 Power_On_Hours          -O--C-   076   076   000    -    10597
 10 Spin_Retry_Count        PO--C-   100   100   060    -    0
 12 Power_Cycle_Count       -O--CK   099   099   000    -    2109
191 G-Sense_Error_Rate      -O-R--   100   100   000    -    0
192 Power-Off_Retract_Count -O--CK   100   100   000    -    173
193 Load_Cycle_Count        -O--C-   098   098   000    -    29125
194 Temperature_Celsius     -O----   153   153   000    -    39 (Min/Max 22/44)
196 Reallocated_Event_Count -O--CK   100   100   000    -    0
197 Current_Pending_Sector  -O---K   100   100   000    -    0
198 Offline_Uncorrectable   ---R--   100   100   000    -    0
199 UDMA_CRC_Error_Count    -O-R--   200   200   000    -    0
223 Load_Retry_Count        -O-R--   100   100   000    -    0
                            ||||||_ K auto-keep
                            |||||__ C event count
                            ||||___ R error rate
                            |||____ S speed/performance
                            ||_____ O updated online
                            |______ P prefailure warning

General Purpose Log Directory Version 1
SMART           Log Directory Version 1 [multi-sector log support]
Address    Access  R/W   Size  Description
0x00       GPL,SL  R/O      1  Log Directory
0x01           SL  R/O      1  Summary SMART error log
0x02           SL  R/O      1  Comprehensive SMART error log
0x03       GPL     R/O      1  Ext. Comprehensive SMART error log
0x06           SL  R/O      1  SMART self-test log
0x07       GPL     R/O      1  Extended self-test log
0x09           SL  R/W      1  Selective self-test log
0x10       GPL     R/O      1  NCQ Command Error log
0x11       GPL     R/O      1  SATA Phy Event Counters log
0x80-0x9f  GPL,SL  R/W     16  Host vendor specific log
0xe0       GPL,SL  R/W      1  SCT Command/Status
0xe1       GPL,SL  R/W      1  SCT Data Transfer

SMART Extended Comprehensive Error Log Version: 1 (1 sectors)
No Errors Logged

SMART Extended Self-test Log Version: 1 (1 sectors)
Num  Test_Description    Status                  Remaining  LifeTime(hours)  LBA_of_first_error
# 1  Short offline       Completed without error       00%     10597         -
# 2  Extended offline    Completed without error       00%     10520         -
# 3  Extended offline    Aborted by host               90%     10518         -

SMART Selective self-test log data structure revision number 1
 SPAN  MIN_LBA  MAX_LBA  CURRENT_TEST_STATUS
    1        0        0  Not_testing
    2        0        0  Not_testing
    3        0        0  Not_testing
    4        0        0  Not_testing
    5        0        0  Not_testing
Selective self-test flags (0x0):
  After scanning selected spans, do NOT read-scan remainder of disk.
If Selective self-test is pending on power-up, resume after 0 minute delay.

SCT Status Version:                  3
SCT Version (vendor specific):       256 (0x0100)
Device State:                        Active (0)
Current Temperature:                    39 Celsius
Power Cycle Min/Max Temperature:     34/40 Celsius
Lifetime    Min/Max Temperature:     22/44 Celsius
Specified Max Operating Temperature:    28 Celsius
Under/Over Temperature Limit Count:   0/0

SCT Temperature History Version:     2
Temperature Sampling Period:         1 minute
Temperature Logging Interval:        1 minute
Min/Max recommended Temperature:      0/60 Celsius
Min/Max Temperature Limit:           -40/65 Celsius
Temperature History Size (Index):    128 (52)

Index    Estimated Time   Temperature Celsius
  53    2024-02-18 20:19    35  ****************
 ...    ..(  2 skipped).    ..  ****************
  56    2024-02-18 20:22    35  ****************
  57    2024-02-18 20:23    34  ***************
  58    2024-02-18 20:24    34  ***************
  59    2024-02-18 20:25    35  ****************
  60    2024-02-18 20:26    35  ****************
  61    2024-02-18 20:27    35  ****************
  62    2024-02-18 20:28    34  ***************
 ...    ..( 19 skipped).    ..  ***************
  82    2024-02-18 20:48    34  ***************
  83    2024-02-18 20:49    35  ****************
...    ..(  9 skipped).    ..  ****************
  93    2024-02-18 20:59    35  ****************
  94    2024-02-18 21:00    34  ***************
  95    2024-02-18 21:01    34  ***************
  96    2024-02-18 21:02    35  ****************
  97    2024-02-18 21:03    34  ***************
 ...    ..(  8 skipped).    ..  ***************
 106    2024-02-18 21:12    34  ***************
 107    2024-02-18 21:13    35  ****************
 ...    ..(  4 skipped).    ..  ****************
 112    2024-02-18 21:18    35  ****************
 113    2024-02-18 21:19    36  *****************
 ...    ..(  4 skipped).    ..  *****************
 118    2024-02-18 21:24    36  *****************
 119    2024-02-18 21:25    37  ******************
 ...    ..(  8 skipped).    ..  ******************
   0    2024-02-18 21:34    37  ******************
   1    2024-02-18 21:35    38  *******************
   2    2024-02-18 21:36    37  ******************
   3    2024-02-18 21:37    38  *******************
 ...    ..( 11 skipped).    ..  *******************
  15    2024-02-18 21:49    38  *******************
  16    2024-02-18 21:50    39  ********************
 ...    ..(  2 skipped).    ..  ********************
  19    2024-02-18 21:53    39  ********************
  20    2024-02-18 21:54    38  *******************
  21    2024-02-18 21:55    39  ********************
  22    2024-02-18 21:56    38  *******************
 ...    ..( 14 skipped).    ..  *******************
  37    2024-02-18 22:11    38  *******************
  38    2024-02-18 22:12    39  ********************
  39    2024-02-18 22:13    38  *******************
  40    2024-02-18 22:14    38  *******************
  41    2024-02-18 22:15    39  ********************
 ...    ..(  7 skipped).    ..  ********************
  49    2024-02-18 22:23    39  ********************
  50    2024-02-18 22:24    38  *******************
  51    2024-02-18 22:25    39  ********************
  52    2024-02-18 22:26    39  ********************

SCT Error Recovery Control:
           Read: Disabled
          Write: Disabled

Device Statistics (GP/SMART Log 0x04) not supported

Pending Defects log (GP Log 0x0c) not supported

SATA Phy Event Counters (GP Log 0x11)
ID      Size     Value  Description
0x0001  2            0  Command failed due to ICRC error
0x0002  2            0  R_ERR response for data FIS
0x0003  2            0  R_ERR response for device-to-host data FIS
0x0004  2            0  R_ERR response for host-to-device data FIS
0x0005  2            0  R_ERR response for non-data FIS
0x0006  2            0  R_ERR response for device-to-host non-data FIS
0x0007  2            0  R_ERR response for host-to-device non-data FIS
0x0009  2        10596  Transition from drive PhyRdy to drive PhyNRdy
0x000a  2           15  Device-to-host register FISes sent due to a COMRESET
0x000b  2            0  CRC errors within host-to-device FIS
0x000d  2            0  Non-CRC errors within host-to-device FIS