smartctl 6.6 2016-05-31 r4324 [x86_64-linux-5.4.0-100-generic] (local build)
Copyright (C) 2002-16, Bruce Allen, Christian Franke, www.smartmontools.org

=== START OF INFORMATION SECTION ===
Device Model:     HP SSD S600 240GB
Firmware Version: SN8108
User Capacity:    240 057 409 536 bytes [240 GB]
Sector Size:      512 bytes logical/physical
Rotation Rate:    Solid State Device
Form Factor:      2.5 inches
Device is:        Not in smartctl database [for details use: -P showall]
ATA Version is:   Unknown(0x0bf8) (minor revision not indicated)
SATA Version is:  SATA 3.2, 6.0 Gb/s (current: 6.0 Gb/s)
Local Time is:    Tue Mar  8 00:57:25 2022 MSK
SMART support is: Available - device has SMART capability.
SMART support is: Enabled
AAM feature is:   Unavailable
APM feature is:   Unavailable
Rd look-ahead is: Enabled
Write cache is:   Enabled
ATA Security is:  Disabled, NOT FROZEN [SEC1]
Wt Cache Reorder: Enabled

=== START OF READ SMART DATA SECTION ===
SMART overall-health self-assessment test result: PASSED

General SMART Values:
Offline data collection status:  (0x00)	Offline data collection activity
					was never started.
					Auto Offline Data Collection: Disabled.
Self-test execution status:      (   0)	The previous self-test routine completed
					without error or no self-test has ever 
					been run.
Total time to complete Offline 
data collection: 		(   33) seconds.
Offline data collection
capabilities: 			 (0x7b) SMART execute Offline immediate.
					Auto Offline data collection on/off support.
					Suspend Offline collection upon new
					command.
					Offline surface scan supported.
					Self-test supported.
					Conveyance Self-test supported.
					Selective Self-test supported.
SMART capabilities:            (0x0003)	Saves SMART data before entering
					power-saving mode.
					Supports SMART auto save timer.
Error logging capability:        (0x01)	Error logging supported.
					General Purpose Logging supported.
Short self-test routine 
recommended polling time: 	 (   2) minutes.
Extended self-test routine
recommended polling time: 	 (   2) minutes.
Conveyance self-test routine
recommended polling time: 	 (   2) minutes.
SCT capabilities: 	       (0x0031)	SCT Status supported.
					SCT Feature Control supported.
					SCT Data Table supported.

SMART Attributes Data Structure revision number: 20
Vendor Specific SMART Attributes with Thresholds:
ID# ATTRIBUTE_NAME          FLAGS    VALUE WORST THRESH FAIL RAW_VALUE
  5 Reallocated_Sector_Ct   PO--C-   100   100   050    -    0
  9 Power_On_Hours          -O--C-   100   100   000    -    2
 12 Power_Cycle_Count       -O--C-   100   100   000    -    15
167 Unknown_Attribute       -O---K   100   100   000    -    0
168 Unknown_Attribute       -O--C-   100   100   000    -    0
169 Unknown_Attribute       PO--C-   100   100   010    -    0
171 Unknown_Attribute       -O--CK   000   000   000    -    0
172 Unknown_Attribute       -O--CK   000   000   000    -    0
173 Unknown_Attribute       -O--C-   200   200   000    -    8590262276
174 Unknown_Attribute       -O---K   100   100   000    -    0
175 Program_Fail_Count_Chip -O---K   100   100   010    -    0
180 Unused_Rsvd_Blk_Cnt_Tot PO--CK   100   100   000    -    260
187 Reported_Uncorrect      -O--CK   100   000   000    -    0
192 Power-Off_Retract_Count -O--C-   100   100   000    -    10
194 Temperature_Celsius     -O---K   027   027   000    -    27 (Min/Max 26/32)
206 Unknown_SSD_Attribute   -O--CK   200   200   000    -    2
207 Unknown_SSD_Attribute   -O--CK   200   200   000    -    5
208 Unknown_SSD_Attribute   -O--CK   200   200   000    -    4
209 Unknown_SSD_Attribute   -O--CK   200   200   000    -    1
210 Unknown_Attribute       -O--CK   200   200   000    -    11
211 Unknown_Attribute       -O--CK   200   200   000    -    3
231 Unknown_SSD_Attribute   PO---K   100   100   005    -    0
241 Total_LBAs_Written      -O--CK   100   100   000    -    467
242 Total_LBAs_Read         -O--CK   100   100   000    -    133
243 Unknown_Attribute       -O--CK   050   050   000    -    57082727
245 Unknown_Attribute       -O--CK   100   100   000    -    26
                            ||||||_ K auto-keep
                            |||||__ C event count
                            ||||___ R error rate
                            |||____ S speed/performance
                            ||_____ O updated online
                            |______ P prefailure warning

General Purpose Log Directory Version 1
SMART           Log Directory Version 1 [multi-sector log support]
Address    Access  R/W   Size  Description
0x00       GPL,SL  R/O      1  Log Directory
0x01           SL  R/O      1  Summary SMART error log
0x02           SL  R/O     51  Comprehensive SMART error log
0x03       GPL     R/O     64  Ext. Comprehensive SMART error log
0x04       GPL,SL  R/O      8  Device Statistics log
0x06           SL  R/O      1  SMART self-test log
0x07       GPL     R/O      1  Extended self-test log
0x09           SL  R/W      1  Selective self-test log
0x10       GPL     R/O      1  SATA NCQ Queued Error log
0x11       GPL     R/O      1  SATA Phy Event Counters log
0x30       GPL,SL  R/O      9  IDENTIFY DEVICE data log
0x80-0x9f  GPL,SL  R/W     16  Host vendor specific log
0xe0       GPL,SL  R/W      1  SCT Command/Status
0xe1       GPL,SL  R/W      1  SCT Data Transfer

SMART Extended Comprehensive Error Log Version: 1 (64 sectors)
No Errors Logged

SMART Extended Self-test Log Version: 1 (1 sectors)
Num  Test_Description    Status                  Remaining  LifeTime(hours)  LBA_of_first_error
# 1  Short offline       Completed without error       00%         2         -

SMART Selective self-test log data structure revision number 1
 SPAN  MIN_LBA  MAX_LBA  CURRENT_TEST_STATUS
    1        0        0  Not_testing
    2        0        0  Not_testing
    3        0        0  Not_testing
    4        0        0  Not_testing
    5        0        0  Not_testing
Selective self-test flags (0x0):
  After scanning selected spans, do NOT read-scan remainder of disk.
If Selective self-test is pending on power-up, resume after 0 minute delay.

SCT Status Version:                  3
SCT Version (vendor specific):       1 (0x0001)
SCT Support Level:                   0
Device State:                        Active (0)
Current Temperature:                    27 Celsius
Power Cycle Min/Max Temperature:      ?/30 Celsius
Lifetime    Min/Max Temperature:      ?/ ? Celsius
Under/Over Temperature Limit Count:   0/0

SCT Temperature History Version:     2
Temperature Sampling Period:         1 minute
Temperature Logging Interval:        1 minute
Min/Max recommended Temperature:     -127/127 Celsius
Min/Max Temperature Limit:           -127/127 Celsius
Temperature History Size (Index):    478 (101)

Index    Estimated Time   Temperature Celsius
 102    2022-03-07 17:00     ?  -
 ...    ..(381 skipped).    ..  -
   6    2022-03-07 23:22     ?  -
   7    2022-03-07 23:23    29  **********
   8    2022-03-07 23:24    29  **********
   9    2022-03-07 23:25     ?  -
 ...    ..(  5 skipped).    ..  -
  15    2022-03-07 23:31     ?  -
  16    2022-03-07 23:32    30  ***********
  17    2022-03-07 23:33     ?  -
 ...    ..(  5 skipped).    ..  -
  23    2022-03-07 23:39     ?  -
  24    2022-03-07 23:40    30  ***********
  25    2022-03-07 23:41     ?  -
 ...    ..(  7 skipped).    ..  -
  33    2022-03-07 23:49     ?  -
  34    2022-03-07 23:50    30  ***********
  35    2022-03-07 23:51     ?  -
  36    2022-03-07 23:52     ?  -
  37    2022-03-07 23:53     ?  -
  38    2022-03-07 23:54    30  ***********
  39    2022-03-07 23:55    30  ***********
  40    2022-03-07 23:56     ?  -
 ...    ..( 14 skipped).    ..  -
  55    2022-03-08 00:11     ?  -
  56    2022-03-08 00:12    30  ***********
  57    2022-03-08 00:13    31  ************
  58    2022-03-08 00:14    29  **********
  59    2022-03-08 00:15    29  **********
  60    2022-03-08 00:16     ?  -
  61    2022-03-08 00:17    29  **********
  62    2022-03-08 00:18     ?  -
 ...    ..(  7 skipped).    ..  -
  70    2022-03-08 00:26     ?  -
  71    2022-03-08 00:27    29  **********
 ...    ..(  2 skipped).    ..  **********
  74    2022-03-08 00:30    29  **********
  75    2022-03-08 00:31     ?  -
  76    2022-03-08 00:32     ?  -
  77    2022-03-08 00:33     ?  -
  78    2022-03-08 00:34    29  **********
  79    2022-03-08 00:35     ?  -
  80    2022-03-08 00:36     ?  -
  81    2022-03-08 00:37    30  ***********
  82    2022-03-08 00:38    29  **********
 ...    ..(  2 skipped).    ..  **********
  85    2022-03-08 00:41    29  **********
  86    2022-03-08 00:42     ?  -
 ...    ..(  2 skipped).    ..  -
  89    2022-03-08 00:45     ?  -
  90    2022-03-08 00:46    27  ********
  91    2022-03-08 00:47     ?  -
  92    2022-03-08 00:48     ?  -
  93    2022-03-08 00:49     ?  -
  94    2022-03-08 00:50    26  *******
  95    2022-03-08 00:51     ?  -
  96    2022-03-08 00:52    29  **********
  97    2022-03-08 00:53    28  *********
  98    2022-03-08 00:54    27  ********
  99    2022-03-08 00:55    29  **********
 100    2022-03-08 00:56    30  ***********
 101    2022-03-08 00:57    27  ********

SCT Error Recovery Control command not supported

Device Statistics (GP Log 0x04)
Page  Offset Size        Value Flags Description
0x01  =====  =               =  ===  == General Statistics (rev 1) ==
0x01  0x008  4              15  ---  Lifetime Power-On Resets
0x01  0x010  4               2  ---  Power-on Hours
0x01  0x018  6       979763522  ---  Logical Sectors Written
0x01  0x020  6          924184  ---  Number of Write Commands
0x01  0x028  6       280899759  ---  Logical Sectors Read
0x01  0x030  6         1360962  ---  Number of Read Commands
0x01  0x038  6         7564300  ---  Date and Time TimeStamp
0x07  =====  =               =  ===  == Solid State Device Statistics (rev 1) ==
0x07  0x008  1               0  N--  Percentage Used Endurance Indicator
                                |||_ C monitored condition met
                                ||__ D supports DSN
                                |___ N normalized value

SATA Phy Event Counters (GP Log 0x11)
ID      Size     Value  Description
0x0001  2            0  Command failed due to ICRC error
0x0003  2            0  R_ERR response for device-to-host data FIS
0x0004  2            0  R_ERR response for host-to-device data FIS
0x0006  2            0  R_ERR response for device-to-host non-data FIS
0x0007  2            0  R_ERR response for host-to-device non-data FIS
0x0008  2            0  Device-to-host non-data FIS retries
0x0009  4            0  Transition from drive PhyRdy to drive PhyNRdy
0x000a  4            4  Device-to-host register FISes sent due to a COMRESET
0x000f  2            0  R_ERR response for host-to-device data FIS, CRC
0x0010  2            0  R_ERR response for host-to-device data FIS, non-CRC
0x0012  2            0  R_ERR response for host-to-device non-data FIS, CRC
0x0013  2            0  R_ERR response for host-to-device non-data FIS, non-CRC

