smartctl 7.3 2022-02-28 r5338 [x86_64-linux-5.16.11-gentoo] (local build)
Copyright (C) 2002-22, Bruce Allen, Christian Franke, www.smartmontools.org

=== START OF INFORMATION SECTION ===
Device Model:     ST4000NM0245-1Z2107
Firmware Version: SS05
User Capacity:    4.000.787.030.016 bytes [4,00 TB]
Sector Sizes:     512 bytes logical, 4096 bytes physical
Rotation Rate:    7200 rpm
Form Factor:      3.5 inches
Device is:        Not in smartctl database 7.2/5319
ATA Version is:   ACS-3 T13/2161-D revision 5
SATA Version is:  SATA 3.1, 6.0 Gb/s (current: 6.0 Gb/s)
Local Time is:    Mon Mar  7 01:44:51 2022 CET
SMART support is: Available - device has SMART capability.
SMART support is: Enabled
AAM feature is:   Unavailable
APM feature is:   Unavailable
Rd look-ahead is: Enabled
Write cache is:   Enabled
DSN feature is:   Unavailable
ATA Security is:  Disabled, frozen [SEC2]
Wt Cache Reorder: Enabled

=== START OF READ SMART DATA SECTION ===
SMART overall-health self-assessment test result: PASSED

General SMART Values:
Offline data collection status:  (0x82) Offline data collection activity
                                        was completed without error.
                                        Auto Offline Data Collection: Enabled.
Self-test execution status:      (   0) The previous self-test routine completed
                                        without error or no self-test has ever
                                        been run.
Total time to complete Offline
data collection:                (  567) seconds.
Offline data collection
capabilities:                    (0x7b) SMART execute Offline immediate.
                                        Auto Offline data collection on/off support.
                                        Suspend Offline collection upon new
                                        command.
                                        Offline surface scan supported.
                                        Self-test supported.
                                        Conveyance Self-test supported.
                                        Selective Self-test supported.
SMART capabilities:            (0x0003) Saves SMART data before entering
                                        power-saving mode.
                                        Supports SMART auto save timer.
Error logging capability:        (0x01) Error logging supported.
                                        General Purpose Logging supported.
Short self-test routine
recommended polling time:        (   1) minutes.
Extended self-test routine
recommended polling time:        ( 354) minutes.
Conveyance self-test routine
recommended polling time:        (   2) minutes.
SCT capabilities:              (0x50bd) SCT Status supported.
                                        SCT Error Recovery Control supported.
                                        SCT Feature Control supported.
                                        SCT Data Table supported.

SMART Attributes Data Structure revision number: 10
Vendor Specific SMART Attributes with Thresholds:
ID# ATTRIBUTE_NAME          FLAGS    VALUE WORST THRESH FAIL RAW_VALUE
  1 Raw_Read_Error_Rate     POSR--   073   064   044    -    18230572
  3 Spin_Up_Time            PO----   094   094   000    -    0
  4 Start_Stop_Count        -O--CK   100   100   020    -    28
  5 Reallocated_Sector_Ct   PO--CK   100   100   010    -    0
  7 Seek_Error_Rate         POSR--   092   060   045    -    1748085146
  9 Power_On_Hours          -O--CK   059   059   000    -    36606
 10 Spin_Retry_Count        PO--C-   100   100   097    -    0
 12 Power_Cycle_Count       -O--CK   100   100   020    -    27
184 End-to-End_Error        -O--CK   100   100   099    -    0
187 Reported_Uncorrect      -O--CK   100   100   000    -    0
188 Command_Timeout         -O--CK   100   100   000    -    0
189 High_Fly_Writes         -O-RCK   100   100   000    -    0
190 Airflow_Temperature_Cel -O---K   061   052   040    -    39 (Min/Max 33/43)
191 G-Sense_Error_Rate      -O--CK   085   085   000    -    30529
192 Power-Off_Retract_Count -O--CK   100   100   000    -    513
193 Load_Cycle_Count        -O--CK   099   099   000    -    3043
194 Temperature_Celsius     -O---K   039   048   000    -    39 (0 21 0 0 0)
195 Hardware_ECC_Recovered  -O-RC-   046   001   000    -    18230572
197 Current_Pending_Sector  -O--C-   100   100   000    -    0
198 Offline_Uncorrectable   ----C-   100   100   000    -    0
199 UDMA_CRC_Error_Count    -OSRCK   200   200   000    -    0
240 Head_Flying_Hours       ------   100   253   000    -    35528 (138 9 0)
241 Total_LBAs_Written      ------   100   253   000    -    338361133979
242 Total_LBAs_Read         ------   100   253   000    -    394675343176
                            ||||||_ K auto-keep
                            |||||__ C event count
                            ||||___ R error rate
                            |||____ S speed/performance
                            ||_____ O updated online
                            |______ P prefailure warning

General Purpose Log Directory Version 1
SMART           Log Directory Version 1 [multi-sector log support]
Address    Access  R/W   Size  Description
0x00       GPL,SL  R/O      1  Log Directory
0x01           SL  R/O      1  Summary SMART error log
0x02           SL  R/O      5  Comprehensive SMART error log
0x03       GPL     R/O      5  Ext. Comprehensive SMART error log
0x04       GPL,SL  R/O      8  Device Statistics log
0x06           SL  R/O      1  SMART self-test log
0x07       GPL     R/O      1  Extended self-test log
0x08       GPL     R/O      2  Power Conditions log
0x09           SL  R/W      1  Selective self-test log
0x0c       GPL     R/O   2048  Pending Defects log
0x10       GPL     R/O      1  NCQ Command Error log
0x11       GPL     R/O      1  SATA Phy Event Counters log
0x13       GPL     R/O      1  SATA NCQ Send and Receive log
0x15       GPL     R/W      1  Rebuild Assist log
0x21       GPL     R/O      1  Write stream error log
0x22       GPL     R/O      1  Read stream error log
0x24       GPL     R/O    512  Current Device Internal Status Data log
0x30       GPL,SL  R/O      9  IDENTIFY DEVICE data log
0x80-0x9f  GPL,SL  R/W     16  Host vendor specific log
0xa1       GPL,SL  VS      24  Device vendor specific log
0xa2       GPL     VS    8160  Device vendor specific log
0xa6       GPL     VS     192  Device vendor specific log
0xa8-0xa9  GPL,SL  VS     136  Device vendor specific log
0xab       GPL     VS       1  Device vendor specific log
0xad       GPL     VS      16  Device vendor specific log
0xb0       GPL     VS    9048  Device vendor specific log
0xbe-0xbf  GPL     VS   65535  Device vendor specific log
0xc1       GPL,SL  VS      16  Device vendor specific log
0xc3       GPL,SL  VS       8  Device vendor specific log
0xd1       GPL     VS     264  Device vendor specific log
0xd2       GPL     VS   10000  Device vendor specific log
0xd4       GPL     VS    2048  Device vendor specific log
0xda       GPL,SL  VS       1  Device vendor specific log
0xe0       GPL,SL  R/W      1  SCT Command/Status
0xe1       GPL,SL  R/W      1  SCT Data Transfer

SMART Extended Comprehensive Error Log Version: 1 (5 sectors)
No Errors Logged

SMART Extended Self-test Log Version: 1 (1 sectors)
Num  Test_Description    Status                  Remaining  LifeTime(hours)  LBA_of_first_error
# 1  Short offline       Completed without error       00%     36606         -
# 2  Extended offline    Completed without error       00%     36459         -
# 3  Extended offline    Completed without error       00%     34447         -
# 4  Extended offline    Completed without error       00%     33984         -
# 5  Extended offline    Completed without error       00%     33800         -
# 6  Extended offline    Interrupted (host reset)      10%     33762         -
# 7  Extended offline    Interrupted (host reset)      10%     33757         -
# 8  Extended offline    Completed without error       00%     33664         -
# 9  Short offline       Completed without error       00%     33654         -
#10  Extended offline    Completed without error       00%     33652         -
#11  Extended offline    Completed without error       00%     33633         -
#12  Extended offline    Completed without error       00%      9304         -
#13  Short offline       Completed without error       00%      9294         -

SMART Selective self-test log data structure revision number 1
 SPAN  MIN_LBA  MAX_LBA  CURRENT_TEST_STATUS
    1        0        0  Not_testing
    2        0        0  Not_testing
    3        0        0  Not_testing
    4        0        0  Not_testing
    5        0        0  Not_testing
Selective self-test flags (0x0):
  After scanning selected spans, do NOT read-scan remainder of disk.
If Selective self-test is pending on power-up, resume after 0 minute delay.

SCT Status Version:                  3
SCT Version (vendor specific):       522 (0x020a)
Device State:                        Active (0)
Current Temperature:                    39 Celsius
Power Cycle Min/Max Temperature:     33/43 Celsius
Lifetime    Min/Max Temperature:     21/46 Celsius
Under/Over Temperature Limit Count:   0/26

SCT Temperature History Version:     2
Temperature Sampling Period:         3 minutes
Temperature Logging Interval:        59 minutes
Min/Max recommended Temperature:     10/40 Celsius
Min/Max Temperature Limit:            5/60 Celsius
Temperature History Size (Index):    128 (34)

Index    Estimated Time   Temperature Celsius
  35    2022-03-01 20:42    39  ********************
 ...    ..(  5 skipped).    ..  ********************
  41    2022-03-02 02:36    39  ********************
  42    2022-03-02 03:35    38  *******************
  43    2022-03-02 04:34    38  *******************
  44    2022-03-02 05:33    38  *******************
  45    2022-03-02 06:32    39  ********************
  46    2022-03-02 07:31    38  *******************
  47    2022-03-02 08:30    38  *******************
  48    2022-03-02 09:29    39  ********************
 ...    ..(  3 skipped).    ..  ********************
  52    2022-03-02 13:25    39  ********************
  53    2022-03-02 14:24    38  *******************
  54    2022-03-02 15:23    39  ********************
 ...    ..(  7 skipped).    ..  ********************
  62    2022-03-02 23:15    39  ********************
  63    2022-03-03 00:14    38  *******************
 ...    ..(  7 skipped).    ..  *******************
  71    2022-03-03 08:06    38  *******************
  72    2022-03-03 09:05    39  ********************
 ...    ..( 19 skipped).    ..  ********************
  92    2022-03-04 04:45    39  ********************
  93    2022-03-04 05:44    38  *******************
  94    2022-03-04 06:43    38  *******************
  95    2022-03-04 07:42    38  *******************
  96    2022-03-04 08:41    39  ********************
 ...    ..(  6 skipped).    ..  ********************
 103    2022-03-04 15:34    39  ********************
 104    2022-03-04 16:33    35  ****************
 105    2022-03-04 17:32    34  ***************
 106    2022-03-04 18:31    34  ***************
 107    2022-03-04 19:30    38  *******************
 108    2022-03-04 20:29    38  *******************
 109    2022-03-04 21:28    39  ********************
 ...    ..(  4 skipped).    ..  ********************
 114    2022-03-05 02:23    39  ********************
 115    2022-03-05 03:22    38  *******************
 ...    ..(  5 skipped).    ..  *******************
 121    2022-03-05 09:16    38  *******************
 122    2022-03-05 10:15    39  ********************
 ...    ..(  3 skipped).    ..  ********************
 126    2022-03-05 14:11    39  ********************
 127    2022-03-05 15:10    37  ******************
   0    2022-03-05 16:09    38  *******************
   1    2022-03-05 17:08    39  ********************
 ...    ..( 22 skipped).    ..  ********************
  24    2022-03-06 15:45    39  ********************
  25    2022-03-06 16:44    38  *******************
  26    2022-03-06 17:43    39  ********************
 ...    ..(  2 skipped).    ..  ********************
  29    2022-03-06 20:40    39  ********************
  30    2022-03-06 21:39    38  *******************
  31    2022-03-06 22:38    39  ********************
  32    2022-03-06 23:37    39  ********************
  33    2022-03-07 00:36    38  *******************
  34    2022-03-07 01:35    39  ********************

SCT Error Recovery Control:
           Read:    100 (10,0 seconds)
          Write:    100 (10,0 seconds)

Device Statistics (GP Log 0x04)
Page  Offset Size        Value Flags Description
0x01  =====  =               =  ===  == General Statistics (rev 1) ==
0x01  0x008  4              27  ---  Lifetime Power-On Resets
0x01  0x010  4           36606  ---  Power-on Hours
0x01  0x018  6    338352719932  ---  Logical Sectors Written
0x01  0x020  6      3131702140  ---  Number of Write Commands
0x01  0x028  6    394675329427  ---  Logical Sectors Read
0x01  0x030  6      8543232985  ---  Number of Read Commands
0x01  0x038  6               -  ---  Date and Time TimeStamp
0x03  =====  =               =  ===  == Rotating Media Statistics (rev 1) ==
0x03  0x008  4      1883764304  N--  Spindle Motor Power-on Hours
0x03  0x010  4      1883730773  N--  Head Flying Hours
0x03  0x018  4            3043  ---  Head Load Events
0x03  0x020  4               0  ---  Number of Reallocated Logical Sectors
0x03  0x028  4               0  ---  Read Recovery Attempts
0x03  0x030  4               0  ---  Number of Mechanical Start Failures
0x03  0x038  4               0  ---  Number of Realloc. Candidate Logical Sectors
0x03  0x040  4             513  ---  Number of High Priority Unload Events
0x04  =====  =               =  ===  == General Errors Statistics (rev 1) ==
0x04  0x008  4               0  ---  Number of Reported Uncorrectable Errors
0x04  0x010  4               0  ---  Resets Between Cmd Acceptance and Completion
0x05  =====  =               =  ===  == Temperature Statistics (rev 1) ==
0x05  0x008  1              39  ---  Current Temperature
0x05  0x010  1              38  ---  Average Short Term Temperature
0x05  0x018  1              37  ---  Average Long Term Temperature
0x05  0x020  1              48  ---  Highest Temperature
0x05  0x028  1               0  ---  Lowest Temperature
0x05  0x030  1              42  ---  Highest Average Short Term Temperature
0x05  0x038  1              29  ---  Lowest Average Short Term Temperature
0x05  0x040  1              39  ---  Highest Average Long Term Temperature
0x05  0x048  1              29  ---  Lowest Average Long Term Temperature
0x05  0x050  4               0  ---  Time in Over-Temperature
0x05  0x058  1              60  ---  Specified Maximum Operating Temperature
0x05  0x060  4              70  ---  Time in Under-Temperature
0x05  0x068  1               5  ---  Specified Minimum Operating Temperature
0x06  =====  =               =  ===  == Transport Statistics (rev 1) ==
0x06  0x008  4             189  ---  Number of Hardware Resets
0x06  0x010  4              40  ---  Number of ASR Events
0x06  0x018  4               0  ---  Number of Interface CRC Errors
                                |||_ C monitored condition met
                                ||__ D supports DSN
                                |___ N normalized value

Pending Defects log (GP Log 0x0c)
No Defects Logged

SATA Phy Event Counters (GP Log 0x11)
ID      Size     Value  Description
0x000a  2           72  Device-to-host register FISes sent due to a COMRESET
0x0001  2            0  Command failed due to ICRC error
0x0003  2            0  R_ERR response for device-to-host data FIS
0x0004  2            0  R_ERR response for host-to-device data FIS
0x0006  2            0  R_ERR response for device-to-host non-data FIS
0x0007  2            0  R_ERR response for host-to-device non-data FIS
