smartctl 7.0 2018-12-30 r4883 [x86_64-linux-3.10.0-1160.el7.x86_64] (local build)
Copyright (C) 2002-18, Bruce Allen, Christian Franke, www.smartmontools.org
 
=== START OF INFORMATION SECTION ===
Device Model:     HFS3T8G32FEH-7410A
Serial Number:    FD08N7283I0108O1Y
LU WWN Device Id: 5 ace42e 0251c4656
Add. Product Id:  DELL(tm)
Firmware Version: DE03
User Capacity:    3,840,755,982,336 bytes [3.84 TB]
Sector Sizes:     512 bytes logical, 4096 bytes physical
Rotation Rate:    Solid State Device
Form Factor:      2.5 inches
Device is:        Not in smartctl database [for details use: -P showall]
ATA Version is:   ACS-3 (minor revision not indicated)
SATA Version is:  SATA 3.3, 6.0 Gb/s (current: 6.0 Gb/s)
Local Time is:    Wed Feb 24 01:15:52 2021 UTC
SMART support is: Available - device has SMART capability.
SMART support is: Enabled
 
=== START OF READ SMART DATA SECTION ===
SMART overall-health self-assessment test result: PASSED
 
General SMART Values:
Offline data collection status:  (0x02) Offline data collection activity
                                        was completed without error.
                                        Auto Offline Data Collection: Disabled.
Self-test execution status:      (   0) The previous self-test routine completed
                                        without error or no self-test has ever
                                        been run.
Total time to complete Offline
data collection:                (    4) seconds.
Offline data collection
capabilities:                    (0x19) SMART execute Offline immediate.
                                        No Auto Offline data collection support.
                                        Suspend Offline collection upon new
                                        command.
                                        Offline surface scan supported.
                                        Self-test supported.
                                        No Conveyance Self-test supported.
                                        No Selective Self-test supported.
SMART capabilities:            (0x0002) Does not save SMART data before
                                        entering power-saving mode.
                                        Supports SMART auto save timer.
Error logging capability:        (0x01) Error logging supported.
                                        General Purpose Logging supported.
Short self-test routine
recommended polling time:        (   2) minutes.
Extended self-test routine
recommended polling time:        (  30) minutes.
SCT capabilities:              (0x003d) SCT Status supported.
                                        SCT Error Recovery Control supported.
                                        SCT Feature Control supported.
                                        SCT Data Table supported.
 
SMART Attributes Data Structure revision number: 0
Vendor Specific SMART Attributes with Thresholds:
ID# ATTRIBUTE_NAME          FLAG     VALUE WORST THRESH TYPE      UPDATED  WHEN_FAILED RAW_VALUE
  1 Raw_Read_Error_Rate     0x000e   100   100   006    Old_age   Always       -       0
  5 Reallocated_Sector_Ct   0x0033   100   100   036    Pre-fail  Always       -       0
  9 Power_On_Hours          0x0032   100   100   000    Old_age   Always       -       156
12 Power_Cycle_Count       0x0032   100   100   020    Old_age   Always       -       82
13 Read_Soft_Error_Rate    0x002e   100   100   000    Old_age   Always       -       0
173 Unknown_Attribute       0x0032   100   100   000    Old_age   Always       -       5
175 Program_Fail_Count_Chip 0x0032   100   100   000    Old_age   Always       -       2
179 Used_Rsvd_Blk_Cnt_Tot   0x0033   100   100   001    Pre-fail  Always       -       130
180 Unused_Rsvd_Blk_Cnt_Tot 0x0010   100   100   000    Old_age   Offline      -       49150
181 Program_Fail_Cnt_Total  0x0032   100   100   000    Old_age   Always       -       0
182 Erase_Fail_Count_Total  0x0032   100   100   000    Old_age   Always       -       0
194 Temperature_Celsius     0x0002   071   064   000    Old_age   Always       -       29 (Min/Max 24/36)
195 Hardware_ECC_Recovered  0x0032   100   100   000    Old_age   Always       -       0
198 Offline_Uncorrectable   0x0010   100   100   000    Old_age   Offline      -       0
199 UDMA_CRC_Error_Count    0x003e   100   100   000    Old_age   Always       -       0
201 Unknown_SSD_Attribute   0x0033   100   100   050    Pre-fail  Always       -       0
202 Unknown_SSD_Attribute   0x0033   100   100   050    Pre-fail  Always       -       0
233 Media_Wearout_Indicator 0x0032   100   100   000    Old_age   Always       -       324
235 Unknown_Attribute       0x0032   100   100   000    Old_age   Always       -       324
241 Total_LBAs_Written      0x0032   100   100   000    Old_age   Always       -       358
245 Unknown_Attribute       0x0032   100   100   001    Old_age   Always       -       100
 
SMART Error Log Version: 0
No Errors Logged
 
SMART Self-test log structure revision number 1
Num  Test_Description    Status                  Remaining  LifeTime(hours)  LBA_of_first_error
1.	1  Short offline       Completed without error       00%        62         -
1.	2  Short offline       Completed without error       00%        62         -
1.	3  Short offline       Completed without error       00%        62         -
1.	4  Extended offline    Completed without error       00%         2         -
1.	5  Short offline       Completed without error       00%         1         -
 
Selective Self-tests/Logging not supported
