smartctl 7.0 2019-03-31 r4903 [x86_64-linux-5.3.12-200.fc30.x86_64] (local build)
Copyright (C) 2002-18, Bruce Allen, Christian Franke, www.smartmontools.org

=== START OF INFORMATION SECTION ===
Device Model:     SK hynix SC311 SATA 512GB
Serial Number:    EJ74N283011205R1U
Firmware Version: 70000P10
User Capacity:    512’110’190’592 bytes [512 GB]
Sector Sizes:     512 bytes logical, 4096 bytes physical
Rotation Rate:    Solid State Device
Form Factor:      M.2
Device is:        Not in smartctl database [for details use: -P showall]
ATA Version is:   ACS-3 (minor revision not indicated)
SATA Version is:  SATA 3.2, 6.0 Gb/s (current: 6.0 Gb/s)
Local Time is:    Mon Dec  2 21:04:10 2019 CET
SMART support is: Available - device has SMART capability.
SMART support is: Enabled
AAM feature is:   Unavailable
APM feature is:   Disabled
Rd look-ahead is: Enabled
Write cache is:   Enabled
DSN feature is:   Unavailable
ATA Security is:  Disabled, frozen [SEC2]
Wt Cache Reorder: Unknown

=== START OF READ SMART DATA SECTION ===
SMART overall-health self-assessment test result: PASSED

General SMART Values:
Offline data collection status:  (0x02)	Offline data collection activity
					was completed without error.
					Auto Offline Data Collection: Disabled.
Self-test execution status:      (   0)	The previous self-test routine completed
					without error or no self-test has ever 
					been run.
Total time to complete Offline 
data collection: 		(  110) seconds.
Offline data collection
capabilities: 			 (0x51) SMART execute Offline immediate.
					No Auto Offline data collection support.
					Suspend Offline collection upon new
					command.
					No Offline surface scan supported.
					Self-test supported.
					No Conveyance Self-test supported.
					Selective Self-test supported.
SMART capabilities:            (0x0002)	Does not save SMART data before
					entering power-saving mode.
					Supports SMART auto save timer.
Error logging capability:        (0x01)	Error logging supported.
					General Purpose Logging supported.
Short self-test routine 
recommended polling time: 	 (   2) minutes.
Extended self-test routine
recommended polling time: 	 (  80) minutes.
SCT capabilities: 	       (0x003d)	SCT Status supported.
					SCT Error Recovery Control supported.
					SCT Feature Control supported.
					SCT Data Table supported.

SMART Attributes Data Structure revision number: 0
Vendor Specific SMART Attributes with Thresholds:
ID# ATTRIBUTE_NAME          FLAGS    VALUE WORST THRESH FAIL RAW_VALUE
  1 Raw_Read_Error_Rate     POSR--   166   166   006    -    0
  5 Reallocated_Sector_Ct   -O--CK   253   253   036    -    0
  9 Power_On_Hours          -O--CK   093   093   000    -    6217
 12 Power_Cycle_Count       -O--CK   100   100   020    -    1687
100 Unknown_Attribute       -O--CK   100   100   000    -    787676
168 Unknown_Attribute       -O--CK   100   100   000    -    3
169 Unknown_Attribute       -O--CK   098   098   000    -    44
174 Unknown_Attribute       ----CK   100   100   000    -    134
175 Program_Fail_Count_Chip -O--CK   253   253   000    -    0
176 Erase_Fail_Count_Chip   -O--CK   253   253   000    -    0
177 Wear_Leveling_Count     -O--CK   100   001   000    -    14
178 Used_Rsvd_Blk_Cnt_Chip  -O--CK   253   253   000    -    0
179 Used_Rsvd_Blk_Cnt_Tot   -O--CK   253   253   000    -    0
180 Unused_Rsvd_Blk_Cnt_Tot -O--CK   100   100   000    -    1438
181 Program_Fail_Cnt_Total  -O--CK   253   253   000    -    0
182 Erase_Fail_Count_Total  -O--CK   253   253   000    -    0
184 End-to-End_Error        -O--CK   253   253   000    -    0
187 Reported_Uncorrect      -O--CK   253   253   000    -    0
188 Command_Timeout         -O--CK   100   100   000    -    96
194 Temperature_Celsius     -O----   034   000   000    -    34 (Min/Max 15/68)
195 Hardware_ECC_Recovered  -O--CK   253   253   000    -    0
196 Reallocated_Event_Count -O--CK   253   253   036    -    0
198 Offline_Uncorrectable   -O--CK   253   253   000    -    0
199 UDMA_CRC_Error_Count    -O--CK   253   253   000    -    0
204 Soft_ECC_Correction     -OSR--   001   001   000    -    12925
212 Unknown_Attribute       -O--CK   100   100   000    -    2392371
233 Media_Wearout_Indicator -O--CK   002   001   000    -    99
234 Unknown_Attribute       -O--CK   100   100   000    -    14106245408
241 Total_LBAs_Written      -O--CK   100   100   000    -    15380317573
242 Total_LBAs_Read         -O--CK   100   100   000    -    10285325604
                            ||||||_ K auto-keep
                            |||||__ C event count
                            ||||___ R error rate
                            |||____ S speed/performance
                            ||_____ O updated online
                            |______ P prefailure warning

General Purpose Log Directory Version 1
SMART           Log Directory Version 1 [multi-sector log support]
Address    Access  R/W   Size  Description
0x00       GPL,SL  R/O      1  Log Directory
0x01           SL  R/O      1  Summary SMART error log
0x02           SL  R/O      4  Comprehensive SMART error log
0x03       GPL     R/O      5  Ext. Comprehensive SMART error log
0x04       GPL,SL  R/O      8  Device Statistics log
0x06           SL  R/O      1  SMART self-test log
0x07       GPL     R/O      2  Extended self-test log
0x09           SL  R/W      1  Selective self-test log
0x10       GPL     R/O      1  NCQ Command Error log
0x11       GPL     R/O      1  SATA Phy Event Counters log
0x30       GPL     R/O      8  IDENTIFY DEVICE data log
0x80-0x9f  GPL,SL  R/W     16  Host vendor specific log
0xe0       GPL,SL  R/W      1  SCT Command/Status
0xe1       GPL,SL  R/W      1  SCT Data Transfer

SMART Extended Comprehensive Error Log Version: 1 (5 sectors)
No Errors Logged

SMART Extended Self-test Log Version: 1 (2 sectors)
Num  Test_Description    Status                  Remaining  LifeTime(hours)  LBA_of_first_error
# 1  Short offline       Completed without error       00%      6217         -
# 2  Extended offline    Completed without error       00%      6134         -
# 3  Short offline       Completed without error       00%         0         -

Warning! SMART Selective Self-Test Log Structure error: invalid SMART checksum.
SMART Selective self-test log data structure revision number 0
Note: revision number not 1 implies that no selective self-test has ever been run
 SPAN  MIN_LBA  MAX_LBA  CURRENT_TEST_STATUS
    1        0        0  Not_testing
    2        0        0  Not_testing
    3        0        0  Not_testing
    4        0        0  Not_testing
    5        0        0  Not_testing
Selective self-test flags (0x0):
  After scanning selected spans, do NOT read-scan remainder of disk.
If Selective self-test is pending on power-up, resume after 0 minute delay.

SCT Status Version:                  3
SCT Version (vendor specific):       1 (0x0001)
Device State:                        Active (0)
Current Temperature:                    34 Celsius
Power Cycle Min/Max Temperature:     26/37 Celsius
Lifetime    Min/Max Temperature:     15/68 Celsius
Specified Max Operating Temperature:    80 Celsius
Under/Over Temperature Limit Count:  40/0

SCT Temperature History Version:     2
Temperature Sampling Period:         1 minute
Temperature Logging Interval:        1 minute
Min/Max recommended Temperature:     -20/80 Celsius
Min/Max Temperature Limit:           -20/125 Celsius
Temperature History Size (Index):    192 (76)

Index    Estimated Time   Temperature Celsius
  77    2019-12-02 17:53    36  *****************
 ...    ..( 14 skipped).    ..  *****************
  92    2019-12-02 18:08    36  *****************
  93    2019-12-02 18:09    38  *******************
  94    2019-12-02 18:10    39  ********************
  95    2019-12-02 18:11    40  *********************
  96    2019-12-02 18:12    40  *********************
  97    2019-12-02 18:13    38  *******************
  98    2019-12-02 18:14    39  ********************
  99    2019-12-02 18:15    38  *******************
 100    2019-12-02 18:16    39  ********************
 101    2019-12-02 18:17    38  *******************
 102    2019-12-02 18:18    37  ******************
 ...    ..(  3 skipped).    ..  ******************
 106    2019-12-02 18:22    37  ******************
 107    2019-12-02 18:23    36  *****************
 108    2019-12-02 18:24    36  *****************
 109    2019-12-02 18:25    37  ******************
 110    2019-12-02 18:26    36  *****************
 ...    ..(  8 skipped).    ..  *****************
 119    2019-12-02 18:35    36  *****************
 120    2019-12-02 18:36    37  ******************
 121    2019-12-02 18:37    37  ******************
 122    2019-12-02 18:38    36  *****************
 123    2019-12-02 18:39     ?  -
 124    2019-12-02 18:40    36  *****************
 125    2019-12-02 18:41     ?  -
 ...    ..( 14 skipped).    ..  -
 140    2019-12-02 18:56     ?  -
 141    2019-12-02 18:57    36  *****************
 ...    ..( 10 skipped).    ..  *****************
 152    2019-12-02 19:08    36  *****************
 153    2019-12-02 19:09    37  ******************
 154    2019-12-02 19:10    36  *****************
 ...    ..( 28 skipped).    ..  *****************
 183    2019-12-02 19:39    36  *****************
 184    2019-12-02 19:40     ?  -
 ...    ..(  3 skipped).    ..  -
 188    2019-12-02 19:44     ?  -
 189    2019-12-02 19:45    36  *****************
 190    2019-12-02 19:46     ?  -
 ...    ..( 14 skipped).    ..  -
  13    2019-12-02 20:01     ?  -
  14    2019-12-02 20:02    29  **********
  15    2019-12-02 20:03    27  ********
  16    2019-12-02 20:04    26  *******
 ...    ..(  2 skipped).    ..  *******
  19    2019-12-02 20:07    26  *******
  20    2019-12-02 20:08    27  ********
 ...    ..(  6 skipped).    ..  ********
  27    2019-12-02 20:15    27  ********
  28    2019-12-02 20:16    28  *********
 ...    ..(  9 skipped).    ..  *********
  38    2019-12-02 20:26    28  *********
  39    2019-12-02 20:27    29  **********
 ...    ..(  4 skipped).    ..  **********
  44    2019-12-02 20:32    29  **********
  45    2019-12-02 20:33     ?  -
 ...    ..(  3 skipped).    ..  -
  49    2019-12-02 20:37     ?  -
  50    2019-12-02 20:38    29  **********
  51    2019-12-02 20:39     ?  -
 ...    ..( 16 skipped).    ..  -
  68    2019-12-02 20:56     ?  -
  69    2019-12-02 20:57    29  **********
  70    2019-12-02 20:58    29  **********
  71    2019-12-02 20:59    30  ***********
 ...    ..(  2 skipped).    ..  ***********
  74    2019-12-02 21:02    30  ***********
  75    2019-12-02 21:03    34  ***************
  76    2019-12-02 21:04    37  ******************

SCT Error Recovery Control:
           Read:     80 (8.0 seconds)
          Write:     80 (8.0 seconds)

Device Statistics (GP Log 0x04)
Page  Offset Size        Value Flags Description
0x01  =====  =               =  ===  == General Statistics (rev 2) ==
0x01  0x008  4            1687  ---  Lifetime Power-On Resets
0x01  0x010  4            6217  ---  Power-on Hours
0x01  0x018  6     15380317573  ---  Logical Sectors Written
0x01  0x020  6       250777881  ---  Number of Write Commands
0x01  0x028  6     10285325604  ---  Logical Sectors Read
0x01  0x030  6       177308190  ---  Number of Read Commands
0x01  0x038  6   1523549179838  ---  Date and Time TimeStamp
0x04  =====  =               =  ===  == General Errors Statistics (rev 1) ==
0x04  0x008  4               0  ---  Number of Reported Uncorrectable Errors
0x04  0x010  4              96  ---  Resets Between Cmd Acceptance and Completion
0x05  =====  =               =  ===  == Temperature Statistics (rev 1) ==
0x05  0x008  1              34  ---  Current Temperature
0x05  0x010  1              33  ---  Average Short Term Temperature
0x05  0x018  1               -  ---  Average Long Term Temperature
0x05  0x020  1              68  ---  Highest Temperature
0x05  0x028  1              15  ---  Lowest Temperature
0x05  0x030  1               -  ---  Highest Average Short Term Temperature
0x05  0x038  1              25  ---  Lowest Average Short Term Temperature
0x05  0x040  1               -  ---  Highest Average Long Term Temperature
0x05  0x048  1              32  ---  Lowest Average Long Term Temperature
0x05  0x050  4               0  ---  Time in Over-Temperature
0x05  0x058  1              80  ---  Specified Maximum Operating Temperature
0x05  0x060  4          363620  ---  Time in Under-Temperature
0x05  0x068  1             -20  ---  Specified Minimum Operating Temperature
0x06  =====  =               =  ===  == Transport Statistics (rev 1) ==
0x06  0x008  4            5032  ---  Number of Hardware Resets
0x06  0x018  4               0  ---  Number of Interface CRC Errors
0x07  =====  =               =  ===  == Solid State Device Statistics (rev 1) ==
0x07  0x008  1               0  ---  Percentage Used Endurance Indicator
                                |||_ C monitored condition met
                                ||__ D supports DSN
                                |___ N normalized value

Pending Defects log (GP Log 0x0c) not supported

SATA Phy Event Counters (GP Log 0x11)
ID      Size     Value  Description
0x0001  2            0  Command failed due to ICRC error
0x000a  2            3  Device-to-host register FISes sent due to a COMRESET

