smartctl 6.5 2016-01-24 r4214 [x86_64-linux-4.4.0-64-lowlatency] (local build)
Copyright (C) 2002-16, Bruce Allen, Christian Franke, www.smartmontools.org

=== START OF INFORMATION SECTION ===
Device Model:     Crucial_CT128M550SSD4
Serial Number:    14490DFE802F
LU WWN Device Id: 5 00a075 10dfe802f
Firmware Version: MU02
User Capacity:    128,035,676,160 bytes [128 GB]
Sector Sizes:     512 bytes logical, 4096 bytes physical
Rotation Rate:    Solid State Device
Form Factor:      < 1.8 inches
Device is:        Not in smartctl database [for details use: -P showall]
ATA Version is:   ACS-2, ATA8-ACS T13/1699-D revision 6
SATA Version is:  SATA 3.1, 6.0 Gb/s (current: 6.0 Gb/s)
Local Time is:    Sat Feb 25 03:54:07 2017 CET
SMART support is: Available - device has SMART capability.
SMART support is: Enabled
AAM feature is:   Unavailable
APM level is:     254 (maximum performance)
Rd look-ahead is: Enabled
Write cache is:   Enabled
ATA Security is:  Disabled, frozen [SEC2]
Wt Cache Reorder: Enabled

=== START OF READ SMART DATA SECTION ===
SMART overall-health self-assessment test result: PASSED

General SMART Values:
Offline data collection status:  (0x80)	Offline data collection activity
					was never started.
					Auto Offline Data Collection: Enabled.
Self-test execution status:      (   0)	The previous self-test routine completed
					without error or no self-test has ever 
					been run.
Total time to complete Offline 
data collection: 		(  595) seconds.
Offline data collection
capabilities: 			 (0x7b) SMART execute Offline immediate.
					Auto Offline data collection on/off support.
					Suspend Offline collection upon new
					command.
					Offline surface scan supported.
					Self-test supported.
					Conveyance Self-test supported.
					Selective Self-test supported.
SMART capabilities:            (0x0003)	Saves SMART data before entering
					power-saving mode.
					Supports SMART auto save timer.
Error logging capability:        (0x01)	Error logging supported.
					General Purpose Logging supported.
Short self-test routine 
recommended polling time: 	 (   2) minutes.
Extended self-test routine
recommended polling time: 	 (   3) minutes.
Conveyance self-test routine
recommended polling time: 	 (   3) minutes.
SCT capabilities: 	       (0x0035)	SCT Status supported.
					SCT Feature Control supported.
					SCT Data Table supported.

SMART Attributes Data Structure revision number: 16
Vendor Specific SMART Attributes with Thresholds:
ID# ATTRIBUTE_NAME          FLAGS    VALUE WORST THRESH FAIL RAW_VALUE
  1 Raw_Read_Error_Rate     POSR-K   100   100   000    -    0
  5 Reallocated_Sector_Ct   PO--CK   100   100   000    -    0
  9 Power_On_Hours          -O--CK   100   100   000    -    4591
 12 Power_Cycle_Count       -O--CK   100   100   000    -    30
171 Unknown_Attribute       -O--CK   100   100   000    -    0
172 Unknown_Attribute       -O--CK   100   100   000    -    0
173 Unknown_Attribute       -O--CK   097   097   000    -    90
174 Unknown_Attribute       -O--CK   100   100   000    -    12
180 Unused_Rsvd_Blk_Cnt_Tot PO--CK   000   000   000    -    1044
183 Runtime_Bad_Block       -O--CK   100   100   000    -    0
184 End-to-End_Error        -O--CK   100   100   000    -    0
187 Reported_Uncorrect      -O--CK   100   100   000    -    0
194 Temperature_Celsius     -O---K   049   029   000    -    51 (Min/Max 32/71)
196 Reallocated_Event_Count -O--CK   100   100   000    -    0
197 Current_Pending_Sector  -O--CK   100   100   000    -    0
198 Offline_Uncorrectable   ----CK   100   100   000    -    0
199 UDMA_CRC_Error_Count    -O--CK   100   100   000    -    0
202 Unknown_SSD_Attribute   P---CK   097   097   000    -    3
206 Unknown_SSD_Attribute   -OSR--   100   100   000    -    0
210 Unknown_Attribute       -O--CK   100   100   000    -    0
246 Unknown_Attribute       -O--CK   100   100   000    -    2004498524
247 Unknown_Attribute       -O--CK   100   100   000    -    72342012
248 Unknown_Attribute       -O--CK   100   100   000    -    698030346
                            ||||||_ K auto-keep
                            |||||__ C event count
                            ||||___ R error rate
                            |||____ S speed/performance
                            ||_____ O updated online
                            |______ P prefailure warning

General Purpose Log Directory Version 1
SMART           Log Directory Version 1 [multi-sector log support]
Address    Access  R/W   Size  Description
0x00       GPL,SL  R/O      1  Log Directory
0x01           SL  R/O      1  Summary SMART error log
0x02           SL  R/O     51  Comprehensive SMART error log
0x03       GPL     R/O  16383  Ext. Comprehensive SMART error log
0x04       GPL,SL  R/O    255  Device Statistics log
0x06           SL  R/O      1  SMART self-test log
0x07       GPL     R/O      1  Extended self-test log
0x09           SL  R/W      1  Selective self-test log
0x10       GPL     R/O      1  SATA NCQ Queued Error log
0x11       GPL     R/O      1  SATA Phy Event Counters log
0x13       GPL     R/O      1  SATA NCQ Send and Receive log
0x24       GPL     R/O    429  Current Device Internal Status Data log
0x25       GPL     R/O    145  Saved Device Internal Status Data log
0x30       GPL,SL  R/O      9  IDENTIFY DEVICE data log
0x80-0x9f  GPL,SL  R/W     16  Host vendor specific log
0xa0       GPL     VS    2000  Device vendor specific log
0xa0       SL      VS     208  Device vendor specific log
0xa1-0xbf  GPL,SL  VS       1  Device vendor specific log
0xc0       GPL,SL  VS      80  Device vendor specific log
0xc1-0xdf  GPL,SL  VS       1  Device vendor specific log
0xe0       GPL,SL  R/W      1  SCT Command/Status
0xe1       GPL,SL  R/W      1  SCT Data Transfer

SMART Extended Comprehensive Error Log Version: 1 (16383 sectors)
No Errors Logged

SMART Extended Self-test Log Version: 1 (1 sectors)
Num  Test_Description    Status                  Remaining  LifeTime(hours)  LBA_of_first_error
# 1  Short offline       Completed without error       00%      4590         -

SMART Selective self-test log data structure revision number 1
 SPAN  MIN_LBA  MAX_LBA  CURRENT_TEST_STATUS
    1        0        0  Not_testing
    2        0        0  Not_testing
    3        0        0  Completed [00% left] (57881389-57946924)
    4        0        0  Not_testing
    5        0        0  Not_testing
Selective self-test flags (0x0):
  After scanning selected spans, do NOT read-scan remainder of disk.
If Selective self-test is pending on power-up, resume after 0 minute delay.

SCT Status Version:                  3
SCT Version (vendor specific):       1 (0x0001)
SCT Support Level:                   0
Device State:                        Active (0)
Current Temperature:                    51 Celsius
Power Cycle Min/Max Temperature:     42/56 Celsius
Lifetime    Min/Max Temperature:     32/71 Celsius
Under/Over Temperature Limit Count:   0/0

SCT Temperature History Version:     2
Temperature Sampling Period:         1 minute
Temperature Logging Interval:        1 minute
Min/Max recommended Temperature:      0/70 Celsius
Min/Max Temperature Limit:           -5/75 Celsius
Temperature History Size (Index):    478 (474)

Index    Estimated Time   Temperature Celsius
 475    2017-02-24 19:57    53  **********************************
 476    2017-02-24 19:58    52  *********************************
 477    2017-02-24 19:59    51  ********************************
   0    2017-02-24 20:00    49  ******************************
 ...    ..(239 skipped).    ..  ******************************
 240    2017-02-25 00:00    49  ******************************
 241    2017-02-25 00:01     ?  -
 242    2017-02-25 00:02    49  ******************************
 243    2017-02-25 00:03    49  ******************************
 244    2017-02-25 00:04    49  ******************************
 245    2017-02-25 00:05     ?  -
 246    2017-02-25 00:06    35  ****************
 247    2017-02-25 00:07    37  ******************
 248    2017-02-25 00:08    39  ********************
 249    2017-02-25 00:09    40  *********************
 250    2017-02-25 00:10    41  **********************
 251    2017-02-25 00:11    43  ************************
 252    2017-02-25 00:12    44  *************************
 253    2017-02-25 00:13    44  *************************
 254    2017-02-25 00:14    44  *************************
 255    2017-02-25 00:15    48  *****************************
 256    2017-02-25 00:16    47  ****************************
 257    2017-02-25 00:17    49  ******************************
 258    2017-02-25 00:18    52  *********************************
 259    2017-02-25 00:19    54  ***********************************
 260    2017-02-25 00:20     ?  -
 261    2017-02-25 00:21    49  ******************************
 ...    ..(  3 skipped).    ..  ******************************
 265    2017-02-25 00:25    49  ******************************
 266    2017-02-25 00:26    50  *******************************
 267    2017-02-25 00:27    52  *********************************
 268    2017-02-25 00:28    51  ********************************
 269    2017-02-25 00:29    54  ***********************************
 270    2017-02-25 00:30    56  *************************************
 271    2017-02-25 00:31    49  ******************************
 272    2017-02-25 00:32     ?  -
 273    2017-02-25 00:33    51  ********************************
 274    2017-02-25 00:34     ?  -
 275    2017-02-25 00:35    39  ********************
 276    2017-02-25 00:36    41  **********************
 277    2017-02-25 00:37    42  ***********************
 278    2017-02-25 00:38    43  ************************
 279    2017-02-25 00:39    44  *************************
 280    2017-02-25 00:40    44  *************************
 281    2017-02-25 00:41    45  **************************
 282    2017-02-25 00:42    50  *******************************
 283    2017-02-25 00:43    52  *********************************
 284    2017-02-25 00:44    51  ********************************
 285    2017-02-25 00:45    50  *******************************
 286    2017-02-25 00:46    50  *******************************
 287    2017-02-25 00:47    49  ******************************
 ...    ..(  5 skipped).    ..  ******************************
 293    2017-02-25 00:53    49  ******************************
 294    2017-02-25 00:54     ?  -
 295    2017-02-25 00:55    51  ********************************
 296    2017-02-25 00:56    55  ************************************
 297    2017-02-25 00:57    56  *************************************
 298    2017-02-25 00:58    54  ***********************************
 299    2017-02-25 00:59    54  ***********************************
 300    2017-02-25 01:00    53  **********************************
 ...    ..(  4 skipped).    ..  **********************************
 305    2017-02-25 01:05    53  **********************************
 306    2017-02-25 01:06    49  ******************************
 ...    ..(  2 skipped).    ..  ******************************
 309    2017-02-25 01:09    49  ******************************
 310    2017-02-25 01:10     ?  -
 311    2017-02-25 01:11    42  ***********************
 312    2017-02-25 01:12    46  ***************************
 313    2017-02-25 01:13    48  *****************************
 314    2017-02-25 01:14    50  *******************************
 315    2017-02-25 01:15    51  ********************************
 316    2017-02-25 01:16    52  *********************************
 317    2017-02-25 01:17    53  **********************************
 318    2017-02-25 01:18    54  ***********************************
 ...    ..(  3 skipped).    ..  ***********************************
 322    2017-02-25 01:22    54  ***********************************
 323    2017-02-25 01:23    55  ************************************
 ...    ..(  5 skipped).    ..  ************************************
 329    2017-02-25 01:29    55  ************************************
 330    2017-02-25 01:30    54  ***********************************
 331    2017-02-25 01:31    54  ***********************************
 332    2017-02-25 01:32    55  ************************************
 333    2017-02-25 01:33    56  *************************************
 334    2017-02-25 01:34    56  *************************************
 335    2017-02-25 01:35    55  ************************************
 336    2017-02-25 01:36    54  ***********************************
 ...    ..( 30 skipped).    ..  ***********************************
 367    2017-02-25 02:07    54  ***********************************
 368    2017-02-25 02:08    55  ************************************
 ...    ..( 29 skipped).    ..  ************************************
 398    2017-02-25 02:38    55  ************************************
 399    2017-02-25 02:39    56  *************************************
 400    2017-02-25 02:40    56  *************************************
 401    2017-02-25 02:41    56  *************************************
 402    2017-02-25 02:42    55  ************************************
 ...    ..(  4 skipped).    ..  ************************************
 407    2017-02-25 02:47    55  ************************************
 408    2017-02-25 02:48    54  ***********************************
 409    2017-02-25 02:49    54  ***********************************
 410    2017-02-25 02:50    55  ************************************
 411    2017-02-25 02:51    56  *************************************
 412    2017-02-25 02:52    55  ************************************
 413    2017-02-25 02:53    54  ***********************************
 414    2017-02-25 02:54    54  ***********************************
 415    2017-02-25 02:55    54  ***********************************
 416    2017-02-25 02:56    53  **********************************
 ...    ..(  5 skipped).    ..  **********************************
 422    2017-02-25 03:02    53  **********************************
 423    2017-02-25 03:03    52  *********************************
 ...    ..(  2 skipped).    ..  *********************************
 426    2017-02-25 03:06    52  *********************************
 427    2017-02-25 03:07    51  ********************************
 ...    ..( 13 skipped).    ..  ********************************
 441    2017-02-25 03:21    51  ********************************
 442    2017-02-25 03:22    50  *******************************
 443    2017-02-25 03:23    50  *******************************
 444    2017-02-25 03:24    51  ********************************
 ...    ..(  8 skipped).    ..  ********************************
 453    2017-02-25 03:33    51  ********************************
 454    2017-02-25 03:34    50  *******************************
 ...    ..( 19 skipped).    ..  *******************************
 474    2017-02-25 03:54    50  *******************************

SCT Error Recovery Control command not supported

Device Statistics (GP Log 0x04)
Page  Offset Size        Value Flags Description
0x01  =====  =               =  ===  == General Statistics (rev 2) ==
0x01  0x008  4              30  ---  Lifetime Power-On Resets
0x01  0x010  4            4591  ---  Power-on Hours
0x01  0x018  6      2004498524  ---  Logical Sectors Written
0x01  0x020  6        43044536  ---  Number of Write Commands
0x01  0x028  6       300724645  ---  Logical Sectors Read
0x01  0x030  6         9609730  ---  Number of Read Commands
0x04  =====  =               =  ===  == General Errors Statistics (rev 1) ==
0x04  0x008  4               0  ---  Number of Reported Uncorrectable Errors
0x04  0x010  4              14  ---  Resets Between Cmd Acceptance and Completion
0x05  =====  =               =  ===  == Temperature Statistics (rev 1) ==
0x05  0x008  1              51  ---  Current Temperature
0x05  0x010  1              50  ---  Average Short Term Temperature
0x05  0x018  1              49  ---  Average Long Term Temperature
0x05  0x020  1              71  ---  Highest Temperature
0x05  0x028  1              32  ---  Lowest Temperature
0x05  0x030  1              57  ---  Highest Average Short Term Temperature
0x05  0x038  1              38  ---  Lowest Average Short Term Temperature
0x05  0x040  1              51  ---  Highest Average Long Term Temperature
0x05  0x048  1              40  ---  Lowest Average Long Term Temperature
0x05  0x050  4               -  ---  Time in Over-Temperature
0x05  0x058  1              70  ---  Specified Maximum Operating Temperature
0x05  0x060  4               -  ---  Time in Under-Temperature
0x05  0x068  1               0  ---  Specified Minimum Operating Temperature
0x06  =====  =               =  ===  == Transport Statistics (rev 1) ==
0x06  0x008  4               0  ---  Number of Hardware Resets
0x06  0x010  4               0  ---  Number of ASR Events
0x06  0x018  4               0  ---  Number of Interface CRC Errors
0x07  =====  =               =  ===  == Solid State Device Statistics (rev 1) ==
0x07  0x008  1              45  N--  Percentage Used Endurance Indicator
                                |||_ C monitored condition met
                                ||__ D supports DSN
                                |___ N normalized value

SATA Phy Event Counters (GP Log 0x11)
ID      Size     Value  Description
0x0001  4            0  Command failed due to ICRC error
0x000a  4            8  Device-to-host register FISes sent due to a COMRESET

