smartctl 6.5 2016-05-07 r4318 [x86_64-linux-4.9.9-100.fc24.x86_64] (local build)
Copyright (C) 2002-16, Bruce Allen, Christian Franke, www.smartmontools.org

=== START OF INFORMATION SECTION ===
Device Model:     Samsung SSD 850 EVO 2TB
Firmware Version: EMT02B6Q
User Capacity:    2.000.398.934.016 bytes [2,00 TB]
Sector Size:      512 bytes logical/physical
Rotation Rate:    Solid State Device
Form Factor:      2.5 inches
Device is:        Not in smartctl database [for details use: -P showall]
ATA Version is:   ACS-2, ATA8-ACS T13/1699-D revision 4c
SATA Version is:  SATA 3.1, 6.0 Gb/s (current: 6.0 Gb/s)
Local Time is:    Tue Feb 14 14:49:46 2017 CET
SMART support is: Available - device has SMART capability.
SMART support is: Enabled
AAM feature is:   Unavailable
APM feature is:   Unavailable
Rd look-ahead is: Enabled
Write cache is:   Enabled
ATA Security is:  Disabled, frozen [SEC2]
Wt Cache Reorder: Enabled

=== START OF READ SMART DATA SECTION ===
SMART overall-health self-assessment test result: PASSED

General SMART Values:
Offline data collection status:  (0x80)	Offline data collection activity
					was never started.
					Auto Offline Data Collection: Enabled.
Self-test execution status:      (   0)	The previous self-test routine completed
					without error or no self-test has ever 
					been run.
Total time to complete Offline 
data collection: 		(    0) seconds.
Offline data collection
capabilities: 			 (0x53) SMART execute Offline immediate.
					Auto Offline data collection on/off support.
					Suspend Offline collection upon new
					command.
					No Offline surface scan supported.
					Self-test supported.
					No Conveyance Self-test supported.
					Selective Self-test supported.
SMART capabilities:            (0x0003)	Saves SMART data before entering
					power-saving mode.
					Supports SMART auto save timer.
Error logging capability:        (0x01)	Error logging supported.
					General Purpose Logging supported.
Short self-test routine 
recommended polling time: 	 (   2) minutes.
Extended self-test routine
recommended polling time: 	 ( 265) minutes.
SCT capabilities: 	       (0x003d)	SCT Status supported.
					SCT Error Recovery Control supported.
					SCT Feature Control supported.
					SCT Data Table supported.

SMART Attributes Data Structure revision number: 1
Vendor Specific SMART Attributes with Thresholds:
ID# ATTRIBUTE_NAME          FLAGS    VALUE WORST THRESH FAIL RAW_VALUE
  5 Reallocated_Sector_Ct   PO--CK   100   100   010    -    0
  9 Power_On_Hours          -O--CK   099   099   000    -    145
 12 Power_Cycle_Count       -O--CK   099   099   000    -    9
177 Wear_Leveling_Count     PO--C-   099   099   000    -    1
179 Used_Rsvd_Blk_Cnt_Tot   PO--C-   100   100   010    -    0
181 Program_Fail_Cnt_Total  -O--CK   100   100   010    -    0
182 Erase_Fail_Count_Total  -O--CK   100   100   010    -    0
183 Runtime_Bad_Block       PO--C-   100   100   010    -    0
187 Reported_Uncorrect      -O--CK   100   100   000    -    0
190 Airflow_Temperature_Cel -O--CK   060   050   000    -    40
195 Hardware_ECC_Recovered  -O-RC-   200   200   000    -    0
199 UDMA_CRC_Error_Count    -OSRCK   100   100   000    -    0
235 Unknown_Attribute       -O--C-   099   099   000    -    3
241 Total_LBAs_Written      -O--CK   099   099   000    -    4356547999
                            ||||||_ K auto-keep
                            |||||__ C event count
                            ||||___ R error rate
                            |||____ S speed/performance
                            ||_____ O updated online
                            |______ P prefailure warning

General Purpose Log Directory Version 1
SMART           Log Directory Version 1 [multi-sector log support]
Address    Access  R/W   Size  Description
0x00       GPL,SL  R/O      1  Log Directory
0x01           SL  R/O      1  Summary SMART error log
0x02           SL  R/O      1  Comprehensive SMART error log
0x03       GPL     R/O      1  Ext. Comprehensive SMART error log
0x06           SL  R/O      1  SMART self-test log
0x07       GPL     R/O      1  Extended self-test log
0x09           SL  R/W      1  Selective self-test log
0x10       GPL     R/O      1  SATA NCQ Queued Error log
0x11       GPL     R/O      1  SATA Phy Event Counters log
0x13       GPL     R/O      1  SATA NCQ Send and Receive log
0x30       GPL,SL  R/O      9  IDENTIFY DEVICE data log
0x80-0x9f  GPL,SL  R/W     16  Host vendor specific log
0xa1           SL  VS      16  Device vendor specific log
0xa5           SL  VS      16  Device vendor specific log
0xce           SL  VS      16  Device vendor specific log
0xe0       GPL,SL  R/W      1  SCT Command/Status
0xe1       GPL,SL  R/W      1  SCT Data Transfer

SMART Extended Comprehensive Error Log Version: 1 (1 sectors)
No Errors Logged

SMART Extended Self-test Log Version: 1 (1 sectors)
Num  Test_Description    Status                  Remaining  LifeTime(hours)  LBA_of_first_error
# 1  Short offline       Completed without error       00%       135         -
# 2  Short offline       Completed without error       00%       111         -
# 3  Extended offline    Completed without error       00%       111         -
# 4  Short offline       Completed without error       00%        87         -
# 5  Extended offline    Completed without error       00%        68         -
# 6  Short offline       Completed without error       00%        64         -
# 7  Extended offline    Completed without error       00%        14         -

SMART Selective self-test log data structure revision number 1
 SPAN  MIN_LBA  MAX_LBA  CURRENT_TEST_STATUS
    1        0        0  Not_testing
    2        0        0  Not_testing
    3        0        0  Not_testing
    4        0        0  Not_testing
    5        0        0  Not_testing
  255        0    65535  Read_scanning was never started
Selective self-test flags (0x0):
  After scanning selected spans, do NOT read-scan remainder of disk.
If Selective self-test is pending on power-up, resume after 0 minute delay.

SCT Status Version:                  3
SCT Version (vendor specific):       256 (0x0100)
SCT Support Level:                   1
Device State:                        Active (0)
Current Temperature:                    40 Celsius
Power Cycle Min/Max Temperature:     31/50 Celsius
Lifetime    Min/Max Temperature:     31/50 Celsius
Under/Over Temperature Limit Count:   0/0

SCT Temperature History Version:     2
Temperature Sampling Period:         1 minute
Temperature Logging Interval:        10 minutes
Min/Max recommended Temperature:      0/70 Celsius
Min/Max Temperature Limit:            0/70 Celsius
Temperature History Size (Index):    128 (122)

Index    Estimated Time   Temperature Celsius
 123    2017-02-13 17:30    40  *********************
 ...    ..( 10 skipped).    ..  *********************
   6    2017-02-13 19:20    40  *********************
   7    2017-02-13 19:30    41  **********************
   8    2017-02-13 19:40    41  **********************
   9    2017-02-13 19:50    45  **************************
  10    2017-02-13 20:00    47  ****************************
  11    2017-02-13 20:10    46  ***************************
  12    2017-02-13 20:20    46  ***************************
  13    2017-02-13 20:30    46  ***************************
  14    2017-02-13 20:40    42  ***********************
  15    2017-02-13 20:50    41  **********************
  16    2017-02-13 21:00    41  **********************
  17    2017-02-13 21:10    40  *********************
 ...    ..( 23 skipped).    ..  *********************
  41    2017-02-14 01:10    40  *********************
  42    2017-02-14 01:20    39  ********************
 ...    ..( 12 skipped).    ..  ********************
  55    2017-02-14 03:30    39  ********************
  56    2017-02-14 03:40    40  *********************
  57    2017-02-14 03:50    40  *********************
  58    2017-02-14 04:00    40  *********************
  59    2017-02-14 04:10    39  ********************
 ...    ..(  5 skipped).    ..  ********************
  65    2017-02-14 05:10    39  ********************
  66    2017-02-14 05:20    40  *********************
  67    2017-02-14 05:30    39  ********************
 ...    ..(  6 skipped).    ..  ********************
  74    2017-02-14 06:40    39  ********************
  75    2017-02-14 06:50    40  *********************
  76    2017-02-14 07:00    40  *********************
  77    2017-02-14 07:10    39  ********************
 ...    ..( 17 skipped).    ..  ********************
  95    2017-02-14 10:10    39  ********************
  96    2017-02-14 10:20    40  *********************
 ...    ..( 10 skipped).    ..  *********************
 107    2017-02-14 12:10    40  *********************
 108    2017-02-14 12:20    38  *******************
 109    2017-02-14 12:30    36  *****************
 110    2017-02-14 12:40    34  ***************
 111    2017-02-14 12:50    35  ****************
 112    2017-02-14 13:00    37  ******************
 113    2017-02-14 13:10    39  ********************
 114    2017-02-14 13:20    39  ********************
 115    2017-02-14 13:30    40  *********************
 ...    ..(  6 skipped).    ..  *********************
 122    2017-02-14 14:40    40  *********************

SCT Error Recovery Control:
           Read: Disabled
          Write: Disabled

Device Statistics (GP/SMART Log 0x04) not supported

SATA Phy Event Counters (GP Log 0x11)
ID      Size     Value  Description
0x0001  2            0  Command failed due to ICRC error
0x0002  2            0  R_ERR response for data FIS
0x0003  2            0  R_ERR response for device-to-host data FIS
0x0004  2            0  R_ERR response for host-to-device data FIS
0x0005  2            0  R_ERR response for non-data FIS
0x0006  2            0  R_ERR response for device-to-host non-data FIS
0x0007  2            0  R_ERR response for host-to-device non-data FIS
0x0008  2            0  Device-to-host non-data FIS retries
0x0009  2           27  Transition from drive PhyRdy to drive PhyNRdy
0x000a  2           27  Device-to-host register FISes sent due to a COMRESET
0x000b  2            0  CRC errors within host-to-device FIS
0x000d  2            0  Non-CRC errors within host-to-device FIS
0x000f  2            0  R_ERR response for host-to-device data FIS, CRC
0x0010  2            0  R_ERR response for host-to-device data FIS, non-CRC
0x0012  2            0  R_ERR response for host-to-device non-data FIS, CRC
0x0013  2            0  R_ERR response for host-to-device non-data FIS, non-CRC

