smartctl 7.4 2023-08-01 r5530 [x86_64-linux-6.10.9-zen1-2-zen] (local build)
Copyright (C) 2002-23, Bruce Allen, Christian Franke, www.smartmontools.org

=== START OF INFORMATION SECTION ===
Device Model:     ST4000NC000-1FR168
Firmware Version: CE03
User Capacity:    4,000,787,030,016 bytes [4.00 TB]
Sector Sizes:     512 bytes logical, 4096 bytes physical
Rotation Rate:    5900 rpm
Form Factor:      3.5 inches
Device is:        Not in smartctl database 7.3/5528
ATA Version is:   ACS-2, ACS-3 T13/2161-D revision 3b
SATA Version is:  SATA 3.1, 6.0 Gb/s (current: 6.0 Gb/s)
Local Time is:    Fri Sep 13 07:25:22 2024 PDT
SMART support is: Available - device has SMART capability.
SMART support is: Enabled
AAM feature is:   Unavailable
APM feature is:   Unavailable
Rd look-ahead is: Enabled
Write cache is:   Enabled
DSN feature is:   Unavailable
ATA Security is:  Disabled, frozen [SEC2]
Wt Cache Reorder: Enabled

=== START OF READ SMART DATA SECTION ===
SMART overall-health self-assessment test result: PASSED

General SMART Values:
Offline data collection status:  (0x82)	Offline data collection activity
					was completed without error.
					Auto Offline Data Collection: Enabled.
Self-test execution status:      ( 249)	Self-test routine in progress...
					90% of test remaining.
Total time to complete Offline 
data collection: 		(  107) seconds.
Offline data collection
capabilities: 			 (0x7b) SMART execute Offline immediate.
					Auto Offline data collection on/off support.
					Suspend Offline collection upon new
					command.
					Offline surface scan supported.
					Self-test supported.
					Conveyance Self-test supported.
					Selective Self-test supported.
SMART capabilities:            (0x0003)	Saves SMART data before entering
					power-saving mode.
					Supports SMART auto save timer.
Error logging capability:        (0x01)	Error logging supported.
					General Purpose Logging supported.
Short self-test routine 
recommended polling time: 	 (   1) minutes.
Extended self-test routine
recommended polling time: 	 ( 495) minutes.
Conveyance self-test routine
recommended polling time: 	 (   2) minutes.
SCT capabilities: 	       (0x10bd)	SCT Status supported.
					SCT Error Recovery Control supported.
					SCT Feature Control supported.
					SCT Data Table supported.

SMART Attributes Data Structure revision number: 10
Vendor Specific SMART Attributes with Thresholds:
ID# ATTRIBUTE_NAME          FLAGS    VALUE WORST THRESH FAIL RAW_VALUE
  1 Raw_Read_Error_Rate     POSR--   079   063   044    -    84810664
  3 Spin_Up_Time            PO----   096   091   000    -    0
  4 Start_Stop_Count        -O--CK   099   099   020    -    1730
  5 Reallocated_Sector_Ct   PO--CK   100   100   010    -    0
  7 Seek_Error_Rate         POSR--   076   060   030    -    47679099
  9 Power_On_Hours          -O--CK   071   071   000    -    25809
 10 Spin_Retry_Count        PO--C-   100   100   097    -    0
 12 Power_Cycle_Count       -O--CK   100   100   020    -    986
184 End-to-End_Error        -O--CK   100   100   099    -    0
187 Reported_Uncorrect      -O--CK   100   100   000    -    0
188 Command_Timeout         -O--CK   100   100   000    -    1
189 High_Fly_Writes         -O-RCK   100   100   000    -    0
190 Airflow_Temperature_Cel -O---K   065   056   045    -    35 (Min/Max 28/37)
191 G-Sense_Error_Rate      -O--CK   100   100   000    -    0
192 Power-Off_Retract_Count -O--CK   100   100   000    -    813
193 Load_Cycle_Count        -O--CK   100   100   000    -    1736
194 Temperature_Celsius     -O---K   035   044   000    -    35 (0 16 0 0 0)
197 Current_Pending_Sector  -O--C-   100   100   000    -    0
198 Offline_Uncorrectable   ----C-   100   100   000    -    0
199 UDMA_CRC_Error_Count    -OSRCK   200   200   000    -    0
                            ||||||_ K auto-keep
                            |||||__ C event count
                            ||||___ R error rate
                            |||____ S speed/performance
                            ||_____ O updated online
                            |______ P prefailure warning

General Purpose Log Directory Version 1
SMART           Log Directory Version 1 [multi-sector log support]
Address    Access  R/W   Size  Description
0x00       GPL,SL  R/O      1  Log Directory
0x01           SL  R/O      1  Summary SMART error log
0x02           SL  R/O      5  Comprehensive SMART error log
0x03       GPL     R/O      5  Ext. Comprehensive SMART error log
0x04       GPL,SL  R/O      8  Device Statistics log
0x06           SL  R/O      1  SMART self-test log
0x07       GPL     R/O      1  Extended self-test log
0x08       GPL,SL  R/O      2  Power Conditions log
0x09           SL  R/W      1  Selective self-test log
0x10       GPL     R/O      1  NCQ Command Error log
0x11       GPL     R/O      1  SATA Phy Event Counters log
0x21       GPL     R/O      1  Write stream error log
0x22       GPL     R/O      1  Read stream error log
0x30       GPL,SL  R/O      9  IDENTIFY DEVICE data log
0x80-0x9f  GPL,SL  R/W     16  Host vendor specific log
0xa1       GPL,SL  VS      20  Device vendor specific log
0xa2       GPL     VS    4496  Device vendor specific log
0xa8       GPL,SL  VS     129  Device vendor specific log
0xa9       GPL,SL  VS       1  Device vendor specific log
0xab       GPL     VS       1  Device vendor specific log
0xb0       GPL     VS    5176  Device vendor specific log
0xbe-0xbf  GPL     VS   65535  Device vendor specific log
0xc1       GPL,SL  VS      10  Device vendor specific log
0xc3       GPL,SL  VS       8  Device vendor specific log
0xc4       GPL,SL  VS       5  Device vendor specific log
0xd1       GPL,SL  VS       8  Device vendor specific log
0xe0       GPL,SL  R/W      1  SCT Command/Status
0xe1       GPL,SL  R/W      1  SCT Data Transfer

SMART Extended Comprehensive Error Log Version: 1 (5 sectors)
No Errors Logged

SMART Extended Self-test Log Version: 1 (1 sectors)
Num  Test_Description    Status                  Remaining  LifeTime(hours)  LBA_of_first_error
# 1  Extended offline    Self-test routine in progress 90%     25809         -

SMART Selective self-test log data structure revision number 1
 SPAN  MIN_LBA  MAX_LBA  CURRENT_TEST_STATUS
    1        0        0  Not_testing
    2        0        0  Not_testing
    3        0        0  Not_testing
    4        0        0  Not_testing
    5        0        0  Not_testing
Selective self-test flags (0x0):
  After scanning selected spans, do NOT read-scan remainder of disk.
If Selective self-test is pending on power-up, resume after 0 minute delay.

SCT Status Version:                  3
SCT Version (vendor specific):       522 (0x020a)
Device State:                        Active (0)
Current Temperature:                    34 Celsius
Power Cycle Min/Max Temperature:     28/37 Celsius
Lifetime    Min/Max Temperature:     16/44 Celsius
Under/Over Temperature Limit Count:   0/1776

SCT Temperature History Version:     2
Temperature Sampling Period:         1 minute
Temperature Logging Interval:        10 minutes
Min/Max recommended Temperature:      0/ 0 Celsius
Min/Max Temperature Limit:            0/ 0 Celsius
Temperature History Size (Index):    128 (86)

Index    Estimated Time   Temperature Celsius
  87    2024-09-12 10:10    34  ***************
  88    2024-09-12 10:20    34  ***************
  89    2024-09-12 10:30    34  ***************
  90    2024-09-12 10:40    35  ****************
  91    2024-09-12 10:50    35  ****************
  92    2024-09-12 11:00    34  ***************
 ...    ..(  6 skipped).    ..  ***************
  99    2024-09-12 12:10    34  ***************
 100    2024-09-12 12:20    35  ****************
 ...    ..( 37 skipped).    ..  ****************
  10    2024-09-12 18:40    35  ****************
  11    2024-09-12 18:50    34  ***************
 ...    ..(  2 skipped).    ..  ***************
  14    2024-09-12 19:20    34  ***************
  15    2024-09-12 19:30    35  ****************
 ...    ..(  4 skipped).    ..  ****************
  20    2024-09-12 20:20    35  ****************
  21    2024-09-12 20:30    34  ***************
  22    2024-09-12 20:40    33  **************
  23    2024-09-12 20:50    32  *************
  24    2024-09-12 21:00    32  *************
  25    2024-09-12 21:10    31  ************
  26    2024-09-12 21:20    30  ***********
  27    2024-09-12 21:30    30  ***********
  28    2024-09-12 21:40    30  ***********
  29    2024-09-12 21:50    29  **********
  30    2024-09-12 22:00    29  **********
  31    2024-09-12 22:10    30  ***********
  32    2024-09-12 22:20    31  ************
  33    2024-09-12 22:30    32  *************
  34    2024-09-12 22:40    32  *************
  35    2024-09-12 22:50    32  *************
  36    2024-09-12 23:00    33  **************
 ...    ..(  7 skipped).    ..  **************
  44    2024-09-13 00:20    33  **************
  45    2024-09-13 00:30    34  ***************
 ...    ..( 21 skipped).    ..  ***************
  67    2024-09-13 04:10    34  ***************
  68    2024-09-13 04:20    33  **************
  69    2024-09-13 04:30    32  *************
  70    2024-09-13 04:40    31  ************
  71    2024-09-13 04:50    30  ***********
  72    2024-09-13 05:00    29  **********
 ...    ..(  7 skipped).    ..  **********
  80    2024-09-13 06:20    29  **********
  81    2024-09-13 06:30    31  ************
  82    2024-09-13 06:40    32  *************
  83    2024-09-13 06:50    33  **************
  84    2024-09-13 07:00    33  **************
  85    2024-09-13 07:10    34  ***************
  86    2024-09-13 07:20    34  ***************

SCT Error Recovery Control:
           Read:    100 (10.0 seconds)
          Write:    100 (10.0 seconds)

Device Statistics (GP Log 0x04)
Page  Offset Size        Value Flags Description
0x01  =====  =               =  ===  == General Statistics (rev 2) ==
0x01  0x008  4             986  ---  Lifetime Power-On Resets
0x01  0x010  4           25809  ---  Power-on Hours
0x01  0x018  6    157226863634  ---  Logical Sectors Written
0x01  0x020  6       952584062  ---  Number of Write Commands
0x01  0x028  6    136361083404  ---  Logical Sectors Read
0x01  0x030  6       327604918  ---  Number of Read Commands
0x01  0x038  6               -  ---  Date and Time TimeStamp
0x03  =====  =               =  ===  == Rotating Media Statistics (rev 1) ==
0x03  0x008  4            1628  N--  Spindle Motor Power-on Hours
0x03  0x010  4            1628  N--  Head Flying Hours
0x03  0x018  4            1736  ---  Head Load Events
0x03  0x020  4               0  ---  Number of Reallocated Logical Sectors
0x03  0x028  4               0  ---  Read Recovery Attempts
0x03  0x030  4               0  ---  Number of Mechanical Start Failures
0x04  =====  =               =  ===  == General Errors Statistics (rev 1) ==
0x04  0x008  4               0  ---  Number of Reported Uncorrectable Errors
0x04  0x010  4               0  ---  Resets Between Cmd Acceptance and Completion
                                |||_ C monitored condition met
                                ||__ D supports DSN
                                |___ N normalized value

Pending Defects log (GP Log 0x0c) not supported

SATA Phy Event Counters (GP Log 0x11)
ID      Size     Value  Description
0x000a  2           18  Device-to-host register FISes sent due to a COMRESET
0x0001  2            0  Command failed due to ICRC error
0x0003  2            0  R_ERR response for device-to-host data FIS
0x0004  2            0  R_ERR response for host-to-device data FIS
0x0006  2            0  R_ERR response for device-to-host non-data FIS
0x0007  2            0  R_ERR response for host-to-device non-data FIS

