smartctl 6.6 2017-11-05 r4594 [Darwin 17.3.0 x86_64] (local build)
Copyright (C) 2002-17, Bruce Allen, Christian Franke, www.smartmontools.org

=== START OF INFORMATION SECTION ===
Device Model:     CT500MX500SSD1
Firmware Version: M3CR010
User Capacity:    500,107,862,016 bytes [500 GB]
Sector Sizes:     512 bytes logical, 4096 bytes physical
Rotation Rate:    Solid State Device
Form Factor:      2.5 inches
Device is:        Not in smartctl database [for details use: -P showall]
ATA Version is:   ACS-3 T13/2161-D revision 5
SATA Version is:  SATA 3.3, 6.0 Gb/s (current: 3.0 Gb/s)
Local Time is:    Wed Jan 24 12:25:25 2018 CET
SMART support is: Available - device has SMART capability.
SMART support is: Enabled
AAM feature is:   Unavailable
APM level is:     254 (maximum performance)
Rd look-ahead is: Enabled
Write cache is:   Enabled
DSN feature is:   Unavailable
ATA Security is:  Disabled, NOT FROZEN [SEC1]
Wt Cache Reorder: Unknown

=== START OF READ SMART DATA SECTION ===
SMART overall-health self-assessment test result: PASSED

General SMART Values:
Offline data collection status:  (0x82)	Offline data collection activity
					was completed without error.
					Auto Offline Data Collection: Enabled.
Self-test execution status:      (   0)	The previous self-test routine completed
					without error or no self-test has ever 
					been run.
Total time to complete Offline 
data collection: 		(    0) seconds.
Offline data collection
capabilities: 			 (0x7b) SMART execute Offline immediate.
					Auto Offline data collection on/off support.
					Suspend Offline collection upon new
					command.
					Offline surface scan supported.
					Self-test supported.
					Conveyance Self-test supported.
					Selective Self-test supported.
SMART capabilities:            (0x0003)	Saves SMART data before entering
					power-saving mode.
					Supports SMART auto save timer.
Error logging capability:        (0x01)	Error logging supported.
					General Purpose Logging supported.
Short self-test routine 
recommended polling time: 	 (   2) minutes.
Extended self-test routine
recommended polling time: 	 (  30) minutes.
Conveyance self-test routine
recommended polling time: 	 (   2) minutes.
SCT capabilities: 	       (0x0031)	SCT Status supported.
					SCT Feature Control supported.
					SCT Data Table supported.

SMART Attributes Data Structure revision number: 16
Vendor Specific SMART Attributes with Thresholds:
ID# ATTRIBUTE_NAME          FLAGS    VALUE WORST THRESH FAIL RAW_VALUE
  1 Raw_Read_Error_Rate     POSR-K   100   100   000    -    0
  5 Reallocated_Sector_Ct   -O--CK   100   100   010    -    0
  9 Power_On_Hours          -O--CK   100   100   000    -    38
 12 Power_Cycle_Count       -O--CK   100   100   000    -    42
171 Unknown_Attribute       -O--CK   100   100   000    -    0
172 Unknown_Attribute       -O--CK   100   100   000    -    0
173 Unknown_Attribute       -O--CK   100   100   000    -    1
174 Unknown_Attribute       -O--CK   100   100   000    -    1
180 Unused_Rsvd_Blk_Cnt_Tot PO--CK   000   000   000    -    34
183 Runtime_Bad_Block       -O--CK   100   100   000    -    0
184 End-to-End_Error        -O--CK   100   100   000    -    0
187 Reported_Uncorrect      -O--CK   100   100   000    -    0
194 Temperature_Celsius     -O---K   065   050   000    -    35 (Min/Max 0/50)
196 Reallocated_Event_Count -O--CK   100   100   000    -    0
197 Current_Pending_Sector  -O--CK   100   100   000    -    0
198 Offline_Uncorrectable   ----CK   100   100   000    -    0
199 UDMA_CRC_Error_Count    -O--CK   100   100   000    -    0
202 Unknown_SSD_Attribute   ----CK   100   100   001    -    0
206 Unknown_SSD_Attribute   -OSR--   100   100   000    -    0
210 Unknown_Attribute       -O--CK   100   100   000    -    0
246 Unknown_Attribute       -O--CK   100   100   000    -    741781174
247 Unknown_Attribute       -O--CK   100   100   000    -    12147773
248 Unknown_Attribute       -O--CK   100   100   000    -    4060895
                            ||||||_ K auto-keep
                            |||||__ C event count
                            ||||___ R error rate
                            |||____ S speed/performance
                            ||_____ O updated online
                            |______ P prefailure warning

ATA_READ_LOG_EXT (addr=0x00:0x00, page=0, n=1) failed: 48-bit ATA commands not implemented
Read GP Log Directory failed

SMART Log Directory Version 1 [multi-sector log support]
Address    Access  R/W   Size  Description
0x00           SL  R/O      1  Log Directory
0x01           SL  R/O      1  Summary SMART error log
0x02           SL  R/O      1  Comprehensive SMART error log
0x04           SL  R/O      8  Device Statistics log
0x06           SL  R/O      1  SMART self-test log
0x09           SL  R/W      1  Selective self-test log
0x30           SL  R/O      9  IDENTIFY DEVICE data log
0x80-0x9f      SL  R/W     16  Host vendor specific log
0xe0           SL  R/W      1  SCT Command/Status
0xe1           SL  R/W      1  SCT Data Transfer

SMART Extended Comprehensive Error Log (GP Log 0x03) not supported

SMART Error Log Version: 1
Warning: ATA error count 0 inconsistent with error log pointer 1

ATA Error Count: 0
	CR = Command Register [HEX]
	FR = Features Register [HEX]
	SC = Sector Count Register [HEX]
	SN = Sector Number Register [HEX]
	CL = Cylinder Low Register [HEX]
	CH = Cylinder High Register [HEX]
	DH = Device/Head Register [HEX]
	DC = Device Command Register [HEX]
	ER = Error register [HEX]
	ST = Status register [HEX]
Powered_Up_Time is measured from power on, and printed as
DDd+hh:mm:SS.sss where DD=days, hh=hours, mm=minutes,
SS=sec, and sss=millisec. It "wraps" after 49.710 days.

Error 0 occurred at disk power-on lifetime: 0 hours (0 days + 0 hours)
  When the command that caused the error occurred, the device was in an unknown state.

  After command completion occurred, registers were:
  ER ST SC SN CL CH DH
  -- -- -- -- -- -- --
  00 ec 00 00 00 00 00

  Commands leading to the command that caused the error were:
  CR FR SC SN CL CH DH DC   Powered_Up_Time  Command/Feature_Name
  -- -- -- -- -- -- -- --  ----------------  --------------------
  ec 00 00 00 00 00 00 00      00:00:00.000  IDENTIFY DEVICE
  ec 00 00 00 00 00 00 00      00:00:00.000  IDENTIFY DEVICE
  ec 00 00 00 00 00 00 00      00:00:00.000  IDENTIFY DEVICE
  ec 00 00 00 00 00 00 00      00:00:00.000  IDENTIFY DEVICE
  c8 00 00 00 00 00 00 00      00:00:00.000  READ DMA

SMART Extended Self-test Log (GP Log 0x07) not supported

SMART Self-test log structure revision number 1
Num  Test_Description    Status                  Remaining  LifeTime(hours)  LBA_of_first_error
# 1  Short offline       Completed without error       00%        38         -

SMART Selective self-test log data structure revision number 1
 SPAN  MIN_LBA  MAX_LBA  CURRENT_TEST_STATUS
    1        0        0  Not_testing
    2        0        0  Not_testing
    3        0        0  Not_testing
    4        0        0  Not_testing
    5        0        0  Not_testing
Selective self-test flags (0x0):
  After scanning selected spans, do NOT read-scan remainder of disk.
If Selective self-test is pending on power-up, resume after 0 minute delay.

SCT Status Version:                  3
SCT Version (vendor specific):       1 (0x0001)
SCT Support Level:                   0
Device State:                        Active (0)
Current Temperature:                    35 Celsius
Power Cycle Min/Max Temperature:     28/43 Celsius
Lifetime    Min/Max Temperature:      0/50 Celsius
Under/Over Temperature Limit Count:   0/0

SCT Temperature History Version:     2
Temperature Sampling Period:         1 minute
Temperature Logging Interval:        1 minute
Min/Max recommended Temperature:      0/100 Celsius
Min/Max Temperature Limit:            0/100 Celsius
Temperature History Size (Index):    128 (53)

Index    Estimated Time   Temperature Celsius
  54    2018-01-24 10:18    26  *******
 ...    ..( 12 skipped).    ..  *******
  67    2018-01-24 10:31    26  *******
  68    2018-01-24 10:32    28  *********
  69    2018-01-24 10:33    33  **************
  70    2018-01-24 10:34    26  *******
  71    2018-01-24 10:35    26  *******
  72    2018-01-24 10:36    26  *******
  73    2018-01-24 10:37    28  *********
  74    2018-01-24 10:38    38  *******************
  75    2018-01-24 10:39    30  ***********
  76    2018-01-24 10:40    33  **************
  77    2018-01-24 10:41    31  ************
  78    2018-01-24 10:42    30  ***********
  79    2018-01-24 10:43    28  *********
  80    2018-01-24 10:44    36  *****************
  81    2018-01-24 10:45    36  *****************
  82    2018-01-24 10:46    30  ***********
  83    2018-01-24 10:47    30  ***********
  84    2018-01-24 10:48    33  **************
  85    2018-01-24 10:49    30  ***********
  86    2018-01-24 10:50    30  ***********
  87    2018-01-24 10:51    35  ****************
  88    2018-01-24 10:52    33  **************
  89    2018-01-24 10:53    35  ****************
  90    2018-01-24 10:54    30  ***********
 ...    ..(  4 skipped).    ..  ***********
  95    2018-01-24 10:59    30  ***********
  96    2018-01-24 11:00    31  ************
  97    2018-01-24 11:01    38  *******************
  98    2018-01-24 11:02    30  ***********
 ...    ..(  7 skipped).    ..  ***********
 106    2018-01-24 11:10    30  ***********
 107    2018-01-24 11:11    40  *********************
 108    2018-01-24 11:12    31  ************
 109    2018-01-24 11:13    30  ***********
 110    2018-01-24 11:14    31  ************
 111    2018-01-24 11:15    38  *******************
 112    2018-01-24 11:16    30  ***********
 113    2018-01-24 11:17    30  ***********
 114    2018-01-24 11:18    33  **************
 115    2018-01-24 11:19    38  *******************
 116    2018-01-24 11:20    33  **************
 117    2018-01-24 11:21    31  ************
 118    2018-01-24 11:22    30  ***********
 119    2018-01-24 11:23    30  ***********
 120    2018-01-24 11:24    31  ************
 121    2018-01-24 11:25    30  ***********
 122    2018-01-24 11:26    31  ************
 123    2018-01-24 11:27    30  ***********
 124    2018-01-24 11:28    33  **************
 125    2018-01-24 11:29    30  ***********
 ...    ..(  8 skipped).    ..  ***********
   6    2018-01-24 11:38    30  ***********
   7    2018-01-24 11:39    31  ************
   8    2018-01-24 11:40    30  ***********
   9    2018-01-24 11:41    41  **********************
  10    2018-01-24 11:42    41  **********************
  11    2018-01-24 11:43    43  ************************
  12    2018-01-24 11:44     ?  -
  13    2018-01-24 11:45     ?  -
  14    2018-01-24 11:46    40  *********************
  15    2018-01-24 11:47    40  *********************
  16    2018-01-24 11:48    40  *********************
  17    2018-01-24 11:49    38  *******************
  18    2018-01-24 11:50    41  **********************
  19    2018-01-24 11:51    41  **********************
  20    2018-01-24 11:52    40  *********************
  21    2018-01-24 11:53    38  *******************
  22    2018-01-24 11:54    41  **********************
  23    2018-01-24 11:55    36  *****************
  24    2018-01-24 11:56    43  ************************
  25    2018-01-24 11:57    41  **********************
  26    2018-01-24 11:58    41  **********************
  27    2018-01-24 11:59    43  ************************
  28    2018-01-24 12:00    43  ************************
  29    2018-01-24 12:01    41  **********************
  30    2018-01-24 12:02    43  ************************
  31    2018-01-24 12:03    33  **************
  32    2018-01-24 12:04    31  ************
  33    2018-01-24 12:05    31  ************
  34    2018-01-24 12:06    33  **************
  35    2018-01-24 12:07    31  ************
  36    2018-01-24 12:08    31  ************
  37    2018-01-24 12:09    40  *********************
  38    2018-01-24 12:10    40  *********************
  39    2018-01-24 12:11    30  ***********
 ...    ..(  5 skipped).    ..  ***********
  45    2018-01-24 12:17    30  ***********
  46    2018-01-24 12:18    28  *********
  47    2018-01-24 12:19    33  **************
  48    2018-01-24 12:20    31  ************
  49    2018-01-24 12:21    28  *********
  50    2018-01-24 12:22    40  *********************
  51    2018-01-24 12:23    33  **************
  52    2018-01-24 12:24    35  ****************
  53    2018-01-24 12:25    30  ***********

SCT Error Recovery Control command not supported

Device Statistics (SMART Log 0x04)
Page  Offset Size        Value Flags Description
0x01  =====  =               =  ===  == General Statistics (rev 1) ==
0x01  0x008  4              42  ---  Lifetime Power-On Resets
0x01  0x010  4              38  ---  Power-on Hours
0x01  0x018  6       741781174  ---  Logical Sectors Written
0x01  0x020  6         4742795  ---  Number of Write Commands
0x01  0x028  6       294393128  ---  Logical Sectors Read
0x01  0x030  6         5175400  ---  Number of Read Commands
0x01  0x038  6      4294967296  ---  Date and Time TimeStamp
0x04  =====  =               =  ===  == General Errors Statistics (rev 1) ==
0x04  0x008  4               0  ---  Number of Reported Uncorrectable Errors
0x04  0x010  4               1  ---  Resets Between Cmd Acceptance and Completion
0x05  =====  =               =  ===  == Temperature Statistics (rev 1) ==
0x05  0x008  1              35  ---  Current Temperature
0x05  0x010  1              30  ---  Average Short Term Temperature
0x05  0x018  1              29  ---  Average Long Term Temperature
0x05  0x020  1              50  ---  Highest Temperature
0x05  0x028  1               0  ---  Lowest Temperature
0x05  0x030  1              44  ---  Highest Average Short Term Temperature
0x05  0x038  1               0  ---  Lowest Average Short Term Temperature
0x05  0x040  1              41  ---  Highest Average Long Term Temperature
0x05  0x048  1               0  ---  Lowest Average Long Term Temperature
0x05  0x050  4               0  ---  Time in Over-Temperature
0x05  0x058  1              70  ---  Specified Maximum Operating Temperature
0x05  0x060  4               0  ---  Time in Under-Temperature
0x05  0x068  1               0  ---  Specified Minimum Operating Temperature
0x06  =====  =               =  ===  == Transport Statistics (rev 1) ==
0x06  0x008  4             133  ---  Number of Hardware Resets
0x06  0x010  4               2  ---  Number of ASR Events
0x06  0x018  4               0  ---  Number of Interface CRC Errors
0x07  =====  =               =  ===  == Solid State Device Statistics (rev 1) ==
0x07  0x008  1               0  ---  Percentage Used Endurance Indicator
                                |||_ C monitored condition met
                                ||__ D supports DSN
                                |___ N normalized value

Pending Defects log (GP Log 0x0c) not supported

ATA_READ_LOG_EXT (addr=0x11:0x00, page=0, n=1) failed: 48-bit ATA commands not implemented
Read SATA Phy Event Counters failed

