smartctl 6.6 2017-11-05 r4594 [x86_64-sun-solaris2.11] (local build)
Copyright (C) 2002-17, Bruce Allen, Christian Franke, www.smartmontools.org

=== START OF INFORMATION SECTION ===
Device Model:     SAMSUNG MZ7KM480HMHQ-00005
Firmware Version: GXM5104Q
User Capacity:    480,103,981,056 bytes [480 GB]
Sector Size:      512 bytes logical/physical
Rotation Rate:    Solid State Device
Form Factor:      2.5 inches
Device is:        Not in smartctl database [for details use: -P showall]
ATA Version is:   ACS-2, ATA8-ACS T13/1699-D revision 4c
SATA Version is:  SATA 3.1, 6.0 Gb/s (current: 6.0 Gb/s)
Local Time is:    Wed Nov 28 15:29:57 2018 EST
SMART support is: Available - device has SMART capability.
SMART support is: Enabled
AAM feature is:   Unavailable
APM feature is:   Disabled
Rd look-ahead is: Enabled
Write cache is:   Enabled
DSN feature is:   Unavailable
ATA Security is:  Disabled, frozen [SEC2]
Wt Cache Reorder: Unknown (0xe001)

=== START OF READ SMART DATA SECTION ===
SMART overall-health self-assessment test result: PASSED

General SMART Values:
Offline data collection status:  (0x02)	Offline data collection activity
					was completed without error.
					Auto Offline Data Collection: Disabled.
Self-test execution status:      (   0)	The previous self-test routine completed
					without error or no self-test has ever 
					been run.
Total time to complete Offline 
data collection: 		( 2100) seconds.
Offline data collection
capabilities: 			 (0x53) SMART execute Offline immediate.
					Auto Offline data collection on/off support.
					Suspend Offline collection upon new
					command.
					No Offline surface scan supported.
					Self-test supported.
					No Conveyance Self-test supported.
					Selective Self-test supported.
SMART capabilities:            (0x0003)	Saves SMART data before entering
					power-saving mode.
					Supports SMART auto save timer.
Error logging capability:        (0x01)	Error logging supported.
					General Purpose Logging supported.
Short self-test routine 
recommended polling time: 	 (   2) minutes.
Extended self-test routine
recommended polling time: 	 (  35) minutes.
SCT capabilities: 	       (0x003d)	SCT Status supported.
					SCT Error Recovery Control supported.
					SCT Feature Control supported.
					SCT Data Table supported.

SMART Attributes Data Structure revision number: 1
Vendor Specific SMART Attributes with Thresholds:
ID# ATTRIBUTE_NAME          FLAGS    VALUE WORST THRESH FAIL RAW_VALUE
  5 Reallocated_Sector_Ct   PO--CK   100   100   010    -    0
  9 Power_On_Hours          -O--CK   099   099   000    -    94
 12 Power_Cycle_Count       -O--CK   099   099   000    -    32
177 Wear_Leveling_Count     PO--C-   100   099   005    -    0
179 Used_Rsvd_Blk_Cnt_Tot   PO--C-   100   100   010    -    0
180 Unused_Rsvd_Blk_Cnt_Tot PO--C-   100   100   010    -    2752
181 Program_Fail_Cnt_Total  -O--CK   100   100   010    -    0
182 Erase_Fail_Count_Total  -O--CK   100   100   010    -    0
183 Runtime_Bad_Block       PO--C-   100   100   010    -    0
184 End-to-End_Error        PO--CK   100   100   097    -    0
187 Reported_Uncorrect      -O--CK   100   100   000    -    0
190 Airflow_Temperature_Cel -O--CK   069   059   000    -    31
194 Temperature_Celsius     -O---K   069   059   000    -    31 (Min/Max 21/41)
195 Hardware_ECC_Recovered  -O-RC-   200   200   000    -    0
197 Current_Pending_Sector  -O--CK   100   100   000    -    0
199 UDMA_CRC_Error_Count    -OSRCK   100   100   000    -    0
202 Unknown_SSD_Attribute   PO--CK   100   100   010    -    0
235 Unknown_Attribute       -O--C-   099   099   000    -    28
241 Total_LBAs_Written      -O--CK   099   099   000    -    222512133
242 Total_LBAs_Read         -O--CK   099   099   000    -    155063007
243 Unknown_Attribute       -O--CK   100   100   000    -    0
244 Unknown_Attribute       -O--CK   100   100   000    -    0
245 Unknown_Attribute       -O--CK   100   100   000    -    65535
246 Unknown_Attribute       -O--CK   100   100   000    -    65535
247 Unknown_Attribute       -O--CK   100   100   000    -    65535
251 Unknown_Attribute       -O--CK   100   100   000    -    259752448
                            ||||||_ K auto-keep
                            |||||__ C event count
                            ||||___ R error rate
                            |||____ S speed/performance
                            ||_____ O updated online
                            |______ P prefailure warning

ATA_READ_LOG_EXT (addr=0x00:0x00, page=0, n=1) failed: 48-bit ATA commands require SAT ATA PASS-THROUGH (16)
Read GP Log Directory failed

SMART Log Directory Version 1 [multi-sector log support]
Address    Access  R/W   Size  Description
0x00           SL  R/O      1  Log Directory
0x01           SL  R/O      1  Summary SMART error log
0x02           SL  R/O      1  Comprehensive SMART error log
0x04           SL  R/O      8  Device Statistics log
0x06           SL  R/O      1  SMART self-test log
0x09           SL  R/W      1  Selective self-test log
0x30           SL  R/O      9  IDENTIFY DEVICE data log
0x80-0x9f      SL  R/W     16  Host vendor specific log
0xce           SL  VS      16  Device vendor specific log
0xe0           SL  R/W      1  SCT Command/Status
0xe1           SL  R/W      1  SCT Data Transfer

SMART Extended Comprehensive Error Log (GP Log 0x03) not supported

SMART Error Log Version: 1
No Errors Logged

SMART Extended Self-test Log (GP Log 0x07) not supported

SMART Self-test log structure revision number 1
Num  Test_Description    Status                  Remaining  LifeTime(hours)  LBA_of_first_error
# 1  Short offline       Completed without error       00%        94         -

SMART Selective self-test log data structure revision number 1
 SPAN  MIN_LBA  MAX_LBA  CURRENT_TEST_STATUS
    1        0        0  Not_testing
    2        0        0  Not_testing
    3        0        0  Not_testing
    4        0        0  Not_testing
    5        0        0  Not_testing
  255        0    65535  Read_scanning was completed without error
Selective self-test flags (0x0):
  After scanning selected spans, do NOT read-scan remainder of disk.
If Selective self-test is pending on power-up, resume after 0 minute delay.

SCT Status Version:                  3
SCT Version (vendor specific):       256 (0x0100)
SCT Support Level:                   1
Device State:                        SCT command executing in background (5)
Current Temperature:                    31 Celsius
Power Cycle Min/Max Temperature:     30/32 Celsius
Lifetime    Min/Max Temperature:     21/41 Celsius
Under/Over Temperature Limit Count:   0/0

SCT Temperature History Version:     2
Temperature Sampling Period:         1 minute
Temperature Logging Interval:        10 minutes
Min/Max recommended Temperature:      0/70 Celsius
Min/Max Temperature Limit:            0/70 Celsius
Temperature History Size (Index):    128 (60)

Index    Estimated Time   Temperature Celsius
  61    2018-11-27 18:10    31  ************
  62    2018-11-27 18:20    30  ***********
  63    2018-11-27 18:30    31  ************
  64    2018-11-27 18:40    31  ************
  65    2018-11-27 18:50    30  ***********
  66    2018-11-27 19:00    31  ************
 ...    ..(  6 skipped).    ..  ************
  73    2018-11-27 20:10    31  ************
  74    2018-11-27 20:20    30  ***********
  75    2018-11-27 20:30    31  ************
  76    2018-11-27 20:40    30  ***********
  77    2018-11-27 20:50    31  ************
  78    2018-11-27 21:00    31  ************
  79    2018-11-27 21:10    30  ***********
  80    2018-11-27 21:20    31  ************
  81    2018-11-27 21:30    30  ***********
  82    2018-11-27 21:40    31  ************
  83    2018-11-27 21:50    31  ************
  84    2018-11-27 22:00    30  ***********
  85    2018-11-27 22:10    31  ************
  86    2018-11-27 22:20    30  ***********
  87    2018-11-27 22:30    31  ************
 ...    ..(  2 skipped).    ..  ************
  90    2018-11-27 23:00    31  ************
  91    2018-11-27 23:10    30  ***********
  92    2018-11-27 23:20    31  ************
  93    2018-11-27 23:30    30  ***********
  94    2018-11-27 23:40    30  ***********
  95    2018-11-27 23:50    31  ************
  96    2018-11-28 00:00    30  ***********
  97    2018-11-28 00:10    31  ************
 ...    ..(  2 skipped).    ..  ************
 100    2018-11-28 00:40    31  ************
 101    2018-11-28 00:50    30  ***********
 102    2018-11-28 01:00    31  ************
 103    2018-11-28 01:10    30  ***********
 104    2018-11-28 01:20    30  ***********
 105    2018-11-28 01:30    31  ************
 106    2018-11-28 01:40    30  ***********
 107    2018-11-28 01:50    31  ************
 108    2018-11-28 02:00    30  ***********
 109    2018-11-28 02:10    30  ***********
 110    2018-11-28 02:20    31  ************
 111    2018-11-28 02:30    30  ***********
 112    2018-11-28 02:40    31  ************
 113    2018-11-28 02:50    30  ***********
 114    2018-11-28 03:00    31  ************
 ...    ..(  2 skipped).    ..  ************
 117    2018-11-28 03:30    31  ************
 118    2018-11-28 03:40    30  ***********
 119    2018-11-28 03:50    31  ************
 ...    ..(  2 skipped).    ..  ************
 122    2018-11-28 04:20    31  ************
 123    2018-11-28 04:30    30  ***********
 124    2018-11-28 04:40    31  ************
 125    2018-11-28 04:50    30  ***********
 126    2018-11-28 05:00    31  ************
 127    2018-11-28 05:10    31  ************
   0    2018-11-28 05:20    30  ***********
   1    2018-11-28 05:30    31  ************
   2    2018-11-28 05:40    30  ***********
   3    2018-11-28 05:50    31  ************
   4    2018-11-28 06:00    30  ***********
   5    2018-11-28 06:10    31  ************
 ...    ..(  2 skipped).    ..  ************
   8    2018-11-28 06:40    31  ************
   9    2018-11-28 06:50    30  ***********
  10    2018-11-28 07:00    31  ************
 ...    ..(  2 skipped).    ..  ************
  13    2018-11-28 07:30    31  ************
  14    2018-11-28 07:40    30  ***********
  15    2018-11-28 07:50    30  ***********
  16    2018-11-28 08:00    31  ************
 ...    ..(  2 skipped).    ..  ************
  19    2018-11-28 08:30    31  ************
  20    2018-11-28 08:40    30  ***********
  21    2018-11-28 08:50    31  ************
  22    2018-11-28 09:00    30  ***********
  23    2018-11-28 09:10    30  ***********
  24    2018-11-28 09:20    31  ************
  25    2018-11-28 09:30    30  ***********
  26    2018-11-28 09:40    31  ************
  27    2018-11-28 09:50    31  ************
  28    2018-11-28 10:00    30  ***********
  29    2018-11-28 10:10    31  ************
  30    2018-11-28 10:20    31  ************
  31    2018-11-28 10:30    30  ***********
  32    2018-11-28 10:40    30  ***********
  33    2018-11-28 10:50    31  ************
 ...    ..(  4 skipped).    ..  ************
  38    2018-11-28 11:40    31  ************
  39    2018-11-28 11:50    30  ***********
  40    2018-11-28 12:00    31  ************
  41    2018-11-28 12:10    31  ************
  42    2018-11-28 12:20    31  ************
  43    2018-11-28 12:30    30  ***********
  44    2018-11-28 12:40    31  ************
 ...    ..( 14 skipped).    ..  ************
  59    2018-11-28 15:10    31  ************
  60    2018-11-28 15:20    32  *************

SMART WRITE LOG returns COUNT and LBA_LOW register unchanged
SCT (Get) Error Recovery Control command failed

Device Statistics (SMART Log 0x04)
Page  Offset Size        Value Flags Description
0x01  =====  =               =  ===  == General Statistics (rev 1) ==
0x01  0x008  4              32  ---  Lifetime Power-On Resets
0x01  0x010  4              94  ---  Power-on Hours
0x01  0x018  6       222512133  ---  Logical Sectors Written
0x01  0x020  6          324096  ---  Number of Write Commands
0x01  0x028  6       155063007  ---  Logical Sectors Read
0x01  0x030  6            3550  ---  Number of Read Commands
0x01  0x038  6         2205000  ---  Date and Time TimeStamp
0x04  =====  =               =  ===  == General Errors Statistics (rev 1) ==
0x04  0x008  4               0  ---  Number of Reported Uncorrectable Errors
0x04  0x010  4               0  ---  Resets Between Cmd Acceptance and Completion
0x05  =====  =               =  ===  == Temperature Statistics (rev 1) ==
0x05  0x008  1              31  ---  Current Temperature
0x05  0x020  1              41  ---  Highest Temperature
0x05  0x028  1              21  ---  Lowest Temperature
0x05  0x058  1              55  ---  Specified Maximum Operating Temperature
0x06  =====  =               =  ===  == Transport Statistics (rev 1) ==
0x06  0x008  4               1  ---  Number of Hardware Resets
0x06  0x010  4               0  ---  Number of ASR Events
0x06  0x018  4               0  ---  Number of Interface CRC Errors
0x07  =====  =               =  ===  == Solid State Device Statistics (rev 1) ==
0x07  0x008  1               0  N--  Percentage Used Endurance Indicator
                                |||_ C monitored condition met
                                ||__ D supports DSN
                                |___ N normalized value

Pending Defects log (GP Log 0x0c) not supported

ATA_READ_LOG_EXT (addr=0x11:0x00, page=0, n=1) failed: 48-bit ATA commands require SAT ATA PASS-THROUGH (16)
Read SATA Phy Event Counters failed
