smartctl 7.4 2023-08-01 r5530 [x86_64-linux-6.12.6-200.fc41.x86_64] (local build)
Copyright (C) 2002-23, Bruce Allen, Christian Franke, www.smartmontools.org

=== START OF INFORMATION SECTION ===
Device Model:     WDC WD80EFPX-68C4ZN0
Serial Number:    WD-RD14X8DD
LU WWN Device Id: 5 0014ee 2c11424ae
Firmware Version: 81.00A81
User Capacity:    8,001,563,222,016 bytes [8.00 TB]
Sector Sizes:     512 bytes logical, 4096 bytes physical
Rotation Rate:    5640 rpm
Form Factor:      3.5 inches
Device is:        Not in smartctl database 7.3/5528
ATA Version is:   ACS-3 T13/2161-D revision 5
SATA Version is:  SATA 3.1, 6.0 Gb/s (current: 6.0 Gb/s)
Local Time is:    Sun Jan  5 15:05:53 2025 CET
SMART support is: Available - device has SMART capability.
SMART support is: Enabled
AAM feature is:   Unavailable
APM feature is:   Unavailable
Rd look-ahead is: Enabled
Write cache is:   Enabled
DSN feature is:   Unavailable
ATA Security is:  Disabled, NOT FROZEN [SEC1]
Wt Cache Reorder: Enabled

Warning! SMART Attribute Thresholds Structure error: invalid SMART checksum.
=== START OF READ SMART DATA SECTION ===
SMART overall-health self-assessment test result: PASSED

General SMART Values:
Offline data collection status:  (0x00)	Offline data collection activity
					was never started.
					Auto Offline Data Collection: Disabled.
Self-test execution status:      ( 249)	Self-test routine in progress...
					90% of test remaining.
Total time to complete Offline 
data collection: 		(10184) seconds.
Offline data collection
capabilities: 			 (0x7b) SMART execute Offline immediate.
					Auto Offline data collection on/off support.
					Suspend Offline collection upon new
					command.
					Offline surface scan supported.
					Self-test supported.
					Conveyance Self-test supported.
					Selective Self-test supported.
SMART capabilities:            (0x0003)	Saves SMART data before entering
					power-saving mode.
					Supports SMART auto save timer.
Error logging capability:        (0x01)	Error logging supported.
					General Purpose Logging supported.
Short self-test routine 
recommended polling time: 	 (   2) minutes.
Extended self-test routine
recommended polling time: 	 ( 777) minutes.
Conveyance self-test routine
recommended polling time: 	 (   5) minutes.
SCT capabilities: 	       (0x0039)	SCT Status supported.
					SCT Error Recovery Control supported.
					SCT Feature Control supported.
					SCT Data Table supported.

SMART Attributes Data Structure revision number: 16
Vendor Specific SMART Attributes with Thresholds:
ID# ATTRIBUTE_NAME          FLAGS    VALUE WORST THRESH FAIL RAW_VALUE
  1 Raw_Read_Error_Rate     POSR-K   200   200   051    -    0
  3 Spin_Up_Time            POS--K   253   230   021    -    3475
  4 Start_Stop_Count        -O--CK   100   100   000    -    243
  5 Reallocated_Sector_Ct   PO--CK   200   200   140    -    0
  7 Seek_Error_Rate         -OSR-K   200   200   000    -    0
  9 Power_On_Hours          -O--CK   098   098   000    -    1463
 10 Spin_Retry_Count        -O--CK   100   100   000    -    0
 11 Calibration_Retry_Count -O--CK   100   100   000    -    0
 12 Power_Cycle_Count       -O--CK   100   100   000    -    242
192 Power-Off_Retract_Count -O--CK   200   200   000    -    229
193 Load_Cycle_Count        -O--CK   200   200   000    -    204
194 Temperature_Celsius     -O---K   119   113   000    -    33
196 Reallocated_Event_Count -O--CK   200   200   000    -    0
197 Current_Pending_Sector  -O--CK   200   200   000    -    0
198 Offline_Uncorrectable   ----CK   100   253   000    -    0
199 UDMA_CRC_Error_Count    -O--CK   200   200   000    -    0
200 Multi_Zone_Error_Rate   ---R--   100   253   000    -    0
                            ||||||_ K auto-keep
                            |||||__ C event count
                            ||||___ R error rate
                            |||____ S speed/performance
                            ||_____ O updated online
                            |______ P prefailure warning

General Purpose Log Directory Version 1
SMART           Log Directory Version 1 [multi-sector log support]
Address    Access  R/W   Size  Description
0x00       GPL,SL  R/O      1  Log Directory
0x01           SL  R/O      1  Summary SMART error log
0x02           SL  R/O      5  Comprehensive SMART error log
0x03       GPL     R/O      6  Ext. Comprehensive SMART error log
0x04       GPL     R/O    256  Device Statistics log
0x04       SL      R/O    255  Device Statistics log
0x06           SL  R/O      1  SMART self-test log
0x07       GPL     R/O      1  Extended self-test log
0x09           SL  R/W      1  Selective self-test log
0x0c       GPL     R/O   2048  Pending Defects log
0x10       GPL     R/O      1  NCQ Command Error log
0x11       GPL     R/O      1  SATA Phy Event Counters log
0x24       GPL     R/O    310  Current Device Internal Status Data log
0x30       GPL,SL  R/O      9  IDENTIFY DEVICE data log
0x80-0x9f  GPL,SL  R/W     16  Host vendor specific log
0xa0-0xa1  GPL,SL  VS      16  Device vendor specific log
0xa3-0xa7  GPL,SL  VS      16  Device vendor specific log
0xa8-0xb6  GPL,SL  VS       1  Device vendor specific log
0xb7       GPL,SL  VS      80  Device vendor specific log
0xbd       GPL,SL  VS       1  Device vendor specific log
0xc0       GPL,SL  VS       1  Device vendor specific log
0xc1       GPL     VS      93  Device vendor specific log
0xe0       GPL,SL  R/W      1  SCT Command/Status
0xe1       GPL,SL  R/W      1  SCT Data Transfer

SMART Extended Comprehensive Error Log Version: 1 (6 sectors)
Device Error Count: 8
	CR     = Command Register
	FEATR  = Features Register
	COUNT  = Count (was: Sector Count) Register
	LBA_48 = Upper bytes of LBA High/Mid/Low Registers ]  ATA-8
	LH     = LBA High (was: Cylinder High) Register    ]   LBA
	LM     = LBA Mid (was: Cylinder Low) Register      ] Register
	LL     = LBA Low (was: Sector Number) Register     ]
	DV     = Device (was: Device/Head) Register
	DC     = Device Control Register
	ER     = Error register
	ST     = Status register
Powered_Up_Time is measured from power on, and printed as
DDd+hh:mm:SS.sss where DD=days, hh=hours, mm=minutes,
SS=sec, and sss=millisec. It "wraps" after 49.710 days.

Error 8 [7] occurred at disk power-on lifetime: 832 hours (34 days + 16 hours)
  When the command that caused the error occurred, the device was active or idle.

  After command completion occurred, registers were:
  ER -- ST COUNT  LBA_48  LH LM LL DV DC
  -- -- -- == -- == == == -- -- -- -- --
  40 -- 51 00 08 00 01 a4 79 98 40 e0 00  Error: UNC 8 sectors at LBA = 0x1a4799840 = 7054399552

  Commands leading to the command that caused the error were:
  CR FEATR COUNT  LBA_48  LH LM LL DV DC  Powered_Up_Time  Command/Feature_Name
  -- == -- == -- == == == -- -- -- -- --  ---------------  --------------------
  25 00 00 00 08 00 01 a4 79 98 40 e0 08     22:51:49.371  READ DMA EXT
  b0 00 d5 00 01 00 00 00 c2 4f 01 00 08     22:22:34.655  SMART READ LOG
  b0 00 d5 00 01 00 00 00 c2 4f 06 00 08     22:22:34.654  SMART READ LOG
  b0 00 d0 00 01 00 00 00 c2 4f 00 00 08     22:22:34.645  SMART READ DATA
  b0 00 da 00 00 00 00 00 c2 4f 00 00 08     22:22:34.642  SMART RETURN STATUS

Error 7 [6] occurred at disk power-on lifetime: 642 hours (26 days + 18 hours)
  When the command that caused the error occurred, the device was active or idle.

  After command completion occurred, registers were:
  ER -- ST COUNT  LBA_48  LH LM LL DV DC
  -- -- -- == -- == == == -- -- -- -- --
  10 -- 51 00 00 00 00 00 00 00 00 40 00  Error: IDNF at LBA = 0x00000000 = 0

  Commands leading to the command that caused the error were:
  CR FEATR COUNT  LBA_48  LH LM LL DV DC  Powered_Up_Time  Command/Feature_Name
  -- == -- == -- == == == -- -- -- -- --  ---------------  --------------------
  61 00 08 00 70 00 00 00 00 00 00 40 08  6d+22:11:41.835  WRITE FPDMA QUEUED
  60 01 f8 00 68 00 00 00 00 02 08 40 08  6d+22:11:41.834  READ FPDMA QUEUED
  60 00 f8 00 60 00 00 00 00 01 08 40 08  6d+22:11:41.833  READ FPDMA QUEUED
  60 00 78 00 58 00 00 00 00 00 88 40 08  6d+22:11:41.833  READ FPDMA QUEUED
  60 00 30 00 50 00 00 00 00 00 48 40 08  6d+22:11:41.833  READ FPDMA QUEUED

Error 6 [5] occurred at disk power-on lifetime: 467 hours (19 days + 11 hours)
  When the command that caused the error occurred, the device was active or idle.

  After command completion occurred, registers were:
  ER -- ST COUNT  LBA_48  LH LM LL DV DC
  -- -- -- == -- == == == -- -- -- -- --
  40 -- 51 00 00 00 03 a3 81 2a 00 40 00  Error: UNC at LBA = 0x3a3812a00 = 15628052992

  Commands leading to the command that caused the error were:
  CR FEATR COUNT  LBA_48  LH LM LL DV DC  Powered_Up_Time  Command/Feature_Name
  -- == -- == -- == == == -- -- -- -- --  ---------------  --------------------
  60 00 08 00 f8 00 03 a3 81 2a 00 40 08  6d+21:00:28.775  READ FPDMA QUEUED
  b0 00 da 00 00 00 00 00 c2 4f 00 00 08  6d+20:55:51.084  SMART RETURN STATUS
  b0 00 d0 00 01 00 00 00 c2 4f 00 00 08  6d+20:55:51.075  SMART READ DATA
  b0 00 d1 00 01 00 00 00 c2 4f 00 00 08  6d+20:55:51.071  SMART READ ATTRIBUTE THRESHOLDS [OBS-4]
  ec 00 00 00 01 00 00 00 00 00 00 00 08  6d+20:55:51.071  IDENTIFY DEVICE

Error 5 [4] occurred at disk power-on lifetime: 111 hours (4 days + 15 hours)
  When the command that caused the error occurred, the device was active or idle.

  After command completion occurred, registers were:
  ER -- ST COUNT  LBA_48  LH LM LL DV DC
  -- -- -- == -- == == == -- -- -- -- --
  40 -- 51 00 00 00 00 85 e1 f8 b8 40 00  Error: UNC at LBA = 0x85e1f8b8 = 2246179000

  Commands leading to the command that caused the error were:
  CR FEATR COUNT  LBA_48  LH LM LL DV DC  Powered_Up_Time  Command/Feature_Name
  -- == -- == -- == == == -- -- -- -- --  ---------------  --------------------
  60 00 20 00 98 00 00 85 e1 f8 b8 40 08     00:46:55.773  READ FPDMA QUEUED
  b0 00 da 00 00 00 00 00 c2 4f 00 00 08     00:45:17.003  SMART RETURN STATUS
  b0 00 d0 00 01 00 00 00 c2 4f 00 00 08     00:45:16.994  SMART READ DATA
  b0 00 d1 00 01 00 00 00 c2 4f 00 00 08     00:45:16.990  SMART READ ATTRIBUTE THRESHOLDS [OBS-4]
  ec 00 00 00 01 00 00 00 00 00 00 00 08     00:45:16.990  IDENTIFY DEVICE

Error 4 [3] occurred at disk power-on lifetime: 832 hours (34 days + 16 hours)
  When the command that caused the error occurred, the device was active or idle.

  After command completion occurred, registers were:
  ER -- ST COUNT  LBA_48  LH LM LL DV DC
  -- -- -- == -- == == == -- -- -- -- --
  40 -- 51 00 08 00 01 a4 79 98 40 e0 00  Error: UNC 8 sectors at LBA = 0x1a4799840 = 7054399552

  Commands leading to the command that caused the error were:
  CR FEATR COUNT  LBA_48  LH LM LL DV DC  Powered_Up_Time  Command/Feature_Name
  -- == -- == -- == == == -- -- -- -- --  ---------------  --------------------
  25 00 00 00 08 00 01 a4 79 98 40 e0 08     22:51:49.371  READ DMA EXT
  b0 00 d5 00 01 00 00 00 c2 4f 01 00 08     22:22:34.655  SMART READ LOG
  b0 00 d5 00 01 00 00 00 c2 4f 06 00 08     22:22:34.654  SMART READ LOG
  b0 00 d0 00 01 00 00 00 c2 4f 00 00 08     22:22:34.645  SMART READ DATA
  b0 00 da 00 00 00 00 00 c2 4f 00 00 08     22:22:34.642  SMART RETURN STATUS

Error 3 [2] occurred at disk power-on lifetime: 642 hours (26 days + 18 hours)
  When the command that caused the error occurred, the device was active or idle.

  After command completion occurred, registers were:
  ER -- ST COUNT  LBA_48  LH LM LL DV DC
  -- -- -- == -- == == == -- -- -- -- --
  10 -- 51 00 00 00 00 00 00 00 00 40 00  Error: IDNF at LBA = 0x00000000 = 0

  Commands leading to the command that caused the error were:
  CR FEATR COUNT  LBA_48  LH LM LL DV DC  Powered_Up_Time  Command/Feature_Name
  -- == -- == -- == == == -- -- -- -- --  ---------------  --------------------
  61 00 08 00 70 00 00 00 00 00 00 40 08  6d+22:11:41.835  WRITE FPDMA QUEUED
  60 01 f8 00 68 00 00 00 00 02 08 40 08  6d+22:11:41.834  READ FPDMA QUEUED
  60 00 f8 00 60 00 00 00 00 01 08 40 08  6d+22:11:41.833  READ FPDMA QUEUED
  60 00 78 00 58 00 00 00 00 00 88 40 08  6d+22:11:41.833  READ FPDMA QUEUED
  60 00 30 00 50 00 00 00 00 00 48 40 08  6d+22:11:41.833  READ FPDMA QUEUED

Error 2 [1] occurred at disk power-on lifetime: 467 hours (19 days + 11 hours)
  When the command that caused the error occurred, the device was active or idle.

  After command completion occurred, registers were:
  ER -- ST COUNT  LBA_48  LH LM LL DV DC
  -- -- -- == -- == == == -- -- -- -- --
  40 -- 51 00 00 00 03 a3 81 2a 00 40 00  Error: UNC at LBA = 0x3a3812a00 = 15628052992

  Commands leading to the command that caused the error were:
  CR FEATR COUNT  LBA_48  LH LM LL DV DC  Powered_Up_Time  Command/Feature_Name
  -- == -- == -- == == == -- -- -- -- --  ---------------  --------------------
  60 00 08 00 f8 00 03 a3 81 2a 00 40 08  6d+21:00:28.775  READ FPDMA QUEUED
  b0 00 da 00 00 00 00 00 c2 4f 00 00 08  6d+20:55:51.084  SMART RETURN STATUS
  b0 00 d0 00 01 00 00 00 c2 4f 00 00 08  6d+20:55:51.075  SMART READ DATA
  b0 00 d1 00 01 00 00 00 c2 4f 00 00 08  6d+20:55:51.071  SMART READ ATTRIBUTE THRESHOLDS [OBS-4]
  ec 00 00 00 01 00 00 00 00 00 00 00 08  6d+20:55:51.071  IDENTIFY DEVICE

Error 1 [0] occurred at disk power-on lifetime: 111 hours (4 days + 15 hours)
  When the command that caused the error occurred, the device was active or idle.

  After command completion occurred, registers were:
  ER -- ST COUNT  LBA_48  LH LM LL DV DC
  -- -- -- == -- == == == -- -- -- -- --
  40 -- 51 00 00 00 00 85 e1 f8 b8 40 00  Error: UNC at LBA = 0x85e1f8b8 = 2246179000

  Commands leading to the command that caused the error were:
  CR FEATR COUNT  LBA_48  LH LM LL DV DC  Powered_Up_Time  Command/Feature_Name
  -- == -- == -- == == == -- -- -- -- --  ---------------  --------------------
  60 00 20 00 98 00 00 85 e1 f8 b8 40 08     00:46:55.773  READ FPDMA QUEUED
  b0 00 da 00 00 00 00 00 c2 4f 00 00 08     00:45:17.003  SMART RETURN STATUS
  b0 00 d0 00 01 00 00 00 c2 4f 00 00 08     00:45:16.994  SMART READ DATA
  b0 00 d1 00 01 00 00 00 c2 4f 00 00 08     00:45:16.990  SMART READ ATTRIBUTE THRESHOLDS [OBS-4]
  ec 00 00 00 01 00 00 00 00 00 00 00 08     00:45:16.990  IDENTIFY DEVICE

SMART Error Log Version: 1
ATA Error Count: 1
	CR = Command Register [HEX]
	FR = Features Register [HEX]
	SC = Sector Count Register [HEX]
	SN = Sector Number Register [HEX]
	CL = Cylinder Low Register [HEX]
	CH = Cylinder High Register [HEX]
	DH = Device/Head Register [HEX]
	DC = Device Command Register [HEX]
	ER = Error register [HEX]
	ST = Status register [HEX]
Powered_Up_Time is measured from power on, and printed as
DDd+hh:mm:SS.sss where DD=days, hh=hours, mm=minutes,
SS=sec, and sss=millisec. It "wraps" after 49.710 days.

Error 1 occurred at disk power-on lifetime: 936 hours (39 days + 0 hours)
  When the command that caused the error occurred, the device was active or idle.

  After command completion occurred, registers were:
  ER ST SC SN CL CH DH
  -- -- -- -- -- -- --
  40 51 10 10 0a 00 e0  Error: UNC 16 sectors at LBA = 0x00000a10 = 2576

  Commands leading to the command that caused the error were:
  CR FR SC SN CL CH DH DC   Powered_Up_Time  Command/Feature_Name
  -- -- -- -- -- -- -- --  ----------------  --------------------
  c8 00 10 10 0a 00 e0 08   2d+06:18:22.390  READ DMA
  b0 d5 01 01 4f c2 00 08   2d+05:55:07.338  SMART READ LOG
  b0 d5 01 06 4f c2 00 08   2d+05:55:07.338  SMART READ LOG
  b0 d0 01 00 4f c2 00 08   2d+05:55:07.329  SMART READ DATA
  b0 da 00 00 4f c2 00 08   2d+05:55:07.325  SMART RETURN STATUS

SMART Extended Self-test Log Version: 1 (1 sectors)
Num  Test_Description    Status                  Remaining  LifeTime(hours)  LBA_of_first_error
# 1  Short offline       Completed without error       00%      1461         -
# 2  Short offline       Completed without error       00%      1435         -
# 3  Short offline       Completed without error       00%      1409         -

SMART Self-test log structure revision number 1
Num  Test_Description    Status                  Remaining  LifeTime(hours)  LBA_of_first_error
# 1  Short offline       Completed without error       00%      1461         -
# 2  Short offline       Completed without error       00%      1435         -
# 3  Short offline       Completed without error       00%      1409         -

SMART Selective self-test log data structure revision number 1
 SPAN  MIN_LBA  MAX_LBA  CURRENT_TEST_STATUS
    1        0        0  Not_testing
    2        0        0  Not_testing
    3        0        0  Not_testing
    4        0        0  Not_testing
    5        0        0  Not_testing
Selective self-test flags (0x0):
  After scanning selected spans, do NOT read-scan remainder of disk.
If Selective self-test is pending on power-up, resume after 0 minute delay.

SCT Status Version:                  3
SCT Version (vendor specific):       258 (0x0102)
Device State:                        Stand-by (1)
Current Temperature:                    33 Celsius
Power Cycle Min/Max Temperature:     28/33 Celsius
Lifetime    Min/Max Temperature:     21/38 Celsius
Under/Over Temperature Limit Count:   0/0
Vendor specific:
01 00 00 00 00 00 00 00 00 00 00 00 00 00 00 00
00 00 00 00 00 00 00 00 00 00 00 00 00 00 00 00

SCT Temperature History Version:     2
Temperature Sampling Period:         1 minute
Temperature Logging Interval:        1 minute
Min/Max recommended Temperature:      0/65 Celsius
Min/Max Temperature Limit:           -41/85 Celsius
Temperature History Size (Index):    478 (191)

Index    Estimated Time   Temperature Celsius
 192    2025-01-05 07:08    30  ***********
 ...    ..(  4 skipped).    ..  ***********
 197    2025-01-05 07:13    30  ***********
 198    2025-01-05 07:14    29  **********
 ...    ..( 20 skipped).    ..  **********
 219    2025-01-05 07:35    29  **********
 220    2025-01-05 07:36     ?  -
 221    2025-01-05 07:37    28  *********
 ...    ..(  3 skipped).    ..  *********
 225    2025-01-05 07:41    28  *********
 226    2025-01-05 07:42    29  **********
 ...    ..(  3 skipped).    ..  **********
 230    2025-01-05 07:46    29  **********
 231    2025-01-05 07:47     ?  -
 232    2025-01-05 07:48    29  **********
 ...    ..(  2 skipped).    ..  **********
 235    2025-01-05 07:51    29  **********
 236    2025-01-05 07:52    30  ***********
 237    2025-01-05 07:53    30  ***********
 238    2025-01-05 07:54    30  ***********
 239    2025-01-05 07:55    31  ************
 240    2025-01-05 07:56    31  ************
 241    2025-01-05 07:57    33  **************
 242    2025-01-05 07:58    29  **********
 ...    ..(276 skipped).    ..  **********
  41    2025-01-05 12:35    29  **********
  42    2025-01-05 12:36    30  ***********
  43    2025-01-05 12:37    29  **********
  44    2025-01-05 12:38    29  **********
  45    2025-01-05 12:39    30  ***********
  46    2025-01-05 12:40    30  ***********
  47    2025-01-05 12:41    30  ***********
  48    2025-01-05 12:42    29  **********
  49    2025-01-05 12:43    30  ***********
  50    2025-01-05 12:44    29  **********
 ...    ..(  7 skipped).    ..  **********
  58    2025-01-05 12:52    29  **********
  59    2025-01-05 12:53    30  ***********
  60    2025-01-05 12:54    29  **********
 ...    ..( 77 skipped).    ..  **********
 138    2025-01-05 14:12    29  **********
 139    2025-01-05 14:13    30  ***********
 ...    ..( 12 skipped).    ..  ***********
 152    2025-01-05 14:26    30  ***********
 153    2025-01-05 14:27     ?  -
 154    2025-01-05 14:28    31  ************
 ...    ..(  8 skipped).    ..  ************
 163    2025-01-05 14:37    31  ************
 164    2025-01-05 14:38    32  *************
 165    2025-01-05 14:39    32  *************
 166    2025-01-05 14:40    31  ************
 ...    ..( 10 skipped).    ..  ************
 177    2025-01-05 14:51    31  ************
 178    2025-01-05 14:52    30  ***********
 ...    ..( 12 skipped).    ..  ***********
 191    2025-01-05 15:05    30  ***********

SCT Error Recovery Control:
           Read:     70 (7.0 seconds)
          Write:     70 (7.0 seconds)

Device Statistics (GP Log 0x04)
Page  Offset Size        Value Flags Description
0x01  =====  =               =  ===  == General Statistics (rev 3) ==
0x01  0x008  4             242  ---  Lifetime Power-On Resets
0x01  0x010  4            1463  ---  Power-on Hours
0x01  0x018  6      6548470499  ---  Logical Sectors Written
0x01  0x020  6        30923692  ---  Number of Write Commands
0x01  0x028  6     43714883111  ---  Logical Sectors Read
0x01  0x030  6       125057595  ---  Number of Read Commands
0x01  0x038  6       971832704  ---  Date and Time TimeStamp
0x02  =====  =               =  ===  == Free-Fall Statistics (rev 1) ==
0x02  0x010  4               0  ---  Overlimit Shock Events
0x03  =====  =               =  ===  == Rotating Media Statistics (rev 1) ==
0x03  0x008  4            1461  ---  Spindle Motor Power-on Hours
0x03  0x010  4             206  ---  Head Flying Hours
0x03  0x018  4             434  ---  Head Load Events
0x03  0x020  4               0  ---  Number of Reallocated Logical Sectors
0x03  0x028  4              96  ---  Read Recovery Attempts
0x03  0x030  4               0  ---  Number of Mechanical Start Failures
0x03  0x038  4               0  ---  Number of Realloc. Candidate Logical Sectors
0x03  0x040  4             229  ---  Number of High Priority Unload Events
0x04  =====  =               =  ===  == General Errors Statistics (rev 1) ==
0x04  0x008  4               8  ---  Number of Reported Uncorrectable Errors
0x04  0x010  4              10  ---  Resets Between Cmd Acceptance and Completion
0x05  =====  =               =  ===  == Temperature Statistics (rev 1) ==
0x05  0x008  1              32  ---  Current Temperature
0x05  0x010  1              31  ---  Average Short Term Temperature
0x05  0x018  1              29  ---  Average Long Term Temperature
0x05  0x020  1              38  ---  Highest Temperature
0x05  0x028  1              24  ---  Lowest Temperature
0x05  0x030  1              33  ---  Highest Average Short Term Temperature
0x05  0x038  1              24  ---  Lowest Average Short Term Temperature
0x05  0x040  1              30  ---  Highest Average Long Term Temperature
0x05  0x048  1              29  ---  Lowest Average Long Term Temperature
0x05  0x050  4               0  ---  Time in Over-Temperature
0x05  0x058  1              65  ---  Specified Maximum Operating Temperature
0x05  0x060  4               0  ---  Time in Under-Temperature
0x05  0x068  1               0  ---  Specified Minimum Operating Temperature
0x06  =====  =               =  ===  == Transport Statistics (rev 1) ==
0x06  0x008  4             460  ---  Number of Hardware Resets
0x06  0x010  4             163  ---  Number of ASR Events
0x06  0x018  4               0  ---  Number of Interface CRC Errors
0xff  =====  =               =  ===  == Vendor Specific Statistics (rev 1) ==
0xff  0x008  7               0  ---  Vendor Specific
0xff  0x010  7               0  ---  Vendor Specific
0xff  0x018  7               0  ---  Vendor Specific
                                |||_ C monitored condition met
                                ||__ D supports DSN
                                |___ N normalized value

Pending Defects log (GP Log 0x0c)
No Defects Logged

SATA Phy Event Counters (GP Log 0x11)
ID      Size     Value  Description
0x0001  2            0  Command failed due to ICRC error
0x0002  2            0  R_ERR response for data FIS
0x0003  2            0  R_ERR response for device-to-host data FIS
0x0004  2            0  R_ERR response for host-to-device data FIS
0x0005  2            0  R_ERR response for non-data FIS
0x0006  2            0  R_ERR response for device-to-host non-data FIS
0x0007  2            0  R_ERR response for host-to-device non-data FIS
0x0008  2            0  Device-to-host non-data FIS retries
0x0009  2            0  Transition from drive PhyRdy to drive PhyNRdy
0x000a  2            1  Device-to-host register FISes sent due to a COMRESET
0x000b  2            0  CRC errors within host-to-device FIS
0x000d  2            0  Non-CRC errors within host-to-device FIS
0x000f  2            0  R_ERR response for host-to-device data FIS, CRC
0x0012  2            0  R_ERR response for host-to-device non-data FIS, CRC
0x8000  4         1134  Vendor specific

