smartctl 7.3 2022-02-28 r5338 [x86_64-linux-6.5.11-7-pve] (local build)
Copyright (C) 2002-22, Bruce Allen, Christian Franke, www.smartmontools.org

=== START OF INFORMATION SECTION ===
Device Model:     512GB SSD
Serial Number:    CM42ABH1800237
LU WWN Device Id: 5 3a5a27 0180e00ed
Firmware Version: SN11986
User Capacity:    512,110,190,592 bytes [512 GB]
Sector Size:      512 bytes logical/physical
Rotation Rate:    Solid State Device
Form Factor:      M.2
TRIM Command:     Available, deterministic, zeroed
Device is:        Not in smartctl database 7.3/5571
ATA Version is:   ACS-4 (minor revision not indicated)
SATA Version is:  SATA 3.2, 6.0 Gb/s (current: 6.0 Gb/s)
Local Time is:    Sun Jan  7 19:37:34 2024 CET
SMART support is: Available - device has SMART capability.
SMART support is: Enabled
AAM feature is:   Unavailable
APM feature is:   Unavailable
Rd look-ahead is: Enabled
Write cache is:   Enabled
DSN feature is:   Unavailable
ATA Security is:  Disabled, frozen [SEC2]
Wt Cache Reorder: Enabled

=== START OF READ SMART DATA SECTION ===
SMART overall-health self-assessment test result: PASSED

General SMART Values:
Offline data collection status:  (0x00)	Offline data collection activity
					was never started.
					Auto Offline Data Collection: Disabled.
Self-test execution status:      (   0)	The previous self-test routine completed
					without error or no self-test has ever 
					been run.
Total time to complete Offline 
data collection: 		(   33) seconds.
Offline data collection
capabilities: 			 (0x7b) SMART execute Offline immediate.
					Auto Offline data collection on/off support.
					Suspend Offline collection upon new
					command.
					Offline surface scan supported.
					Self-test supported.
					Conveyance Self-test supported.
					Selective Self-test supported.
SMART capabilities:            (0x0003)	Saves SMART data before entering
					power-saving mode.
					Supports SMART auto save timer.
Error logging capability:        (0x01)	Error logging supported.
					General Purpose Logging supported.
Short self-test routine 
recommended polling time: 	 (   2) minutes.
Extended self-test routine
recommended polling time: 	 (  85) minutes.
Conveyance self-test routine
recommended polling time: 	 (   2) minutes.
SCT capabilities: 	       (0x0031)	SCT Status supported.
					SCT Feature Control supported.
					SCT Data Table supported.

SMART Attributes Data Structure revision number: 20
Vendor Specific SMART Attributes with Thresholds:
ID# ATTRIBUTE_NAME          FLAGS    VALUE WORST THRESH FAIL RAW_VALUE
  5 Reallocated_Sector_Ct   ------+  100   100   010    -    0
  9 Power_On_Hours          ------+  100   100   000    -    7182
 12 Power_Cycle_Count       ------+  100   100   000    -    173
164 Unknown_Attribute       ------   100   100   000    -    30079778873
165 Unknown_Attribute       ------   100   100   000    -    229
166 Unknown_Attribute       ------   100   100   000    -    7
167 Unknown_Attribute       ------+  100   100   000    -    57
194 Temperature_Celsius     ------+  034   034   000    -    34 (Min/Max 25/39)
199 UDMA_CRC_Error_Count    ------+  100   100   000    -    0
241 Total_LBAs_Written      ------+  100   100   000    -    11958
242 Total_LBAs_Read         ------+  100   100   000    -    5782
                            ||||||_ K auto-keep
                            |||||__ C event count
                            ||||___ R error rate
                            |||____ S speed/performance
                            ||_____ O updated online
                            |______ P prefailure warning

General Purpose Log Directory Version 1
SMART           Log Directory Version 1 [multi-sector log support]
Address    Access  R/W   Size  Description
0x00       GPL,SL  R/O      1  Log Directory
0x01           SL  R/O      1  Summary SMART error log
0x02           SL  R/O     51  Comprehensive SMART error log
0x03       GPL     R/O     64  Ext. Comprehensive SMART error log
0x04       GPL,SL  R/O      8  Device Statistics log
0x06           SL  R/O      1  SMART self-test log
0x07       GPL     R/O      1  Extended self-test log
0x09           SL  R/W      1  Selective self-test log
0x10       GPL     R/O      1  NCQ Command Error log
0x11       GPL     R/O      1  SATA Phy Event Counters log
0x30       GPL,SL  R/O      9  IDENTIFY DEVICE data log
0x80-0x9f  GPL,SL  R/W     16  Host vendor specific log
0xe0       GPL,SL  R/W      1  SCT Command/Status
0xe1       GPL,SL  R/W      1  SCT Data Transfer

SMART Extended Comprehensive Error Log Version: 1 (64 sectors)
No Errors Logged

SMART Extended Self-test Log Version: 1 (1 sectors)
Num  Test_Description    Status                  Remaining  LifeTime(hours)  LBA_of_first_error
# 1  Short offline       Completed without error       00%      7182         -
# 2  Short offline       Completed without error       00%      7175         -
# 3  Short offline       Completed without error       00%      1975         -
# 4  Short offline       Completed without error       00%      1639         -
# 5  Short offline       Completed without error       00%      1638         -

SMART Selective self-test log data structure revision number 1
 SPAN  MIN_LBA  MAX_LBA  CURRENT_TEST_STATUS
    1        0        0  Not_testing
    2        0        0  Not_testing
    3        0        0  Not_testing
    4        0        0  Not_testing
    5        0        0  Not_testing
Selective self-test flags (0x0):
  After scanning selected spans, do NOT read-scan remainder of disk.
If Selective self-test is pending on power-up, resume after 0 minute delay.

SCT Status Version:                  3
SCT Version (vendor specific):       1 (0x0001)
Device State:                        Active (0)
Current Temperature:                    34 Celsius
Power Cycle Min/Max Temperature:      ?/35 Celsius
Lifetime    Min/Max Temperature:      ?/ ? Celsius
Under/Over Temperature Limit Count:   0/0

SCT Temperature History Version:     2
Temperature Sampling Period:         1 minute
Temperature Logging Interval:        1 minute
Min/Max recommended Temperature:     -127/127 Celsius
Min/Max Temperature Limit:           -127/127 Celsius
Temperature History Size (Index):    478 (168)

Index    Estimated Time   Temperature Celsius
 169    2024-01-07 11:40    34  ***************
 170    2024-01-07 11:41    35  ****************
 ...    ..(  2 skipped).    ..  ****************
 173    2024-01-07 11:44    35  ****************
 174    2024-01-07 11:45    34  ***************
 175    2024-01-07 11:46    35  ****************
 176    2024-01-07 11:47    35  ****************
 177    2024-01-07 11:48    35  ****************
 178    2024-01-07 11:49    34  ***************
 179    2024-01-07 11:50    35  ****************
 180    2024-01-07 11:51    35  ****************
 181    2024-01-07 11:52    34  ***************
 182    2024-01-07 11:53    34  ***************
 183    2024-01-07 11:54    35  ****************
 184    2024-01-07 11:55    35  ****************
 185    2024-01-07 11:56    34  ***************
 186    2024-01-07 11:57    35  ****************
 187    2024-01-07 11:58    35  ****************
 188    2024-01-07 11:59    35  ****************
 189    2024-01-07 12:00    34  ***************
 190    2024-01-07 12:01    35  ****************
 191    2024-01-07 12:02    34  ***************
 192    2024-01-07 12:03    35  ****************
 193    2024-01-07 12:04    34  ***************
 194    2024-01-07 12:05    35  ****************
 ...    ..( 14 skipped).    ..  ****************
 209    2024-01-07 12:20    35  ****************
 210    2024-01-07 12:21    34  ***************
 211    2024-01-07 12:22    35  ****************
 ...    ..( 35 skipped).    ..  ****************
 247    2024-01-07 12:58    35  ****************
 248    2024-01-07 12:59    36  *****************
 249    2024-01-07 13:00    37  ******************
 ...    ..(  3 skipped).    ..  ******************
 253    2024-01-07 13:04    37  ******************
 254    2024-01-07 13:05    38  *******************
 ...    ..(  7 skipped).    ..  *******************
 262    2024-01-07 13:13    38  *******************
 263    2024-01-07 13:14    36  *****************
 264    2024-01-07 13:15    35  ****************
 ...    ..(  4 skipped).    ..  ****************
 269    2024-01-07 13:20    35  ****************
 270    2024-01-07 13:21    34  ***************
 271    2024-01-07 13:22    35  ****************
 ...    ..(  8 skipped).    ..  ****************
 280    2024-01-07 13:31    35  ****************
 281    2024-01-07 13:32    36  *****************
 282    2024-01-07 13:33    36  *****************
 283    2024-01-07 13:34    36  *****************
 284    2024-01-07 13:35    34  ***************
 285    2024-01-07 13:36    35  ****************
 ...    ..( 28 skipped).    ..  ****************
 314    2024-01-07 14:05    35  ****************
 315    2024-01-07 14:06    34  ***************
 316    2024-01-07 14:07    35  ****************
 317    2024-01-07 14:08    35  ****************
 318    2024-01-07 14:09    34  ***************
 319    2024-01-07 14:10    35  ****************
 ...    ..(  4 skipped).    ..  ****************
 324    2024-01-07 14:15    35  ****************
 325    2024-01-07 14:16    34  ***************
 326    2024-01-07 14:17    35  ****************
 ...    ..(  2 skipped).    ..  ****************
 329    2024-01-07 14:20    35  ****************
 330    2024-01-07 14:21    34  ***************
 331    2024-01-07 14:22    35  ****************
 ...    ..(  4 skipped).    ..  ****************
 336    2024-01-07 14:27    35  ****************
 337    2024-01-07 14:28    34  ***************
 338    2024-01-07 14:29    35  ****************
 ...    ..(  4 skipped).    ..  ****************
 343    2024-01-07 14:34    35  ****************
 344    2024-01-07 14:35    34  ***************
 345    2024-01-07 14:36    35  ****************
 346    2024-01-07 14:37    35  ****************
 347    2024-01-07 14:38    34  ***************
 348    2024-01-07 14:39    34  ***************
 349    2024-01-07 14:40    35  ****************
 ...    ..(  6 skipped).    ..  ****************
 356    2024-01-07 14:47    35  ****************
 357    2024-01-07 14:48    34  ***************
 358    2024-01-07 14:49    35  ****************
 ...    ..(  2 skipped).    ..  ****************
 361    2024-01-07 14:52    35  ****************
 362    2024-01-07 14:53    34  ***************
 363    2024-01-07 14:54    35  ****************
 364    2024-01-07 14:55    34  ***************
 365    2024-01-07 14:56    35  ****************
 366    2024-01-07 14:57    34  ***************
 367    2024-01-07 14:58    35  ****************
 ...    ..(  3 skipped).    ..  ****************
 371    2024-01-07 15:02    35  ****************
 372    2024-01-07 15:03    34  ***************
 373    2024-01-07 15:04    35  ****************
 ...    ..(  5 skipped).    ..  ****************
 379    2024-01-07 15:10    35  ****************
 380    2024-01-07 15:11    34  ***************
 381    2024-01-07 15:12    35  ****************
 382    2024-01-07 15:13    34  ***************
 383    2024-01-07 15:14    35  ****************
 ...    ..( 19 skipped).    ..  ****************
 403    2024-01-07 15:34    35  ****************
 404    2024-01-07 15:35    34  ***************
 405    2024-01-07 15:36    34  ***************
 406    2024-01-07 15:37    35  ****************
 ...    ..(  2 skipped).    ..  ****************
 409    2024-01-07 15:40    35  ****************
 410    2024-01-07 15:41    34  ***************
 411    2024-01-07 15:42    35  ****************
 ...    ..( 33 skipped).    ..  ****************
 445    2024-01-07 16:16    35  ****************
 446    2024-01-07 16:17    37  ******************
 447    2024-01-07 16:18    36  *****************
 448    2024-01-07 16:19    37  ******************
 ...    ..(  8 skipped).    ..  ******************
 457    2024-01-07 16:28    37  ******************
 458    2024-01-07 16:29    36  *****************
 ...    ..(  5 skipped).    ..  *****************
 464    2024-01-07 16:35    36  *****************
 465    2024-01-07 16:36    37  ******************
 466    2024-01-07 16:37    38  *******************
 ...    ..(  2 skipped).    ..  *******************
 469    2024-01-07 16:40    38  *******************
 470    2024-01-07 16:41    39  ********************
 471    2024-01-07 16:42    38  *******************
 472    2024-01-07 16:43    39  ********************
 ...    ..(  4 skipped).    ..  ********************
 477    2024-01-07 16:48    39  ********************
   0    2024-01-07 16:49    38  *******************
   1    2024-01-07 16:50    39  ********************
 ...    ..(  3 skipped).    ..  ********************
   5    2024-01-07 16:54    39  ********************
   6    2024-01-07 16:55    38  *******************
   7    2024-01-07 16:56    39  ********************
   8    2024-01-07 16:57    36  *****************
   9    2024-01-07 16:58    36  *****************
  10    2024-01-07 16:59    35  ****************
 ...    ..( 23 skipped).    ..  ****************
  34    2024-01-07 17:23    35  ****************
  35    2024-01-07 17:24    37  ******************
  36    2024-01-07 17:25    35  ****************
 ...    ..(  8 skipped).    ..  ****************
  45    2024-01-07 17:34    35  ****************
  46    2024-01-07 17:35    34  ***************
  47    2024-01-07 17:36    35  ****************
 ...    ..( 15 skipped).    ..  ****************
  63    2024-01-07 17:52    35  ****************
  64    2024-01-07 17:53    34  ***************
  65    2024-01-07 17:54    35  ****************
  66    2024-01-07 17:55    35  ****************
  67    2024-01-07 17:56    36  *****************
 ...    ..( 11 skipped).    ..  *****************
  79    2024-01-07 18:08    36  *****************
  80    2024-01-07 18:09     ?  -
  81    2024-01-07 18:10    34  ***************
  82    2024-01-07 18:11     ?  -
  83    2024-01-07 18:12    31  ************
  84    2024-01-07 18:13    34  ***************
 ...    ..(  5 skipped).    ..  ***************
  90    2024-01-07 18:19    34  ***************
  91    2024-01-07 18:20    35  ****************
 ...    ..(  4 skipped).    ..  ****************
  96    2024-01-07 18:25    35  ****************
  97    2024-01-07 18:26    34  ***************
 ...    ..( 39 skipped).    ..  ***************
 137    2024-01-07 19:06    34  ***************
 138    2024-01-07 19:07    35  ****************
 139    2024-01-07 19:08    34  ***************
 ...    ..( 11 skipped).    ..  ***************
 151    2024-01-07 19:20    34  ***************
 152    2024-01-07 19:21    35  ****************
 ...    ..(  2 skipped).    ..  ****************
 155    2024-01-07 19:24    35  ****************
 156    2024-01-07 19:25    34  ***************
 ...    ..(  8 skipped).    ..  ***************
 165    2024-01-07 19:34    34  ***************
 166    2024-01-07 19:35    35  ****************
 167    2024-01-07 19:36    35  ****************
 168    2024-01-07 19:37    34  ***************

SCT Error Recovery Control command not supported

Device Statistics (GP Log 0x04)
Page  Offset Size        Value Flags Description
0x01  =====  =               =  ===  == General Statistics (rev 1) ==
0x01  0x008  4             173  ---  Lifetime Power-On Resets
0x01  0x010  4            7182  ---  Power-on Hours
0x01  0x018  6     25078020040  ---  Logical Sectors Written
0x01  0x020  6       768598052  ---  Number of Write Commands
0x01  0x028  6     12126577468  ---  Logical Sectors Read
0x01  0x030  6       191323776  ---  Number of Read Commands
0x01  0x038  6   6614320471864  ---  Date and Time TimeStamp
0x07  =====  =               =  ===  == Solid State Device Statistics (rev 1) ==
0x07  0x008  1              15  N--  Percentage Used Endurance Indicator
                                |||_ C monitored condition met
                                ||__ D supports DSN
                                |___ N normalized value

Pending Defects log (GP Log 0x0c) not supported

SATA Phy Event Counters (GP Log 0x11)
ID      Size     Value  Description
0x0001  2            0  Command failed due to ICRC error
0x0003  2            0  R_ERR response for device-to-host data FIS
0x0004  2            0  R_ERR response for host-to-device data FIS
0x0006  2            0  R_ERR response for device-to-host non-data FIS
0x0007  2            0  R_ERR response for host-to-device non-data FIS
0x0008  2            0  Device-to-host non-data FIS retries
0x0009  4            0  Transition from drive PhyRdy to drive PhyNRdy
0x000a  4            3  Device-to-host register FISes sent due to a COMRESET
0x000f  2            0  R_ERR response for host-to-device data FIS, CRC
0x0010  2            0  R_ERR response for host-to-device data FIS, non-CRC
0x0012  2            0  R_ERR response for host-to-device non-data FIS, CRC
0x0013  2            0  R_ERR response for host-to-device non-data FIS, non-CRC

