smartctl 6.6 2016-05-31 r4324 [x86_64-linux-4.15.0-112-generic] (local build)
Copyright (C) 2002-16, Bruce Allen, Christian Franke, www.smartmontools.org

=== START OF INFORMATION SECTION ===
Device Model:     KINGSTON SA400S37480G
Serial Number:    50026B7782F85D22
LU WWN Device Id: 5 0026b7 782f85d22
Firmware Version: SBFKK1B3
User Capacity:    480,103,981,056 bytes [480 GB]
Sector Size:      512 bytes logical/physical
Rotation Rate:    Solid State Device
Device is:        Not in smartctl database [for details use: -P showall]
ATA Version is:   ACS-3 T13/2161-D revision 4
SATA Version is:  SATA 3.2, 6.0 Gb/s (current: 6.0 Gb/s)
Local Time is:    Fri Aug 14 12:12:39 2020 PDT
SMART support is: Available - device has SMART capability.
SMART support is: Enabled
AAM feature is:   Unavailable
APM level is:     254 (maximum performance)
Rd look-ahead is: Enabled
Write cache is:   Enabled
ATA Security is:  Disabled, frozen [SEC2]
Wt Cache Reorder: Unavailable

=== START OF READ SMART DATA SECTION ===
SMART overall-health self-assessment test result: PASSED

General SMART Values:
Offline data collection status:  (0x00)	Offline data collection activity
					was never started.
					Auto Offline Data Collection: Disabled.
Total time to complete Offline 
data collection: 		(65535) seconds.
Offline data collection
capabilities: 			 (0x00) 	Offline data collection not supported.
SMART capabilities:            (0x0003)	Saves SMART data before entering
					power-saving mode.
					Supports SMART auto save timer.
Error logging capability:        (0x01)	Error logging supported.
					General Purpose Logging supported.

SMART Attributes Data Structure revision number: 16
Vendor Specific SMART Attributes with Thresholds:
ID# ATTRIBUTE_NAME          FLAGS    VALUE WORST THRESH FAIL RAW_VALUE
  1 Raw_Read_Error_Rate     -O--CK   100   100   000    -    0
  9 Power_On_Hours          -O--CK   100   100   000    -    4794
 12 Power_Cycle_Count       -O--CK   100   100   000    -    86
148 Unknown_Attribute       ------   100   100   000    -    0
149 Unknown_Attribute       ------   100   100   000    -    0
167 Unknown_Attribute       ------   100   100   000    -    0
168 Unknown_Attribute       -O--C-   100   100   000    -    0
169 Unknown_Attribute       ------   100   100   000    -    8
170 Unknown_Attribute       ------   100   100   010    -    8
172 Unknown_Attribute       -O--CK   100   100   000    -    0
173 Unknown_Attribute       ------   100   100   000    -    1310749
181 Program_Fail_Cnt_Total  -O--CK   100   100   000    -    0
182 Erase_Fail_Count_Total  ------   100   100   000    -    0
187 Reported_Uncorrect      -O--CK   100   100   000    -    0
192 Power-Off_Retract_Count -O--C-   100   100   000    -    62
194 Temperature_Celsius     -O---K   031   039   000    -    31 (Min/Max 19/39)
196 Reallocated_Event_Count -O--CK   100   100   000    -    0
199 UDMA_CRC_Error_Count    -O--CK   100   100   000    -    0
218 Unknown_Attribute       -O--CK   100   100   000    -    0
231 Temperature_Celsius     ------   098   098   000    -    98
233 Media_Wearout_Indicator -O--CK   100   100   000    -    2834
241 Total_LBAs_Written      -O--CK   100   100   000    -    2481
242 Total_LBAs_Read         -O--CK   100   100   000    -    417
244 Unknown_Attribute       ------   100   100   000    -    20
245 Unknown_Attribute       ------   100   100   000    -    29
246 Unknown_Attribute       ------   100   100   000    -    227392
                            ||||||_ K auto-keep
                            |||||__ C event count
                            ||||___ R error rate
                            |||____ S speed/performance
                            ||_____ O updated online
                            |______ P prefailure warning

General Purpose Log Directory Version 1
SMART           Log Directory Version 1 [multi-sector log support]
Address    Access  R/W   Size  Description
0x00       GPL,SL  R/O      1  Log Directory
0x03       GPL     R/O     64  Ext. Comprehensive SMART error log
0x04       GPL,SL  R/O      8  Device Statistics log
0x06           SL  R/O      1  SMART self-test log
0x07       GPL     R/O      1  Extended self-test log
0x09           SL  R/W      1  Selective self-test log
0x10       GPL     R/O      1  SATA NCQ Queued Error log
0x11       GPL     R/O      1  SATA Phy Event Counters log
0x30       GPL,SL  R/O      9  IDENTIFY DEVICE data log
0x80-0x9f  GPL,SL  R/W     16  Host vendor specific log

SMART Extended Comprehensive Error Log Version: 1 (64 sectors)
No Errors Logged

SMART Extended Self-test Log Version: 1 (1 sectors)
No self-tests have been logged.  [To run self-tests, use: smartctl -t]

Selective Self-tests/Logging not supported

SCT Commands not supported

Device Statistics (GP Log 0x04)
Page  Offset Size        Value Flags Description
0x01  =====  =               =  ===  == General Statistics (rev 1) ==
0x01  0x008  4              86  ---  Lifetime Power-On Resets
0x01  0x010  4            4794  ---  Power-on Hours
0x01  0x018  6      5203218730  ---  Logical Sectors Written
0x01  0x028  6       876078526  ---  Logical Sectors Read
0x04  =====  =               =  ===  == General Errors Statistics (rev 1) ==
0x04  0x008  4               0  ---  Number of Reported Uncorrectable Errors
0x05  =====  =               =  ===  == Temperature Statistics (rev 1) ==
0x05  0x008  1              31  ---  Current Temperature
0x05  0x020  1              39  ---  Highest Temperature
0x05  0x028  1              19  ---  Lowest Temperature
0x06  =====  =               =  ===  == Transport Statistics (rev 1) ==
0x06  0x018  4               0  ---  Number of Interface CRC Errors
0x07  =====  =               =  ===  == Solid State Device Statistics (rev 1) ==
0x07  0x008  1               2  ---  Percentage Used Endurance Indicator
                                |||_ C monitored condition met
                                ||__ D supports DSN
                                |___ N normalized value

SATA Phy Event Counters (GP Log 0x11)
ID      Size     Value  Description
0x0001  2            0  Command failed due to ICRC error
0x0003  2            0  R_ERR response for device-to-host data FIS
0x0004  2            0  R_ERR response for host-to-device data FIS
0x0006  2            0  R_ERR response for device-to-host non-data FIS
0x0007  2            0  R_ERR response for host-to-device non-data FIS
0x0008  2            0  Device-to-host non-data FIS retries
0x0009  4            3  Transition from drive PhyRdy to drive PhyNRdy
0x000a  4            4  Device-to-host register FISes sent due to a COMRESET
0x000f  2            0  R_ERR response for host-to-device data FIS, CRC
0x0010  2            0  R_ERR response for host-to-device data FIS, non-CRC
0x0012  2            0  R_ERR response for host-to-device non-data FIS, CRC
0x0013  2            0  R_ERR response for host-to-device non-data FIS, non-CRC

