smartctl 6.6 2017-11-05 r4594 [x86_64-linux-4.14.52-gentoo-apu2v2] (local build)
Copyright (C) 2002-17, Bruce Allen, Christian Franke, www.smartmontools.org

=== START OF INFORMATION SECTION ===
Device Model:     Samsung SSD 860 EVO mSATA 250GB
Serial Number:    
LU WWN Device Id: 
Firmware Version: RVT41B6Q
User Capacity:    250,059,350,016 bytes [250 GB]
Sector Size:      512 bytes logical/physical
Rotation Rate:    Solid State Device
Form Factor:      mSATA
Device is:        Not in smartctl database [for details use: -P showall]
ATA Version is:   ACS-4 T13/BSR INCITS 529 revision 5
SATA Version is:  SATA 3.1, 6.0 Gb/s (current: 6.0 Gb/s)
Local Time is:    Sat Jul 28 11:12:03 2018 CEST
SMART support is: Available - device has SMART capability.
SMART support is: Enabled
AAM feature is:   Unavailable
APM feature is:   Unavailable
Rd look-ahead is: Enabled
Write cache is:   Enabled
DSN feature is:   Unavailable
ATA Security is:  Disabled, NOT FROZEN [SEC1]
Wt Cache Reorder: Enabled

=== START OF READ SMART DATA SECTION ===
SMART overall-health self-assessment test result: PASSED

General SMART Values:
Offline data collection status:  (0x80)	Offline data collection activity
					was never started.
					Auto Offline Data Collection: Enabled.
Self-test execution status:      (   0)	The previous self-test routine completed
					without error or no self-test has ever 
					been run.
Total time to complete Offline 
data collection: 		(    0) seconds.
Offline data collection
capabilities: 			 (0x53) SMART execute Offline immediate.
					Auto Offline data collection on/off support.
					Suspend Offline collection upon new
					command.
					No Offline surface scan supported.
					Self-test supported.
					No Conveyance Self-test supported.
					Selective Self-test supported.
SMART capabilities:            (0x0003)	Saves SMART data before entering
					power-saving mode.
					Supports SMART auto save timer.
Error logging capability:        (0x01)	Error logging supported.
					General Purpose Logging supported.
Short self-test routine 
recommended polling time: 	 (   2) minutes.
Extended self-test routine
recommended polling time: 	 (  85) minutes.
SCT capabilities: 	       (0x003d)	SCT Status supported.
					SCT Error Recovery Control supported.
					SCT Feature Control supported.
					SCT Data Table supported.

SMART Attributes Data Structure revision number: 1
Vendor Specific SMART Attributes with Thresholds:
ID# ATTRIBUTE_NAME          FLAGS    VALUE WORST THRESH FAIL RAW_VALUE
  5 Reallocated_Sector_Ct   PO--CK   100   100   010    -    0
  9 Power_On_Hours          -O--CK   099   099   000    -    3641
 12 Power_Cycle_Count       -O--CK   099   099   000    -    62
177 Wear_Leveling_Count     PO--C-   099   099   000    -    1
179 Used_Rsvd_Blk_Cnt_Tot   PO--C-   100   100   010    -    0
181 Program_Fail_Cnt_Total  -O--CK   100   100   010    -    0
182 Erase_Fail_Count_Total  -O--CK   100   100   010    -    0
183 Runtime_Bad_Block       PO--C-   100   100   010    -    0
187 Reported_Uncorrect      -O--CK   100   100   000    -    0
190 Airflow_Temperature_Cel -O--CK   063   042   000    -    37
195 Hardware_ECC_Recovered  -O-RC-   200   200   000    -    0
199 UDMA_CRC_Error_Count    -OSRCK   100   100   000    -    0
235 Unknown_Attribute       -O--C-   099   099   000    -    44
241 Total_LBAs_Written      -O--CK   099   099   000    -    1555689982
                            ||||||_ K auto-keep
                            |||||__ C event count
                            ||||___ R error rate
                            |||____ S speed/performance
                            ||_____ O updated online
                            |______ P prefailure warning

General Purpose Log Directory Version 1
SMART           Log Directory Version 1 [multi-sector log support]
Address    Access  R/W   Size  Description
0x00       GPL,SL  R/O      1  Log Directory
0x01           SL  R/O      1  Summary SMART error log
0x02           SL  R/O      1  Comprehensive SMART error log
0x03       GPL     R/O      1  Ext. Comprehensive SMART error log
0x04       GPL,SL  R/O      8  Device Statistics log
0x06           SL  R/O      1  SMART self-test log
0x07       GPL     R/O      1  Extended self-test log
0x09           SL  R/W      1  Selective self-test log
0x10       GPL     R/O      1  NCQ Command Error log
0x11       GPL     R/O      1  SATA Phy Event Counters log
0x13       GPL     R/O      1  SATA NCQ Send and Receive log
0x30       GPL,SL  R/O      9  IDENTIFY DEVICE data log
0x80-0x9f  GPL,SL  R/W     16  Host vendor specific log
0xa1           SL  VS      16  Device vendor specific log
0xa5           SL  VS      16  Device vendor specific log
0xce-0xcf      SL  VS      16  Device vendor specific log
0xe0       GPL,SL  R/W      1  SCT Command/Status
0xe1       GPL,SL  R/W      1  SCT Data Transfer

SMART Extended Comprehensive Error Log Version: 1 (1 sectors)
No Errors Logged

SMART Extended Self-test Log Version: 1 (1 sectors)
Num  Test_Description    Status                  Remaining  LifeTime(hours)  LBA_of_first_error
# 1  Short offline       Completed without error       00%      3641         -
# 2  Extended offline    Completed without error       00%      3635         -
# 3  Short offline       Completed without error       00%      3632         -
# 4  Short offline       Completed without error       00%      3608         -
# 5  Short offline       Completed without error       00%      3584         -
# 6  Short offline       Completed without error       00%      3560         -
# 7  Short offline       Completed without error       00%      3536         -
# 8  Short offline       Completed without error       00%      3512         -
# 9  Short offline       Completed without error       00%      3488         -
#10  Extended offline    Completed without error       00%      3467         -
#11  Short offline       Completed without error       00%      3464         -
#12  Short offline       Completed without error       00%      3440         -
#13  Short offline       Completed without error       00%      3416         -
#14  Short offline       Completed without error       00%      3392         -
#15  Short offline       Completed without error       00%      3368         -
#16  Short offline       Completed without error       00%      3344         -
#17  Short offline       Completed without error       00%      3320         -
#18  Extended offline    Completed without error       00%      3299         -
#19  Short offline       Completed without error       00%      3296         -

SMART Selective self-test log data structure revision number 1
 SPAN  MIN_LBA  MAX_LBA  CURRENT_TEST_STATUS
    1        0        0  Not_testing
    2        0        0  Not_testing
    3        0        0  Not_testing
    4        0        0  Not_testing
    5        0        0  Not_testing
Selective self-test flags (0x0):
  After scanning selected spans, do NOT read-scan remainder of disk.
If Selective self-test is pending on power-up, resume after 0 minute delay.

SCT Status Version:                  3
SCT Version (vendor specific):       256 (0x0100)
SCT Support Level:                   1
Device State:                        Active (0)
Current Temperature:                    37 Celsius
Power Cycle Min/Max Temperature:     34/58 Celsius
Lifetime    Min/Max Temperature:     27/58 Celsius
Under/Over Temperature Limit Count:   0/0

SCT Temperature History Version:     2
Temperature Sampling Period:         1 minute
Temperature Logging Interval:        10 minutes
Min/Max recommended Temperature:      0/70 Celsius
Min/Max Temperature Limit:            0/70 Celsius
Temperature History Size (Index):    128 (101)

Index    Estimated Time   Temperature Celsius
 102    2018-07-27 14:00    41  **********************
 ...    ..( 26 skipped).    ..  **********************
   1    2018-07-27 18:30    41  **********************
   2    2018-07-27 18:40    40  *********************
   3    2018-07-27 18:50    41  **********************
   4    2018-07-27 19:00    41  **********************
   5    2018-07-27 19:10    40  *********************
 ...    ..(  3 skipped).    ..  *********************
   9    2018-07-27 19:50    40  *********************
  10    2018-07-27 20:00    41  **********************
  11    2018-07-27 20:10    40  *********************
 ...    ..(  6 skipped).    ..  *********************
  18    2018-07-27 21:20    40  *********************
  19    2018-07-27 21:30    41  **********************
  20    2018-07-27 21:40    40  *********************
 ...    ..( 26 skipped).    ..  *********************
  47    2018-07-28 02:10    40  *********************
  48    2018-07-28 02:20    42  ***********************
  49    2018-07-28 02:30    40  *********************
 ...    ..(  3 skipped).    ..  *********************
  53    2018-07-28 03:10    40  *********************
  54    2018-07-28 03:20    58  ***************************************
  55    2018-07-28 03:30    57  **************************************
  56    2018-07-28 03:40    58  ***************************************
 ...    ..(  4 skipped).    ..  ***************************************
  61    2018-07-28 04:30    58  ***************************************
  62    2018-07-28 04:40    48  *****************************
  63    2018-07-28 04:50    41  **********************
 ...    ..(  2 skipped).    ..  **********************
  66    2018-07-28 05:20    41  **********************
  67    2018-07-28 05:30    40  *********************
 ...    ..( 22 skipped).    ..  *********************
  90    2018-07-28 09:20    40  *********************
  91    2018-07-28 09:30    41  **********************
 ...    ..(  3 skipped).    ..  **********************
  95    2018-07-28 10:10    41  **********************
  96    2018-07-28 10:20    38  *******************
  97    2018-07-28 10:30    38  *******************
  98    2018-07-28 10:40    37  ******************
  99    2018-07-28 10:50    38  *******************
 100    2018-07-28 11:00    38  *******************
 101    2018-07-28 11:10    37  ******************

SCT Error Recovery Control:
           Read: Disabled
          Write: Disabled

Device Statistics (GP Log 0x04)
Page  Offset Size        Value Flags Description
0x01  =====  =               =  ===  == General Statistics (rev 1) ==
0x01  0x008  4              62  ---  Lifetime Power-On Resets
0x01  0x010  4            3641  ---  Power-on Hours
0x01  0x018  6      1555689982  ---  Logical Sectors Written
0x01  0x020  6        44976513  ---  Number of Write Commands
0x01  0x028  6       344183088  ---  Logical Sectors Read
0x01  0x030  6        12658102  ---  Number of Read Commands
0x01  0x038  6         2897000  ---  Date and Time TimeStamp
0x04  =====  =               =  ===  == General Errors Statistics (rev 1) ==
0x04  0x008  4               0  ---  Number of Reported Uncorrectable Errors
0x04  0x010  4              30  ---  Resets Between Cmd Acceptance and Completion
0x05  =====  =               =  ===  == Temperature Statistics (rev 1) ==
0x05  0x008  1              37  ---  Current Temperature
0x05  0x020  1              58  ---  Highest Temperature
0x05  0x028  1              27  ---  Lowest Temperature
0x05  0x058  1              55  ---  Specified Maximum Operating Temperature
0x06  =====  =               =  ===  == Transport Statistics (rev 1) ==
0x06  0x008  4            4753  ---  Number of Hardware Resets
0x06  0x010  4               0  ---  Number of ASR Events
0x06  0x018  4               0  ---  Number of Interface CRC Errors
0x07  =====  =               =  ===  == Solid State Device Statistics (rev 1) ==
0x07  0x008  1               0  N--  Percentage Used Endurance Indicator
                                |||_ C monitored condition met
                                ||__ D supports DSN
                                |___ N normalized value

Pending Defects log (GP Log 0x0c) not supported

SATA Phy Event Counters (GP Log 0x11)
ID      Size     Value  Description
0x0001  2            0  Command failed due to ICRC error
0x0002  2            0  R_ERR response for data FIS
0x0003  2            0  R_ERR response for device-to-host data FIS
0x0004  2            0  R_ERR response for host-to-device data FIS
0x0005  2            0  R_ERR response for non-data FIS
0x0006  2            0  R_ERR response for device-to-host non-data FIS
0x0007  2            0  R_ERR response for host-to-device non-data FIS
0x0008  2            0  Device-to-host non-data FIS retries
0x0009  2         3735  Transition from drive PhyRdy to drive PhyNRdy
0x000a  2           18  Device-to-host register FISes sent due to a COMRESET
0x000b  2            0  CRC errors within host-to-device FIS
0x000d  2            0  Non-CRC errors within host-to-device FIS
0x000f  2            0  R_ERR response for host-to-device data FIS, CRC
0x0010  2            0  R_ERR response for host-to-device data FIS, non-CRC
0x0012  2            0  R_ERR response for host-to-device non-data FIS, CRC
0x0013  2            0  R_ERR response for host-to-device non-data FIS, non-CRC

