smartctl 7.1 2019-12-30 r5022 [x86_64-linux-5.4.0-26-generic] (local build)
Copyright (C) 2002-19, Bruce Allen, Christian Franke, www.smartmontools.org

=== START OF INFORMATION SECTION ===
Device Model:     Corsair Neutron GTX SSD
Firmware Version: M311
User Capacity:    120 034 123 776 bytes [120 GB]
Sector Size:      512 bytes logical/physical
Rotation Rate:    Solid State Device
Device is:        Not in smartctl database [for details use: -P showall]
ATA Version is:   ATA8-ACS (minor revision not indicated)
SATA Version is:  SATA 2.5, 6.0 Gb/s
Local Time is:    Mon Apr 27 12:37:39 2020 EEST
SMART support is: Available - device has SMART capability.
SMART support is: Enabled
AAM feature is:   Unavailable
APM feature is:   Unavailable
Rd look-ahead is: Enabled
Write cache is:   Enabled
DSN feature is:   Unavailable
ATA Security is:  Disabled, frozen [SEC2]
Wt Cache Reorder: Unavailable

=== START OF READ SMART DATA SECTION ===
SMART overall-health self-assessment test result: PASSED

General SMART Values:
Offline data collection status:  (0x02)	Offline data collection activity
					was completed without error.
					Auto Offline Data Collection: Disabled.
Self-test execution status:      (   0)	The previous self-test routine completed
					without error or no self-test has ever 
					been run.
Total time to complete Offline 
data collection: 		(    5) seconds.
Offline data collection
capabilities: 			 (0x19) SMART execute Offline immediate.
					No Auto Offline data collection support.
					Suspend Offline collection upon new
					command.
					Offline surface scan supported.
					Self-test supported.
					No Conveyance Self-test supported.
					No Selective Self-test supported.
SMART capabilities:            (0x0002)	Does not save SMART data before
					entering power-saving mode.
					Supports SMART auto save timer.
Error logging capability:        (0x01)	Error logging supported.
					No General Purpose Logging support.
Short self-test routine 
recommended polling time: 	 (   1) minutes.
Extended self-test routine
recommended polling time: 	 (   5) minutes.

SMART Attributes Data Structure revision number: 0
Vendor Specific SMART Attributes with Thresholds:
ID# ATTRIBUTE_NAME          FLAGS    VALUE WORST THRESH FAIL RAW_VALUE
  1 Raw_Read_Error_Rate     -OSR--   166   165   006    -    4
  5 Reallocated_Sector_Ct   -O--CK   253   253   036    -    0
  9 Power_On_Hours          -O--CK   071   071   000    -    26525
 12 Power_Cycle_Count       -O--CK   100   100   000    -    3488
171 Unknown_Attribute       -O--CK   253   253   000    -    0
172 Unknown_Attribute       -O--CK   253   253   000    -    0
181 Program_Fail_Cnt_Total  -O--CK   253   253   000    -    0
182 Erase_Fail_Count_Total  -O--CK   253   253   000    -    0
194 Temperature_Celsius     -O----   031   000   000    -    31 (Min/Max 13/60)
201 Unknown_SSD_Attribute   -OSR--   100   100   000    -    0
204 Soft_ECC_Correction     -OSR--   100   100   000    -    4
231 Temperature_Celsius     PO--CK   024   024   010    -    77
234 Unknown_Attribute       -O--CK   100   100   000    -    492868
241 Total_LBAs_Written      -O--CK   100   100   000    -    28295
242 Total_LBAs_Read         -O--CK   100   100   000    -    24663
250 Read_Error_Retry_Rate   -O--CK   100   100   000    -    220821
                            ||||||_ K auto-keep
                            |||||__ C event count
                            ||||___ R error rate
                            |||____ S speed/performance
                            ||_____ O updated online
                            |______ P prefailure warning

General Purpose Log Directory not supported

SMART Log Directory Version 1 [multi-sector log support]
Address    Access  R/W   Size  Description
0x00           SL  R/O      1  Log Directory
0x01           SL  R/O      1  Summary SMART error log
0x02           SL  R/O      4  Comprehensive SMART error log
0x03           SL  R/O      5  Ext. Comprehensive SMART error log
0x04           SL  R/O      8  Device Statistics log
0x06           SL  R/O      1  SMART self-test log

SMART Extended Comprehensive Error Log (GP Log 0x03) not supported

SMART Error Log Version: 1
Warning: ATA error count 65535 inconsistent with error log pointer 3

ATA Error Count: 65535 (device log contains only the most recent five errors)
	CR = Command Register [HEX]
	FR = Features Register [HEX]
	SC = Sector Count Register [HEX]
	SN = Sector Number Register [HEX]
	CL = Cylinder Low Register [HEX]
	CH = Cylinder High Register [HEX]
	DH = Device/Head Register [HEX]
	DC = Device Command Register [HEX]
	ER = Error register [HEX]
	ST = Status register [HEX]
Powered_Up_Time is measured from power on, and printed as
DDd+hh:mm:SS.sss where DD=days, hh=hours, mm=minutes,
SS=sec, and sss=millisec. It "wraps" after 49.710 days.

Error 65535 occurred at disk power-on lifetime: 26522 hours (1105 days + 2 hours)
  When the command that caused the error occurred, the device was in an unknown state.

  After command completion occurred, registers were:
  ER ST SC SN CL CH DH
  -- -- -- -- -- -- --
  04 51 fe 00 00 00 40  Error: ABRT

  Commands leading to the command that caused the error were:
  CR FR SC SN CL CH DH DC   Powered_Up_Time  Command/Feature_Name
  -- -- -- -- -- -- -- --  ----------------  --------------------
  ef 05 fe 00 00 00 40 40      00:00:30.950  SET FEATURES [Enable APM]
  60 68 40 88 37 11 40 40      00:00:30.950  READ FPDMA QUEUED
  60 80 08 00 37 11 40 40      00:00:30.950  READ FPDMA QUEUED
  60 f8 38 00 36 11 40 40      00:00:30.950  READ FPDMA QUEUED
  60 88 00 40 8e e6 40 40      00:00:30.950  READ FPDMA QUEUED

Error 65534 occurred at disk power-on lifetime: 26522 hours (1105 days + 2 hours)
  When the command that caused the error occurred, the device was in an unknown state.

  After command completion occurred, registers were:
  ER ST SC SN CL CH DH
  -- -- -- -- -- -- --
  04 51 fe 00 00 00 40  Error: ABRT

  Commands leading to the command that caused the error were:
  CR FR SC SN CL CH DH DC   Powered_Up_Time  Command/Feature_Name
  -- -- -- -- -- -- -- --  ----------------  --------------------
  ef 05 fe 00 00 00 40 40      00:00:30.910  SET FEATURES [Enable APM]
  60 e0 00 20 7c 80 40 40      00:00:30.910  READ FPDMA QUEUED
  60 f8 c0 08 1a 0e 40 40      00:00:30.910  READ FPDMA QUEUED
  60 88 f8 18 7e 80 40 40      00:00:30.910  READ FPDMA QUEUED
  60 f8 b8 08 19 0e 40 40      00:00:30.910  READ FPDMA QUEUED

Error 65533 occurred at disk power-on lifetime: 26522 hours (1105 days + 2 hours)
  When the command that caused the error occurred, the device was in an unknown state.

  After command completion occurred, registers were:
  ER ST SC SN CL CH DH
  -- -- -- -- -- -- --
  01 50 01 01 00 00 00

  Commands leading to the command that caused the error were:
  CR FR SC SN CL CH DH DC   Powered_Up_Time  Command/Feature_Name
  -- -- -- -- -- -- -- --  ----------------  --------------------
  00 00 00 00 00 00 a0 a0      00:00:28.290  NOP [Abort queued commands]
  00 00 00 00 00 00 a0 a0      00:00:28.300  NOP [Abort queued commands]
  25 00 40 40 13 60 40 40      00:00:25.380  READ DMA EXT
  25 00 40 00 13 60 40 40      00:00:25.380  READ DMA EXT
  25 00 40 c0 12 60 40 40      00:00:25.380  READ DMA EXT

Error 65532 occurred at disk power-on lifetime: 26522 hours (1105 days + 2 hours)
  When the command that caused the error occurred, the device was in an unknown state.

  After command completion occurred, registers were:
  ER ST SC SN CL CH DH
  -- -- -- -- -- -- --
  00 00 00 00 00 00 00   at LBA = 0x00000000 = 0

  Commands leading to the command that caused the error were:
  CR FR SC SN CL CH DH DC   Powered_Up_Time  Command/Feature_Name
  -- -- -- -- -- -- -- --  ----------------  --------------------
  25 00 40 40 13 60 40 40      00:00:25.380  READ DMA EXT
  25 00 40 00 13 60 40 40      00:00:25.380  READ DMA EXT
  25 00 40 c0 12 60 40 40      00:00:25.380  READ DMA EXT
  25 00 40 80 12 60 40 40      00:00:25.380  READ DMA EXT
  25 00 40 40 12 60 40 40      00:00:25.370  READ DMA EXT

Error 65531 occurred at disk power-on lifetime: 26522 hours (1105 days + 2 hours)
  When the command that caused the error occurred, the device was in an unknown state.

  After command completion occurred, registers were:
  ER ST SC SN CL CH DH
  -- -- -- -- -- -- --
  00 00 00 00 00 00 00   at LBA = 0x00000000 = 0

  Commands leading to the command that caused the error were:
  CR FR SC SN CL CH DH DC   Powered_Up_Time  Command/Feature_Name
  -- -- -- -- -- -- -- --  ----------------  --------------------
  25 00 40 40 13 60 40 40      00:00:25.380  READ DMA EXT
  25 00 40 00 13 60 40 40      00:00:25.380  READ DMA EXT
  25 00 40 c0 12 60 40 40      00:00:25.380  READ DMA EXT
  25 00 40 80 12 60 40 40      00:00:25.380  READ DMA EXT
  25 00 40 40 12 60 40 40      00:00:25.370  READ DMA EXT

SMART Extended Self-test Log (GP Log 0x07) not supported

SMART Self-test log structure revision number 1
Num  Test_Description    Status                  Remaining  LifeTime(hours)  LBA_of_first_error
# 1  Short offline       Completed without error       00%     26438         -
# 2  Extended offline    Completed without error       00%     24217         -
# 3  Short offline       Completed without error       00%     24217         -
# 4  Short offline       Completed without error       00%     16024         -
# 5  Short offline       Completed without error       00%     15589         -
# 6  Short offline       Completed without error       00%     15358         -
# 7  Short offline       Completed without error       00%     14604         -
# 8  Short offline       Completed without error       00%     13630         -
# 9  Short offline       Completed without error       00%     12972         -
#10  Short offline       Completed without error       00%     11765         -
#11  Short offline       Completed without error       00%     11194         -
#12  Short offline       Completed without error       00%     10978         -
#13  Short offline       Completed without error       00%     10635         -
#14  Short offline       Completed without error       00%     10239         -
#15  Short offline       Completed without error       00%      9097         -
#16  Short offline       Completed without error       00%      8780         -
#17  Short offline       Completed without error       00%      4032         -
#18  Short offline       Completed without error       00%      2077         -

Selective Self-tests/Logging not supported

SCT Commands not supported

Device Statistics (SMART Log 0x04)
Page  Offset Size        Value Flags Description
ATA_SMART_READ_LOG failed: scsi error badly formed scsi parameters
Read Device Statistics pages 0x00-0x80 failed

Pending Defects log (GP Log 0x0c) not supported

SATA Phy Event Counters (GP Log 0x11)
ID      Size     Value  Description
0x0001  2            0  Command failed due to ICRC error
0x0002  2            0  R_ERR response for data FIS
0x0003  2            0  R_ERR response for device-to-host data FIS
0x0004  2            0  R_ERR response for host-to-device data FIS
0x0005  2            0  R_ERR response for non-data FIS
0x0006  2            0  R_ERR response for device-to-host non-data FIS
0x0007  2            0  R_ERR response for host-to-device non-data FIS
0x0008  2            0  Device-to-host non-data FIS retries
0x0009  2            0  Transition from drive PhyRdy to drive PhyNRdy
0x000a  2            4  Device-to-host register FISes sent due to a COMRESET
0x000b  2            0  CRC errors within host-to-device FIS
0x000d  2            0  Non-CRC errors within host-to-device FIS
0x000f  2            0  R_ERR response for host-to-device data FIS, CRC
0x0010  2            0  R_ERR response for host-to-device data FIS, non-CRC
0x0012  2            0  R_ERR response for host-to-device non-data FIS, CRC
0x0013  2            0  R_ERR response for host-to-device non-data FIS, non-CRC

