smartctl 6.5 2016-05-07 r4318 [x86_64-linux-3.10.0-693.el7.x86_64] (local build)
Copyright (C) 2002-16, Bruce Allen, Christian Franke, www.smartmontools.org

=== START OF INFORMATION SECTION ===
Device Model:     INTEL SSDSC2KB019T8
Firmware Version: XCV10100
User Capacity:    1 920 383 410 176 bytes [1,92 TB]
Sector Sizes:     512 bytes logical, 4096 bytes physical
Rotation Rate:    Solid State Device
Form Factor:      2.5 inches
Device is:        Not in smartctl database [for details use: -P showall]
ATA Version is:   ACS-3 T13/2161-D revision 5
SATA Version is:  SATA 3.2, 6.0 Gb/s (current: 6.0 Gb/s)
Local Time is:    Mon Oct 15 13:29:20 2018 MSK
SMART support is: Available - device has SMART capability.
SMART support is: Enabled
AAM feature is:   Unavailable
APM feature is:   Unavailable
Rd look-ahead is: Enabled
Write cache is:   Enabled
ATA Security is:  Disabled, NOT FROZEN [SEC1]
Wt Cache Reorder: Enabled

=== START OF READ SMART DATA SECTION ===
SMART overall-health self-assessment test result: PASSED

General SMART Values:
Offline data collection status:  (0x00)	Offline data collection activity
					was never started.
					Auto Offline Data Collection: Disabled.
Self-test execution status:      (   0)	The previous self-test routine completed
					without error or no self-test has ever 
					been run.
Total time to complete Offline 
data collection: 		(    0) seconds.
Offline data collection
capabilities: 			 (0x79) SMART execute Offline immediate.
					No Auto Offline data collection support.
					Suspend Offline collection upon new
					command.
					Offline surface scan supported.
					Self-test supported.
					Conveyance Self-test supported.
					Selective Self-test supported.
SMART capabilities:            (0x0003)	Saves SMART data before entering
					power-saving mode.
					Supports SMART auto save timer.
Error logging capability:        (0x01)	Error logging supported.
					General Purpose Logging supported.
Short self-test routine 
recommended polling time: 	 (   1) minutes.
Extended self-test routine
recommended polling time: 	 (   2) minutes.
Conveyance self-test routine
recommended polling time: 	 (   2) minutes.
SCT capabilities: 	       (0x003d)	SCT Status supported.
					SCT Error Recovery Control supported.
					SCT Feature Control supported.
					SCT Data Table supported.

SMART Attributes Data Structure revision number: 1
Vendor Specific SMART Attributes with Thresholds:
ID# ATTRIBUTE_NAME          FLAGS    VALUE WORST THRESH FAIL RAW_VALUE
  5 Reallocated_Sector_Ct   -O--CK   100   100   000    -    0
  9 Power_On_Hours          -O--CK   100   100   000    -    83
 12 Power_Cycle_Count       -O--CK   100   100   000    -    11
170 Unknown_Attribute       PO--CK   100   100   010    -    0
171 Unknown_Attribute       -O--CK   100   100   000    -    0
172 Unknown_Attribute       -O--CK   100   100   000    -    0
174 Unknown_Attribute       -O--CK   100   100   000    -    11
175 Program_Fail_Count_Chip PO--CK   100   100   010    -    47573764327
183 Runtime_Bad_Block       -O--CK   100   100   000    -    0
184 End-to-End_Error        PO--CK   100   100   090    -    0
187 Reported_Uncorrect      -O--CK   100   100   000    -    0
190 Airflow_Temperature_Cel -O---K   079   077   000    -    21 (Min/Max 14/24)
192 Power-Off_Retract_Count -O--CK   100   100   000    -    11
194 Temperature_Celsius     -O---K   100   100   000    -    21
197 Current_Pending_Sector  -O--C-   100   100   000    -    0
199 UDMA_CRC_Error_Count    -OSRCK   100   100   000    -    0
225 Unknown_SSD_Attribute   -O--CK   100   100   000    -    102245
226 Unknown_SSD_Attribute   -O--CK   100   100   000    -    20
227 Unknown_SSD_Attribute   -O--CK   100   100   000    -    38
228 Power-off_Retract_Count -O--CK   100   100   000    -    4948
232 Available_Reservd_Space PO--CK   100   100   010    -    0
233 Media_Wearout_Indicator -O--CK   100   100   000    -    0
234 Unknown_Attribute       -O--CK   100   100   000    -    0
235 Unknown_Attribute       PO--CK   100   100   010    -    47573764327
241 Total_LBAs_Written      -O--CK   100   100   000    -    102245
242 Total_LBAs_Read         -O--CK   100   100   000    -    63671
243 Unknown_Attribute       -O--CK   100   100   000    -    186440
                            ||||||_ K auto-keep
                            |||||__ C event count
                            ||||___ R error rate
                            |||____ S speed/performance
                            ||_____ O updated online
                            |______ P prefailure warning

General Purpose Log Directory Version 1
SMART           Log Directory Version 1 [multi-sector log support]
Address    Access  R/W   Size  Description
0x00       GPL,SL  R/O      1  Log Directory
0x01           SL  R/O      1  Summary SMART error log
0x02           SL  R/O      8  Comprehensive SMART error log
0x03       GPL     R/O     20  Ext. Comprehensive SMART error log
0x04       GPL,SL  R/O      8  Device Statistics log
0x06           SL  R/O      1  SMART self-test log
0x07       GPL     R/O      2  Extended self-test log
0x08       GPL     R/O      2  Power Conditions log
0x09           SL  R/W      1  Selective self-test log
0x10       GPL     R/O      1  SATA NCQ Queued Error log
0x11       GPL     R/O      1  SATA Phy Event Counters log
0x30       GPL,SL  R/O      9  IDENTIFY DEVICE data log
0x80-0x9f  GPL,SL  R/W     16  Host vendor specific log
0xb8       GPL,SL  VS       1  Device vendor specific log
0xb9       GPL     VS    3336  Device vendor specific log
0xb9       SL      VS       8  Device vendor specific log
0xba       GPL     VS    1280  Device vendor specific log
0xe0       GPL,SL  R/W      1  SCT Command/Status
0xe1       GPL,SL  R/W      8  SCT Data Transfer

SMART Extended Comprehensive Error Log Version: 1 (20 sectors)
No Errors Logged

SMART Extended Self-test Log Version: 1 (2 sectors)
No self-tests have been logged.  [To run self-tests, use: smartctl -t]

SMART Selective self-test log data structure revision number 1
 SPAN  MIN_LBA  MAX_LBA  CURRENT_TEST_STATUS
    1        0        0  Not_testing
    2        0        0  Not_testing
    3        0        0  Not_testing
    4        0        0  Not_testing
    5        0        0  Not_testing
Selective self-test flags (0x0):
  After scanning selected spans, do NOT read-scan remainder of disk.
If Selective self-test is pending on power-up, resume after 0 minute delay.

SCT Status Version:                  3
SCT Version (vendor specific):       1 (0x0001)
SCT Support Level:                   0
Device State:                        Active (0)
Current Temperature:                    21 Celsius
Power Cycle Min/Max Temperature:     14/24 Celsius
Lifetime    Min/Max Temperature:     14/25 Celsius
Under/Over Temperature Limit Count:   0/0
Vendor specific:
00 00 2c 01 00 00 00 00 00 00 00 00 00 00 00 00
00 00 00 00 00 00 00 00 00 00 00 00 00 00 00 00

SCT Temperature History Version:     2
Temperature Sampling Period:         1 minute
Temperature Logging Interval:        1 minute
Min/Max recommended Temperature:      0/73 Celsius
Min/Max Temperature Limit:            0/73 Celsius
Temperature History Size (Index):    478 (252)

Index    Estimated Time   Temperature Celsius
 253    2018-10-15 05:32    21  **
 ...    ..(  3 skipped).    ..  **
 257    2018-10-15 05:36    21  **
 258    2018-10-15 05:37    20  *
 259    2018-10-15 05:38    20  *
 260    2018-10-15 05:39    21  **
 ...    ..(  3 skipped).    ..  **
 264    2018-10-15 05:43    21  **
 265    2018-10-15 05:44    20  *
 ...    ..(  2 skipped).    ..  *
 268    2018-10-15 05:47    20  *
 269    2018-10-15 05:48    21  **
 ...    ..(  3 skipped).    ..  **
 273    2018-10-15 05:52    21  **
 274    2018-10-15 05:53    20  *
 275    2018-10-15 05:54    20  *
 276    2018-10-15 05:55    20  *
 277    2018-10-15 05:56    21  **
 ...    ..(  2 skipped).    ..  **
 280    2018-10-15 05:59    21  **
 281    2018-10-15 06:00    20  *
 ...    ..(  2 skipped).    ..  *
 284    2018-10-15 06:03    20  *
 285    2018-10-15 06:04    21  **
 286    2018-10-15 06:05    21  **
 287    2018-10-15 06:06    22  ***
 288    2018-10-15 06:07    22  ***
 289    2018-10-15 06:08    21  **
 290    2018-10-15 06:09    21  **
 291    2018-10-15 06:10    21  **
 292    2018-10-15 06:11    20  *
 293    2018-10-15 06:12    21  **
 ...    ..(  3 skipped).    ..  **
 297    2018-10-15 06:16    21  **
 298    2018-10-15 06:17    20  *
 ...    ..(  4 skipped).    ..  *
 303    2018-10-15 06:22    20  *
 304    2018-10-15 06:23    21  **
 305    2018-10-15 06:24    21  **
 306    2018-10-15 06:25    21  **
 307    2018-10-15 06:26    20  *
 ...    ..(  3 skipped).    ..  *
 311    2018-10-15 06:30    20  *
 312    2018-10-15 06:31    21  **
 313    2018-10-15 06:32    21  **
 314    2018-10-15 06:33    21  **
 315    2018-10-15 06:34    20  *
 ...    ..(  4 skipped).    ..  *
 320    2018-10-15 06:39    20  *
 321    2018-10-15 06:40    21  **
 ...    ..(  2 skipped).    ..  **
 324    2018-10-15 06:43    21  **
 325    2018-10-15 06:44    20  *
 ...    ..(  2 skipped).    ..  *
 328    2018-10-15 06:47    20  *
 329    2018-10-15 06:48    21  **
 ...    ..(  2 skipped).    ..  **
 332    2018-10-15 06:51    21  **
 333    2018-10-15 06:52    20  *
 ...    ..(  3 skipped).    ..  *
 337    2018-10-15 06:56    20  *
 338    2018-10-15 06:57    21  **
 339    2018-10-15 06:58    21  **
 340    2018-10-15 06:59    21  **
 341    2018-10-15 07:00    20  *
 ...    ..(  2 skipped).    ..  *
 344    2018-10-15 07:03    20  *
 345    2018-10-15 07:04    21  **
 ...    ..(  3 skipped).    ..  **
 349    2018-10-15 07:08    21  **
 350    2018-10-15 07:09    20  *
 ...    ..(  3 skipped).    ..  *
 354    2018-10-15 07:13    20  *
 355    2018-10-15 07:14    21  **
 ...    ..(  2 skipped).    ..  **
 358    2018-10-15 07:17    21  **
 359    2018-10-15 07:18    20  *
 ...    ..(  2 skipped).    ..  *
 362    2018-10-15 07:21    20  *
 363    2018-10-15 07:22    21  **
 ...    ..(  2 skipped).    ..  **
 366    2018-10-15 07:25    21  **
 367    2018-10-15 07:26    20  *
 ...    ..(  3 skipped).    ..  *
 371    2018-10-15 07:30    20  *
 372    2018-10-15 07:31    21  **
 ...    ..(  2 skipped).    ..  **
 375    2018-10-15 07:34    21  **
 376    2018-10-15 07:35    20  *
 ...    ..(  2 skipped).    ..  *
 379    2018-10-15 07:38    20  *
 380    2018-10-15 07:39    21  **
 ...    ..(  2 skipped).    ..  **
 383    2018-10-15 07:42    21  **
 384    2018-10-15 07:43    20  *
 ...    ..(  3 skipped).    ..  *
 388    2018-10-15 07:47    20  *
 389    2018-10-15 07:48    21  **
 ...    ..(  5 skipped).    ..  **
 395    2018-10-15 07:54    21  **
 396    2018-10-15 07:55    20  *
 397    2018-10-15 07:56    21  **
 398    2018-10-15 07:57    21  **
 399    2018-10-15 07:58    21  **
 400    2018-10-15 07:59    20  *
 ...    ..(  5 skipped).    ..  *
 406    2018-10-15 08:05    20  *
 407    2018-10-15 08:06    21  **
 408    2018-10-15 08:07    21  **
 409    2018-10-15 08:08    21  **
 410    2018-10-15 08:09    20  *
 ...    ..(  2 skipped).    ..  *
 413    2018-10-15 08:12    20  *
 414    2018-10-15 08:13    21  **
 ...    ..(  2 skipped).    ..  **
 417    2018-10-15 08:16    21  **
 418    2018-10-15 08:17    20  *
 419    2018-10-15 08:18    20  *
 420    2018-10-15 08:19    20  *
 421    2018-10-15 08:20    19  -
 422    2018-10-15 08:21    20  *
 423    2018-10-15 08:22    20  *
 424    2018-10-15 08:23    20  *
 425    2018-10-15 08:24    21  **
 426    2018-10-15 08:25    21  **
 427    2018-10-15 08:26    20  *
 ...    ..(  3 skipped).    ..  *
 431    2018-10-15 08:30    20  *
 432    2018-10-15 08:31    21  **
 ...    ..(  2 skipped).    ..  **
 435    2018-10-15 08:34    21  **
 436    2018-10-15 08:35    20  *
 ...    ..(  3 skipped).    ..  *
 440    2018-10-15 08:39    20  *
 441    2018-10-15 08:40    21  **
 ...    ..(  2 skipped).    ..  **
 444    2018-10-15 08:43    21  **
 445    2018-10-15 08:44    20  *
 ...    ..(  3 skipped).    ..  *
 449    2018-10-15 08:48    20  *
 450    2018-10-15 08:49    21  **
 451    2018-10-15 08:50    21  **
 452    2018-10-15 08:51    21  **
 453    2018-10-15 08:52    20  *
 ...    ..(  3 skipped).    ..  *
 457    2018-10-15 08:56    20  *
 458    2018-10-15 08:57    21  **
 ...    ..(  2 skipped).    ..  **
 461    2018-10-15 09:00    21  **
 462    2018-10-15 09:01    20  *
 ...    ..(  4 skipped).    ..  *
 467    2018-10-15 09:06    20  *
 468    2018-10-15 09:07    21  **
 469    2018-10-15 09:08    21  **
 470    2018-10-15 09:09    20  *
 ...    ..(  4 skipped).    ..  *
 475    2018-10-15 09:14    20  *
 476    2018-10-15 09:15    21  **
 477    2018-10-15 09:16    21  **
   0    2018-10-15 09:17    21  **
   1    2018-10-15 09:18    20  *
 ...    ..(  4 skipped).    ..  *
   6    2018-10-15 09:23    20  *
   7    2018-10-15 09:24    21  **
   8    2018-10-15 09:25    21  **
   9    2018-10-15 09:26    21  **
  10    2018-10-15 09:27    20  *
 ...    ..(  3 skipped).    ..  *
  14    2018-10-15 09:31    20  *
  15    2018-10-15 09:32    21  **
  16    2018-10-15 09:33    21  **
  17    2018-10-15 09:34    21  **
  18    2018-10-15 09:35    20  *
 ...    ..(  4 skipped).    ..  *
  23    2018-10-15 09:40    20  *
  24    2018-10-15 09:41    21  **
 ...    ..(  2 skipped).    ..  **
  27    2018-10-15 09:44    21  **
  28    2018-10-15 09:45    20  *
 ...    ..(  3 skipped).    ..  *
  32    2018-10-15 09:49    20  *
  33    2018-10-15 09:50    21  **
 ...    ..(  3 skipped).    ..  **
  37    2018-10-15 09:54    21  **
  38    2018-10-15 09:55    20  *
 ...    ..(  2 skipped).    ..  *
  41    2018-10-15 09:58    20  *
  42    2018-10-15 09:59    21  **
  43    2018-10-15 10:00    21  **
  44    2018-10-15 10:01    21  **
  45    2018-10-15 10:02    20  *
 ...    ..(  4 skipped).    ..  *
  50    2018-10-15 10:07    20  *
  51    2018-10-15 10:08    21  **
 ...    ..(  2 skipped).    ..  **
  54    2018-10-15 10:11    21  **
  55    2018-10-15 10:12    20  *
 ...    ..(  7 skipped).    ..  *
  63    2018-10-15 10:20    20  *
  64    2018-10-15 10:21    21  **
  65    2018-10-15 10:22    21  **
  66    2018-10-15 10:23    21  **
  67    2018-10-15 10:24    20  *
 ...    ..(  4 skipped).    ..  *
  72    2018-10-15 10:29    20  *
  73    2018-10-15 10:30    21  **
 ...    ..(  4 skipped).    ..  **
  78    2018-10-15 10:35    21  **
  79    2018-10-15 10:36    20  *
  80    2018-10-15 10:37    20  *
  81    2018-10-15 10:38    20  *
  82    2018-10-15 10:39    23  ****
  83    2018-10-15 10:40    21  **
  84    2018-10-15 10:41    21  **
  85    2018-10-15 10:42    21  **
  86    2018-10-15 10:43    20  *
 ...    ..(  2 skipped).    ..  *
  89    2018-10-15 10:46    20  *
  90    2018-10-15 10:47    21  **
  91    2018-10-15 10:48    21  **
  92    2018-10-15 10:49    21  **
  93    2018-10-15 10:50    20  *
  94    2018-10-15 10:51    20  *
  95    2018-10-15 10:52    20  *
  96    2018-10-15 10:53    22  ***
  97    2018-10-15 10:54    20  *
  98    2018-10-15 10:55    21  **
 ...    ..(  5 skipped).    ..  **
 104    2018-10-15 11:01    21  **
 105    2018-10-15 11:02    20  *
 106    2018-10-15 11:03    21  **
 ...    ..(  2 skipped).    ..  **
 109    2018-10-15 11:06    21  **
 110    2018-10-15 11:07    20  *
 111    2018-10-15 11:08    20  *
 112    2018-10-15 11:09    21  **
 113    2018-10-15 11:10    20  *
 114    2018-10-15 11:11    21  **
 115    2018-10-15 11:12    22  ***
 116    2018-10-15 11:13    21  **
 117    2018-10-15 11:14    21  **
 118    2018-10-15 11:15    21  **
 119    2018-10-15 11:16    20  *
 120    2018-10-15 11:17    20  *
 121    2018-10-15 11:18    21  **
 122    2018-10-15 11:19    20  *
 123    2018-10-15 11:20    21  **
 124    2018-10-15 11:21    21  **
 125    2018-10-15 11:22    22  ***
 126    2018-10-15 11:23    22  ***
 127    2018-10-15 11:24    21  **
 128    2018-10-15 11:25    20  *
 ...    ..(  2 skipped).    ..  *
 131    2018-10-15 11:28    20  *
 132    2018-10-15 11:29    22  ***
 133    2018-10-15 11:30    21  **
 134    2018-10-15 11:31    21  **
 135    2018-10-15 11:32    21  **
 136    2018-10-15 11:33    20  *
 ...    ..(  3 skipped).    ..  *
 140    2018-10-15 11:37    20  *
 141    2018-10-15 11:38    21  **
 ...    ..(  2 skipped).    ..  **
 144    2018-10-15 11:41    21  **
 145    2018-10-15 11:42    20  *
 146    2018-10-15 11:43    20  *
 147    2018-10-15 11:44    20  *
 148    2018-10-15 11:45    21  **
 ...    ..(  3 skipped).    ..  **
 152    2018-10-15 11:49    21  **
 153    2018-10-15 11:50    20  *
 154    2018-10-15 11:51    22  ***
 155    2018-10-15 11:52    21  **
 ...    ..(  4 skipped).    ..  **
 160    2018-10-15 11:57    21  **
 161    2018-10-15 11:58    20  *
 162    2018-10-15 11:59    20  *
 163    2018-10-15 12:00    20  *
 164    2018-10-15 12:01    21  **
 ...    ..(  6 skipped).    ..  **
 171    2018-10-15 12:08    21  **
 172    2018-10-15 12:09    20  *
 ...    ..(  2 skipped).    ..  *
 175    2018-10-15 12:12    20  *
 176    2018-10-15 12:13    21  **
 ...    ..(  3 skipped).    ..  **
 180    2018-10-15 12:17    21  **
 181    2018-10-15 12:18    20  *
 182    2018-10-15 12:19    20  *
 183    2018-10-15 12:20    21  **
 ...    ..(  3 skipped).    ..  **
 187    2018-10-15 12:24    21  **
 188    2018-10-15 12:25    20  *
 ...    ..(  2 skipped).    ..  *
 191    2018-10-15 12:28    20  *
 192    2018-10-15 12:29    21  **
 193    2018-10-15 12:30    21  **
 194    2018-10-15 12:31    22  ***
 195    2018-10-15 12:32    21  **
 196    2018-10-15 12:33    21  **
 197    2018-10-15 12:34    21  **
 198    2018-10-15 12:35    20  *
 199    2018-10-15 12:36    20  *
 200    2018-10-15 12:37    20  *
 201    2018-10-15 12:38    22  ***
 202    2018-10-15 12:39    21  **
 203    2018-10-15 12:40    21  **
 204    2018-10-15 12:41    21  **
 205    2018-10-15 12:42    20  *
 206    2018-10-15 12:43    20  *
 207    2018-10-15 12:44    20  *
 208    2018-10-15 12:45    21  **
 ...    ..(  4 skipped).    ..  **
 213    2018-10-15 12:50    21  **
 214    2018-10-15 12:51    20  *
 215    2018-10-15 12:52    20  *
 216    2018-10-15 12:53    20  *
 217    2018-10-15 12:54    21  **
 ...    ..(  4 skipped).    ..  **
 222    2018-10-15 12:59    21  **
 223    2018-10-15 13:00    22  ***
 224    2018-10-15 13:01    21  **
 225    2018-10-15 13:02    21  **
 226    2018-10-15 13:03    20  *
 ...    ..(  5 skipped).    ..  *
 232    2018-10-15 13:09    20  *
 233    2018-10-15 13:10    22  ***
 234    2018-10-15 13:11    21  **
 235    2018-10-15 13:12    20  *
 ...    ..(  3 skipped).    ..  *
 239    2018-10-15 13:16    20  *
 240    2018-10-15 13:17    21  **
 ...    ..(  2 skipped).    ..  **
 243    2018-10-15 13:20    21  **
 244    2018-10-15 13:21    20  *
 245    2018-10-15 13:22    20  *
 246    2018-10-15 13:23    20  *
 247    2018-10-15 13:24    21  **
 248    2018-10-15 13:25    20  *
 249    2018-10-15 13:26    21  **
 ...    ..(  2 skipped).    ..  **
 252    2018-10-15 13:29    21  **

SCT Error Recovery Control:
           Read: Disabled
          Write: Disabled

Device Statistics (GP Log 0x04)
Page  Offset Size        Value Flags Description
0x01  =====  =               =  ===  == General Statistics (rev 2) ==
0x01  0x008  4              11  ---  Lifetime Power-On Resets
0x01  0x018  6      6700743178  ---  Logical Sectors Written
0x01  0x020  6       154958345  ---  Number of Write Commands
0x01  0x028  6      4172777354  ---  Logical Sectors Read
0x01  0x030  6         9599465  ---  Number of Read Commands
0x01  0x038  6       301349628  ---  Date and Time TimeStamp
0x04  =====  =               =  ===  == General Errors Statistics (rev 1) ==
0x04  0x008  4               0  ---  Number of Reported Uncorrectable Errors
0x04  0x010  4               0  ---  Resets Between Cmd Acceptance and Completion
0x05  =====  =               =  ===  == Temperature Statistics (rev 1) ==
0x05  0x008  1              21  ---  Current Temperature
0x05  0x010  1              20  ---  Average Short Term Temperature
0x05  0x018  1               -  ---  Average Long Term Temperature
0x05  0x020  1              25  ---  Highest Temperature
0x05  0x028  1              20  ---  Lowest Temperature
0x05  0x030  1              21  ---  Highest Average Short Term Temperature
0x05  0x038  1              20  ---  Lowest Average Short Term Temperature
0x05  0x040  1               -  ---  Highest Average Long Term Temperature
0x05  0x048  1               -  ---  Lowest Average Long Term Temperature
0x05  0x050  4               0  ---  Time in Over-Temperature
0x05  0x058  1              73  ---  Specified Maximum Operating Temperature
0x05  0x060  4               0  ---  Time in Under-Temperature
0x05  0x068  1               0  ---  Specified Minimum Operating Temperature
0x06  =====  =               =  ===  == Transport Statistics (rev 1) ==
0x06  0x008  4              36  ---  Number of Hardware Resets
0x06  0x010  4              34  ---  Number of ASR Events
0x06  0x018  4               0  ---  Number of Interface CRC Errors
0x07  =====  =               =  ===  == Solid State Device Statistics (rev 1) ==
0x07  0x008  1               0  ---  Percentage Used Endurance Indicator
                                |||_ C monitored condition met
                                ||__ D supports DSN
                                |___ N normalized value

SATA Phy Event Counters (GP Log 0x11)
ID      Size     Value  Description
0x0001  4            0  Command failed due to ICRC error
0x0002  4            0  R_ERR response for data FIS
0x0003  4            0  R_ERR response for device-to-host data FIS
0x0004  4            0  R_ERR response for host-to-device data FIS
0x0005  4            0  R_ERR response for non-data FIS
0x0006  4            0  R_ERR response for device-to-host non-data FIS
0x0007  4            0  R_ERR response for host-to-device non-data FIS
0x000a  4           20  Device-to-host register FISes sent due to a COMRESET
0x000b  4            0  CRC errors within host-to-device FIS
0x000d  4            0  Non-CRC errors within host-to-device FIS