smartctl 6.5 2016-05-07 r4318 [x86_64-linux-4.7.2-1-ARCH] (local build)
Copyright (C) 2002-16, Bruce Allen, Christian Franke, www.smartmontools.org

=== START OF INFORMATION SECTION ===
Model Family:     Seagate Samsung SpinPoint M8 (AF)
Device Model:     ST1000LM024 HN-M101MBB
Serial Number:    S2RUJ9DD107265
LU WWN Device Id: 5 0004cf 20959084c
Firmware Version: 2AR20003
User Capacity:    1,000,204,886,016 bytes [1.00 TB]
Sector Sizes:     512 bytes logical, 4096 bytes physical
Rotation Rate:    5400 rpm
Form Factor:      2.5 inches
Device is:        In smartctl database [for details use: -P show]
ATA Version is:   ATA8-ACS T13/1699-D revision 6
SATA Version is:  SATA 3.0, 3.0 Gb/s (current: 3.0 Gb/s)
Local Time is:    Thu Sep 15 20:57:39 2016 CST
SMART support is: Available - device has SMART capability.
SMART support is: Enabled
AAM feature is:   Disabled
APM feature is:   Disabled
Rd look-ahead is: Enabled
Write cache is:   Enabled
ATA Security is:  Disabled, NOT FROZEN [SEC1]
Wt Cache Reorder: Enabled

=== START OF READ SMART DATA SECTION ===
SMART overall-health self-assessment test result: PASSED

General SMART Values:
Offline data collection status:  (0x80)	Offline data collection activity
					was never started.
					Auto Offline Data Collection: Enabled.
Self-test execution status:      (   0)	The previous self-test routine completed
					without error or no self-test has ever 
					been run.
Total time to complete Offline 
data collection: 		(13140) seconds.
Offline data collection
capabilities: 			 (0x5b) SMART execute Offline immediate.
					Auto Offline data collection on/off support.
					Suspend Offline collection upon new
					command.
					Offline surface scan supported.
					Self-test supported.
					No Conveyance Self-test supported.
					Selective Self-test supported.
SMART capabilities:            (0x0003)	Saves SMART data before entering
					power-saving mode.
					Supports SMART auto save timer.
Error logging capability:        (0x01)	Error logging supported.
					General Purpose Logging supported.
Short self-test routine 
recommended polling time: 	 (   2) minutes.
Extended self-test routine
recommended polling time: 	 ( 219) minutes.
SCT capabilities: 	       (0x003f)	SCT Status supported.
					SCT Error Recovery Control supported.
					SCT Feature Control supported.
					SCT Data Table supported.

SMART Attributes Data Structure revision number: 16
Vendor Specific SMART Attributes with Thresholds:
ID# ATTRIBUTE_NAME          FLAGS    VALUE WORST THRESH FAIL RAW_VALUE
  1 Raw_Read_Error_Rate     POSR-K   100   100   051    -    0
  2 Throughput_Performance  -OS--K   056   056   000    -    11950
  3 Spin_Up_Time            PO---K   086   086   025    -    4455
  4 Start_Stop_Count        -O--CK   100   100   000    -    184
  5 Reallocated_Sector_Ct   PO--CK   252   252   010    -    0
  7 Seek_Error_Rate         -OSR-K   252   252   051    -    0
  8 Seek_Time_Performance   --S--K   252   252   015    -    0
  9 Power_On_Hours          -O--CK   100   100   000    -    1213
 10 Spin_Retry_Count        -O--CK   252   252   051    -    0
 11 Calibration_Retry_Count -O--CK   100   100   000    -    2
 12 Power_Cycle_Count       -O--CK   100   100   000    -    176
191 G-Sense_Error_Rate      -O---K   100   100   000    -    1
192 Power-Off_Retract_Count -O---K   252   252   000    -    0
194 Temperature_Celsius     -O----   064   059   000    -    34 (Min/Max 15/53)
195 Hardware_ECC_Recovered  -O-RCK   100   100   000    -    0
196 Reallocated_Event_Count -O--CK   252   252   000    -    0
197 Current_Pending_Sector  -O--CK   252   252   000    -    0
198 Offline_Uncorrectable   ----CK   252   252   000    -    0
199 UDMA_CRC_Error_Count    -OS-CK   200   200   000    -    0
200 Multi_Zone_Error_Rate   -O-R-K   100   100   000    -    940
223 Load_Retry_Count        -O--CK   100   100   000    -    2
225 Load_Cycle_Count        -O--CK   098   098   000    -    21165
                            ||||||_ K auto-keep
                            |||||__ C event count
                            ||||___ R error rate
                            |||____ S speed/performance
                            ||_____ O updated online
                            |______ P prefailure warning

General Purpose Log Directory Version 1
SMART           Log Directory Version 1 [multi-sector log support]
Address    Access  R/W   Size  Description
0x00       GPL,SL  R/O      1  Log Directory
0x01           SL  R/O      1  Summary SMART error log
0x02           SL  R/O      2  Comprehensive SMART error log
0x03       GPL     R/O      2  Ext. Comprehensive SMART error log
0x06           SL  R/O      1  SMART self-test log
0x07       GPL     R/O      2  Extended self-test log
0x08       GPL     R/O      2  Power Conditions log
0x09           SL  R/W      1  Selective self-test log
0x10       GPL     R/O      1  SATA NCQ Queued Error log
0x11       GPL     R/O      1  SATA Phy Event Counters log
0x80-0x9f  GPL,SL  R/W     16  Host vendor specific log
0xc0-0xdf  GPL,SL  VS      16  Device vendor specific log
0xe0       GPL,SL  R/W      1  SCT Command/Status
0xe1       GPL,SL  R/W      1  SCT Data Transfer

SMART Extended Comprehensive Error Log Version: 1 (2 sectors)
No Errors Logged

SMART Extended Self-test Log Version: 1 (2 sectors)
Num  Test_Description    Status                  Remaining  LifeTime(hours)  LBA_of_first_error
# 1  Short offline       Completed without error       00%      1213         -
# 2  Short offline       Completed without error       00%      1213         -
# 3  Extended offline    Completed without error       00%      1204         -
# 4  Short offline       Completed without error       00%      1196         -
# 5  Extended offline    Aborted by host               30%      1166         -
# 6  Extended offline    Completed without error       00%       987         -

SMART Selective self-test log data structure revision number 0
Note: revision number not 1 implies that no selective self-test has ever been run
 SPAN  MIN_LBA  MAX_LBA  CURRENT_TEST_STATUS
    1        0        0  Completed [00% left] (0-65535)
    2        0        0  Not_testing
    3        0        0  Not_testing
    4        0        0  Not_testing
    5        0        0  Not_testing
Selective self-test flags (0x0):
  After scanning selected spans, do NOT read-scan remainder of disk.
If Selective self-test is pending on power-up, resume after 0 minute delay.

SCT Status Version:                  2
SCT Version (vendor specific):       256 (0x0100)
SCT Support Level:                   1
Device State:                        Active (0)
Current Temperature:                    35 Celsius
Power Cycle Min/Max Temperature:     27/35 Celsius
Lifetime    Min/Max Temperature:     15/54 Celsius
Under/Over Temperature Limit Count:   0/0

SCT Temperature History Version:     2
Temperature Sampling Period:         5 minutes
Temperature Logging Interval:        5 minutes
Min/Max recommended Temperature:     -5/80 Celsius
Min/Max Temperature Limit:           -10/85 Celsius
Temperature History Size (Index):    128 (127)

Index    Estimated Time   Temperature Celsius
   0    2016-09-15 10:20    33  **************
   1    2016-09-15 10:25    33  **************
   2    2016-09-15 10:30    30  ***********
   3    2016-09-15 10:35    34  ***************
   4    2016-09-15 10:40    35  ****************
   5    2016-09-15 10:45    36  *****************
   6    2016-09-15 10:50    37  ******************
   7    2016-09-15 10:55    29  **********
   8    2016-09-15 11:00    30  ***********
   9    2016-09-15 11:05    32  *************
  10    2016-09-15 11:10    33  **************
  11    2016-09-15 11:15    36  *****************
  12    2016-09-15 11:20    38  *******************
  13    2016-09-15 11:25    38  *******************
  14    2016-09-15 11:30    37  ******************
  15    2016-09-15 11:35    37  ******************
  16    2016-09-15 11:40    36  *****************
  17    2016-09-15 11:45    35  ****************
  18    2016-09-15 11:50    34  ***************
 ...    ..(  6 skipped).    ..  ***************
  25    2016-09-15 12:25    34  ***************
  26    2016-09-15 12:30    33  **************
  27    2016-09-15 12:35    34  ***************
  28    2016-09-15 12:40    34  ***************
  29    2016-09-15 12:45    33  **************
  30    2016-09-15 12:50    28  *********
  31    2016-09-15 12:55    32  *************
  32    2016-09-15 13:00    35  ****************
  33    2016-09-15 13:05    37  ******************
  34    2016-09-15 13:10    39  ********************
  35    2016-09-15 13:15    41  **********************
  36    2016-09-15 13:20    43  ************************
  37    2016-09-15 13:25    45  **************************
  38    2016-09-15 13:30    47  ****************************
  39    2016-09-15 13:35    48  *****************************
  40    2016-09-15 13:40    49  ******************************
  41    2016-09-15 13:45    50  *******************************
  42    2016-09-15 13:50    51  ********************************
  43    2016-09-15 13:55    51  ********************************
  44    2016-09-15 14:00    52  *********************************
  45    2016-09-15 14:05    52  *********************************
  46    2016-09-15 14:10    53  **********************************
  47    2016-09-15 14:15    31  ************
  48    2016-09-15 14:20    41  **********************
  49    2016-09-15 14:25    46  ***************************
  50    2016-09-15 14:30    46  ***************************
  51    2016-09-15 14:35    45  **************************
 ...    ..(  2 skipped).    ..  **************************
  54    2016-09-15 14:50    45  **************************
  55    2016-09-15 14:55    46  ***************************
  56    2016-09-15 15:00    45  **************************
 ...    ..(  8 skipped).    ..  **************************
  65    2016-09-15 15:45    45  **************************
  66    2016-09-15 15:50    46  ***************************
 ...    ..( 17 skipped).    ..  ***************************
  84    2016-09-15 17:20    46  ***************************
  85    2016-09-15 17:25    42  ***********************
  86    2016-09-15 17:30    39  ********************
  87    2016-09-15 17:35    38  *******************
  88    2016-09-15 17:40    37  ******************
  89    2016-09-15 17:45    39  ********************
  90    2016-09-15 17:50    40  *********************
  91    2016-09-15 17:55    41  **********************
  92    2016-09-15 18:00    39  ********************
  93    2016-09-15 18:05    38  *******************
  94    2016-09-15 18:10    40  *********************
  95    2016-09-15 18:15    40  *********************
  96    2016-09-15 18:20    38  *******************
  97    2016-09-15 18:25    37  ******************
  98    2016-09-15 18:30    37  ******************
  99    2016-09-15 18:35    28  *********
 100    2016-09-15 18:40    46  ***************************
 101    2016-09-15 18:45    40  *********************
 102    2016-09-15 18:50    38  *******************
 103    2016-09-15 18:55    37  ******************
 104    2016-09-15 19:00    36  *****************
 ...    ..(  2 skipped).    ..  *****************
 107    2016-09-15 19:15    36  *****************
 108    2016-09-15 19:20    35  ****************
 ...    ..( 12 skipped).    ..  ****************
 121    2016-09-15 20:25    35  ****************
 122    2016-09-15 20:30    33  **************
 123    2016-09-15 20:35    36  *****************
 124    2016-09-15 20:40    37  ******************
 125    2016-09-15 20:45    37  ******************
 126    2016-09-15 20:50    38  *******************
 127    2016-09-15 20:55    32  *************

SCT Error Recovery Control:
           Read: Disabled
          Write: Disabled

Device Statistics (GP/SMART Log 0x04) not supported

SATA Phy Event Counters (GP Log 0x11)
ID      Size     Value  Description
0x0001  4            0  Command failed due to ICRC error
0x0002  4            0  R_ERR response for data FIS
0x0003  4            0  R_ERR response for device-to-host data FIS
0x0004  4            0  R_ERR response for host-to-device data FIS
0x0005  4            0  R_ERR response for non-data FIS
0x0006  4            0  R_ERR response for device-to-host non-data FIS
0x0007  4            0  R_ERR response for host-to-device non-data FIS
0x0008  4            0  Device-to-host non-data FIS retries
0x0009  4            0  Transition from drive PhyRdy to drive PhyNRdy
0x000a  4            0  Device-to-host register FISes sent due to a COMRESET
0x000b  4            0  CRC errors within host-to-device FIS
0x000d  4            0  Non-CRC errors within host-to-device FIS
0x000f  4            0  R_ERR response for host-to-device data FIS, CRC
0x0010  4            0  R_ERR response for host-to-device data FIS, non-CRC
0x0012  4            0  R_ERR response for host-to-device non-data FIS, CRC
0x0013  4            0  R_ERR response for host-to-device non-data FIS, non-CRC
0x8e00  4            0  Vendor specific
0x8e01  4            0  Vendor specific
0x8e02  4            0  Vendor specific
0x8e03  4            0  Vendor specific
0x8e04  4            0  Vendor specific
0x8e05  4            0  Vendor specific
0x8e06  4            0  Vendor specific
0x8e07  4            0  Vendor specific
0x8e08  4            0  Vendor specific
0x8e09  4            0  Vendor specific
0x8e0a  4            0  Vendor specific
0x8e0b  4            0  Vendor specific
0x8e0c  4            0  Vendor specific
0x8e0d  4            0  Vendor specific
0x8e0e  4            0  Vendor specific
0x8e0f  4            0  Vendor specific
0x8e10  4            0  Vendor specific
0x8e11  4            0  Vendor specific

