smartctl 7.3 2022-02-28 r5338 [x86_64-linux-6.2.0-23-generic] (local build)
Copyright (C) 2002-22, Bruce Allen, Christian Franke, www.smartmontools.org

=== START OF INFORMATION SECTION ===
Model Family:     Samsung based SSDs
Device Model:     Samsung SSD 870 EVO 4TB
Serial Number:    S6PJNS0W307187M
LU WWN Device Id: 5 002538 f3333da0e
Firmware Version: SVT02B6Q
User Capacity:    4,000,787,030,016 bytes [4.00 TB]
Sector Size:      512 bytes logical/physical
Rotation Rate:    Solid State Device
Form Factor:      2.5 inches
TRIM Command:     Available, deterministic, zeroed
Device is:        In smartctl database 7.3/5440
ATA Version is:   ACS-4 T13/BSR INCITS 529 revision 5
SATA Version is:  SATA 3.3, 6.0 Gb/s (current: 6.0 Gb/s)
Local Time is:    Sat Jun 24 18:37:06 2023 UTC
SMART support is: Available - device has SMART capability.
SMART support is: Enabled
AAM feature is:   Unavailable
APM feature is:   Unavailable
Rd look-ahead is: Enabled
Write cache is:   Enabled
DSN feature is:   Unavailable
ATA Security is:  Disabled, frozen [SEC2]
Wt Cache Reorder: Enabled

=== START OF READ SMART DATA SECTION ===
SMART overall-health self-assessment test result: PASSED

General SMART Values:
Offline data collection status:  (0x00)	Offline data collection activity
					was never started.
					Auto Offline Data Collection: Disabled.
Self-test execution status:      (   0)	The previous self-test routine completed
					without error or no self-test has ever 
					been run.
Total time to complete Offline 
data collection: 		(    0) seconds.
Offline data collection
capabilities: 			 (0x53) SMART execute Offline immediate.
					Auto Offline data collection on/off support.
					Suspend Offline collection upon new
					command.
					No Offline surface scan supported.
					Self-test supported.
					No Conveyance Self-test supported.
					Selective Self-test supported.
SMART capabilities:            (0x0003)	Saves SMART data before entering
					power-saving mode.
					Supports SMART auto save timer.
Error logging capability:        (0x01)	Error logging supported.
					General Purpose Logging supported.
Short self-test routine 
recommended polling time: 	 (   2) minutes.
Extended self-test routine
recommended polling time: 	 ( 320) minutes.
SCT capabilities: 	       (0x003d)	SCT Status supported.
					SCT Error Recovery Control supported.
					SCT Feature Control supported.
					SCT Data Table supported.

SMART Attributes Data Structure revision number: 1
Vendor Specific SMART Attributes with Thresholds:
ID# ATTRIBUTE_NAME          FLAGS    VALUE WORST THRESH FAIL RAW_VALUE
  5 Reallocated_Sector_Ct   PO--CK   100   100   010    -    0
  9 Power_On_Hours          -O--CK   099   099   000    -    164
 12 Power_Cycle_Count       -O--CK   099   099   000    -    25
177 Wear_Leveling_Count     PO--C-   100   100   000    -    0
179 Used_Rsvd_Blk_Cnt_Tot   PO--C-   100   100   010    -    0
181 Program_Fail_Cnt_Total  -O--CK   100   100   010    -    0
182 Erase_Fail_Count_Total  -O--CK   100   100   010    -    0
183 Runtime_Bad_Block       PO--C-   100   100   010    -    0
187 Uncorrectable_Error_Cnt -O--CK   100   100   000    -    0
190 Airflow_Temperature_Cel -O--CK   068   057   000    -    32
195 ECC_Error_Rate          -O-RC-   200   200   000    -    0
199 CRC_Error_Count         -OSRCK   100   100   000    -    0
235 POR_Recovery_Count      -O--C-   099   099   000    -    22
241 Total_LBAs_Written      -O--CK   099   099   000    -    279402843
252 Unknown_Attribute       -O--CK   100   100   000    -    0
                            ||||||_ K auto-keep
                            |||||__ C event count
                            ||||___ R error rate
                            |||____ S speed/performance
                            ||_____ O updated online
                            |______ P prefailure warning

General Purpose Log Directory Version 1
SMART           Log Directory Version 1 [multi-sector log support]
Address    Access  R/W   Size  Description
0x00       GPL,SL  R/O      1  Log Directory
0x01           SL  R/O      1  Summary SMART error log
0x02           SL  R/O      1  Comprehensive SMART error log
0x03       GPL     R/O      1  Ext. Comprehensive SMART error log
0x04       GPL,SL  R/O      8  Device Statistics log
0x06           SL  R/O      1  SMART self-test log
0x07       GPL     R/O      1  Extended self-test log
0x09           SL  R/W      1  Selective self-test log
0x10       GPL     R/O      1  NCQ Command Error log
0x11       GPL     R/O      1  SATA Phy Event Counters log
0x13       GPL     R/O      1  SATA NCQ Send and Receive log
0x30       GPL,SL  R/O      9  IDENTIFY DEVICE data log
0x80-0x9f  GPL,SL  R/W     16  Host vendor specific log
0xa1           SL  VS      16  Device vendor specific log
0xa5           SL  VS      16  Device vendor specific log
0xce           SL  VS      16  Device vendor specific log
0xe0       GPL,SL  R/W      1  SCT Command/Status
0xe1       GPL,SL  R/W      1  SCT Data Transfer

SMART Extended Comprehensive Error Log Version: 1 (1 sectors)
No Errors Logged

SMART Extended Self-test Log Version: 1 (1 sectors)
Num  Test_Description    Status                  Remaining  LifeTime(hours)  LBA_of_first_error
# 1  Short offline       Completed without error       00%       164         -
# 2  Extended offline    Completed without error       00%       145         -
# 3  Extended offline    Aborted by host               90%       140         -
# 4  Extended offline    Aborted by host               90%       140         -
# 5  Extended offline    Aborted by host               90%       140         -

SMART Selective self-test log data structure revision number 1
 SPAN  MIN_LBA  MAX_LBA  CURRENT_TEST_STATUS
    1        0        0  Not_testing
    2        0        0  Not_testing
    3        0        0  Not_testing
    4        0        0  Not_testing
    5        0        0  Not_testing
  256        0    65535  Read_scanning was never started
Selective self-test flags (0x0):
  After scanning selected spans, do NOT read-scan remainder of disk.
If Selective self-test is pending on power-up, resume after 0 minute delay.

SCT Status Version:                  3
SCT Version (vendor specific):       256 (0x0100)
Device State:                        Active (0)
Current Temperature:                    32 Celsius
Power Cycle Min/Max Temperature:     21/43 Celsius
Lifetime    Min/Max Temperature:     21/43 Celsius
Specified Max Operating Temperature:    70 Celsius
Under/Over Temperature Limit Count:   0/0
SMART Status:                        0xc24f (PASSED)

SCT Temperature History Version:     2
Temperature Sampling Period:         10 minutes
Temperature Logging Interval:        10 minutes
Min/Max recommended Temperature:      0/70 Celsius
Min/Max Temperature Limit:            0/70 Celsius
Temperature History Size (Index):    128 (125)

Index    Estimated Time   Temperature Celsius
 126    2023-06-23 21:20    40  *********************
 127    2023-06-23 21:30    41  **********************
   0    2023-06-23 21:40    41  **********************
   1    2023-06-23 21:50    41  **********************
   2    2023-06-23 22:00    40  *********************
 ...    ..(  2 skipped).    ..  *********************
   5    2023-06-23 22:30    40  *********************
   6    2023-06-23 22:40    41  **********************
   7    2023-06-23 22:50    41  **********************
   8    2023-06-23 23:00    42  ***********************
   9    2023-06-23 23:10    42  ***********************
  10    2023-06-23 23:20    33  **************
  11    2023-06-23 23:30    28  *********
  12    2023-06-23 23:40    27  ********
  13    2023-06-23 23:50    26  *******
  14    2023-06-24 00:00    27  ********
  15    2023-06-24 00:10    26  *******
  16    2023-06-24 00:20    26  *******
  17    2023-06-24 00:30    24  *****
  18    2023-06-24 00:40    24  *****
  19    2023-06-24 00:50    25  ******
 ...    ..(  2 skipped).    ..  ******
  22    2023-06-24 01:20    25  ******
  23    2023-06-24 01:30    24  *****
  24    2023-06-24 01:40    24  *****
  25    2023-06-24 01:50    24  *****
  26    2023-06-24 02:00    26  *******
  27    2023-06-24 02:10    25  ******
  28    2023-06-24 02:20    25  ******
  29    2023-06-24 02:30    26  *******
  30    2023-06-24 02:40    25  ******
  31    2023-06-24 02:50    24  *****
  32    2023-06-24 03:00    24  *****
  33    2023-06-24 03:10    25  ******
  34    2023-06-24 03:20    25  ******
  35    2023-06-24 03:30    25  ******
  36    2023-06-24 03:40    26  *******
  37    2023-06-24 03:50    25  ******
  38    2023-06-24 04:00    25  ******
  39    2023-06-24 04:10    24  *****
  40    2023-06-24 04:20    24  *****
  41    2023-06-24 04:30    23  ****
 ...    ..(  2 skipped).    ..  ****
  44    2023-06-24 05:00    23  ****
  45    2023-06-24 05:10    26  *******
  46    2023-06-24 05:20    24  *****
  47    2023-06-24 05:30    25  ******
 ...    ..(  3 skipped).    ..  ******
  51    2023-06-24 06:10    25  ******
  52    2023-06-24 06:20    24  *****
  53    2023-06-24 06:30    24  *****
  54    2023-06-24 06:40    24  *****
  55    2023-06-24 06:50    25  ******
  56    2023-06-24 07:00    25  ******
  57    2023-06-24 07:10    25  ******
  58    2023-06-24 07:20    26  *******
  59    2023-06-24 07:30    25  ******
  60    2023-06-24 07:40    24  *****
  61    2023-06-24 07:50    23  ****
  62    2023-06-24 08:00    23  ****
  63    2023-06-24 08:10    23  ****
  64    2023-06-24 08:20    24  *****
  65    2023-06-24 08:30    24  *****
  66    2023-06-24 08:40    23  ****
  67    2023-06-24 08:50    23  ****
  68    2023-06-24 09:00    22  ***
 ...    ..(  2 skipped).    ..  ***
  71    2023-06-24 09:30    22  ***
  72    2023-06-24 09:40    21  **
  73    2023-06-24 09:50    21  **
  74    2023-06-24 10:00    22  ***
  75    2023-06-24 10:10    23  ****
  76    2023-06-24 10:20    24  *****
  77    2023-06-24 10:30    24  *****
  78    2023-06-24 10:40    24  *****
  79    2023-06-24 10:50    23  ****
  80    2023-06-24 11:00    23  ****
  81    2023-06-24 11:10    22  ***
  82    2023-06-24 11:20    22  ***
  83    2023-06-24 11:30    21  **
  84    2023-06-24 11:40    21  **
  85    2023-06-24 11:50    21  **
  86    2023-06-24 12:00    22  ***
  87    2023-06-24 12:10    22  ***
  88    2023-06-24 12:20    23  ****
  89    2023-06-24 12:30    23  ****
  90    2023-06-24 12:40    24  *****
 ...    ..(  3 skipped).    ..  *****
  94    2023-06-24 13:20    24  *****
  95    2023-06-24 13:30    25  ******
  96    2023-06-24 13:40    24  *****
  97    2023-06-24 13:50    24  *****
  98    2023-06-24 14:00    24  *****
  99    2023-06-24 14:10    25  ******
 100    2023-06-24 14:20    24  *****
 101    2023-06-24 14:30    25  ******
 ...    ..( 11 skipped).    ..  ******
 113    2023-06-24 16:30    25  ******
 114    2023-06-24 16:40    27  ********
 115    2023-06-24 16:50    26  *******
 116    2023-06-24 17:00    26  *******
 117    2023-06-24 17:10    26  *******
 118    2023-06-24 17:20    25  ******
 ...    ..(  2 skipped).    ..  ******
 121    2023-06-24 17:50    25  ******
 122    2023-06-24 18:00    26  *******
 123    2023-06-24 18:10    25  ******
 124    2023-06-24 18:20    25  ******
 125    2023-06-24 18:30    25  ******

SCT Error Recovery Control:
           Read: Disabled
          Write: Disabled

Device Statistics (GP Log 0x04)
Page  Offset Size        Value Flags Description
0x01  =====  =               =  ===  == General Statistics (rev 1) ==
0x01  0x008  4              25  ---  Lifetime Power-On Resets
0x01  0x010  4             164  ---  Power-on Hours
0x01  0x018  6       279402843  ---  Logical Sectors Written
0x01  0x020  6         1890867  ---  Number of Write Commands
0x01  0x028  6      8799020947  ---  Logical Sectors Read
0x01  0x030  6        51561640  ---  Number of Read Commands
0x01  0x038  6         3413000  ---  Date and Time TimeStamp
0x04  =====  =               =  ===  == General Errors Statistics (rev 1) ==
0x04  0x008  4               0  ---  Number of Reported Uncorrectable Errors
0x04  0x010  4               0  ---  Resets Between Cmd Acceptance and Completion
0x05  =====  =               =  ===  == Temperature Statistics (rev 1) ==
0x05  0x008  1              32  ---  Current Temperature
0x05  0x020  1              43  ---  Highest Temperature
0x05  0x028  1              21  ---  Lowest Temperature
0x05  0x058  1              70  ---  Specified Maximum Operating Temperature
0x06  =====  =               =  ===  == Transport Statistics (rev 1) ==
0x06  0x008  4              16  ---  Number of Hardware Resets
0x06  0x010  4               0  ---  Number of ASR Events
0x06  0x018  4               0  ---  Number of Interface CRC Errors
0x07  =====  =               =  ===  == Solid State Device Statistics (rev 1) ==
0x07  0x008  1               0  N--  Percentage Used Endurance Indicator
                                |||_ C monitored condition met
                                ||__ D supports DSN
                                |___ N normalized value

Pending Defects log (GP Log 0x0c) not supported

SATA Phy Event Counters (GP Log 0x11)
ID      Size     Value  Description
0x0001  2            0  Command failed due to ICRC error
0x0002  2            0  R_ERR response for data FIS
0x0003  2            0  R_ERR response for device-to-host data FIS
0x0004  2            0  R_ERR response for host-to-device data FIS
0x0005  2            0  R_ERR response for non-data FIS
0x0006  2            0  R_ERR response for device-to-host non-data FIS
0x0007  2            0  R_ERR response for host-to-device non-data FIS
0x0008  2            0  Device-to-host non-data FIS retries
0x0009  2            5  Transition from drive PhyRdy to drive PhyNRdy
0x000a  2            4  Device-to-host register FISes sent due to a COMRESET
0x000b  2            0  CRC errors within host-to-device FIS
0x000d  2            0  Non-CRC errors within host-to-device FIS
0x000f  2            0  R_ERR response for host-to-device data FIS, CRC
0x0010  2            0  R_ERR response for host-to-device data FIS, non-CRC
0x0012  2            0  R_ERR response for host-to-device non-data FIS, CRC
0x0013  2            0  R_ERR response for host-to-device non-data FIS, non-CRC

