smartctl 6.6 2017-11-05 r4594 [x86_64-linux-4.12.14-lp150.12.61-default] (SUSE RPM)
Copyright (C) 2002-17, Bruce Allen, Christian Franke, www.smartmontools.org

=== START OF INFORMATION SECTION ===
Device Model:     HUS724030ALA640
Serial Number:    P9KAN8SY
Firmware Version: MF8OAAZ0
User Capacity:    3,000,592,982,016 bytes [3.00 TB]
Sector Size:      512 bytes logical/physical
Rotation Rate:    7200 rpm
Form Factor:      3.5 inches
Device is:        Not in smartctl database [for details use: -P showall]
ATA Version is:   ATA8-ACS T13/1699-D revision 4
SATA Version is:  SATA 3.0, 6.0 Gb/s (current: 6.0 Gb/s)
Local Time is:    Sat May 25 21:01:55 2019 CEST
SMART support is: Available - device has SMART capability.
SMART support is: Enabled
AAM feature is:   Unavailable
APM feature is:   Disabled
Rd look-ahead is: Enabled
Write cache is:   Disabled
DSN feature is:   Unavailable
ATA Security is:  Disabled, NOT FROZEN [SEC1]
Wt Cache Reorder: Enabled

=== START OF READ SMART DATA SECTION ===
SMART overall-health self-assessment test result: PASSED

General SMART Values:
Offline data collection status:  (0x82)	Offline data collection activity
					was completed without error.
					Auto Offline Data Collection: Enabled.
Self-test execution status:      (   0)	The previous self-test routine completed
					without error or no self-test has ever 
					been run.
Total time to complete Offline 
data collection: 		(   24) seconds.
Offline data collection
capabilities: 			 (0x5b) SMART execute Offline immediate.
					Auto Offline data collection on/off support.
					Suspend Offline collection upon new
					command.
					Offline surface scan supported.
					Self-test supported.
					No Conveyance Self-test supported.
					Selective Self-test supported.
SMART capabilities:            (0x0003)	Saves SMART data before entering
					power-saving mode.
					Supports SMART auto save timer.
Error logging capability:        (0x01)	Error logging supported.
					General Purpose Logging supported.
Short self-test routine 
recommended polling time: 	 (   1) minutes.
Extended self-test routine
recommended polling time: 	 ( 432) minutes.
SCT capabilities: 	       (0x003d)	SCT Status supported.
					SCT Error Recovery Control supported.
					SCT Feature Control supported.
					SCT Data Table supported.

SMART Attributes Data Structure revision number: 16
Vendor Specific SMART Attributes with Thresholds:
ID# ATTRIBUTE_NAME          FLAGS    VALUE WORST THRESH FAIL RAW_VALUE
  1 Raw_Read_Error_Rate     PO-R--   100   100   016    -    0
  2 Throughput_Performance  P-S---   137   137   054    -    78
  3 Spin_Up_Time            POS---   121   121   024    -    512 (Average 514)
  4 Start_Stop_Count        -O--C-   100   100   000    -    47
  5 Reallocated_Sector_Ct   PO--CK   100   100   005    -    0
  7 Seek_Error_Rate         PO-R--   100   100   067    -    0
  8 Seek_Time_Performance   P-S---   140   140   020    -    26
  9 Power_On_Hours          -O--C-   099   099   000    -    10089
 10 Spin_Retry_Count        PO--C-   100   100   060    -    0
 12 Power_Cycle_Count       -O--CK   100   100   000    -    47
192 Power-Off_Retract_Count -O--CK   100   100   000    -    455
193 Load_Cycle_Count        -O--C-   100   100   000    -    455
194 Temperature_Celsius     -O----   166   166   000    -    36 (Min/Max 20/44)
196 Reallocated_Event_Count -O--CK   100   100   000    -    0
197 Current_Pending_Sector  -O---K   100   100   000    -    0
198 Offline_Uncorrectable   ---R--   100   100   000    -    0
199 UDMA_CRC_Error_Count    -O-R--   200   200   000    -    0
                            ||||||_ K auto-keep
                            |||||__ C event count
                            ||||___ R error rate
                            |||____ S speed/performance
                            ||_____ O updated online
                            |______ P prefailure warning

General Purpose Log Directory Version 1
SMART           Log Directory Version 1 [multi-sector log support]
Address    Access  R/W   Size  Description
0x00       GPL,SL  R/O      1  Log Directory
0x01           SL  R/O      1  Summary SMART error log
0x03       GPL     R/O      1  Ext. Comprehensive SMART error log
0x04       GPL     R/O      7  Device Statistics log
0x06           SL  R/O      1  SMART self-test log
0x07       GPL     R/O      1  Extended self-test log
0x08       GPL     R/O      2  Power Conditions log
0x09           SL  R/W      1  Selective self-test log
0x10       GPL     R/O      1  NCQ Command Error log
0x11       GPL     R/O      1  SATA Phy Event Counters log
0x20       GPL     R/O      1  Streaming performance log [OBS-8]
0x21       GPL     R/O      1  Write stream error log
0x22       GPL     R/O      1  Read stream error log
0x80-0x9f  GPL,SL  R/W     16  Host vendor specific log
0xe0       GPL,SL  R/W      1  SCT Command/Status
0xe1       GPL,SL  R/W      1  SCT Data Transfer

SMART Extended Comprehensive Error Log Version: 1 (1 sectors)
No Errors Logged

SMART Extended Self-test Log Version: 1 (1 sectors)
Num  Test_Description    Status                  Remaining  LifeTime(hours)  LBA_of_first_error
# 1  Short offline       Completed without error       00%     10071         -
# 2  Short offline       Completed without error       00%     10047         -
# 3  Short offline       Completed without error       00%     10023         -
# 4  Short offline       Completed without error       00%      9999         -
# 5  Short offline       Completed without error       00%      9975         -
# 6  Short offline       Completed without error       00%      9951         -
# 7  Short offline       Completed without error       00%      9927         -
# 8  Short offline       Completed without error       00%      9903         -
# 9  Short offline       Completed without error       00%      9879         -
#10  Short offline       Completed without error       00%      9854         -
#11  Short offline       Completed without error       00%      9830         -
#12  Short offline       Completed without error       00%      9806         -
#13  Short offline       Completed without error       00%      9782         -
#14  Short offline       Completed without error       00%      9758         -
#15  Short offline       Completed without error       00%      9734         -
#16  Short offline       Completed without error       00%      9710         -
#17  Short offline       Completed without error       00%      9686         -
#18  Short offline       Completed without error       00%      9662         -
#19  Short offline       Completed without error       00%      9638         -

SMART Selective self-test log data structure revision number 1
 SPAN  MIN_LBA  MAX_LBA  CURRENT_TEST_STATUS
    1        0        0  Not_testing
    2        0        0  Not_testing
    3        0        0  Not_testing
    4        0        0  Not_testing
    5        0        0  Not_testing
Selective self-test flags (0x0):
  After scanning selected spans, do NOT read-scan remainder of disk.
If Selective self-test is pending on power-up, resume after 0 minute delay.

SCT Status Version:                  3
SCT Version (vendor specific):       256 (0x0100)
SCT Support Level:                   1
Device State:                        Active (0)
Current Temperature:                    36 Celsius
Power Cycle Min/Max Temperature:     23/39 Celsius
Lifetime    Min/Max Temperature:     20/44 Celsius
Under/Over Temperature Limit Count:   0/0

SCT Temperature History Version:     2
Temperature Sampling Period:         1 minute
Temperature Logging Interval:        1 minute
Min/Max recommended Temperature:      0/60 Celsius
Min/Max Temperature Limit:           -40/70 Celsius
Temperature History Size (Index):    128 (50)

Index    Estimated Time   Temperature Celsius
  51    2019-05-25 18:54    36  *****************
 ...    ..(  2 skipped).    ..  *****************
  54    2019-05-25 18:57    36  *****************
  55    2019-05-25 18:58    37  ******************
  56    2019-05-25 18:59    36  *****************
 ...    ..(  7 skipped).    ..  *****************
  64    2019-05-25 19:07    36  *****************
  65    2019-05-25 19:08    37  ******************
  66    2019-05-25 19:09    36  *****************
  67    2019-05-25 19:10    36  *****************
  68    2019-05-25 19:11    37  ******************
 ...    ..(  2 skipped).    ..  ******************
  71    2019-05-25 19:14    37  ******************
  72    2019-05-25 19:15    36  *****************
  73    2019-05-25 19:16    36  *****************
  74    2019-05-25 19:17    36  *****************
  75    2019-05-25 19:18    37  ******************
  76    2019-05-25 19:19    37  ******************
  77    2019-05-25 19:20    36  *****************
  78    2019-05-25 19:21    36  *****************
  79    2019-05-25 19:22    36  *****************
  80    2019-05-25 19:23    37  ******************
  81    2019-05-25 19:24    36  *****************
 ...    ..(  2 skipped).    ..  *****************
  84    2019-05-25 19:27    36  *****************
  85    2019-05-25 19:28    37  ******************
  86    2019-05-25 19:29    36  *****************
 ...    ..(  2 skipped).    ..  *****************
  89    2019-05-25 19:32    36  *****************
  90    2019-05-25 19:33    37  ******************
  91    2019-05-25 19:34    36  *****************
 ...    ..(  5 skipped).    ..  *****************
  97    2019-05-25 19:40    36  *****************
  98    2019-05-25 19:41    37  ******************
 ...    ..(  8 skipped).    ..  ******************
 107    2019-05-25 19:50    37  ******************
 108    2019-05-25 19:51    36  *****************
 109    2019-05-25 19:52    37  ******************
 110    2019-05-25 19:53    37  ******************
 111    2019-05-25 19:54    37  ******************
 112    2019-05-25 19:55    36  *****************
 113    2019-05-25 19:56    36  *****************
 114    2019-05-25 19:57    37  ******************
 115    2019-05-25 19:58    37  ******************
 116    2019-05-25 19:59    37  ******************
 117    2019-05-25 20:00    36  *****************
 118    2019-05-25 20:01    36  *****************
 119    2019-05-25 20:02    36  *****************
 120    2019-05-25 20:03    37  ******************
 121    2019-05-25 20:04    37  ******************
 122    2019-05-25 20:05    36  *****************
 123    2019-05-25 20:06    36  *****************
 124    2019-05-25 20:07    37  ******************
 125    2019-05-25 20:08    37  ******************
 126    2019-05-25 20:09    36  *****************
 127    2019-05-25 20:10    36  *****************
   0    2019-05-25 20:11    37  ******************
 ...    ..(  2 skipped).    ..  ******************
   3    2019-05-25 20:14    37  ******************
   4    2019-05-25 20:15    36  *****************
   5    2019-05-25 20:16    36  *****************
   6    2019-05-25 20:17    37  ******************
   7    2019-05-25 20:18    37  ******************
   8    2019-05-25 20:19    36  *****************
 ...    ..(  2 skipped).    ..  *****************
  11    2019-05-25 20:22    36  *****************
  12    2019-05-25 20:23    37  ******************
  13    2019-05-25 20:24    36  *****************
 ...    ..(  2 skipped).    ..  *****************
  16    2019-05-25 20:27    36  *****************
  17    2019-05-25 20:28    37  ******************
  18    2019-05-25 20:29    36  *****************
 ...    ..( 31 skipped).    ..  *****************
  50    2019-05-25 21:01    36  *****************

SCT Error Recovery Control:
           Read:    140 (14.0 seconds)
          Write:    140 (14.0 seconds)

Device Statistics (GP Log 0x04)
Page  Offset Size        Value Flags Description
0x01  =====  =               =  ===  == General Statistics (rev 2) ==
0x01  0x008  4              47  ---  Lifetime Power-On Resets
0x01  0x018  6     18719781286  ---  Logical Sectors Written
0x01  0x020  6        95992098  ---  Number of Write Commands
0x01  0x028  6    277748371831  ---  Logical Sectors Read
0x01  0x030  6       688924605  ---  Number of Read Commands
0x03  =====  =               =  ===  == Rotating Media Statistics (rev 1) ==
0x03  0x008  4           10086  ---  Spindle Motor Power-on Hours
0x03  0x010  4           10086  ---  Head Flying Hours
0x03  0x018  4             455  ---  Head Load Events
0x03  0x020  4               0  ---  Number of Reallocated Logical Sectors
0x03  0x028  4               0  ---  Read Recovery Attempts
0x03  0x030  4               0  ---  Number of Mechanical Start Failures
0x04  =====  =               =  ===  == General Errors Statistics (rev 1) ==
0x04  0x008  4               0  ---  Number of Reported Uncorrectable Errors
0x04  0x010  4               0  ---  Resets Between Cmd Acceptance and Completion
0x05  =====  =               =  ===  == Temperature Statistics (rev 1) ==
0x05  0x008  1              36  ---  Current Temperature
0x05  0x010  1              35  N--  Average Short Term Temperature
0x05  0x018  1              34  N--  Average Long Term Temperature
0x05  0x020  1              44  ---  Highest Temperature
0x05  0x028  1              20  ---  Lowest Temperature
0x05  0x030  1              41  N--  Highest Average Short Term Temperature
0x05  0x038  1              25  N--  Lowest Average Short Term Temperature
0x05  0x040  1              37  N--  Highest Average Long Term Temperature
0x05  0x048  1              25  N--  Lowest Average Long Term Temperature
0x05  0x050  4               0  ---  Time in Over-Temperature
0x05  0x058  1              60  ---  Specified Maximum Operating Temperature
0x05  0x060  4               0  ---  Time in Under-Temperature
0x05  0x068  1               0  ---  Specified Minimum Operating Temperature
0x06  =====  =               =  ===  == Transport Statistics (rev 1) ==
0x06  0x008  4            2476  ---  Number of Hardware Resets
0x06  0x010  4             432  ---  Number of ASR Events
0x06  0x018  4               0  ---  Number of Interface CRC Errors
                                |||_ C monitored condition met
                                ||__ D supports DSN
                                |___ N normalized value

Pending Defects log (GP Log 0x0c) not supported

SATA Phy Event Counters (GP Log 0x11)
ID      Size     Value  Description
0x0001  2            0  Command failed due to ICRC error
0x0002  2            0  R_ERR response for data FIS
0x0003  2            0  R_ERR response for device-to-host data FIS
0x0004  2            0  R_ERR response for host-to-device data FIS
0x0005  2            0  R_ERR response for non-data FIS
0x0006  2            0  R_ERR response for device-to-host non-data FIS
0x0007  2            0  R_ERR response for host-to-device non-data FIS
0x0009  2           98  Transition from drive PhyRdy to drive PhyNRdy
0x000a  2           98  Device-to-host register FISes sent due to a COMRESET
0x000b  2            0  CRC errors within host-to-device FIS
0x000d  2            0  Non-CRC errors within host-to-device FIS

