smartctl 6.6 2017-11-05 r4594 [FreeBSD 11.2-STABLE amd64] (local build)
Copyright (C) 2002-17, Bruce Allen, Christian Franke, www.smartmontools.org

=== START OF INFORMATION SECTION ===
Device Model:     HUA723020ALA640
Serial Number:    YFKSAHWG
Firmware Version: MK7OAAA0
User Capacity:    2,000,398,934,016 bytes [2.00 TB]
Sector Size:      512 bytes logical/physical
Rotation Rate:    7200 rpm
Form Factor:      3.5 inches
Device is:        Not in smartctl database [for details use: -P showall]
ATA Version is:   ATA8-ACS T13/1699-D revision 4
SATA Version is:  SATA 2.6, 6.0 Gb/s (current: 1.5 Gb/s)
Local Time is:    Thu May 23 15:27:07 2019 CEST
SMART support is: Available - device has SMART capability.
SMART support is: Enabled
AAM feature is:   Unavailable
APM feature is:   Disabled
Rd look-ahead is: Enabled
Write cache is:   Enabled
DSN feature is:   Unavailable
ATA Security is:  Disabled, NOT FROZEN [SEC1]
Wt Cache Reorder: Enabled

=== START OF READ SMART DATA SECTION ===
SMART overall-health self-assessment test result: PASSED

General SMART Values:
Offline data collection status:  (0x85)	Offline data collection activity
					was aborted by an interrupting command from host.
					Auto Offline Data Collection: Enabled.
Self-test execution status:      (   0)	The previous self-test routine completed
					without error or no self-test has ever 
					been run.
Total time to complete Offline 
data collection: 		(18950) seconds.
Offline data collection
capabilities: 			 (0x5b) SMART execute Offline immediate.
					Auto Offline data collection on/off support.
					Suspend Offline collection upon new
					command.
					Offline surface scan supported.
					Self-test supported.
					No Conveyance Self-test supported.
					Selective Self-test supported.
SMART capabilities:            (0x0003)	Saves SMART data before entering
					power-saving mode.
					Supports SMART auto save timer.
Error logging capability:        (0x01)	Error logging supported.
					General Purpose Logging supported.
Short self-test routine 
recommended polling time: 	 (   1) minutes.
Extended self-test routine
recommended polling time: 	 ( 316) minutes.
SCT capabilities: 	       (0x003f)	SCT Status supported.
					SCT Error Recovery Control supported.
					SCT Feature Control supported.
					SCT Data Table supported.

SMART Attributes Data Structure revision number: 16
Vendor Specific SMART Attributes with Thresholds:
ID# ATTRIBUTE_NAME          FLAGS    VALUE WORST THRESH FAIL RAW_VALUE
  1 Raw_Read_Error_Rate     PO-R--   100   100   016    -    0
  2 Throughput_Performance  P-S---   134   134   054    -    89
  3 Spin_Up_Time            POS---   127   127   024    -    491 (Average 492)
  4 Start_Stop_Count        -O--C-   100   100   000    -    125
  5 Reallocated_Sector_Ct   PO--CK   100   100   005    -    0
  7 Seek_Error_Rate         PO-R--   100   100   067    -    0
  8 Seek_Time_Performance   P-S---   123   123   020    -    31
  9 Power_On_Hours          -O--C-   096   096   000    -    30017
 10 Spin_Retry_Count        PO--C-   100   100   060    -    0
 12 Power_Cycle_Count       -O--CK   100   100   000    -    124
192 Power-Off_Retract_Count -O--CK   100   100   000    -    224
193 Load_Cycle_Count        -O--C-   100   100   000    -    224
194 Temperature_Celsius     -O----   176   176   000    -    34 (Min/Max 21/47)
196 Reallocated_Event_Count -O--CK   100   100   000    -    0
197 Current_Pending_Sector  -O---K   100   100   000    -    0
198 Offline_Uncorrectable   ---R--   100   100   000    -    0
199 UDMA_CRC_Error_Count    -O-R--   200   200   000    -    1
                            ||||||_ K auto-keep
                            |||||__ C event count
                            ||||___ R error rate
                            |||____ S speed/performance
                            ||_____ O updated online
                            |______ P prefailure warning

General Purpose Log Directory Version 1
SMART           Log Directory Version 1 [multi-sector log support]
Address    Access  R/W   Size  Description
0x00       GPL,SL  R/O      1  Log Directory
0x01           SL  R/O      1  Summary SMART error log
0x03       GPL     R/O      1  Ext. Comprehensive SMART error log
0x04       GPL     R/O      7  Device Statistics log
0x06           SL  R/O      1  SMART self-test log
0x07       GPL     R/O      1  Extended self-test log
0x08       GPL     R/O      2  Power Conditions log
0x09           SL  R/W      1  Selective self-test log
0x10       GPL     R/O      1  NCQ Command Error log
0x11       GPL     R/O      1  SATA Phy Event Counters log
0x20       GPL     R/O      1  Streaming performance log [OBS-8]
0x21       GPL     R/O      1  Write stream error log
0x22       GPL     R/O      1  Read stream error log
0x24       GPL     R/O     63  Current Device Internal Status Data log
0x80       GPL     R/W     63  Host vendor specific log
0x81-0x9f  GPL,SL  R/W     16  Host vendor specific log
0xe0       GPL,SL  R/W      1  SCT Command/Status
0xe1       GPL,SL  R/W      1  SCT Data Transfer

SMART Extended Comprehensive Error Log Version: 1 (1 sectors)
Device Error Count: 1
	CR     = Command Register
	FEATR  = Features Register
	COUNT  = Count (was: Sector Count) Register
	LBA_48 = Upper bytes of LBA High/Mid/Low Registers ]  ATA-8
	LH     = LBA High (was: Cylinder High) Register    ]   LBA
	LM     = LBA Mid (was: Cylinder Low) Register      ] Register
	LL     = LBA Low (was: Sector Number) Register     ]
	DV     = Device (was: Device/Head) Register
	DC     = Device Control Register
	ER     = Error register
	ST     = Status register
Powered_Up_Time is measured from power on, and printed as
DDd+hh:mm:SS.sss where DD=days, hh=hours, mm=minutes,
SS=sec, and sss=millisec. It "wraps" after 49.710 days.

Error 1 [0] occurred at disk power-on lifetime: 29870 hours (1244 days + 14 hours)
  When the command that caused the error occurred, the device was active or idle.

  After command completion occurred, registers were:
  ER -- ST COUNT  LBA_48  LH LM LL DV DC
  -- -- -- == -- == == == -- -- -- -- --
  84 -- 51 00 5d 00 00 00 d9 29 4b 00 00  Error: ICRC, ABRT at LBA = 0x00d9294b = 14231883

  Commands leading to the command that caused the error were:
  CR FEATR COUNT  LBA_48  LH LM LL DV DC  Powered_Up_Time  Command/Feature_Name
  -- == -- == -- == == == -- -- -- -- --  ---------------  --------------------
  61 03 ff 00 00 00 00 00 d9 25 a9 40 00     00:21:14.112  WRITE FPDMA QUEUED
  61 03 ff 00 00 00 00 00 d9 21 aa 40 00     00:21:14.108  WRITE FPDMA QUEUED
  61 03 ff 00 00 00 00 00 d9 1d ab 40 00     00:21:14.104  WRITE FPDMA QUEUED
  61 03 ff 00 00 00 00 00 d9 19 ac 40 00     00:21:14.101  WRITE FPDMA QUEUED
  61 03 ff 00 00 00 00 00 d9 15 ad 40 00     00:21:14.097  WRITE FPDMA QUEUED

SMART Extended Self-test Log Version: 1 (1 sectors)
Num  Test_Description    Status                  Remaining  LifeTime(hours)  LBA_of_first_error
# 1  Short offline       Completed without error       00%     30017         -
# 2  Extended offline    Completed without error       00%     29999         -

SMART Selective self-test log data structure revision number 1
 SPAN  MIN_LBA  MAX_LBA  CURRENT_TEST_STATUS
    1        0        0  Not_testing
    2        0        0  Not_testing
    3        0        0  Not_testing
    4        0        0  Not_testing
    5        0        0  Not_testing
Selective self-test flags (0x0):
  After scanning selected spans, do NOT read-scan remainder of disk.
If Selective self-test is pending on power-up, resume after 0 minute delay.

SCT Status Version:                  3
SCT Version (vendor specific):       256 (0x0100)
SCT Support Level:                   1
Device State:                        Active (0)
Current Temperature:                    34 Celsius
Power Cycle Min/Max Temperature:     27/34 Celsius
Lifetime    Min/Max Temperature:     21/47 Celsius
Under/Over Temperature Limit Count:   0/0

SCT Temperature History Version:     2
Temperature Sampling Period:         1 minute
Temperature Logging Interval:        1 minute
Min/Max recommended Temperature:      0/60 Celsius
Min/Max Temperature Limit:           -40/70 Celsius
Temperature History Size (Index):    128 (48)

Index    Estimated Time   Temperature Celsius
  49    2019-05-23 13:20    34  ***************
  50    2019-05-23 13:21    34  ***************
  51    2019-05-23 13:22    33  **************
 ...    ..(  6 skipped).    ..  **************
  58    2019-05-23 13:29    33  **************
  59    2019-05-23 13:30    34  ***************
 ...    ..(  3 skipped).    ..  ***************
  63    2019-05-23 13:34    34  ***************
  64    2019-05-23 13:35    33  **************
 ...    ..(  7 skipped).    ..  **************
  72    2019-05-23 13:43    33  **************
  73    2019-05-23 13:44    34  ***************
  74    2019-05-23 13:45    33  **************
 ...    ..(  3 skipped).    ..  **************
  78    2019-05-23 13:49    33  **************
  79    2019-05-23 13:50     ?  -
  80    2019-05-23 13:51    31  ************
  81    2019-05-23 13:52    31  ************
  82    2019-05-23 13:53    32  *************
 ...    ..(  9 skipped).    ..  *************
  92    2019-05-23 14:03    32  *************
  93    2019-05-23 14:04    33  **************
  94    2019-05-23 14:05    32  *************
  95    2019-05-23 14:06    33  **************
 ...    ..(  9 skipped).    ..  **************
 105    2019-05-23 14:16    33  **************
 106    2019-05-23 14:17     ?  -
 107    2019-05-23 14:18    30  ***********
 108    2019-05-23 14:19    30  ***********
 109    2019-05-23 14:20    31  ************
 ...    ..(  4 skipped).    ..  ************
 114    2019-05-23 14:25    31  ************
 115    2019-05-23 14:26    32  *************
 ...    ..(  5 skipped).    ..  *************
 121    2019-05-23 14:32    32  *************
 122    2019-05-23 14:33     ?  -
 123    2019-05-23 14:34     ?  -
 124    2019-05-23 14:35    27  ********
 125    2019-05-23 14:36    28  *********
 126    2019-05-23 14:37    28  *********
 127    2019-05-23 14:38    29  **********
 ...    ..(  2 skipped).    ..  **********
   2    2019-05-23 14:41    29  **********
   3    2019-05-23 14:42    30  ***********
   4    2019-05-23 14:43    30  ***********
   5    2019-05-23 14:44    30  ***********
   6    2019-05-23 14:45    31  ************
 ...    ..(  3 skipped).    ..  ************
  10    2019-05-23 14:49    31  ************
  11    2019-05-23 14:50    32  *************
 ...    ..(  7 skipped).    ..  *************
  19    2019-05-23 14:58    32  *************
  20    2019-05-23 14:59    33  **************
 ...    ..(  5 skipped).    ..  **************
  26    2019-05-23 15:05    33  **************
  27    2019-05-23 15:06    34  ***************
  28    2019-05-23 15:07    33  **************
 ...    ..(  3 skipped).    ..  **************
  32    2019-05-23 15:11    33  **************
  33    2019-05-23 15:12    34  ***************
 ...    ..( 14 skipped).    ..  ***************
  48    2019-05-23 15:27    34  ***************

SCT Error Recovery Control:
           Read:    140 (14.0 seconds)
          Write:    140 (14.0 seconds)

Device Statistics (GP Log 0x04)
Page  Offset Size        Value Flags Description
0x01  =====  =               =  ===  == General Statistics (rev 1) ==
0x01  0x008  4             124  ---  Lifetime Power-On Resets
0x01  0x010  4           30017  ---  Power-on Hours
0x01  0x018  6    223005734345  ---  Logical Sectors Written
0x01  0x020  6      1821984989  ---  Number of Write Commands
0x01  0x028  6   1037672941575  ---  Logical Sectors Read
0x01  0x030  6      6142558541  ---  Number of Read Commands
0x03  =====  =               =  ===  == Rotating Media Statistics (rev 1) ==
0x03  0x008  4           30006  ---  Spindle Motor Power-on Hours
0x03  0x010  4           30006  ---  Head Flying Hours
0x03  0x018  4             224  ---  Head Load Events
0x03  0x020  4               0  ---  Number of Reallocated Logical Sectors
0x03  0x028  4               1  ---  Read Recovery Attempts
0x03  0x030  4               0  ---  Number of Mechanical Start Failures
0x04  =====  =               =  ===  == General Errors Statistics (rev 1) ==
0x04  0x008  4               0  ---  Number of Reported Uncorrectable Errors
0x04  0x010  4               0  ---  Resets Between Cmd Acceptance and Completion
0x05  =====  =               =  ===  == Temperature Statistics (rev 1) ==
0x05  0x008  1              34  ---  Current Temperature
0x05  0x010  1              34  N--  Average Short Term Temperature
0x05  0x018  1              35  N--  Average Long Term Temperature
0x05  0x020  1              47  ---  Highest Temperature
0x05  0x028  1              21  ---  Lowest Temperature
0x05  0x030  1              41  N--  Highest Average Short Term Temperature
0x05  0x038  1              25  N--  Lowest Average Short Term Temperature
0x05  0x040  1              37  N--  Highest Average Long Term Temperature
0x05  0x048  1              25  N--  Lowest Average Long Term Temperature
0x05  0x050  4               0  ---  Time in Over-Temperature
0x05  0x058  1              60  ---  Specified Maximum Operating Temperature
0x05  0x060  4               0  ---  Time in Under-Temperature
0x05  0x068  1               0  ---  Specified Minimum Operating Temperature
0x06  =====  =               =  ===  == Transport Statistics (rev 1) ==
0x06  0x008  4          676413  ---  Number of Hardware Resets
0x06  0x010  4             270  ---  Number of ASR Events
0x06  0x018  4               1  ---  Number of Interface CRC Errors
                                |||_ C monitored condition met
                                ||__ D supports DSN
                                |___ N normalized value

Pending Defects log (GP Log 0x0c) not supported

SATA Phy Event Counters (GP Log 0x11)
ID      Size     Value  Description
0x0001  2            0  Command failed due to ICRC error
0x0002  2            0  R_ERR response for data FIS
0x0003  2            0  R_ERR response for device-to-host data FIS
0x0004  2            0  R_ERR response for host-to-device data FIS
0x0005  2            0  R_ERR response for non-data FIS
0x0006  2            0  R_ERR response for device-to-host non-data FIS
0x0007  2            0  R_ERR response for host-to-device non-data FIS
0x0009  2            8  Transition from drive PhyRdy to drive PhyNRdy
0x000a  2            6  Device-to-host register FISes sent due to a COMRESET
0x000b  2            0  CRC errors within host-to-device FIS
0x000d  2            0  Non-CRC errors within host-to-device FIS

