smartctl 6.5 2016-01-24 r4214 [i686-linux-4.4.0-137-generic] (local build)
Copyright (C) 2002-16, Bruce Allen, Christian Franke, www.smartmontools.org

=== START OF INFORMATION SECTION ===
Device Model:     TOSHIBA MQ01ACF050
Serial Number:    56F9P0GLT
LU WWN Device Id: 5 000039 702585d97
Firmware Version: AV0A1C
User Capacity:    500.107.862.016 bytes [500 GB]
Sector Sizes:     512 bytes logical, 4096 bytes physical
Rotation Rate:    7200 rpm
Form Factor:      2.5 inches
Device is:        Not in smartctl database [for details use: -P showall]
ATA Version is:   ATA8-ACS (minor revision not indicated)
SATA Version is:  SATA 3.0, 6.0 Gb/s (current: 1.5 Gb/s)
Local Time is:    Sat Oct 20 13:08:30 2018 CEST
SMART support is: Available - device has SMART capability.
SMART support is: Enabled
AAM feature is:   Unavailable
APM level is:     254 (maximum performance)
Rd look-ahead is: Enabled
Write cache is:   Enabled
ATA Security is:  Disabled, NOT FROZEN [SEC1]
Wt Cache Reorder: Enabled

=== START OF READ SMART DATA SECTION ===
SMART overall-health self-assessment test result: PASSED

General SMART Values:
Offline data collection status:  (0x85)	Offline data collection activity
					was aborted by an interrupting command from host.
					Auto Offline Data Collection: Enabled.
Self-test execution status:      (   0)	The previous self-test routine completed
					without error or no self-test has ever 
					been run.
Total time to complete Offline 
data collection: 		(  120) seconds.
Offline data collection
capabilities: 			 (0x51) SMART execute Offline immediate.
					No Auto Offline data collection support.
					Suspend Offline collection upon new
					command.
					No Offline surface scan supported.
					Self-test supported.
					No Conveyance Self-test supported.
					Selective Self-test supported.
SMART capabilities:            (0x0003)	Saves SMART data before entering
					power-saving mode.
					Supports SMART auto save timer.
Error logging capability:        (0x01)	Error logging supported.
					General Purpose Logging supported.
Short self-test routine 
recommended polling time: 	 (   2) minutes.
Extended self-test routine
recommended polling time: 	 (  84) minutes.
SCT capabilities: 	       (0x003d)	SCT Status supported.
					SCT Error Recovery Control supported.
					SCT Feature Control supported.
					SCT Data Table supported.

SMART Attributes Data Structure revision number: 16
Vendor Specific SMART Attributes with Thresholds:
ID# ATTRIBUTE_NAME          FLAGS    VALUE WORST THRESH FAIL RAW_VALUE
  1 Raw_Read_Error_Rate     POSR-K   100   100   050    -    0
  2 Throughput_Performance  POS--K   100   100   050    -    0
  3 Spin_Up_Time            PO---K   100   100   002    -    2001
  4 Start_Stop_Count        -O--CK   100   100   000    -    5232
  5 Reallocated_Sector_Ct   PO--CK   100   100   010    -    0
  7 Seek_Error_Rate         POSR-K   100   100   050    -    0
  8 Seek_Time_Performance   P-S--K   100   100   050    -    0
  9 Power_On_Hours          -O--CK   077   077   000    -    9399
 10 Spin_Retry_Count        PO--CK   204   100   030    -    0
 12 Power_Cycle_Count       -O--CK   100   100   000    -    5232
183 Runtime_Bad_Block       -O--CK   100   100   001    -    5653
184 End-to-End_Error        PO--CK   100   100   097    -    0
185 Unknown_Attribute       -O--CK   100   100   001    -    65535
187 Reported_Uncorrect      -O--CK   100   100   000    -    0
188 Command_Timeout         -O--CK   100   099   000    -    1
189 High_Fly_Writes         -O-RCK   100   100   001    -    0
190 Airflow_Temperature_Cel -O---K   062   048   040    -    38 (Min/Max 37/39)
191 G-Sense_Error_Rate      -O--CK   100   100   000    -    1
192 Power-Off_Retract_Count -O---K   090   090   000    -    340005956
193 Load_Cycle_Count        -O--CK   098   098   000    -    20154
194 Temperature_Celsius     -O---K   062   048   040    -    38 (Min/Max 37/39)
196 Reallocated_Event_Count -O--CK   100   100   000    -    0
197 Current_Pending_Sector  -O--CK   100   100   000    -    0
199 UDMA_CRC_Error_Count    -O--CK   200   253   000    -    0
                            ||||||_ K auto-keep
                            |||||__ C event count
                            ||||___ R error rate
                            |||____ S speed/performance
                            ||_____ O updated online
                            |______ P prefailure warning

General Purpose Log Directory Version 1
SMART           Log Directory Version 1 [multi-sector log support]
Address    Access  R/W   Size  Description
0x00       GPL,SL  R/O      1  Log Directory
0x01           SL  R/O      1  Summary SMART error log
0x02           SL  R/O     51  Comprehensive SMART error log
0x03       GPL     R/O     64  Ext. Comprehensive SMART error log
0x04       GPL,SL  R/O      8  Device Statistics log
0x06           SL  R/O      1  SMART self-test log
0x07       GPL     R/O      1  Extended self-test log
0x09           SL  R/W      1  Selective self-test log
0x10       GPL     R/O      1  SATA NCQ Queued Error log
0x11       GPL     R/O      1  SATA Phy Event Counters log
0x80-0x9f  GPL,SL  R/W     16  Host vendor specific log
0xb6       GPL     VS    8191  Device vendor specific log
0xe0       GPL,SL  R/W      1  SCT Command/Status
0xe1       GPL,SL  R/W      1  SCT Data Transfer

SMART Extended Comprehensive Error Log Version: 1 (64 sectors)
No Errors Logged

SMART Extended Self-test Log Version: 1 (1 sectors)
Num  Test_Description    Status                  Remaining  LifeTime(hours)  LBA_of_first_error
# 1  Short offline       Completed without error       00%      9399         -
# 2  Short offline       Completed without error       00%      9398         -
# 3  Extended offline    Completed without error       00%       892         -
# 4  Short offline       Completed without error       00%       890         -

SMART Selective self-test log data structure revision number 1
 SPAN  MIN_LBA  MAX_LBA  CURRENT_TEST_STATUS
    1        0        0  Not_testing
    2        0        0  Not_testing
    3        0        0  Not_testing
    4        0        0  Not_testing
    5        0        0  Not_testing
Selective self-test flags (0x0):
  After scanning selected spans, do NOT read-scan remainder of disk.
If Selective self-test is pending on power-up, resume after 0 minute delay.

SCT Status Version:                  2
SCT Version (vendor specific):       1 (0x0001)
SCT Support Level:                   1
Device State:                        Active (0)
Current Temperature:                    38 Celsius
Power Cycle Min/Max Temperature:     37/39 Celsius
Lifetime    Min/Max Temperature:     15/52 Celsius
Under/Over Temperature Limit Count:   0/0

SCT Temperature History Version:     2
Temperature Sampling Period:         1 minute
Temperature Logging Interval:        1 minute
Min/Max recommended Temperature:      0/60 Celsius
Min/Max Temperature Limit:            0/60 Celsius
Temperature History Size (Index):    478 (14)

Index    Estimated Time   Temperature Celsius
  15    2018-10-20 05:11    38  *******************
 ...    ..(  2 skipped).    ..  *******************
  18    2018-10-20 05:14    38  *******************
  19    2018-10-20 05:15    37  ******************
  20    2018-10-20 05:16    38  *******************
  21    2018-10-20 05:17    37  ******************
  22    2018-10-20 05:18    37  ******************
  23    2018-10-20 05:19    38  *******************
  24    2018-10-20 05:20    38  *******************
  25    2018-10-20 05:21    37  ******************
 ...    ..(  4 skipped).    ..  ******************
  30    2018-10-20 05:26    37  ******************
  31    2018-10-20 05:27    38  *******************
  32    2018-10-20 05:28    37  ******************
  33    2018-10-20 05:29    37  ******************
  34    2018-10-20 05:30    38  *******************
  35    2018-10-20 05:31    38  *******************
  36    2018-10-20 05:32    37  ******************
 ...    ..(  8 skipped).    ..  ******************
  45    2018-10-20 05:41    37  ******************
  46    2018-10-20 05:42    38  *******************
  47    2018-10-20 05:43    37  ******************
 ...    ..(  2 skipped).    ..  ******************
  50    2018-10-20 05:46    37  ******************
  51    2018-10-20 05:47    38  *******************
  52    2018-10-20 05:48    38  *******************
  53    2018-10-20 05:49    37  ******************
  54    2018-10-20 05:50    38  *******************
  55    2018-10-20 05:51    37  ******************
 ...    ..(  2 skipped).    ..  ******************
  58    2018-10-20 05:54    37  ******************
  59    2018-10-20 05:55    38  *******************
  60    2018-10-20 05:56    37  ******************
 ...    ..(  5 skipped).    ..  ******************
  66    2018-10-20 06:02    37  ******************
  67    2018-10-20 06:03    38  *******************
 ...    ..(  2 skipped).    ..  *******************
  70    2018-10-20 06:06    38  *******************
  71    2018-10-20 06:07    37  ******************
  72    2018-10-20 06:08    37  ******************
  73    2018-10-20 06:09    38  *******************
  74    2018-10-20 06:10    38  *******************
  75    2018-10-20 06:11    37  ******************
  76    2018-10-20 06:12    37  ******************
  77    2018-10-20 06:13    38  *******************
  78    2018-10-20 06:14    38  *******************
  79    2018-10-20 06:15    37  ******************
 ...    ..(  9 skipped).    ..  ******************
  89    2018-10-20 06:25    37  ******************
  90    2018-10-20 06:26    38  *******************
 ...    ..(  4 skipped).    ..  *******************
  95    2018-10-20 06:31    38  *******************
  96    2018-10-20 06:32    37  ******************
  97    2018-10-20 06:33    38  *******************
  98    2018-10-20 06:34    37  ******************
  99    2018-10-20 06:35    37  ******************
 100    2018-10-20 06:36    38  *******************
 101    2018-10-20 06:37    37  ******************
 102    2018-10-20 06:38    38  *******************
 103    2018-10-20 06:39    37  ******************
 ...    ..( 72 skipped).    ..  ******************
 176    2018-10-20 07:52    37  ******************
 177    2018-10-20 07:53    38  *******************
 178    2018-10-20 07:54    37  ******************
 ...    ..(189 skipped).    ..  ******************
 368    2018-10-20 11:04    37  ******************
 369    2018-10-20 11:05    38  *******************
 ...    ..(  9 skipped).    ..  *******************
 379    2018-10-20 11:15    38  *******************
 380    2018-10-20 11:16    37  ******************
 ...    ..( 40 skipped).    ..  ******************
 421    2018-10-20 11:57    37  ******************
 422    2018-10-20 11:58    38  *******************
 423    2018-10-20 11:59    37  ******************
 ...    ..( 13 skipped).    ..  ******************
 437    2018-10-20 12:13    37  ******************
 438    2018-10-20 12:14    38  *******************
 439    2018-10-20 12:15    37  ******************
 440    2018-10-20 12:16    38  *******************
 441    2018-10-20 12:17    38  *******************
 442    2018-10-20 12:18    37  ******************
 ...    ..(  7 skipped).    ..  ******************
 450    2018-10-20 12:26    37  ******************
 451    2018-10-20 12:27    38  *******************
 452    2018-10-20 12:28    38  *******************
 453    2018-10-20 12:29    39  ********************
 454    2018-10-20 12:30    38  *******************
 ...    ..( 35 skipped).    ..  *******************
  12    2018-10-20 13:06    38  *******************
  13    2018-10-20 13:07    39  ********************
  14    2018-10-20 13:08    39  ********************

SCT Error Recovery Control:
           Read: Disabled
          Write: Disabled

Device Statistics (GP Log 0x04)
Page  Offset Size        Value Flags Description
0x01  =====  =               =  ===  == General Statistics (rev 2) ==
0x01  0x008  4            5232  ---  Lifetime Power-On Resets
0x01  0x010  4            9399  ---  Power-on Hours
0x01  0x018  6     10418627435  ---  Logical Sectors Written
0x01  0x020  6        83758313  ---  Number of Write Commands
0x01  0x028  6     13848300295  ---  Logical Sectors Read
0x01  0x030  6       212929975  ---  Number of Read Commands
0x02  =====  =               =  ===  == Free-Fall Statistics (rev 1) ==
0x02  0x010  4               1  ---  Overlimit Shock Events
0x03  =====  =               =  ===  == Rotating Media Statistics (rev 1) ==
0x03  0x008  4            9397  ---  Spindle Motor Power-on Hours
0x03  0x010  4            8744  ---  Head Flying Hours
0x03  0x018  4           20154  ---  Head Load Events
0x03  0x020  4               0  ---  Number of Reallocated Logical Sectors
0x03  0x028  4               0  ---  Read Recovery Attempts
0x03  0x030  4               0  ---  Number of Mechanical Start Failures
0x04  =====  =               =  ===  == General Errors Statistics (rev 1) ==
0x04  0x008  4               0  ---  Number of Reported Uncorrectable Errors
0x04  0x010  4               1  ---  Resets Between Cmd Acceptance and Completion
0x05  =====  =               =  ===  == Temperature Statistics (rev 1) ==
0x05  0x008  1              38  ---  Current Temperature
0x05  0x010  1              37  N--  Average Short Term Temperature
0x05  0x018  1              41  N--  Average Long Term Temperature
0x05  0x020  1              52  ---  Highest Temperature
0x05  0x028  1              15  ---  Lowest Temperature
0x05  0x030  1              47  N--  Highest Average Short Term Temperature
0x05  0x038  1              29  N--  Lowest Average Short Term Temperature
0x05  0x040  1              44  N--  Highest Average Long Term Temperature
0x05  0x048  1              30  N--  Lowest Average Long Term Temperature
0x05  0x050  4               0  ---  Time in Over-Temperature
0x05  0x058  1              60  ---  Specified Maximum Operating Temperature
0x05  0x060  4               0  ---  Time in Under-Temperature
0x05  0x068  1               0  ---  Specified Minimum Operating Temperature
0x06  =====  =               =  ===  == Transport Statistics (rev 1) ==
0x06  0x008  4             499  ---  Number of Hardware Resets
0x06  0x018  4               0  ---  Number of Interface CRC Errors
0x07  =====  =               =  ===  == Solid State Device Statistics (rev 1) ==
0x07  0x008  1              15  N--  Percentage Used Endurance Indicator
                                |||_ C monitored condition met
                                ||__ D supports DSN
                                |___ N normalized value

SATA Phy Event Counters (GP Log 0x11)
ID      Size     Value  Description
0x0001  4            0  Command failed due to ICRC error
0x0002  4            0  R_ERR response for data FIS
0x0003  4            0  R_ERR response for device-to-host data FIS
0x0004  4            0  R_ERR response for host-to-device data FIS
0x0005  4            0  R_ERR response for non-data FIS
0x0006  4            0  R_ERR response for device-to-host non-data FIS
0x0007  4            0  R_ERR response for host-to-device non-data FIS
0x0008  4            0  Device-to-host non-data FIS retries
0x0009  4            4  Transition from drive PhyRdy to drive PhyNRdy
0x000a  4            4  Device-to-host register FISes sent due to a COMRESET
0x000b  4            0  CRC errors within host-to-device FIS
0x000d  4            0  Non-CRC errors within host-to-device FIS
0x000f  4            0  R_ERR response for host-to-device data FIS, CRC
0x0010  4            0  R_ERR response for host-to-device data FIS, non-CRC
0x0012  4            0  R_ERR response for host-to-device non-data FIS, CRC
0x0013  4            0  R_ERR response for host-to-device non-data FIS, non-CRC

