smartctl 7.2 2020-12-30 r5155 [x86_64-linux-5.9.0-0.bpo.5-amd64] (local build)
Copyright (C) 2002-20, Bruce Allen, Christian Franke, www.smartmontools.org

=== START OF INFORMATION SECTION ===
Device Model:     WD3000FYYZ-23UL      81Y9799 81Y3865IBM
Firmware Version: WD40
User Capacity:    3,000,592,982,016 bytes [3.00 TB]
Sector Size:      512 bytes logical/physical
Rotation Rate:    7200 rpm
Device is:        Not in smartctl database [for details use: -P showall]
ATA Version is:   ATA8-ACS (minor revision not indicated)
SATA Version is:  SATA 3.0, 6.0 Gb/s (current: 6.0 Gb/s)
Local Time is:    Sat Jan 23 12:16:40 2021 CET
SMART support is: Available - device has SMART capability.
SMART support is: Enabled
AAM feature is:   Unavailable
APM level is:     128 (minimum power consumption without standby)
Rd look-ahead is: Enabled
Write cache is:   Enabled
DSN feature is:   Unavailable
ATA Security is:  Disabled, NOT FROZEN [SEC1]
Wt Cache Reorder: Enabled

=== START OF READ SMART DATA SECTION ===
SMART overall-health self-assessment test result: PASSED

General SMART Values:
Offline data collection status:  (0x02)	Offline data collection activity
					was completed without error.
					Auto Offline Data Collection: Disabled.
Self-test execution status:      ( 246)	Self-test routine in progress...
					60% of test remaining.
Total time to complete Offline 
data collection: 		(36000) seconds.
Offline data collection
capabilities: 			 (0x7b) SMART execute Offline immediate.
					Auto Offline data collection on/off support.
					Suspend Offline collection upon new
					command.
					Offline surface scan supported.
					Self-test supported.
					Conveyance Self-test supported.
					Selective Self-test supported.
SMART capabilities:            (0x0003)	Saves SMART data before entering
					power-saving mode.
					Supports SMART auto save timer.
Error logging capability:        (0x01)	Error logging supported.
					General Purpose Logging supported.
Short self-test routine 
recommended polling time: 	 (   2) minutes.
Extended self-test routine
recommended polling time: 	 ( 389) minutes.
Conveyance self-test routine
recommended polling time: 	 (   5) minutes.
SCT capabilities: 	       (0x70bd)	SCT Status supported.
					SCT Error Recovery Control supported.
					SCT Feature Control supported.
					SCT Data Table supported.

SMART Attributes Data Structure revision number: 16
Vendor Specific SMART Attributes with Thresholds:
ID# ATTRIBUTE_NAME          FLAGS    VALUE WORST THRESH FAIL RAW_VALUE
  1 Raw_Read_Error_Rate     POSR-K   200   191   051    -    0
  3 Spin_Up_Time            POS--K   227   227   021    -    7616
  4 Start_Stop_Count        -O--CK   100   100   000    -    45
  5 Reallocated_Sector_Ct   PO--CK   199   199   140    -    53
  7 Seek_Error_Rate         -OSR-K   200   200   000    -    0
  9 Power_On_Hours          -O--CK   072   072   000    -    20557
 10 Spin_Retry_Count        -O--CK   100   253   000    -    0
 11 Calibration_Retry_Count -O--CK   100   253   000    -    0
 12 Power_Cycle_Count       -O--CK   100   100   000    -    45
 16 Unknown_Attribute       -O---K   047   153   000    -    2573469547285
191 G-Sense_Error_Rate      -O--CK   100   100   000    -    0
192 Power-Off_Retract_Count -O--CK   200   200   000    -    43
193 Load_Cycle_Count        -O--CK   200   200   000    -    1
194 Temperature_Celsius     -O---K   116   111   000    -    36
195 Hardware_ECC_Recovered  -OS-CK   200   200   000    -    0
196 Reallocated_Event_Count -O--CK   199   199   000    -    1
197 Current_Pending_Sector  -O--CK   200   200   000    -    0
198 Offline_Uncorrectable   ----CK   200   200   000    -    0
199 UDMA_CRC_Error_Count    -O--CK   200   200   000    -    0
200 Multi_Zone_Error_Rate   ---R--   200   200   000    -    0
                            ||||||_ K auto-keep
                            |||||__ C event count
                            ||||___ R error rate
                            |||____ S speed/performance
                            ||_____ O updated online
                            |______ P prefailure warning

General Purpose Log Directory Version 1
SMART           Log Directory Version 1 [multi-sector log support]
Address    Access  R/W   Size  Description
0x00       GPL,SL  R/O      1  Log Directory
0x01           SL  R/O      1  Summary SMART error log
0x02           SL  R/O      5  Comprehensive SMART error log
0x03       GPL     R/O      6  Ext. Comprehensive SMART error log
0x04       GPL,SL  R/O      8  Device Statistics log
0x06           SL  R/O      1  SMART self-test log
0x07       GPL     R/O      1  Extended self-test log
0x08       GPL     R/O      2  Power Conditions log
0x09           SL  R/W      1  Selective self-test log
0x10       GPL     R/O      1  NCQ Command Error log
0x11       GPL     R/O      1  SATA Phy Event Counters log
0x24       GPL     R/O      1  Current Device Internal Status Data log
0x30       GPL,SL  R/O      9  IDENTIFY DEVICE data log
0x80-0x9f  GPL,SL  R/W     16  Host vendor specific log
0xa0-0xa7  GPL,SL  VS      16  Device vendor specific log
0xa8-0xb1  GPL,SL  VS       1  Device vendor specific log
0xb2       GPL     VS   65535  Device vendor specific log
0xb2       SL      VS     255  Device vendor specific log
0xb3-0xb7  GPL,SL  VS       1  Device vendor specific log
0xbd       GPL,SL  VS       1  Device vendor specific log
0xc0       GPL,SL  VS       1  Device vendor specific log
0xc1       GPL     VS      24  Device vendor specific log
0xd0       GPL     VS       1  Device vendor specific log
0xe0       GPL,SL  R/W      1  SCT Command/Status
0xe1       GPL,SL  R/W      1  SCT Data Transfer

SMART Extended Comprehensive Error Log Version: 1 (6 sectors)
Device Error Count: 47 (device log contains only the most recent 24 errors)
	CR     = Command Register
	FEATR  = Features Register
	COUNT  = Count (was: Sector Count) Register
	LBA_48 = Upper bytes of LBA High/Mid/Low Registers ]  ATA-8
	LH     = LBA High (was: Cylinder High) Register    ]   LBA
	LM     = LBA Mid (was: Cylinder Low) Register      ] Register
	LL     = LBA Low (was: Sector Number) Register     ]
	DV     = Device (was: Device/Head) Register
	DC     = Device Control Register
	ER     = Error register
	ST     = Status register
Powered_Up_Time is measured from power on, and printed as
DDd+hh:mm:SS.sss where DD=days, hh=hours, mm=minutes,
SS=sec, and sss=millisec. It "wraps" after 49.710 days.

Error 47 [22] occurred at disk power-on lifetime: 20495 hours (853 days + 23 hours)
  When the command that caused the error occurred, the device was active or idle.

  After command completion occurred, registers were:
  ER -- ST COUNT  LBA_48  LH LM LL DV DC
  -- -- -- == -- == == == -- -- -- -- --
  40 -- 51 00 00 00 01 17 3a ed 13 40 00  Error: UNC at LBA = 0x1173aed13 = 4684705043

  Commands leading to the command that caused the error were:
  CR FEATR COUNT  LBA_48  LH LM LL DV DC  Powered_Up_Time  Command/Feature_Name
  -- == -- == -- == == == -- -- -- -- --  ---------------  --------------------
  60 01 00 00 00 00 01 17 3a ed 00 40 00  1d+16:37:35.435  READ FPDMA QUEUED
  60 01 00 00 00 00 01 17 3a ec 00 40 00  1d+16:37:35.434  READ FPDMA QUEUED
  60 01 00 00 00 00 01 17 3a eb 00 40 00  1d+16:37:35.433  READ FPDMA QUEUED
  60 01 00 00 00 00 01 17 3a ea 00 40 00  1d+16:37:35.432  READ FPDMA QUEUED
  60 01 00 00 00 00 01 17 3a e9 00 40 00  1d+16:37:35.430  READ FPDMA QUEUED

Error 46 [21] occurred at disk power-on lifetime: 18318 hours (763 days + 6 hours)
  When the command that caused the error occurred, the device was active or idle.

  After command completion occurred, registers were:
  ER -- ST COUNT  LBA_48  LH LM LL DV DC
  -- -- -- == -- == == == -- -- -- -- --
  40 -- 51 10 00 00 01 17 3a bc 97 40 00  Error: UNC at LBA = 0x1173abc97 = 4684692631

  Commands leading to the command that caused the error were:
  CR FEATR COUNT  LBA_48  LH LM LL DV DC  Powered_Up_Time  Command/Feature_Name
  -- == -- == -- == == == -- -- -- -- --  ---------------  --------------------
  42 00 00 10 00 00 01 17 3a b0 00 40 00 23d+06:42:45.164  READ VERIFY SECTOR(S) EXT
  42 00 00 10 00 00 01 17 3a a0 00 40 00 23d+06:42:45.070  READ VERIFY SECTOR(S) EXT
  42 00 00 10 00 00 01 17 3a 90 00 40 00 23d+06:42:45.051  READ VERIFY SECTOR(S) EXT
  42 00 00 10 00 00 01 17 3a 80 00 40 00 23d+06:42:45.036  READ VERIFY SECTOR(S) EXT
  42 00 00 10 00 00 01 17 3a 70 00 40 00 23d+06:42:45.020  READ VERIFY SECTOR(S) EXT

Error 45 [20] occurred at disk power-on lifetime: 17815 hours (742 days + 7 hours)
  When the command that caused the error occurred, the device was active or idle.

  After command completion occurred, registers were:
  ER -- ST COUNT  LBA_48  LH LM LL DV DC
  -- -- -- == -- == == == -- -- -- -- --
  40 -- 51 10 00 00 01 17 3a b5 b8 40 00  Error: UNC at LBA = 0x1173ab5b8 = 4684690872

  Commands leading to the command that caused the error were:
  CR FEATR COUNT  LBA_48  LH LM LL DV DC  Powered_Up_Time  Command/Feature_Name
  -- == -- == -- == == == -- -- -- -- --  ---------------  --------------------
  42 00 00 10 00 00 01 17 3a b0 00 40 00  2d+07:40:23.347  READ VERIFY SECTOR(S) EXT
  42 00 00 10 00 00 01 17 3a a0 00 40 00  2d+07:40:23.253  READ VERIFY SECTOR(S) EXT
  42 00 00 10 00 00 01 17 3a 90 00 40 00  2d+07:40:23.234  READ VERIFY SECTOR(S) EXT
  42 00 00 10 00 00 01 17 3a 80 00 40 00  2d+07:40:23.218  READ VERIFY SECTOR(S) EXT
  42 00 00 10 00 00 01 17 3a 70 00 40 00  2d+07:40:23.202  READ VERIFY SECTOR(S) EXT

Error 44 [19] occurred at disk power-on lifetime: 17809 hours (742 days + 1 hours)
  When the command that caused the error occurred, the device was active or idle.

  After command completion occurred, registers were:
  ER -- ST COUNT  LBA_48  LH LM LL DV DC
  -- -- -- == -- == == == -- -- -- -- --
  40 -- 51 00 00 00 01 17 1d 43 a7 40 00  Error: UNC at LBA = 0x1171d43a7 = 4682761127

  Commands leading to the command that caused the error were:
  CR FEATR COUNT  LBA_48  LH LM LL DV DC  Powered_Up_Time  Command/Feature_Name
  -- == -- == -- == == == -- -- -- -- --  ---------------  --------------------
  60 01 00 00 00 00 01 17 1d 43 00 40 00  2d+01:08:38.669  READ FPDMA QUEUED
  60 01 00 00 00 00 01 17 1d 42 00 40 00  2d+01:08:38.668  READ FPDMA QUEUED
  60 01 00 00 00 00 01 17 1d 41 00 40 00  2d+01:08:38.667  READ FPDMA QUEUED
  60 01 00 00 00 00 01 17 1d 40 00 40 00  2d+01:08:38.666  READ FPDMA QUEUED
  60 01 00 00 00 00 01 17 1d 3f 00 40 00  2d+01:08:38.664  READ FPDMA QUEUED

Error 43 [18] occurred at disk power-on lifetime: 17662 hours (735 days + 22 hours)
  When the command that caused the error occurred, the device was active or idle.

  After command completion occurred, registers were:
  ER -- ST COUNT  LBA_48  LH LM LL DV DC
  -- -- -- == -- == == == -- -- -- -- --
  40 -- 51 00 00 00 01 17 3a b5 b8 40 00  Error: UNC at LBA = 0x1173ab5b8 = 4684690872

  Commands leading to the command that caused the error were:
  CR FEATR COUNT  LBA_48  LH LM LL DV DC  Powered_Up_Time  Command/Feature_Name
  -- == -- == -- == == == -- -- -- -- --  ---------------  --------------------
  60 01 00 00 08 00 01 17 3a b6 00 40 00 45d+14:59:02.371  READ FPDMA QUEUED
  60 01 00 00 00 00 01 17 3a b5 00 40 00 45d+14:59:02.368  READ FPDMA QUEUED
  60 01 00 00 00 00 01 17 3a b3 00 40 00 45d+14:59:02.362  READ FPDMA QUEUED
  60 01 00 00 00 00 01 17 3a b2 00 40 00 45d+14:59:02.359  READ FPDMA QUEUED
  60 01 00 00 08 00 01 17 3a b1 00 40 00 45d+14:59:02.357  READ FPDMA QUEUED

Error 42 [17] occurred at disk power-on lifetime: 17641 hours (735 days + 1 hours)
  When the command that caused the error occurred, the device was active or idle.

  After command completion occurred, registers were:
  ER -- ST COUNT  LBA_48  LH LM LL DV DC
  -- -- -- == -- == == == -- -- -- -- --
  40 -- 51 00 00 00 01 17 1d 28 2a 40 00  Error: UNC at LBA = 0x1171d282a = 4682754090

  Commands leading to the command that caused the error were:
  CR FEATR COUNT  LBA_48  LH LM LL DV DC  Powered_Up_Time  Command/Feature_Name
  -- == -- == -- == == == -- -- -- -- --  ---------------  --------------------
  60 01 00 00 00 00 01 17 1d 28 00 40 00 44d+18:16:44.446  READ FPDMA QUEUED
  60 01 00 00 00 00 01 17 1d 27 00 40 00 44d+18:16:44.445  READ FPDMA QUEUED
  60 01 00 00 00 00 01 17 1d 26 00 40 00 44d+18:16:44.443  READ FPDMA QUEUED
  60 01 00 00 00 00 01 17 1d 25 00 40 00 44d+18:16:44.442  READ FPDMA QUEUED
  60 01 00 00 00 00 01 17 1d 24 00 40 00 44d+18:16:44.441  READ FPDMA QUEUED

Error 41 [16] occurred at disk power-on lifetime: 16641 hours (693 days + 9 hours)
  When the command that caused the error occurred, the device was active or idle.

  After command completion occurred, registers were:
  ER -- ST COUNT  LBA_48  LH LM LL DV DC
  -- -- -- == -- == == == -- -- -- -- --
  40 -- 51 00 00 00 01 17 1d 05 6c 40 00  Error: UNC at LBA = 0x1171d056c = 4682745196

  Commands leading to the command that caused the error were:
  CR FEATR COUNT  LBA_48  LH LM LL DV DC  Powered_Up_Time  Command/Feature_Name
  -- == -- == -- == == == -- -- -- -- --  ---------------  --------------------
  60 00 98 00 08 00 01 17 1d 05 68 40 00  3d+01:50:29.423  READ FPDMA QUEUED
  60 00 68 00 00 00 01 17 1d 05 00 40 00  3d+01:50:29.423  READ FPDMA QUEUED
  42 00 00 10 00 00 00 21 d6 d0 00 40 00  3d+01:50:29.394  READ VERIFY SECTOR(S) EXT
  60 01 00 00 00 00 01 17 1d 08 00 40 00  3d+01:50:29.392  READ FPDMA QUEUED
  60 00 6c 00 10 00 01 17 1d 05 00 40 00  3d+01:50:29.369  READ FPDMA QUEUED

Error 40 [15] occurred at disk power-on lifetime: 16641 hours (693 days + 9 hours)
  When the command that caused the error occurred, the device was active or idle.

  After command completion occurred, registers were:
  ER -- ST COUNT  LBA_48  LH LM LL DV DC
  -- -- -- == -- == == == -- -- -- -- --
  40 -- 51 00 00 00 01 17 1d 05 6c 40 00  Error: UNC at LBA = 0x1171d056c = 4682745196

  Commands leading to the command that caused the error were:
  CR FEATR COUNT  LBA_48  LH LM LL DV DC  Powered_Up_Time  Command/Feature_Name
  -- == -- == -- == == == -- -- -- -- --  ---------------  --------------------
  60 01 00 00 00 00 01 17 1d 05 00 40 00  3d+01:50:27.549  READ FPDMA QUEUED
  60 01 00 00 00 00 01 17 1d 04 00 40 00  3d+01:50:27.545  READ FPDMA QUEUED
  60 01 00 00 00 00 01 17 1d 03 00 40 00  3d+01:50:27.542  READ FPDMA QUEUED
  60 01 00 00 00 00 01 17 1d 01 00 40 00  3d+01:50:27.536  READ FPDMA QUEUED
  60 01 00 00 08 00 01 17 1d 00 00 40 00  3d+01:50:27.535  READ FPDMA QUEUED

SMART Extended Self-test Log Version: 1 (1 sectors)
Num  Test_Description    Status                  Remaining  LifeTime(hours)  LBA_of_first_error
# 1  Short offline       Self-test routine in progress 60%     20557         -
# 2  Extended offline    Completed without error       00%     20548         -

SMART Selective self-test log data structure revision number 1
 SPAN  MIN_LBA  MAX_LBA  CURRENT_TEST_STATUS
    1        0        0  Not_testing
    2        0        0  Not_testing
    3        0        0  Not_testing
    4        0        0  Not_testing
    5        0        0  Not_testing
Selective self-test flags (0x0):
  After scanning selected spans, do NOT read-scan remainder of disk.
If Selective self-test is pending on power-up, resume after 0 minute delay.

SCT Status Version:                  3
SCT Version (vendor specific):       258 (0x0102)
Device State:                        DST executing in background (3)
Current Temperature:                    36 Celsius
Power Cycle Min/Max Temperature:     31/40 Celsius
Lifetime    Min/Max Temperature:     21/41 Celsius
Specified Max Operating Temperature:    60 Celsius
Under/Over Temperature Limit Count:   0/0
Vendor specific:
01 00 00 00 00 00 00 00 00 00 00 00 00 00 00 00
00 00 00 00 00 00 00 00 00 00 00 00 00 00 00 00

SCT Temperature History Version:     2
Temperature Sampling Period:         1 minute
Temperature Logging Interval:        1 minute
Min/Max recommended Temperature:      0/60 Celsius
Min/Max Temperature Limit:           -41/85 Celsius
Temperature History Size (Index):    478 (244)

Index    Estimated Time   Temperature Celsius
 245    2021-01-23 04:19    36  *****************
 ...    ..(476 skipped).    ..  *****************
 244    2021-01-23 12:16    36  *****************

SCT Error Recovery Control:
           Read:     70 (7.0 seconds)
          Write:     70 (7.0 seconds)

Device Statistics (GP Log 0x04)
Page  Offset Size        Value Flags Description
0x01  =====  =               =  ===  == General Statistics (rev 2) ==
0x01  0x008  4              45  ---  Lifetime Power-On Resets
0x01  0x010  4           20557  ---  Power-on Hours
0x01  0x018  6   1556262443474  ---  Logical Sectors Written
0x01  0x020  6       942684715  ---  Number of Write Commands
0x01  0x028  6   1017207103832  ---  Logical Sectors Read
0x01  0x030  6      4152049099  ---  Number of Read Commands
0x01  0x048  2            4791  N--  Workload Utilization
0x03  =====  =               =  ===  == Rotating Media Statistics (rev 1) ==
0x03  0x008  4           20377  ---  Spindle Motor Power-on Hours
0x03  0x010  4           20377  ---  Head Flying Hours
0x03  0x018  4              45  ---  Head Load Events
0x03  0x020  4             199  N--  Number of Reallocated Logical Sectors
0x03  0x028  4             528  ---  Read Recovery Attempts
0x03  0x030  4               0  ---  Number of Mechanical Start Failures
0x04  =====  =               =  ===  == General Errors Statistics (rev 1) ==
0x04  0x008  4              47  ---  Number of Reported Uncorrectable Errors
0x04  0x010  4              39  ---  Resets Between Cmd Acceptance and Completion
0x05  =====  =               =  ===  == Temperature Statistics (rev 1) ==
0x05  0x008  1              36  ---  Current Temperature
0x05  0x010  1              36  ---  Average Short Term Temperature
0x05  0x018  1              32  ---  Average Long Term Temperature
0x05  0x020  1              39  ---  Highest Temperature
0x05  0x028  1              27  ---  Lowest Temperature
0x05  0x030  1              36  ---  Highest Average Short Term Temperature
0x05  0x038  1              31  ---  Lowest Average Short Term Temperature
0x05  0x040  1              35  ---  Highest Average Long Term Temperature
0x05  0x048  1              32  ---  Lowest Average Long Term Temperature
0x05  0x050  4               0  ---  Time in Over-Temperature
0x05  0x058  1              60  ---  Specified Maximum Operating Temperature
0x05  0x060  4               0  ---  Time in Under-Temperature
0x05  0x068  1               0  ---  Specified Minimum Operating Temperature
0x06  =====  =               =  ===  == Transport Statistics (rev 1) ==
0x06  0x008  4             109  ---  Number of Hardware Resets
0x06  0x010  4              42  ---  Number of ASR Events
0x06  0x018  4               0  ---  Number of Interface CRC Errors
                                |||_ C monitored condition met
                                ||__ D supports DSN
                                |___ N normalized value

Pending Defects log (GP Log 0x0c) not supported

SATA Phy Event Counters (GP Log 0x11)
ID      Size     Value  Description
0x0001  2            0  Command failed due to ICRC error
0x0002  2            0  R_ERR response for data FIS
0x0003  2            0  R_ERR response for device-to-host data FIS
0x0004  2            0  R_ERR response for host-to-device data FIS
0x0005  2            0  R_ERR response for non-data FIS
0x0006  2            0  R_ERR response for device-to-host non-data FIS
0x0007  2            0  R_ERR response for host-to-device non-data FIS
0x0008  2            0  Device-to-host non-data FIS retries
0x0009  2            6  Transition from drive PhyRdy to drive PhyNRdy
0x000a  2            4  Device-to-host register FISes sent due to a COMRESET
0x000b  2            0  CRC errors within host-to-device FIS
0x000d  2            0  Non-CRC errors within host-to-device FIS
0x000f  2            0  R_ERR response for host-to-device data FIS, CRC
0x0012  2            0  R_ERR response for host-to-device non-data FIS, CRC
0x8000  4        90199  Vendor specific

