smartctl 6.5 2016-05-07 r4318 [i686-w64-mingw32-win10(64)] (sf-6.5-1)
Copyright (C) 2002-16, Bruce Allen, Christian Franke, www.smartmontools.org

=== START OF INFORMATION SECTION ===
Device Model:     SK hynix SC308 SATA 128GB
Serial Number:    FI6AN02081080AB23
Firmware Version: 30001P10
User Capacity:    128,035,676,160 bytes [128 GB]
Sector Sizes:     512 bytes logical, 4096 bytes physical
Rotation Rate:    Solid State Device
Form Factor:      M.2
Device is:        Not in smartctl database [for details use: -P showall]
ATA Version is:   ACS-2 (minor revision not indicated)
SATA Version is:  SATA 3.1, 6.0 Gb/s (current: 6.0 Gb/s)
Local Time is:    Fri Jan 13 06:23:13 2017 GMTST
SMART support is: Available - device has SMART capability.
SMART support is: Enabled
AAM feature is:   Unavailable
APM level is:     128 (minimum power consumption without standby)
Rd look-ahead is: Enabled
Write cache is:   Enabled
ATA Security is:  Disabled, frozen [SEC2]
Wt Cache Reorder: Unavailable

=== START OF READ SMART DATA SECTION ===
SMART overall-health self-assessment test result: PASSED

General SMART Values:
Offline data collection status:  (0x02)	Offline data collection activity
					was completed without error.
					Auto Offline Data Collection: Disabled.
Self-test execution status:      (   4)	The previous self-test routine completed
					without error or no self-test has ever 
					been run.
Total time to complete Offline 
data collection: 		(  105) seconds.
Offline data collection
capabilities: 			 (0x19) SMART execute Offline immediate.
					No Auto Offline data collection support.
					Suspend Offline collection upon new
					command.
					Offline surface scan supported.
					Self-test supported.
					No Conveyance Self-test supported.
					No Selective Self-test supported.
SMART capabilities:            (0x0002)	Does not save SMART data before
					entering power-saving mode.
					Supports SMART auto save timer.
Error logging capability:        (0x01)	Error logging supported.
					General Purpose Logging supported.
Short self-test routine 
recommended polling time: 	 (   2) minutes.
Extended self-test routine
recommended polling time: 	 (  10) minutes.

SMART Attributes Data Structure revision number: 0
Vendor Specific SMART Attributes with Thresholds:
ID# ATTRIBUTE_NAME          FLAGS    VALUE WORST THRESH FAIL RAW_VALUE
  1 Raw_Read_Error_Rate     POSR--   166   166   006    -    0
  5 Reallocated_Sector_Ct   -O--CK   253   100   036    -    0
  9 Power_On_Hours          -O--CK   100   100   000    -    4
 12 Power_Cycle_Count       -O--CK   100   100   020    -    15
100 Unknown_Attribute       -O--CK   100   100   000    -    197324
171 Unknown_Attribute       -O--CK   253   253   000    -    0
172 Unknown_Attribute       -O--CK   253   253   000    -    0
174 Unknown_Attribute       ----CK   100   100   000    -    11
175 Program_Fail_Count_Chip -O--CK   253   253   000    -    0
176 Erase_Fail_Count_Chip   -O--CK   253   253   000    -    0
177 Wear_Leveling_Count     -O--CK   100   100   000    -    2
178 Used_Rsvd_Blk_Cnt_Chip  -O--CK   100   100   000    -    31
179 Used_Rsvd_Blk_Cnt_Tot   -O--CK   100   100   000    -    152
180 Unused_Rsvd_Blk_Cnt_Tot -O--CK   100   100   000    -    2488
181 Program_Fail_Cnt_Total  -O--CK   253   253   000    -    0
182 Erase_Fail_Count_Total  -O--CK   253   253   000    -    0
183 Runtime_Bad_Block       -O--CK   253   253   000    -    0
187 Reported_Uncorrect      -O--CK   253   253   000    -    0
188 Command_Timeout         -O--CK   253   253   000    -    0
191 Unknown_SSD_Attribute   -O--CK   253   253   000    -    0
194 Temperature_Celsius     -O----   029   000   000    -    29 (Min/Max 19/53)
195 Hardware_ECC_Recovered  -O--CK   253   253   000    -    0
199 UDMA_CRC_Error_Count    -O--CK   253   253   000    -    0
201 Unknown_SSD_Attribute   -OSR--   100   100   000    -    0
204 Soft_ECC_Correction     -OSR--   098   001   000    -    311
231 Temperature_Celsius     PO--CK   253   253   010    -    0
234 Unknown_Attribute       -O--CK   100   100   000    -    255708864
241 Total_LBAs_Written      -O--CK   100   100   000    -    209284239
242 Total_LBAs_Read         -O--CK   100   100   000    -    139077322
250 Read_Error_Retry_Rate   -O--CK   100   100   000    -    47222
                            ||||||_ K auto-keep
                            |||||__ C event count
                            ||||___ R error rate
                            |||____ S speed/performance
                            ||_____ O updated online
                            |______ P prefailure warning

General Purpose Log Directory Version 1
SMART           Log Directory Version 1 [multi-sector log support]
Address    Access  R/W   Size  Description
0x00       GPL,SL  R/O      1  Log Directory
0x01           SL  R/O      1  Summary SMART error log
0x02           SL  R/O      4  Comprehensive SMART error log
0x03       GPL     R/O      5  Ext. Comprehensive SMART error log
0x04       GPL,SL  R/O      8  Device Statistics log
0x06           SL  R/O      1  SMART self-test log
0x07       GPL     R/O      2  Extended self-test log
0x10       GPL     R/O      1  SATA NCQ Queued Error log
0x11       GPL     R/O      1  SATA Phy Event Counters log
0x30       GPL     R/O      8  IDENTIFY DEVICE data log
0x80-0x9f  GPL,SL  R/W     16  Host vendor specific log

SMART Extended Comprehensive Error Log Version: 1 (5 sectors)
No Errors Logged

SMART Extended Self-test Log Version: 1 (2 sectors)
Num  Test_Description    Status                  Remaining  LifeTime(hours)  LBA_of_first_error
# 1  Short offline       Completed without error       00%         4         -
# 2  Short offline       Completed without error       90%         0         -

Selective Self-tests/Logging not supported

SCT Commands not supported

Device Statistics (GP Log 0x04)
Page  Offset Size        Value Flags Description
0x01  =====  =               =  ===  == General Statistics (empty) ==
0x04  =====  =               =  ===  == General Errors Statistics (empty) ==
0x05  =====  =               =  ===  == Temperature Statistics (empty) ==
0x06  =====  =               =  ===  == Transport Statistics (empty) ==
0x07  =====  =               =  ===  == Solid State Device Statistics (empty) ==
                                |||_ C monitored condition met
                                ||__ D supports DSN
                                |___ N normalized value

SATA Phy Event Counters (GP Log 0x11)
ID      Size     Value  Description
0x0001  2            0  Command failed due to ICRC error
0x000a  2            8  Device-to-host register FISes sent due to a COMRESET

