smartctl 6.5 2016-05-07 r4318 [x86_64-w64-mingw32-win10] (sf-6.5-1)
Copyright (C) 2002-16, Bruce Allen, Christian Franke, www.smartmontools.org

=== START OF INFORMATION SECTION ===
Device Model:     SAMSUNG SSD PM871 2.5 7mm 256GB
Serial Number:    S1ZTNXAG869209
LU WWN Device Id: 5 002538 d4044d927
Firmware Version: EMT02D0Q
User Capacity:    256 060 514 304 bytes [256 GB]
Sector Size:      512 bytes logical/physical
Rotation Rate:    Solid State Device
Form Factor:      2.5 inches
Device is:        Not in smartctl database [for details use: -P showall]
ATA Version is:   ACS-2, ATA8-ACS T13/1699-D revision 4c
SATA Version is:  SATA 3.1, 6.0 Gb/s (current: 6.0 Gb/s)
Local Time is:    Wed Jan 25 15:01:15 2017 PM
SMART support is: Available - device has SMART capability.
SMART support is: Enabled
AAM feature is:   Unavailable
APM feature is:   Unavailable
Rd look-ahead is: Enabled
Write cache is:   Enabled
ATA Security is:  Disabled, frozen [SEC2]
Wt Cache Reorder: Enabled

=== START OF READ SMART DATA SECTION ===
SMART overall-health self-assessment test result: PASSED

General SMART Values:
Offline data collection status:  (0x00)	Offline data collection activity
					was never started.
					Auto Offline Data Collection: Disabled.
Self-test execution status:      (   0)	The previous self-test routine completed
					without error or no self-test has ever 
					been run.
Total time to complete Offline 
data collection: 		(    0) seconds.
Offline data collection
capabilities: 			 (0x53) SMART execute Offline immediate.
					Auto Offline data collection on/off support.
					Suspend Offline collection upon new
					command.
					No Offline surface scan supported.
					Self-test supported.
					No Conveyance Self-test supported.
					Selective Self-test supported.
SMART capabilities:            (0x0003)	Saves SMART data before entering
					power-saving mode.
					Supports SMART auto save timer.
Error logging capability:        (0x01)	Error logging supported.
					General Purpose Logging supported.
Short self-test routine 
recommended polling time: 	 (   2) minutes.
Extended self-test routine
recommended polling time: 	 ( 133) minutes.
SCT capabilities: 	       (0x003d)	SCT Status supported.
					SCT Error Recovery Control supported.
					SCT Feature Control supported.
					SCT Data Table supported.

SMART Attributes Data Structure revision number: 1
Vendor Specific SMART Attributes with Thresholds:
ID# ATTRIBUTE_NAME          FLAGS    VALUE WORST THRESH FAIL RAW_VALUE
  5 Reallocated_Sector_Ct   PO--CK   100   100   010    -    0
 12 Power_Cycle_Count       PO--CK   099   099   000    -    533
175 Program_Fail_Count_Chip PO--CK   100   100   010    -    0
176 Erase_Fail_Count_Chip   PO--CK   100   100   010    -    0
177 Wear_Leveling_Count     PO--C-   098   098   005    -    27
178 Used_Rsvd_Blk_Cnt_Chip  PO--C-   100   100   010    -    0
179 Used_Rsvd_Blk_Cnt_Tot   PO--C-   100   100   010    -    0
180 Unused_Rsvd_Blk_Cnt_Tot PO--C-   100   100   010    -    771
181 Program_Fail_Cnt_Total  PO--CK   100   100   010    -    0
182 Erase_Fail_Count_Total  PO--CK   100   100   010    -    0
187 Reported_Uncorrect      PO--CK   100   100   000    -    0
195 Hardware_ECC_Recovered  PO-RC-   200   200   000    -    0
241 Total_LBAs_Written      PO--CK   099   099   000    -    6470667811
242 Total_LBAs_Read         PO--CK   099   099   000    -    8335143620
                            ||||||_ K auto-keep
                            |||||__ C event count
                            ||||___ R error rate
                            |||____ S speed/performance
                            ||_____ O updated online
                            |______ P prefailure warning

General Purpose Log Directory Version 1
SMART           Log Directory Version 1 [multi-sector log support]
Address    Access  R/W   Size  Description
0x00       GPL,SL  R/O      1  Log Directory
0x01           SL  R/O      1  Summary SMART error log
0x02           SL  R/O      1  Comprehensive SMART error log
0x03       GPL     R/O      1  Ext. Comprehensive SMART error log
0x06           SL  R/O      1  SMART self-test log
0x07       GPL     R/O      1  Extended self-test log
0x09           SL  R/W      1  Selective self-test log
0x10       GPL     R/O      1  SATA NCQ Queued Error log
0x11       GPL     R/O      1  SATA Phy Event Counters log
0x13       GPL     R/O      1  SATA NCQ Send and Receive log
0x30       GPL,SL  R/O      9  IDENTIFY DEVICE data log
0x80-0x9f  GPL,SL  R/W     16  Host vendor specific log
0xe0       GPL,SL  R/W      1  SCT Command/Status
0xe1       GPL,SL  R/W      1  SCT Data Transfer

SMART Extended Comprehensive Error Log Version: 1 (1 sectors)
No Errors Logged

SMART Extended Self-test Log Version: 1 (1 sectors)
Num  Test_Description    Status                  Remaining  LifeTime(hours)  LBA_of_first_error
# 1  Short offline       Completed without error       00%      2258         -
# 2  Short offline       Completed without error       00%      2217         -
# 3  Short offline       Completed without error       00%      2188         -
# 4  Short offline       Completed without error       00%      2180         -
# 5  Extended offline    Completed without error       00%      2147         -
# 6  Short offline       Completed without error       00%      2140         -
# 7  Short offline       Completed without error       00%      2102         -
# 8  Short offline       Completed without error       00%      2094         -
# 9  Short offline       Completed without error       00%      2057         -
#10  Short offline       Completed without error       00%      1986         -
#11  Short offline       Completed without error       00%      1949         -
#12  Short offline       Completed without error       00%      1941         -
#13  Short offline       Completed without error       00%      1903         -
#14  Short offline       Completed without error       00%      1895         -
#15  Short offline       Completed without error       00%      1895         -
#16  Short offline       Completed without error       00%      1875         -

Warning! SMART Selective Self-Test Log Structure error: invalid SMART checksum.
SMART Selective self-test log data structure revision number 1
 SPAN  MIN_LBA  MAX_LBA  CURRENT_TEST_STATUS
    1        0        0  Not_testing
    2        0        0  Not_testing
    3        0        0  Not_testing
    4        0        0  Not_testing
    5        0        0  Not_testing
  255        0    65535  Read_scanning was never started
Selective self-test flags (0x0):
  After scanning selected spans, do NOT read-scan remainder of disk.
If Selective self-test is pending on power-up, resume after 0 minute delay.

SCT Status Version:                  3
SCT Version (vendor specific):       256 (0x0100)
SCT Support Level:                   1
Device State:                        SCT command executing in background (5)
Current Temperature:                    45 Celsius
Power Cycle Min/Max Temperature:     37/49 Celsius
Lifetime    Min/Max Temperature:      0/70 Celsius
Under/Over Temperature Limit Count:  4294967295/4294901760
SMART Status:                        0xffff (Reserved)

SCT Temperature History Version:     3 (Unknown, should be 2)
Temperature Sampling Period:         1 minute
Temperature Logging Interval:        10 minutes
Min/Max recommended Temperature:      0/70 Celsius
Min/Max Temperature Limit:            0/70 Celsius
Temperature History Size (Index):    128 (38)

Index    Estimated Time   Temperature Celsius
  39    2017-01-24 17:50     ?  -
 ...    ..( 87 skipped).    ..  -
 127    2017-01-25 08:30     ?  -
   0    2017-01-25 08:40    40  *********************
   1    2017-01-25 08:50    37  ******************
   2    2017-01-25 09:00    38  *******************
   3    2017-01-25 09:10    40  *********************
   4    2017-01-25 09:20    44  *************************
   5    2017-01-25 09:30    42  ***********************
   6    2017-01-25 09:40    42  ***********************
   7    2017-01-25 09:50    47  ****************************
   8    2017-01-25 10:00    46  ***************************
   9    2017-01-25 10:10    43  ************************
  10    2017-01-25 10:20    46  ***************************
  11    2017-01-25 10:30    48  *****************************
  12    2017-01-25 10:40    48  *****************************
  13    2017-01-25 10:50    46  ***************************
  14    2017-01-25 11:00    47  ****************************
  15    2017-01-25 11:10    46  ***************************
  16    2017-01-25 11:20    46  ***************************
  17    2017-01-25 11:30    44  *************************
  18    2017-01-25 11:40    46  ***************************
  19    2017-01-25 11:50    47  ****************************
  20    2017-01-25 12:00    47  ****************************
  21    2017-01-25 12:10    48  *****************************
  22    2017-01-25 12:20    48  *****************************
  23    2017-01-25 12:30    45  **************************
  24    2017-01-25 12:40    44  *************************
  25    2017-01-25 12:50    44  *************************
  26    2017-01-25 13:00    44  *************************
  27    2017-01-25 13:10    42  ***********************
  28    2017-01-25 13:20    42  ***********************
  29    2017-01-25 13:30    43  ************************
  30    2017-01-25 13:40    44  *************************
  31    2017-01-25 13:50    43  ************************
  32    2017-01-25 14:00    44  *************************
  33    2017-01-25 14:10    46  ***************************
  34    2017-01-25 14:20    46  ***************************
  35    2017-01-25 14:30    45  **************************
  36    2017-01-25 14:40    49  ******************************
  37    2017-01-25 14:50    49  ******************************
  38    2017-01-25 15:00    45  **************************

SCT Error Recovery Control:
           Read: Disabled
          Write: Disabled

Device Statistics (GP/SMART Log 0x04) not supported

SATA Phy Event Counters (GP Log 0x11)
ID      Size     Value  Description
0x0001  2            0  Command failed due to ICRC error
0x0002  2            0  R_ERR response for data FIS
0x0003  2            0  R_ERR response for device-to-host data FIS
0x0004  2            0  R_ERR response for host-to-device data FIS
0x0005  2            0  R_ERR response for non-data FIS
0x0006  2            0  R_ERR response for device-to-host non-data FIS
0x0007  2            0  R_ERR response for host-to-device non-data FIS
0x0008  2            0  Device-to-host non-data FIS retries
0x0009  2        65535+ Transition from drive PhyRdy to drive PhyNRdy
0x000a  2            3  Device-to-host register FISes sent due to a COMRESET
0x000b  2            0  CRC errors within host-to-device FIS
0x000d  2            0  Non-CRC errors within host-to-device FIS
0x000f  2            0  R_ERR response for host-to-device data FIS, CRC
0x0010  2            0  R_ERR response for host-to-device data FIS, non-CRC
0x0012  2            0  R_ERR response for host-to-device non-data FIS, CRC
0x0013  2            0  R_ERR response for host-to-device non-data FIS, non-CRC

