smartctl 7.2 2020-12-30 r5155 [x86_64-w64-mingw32-w10-20H2] (sf-7.2-1)
Copyright (C) 2002-20, Bruce Allen, Christian Franke, www.smartmontools.org

=== START OF INFORMATION SECTION ===
Device Model:     TOSHIBA DT01ABA200V
Firmware Version: MZ4OABC0
User Capacity:    2.000.398.934.016 bytes [2.00 TB]
Sector Sizes:     512 bytes logical, 4096 bytes physical
Rotation Rate:    5700 rpm
Form Factor:      3.5 inches
Device is:        Not in smartctl database [for details use: -P showall]
ATA Version is:   ATA8-ACS T13/1699-D revision 4
SATA Version is:  SATA 3.0, 6.0 Gb/s (current: 6.0 Gb/s)
Local Time is:    Sun Jun 06 06:17:06 2021 HB
SMART support is: Available - device has SMART capability.
SMART support is: Enabled
AAM feature is:   Unavailable
APM feature is:   Disabled
Rd look-ahead is: Enabled
Write cache is:   Enabled
DSN feature is:   Unavailable
ATA Security is:  Disabled, NOT FROZEN [SEC1]
Wt Cache Reorder: Enabled

=== START OF READ SMART DATA SECTION ===
SMART overall-health self-assessment test result: PASSED

General SMART Values:
Offline data collection status:  (0x00)	Offline data collection activity
					was never started.
					Auto Offline Data Collection: Disabled.
Self-test execution status:      (   0)	The previous self-test routine completed
					without error or no self-test has ever 
					been run.
Total time to complete Offline 
data collection: 		(17623) seconds.
Offline data collection
capabilities: 			 (0x5b) SMART execute Offline immediate.
					Auto Offline data collection on/off support.
					Suspend Offline collection upon new
					command.
					Offline surface scan supported.
					Self-test supported.
					No Conveyance Self-test supported.
					Selective Self-test supported.
SMART capabilities:            (0x0003)	Saves SMART data before entering
					power-saving mode.
					Supports SMART auto save timer.
Error logging capability:        (0x01)	Error logging supported.
					General Purpose Logging supported.
Short self-test routine 
recommended polling time: 	 (   1) minutes.
Extended self-test routine
recommended polling time: 	 ( 294) minutes.
SCT capabilities: 	       (0x003d)	SCT Status supported.
					SCT Error Recovery Control supported.
					SCT Feature Control supported.
					SCT Data Table supported.

SMART Attributes Data Structure revision number: 16
Vendor Specific SMART Attributes with Thresholds:
ID# ATTRIBUTE_NAME          FLAGS    VALUE WORST THRESH FAIL RAW_VALUE
  1 Raw_Read_Error_Rate     PO-R--   100   100   016    -    0
  2 Throughput_Performance  P-S---   100   100   054    -    0
  3 Spin_Up_Time            POS---   133   133   024    -    269 (Average 257)
  4 Start_Stop_Count        -O--C-   100   100   000    -    1471
  5 Reallocated_Sector_Ct   PO--CK   100   100   005    -    0
  7 Seek_Error_Rate         PO-R--   100   100   067    -    0
  8 Seek_Time_Performance   P-S---   100   100   020    -    0
  9 Power_On_Hours          -O--C-   096   096   000    -    32627
 10 Spin_Retry_Count        PO--C-   100   100   060    -    0
 12 Power_Cycle_Count       -O--CK   100   100   000    -    1443
192 Power-Off_Retract_Count -O--CK   099   099   000    -    1573
193 Load_Cycle_Count        -O--C-   099   099   000    -    1573
194 Temperature_Celsius     -O----   171   171   000    -    35 (Min/Max 12/50)
196 Reallocated_Event_Count -O--CK   100   100   000    -    0
197 Current_Pending_Sector  -O---K   100   100   000    -    0
198 Offline_Uncorrectable   ---R--   100   100   000    -    0
199 UDMA_CRC_Error_Count    -O-R--   200   200   000    -    0
                            ||||||_ K auto-keep
                            |||||__ C event count
                            ||||___ R error rate
                            |||____ S speed/performance
                            ||_____ O updated online
                            |______ P prefailure warning

General Purpose Log Directory Version 1
SMART           Log Directory Version 1 [multi-sector log support]
Address    Access  R/W   Size  Description
0x00       GPL,SL  R/O      1  Log Directory
0x01           SL  R/O      1  Summary SMART error log
0x03       GPL     R/O      1  Ext. Comprehensive SMART error log
0x04       GPL     R/O      7  Device Statistics log
0x06           SL  R/O      1  SMART self-test log
0x07       GPL     R/O      1  Extended self-test log
0x08       GPL     R/O      2  Power Conditions log
0x09           SL  R/W      1  Selective self-test log
0x10       GPL     R/O      1  NCQ Command Error log
0x11       GPL     R/O      1  SATA Phy Event Counters log
0x20       GPL     R/O      1  Streaming performance log [OBS-8]
0x21       GPL     R/O      1  Write stream error log
0x22       GPL     R/O      1  Read stream error log
0x80-0x9f  GPL,SL  R/W     16  Host vendor specific log
0xe0       GPL,SL  R/W      1  SCT Command/Status
0xe1       GPL,SL  R/W      1  SCT Data Transfer

SMART Extended Comprehensive Error Log Version: 1 (1 sectors)
No Errors Logged

SMART Extended Self-test Log Version: 1 (1 sectors)
Num  Test_Description    Status                  Remaining  LifeTime(hours)  LBA_of_first_error
# 1  Short offline       Completed without error       00%     32627         -
# 2  Short offline       Completed without error       00%     20982         -
# 3  Short offline       Completed without error       00%     13661         -
# 4  Short offline       Completed without error       00%      3118         -
# 5  Vendor (0x48)       Completed without error       00%         3         -
# 6  Vendor (0x48)       Completed without error       00%         1         -

SMART Selective self-test log data structure revision number 1
 SPAN  MIN_LBA  MAX_LBA  CURRENT_TEST_STATUS
    1        0        0  Not_testing
    2        0        0  Not_testing
    3        0        0  Not_testing
    4        0        0  Not_testing
    5        0        0  Not_testing
Selective self-test flags (0x0):
  After scanning selected spans, do NOT read-scan remainder of disk.
If Selective self-test is pending on power-up, resume after 0 minute delay.

SCT Status Version:                  3
SCT Version (vendor specific):       256 (0x0100)
Device State:                        Active (0)
Current Temperature:                    35 Celsius
Power Cycle Min/Max Temperature:     29/38 Celsius
Lifetime    Min/Max Temperature:     12/50 Celsius
Under/Over Temperature Limit Count:   0/0

SCT Temperature History Version:     2
Temperature Sampling Period:         1 minute
Temperature Logging Interval:        1 minute
Min/Max recommended Temperature:      0/60 Celsius
Min/Max Temperature Limit:           -40/70 Celsius
Temperature History Size (Index):    128 (13)

Index    Estimated Time   Temperature Celsius
  14    2021-06-06 04:10    35  ****************
 ...    ..( 34 skipped).    ..  ****************
  49    2021-06-06 04:45    35  ****************
  50    2021-06-06 04:46    36  *****************
 ...    ..(  7 skipped).    ..  *****************
  58    2021-06-06 04:54    36  *****************
  59    2021-06-06 04:55    35  ****************
  60    2021-06-06 04:56    36  *****************
 ...    ..(  4 skipped).    ..  *****************
  65    2021-06-06 05:01    36  *****************
  66    2021-06-06 05:02    35  ****************
 ...    ..(  3 skipped).    ..  ****************
  70    2021-06-06 05:06    35  ****************
  71    2021-06-06 05:07    36  *****************
  72    2021-06-06 05:08    36  *****************
  73    2021-06-06 05:09    35  ****************
 ...    ..(  2 skipped).    ..  ****************
  76    2021-06-06 05:12    35  ****************
  77    2021-06-06 05:13    36  *****************
 ...    ..( 15 skipped).    ..  *****************
  93    2021-06-06 05:29    36  *****************
  94    2021-06-06 05:30    35  ****************
  95    2021-06-06 05:31    35  ****************
  96    2021-06-06 05:32    36  *****************
 ...    ..(  5 skipped).    ..  *****************
 102    2021-06-06 05:38    36  *****************
 103    2021-06-06 05:39    35  ****************
 104    2021-06-06 05:40    36  *****************
 105    2021-06-06 05:41    36  *****************
 106    2021-06-06 05:42    36  *****************
 107    2021-06-06 05:43    35  ****************
 ...    ..(  2 skipped).    ..  ****************
 110    2021-06-06 05:46    35  ****************
 111    2021-06-06 05:47    36  *****************
 ...    ..(  6 skipped).    ..  *****************
 118    2021-06-06 05:54    36  *****************
 119    2021-06-06 05:55    35  ****************
 120    2021-06-06 05:56    35  ****************
 121    2021-06-06 05:57    36  *****************
 122    2021-06-06 05:58    36  *****************
 123    2021-06-06 05:59    35  ****************
 124    2021-06-06 06:00    36  *****************
 125    2021-06-06 06:01    36  *****************
 126    2021-06-06 06:02    35  ****************
 ...    ..( 14 skipped).    ..  ****************
  13    2021-06-06 06:17    35  ****************

SCT Error Recovery Control:
           Read: Disabled
          Write: Disabled

Device Statistics (GP Log 0x04)
Page  Offset Size        Value Flags Description
0x01  =====  =               =  ===  == General Statistics (rev 1) ==
0x01  0x008  4            1443  ---  Lifetime Power-On Resets
0x01  0x010  4           32627  ---  Power-on Hours
0x01  0x018  6     93337127569  ---  Logical Sectors Written
0x01  0x020  6      1521380268  ---  Number of Write Commands
0x01  0x028  6    145825526444  ---  Logical Sectors Read
0x01  0x030  6      1562811486  ---  Number of Read Commands
0x03  =====  =               =  ===  == Rotating Media Statistics (rev 1) ==
0x03  0x008  4           32482  ---  Spindle Motor Power-on Hours
0x03  0x010  4           32482  ---  Head Flying Hours
0x03  0x018  4            1573  ---  Head Load Events
0x03  0x020  4               0  ---  Number of Reallocated Logical Sectors
0x03  0x028  4               1  ---  Read Recovery Attempts
0x03  0x030  4               0  ---  Number of Mechanical Start Failures
0x04  =====  =               =  ===  == General Errors Statistics (rev 1) ==
0x04  0x008  4               0  ---  Number of Reported Uncorrectable Errors
0x04  0x010  4               0  ---  Resets Between Cmd Acceptance and Completion
0x05  =====  =               =  ===  == Temperature Statistics (rev 1) ==
0x05  0x008  1              35  ---  Current Temperature
0x05  0x010  1              36  N--  Average Short Term Temperature
0x05  0x018  1              36  N--  Average Long Term Temperature
0x05  0x020  1              50  ---  Highest Temperature
0x05  0x028  1              12  ---  Lowest Temperature
0x05  0x030  1              47  N--  Highest Average Short Term Temperature
0x05  0x038  1              21  N--  Lowest Average Short Term Temperature
0x05  0x040  1              41  N--  Highest Average Long Term Temperature
0x05  0x048  1              23  N--  Lowest Average Long Term Temperature
0x05  0x050  4               0  ---  Time in Over-Temperature
0x05  0x058  1              60  ---  Specified Maximum Operating Temperature
0x05  0x060  4               0  ---  Time in Under-Temperature
0x05  0x068  1               0  ---  Specified Minimum Operating Temperature
0x06  =====  =               =  ===  == Transport Statistics (rev 1) ==
0x06  0x008  4            4151  ---  Number of Hardware Resets
0x06  0x010  4            2666  ---  Number of ASR Events
0x06  0x018  4               0  ---  Number of Interface CRC Errors
                                |||_ C monitored condition met
                                ||__ D supports DSN
                                |___ N normalized value

Pending Defects log (GP Log 0x0c) not supported

SATA Phy Event Counters (GP Log 0x11)
ID      Size     Value  Description
0x0001  2            0  Command failed due to ICRC error
0x0002  2            0  R_ERR response for data FIS
0x0003  2            0  R_ERR response for device-to-host data FIS
0x0004  2            0  R_ERR response for host-to-device data FIS
0x0005  2            0  R_ERR response for non-data FIS
0x0006  2            0  R_ERR response for device-to-host non-data FIS
0x0007  2            0  R_ERR response for host-to-device non-data FIS
0x0009  2           10  Transition from drive PhyRdy to drive PhyNRdy
0x000a  2            9  Device-to-host register FISes sent due to a COMRESET
0x000b  2            0  CRC errors within host-to-device FIS
0x000d  2            0  Non-CRC errors within host-to-device FIS

