smartctl 7.2 2020-12-30 r5155 [x86_64-linux-5.15.83-1-pve] (local build)
Copyright (C) 2002-20, Bruce Allen, Christian Franke, www.smartmontools.org

=== START OF INFORMATION SECTION ===
Device Model:     VK000960GWCNR
Serial Number:    PHDV71110196960FGN
LU WWN Device Id: 5 5cd2e4 14d6f0e2b
Firmware Version: 4IDVHPG1
User Capacity:    960,197,124,096 bytes [960 GB]
Sector Sizes:     512 bytes logical, 4096 bytes physical
Rotation Rate:    Solid State Device
Form Factor:      2.5 inches
TRIM Command:     Available, deterministic, zeroed
Device is:        Not in smartctl database [for details use: -P showall]
ATA Version is:   ACS-3 T13/2161-D revision 5
SATA Version is:  SATA 3.1, 6.0 Gb/s (current: 6.0 Gb/s)
Local Time is:    Sun Jan 29 03:17:48 2023 MST
SMART support is: Available - device has SMART capability.
SMART support is: Enabled
AAM feature is:   Unavailable
APM feature is:   Unavailable
Rd look-ahead is: Enabled
Write cache is:   Disabled
DSN feature is:   Unavailable
ATA Security is:  Unavailable
Wt Cache Reorder: Unavailable

=== START OF READ SMART DATA SECTION ===
SMART overall-health self-assessment test result: PASSED

General SMART Values:
Offline data collection status:  (0x02)	Offline data collection activity
					was completed without error.
					Auto Offline Data Collection: Disabled.
Self-test execution status:      (   0)	The previous self-test routine completed
					without error or no self-test has ever 
					been run.
Total time to complete Offline 
data collection: 		(    2) seconds.
Offline data collection
capabilities: 			 (0x79) SMART execute Offline immediate.
					No Auto Offline data collection support.
					Suspend Offline collection upon new
					command.
					Offline surface scan supported.
					Self-test supported.
					Conveyance Self-test supported.
					Selective Self-test supported.
SMART capabilities:            (0x0003)	Saves SMART data before entering
					power-saving mode.
					Supports SMART auto save timer.
Error logging capability:        (0x01)	Error logging supported.
					General Purpose Logging supported.
Short self-test routine 
recommended polling time: 	 (   1) minutes.
Extended self-test routine
recommended polling time: 	 ( 132) minutes.
Conveyance self-test routine
recommended polling time: 	 ( 132) minutes.
SCT capabilities: 	       (0x0021)	SCT Status supported.
					SCT Data Table supported.

SMART Attributes Data Structure revision number: 1
Vendor Specific SMART Attributes with Thresholds:
ID# ATTRIBUTE_NAME          FLAGS    VALUE WORST THRESH FAIL RAW_VALUE
  1 Raw_Read_Error_Rate     POSR--   130   130   039    -    1894082397
  5 Reallocated_Sector_Ct   PO--CK   100   100   001    -    2
  9 Power_On_Hours          -O--CK   100   100   000    -    19833
173 Unknown_Attribute       PO--CK   090   090   001    -    0
175 Program_Fail_Count_Chip PO--CK   100   100   010    -    700087743716
180 Unused_Rsvd_Blk_Cnt_Tot PO-RCK   130   130   039    -    2116108693
194 Temperature_Celsius     -O---K   100   100   000    -    25
196 Reallocated_Event_Count PO--CK   099   099   010    -    2
                            ||||||_ K auto-keep
                            |||||__ C event count
                            ||||___ R error rate
                            |||____ S speed/performance
                            ||_____ O updated online
                            |______ P prefailure warning

General Purpose Log Directory Version 1
SMART           Log Directory Version 1 [multi-sector log support]
Address    Access  R/W   Size  Description
0x00       GPL,SL  R/O      1  Log Directory
0x03       GPL     R/O     20  Ext. Comprehensive SMART error log
0x04       GPL,SL  R/O      8  Device Statistics log
0x07       GPL     R/O      2  Extended self-test log
0x08       GPL     R/O      2  Power Conditions log
0x09           SL  R/W      1  Selective self-test log
0x10       GPL     R/O      1  NCQ Command Error log
0x11       GPL     R/O      1  SATA Phy Event Counters log
0x30       GPL     R/O      9  IDENTIFY DEVICE data log
0x80-0x9f  GPL,SL  R/W     16  Host vendor specific log
0xb5       GPL,SL  VS       1  Device vendor specific log
0xb6       GPL     VS     127  Device vendor specific log
0xb6       SL      VS       2  Device vendor specific log
0xb7       GPL     VS   30976  Device vendor specific log
0xb8       GPL,SL  VS       1  Device vendor specific log
0xb9       GPL     VS    1704  Device vendor specific log
0xb9       SL      VS     168  Device vendor specific log
0xba       GPL     VS    1280  Device vendor specific log
0xbb       GPL,SL  VS       1  Device vendor specific log
0xd0       GPL,SL  VS       1  Device vendor specific log
0xd7       GPL,SL  VS       1  Device vendor specific log
0xe0       GPL,SL  R/W      1  SCT Command/Status
0xe1       GPL,SL  R/W      8  SCT Data Transfer
0xff       GPL     -     7424  Reserved

SMART Extended Comprehensive Error Log Version: 1 (20 sectors)
Device Error Count: 1
	CR     = Command Register
	FEATR  = Features Register
	COUNT  = Count (was: Sector Count) Register
	LBA_48 = Upper bytes of LBA High/Mid/Low Registers ]  ATA-8
	LH     = LBA High (was: Cylinder High) Register    ]   LBA
	LM     = LBA Mid (was: Cylinder Low) Register      ] Register
	LL     = LBA Low (was: Sector Number) Register     ]
	DV     = Device (was: Device/Head) Register
	DC     = Device Control Register
	ER     = Error register
	ST     = Status register
Powered_Up_Time is measured from power on, and printed as
DDd+hh:mm:SS.sss where DD=days, hh=hours, mm=minutes,
SS=sec, and sss=millisec. It "wraps" after 49.710 days.

Error 1 [0] occurred at disk power-on lifetime: 3 hours (0 days + 3 hours)
  When the command that caused the error occurred, the device was active or idle.

  After command completion occurred, registers were:
  ER -- ST COUNT  LBA_48  LH LM LL DV DC
  -- -- -- == -- == == == -- -- -- -- --
  84 -- 41 02 00 00 00 50 d3 80 00 40 00  Error: ICRC, ABRT at LBA = 0x50d38000 = 1356038144

  Commands leading to the command that caused the error were:
  CR FEATR COUNT  LBA_48  LH LM LL DV DC  Powered_Up_Time  Command/Feature_Name
  -- == -- == -- == == == -- -- -- -- --  ---------------  --------------------
  61 00 00 02 00 00 00 50 d3 80 00 40 00     02:31:19.961  WRITE FPDMA QUEUED
  61 00 00 02 00 00 00 50 d3 7e 00 40 00     02:31:19.960  WRITE FPDMA QUEUED
  61 00 00 02 00 00 00 50 d3 7c 00 40 00     02:31:19.956  WRITE FPDMA QUEUED
  61 00 00 02 00 00 00 50 d3 7a 00 40 00     02:31:19.953  WRITE FPDMA QUEUED
  61 00 00 02 00 00 00 50 d3 78 00 40 00     02:31:19.949  WRITE FPDMA QUEUED

SMART Extended Self-test Log Version: 1 (2 sectors)
Num  Test_Description    Status                  Remaining  LifeTime(hours)  LBA_of_first_error
# 1  Short offline       Completed without error       00%     19833         -
# 2  Extended offline    Completed without error       00%     19833         -
# 3  Extended offline    Completed without error       00%     17789         -
# 4  Extended offline    Completed without error       00%     17762         -
# 5  Extended offline    Interrupted (host reset)      00%     17708         -
# 6  Extended offline    Completed without error       00%     17697         -
# 7  Short offline       Completed without error       00%      1461         -
# 8  Short offline       Completed without error       00%       717         -
# 9  Short offline       Completed without error       00%         9         -

SMART Selective self-test log data structure revision number 1
 SPAN  MIN_LBA  MAX_LBA  CURRENT_TEST_STATUS
    1        0        0  Not_testing
    2        0        0  Not_testing
    3        0        0  Not_testing
    4        0        0  Not_testing
    5        0        0  Not_testing
Selective self-test flags (0x0):
  After scanning selected spans, do NOT read-scan remainder of disk.
If Selective self-test is pending on power-up, resume after 0 minute delay.

SCT Status Version:                  3
SCT Version (vendor specific):       1 (0x0001)
Device State:                        Active (0)
Current Temperature:                    25 Celsius
Power Cycle Min/Max Temperature:     21/30 Celsius
Lifetime    Min/Max Temperature:     17/42 Celsius
Specified Max Operating Temperature:    60 Celsius
Under/Over Temperature Limit Count:   0/0
Vendor specific:
00 00 64 00 00 00 00 00 00 00 00 00 00 00 00 00
00 00 00 00 00 00 00 00 00 00 00 00 00 00 00 00

SCT Temperature History Version:     2
Temperature Sampling Period:         1 minute
Temperature Logging Interval:        1 minute
Min/Max recommended Temperature:      0/60 Celsius
Min/Max Temperature Limit:            0/60 Celsius
Temperature History Size (Index):    478 (268)

Index    Estimated Time   Temperature Celsius
 269    2023-01-28 19:20    28  *********
 ...    ..(  2 skipped).    ..  *********
 272    2023-01-28 19:23    28  *********
 273    2023-01-28 19:24    27  ********
 ...    ..( 18 skipped).    ..  ********
 292    2023-01-28 19:43    27  ********
 293    2023-01-28 19:44    28  *********
 ...    ..(  2 skipped).    ..  *********
 296    2023-01-28 19:47    28  *********
 297    2023-01-28 19:48    29  **********
 298    2023-01-28 19:49    29  **********
 299    2023-01-28 19:50    29  **********
 300    2023-01-28 19:51    28  *********
 ...    ..(  5 skipped).    ..  *********
 306    2023-01-28 19:57    28  *********
 307    2023-01-28 19:58    27  ********
 308    2023-01-28 19:59    28  *********
 309    2023-01-28 20:00    28  *********
 310    2023-01-28 20:01    28  *********
 311    2023-01-28 20:02    27  ********
 ...    ..(  6 skipped).    ..  ********
 318    2023-01-28 20:09    27  ********
 319    2023-01-28 20:10    28  *********
 320    2023-01-28 20:11    27  ********
 ...    ..(  4 skipped).    ..  ********
 325    2023-01-28 20:16    27  ********
 326    2023-01-28 20:17    26  *******
 ...    ..(  6 skipped).    ..  *******
 333    2023-01-28 20:24    26  *******
 334    2023-01-28 20:25    27  ********
 ...    ..(  2 skipped).    ..  ********
 337    2023-01-28 20:28    27  ********
 338    2023-01-28 20:29    26  *******
 ...    ..(  3 skipped).    ..  *******
 342    2023-01-28 20:33    26  *******
 343    2023-01-28 20:34    27  ********
 ...    ..(  2 skipped).    ..  ********
 346    2023-01-28 20:37    27  ********
 347    2023-01-28 20:38    28  *********
 348    2023-01-28 20:39    28  *********
 349    2023-01-28 20:40    27  ********
 350    2023-01-28 20:41    28  *********
 351    2023-01-28 20:42    27  ********
 352    2023-01-28 20:43    27  ********
 353    2023-01-28 20:44    28  *********
 354    2023-01-28 20:45    29  **********
 355    2023-01-28 20:46    29  **********
 356    2023-01-28 20:47    28  *********
 357    2023-01-28 20:48    28  *********
 358    2023-01-28 20:49    27  ********
 ...    ..(  5 skipped).    ..  ********
 364    2023-01-28 20:55    27  ********
 365    2023-01-28 20:56    28  *********
 366    2023-01-28 20:57    29  **********
 367    2023-01-28 20:58    29  **********
 368    2023-01-28 20:59    28  *********
 369    2023-01-28 21:00    27  ********
 ...    ..(  2 skipped).    ..  ********
 372    2023-01-28 21:03    27  ********
 373    2023-01-28 21:04    26  *******
 ...    ..( 10 skipped).    ..  *******
 384    2023-01-28 21:15    26  *******
 385    2023-01-28 21:16    27  ********
 386    2023-01-28 21:17    27  ********
 387    2023-01-28 21:18    27  ********
 388    2023-01-28 21:19    28  *********
 389    2023-01-28 21:20    27  ********
 390    2023-01-28 21:21    27  ********
 391    2023-01-28 21:22    27  ********
 392    2023-01-28 21:23    26  *******
 393    2023-01-28 21:24    26  *******
 394    2023-01-28 21:25    27  ********
 395    2023-01-28 21:26    28  *********
 396    2023-01-28 21:27    29  **********
 397    2023-01-28 21:28    28  *********
 398    2023-01-28 21:29    27  ********
 399    2023-01-28 21:30    27  ********
 400    2023-01-28 21:31    27  ********
 401    2023-01-28 21:32    26  *******
 ...    ..( 29 skipped).    ..  *******
 431    2023-01-28 22:02    26  *******
 432    2023-01-28 22:03    27  ********
 433    2023-01-28 22:04    27  ********
 434    2023-01-28 22:05    26  *******
 435    2023-01-28 22:06    26  *******
 436    2023-01-28 22:07    27  ********
 437    2023-01-28 22:08    26  *******
 438    2023-01-28 22:09    27  ********
 ...    ..(  2 skipped).    ..  ********
 441    2023-01-28 22:12    27  ********
 442    2023-01-28 22:13    26  *******
 ...    ..(  8 skipped).    ..  *******
 451    2023-01-28 22:22    26  *******
 452    2023-01-28 22:23    27  ********
 453    2023-01-28 22:24    26  *******
 454    2023-01-28 22:25    26  *******
 455    2023-01-28 22:26    26  *******
 456    2023-01-28 22:27    27  ********
 457    2023-01-28 22:28    28  *********
 458    2023-01-28 22:29    28  *********
 459    2023-01-28 22:30    29  **********
 460    2023-01-28 22:31    29  **********
 461    2023-01-28 22:32    29  **********
 462    2023-01-28 22:33    30  ***********
 ...    ..(  6 skipped).    ..  ***********
 469    2023-01-28 22:40    30  ***********
 470    2023-01-28 22:41    31  ************
 471    2023-01-28 22:42    30  ***********
 472    2023-01-28 22:43    29  **********
 473    2023-01-28 22:44    29  **********
 474    2023-01-28 22:45    30  ***********
 475    2023-01-28 22:46    30  ***********
 476    2023-01-28 22:47    31  ************
 477    2023-01-28 22:48    31  ************
   0    2023-01-28 22:49    31  ************
   1    2023-01-28 22:50    32  *************
 ...    ..(  5 skipped).    ..  *************
   7    2023-01-28 22:56    32  *************
   8    2023-01-28 22:57    33  **************
 ...    ..( 19 skipped).    ..  **************
  28    2023-01-28 23:17    33  **************
  29    2023-01-28 23:18    32  *************
  30    2023-01-28 23:19    30  ***********
  31    2023-01-28 23:20    29  **********
  32    2023-01-28 23:21    28  *********
  33    2023-01-28 23:22    27  ********
 ...    ..(  2 skipped).    ..  ********
  36    2023-01-28 23:25    27  ********
  37    2023-01-28 23:26    28  *********
 ...    ..(  4 skipped).    ..  *********
  42    2023-01-28 23:31    28  *********
  43    2023-01-28 23:32    27  ********
  44    2023-01-28 23:33    27  ********
  45    2023-01-28 23:34    26  *******
  46    2023-01-28 23:35    26  *******
  47    2023-01-28 23:36    26  *******
  48    2023-01-28 23:37    27  ********
  49    2023-01-28 23:38    27  ********
  50    2023-01-28 23:39    28  *********
  51    2023-01-28 23:40    28  *********
  52    2023-01-28 23:41    27  ********
  53    2023-01-28 23:42    28  *********
  54    2023-01-28 23:43    27  ********
  55    2023-01-28 23:44    26  *******
 ...    ..(  4 skipped).    ..  *******
  60    2023-01-28 23:49    26  *******
  61    2023-01-28 23:50    25  ******
  62    2023-01-28 23:51    26  *******
  63    2023-01-28 23:52    26  *******
  64    2023-01-28 23:53    25  ******
 ...    ..(  9 skipped).    ..  ******
  74    2023-01-29 00:03    25  ******
  75    2023-01-29 00:04    26  *******
  76    2023-01-29 00:05    27  ********
 ...    ..(  3 skipped).    ..  ********
  80    2023-01-29 00:09    27  ********
  81    2023-01-29 00:10    28  *********
  82    2023-01-29 00:11    27  ********
  83    2023-01-29 00:12    28  *********
  84    2023-01-29 00:13    27  ********
  85    2023-01-29 00:14    28  *********
  86    2023-01-29 00:15    29  **********
  87    2023-01-29 00:16    29  **********
  88    2023-01-29 00:17    29  **********
  89    2023-01-29 00:18    30  ***********
  90    2023-01-29 00:19    29  **********
  91    2023-01-29 00:20    29  **********
  92    2023-01-29 00:21    28  *********
  93    2023-01-29 00:22    28  *********
  94    2023-01-29 00:23    27  ********
 ...    ..(  2 skipped).    ..  ********
  97    2023-01-29 00:26    27  ********
  98    2023-01-29 00:27    26  *******
  99    2023-01-29 00:28    26  *******
 100    2023-01-29 00:29    25  ******
 101    2023-01-29 00:30    26  *******
 102    2023-01-29 00:31    26  *******
 103    2023-01-29 00:32    26  *******
 104    2023-01-29 00:33    25  ******
 ...    ..(  6 skipped).    ..  ******
 111    2023-01-29 00:40    25  ******
 112    2023-01-29 00:41    26  *******
 113    2023-01-29 00:42    25  ******
 114    2023-01-29 00:43    25  ******
 115    2023-01-29 00:44    25  ******
 116    2023-01-29 00:45    26  *******
 117    2023-01-29 00:46    26  *******
 118    2023-01-29 00:47    27  ********
 119    2023-01-29 00:48    26  *******
 ...    ..(  2 skipped).    ..  *******
 122    2023-01-29 00:51    26  *******
 123    2023-01-29 00:52    27  ********
 124    2023-01-29 00:53    28  *********
 125    2023-01-29 00:54    28  *********
 126    2023-01-29 00:55    27  ********
 127    2023-01-29 00:56    27  ********
 128    2023-01-29 00:57    26  *******
 129    2023-01-29 00:58    26  *******
 130    2023-01-29 00:59    25  ******
 ...    ..(  2 skipped).    ..  ******
 133    2023-01-29 01:02    25  ******
 134    2023-01-29 01:03    24  *****
 135    2023-01-29 01:04    24  *****
 136    2023-01-29 01:05     ?  -
 137    2023-01-29 01:06    24  *****
 138    2023-01-29 01:07    25  ******
 139    2023-01-29 01:08     ?  -
 140    2023-01-29 01:09    26  *******
 ...    ..(  3 skipped).    ..  *******
 144    2023-01-29 01:13    26  *******
 145    2023-01-29 01:14     ?  -
 146    2023-01-29 01:15    26  *******
 147    2023-01-29 01:16    26  *******
 148    2023-01-29 01:17    26  *******
 149    2023-01-29 01:18    27  ********
 150    2023-01-29 01:19    27  ********
 151    2023-01-29 01:20    26  *******
 152    2023-01-29 01:21    26  *******
 153    2023-01-29 01:22    27  ********
 154    2023-01-29 01:23    28  *********
 155    2023-01-29 01:24    28  *********
 156    2023-01-29 01:25    28  *********
 157    2023-01-29 01:26    29  **********
 158    2023-01-29 01:27    29  **********
 159    2023-01-29 01:28    30  ***********
 ...    ..( 14 skipped).    ..  ***********
 174    2023-01-29 01:43    30  ***********
 175    2023-01-29 01:44    29  **********
 ...    ..( 81 skipped).    ..  **********
 257    2023-01-29 03:06    29  **********
 258    2023-01-29 03:07    28  *********
 259    2023-01-29 03:08    27  ********
 260    2023-01-29 03:09    26  *******
 261    2023-01-29 03:10    26  *******
 262    2023-01-29 03:11    25  ******
 ...    ..(  3 skipped).    ..  ******
 266    2023-01-29 03:15    25  ******
 267    2023-01-29 03:16    26  *******
 268    2023-01-29 03:17    25  ******

SCT Error Recovery Control command not supported

Device Statistics (GP Log 0x04)
Page  Offset Size        Value Flags Description
0x01  =====  =               =  ===  == General Statistics (rev 1) ==
0x01  0x008  4              52  ---  Lifetime Power-On Resets
0x01  0x018  6    364972900675  ---  Logical Sectors Written
0x01  0x020  6      5641488178  ---  Number of Write Commands
0x01  0x028  6     44294588254  ---  Logical Sectors Read
0x01  0x030  6      1087681364  ---  Number of Read Commands
0x01  0x038  6      2680627377  ---  Date and Time TimeStamp
0x04  =====  =               =  ===  == General Errors Statistics (rev 1) ==
0x04  0x008  4               0  ---  Number of Reported Uncorrectable Errors
0x04  0x010  4               0  ---  Resets Between Cmd Acceptance and Completion
0x05  =====  =               =  ===  == Temperature Statistics (rev 1) ==
0x05  0x008  1              25  ---  Current Temperature
0x05  0x010  1              27  ---  Average Short Term Temperature
0x05  0x018  1              31  ---  Average Long Term Temperature
0x05  0x020  1              42  ---  Highest Temperature
0x05  0x028  1              17  ---  Lowest Temperature
0x05  0x030  1              36  ---  Highest Average Short Term Temperature
0x05  0x038  1              18  ---  Lowest Average Short Term Temperature
0x05  0x040  1              31  ---  Highest Average Long Term Temperature
0x05  0x048  1              19  ---  Lowest Average Long Term Temperature
0x05  0x050  4               0  ---  Time in Over-Temperature
0x05  0x058  1              60  ---  Specified Maximum Operating Temperature
0x05  0x060  4               0  ---  Time in Under-Temperature
0x05  0x068  1               0  ---  Specified Minimum Operating Temperature
0x06  =====  =               =  ===  == Transport Statistics (rev 1) ==
0x06  0x008  4             443  ---  Number of Hardware Resets
0x06  0x010  4             434  ---  Number of ASR Events
0x06  0x018  4              15  ---  Number of Interface CRC Errors
0x07  =====  =               =  ===  == Solid State Device Statistics (rev 1) ==
0x07  0x008  1              10  ---  Percentage Used Endurance Indicator
                                |||_ C monitored condition met
                                ||__ D supports DSN
                                |___ N normalized value

Pending Defects log (GP Log 0x0c) not supported

SATA Phy Event Counters (GP Log 0x11)
ID      Size     Value  Description
0x0001  4            0  Command failed due to ICRC error
0x0003  4            0  R_ERR response for device-to-host data FIS
0x0004  4            0  R_ERR response for host-to-device data FIS
0x0006  4            0  R_ERR response for device-to-host non-data FIS
0x000a  4            3  Device-to-host register FISes sent due to a COMRESET
0x000b  4            0  CRC errors within host-to-device FIS
0x000d  4            0  Non-CRC errors within host-to-device FIS

