smartctl 7.3 2022-02-28 r5338 [x86_64-linux-6.8.12-12-pve] (local build)
Copyright (C) 2002-22, Bruce Allen, Christian Franke, www.smartmontools.org

=== START OF INFORMATION SECTION ===
Device Model:     VK001920GWSXK
Serial Number:    200225EF5B2B
LU WWN Device Id: 5 00a075 125ef5b2b
Firmware Version: HPG3
User Capacity:    1,920,383,410,176 bytes [1.92 TB]
Sector Sizes:     512 bytes logical, 4096 bytes physical
Rotation Rate:    Solid State Device
Form Factor:      2.5 inches
TRIM Command:     Available, deterministic, zeroed
Device is:        Not in smartctl database 7.3/5787
ATA Version is:   ACS-3 T13/2161-D revision 5
SATA Version is:  SATA 3.2, 6.0 Gb/s (current: 6.0 Gb/s)
Local Time is:    Tue Jul 22 10:04:53 2025 PDT
SMART support is: Available - device has SMART capability.
SMART support is: Enabled
AAM feature is:   Unavailable
APM feature is:   Unavailable
Rd look-ahead is: Enabled
Write cache is:   Disabled
DSN feature is:   Unavailable
ATA Security is:  Unavailable
Wt Cache Reorder: Enabled

=== START OF READ SMART DATA SECTION ===
SMART overall-health self-assessment test result: PASSED

General SMART Values:
Offline data collection status:  (0x00)	Offline data collection activity
					was never started.
					Auto Offline Data Collection: Disabled.
Self-test execution status:      (   0)	The previous self-test routine completed
					without error or no self-test has ever
					been run.
Total time to complete Offline
data collection: 		( 3780) seconds.
Offline data collection
capabilities: 			 (0x7b) SMART execute Offline immediate.
					Auto Offline data collection on/off support.
					Suspend Offline collection upon new
					command.
					Offline surface scan supported.
					Self-test supported.
					Conveyance Self-test supported.
					Selective Self-test supported.
SMART capabilities:            (0x0003)	Saves SMART data before entering
					power-saving mode.
					Supports SMART auto save timer.
Error logging capability:        (0x01)	Error logging supported.
					General Purpose Logging supported.
Short self-test routine
recommended polling time: 	 (   2) minutes.
Extended self-test routine
recommended polling time: 	 (  14) minutes.
Conveyance self-test routine
recommended polling time: 	 (   3) minutes.
SCT capabilities: 	       (0x0035)	SCT Status supported.
					SCT Feature Control supported.
					SCT Data Table supported.

SMART Attributes Data Structure revision number: 16
Vendor Specific SMART Attributes with Thresholds:
ID# ATTRIBUTE_NAME          FLAGS    VALUE WORST THRESH FAIL RAW_VALUE
  1 Raw_Read_Error_Rate     POSR--   100   100   050    -    0
  5 Reallocated_Sector_Ct   PO--CK   100   100   010    -    0
  9 Power_On_Hours          -O--CK   100   100   000    -    27901
 11 Unknown_SSD_Attribute   -O--C-   100   100   000    -    41
 12 Power_Cycle_Count       -O--CK   100   100   000    -    48
171 Unknown_Attribute       -O--CK   100   100   000    -    0
172 Unknown_Attribute       -O--CK   100   100   000    -    0
173 Unknown_Attribute       PO--CK   099   099   010    -    112
174 Unknown_Attribute       -O--CK   100   100   000    -    41
175 Program_Fail_Count_Chip PO--CK   100   100   001    -    0
180 Unused_Rsvd_Blk_Cnt_Tot PO-RCK   100   100   001    -    0
184 End-to-End_Error        -O--CK   100   100   000    -    0
187 Reported_Uncorrect      -O--CK   100   100   000    -    0
188 Command_Timeout         -O--CK   100   100   000    -    151
194 Temperature_Celsius     -O---K   062   062   000    -    38 (Min/Max 19/38)
196 Reallocated_Event_Count PO--CK   100   100   001    -    0
197 Current_Pending_Sector  -O--C-   100   100   000    -    0
198 Offline_Uncorrectable   ----C-   100   100   000    -    0
199 UDMA_CRC_Error_Count    -OSRCK   100   100   000    -    0
                            ||||||_ K auto-keep
                            |||||__ C event count
                            ||||___ R error rate
                            |||____ S speed/performance
                            ||_____ O updated online
                            |______ P prefailure warning

General Purpose Log Directory Version 1
SMART           Log Directory Version 1 [multi-sector log support]
Address    Access  R/W   Size  Description
0x00       GPL,SL  R/O      1  Log Directory
0x03       GPL     R/O  16383  Ext. Comprehensive SMART error log
0x04       GPL,SL  R/O      8  Device Statistics log
0x07       GPL     R/O      1  Extended self-test log
0x08       GPL     R/O      2  Power Conditions log
0x09           SL  R/W      1  Selective self-test log
0x0c       GPL     R/O     16  Pending Defects log
0x10       GPL     R/O      1  NCQ Command Error log
0x11       GPL     R/O      1  SATA Phy Event Counters log
0x30       GPL     R/O      9  IDENTIFY DEVICE data log
0x80       GPL     R/W     16  Host vendor specific log
0x81-0x9f  GPL,SL  R/W     16  Host vendor specific log
0xa0       GPL     VS   35328  Device vendor specific log
0xa1       GPL,SL  VS       4  Device vendor specific log
0xa3       GPL     VS   13824  Device vendor specific log
0xa4       GPL     VS     354  Device vendor specific log
0xa4       SL      VS      98  Device vendor specific log
0xa5       GPL     VS    8000  Device vendor specific log
0xa5       SL      VS      64  Device vendor specific log
0xa6       GPL     VS    8000  Device vendor specific log
0xa6       SL      VS      64  Device vendor specific log
0xb5           SL  VS       1  Device vendor specific log
0xb6       GPL     VS    8193  Device vendor specific log
0xbb       GPL     VS       1  Device vendor specific log
0xd0       GPL     VS       1  Device vendor specific log
0xd7       GPL     VS       1  Device vendor specific log
0xe0       GPL,SL  R/W      1  SCT Command/Status
0xe1       GPL,SL  R/W      1  SCT Data Transfer

SMART Extended Comprehensive Error Log Version: 1 (16383 sectors)
No Errors Logged

SMART Error Log not supported

SMART Extended Self-test Log Version: 1 (1 sectors)
Num  Test_Description    Status                  Remaining  LifeTime(hours)  LBA_of_first_error
# 1  Short offline       Completed without error       00%     27901         -
# 2  Short offline       Completed without error       00%     27900         -
# 3  Vendor (0xff)       Completed without error       00%     27532         -
# 4  Vendor (0xff)       Completed without error       00%      1254         -
# 5  Vendor (0xff)       Completed without error       00%      1065         -
# 6  Vendor (0xff)       Completed without error       00%       506         -

SMART Self-test Log not supported

SMART Selective self-test log data structure revision number 1
 SPAN  MIN_LBA  MAX_LBA  CURRENT_TEST_STATUS
    1        0        0  Not_testing
    2        0        0  Not_testing
    3        0        0  Completed [00% left] (129396864-129462399)
    4        0        0  Not_testing
    5        0        0  Not_testing
Selective self-test flags (0x0):
  After scanning selected spans, do NOT read-scan remainder of disk.
If Selective self-test is pending on power-up, resume after 0 minute delay.

SCT Status Version:                  3
SCT Version (vendor specific):       1 (0x0001)
Device State:                        Active (0)
Current Temperature:                    38 Celsius
Power Cycle Min/Max Temperature:     37/38 Celsius
Lifetime    Min/Max Temperature:     19/38 Celsius
Specified Max Operating Temperature:    60 Celsius
Under/Over Temperature Limit Count:   0/0

SCT Temperature History Version:     2
Temperature Sampling Period:         1 minute
Temperature Logging Interval:        1 minute
Min/Max recommended Temperature:      0/60 Celsius
Min/Max Temperature Limit:           -5/75 Celsius
Temperature History Size (Index):    478 (115)

Index    Estimated Time   Temperature Celsius
 116    2025-07-22 02:07    25  ******
 ...    ..( 28 skipped).    ..  ******
 145    2025-07-22 02:36    25  ******
 146    2025-07-22 02:37    26  *******
 147    2025-07-22 02:38    26  *******
 148    2025-07-22 02:39    25  ******
 149    2025-07-22 02:40    25  ******
 150    2025-07-22 02:41    25  ******
 151    2025-07-22 02:42    26  *******
 152    2025-07-22 02:43    26  *******
 153    2025-07-22 02:44    25  ******
 ...    ..( 14 skipped).    ..  ******
 168    2025-07-22 02:59    25  ******
 169    2025-07-22 03:00    26  *******
 170    2025-07-22 03:01    25  ******
 171    2025-07-22 03:02    25  ******
 172    2025-07-22 03:03    25  ******
 173    2025-07-22 03:04    26  *******
 174    2025-07-22 03:05    25  ******
 175    2025-07-22 03:06    25  ******
 176    2025-07-22 03:07    26  *******
 177    2025-07-22 03:08    26  *******
 178    2025-07-22 03:09    26  *******
 179    2025-07-22 03:10    25  ******
 ...    ..( 30 skipped).    ..  ******
 210    2025-07-22 03:41    25  ******
 211    2025-07-22 03:42    26  *******
 212    2025-07-22 03:43    26  *******
 213    2025-07-22 03:44    25  ******
 214    2025-07-22 03:45    25  ******
 215    2025-07-22 03:46    25  ******
 216    2025-07-22 03:47    26  *******
 217    2025-07-22 03:48    25  ******
 ...    ..( 16 skipped).    ..  ******
 234    2025-07-22 04:05    25  ******
 235    2025-07-22 04:06    26  *******
 236    2025-07-22 04:07    25  ******
 ...    ..(  3 skipped).    ..  ******
 240    2025-07-22 04:11    25  ******
 241    2025-07-22 04:12    26  *******
 242    2025-07-22 04:13    25  ******
 ...    ..(121 skipped).    ..  ******
 364    2025-07-22 06:15    25  ******
 365    2025-07-22 06:16    26  *******
 366    2025-07-22 06:17    26  *******
 367    2025-07-22 06:18     ?  -
 368    2025-07-22 06:19    24  *****
 369    2025-07-22 06:20    26  *******
 370    2025-07-22 06:21    26  *******
 371    2025-07-22 06:22    27  ********
 372    2025-07-22 06:23    27  ********
 373    2025-07-22 06:24    28  *********
 ...    ..(  7 skipped).    ..  *********
 381    2025-07-22 06:32    28  *********
 382    2025-07-22 06:33    30  ***********
 ...    ..(  2 skipped).    ..  ***********
 385    2025-07-22 06:36    30  ***********
 386    2025-07-22 06:37    29  **********
 ...    ..( 24 skipped).    ..  **********
 411    2025-07-22 07:02    29  **********
 412    2025-07-22 07:03    30  ***********
 413    2025-07-22 07:04    30  ***********
 414    2025-07-22 07:05    30  ***********
 415    2025-07-22 07:06     ?  -
 416    2025-07-22 07:07    26  *******
 417    2025-07-22 07:08    28  *********
 418    2025-07-22 07:09    30  ***********
 419    2025-07-22 07:10    31  ************
 420    2025-07-22 07:11    32  *************
 421    2025-07-22 07:12    33  **************
 422    2025-07-22 07:13    33  **************
 423    2025-07-22 07:14    34  ***************
 424    2025-07-22 07:15    35  ****************
 425    2025-07-22 07:16    35  ****************
 426    2025-07-22 07:17    26  *******
 427    2025-07-22 07:18    25  ******
 428    2025-07-22 07:19    26  *******
 429    2025-07-22 07:20    25  ******
 430    2025-07-22 07:21    25  ******
 431    2025-07-22 07:22    25  ******
 432    2025-07-22 07:23     ?  -
 433    2025-07-22 07:24    38  *******************
 ...    ..( 20 skipped).    ..  *******************
 454    2025-07-22 07:45    38  *******************
 455    2025-07-22 07:46    37  ******************
 456    2025-07-22 07:47    38  *******************
 ...    ..(  5 skipped).    ..  *******************
 462    2025-07-22 07:53    38  *******************
 463    2025-07-22 07:54    37  ******************
 ...    ..(  6 skipped).    ..  ******************
 470    2025-07-22 08:01    37  ******************
 471    2025-07-22 08:02    38  *******************
 ...    ..(  5 skipped).    ..  *******************
 477    2025-07-22 08:08    38  *******************
   0    2025-07-22 08:09    26  *******
 ...    ..(  3 skipped).    ..  *******
   4    2025-07-22 08:13    26  *******
   5    2025-07-22 08:14    25  ******
   6    2025-07-22 08:15    25  ******
   7    2025-07-22 08:16    25  ******
   8    2025-07-22 08:17    26  *******
   9    2025-07-22 08:18    26  *******
  10    2025-07-22 08:19    25  ******
  11    2025-07-22 08:20    26  *******
 ...    ..( 12 skipped).    ..  *******
  24    2025-07-22 08:33    26  *******
  25    2025-07-22 08:34    25  ******
  26    2025-07-22 08:35    26  *******
 ...    ..(  7 skipped).    ..  *******
  34    2025-07-22 08:43    26  *******
  35    2025-07-22 08:44    25  ******
  36    2025-07-22 08:45    26  *******
  37    2025-07-22 08:46    25  ******
 ...    ..( 21 skipped).    ..  ******
  59    2025-07-22 09:08    25  ******
  60    2025-07-22 09:09    26  *******
 ...    ..(  2 skipped).    ..  *******
  63    2025-07-22 09:12    26  *******
  64    2025-07-22 09:13    25  ******
 ...    ..(  9 skipped).    ..  ******
  74    2025-07-22 09:23    25  ******
  75    2025-07-22 09:24    26  *******
  76    2025-07-22 09:25    25  ******
  77    2025-07-22 09:26    25  ******
  78    2025-07-22 09:27    25  ******
  79    2025-07-22 09:28    26  *******
  80    2025-07-22 09:29    25  ******
  81    2025-07-22 09:30    26  *******
  82    2025-07-22 09:31    26  *******
  83    2025-07-22 09:32    25  ******
 ...    ..(  2 skipped).    ..  ******
  86    2025-07-22 09:35    25  ******
  87    2025-07-22 09:36    26  *******
 ...    ..(  2 skipped).    ..  *******
  90    2025-07-22 09:39    26  *******
  91    2025-07-22 09:40    25  ******
 ...    ..( 15 skipped).    ..  ******
 107    2025-07-22 09:56    25  ******
 108    2025-07-22 09:57    26  *******
 109    2025-07-22 09:58    26  *******
 110    2025-07-22 09:59    25  ******
 111    2025-07-22 10:00    26  *******
 112    2025-07-22 10:01    25  ******
 ...    ..(  2 skipped).    ..  ******
 115    2025-07-22 10:04    25  ******

SCT Error Recovery Control command not supported

Device Statistics (GP Log 0x04)
Page  Offset Size        Value Flags Description
0x01  =====  =               =  ===  == General Statistics (rev 1) ==
0x01  0x008  4              48  ---  Lifetime Power-On Resets
0x01  0x010  4           27901  ---  Power-on Hours
0x01  0x018  6     93473680411  ---  Logical Sectors Written
0x01  0x020  6       949929978  ---  Number of Write Commands
0x01  0x028  6    506445084969  ---  Logical Sectors Read
0x01  0x030  6      4870863022  ---  Number of Read Commands
0x01  0x038  6    100447157090  ---  Date and Time TimeStamp
0x04  =====  =               =  ===  == General Errors Statistics (rev 1) ==
0x04  0x008  4               0  ---  Number of Reported Uncorrectable Errors
0x04  0x010  4             151  ---  Resets Between Cmd Acceptance and Completion
0x05  =====  =               =  ===  == Temperature Statistics (rev 1) ==
0x05  0x008  1              38  ---  Current Temperature
0x05  0x010  1              25  ---  Average Short Term Temperature
0x05  0x018  1              24  ---  Average Long Term Temperature
0x05  0x020  1              38  ---  Highest Temperature
0x05  0x028  1              19  ---  Lowest Temperature
0x05  0x030  1              27  ---  Highest Average Short Term Temperature
0x05  0x038  1              22  ---  Lowest Average Short Term Temperature
0x05  0x040  1              25  ---  Highest Average Long Term Temperature
0x05  0x048  1              23  ---  Lowest Average Long Term Temperature
0x05  0x050  4               0  ---  Time in Over-Temperature
0x05  0x058  1              60  ---  Specified Maximum Operating Temperature
0x05  0x060  4               0  ---  Time in Under-Temperature
0x05  0x068  1               0  ---  Specified Minimum Operating Temperature
0x06  =====  =               =  ===  == Transport Statistics (rev 1) ==
0x06  0x008  4             297  ---  Number of Hardware Resets
0x06  0x010  4             251  ---  Number of ASR Events
0x06  0x018  4               0  ---  Number of Interface CRC Errors
0x07  =====  =               =  ===  == Solid State Device Statistics (rev 1) ==
0x07  0x008  1               1  N--  Percentage Used Endurance Indicator
                                |||_ C monitored condition met
                                ||__ D supports DSN
                                |___ N normalized value

Pending Defects log (GP Log 0x0c)
No Defects Logged

SATA Phy Event Counters (GP Log 0x11)
ID      Size     Value  Description
0x0001  4            0  Command failed due to ICRC error
0x0003  4            0  R_ERR response for device-to-host data FIS
0x0004  4            0  R_ERR response for host-to-device data FIS
0x0006  4            0  R_ERR response for device-to-host non-data FIS
0x000a  4            3  Device-to-host register FISes sent due to a COMRESET
0x000b  4            0  CRC errors within host-to-device FIS
0x000d  4            0  Non-CRC errors within host-to-device FIS