smartctl 6.6 2016-05-31 r4324 [x86_64-linux-4.10.0-33-generic] (local build)
Copyright (C) 2002-16, Bruce Allen, Christian Franke, www.smartmontools.org

=== START OF INFORMATION SECTION ===
Device Model:     StorFly VSFCS2CC060G-100
Firmware Version: 0409-000
User Capacity:    60 022 480 896 bytes [60,0 GB]
Sector Size:      512 bytes logical/physical
Rotation Rate:    Solid State Device
Device is:        Not in smartctl database [for details use: -P showall]
ATA Version is:   ACS-2 (minor revision not indicated)
SATA Version is:  SATA 3.1, 6.0 Gb/s (current: 3.0 Gb/s)
Local Time is:    Wed Oct  4 08:23:37 2017 CEST
SMART support is: Available - device has SMART capability.
SMART support is: Enabled
AAM feature is:   Disabled
APM feature is:   Unavailable
Rd look-ahead is: Enabled
Write cache is:   Enabled
ATA Security is:  Disabled, frozen [SEC2]
Wt Cache Reorder: Unavailable

=== START OF READ SMART DATA SECTION ===
SMART overall-health self-assessment test result: PASSED

General SMART Values:
Offline data collection status:  (0x00)	Offline data collection activity
					was never started.
					Auto Offline Data Collection: Disabled.
Self-test execution status:      (   0)	The previous self-test routine completed
					without error or no self-test has ever 
					been run.
Total time to complete Offline 
data collection: 		(    0) seconds.
Offline data collection
capabilities: 			 (0x71) SMART execute Offline immediate.
					No Auto Offline data collection support.
					Suspend Offline collection upon new
					command.
					No Offline surface scan supported.
					Self-test supported.
					Conveyance Self-test supported.
					Selective Self-test supported.
SMART capabilities:            (0x0002)	Does not save SMART data before
					entering power-saving mode.
					Supports SMART auto save timer.
Error logging capability:        (0x01)	Error logging supported.
					General Purpose Logging supported.
Short self-test routine 
recommended polling time: 	 (   2) minutes.
Extended self-test routine
recommended polling time: 	 (  10) minutes.
Conveyance self-test routine
recommended polling time: 	 (   2) minutes.

SMART Attributes Data Structure revision number: 1
Vendor Specific SMART Attributes with Thresholds:
ID# ATTRIBUTE_NAME          FLAGS    VALUE WORST THRESH FAIL RAW_VALUE
  1 Raw_Read_Error_Rate     ------   100   100   000    -    0
  5 Reallocated_Sector_Ct   ------   100   100   000    -    0
  9 Power_On_Hours          ------   100   100   000    -    159
 12 Power_Cycle_Count       ------   100   100   000    -    97
192 Power-Off_Retract_Count ------   100   100   000    -    31
194 Temperature_Celsius     ------   100   100   000    -    33
195 Hardware_ECC_Recovered  ------   100   100   000    -    1
196 Reallocated_Event_Count ------   100   100   016    -    0
199 UDMA_CRC_Error_Count    ------   100   100   050    -    0
160 Unknown_Attribute       ------   100   100   000    -    0
161 Unknown_Attribute       ------   100   100   000    -    113
163 Unknown_Attribute       ------   100   100   000    -    34
164 Unknown_Attribute       ------   100   100   000    -    30003
165 Unknown_Attribute       ------   100   100   000    -    74
166 Unknown_Attribute       ------   100   100   000    -    0
167 Unknown_Attribute       ------   100   100   000    -    29
241 Total_LBAs_Written      ------   100   100   000    -    41735
242 Total_LBAs_Read         ------   100   100   000    -    36229
168 Unknown_Attribute       ------   100   100   000    -    3000
169 Unknown_Attribute       ------   100   100   000    -    100
232 Available_Reservd_Space ------   100   100   000    -    100
175 Program_Fail_Count_Chip ------   100   100   000    -    0
176 Erase_Fail_Count_Chip   ------   100   100   000    -    0
177 Wear_Leveling_Count     ------   100   100   050    -    0
178 Used_Rsvd_Blk_Cnt_Chip  ------   100   100   000    -    0
181 Program_Fail_Cnt_Total  ------   100   100   000    -    0
182 Erase_Fail_Count_Total  ------   100   100   000    -    0
187 Reported_Uncorrect      ------   100   100   000    -    0
225 Unknown_SSD_Attribute   ------   100   100   000    -    41735
198 Offline_Uncorrectable   ------   100   100   000    -    0
                            ||||||_ K auto-keep
                            |||||__ C event count
                            ||||___ R error rate
                            |||____ S speed/performance
                            ||_____ O updated online
                            |______ P prefailure warning

General Purpose Log Directory Version 1
SMART           Log Directory Version 1 [multi-sector log support]
Address    Access  R/W   Size  Description
0x00       GPL,SL  R/O      1  Log Directory
0x01       GPL,SL  R/O      1  Summary SMART error log
0x02       GPL,SL  R/O      1  Comprehensive SMART error log
0x03       GPL,SL  R/O      1  Ext. Comprehensive SMART error log
0x04       GPL,SL  R/O      8  Device Statistics log
0x06       GPL,SL  R/O      1  SMART self-test log
0x07       GPL,SL  R/O      1  Extended self-test log
0x09       GPL,SL  R/W      1  Selective self-test log
0x10       GPL,SL  R/O      1  SATA NCQ Queued Error log
0x30       GPL,SL  R/O      9  IDENTIFY DEVICE data log
0x80-0x9f  GPL,SL  R/W     16  Host vendor specific log

SMART Extended Comprehensive Error Log Version: 1 (1 sectors)
No Errors Logged

SMART Extended Self-test Log Version: 1 (1 sectors)
No self-tests have been logged.  [To run self-tests, use: smartctl -t]

SMART Selective self-test log data structure revision number 1
 SPAN  MIN_LBA  MAX_LBA  CURRENT_TEST_STATUS
    1        0        0  Not_testing
    2        0        0  Not_testing
    3        0        0  Not_testing
    4        0        0  Not_testing
    5        0        0  Not_testing
Selective self-test flags (0x0):
  After scanning selected spans, do NOT read-scan remainder of disk.
If Selective self-test is pending on power-up, resume after 0 minute delay.

SCT Commands not supported

Device Statistics (GP Log 0x04)
Page  Offset Size        Value Flags Description
0x01  =====  =               =  ===  == General Statistics (rev 2) ==
0x01  0x008  4              97  ---  Lifetime Power-On Resets
0x01  0x010  4             159  ---  Power-on Hours
0x01  0x018  6      2735170061  ---  Logical Sectors Written
0x01  0x020  6        20881664  ---  Number of Write Commands
0x01  0x028  6      2374315889  ---  Logical Sectors Read
0x01  0x030  6        21502891  ---  Number of Read Commands
0x02  =====  =               =  ===  == Free-Fall Statistics (empty) ==
0x03  =====  =               =  ===  == Rotating Media Statistics (empty) ==
0x04  =====  =               =  ===  == General Errors Statistics (rev 1) ==
0x04  0x008  4               0  ---  Number of Reported Uncorrectable Errors
0x04  0x010  4              31  ---  Resets Between Cmd Acceptance and Completion
0x05  =====  =               =  ===  == Temperature Statistics (empty) ==
0x06  =====  =               =  ===  == Transport Statistics (rev 1) ==
0x06  0x008  4             198  ---  Number of Hardware Resets
0x06  0x018  4               0  ---  Number of Interface CRC Errors
0x07  =====  =               =  ===  == Solid State Device Statistics (rev 1) ==
0x07  0x008  1               0  ---  Percentage Used Endurance Indicator
                                |||_ C monitored condition met
                                ||__ D supports DSN
                                |___ N normalized value

SATA Phy Event Counters (GP Log 0x11) not supported

