smartctl 6.4 2015-06-04 r4109 [FreeBSD 10.2-RELEASE-p7 amd64] (local build)
Copyright (C) 2002-15, Bruce Allen, Christian Franke, www.smartmontools.org

=== START OF INFORMATION SECTION ===
Device Model:     SG9XCS2D50GE01
Serial Number:    5G000KEN
LU WWN Device Id: 5 000516 100114ae0
Firmware Version: SA03F34V
User Capacity:    50,020,540,416 bytes [50.0 GB]
Sector Size:      512 bytes logical/physical
Rotation Rate:    Solid State Device
Device is:        Not in smartctl database [for details use: -P showall]
ATA Version is:   ATA8-ACS T13/1699-D revision 6
SATA Version is:  SATA 2.6, 3.0 Gb/s
Local Time is:    Mon Mar 21 17:47:11 2016 UTC
SMART support is: Available - device has SMART capability.
SMART support is: Enabled
AAM feature is:   Unavailable
APM feature is:   Unavailable
Rd look-ahead is: Enabled
Write cache is:   Enabled
ATA Security is:  Disabled, NOT FROZEN [SEC1]
Wt Cache Reorder: Unknown (0x100)

=== START OF READ SMART DATA SECTION ===
SMART overall-health self-assessment test result: PASSED

General SMART Values:
Offline data collection status:  (0x02)	Offline data collection activity
					was completed without error.
					Auto Offline Data Collection: Disabled.
Self-test execution status:      (   0)	The previous self-test routine completed
					without error or no self-test has ever 
					been run.
Total time to complete Offline 
data collection: 		(    0) seconds.
Offline data collection
capabilities: 			 (0x7f) SMART execute Offline immediate.
					Auto Offline data collection on/off support.
					Abort Offline collection upon new
					command.
					Offline surface scan supported.
					Self-test supported.
					Conveyance Self-test supported.
					Selective Self-test supported.
SMART capabilities:            (0x0003)	Saves SMART data before entering
					power-saving mode.
					Supports SMART auto save timer.
Error logging capability:        (0x01)	Error logging supported.
					General Purpose Logging supported.
Short self-test routine 
recommended polling time: 	 (   1) minutes.
Extended self-test routine
recommended polling time: 	 (   5) minutes.
Conveyance self-test routine
recommended polling time: 	 (   2) minutes.
SCT capabilities: 	       (0x003d)	SCT Status supported.
					SCT Error Recovery Control supported.
					SCT Feature Control supported.
					SCT Data Table supported.

SMART Attributes Data Structure revision number: 10
Vendor Specific SMART Attributes with Thresholds:
ID# ATTRIBUTE_NAME          FLAGS    VALUE WORST THRESH FAIL RAW_VALUE
  1 Raw_Read_Error_Rate     POSR--   106   099   050    -    12592394
  5 Reallocated_Sector_Ct   PO--CK   100   100   003    -    0
  9 Power_On_Hours          -O--CK   100   100   000    -    34914 (46 192 0)
 12 Power_Cycle_Count       -O--CK   100   100   000    -    18
 13 Read_Soft_Error_Rate    -O-R--   070   065   000    -    19774042023178
100 Unknown_Attribute       -O--CK   000   000   000    -    74880
170 Unknown_Attribute       -O--CK   000   000   000    -    17248
171 Unknown_Attribute       -O--CK   000   000   000    -    0
172 Unknown_Attribute       -O--CK   000   000   000    -    0
174 Unknown_Attribute       ----CK   000   000   000    -    6
177 Wear_Leveling_Count     ------   000   000   000    -    3
181 Program_Fail_Cnt_Total  -O--CK   000   000   000    -    0
182 Erase_Fail_Count_Total  -O--CK   000   000   000    -    0
184 End-to-End_Error        -O--CK   100   100   090    -    0
187 Reported_Uncorrect      -O--CK   100   100   000    -    0
194 Temperature_Celsius     -O---K   025   043   000    -    25 (Min/Max 16/43)
195 Hardware_ECC_Recovered  --SRC-   106   099   000    -    12592394
196 Reallocated_Event_Count PO--CK   100   100   003    -    0
198 Offline_Uncorrectable   ----C-   106   099   000    -    40724879900672
199 UDMA_CRC_Error_Count    -OSRCK   200   200   000    -    0
201 Unknown_SSD_Attribute   --SRC-   106   099   000    -    12592394
204 Soft_ECC_Correction     --SRC-   106   099   000    -    12592394
230 Unknown_SSD_Attribute   PO--C-   100   100   000    -    100
231 Temperature_Celsius     PO--C-   099   099   010    -    0
232 Available_Reservd_Space ------   000   000   000    -    16
233 Media_Wearout_Indicator ------   000   000   000    -    75008
234 Unknown_Attribute       -O--CK   000   000   000    -    157312
235 Unknown_Attribute       PO--CK   100   100   002    -    0
241 Total_LBAs_Written      -O--CK   000   000   000    -    157312
242 Total_LBAs_Read         -O--CK   000   000   000    -    11904
                            ||||||_ K auto-keep
                            |||||__ C event count
                            ||||___ R error rate
                            |||____ S speed/performance
                            ||_____ O updated online
                            |______ P prefailure warning

General Purpose Log Directory Version 1
SMART           Log Directory Version 1 [multi-sector log support]
Address    Access  R/W   Size  Description
0x00       GPL,SL  R/O      1  Log Directory
0x03       GPL     R/O     16  Ext. Comprehensive SMART error log
0x04       GPL,SL  R/O      8  Device Statistics log
0x07       GPL     R/O      1  Extended self-test log
0x09           SL  R/W      1  Selective self-test log
0x10       GPL     R/O      1  SATA NCQ Queued Error log
0x11       GPL,SL  R/O      1  SATA Phy Event Counters log
0x80-0x9f  GPL,SL  R/W     16  Host vendor specific log
0xa8       GPL,SL  VS      16  Device vendor specific log
0xb7       GPL,SL  VS      16  Device vendor specific log
0xe0       GPL,SL  R/W      1  SCT Command/Status
0xe1       GPL,SL  R/W      1  SCT Data Transfer

SMART Extended Comprehensive Error Log Version: 1 (16 sectors)
No Errors Logged

SMART Extended Self-test Log Version: 1 (1 sectors)
Num  Test_Description    Status                  Remaining  LifeTime(hours)  LBA_of_first_error
# 1  Short offline       Self-test routine in progress 90%     34914         -

SMART Selective self-test log data structure revision number 1
 SPAN  MIN_LBA  MAX_LBA  CURRENT_TEST_STATUS
    1        0        0  Not_testing
    2        0        0  Not_testing
    3        0        0  Not_testing
    4        0        0  Not_testing
    5        0        0  Not_testing
Selective self-test flags (0x0):
  After scanning selected spans, do NOT read-scan remainder of disk.
If Selective self-test is pending on power-up, resume after 0 minute delay.

SCT Status Version:                  3
SCT Version (vendor specific):       0 (0x0000)
SCT Support Level:                   1
Device State:                        Active (0)
Current Temperature:                    25 Celsius
Power Cycle Min/Max Temperature:     25/27 Celsius
Lifetime    Min/Max Temperature:     16/43 Celsius
Under/Over Temperature Limit Count:   0/0

SCT Temperature History Version:     2
Temperature Sampling Period:         1 minute
Temperature Logging Interval:        1 minute
Min/Max recommended Temperature:      ?/ ? Celsius
Min/Max Temperature Limit:            ?/ ? Celsius
Temperature History Size (Index):    478 (345)

Index    Estimated Time   Temperature Celsius
 346    2016-03-21 09:50    25  ******
 ...    ..( 91 skipped).    ..  ******
 438    2016-03-21 11:22    25  ******
 439    2016-03-21 11:23     ?  -
 440    2016-03-21 11:24    26  *******
 441    2016-03-21 11:25    26  *******
 442    2016-03-21 11:26    26  *******
 443    2016-03-21 11:27    25  ******
 ...    ..(  7 skipped).    ..  ******
 451    2016-03-21 11:35    25  ******
 452    2016-03-21 11:36     ?  -
 453    2016-03-21 11:37    25  ******
 ...    ..(369 skipped).    ..  ******
 345    2016-03-21 17:47    25  ******

SCT Error Recovery Control:
           Read:    256 (25.6 seconds)
          Write:    256 (25.6 seconds)

Device Statistics (GP Log 0x04)
Page  Offset Size        Value Flags Description
0x07  =====  =               =  ===  == Solid State Device Statistics (empty) ==
                                |||_ C monitored condition met
                                ||__ D supports DSN
                                |___ N normalized value

SATA Phy Event Counters (GP Log 0x11)
ID      Size     Value  Description
0x0001  2            0  Command failed due to ICRC error
0x000a  2            6  Device-to-host register FISes sent due to a COMRESET

