smartctl 6.2 2013-07-26 r3841 [x86_64-linux-3.10.0-514.26.2.el7.x86_64] (local build)
Copyright (C) 2002-13, Bruce Allen, Christian Franke, www.smartmontools.org

=== START OF INFORMATION SECTION ===
Device Model:     SAMSUNG MZ7LN256HMJP-00000
Firmware Version: MAV0100Q
User Capacity:    256,060,514,304 bytes [256 GB]
Sector Size:      512 bytes logical/physical
Rotation Rate:    Solid State Device
Device is:        Not in smartctl database [for details use: -P showall]
ATA Version is:   ACS-2, ATA8-ACS T13/1699-D revision 4c
SATA Version is:  SATA 3.1, 6.0 Gb/s (current: 6.0 Gb/s)
Local Time is:    Tue Sep 12 09:38:16 2017 CEST
SMART support is: Available - device has SMART capability.
SMART support is: Enabled
AAM feature is:   Unavailable
APM feature is:   Unavailable
Rd look-ahead is: Enabled
Write cache is:   Enabled
ATA Security is:  Disabled, frozen [SEC2]
Wt Cache Reorder: Enabled

=== START OF READ SMART DATA SECTION ===
SMART overall-health self-assessment test result: PASSED

General SMART Values:
Offline data collection status:  (0x00)	Offline data collection activity
					was never started.
					Auto Offline Data Collection: Disabled.
Self-test execution status:      (   0)	The previous self-test routine completed
					without error or no self-test has ever 
					been run.
Total time to complete Offline 
data collection: 		(    0) seconds.
Offline data collection
capabilities: 			 (0x53) SMART execute Offline immediate.
					Auto Offline data collection on/off support.
					Suspend Offline collection upon new
					command.
					No Offline surface scan supported.
					Self-test supported.
					No Conveyance Self-test supported.
					Selective Self-test supported.
SMART capabilities:            (0x0003)	Saves SMART data before entering
					power-saving mode.
					Supports SMART auto save timer.
Error logging capability:        (0x01)	Error logging supported.
					General Purpose Logging supported.
Short self-test routine 
recommended polling time: 	 (   2) minutes.
Extended self-test routine
recommended polling time: 	 ( 133) minutes.
SCT capabilities: 	       (0x003d)	SCT Status supported.
					SCT Error Recovery Control supported.
					SCT Feature Control supported.
					SCT Data Table supported.

SMART Attributes Data Structure revision number: 1
Vendor Specific SMART Attributes with Thresholds:
ID# ATTRIBUTE_NAME          FLAGS    VALUE WORST THRESH FAIL RAW_VALUE
  5 Reallocated_Sector_Ct   PO--CK   100   100   010    -    0
  9 Power_On_Hours          -O--CK   099   099   000    -    3862
 12 Power_Cycle_Count       -O--CK   099   099   000    -    9
170 Unknown_Attribute       -O--CK   100   100   010    -    0
171 Unknown_Attribute       -O--CK   100   100   010    -    0
172 Unknown_Attribute       -O--CK   100   100   010    -    0
173 Unknown_Attribute       PO--CK   098   098   005    -    21
174 Unknown_Attribute       -O--CK   100   100   000    -    0
178 Used_Rsvd_Blk_Cnt_Chip  PO--C-   100   100   010    -    0
180 Unused_Rsvd_Blk_Cnt_Tot PO--C-   100   100   010    -    827
184 End-to-End_Error        PO--CK   100   100   097    -    0
187 Reported_Uncorrect      -O--CK   100   100   000    -    0
194 Temperature_Celsius     -O--CK   066   057   000    -    34
199 UDMA_CRC_Error_Count    -OSRCK   100   100   000    -    0
233 Media_Wearout_Indicator PO--C-   098   098   000    -    16483613
241 Total_LBAs_Written      -O--CK   099   099   000    -    4061
242 Total_LBAs_Read         -O--CK   099   099   000    -    7842
249 Unknown_Attribute       -O--CK   099   099   000    -    5376
                            ||||||_ K auto-keep
                            |||||__ C event count
                            ||||___ R error rate
                            |||____ S speed/performance
                            ||_____ O updated online
                            |______ P prefailure warning

General Purpose Log Directory Version 1
SMART           Log Directory Version 1 [multi-sector log support]
Address    Access  R/W   Size  Description
0x00       GPL,SL  R/O      1  Log Directory
0x01           SL  R/O      1  Summary SMART error log
0x02           SL  R/O      1  Comprehensive SMART error log
0x03       GPL     R/O      1  Ext. Comprehensive SMART error log
0x06           SL  R/O      1  SMART self-test log
0x07       GPL     R/O      1  Extended self-test log
0x09           SL  R/W      1  Selective self-test log
0x10       GPL     R/O      1  NCQ Command Error log
0x11       GPL     R/O      1  SATA Phy Event Counters
0x13       GPL     R/O      1  SATA NCQ Send and Receive log
0x30       GPL,SL  R/O      9  IDENTIFY DEVICE data log
0x80-0x9f  GPL,SL  R/W     16  Host vendor specific log
0xdf       GPL,SL  VS       1  Device vendor specific log
0xe0       GPL,SL  R/W      1  SCT Command/Status
0xe1       GPL,SL  R/W      1  SCT Data Transfer

SMART Extended Comprehensive Error Log Version: 1 (1 sectors)
No Errors Logged

SMART Extended Self-test Log Version: 1 (1 sectors)
Num  Test_Description    Status                  Remaining  LifeTime(hours)  LBA_of_first_error
# 1  Extended offline    Completed without error       00%       100         -
# 2  Extended offline    Completed without error       00%        86         -
# 3  Extended offline    Completed without error       00%        17         -
# 4  Extended offline    Completed without error       00%         2         -

SMART Selective self-test log data structure revision number 1
 SPAN  MIN_LBA  MAX_LBA  CURRENT_TEST_STATUS
    1        0        0  Not_testing
    2        0        0  Not_testing
    3        0        0  Not_testing
    4        0        0  Not_testing
    5        0        0  Not_testing
  255        0    65535  Read_scanning was never started
Selective self-test flags (0x0):
  After scanning selected spans, do NOT read-scan remainder of disk.
If Selective self-test is pending on power-up, resume after 0 minute delay.

SCT Status Version:                  3
SCT Version (vendor specific):       256 (0x0100)
SCT Support Level:                   1
Device State:                        Active (0)
Current Temperature:                    34 Celsius
Power Cycle Min/Max Temperature:     24/43 Celsius
Lifetime    Min/Max Temperature:     24/43 Celsius
Under/Over Temperature Limit Count:   0/0
SCT Temperature History Version:     2
Temperature Sampling Period:         1 minute
Temperature Logging Interval:        10 minutes
Min/Max recommended Temperature:      0/70 Celsius
Min/Max Temperature Limit:            0/70 Celsius
Temperature History Size (Index):    128 (21)

Index    Estimated Time   Temperature Celsius
  22    2017-09-11 12:20    34  ***************
  23    2017-09-11 12:30    34  ***************
  24    2017-09-11 12:40    33  **************
 ...    ..(  7 skipped).    ..  **************
  32    2017-09-11 14:00    33  **************
  33    2017-09-11 14:10    34  ***************
  34    2017-09-11 14:20    33  **************
  35    2017-09-11 14:30    34  ***************
  36    2017-09-11 14:40    34  ***************
  37    2017-09-11 14:50    33  **************
  38    2017-09-11 15:00    33  **************
  39    2017-09-11 15:10    33  **************
  40    2017-09-11 15:20    34  ***************
  41    2017-09-11 15:30    33  **************
 ...    ..(  4 skipped).    ..  **************
  46    2017-09-11 16:20    33  **************
  47    2017-09-11 16:30    34  ***************
  48    2017-09-11 16:40    33  **************
  49    2017-09-11 16:50    33  **************
  50    2017-09-11 17:00    33  **************
  51    2017-09-11 17:10    34  ***************
  52    2017-09-11 17:20    33  **************
  53    2017-09-11 17:30    33  **************
  54    2017-09-11 17:40    34  ***************
  55    2017-09-11 17:50    34  ***************
  56    2017-09-11 18:00    33  **************
 ...    ..( 11 skipped).    ..  **************
  68    2017-09-11 20:00    33  **************
  69    2017-09-11 20:10    34  ***************
  70    2017-09-11 20:20    33  **************
  71    2017-09-11 20:30    33  **************
  72    2017-09-11 20:40    33  **************
  73    2017-09-11 20:50    34  ***************
  74    2017-09-11 21:00    34  ***************
  75    2017-09-11 21:10    33  **************
 ...    ..( 15 skipped).    ..  **************
  91    2017-09-11 23:50    33  **************
  92    2017-09-12 00:00    34  ***************
  93    2017-09-12 00:10    35  ****************
  94    2017-09-12 00:20    34  ***************
  95    2017-09-12 00:30    33  **************
 ...    ..(  4 skipped).    ..  **************
 100    2017-09-12 01:20    33  **************
 101    2017-09-12 01:30    32  *************
 102    2017-09-12 01:40    32  *************
 103    2017-09-12 01:50    33  **************
 104    2017-09-12 02:00    32  *************
 105    2017-09-12 02:10    32  *************
 106    2017-09-12 02:20    32  *************
 107    2017-09-12 02:30    33  **************
 108    2017-09-12 02:40    33  **************
 109    2017-09-12 02:50    32  *************
 110    2017-09-12 03:00    32  *************
 111    2017-09-12 03:10    32  *************
 112    2017-09-12 03:20    33  **************
 113    2017-09-12 03:30    32  *************
 114    2017-09-12 03:40    33  **************
 ...    ..( 12 skipped).    ..  **************
 127    2017-09-12 05:50    33  **************
   0    2017-09-12 06:00    34  ***************
   1    2017-09-12 06:10    34  ***************
   2    2017-09-12 06:20    33  **************
   3    2017-09-12 06:30    34  ***************
 ...    ..(  3 skipped).    ..  ***************
   7    2017-09-12 07:10    34  ***************
   8    2017-09-12 07:20    33  **************
 ...    ..(  2 skipped).    ..  **************
  11    2017-09-12 07:50    33  **************
  12    2017-09-12 08:00    34  ***************
  13    2017-09-12 08:10    34  ***************
  14    2017-09-12 08:20    33  **************
  15    2017-09-12 08:30    33  **************
  16    2017-09-12 08:40    34  ***************
  17    2017-09-12 08:50    33  **************
  18    2017-09-12 09:00    33  **************
  19    2017-09-12 09:10    34  ***************
  20    2017-09-12 09:20    33  **************
  21    2017-09-12 09:30    34  ***************

SCT Error Recovery Control:
           Read: Disabled
          Write: Disabled

Device Statistics (GP Log 0x04) not supported

SATA Phy Event Counters (GP Log 0x11)
ID      Size     Value  Description
0x0001  2            0  Command failed due to ICRC error
0x0002  2            0  R_ERR response for data FIS
0x0003  2            0  R_ERR response for device-to-host data FIS
0x0004  2            0  R_ERR response for host-to-device data FIS
0x0005  2            0  R_ERR response for non-data FIS
0x0006  2            0  R_ERR response for device-to-host non-data FIS
0x0007  2            0  R_ERR response for host-to-device non-data FIS
0x0008  2            0  Device-to-host non-data FIS retries
0x0009  2           23  Transition from drive PhyRdy to drive PhyNRdy
0x000a  2           23  Device-to-host register FISes sent due to a COMRESET
0x000b  2            0  CRC errors within host-to-device FIS
0x000d  2            0  Non-CRC errors within host-to-device FIS
0x000f  2            0  R_ERR response for host-to-device data FIS, CRC
0x0010  2            0  R_ERR response for host-to-device data FIS, non-CRC
0x0012  2            0  R_ERR response for host-to-device non-data FIS, CRC
0x0013  2            0  R_ERR response for host-to-device non-data FIS, non-CRC

