smartctl 6.2 2013-07-26 r3841 [x86_64-linux-3.10.0-514.26.2.el7.x86_64] (local build)
Copyright (C) 2002-13, Bruce Allen, Christian Franke, www.smartmontools.org

=== START OF INFORMATION SECTION ===
Device Model:     SAMSUNG MZ7LN512HMJP-00000
Firmware Version: MAV0100Q
User Capacity:    512,110,190,592 bytes [512 GB]
Sector Size:      512 bytes logical/physical
Rotation Rate:    Solid State Device
Device is:        Not in smartctl database [for details use: -P showall]
ATA Version is:   ACS-2, ATA8-ACS T13/1699-D revision 4c
SATA Version is:  SATA 3.1, 6.0 Gb/s (current: 6.0 Gb/s)
Local Time is:    Tue Sep 12 09:38:52 2017 CEST
SMART support is: Available - device has SMART capability.
SMART support is: Enabled
AAM feature is:   Unavailable
APM feature is:   Unavailable
Rd look-ahead is: Enabled
Write cache is:   Enabled
ATA Security is:  Disabled, frozen [SEC2]
Wt Cache Reorder: Enabled

=== START OF READ SMART DATA SECTION ===
SMART overall-health self-assessment test result: PASSED

General SMART Values:
Offline data collection status:  (0x00)	Offline data collection activity
					was never started.
					Auto Offline Data Collection: Disabled.
Self-test execution status:      (   0)	The previous self-test routine completed
					without error or no self-test has ever 
					been run.
Total time to complete Offline 
data collection: 		(    0) seconds.
Offline data collection
capabilities: 			 (0x53) SMART execute Offline immediate.
					Auto Offline data collection on/off support.
					Suspend Offline collection upon new
					command.
					No Offline surface scan supported.
					Self-test supported.
					No Conveyance Self-test supported.
					Selective Self-test supported.
SMART capabilities:            (0x0003)	Saves SMART data before entering
					power-saving mode.
					Supports SMART auto save timer.
Error logging capability:        (0x01)	Error logging supported.
					General Purpose Logging supported.
Short self-test routine 
recommended polling time: 	 (   2) minutes.
Extended self-test routine
recommended polling time: 	 ( 265) minutes.
SCT capabilities: 	       (0x003d)	SCT Status supported.
					SCT Error Recovery Control supported.
					SCT Feature Control supported.
					SCT Data Table supported.

SMART Attributes Data Structure revision number: 1
Vendor Specific SMART Attributes with Thresholds:
ID# ATTRIBUTE_NAME          FLAGS    VALUE WORST THRESH FAIL RAW_VALUE
  5 Reallocated_Sector_Ct   PO--CK   099   099   010    -    1
  9 Power_On_Hours          -O--CK   099   099   000    -    3975
 12 Power_Cycle_Count       -O--CK   099   099   000    -    7
170 Unknown_Attribute       -O--CK   099   099   010    -    1
171 Unknown_Attribute       -O--CK   100   100   010    -    0
172 Unknown_Attribute       -O--CK   100   100   010    -    0
173 Unknown_Attribute       PO--CK   099   099   005    -    2
174 Unknown_Attribute       -O--CK   100   100   000    -    0
178 Used_Rsvd_Blk_Cnt_Chip  PO--C-   099   099   010    -    1
180 Unused_Rsvd_Blk_Cnt_Tot PO--C-   099   099   010    -    1603
184 End-to-End_Error        PO--CK   100   100   097    -    0
187 Reported_Uncorrect      -O--CK   099   099   000    -    6
194 Temperature_Celsius     -O--CK   066   056   000    -    34
199 UDMA_CRC_Error_Count    -OSRCK   100   100   000    -    0
233 Media_Wearout_Indicator PO--C-   099   099   000    -    16749252
241 Total_LBAs_Written      -O--CK   099   099   000    -    1452
242 Total_LBAs_Read         -O--CK   099   099   000    -    13730
249 Unknown_Attribute       -O--CK   099   099   000    -    1452
                            ||||||_ K auto-keep
                            |||||__ C event count
                            ||||___ R error rate
                            |||____ S speed/performance
                            ||_____ O updated online
                            |______ P prefailure warning

General Purpose Log Directory Version 1
SMART           Log Directory Version 1 [multi-sector log support]
Address    Access  R/W   Size  Description
0x00       GPL,SL  R/O      1  Log Directory
0x01           SL  R/O      1  Summary SMART error log
0x02           SL  R/O      1  Comprehensive SMART error log
0x03       GPL     R/O      1  Ext. Comprehensive SMART error log
0x06           SL  R/O      1  SMART self-test log
0x07       GPL     R/O      1  Extended self-test log
0x09           SL  R/W      1  Selective self-test log
0x10       GPL     R/O      1  NCQ Command Error log
0x11       GPL     R/O      1  SATA Phy Event Counters
0x13       GPL     R/O      1  SATA NCQ Send and Receive log
0x30       GPL,SL  R/O      9  IDENTIFY DEVICE data log
0x80-0x9f  GPL,SL  R/W     16  Host vendor specific log
0xdf       GPL,SL  VS       1  Device vendor specific log
0xe0       GPL,SL  R/W      1  SCT Command/Status
0xe1       GPL,SL  R/W      1  SCT Data Transfer

SMART Extended Comprehensive Error Log Version: 1 (1 sectors)
Device Error Count: 6 (device log contains only the most recent 4 errors)
	CR     = Command Register
	FEATR  = Features Register
	COUNT  = Count (was: Sector Count) Register
	LBA_48 = Upper bytes of LBA High/Mid/Low Registers ]  ATA-8
	LH     = LBA High (was: Cylinder High) Register    ]   LBA
	LM     = LBA Mid (was: Cylinder Low) Register      ] Register
	LL     = LBA Low (was: Sector Number) Register     ]
	DV     = Device (was: Device/Head) Register
	DC     = Device Control Register
	ER     = Error register
	ST     = Status register
Powered_Up_Time is measured from power on, and printed as
DDd+hh:mm:SS.sss where DD=days, hh=hours, mm=minutes,
SS=sec, and sss=millisec. It "wraps" after 49.710 days.

Error 6 [1] occurred at disk power-on lifetime: 1735 hours (72 days + 7 hours)
  When the command that caused the error occurred, the device was active or idle.

  After command completion occurred, registers were:
  ER -- ST COUNT  LBA_48  LH LM LL DV DC
  -- -- -- == -- == == == -- -- -- -- --
  40 -- 51 00 80 00 00 18 70 43 80 e0 00  Error: UNC 128 sectors at LBA = 0x18704380 = 410010496

  Commands leading to the command that caused the error were:
  CR FEATR COUNT  LBA_48  LH LM LL DV DC  Powered_Up_Time  Command/Feature_Name
  -- == -- == -- == == == -- -- -- -- --  ---------------  --------------------
  25 00 00 00 80 00 00 18 70 43 80 e0 18 21d+16:43:44.704  READ DMA EXT
  47 00 00 00 01 00 00 00 00 08 30 e0 18 21d+16:43:44.704  READ LOG DMA EXT
  47 00 00 00 01 00 00 00 00 00 13 e0 18 21d+16:43:44.704  READ LOG DMA EXT
  ef 00 10 00 02 00 00 00 00 00 00 e0 18 21d+16:43:44.704  SET FEATURES [Enable SATA feature]
  27 00 00 00 00 00 00 00 00 00 00 e0 18 21d+16:43:44.704  READ NATIVE MAX ADDRESS EXT [OBS-ACS-3]

Error 5 [0] occurred at disk power-on lifetime: 1735 hours (72 days + 7 hours)
  When the command that caused the error occurred, the device was active or idle.

  After command completion occurred, registers were:
  ER -- ST COUNT  LBA_48  LH LM LL DV DC
  -- -- -- == -- == == == -- -- -- -- --
  40 -- 51 00 80 00 00 18 70 43 00 e0 00  Error: UNC 128 sectors at LBA = 0x18704300 = 410010368

  Commands leading to the command that caused the error were:
  CR FEATR COUNT  LBA_48  LH LM LL DV DC  Powered_Up_Time  Command/Feature_Name
  -- == -- == -- == == == -- -- -- -- --  ---------------  --------------------
  25 00 00 00 80 00 00 18 70 43 00 e0 18 21d+16:43:44.704  READ DMA EXT
  25 00 00 00 80 00 00 18 70 52 00 e0 18 21d+16:43:44.704  READ DMA EXT
  25 00 00 00 80 00 00 18 70 51 80 e0 18 21d+16:43:44.704  READ DMA EXT
  25 00 00 00 80 00 00 18 70 51 00 e0 18 21d+16:43:44.704  READ DMA EXT
  25 00 00 00 80 00 00 18 70 50 80 e0 18 21d+16:43:44.704  READ DMA EXT

Error 4 [3] occurred at disk power-on lifetime: 1735 hours (72 days + 7 hours)
  When the command that caused the error occurred, the device was active or idle.

  After command completion occurred, registers were:
  ER -- ST COUNT  LBA_48  LH LM LL DV DC
  -- -- -- == -- == == == -- -- -- -- --
  40 -- 51 00 c0 00 00 18 70 4d 80 40 00  Error: UNC at LBA = 0x18704d80 = 410013056

  Commands leading to the command that caused the error were:
  CR FEATR COUNT  LBA_48  LH LM LL DV DC  Powered_Up_Time  Command/Feature_Name
  -- == -- == -- == == == -- -- -- -- --  ---------------  --------------------
  60 00 80 00 c0 00 00 18 70 4d 80 40 18 21d+16:43:43.704  READ FPDMA QUEUED
  60 00 80 00 b8 00 00 18 70 4e 00 40 17 21d+16:43:43.704  READ FPDMA QUEUED
  60 00 80 00 b0 00 00 18 70 4e 80 40 16 21d+16:43:43.704  READ FPDMA QUEUED
  60 00 80 00 a8 00 00 18 70 4f 00 40 15 21d+16:43:43.704  READ FPDMA QUEUED
  60 00 80 00 a0 00 00 18 70 4f 80 40 14 21d+16:43:43.704  READ FPDMA QUEUED

Error 3 [2] occurred at disk power-on lifetime: 1735 hours (72 days + 7 hours)
  When the command that caused the error occurred, the device was active or idle.

  After command completion occurred, registers were:
  ER -- ST COUNT  LBA_48  LH LM LL DV DC
  -- -- -- == -- == == == -- -- -- -- --
  40 -- 51 00 48 00 00 18 70 52 00 40 00  Error: UNC at LBA = 0x18705200 = 410014208

  Commands leading to the command that caused the error were:
  CR FEATR COUNT  LBA_48  LH LM LL DV DC  Powered_Up_Time  Command/Feature_Name
  -- == -- == -- == == == -- -- -- -- --  ---------------  --------------------
  60 00 80 00 48 00 00 18 70 52 00 40 09 21d+16:43:43.704  READ FPDMA QUEUED
  60 00 80 00 40 00 00 18 70 51 80 40 08 21d+16:43:43.704  READ FPDMA QUEUED
  60 00 80 00 38 00 00 18 70 51 00 40 07 21d+16:43:43.704  READ FPDMA QUEUED
  60 00 80 00 30 00 00 18 70 50 80 40 06 21d+16:43:43.704  READ FPDMA QUEUED
  60 00 80 00 28 00 00 18 70 50 00 40 05 21d+16:43:43.704  READ FPDMA QUEUED

SMART Extended Self-test Log Version: 1 (1 sectors)
Num  Test_Description    Status                  Remaining  LifeTime(hours)  LBA_of_first_error
# 1  Extended offline    Completed without error       00%        21         -
# 2  Extended offline    Completed without error       00%         4         -

SMART Selective self-test log data structure revision number 1
 SPAN  MIN_LBA  MAX_LBA  CURRENT_TEST_STATUS
    1        0        0  Not_testing
    2        0        0  Not_testing
    3        0        0  Not_testing
    4        0        0  Not_testing
    5        0        0  Not_testing
  255        0    65535  Read_scanning was never started
Selective self-test flags (0x0):
  After scanning selected spans, do NOT read-scan remainder of disk.
If Selective self-test is pending on power-up, resume after 0 minute delay.

SCT Status Version:                  3
SCT Version (vendor specific):       256 (0x0100)
SCT Support Level:                   1
Device State:                        Active (0)
Current Temperature:                    34 Celsius
Power Cycle Min/Max Temperature:     28/44 Celsius
Lifetime    Min/Max Temperature:     28/44 Celsius
Under/Over Temperature Limit Count:   0/0
SCT Temperature History Version:     2
Temperature Sampling Period:         1 minute
Temperature Logging Interval:        10 minutes
Min/Max recommended Temperature:      0/70 Celsius
Min/Max Temperature Limit:            0/70 Celsius
Temperature History Size (Index):    128 (59)

Index    Estimated Time   Temperature Celsius
  60    2017-09-11 12:20    34  ***************
 ...    ..(126 skipped).    ..  ***************
  59    2017-09-12 09:30    34  ***************

SCT Error Recovery Control:
           Read: Disabled
          Write: Disabled

Device Statistics (GP Log 0x04) not supported

SATA Phy Event Counters (GP Log 0x11)
ID      Size     Value  Description
0x0001  2            0  Command failed due to ICRC error
0x0002  2            0  R_ERR response for data FIS
0x0003  2            0  R_ERR response for device-to-host data FIS
0x0004  2            0  R_ERR response for host-to-device data FIS
0x0005  2            0  R_ERR response for non-data FIS
0x0006  2            0  R_ERR response for device-to-host non-data FIS
0x0007  2            0  R_ERR response for host-to-device non-data FIS
0x0008  2            0  Device-to-host non-data FIS retries
0x0009  2           33  Transition from drive PhyRdy to drive PhyNRdy
0x000a  2           33  Device-to-host register FISes sent due to a COMRESET
0x000b  2            0  CRC errors within host-to-device FIS
0x000d  2            0  Non-CRC errors within host-to-device FIS
0x000f  2            0  R_ERR response for host-to-device data FIS, CRC
0x0010  2            0  R_ERR response for host-to-device data FIS, non-CRC
0x0012  2            0  R_ERR response for host-to-device non-data FIS, CRC
0x0013  2            0  R_ERR response for host-to-device non-data FIS, non-CRC

