smartctl 7.1 2019-12-30 r5022 [x86_64-w64-mingw32-w10-1909] (sf-7.1-1)
Copyright (C) 2002-19, Bruce Allen, Christian Franke, www.smartmontools.org

=== START OF INFORMATION SECTION ===
Device Model:     Samsung SSD 870 QVO 4TB
Firmware Version: SVQ01B6Q
User Capacity:    4 000 787 030 016 bytes [4,00 TB]
Sector Size:      512 bytes logical/physical
Rotation Rate:    Solid State Device
Form Factor:      2.5 inches
Device is:        Not in smartctl database [for details use: -P showall]
ATA Version is:   ACS-4 T13/BSR INCITS 529 revision 5
SATA Version is:  SATA 3.3, 6.0 Gb/s (current: 6.0 Gb/s)
Local Time is:    Sun Oct 25 18:09:38 2020 FLEST
SMART support is: Available - device has SMART capability.
SMART support is: Enabled
AAM feature is:   Unavailable
APM feature is:   Unavailable
Rd look-ahead is: Enabled
Write cache is:   Enabled
DSN feature is:   Unavailable
ATA Security is:  Disabled, frozen [SEC2]
Wt Cache Reorder: Enabled

=== START OF READ SMART DATA SECTION ===
SMART overall-health self-assessment test result: PASSED

General SMART Values:
Offline data collection status:  (0x00)	Offline data collection activity
					was never started.
					Auto Offline Data Collection: Disabled.
Self-test execution status:      (   0)	The previous self-test routine completed
					without error or no self-test has ever 
					been run.
Total time to complete Offline 
data collection: 		(    0) seconds.
Offline data collection
capabilities: 			 (0x53) SMART execute Offline immediate.
					Auto Offline data collection on/off support.
					Suspend Offline collection upon new
					command.
					No Offline surface scan supported.
					Self-test supported.
					No Conveyance Self-test supported.
					Selective Self-test supported.
SMART capabilities:            (0x0003)	Saves SMART data before entering
					power-saving mode.
					Supports SMART auto save timer.
Error logging capability:        (0x01)	Error logging supported.
					General Purpose Logging supported.
Short self-test routine 
recommended polling time: 	 (   2) minutes.
Extended self-test routine
recommended polling time: 	 ( 320) minutes.
SCT capabilities: 	       (0x003d)	SCT Status supported.
					SCT Error Recovery Control supported.
					SCT Feature Control supported.
					SCT Data Table supported.

SMART Attributes Data Structure revision number: 1
Vendor Specific SMART Attributes with Thresholds:
ID# ATTRIBUTE_NAME          FLAGS    VALUE WORST THRESH FAIL RAW_VALUE
  5 Reallocated_Sector_Ct   PO--CK   100   100   010    -    0
  9 Power_On_Hours          -O--CK   099   099   000    -    39
 12 Power_Cycle_Count       -O--CK   099   099   000    -    11
177 Wear_Leveling_Count     PO--C-   100   100   000    -    0
179 Used_Rsvd_Blk_Cnt_Tot   PO--C-   100   100   010    -    0
181 Program_Fail_Cnt_Total  -O--CK   100   100   010    -    0
182 Erase_Fail_Count_Total  -O--CK   100   100   010    -    0
183 Runtime_Bad_Block       PO--C-   100   100   010    -    0
187 Reported_Uncorrect      -O--CK   100   100   000    -    0
190 Airflow_Temperature_Cel -O--CK   074   050   000    -    26
195 Hardware_ECC_Recovered  -O-RC-   200   200   000    -    0
199 UDMA_CRC_Error_Count    -OSRCK   100   100   000    -    0
235 Unknown_Attribute       -O--C-   099   099   000    -    6
241 Total_LBAs_Written      -O--CK   099   099   000    -    985323470
                            ||||||_ K auto-keep
                            |||||__ C event count
                            ||||___ R error rate
                            |||____ S speed/performance
                            ||_____ O updated online
                            |______ P prefailure warning

General Purpose Log Directory Version 1
SMART           Log Directory Version 1 [multi-sector log support]
Address    Access  R/W   Size  Description
0x00       GPL,SL  R/O      1  Log Directory
0x01           SL  R/O      1  Summary SMART error log
0x02           SL  R/O      1  Comprehensive SMART error log
0x03       GPL     R/O      1  Ext. Comprehensive SMART error log
0x04       GPL,SL  R/O      8  Device Statistics log
0x06           SL  R/O      1  SMART self-test log
0x07       GPL     R/O      1  Extended self-test log
0x09           SL  R/W      1  Selective self-test log
0x10       GPL     R/O      1  NCQ Command Error log
0x11       GPL     R/O      1  SATA Phy Event Counters log
0x13       GPL     R/O      1  SATA NCQ Send and Receive log
0x30       GPL,SL  R/O      9  IDENTIFY DEVICE data log
0x80-0x9f  GPL,SL  R/W     16  Host vendor specific log
0xa1           SL  VS      16  Device vendor specific log
0xa5           SL  VS      16  Device vendor specific log
0xce           SL  VS      16  Device vendor specific log
0xe0       GPL,SL  R/W      1  SCT Command/Status
0xe1       GPL,SL  R/W      1  SCT Data Transfer

SMART Extended Comprehensive Error Log Version: 1 (1 sectors)
No Errors Logged

SMART Extended Self-test Log Version: 1 (1 sectors)
Num  Test_Description    Status                  Remaining  LifeTime(hours)  LBA_of_first_error
# 1  Short offline       Completed without error       00%        10         -
# 2  Short offline       Aborted by host               40%        10         -
# 3  Short offline       Aborted by host               50%        10         -
# 4  Short offline       Aborted by host               40%         9         -

SMART Selective self-test log data structure revision number 1
 SPAN  MIN_LBA  MAX_LBA  CURRENT_TEST_STATUS
    1        0        0  Not_testing
    2        0        0  Not_testing
    3        0        0  Not_testing
    4        0        0  Not_testing
    5        0        0  Not_testing
  256        0    65535  Read_scanning was never started
Selective self-test flags (0x0):
  After scanning selected spans, do NOT read-scan remainder of disk.
If Selective self-test is pending on power-up, resume after 0 minute delay.

SCT Status Version:                  3
SCT Version (vendor specific):       256 (0x0100)
Device State:                        Active (0)
Current Temperature:                    26 Celsius
Power Cycle Min/Max Temperature:     25/26 Celsius
Lifetime    Min/Max Temperature:     25/50 Celsius
Specified Max Operating Temperature:    70 Celsius
Under/Over Temperature Limit Count:   0/0
SMART Status:                        0xc24f (PASSED)

SCT Temperature History Version:     2
Temperature Sampling Period:         10 minutes
Temperature Logging Interval:        10 minutes
Min/Max recommended Temperature:      0/70 Celsius
Min/Max Temperature Limit:            0/70 Celsius
Temperature History Size (Index):    128 (7)

Index    Estimated Time   Temperature Celsius
   8    2020-10-24 21:50    27  ********
   9    2020-10-24 22:00     ?  -
  10    2020-10-24 22:10    27  ********
 ...    ..(  3 skipped).    ..  ********
  14    2020-10-24 22:50    27  ********
  15    2020-10-24 23:00    26  *******
 ...    ..(  3 skipped).    ..  *******
  19    2020-10-24 23:40    26  *******
  20    2020-10-24 23:50    27  ********
  21    2020-10-25 00:00    26  *******
 ...    ..(  4 skipped).    ..  *******
  26    2020-10-25 00:50    26  *******
  27    2020-10-25 01:00    25  ******
  28    2020-10-25 01:10    25  ******
  29    2020-10-25 01:20     ?  -
  30    2020-10-25 01:30    25  ******
 ...    ..(  3 skipped).    ..  ******
  34    2020-10-25 02:10    25  ******
  35    2020-10-25 02:20    24  *****
 ...    ..(  6 skipped).    ..  *****
  42    2020-10-25 03:30    24  *****
  43    2020-10-25 03:40     ?  -
  44    2020-10-25 03:50    24  *****
 ...    ..(  8 skipped).    ..  *****
  53    2020-10-25 04:20    24  *****
  54    2020-10-25 04:30    23  ****
 ...    ..(  9 skipped).    ..  ****
  64    2020-10-25 06:10    23  ****
  65    2020-10-25 06:20    24  *****
 ...    ..(  3 skipped).    ..  *****
  69    2020-10-25 07:00    24  *****
  70    2020-10-25 07:10    23  ****
  71    2020-10-25 07:20    24  *****
  72    2020-10-25 07:30    23  ****
 ...    ..(  3 skipped).    ..  ****
  76    2020-10-25 08:10    23  ****
  77    2020-10-25 08:20    24  *****
 ...    ..(  5 skipped).    ..  *****
  83    2020-10-25 09:20    24  *****
  84    2020-10-25 09:30    25  ******
 ...    ..(  3 skipped).    ..  ******
  88    2020-10-25 10:10    25  ******
  89    2020-10-25 10:20    24  *****
 ...    ..(  4 skipped).    ..  *****
  94    2020-10-25 11:10    24  *****
  95    2020-10-25 11:20    25  ******
 ...    ..(  7 skipped).    ..  ******
 103    2020-10-25 12:40    25  ******
 104    2020-10-25 12:50    26  *******
 105    2020-10-25 13:00     ?  -
 106    2020-10-25 13:10    26  *******
 107    2020-10-25 13:20    26  *******
 108    2020-10-25 13:30     ?  -
 109    2020-10-25 13:40    25  ******
 110    2020-10-25 13:50     ?  -
 111    2020-10-25 14:00    25  ******
 ...    ..(  5 skipped).    ..  ******
 117    2020-10-25 15:00    25  ******
 118    2020-10-25 15:10     ?  -
 119    2020-10-25 15:20    43  ************************
 120    2020-10-25 15:30    50  *******************************
 121    2020-10-25 15:40    49  ******************************
 122    2020-10-25 15:50    38  *******************
 123    2020-10-25 16:00    32  *************
 124    2020-10-25 16:10     ?  -
 ...    ..(  4 skipped).    ..  -
   1    2020-10-25 17:00     ?  -
   2    2020-10-25 17:10    45  **************************
   3    2020-10-25 17:20    50  *******************************
   4    2020-10-25 17:30     ?  -
   5    2020-10-25 17:40    25  ******
   6    2020-10-25 17:50    25  ******
   7    2020-10-25 18:00    25  ******

SCT Error Recovery Control:
           Read: Disabled
          Write: Disabled

Device Statistics (GP Log 0x04)
Page  Offset Size        Value Flags Description
0x01  =====  =               =  ===  == General Statistics (rev 1) ==
0x01  0x008  4              11  ---  Lifetime Power-On Resets
0x01  0x010  4              39  ---  Power-on Hours
0x01  0x018  6       985323470  ---  Logical Sectors Written
0x01  0x020  6          561524  ---  Number of Write Commands
0x01  0x028  6        12239146  ---  Logical Sectors Read
0x01  0x030  6          245028  ---  Number of Read Commands
0x01  0x038  6         2444000  ---  Date and Time TimeStamp
0x04  =====  =               =  ===  == General Errors Statistics (rev 1) ==
0x04  0x008  4               0  ---  Number of Reported Uncorrectable Errors
0x04  0x010  4               3  ---  Resets Between Cmd Acceptance and Completion
0x05  =====  =               =  ===  == Temperature Statistics (rev 1) ==
0x05  0x008  1              26  ---  Current Temperature
0x05  0x020  1              50  ---  Highest Temperature
0x05  0x028  1              25  ---  Lowest Temperature
0x05  0x058  1              70  ---  Specified Maximum Operating Temperature
0x06  =====  =               =  ===  == Transport Statistics (rev 1) ==
0x06  0x008  4             308  ---  Number of Hardware Resets
0x06  0x010  4               0  ---  Number of ASR Events
0x06  0x018  4               0  ---  Number of Interface CRC Errors
0x07  =====  =               =  ===  == Solid State Device Statistics (rev 1) ==
0x07  0x008  1               0  N--  Percentage Used Endurance Indicator
                                |||_ C monitored condition met
                                ||__ D supports DSN
                                |___ N normalized value

Pending Defects log (GP Log 0x0c) not supported

SATA Phy Event Counters (GP Log 0x11)
ID      Size     Value  Description
0x0001  2            0  Command failed due to ICRC error
0x0002  2            0  R_ERR response for data FIS
0x0003  2            0  R_ERR response for device-to-host data FIS
0x0004  2            0  R_ERR response for host-to-device data FIS
0x0005  2            0  R_ERR response for non-data FIS
0x0006  2            0  R_ERR response for device-to-host non-data FIS
0x0007  2            0  R_ERR response for host-to-device non-data FIS
0x0008  2            0  Device-to-host non-data FIS retries
0x0009  2         1962  Transition from drive PhyRdy to drive PhyNRdy
0x000a  2            2  Device-to-host register FISes sent due to a COMRESET
0x000b  2            0  CRC errors within host-to-device FIS
0x000d  2            0  Non-CRC errors within host-to-device FIS
0x000f  2            0  R_ERR response for host-to-device data FIS, CRC
0x0010  2            0  R_ERR response for host-to-device data FIS, non-CRC
0x0012  2            0  R_ERR response for host-to-device non-data FIS, CRC
0x0013  2            0  R_ERR response for host-to-device non-data FIS, non-CRC

