# smartctl -x /dev/sdb
smartctl 6.6 2016-05-31 r4324 [x86_64-linux-4.9.0-4-amd64] (local build)
Copyright (C) 2002-16, Bruce Allen, Christian Franke, www.smartmontools.org

/dev/sdb: Unknown USB bridge [0x1058:0x25e2 (0x4004)]
Please specify device type with the -d option.

Use smartctl -h to get a usage summary

# smartctl -d sat -x /dev/sdb
smartctl 6.6 2016-05-31 r4324 [x86_64-linux-4.9.0-4-amd64] (local build)
Copyright (C) 2002-16, Bruce Allen, Christian Franke, www.smartmontools.org

=== START OF INFORMATION SECTION ===
Device Model:     WDC WD40NMZW-11GX6S1
Serial Number:    WD-WX21D47E8DAD
LU WWN Device Id: 5 0014ee 6b2735659
Firmware Version: 01.01A01
User Capacity:    4,000,753,472,000 bytes [4.00 TB]
Sector Sizes:     512 bytes logical, 4096 bytes physical
Rotation Rate:    5400 rpm
Form Factor:      2.5 inches
Device is:        Not in smartctl database [for details use: -P showall]
ATA Version is:   ACS-3 (minor revision not indicated)
SATA Version is:  SATA 3.1, 6.0 Gb/s (current: 6.0 Gb/s)
Local Time is:    Thu Dec 28 15:02:07 2017 MST
SMART support is: Available - device has SMART capability.
SMART support is: Enabled
AAM feature is:   Unavailable
APM level is:     128 (minimum power consumption without standby)
Rd look-ahead is: Enabled
Write cache is:   Enabled
ATA Security is:  Disabled, NOT FROZEN [SEC1]
Wt Cache Reorder: Enabled

=== START OF READ SMART DATA SECTION ===
SMART overall-health self-assessment test result: PASSED

General SMART Values:
Offline data collection status:  (0x00) Offline data collection activity
                                        was never started.
                                        Auto Offline Data Collection: Disabled.
Self-test execution status:      (   0) The previous self-test routine completed
                                        without error or no self-test has ever
                                        been run.
Total time to complete Offline
data collection:                ( 1064) seconds.
Offline data collection
capabilities:                    (0x1b) SMART execute Offline immediate.
                                        Auto Offline data collection on/off support.
                                        Suspend Offline collection upon new
                                        command.
                                        Offline surface scan supported.
                                        Self-test supported.
                                        No Conveyance Self-test supported.
                                        No Selective Self-test supported.
SMART capabilities:            (0x0003) Saves SMART data before entering
                                        power-saving mode.
                                        Supports SMART auto save timer.
Error logging capability:        (0x01) Error logging supported.
                                        General Purpose Logging supported.
Short self-test routine
recommended polling time:        (   2) minutes.
Extended self-test routine
recommended polling time:        ( 418) minutes.
SCT capabilities:              (0x30b5) SCT Status supported.
                                        SCT Feature Control supported.
                                        SCT Data Table supported.

SMART Attributes Data Structure revision number: 16
Vendor Specific SMART Attributes with Thresholds:
ID# ATTRIBUTE_NAME          FLAGS    VALUE WORST THRESH FAIL RAW_VALUE
  1 Raw_Read_Error_Rate     POSR-K   200   200   051    -    0
  3 Spin_Up_Time            POS--K   253   253   021    -    5166
  4 Start_Stop_Count        -O--CK   099   099   000    -    1573
  5 Reallocated_Sector_Ct   PO--CK   200   200   140    -    0
  9 Power_On_Hours          -O--CK   097   097   000    -    2522
 10 Spin_Retry_Count        -O--CK   100   100   000    -    0
 11 Calibration_Retry_Count -O--CK   100   100   000    -    0
 12 Power_Cycle_Count       -O--CK   100   100   000    -    264
192 Power-Off_Retract_Count -O--CK   200   200   000    -    242
193 Load_Cycle_Count        -O--CK   199   199   000    -    4231
194 Temperature_Celsius     -O---K   120   095   000    -    32
197 Current_Pending_Sector  -O--CK   200   200   000    -    0
198 Offline_Uncorrectable   ----CK   100   253   000    -    0
199 UDMA_CRC_Error_Count    -O--CK   200   200   000    -    0
200 Multi_Zone_Error_Rate   ---R--   100   253   000    -    0
                            ||||||_ K auto-keep
                            |||||__ C event count
                            ||||___ R error rate
                            |||____ S speed/performance
                            ||_____ O updated online
                            |______ P prefailure warning

General Purpose Log Directory Version 1
SMART           Log Directory Version 1 [multi-sector log support]
Address    Access  R/W   Size  Description
0x00       GPL,SL  R/O      1  Log Directory
0x01           SL  R/O      1  Summary SMART error log
0x02           SL  R/O      5  Comprehensive SMART error log
0x03       GPL     R/O      6  Ext. Comprehensive SMART error log
0x06           SL  R/O      1  SMART self-test log
0x07       GPL     R/O      1  Extended self-test log
0x10       GPL     R/O      1  SATA NCQ Queued Error log
0x11       GPL     R/O      1  SATA Phy Event Counters log
0x24       GPL     R/O    274  Current Device Internal Status Data log
0x30       GPL,SL  R/O      9  IDENTIFY DEVICE data log
0x80-0x9f  GPL,SL  R/W     16  Host vendor specific log
0xa0-0xa7  GPL,SL  VS      16  Device vendor specific log
0xa8-0xb6  GPL,SL  VS       1  Device vendor specific log
0xb7       GPL,SL  VS      58  Device vendor specific log
0xbd       GPL,SL  VS       1  Device vendor specific log
0xc0       GPL,SL  VS       1  Device vendor specific log
0xc1       GPL     VS      93  Device vendor specific log
0xcf       GPL     VS   65535  Device vendor specific log
0xe0       GPL,SL  R/W      1  SCT Command/Status
0xe1       GPL,SL  R/W      1  SCT Data Transfer

SMART Extended Comprehensive Error Log Version: 1 (6 sectors)
No Errors Logged

SMART Extended Self-test Log Version: 1 (1 sectors)
No self-tests have been logged.  [To run self-tests, use: smartctl -t]

Selective Self-tests/Logging not supported

SCT Status Version:                  3
SCT Version (vendor specific):       258 (0x0102)
SCT Support Level:                   1
Device State:                        Active (0)
Current Temperature:                    33 Celsius
Power Cycle Min/Max Temperature:     28/38 Celsius
Lifetime    Min/Max Temperature:     19/57 Celsius
Lifetime    Average Temperature:        37 Celsius
Under/Over Temperature Limit Count:   0/0
Vendor specific:
01 00 00 00 00 00 00 00 00 00 00 00 00 00 00 00
00 00 00 00 00 00 00 00 00 00 00 00 00 00 00 00

SCT Temperature History Version:     2
Temperature Sampling Period:         1 minute
Temperature Logging Interval:        1 minute
Min/Max recommended Temperature:      0/60 Celsius
Min/Max Temperature Limit:           -41/85 Celsius
Temperature History Size (Index):    128 (77)

Index    Estimated Time   Temperature Celsius
  78    2017-12-28 12:55    29  **********
 ...    ..( 45 skipped).    ..  **********
 124    2017-12-28 13:41    29  **********
 125    2017-12-28 13:42    30  ***********
 ...    ..(  2 skipped).    ..  ***********
   0    2017-12-28 13:45    30  ***********
   1    2017-12-28 13:46    31  ************
   2    2017-12-28 13:47    31  ************
   3    2017-12-28 13:48    32  *************
   4    2017-12-28 13:49    32  *************
   5    2017-12-28 13:50    32  *************
   6    2017-12-28 13:51     ?  -
   7    2017-12-28 13:52    32  *************
   8    2017-12-28 13:53    32  *************
   9    2017-12-28 13:54    33  **************
 ...    ..(  3 skipped).    ..  **************
  13    2017-12-28 13:58    33  **************
  14    2017-12-28 13:59    34  ***************
 ...    ..(  3 skipped).    ..  ***************
  18    2017-12-28 14:03    34  ***************
  19    2017-12-28 14:04    35  ****************
 ...    ..(  8 skipped).    ..  ****************
  28    2017-12-28 14:13    35  ****************
  29    2017-12-28 14:14    34  ***************
 ...    ..(  2 skipped).    ..  ***************
  32    2017-12-28 14:17    34  ***************
  33    2017-12-28 14:18    33  **************
 ...    ..(  5 skipped).    ..  **************
  39    2017-12-28 14:24    33  **************
  40    2017-12-28 14:25    32  *************
 ...    ..(  9 skipped).    ..  *************
  50    2017-12-28 14:35    32  *************
  51    2017-12-28 14:36    33  **************
 ...    ..(  2 skipped).    ..  **************
  54    2017-12-28 14:39    33  **************
  55    2017-12-28 14:40    34  ***************
 ...    ..(  2 skipped).    ..  ***************
  58    2017-12-28 14:43    34  ***************
  59    2017-12-28 14:44    35  ****************
 ...    ..(  4 skipped).    ..  ****************
  64    2017-12-28 14:49    35  ****************
  65    2017-12-28 14:50    34  ***************
 ...    ..(  3 skipped).    ..  ***************
  69    2017-12-28 14:54    34  ***************
  70    2017-12-28 14:55    33  **************
 ...    ..(  6 skipped).    ..  **************
  77    2017-12-28 15:02    33  **************

SCT Error Recovery Control command not supported

Device Statistics (GP/SMART Log 0x04) not supported

SATA Phy Event Counters (GP Log 0x11)
ID      Size     Value  Description
0x0001  2            0  Command failed due to ICRC error
0x0002  2            0  R_ERR response for data FIS
0x0003  2            0  R_ERR response for device-to-host data FIS
0x0004  2            0  R_ERR response for host-to-device data FIS
0x0005  2            0  R_ERR response for non-data FIS
0x0006  2            0  R_ERR response for device-to-host non-data FIS
0x0007  2            0  R_ERR response for host-to-device non-data FIS
0x0008  2            0  Device-to-host non-data FIS retries
0x0009  2            0  Transition from drive PhyRdy to drive PhyNRdy
0x000a  2            1  Device-to-host register FISes sent due to a COMRESET
0x000b  2            0  CRC errors within host-to-device FIS
0x000d  2            0  Non-CRC errors within host-to-device FIS
0x000f  2            0  R_ERR response for host-to-device data FIS, CRC
0x0012  2            0  R_ERR response for host-to-device non-data FIS, CRC
0x8000  4      3031381  Vendor specific

