smartctl 7.4 2023-08-01 r5530 [FreeBSD 12.4-STABLE amd64] (local build)
Copyright (C) 2002-23, Bruce Allen, Christian Franke, www.smartmontools.org

=== ATA IDENTIFY DATA ===
Word     Bit     Value   Description

   0      -     0x0040   General configuration
   0     15          0   Device identifier: 0 = ATA, 1 = ATAPI
   0     14:8     0x00   Vendor specific [RET-3]
   0      7          0   Removable media device [OBS-8]
   0      6          1   Not removable controller and/or device [OBS-6]
   0      5:3      0x0   Vendor specific [RET-3]
   0      2          0   Response incomplete
   0      1          0   Vendor specific [RET-3]
   0      0          0   Reserved

   1      -     0x3fff   Cylinders [OBS-6]

   2      -     0xc837   Specific configuration (0x37c8/738c/8c73/c837)

   3      -     0x0010   Heads [OBS-6]

   4      -     0x0000   Vendor specific [RET-3]

   5      -     0x0000   Vendor specific [RET-3]

   6      -     0x003f   Sectors per track [OBS-6]

   7-8    -     0x00...  Reserved for CFA (Sectors per card)

   9      -     0x0000   Vendor specific [RET-4]

  10-19   -     .        Serial number (String)
  10-13   .     0x3030:3030:3030:3030  "00000000"
  14-17   .     0x3030:3030:3030:3030  "00000000"
  18-19   .     0x3030:3030            "0000"

  20      -     0x0000   Vendor specific [RET-3]

  21      -     0x0000   Vendor specific [RET-3]

  22      -     0x0000   Vendor specific bytes on READ/WRITE LONG [OBS-4]

  23-26   -     .        Firmware revision (String)
  23-26   .     0x4853:3135:3535:3120  "HS15551 "

  27-46   -     .        Model number (String)
  27-30   .     0x4849:4b53:454d:4920  "HIKSEMI "
  31-34   .     0x2020:2020:2020:2020  "        "
  35-38   .     0x2020:2020:2020:2020  "        "
  39-42   .     0x2020:2020:2020:2020  "        "
  43-46   .     0x2020:2020:2020:2020  "        "

  47      -     0x8001   READ/WRITE MULTIPLE support [OBS-ACS-4]
  47     15:8     0x80   Must be set to 0x80
  47      7:0     0x01   Max sectors per DRQ on READ/WRITE MULTIPLE [OBS-ACS-4]

  48      -     0x4000   Trusted Computing feature set options
  48     15:14     0x1   Must be set to 0x1
  48     13:1   0x0000   Reserved for the Trusted Computing Group
  48      0          0   Trusted Computing feature set supported

  49      -     0x2f00   Capabilities
  49     15:14     0x0   Reserved for IDENTIFY PACKET DEVICE
  49     13          1   Standard standby timer values supported
  49     12          0   Reserved for IDENTIFY PACKET DEVICE
  49     11          1   IORDY supported
  49     10          1   IORDY may be disabled
  49      9          1   LBA supported
  49      8          1   DMA supported
  49      7:2     0x00   Reserved
  49      1:0      0x0   Long Phy Sector Alignment Error reporting

  50      -     0x4000   Capabilities
  50     15:14     0x1   Must be set to 0x1
  50     13:2    0x000   Reserved
  50      1          0   Reserved [OBS-6]
  50      0          0   Vendor specific minimum standby timer value

  51      -     0x0000   PIO data transfer mode [OBS-5]

  52      -     0x0000   Single Word DMA data transfer mode [OBS-3]

  53      -     0x0007   Field validity / Free-fall Control
  53     15:8     0x00   Free-fall Control sensitivity
  53      7:3     0x00   Reserved
  53      2          1   Word 88 (Ultra DMA modes) is valid
  53      1          1   Words 64-70 (PIO modes) are valid
  53      0          1   Words 54-58 (CHS) are valid [OBS-6]

  54      -     0x3fff   Current cylinders [OBS-6]

  55      -     0x0010   Current heads [OBS-6]

  56      -     0x003f   Current sectors per track [OBS-6]

  57-58   -     .        Current capacity in sectors (DWord) [OBS-6]
  57-58   .     0xfc10:00fb  (16514064)

  59      -     0x0101   Sanitize Device - READ/WRITE MULTIPLE support
  59     15          0   BLOCK ERASE EXT supported
  59     14          0   OVERWRITE EXT supported
  59     13          0   CRYPTO SCRAMBLE EXT supported
  59     12          0   Sanitize Device feature set supported
  59     11          0   Cmds during sanitize are as specified by ACS-3
  59     10          0   SANITIZE ANTIFREEZE LOCK EXT supported
  59      9          0   Reserved
  59      8          1   Bits 7:0 are valid [OBS-ACS-4]
  59      7:0     0x01   Current number of sectors per DRQ [OBS-ACS-4]

  60-61   -     .        User addressable sectors for 28-bit commands (DWord)
  60-61   .     0xffff:0fff  (268435455)

  62      -     0x0000   Single Word DMA modes [OBS-3]

  63      -     0x0007   Multiword DMA modes
  63     15:11    0x00   Reserved
  63     10          0   Multiword DMA mode 2 selected
  63      9          0   Multiword DMA mode 1 selected
  63      8          0   Multiword DMA mode 0 selected
  63      7:3     0x00   Reserved
  63      2          1   Multiword DMA mode 2 and below supported
  63      1          1   Multiword DMA mode 1 and below supported
  63      0          1   Multiword DMA mode 0 supported

  64      -     0x0003   PIO modes
  64     15:2   0x0000   Reserved
  64      1          1   PIO mode 4 supported
  64      0          1   PIO mode 3 supported

  65      -     0x0078   Minimum Multiword DMA cycle time per word in ns

  66      -     0x0078   Recommended Multiword DMA cycle time in ns

  67      -     0x0078   Minimum PIO cycle time without flow control in ns

  68      -     0x0078   Minimum PIO cycle time with IORDY flow control in ns

  69      -     0x4d20   Additional support
  69     15          0   CFast specification supported
  69     14          1   Deterministic data after trim supported
  69     13          0   LPS Alignment Error Reporting Control supported
  69     12          0   DCO IDENTIFY/SET DMA supported [OBS-ACS-3]
  69     11          1   READ BUFFER DMA supported
  69     10          1   WRITE BUFFER DMA supported
  69      9          0   SET MAX SET PASSWORD/UNLOCK DMA supported [OBS-ACS-3]
  69      8          1   DOWNLOAD MICROCODE DMA supported
  69      7          0   Reserved for IEEE 1667
  69      6          0   Optional ATA device 28-bit commands supported
  69      5          1   Trimmed LBA range(s) returning zeroed data supported
  69      4          0   Device encrypts all user data
  69      3          0   Extended number of user addressable sectors supported
  69      2          0   All write cache is non-volatile
  69      1:0      0x0   Zoned Capabilities [OBS-ACS-5]

  70      -     0x0000   Reserved

  71-74   -     0x00...  Reserved for IDENTIFY PACKET DEVICE

  75      -     0x001f   Queue depth
  75     15:5    0x000   Reserved
  75      4:0     0x1f   Maximum queue depth - 1

  76      -     0xc50e   Serial ATA capabilities
  76     15          1   READ LOG DMA EXT as equiv to READ LOG EXT supported
  76     14          1   Device Auto Partial to Slumber transitions supported
  76     13          0   Host Auto Partial to Slumber transitions supported
  76     12          0   NCQ priority information supported
  76     11          0   Unload while NCQ commands are outstanding supported
  76     10          1   Phy Event Counters supported
  76      9          0   Receipt of host initiated PM requests supported
  76      8          1   NCQ feature set supported
  76      7:4      0x0   Reserved for Serial ATA
  76      3          1   SATA Gen3 signaling speed (6.0 Gb/s) supported
  76      2          1   SATA Gen2 signaling speed (3.0 Gb/s) supported
  76      1          1   SATA Gen1 signaling speed (1.5 Gb/s) supported
  76      0          0   Must be set to 0

  77      -     0x0006   Serial ATA additional capabilities
  77     15:10    0x00   Reserved for Serial ATA
  77      9          0   Out Of Band Management supported
  77      8          0   Power Disable feature always enabled
  77      7          0   DevSleep to ReducedPwrState supported
  77      6          0   RECEIVE/SEND FPDMA QUEUED supported
  77      5          0   NCQ Queue Management supported
  77      4          0   NCQ Streaming supported
  77      3:1      0x3   Current Serial ATA signal speed
  77      0          0   Must be set to 0

  78      -     0x004c   Serial ATA features supported
  78     15:13     0x0   Reserved for Serial ATA
  78     12          0   Power Disable feature supported
  78     11          0   Rebuild Assist feature set supported
  78     10          0   Reserved for Serial ATA
  78      9          0   Hybrid Information supported
  78      8          0   Device Sleep feature supported
  78      7          0   NCQ Autosense supported
  78      6          1   Software Settings Preservation supported
  78      5          0   Hardware Feature Control supported
  78      4          0   In-order data delivery supported
  78      3          1   Device initiated power management supported
  78      2          1   DMA Setup auto-activation supported
  78      1          0   Non-zero buffer offsets supported
  78      0          0   Must be set to 0

  79      -     0x0040   Serial ATA features enabled
  79     15:12     0x0   Reserved for Serial ATA
  79     11          0   Rebuild Assist feature set enabled
  79     10          0   Power Disable feature enabled
  79      9          0   Hybrid Information enabled
  79      8          0   Device Sleep feature enabled
  79      7          0   Automatic Partial to Slumber transitions enabled
  79      6          1   Software Settings Preservation enabled
  79      5          0   Hardware Feature Control enabled
  79      4          0   In-order data delivery enabled
  79      3          0   Device initiated power management enabled
  79      2          0   DMA Setup auto-activation enabled
  79      1          0   Non-zero buffer offsets enabled
  79      0          0   Must be set to 0

  80      -     0x0bf8   Major version number
  80     15:13     0x0   Reserved
  80     12          0   ACS-5 supported
  80     11          1   ACS-4 supported
  80     10          0   ACS-3 supported
  80      9          1   ACS-2 supported
  80      8          1   ATA8-ACS supported
  80      7          1   ATA/ATAPI-7 supported [OBS-ACS-4]
  80      6          1   ATA/ATAPI-6 supported [OBS-ACS-4]
  80      5          1   ATA/ATAPI-5 supported [OBS-ACS-4]
  80      4          1   ATA/ATAPI-4 supported [OBS-8]
  80      3          1   ATA-3 supported [OBS-7]
  80      2          0   ATA-2 supported [OBS-6]
  80      1          0   ATA-1 supported [OBS-5]
  80      0          0   Reserved

  81      -     0x0000   Minor version number

  82      -     0x706b   Commands and feature sets supported
  82     15          0   IDENTIFY DEVICE DMA supported [OBS-4]
  82     14          1   NOP supported
  82     13          1   READ BUFFER supported
  82     12          1   WRITE BUFFER supported
  82     11          0   WRITE VERIFY supported [OBS-4]
  82     10          0   HPA feature set supported [OBS-ACS-3]
  82      9          0   DEVICE RESET supported
  82      8          0   SERVICE interrupt supported [OBS-ACS-2]
  82      7          0   Release interrupt supported [OBS-ACS-2]
  82      6          1   Read look-ahead supported
  82      5          1   Volatile write cache supported
  82      4          0   PACKET feature set supported
  82      3          1   Power Management feature set supported
  82      2          0   Removable Media feature set supported [OBS-8]
  82      1          1   Security feature set supported
  82      0          1   SMART feature set supported

  83      -     0x7401   Commands and feature sets supported
  83     15:14     0x1   Must be set to 0x1
  83     13          1   FLUSH CACHE EXT supported
  83     12          1   FLUSH CACHE supported
  83     11          0   DCO feature set supported [OBS-ACS-3]
  83     10          1   48-bit Address feature set supported
  83      9          0   AAM feature set supported [OBS-ACS-2]
  83      8          0   SET MAX security extension supported [OBS-ACS-3]
  83      7          0   Reserved for Addr Offset Resvd Area Boot [OBS-ACS-3]
  83      6          0   SET FEATURES subcommand required to spin-up
  83      5          0   PUIS feature set supported
  83      4          0   Removable Media Status Notification supported [OBS-8]
  83      3          0   APM feature set supported
  83      2          0   CFA feature set supported
  83      1          0   TCQ feature set supported [OBS-ACS-2]
  83      0          1   DOWNLOAD MICROCODE supported

  84      -     0x4163   Commands and feature sets supported
  84     15:14     0x1   Must be set to 0x1
  84     13          0   IDLE IMMEDIATE with UNLOAD feature supported
  84     12:11     0x0   Reserved for TLC [OBS-ACS-3]
  84     10          0   URG bit for WRITE STREAM (DMA) EXT supported [OBS-8]
  84      9          0   URG bit for READ STREAM (DMA) EXT supported [OBS-8]
  84      8          1   64-bit World Wide Name supported
  84      7          0   WRITE DMA QUEUED FUA EXT supported [OBS-ACS-2]
  84      6          1   WRITE DMA/MULTIPLE FUA EXT supported
  84      5          1   GPL feature set supported
  84      4          0   Streaming feature set supported
  84      3          0   Media Card Pass Through Command supported [OBS-ACS-2]
  84      2          0   Media serial number supported [RES-ACS-3]
  84      1          1   SMART self-test supported
  84      0          1   SMART error logging supported

  85      -     0x7069   Commands and feature sets supported or enabled
  85     15          0   IDENTIFY DEVICE DMA supported [OBS-4]
  85     14          1   NOP supported
  85     13          1   READ BUFFER supported
  85     12          1   WRITE BUFFER supported
  85     11          0   WRITE VERIFY supported [OBS-4]
  85     10          0   HPA feature set supported [OBS-ACS-3]
  85      9          0   DEVICE RESET supported
  85      8          0   SERVICE interrupt enabled [OBS-ACS-2]
  85      7          0   Release interrupt enabled [OBS-ACS-2]
  85      6          1   Read look-ahead enabled
  85      5          1   Write cache enabled
  85      4          0   PACKET feature set supported
  85      3          1   Power Management feature set supported
  85      2          0   Removable Media feature set supported [OBS-8]
  85      1          0   Security feature set enabled
  85      0          1   SMART feature set enabled

  86      -     0xb401   Commands and feature sets supported or enabled
  86     15          1   Words 119-120 are valid
  86     14          0   Reserved
  86     13          1   FLUSH CACHE EXT supported
  86     12          1   FLUSH CACHE supported
  86     11          0   DCO feature set supported [OBS-ACS-3]
  86     10          1   48-bit Address features set supported
  86      9          0   AAM feature set enabled [OBS-ACS-2]
  86      8          0   SET MAX security extension enabled [OBS-ACS-3]
  86      7          0   Reserved for Addr Offset Resvd Area Boot [OBS-ACS-3]
  86      6          0   SET FEATURES subcommand required to spin-up
  86      5          0   PUIS feature set enabled
  86      4          0   Removable Media Status Notification enabled [OBS-8]
  86      3          0   APM feature set enabled
  86      2          0   CFA feature set supported
  86      1          0   TCQ feature set supported [OBS-ACS-2]
  86      0          1   DOWNLOAD MICROCODE supported

  87      -     0x4163   Commands and feature sets supported or enabled
  87     15:14     0x1   Must be set to 0x1
  87     13          0   IDLE IMMEDIATE with UNLOAD FEATURE supported
  87     12:11     0x0   Reserved for TLC [OBS-ACS-3]
  87     10          0   URG bit for WRITE STREAM (DMA) EXT supported [OBS-8]
  87      9          0   URG bit for READ STREAM (DMA) EXT supported [OBS-8]
  87      8          1   64-bit World Wide Name supported
  87      7          0   WRITE DMA QUEUED FUA EXT supported [OBS-ACS-2]
  87      6          1   WRITE DMA/MULTIPLE FUA EXT supported
  87      5          1   GPL feature set supported
  87      4          0   Valid CONFIGURE STREAM has been executed [OBS-8]
  87      3          0   Media Card Pass Through Command supported [OBS-ACS-2]
  87      2          0   Media serial number is valid
  87      1          1   SMART self-test supported
  87      0          1   SMART error logging supported

  88      -     0x407f   Ultra DMA modes
  88     15          0   Reserved
  88     14          1   Ultra DMA mode 6 selected
  88     13          0   Ultra DMA mode 5 selected
  88     12          0   Ultra DMA mode 4 selected
  88     11          0   Ultra DMA mode 3 selected
  88     10          0   Ultra DMA mode 2 selected
  88      9          0   Ultra DMA mode 1 selected
  88      8          0   Ultra DMA mode 0 selected
  88      7          0   Reserved
  88      6          1   Ultra DMA mode 6 and below supported
  88      5          1   Ultra DMA mode 5 and below supported
  88      4          1   Ultra DMA mode 4 and below supported
  88      3          1   Ultra DMA mode 3 and below supported
  88      2          1   Ultra DMA mode 2 and below supported
  88      1          1   Ultra DMA mode 1 and below supported
  88      0          1   Ultra DMA mode 0 supported

  89      -     0x0001   SECURITY ERASE UNIT time
  89     15          0   Bits 14:8 of value are valid
  89     14:0   0x0001   SECURITY ERASE UNIT time value

  90      -     0x0001   ENHANCED SECURITY ERASE UNIT time
  90     15          0   Bits 14:8 of value are valid
  90     14:0   0x0001   ENHANCED SECURITY ERASE UNIT time value

  91      -     0x0000   Current APM level
  91     15:8     0x00   Reserved
  91      7:0     0x00   Current APM level value

  92      -     0xfffe   Master Password Identifier

  93      -     0x0000   Hardware reset result (PATA)
  93     15:14     0x0   Must be set to 0x1
  93     13          0   Device detected CBLID- above(1)/below(0) ViHB
  93     12          0   Reserved
  93     11          0   Device 1 asserted PDIAG-
  93     10:9      0x0   Device 1 detection method: -, Jumper, CSEL, other
  93      8          0   Must be set to 1
  93      7          0   Reserved
  93      6          0   Device 0 responds when device 1 selected
  93      5          0   Device 0 detected the assertion of DASP-
  93      4          0   Device 0 detected the assertion of PDIAG-
  93      3          0   Device 0 passed diagnostics
  93      2:1      0x0   Device 0 detection method: -, Jumper, CSEL, other
  93      0          0   Must be set to 1 for PATA devices

  94      -     0x0000   AAM level [OBS-ACS-2]
  94     15:8     0x00   Recommended AAM level [OBS-ACS-2]
  94      7:0     0x00   Current AAM level [OBS-ACS-2]

  95      -     0x0000   Stream Minimum Request Size

  96      -     0x0000   Streaming Transfer Time - DMA

  97      -     0x0000   Streaming Access Latency - DMA and PIO

  98-99   -     0x00...  Streaming Performance Granularity (DWord)

 100-103  -     .        User addressable sectors for 48-bit commands (QWord)
 100-103  .     0xd2b0:773b:0000:0000  (2000409264)

 104      -     0x0000   Streaming Transfer Time - PIO

 105      -     0x0008   Max blocks of LBA Range Entries per DS MANAGEMENT cmd

 106      -     0x4000   Physical sector size / logical sector size
 106     15:14     0x1   Must be set to 0x1
 106     13          0   Multiple logical sectors per physical sector
 106     12          0   Logical Sector longer than 256 words
 106     11:4     0x00   Reserved
 106      3:0      0x0   2^X logical sectors per physical sector

 107      -     0x0000   Inter-seek delay for ISO 7779 acoustic testing

 108-111  -     .        World Wide Name
 108-111  .     0x5000:0000:0000:27b6

 112-115  -     0x00...  Reserved

 116      -     0x0000   Reserved for TLC [OBS-ACS-3]

 117-118  -     0x00...  Logical sector size (DWord)

 119      -     0x401c   Commands and feature sets supported
 119     15:14     0x1   Must be set to 0x1
 119     13:10     0x0   Reserved
 119      9          0   DSN feature set supported
 119      8          0   Accessible Max Address Config feature set supported
 119      7          0   Extended Power Conditions feature set supported
 119      6          0   Sense Data Reporting feature set supported
 119      5          0   Free-fall Control feature set supported
 119      4          1   DOWNLOAD MICROCODE with mode 3 supported
 119      3          1   READ/WRITE LOG DMA EXT supported
 119      2          1   WRITE UNCORRECTABLE EXT supported
 119      1          0   Write-Read-Verify feature set supported
 119      0          0   Reserved for DDT [OBS-ACS-3]

 120      -     0x401c   Commands and feature sets supported or enabled
 120     15:14     0x1   Must be set to 0x1
 120     13:10     0x0   Reserved
 120      9          0   DSN feature set enabled
 120      8          0   Reserved
 120      7          0   Extended Power Conditions feature set enabled
 120      6          0   Sense Data Reporting feature set enabled
 120      5          0   Free-fall Control feature set enabled
 120      4          1   DOWNLOAD MICROCODE with mode 3 supported
 120      3          1   READ/WRITE LOG DMA EXT supported
 120      2          1   WRITE UNCORRECTABLE EXT supported
 120      1          0   Write-Read-Verify feature set enabled
 120      0          0   Reserved for DDT [OBS-ACS-3]

 121-126  -     0x00...  Reserved

 127      -     0x0000   Removable Media Status Notification [OBS-8]
 127     15:1   0x0000   Reserved
 127      0          0   Removable Media Status Notification supported [OBS-8]

 128      -     0x0021   Security status
 128     15:9     0x00   Reserved
 128      8          0   Master password capability: 0 = High, 1 = Maximum
 128      7:6      0x0   Reserved
 128      5          1   Enhanced security erase supported
 128      4          0   Security count expired
 128      3          0   Security frozen
 128      2          0   Security locked
 128      1          0   Security enabled
 128      0          1   Security supported

 129-159  -     0x00...  Vendor specific

 160      -     0x0000   CFA power mode

 161-167  -     0x00...  Reserved for CFA

 168      -     0x0003   Form factor
 168     15:4    0x000   Reserved
 168      3:0      0x3   Nominal form factor: -, 5.25, 3.5, 2.5, 1.8, ...

 169      -     0x0001   DATA SET MANAGEMENT command support
 169     15:1   0x0000   Reserved
 169      0          1   Trim bit in DATA SET MANAGEMENT command supported

 170-173  -     0x00...  Additional product identifier (String)

 174-175  -     0x00...  Reserved

 176-205  -     0x00...  Current media serial number (String)

 206      -     0x0031   SCT Command Transport
 206     15:12     0x0   Vendor specific
 206     11:8      0x0   Reserved
 206      7          0   Reserved for Serial ATA
 206      6          0   Reserved
 206      5          1   SCT Data Tables supported
 206      4          1   SCT Feature Control supported
 206      3          0   SCT Error Recovery Control supported
 206      2          0   SCT Write Same supported
 206      1          0   SCT Read/Write Long supported [OBS-ACS-2]
 206      0          1   SCT Command Transport supported

 207-208  -     0x00...  Reserved

 209      -     0x4000   Alignment of logical sectors
 209     15:14     0x1   Must be set to 0x1
 209     13:0   0x0000   Logical sector offset

 210-211  -     0x00...  Write-Read-Verify sector count mode 3 (DWord)

 212-213  -     0x00...  Write-Read-Verify sector count mode 2 (DWord)

 214      -     0x0000   NV Cache capabilities [OBS-ACS-3]
 214     15:12     0x0   NV Cache feature set version [OBS-ACS-3]
 214     11:8      0x0   NV Cache Power Mode feature set version [OBS-ACS-3]
 214      7:5      0x0   Reserved [OBS-ACS-3]
 214      4          0   NV Cache feature set enabled [OBS-ACS-3]
 214      3:2      0x0   Reserved
 214      1          0   NV Cache Power Mode feature set enabled [OBS-ACS-3]
 214      0          0   NV Cache Power Mode feature set supported [OBS-ACS-3]

 215-216  -     0x00...  NV Cache size in logical blocks (DWord) [OBS-ACS-3]

 217      -     0x0001   Nominal media rotation rate

 218      -     0x0000   Reserved

 219      -     0x0000   NV Cache options [OBS-ACS-3]
 219     15:8     0x00   Reserved [OBS-ACS-3]
 219      7:0     0x00   Estimated time to spin up in seconds [OBS-ACS-3]

 220      -     0x0000   Write-Read-Verify mode
 220     15:8     0x00   Reserved
 220      7:0     0x00   Write-Read-Verify feature set current mode

 221      -     0x0000   Reserved

 222      -     0x10ff   Transport major version number
 222     15:12     0x1   Type: 0x1 = Serial  | 0x0 = Parallel | 0xe = PCIe
 222     11          0   Reserved
 222     10          0   SATA 3.5
 222      9          0   SATA 3.4
 222      8          0   SATA 3.3
 222      7          1   SATA 3.2
 222      6          1   SATA 3.1
 222      5          1   SATA 3.0
 222      4          1   SATA 2.6
 222      3          1   SATA 2.5
 222      2          1   SATA II: Extensions
 222      1          1   SATA 1.0a           | ATA/ATAPI-7 [OBS-ACS-5]
 222      0          1   ATA8-AST            | ATA8-APT    [OBS-ACS-5]

 223      -     0x0000   Transport minor version number

 224-229  -     0x00...  Reserved

 230-233  -     0x00...  Extended number of user addressable sectors (QWord)

 234      -     0x0001   Minimum blocks per DOWNLOAD MICROCODE mode 3 command

 235      -     0x03e8   Maximum blocks per DOWNLOAD MICROCODE mode 3 command

 236-254  -     0x00...  Reserved

 255      -     0x5ba5   Integrity word
 255     15:8     0x5b   Checksum
 255      7:0     0xa5   Signature

=== START OF INFORMATION SECTION ===
Device Model:     HIKSEMI
Serial Number:    00000000000000000000
LU WWN Device Id: 5 000000 0000027b6
Firmware Version: HS15551
User Capacity:    1,024,209,543,168 bytes [1.02 TB]
Sector Size:      512 bytes logical/physical
Rotation Rate:    Solid State Device
Form Factor:      2.5 inches
TRIM Command:     Available, deterministic, zeroed
Device is:        Not in smartctl database
ATA Version is:   ACS-4 (minor revision not indicated)
SATA Version is:  SATA 3.2, 6.0 Gb/s (current: 6.0 Gb/s)
Local Time is:    Sun Sep 15 19:30:29 2024 CST
SMART support is: Available - device has SMART capability.
SMART support is: Enabled
AAM feature is:   Unavailable
APM feature is:   Unavailable
Rd look-ahead is: Enabled
Write cache is:   Enabled
DSN feature is:   Unavailable
ATA Security is:  Disabled, NOT FROZEN [SEC1]
Wt Cache Reorder: Unknown

=== START OF READ SMART DATA SECTION ===
SMART Status not supported: Incomplete response, ATA output registers missing
SMART overall-health self-assessment test result: PASSED
Warning: This result is based on an Attribute check.

General SMART Values:
Offline data collection status:  (0x00)	Offline data collection activity
					was never started.
					Auto Offline Data Collection: Disabled.
Self-test execution status:      (   0)	The previous self-test routine completed
					without error or no self-test has ever 
					been run.
Total time to complete Offline 
data collection: 		(   33) seconds.
Offline data collection
capabilities: 			 (0x7b) SMART execute Offline immediate.
					Auto Offline data collection on/off support.
					Suspend Offline collection upon new
					command.
					Offline surface scan supported.
					Self-test supported.
					Conveyance Self-test supported.
					Selective Self-test supported.
SMART capabilities:            (0x0003)	Saves SMART data before entering
					power-saving mode.
					Supports SMART auto save timer.
Error logging capability:        (0x01)	Error logging supported.
					General Purpose Logging supported.
Short self-test routine 
recommended polling time: 	 (   2) minutes.
Extended self-test routine
recommended polling time: 	 (  85) minutes.
Conveyance self-test routine
recommended polling time: 	 (   2) minutes.
SCT capabilities: 	       (0x0031)	SCT Status supported.
					SCT Feature Control supported.
					SCT Data Table supported.

SMART Attributes Data Structure revision number: 20
Vendor Specific SMART Attributes with Thresholds:
ID# ATTRIBUTE_NAME          FLAGS    VALUE WORST THRESH FAIL RAW_VALUE
  5 Reallocated_Sector_Ct   PO--C-   100   100   050    -    0
  9 Power_On_Hours          -O--C-   100   100   000    -    74
 12 Power_Cycle_Count       -O--C-   100   100   000    -    55
167 Unknown_Attribute       -O---K   100   100   000    -    0
168 Unknown_Attribute       -O--C-   100   100   000    -    0
169 Unknown_Attribute       PO--C-   100   100   010    -    196614
170 Unknown_Attribute       PO--CK   100   100   010    -    100
171 Unknown_Attribute       -O--CK   100   100   000    -    0
172 Unknown_Attribute       -O--CK   100   100   000    -    0
174 Unknown_Attribute       -O---K   100   100   000    -    0
175 Program_Fail_Count_Chip -O---K   100   100   010    -    0
177 Wear_Leveling_Count     -O--C-   100   100   000    -    0
180 Unused_Rsvd_Blk_Cnt_Tot PO--CK   100   100   000    -    549
183 Runtime_Bad_Block       PO--CK   100   100   000    -    0
184 End-to-End_Error        PO-RCK   100   100   090    -    0
192 Power-Off_Retract_Count -O--C-   100   100   000    -    32
194 Temperature_Celsius     -O---K   026   026   000    -    26 (Min/Max 12/40)
196 Reallocated_Event_Count -O--C-   100   100   000    -    0
197 Current_Pending_Sector  -O--C-   100   100   000    -    0
199 UDMA_CRC_Error_Count    -O--CK   100   100   000    -    0
206 Unknown_SSD_Attribute   -O--CK   200   200   000    -    3
207 Unknown_SSD_Attribute   -O--CK   200   200   000    -    13
208 Unknown_SSD_Attribute   -O--CK   200   200   000    -    6
231 Unknown_SSD_Attribute   PO---K   100   100   005    -    0
233 Media_Wearout_Indicator -O--CK   100   100   000    -    5092
234 Unknown_Attribute       -O--CK   100   100   000    -    457602
241 Total_LBAs_Written      -O--CK   100   100   000    -    4564
242 Total_LBAs_Read         -O--CK   100   100   000    -    4775
                            ||||||_ K auto-keep
                            |||||__ C event count
                            ||||___ R error rate
                            |||____ S speed/performance
                            ||_____ O updated online
                            |______ P prefailure warning

General Purpose Log Directory Version 1
SMART           Log Directory Version 1 [multi-sector log support]
Address    Access  R/W   Size  Description
0x00       GPL,SL  R/O      1  Log Directory
0x01           SL  R/O      1  Summary SMART error log
0x02           SL  R/O     51  Comprehensive SMART error log
0x03       GPL     R/O     64  Ext. Comprehensive SMART error log
0x04       GPL,SL  R/O      8  Device Statistics log
0x06           SL  R/O      1  SMART self-test log
0x07       GPL     R/O      1  Extended self-test log
0x09           SL  R/W      1  Selective self-test log
0x10       GPL     R/O      1  NCQ Command Error log
0x11       GPL     R/O      1  SATA Phy Event Counters log
0x30       GPL,SL  R/O      9  IDENTIFY DEVICE data log
0x80-0x9f  GPL,SL  R/W     16  Host vendor specific log
0xe0       GPL,SL  R/W      1  SCT Command/Status
0xe1       GPL,SL  R/W      1  SCT Data Transfer

SMART Extended Comprehensive Error Log Version: 1 (64 sectors)
No Errors Logged

SMART Extended Self-test Log Version: 1 (1 sectors)
No self-tests have been logged.  [To run self-tests, use: smartctl -t]

SMART Selective self-test log data structure revision number 1
 SPAN  MIN_LBA  MAX_LBA  CURRENT_TEST_STATUS
    1        0        0  Not_testing
    2        0        0  Not_testing
    3        0        0  Not_testing
    4        0        0  Not_testing
    5        0        0  Not_testing
Selective self-test flags (0x0):
  After scanning selected spans, do NOT read-scan remainder of disk.
If Selective self-test is pending on power-up, resume after 0 minute delay.

SCT Status Version:                  3
SCT Version (vendor specific):       1 (0x0001)
Device State:                        Active (0)
Current Temperature:                    28 Celsius
Power Cycle Min/Max Temperature:      ?/28 Celsius
Lifetime    Min/Max Temperature:      ?/ ? Celsius
Under/Over Temperature Limit Count:   0/0

SCT Temperature History Version:     2
Temperature Sampling Period:         1 minute
Temperature Logging Interval:        1 minute
Min/Max recommended Temperature:     -127/127 Celsius
Min/Max Temperature Limit:           -127/127 Celsius
Temperature History Size (Index):    478 (196)

Index    Estimated Time   Temperature Celsius
 197    2024-09-15 11:33    39  ********************
 198    2024-09-15 11:34    40  *********************
 199    2024-09-15 11:35    40  *********************
 200    2024-09-15 11:36    40  *********************
 201    2024-09-15 11:37    39  ********************
 202    2024-09-15 11:38    40  *********************
 203    2024-09-15 11:39    39  ********************
 204    2024-09-15 11:40    37  ******************
 205    2024-09-15 11:41    39  ********************
 206    2024-09-15 11:42    40  *********************
 ...    ..(  2 skipped).    ..  *********************
 209    2024-09-15 11:45    40  *********************
 210    2024-09-15 11:46    36  *****************
 211    2024-09-15 11:47    39  ********************
 212    2024-09-15 11:48    40  *********************
 213    2024-09-15 11:49    39  ********************
 214    2024-09-15 11:50    39  ********************
 215    2024-09-15 11:51    40  *********************
 216    2024-09-15 11:52    39  ********************
 217    2024-09-15 11:53    37  ******************
 218    2024-09-15 11:54    36  *****************
 219    2024-09-15 11:55    37  ******************
 220    2024-09-15 11:56    36  *****************
 221    2024-09-15 11:57    35  ****************
 222    2024-09-15 11:58    36  *****************
 223    2024-09-15 11:59     ?  -
 224    2024-09-15 12:00    24  *****
 225    2024-09-15 12:01    27  ********
 226    2024-09-15 12:02    29  **********
 227    2024-09-15 12:03    30  ***********
 228    2024-09-15 12:04    31  ************
 229    2024-09-15 12:05    31  ************
 230    2024-09-15 12:06    32  *************
 ...    ..( 10 skipped).    ..  *************
 241    2024-09-15 12:17    32  *************
 242    2024-09-15 12:18     ?  -
 243    2024-09-15 12:19    33  **************
 244    2024-09-15 12:20     ?  -
 245    2024-09-15 12:21    24  *****
 246    2024-09-15 12:22    25  ******
 247    2024-09-15 12:23    22  ***
 248    2024-09-15 12:24     ?  -
 249    2024-09-15 12:25    26  *******
 250    2024-09-15 12:26     ?  -
 251    2024-09-15 12:27    28  *********
 252    2024-09-15 12:28     ?  -
 ...    ..(  8 skipped).    ..  -
 261    2024-09-15 12:37     ?  -
 262    2024-09-15 12:38    29  **********
 263    2024-09-15 12:39     ?  -
 264    2024-09-15 12:40     ?  -
 265    2024-09-15 12:41    29  **********
 266    2024-09-15 12:42     ?  -
 267    2024-09-15 12:43    29  **********
 268    2024-09-15 12:44     ?  -
 269    2024-09-15 12:45    29  **********
 270    2024-09-15 12:46    29  **********
 271    2024-09-15 12:47     ?  -
 272    2024-09-15 12:48    29  **********
 273    2024-09-15 12:49     ?  -
 ...    ..(  2 skipped).    ..  -
 276    2024-09-15 12:52     ?  -
 277    2024-09-15 12:53    29  **********
 278    2024-09-15 12:54     ?  -
 279    2024-09-15 12:55    30  ***********
 280    2024-09-15 12:56    26  *******
 281    2024-09-15 12:57     ?  -
 282    2024-09-15 12:58     ?  -
 283    2024-09-15 12:59    22  ***
 284    2024-09-15 13:00    24  *****
 285    2024-09-15 13:01    22  ***
 286    2024-09-15 13:02    30  ***********
 287    2024-09-15 13:03    28  *********
 288    2024-09-15 13:04    33  **************
 289    2024-09-15 13:05    35  ****************
 290    2024-09-15 13:06    35  ****************
 291    2024-09-15 13:07    35  ****************
 292    2024-09-15 13:08    38  *******************
 293    2024-09-15 13:09    36  *****************
 294    2024-09-15 13:10    37  ******************
 295    2024-09-15 13:11    37  ******************
 296    2024-09-15 13:12    36  *****************
 297    2024-09-15 13:13    35  ****************
 298    2024-09-15 13:14    34  ***************
 299    2024-09-15 13:15    34  ***************
 300    2024-09-15 13:16    28  *********
 301    2024-09-15 13:17    28  *********
 302    2024-09-15 13:18    36  *****************
 303    2024-09-15 13:19    34  ***************
 304    2024-09-15 13:20    36  *****************
 305    2024-09-15 13:21    35  ****************
 306    2024-09-15 13:22    36  *****************
 307    2024-09-15 13:23    38  *******************
 308    2024-09-15 13:24    35  ****************
 309    2024-09-15 13:25    35  ****************
 310    2024-09-15 13:26    34  ***************
 311    2024-09-15 13:27     ?  -
 312    2024-09-15 13:28    25  ******
 313    2024-09-15 13:29    29  **********
 314    2024-09-15 13:30    31  ************
 315    2024-09-15 13:31    32  *************
 316    2024-09-15 13:32    33  **************
 317    2024-09-15 13:33    34  ***************
 318    2024-09-15 13:34    34  ***************
 319    2024-09-15 13:35    35  ****************
 320    2024-09-15 13:36    36  *****************
 321    2024-09-15 13:37    37  ******************
 322    2024-09-15 13:38    37  ******************
 323    2024-09-15 13:39    36  *****************
 324    2024-09-15 13:40    37  ******************
 325    2024-09-15 13:41    37  ******************
 326    2024-09-15 13:42    38  *******************
 ...    ..(  6 skipped).    ..  *******************
 333    2024-09-15 13:49    38  *******************
 334    2024-09-15 13:50    37  ******************
 335    2024-09-15 13:51    38  *******************
 ...    ..(  4 skipped).    ..  *******************
 340    2024-09-15 13:56    38  *******************
 341    2024-09-15 13:57    37  ******************
 342    2024-09-15 13:58    38  *******************
 343    2024-09-15 13:59    37  ******************
 344    2024-09-15 14:00     ?  -
 345    2024-09-15 14:01     ?  -
 346    2024-09-15 14:02    23  ****
 347    2024-09-15 14:03    26  *******
 348    2024-09-15 14:04    27  ********
 349    2024-09-15 14:05    27  ********
 350    2024-09-15 14:06    28  *********
 351    2024-09-15 14:07    30  ***********
 352    2024-09-15 14:08    31  ************
 353    2024-09-15 14:09    32  *************
 ...    ..(  2 skipped).    ..  *************
 356    2024-09-15 14:12    32  *************
 357    2024-09-15 14:13    33  **************
 358    2024-09-15 14:14    32  *************
 359    2024-09-15 14:15    33  **************
 360    2024-09-15 14:16    35  ****************
 361    2024-09-15 14:17    35  ****************
 362    2024-09-15 14:18    36  *****************
 363    2024-09-15 14:19    36  *****************
 364    2024-09-15 14:20    36  *****************
 365    2024-09-15 14:21    33  **************
 ...    ..(  2 skipped).    ..  **************
 368    2024-09-15 14:24    33  **************
 369    2024-09-15 14:25    29  **********
 370    2024-09-15 14:26    36  *****************
 371    2024-09-15 14:27    36  *****************
 372    2024-09-15 14:28    37  ******************
 373    2024-09-15 14:29    35  ****************
 374    2024-09-15 14:30    35  ****************
 375    2024-09-15 14:31    34  ***************
 376    2024-09-15 14:32    36  *****************
 377    2024-09-15 14:33    37  ******************
 378    2024-09-15 14:34    35  ****************
 379    2024-09-15 14:35    34  ***************
 380    2024-09-15 14:36    34  ***************
 381    2024-09-15 14:37    28  *********
 382    2024-09-15 14:38    30  ***********
 383    2024-09-15 14:39    33  **************
 384    2024-09-15 14:40    33  **************
 385    2024-09-15 14:41    37  ******************
 386    2024-09-15 14:42     ?  -
 387    2024-09-15 14:43     ?  -
 388    2024-09-15 14:44    36  *****************
 389    2024-09-15 14:45    36  *****************
 390    2024-09-15 14:46    37  ******************
 391    2024-09-15 14:47    35  ****************
 392    2024-09-15 14:48    34  ***************
 393    2024-09-15 14:49    34  ***************
 394    2024-09-15 14:50    34  ***************
 395    2024-09-15 14:51    33  **************
 396    2024-09-15 14:52    33  **************
 397    2024-09-15 14:53    35  ****************
 398    2024-09-15 14:54    33  **************
 399    2024-09-15 14:55    33  **************
 400    2024-09-15 14:56    35  ****************
 401    2024-09-15 14:57    35  ****************
 402    2024-09-15 14:58    34  ***************
 403    2024-09-15 14:59    35  ****************
 404    2024-09-15 15:00    35  ****************
 405    2024-09-15 15:01     ?  -
 406    2024-09-15 15:02    24  *****
 407    2024-09-15 15:03    27  ********
 408    2024-09-15 15:04    30  ***********
 409    2024-09-15 15:05    31  ************
 410    2024-09-15 15:06    32  *************
 411    2024-09-15 15:07    33  **************
 412    2024-09-15 15:08    33  **************
 413    2024-09-15 15:09    34  ***************
 ...    ..(  2 skipped).    ..  ***************
 416    2024-09-15 15:12    34  ***************
 417    2024-09-15 15:13    35  ****************
 ...    ..(  4 skipped).    ..  ****************
 422    2024-09-15 15:18    35  ****************
 423    2024-09-15 15:19    36  *****************
 424    2024-09-15 15:20    35  ****************
 ...    ..(  2 skipped).    ..  ****************
 427    2024-09-15 15:23    35  ****************
 428    2024-09-15 15:24    36  *****************
 ...    ..( 22 skipped).    ..  *****************
 451    2024-09-15 15:47    36  *****************
 452    2024-09-15 15:48     ?  -
 453    2024-09-15 15:49    22  ***
 454    2024-09-15 15:50    24  *****
 455    2024-09-15 15:51     ?  -
 456    2024-09-15 15:52    32  *************
 457    2024-09-15 15:53    38  *******************
 458    2024-09-15 15:54    36  *****************
 459    2024-09-15 15:55    36  *****************
 460    2024-09-15 15:56    35  ****************
 461    2024-09-15 15:57    35  ****************
 462    2024-09-15 15:58    36  *****************
 463    2024-09-15 15:59    34  ***************
 464    2024-09-15 16:00    32  *************
 465    2024-09-15 16:01    34  ***************
 466    2024-09-15 16:02    32  *************
 467    2024-09-15 16:03    33  **************
 468    2024-09-15 16:04    32  *************
 ...    ..(  4 skipped).    ..  *************
 473    2024-09-15 16:09    32  *************
 474    2024-09-15 16:10    33  **************
 475    2024-09-15 16:11    28  *********
 476    2024-09-15 16:12    29  **********
 477    2024-09-15 16:13     ?  -
   0    2024-09-15 16:14    30  ***********
   1    2024-09-15 16:15    31  ************
   2    2024-09-15 16:16    30  ***********
   3    2024-09-15 16:17    35  ****************
   4    2024-09-15 16:18    32  *************
   5    2024-09-15 16:19    34  ***************
   6    2024-09-15 16:20    34  ***************
   7    2024-09-15 16:21    33  **************
   8    2024-09-15 16:22    34  ***************
   9    2024-09-15 16:23    34  ***************
  10    2024-09-15 16:24    32  *************
  11    2024-09-15 16:25    33  **************
  12    2024-09-15 16:26    33  **************
  13    2024-09-15 16:27    33  **************
  14    2024-09-15 16:28    32  *************
  15    2024-09-15 16:29    32  *************
  16    2024-09-15 16:30    33  **************
  17    2024-09-15 16:31    33  **************
  18    2024-09-15 16:32    33  **************
  19    2024-09-15 16:33    29  **********
  20    2024-09-15 16:34    37  ******************
  21    2024-09-15 16:35    34  ***************
  22    2024-09-15 16:36    34  ***************
  23    2024-09-15 16:37    33  **************
 ...    ..(  2 skipped).    ..  **************
  26    2024-09-15 16:40    33  **************
  27    2024-09-15 16:41    34  ***************
  28    2024-09-15 16:42     ?  -
  29    2024-09-15 16:43    24  *****
  30    2024-09-15 16:44    28  *********
  31    2024-09-15 16:45    29  **********
  32    2024-09-15 16:46    31  ************
  33    2024-09-15 16:47    32  *************
  34    2024-09-15 16:48    33  **************
  35    2024-09-15 16:49    34  ***************
  36    2024-09-15 16:50    32  *************
  37    2024-09-15 16:51    29  **********
  38    2024-09-15 16:52    33  **************
  39    2024-09-15 16:53    34  ***************
  40    2024-09-15 16:54    35  ****************
 ...    ..(  2 skipped).    ..  ****************
  43    2024-09-15 16:57    35  ****************
  44    2024-09-15 16:58    36  *****************
 ...    ..(  6 skipped).    ..  *****************
  51    2024-09-15 17:05    36  *****************
  52    2024-09-15 17:06    35  ****************
  53    2024-09-15 17:07    34  ***************
 ...    ..(  6 skipped).    ..  ***************
  60    2024-09-15 17:14    34  ***************
  61    2024-09-15 17:15    33  **************
  62    2024-09-15 17:16    34  ***************
  63    2024-09-15 17:17    34  ***************
  64    2024-09-15 17:18    34  ***************
  65    2024-09-15 17:19     ?  -
  66    2024-09-15 17:20    26  *******
  67    2024-09-15 17:21    27  ********
  68    2024-09-15 17:22    26  *******
  69    2024-09-15 17:23     ?  -
  70    2024-09-15 17:24    25  ******
  71    2024-09-15 17:25    27  ********
  72    2024-09-15 17:26    27  ********
  73    2024-09-15 17:27    28  *********
  74    2024-09-15 17:28     ?  -
  75    2024-09-15 17:29    29  **********
  76    2024-09-15 17:30    31  ************
  77    2024-09-15 17:31    30  ***********
  78    2024-09-15 17:32    31  ************
  79    2024-09-15 17:33    32  *************
  80    2024-09-15 17:34    32  *************
  81    2024-09-15 17:35    33  **************
  82    2024-09-15 17:36    32  *************
  83    2024-09-15 17:37    31  ************
  84    2024-09-15 17:38    30  ***********
  85    2024-09-15 17:39    30  ***********
  86    2024-09-15 17:40    34  ***************
  87    2024-09-15 17:41    34  ***************
  88    2024-09-15 17:42    29  **********
  89    2024-09-15 17:43    34  ***************
  90    2024-09-15 17:44    34  ***************
  91    2024-09-15 17:45    34  ***************
  92    2024-09-15 17:46    29  **********
  93    2024-09-15 17:47    34  ***************
  94    2024-09-15 17:48    34  ***************
  95    2024-09-15 17:49    27  ********
  96    2024-09-15 17:50    34  ***************
  97    2024-09-15 17:51    29  **********
  98    2024-09-15 17:52    30  ***********
  99    2024-09-15 17:53    34  ***************
 100    2024-09-15 17:54    34  ***************
 101    2024-09-15 17:55    34  ***************
 102    2024-09-15 17:56     ?  -
 103    2024-09-15 17:57    23  ****
 104    2024-09-15 17:58     ?  -
 105    2024-09-15 17:59     ?  -
 106    2024-09-15 18:00    23  ****
 107    2024-09-15 18:01    32  *************
 108    2024-09-15 18:02    34  ***************
 109    2024-09-15 18:03    34  ***************
 110    2024-09-15 18:04    33  **************
 111    2024-09-15 18:05    35  ****************
 112    2024-09-15 18:06    35  ****************
 113    2024-09-15 18:07    34  ***************
 114    2024-09-15 18:08    34  ***************
 115    2024-09-15 18:09    33  **************
 116    2024-09-15 18:10    33  **************
 117    2024-09-15 18:11    34  ***************
 118    2024-09-15 18:12    34  ***************
 119    2024-09-15 18:13    32  *************
 120    2024-09-15 18:14    36  *****************
 121    2024-09-15 18:15    34  ***************
 122    2024-09-15 18:16    35  ****************
 123    2024-09-15 18:17    35  ****************
 124    2024-09-15 18:18    35  ****************
 125    2024-09-15 18:19    29  **********
 126    2024-09-15 18:20    30  ***********
 127    2024-09-15 18:21    26  *******
 128    2024-09-15 18:22    36  *****************
 129    2024-09-15 18:23    37  ******************
 130    2024-09-15 18:24    38  *******************
 131    2024-09-15 18:25    36  *****************
 132    2024-09-15 18:26    37  ******************
 ...    ..(  2 skipped).    ..  ******************
 135    2024-09-15 18:29    37  ******************
 136    2024-09-15 18:30    36  *****************
 137    2024-09-15 18:31    35  ****************
 138    2024-09-15 18:32    35  ****************
 139    2024-09-15 18:33     ?  -
 140    2024-09-15 18:34    27  ********
 141    2024-09-15 18:35    32  *************
 142    2024-09-15 18:36    37  ******************
 143    2024-09-15 18:37     ?  -
 144    2024-09-15 18:38    22  ***
 145    2024-09-15 18:39     ?  -
 146    2024-09-15 18:40    36  *****************
 147    2024-09-15 18:41    34  ***************
 ...    ..(  2 skipped).    ..  ***************
 150    2024-09-15 18:44    34  ***************
 151    2024-09-15 18:45    29  **********
 152    2024-09-15 18:46    31  ************
 153    2024-09-15 18:47    30  ***********
 154    2024-09-15 18:48     ?  -
 155    2024-09-15 18:49     ?  -
 156    2024-09-15 18:50     ?  -
 157    2024-09-15 18:51    26  *******
 158    2024-09-15 18:52    27  ********
 159    2024-09-15 18:53    38  *******************
 160    2024-09-15 18:54    30  ***********
 161    2024-09-15 18:55    31  ************
 162    2024-09-15 18:56    31  ************
 163    2024-09-15 18:57    39  ********************
 164    2024-09-15 18:58    32  *************
 165    2024-09-15 18:59    36  *****************
 166    2024-09-15 19:00    36  *****************
 167    2024-09-15 19:01    36  *****************
 168    2024-09-15 19:02    34  ***************
 169    2024-09-15 19:03    32  *************
 170    2024-09-15 19:04    33  **************
 171    2024-09-15 19:05    32  *************
 172    2024-09-15 19:06    33  **************
 173    2024-09-15 19:07    38  *******************
 174    2024-09-15 19:08    36  *****************
 175    2024-09-15 19:09    37  ******************
 176    2024-09-15 19:10    38  *******************
 177    2024-09-15 19:11    38  *******************
 178    2024-09-15 19:12    32  *************
 179    2024-09-15 19:13    32  *************
 180    2024-09-15 19:14    39  ********************
 181    2024-09-15 19:15    38  *******************
 182    2024-09-15 19:16    33  **************
 183    2024-09-15 19:17    33  **************
 184    2024-09-15 19:18     ?  -
 185    2024-09-15 19:19    23  ****
 186    2024-09-15 19:20    25  ******
 187    2024-09-15 19:21     ?  -
 188    2024-09-15 19:22    23  ****
 189    2024-09-15 19:23    25  ******
 190    2024-09-15 19:24    27  ********
 191    2024-09-15 19:25     ?  -
 192    2024-09-15 19:26     ?  -
 193    2024-09-15 19:27    24  *****
 194    2024-09-15 19:28     ?  -
 195    2024-09-15 19:29    26  *******
 196    2024-09-15 19:30    28  *********

SCT Error Recovery Control command not supported

Device Statistics (GP Log 0x04)
Page  Offset Size        Value Flags Description
0x01  =====  =               =  ===  == General Statistics (rev 1) ==
0x01  0x008  4              55  ---  Lifetime Power-On Resets
0x01  0x010  4              74  ---  Power-on Hours
0x01  0x018  6      9572637606  ---  Logical Sectors Written
0x01  0x020  6         6968714  ---  Number of Write Commands
0x01  0x028  6     10015259416  ---  Logical Sectors Read
0x01  0x030  6        14086332  ---  Number of Read Commands
0x07  =====  =               =  ===  == Solid State Device Statistics (rev 1) ==
0x07  0x008  1               0  N--  Percentage Used Endurance Indicator
                                |||_ C monitored condition met
                                ||__ D supports DSN
                                |___ N normalized value

Pending Defects log (GP Log 0x0c) not supported

SATA Phy Event Counters (GP Log 0x11)
ID      Size     Value  Description
0x0001  2            0  Command failed due to ICRC error
0x0003  2            0  R_ERR response for device-to-host data FIS
0x0004  2            0  R_ERR response for host-to-device data FIS
0x0006  2            0  R_ERR response for device-to-host non-data FIS
0x0007  2            0  R_ERR response for host-to-device non-data FIS
0x0008  2            0  Device-to-host non-data FIS retries
0x0009  4            0  Transition from drive PhyRdy to drive PhyNRdy
0x000a  4            1  Device-to-host register FISes sent due to a COMRESET
0x000f  2            0  R_ERR response for host-to-device data FIS, CRC
0x0010  2            0  R_ERR response for host-to-device data FIS, non-CRC
0x0012  2            0  R_ERR response for host-to-device non-data FIS, CRC
0x0013  2            0  R_ERR response for host-to-device non-data FIS, non-CRC

