smartctl 7.3 2022-02-28 r5338 [x86_64-w64-mingw32-w11-21H2] (sf-7.3-1)
Copyright (C) 2002-22, Bruce Allen, Christian Franke, www.smartmontools.org

=== START OF INFORMATION SECTION ===
Device Model:     WDC WD4005FZBX-00K5WB0
Serial Number:    V1JRUHWG
LU WWN Device Id: 5 000cca 0bce68ef1
Firmware Version: 01.01A01
User Capacity:    4,000,787,030,016 bytes [4.00 TB]
Sector Size:      4096 bytes logical/physical
Rotation Rate:    7200 rpm
Form Factor:      3.5 inches
Device is:        Not in smartctl database 7.3/5319
ATA Version is:   ACS-2, ATA8-ACS T13/1699-D revision 4
SATA Version is:  SATA 3.2, 6.0 Gb/s (current: 6.0 Gb/s)
Local Time is:    Fri Apr 01 21:34:08 2022 EDT
SMART support is: Available - device has SMART capability.
SMART support is: Enabled
AAM feature is:   Unavailable
APM level is:     254 (maximum performance)
Rd look-ahead is: Enabled
Write cache is:   Enabled
DSN feature is:   Unavailable
ATA Security is:  Disabled, frozen [SEC2]
Wt Cache Reorder: Enabled

=== START OF READ SMART DATA SECTION ===
SMART overall-health self-assessment test result: PASSED

General SMART Values:
Offline data collection status:  (0x80)	Offline data collection activity
					was never started.
					Auto Offline Data Collection: Enabled.
Self-test execution status:      (   0)	The previous self-test routine completed
					without error or no self-test has ever 
					been run.
Total time to complete Offline 
data collection: 		(   87) seconds.
Offline data collection
capabilities: 			 (0x5b) SMART execute Offline immediate.
					Auto Offline data collection on/off support.
					Suspend Offline collection upon new
					command.
					Offline surface scan supported.
					Self-test supported.
					No Conveyance Self-test supported.
					Selective Self-test supported.
SMART capabilities:            (0x0003)	Saves SMART data before entering
					power-saving mode.
					Supports SMART auto save timer.
Error logging capability:        (0x01)	Error logging supported.
					General Purpose Logging supported.
Short self-test routine 
recommended polling time: 	 (   2) minutes.
Extended self-test routine
recommended polling time: 	 ( 480) minutes.
SCT capabilities: 	       (0x0035)	SCT Status supported.
					SCT Feature Control supported.
					SCT Data Table supported.

SMART Attributes Data Structure revision number: 16
Vendor Specific SMART Attributes with Thresholds:
ID# ATTRIBUTE_NAME          FLAGS    VALUE WORST THRESH FAIL RAW_VALUE
  1 Raw_Read_Error_Rate     PO-R--   100   100   016    -    0
  2 Throughput_Performance  --S---   130   130   054    -    100
  3 Spin_Up_Time            POS---   162   162   024    -    245 (Average 277)
  4 Start_Stop_Count        -O--C-   100   100   000    -    581
  5 Reallocated_Sector_Ct   PO--CK   100   100   005    -    0
  7 Seek_Error_Rate         -O-R--   100   100   067    -    0
  8 Seek_Time_Performance   --S---   128   128   020    -    18
  9 Power_On_Hours          -O--C-   100   100   000    -    196
 10 Spin_Retry_Count        -O--C-   100   100   060    -    0
 12 Power_Cycle_Count       -O--CK   100   100   000    -    496
192 Power-Off_Retract_Count -O--CK   100   100   000    -    581
193 Load_Cycle_Count        -O--C-   100   100   000    -    581
194 Temperature_Celsius     -O----   166   166   000    -    33 (Min/Max 19/45)
196 Reallocated_Event_Count -O--CK   100   100   000    -    0
197 Current_Pending_Sector  -O---K   100   100   000    -    0
198 Offline_Uncorrectable   ---R--   100   100   000    -    0
199 UDMA_CRC_Error_Count    -O-R--   200   200   000    -    0
                            ||||||_ K auto-keep
                            |||||__ C event count
                            ||||___ R error rate
                            |||____ S speed/performance
                            ||_____ O updated online
                            |______ P prefailure warning

General Purpose Log Directory Version 1
SMART           Log Directory Version 1 [multi-sector log support]
Address    Access  R/W   Size  Description
0x00       GPL,SL  R/O      1  Log Directory
0x01           SL  R/O      1  Summary SMART error log
0x02           SL  R/O      1  Comprehensive SMART error log
0x03       GPL     R/O      1  Ext. Comprehensive SMART error log
0x04       GPL     R/O    256  Device Statistics log
0x04       SL      R/O    255  Device Statistics log
0x06           SL  R/O      1  SMART self-test log
0x07       GPL     R/O      1  Extended self-test log
0x08       GPL     R/O      2  Power Conditions log
0x09           SL  R/W      1  Selective self-test log
0x0c       GPL     R/O    688  Pending Defects log
0x10       GPL     R/O      1  NCQ Command Error log
0x11       GPL     R/O      1  SATA Phy Event Counters log
0x12       GPL     R/O      1  SATA NCQ Non-Data log
0x13       GPL     R/O      1  SATA NCQ Send and Receive log
0x15       GPL     R/W      1  Rebuild Assist log
0x21       GPL     R/O      1  Write stream error log
0x22       GPL     R/O      1  Read stream error log
0x24       GPL     R/O    256  Current Device Internal Status Data log
0x25       GPL     R/O    256  Saved Device Internal Status Data log
0x2f       GPL     -        1  Set Sector Configuration
0x30       GPL,SL  R/O      9  IDENTIFY DEVICE data log
0x80-0x9f  GPL,SL  R/W     16  Host vendor specific log
0xe0       GPL,SL  R/W      1  SCT Command/Status
0xe1       GPL,SL  R/W      1  SCT Data Transfer

SMART Extended Comprehensive Error Log Version: 1 (1 sectors)
No Errors Logged

SMART Extended Self-test Log Version: 1 (1 sectors)
Num  Test_Description    Status                  Remaining  LifeTime(hours)  LBA_of_first_error
# 1  Short offline       Completed without error       00%       196         -

SMART Selective self-test log data structure revision number 1
 SPAN  MIN_LBA  MAX_LBA  CURRENT_TEST_STATUS
    1        0        0  Not_testing
    2        0        0  Not_testing
    3        0        0  Not_testing
    4        0        0  Not_testing
    5        0        0  Not_testing
Selective self-test flags (0x0):
  After scanning selected spans, do NOT read-scan remainder of disk.
If Selective self-test is pending on power-up, resume after 0 minute delay.

SCT Status Version:                  3
SCT Version (vendor specific):       256 (0x0100)
Device State:                        Active (0)
Current Temperature:                    33 Celsius
Power Cycle Min/Max Temperature:     27/33 Celsius
Lifetime    Min/Max Temperature:     19/45 Celsius
Under/Over Temperature Limit Count:   0/0

SCT Temperature History Version:     2
Temperature Sampling Period:         1 minute
Temperature Logging Interval:        1 minute
Min/Max recommended Temperature:      0/55 Celsius
Min/Max Temperature Limit:           -40/70 Celsius
Temperature History Size (Index):    128 (98)

Index    Estimated Time   Temperature Celsius
  99    2022-04-01 19:27    41  **********************
 ...    ..(  7 skipped).    ..  **********************
 107    2022-04-01 19:35    41  **********************
 108    2022-04-01 19:36    42  ***********************
 ...    ..( 12 skipped).    ..  ***********************
 121    2022-04-01 19:49    42  ***********************
 122    2022-04-01 19:50    43  ************************
 ...    ..(  6 skipped).    ..  ************************
   1    2022-04-01 19:57    43  ************************
   2    2022-04-01 19:58    35  ****************
   3    2022-04-01 19:59    35  ****************
   4    2022-04-01 20:00    36  *****************
   5    2022-04-01 20:01    36  *****************
   6    2022-04-01 20:02    36  *****************
   7    2022-04-01 20:03    37  ******************
   8    2022-04-01 20:04    37  ******************
   9    2022-04-01 20:05    37  ******************
  10    2022-04-01 20:06    38  *******************
 ...    ..(  2 skipped).    ..  *******************
  13    2022-04-01 20:09    38  *******************
  14    2022-04-01 20:10    39  ********************
 ...    ..(  2 skipped).    ..  ********************
  17    2022-04-01 20:13    39  ********************
  18    2022-04-01 20:14    40  *********************
 ...    ..(  4 skipped).    ..  *********************
  23    2022-04-01 20:19    40  *********************
  24    2022-04-01 20:20    41  **********************
 ...    ..(  4 skipped).    ..  **********************
  29    2022-04-01 20:25    41  **********************
  30    2022-04-01 20:26    42  ***********************
 ...    ..(  4 skipped).    ..  ***********************
  35    2022-04-01 20:31    42  ***********************
  36    2022-04-01 20:32    43  ************************
 ...    ..(  2 skipped).    ..  ************************
  39    2022-04-01 20:35    43  ************************
  40    2022-04-01 20:36    27  ********
  41    2022-04-01 20:37    27  ********
  42    2022-04-01 20:38    28  *********
  43    2022-04-01 20:39    29  **********
  44    2022-04-01 20:40    29  **********
  45    2022-04-01 20:41    30  ***********
  46    2022-04-01 20:42    30  ***********
  47    2022-04-01 20:43    31  ************
  48    2022-04-01 20:44    31  ************
  49    2022-04-01 20:45    32  *************
  50    2022-04-01 20:46    32  *************
  51    2022-04-01 20:47    32  *************
  52    2022-04-01 20:48    33  **************
  53    2022-04-01 20:49    33  **************
  54    2022-04-01 20:50    34  ***************
  55    2022-04-01 20:51    34  ***************
  56    2022-04-01 20:52    34  ***************
  57    2022-04-01 20:53    26  *******
  58    2022-04-01 20:54    27  ********
  59    2022-04-01 20:55    28  *********
  60    2022-04-01 20:56    29  **********
  61    2022-04-01 20:57    30  ***********
  62    2022-04-01 20:58    29  **********
  63    2022-04-01 20:59    30  ***********
  64    2022-04-01 21:00    31  ************
  65    2022-04-01 21:01    30  ***********
  66    2022-04-01 21:02    30  ***********
  67    2022-04-01 21:03    31  ************
  68    2022-04-01 21:04    31  ************
  69    2022-04-01 21:05    32  *************
  70    2022-04-01 21:06    32  *************
  71    2022-04-01 21:07    32  *************
  72    2022-04-01 21:08    33  **************
  73    2022-04-01 21:09    33  **************
  74    2022-04-01 21:10    34  ***************
  75    2022-04-01 21:11    34  ***************
  76    2022-04-01 21:12    34  ***************
  77    2022-04-01 21:13    35  ****************
  78    2022-04-01 21:14    35  ****************
  79    2022-04-01 21:15    35  ****************
  80    2022-04-01 21:16    36  *****************
 ...    ..(  2 skipped).    ..  *****************
  83    2022-04-01 21:19    36  *****************
  84    2022-04-01 21:20    27  ********
  85    2022-04-01 21:21    27  ********
  86    2022-04-01 21:22    28  *********
  87    2022-04-01 21:23    29  **********
  88    2022-04-01 21:24    29  **********
  89    2022-04-01 21:25    29  **********
  90    2022-04-01 21:26    30  ***********
  91    2022-04-01 21:27    30  ***********
  92    2022-04-01 21:28    31  ************
  93    2022-04-01 21:29    31  ************
  94    2022-04-01 21:30    32  *************
  95    2022-04-01 21:31    32  *************
  96    2022-04-01 21:32    33  **************
  97    2022-04-01 21:33    33  **************
  98    2022-04-01 21:34    41  **********************

SCT Error Recovery Control command not supported

Device Statistics (GP Log 0x04)
Page  Offset Size        Value Flags Description
0x01  =====  =               =  ===  == General Statistics (rev 1) ==
0x01  0x008  4             496  ---  Lifetime Power-On Resets
0x01  0x010  4             196  ---  Power-on Hours
0x01  0x018  6        39904556  ---  Logical Sectors Written
0x01  0x020  6         9404502  ---  Number of Write Commands
0x01  0x028  6        34421082  ---  Logical Sectors Read
0x01  0x030  6         3497437  ---  Number of Read Commands
0x01  0x038  6   1648863248654  ---  Date and Time TimeStamp
0x03  =====  =               =  ===  == Rotating Media Statistics (rev 1) ==
0x03  0x008  4             168  ---  Spindle Motor Power-on Hours
0x03  0x010  4             168  ---  Head Flying Hours
0x03  0x018  4             581  ---  Head Load Events
0x03  0x020  4               0  ---  Number of Reallocated Logical Sectors
0x03  0x028  4               0  ---  Read Recovery Attempts
0x03  0x030  4               0  ---  Number of Mechanical Start Failures
0x04  =====  =               =  ===  == General Errors Statistics (rev 1) ==
0x04  0x008  4              41  ---  Number of Reported Uncorrectable Errors
0x04  0x010  4              24  ---  Resets Between Cmd Acceptance and Completion
0x05  =====  =               =  ===  == Temperature Statistics (rev 1) ==
0x05  0x008  1              33  ---  Current Temperature
0x05  0x010  1              37  N--  Average Short Term Temperature
0x05  0x018  1              37  N--  Average Long Term Temperature
0x05  0x020  1              45  ---  Highest Temperature
0x05  0x028  1              19  ---  Lowest Temperature
0x05  0x030  1              42  N--  Highest Average Short Term Temperature
0x05  0x038  1              25  N--  Lowest Average Short Term Temperature
0x05  0x040  1              40  N--  Highest Average Long Term Temperature
0x05  0x048  1              25  N--  Lowest Average Long Term Temperature
0x05  0x050  4               0  ---  Time in Over-Temperature
0x05  0x058  1              55  ---  Specified Maximum Operating Temperature
0x05  0x060  4               0  ---  Time in Under-Temperature
0x05  0x068  1               0  ---  Specified Minimum Operating Temperature
0x06  =====  =               =  ===  == Transport Statistics (rev 1) ==
0x06  0x008  4             315  ---  Number of Hardware Resets
0x06  0x010  4             124  ---  Number of ASR Events
0x06  0x018  4               0  ---  Number of Interface CRC Errors
0xff  =====  =               =  ===  == Vendor Specific Statistics (rev 1) ==
                                |||_ C monitored condition met
                                ||__ D supports DSN
                                |___ N normalized value

Pending Defects log (GP Log 0x0c)
No Defects Logged

SATA Phy Event Counters (GP Log 0x11)
ID      Size     Value  Description
0x0001  2            0  Command failed due to ICRC error
0x0002  2            0  R_ERR response for data FIS
0x0003  2            0  R_ERR response for device-to-host data FIS
0x0004  2            0  R_ERR response for host-to-device data FIS
0x0005  2            0  R_ERR response for non-data FIS
0x0006  2            0  R_ERR response for device-to-host non-data FIS
0x0007  2            0  R_ERR response for host-to-device non-data FIS
0x0008  2            0  Device-to-host non-data FIS retries
0x0009  2            4  Transition from drive PhyRdy to drive PhyNRdy
0x000a  2            5  Device-to-host register FISes sent due to a COMRESET
0x000b  2            0  CRC errors within host-to-device FIS
0x000d  2            0  Non-CRC errors within host-to-device FIS

