smartctl 7.1 2019-12-30 r5022 [armv7l-linux-5.4.0-1048-raspi] (local build)
Copyright (C) 2002-19, Bruce Allen, Christian Franke, www.smartmontools.org

=== START OF INFORMATION SECTION ===
Model Family:     Transcend CF220I Industrial CompactFlash Card
Device Model:     TS4GCF220I-P
Firmware Version: 20150912
User Capacity:    4,076,642,304 bytes [4.07 GB]
Sector Size:      512 bytes logical/physical
Device is:        In smartctl database [for details use: -P show]
ATA Version is:   [No Information Found]
Local Time is:    Fri Jan 14 13:18:56 2022 UTC
SMART support is: Available - device has SMART capability.
SMART support is: Enabled
AAM feature is:   Unavailable
APM feature is:   Disabled
Rd look-ahead is: Unavailable
Write cache is:   Disabled
DSN feature is:   Unavailable
ATA Security is:  Disabled, NOT FROZEN [SEC1]
Wt Cache Reorder: Unavailable

=== START OF READ SMART DATA SECTION ===
SMART overall-health self-assessment test result: PASSED

General SMART Values:
Offline data collection status:  (0x02)	Offline data collection activity
					was completed without error.
					Auto Offline Data Collection: Disabled.
Total time to complete Offline 
data collection: 		(    1) seconds.
Offline data collection
capabilities: 			 (0x00) 	Offline data collection not supported.
SMART capabilities:            (0x0002)	Does not save SMART data before
					entering power-saving mode.
					Supports SMART auto save timer.
Error logging capability:        (0x00)	Error logging NOT supported.
					No General Purpose Logging support.

SMART Attributes Data Structure revision number: 1
Vendor Specific SMART Attributes with Thresholds:
ID# ATTRIBUTE_NAME          FLAGS    VALUE WORST THRESH FAIL RAW_VALUE
  1 Raw_Read_Error_Rate     ------   100   100   050    -    0
  5 Reallocated_Sector_Ct   ------   100   100   050    -    0
 12 Power_Cycle_Count       ------   100   100   050    -    884
160 Uncorrectable_Error_Cnt ------   100   100   050    -    0
161 Valid_Spare_Block_Cnt   ------   100   100   050    -    35
162 Child_Pair_Count        ------   100   100   050    -    21
163 Initial_Bad_Block_Count ------   100   100   050    -    21
164 Total_Erase_Count       ------   100   100   050    -    344983
165 Max_Erase_Count         ------   100   100   050    -    385
166 Min_Erase_Count         ------   100   100   050    -    312
167 Average_Erase_Count     ------   100   100   050    -    338
192 Power-Off_Retract_Count ------   100   100   050    -    0
194 Temperature_Celsius     ------   100   100   000    -    37 (Min/Max 20/73)
195 Hardware_ECC_Recovered  ------   100   100   050    -    0
196 Reallocated_Event_Count ------   100   100   050    -    0
198 Offline_Uncorrectable   ------   100   100   050    -    0
199 UDMA_CRC_Error_Count    ------   100   100   050    -    0
241 Host_Writes_32MiB       ------   100   100   050    -    4938
242 Host_Reads_32MiB        ------   100   100   050    -    32956
                            ||||||_ K auto-keep
                            |||||__ C event count
                            ||||___ R error rate
                            |||____ S speed/performance
                            ||_____ O updated online
                            |______ P prefailure warning

Read SMART Log Directory failed: Success

General Purpose Log Directory not supported

SMART Extended Comprehensive Error Log (GP Log 0x03) not supported

SMART Error Log not supported

SMART Extended Self-test Log (GP Log 0x07) not supported

SMART Self-test Log not supported

Selective Self-tests/Logging not supported

SCT Commands not supported

Device Statistics (GP/SMART Log 0x04) not supported

Pending Defects log (GP Log 0x0c) not supported

SATA Phy Event Counters (GP Log 0x11) not supported

