smartctl 7.1 2019-12-30 r5022 [x86_64-linux-5.4.0-37-generic] (local build)
Copyright (C) 2002-19, Bruce Allen, Christian Franke, www.smartmontools.org

=== START OF INFORMATION SECTION ===
Model Number:                       m.2 Smartbuy PS5013-2280T 128GB
Serial Number:                      27FF0702089700834772
Firmware Version:                   EDFM00E3
PCI Vendor/Subsystem ID:            0x1987
IEEE OUI Identifier:                0x6479a7
Total NVM Capacity:                 128,035,676,160 [128 GB]
Unallocated NVM Capacity:           0
Controller ID:                      1
Number of Namespaces:               1
Namespace 1 Size/Capacity:          128,035,676,160 [128 GB]
Namespace 1 Formatted LBA Size:     512
Namespace 1 IEEE EUI-64:            6479a7 2fc35987d4
Local Time is:                      Thu Jun 18 03:02:55 2020 MSK
Firmware Updates (0x12):            1 Slot, no Reset required
Optional Admin Commands (0x001f):   Security Format Frmw_DL NS_Mngmt Self_Test
Optional NVM Commands (0x005e):     Wr_Unc DS_Mngmt Wr_Zero Sav/Sel_Feat Timestmp
Maximum Data Transfer Size:         64 Pages
Warning  Comp. Temp. Threshold:     68 Celsius
Critical Comp. Temp. Threshold:     70 Celsius

Supported Power States
St Op     Max   Active     Idle   RL RT WL WT  Ent_Lat  Ex_Lat
 0 +     4.50W       -        -    0  0  0  0        0       0
 1 +     2.70W       -        -    1  1  1  1        0       0
 2 +     2.16W       -        -    2  2  2  2        0       0
 3 -   0.0700W       -        -    3  3  3  3     1000    1000
 4 -   0.0020W       -        -    4  4  4  4     5000   60000

Supported LBA Sizes (NSID 0x1)
Id Fmt  Data  Metadt  Rel_Perf
 0 +     512       0         1
 1 -    4096       0         0

=== START OF SMART DATA SECTION ===
SMART overall-health self-assessment test result: PASSED

SMART/Health Information (NVMe Log 0x02)
Critical Warning:                   0x00
Temperature:                        32 Celsius
Available Spare:                    100%
Available Spare Threshold:          5%
Percentage Used:                    0%
Data Units Read:                    680,644 [348 GB]
Data Units Written:                 909,523 [465 GB]
Host Read Commands:                 5,895,138
Host Write Commands:                6,936,279
Controller Busy Time:               427
Power Cycles:                       30
Power On Hours:                     238
Unsafe Shutdowns:                   9
Media and Data Integrity Errors:    0
Error Information Log Entries:      542
Warning  Comp. Temperature Time:    0
Critical Comp. Temperature Time:    0

Error Information (NVMe Log 0x01, max 16 entries)
No Errors Logged

