smartctl 6.6 2016-05-31 r4324 [x86_64-linux-5.4.0-97-generic] (local build)
Copyright (C) 2002-16, Bruce Allen, Christian Franke, www.smartmontools.org

=== START OF INFORMATION SECTION ===
Device Model:     VK000480GWSRR
Firmware Version: HPG3
User Capacity:    480,103,981,056 bytes [480 GB]
Sector Sizes:     512 bytes logical, 4096 bytes physical
Rotation Rate:    Solid State Device
Form Factor:      2.5 inches
Device is:        Not in smartctl database [for details use: -P showall]
ATA Version is:   Unknown(0x0ffc), ACS-3 T13/2161-D revision 5
SATA Version is:  SATA 3.2, 6.0 Gb/s (current: 6.0 Gb/s)
Local Time is:    Thu Mar 17 23:12:59 2022 EDT
SMART support is: Available - device has SMART capability.
SMART support is: Enabled
AAM feature is:   Unavailable
APM feature is:   Unavailable
Rd look-ahead is: Enabled
Write cache is:   Disabled
ATA Security is:  Unavailable
Wt Cache Reorder: Unavailable

=== START OF READ SMART DATA SECTION ===
SMART overall-health self-assessment test result: PASSED

General SMART Values:
Offline data collection status:  (0x82)	Offline data collection activity
					was completed without error.
					Auto Offline Data Collection: Enabled.
Self-test execution status:      (   0)	The previous self-test routine completed
					without error or no self-test has ever 
					been run.
Total time to complete Offline 
data collection: 		(    0) seconds.
Offline data collection
capabilities: 			 (0x53) SMART execute Offline immediate.
					Auto Offline data collection on/off support.
					Suspend Offline collection upon new
					command.
					No Offline surface scan supported.
					Self-test supported.
					No Conveyance Self-test supported.
					Selective Self-test supported.
SMART capabilities:            (0x0003)	Saves SMART data before entering
					power-saving mode.
					Supports SMART auto save timer.
Error logging capability:        (0x01)	Error logging supported.
					General Purpose Logging supported.
Short self-test routine 
recommended polling time: 	 (   2) minutes.
Extended self-test routine
recommended polling time: 	 (  35) minutes.
SCT capabilities: 	       (0x0025)	SCT Status supported.
					SCT Data Table supported.

SMART Attributes Data Structure revision number: 1
Vendor Specific SMART Attributes with Thresholds:
ID# ATTRIBUTE_NAME          FLAGS    VALUE WORST THRESH FAIL RAW_VALUE
  1 Raw_Read_Error_Rate     POSR--   200   200   002    -    0
  5 Reallocated_Sector_Ct   PO--CK   100   100   005    -    0
  9 Power_On_Hours          -O--CK   099   099   000    -    3220
173 Unknown_Attribute       PO--CK   099   099   005    -    68
175 Program_Fail_Count_Chip PO--CK   100   100   001    -    0
180 Unused_Rsvd_Blk_Cnt_Tot PO-RCK   200   200   097    -    0
194 Temperature_Celsius     -O---K   070   057   000    -    30
196 Reallocated_Event_Count PO--CK   100   100   005    -    0
202 Unknown_SSD_Attribute   PO--CK   100   100   010    -    0
                            ||||||_ K auto-keep
                            |||||__ C event count
                            ||||___ R error rate
                            |||____ S speed/performance
                            ||_____ O updated online
                            |______ P prefailure warning

General Purpose Log Directory Version 1
SMART           Log Directory Version 1 [multi-sector log support]
Address    Access  R/W   Size  Description
0x00       GPL,SL  R/O      1  Log Directory
0x03       GPL     R/O      1  Ext. Comprehensive SMART error log
0x04       GPL,SL  R/O      8  Device Statistics log
0x07       GPL     R/O      1  Extended self-test log
0x09           SL  R/W      1  Selective self-test log
0x0c       GPL     R/O      1  Pending Defects log
0x0d       GPL     R/O      1  LPS Mis-alignment log
0x10       GPL     R/O      1  SATA NCQ Queued Error log
0x11       GPL     R/O      1  SATA Phy Event Counters log
0x13       GPL     R/O      1  SATA NCQ Send and Receive log
0x30       GPL     R/O      9  IDENTIFY DEVICE data log
0x80       GPL     R/W     16  Host vendor specific log
0x81-0x9f  GPL,SL  R/W     16  Host vendor specific log
0xb5           SL  VS       1  Device vendor specific log
0xb6       GPL     VS       1  Device vendor specific log
0xbb       GPL     VS       1  Device vendor specific log
0xd0       GPL     VS       1  Device vendor specific log
0xd7       GPL     VS       1  Device vendor specific log
0xe0       GPL,SL  R/W      1  SCT Command/Status
0xe1       GPL,SL  R/W      1  SCT Data Transfer

SMART Extended Comprehensive Error Log Version: 1 (1 sectors)
No Errors Logged

SMART Extended Self-test Log Version: 1 (1 sectors)
Num  Test_Description    Status                  Remaining  LifeTime(hours)  LBA_of_first_error
# 1  Short offline       Completed without error       00%      3220         -
# 2  Short offline       Completed without error       00%      3197         -
# 3  Short offline       Completed without error       00%      3173         -
# 4  Short offline       Completed without error       00%      3149         -
# 5  Short offline       Completed without error       00%      3125         -
# 6  Short offline       Completed without error       00%      3102         -
# 7  Short offline       Completed without error       00%      3078         -
# 8  Short offline       Completed without error       00%      3054         -
# 9  Short offline       Completed without error       00%      3030         -
#10  Short offline       Completed without error       00%      3006         -
#11  Short offline       Completed without error       00%      2982         -
#12  Short offline       Completed without error       00%      2958         -
#13  Short offline       Completed without error       00%      2934         -
#14  Short offline       Completed without error       00%      2910         -
#15  Short offline       Completed without error       00%      2886         -
#16  Short offline       Completed without error       00%      2862         -
#17  Short offline       Completed without error       00%      2838         -
#18  Short offline       Completed without error       00%      2814         -
#19  Short offline       Completed without error       00%      2790         -

SMART Selective self-test log data structure revision number 1
 SPAN  MIN_LBA  MAX_LBA  CURRENT_TEST_STATUS
    1        0        0  Not_testing
    2        0        0  Not_testing
    3        0        0  Not_testing
    4        0        0  Not_testing
    5        0        0  Not_testing
Selective self-test flags (0x0):
  After scanning selected spans, do NOT read-scan remainder of disk.
If Selective self-test is pending on power-up, resume after 0 minute delay.

SCT Status Version:                  3
SCT Version (vendor specific):       256 (0x0100)
SCT Support Level:                   0
Device State:                        Active (0)
Current Temperature:                    30 Celsius
Power Cycle Min/Max Temperature:     29/35 Celsius
Lifetime    Min/Max Temperature:      7/43 Celsius
Under/Over Temperature Limit Count:   0/0

SCT Temperature History Version:     2
Temperature Sampling Period:         1 minute
Temperature Logging Interval:        10 minutes
Min/Max recommended Temperature:      0/60 Celsius
Min/Max Temperature Limit:            0/60 Celsius
Temperature History Size (Index):    128 (29)

Index    Estimated Time   Temperature Celsius
  30    2022-03-17 02:00    43  ************************
  31    2022-03-17 02:10    43  ************************
  32    2022-03-17 02:20    43  ************************
  33    2022-03-17 02:30    42  ***********************
  34    2022-03-17 02:40    42  ***********************
  35    2022-03-17 02:50    42  ***********************
  36    2022-03-17 03:00    43  ************************
 ...    ..(  2 skipped).    ..  ************************
  39    2022-03-17 03:30    43  ************************
  40    2022-03-17 03:40    42  ***********************
  41    2022-03-17 03:50    42  ***********************
  42    2022-03-17 04:00    43  ************************
 ...    ..(  3 skipped).    ..  ************************
  46    2022-03-17 04:40    43  ************************
  47    2022-03-17 04:50    42  ***********************
  48    2022-03-17 05:00    42  ***********************
  49    2022-03-17 05:10    43  ************************
 ...    ..(  2 skipped).    ..  ************************
  52    2022-03-17 05:40    43  ************************
  53    2022-03-17 05:50    42  ***********************
  54    2022-03-17 06:00    43  ************************
  55    2022-03-17 06:10    43  ************************
  56    2022-03-17 06:20    43  ************************
  57    2022-03-17 06:30    42  ***********************
  58    2022-03-17 06:40    42  ***********************
  59    2022-03-17 06:50    42  ***********************
  60    2022-03-17 07:00    43  ************************
 ...    ..(  2 skipped).    ..  ************************
  63    2022-03-17 07:30    43  ************************
  64    2022-03-17 07:40    42  ***********************
  65    2022-03-17 07:50    42  ***********************
  66    2022-03-17 08:00    43  ************************
 ...    ..(  3 skipped).    ..  ************************
  70    2022-03-17 08:40    43  ************************
  71    2022-03-17 08:50    42  ***********************
  72    2022-03-17 09:00    43  ************************
 ...    ..(  4 skipped).    ..  ************************
  77    2022-03-17 09:50    43  ************************
  78    2022-03-17 10:00    42  ***********************
  79    2022-03-17 10:10    42  ***********************
  80    2022-03-17 10:20    43  ************************
 ...    ..(  4 skipped).    ..  ************************
  85    2022-03-17 11:10    43  ************************
  86    2022-03-17 11:20    42  ***********************
 ...    ..(  7 skipped).    ..  ***********************
  94    2022-03-17 12:40    42  ***********************
  95    2022-03-17 12:50    43  ************************
  96    2022-03-17 13:00    44  *************************
 ...    ..( 45 skipped).    ..  *************************
  14    2022-03-17 20:40    44  *************************
  15    2022-03-17 20:50    43  ************************
 ...    ..(  3 skipped).    ..  ************************
  19    2022-03-17 21:30    43  ************************
  20    2022-03-17 21:40    42  ***********************
 ...    ..(  4 skipped).    ..  ***********************
  25    2022-03-17 22:30    42  ***********************
  26    2022-03-17 22:40    43  ************************
  27    2022-03-17 22:50    42  ***********************
  28    2022-03-17 23:00    42  ***********************
  29    2022-03-17 23:10    42  ***********************

SCT Error Recovery Control command not supported

Device Statistics (GP Log 0x04)
Page  Offset Size        Value Flags Description
0x01  =====  =               =  ===  == General Statistics (rev 1) ==
0x01  0x008  4              56  ---  Lifetime Power-On Resets
0x01  0x010  4            3220  ---  Power-on Hours
0x01  0x018  6     57730863966  ---  Logical Sectors Written
0x01  0x020  6       266206863  ---  Number of Write Commands
0x01  0x028  6      5390274795  ---  Logical Sectors Read
0x01  0x030  6        20588818  ---  Number of Read Commands
0x01  0x038  6         2317000  ---  Date and Time TimeStamp
0x04  =====  =               =  ===  == General Errors Statistics (rev 1) ==
0x04  0x008  4               0  ---  Number of Reported Uncorrectable Errors
0x04  0x010  4               0  ---  Resets Between Cmd Acceptance and Completion
0x05  =====  =               =  ===  == Temperature Statistics (rev 1) ==
0x05  0x008  1              30  ---  Current Temperature
0x05  0x020  1              43  ---  Highest Temperature
0x05  0x028  1               7  ---  Lowest Temperature
0x05  0x058  1              60  ---  Specified Maximum Operating Temperature
0x06  =====  =               =  ===  == Transport Statistics (rev 1) ==
0x06  0x008  4             444  ---  Number of Hardware Resets
0x06  0x010  4               0  ---  Number of ASR Events
0x06  0x018  4               0  ---  Number of Interface CRC Errors
0x07  =====  =               =  ===  == Solid State Device Statistics (rev 1) ==
0x07  0x008  1               0  N--  Percentage Used Endurance Indicator
                                |||_ C monitored condition met
                                ||__ D supports DSN
                                |___ N normalized value

SATA Phy Event Counters (GP Log 0x11)
ID      Size     Value  Description

