smartctl 7.3 2022-02-28 r5338 [x86_64-linux-6.8.12-8-pve] (local build)
Copyright (C) 2002-22, Bruce Allen, Christian Franke, www.smartmontools.org

=== START OF INFORMATION SECTION ===
Model Family:     Intel/Solidigm S46x0/S45x0 Series SSDs
Device Model:     VK000480GWTTA
Serial Number:    PHYF0040004E480BGN
LU WWN Device Id: 5 5cd2e4 1521c15b4
Firmware Version: 4IYRHPG7
User Capacity:    480,103,981,056 bytes [480 GB]
Sector Sizes:     512 bytes logical, 4096 bytes physical
Rotation Rate:    Solid State Device
Form Factor:      2.5 inches
TRIM Command:     Available, deterministic, zeroed
Device is:        In smartctl database 7.3/5653
ATA Version is:   ACS-3 T13/2161-D revision 5
SATA Version is:  SATA 3.2, 6.0 Gb/s (current: 6.0 Gb/s)
Local Time is:    Sun Feb  9 14:55:27 2025 UTC
SMART support is: Available - device has SMART capability.
SMART support is: Enabled
AAM feature is:   Unavailable
APM feature is:   Unavailable
Rd look-ahead is: Enabled
Write cache is:   Disabled
DSN feature is:   Unavailable
ATA Security is:  Unavailable
Wt Cache Reorder: Unavailable

=== START OF READ SMART DATA SECTION ===
SMART overall-health self-assessment test result: PASSED

General SMART Values:
Offline data collection status:  (0x02)	Offline data collection activity
					was completed without error.
					Auto Offline Data Collection: Disabled.
Self-test execution status:      (   0)	The previous self-test routine completed
					without error or no self-test has ever 
					been run.
Total time to complete Offline 
data collection: 		(   72) seconds.
Offline data collection
capabilities: 			 (0x79) SMART execute Offline immediate.
					No Auto Offline data collection support.
					Suspend Offline collection upon new
					command.
					Offline surface scan supported.
					Self-test supported.
					Conveyance Self-test supported.
					Selective Self-test supported.
SMART capabilities:            (0x0003)	Saves SMART data before entering
					power-saving mode.
					Supports SMART auto save timer.
Error logging capability:        (0x01)	Error logging supported.
					General Purpose Logging supported.
Short self-test routine 
recommended polling time: 	 (   2) minutes.
Extended self-test routine
recommended polling time: 	 (   3) minutes.
Conveyance self-test routine
recommended polling time: 	 (   3) minutes.
SCT capabilities: 	       (0x0021)	SCT Status supported.
					SCT Data Table supported.

SMART Attributes Data Structure revision number: 1
Vendor Specific SMART Attributes with Thresholds:
ID# ATTRIBUTE_NAME          FLAGS    VALUE WORST THRESH FAIL RAW_VALUE
  5 Reallocated_Sector_Ct   -O--CK   100   100   000    -    0
  9 Power_On_Hours          -O--CK   100   100   000    -    7641
 12 Power_Cycle_Count       -O--CK   100   100   000    -    34
170 Available_Reservd_Space PO--CK   100   100   010    -    0
171 Program_Fail_Count      -O--CK   100   100   000    -    0
172 Erase_Fail_Count        -O--CK   100   100   000    -    0
174 Unsafe_Shutdown_Count   -O--CK   100   100   000    -    30
175 Power_Loss_Cap_Test     PO--CK   100   100   010    -    2557 (34 65535)
183 SATA_Downshift_Count    -O--CK   100   100   000    -    0
184 End-to-End_Error_Count  PO--CK   100   100   090    -    0
187 Uncorrectable_Error_Cnt -O--CK   100   100   000    -    0
190 Drive_Temperature       -O---K   083   078   000    -    17 (Min/Max 15/22)
192 Unsafe_Shutdown_Count   -O--CK   100   100   000    -    30
194 Temperature_Celsius     -O---K   100   100   000    -    17
197 Pending_Sector_Count    -O--C-   100   100   000    -    0
199 CRC_Error_Count         -OSRCK   100   100   000    -    0
225 Host_Writes_32MiB       -O--CK   100   100   000    -    30946
226 Workld_Media_Wear_Indic -O--CK   100   100   000    -    153
227 Workld_Host_Reads_Perc  -O--CK   100   100   000    -    86
228 Workload_Minutes        -O--CK   100   100   000    -    458134
232 Available_Reservd_Space PO--CK   100   100   010    -    0
233 Media_Wearout_Indicator -O--CK   100   100   000    -    0
234 Thermal_Throttle_Status -O--CK   100   100   000    -    0/0
235 Power_Loss_Cap_Test     PO--CK   100   100   010    -    2557 (34 65535)
241 Host_Writes_32MiB       -O--CK   100   100   000    -    30946
242 Host_Reads_32MiB        -O--CK   100   100   000    -    216170
243 NAND_Writes_32MiB       -O--CK   100   100   000    -    99530
                            ||||||_ K auto-keep
                            |||||__ C event count
                            ||||___ R error rate
                            |||____ S speed/performance
                            ||_____ O updated online
                            |______ P prefailure warning

General Purpose Log Directory Version 1
SMART           Log Directory Version 1 [multi-sector log support]
Address    Access  R/W   Size  Description
0x00       GPL,SL  R/O      1  Log Directory
0x03       GPL     R/O     20  Ext. Comprehensive SMART error log
0x04       GPL,SL  R/O      8  Device Statistics log
0x07       GPL     R/O      2  Extended self-test log
0x08       GPL     R/O      2  Power Conditions log
0x09           SL  R/W      1  Selective self-test log
0x10       GPL     R/O      1  NCQ Command Error log
0x11       GPL     R/O      1  SATA Phy Event Counters log
0x24       GPL     R/O    512  Current Device Internal Status Data log
0x25       GPL     R/O    512  Saved Device Internal Status Data log
0x30       GPL     R/O      9  IDENTIFY DEVICE data log
0x80       GPL     R/W     16  Host vendor specific log
0x81-0x9f  GPL,SL  R/W     16  Host vendor specific log
0xb5           SL  VS       1  Device vendor specific log
0xb6       GPL     VS     127  Device vendor specific log
0xb8       GPL,SL  VS       1  Device vendor specific log
0xb9       GPL     VS    3336  Device vendor specific log
0xb9       SL      VS       8  Device vendor specific log
0xba       GPL     VS    1280  Device vendor specific log
0xbb       GPL     VS       1  Device vendor specific log
0xd0       GPL     VS       1  Device vendor specific log
0xd7       GPL     VS       1  Device vendor specific log
0xe0       GPL,SL  R/W      1  SCT Command/Status
0xe1       GPL,SL  R/W      8  SCT Data Transfer

SMART Extended Comprehensive Error Log Version: 1 (20 sectors)
No Errors Logged

SMART Error Log not supported

SMART Extended Self-test Log Version: 1 (2 sectors)
Num  Test_Description    Status                  Remaining  LifeTime(hours)  LBA_of_first_error
# 1  Extended offline    Completed without error       00%      7499         -

SMART Self-test Log not supported

SMART Selective self-test log data structure revision number 1
 SPAN  MIN_LBA  MAX_LBA  CURRENT_TEST_STATUS
    1        0        0  Not_testing
    2        0        0  Not_testing
    3        0        0  Not_testing
    4        0        0  Not_testing
    5        0        0  Not_testing
Selective self-test flags (0x0):
  After scanning selected spans, do NOT read-scan remainder of disk.
If Selective self-test is pending on power-up, resume after 0 minute delay.

SCT Status Version:                  3
SCT Version (vendor specific):       1 (0x0001)
Device State:                        Active (0)
Current Temperature:                    17 Celsius
Power Cycle Min/Max Temperature:     15/22 Celsius
Lifetime    Min/Max Temperature:      6/23 Celsius
Specified Max Operating Temperature:    60 Celsius
Under/Over Temperature Limit Count:   0/0
Vendor specific:
00 00 28 01 00 00 00 00 00 00 00 00 00 00 00 00
00 00 00 00 00 00 00 00 00 00 00 00 00 00 00 00

SCT Temperature History Version:     2
Temperature Sampling Period:         1 minute
Temperature Logging Interval:        1 minute
Min/Max recommended Temperature:      0/60 Celsius
Min/Max Temperature Limit:            0/60 Celsius
Temperature History Size (Index):    478 (217)

Index    Estimated Time   Temperature Celsius
 218    2025-02-09 06:58    16  -
 ...    ..(417 skipped).    ..  -
 158    2025-02-09 13:56    16  -
 159    2025-02-09 13:57    17  -
 ...    ..(  6 skipped).    ..  -
 166    2025-02-09 14:04    17  -
 167    2025-02-09 14:05    16  -
 ...    ..(  3 skipped).    ..  -
 171    2025-02-09 14:09    16  -
 172    2025-02-09 14:10    17  -
 173    2025-02-09 14:11    16  -
 174    2025-02-09 14:12    17  -
 ...    ..( 10 skipped).    ..  -
 185    2025-02-09 14:23    17  -
 186    2025-02-09 14:24    16  -
 187    2025-02-09 14:25    17  -
 ...    ..(  2 skipped).    ..  -
 190    2025-02-09 14:28    17  -
 191    2025-02-09 14:29    16  -
 192    2025-02-09 14:30    16  -
 193    2025-02-09 14:31    16  -
 194    2025-02-09 14:32    17  -
 195    2025-02-09 14:33    16  -
 196    2025-02-09 14:34    17  -
 ...    ..( 20 skipped).    ..  -
 217    2025-02-09 14:55    17  -

SCT Error Recovery Control command not supported

Device Statistics (GP Log 0x04)
Page  Offset Size        Value Flags Description
0x01  =====  =               =  ===  == General Statistics (rev 1) ==
0x01  0x008  4              34  ---  Lifetime Power-On Resets
0x01  0x018  6      2028136386  ---  Logical Sectors Written
0x01  0x020  6        63604784  ---  Number of Write Commands
0x01  0x028  6     14166948009  ---  Logical Sectors Read
0x01  0x030  6        59918102  ---  Number of Read Commands
0x01  0x038  6      1740666831  ---  Date and Time TimeStamp
0x04  =====  =               =  ===  == General Errors Statistics (rev 1) ==
0x04  0x008  4               0  ---  Number of Reported Uncorrectable Errors
0x04  0x010  4               0  ---  Resets Between Cmd Acceptance and Completion
0x05  =====  =               =  ===  == Temperature Statistics (rev 1) ==
0x05  0x008  1              17  ---  Current Temperature
0x05  0x010  1              16  ---  Average Short Term Temperature
0x05  0x018  1              16  ---  Average Long Term Temperature
0x05  0x020  1              23  ---  Highest Temperature
0x05  0x028  1               6  ---  Lowest Temperature
0x05  0x030  1              19  ---  Highest Average Short Term Temperature
0x05  0x038  1              12  ---  Lowest Average Short Term Temperature
0x05  0x040  1              16  ---  Highest Average Long Term Temperature
0x05  0x048  1              12  ---  Lowest Average Long Term Temperature
0x05  0x050  4               0  ---  Time in Over-Temperature
0x05  0x058  1              60  ---  Specified Maximum Operating Temperature
0x05  0x060  4               0  ---  Time in Under-Temperature
0x05  0x068  1               0  ---  Specified Minimum Operating Temperature
0x06  =====  =               =  ===  == Transport Statistics (rev 1) ==
0x06  0x008  4              45  ---  Number of Hardware Resets
0x06  0x010  4              42  ---  Number of ASR Events
0x06  0x018  4               0  ---  Number of Interface CRC Errors
0x07  =====  =               =  ===  == Solid State Device Statistics (rev 1) ==
0x07  0x008  1               0  ---  Percentage Used Endurance Indicator
                                |||_ C monitored condition met
                                ||__ D supports DSN
                                |___ N normalized value

Pending Defects log (GP Log 0x0c) not supported

SATA Phy Event Counters (GP Log 0x11)
ID      Size     Value  Description
0x0001  4            0  Command failed due to ICRC error
0x0002  4            0  R_ERR response for data FIS
0x0003  4            0  R_ERR response for device-to-host data FIS
0x0004  4            0  R_ERR response for host-to-device data FIS
0x0005  4            0  R_ERR response for non-data FIS
0x0006  4            0  R_ERR response for device-to-host non-data FIS
0x0007  4            0  R_ERR response for host-to-device non-data FIS
0x000a  4            0  Device-to-host register FISes sent due to a COMRESET
0x000b  4            0  CRC errors within host-to-device FIS
0x000d  4            0  Non-CRC errors within host-to-device FIS

