installer@ubuntu20:~$ sudo smartctl -x /dev/sda
smartctl 7.1 2019-12-30 r5022 [x86_64-linux-5.4.0-126-generic] (local build)
Copyright (C) 2002-19, Bruce Allen, Christian Franke, www.smartmontools.org

=== START OF INFORMATION SECTION ===
Device Model:     MK000960GZXRB
Serial Number:    S6M7NE0RC00138
LU WWN Device Id: 5 002538 f01c2ae8d
Firmware Version: HPG0
User Capacity:    960,197,124,096 bytes [960 GB]
Sector Sizes:     512 bytes logical, 4096 bytes physical
Rotation Rate:    Solid State Device
Form Factor:      2.5 inches
Device is:        Not in smartctl database [for details use: -P showall]
ATA Version is:   ACS-4, ACS-3 T13/2161-D revision 5
SATA Version is:  SATA 3.3, 6.0 Gb/s (current: 6.0 Gb/s)
Local Time is:    Thu Sep 22 07:13:40 2022 UTC
SMART support is: Available - device has SMART capability.
SMART support is: Enabled
AAM feature is:   Unavailable
APM feature is:   Unavailable
Rd look-ahead is: Enabled
Write cache is:   Enabled
DSN feature is:   Unavailable
ATA Security is:  Unavailable
Wt Cache Reorder: Unavailable

=== START OF READ SMART DATA SECTION ===
SMART overall-health self-assessment test result: PASSED

General SMART Values:
Offline data collection status:  (0x00)	Offline data collection activity
					was never started.
					Auto Offline Data Collection: Disabled.
Self-test execution status:      (   0)	The previous self-test routine completed
					without error or no self-test has ever
					been run.
Total time to complete Offline
data collection: 		(    0) seconds.
Offline data collection
capabilities: 			 (0x53) SMART execute Offline immediate.
					Auto Offline data collection on/off support.
					Suspend Offline collection upon new
					command.
					No Offline surface scan supported.
					Self-test supported.
					No Conveyance Self-test supported.
					Selective Self-test supported.
SMART capabilities:            (0x0003)	Saves SMART data before entering
					power-saving mode.
					Supports SMART auto save timer.
Error logging capability:        (0x01)	Error logging supported.
					General Purpose Logging supported.
Short self-test routine
recommended polling time: 	 (   2) minutes.
Extended self-test routine
recommended polling time: 	 (  60) minutes.
SCT capabilities: 	       (0x0025)	SCT Status supported.
					SCT Data Table supported.

SMART Attributes Data Structure revision number: 1
Vendor Specific SMART Attributes with Thresholds:
ID# ATTRIBUTE_NAME          FLAGS    VALUE WORST THRESH FAIL RAW_VALUE
  1 Raw_Read_Error_Rate     POSR--   200   200   002    -    0
  5 Reallocated_Sector_Ct   PO--CK   100   100   005    -    0
  9 Power_On_Hours          -O--CK   099   099   000    -    682
 12 Power_Cycle_Count       -O--CK   099   099   000    -    16
171 Unknown_Attribute       -O--CK   100   100   000    -    0
172 Unknown_Attribute       -O--CK   100   100   000    -    0
173 Unknown_Attribute       PO--CK   099   099   005    -    1
174 Unknown_Attribute       -O--CK   100   100   000    -    0
175 Program_Fail_Count_Chip PO--CK   100   100   001    -    0
180 Unused_Rsvd_Blk_Cnt_Tot PO-RCK   200   200   097    -    0
187 Reported_Uncorrect      -O--CK   100   100   000    -    0
194 Temperature_Celsius     -O---K   081   079   000    -    19
196 Reallocated_Event_Count PO--CK   100   100   005    -    0
197 Current_Pending_Sector  -O--C-   100   100   000    -    0
198 Offline_Uncorrectable   ----C-   100   100   000    -    0
199 UDMA_CRC_Error_Count    -OSRCK   100   100   000    -    0
202 Unknown_SSD_Attribute   PO--CK   100   100   010    -    0
                            ||||||_ K auto-keep
                            |||||__ C event count
                            ||||___ R error rate
                            |||____ S speed/performance
                            ||_____ O updated online
                            |______ P prefailure warning

General Purpose Log Directory Version 1
SMART           Log Directory Version 1 [multi-sector log support]
Address    Access  R/W   Size  Description
0x00       GPL,SL  R/O      1  Log Directory
0x03       GPL     R/O      1  Ext. Comprehensive SMART error log
0x04       GPL,SL  R/O      8  Device Statistics log
0x07       GPL     R/O      1  Extended self-test log
0x09           SL  R/W      1  Selective self-test log
0x0c       GPL     R/O      1  Pending Defects log
0x0d       GPL     R/O      1  LPS Mis-alignment log
0x10       GPL     R/O      1  NCQ Command Error log
0x11       GPL     R/O      1  SATA Phy Event Counters log
0x30       GPL     R/O      9  IDENTIFY DEVICE data log
0x80       GPL     R/W     16  Host vendor specific log
0x81-0x9f  GPL,SL  R/W     16  Host vendor specific log
0xb6       GPL     VS       1  Device vendor specific log
0xbb       GPL     VS       1  Device vendor specific log
0xd0       GPL     VS       1  Device vendor specific log
0xd7       GPL     VS       1  Device vendor specific log
0xe0       GPL,SL  R/W      1  SCT Command/Status
0xe1       GPL,SL  R/W      1  SCT Data Transfer

SMART Extended Comprehensive Error Log Version: 1 (1 sectors)
No Errors Logged

SMART Extended Self-test Log Version: 1 (1 sectors)
Num  Test_Description    Status                  Remaining  LifeTime(hours)  LBA_of_first_error
# 1  Short offline       Completed without error       00%       682         -

SMART Selective self-test log data structure revision number 1
 SPAN  MIN_LBA  MAX_LBA  CURRENT_TEST_STATUS
    1        0        0  Not_testing
    2        0        0  Not_testing
    3        0        0  Not_testing
    4        0        0  Not_testing
    5        0        0  Not_testing
  256        0    65535  Read_scanning was never started
Selective self-test flags (0x0):
  After scanning selected spans, do NOT read-scan remainder of disk.
If Selective self-test is pending on power-up, resume after 0 minute delay.

SCT Status Version:                  3
SCT Version (vendor specific):       256 (0x0100)
Device State:                        Active (0)
Current Temperature:                    19 Celsius
Power Cycle Min/Max Temperature:     17/24 Celsius
Lifetime    Min/Max Temperature:     17/24 Celsius
Specified Max Operating Temperature:    60 Celsius
Under/Over Temperature Limit Count:   0/0
SMART Status:                        0xc24f (PASSED)

SCT Temperature History Version:     2
Temperature Sampling Period:         10 minutes
Temperature Logging Interval:        10 minutes
Min/Max recommended Temperature:      0/60 Celsius
Min/Max Temperature Limit:            0/60 Celsius
Temperature History Size (Index):    128 (12)

Index    Estimated Time   Temperature Celsius
  13    2022-09-21 10:00    19  -
 ...    ..(  3 skipped).    ..  -
  17    2022-09-21 10:40    19  -
  18    2022-09-21 10:50    18  -
  19    2022-09-21 11:00    18  -
  20    2022-09-21 11:10    19  -
  21    2022-09-21 11:20    19  -
  22    2022-09-21 11:30    18  -
 ...    ..(  4 skipped).    ..  -
  27    2022-09-21 12:20    18  -
  28    2022-09-21 12:30    19  -
  29    2022-09-21 12:40    18  -
  30    2022-09-21 12:50    18  -
  31    2022-09-21 13:00    18  -
  32    2022-09-21 13:10    19  -
 ...    ..(  3 skipped).    ..  -
  36    2022-09-21 13:50    19  -
  37    2022-09-21 14:00    18  -
  38    2022-09-21 14:10    18  -
  39    2022-09-21 14:20    18  -
  40    2022-09-21 14:30    19  -
 ...    ..(  4 skipped).    ..  -
  45    2022-09-21 15:20    19  -
  46    2022-09-21 15:30    18  -
  47    2022-09-21 15:40    18  -
  48    2022-09-21 15:50    19  -
 ...    ..(  5 skipped).    ..  -
  54    2022-09-21 16:50    19  -
  55    2022-09-21 17:00    18  -
 ...    ..(  2 skipped).    ..  -
  58    2022-09-21 17:30    18  -
  59    2022-09-21 17:40    19  -
 ...    ..(  3 skipped).    ..  -
  63    2022-09-21 18:20    19  -
  64    2022-09-21 18:30    20  *
  65    2022-09-21 18:40    20  *
  66    2022-09-21 18:50    19  -
  67    2022-09-21 19:00    19  -
  68    2022-09-21 19:10    19  -
  69    2022-09-21 19:20    18  -
 ...    ..(  9 skipped).    ..  -
  79    2022-09-21 21:00    18  -
  80    2022-09-21 21:10    19  -
 ...    ..(  2 skipped).    ..  -
  83    2022-09-21 21:40    19  -
  84    2022-09-21 21:50    18  -
 ...    ..(  7 skipped).    ..  -
  92    2022-09-21 23:10    18  -
  93    2022-09-21 23:20    19  -
  94    2022-09-21 23:30    19  -
  95    2022-09-21 23:40    18  -
 ...    ..( 12 skipped).    ..  -
 108    2022-09-22 01:50    18  -
 109    2022-09-22 02:00    19  -
 110    2022-09-22 02:10    18  -
 ...    ..(  2 skipped).    ..  -
 113    2022-09-22 02:40    18  -
 114    2022-09-22 02:50    19  -
 ...    ..(  6 skipped).    ..  -
 121    2022-09-22 04:00    19  -
 122    2022-09-22 04:10    18  -
 ...    ..(  7 skipped).    ..  -
   2    2022-09-22 05:30    18  -
   3    2022-09-22 05:40    19  -
 ...    ..(  2 skipped).    ..  -
   6    2022-09-22 06:10    19  -
   7    2022-09-22 06:20    18  -
   8    2022-09-22 06:30    18  -
   9    2022-09-22 06:40    18  -
  10    2022-09-22 06:50    19  -
  11    2022-09-22 07:00    19  -
  12    2022-09-22 07:10    19  -

SCT Error Recovery Control command not supported

Device Statistics (GP Log 0x04)
Page  Offset Size        Value Flags Description
0x01  =====  =               =  ===  == General Statistics (rev 1) ==
0x01  0x008  4              16  ---  Lifetime Power-On Resets
0x01  0x010  4             682  ---  Power-on Hours
0x01  0x018  6       143752493  ---  Logical Sectors Written
0x01  0x020  6          777822  ---  Number of Write Commands
0x01  0x028  6      3825271307  ---  Logical Sectors Read
0x01  0x030  6        16057107  ---  Number of Read Commands
0x01  0x038  6         3573000  ---  Date and Time TimeStamp
0x04  =====  =               =  ===  == General Errors Statistics (rev 1) ==
0x04  0x008  4               0  ---  Number of Reported Uncorrectable Errors
0x04  0x010  4               0  ---  Resets Between Cmd Acceptance and Completion
0x05  =====  =               =  ===  == Temperature Statistics (rev 1) ==
0x05  0x008  1              19  ---  Current Temperature
0x05  0x020  1              24  ---  Highest Temperature
0x05  0x028  1              17  ---  Lowest Temperature
0x05  0x058  1              60  ---  Specified Maximum Operating Temperature
0x06  =====  =               =  ===  == Transport Statistics (rev 1) ==
0x06  0x008  4              90  ---  Number of Hardware Resets
0x06  0x010  4               0  ---  Number of ASR Events
0x06  0x018  4               0  ---  Number of Interface CRC Errors
0x07  =====  =               =  ===  == Solid State Device Statistics (rev 1) ==
0x07  0x008  1               0  N--  Percentage Used Endurance Indicator
                                |||_ C monitored condition met
                                ||__ D supports DSN
                                |___ N normalized value

Pending Defects log (GP Log 0x0c)
No Defects Logged

SATA Phy Event Counters (GP Log 0x11)
ID      Size     Value  Description
0x0001  2            0  Command failed due to ICRC error
0x0002  2            0  R_ERR response for data FIS
0x0003  2            0  R_ERR response for device-to-host data FIS
0x0004  2            0  R_ERR response for host-to-device data FIS
0x0005  2            0  R_ERR response for non-data FIS
0x0006  2            0  R_ERR response for device-to-host non-data FIS
0x0007  2            0  R_ERR response for host-to-device non-data FIS
0x0008  2            0  Device-to-host non-data FIS retries
0x0009  2           27  Transition from drive PhyRdy to drive PhyNRdy
0x000a  2           27  Device-to-host register FISes sent due to a COMRESET
0x000b  2            0  CRC errors within host-to-device FIS
0x000d  2            0  Non-CRC errors within host-to-device FIS
0x000f  2            0  R_ERR response for host-to-device data FIS, CRC
0x0010  2            0  R_ERR response for host-to-device data FIS, non-CRC
0x0012  2            0  R_ERR response for host-to-device non-data FIS, CRC
0x0013  2            0  R_ERR response for host-to-device non-data FIS, non-CRC

