smartctl 6.5 2016-05-07 r4318 [x86_64-linux-4.4.12] (local build)
Copyright (C) 2002-16, Bruce Allen, Christian Franke, www.smartmontools.org

=== START OF INFORMATION SECTION ===
Device Model:     SAMSUNG MZHPV512HDGL-00000
Serial Number:    S1X1NYAG614548
LU WWN Device Id: 5 002538 900021fb1
Firmware Version: BXW2500Q
User Capacity:    512,110,190,592 bytes [512 GB]
Sector Size:      512 bytes logical/physical
Rotation Rate:    Solid State Device
Device is:        Not in smartctl database [for details use: -P showall]
ATA Version is:   ACS-2, ATA8-ACS T13/1699-D revision 4c
SATA Version is:  SATA 3.1, 6.0 Gb/s (current: 6.0 Gb/s)
Local Time is:    Tue Jun  7 05:59:33 2016 CDT
SMART support is: Available - device has SMART capability.
SMART support is: Enabled
AAM feature is:   Unavailable
APM feature is:   Unavailable
Rd look-ahead is: Enabled
Write cache is:   Enabled
ATA Security is:  Disabled, frozen [SEC2]
Wt Cache Reorder: Enabled

=== START OF READ SMART DATA SECTION ===
SMART overall-health self-assessment test result: PASSED

General SMART Values:
Offline data collection status:  (0x00)	Offline data collection activity
					was never started.
					Auto Offline Data Collection: Disabled.
Self-test execution status:      (   0)	The previous self-test routine completed
					without error or no self-test has ever 
					been run.
Total time to complete Offline 
data collection: 		(    0) seconds.
Offline data collection
capabilities: 			 (0x53) SMART execute Offline immediate.
					Auto Offline data collection on/off support.
					Suspend Offline collection upon new
					command.
					No Offline surface scan supported.
					Self-test supported.
					No Conveyance Self-test supported.
					Selective Self-test supported.
SMART capabilities:            (0x0003)	Saves SMART data before entering
					power-saving mode.
					Supports SMART auto save timer.
Error logging capability:        (0x01)	Error logging supported.
					General Purpose Logging supported.
Short self-test routine 
recommended polling time: 	 (   2) minutes.
Extended self-test routine
recommended polling time: 	 (  35) minutes.
SCT capabilities: 	       (0x003d)	SCT Status supported.
					SCT Error Recovery Control supported.
					SCT Feature Control supported.
					SCT Data Table supported.

SMART Attributes Data Structure revision number: 1
Vendor Specific SMART Attributes with Thresholds:
ID# ATTRIBUTE_NAME          FLAGS    VALUE WORST THRESH FAIL RAW_VALUE
  5 Reallocated_Sector_Ct   PO--CK   100   100   010    -    0
  9 Power_On_Hours          -O--CK   099   099   000    -    4454
 12 Power_Cycle_Count       -O--CK   099   099   000    -    98
170 Unknown_Attribute       -O--CK   100   100   010    -    0
171 Unknown_Attribute       -O--CK   100   100   010    -    0
172 Unknown_Attribute       -O--CK   100   100   010    -    0
173 Unknown_Attribute       PO--CK   100   100   005    -    0
174 Unknown_Attribute       -O--CK   099   099   000    -    29
178 Used_Rsvd_Blk_Cnt_Chip  PO--C-   100   100   010    -    0
180 Unused_Rsvd_Blk_Cnt_Tot PO--C-   100   100   010    -    1634
184 End-to-End_Error        PO--CK   100   100   097    -    0
187 Reported_Uncorrect      -O--CK   100   100   000    -    0
194 Temperature_Celsius     -O--CK   051   035   000    -    49
199 UDMA_CRC_Error_Count    -OSRCK   100   100   000    -    0
233 Media_Wearout_Indicator -O--CK   099   099   000    -    201
241 Total_LBAs_Written      -O--CK   099   099   000    -    201
242 Total_LBAs_Read         -O--CK   099   099   000    -    203
                            ||||||_ K auto-keep
                            |||||__ C event count
                            ||||___ R error rate
                            |||____ S speed/performance
                            ||_____ O updated online
                            |______ P prefailure warning

General Purpose Log Directory Version 1
SMART           Log Directory Version 1 [multi-sector log support]
Address    Access  R/W   Size  Description
0x00       GPL,SL  R/O      1  Log Directory
0x01           SL  R/O      1  Summary SMART error log
0x02           SL  R/O      1  Comprehensive SMART error log
0x03       GPL     R/O      1  Ext. Comprehensive SMART error log
0x06           SL  R/O      1  SMART self-test log
0x07       GPL     R/O      1  Extended self-test log
0x09           SL  R/W      1  Selective self-test log
0x10       GPL     R/O      1  SATA NCQ Queued Error log
0x11       GPL     R/O      1  SATA Phy Event Counters log
0x13       GPL     R/O      1  SATA NCQ Send and Receive log
0x30       GPL,SL  R/O      9  IDENTIFY DEVICE data log
0x80-0x9f  GPL,SL  R/W     16  Host vendor specific log
0xdf       GPL     VS       1  Device vendor specific log

SMART Extended Comprehensive Error Log Version: 1 (1 sectors)
No Errors Logged

SMART Extended Self-test Log Version: 1 (1 sectors)
Num  Test_Description    Status                  Remaining  LifeTime(hours)  LBA_of_first_error
# 1  Short offline       Completed without error       00%      4454         -
# 2  Short offline       Completed without error       00%      4453         -
# 3  Short offline       Completed without error       00%      4453         -

SMART Selective self-test log data structure revision number 1
 SPAN  MIN_LBA  MAX_LBA  CURRENT_TEST_STATUS
    1        0        0  Not_testing
    2        0        0  Not_testing
    3        0        0  Not_testing
    4        0        0  Not_testing
    5        0        0  Not_testing
  255        0    65535  Read_scanning was never started
Selective self-test flags (0x0):
  After scanning selected spans, do NOT read-scan remainder of disk.
If Selective self-test is pending on power-up, resume after 0 minute delay.

SCT Status Version:                  3
SCT Version (vendor specific):       256 (0x0100)
SCT Support Level:                   1
Device State:                        SCT command executing in background (5)
Current Temperature:                    50 Celsius
Power Cycle Min/Max Temperature:     40/52 Celsius
Lifetime    Min/Max Temperature:      0/70 Celsius
Under/Over Temperature Limit Count:  4294967295/4294901760
SMART Status:                        0xffff (Reserved)

SCT Temperature History Version:     3 (Unknown, should be 2)
Temperature Sampling Period:         1 minute
Temperature Logging Interval:        10 minutes
Min/Max recommended Temperature:      0/70 Celsius
Min/Max Temperature Limit:            0/70 Celsius
Temperature History Size (Index):    128 (49)

Index    Estimated Time   Temperature Celsius
  50    2016-06-06 08:40    48  *****************************
 ...    ..( 13 skipped).    ..  *****************************
  64    2016-06-06 11:00    48  *****************************
  65    2016-06-06 11:10    49  ******************************
 ...    ..( 13 skipped).    ..  ******************************
  79    2016-06-06 13:30    49  ******************************
  80    2016-06-06 13:40    50  *******************************
 ...    ..( 13 skipped).    ..  *******************************
  94    2016-06-06 16:00    50  *******************************
  95    2016-06-06 16:10    51  ********************************
 ...    ..( 12 skipped).    ..  ********************************
 108    2016-06-06 18:20    51  ********************************
 109    2016-06-06 18:30    52  *********************************
 ...    ..( 12 skipped).    ..  *********************************
 122    2016-06-06 20:40    52  *********************************
 123    2016-06-06 20:50    51  ********************************
 124    2016-06-06 21:00    51  ********************************
 125    2016-06-06 21:10    52  *********************************
 ...    ..( 13 skipped).    ..  *********************************
  11    2016-06-06 23:30    52  *********************************
  12    2016-06-06 23:40    51  ********************************
 ...    ..( 19 skipped).    ..  ********************************
  32    2016-06-07 03:00    51  ********************************
  33    2016-06-07 03:10    50  *******************************
 ...    ..(  9 skipped).    ..  *******************************
  43    2016-06-07 04:50    50  *******************************
  44    2016-06-07 05:00    49  ******************************
 ...    ..(  3 skipped).    ..  ******************************
  48    2016-06-07 05:40    49  ******************************
  49    2016-06-07 05:50    50  *******************************

SCT Error Recovery Control:
           Read: Disabled
          Write: Disabled

Device Statistics (GP/SMART Log 0x04) not supported

SATA Phy Event Counters (GP Log 0x11)
ID      Size     Value  Description
0x0001  4            0  Command failed due to ICRC error
0x000a  4           16  Device-to-host register FISes sent due to a COMRESET

