smartctl 6.4 2015-06-04 r4109 [x86_64-linux-4.1.6-1-ARCH] (local build)
Copyright (C) 2002-15, Bruce Allen, Christian Franke, www.smartmontools.org

=== START OF INFORMATION SECTION ===
Model Family:     HGST Travelstar 5K1000
Device Model:     HGST HTS541010A9E680
Firmware Version: JA0OA560
User Capacity:    1,000,204,886,016 bytes [1.00 TB]
Sector Sizes:     512 bytes logical, 4096 bytes physical
Rotation Rate:    5400 rpm
Form Factor:      2.5 inches
Device is:        In smartctl database [for details use: -P show]
ATA Version is:   ATA8-ACS T13/1699-D revision 6
SATA Version is:  SATA 2.6, 6.0 Gb/s (current: 3.0 Gb/s)
Local Time is:    Mon Sep 21 15:04:34 2015 WEST
SMART support is: Available - device has SMART capability.
SMART support is: Enabled
AAM feature is:   Unavailable
APM level is:     128 (minimum power consumption without standby)
Rd look-ahead is: Enabled
Write cache is:   Enabled
ATA Security is:  Disabled, NOT FROZEN [SEC1]
Wt Cache Reorder: Unknown

=== START OF READ SMART DATA SECTION ===
SMART Status not supported: Incomplete response, ATA output registers missing
SMART overall-health self-assessment test result: PASSED
Warning: This result is based on an Attribute check.

General SMART Values:
Offline data collection status:  (0x02)	Offline data collection activity
					was completed without error.
					Auto Offline Data Collection: Disabled.
Self-test execution status:      (   0)	The previous self-test routine completed
					without error or no self-test has ever 
					been run.
Total time to complete Offline 
data collection: 		(   45) seconds.
Offline data collection
capabilities: 			 (0x5b) SMART execute Offline immediate.
					Auto Offline data collection on/off support.
					Suspend Offline collection upon new
					command.
					Offline surface scan supported.
					Self-test supported.
					No Conveyance Self-test supported.
					Selective Self-test supported.
SMART capabilities:            (0x0003)	Saves SMART data before entering
					power-saving mode.
					Supports SMART auto save timer.
Error logging capability:        (0x01)	Error logging supported.
					General Purpose Logging supported.
Short self-test routine 
recommended polling time: 	 (   2) minutes.
Extended self-test routine
recommended polling time: 	 ( 226) minutes.
SCT capabilities: 	       (0x003d)	SCT Status supported.
					SCT Error Recovery Control supported.
					SCT Feature Control supported.
					SCT Data Table supported.

SMART Attributes Data Structure revision number: 16
Vendor Specific SMART Attributes with Thresholds:
ID# ATTRIBUTE_NAME          FLAGS    VALUE WORST THRESH FAIL RAW_VALUE
  1 Raw_Read_Error_Rate     PO-R--   100   100   062    -    0
  2 Throughput_Performance  P-S---   198   198   040    -    123
  3 Spin_Up_Time            POS---   160   160   033    -    1
  4 Start_Stop_Count        -O--C-   100   100   000    -    1555
  5 Reallocated_Sector_Ct   PO--CK   100   100   005    -    0
  7 Seek_Error_Rate         PO-R--   100   100   067    -    0
  8 Seek_Time_Performance   P-S---   115   115   040    -    34
  9 Power_On_Hours          -O--C-   090   090   000    -    4472
 10 Spin_Retry_Count        PO--C-   100   100   060    -    0
 12 Power_Cycle_Count       -O--CK   100   100   000    -    1506
191 G-Sense_Error_Rate      -O-R--   100   100   000    -    0
192 Power-Off_Retract_Count -O--CK   100   100   000    -    65561
193 Load_Cycle_Count        -O--C-   100   100   000    -    4435
194 Temperature_Celsius     -O----   222   222   000    -    27 (Min/Max 10/48)
196 Reallocated_Event_Count -O--CK   100   100   000    -    0
197 Current_Pending_Sector  -O---K   100   100   000    -    0
198 Offline_Uncorrectable   ---R--   100   100   000    -    0
199 UDMA_CRC_Error_Count    -O-R--   200   200   000    -    0
223 Load_Retry_Count        -O-R--   100   100   000    -    0
                            ||||||_ K auto-keep
                            |||||__ C event count
                            ||||___ R error rate
                            |||____ S speed/performance
                            ||_____ O updated online
                            |______ P prefailure warning

General Purpose Log Directory Version 1
SMART           Log Directory Version 1 [multi-sector log support]
Address    Access  R/W   Size  Description
0x00       GPL,SL  R/O      1  Log Directory
0x01           SL  R/O      1  Summary SMART error log
0x02           SL  R/O      1  Comprehensive SMART error log
0x03       GPL     R/O      1  Ext. Comprehensive SMART error log
0x06           SL  R/O      1  SMART self-test log
0x07       GPL     R/O      1  Extended self-test log
0x09           SL  R/W      1  Selective self-test log
0x10       GPL     R/O      1  SATA NCQ Queued Error log
0x11       GPL     R/O      1  SATA Phy Event Counters log
0x80-0x9f  GPL,SL  R/W     16  Host vendor specific log
0xe0       GPL,SL  R/W      1  SCT Command/Status
0xe1       GPL,SL  R/W      1  SCT Data Transfer

SMART Extended Comprehensive Error Log Version: 1 (1 sectors)
No Errors Logged

SMART Extended Self-test Log Version: 1 (1 sectors)
Num  Test_Description    Status                  Remaining  LifeTime(hours)  LBA_of_first_error
# 1  Short offline       Completed without error       00%      4440         -
# 2  Extended offline    Completed without error       00%      4402         -
# 3  Extended offline    Aborted by host               90%      4398         -
# 4  Short offline       Completed without error       00%      4388         -
# 5  Short offline       Completed without error       00%      4362         -
# 6  Extended offline    Completed without error       00%      4007         -
# 7  Extended offline    Completed without error       00%      1425         -
# 8  Short offline       Completed without error       00%      1421         -
# 9  Extended offline    Completed without error       00%         4         -
#10  Short offline       Completed without error       00%         0         -

SMART Selective self-test log data structure revision number 1
 SPAN  MIN_LBA  MAX_LBA  CURRENT_TEST_STATUS
    1        0        0  Not_testing
    2        0        0  Not_testing
    3        0        0  Not_testing
    4        0        0  Not_testing
    5        0        0  Not_testing
Selective self-test flags (0x0):
  After scanning selected spans, do NOT read-scan remainder of disk.
If Selective self-test is pending on power-up, resume after 0 minute delay.

SCT Status Version:                  3
SCT Version (vendor specific):       256 (0x0100)
SCT Support Level:                   1
Device State:                        Active (0)
Current Temperature:                    27 Celsius
Power Cycle Min/Max Temperature:     21/27 Celsius
Lifetime    Min/Max Temperature:     10/48 Celsius
Lifetime    Average Temperature:        34 Celsius
Under/Over Temperature Limit Count:   0/0

SCT Temperature History Version:     2
Temperature Sampling Period:         1 minute
Temperature Logging Interval:        1 minute
Min/Max recommended Temperature:      0/60 Celsius
Min/Max Temperature Limit:           -40/65 Celsius
Temperature History Size (Index):    128 (121)

Index    Estimated Time   Temperature Celsius
 122    2015-09-21 12:57    29  **********
 ...    ..(  2 skipped).    ..  **********
 125    2015-09-21 13:00    29  **********
 126    2015-09-21 13:01    28  *********
 127    2015-09-21 13:02    29  **********
 ...    ..(  2 skipped).    ..  **********
   2    2015-09-21 13:05    29  **********
   3    2015-09-21 13:06    28  *********
   4    2015-09-21 13:07     ?  -
   5    2015-09-21 13:08    24  *****
   6    2015-09-21 13:09    25  ******
   7    2015-09-21 13:10    25  ******
   8    2015-09-21 13:11    26  *******
   9    2015-09-21 13:12    26  *******
  10    2015-09-21 13:13     ?  -
  11    2015-09-21 13:14    20  *
  12    2015-09-21 13:15    20  *
  13    2015-09-21 13:16    21  **
  14    2015-09-21 13:17    22  ***
  15    2015-09-21 13:18    23  ****
  16    2015-09-21 13:19    24  *****
  17    2015-09-21 13:20    25  ******
  18    2015-09-21 13:21    25  ******
  19    2015-09-21 13:22    26  *******
  20    2015-09-21 13:23    26  *******
  21    2015-09-21 13:24    27  ********
  22    2015-09-21 13:25    28  *********
  23    2015-09-21 13:26    28  *********
  24    2015-09-21 13:27    29  **********
  25    2015-09-21 13:28    29  **********
  26    2015-09-21 13:29    29  **********
  27    2015-09-21 13:30    30  ***********
 ...    ..(  4 skipped).    ..  ***********
  32    2015-09-21 13:35    30  ***********
  33    2015-09-21 13:36    29  **********
 ...    ..( 12 skipped).    ..  **********
  46    2015-09-21 13:49    29  **********
  47    2015-09-21 13:50    28  *********
  48    2015-09-21 13:51    29  **********
 ...    ..(  4 skipped).    ..  **********
  53    2015-09-21 13:56    29  **********
  54    2015-09-21 13:57    28  *********
  55    2015-09-21 13:58    28  *********
  56    2015-09-21 13:59    28  *********
  57    2015-09-21 14:00    29  **********
 ...    ..( 11 skipped).    ..  **********
  69    2015-09-21 14:12    29  **********
  70    2015-09-21 14:13    30  ***********
  71    2015-09-21 14:14    30  ***********
  72    2015-09-21 14:15    31  ************
  73    2015-09-21 14:16    31  ************
  74    2015-09-21 14:17    31  ************
  75    2015-09-21 14:18    30  ***********
 ...    ..(  2 skipped).    ..  ***********
  78    2015-09-21 14:21    30  ***********
  79    2015-09-21 14:22    31  ************
  80    2015-09-21 14:23    31  ************
  81    2015-09-21 14:24    31  ************
  82    2015-09-21 14:25    32  *************
 ...    ..(  7 skipped).    ..  *************
  90    2015-09-21 14:33    32  *************
  91    2015-09-21 14:34    33  **************
 ...    ..(  2 skipped).    ..  **************
  94    2015-09-21 14:37    33  **************
  95    2015-09-21 14:38    34  ***************
 ...    ..(  2 skipped).    ..  ***************
  98    2015-09-21 14:41    34  ***************
  99    2015-09-21 14:42    33  **************
 100    2015-09-21 14:43    34  ***************
 101    2015-09-21 14:44    34  ***************
 102    2015-09-21 14:45    34  ***************
 103    2015-09-21 14:46     ?  -
 104    2015-09-21 14:47     ?  -
 105    2015-09-21 14:48    22  ***
 106    2015-09-21 14:49    24  *****
 107    2015-09-21 14:50    25  ******
 108    2015-09-21 14:51    26  *******
 109    2015-09-21 14:52    28  *********
 110    2015-09-21 14:53     ?  -
 111    2015-09-21 14:54     ?  -
 112    2015-09-21 14:55    22  ***
 113    2015-09-21 14:56    23  ****
 114    2015-09-21 14:57    23  ****
 115    2015-09-21 14:58    24  *****
 116    2015-09-21 14:59    24  *****
 117    2015-09-21 15:00    25  ******
 118    2015-09-21 15:01    25  ******
 119    2015-09-21 15:02    26  *******
 120    2015-09-21 15:03    26  *******
 121    2015-09-21 15:04    27  ********

SMART WRITE LOG does not return COUNT and LBA_LOW register
SCT (Get) Error Recovery Control command failed

Device Statistics (GP/SMART Log 0x04) not supported

SATA Phy Event Counters (GP Log 0x11)
ID      Size     Value  Description
0x0001  2            0  Command failed due to ICRC error
0x0002  2            0  R_ERR response for data FIS
0x0003  2            0  R_ERR response for device-to-host data FIS
0x0004  2            0  R_ERR response for host-to-device data FIS
0x0005  2            0  R_ERR response for non-data FIS
0x0006  2            0  R_ERR response for device-to-host non-data FIS
0x0007  2            0  R_ERR response for host-to-device non-data FIS
0x0009  2            4  Transition from drive PhyRdy to drive PhyNRdy
0x000a  2            0  Device-to-host register FISes sent due to a COMRESET
0x000b  2            0  CRC errors within host-to-device FIS
0x000d  2            0  Non-CRC errors within host-to-device FIS

