smartctl 6.5 2016-05-07 r4318 [x86_64-linux-4.8.17-1-MANJARO] (local build)
Copyright (C) 2002-16, Bruce Allen, Christian Franke, www.smartmontools.org

=== START OF INFORMATION SECTION ===
Device Model:     KINGSTON SHFS37A240G
Serial Number:    50026B72620338EC
LU WWN Device Id: 5 0026b7 2620338ec
Firmware Version: 608ABBF0
User Capacity:    240.057.409.536 bytes [240 GB]
Sector Size:      512 bytes logical/physical
Rotation Rate:    Solid State Device
Device is:        Not in smartctl database [for details use: -P showall]
ATA Version is:   ATA8-ACS, ACS-2 T13/2015-D revision 3
SATA Version is:  SATA 3.0, 6.0 Gb/s (current: 3.0 Gb/s)
Local Time is:    Tue Feb 14 03:53:08 2017 ART
SMART support is: Available - device has SMART capability.
SMART support is: Enabled
AAM feature is:   Unavailable
APM level is:     254 (maximum performance)
Rd look-ahead is: Disabled
Write cache is:   Enabled
ATA Security is:  Disabled, frozen [SEC2]
Wt Cache Reorder: Unavailable

=== START OF READ SMART DATA SECTION ===
SMART overall-health self-assessment test result: PASSED

General SMART Values:
Offline data collection status:  (0x02)	Offline data collection activity
					was completed without error.
					Auto Offline Data Collection: Disabled.
Self-test execution status:      (   0)	The previous self-test routine completed
					without error or no self-test has ever 
					been run.
Total time to complete Offline 
data collection: 		(    0) seconds.
Offline data collection
capabilities: 			 (0x7d) SMART execute Offline immediate.
					No Auto Offline data collection support.
					Abort Offline collection upon new
					command.
					Offline surface scan supported.
					Self-test supported.
					Conveyance Self-test supported.
					Selective Self-test supported.
SMART capabilities:            (0x0003)	Saves SMART data before entering
					power-saving mode.
					Supports SMART auto save timer.
Error logging capability:        (0x01)	Error logging supported.
					General Purpose Logging supported.
Short self-test routine 
recommended polling time: 	 (   1) minutes.
Extended self-test routine
recommended polling time: 	 (  48) minutes.
Conveyance self-test routine
recommended polling time: 	 (   2) minutes.
SCT capabilities: 	       (0x0025)	SCT Status supported.
					SCT Data Table supported.

SMART Attributes Data Structure revision number: 10
Vendor Specific SMART Attributes with Thresholds:
ID# ATTRIBUTE_NAME          FLAGS    VALUE WORST THRESH FAIL RAW_VALUE
  1 Raw_Read_Error_Rate     -O--CK   095   095   050    -    3974483
  5 Reallocated_Sector_Ct   PO--CK   100   100   003    -    0
  9 Power_On_Hours          -O--CK   099   099   000    -    1671 (13 128 0)
 12 Power_Cycle_Count       -O--CK   100   100   000    -    603
171 Unknown_Attribute       -O-R--   100   100   000    -    0
172 Unknown_Attribute       -O--CK   100   100   000    -    0
174 Unknown_Attribute       ----CK   000   000   000    -    13
177 Wear_Leveling_Count     ------   000   000   000    -    0
181 Program_Fail_Cnt_Total  -O-R--   100   100   000    -    0
182 Erase_Fail_Count_Total  -O--CK   100   100   000    -    0
187 Reported_Uncorrect      -O--C-   100   100   000    -    0
189 Unknown_SSD_Attribute   ------   044   050   000    -    73017720876
194 Temperature_Celsius     -O---K   044   050   000    -    44 (Min/Max 17/50)
195 Hardware_ECC_Recovered  --SRC-   120   120   000    -    3974483
196 Reallocated_Event_Count PO--CK   100   100   003    -    0
201 Unknown_SSD_Attribute   --SRC-   120   120   000    -    3974483
204 Soft_ECC_Correction     --SRC-   120   120   000    -    3974483
230 Unknown_SSD_Attribute   PO--C-   100   100   000    -    100
231 Temperature_Celsius     ------   100   100   011    -    94489280512
233 Media_Wearout_Indicator -O--CK   000   000   000    -    1006
234 Unknown_Attribute       -O--CK   000   000   000    -    583
241 Total_LBAs_Written      -O--CK   000   000   000    -    583
242 Total_LBAs_Read         -O--CK   000   000   000    -    1186
244 Unknown_Attribute       ------   100   100   010    -    983042
                            ||||||_ K auto-keep
                            |||||__ C event count
                            ||||___ R error rate
                            |||____ S speed/performance
                            ||_____ O updated online
                            |______ P prefailure warning

General Purpose Log Directory Version 1
SMART           Log Directory Version 1 [multi-sector log support]
Address    Access  R/W   Size  Description
0x00       GPL,SL  R/O      1  Log Directory
0x04       GPL,SL  R/O      6  Device Statistics log
0x06           SL  R/O      1  SMART self-test log
0x07       GPL     R/O      1  Extended self-test log
0x09           SL  R/W      1  Selective self-test log
0x10       GPL     R/O      1  SATA NCQ Queued Error log
0x11       GPL     R/O      1  SATA Phy Event Counters log
0x80-0x9f  GPL,SL  R/W     16  Host vendor specific log
0xb7       GPL,SL  VS      16  Device vendor specific log
0xe0       GPL,SL  R/W      1  SCT Command/Status
0xe1       GPL,SL  R/W      1  SCT Data Transfer

SMART Extended Comprehensive Error Log (GP Log 0x03) not supported

SMART Error Log not supported

SMART Extended Self-test Log Version: 1 (1 sectors)
Num  Test_Description    Status                  Remaining  LifeTime(hours)  LBA_of_first_error
# 1  Short offline       Completed without error       00%      1671         -
# 2  Short offline       Completed without error       00%        35         -
# 3  Short offline       Completed without error       00%        35         -
# 4  Short offline       Completed without error       00%        10         -
# 5  Conveyance offline  Completed without error       00%        10         -

SMART Selective self-test log data structure revision number 1
 SPAN  MIN_LBA  MAX_LBA  CURRENT_TEST_STATUS
    1        0        0  Not_testing
    2        0        0  Not_testing
    3        0        0  Not_testing
    4        0        0  Not_testing
    5        0        0  Not_testing
Selective self-test flags (0x0):
  After scanning selected spans, do NOT read-scan remainder of disk.
If Selective self-test is pending on power-up, resume after 0 minute delay.

SCT Status Version:                  3
SCT Version (vendor specific):       0 (0x0000)
SCT Support Level:                   1
Device State:                        Active (0)
Current Temperature:                    44 Celsius
Power Cycle Min/Max Temperature:     17/50 Celsius
Lifetime    Min/Max Temperature:     17/50 Celsius
Under/Over Temperature Limit Count:   0/0

SCT Temperature History Version:     2
Temperature Sampling Period:         1 minute
Temperature Logging Interval:        10 minutes
Min/Max recommended Temperature:      0/70 Celsius
Min/Max Temperature Limit:            0/85 Celsius
Temperature History Size (Index):    478 (81)

Index    Estimated Time   Temperature Celsius
  82    2017-02-10 20:20    43  ************************
  83    2017-02-10 20:30    43  ************************
  84    2017-02-10 20:40    43  ************************
  85    2017-02-10 20:50    42  ***********************
 ...    ..( 10 skipped).    ..  ***********************
  96    2017-02-10 22:40    42  ***********************
  97    2017-02-10 22:50    41  **********************
 ...    ..( 33 skipped).    ..  **********************
 131    2017-02-11 04:30    41  **********************
 132    2017-02-11 04:40    42  ***********************
 133    2017-02-11 04:50    43  ************************
 134    2017-02-11 05:00    44  *************************
 ...    ..(  5 skipped).    ..  *************************
 140    2017-02-11 06:00    44  *************************
 141    2017-02-11 06:10     ?  -
 142    2017-02-11 06:20    29  **********
 143    2017-02-11 06:30    32  *************
 144    2017-02-11 06:40    35  ****************
 145    2017-02-11 06:50     ?  -
 146    2017-02-11 07:00     ?  -
 147    2017-02-11 07:10    31  ************
 148    2017-02-11 07:20    38  *******************
 149    2017-02-11 07:30    41  **********************
 150    2017-02-11 07:40    42  ***********************
 151    2017-02-11 07:50    43  ************************
 152    2017-02-11 08:00    44  *************************
 153    2017-02-11 08:10    44  *************************
 154    2017-02-11 08:20    44  *************************
 155    2017-02-11 08:30    43  ************************
 156    2017-02-11 08:40    42  ***********************
 ...    ..(  4 skipped).    ..  ***********************
 161    2017-02-11 09:30    42  ***********************
 162    2017-02-11 09:40    43  ************************
 ...    ..(  2 skipped).    ..  ************************
 165    2017-02-11 10:10    43  ************************
 166    2017-02-11 10:20    42  ***********************
 167    2017-02-11 10:30    42  ***********************
 168    2017-02-11 10:40    43  ************************
 169    2017-02-11 10:50    44  *************************
 170    2017-02-11 11:00    44  *************************
 171    2017-02-11 11:10    44  *************************
 172    2017-02-11 11:20    45  **************************
 173    2017-02-11 11:30    44  *************************
 174    2017-02-11 11:40    45  **************************
 175    2017-02-11 11:50    44  *************************
 176    2017-02-11 12:00    43  ************************
 ...    ..(  8 skipped).    ..  ************************
 185    2017-02-11 13:30    43  ************************
 186    2017-02-11 13:40    44  *************************
 187    2017-02-11 13:50    43  ************************
 ...    ..(  5 skipped).    ..  ************************
 193    2017-02-11 14:50    43  ************************
 194    2017-02-11 15:00    44  *************************
 ...    ..(  2 skipped).    ..  *************************
 197    2017-02-11 15:30    44  *************************
 198    2017-02-11 15:40    43  ************************
 ...    ..(  4 skipped).    ..  ************************
 203    2017-02-11 16:30    43  ************************
 204    2017-02-11 16:40     ?  -
 205    2017-02-11 16:50    34  ***************
 206    2017-02-11 17:00    38  *******************
 207    2017-02-11 17:10    41  **********************
 208    2017-02-11 17:20    43  ************************
 209    2017-02-11 17:30    43  ************************
 210    2017-02-11 17:40    44  *************************
 211    2017-02-11 17:50    44  *************************
 212    2017-02-11 18:00    45  **************************
 213    2017-02-11 18:10    44  *************************
 214    2017-02-11 18:20    43  ************************
 ...    ..(  7 skipped).    ..  ************************
 222    2017-02-11 19:40    43  ************************
 223    2017-02-11 19:50    44  *************************
 224    2017-02-11 20:00    44  *************************
 225    2017-02-11 20:10    44  *************************
 226    2017-02-11 20:20    43  ************************
 ...    ..(  9 skipped).    ..  ************************
 236    2017-02-11 22:00    43  ************************
 237    2017-02-11 22:10     ?  -
 238    2017-02-11 22:20    40  *********************
 239    2017-02-11 22:30    41  **********************
 240    2017-02-11 22:40    42  ***********************
 241    2017-02-11 22:50    43  ************************
 242    2017-02-11 23:00    44  *************************
 ...    ..( 11 skipped).    ..  *************************
 254    2017-02-12 01:00    44  *************************
 255    2017-02-12 01:10    45  **************************
 256    2017-02-12 01:20    45  **************************
 257    2017-02-12 01:30    45  **************************
 258    2017-02-12 01:40    44  *************************
 ...    ..(  5 skipped).    ..  *************************
 264    2017-02-12 02:40    44  *************************
 265    2017-02-12 02:50     ?  -
 266    2017-02-12 03:00    43  ************************
 267    2017-02-12 03:10    43  ************************
 268    2017-02-12 03:20     ?  -
 269    2017-02-12 03:30    32  *************
 270    2017-02-12 03:40    38  *******************
 271    2017-02-12 03:50    41  **********************
 272    2017-02-12 04:00    43  ************************
 273    2017-02-12 04:10    44  *************************
 274    2017-02-12 04:20    44  *************************
 275    2017-02-12 04:30    44  *************************
 276    2017-02-12 04:40    45  **************************
 ...    ..(  7 skipped).    ..  **************************
 284    2017-02-12 06:00    45  **************************
 285    2017-02-12 06:10    46  ***************************
 286    2017-02-12 06:20    46  ***************************
 287    2017-02-12 06:30    47  ****************************
 288    2017-02-12 06:40    46  ***************************
 ...    ..(  7 skipped).    ..  ***************************
 296    2017-02-12 08:00    46  ***************************
 297    2017-02-12 08:10    45  **************************
 ...    ..( 12 skipped).    ..  **************************
 310    2017-02-12 10:20    45  **************************
 311    2017-02-12 10:30    46  ***************************
 ...    ..(  6 skipped).    ..  ***************************
 318    2017-02-12 11:40    46  ***************************
 319    2017-02-12 11:50    45  **************************
 ...    ..( 21 skipped).    ..  **************************
 341    2017-02-12 15:30    45  **************************
 342    2017-02-12 15:40     ?  -
 343    2017-02-12 15:50    29  **********
 344    2017-02-12 16:00    34  ***************
 345    2017-02-12 16:10    36  *****************
 346    2017-02-12 16:20     ?  -
 347    2017-02-12 16:30    31  ************
 348    2017-02-12 16:40    36  *****************
 349    2017-02-12 16:50    37  ******************
 350    2017-02-12 17:00    39  ********************
 351    2017-02-12 17:10     ?  -
 352    2017-02-12 17:20    39  ********************
 353    2017-02-12 17:30    40  *********************
 354    2017-02-12 17:40    41  **********************
 ...    ..(  8 skipped).    ..  **********************
 363    2017-02-12 19:10    41  **********************
 364    2017-02-12 19:20    42  ***********************
 ...    ..(  5 skipped).    ..  ***********************
 370    2017-02-12 20:20    42  ***********************
 371    2017-02-12 20:30     ?  -
 372    2017-02-12 20:40    32  *************
 373    2017-02-12 20:50    39  ********************
 374    2017-02-12 21:00    43  ************************
 375    2017-02-12 21:10    45  **************************
 376    2017-02-12 21:20    46  ***************************
 ...    ..(  6 skipped).    ..  ***************************
 383    2017-02-12 22:30    46  ***************************
 384    2017-02-12 22:40    45  **************************
 385    2017-02-12 22:50    45  **************************
 386    2017-02-12 23:00    44  *************************
 ...    ..(  4 skipped).    ..  *************************
 391    2017-02-12 23:50    44  *************************
 392    2017-02-13 00:00    43  ************************
 ...    ..(  2 skipped).    ..  ************************
 395    2017-02-13 00:30    43  ************************
 396    2017-02-13 00:40    44  *************************
 ...    ..(  7 skipped).    ..  *************************
 404    2017-02-13 02:00    44  *************************
 405    2017-02-13 02:10    45  **************************
 ...    ..(  5 skipped).    ..  **************************
 411    2017-02-13 03:10    45  **************************
 412    2017-02-13 03:20    44  *************************
 413    2017-02-13 03:30    45  **************************
 414    2017-02-13 03:40    44  *************************
 ...    ..(  2 skipped).    ..  *************************
 417    2017-02-13 04:10    44  *************************
 418    2017-02-13 04:20    45  **************************
 ...    ..(  3 skipped).    ..  **************************
 422    2017-02-13 05:00    45  **************************
 423    2017-02-13 05:10    46  ***************************
 ...    ..( 16 skipped).    ..  ***************************
 440    2017-02-13 08:00    46  ***************************
 441    2017-02-13 08:10    45  **************************
 442    2017-02-13 08:20    45  **************************
 443    2017-02-13 08:30    46  ***************************
 ...    ..(  5 skipped).    ..  ***************************
 449    2017-02-13 09:30    46  ***************************
 450    2017-02-13 09:40     ?  -
 451    2017-02-13 09:50    30  ***********
 452    2017-02-13 10:00    36  *****************
 453    2017-02-13 10:10    40  *********************
 454    2017-02-13 10:20    42  ***********************
 455    2017-02-13 10:30    43  ************************
 456    2017-02-13 10:40    43  ************************
 457    2017-02-13 10:50    44  *************************
 458    2017-02-13 11:00    44  *************************
 459    2017-02-13 11:10    44  *************************
 460    2017-02-13 11:20    45  **************************
 461    2017-02-13 11:30    45  **************************
 462    2017-02-13 11:40    44  *************************
 463    2017-02-13 11:50    44  *************************
 464    2017-02-13 12:00    44  *************************
 465    2017-02-13 12:10    45  **************************
 ...    ..(  5 skipped).    ..  **************************
 471    2017-02-13 13:10    45  **************************
 472    2017-02-13 13:20    46  ***************************
 ...    ..(  6 skipped).    ..  ***************************
   1    2017-02-13 14:30    46  ***************************
   2    2017-02-13 14:40     ?  -
   3    2017-02-13 14:50    36  *****************
   4    2017-02-13 15:00    41  **********************
   5    2017-02-13 15:10     ?  -
   6    2017-02-13 15:20     ?  -
   7    2017-02-13 15:30    26  *******
   8    2017-02-13 15:40     ?  -
 ...    ..(  5 skipped).    ..  -
  14    2017-02-13 16:40     ?  -
  15    2017-02-13 16:50    32  *************
  16    2017-02-13 17:00    35  ****************
  17    2017-02-13 17:10    37  ******************
  18    2017-02-13 17:20    37  ******************
  19    2017-02-13 17:30    38  *******************
  20    2017-02-13 17:40    38  *******************
  21    2017-02-13 17:50    40  *********************
  22    2017-02-13 18:00    42  ***********************
  23    2017-02-13 18:10    41  **********************
  24    2017-02-13 18:20    43  ************************
  25    2017-02-13 18:30    44  *************************
  26    2017-02-13 18:40    45  **************************
  27    2017-02-13 18:50    45  **************************
  28    2017-02-13 19:00    45  **************************
  29    2017-02-13 19:10    46  ***************************
  30    2017-02-13 19:20    46  ***************************
  31    2017-02-13 19:30    45  **************************
  32    2017-02-13 19:40     ?  -
  33    2017-02-13 19:50    44  *************************
  34    2017-02-13 20:00    44  *************************
  35    2017-02-13 20:10    45  **************************
  36    2017-02-13 20:20    45  **************************
  37    2017-02-13 20:30    44  *************************
  38    2017-02-13 20:40    45  **************************
  39    2017-02-13 20:50    45  **************************
  40    2017-02-13 21:00    46  ***************************
  41    2017-02-13 21:10    46  ***************************
  42    2017-02-13 21:20    44  *************************
  43    2017-02-13 21:30    43  ************************
  44    2017-02-13 21:40    43  ************************
  45    2017-02-13 21:50    47  ****************************
  46    2017-02-13 22:00    48  *****************************
  47    2017-02-13 22:10     ?  -
  48    2017-02-13 22:20    46  ***************************
  49    2017-02-13 22:30    45  **************************
  50    2017-02-13 22:40    44  *************************
  51    2017-02-13 22:50    43  ************************
 ...    ..(  5 skipped).    ..  ************************
  57    2017-02-13 23:50    43  ************************
  58    2017-02-14 00:00    44  *************************
  59    2017-02-14 00:10    44  *************************
  60    2017-02-14 00:20    43  ************************
 ...    ..(  6 skipped).    ..  ************************
  67    2017-02-14 01:30    43  ************************
  68    2017-02-14 01:40    44  *************************
 ...    ..(  2 skipped).    ..  *************************
  71    2017-02-14 02:10    44  *************************
  72    2017-02-14 02:20     ?  -
  73    2017-02-14 02:30     ?  -
  74    2017-02-14 02:40     ?  -
  75    2017-02-14 02:50    44  *************************
 ...    ..(  2 skipped).    ..  *************************
  78    2017-02-14 03:20    44  *************************
  79    2017-02-14 03:30    45  **************************
  80    2017-02-14 03:40    45  **************************
  81    2017-02-14 03:50    44  *************************

SCT Error Recovery Control command not supported

Device Statistics (GP Log 0x04)
Page  Offset Size        Value Flags Description
0x01  =====  =               =  ===  == General Statistics (rev 2) ==
0x01  0x008  4             603  ---  Lifetime Power-On Resets
0x01  0x010  4            1671  ---  Power-on Hours
0x01  0x018  6      1223268169  ---  Logical Sectors Written
0x01  0x028  6      2489254472  ---  Logical Sectors Read
0x04  =====  =               =  ===  == General Errors Statistics (rev 1) ==
0x04  0x008  4               0  ---  Number of Reported Uncorrectable Errors
0x04  0x010  4               0  ---  Resets Between Cmd Acceptance and Completion
0x05  =====  =               =  ===  == Temperature Statistics (rev 1) ==
0x05  0x008  1              44  ---  Current Temperature
0x05  0x010  1              43  ---  Average Short Term Temperature
0x05  0x018  1              36  ---  Average Long Term Temperature
0x05  0x020  1              50  ---  Highest Temperature
0x05  0x028  1              18  ---  Lowest Temperature
0x05  0x030  1              46  ---  Highest Average Short Term Temperature
0x05  0x038  1              33  ---  Lowest Average Short Term Temperature
0x05  0x040  1              36  ---  Highest Average Long Term Temperature
0x05  0x048  1              36  ---  Lowest Average Long Term Temperature
0x05  0x050  4               0  ---  Time in Over-Temperature
0x05  0x058  1              70  ---  Specified Maximum Operating Temperature
0x05  0x060  4               0  ---  Time in Under-Temperature
0x05  0x068  1               0  ---  Specified Minimum Operating Temperature
0x06  =====  =               =  ===  == Transport Statistics (rev 1) ==
0x06  0x008  4               0  ---  Number of Hardware Resets
0x06  0x010  4             987  ---  Number of ASR Events
0x06  0x018  4               0  ---  Number of Interface CRC Errors
0x07  =====  =               =  ===  == Solid State Device Statistics (rev 1) ==
0x07  0x008  1               0  ---  Percentage Used Endurance Indicator
                                |||_ C monitored condition met
                                ||__ D supports DSN
                                |___ N normalized value

SATA Phy Event Counters (GP Log 0x11)
ID      Size     Value  Description
0x0001  2            0  Command failed due to ICRC error
0x0003  2            0  R_ERR response for device-to-host data FIS
0x0004  2            0  R_ERR response for host-to-device data FIS
0x0006  2            0  R_ERR response for device-to-host non-data FIS
0x0007  2            0  R_ERR response for host-to-device non-data FIS
0x0008  2            0  Device-to-host non-data FIS retries
0x0009  2            7  Transition from drive PhyRdy to drive PhyNRdy
0x000a  2            7  Device-to-host register FISes sent due to a COMRESET
0x000f  2            0  R_ERR response for host-to-device data FIS, CRC
0x0010  2            0  R_ERR response for host-to-device data FIS, non-CRC
0x0012  2            0  R_ERR response for host-to-device non-data FIS, CRC
0x0013  2            0  R_ERR response for host-to-device non-data FIS, non-CRC
0x0002  2            0  R_ERR response for data FIS
0x0005  2            0  R_ERR response for non-data FIS
0x000b  2            0  CRC errors within host-to-device FIS
0x000d  2            0  Non-CRC errors within host-to-device FIS

