smartctl 6.4 2014-10-07 r4002 [x86_64-linux-3.16.0-4-amd64] (local build)
Copyright (C) 2002-14, Bruce Allen, Christian Franke, www.smartmontools.org

=== START OF INFORMATION SECTION ===
Device Model:     ADATA SX930
Firmware Version: 6.8SE
User Capacity:    120,034,123,776 bytes [120 GB]
Sector Size:      512 bytes logical/physical
Rotation Rate:    Solid State Device
Form Factor:      2.5 inches
Device is:        Not in smartctl database [for details use: -P showall]
ATA Version is:   ACS-2 (minor revision not indicated)
SATA Version is:  SATA 3.1, 6.0 Gb/s (current: 6.0 Gb/s)
Local Time is:    Fri Mar 17 10:06:51 2017 CET
SMART support is: Available - device has SMART capability.
SMART support is: Enabled
AAM feature is:   Unavailable
APM level is:     254 (maximum performance)
Rd look-ahead is: Enabled
Write cache is:   Enabled
ATA Security is:  Disabled, frozen [SEC2]
Wt Cache Reorder: Enabled

=== START OF READ SMART DATA SECTION ===
SMART overall-health self-assessment test result: PASSED

General SMART Values:
Offline data collection status:  (0x02)	Offline data collection activity
					was completed without error.
					Auto Offline Data Collection: Disabled.
Self-test execution status:      (   0)	The previous self-test routine completed
					without error or no self-test has ever 
					been run.
Total time to complete Offline 
data collection: 		(   32) seconds.
Offline data collection
capabilities: 			 (0x5b) SMART execute Offline immediate.
					Auto Offline data collection on/off support.
					Suspend Offline collection upon new
					command.
					Offline surface scan supported.
					Self-test supported.
					No Conveyance Self-test supported.
					Selective Self-test supported.
SMART capabilities:            (0x0003)	Saves SMART data before entering
					power-saving mode.
					Supports SMART auto save timer.
Error logging capability:        (0x01)	Error logging supported.
					General Purpose Logging supported.
Short self-test routine 
recommended polling time: 	 (   1) minutes.
Extended self-test routine
recommended polling time: 	 (   1) minutes.
SCT capabilities: 	       (0x0039)	SCT Status supported.
					SCT Error Recovery Control supported.
					SCT Feature Control supported.
					SCT Data Table supported.

SMART Attributes Data Structure revision number: 16
Vendor Specific SMART Attributes with Thresholds:
ID# ATTRIBUTE_NAME          FLAGS    VALUE WORST THRESH FAIL RAW_VALUE
  1 Raw_Read_Error_Rate     -O-R--   100   100   000    -    0
  2 Throughput_Performance  P-S---   100   100   050    -    0
  3 Spin_Up_Time            POS---   100   100   050    -    0
  5 Reallocated_Sector_Ct   PO--C-   100   100   050    -    0
  7 Unknown_SSD_Attribute   PO-R--   100   100   050    -    0
  8 Unknown_SSD_Attribute   P-S---   100   100   050    -    0
  9 Power_On_Hours          -O--C-   100   100   000    -    74
 10 Unknown_SSD_Attribute   PO--C-   100   100   050    -    0
 12 Power_Cycle_Count       -O--C-   100   100   000    -    13
167 Unknown_Attribute       -O---K   100   100   000    -    0
168 Unknown_Attribute       -O--C-   100   100   000    -    0
169 Unknown_Attribute       PO--C-   100   100   010    -    262145
170 Unknown_Attribute       PO--C-   100   100   010    -    0
173 Unknown_Attribute       -O--C-   199   199   000    -    8590458883
175 Program_Fail_Count_Chip PO--C-   100   100   010    -    0
180 Unused_Rsvd_Blk_Cnt_Tot PO--CK   100   100   020    -    1020
192 Power-Off_Retract_Count -O--C-   100   100   000    -    8
194 Temperature_Celsius     -O---K   072   072   030    -    28 (Min/Max 25/30)
197 Current_Pending_Sector  -O--C-   100   100   000    -    0
231 Temperature_Celsius     PO--CK   100   100   005    -    0
233 Media_Wearout_Indicator -O--CK   100   100   000    -    758656000
234 Unknown_Attribute       -O--CK   100   100   000    -    779271872
240 Unknown_SSD_Attribute   PO--C-   100   100   050    -    0
241 Total_LBAs_Written      -O--CK   100   100   000    -    516583543
242 Total_LBAs_Read         -O--CK   100   100   000    -    726648101
                            ||||||_ K auto-keep
                            |||||__ C event count
                            ||||___ R error rate
                            |||____ S speed/performance
                            ||_____ O updated online
                            |______ P prefailure warning

General Purpose Log Directory Version 1
SMART           Log Directory Version 1 [multi-sector log support]
Address    Access  R/W   Size  Description
0x00       GPL,SL  R/O      1  Log Directory
0x01           SL  R/O      1  Summary SMART error log
0x02           SL  R/O     51  Comprehensive SMART error log
0x03       GPL     R/O     64  Ext. Comprehensive SMART error log
0x04       GPL,SL  R/O      8  Device Statistics log
0x06           SL  R/O      1  SMART self-test log
0x07       GPL     R/O      1  Extended self-test log
0x09           SL  R/W      1  Selective self-test log
0x10       GPL     R/O      1  SATA NCQ Queued Error log
0x11       GPL     R/O      1  SATA Phy Event Counters log
0x30       GPL,SL  R/O      9  IDENTIFY DEVICE data log
0x80-0x9f  GPL,SL  R/W     16  Host vendor specific log
0xe0       GPL,SL  R/W      1  SCT Command/Status
0xe1       GPL,SL  R/W      1  SCT Data Transfer

SMART Extended Comprehensive Error Log Version: 1 (64 sectors)
No Errors Logged

SMART Extended Self-test Log Version: 1 (1 sectors)
Num  Test_Description    Status                  Remaining  LifeTime(hours)  LBA_of_first_error
# 1  Short offline       Completed without error       00%        74         -
# 2  Short offline       Completed without error       00%        66         -
# 3  Short offline       Completed without error       00%        42         -
# 4  Short offline       Completed without error       00%        28         -

SMART Selective self-test log data structure revision number 1
 SPAN  MIN_LBA  MAX_LBA  CURRENT_TEST_STATUS
    1        0        0  Not_testing
    2        0        0  Not_testing
    3        0        0  Not_testing
    4        0        0  Not_testing
    5        0        0  Not_testing
Selective self-test flags (0x0):
  After scanning selected spans, do NOT read-scan remainder of disk.
If Selective self-test is pending on power-up, resume after 0 minute delay.

SCT Status Version:                  3
SCT Version (vendor specific):       1 (0x0001)
SCT Support Level:                   0
Device State:                        Active (0)
Current Temperature:                  0 Celsius
Power Cycle Max Temperature:          0 Celsius
Lifetime    Max Temperature:          0 Celsius

SCT Temperature History Version:     2
Temperature Sampling Period:         1 minute
Temperature Logging Interval:        1 minute
Min/Max recommended Temperature:     -127/127 Celsius
Min/Max Temperature Limit:           -127/127 Celsius
Temperature History Size (Index):    478 (127)

Index    Estimated Time   Temperature Celsius
 128    2017-03-17 02:09    26  *******
 129    2017-03-17 02:10    26  *******
 130    2017-03-17 02:11    26  *******
 131    2017-03-17 02:12     ?  -
 132    2017-03-17 02:13    29  **********
 133    2017-03-17 02:14    28  *********
 ...    ..(  2 skipped).    ..  *********
 136    2017-03-17 02:17    28  *********
 137    2017-03-17 02:18    27  ********
 ...    ..( 10 skipped).    ..  ********
 148    2017-03-17 02:29    27  ********
 149    2017-03-17 02:30    26  *******
 ...    ..( 18 skipped).    ..  *******
 168    2017-03-17 02:49    26  *******
 169    2017-03-17 02:50    27  ********
 ...    ..(103 skipped).    ..  ********
 273    2017-03-17 04:34    27  ********
 274    2017-03-17 04:35     ?  -
 275    2017-03-17 04:36    27  ********
 276    2017-03-17 04:37    27  ********
 277    2017-03-17 04:38    28  *********
 278    2017-03-17 04:39    28  *********
 279    2017-03-17 04:40    28  *********
 280    2017-03-17 04:41    29  **********
 ...    ..( 11 skipped).    ..  **********
 292    2017-03-17 04:53    29  **********
 293    2017-03-17 04:54    30  ***********
 294    2017-03-17 04:55    30  ***********
 295    2017-03-17 04:56    28  *********
 296    2017-03-17 04:57    28  *********
 297    2017-03-17 04:58    28  *********
 298    2017-03-17 04:59    27  ********
 ...    ..( 11 skipped).    ..  ********
 310    2017-03-17 05:11    27  ********
 311    2017-03-17 05:12    26  *******
 ...    ..( 10 skipped).    ..  *******
 322    2017-03-17 05:23    26  *******
 323    2017-03-17 05:24    25  ******
 ...    ..( 10 skipped).    ..  ******
 334    2017-03-17 05:35    25  ******
 335    2017-03-17 05:36    26  *******
 336    2017-03-17 05:37    25  ******
 337    2017-03-17 05:38    25  ******
 338    2017-03-17 05:39    25  ******
 339    2017-03-17 05:40    26  *******
 340    2017-03-17 05:41    25  ******
 341    2017-03-17 05:42    26  *******
 342    2017-03-17 05:43    25  ******
 ...    ..( 25 skipped).    ..  ******
 368    2017-03-17 06:09    25  ******
 369    2017-03-17 06:10    26  *******
 ...    ..(  7 skipped).    ..  *******
 377    2017-03-17 06:18    26  *******
 378    2017-03-17 06:19    27  ********
 379    2017-03-17 06:20    27  ********
 380    2017-03-17 06:21    27  ********
 381    2017-03-17 06:22    28  *********
 ...    ..(  2 skipped).    ..  *********
 384    2017-03-17 06:25    28  *********
 385    2017-03-17 06:26    27  ********
 ...    ..( 36 skipped).    ..  ********
 422    2017-03-17 07:03    27  ********
 423    2017-03-17 07:04    26  *******
 ...    ..( 61 skipped).    ..  *******
   7    2017-03-17 08:06    26  *******
   8    2017-03-17 08:07    25  ******
 ...    ..(  4 skipped).    ..  ******
  13    2017-03-17 08:12    25  ******
  14    2017-03-17 08:13    26  *******
 ...    ..(  4 skipped).    ..  *******
  19    2017-03-17 08:18    26  *******
  20    2017-03-17 08:19    27  ********
 ...    ..( 11 skipped).    ..  ********
  32    2017-03-17 08:31    27  ********
  33    2017-03-17 08:32    26  *******
  34    2017-03-17 08:33    26  *******
  35    2017-03-17 08:34    27  ********
  36    2017-03-17 08:35    26  *******
 ...    ..( 18 skipped).    ..  *******
  55    2017-03-17 08:54    26  *******
  56    2017-03-17 08:55    27  ********
  57    2017-03-17 08:56    27  ********
  58    2017-03-17 08:57    26  *******
 ...    ..( 61 skipped).    ..  *******
 120    2017-03-17 09:59    26  *******
 121    2017-03-17 10:00    27  ********
 ...    ..(  4 skipped).    ..  ********
 126    2017-03-17 10:05    27  ********
 127    2017-03-17 10:06    28  *********

SCT Error Recovery Control:
           Read:     70 (7,0 seconds)
          Write:     70 (7,0 seconds)

Device Statistics (GP Log 0x04)
Page Offset Size         Value  Description
  1  =====  =                =  == General Statistics (rev 2) ==
  1  0x008  4               13  Lifetime Power-On Resets
  1  0x018  6        516583642  Logical Sectors Written
  1  0x020  6          2174610  Number of Write Commands
  1  0x028  6        726648101  Logical Sectors Read
  1  0x030  6          2213145  Number of Read Commands
  1  0x038  6        266400000  Date and Time TimeStamp
  7  =====  =                =  == Solid State Device Statistics (rev 1) ==
  7  0x008  1                0~ Percentage Used Endurance Indicator
                              |_ ~ normalized value

SATA Phy Event Counters (GP Log 0x11)
ID      Size     Value  Description
0x0001  2            0  Command failed due to ICRC error
0x0003  2            0  R_ERR response for device-to-host data FIS
0x0004  2            0  R_ERR response for host-to-device data FIS
0x0006  2            0  R_ERR response for device-to-host non-data FIS
0x0007  2            0  R_ERR response for host-to-device non-data FIS
0x0008  2            0  Device-to-host non-data FIS retries
0x0009  4            0  Transition from drive PhyRdy to drive PhyNRdy
0x000a  4           18  Device-to-host register FISes sent due to a COMRESET
0x000f  2            0  R_ERR response for host-to-device data FIS, CRC
0x0010  2            0  R_ERR response for host-to-device data FIS, non-CRC
0x0012  2            0  R_ERR response for host-to-device non-data FIS, CRC
0x0013  2            0  R_ERR response for host-to-device non-data FIS, non-CRC

