smartctl 6.4 2014-10-07 r4002 [x86_64-linux-3.16.0-4-amd64] (local build)
Copyright (C) 2002-14, Bruce Allen, Christian Franke, www.smartmontools.org

=== START OF INFORMATION SECTION ===
Device Model:     ADATA SX930
Firmware Version: 6.8SE
User Capacity:    120,034,123,776 bytes [120 GB]
Sector Size:      512 bytes logical/physical
Rotation Rate:    Solid State Device
Form Factor:      2.5 inches
Device is:        Not in smartctl database [for details use: -P showall]
ATA Version is:   ACS-2 (minor revision not indicated)
SATA Version is:  SATA 3.1, 6.0 Gb/s (current: 6.0 Gb/s)
Local Time is:    Wed Mar 15 12:17:31 2017 CET
SMART support is: Available - device has SMART capability.
SMART support is: Enabled
AAM feature is:   Unavailable
APM level is:     254 (maximum performance)
Rd look-ahead is: Enabled
Write cache is:   Enabled
ATA Security is:  Disabled, frozen [SEC2]
Wt Cache Reorder: Enabled

=== START OF READ SMART DATA SECTION ===
SMART overall-health self-assessment test result: PASSED

General SMART Values:
Offline data collection status:  (0x02)	Offline data collection activity
					was completed without error.
					Auto Offline Data Collection: Disabled.
Self-test execution status:      (   0)	The previous self-test routine completed
					without error or no self-test has ever 
					been run.
Total time to complete Offline 
data collection: 		(   32) seconds.
Offline data collection
capabilities: 			 (0x5b) SMART execute Offline immediate.
					Auto Offline data collection on/off support.
					Suspend Offline collection upon new
					command.
					Offline surface scan supported.
					Self-test supported.
					No Conveyance Self-test supported.
					Selective Self-test supported.
SMART capabilities:            (0x0003)	Saves SMART data before entering
					power-saving mode.
					Supports SMART auto save timer.
Error logging capability:        (0x01)	Error logging supported.
					General Purpose Logging supported.
Short self-test routine 
recommended polling time: 	 (   1) minutes.
Extended self-test routine
recommended polling time: 	 (   1) minutes.
SCT capabilities: 	       (0x0039)	SCT Status supported.
					SCT Error Recovery Control supported.
					SCT Feature Control supported.
					SCT Data Table supported.

SMART Attributes Data Structure revision number: 16
Vendor Specific SMART Attributes with Thresholds:
ID# ATTRIBUTE_NAME          FLAGS    VALUE WORST THRESH FAIL RAW_VALUE
  1 Raw_Read_Error_Rate     -O-R--   100   100   000    -    0
  2 Throughput_Performance  P-S---   100   100   050    -    0
  3 Spin_Up_Time            POS---   100   100   050    -    0
  5 Reallocated_Sector_Ct   PO--C-   100   100   050    -    0
  7 Unknown_SSD_Attribute   PO-R--   100   100   050    -    0
  8 Unknown_SSD_Attribute   P-S---   100   100   050    -    0
  9 Power_On_Hours          -O--C-   100   100   000    -    28
 10 Unknown_SSD_Attribute   PO--C-   100   100   050    -    0
 12 Power_Cycle_Count       -O--C-   100   100   000    -    13
167 Unknown_Attribute       -O---K   100   100   000    -    0
168 Unknown_Attribute       -O--C-   100   100   000    -    0
169 Unknown_Attribute       PO--C-   100   100   010    -    262145
170 Unknown_Attribute       PO--C-   100   100   010    -    0
173 Unknown_Attribute       -O--C-   199   199   000    -    8590458883
175 Program_Fail_Count_Chip PO--C-   100   100   010    -    0
180 Unused_Rsvd_Blk_Cnt_Tot PO--CK   100   100   020    -    1020
192 Power-Off_Retract_Count -O--C-   100   100   000    -    8
194 Temperature_Celsius     -O---K   073   073   030    -    27 (Min/Max 25/30)
197 Current_Pending_Sector  -O--C-   100   100   000    -    0
231 Temperature_Celsius     PO--CK   100   100   005    -    0
233 Media_Wearout_Indicator -O--CK   100   100   000    -    631725056
234 Unknown_Attribute       -O--CK   100   100   000    -    620312512
240 Unknown_SSD_Attribute   PO--C-   100   100   050    -    0
241 Total_LBAs_Written      -O--CK   100   100   000    -    515759991
242 Total_LBAs_Read         -O--CK   100   100   000    -    726648101
                            ||||||_ K auto-keep
                            |||||__ C event count
                            ||||___ R error rate
                            |||____ S speed/performance
                            ||_____ O updated online
                            |______ P prefailure warning

General Purpose Log Directory Version 1
SMART           Log Directory Version 1 [multi-sector log support]
Address    Access  R/W   Size  Description
0x00       GPL,SL  R/O      1  Log Directory
0x01           SL  R/O      1  Summary SMART error log
0x02           SL  R/O     51  Comprehensive SMART error log
0x03       GPL     R/O     64  Ext. Comprehensive SMART error log
0x04       GPL,SL  R/O      8  Device Statistics log
0x06           SL  R/O      1  SMART self-test log
0x07       GPL     R/O      1  Extended self-test log
0x09           SL  R/W      1  Selective self-test log
0x10       GPL     R/O      1  SATA NCQ Queued Error log
0x11       GPL     R/O      1  SATA Phy Event Counters log
0x30       GPL,SL  R/O      9  IDENTIFY DEVICE data log
0x80-0x9f  GPL,SL  R/W     16  Host vendor specific log
0xe0       GPL,SL  R/W      1  SCT Command/Status
0xe1       GPL,SL  R/W      1  SCT Data Transfer

SMART Extended Comprehensive Error Log Version: 1 (64 sectors)
No Errors Logged

SMART Extended Self-test Log Version: 1 (1 sectors)
Num  Test_Description    Status                  Remaining  LifeTime(hours)  LBA_of_first_error
# 1  Short offline       Completed without error       00%        28         -

SMART Selective self-test log data structure revision number 1
 SPAN  MIN_LBA  MAX_LBA  CURRENT_TEST_STATUS
    1        0        0  Not_testing
    2        0        0  Not_testing
    3        0        0  Not_testing
    4        0        0  Not_testing
    5        0        0  Not_testing
Selective self-test flags (0x0):
  After scanning selected spans, do NOT read-scan remainder of disk.
If Selective self-test is pending on power-up, resume after 0 minute delay.

SCT Status Version:                  3
SCT Version (vendor specific):       1 (0x0001)
SCT Support Level:                   0
Device State:                        Active (0)
Current Temperature:                  0 Celsius
Power Cycle Max Temperature:          0 Celsius
Lifetime    Max Temperature:          0 Celsius

SCT Temperature History Version:     2
Temperature Sampling Period:         1 minute
Temperature Logging Interval:        1 minute
Min/Max recommended Temperature:     -127/127 Celsius
Min/Max Temperature Limit:           -127/127 Celsius
Temperature History Size (Index):    478 (408)

Index    Estimated Time   Temperature Celsius
 409    2017-03-15 04:20     ?  -
 ...    ..( 69 skipped).    ..  -
   1    2017-03-15 05:30     ?  -
   2    2017-03-15 05:31    36  *****************
   3    2017-03-15 05:32    38  *******************
   4    2017-03-15 05:33    41  **********************
   5    2017-03-15 05:34    41  **********************
   6    2017-03-15 05:35    43  ************************
   7    2017-03-15 05:36    42  ***********************
   8    2017-03-15 05:37    43  ************************
   9    2017-03-15 05:38    42  ***********************
  10    2017-03-15 05:39    44  *************************
  11    2017-03-15 05:40    43  ************************
  12    2017-03-15 05:41    44  *************************
  13    2017-03-15 05:42    43  ************************
  14    2017-03-15 05:43    44  *************************
  15    2017-03-15 05:44    43  ************************
  16    2017-03-15 05:45    44  *************************
  17    2017-03-15 05:46    44  *************************
  18    2017-03-15 05:47    43  ************************
  19    2017-03-15 05:48    43  ************************
  20    2017-03-15 05:49    43  ************************
  21    2017-03-15 05:50    44  *************************
  22    2017-03-15 05:51    43  ************************
  23    2017-03-15 05:52    44  *************************
  24    2017-03-15 05:53    44  *************************
  25    2017-03-15 05:54    45  **************************
  26    2017-03-15 05:55    44  *************************
 ...    ..(  4 skipped).    ..  *************************
  31    2017-03-15 06:00    44  *************************
  32    2017-03-15 06:01    45  **************************
  33    2017-03-15 06:02    44  *************************
  34    2017-03-15 06:03    45  **************************
  35    2017-03-15 06:04    44  *************************
 ...    ..(  3 skipped).    ..  *************************
  39    2017-03-15 06:08    44  *************************
  40    2017-03-15 06:09     ?  -
 ...    ..(  7 skipped).    ..  -
  48    2017-03-15 06:17     ?  -
  49    2017-03-15 06:18    27  ********
  50    2017-03-15 06:19    25  ******
  51    2017-03-15 06:20    26  *******
 ...    ..( 78 skipped).    ..  *******
 130    2017-03-15 07:39    26  *******
 131    2017-03-15 07:40     ?  -
 132    2017-03-15 07:41    29  **********
 133    2017-03-15 07:42    28  *********
 ...    ..(  2 skipped).    ..  *********
 136    2017-03-15 07:45    28  *********
 137    2017-03-15 07:46    27  ********
 ...    ..( 10 skipped).    ..  ********
 148    2017-03-15 07:57    27  ********
 149    2017-03-15 07:58    26  *******
 ...    ..( 18 skipped).    ..  *******
 168    2017-03-15 08:17    26  *******
 169    2017-03-15 08:18    27  ********
 ...    ..(103 skipped).    ..  ********
 273    2017-03-15 10:02    27  ********
 274    2017-03-15 10:03     ?  -
 275    2017-03-15 10:04    27  ********
 276    2017-03-15 10:05    27  ********
 277    2017-03-15 10:06    28  *********
 278    2017-03-15 10:07    28  *********
 279    2017-03-15 10:08    28  *********
 280    2017-03-15 10:09    29  **********
 ...    ..( 11 skipped).    ..  **********
 292    2017-03-15 10:21    29  **********
 293    2017-03-15 10:22    30  ***********
 294    2017-03-15 10:23    30  ***********
 295    2017-03-15 10:24    28  *********
 296    2017-03-15 10:25    28  *********
 297    2017-03-15 10:26    28  *********
 298    2017-03-15 10:27    27  ********
 ...    ..( 11 skipped).    ..  ********
 310    2017-03-15 10:39    27  ********
 311    2017-03-15 10:40    26  *******
 ...    ..( 10 skipped).    ..  *******
 322    2017-03-15 10:51    26  *******
 323    2017-03-15 10:52    25  ******
 ...    ..( 10 skipped).    ..  ******
 334    2017-03-15 11:03    25  ******
 335    2017-03-15 11:04    26  *******
 336    2017-03-15 11:05    25  ******
 337    2017-03-15 11:06    25  ******
 338    2017-03-15 11:07    25  ******
 339    2017-03-15 11:08    26  *******
 340    2017-03-15 11:09    25  ******
 341    2017-03-15 11:10    26  *******
 342    2017-03-15 11:11    25  ******
 ...    ..( 25 skipped).    ..  ******
 368    2017-03-15 11:37    25  ******
 369    2017-03-15 11:38    26  *******
 ...    ..(  7 skipped).    ..  *******
 377    2017-03-15 11:46    26  *******
 378    2017-03-15 11:47    27  ********
 379    2017-03-15 11:48    27  ********
 380    2017-03-15 11:49    27  ********
 381    2017-03-15 11:50    28  *********
 ...    ..(  2 skipped).    ..  *********
 384    2017-03-15 11:53    28  *********
 385    2017-03-15 11:54    27  ********
 ...    ..( 22 skipped).    ..  ********
 408    2017-03-15 12:17    27  ********

SCT Error Recovery Control:
           Read:     70 (7,0 seconds)
          Write:     70 (7,0 seconds)

Device Statistics (GP Log 0x04)
Page Offset Size         Value  Description
  1  =====  =                =  == General Statistics (rev 2) ==
  1  0x008  4               13  Lifetime Power-On Resets
  1  0x018  6        515759991  Logical Sectors Written
  1  0x020  6          2127113  Number of Write Commands
  1  0x028  6        726648101  Logical Sectors Read
  1  0x030  6          2213145  Number of Read Commands
  1  0x038  6        100800000  Date and Time TimeStamp
  7  =====  =                =  == Solid State Device Statistics (rev 1) ==
  7  0x008  1                0~ Percentage Used Endurance Indicator
                              |_ ~ normalized value

SATA Phy Event Counters (GP Log 0x11)
ID      Size     Value  Description
0x0001  2            0  Command failed due to ICRC error
0x0003  2            0  R_ERR response for device-to-host data FIS
0x0004  2            0  R_ERR response for host-to-device data FIS
0x0006  2            0  R_ERR response for device-to-host non-data FIS
0x0007  2            0  R_ERR response for host-to-device non-data FIS
0x0008  2            0  Device-to-host non-data FIS retries
0x0009  4            0  Transition from drive PhyRdy to drive PhyNRdy
0x000a  4           18  Device-to-host register FISes sent due to a COMRESET
0x000f  2            0  R_ERR response for host-to-device data FIS, CRC
0x0010  2            0  R_ERR response for host-to-device data FIS, non-CRC
0x0012  2            0  R_ERR response for host-to-device non-data FIS, CRC
0x0013  2            0  R_ERR response for host-to-device non-data FIS, non-CRC

