smartctl 7.5 2025-04-30 r5714 [x86_64-linux-6.12.54-Unraid] (local build)
Copyright (C) 2002-25, Bruce Allen, Christian Franke, www.smartmontools.org

=== START OF READ SMART DATA SECTION ===
SMART Attributes Data Structure revision number: 1
Vendor Specific SMART Attributes with Thresholds:
ID# ATTRIBUTE_NAME          FLAG     VALUE WORST THRESH TYPE      UPDATED  WHEN_FAILED RAW_VALUE
  1 Raw_Read_Error_Rate     0x0032   100   100   050    Old_age   Always       -       0
  5 Reallocated_Sector_Ct   0x0032   100   100   050    Old_age   Always       -       0
  9 Power_On_Hours          0x0032   100   100   050    Old_age   Always       -       2977
 12 Power_Cycle_Count       0x0032   100   100   050    Old_age   Always       -       13
160 Unknown_Attribute       0x0032   100   100   050    Old_age   Always       -       0
161 Unknown_Attribute       0x0033   100   100   050    Pre-fail  Always       -       100
163 Unknown_Attribute       0x0032   100   100   050    Old_age   Always       -       6
164 Unknown_Attribute       0x0032   100   100   050    Old_age   Always       -       4733
165 Unknown_Attribute       0x0032   100   100   050    Old_age   Always       -       41
166 Unknown_Attribute       0x0032   100   100   050    Old_age   Always       -       2
167 Unknown_Attribute       0x0032   100   100   050    Old_age   Always       -       20
168 Unknown_Attribute       0x0032   100   100   050    Old_age   Always       -       3808
169 Unknown_Attribute       0x0032   100   100   050    Old_age   Always       -       100
175 Program_Fail_Count_Chip 0x0032   100   100   050    Old_age   Always       -       0
176 Erase_Fail_Count_Chip   0x0032   100   100   050    Old_age   Always       -       0
177 Wear_Leveling_Count     0x0032   100   100   050    Old_age   Always       -       0
178 Used_Rsvd_Blk_Cnt_Chip  0x0032   100   100   050    Old_age   Always       -       0
181 Program_Fail_Cnt_Total  0x0032   100   100   050    Old_age   Always       -       0
182 Erase_Fail_Count_Total  0x0032   100   100   050    Old_age   Always       -       0
192 Power-Off_Retract_Count 0x0032   100   100   050    Old_age   Always       -       4
194 Temperature_Celsius     0x0022   100   100   050    Old_age   Always       -       38
195 Hardware_ECC_Recovered  0x0032   100   100   050    Old_age   Always       -       0
196 Reallocated_Event_Count 0x0032   100   100   050    Old_age   Always       -       0
197 Current_Pending_Sector  0x0032   100   100   050    Old_age   Always       -       0
198 Offline_Uncorrectable   0x0032   100   100   050    Old_age   Always       -       0
199 UDMA_CRC_Error_Count    0x0032   100   100   050    Old_age   Always       -       0
232 Available_Reservd_Space 0x0032   100   100   050    Old_age   Always       -       100
241 Total_LBAs_Written      0x0030   100   100   050    Old_age   Offline      -       409596
242 Total_LBAs_Read         0x0030   100   100   050    Old_age   Offline      -       131131
245 Unknown_Attribute       0x0032   100   100   050    Old_age   Always       -       328612


