smartctl 5.41 2011-06-09 r3365 [x86_64-linux-3.2.0-4-amd64] (local build)
Copyright (C) 2002-11 by Bruce Allen, http://smartmontools.sourceforge.net

=== START OF INFORMATION SECTION ===
Device Model:     WDC WD40EFRX-68WT0N0
Serial Number:    WD-WCC4E1039906
LU WWN Device Id: 5 0014ee 25f2a812f
Firmware Version: 80.00A80
User Capacity:    4,000,787,030,016 bytes [4.00 TB]
Sector Sizes:     512 bytes logical, 4096 bytes physical
Device is:        Not in smartctl database [for details use: -P showall]
ATA Version is:   9
ATA Standard is:  Exact ATA specification draft version not indicated
Local Time is:    Wed Dec 10 13:27:47 2014 EST
SMART support is: Available - device has SMART capability.
SMART support is: Enabled

=== START OF READ SMART DATA SECTION ===
SMART STATUS RETURN: incomplete response, ATA output registers missing
SMART overall-health self-assessment test result: PASSED
Warning: This result is based on an Attribute check.

General SMART Values:
Offline data collection status:  (0x00)	Offline data collection activity
					was never started.
					Auto Offline Data Collection: Disabled.
Self-test execution status:      (   0)	The previous self-test routine completed
					without error or no self-test has ever 
					been run.
Total time to complete Offline 
data collection: 		(54000) seconds.
Offline data collection
capabilities: 			 (0x7b) SMART execute Offline immediate.
					Auto Offline data collection on/off support.
					Suspend Offline collection upon new
					command.
					Offline surface scan supported.
					Self-test supported.
					Conveyance Self-test supported.
					Selective Self-test supported.
SMART capabilities:            (0x0003)	Saves SMART data before entering
					power-saving mode.
					Supports SMART auto save timer.
Error logging capability:        (0x01)	Error logging supported.
					General Purpose Logging supported.
Short self-test routine 
recommended polling time: 	 (   2) minutes.
Extended self-test routine
recommended polling time: 	 ( 255) minutes.
Conveyance self-test routine
recommended polling time: 	 (   5) minutes.
SCT capabilities: 	       (0x703d)	SCT Status supported.
					SCT Error Recovery Control supported.
					SCT Feature Control supported.
					SCT Data Table supported.

SMART Attributes Data Structure revision number: 16
Vendor Specific SMART Attributes with Thresholds:
ID# ATTRIBUTE_NAME          FLAGS    VALUE WORST THRESH FAIL RAW_VALUE
  1 Raw_Read_Error_Rate     POSR-K   200   200   051    -    0
  3 Spin_Up_Time            POS--K   174   173   021    -    8275
  4 Start_Stop_Count        -O--CK   100   100   000    -    28
  5 Reallocated_Sector_Ct   PO--CK   200   200   140    -    0
  7 Seek_Error_Rate         -OSR-K   200   200   000    -    0
  9 Power_On_Hours          -O--CK   099   099   000    -    894
 10 Spin_Retry_Count        -O--CK   100   253   000    -    0
 11 Calibration_Retry_Count -O--CK   100   253   000    -    0
 12 Power_Cycle_Count       -O--CK   100   100   000    -    28
192 Power-Off_Retract_Count -O--CK   200   200   000    -    22
193 Load_Cycle_Count        -O--CK   200   200   000    -    45
194 Temperature_Celsius     -O---K   123   115   000    -    29
196 Reallocated_Event_Count -O--CK   200   200   000    -    0
197 Current_Pending_Sector  -O--CK   200   200   000    -    0
198 Offline_Uncorrectable   ----CK   100   253   000    -    0
199 UDMA_CRC_Error_Count    -O--CK   200   200   000    -    0
200 Multi_Zone_Error_Rate   ---R--   100   253   000    -    0
                            ||||||_ K auto-keep
                            |||||__ C event count
                            ||||___ R error rate
                            |||____ S speed/performance
                            ||_____ O updated online
                            |______ P prefailure warning

General Purpose Log Directory Version 1
SMART           Log Directory Version 1 [multi-sector log support]
GP/S  Log at address 0x00 has    1 sectors [Log Directory]
SMART Log at address 0x01 has    1 sectors [Summary SMART error log]
SMART Log at address 0x02 has    5 sectors [Comprehensive SMART error log]
GP    Log at address 0x03 has    6 sectors [Ext. Comprehensive SMART error log]
SMART Log at address 0x06 has    1 sectors [SMART self-test log]
GP    Log at address 0x07 has    1 sectors [Extended self-test log]
SMART Log at address 0x09 has    1 sectors [Selective self-test log]
GP    Log at address 0x10 has    1 sectors [NCQ Command Error]
GP    Log at address 0x11 has    1 sectors [SATA Phy Event Counters]
GP    Log at address 0x21 has    1 sectors [Write stream error log]
GP    Log at address 0x22 has    1 sectors [Read stream error log]
GP/S  Log at address 0x80 has   16 sectors [Host vendor specific log]
GP/S  Log at address 0x81 has   16 sectors [Host vendor specific log]
GP/S  Log at address 0x82 has   16 sectors [Host vendor specific log]
GP/S  Log at address 0x83 has   16 sectors [Host vendor specific log]
GP/S  Log at address 0x84 has   16 sectors [Host vendor specific log]
GP/S  Log at address 0x85 has   16 sectors [Host vendor specific log]
GP/S  Log at address 0x86 has   16 sectors [Host vendor specific log]
GP/S  Log at address 0x87 has   16 sectors [Host vendor specific log]
GP/S  Log at address 0x88 has   16 sectors [Host vendor specific log]
GP/S  Log at address 0x89 has   16 sectors [Host vendor specific log]
GP/S  Log at address 0x8a has   16 sectors [Host vendor specific log]
GP/S  Log at address 0x8b has   16 sectors [Host vendor specific log]
GP/S  Log at address 0x8c has   16 sectors [Host vendor specific log]
GP/S  Log at address 0x8d has   16 sectors [Host vendor specific log]
GP/S  Log at address 0x8e has   16 sectors [Host vendor specific log]
GP/S  Log at address 0x8f has   16 sectors [Host vendor specific log]
GP/S  Log at address 0x90 has   16 sectors [Host vendor specific log]
GP/S  Log at address 0x91 has   16 sectors [Host vendor specific log]
GP/S  Log at address 0x92 has   16 sectors [Host vendor specific log]
GP/S  Log at address 0x93 has   16 sectors [Host vendor specific log]
GP/S  Log at address 0x94 has   16 sectors [Host vendor specific log]
GP/S  Log at address 0x95 has   16 sectors [Host vendor specific log]
GP/S  Log at address 0x96 has   16 sectors [Host vendor specific log]
GP/S  Log at address 0x97 has   16 sectors [Host vendor specific log]
GP/S  Log at address 0x98 has   16 sectors [Host vendor specific log]
GP/S  Log at address 0x99 has   16 sectors [Host vendor specific log]
GP/S  Log at address 0x9a has   16 sectors [Host vendor specific log]
GP/S  Log at address 0x9b has   16 sectors [Host vendor specific log]
GP/S  Log at address 0x9c has   16 sectors [Host vendor specific log]
GP/S  Log at address 0x9d has   16 sectors [Host vendor specific log]
GP/S  Log at address 0x9e has   16 sectors [Host vendor specific log]
GP/S  Log at address 0x9f has   16 sectors [Host vendor specific log]
GP/S  Log at address 0xa0 has   16 sectors [Device vendor specific log]
GP/S  Log at address 0xa1 has   16 sectors [Device vendor specific log]
GP/S  Log at address 0xa2 has   16 sectors [Device vendor specific log]
GP/S  Log at address 0xa3 has   16 sectors [Device vendor specific log]
GP/S  Log at address 0xa4 has   16 sectors [Device vendor specific log]
GP/S  Log at address 0xa5 has   16 sectors [Device vendor specific log]
GP/S  Log at address 0xa6 has   16 sectors [Device vendor specific log]
GP/S  Log at address 0xa7 has   16 sectors [Device vendor specific log]
GP/S  Log at address 0xa8 has    1 sectors [Device vendor specific log]
GP/S  Log at address 0xa9 has    1 sectors [Device vendor specific log]
GP/S  Log at address 0xaa has    1 sectors [Device vendor specific log]
GP/S  Log at address 0xab has    1 sectors [Device vendor specific log]
GP/S  Log at address 0xac has    1 sectors [Device vendor specific log]
GP/S  Log at address 0xad has    1 sectors [Device vendor specific log]
GP/S  Log at address 0xae has    1 sectors [Device vendor specific log]
GP/S  Log at address 0xaf has    1 sectors [Device vendor specific log]
GP/S  Log at address 0xb0 has    1 sectors [Device vendor specific log]
GP/S  Log at address 0xb1 has    1 sectors [Device vendor specific log]
GP/S  Log at address 0xb2 has    1 sectors [Device vendor specific log]
GP/S  Log at address 0xb3 has    1 sectors [Device vendor specific log]
GP/S  Log at address 0xb4 has    1 sectors [Device vendor specific log]
GP/S  Log at address 0xb5 has    1 sectors [Device vendor specific log]
GP/S  Log at address 0xb6 has    1 sectors [Device vendor specific log]
GP/S  Log at address 0xb7 has    1 sectors [Device vendor specific log]
GP/S  Log at address 0xbd has    1 sectors [Device vendor specific log]
GP/S  Log at address 0xc0 has    1 sectors [Device vendor specific log]
GP    Log at address 0xc1 has   93 sectors [Device vendor specific log]
GP/S  Log at address 0xe0 has    1 sectors [SCT Command/Status]
GP/S  Log at address 0xe1 has    1 sectors [SCT Data Transfer]

SMART Extended Comprehensive Error Log Version: 1 (6 sectors)
No Errors Logged

SMART Extended Self-test Log Version: 1 (1 sectors)
No self-tests have been logged.  [To run self-tests, use: smartctl -t]

SMART Selective self-test log data structure revision number 1
 SPAN  MIN_LBA  MAX_LBA  CURRENT_TEST_STATUS
    1        0        0  Not_testing
    2        0        0  Not_testing
    3        0        0  Not_testing
    4        0        0  Not_testing
    5        0        0  Not_testing
Selective self-test flags (0x0):
  After scanning selected spans, do NOT read-scan remainder of disk.
If Selective self-test is pending on power-up, resume after 0 minute delay.

SCT Status Version:                  3
SCT Version (vendor specific):       258 (0x0102)
SCT Support Level:                   1
Device State:                        Active (0)
Current Temperature:                    29 Celsius
Power Cycle Min/Max Temperature:     25/29 Celsius
Lifetime    Min/Max Temperature:     22/37 Celsius
Under/Over Temperature Limit Count:   0/0
SCT Temperature History Version:     2
Temperature Sampling Period:         1 minute
Temperature Logging Interval:        1 minute
Min/Max recommended Temperature:      0/60 Celsius
Min/Max Temperature Limit:           -41/85 Celsius
Temperature History Size (Index):    478 (113)

Index    Estimated Time   Temperature Celsius
 114    2014-12-10 05:30    34  ***************
 ...    ..(247 skipped).    ..  ***************
 362    2014-12-10 09:38    34  ***************
 363    2014-12-10 09:39    33  **************
 ...    ..( 64 skipped).    ..  **************
 428    2014-12-10 10:44    33  **************
 429    2014-12-10 10:45    34  ***************
 ...    ..(  3 skipped).    ..  ***************
 433    2014-12-10 10:49    34  ***************
 434    2014-12-10 10:50    33  **************
 ...    ..( 40 skipped).    ..  **************
 475    2014-12-10 11:31    33  **************
 476    2014-12-10 11:32    34  ***************
 ...    ..(  8 skipped).    ..  ***************
   7    2014-12-10 11:41    34  ***************
   8    2014-12-10 11:42    33  **************
 ...    ..( 23 skipped).    ..  **************
  32    2014-12-10 12:06    33  **************
  33    2014-12-10 12:07    34  ***************
 ...    ..( 44 skipped).    ..  ***************
  78    2014-12-10 12:52    34  ***************
  79    2014-12-10 12:53    33  **************
 ...    ..(  3 skipped).    ..  **************
  83    2014-12-10 12:57    33  **************
  84    2014-12-10 12:58    34  ***************
  85    2014-12-10 12:59     ?  -
  86    2014-12-10 13:00    25  ******
 ...    ..(  2 skipped).    ..  ******
  89    2014-12-10 13:03    25  ******
  90    2014-12-10 13:04    26  *******
  91    2014-12-10 13:05    26  *******
  92    2014-12-10 13:06    27  ********
  93    2014-12-10 13:07    27  ********
  94    2014-12-10 13:08    28  *********
 ...    ..(  9 skipped).    ..  *********
 104    2014-12-10 13:18    28  *********
 105    2014-12-10 13:19    29  **********
 ...    ..(  7 skipped).    ..  **********
 113    2014-12-10 13:27    29  **********

Error SMART WRITE LOG does not return COUNT and LBA_LOW register
Warning: device does not support SCT (Get) Error Recovery Control command

SATA Phy Event Counters (GP Log 0x11)
ID      Size     Value  Description
0x0001  2            0  Command failed due to ICRC error
0x0002  2            0  R_ERR response for data FIS
0x0003  2            0  R_ERR response for device-to-host data FIS
0x0004  2            0  R_ERR response for host-to-device data FIS
0x0005  2            0  R_ERR response for non-data FIS
0x0006  2            0  R_ERR response for device-to-host non-data FIS
0x0007  2            0  R_ERR response for host-to-device non-data FIS
0x0008  2            0  Device-to-host non-data FIS retries
0x0009  2            3  Transition from drive PhyRdy to drive PhyNRdy
0x000a  2            3  Device-to-host register FISes sent due to a COMRESET
0x000b  2            0  CRC errors within host-to-device FIS
0x000f  2            0  R_ERR response for host-to-device data FIS, CRC
0x0012  2            0  R_ERR response for host-to-device non-data FIS, CRC
0x8000  4         1648  Vendor specific

