smartctl 6.5 2016-05-07 r4318 [x86_64-linux-4.9.3-gentoo-1] (local build)
Copyright (C) 2002-16, Bruce Allen, Christian Franke, www.smartmontools.org

=== START OF INFORMATION SECTION ===
Device Model:     INTEL SSDSC2KW120H6
Firmware Version: LSF036C
User Capacity:    120 034 123 776 bytes [120 GB]
Sector Size:      512 bytes logical/physical
Rotation Rate:    Solid State Device
Form Factor:      2.5 inches
Device is:        Not in smartctl database [for details use: -P showall]
ATA Version is:   ACS-3 (minor revision not indicated)
SATA Version is:  SATA 3.2, 6.0 Gb/s (current: 6.0 Gb/s)
Local Time is:    Wed Feb  1 20:40:46 2017 +08
SMART support is: Available - device has SMART capability.
SMART support is: Enabled
AAM feature is:   Unavailable
APM level is:     128 (minimum power consumption without standby)
Rd look-ahead is: Enabled
Write cache is:   Enabled
ATA Security is:  Disabled, frozen [SEC2]
Write SCT (Get) Feature Control Command failed: scsi error badly formed scsi parameters
Wt Cache Reorder: Unknown (SCT Feature Control command failed)

=== START OF READ SMART DATA SECTION ===
SMART overall-health self-assessment test result: PASSED

General SMART Values:
Offline data collection status:  (0x02)	Offline data collection activity
					was completed without error.
					Auto Offline Data Collection: Disabled.
Self-test execution status:      (   0)	The previous self-test routine completed
					without error or no self-test has ever 
					been run.
Total time to complete Offline 
data collection: 		(    0) seconds.
Offline data collection
capabilities: 			 (0x53) SMART execute Offline immediate.
					Auto Offline data collection on/off support.
					Suspend Offline collection upon new
					command.
					No Offline surface scan supported.
					Self-test supported.
					No Conveyance Self-test supported.
					Selective Self-test supported.
SMART capabilities:            (0x0003)	Saves SMART data before entering
					power-saving mode.
					Supports SMART auto save timer.
Error logging capability:        (0x01)	Error logging supported.
					General Purpose Logging supported.
Short self-test routine 
recommended polling time: 	 (   2) minutes.
Extended self-test routine
recommended polling time: 	 (  15) minutes.
SCT capabilities: 	       (0x0039)	SCT Status supported.
					SCT Error Recovery Control supported.
					SCT Feature Control supported.
					SCT Data Table supported.

SMART Attributes Data Structure revision number: 1
Vendor Specific SMART Attributes with Thresholds:
ID# ATTRIBUTE_NAME          FLAGS    VALUE WORST THRESH FAIL RAW_VALUE
  5 Reallocated_Sector_Ct   -O--CK   100   100   000    -    0
  9 Power_On_Hours          -O--CK   100   100   000    -    1
 12 Power_Cycle_Count       -O--CK   100   100   000    -    8
170 Unknown_Attribute       PO--CK   100   100   010    -    0
171 Unknown_Attribute       -O--CK   100   100   010    -    0
172 Unknown_Attribute       -O--CK   100   100   010    -    0
174 Unknown_Attribute       -O--CK   100   100   000    -    2
183 Runtime_Bad_Block       -O--CK   100   100   000    -    0
184 End-to-End_Error        PO--CK   100   100   090    -    0
187 Reported_Uncorrect      -O--CK   100   100   000    -    0
190 Airflow_Temperature_Cel -O--CK   043   049   000    -    43 (Min/Max 33/49)
192 Power-Off_Retract_Count -O--CK   100   100   000    -    2
199 UDMA_CRC_Error_Count    -O--CK   100   100   000    -    0
225 Unknown_SSD_Attribute   -O--CK   100   100   000    -    1112
226 Unknown_SSD_Attribute   -O--CK   100   100   000    -    0
227 Unknown_SSD_Attribute   -O--CK   100   100   000    -    0
228 Power-off_Retract_Count -O--CK   100   100   000    -    0
232 Available_Reservd_Space PO--CK   100   100   010    -    0
233 Media_Wearout_Indicator -O--CK   100   100   000    -    0
241 Total_LBAs_Written      -O--CK   100   100   000    -    1112
242 Total_LBAs_Read         -O--CK   100   100   000    -    223
249 Unknown_Attribute       -O--CK   100   100   000    -    33
252 Unknown_Attribute       -O--CK   100   100   000    -    0
                            ||||||_ K auto-keep
                            |||||__ C event count
                            ||||___ R error rate
                            |||____ S speed/performance
                            ||_____ O updated online
                            |______ P prefailure warning

General Purpose Log Directory Version 1
SMART           Log Directory Version 1 [multi-sector log support]
Address    Access  R/W   Size  Description
0x00       GPL,SL  R/O      1  Log Directory
0x01       GPL,SL  R/O      1  Summary SMART error log
0x02       GPL,SL  R/O      1  Comprehensive SMART error log
0x03       GPL,SL  R/O      1  Ext. Comprehensive SMART error log
0x04       GPL,SL  R/O      8  Device Statistics log
0x06       GPL,SL  R/O      1  SMART self-test log
0x07       GPL,SL  R/O      1  Extended self-test log
0x09       GPL,SL  R/W      1  Selective self-test log
0x10       GPL,SL  R/O      1  SATA NCQ Queued Error log
0x11       GPL,SL  R/O      1  SATA Phy Event Counters log
0x30       GPL,SL  R/O      9  IDENTIFY DEVICE data log
0x80-0x9f  GPL,SL  R/W     16  Host vendor specific log
0xdf       GPL,SL  VS       1  Device vendor specific log
0xe0       GPL,SL  R/W      1  SCT Command/Status
0xe1       GPL,SL  R/W      1  SCT Data Transfer

SMART Extended Comprehensive Error Log Version: 1 (1 sectors)
No Errors Logged

SMART Extended Self-test Log Version: 1 (1 sectors)
Num  Test_Description    Status                  Remaining  LifeTime(hours)  LBA_of_first_error
# 1  Short offline       Completed without error       00%         1         -

SMART Selective self-test log data structure revision number 1
 SPAN         MIN_LBA         MAX_LBA  CURRENT_TEST_STATUS
    1  70403103932424  70403103932424  Not_testing
    2  70403103932424  70403103932424  Not_testing
    3  70403103932424  70403103932424  Not_testing
    4  70403103932424  70403103932424  Not_testing
    5  70403103932424  70403103932424  Not_testing
Selective self-test flags (0x4008):
  After scanning selected spans, do NOT read-scan remainder of disk.
If Selective self-test is pending on power-up, resume after 0 minute delay.

SCT Status Version:                  3
SCT Version (vendor specific):       0 (0x0000)
SCT Support Level:                   0
Device State:                        Active (0)
Current Temperature:                    52 Celsius
Power Cycle Min/Max Temperature:     41/58 Celsius
Lifetime    Min/Max Temperature:     40/58 Celsius
Under/Over Temperature Limit Count:   0/0

SCT Temperature History Version:     2
Temperature Sampling Period:         1 minute
Temperature Logging Interval:        1 minute
Min/Max recommended Temperature:      0/100 Celsius
Min/Max Temperature Limit:            0/100 Celsius
Temperature History Size (Index):    128 (35)

Index    Estimated Time   Temperature Celsius
  36    2017-02-01 18:33    49  ******************************
 ...    ..( 45 skipped).    ..  ******************************
  82    2017-02-01 19:19    49  ******************************
  83    2017-02-01 19:20    50  *******************************
 ...    ..(  8 skipped).    ..  *******************************
  92    2017-02-01 19:29    50  *******************************
  93    2017-02-01 19:30    52  *********************************
  94    2017-02-01 19:31    50  *******************************
  95    2017-02-01 19:32    52  *********************************
  96    2017-02-01 19:33    50  *******************************
  97    2017-02-01 19:34    52  *********************************
  98    2017-02-01 19:35    50  *******************************
  99    2017-02-01 19:36    52  *********************************
 ...    ..( 21 skipped).    ..  *********************************
 121    2017-02-01 19:58    52  *********************************
 122    2017-02-01 19:59    50  *******************************
 ...    ..(  6 skipped).    ..  *******************************
   1    2017-02-01 20:06    50  *******************************
   2    2017-02-01 20:07    49  ******************************
   3    2017-02-01 20:08    50  *******************************
   4    2017-02-01 20:09    50  *******************************
   5    2017-02-01 20:10    49  ******************************
   6    2017-02-01 20:11    50  *******************************
   7    2017-02-01 20:12    50  *******************************
   8    2017-02-01 20:13    49  ******************************
 ...    ..(  2 skipped).    ..  ******************************
  11    2017-02-01 20:16    49  ******************************
  12    2017-02-01 20:17    50  *******************************
  13    2017-02-01 20:18    50  *******************************
  14    2017-02-01 20:19    49  ******************************
  15    2017-02-01 20:20    50  *******************************
 ...    ..( 13 skipped).    ..  *******************************
  29    2017-02-01 20:34    50  *******************************
  30    2017-02-01 20:35    56  *************************************
  31    2017-02-01 20:36    52  *********************************
 ...    ..(  2 skipped).    ..  *********************************
  34    2017-02-01 20:39    52  *********************************
  35    2017-02-01 20:40    49  ******************************

SCT Error Recovery Control:
           Read: Disabled
          Write: Disabled

Device Statistics (GP Log 0x04)
Page  Offset Size        Value Flags Description
0x01  =====  =               =  ===  == General Statistics (rev 2) ==
0x01  0x008  4               8  ---  Lifetime Power-On Resets
0x01  0x010  4               1  ---  Power-on Hours
0x01  0x018  6        72939962  ---  Logical Sectors Written
0x01  0x020  6          310628  ---  Number of Write Commands
0x01  0x028  6        14670803  ---  Logical Sectors Read
0x01  0x030  6          465736  ---  Number of Read Commands
0x02  =====  =               =  ===  == Free-Fall Statistics (empty) ==
0x03  =====  =               =  ===  == Rotating Media Statistics (empty) ==
0x04  =====  =               =  ===  == General Errors Statistics (rev 1) ==
0x04  0x008  4               0  ---  Number of Reported Uncorrectable Errors
0x04  0x010  4               2  ---  Resets Between Cmd Acceptance and Completion
0x05  =====  =               =  ===  == Temperature Statistics (rev 1) ==
0x05  0x008  1              52  ---  Current Temperature
0x05  0x010  1               -  ---  Average Short Term Temperature
0x05  0x018  1               -  ---  Average Long Term Temperature
0x05  0x020  1               -  ---  Highest Temperature
0x05  0x028  1               -  ---  Lowest Temperature
0x05  0x030  1               -  ---  Highest Average Short Term Temperature
0x05  0x038  1               -  ---  Lowest Average Short Term Temperature
0x05  0x040  1               -  ---  Highest Average Long Term Temperature
0x05  0x048  1               -  ---  Lowest Average Long Term Temperature
0x05  0x050  4               0  ---  Time in Over-Temperature
0x05  0x058  1              85  ---  Specified Maximum Operating Temperature
0x05  0x060  4               0  ---  Time in Under-Temperature
0x05  0x068  1               0  ---  Specified Minimum Operating Temperature
0x06  =====  =               =  ===  == Transport Statistics (rev 1) ==
0x06  0x008  4            1911  ---  Number of Hardware Resets
0x06  0x018  4               0  ---  Number of Interface CRC Errors
0x07  =====  =               =  ===  == Solid State Device Statistics (rev 1) ==
0x07  0x008  1               0  ---  Percentage Used Endurance Indicator
                                |||_ C monitored condition met
                                ||__ D supports DSN
                                |___ N normalized value

SATA Phy Event Counters (GP Log 0x11)
ID      Size     Value  Description
0x0001  2            0  Command failed due to ICRC error
0x0005  2            0  R_ERR response for non-data FIS
0x000a  2            4  Device-to-host register FISes sent due to a COMRESET

