smartctl 6.6 2017-11-05 r4594 [x86_64-linux-4.19.10-VANILLA] (local build)
Copyright (C) 2002-17, Bruce Allen, Christian Franke, www.smartmontools.org

=== START OF INFORMATION SECTION ===
Device Model:     HFS128G39TND-N210A
Serial Number:    EI75N086210906205
Firmware Version: 30001P10
User Capacity:    128,035,676,160 bytes [128 GB]
Sector Sizes:     512 bytes logical, 4096 bytes physical
Rotation Rate:    Solid State Device
Form Factor:      M.2
Device is:        Not in smartctl database [for details use: -P showall]
ATA Version is:   ACS-2 (minor revision not indicated)
SATA Version is:  SATA 3.1, 6.0 Gb/s (current: 6.0 Gb/s)
Local Time is:    Tue Dec 18 12:53:39 2018 IST
SMART support is: Available - device has SMART capability.
SMART support is: Enabled
AAM feature is:   Unavailable
APM feature is:   Disabled
Rd look-ahead is: Enabled
Write cache is:   Enabled
DSN feature is:   Unavailable
ATA Security is:  Disabled, NOT FROZEN [SEC1]
Wt Cache Reorder: Unavailable

=== START OF READ SMART DATA SECTION ===
SMART overall-health self-assessment test result: PASSED

General SMART Values:
Offline data collection status:  (0x02)	Offline data collection activity
					was completed without error.
					Auto Offline Data Collection: Disabled.
Self-test execution status:      (   0)	The previous self-test routine completed
					without error or no self-test has ever 
					been run.
Total time to complete Offline 
data collection: 		(  105) seconds.
Offline data collection
capabilities: 			 (0x19) SMART execute Offline immediate.
					No Auto Offline data collection support.
					Suspend Offline collection upon new
					command.
					Offline surface scan supported.
					Self-test supported.
					No Conveyance Self-test supported.
					No Selective Self-test supported.
SMART capabilities:            (0x0002)	Does not save SMART data before
					entering power-saving mode.
					Supports SMART auto save timer.
Error logging capability:        (0x01)	Error logging supported.
					General Purpose Logging supported.
Short self-test routine 
recommended polling time: 	 (   2) minutes.
Extended self-test routine
recommended polling time: 	 (  10) minutes.

SMART Attributes Data Structure revision number: 0
Vendor Specific SMART Attributes with Thresholds:
ID# ATTRIBUTE_NAME          FLAGS    VALUE WORST THRESH FAIL RAW_VALUE
  1 Raw_Read_Error_Rate     POSR--   166   166   006    -    0
  5 Reallocated_Sector_Ct   -O--CK   253   100   036    -    0
  9 Power_On_Hours          -O--CK   098   098   000    -    2561
 12 Power_Cycle_Count       -O--CK   100   100   020    -    2253
100 Unknown_Attribute       -O--CK   100   100   000    -    2819644
168 Unknown_Attribute       -O--CK   094   094   000    -    69
169 Unknown_Attribute       -O--CK   087   087   000    -    143
171 Unknown_Attribute       -O--CK   253   253   000    -    0
172 Unknown_Attribute       -O--CK   253   253   000    -    0
174 Unknown_Attribute       ----CK   100   100   000    -    138
175 Program_Fail_Count_Chip -O--CK   253   253   000    -    0
176 Erase_Fail_Count_Chip   -O--CK   253   253   000    -    0
177 Wear_Leveling_Count     -O--CK   092   092   000    -    85
178 Used_Rsvd_Blk_Cnt_Chip  -O--CK   100   100   000    -    25
179 Used_Rsvd_Blk_Cnt_Tot   -O--CK   100   100   000    -    124
180 Unused_Rsvd_Blk_Cnt_Tot -O--CK   100   100   000    -    2516
184 End-to-End_Error        -O--CK   253   253   000    -    0
187 Reported_Uncorrect      -O--CK   253   253   000    -    0
188 Command_Timeout         -O--CK   253   253   000    -    0
194 Temperature_Celsius     -O----   040   000   000    -    40 (Min/Max 20/60)
195 Hardware_ECC_Recovered  -O--CK   253   253   000    -    0
196 Reallocated_Event_Count -O--CK   253   100   036    -    0
198 Offline_Uncorrectable   -O--CK   253   253   000    -    0
199 UDMA_CRC_Error_Count    -O--CK   253   253   000    -    0
204 Soft_ECC_Correction     -OSR--   100   001   000    -    96
212 Unknown_Attribute       -O--CK   253   253   000    -    0
234 Unknown_Attribute       -O--CK   100   100   000    -    11799
241 Total_LBAs_Written      -O--CK   100   100   000    -    3590
242 Total_LBAs_Read         -O--CK   100   100   000    -    2701
250 Read_Error_Retry_Rate   -O--CK   100   100   000    -    12292160
                            ||||||_ K auto-keep
                            |||||__ C event count
                            ||||___ R error rate
                            |||____ S speed/performance
                            ||_____ O updated online
                            |______ P prefailure warning

General Purpose Log Directory Version 1
SMART           Log Directory Version 1 [multi-sector log support]
Address    Access  R/W   Size  Description
0x00       GPL,SL  R/O      1  Log Directory
0x01           SL  R/O      1  Summary SMART error log
0x02           SL  R/O      4  Comprehensive SMART error log
0x03       GPL     R/O      5  Ext. Comprehensive SMART error log
0x04       GPL,SL  R/O      8  Device Statistics log
0x06           SL  R/O      1  SMART self-test log
0x07       GPL     R/O      2  Extended self-test log
0x10       GPL     R/O      1  NCQ Command Error log
0x11       GPL     R/O      1  SATA Phy Event Counters log
0x30       GPL     R/O      8  IDENTIFY DEVICE data log
0x80-0x9f  GPL,SL  R/W     16  Host vendor specific log

SMART Extended Comprehensive Error Log Version: 1 (5 sectors)
No Errors Logged

SMART Extended Self-test Log Version: 1 (2 sectors)
Num  Test_Description    Status                  Remaining  LifeTime(hours)  LBA_of_first_error
# 1  Short offline       Completed without error       00%      2561         -
# 2  Short offline       Completed without error       00%      2561         -
# 3  Short offline       Completed without error       00%      1034         -
# 4  Short offline       Completed without error       00%        15         -

Selective Self-tests/Logging not supported

SCT Commands not supported

Device Statistics (GP Log 0x04)
Page  Offset Size        Value Flags Description
0x01  =====  =               =  ===  == General Statistics (empty) ==
0x04  =====  =               =  ===  == General Errors Statistics (empty) ==
0x05  =====  =               =  ===  == Temperature Statistics (empty) ==
0x06  =====  =               =  ===  == Transport Statistics (empty) ==
0x07  =====  =               =  ===  == Solid State Device Statistics (empty) ==
                                |||_ C monitored condition met
                                ||__ D supports DSN
                                |___ N normalized value

Pending Defects log (GP Log 0x0c) not supported

SATA Phy Event Counters (GP Log 0x11)
ID      Size     Value  Description
0x0001  2            0  Command failed due to ICRC error
0x000a  2            2  Device-to-host register FISes sent due to a COMRESET

