smartctl 7.4 2023-08-01 r5530 [x86_64-linux-6.1.106-Unraid] (local build)
Copyright (C) 2002-23, Bruce Allen, Christian Franke, www.smartmontools.org

=== START OF INFORMATION SECTION ===
Device Model:     ST18000NM000J-2TV103
Firmware Version: SN02
User Capacity:    18,000,207,937,536 bytes [18.0 TB]
Sector Sizes:     512 bytes logical, 4096 bytes physical
Rotation Rate:    7200 rpm
Form Factor:      3.5 inches
Device is:        Not in smartctl database 7.3/5610
ATA Version is:   ACS-4 (minor revision not indicated)
SATA Version is:  SATA 3.3, 6.0 Gb/s (current: 6.0 Gb/s)
Local Time is:    Tue Sep  3 11:53:26 2024 CDT
SMART support is: Available - device has SMART capability.
SMART support is: Enabled
AAM feature is:   Unavailable
APM feature is:   Unavailable
Rd look-ahead is: Enabled
Write cache is:   Enabled
DSN feature is:   Disabled
ATA Security is:  Disabled, frozen [SEC2]
Write SCT (Get) Feature Control Command failed: scsi error badly formed scsi parameters
Wt Cache Reorder: Unknown (SCT Feature Control command failed)

=== START OF READ SMART DATA SECTION ===
SMART overall-health self-assessment test result: PASSED

General SMART Values:
Offline data collection status:  (0x82)	Offline data collection activity
					was completed without error.
					Auto Offline Data Collection: Enabled.
Self-test execution status:      (   0)	The previous self-test routine completed
					without error or no self-test has ever 
					been run.
Total time to complete Offline 
data collection: 		(  559) seconds.
Offline data collection
capabilities: 			 (0x7b) SMART execute Offline immediate.
					Auto Offline data collection on/off support.
					Suspend Offline collection upon new
					command.
					Offline surface scan supported.
					Self-test supported.
					Conveyance Self-test supported.
					Selective Self-test supported.
SMART capabilities:            (0x0003)	Saves SMART data before entering
					power-saving mode.
					Supports SMART auto save timer.
Error logging capability:        (0x01)	Error logging supported.
					General Purpose Logging supported.
Short self-test routine 
recommended polling time: 	 (   1) minutes.
Extended self-test routine
recommended polling time: 	 (1529) minutes.
Conveyance self-test routine
recommended polling time: 	 (   2) minutes.
SCT capabilities: 	       (0x70bd)	SCT Status supported.
					SCT Error Recovery Control supported.
					SCT Feature Control supported.
					SCT Data Table supported.

SMART Attributes Data Structure revision number: 10
Vendor Specific SMART Attributes with Thresholds:
ID# ATTRIBUTE_NAME          FLAGS    VALUE WORST THRESH FAIL RAW_VALUE
  1 Raw_Read_Error_Rate     POSR--   083   064   044    -    214768136
  3 Spin_Up_Time            PO----   091   090   000    -    0
  4 Start_Stop_Count        -O--CK   099   099   020    -    1462
  5 Reallocated_Sector_Ct   PO--CK   100   100   010    -    0
  7 Seek_Error_Rate         POSR--   087   060   045    -    502215992
  9 Power_On_Hours          -O--CK   083   083   000    -    15073
 10 Spin_Retry_Count        PO--C-   100   100   097    -    0
 12 Power_Cycle_Count       -O--CK   100   100   020    -    41
 18 Unknown_Attribute       PO-R--   100   100   050    -    0
187 Reported_Uncorrect      -O--CK   100   100   000    -    0
188 Command_Timeout         -O--CK   100   100   000    -    0
190 Airflow_Temperature_Cel -O---K   061   054   000    -    39 (Min/Max 29/39)
192 Power-Off_Retract_Count -O--CK   100   100   000    -    24
193 Load_Cycle_Count        -O--CK   097   097   000    -    6393
194 Temperature_Celsius     -O---K   039   046   000    -    39 (0 20 0 0 0)
197 Current_Pending_Sector  -O--C-   100   100   000    -    0
198 Offline_Uncorrectable   ----C-   100   100   000    -    0
199 UDMA_CRC_Error_Count    -OSRCK   200   200   000    -    0
200 Multi_Zone_Error_Rate   PO---K   100   100   001    -    0
240 Head_Flying_Hours       ------   100   253   000    -    3180 (242 28 0)
241 Total_LBAs_Written      ------   100   253   000    -    179999051952
242 Total_LBAs_Read         ------   100   253   000    -    1045355750376
                            ||||||_ K auto-keep
                            |||||__ C event count
                            ||||___ R error rate
                            |||____ S speed/performance
                            ||_____ O updated online
                            |______ P prefailure warning

General Purpose Log Directory Version 1
SMART           Log Directory Version 1 [multi-sector log support]
Address    Access  R/W   Size  Description
0x00       GPL,SL  R/O      1  Log Directory
0x01           SL  R/O      1  Summary SMART error log
0x02           SL  R/O      5  Comprehensive SMART error log
0x03       GPL     R/O      5  Ext. Comprehensive SMART error log
0x04       GPL     R/O    256  Device Statistics log
0x04       SL      R/O      8  Device Statistics log
0x06           SL  R/O      1  SMART self-test log
0x07       GPL     R/O      1  Extended self-test log
0x08       GPL     R/O      2  Power Conditions log
0x09           SL  R/W      1  Selective self-test log
0x0a       GPL     R/W      8  Device Statistics Notification
0x0c       GPL     R/O   2048  Pending Defects log
0x10       GPL     R/O      1  NCQ Command Error log
0x11       GPL     R/O      1  SATA Phy Event Counters log
0x13       GPL     R/O      1  SATA NCQ Send and Receive log
0x21       GPL     R/O      1  Write stream error log
0x22       GPL     R/O      1  Read stream error log
0x24       GPL     R/O    768  Current Device Internal Status Data log
0x2f       GPL     R/O      1  Set Sector Configuration
0x30       GPL,SL  R/O      9  IDENTIFY DEVICE data log
0x80-0x9f  GPL,SL  R/W     16  Host vendor specific log
0xa1       GPL,SL  VS     160  Device vendor specific log
0xa2       GPL     VS   16320  Device vendor specific log
0xa4       GPL,SL  VS     160  Device vendor specific log
0xa6       GPL     VS     192  Device vendor specific log
0xa8-0xa9  GPL,SL  VS     136  Device vendor specific log
0xab       GPL     VS       1  Device vendor specific log
0xad       GPL     VS      16  Device vendor specific log
0xb1       GPL,SL  VS     160  Device vendor specific log
0xb6       GPL     VS    1920  Device vendor specific log
0xbe-0xbf  GPL     VS   65535  Device vendor specific log
0xc1       GPL,SL  VS       8  Device vendor specific log
0xc3       GPL,SL  VS      24  Device vendor specific log
0xc6       GPL     VS    5184  Device vendor specific log
0xc7       GPL,SL  VS       8  Device vendor specific log
0xc9       GPL,SL  VS       8  Device vendor specific log
0xca       GPL,SL  VS      16  Device vendor specific log
0xcd       GPL,SL  VS       1  Device vendor specific log
0xce       GPL     VS       1  Device vendor specific log
0xcf       GPL     VS     512  Device vendor specific log
0xd1       GPL     VS     656  Device vendor specific log
0xd2       GPL     VS   10256  Device vendor specific log
0xd4       GPL     VS    2048  Device vendor specific log
0xda       GPL,SL  VS       1  Device vendor specific log
0xe0       GPL,SL  R/W      1  SCT Command/Status
0xe1       GPL,SL  R/W      1  SCT Data Transfer

SMART Extended Comprehensive Error Log Version: 1 (5 sectors)
No Errors Logged

SMART Extended Self-test Log Version: 1 (1 sectors)
Num  Test_Description    Status                  Remaining  LifeTime(hours)  LBA_of_first_error
# 1  Short offline       Completed without error       00%     15073         -

SMART Selective self-test log data structure revision number 1
 SPAN  MIN_LBA  MAX_LBA  CURRENT_TEST_STATUS
    1        0        0  Not_testing
    2        0        0  Not_testing
    3        0        0  Not_testing
    4        0        0  Not_testing
    5        0        0  Not_testing
Selective self-test flags (0x0):
  After scanning selected spans, do NOT read-scan remainder of disk.
If Selective self-test is pending on power-up, resume after 0 minute delay.

SCT Status Version:                  3
SCT Version (vendor specific):       522 (0x020a)
Device State:                        Active (0)
Current Temperature:                    39 Celsius
Power Cycle Min/Max Temperature:     29/39 Celsius
Lifetime    Min/Max Temperature:     20/46 Celsius
Under/Over Temperature Limit Count:   0/0
SMART Status:                        0xc24f (PASSED)
Vendor specific:
00 00 00 00 00 00 00 00 00 00 00 00 00 00 00 00
00 00 00 00 02 00 00 00 00 00 00 00 00 00 00 00

SCT Temperature History Version:     2
Temperature Sampling Period:         4 minutes
Temperature Logging Interval:        59 minutes
Min/Max recommended Temperature:     10/40 Celsius
Min/Max Temperature Limit:            5/60 Celsius
Temperature History Size (Index):    128 (12)

Index    Estimated Time   Temperature Celsius
  13    2024-08-29 06:51    30  ***********
  14    2024-08-29 07:50    28  *********
  15    2024-08-29 08:49    27  ********
  16    2024-08-29 09:48    26  *******
  17    2024-08-29 10:47    29  **********
  18    2024-08-29 11:46    26  *******
  19    2024-08-29 12:45    26  *******
  20    2024-08-29 13:44    32  *************
  21    2024-08-29 14:43    31  ************
  22    2024-08-29 15:42    28  *********
  23    2024-08-29 16:41    25  ******
  24    2024-08-29 17:40    26  *******
  25    2024-08-29 18:39    30  ***********
  26    2024-08-29 19:38    28  *********
  27    2024-08-29 20:37    28  *********
  28    2024-08-29 21:36    28  *********
  29    2024-08-29 22:35    27  ********
  30    2024-08-29 23:34    26  *******
 ...    ..(  6 skipped).    ..  *******
  37    2024-08-30 06:27    26  *******
  38    2024-08-30 07:26    27  ********
  39    2024-08-30 08:25    28  *********
  40    2024-08-30 09:24    28  *********
  41    2024-08-30 10:23    27  ********
  42    2024-08-30 11:22    27  ********
  43    2024-08-30 12:21    26  *******
  44    2024-08-30 13:20    32  *************
  45    2024-08-30 14:19    32  *************
  46    2024-08-30 15:18    30  ***********
  47    2024-08-30 16:17    26  *******
  48    2024-08-30 17:16    25  ******
  49    2024-08-30 18:15    26  *******
  50    2024-08-30 19:14    26  *******
  51    2024-08-30 20:13    27  ********
  52    2024-08-30 21:12    28  *********
  53    2024-08-30 22:11    28  *********
  54    2024-08-30 23:10    29  **********
  55    2024-08-31 00:09    28  *********
  56    2024-08-31 01:08    27  ********
 ...    ..(  4 skipped).    ..  ********
  61    2024-08-31 06:03    27  ********
  62    2024-08-31 07:02    26  *******
  63    2024-08-31 08:01    26  *******
  64    2024-08-31 09:00    27  ********
 ...    ..(  2 skipped).    ..  ********
  67    2024-08-31 11:57    27  ********
  68    2024-08-31 12:56    32  *************
  69    2024-08-31 13:55    32  *************
  70    2024-08-31 14:54    32  *************
  71    2024-08-31 15:53    28  *********
  72    2024-08-31 16:52    28  *********
  73    2024-08-31 17:51    36  *****************
  74    2024-08-31 18:50    37  ******************
  75    2024-08-31 19:49    38  *******************
 ...    ..(  5 skipped).    ..  *******************
  81    2024-09-01 01:43    38  *******************
  82    2024-09-01 02:42    39  ********************
 ...    ..(  5 skipped).    ..  ********************
  88    2024-09-01 08:36    39  ********************
  89    2024-09-01 09:35    38  *******************
  90    2024-09-01 10:34    37  ******************
  91    2024-09-01 11:33    37  ******************
  92    2024-09-01 12:32    37  ******************
  93    2024-09-01 13:31    36  *****************
 ...    ..(  3 skipped).    ..  *****************
  97    2024-09-01 17:27    36  *****************
  98    2024-09-01 18:26    35  ****************
  99    2024-09-01 19:25    36  *****************
 ...    ..(  3 skipped).    ..  *****************
 103    2024-09-01 23:21    36  *****************
 104    2024-09-02 00:20     ?  -
 105    2024-09-02 01:19    29  **********
 106    2024-09-02 02:18     ?  -
 107    2024-09-02 03:17    35  ****************
 108    2024-09-02 04:16     ?  -
 109    2024-09-02 05:15    36  *****************
 110    2024-09-02 06:14     ?  -
 111    2024-09-02 07:13    34  ***************
 112    2024-09-02 08:12     ?  -
 113    2024-09-02 09:11    35  ****************
 114    2024-09-02 10:10     ?  -
 115    2024-09-02 11:09    36  *****************
 116    2024-09-02 12:08     ?  -
 117    2024-09-02 13:07    36  *****************
 118    2024-09-02 14:06    32  *************
 119    2024-09-02 15:05     ?  -
 120    2024-09-02 16:04    32  *************
 121    2024-09-02 17:03     ?  -
 122    2024-09-02 18:02    35  ****************
 123    2024-09-02 19:01     ?  -
 124    2024-09-02 20:00    37  ******************
 125    2024-09-02 20:59    33  **************
 126    2024-09-02 21:58    29  **********
 127    2024-09-02 22:57     ?  -
   0    2024-09-02 23:56    29  **********
   1    2024-09-03 00:55    38  *******************
   2    2024-09-03 01:54    39  ********************
 ...    ..(  9 skipped).    ..  ********************
  12    2024-09-03 11:44    39  ********************

SCT Error Recovery Control:
           Read:    100 (10.0 seconds)
          Write:    100 (10.0 seconds)

Device Statistics (GP Log 0x04)
Page  Offset Size        Value Flags Description
0x01  =====  =               =  ===  == General Statistics (rev 1) ==
0x01  0x008  4              41  ---  Lifetime Power-On Resets
0x01  0x010  4           15073  ---  Power-on Hours
0x01  0x018  6    179996564256  ---  Logical Sectors Written
0x01  0x020  6       292151587  ---  Number of Write Commands
0x01  0x028  6   1045324691491  ---  Logical Sectors Read
0x01  0x030  6      1108502763  ---  Number of Read Commands
0x01  0x038  6               -  ---  Date and Time TimeStamp
0x03  =====  =               =  ===  == Rotating Media Statistics (rev 1) ==
0x03  0x008  4            4820  ---  Spindle Motor Power-on Hours
0x03  0x010  4            3455  ---  Head Flying Hours
0x03  0x018  4            6393  ---  Head Load Events
0x03  0x020  4               0  ---  Number of Reallocated Logical Sectors
0x03  0x028  4               0  ---  Read Recovery Attempts
0x03  0x030  4               0  ---  Number of Mechanical Start Failures
0x03  0x038  4               0  ---  Number of Realloc. Candidate Logical Sectors
0x03  0x040  4              24  ---  Number of High Priority Unload Events
0x04  =====  =               =  ===  == General Errors Statistics (rev 1) ==
0x04  0x008  4               0  ---  Number of Reported Uncorrectable Errors
0x04  0x010  4               0  ---  Resets Between Cmd Acceptance and Completion
0x04  0x018  4               0  -D-  Physical Element Status Changed
0x05  =====  =               =  ===  == Temperature Statistics (rev 1) ==
0x05  0x008  1              39  ---  Current Temperature
0x05  0x010  1              36  ---  Average Short Term Temperature
0x05  0x018  1              34  ---  Average Long Term Temperature
0x05  0x020  1              46  ---  Highest Temperature
0x05  0x028  1              22  ---  Lowest Temperature
0x05  0x030  1              44  ---  Highest Average Short Term Temperature
0x05  0x038  1              25  ---  Lowest Average Short Term Temperature
0x05  0x040  1              36  ---  Highest Average Long Term Temperature
0x05  0x048  1              28  ---  Lowest Average Long Term Temperature
0x05  0x050  4               0  ---  Time in Over-Temperature
0x05  0x058  1              60  ---  Specified Maximum Operating Temperature
0x05  0x060  4               0  ---  Time in Under-Temperature
0x05  0x068  1               5  ---  Specified Minimum Operating Temperature
0x06  =====  =               =  ===  == Transport Statistics (rev 1) ==
0x06  0x008  4              62  ---  Number of Hardware Resets
0x06  0x010  4              32  ---  Number of ASR Events
0x06  0x018  4               0  ---  Number of Interface CRC Errors
0xff  =====  =               =  ===  == Vendor Specific Statistics (rev 1) ==
0xff  0x008  7               0  ---  Vendor Specific
0xff  0x010  7               0  ---  Vendor Specific
0xff  0x018  7               0  ---  Vendor Specific
                                |||_ C monitored condition met
                                ||__ D supports DSN
                                |___ N normalized value

Pending Defects log (GP Log 0x0c)
No Defects Logged

SATA Phy Event Counters (GP Log 0x11)
ID      Size     Value  Description
0x000a  2            3  Device-to-host register FISes sent due to a COMRESET
0x0001  2            0  Command failed due to ICRC error
0x0003  2            0  R_ERR response for device-to-host data FIS
0x0004  2            0  R_ERR response for host-to-device data FIS
0x0006  2            0  R_ERR response for device-to-host non-data FIS
0x0007  2            0  R_ERR response for host-to-device non-data FIS

Seagate FARM log (GP Log 0xa6) supported [try: -l farm]

