smartctl 7.2 2020-12-30 r5155 [x86_64-linux-5.10.0-23-amd64] (local build)
Copyright (C) 2002-20, Bruce Allen, Christian Franke, www.smartmontools.org

=== START OF INFORMATION SECTION ===
Device Model:     SanDisk Portable SSD
Serial Number:    23191M441707
LU WWN Device Id: 5 001b44 4a583546a
Firmware Version: UM5004RL
User Capacity:    2.000.398.934.016 bytes [2,00 TB]
Sector Size:      512 bytes logical/physical
Rotation Rate:    Solid State Device
Form Factor:      M.2
TRIM Command:     Available, deterministic
Device is:        Not in smartctl database [for details use: -P showall]
ATA Version is:   ACS-3, ACS-2 T13/2015-D revision 3
SATA Version is:  SATA 3.2, 6.0 Gb/s (current: 6.0 Gb/s)
Local Time is:    Sat Sep  2 15:20:08 2023 CEST
SMART support is: Available - device has SMART capability.
SMART support is: Enabled

=== START OF READ SMART DATA SECTION ===
SMART overall-health self-assessment test result: PASSED

General SMART Values:
Offline data collection status:  (0x00)	Offline data collection activity
					was never started.
					Auto Offline Data Collection: Disabled.
Self-test execution status:      (   0)	The previous self-test routine completed
					without error or no self-test has ever 
					been run.
Total time to complete Offline 
data collection: 		(  120) seconds.
Offline data collection
capabilities: 			 (0x11) SMART execute Offline immediate.
					No Auto Offline data collection support.
					Suspend Offline collection upon new
					command.
					No Offline surface scan supported.
					Self-test supported.
					No Conveyance Self-test supported.
					No Selective Self-test supported.
SMART capabilities:            (0x0003)	Saves SMART data before entering
					power-saving mode.
					Supports SMART auto save timer.
Error logging capability:        (0x01)	Error logging supported.
					General Purpose Logging supported.
Short self-test routine 
recommended polling time: 	 (   2) minutes.
Extended self-test routine
recommended polling time: 	 ( 255) minutes.

SMART Attributes Data Structure revision number: 1
Vendor Specific SMART Attributes with Thresholds:
ID# ATTRIBUTE_NAME          FLAG     VALUE WORST THRESH TYPE      UPDATED  WHEN_FAILED RAW_VALUE
  5 Reallocated_Sector_Ct   0x0032   100   100   000    Old_age   Always       -       0
  9 Power_On_Hours          0x0032   100   100   000    Old_age   Always       -       2
 12 Power_Cycle_Count       0x0032   100   100   000    Old_age   Always       -       11
165 Unknown_Attribute       0x0032   100   100   000    Old_age   Always       -       0
166 Unknown_Attribute       0x0032   100   100   ---    Old_age   Always       -       0
167 Unknown_Attribute       0x0032   100   100   ---    Old_age   Always       -       54
168 Unknown_Attribute       0x0032   100   100   ---    Old_age   Always       -       0
169 Unknown_Attribute       0x0032   100   100   ---    Old_age   Always       -       1039
170 Unknown_Attribute       0x0032   100   100   ---    Old_age   Always       -       0
171 Unknown_Attribute       0x0032   100   100   000    Old_age   Always       -       0
172 Unknown_Attribute       0x0032   100   100   000    Old_age   Always       -       0
173 Unknown_Attribute       0x0032   100   100   000    Old_age   Always       -       0
174 Unknown_Attribute       0x0032   100   100   000    Old_age   Always       -       6
184 End-to-End_Error        0x0032   100   100   ---    Old_age   Always       -       0
187 Reported_Uncorrect      0x0032   100   100   000    Old_age   Always       -       0
188 Command_Timeout         0x0032   100   100   ---    Old_age   Always       -       0
194 Temperature_Celsius     0x0022   058   047   000    Old_age   Always       -       42 (Min/Max 20/47)
199 UDMA_CRC_Error_Count    0x0032   100   100   ---    Old_age   Always       -       0
230 Unknown_SSD_Attribute   0x0032   100   100   000    Old_age   Always       -       0
232 Available_Reservd_Space 0x0033   100   100   005    Pre-fail  Always       -       100
233 Media_Wearout_Indicator 0x0032   100   100   ---    Old_age   Always       -       0
234 Unknown_Attribute       0x0032   100   100   000    Old_age   Always       -       0
241 Total_LBAs_Written      0x0030   100   100   000    Old_age   Offline      -       0
242 Total_LBAs_Read         0x0030   100   100   000    Old_age   Offline      -       0
244 Unknown_Attribute       0x0032   000   100   ---    Old_age   Always       -       0

SMART Error Log Version: 1
No Errors Logged

SMART Self-test log structure revision number 1
No self-tests have been logged.  [To run self-tests, use: smartctl -t]

Selective Self-tests/Logging not supported

