smartctl 7.2 2021-09-14 r5236 [FreeBSD 12.3-STABLE amd64] (local build)
Copyright (C) 2002-20, Bruce Allen, Christian Franke, www.smartmontools.org

=== START OF INFORMATION SECTION ===
Device Model:     STT_FTM8GL25V
Serial Number:    P628649-A1J3-511A002
Firmware Version: 090928S
User Capacity:    8,061,419,520 bytes [8.06 GB]
Sector Size:      512 bytes logical/physical
Rotation Rate:    Solid State Device
TRIM Command:     Unavailable
Device is:        Not in smartctl database [for details use: -P showall]
ATA Version is:   ATA/ATAPI-7 (minor revision not indicated)
Local Time is:    Tue Jun  7 15:57:46 2022 JST
SMART support is: Available - device has SMART capability.
SMART support is: Enabled
AAM feature is:   Unavailable
APM feature is:   Unavailable
Rd look-ahead is: Enabled
Write cache is:   Unavailable
DSN feature is:   Unavailable
ATA Security is:  Unavailable
Wt Cache Reorder: Unavailable

=== START OF READ SMART DATA SECTION ===
SMART overall-health self-assessment test result: PASSED

General SMART Values:
Offline data collection status:  (0x00)	Offline data collection activity
					was never started.
					Auto Offline Data Collection: Disabled.
Total time to complete Offline 
data collection: 		(    0) seconds.
Offline data collection
capabilities: 			 (0x00) 	Offline data collection not supported.
SMART capabilities:            (0x0003)	Saves SMART data before entering
					power-saving mode.
					Supports SMART auto save timer.
Error logging capability:        (0x00)	Error logging NOT supported.
					No General Purpose Logging support.

SMART Attributes Data Structure revision number: 1280
Vendor Specific SMART Attributes with Thresholds:
ID# ATTRIBUTE_NAME          FLAGS    VALUE WORST THRESH FAIL RAW_VALUE
 12 Power_Cycle_Count       -O--CK   100   100   000    -    61
  9 Power_On_Hours          -O--CK   100   100   000    -    0
194 Temperature_Celsius     POS---   032   100   000    -    0
229 Unknown_Attribute       -O----   100   000   000    -    259986015180268
232 Available_Reservd_Space -O----   100   048   000    -    4639407288377
233 Media_Wearout_Indicator -O----   100   000   000    -    0
234 Unknown_Attribute       -O----   100   000   000    -    901959941121
235 Unknown_Attribute       -O----   100   000   000    -    4026596367
                            ||||||_ K auto-keep
                            |||||__ C event count
                            ||||___ R error rate
                            |||____ S speed/performance
                            ||_____ O updated online
                            |______ P prefailure warning

General Purpose Log Directory not supported

SMART Log Directory Version 16
Address    Access  R/W   Size  Description
0x00           SL  R/O      1  Log Directory
0x01           SL  R/O     12  Summary SMART error log
0x07           SL  R/O      9  Extended self-test log
0x0d           SL  R/O    194  LPS Mis-alignment log
0x13           SL  R/O    229  SATA NCQ Send and Receive log
0x19           SL  R/O    232  LBA Status log
0x1f           SL  -      233  Reserved
0x25           SL  R/O    234  Saved Device Internal Status Data log
0x2b           SL  -      235  Reserved

SMART Extended Comprehensive Error Log (GP Log 0x03) not supported

SMART Error Log Version: 16
No Errors Logged

SMART Extended Self-test Log (GP Log 0x07) not supported

SMART Self-test Log not supported

Selective Self-tests/Logging not supported

SCT Commands not supported

Device Statistics (GP/SMART Log 0x04) not supported

Pending Defects log (GP Log 0x0c) not supported

SATA Phy Event Counters (GP Log 0x11) not supported

