smartctl 6.2 2013-07-26 r3841 [x86_64-linux-3.10.0-514.26.2.el7.x86_64] (local build)
Copyright (C) 2002-13, Bruce Allen, Christian Franke, www.smartmontools.org

=== START OF INFORMATION SECTION ===
Device Model:     D2RSTK251M11-0100.C
Serial Number:    A20YA011308000035
LU WWN Device Id: 5 e83a97 059bfb0b9
Firmware Version: 3.22E
User Capacity:    100,030,242,816 bytes [100 GB]
Sector Size:      512 bytes logical/physical
Rotation Rate:    Solid State Device
Device is:        Not in smartctl database [for details use: -P showall]
ATA Version is:   ATA8-ACS, ACS-2 T13/2015-D revision 3
SATA Version is:  SATA 3.0, 6.0 Gb/s (current: 3.0 Gb/s)
Local Time is:    Mon Aug 28 09:29:22 2017 EDT
SMART support is: Available - device has SMART capability.
SMART support is: Enabled
AAM feature is:   Unavailable
APM level is:     254 (maximum performance)
Rd look-ahead is: Disabled
Write cache is:   Enabled
ATA Security is:  Disabled, frozen [SEC2]
Unexpected SCT status 0x0010 (action_code=4, function_code=2)
Wt Cache Reorder: N/A

=== START OF READ SMART DATA SECTION ===
SMART overall-health self-assessment test result: PASSED

General SMART Values:
Offline data collection status:  (0x02)	Offline data collection activity
					was completed without error.
					Auto Offline Data Collection: Disabled.
Self-test execution status:      (   0)	The previous self-test routine completed
					without error or no self-test has ever 
					been run.
Total time to complete Offline 
data collection: 		(    0) seconds.
Offline data collection
capabilities: 			 (0x7b) SMART execute Offline immediate.
					Auto Offline data collection on/off support.
					Suspend Offline collection upon new
					command.
					Offline surface scan supported.
					Self-test supported.
					Conveyance Self-test supported.
					Selective Self-test supported.
SMART capabilities:            (0x0003)	Saves SMART data before entering
					power-saving mode.
					Supports SMART auto save timer.
Error logging capability:        (0x01)	Error logging supported.
					General Purpose Logging supported.
Short self-test routine 
recommended polling time: 	 (   1) minutes.
Extended self-test routine
recommended polling time: 	 (  48) minutes.
Conveyance self-test routine
recommended polling time: 	 (   2) minutes.
SCT capabilities: 	       (0x0025)	SCT Status supported.
					SCT Data Table supported.

SMART Attributes Data Structure revision number: 10
Vendor Specific SMART Attributes with Thresholds:
ID# ATTRIBUTE_NAME          FLAGS    VALUE WORST THRESH FAIL RAW_VALUE
  1 Raw_Read_Error_Rate     PO--CK   108   108   050    -    18966225
  5 Reallocated_Sector_Ct   PO--CK   100   100   003    -    0
  9 Power_On_Hours          -O--CK   074   074   000    -    22809 (109 132 0)
 12 Power_Cycle_Count       -O--CK   100   100   000    -    94
 13 Read_Soft_Error_Rate    -O--CK   050   050   000    -    46063543215825
100 Unknown_Attribute       -O--CK   000   000   000    -    282
170 Unknown_Attribute       POSR-K+  000   000   000    -    16960
171 Unknown_Attribute       -O-R--   000   000   000    -    0
172 Unknown_Attribute       -O--CK   000   000   000    -    0
174 Unknown_Attribute       ----CK   000   000   000    -    94
177 Wear_Leveling_Count     ------   000   000   000    -    0
181 Program_Fail_Cnt_Total  -O-R--   000   000   000    -    0
182 Erase_Fail_Count_Total  -O--CK   000   000   000    -    0
184 End-to-End_Error        ------   100   100   090    -    0
187 Reported_Uncorrect      --SRC-   100   100   000    -    0
194 Temperature_Celsius     -O---K   030   030   000    -    30 (Min/Max 30/30)
195 Hardware_ECC_Recovered  --SRC-   120   120   000    -    18966225
196 Reallocated_Event_Count PO--CK   100   100   003    -    0
198 Offline_Uncorrectable   ----C-   108   108   000    -    113047834198016
199 UDMA_CRC_Error_Count    --S---   200   200   000    -    0
201 Unknown_SSD_Attribute   --SRC-   120   120   000    -    18966225
204 Soft_ECC_Correction     --SRC-   120   120   000    -    18966225
230 Unknown_SSD_Attribute   PO--C-   100   100   000    -    281470681743460
231 Temperature_Celsius     PO--C-   080   080   010    -    73014444033
232 Available_Reservd_Space -O--CK   000   000   000    -    33
233 Media_Wearout_Indicator -O--CK   000   000   000    -    211
234 Unknown_Attribute       -O--CK   000   000   000    -    157
235 Unknown_Attribute       PO--CK   100   100   002    -    0
241 Total_LBAs_Written      -O--CK   000   000   000    -    157
242 Total_LBAs_Read         -O--CK   000   000   000    -    226
                            ||||||_ K auto-keep
                            |||||__ C event count
                            ||||___ R error rate
                            |||____ S speed/performance
                            ||_____ O updated online
                            |______ P prefailure warning

General Purpose Log Directory Version 1
SMART           Log Directory Version 1 [multi-sector log support]
Address    Access  R/W   Size  Description
0x00       GPL,SL  R/O      1  Log Directory
0x03       GPL     R/O     16  Ext. Comprehensive SMART error log
0x07       GPL     R/O      1  Extended self-test log
0x09           SL  R/W      1  Selective self-test log
0x10       GPL     R/O      1  NCQ Command Error log
0x11       GPL,SL  R/O      1  SATA Phy Event Counters
0x80-0x9f  GPL,SL  R/W     16  Host vendor specific log
0xa8       GPL,SL  VS      16  Device vendor specific log
0xb7       GPL,SL  VS      16  Device vendor specific log
0xe0       GPL,SL  R/W      1  SCT Command/Status
0xe1       GPL,SL  R/W      1  SCT Data Transfer

SMART Extended Comprehensive Error Log Version: 1 (16 sectors)
No Errors Logged

SMART Extended Self-test Log Version: 1 (1 sectors)
Num  Test_Description    Status                  Remaining  LifeTime(hours)  LBA_of_first_error
# 1  Short offline       Self-test routine in progress 20%     22809         -
# 2  Short offline       Self-test routine in progress 30%     22809         -
# 3  Short offline       Self-test routine in progress 60%     22809         -

SMART Selective self-test log data structure revision number 1
 SPAN  MIN_LBA  MAX_LBA  CURRENT_TEST_STATUS
    1        0        0  Not_testing
    2        0        0  Not_testing
    3        0        0  Not_testing
    4        0        0  Not_testing
    5        0        0  Not_testing
Selective self-test flags (0x0):
  After scanning selected spans, do NOT read-scan remainder of disk.
If Selective self-test is pending on power-up, resume after 0 minute delay.

SCT Status Version:                  3
SCT Version (vendor specific):       0 (0x0000)
SCT Support Level:                   1
Device State:                        Active (0)
Current Temperature:                    30 Celsius
Power Cycle Min/Max Temperature:     30/30 Celsius
Lifetime    Min/Max Temperature:     30/30 Celsius
Under/Over Temperature Limit Count:   0/0
SCT Temperature History Version:     2
Temperature Sampling Period:         0 minutes
Temperature Logging Interval:        0 minutes
Min/Max recommended Temperature:      ?/ ? Celsius
Min/Max Temperature Limit:            ?/ ? Celsius
Temperature History Size (Index):    478 (1)

Index    Estimated Time   Temperature Celsius
   2    2017-08-28 01:32     ?  -
 ...    ..(476 skipped).    ..  -
   1    2017-08-28 09:29     ?  -

SCT Error Recovery Control command not supported

Device Statistics (GP Log 0x04) not supported

SATA Phy Event Counters (GP Log 0x11)
ID      Size     Value  Description
0x0001  2            0  Command failed due to ICRC error
0x0003  2            0  R_ERR response for device-to-host data FIS
0x0004  2            0  R_ERR response for host-to-device data FIS
0x0006  2            0  R_ERR response for device-to-host non-data FIS
0x0007  2            0  R_ERR response for host-to-device non-data FIS
0x0008  2            0  Device-to-host non-data FIS retries
0x0009  2           17  Transition from drive PhyRdy to drive PhyNRdy
0x000a  2           18  Device-to-host register FISes sent due to a COMRESET
0x000f  2            0  R_ERR response for host-to-device data FIS, CRC
0x0010  2            0  R_ERR response for host-to-device data FIS, non-CRC
0x0012  2            0  R_ERR response for host-to-device non-data FIS, CRC
0x0013  2            0  R_ERR response for host-to-device non-data FIS, non-CRC
0x0002  2            0  R_ERR response for data FIS
0x0005  2            0  R_ERR response for non-data FIS
0x000b  2            0  CRC errors within host-to-device FIS
0x000d  2            0  Non-CRC errors within host-to-device FIS

