smartctl 6.4 2014-10-07 r4002 [x86_64-linux-3.16.0-4vpsville1-amd64] (local build)
Copyright (C) 2002-14, Bruce Allen, Christian Franke, www.smartmontools.org

=== START OF INFORMATION SECTION ===
Device Model:     Micron_5100_MTFDDAK240TCC
Firmware Version: D0MU027
User Capacity:    240 057 409 536 bytes [240 GB]
Sector Sizes:     512 bytes logical, 4096 bytes physical
Rotation Rate:    Solid State Device
Form Factor:      2.5 inches
Device is:        Not in smartctl database [for details use: -P showall]
ATA Version is:   ACS-3 T13/2161-D revision 5
SATA Version is:  SATA 3.2, 6.0 Gb/s (current: 3.0 Gb/s)
Local Time is:    Tue Jun 27 01:28:50 2017 MSK
SMART support is: Available - device has SMART capability.
SMART support is: Enabled
AAM feature is:   Unavailable
APM level is:     254 (maximum performance)
Rd look-ahead is: Enabled
Write cache is:   Enabled
ATA Security is:  Disabled, NOT FROZEN [SEC1]
Wt Cache Reorder: Enabled

=== START OF READ SMART DATA SECTION ===
SMART overall-health self-assessment test result: PASSED

General SMART Values:
Offline data collection status:  (0x00)	Offline data collection activity
					was never started.
					Auto Offline Data Collection: Disabled.
Self-test execution status:      (   0)	The previous self-test routine completed
					without error or no self-test has ever 
					been run.
Total time to complete Offline 
data collection: 		(  837) seconds.
Offline data collection
capabilities: 			 (0x7b) SMART execute Offline immediate.
					Auto Offline data collection on/off support.
					Suspend Offline collection upon new
					command.
					Offline surface scan supported.
					Self-test supported.
					Conveyance Self-test supported.
					Selective Self-test supported.
SMART capabilities:            (0x0003)	Saves SMART data before entering
					power-saving mode.
					Supports SMART auto save timer.
Error logging capability:        (0x01)	Error logging supported.
					General Purpose Logging supported.
Short self-test routine 
recommended polling time: 	 (   2) minutes.
Extended self-test routine
recommended polling time: 	 (   5) minutes.
Conveyance self-test routine
recommended polling time: 	 (   3) minutes.
SCT capabilities: 	       (0x0035)	SCT Status supported.
					SCT Feature Control supported.
					SCT Data Table supported.

SMART Attributes Data Structure revision number: 16
Vendor Specific SMART Attributes with Thresholds:
ID# ATTRIBUTE_NAME          FLAGS    VALUE WORST THRESH FAIL RAW_VALUE
  1 Raw_Read_Error_Rate     POSR-K   100   100   050    -    0
  5 Reallocated_Sector_Ct   -O--CK   100   100   001    -    0
  9 Power_On_Hours          -O--CK   100   100   001    -    293
 12 Power_Cycle_Count       -O--CK   100   100   001    -    1
170 Unknown_Attribute       PO--CK   100   100   010    -    0
171 Unknown_Attribute       -O--CK   100   100   000    -    0
172 Unknown_Attribute       -O--CK   100   100   001    -    0
173 Unknown_Attribute       -O--CK   100   100   000    -    2
174 Unknown_Attribute       -O--CK   100   100   000    -    0
183 Runtime_Bad_Block       -O--CK   100   100   000    -    0
184 End-to-End_Error        -O--CK   100   100   000    -    0
187 Reported_Uncorrect      -O--CK   100   100   000    -    0
188 Command_Timeout         -O--CK   100   100   000    -    1
194 Temperature_Celsius     -O---K   065   059   000    -    35 (Min/Max 24/41)
195 Hardware_ECC_Recovered  -O--CK   100   100   000    -    0
196 Reallocated_Event_Count -O--CK   100   100   000    -    0
197 Current_Pending_Sector  -O--CK   100   100   000    -    0
198 Offline_Uncorrectable   ----CK   100   100   000    -    0
199 UDMA_CRC_Error_Count    -O--CK   100   100   000    -    2
202 Unknown_SSD_Attribute   ----CK   100   100   001    -    0
206 Unknown_SSD_Attribute   -OSR--   100   100   000    -    0
246 Unknown_Attribute       -O--CK   100   100   000    -    1897872402
247 Unknown_Attribute       -O--CK   100   100   000    -    81454850
248 Unknown_Attribute       -O--CK   100   100   000    -    5004477
180 Unused_Rsvd_Blk_Cnt_Tot PO--CK   000   000   000    -    8870
210 Unknown_Attribute       -O--CK   100   100   000    -    0
                            ||||||_ K auto-keep
                            |||||__ C event count
                            ||||___ R error rate
                            |||____ S speed/performance
                            ||_____ O updated online
                            |______ P prefailure warning

General Purpose Log Directory Version 1
SMART           Log Directory Version 1 [multi-sector log support]
Address    Access  R/W   Size  Description
0x00       GPL,SL  R/O      1  Log Directory
0x01           SL  R/O      1  Summary SMART error log
0x02           SL  R/O     51  Comprehensive SMART error log
0x03       GPL     R/O  16383  Ext. Comprehensive SMART error log
0x04       GPL,SL  R/O      8  Device Statistics log
0x06           SL  R/O      1  SMART self-test log
0x07       GPL     R/O      1  Extended self-test log
0x09           SL  R/W      1  Selective self-test log
0x10       GPL     R/O      1  SATA NCQ Queued Error log
0x11       GPL     R/O      1  SATA Phy Event Counters log
0x13       GPL     R/O      1  SATA NCQ Send and Receive log
0x24       GPL     R/O   8000  Current Device Internal Status Data log
0x25       GPL     R/O   8000  Saved Device Internal Status Data log
0x30       GPL,SL  R/O      9  IDENTIFY DEVICE data log
0x80-0x9f  GPL,SL  R/W     16  Host vendor specific log
0xa0       GPL     VS   35328  Device vendor specific log
0xa1       GPL,SL  VS       3  Device vendor specific log
0xa3       GPL     VS   13824  Device vendor specific log
0xa4       GPL     VS     354  Device vendor specific log
0xa4       SL      VS      98  Device vendor specific log
0xa5       GPL     VS    8000  Device vendor specific log
0xa5       SL      VS      64  Device vendor specific log
0xa6       GPL     VS    8000  Device vendor specific log
0xa6       SL      VS      64  Device vendor specific log
0xe0       GPL,SL  R/W      1  SCT Command/Status
0xe1       GPL,SL  R/W      1  SCT Data Transfer

SMART Extended Comprehensive Error Log size 16383 not supported

SMART Error Log Version: 1
No Errors Logged

SMART Extended Self-test Log Version: 1 (1 sectors)
No self-tests have been logged.  [To run self-tests, use: smartctl -t]

SMART Selective self-test log data structure revision number 1
 SPAN  MIN_LBA  MAX_LBA  CURRENT_TEST_STATUS
    1        0        0  Not_testing
    2        0        0  Not_testing
    3        0        0  Not_testing
    4        0        0  Not_testing
    5        0        0  Not_testing
Selective self-test flags (0x0):
  After scanning selected spans, do NOT read-scan remainder of disk.
If Selective self-test is pending on power-up, resume after 0 minute delay.

SCT Status Version:                  3
SCT Version (vendor specific):       1 (0x0001)
SCT Support Level:                   0
Device State:                        Active (0)
Current Temperature:                    35 Celsius
Power Cycle Min/Max Temperature:     24/41 Celsius
Lifetime    Min/Max Temperature:     24/41 Celsius
Under/Over Temperature Limit Count:   0/0

SCT Temperature History Version:     2
Temperature Sampling Period:         1 minute
Temperature Logging Interval:        1 minute
Min/Max recommended Temperature:      0/70 Celsius
Min/Max Temperature Limit:           -5/75 Celsius
Temperature History Size (Index):    478 (190)

Index    Estimated Time   Temperature Celsius
 191    2017-06-26 17:31     ?  -
 ...    ..(288 skipped).    ..  -
   2    2017-06-26 22:20     ?  -
   3    2017-06-26 22:21    28  *********
   4    2017-06-26 22:22    29  **********
   5    2017-06-26 22:23    30  ***********
   6    2017-06-26 22:24    31  ************
   7    2017-06-26 22:25    32  *************
   8    2017-06-26 22:26    32  *************
   9    2017-06-26 22:27    32  *************
  10    2017-06-26 22:28    33  **************
 ...    ..(  9 skipped).    ..  **************
  20    2017-06-26 22:38    33  **************
  21    2017-06-26 22:39    32  *************
  22    2017-06-26 22:40    32  *************
  23    2017-06-26 22:41    35  ****************
  24    2017-06-26 22:42    35  ****************
  25    2017-06-26 22:43    36  *****************
  26    2017-06-26 22:44    35  ****************
 ...    ..(  8 skipped).    ..  ****************
  35    2017-06-26 22:53    35  ****************
  36    2017-06-26 22:54    36  *****************
  37    2017-06-26 22:55    36  *****************
  38    2017-06-26 22:56    35  ****************
 ...    ..( 24 skipped).    ..  ****************
  63    2017-06-26 23:21    35  ****************
  64    2017-06-26 23:22    36  *****************
  65    2017-06-26 23:23    35  ****************
 ...    ..(  2 skipped).    ..  ****************
  68    2017-06-26 23:26    35  ****************
  69    2017-06-26 23:27    36  *****************
  70    2017-06-26 23:28    39  ********************
  71    2017-06-26 23:29    37  ******************
  72    2017-06-26 23:30    33  **************
  73    2017-06-26 23:31    33  **************
  74    2017-06-26 23:32    36  *****************
  75    2017-06-26 23:33    35  ****************
  76    2017-06-26 23:34    33  **************
  77    2017-06-26 23:35    33  **************
  78    2017-06-26 23:36    34  ***************
  79    2017-06-26 23:37    34  ***************
  80    2017-06-26 23:38    32  *************
  81    2017-06-26 23:39    33  **************
  82    2017-06-26 23:40    34  ***************
 ...    ..(  3 skipped).    ..  ***************
  86    2017-06-26 23:44    34  ***************
  87    2017-06-26 23:45    33  **************
  88    2017-06-26 23:46    34  ***************
 ...    ..(  2 skipped).    ..  ***************
  91    2017-06-26 23:49    34  ***************
  92    2017-06-26 23:50    31  ************
  93    2017-06-26 23:51    31  ************
  94    2017-06-26 23:52    32  *************
  95    2017-06-26 23:53    32  *************
  96    2017-06-26 23:54    31  ************
  97    2017-06-26 23:55    31  ************
  98    2017-06-26 23:56    32  *************
  99    2017-06-26 23:57    32  *************
 100    2017-06-26 23:58    36  *****************
 101    2017-06-26 23:59    36  *****************
 102    2017-06-27 00:00    35  ****************
 ...    ..(  4 skipped).    ..  ****************
 107    2017-06-27 00:05    35  ****************
 108    2017-06-27 00:06    36  *****************
 109    2017-06-27 00:07    34  ***************
 110    2017-06-27 00:08    35  ****************
 111    2017-06-27 00:09    35  ****************
 112    2017-06-27 00:10    35  ****************
 113    2017-06-27 00:11    36  *****************
 114    2017-06-27 00:12    35  ****************
 115    2017-06-27 00:13    35  ****************
 116    2017-06-27 00:14    36  *****************
 117    2017-06-27 00:15    35  ****************
 118    2017-06-27 00:16    35  ****************
 119    2017-06-27 00:17    36  *****************
 120    2017-06-27 00:18    34  ***************
 121    2017-06-27 00:19    36  *****************
 122    2017-06-27 00:20    35  ****************
 123    2017-06-27 00:21    36  *****************
 124    2017-06-27 00:22    35  ****************
 125    2017-06-27 00:23    35  ****************
 126    2017-06-27 00:24    35  ****************
 127    2017-06-27 00:25    34  ***************
 ...    ..(  2 skipped).    ..  ***************
 130    2017-06-27 00:28    34  ***************
 131    2017-06-27 00:29    35  ****************
 132    2017-06-27 00:30    35  ****************
 133    2017-06-27 00:31    34  ***************
 134    2017-06-27 00:32    36  *****************
 135    2017-06-27 00:33    36  *****************
 136    2017-06-27 00:34    35  ****************
 137    2017-06-27 00:35    35  ****************
 138    2017-06-27 00:36    37  ******************
 139    2017-06-27 00:37    37  ******************
 140    2017-06-27 00:38    36  *****************
 141    2017-06-27 00:39    36  *****************
 142    2017-06-27 00:40    34  ***************
 ...    ..(  4 skipped).    ..  ***************
 147    2017-06-27 00:45    34  ***************
 148    2017-06-27 00:46    35  ****************
 149    2017-06-27 00:47    35  ****************
 150    2017-06-27 00:48    35  ****************
 151    2017-06-27 00:49    36  *****************
 152    2017-06-27 00:50    36  *****************
 153    2017-06-27 00:51    36  *****************
 154    2017-06-27 00:52    35  ****************
 ...    ..(  3 skipped).    ..  ****************
 158    2017-06-27 00:56    35  ****************
 159    2017-06-27 00:57    36  *****************
 160    2017-06-27 00:58    34  ***************
 161    2017-06-27 00:59    35  ****************
 162    2017-06-27 01:00    36  *****************
 163    2017-06-27 01:01    35  ****************
 ...    ..(  6 skipped).    ..  ****************
 170    2017-06-27 01:08    35  ****************
 171    2017-06-27 01:09    33  **************
 172    2017-06-27 01:10    36  *****************
 173    2017-06-27 01:11    34  ***************
 174    2017-06-27 01:12    34  ***************
 175    2017-06-27 01:13    35  ****************
 176    2017-06-27 01:14    36  *****************
 177    2017-06-27 01:15    35  ****************
 178    2017-06-27 01:16    35  ****************
 179    2017-06-27 01:17    35  ****************
 180    2017-06-27 01:18    34  ***************
 181    2017-06-27 01:19    35  ****************
 182    2017-06-27 01:20    35  ****************
 183    2017-06-27 01:21    36  *****************
 184    2017-06-27 01:22    34  ***************
 185    2017-06-27 01:23    35  ****************
 186    2017-06-27 01:24    35  ****************
 187    2017-06-27 01:25    34  ***************
 188    2017-06-27 01:26    36  *****************
 189    2017-06-27 01:27    35  ****************
 190    2017-06-27 01:28    35  ****************

SCT Error Recovery Control command not supported

Device Statistics (GP Log 0x04)
Page Offset Size         Value  Description
  1  =====  =                =  == General Statistics (rev 1) ==
  1  0x008  4                1  Lifetime Power-On Resets
  1  0x010  4              293  Power-on Hours
  1  0x018  6       1897872402  Logical Sectors Written
  1  0x020  6        103157695  Number of Write Commands
  1  0x028  6        226326087  Logical Sectors Read
  1  0x030  6          7636858  Number of Read Commands
  1  0x038  6       1055580000  Date and Time TimeStamp
  4  =====  =                =  == General Errors Statistics (rev 1) ==
  4  0x008  4                0  Number of Reported Uncorrectable Errors
  4  0x010  4                1  Resets Between Cmd Acceptance and Completion
  5  =====  =                =  == Temperature Statistics (rev 1) ==
  5  0x008  1               35  Current Temperature
  5  0x010  1                -  Average Short Term Temperature
  5  0x018  1                -  Average Long Term Temperature
  5  0x020  1               41  Highest Temperature
  5  0x028  1               24  Lowest Temperature
  5  0x030  1                -  Highest Average Short Term Temperature
  5  0x038  1                -  Lowest Average Short Term Temperature
  5  0x040  1                -  Highest Average Long Term Temperature
  5  0x048  1                -  Lowest Average Long Term Temperature
  5  0x050  4                0  Time in Over-Temperature
  5  0x058  1               70  Specified Maximum Operating Temperature
  5  0x060  4                0  Time in Under-Temperature
  5  0x068  1                0  Specified Minimum Operating Temperature
  6  =====  =                =  == Transport Statistics (rev 1) ==
  6  0x008  4                8  Number of Hardware Resets
  6  0x010  4                1  Number of ASR Events
  6  0x018  4                2  Number of Interface CRC Errors
  7  =====  =                =  == Solid State Device Statistics (rev 1) ==
  7  0x008  1                0~ Percentage Used Endurance Indicator
                              |_ ~ normalized value

SATA Phy Event Counters (GP Log 0x11)
ID      Size     Value  Description
0x0001  4            2  Command failed due to ICRC error
0x0003  4            0  R_ERR response for device-to-host data FIS
0x0004  4            2  R_ERR response for host-to-device data FIS
0x0006  4            0  R_ERR response for device-to-host non-data FIS
0x000a  4            8  Device-to-host register FISes sent due to a COMRESET
0x000b  4            2  CRC errors within host-to-device FIS
0x000d  4            0  Non-CRC errors within host-to-device FIS

