smartctl 6.2 2013-07-26 r3841 [x86_64-linux-3.10.0-514.26.2.el7.x86_64] (local build)
Copyright (C) 2002-13, Bruce Allen, Christian Franke, www.smartmontools.org

=== START OF INFORMATION SECTION ===
Device Model:     TOSHIBA MG04ACA400EY
Firmware Version: FQ1B
User Capacity:    4,000,787,030,016 bytes [4.00 TB]
Sector Sizes:     512 bytes logical, 4096 bytes physical
Rotation Rate:    7200 rpm
Device is:        Not in smartctl database [for details use: -P showall]
ATA Version is:   ATA8-ACS (minor revision not indicated)
SATA Version is:  SATA 3.0, 6.0 Gb/s (current: 6.0 Gb/s)
Local Time is:    Tue Sep 12 09:35:42 2017 CEST
SMART support is: Available - device has SMART capability.
SMART support is: Enabled
AAM feature is:   Unavailable
APM level is:     254 (maximum performance)
Rd look-ahead is: Enabled
Write cache is:   Enabled
ATA Security is:  Unavailable
Wt Cache Reorder: Enabled

=== START OF READ SMART DATA SECTION ===
SMART overall-health self-assessment test result: PASSED

General SMART Values:
Offline data collection status:  (0x82)	Offline data collection activity
					was completed without error.
					Auto Offline Data Collection: Enabled.
Self-test execution status:      (   0)	The previous self-test routine completed
					without error or no self-test has ever 
					been run.
Total time to complete Offline 
data collection: 		(  120) seconds.
Offline data collection
capabilities: 			 (0x5b) SMART execute Offline immediate.
					Auto Offline data collection on/off support.
					Suspend Offline collection upon new
					command.
					Offline surface scan supported.
					Self-test supported.
					No Conveyance Self-test supported.
					Selective Self-test supported.
SMART capabilities:            (0x0003)	Saves SMART data before entering
					power-saving mode.
					Supports SMART auto save timer.
Error logging capability:        (0x01)	Error logging supported.
					General Purpose Logging supported.
Short self-test routine 
recommended polling time: 	 (   2) minutes.
Extended self-test routine
recommended polling time: 	 ( 481) minutes.
SCT capabilities: 	       (0x003d)	SCT Status supported.
					SCT Error Recovery Control supported.
					SCT Feature Control supported.
					SCT Data Table supported.

SMART Attributes Data Structure revision number: 16
Vendor Specific SMART Attributes with Thresholds:
ID# ATTRIBUTE_NAME          FLAGS    VALUE WORST THRESH FAIL RAW_VALUE
  1 Raw_Read_Error_Rate     PO-R--   100   100   050    -    0
  2 Throughput_Performance  P-S---   100   100   050    -    0
  3 Spin_Up_Time            POS--K   100   100   001    -    6748
  4 Start_Stop_Count        -O--CK   100   100   000    -    11
  5 Reallocated_Sector_Ct   PO--CK   100   100   050    -    0
  7 Seek_Error_Rate         PO-R--   100   100   050    -    0
  8 Seek_Time_Performance   P-S---   100   100   050    -    0
  9 Power_On_Hours          -O--CK   100   100   000    -    118
 10 Spin_Retry_Count        PO--CK   100   100   030    -    0
 12 Power_Cycle_Count       -O--CK   100   100   000    -    10
191 G-Sense_Error_Rate      -O--CK   100   100   000    -    0
192 Power-Off_Retract_Count -O--CK   100   100   000    -    6
193 Load_Cycle_Count        -O--CK   100   100   000    -    11
194 Temperature_Celsius     -O---K   100   100   000    -    44 (Min/Max 23/47)
196 Reallocated_Event_Count -O--CK   100   100   000    -    0
197 Current_Pending_Sector  -O--CK   100   100   000    -    0
198 Offline_Uncorrectable   ----CK   100   100   000    -    0
199 UDMA_CRC_Error_Count    -O--CK   200   200   000    -    0
220 Disk_Shift              -O----   100   100   000    -    0
222 Loaded_Hours            -O--CK   100   100   000    -    118
223 Load_Retry_Count        -O--CK   100   100   000    -    0
224 Load_Friction           -O---K   100   100   000    -    0
226 Load-in_Time            -OS--K   100   100   000    -    566
240 Head_Flying_Hours       P-----   100   100   001    -    0
                            ||||||_ K auto-keep
                            |||||__ C event count
                            ||||___ R error rate
                            |||____ S speed/performance
                            ||_____ O updated online
                            |______ P prefailure warning

General Purpose Log Directory Version 1
SMART           Log Directory Version 1 [multi-sector log support]
Address    Access  R/W   Size  Description
0x00       GPL,SL  R/O      1  Log Directory
0x01           SL  R/O      1  Summary SMART error log
0x02           SL  R/O     51  Comprehensive SMART error log
0x03       GPL     R/O     64  Ext. Comprehensive SMART error log
0x04       GPL,SL  R/O      8  Device Statistics log
0x06           SL  R/O      1  SMART self-test log
0x07       GPL     R/O      1  Extended self-test log
0x08       GPL     R/O      2  Power Conditions log
0x09           SL  R/W      1  Selective self-test log
0x10       GPL     R/O      1  NCQ Command Error log
0x11       GPL     R/O      1  SATA Phy Event Counters
0x24       GPL     R/O  12288  Current Device Internal Status Data log
0x30       GPL,SL  R/O      9  IDENTIFY DEVICE data log
0x80-0x9f  GPL,SL  R/W     16  Host vendor specific log
0xa7       GPL     VS       8  Device vendor specific log
0xe0       GPL,SL  R/W      1  SCT Command/Status
0xe1       GPL,SL  R/W      1  SCT Data Transfer

SMART Extended Comprehensive Error Log Version: 1 (64 sectors)
No Errors Logged

SMART Extended Self-test Log Version: 1 (1 sectors)
Num  Test_Description    Status                  Remaining  LifeTime(hours)  LBA_of_first_error
# 1  Short offline       Completed without error       00%       118         -
# 2  Short offline       Completed without error       00%         1         -
# 3  Short offline       Completed without error       00%         0         -

SMART Selective self-test log data structure revision number 1
 SPAN  MIN_LBA  MAX_LBA  CURRENT_TEST_STATUS
    1        0        0  Not_testing
    2        0        0  Not_testing
    3        0        0  Not_testing
    4        0        0  Not_testing
    5        0        0  Not_testing
Selective self-test flags (0x0):
  After scanning selected spans, do NOT read-scan remainder of disk.
If Selective self-test is pending on power-up, resume after 0 minute delay.

SCT Status Version:                  3
SCT Version (vendor specific):       1 (0x0001)
SCT Support Level:                   1
Device State:                        Active (0)
Current Temperature:                    44 Celsius
Power Cycle Min/Max Temperature:     37/45 Celsius
Lifetime    Min/Max Temperature:     23/47 Celsius
Under/Over Temperature Limit Count:   0/0
SCT Temperature History Version:     2
Temperature Sampling Period:         1 minute
Temperature Logging Interval:        1 minute
Min/Max recommended Temperature:      5/55 Celsius
Min/Max Temperature Limit:            5/55 Celsius
Temperature History Size (Index):    478 (347)

Index    Estimated Time   Temperature Celsius
 348    2017-09-12 01:38    40  *********************
 ...    ..(  2 skipped).    ..  *********************
 351    2017-09-12 01:41    40  *********************
 352    2017-09-12 01:42    41  **********************
 353    2017-09-12 01:43    41  **********************
 354    2017-09-12 01:44    40  *********************
 355    2017-09-12 01:45    41  **********************
 356    2017-09-12 01:46    40  *********************
 357    2017-09-12 01:47    41  **********************
 358    2017-09-12 01:48    41  **********************
 359    2017-09-12 01:49    40  *********************
 360    2017-09-12 01:50    40  *********************
 361    2017-09-12 01:51    40  *********************
 362    2017-09-12 01:52    41  **********************
 363    2017-09-12 01:53    40  *********************
 364    2017-09-12 01:54    40  *********************
 365    2017-09-12 01:55    41  **********************
 366    2017-09-12 01:56    40  *********************
 367    2017-09-12 01:57    41  **********************
 368    2017-09-12 01:58    40  *********************
 369    2017-09-12 01:59    40  *********************
 370    2017-09-12 02:00    41  **********************
 371    2017-09-12 02:01    40  *********************
 ...    ..( 13 skipped).    ..  *********************
 385    2017-09-12 02:15    40  *********************
 386    2017-09-12 02:16    41  **********************
 387    2017-09-12 02:17    40  *********************
 ...    ..(  3 skipped).    ..  *********************
 391    2017-09-12 02:21    40  *********************
 392    2017-09-12 02:22    41  **********************
 393    2017-09-12 02:23    41  **********************
 394    2017-09-12 02:24    40  *********************
 395    2017-09-12 02:25    41  **********************
 396    2017-09-12 02:26    40  *********************
 397    2017-09-12 02:27    41  **********************
 398    2017-09-12 02:28    40  *********************
 399    2017-09-12 02:29    40  *********************
 400    2017-09-12 02:30    41  **********************
 ...    ..(  2 skipped).    ..  **********************
 403    2017-09-12 02:33    41  **********************
 404    2017-09-12 02:34    40  *********************
 405    2017-09-12 02:35    41  **********************
 406    2017-09-12 02:36    40  *********************
 407    2017-09-12 02:37    41  **********************
 408    2017-09-12 02:38    41  **********************
 409    2017-09-12 02:39    40  *********************
 410    2017-09-12 02:40    41  **********************
 ...    ..(  8 skipped).    ..  **********************
 419    2017-09-12 02:49    41  **********************
 420    2017-09-12 02:50    40  *********************
 421    2017-09-12 02:51    41  **********************
 422    2017-09-12 02:52    41  **********************
 423    2017-09-12 02:53    41  **********************
 424    2017-09-12 02:54    40  *********************
 425    2017-09-12 02:55    41  **********************
 426    2017-09-12 02:56    40  *********************
 427    2017-09-12 02:57    41  **********************
 ...    ..(  2 skipped).    ..  **********************
 430    2017-09-12 03:00    41  **********************
 431    2017-09-12 03:01    40  *********************
 432    2017-09-12 03:02    41  **********************
 433    2017-09-12 03:03    40  *********************
 434    2017-09-12 03:04    41  **********************
 435    2017-09-12 03:05    41  **********************
 436    2017-09-12 03:06    40  *********************
 437    2017-09-12 03:07    41  **********************
 438    2017-09-12 03:08    41  **********************
 439    2017-09-12 03:09    40  *********************
 440    2017-09-12 03:10    40  *********************
 441    2017-09-12 03:11    41  **********************
 442    2017-09-12 03:12    41  **********************
 443    2017-09-12 03:13    40  *********************
 444    2017-09-12 03:14    40  *********************
 445    2017-09-12 03:15    40  *********************
 446    2017-09-12 03:16    41  **********************
 447    2017-09-12 03:17    41  **********************
 448    2017-09-12 03:18    41  **********************
 449    2017-09-12 03:19    40  *********************
 450    2017-09-12 03:20    41  **********************
 451    2017-09-12 03:21    40  *********************
 452    2017-09-12 03:22    40  *********************
 453    2017-09-12 03:23    41  **********************
 ...    ..(  4 skipped).    ..  **********************
 458    2017-09-12 03:28    41  **********************
 459    2017-09-12 03:29    40  *********************
 460    2017-09-12 03:30    41  **********************
 461    2017-09-12 03:31    41  **********************
 462    2017-09-12 03:32    41  **********************
 463    2017-09-12 03:33    40  *********************
 464    2017-09-12 03:34    40  *********************
 465    2017-09-12 03:35    40  *********************
 466    2017-09-12 03:36    41  **********************
 ...    ..( 20 skipped).    ..  **********************
   9    2017-09-12 03:57    41  **********************
  10    2017-09-12 03:58    40  *********************
  11    2017-09-12 03:59    41  **********************
 ...    ..(  7 skipped).    ..  **********************
  19    2017-09-12 04:07    41  **********************
  20    2017-09-12 04:08    40  *********************
  21    2017-09-12 04:09    40  *********************
  22    2017-09-12 04:10    41  **********************
 ...    ..(  2 skipped).    ..  **********************
  25    2017-09-12 04:13    41  **********************
  26    2017-09-12 04:14    40  *********************
  27    2017-09-12 04:15    41  **********************
 ...    ..(  2 skipped).    ..  **********************
  30    2017-09-12 04:18    41  **********************
  31    2017-09-12 04:19    40  *********************
  32    2017-09-12 04:20    40  *********************
  33    2017-09-12 04:21    41  **********************
 ...    ..( 11 skipped).    ..  **********************
  45    2017-09-12 04:33    41  **********************
  46    2017-09-12 04:34    40  *********************
  47    2017-09-12 04:35    41  **********************
 ...    ..(  4 skipped).    ..  **********************
  52    2017-09-12 04:40    41  **********************
  53    2017-09-12 04:41    40  *********************
  54    2017-09-12 04:42    41  **********************
 ...    ..(  5 skipped).    ..  **********************
  60    2017-09-12 04:48    41  **********************
  61    2017-09-12 04:49    40  *********************
  62    2017-09-12 04:50    41  **********************
 ...    ..(  2 skipped).    ..  **********************
  65    2017-09-12 04:53    41  **********************
  66    2017-09-12 04:54    40  *********************
  67    2017-09-12 04:55    41  **********************
 ...    ..( 22 skipped).    ..  **********************
  90    2017-09-12 05:18    41  **********************
  91    2017-09-12 05:19    40  *********************
  92    2017-09-12 05:20    41  **********************
  93    2017-09-12 05:21    40  *********************
  94    2017-09-12 05:22    41  **********************
  95    2017-09-12 05:23    41  **********************
  96    2017-09-12 05:24    40  *********************
  97    2017-09-12 05:25    41  **********************
 ...    ..( 17 skipped).    ..  **********************
 115    2017-09-12 05:43    41  **********************
 116    2017-09-12 05:44    40  *********************
 117    2017-09-12 05:45    41  **********************
 ...    ..(  6 skipped).    ..  **********************
 124    2017-09-12 05:52    41  **********************
 125    2017-09-12 05:53    40  *********************
 126    2017-09-12 05:54    40  *********************
 127    2017-09-12 05:55    41  **********************
 ...    ..( 23 skipped).    ..  **********************
 151    2017-09-12 06:19    41  **********************
 152    2017-09-12 06:20    42  ***********************
 ...    ..( 50 skipped).    ..  ***********************
 203    2017-09-12 07:11    42  ***********************
 204    2017-09-12 07:12    43  ************************
 205    2017-09-12 07:13    43  ************************
 206    2017-09-12 07:14    42  ***********************
 ...    ..( 11 skipped).    ..  ***********************
 218    2017-09-12 07:26    42  ***********************
 219    2017-09-12 07:27    43  ************************
 220    2017-09-12 07:28    42  ***********************
 ...    ..( 16 skipped).    ..  ***********************
 237    2017-09-12 07:45    42  ***********************
 238    2017-09-12 07:46    43  ************************
 239    2017-09-12 07:47    42  ***********************
 240    2017-09-12 07:48    43  ************************
 241    2017-09-12 07:49    42  ***********************
 242    2017-09-12 07:50    42  ***********************
 243    2017-09-12 07:51    42  ***********************
 244    2017-09-12 07:52    43  ************************
 ...    ..( 73 skipped).    ..  ************************
 318    2017-09-12 09:06    43  ************************
 319    2017-09-12 09:07    44  *************************
 320    2017-09-12 09:08    43  ************************
 ...    ..( 15 skipped).    ..  ************************
 336    2017-09-12 09:24    43  ************************
 337    2017-09-12 09:25    44  *************************
 338    2017-09-12 09:26    43  ************************
 339    2017-09-12 09:27    43  ************************
 340    2017-09-12 09:28    44  *************************
 341    2017-09-12 09:29    43  ************************
 ...    ..(  3 skipped).    ..  ************************
 345    2017-09-12 09:33    43  ************************
 346    2017-09-12 09:34    44  *************************
 347    2017-09-12 09:35    44  *************************

SCT Error Recovery Control:
           Read: Disabled
          Write: Disabled

Device Statistics (GP Log 0x04)
Page Offset Size         Value  Description
  1  =====  =                =  == General Statistics (rev 2) ==
  1  0x008  4               10  Lifetime Power-On Resets
  1  0x010  4              118  Power-on Hours
  1  0x018  6       1338935899  Logical Sectors Written
  1  0x020  6          2217707  Number of Write Commands
  1  0x028  6      16022546794  Logical Sectors Read
  1  0x030  6         70308517  Number of Read Commands
  2  =====  =                =  == Free-Fall Statistics (rev 1) ==
  2  0x010  4                0  Overlimit Shock Events
  3  =====  =                =  == Rotating Media Statistics (rev 1) ==
  3  0x008  4              118  Spindle Motor Power-on Hours
  3  0x010  4              118  Head Flying Hours
  3  0x018  4               11  Head Load Events
  3  0x020  4                0  Number of Reallocated Logical Sectors
  3  0x028  4                0  Read Recovery Attempts
  3  0x030  4                0  Number of Mechanical Start Failures
  4  =====  =                =  == General Errors Statistics (rev 1) ==
  4  0x008  4                0  Number of Reported Uncorrectable Errors
  4  0x010  4                0  Resets Between Cmd Acceptance and Completion
  5  =====  =                =  == Temperature Statistics (rev 1) ==
  5  0x008  1               44  Current Temperature
  5  0x010  1               40~ Average Short Term Temperature
  5  0x018  1                -~ Average Long Term Temperature
  5  0x020  1               47  Highest Temperature
  5  0x028  1               23  Lowest Temperature
  5  0x030  1               40~ Highest Average Short Term Temperature
  5  0x038  1               39~ Lowest Average Short Term Temperature
  5  0x040  1                -~ Highest Average Long Term Temperature
  5  0x048  1                -~ Lowest Average Long Term Temperature
  5  0x050  4                0  Time in Over-Temperature
  5  0x058  1               55  Specified Maximum Operating Temperature
  5  0x060  4                0  Time in Under-Temperature
  5  0x068  1                5  Specified Minimum Operating Temperature
  6  =====  =                =  == Transport Statistics (rev 1) ==
  6  0x008  4               25  Number of Hardware Resets
  6  0x018  4                0  Number of Interface CRC Errors
  7  =====  =                =  == Solid State Device Statistics (rev 1) ==
                              |_ ~ normalized value

SATA Phy Event Counters (GP Log 0x11)
ID      Size     Value  Description
0x0001  4            0  Command failed due to ICRC error
0x0002  4            0  R_ERR response for data FIS
0x0003  4            0  R_ERR response for device-to-host data FIS
0x0004  4            0  R_ERR response for host-to-device data FIS
0x0005  4            0  R_ERR response for non-data FIS
0x0006  4            0  R_ERR response for device-to-host non-data FIS
0x0007  4            0  R_ERR response for host-to-device non-data FIS
0x0008  4            0  Device-to-host non-data FIS retries
0x0009  4            9  Transition from drive PhyRdy to drive PhyNRdy
0x000a  4            8  Device-to-host register FISes sent due to a COMRESET
0x000b  4            0  CRC errors within host-to-device FIS
0x000d  4            0  Non-CRC errors within host-to-device FIS
0x000f  4            0  R_ERR response for host-to-device data FIS, CRC
0x0010  4            0  R_ERR response for host-to-device data FIS, non-CRC
0x0012  4            0  R_ERR response for host-to-device non-data FIS, CRC
0x0013  4            0  R_ERR response for host-to-device non-data FIS, non-CRC

