smartctl 6.6 2017-11-05 r4594 [x86_64-linux-5.0.0-15-generic] (local build)
Copyright (C) 2002-17, Bruce Allen, Christian Franke, www.smartmontools.org

=== START OF INFORMATION SECTION ===
Device Model:     KINGSTON SM2280S3120G
Firmware Version: S8FM06.A
User Capacity:    120,034,123,776 bytes [120 GB]
Sector Size:      512 bytes logical/physical
Rotation Rate:    Solid State Device
Form Factor:      M.2
Device is:        Not in smartctl database [for details use: -P showall]
ATA Version is:   ATA8-ACS (minor revision not indicated)
SATA Version is:  SATA 3.2, 6.0 Gb/s (current: 6.0 Gb/s)
Local Time is:    Fri May 17 14:24:16 2019 BST
SMART support is: Available - device has SMART capability.
SMART support is: Enabled
AAM feature is:   Unavailable
APM level is:     254 (maximum performance)
Rd look-ahead is: Enabled
Write cache is:   Enabled
DSN feature is:   Unavailable
ATA Security is:  Disabled, frozen [SEC2]
Wt Cache Reorder: Unavailable

=== START OF READ SMART DATA SECTION ===
SMART overall-health self-assessment test result: PASSED

General SMART Values:
Offline data collection status:  (0x00)	Offline data collection activity
					was never started.
					Auto Offline Data Collection: Disabled.
Self-test execution status:      (   0)	The previous self-test routine completed
					without error or no self-test has ever 
					been run.
Total time to complete Offline 
data collection: 		(  255) seconds.
Offline data collection
capabilities: 			 (0x1b) SMART execute Offline immediate.
					Auto Offline data collection on/off support.
					Suspend Offline collection upon new
					command.
					Offline surface scan supported.
					Self-test supported.
					No Conveyance Self-test supported.
					No Selective Self-test supported.
SMART capabilities:            (0x0003)	Saves SMART data before entering
					power-saving mode.
					Supports SMART auto save timer.
Error logging capability:        (0x01)	Error logging supported.
					General Purpose Logging supported.
Short self-test routine 
recommended polling time: 	 (   1) minutes.
Extended self-test routine
recommended polling time: 	 (   2) minutes.

SMART Attributes Data Structure revision number: 16
Vendor Specific SMART Attributes with Thresholds:
ID# ATTRIBUTE_NAME          FLAGS    VALUE WORST THRESH FAIL RAW_VALUE
  1 Raw_Read_Error_Rate     PO-R--   100   100   050    -    0
  2 Throughput_Performance  P-S---   100   100   050    -    0
  3 Spin_Up_Time            POS---   100   100   050    -    0
  5 Reallocated_Sector_Ct   PO--C-   100   100   050    -    0
  7 Unknown_SSD_Attribute   PO-R--   100   100   050    -    0
  8 Unknown_SSD_Attribute   P-S---   100   100   050    -    0
  9 Power_On_Hours          -O--C-   100   100   000    -    9542
 10 Unknown_SSD_Attribute   PO--C-   100   100   050    -    0
 12 Power_Cycle_Count       -O--C-   100   100   000    -    179
168 Unknown_Attribute       -O--C-   100   100   000    -    76
170 Unknown_Attribute       PO----   100   100   010    -    288
173 Unknown_Attribute       -O--C-   100   100   000    -    3997780
175 Program_Fail_Count_Chip -O--C-   100   100   010    -    0
187 Reported_Uncorrect      -O--C-   100   100   000    -    0
192 Power-Off_Retract_Count -O--C-   100   100   000    -    57
194 Temperature_Celsius     PO---K   100   100   020    -    0
196 Reallocated_Event_Count -O----   100   100   000    -    0
197 Current_Pending_Sector  -O--CK   100   100   000    -    0
199 UDMA_CRC_Error_Count    PO-R--   100   100   050    -    0
218 Unknown_Attribute       PO-R--   100   100   050    -    0
233 Media_Wearout_Indicator PO-R--   100   100   000    -    4746
240 Unknown_SSD_Attribute   PO--C-   100   100   050    -    0
241 Total_LBAs_Written      -O--C-   100   100   000    -    4202
242 Total_LBAs_Read         -O--C-   100   100   000    -    297
244 Unknown_Attribute       -O----   100   100   050    -    61
245 Unknown_Attribute       -O----   100   100   050    -    84
246 Unknown_Attribute       -O----   100   100   050    -    2126936
250 Read_Error_Retry_Rate   -O----   100   100   050    -    3634
                            ||||||_ K auto-keep
                            |||||__ C event count
                            ||||___ R error rate
                            |||____ S speed/performance
                            ||_____ O updated online
                            |______ P prefailure warning

General Purpose Log Directory Version 1
SMART           Log Directory Version 1 [multi-sector log support]
Address    Access  R/W   Size  Description
0x00       GPL,SL  R/O      1  Log Directory
0x01           SL  R/O      1  Summary SMART error log
0x02           SL  R/O     51  Comprehensive SMART error log
0x03       GPL     R/O     64  Ext. Comprehensive SMART error log
0x06           SL  R/O      1  SMART self-test log
0x07       GPL     R/O      1  Extended self-test log
0x10       GPL     R/O      1  NCQ Command Error log
0x11       GPL     R/O      1  SATA Phy Event Counters log
0x30       GPL     R/O      9  IDENTIFY DEVICE data log
0x80-0x9f  GPL,SL  R/W     16  Host vendor specific log

SMART Extended Comprehensive Error Log Version: 1 (64 sectors)
No Errors Logged

SMART Extended Self-test Log Version: 1 (1 sectors)
Num  Test_Description    Status                  Remaining  LifeTime(hours)  LBA_of_first_error
# 1  Short offline       Completed without error       00%      1300         -
# 2  Short offline       Completed without error       00%      1249         -
# 3  Extended offline    Completed without error       00%      1247         -
# 4  Extended offline    Completed without error       00%      1079         -
# 5  Short offline       Completed without error       00%        11         -
# 6  Extended offline    Completed without error       00%         0         -
# 7  Short offline       Completed without error       00%      1063         -
# 8  Extended offline    Completed without error       00%      1063         -
# 9  Short offline       Completed without error       00%      1625         -
#10  Extended offline    Completed without error       00%      1617         -
#11  Short offline       Completed without error       00%       904         -
#12  Short offline       Completed without error       00%       887         -
#13  Short offline       Completed without error       00%       871         -
#14  Extended offline    Completed without error       00%       855         -
#15  Short offline       Completed without error       00%       854         -
#16  Short offline       Completed without error       00%       838         -
#17  Short offline       Completed without error       00%       822         -
#18  Short offline       Completed without error       00%       806         -
#19  Short offline       Completed without error       00%       789         -

Selective Self-tests/Logging not supported

SCT Commands not supported

Device Statistics (GP/SMART Log 0x04) not supported

Pending Defects log (GP Log 0x0c) not supported

SATA Phy Event Counters (GP Log 0x11)
ID      Size     Value  Description
0x0001  2            0  Command failed due to ICRC error
0x0003  2            0  R_ERR response for device-to-host data FIS
0x0004  2            0  R_ERR response for host-to-device data FIS
0x0006  2            0  R_ERR response for device-to-host non-data FIS
0x0007  2            0  R_ERR response for host-to-device non-data FIS
0x0008  2            0  Device-to-host non-data FIS retries
0x0009  4          207  Transition from drive PhyRdy to drive PhyNRdy
0x000a  4           32  Device-to-host register FISes sent due to a COMRESET
0x000f  2            0  R_ERR response for host-to-device data FIS, CRC
0x0010  2            0  R_ERR response for host-to-device data FIS, non-CRC
0x0012  2            0  R_ERR response for host-to-device non-data FIS, CRC
0x0013  2            0  R_ERR response for host-to-device non-data FIS, non-CRC

