smartctl 6.6 2017-11-05 r4594 [x86_64-linux-4.19.0-5-amd64] (local build)
Copyright (C) 2002-17, Bruce Allen, Christian Franke, www.smartmontools.org

=== START OF INFORMATION SECTION ===
Device Model:     TOSHIBA HDWL110
Serial Number:    X87HC2GMT
LU WWN Device Id: 5 000039 8d3b02a2c
Firmware Version: JU000A
User Capacity:    1,000,204,886,016 bytes [1.00 TB]
Sector Sizes:     512 bytes logical, 4096 bytes physical
Rotation Rate:    5400 rpm
Form Factor:      2.5 inches
Device is:        Not in smartctl database [for details use: -P showall]
ATA Version is:   ACS-3 T13/2161-D revision 5
SATA Version is:  SATA 3.3, 6.0 Gb/s (current: 3.0 Gb/s)
Local Time is:    Wed Aug 14 15:13:58 2019 BST
SMART support is: Available - device has SMART capability.
SMART support is: Enabled
AAM feature is:   Unavailable
APM level is:     254 (maximum performance)
Rd look-ahead is: Enabled
Write cache is:   Enabled
DSN feature is:   Disabled
ATA Security is:  Disabled, frozen [SEC2]
Wt Cache Reorder: Enabled

=== START OF READ SMART DATA SECTION ===
SMART overall-health self-assessment test result: PASSED

General SMART Values:
Offline data collection status:  (0x00)	Offline data collection activity
					was never started.
					Auto Offline Data Collection: Disabled.
Self-test execution status:      (   0)	The previous self-test routine completed
					without error or no self-test has ever 
					been run.
Total time to complete Offline 
data collection: 		(  120) seconds.
Offline data collection
capabilities: 			 (0x5b) SMART execute Offline immediate.
					Auto Offline data collection on/off support.
					Suspend Offline collection upon new
					command.
					Offline surface scan supported.
					Self-test supported.
					No Conveyance Self-test supported.
					Selective Self-test supported.
SMART capabilities:            (0x0003)	Saves SMART data before entering
					power-saving mode.
					Supports SMART auto save timer.
Error logging capability:        (0x01)	Error logging supported.
					General Purpose Logging supported.
Short self-test routine 
recommended polling time: 	 (   2) minutes.
Extended self-test routine
recommended polling time: 	 ( 182) minutes.
SCT capabilities: 	       (0x003d)	SCT Status supported.
					SCT Error Recovery Control supported.
					SCT Feature Control supported.
					SCT Data Table supported.

SMART Attributes Data Structure revision number: 16
Vendor Specific SMART Attributes with Thresholds:
ID# ATTRIBUTE_NAME          FLAGS    VALUE WORST THRESH FAIL RAW_VALUE
  1 Raw_Read_Error_Rate     PO-R--   100   100   050    -    0
  2 Throughput_Performance  P-S---   100   100   050    -    0
  3 Spin_Up_Time            POS--K   100   100   001    -    1364
  4 Start_Stop_Count        -O--CK   100   100   000    -    18
  5 Reallocated_Sector_Ct   PO--CK   100   100   050    -    0
  7 Seek_Error_Rate         PO-R--   100   100   050    -    0
  8 Seek_Time_Performance   P-S---   100   100   050    -    0
  9 Power_On_Hours          -O--CK   088   088   000    -    5199
 10 Spin_Retry_Count        PO--CK   100   100   030    -    0
 12 Power_Cycle_Count       -O--CK   100   100   000    -    18
191 G-Sense_Error_Rate      -O--CK   100   100   000    -    0
192 Power-Off_Retract_Count -O--CK   100   100   000    -    7
193 Load_Cycle_Count        -O--CK   100   100   000    -    2252
194 Temperature_Celsius     -O---K   100   100   000    -    30 (Min/Max 18/36)
196 Reallocated_Event_Count -O--CK   100   100   000    -    0
197 Current_Pending_Sector  -O--CK   100   100   000    -    0
198 Offline_Uncorrectable   ----CK   100   100   000    -    0
199 UDMA_CRC_Error_Count    -O--CK   200   200   000    -    0
220 Disk_Shift              -O----   100   100   000    -    0
222 Loaded_Hours            -O--CK   088   088   000    -    5080
223 Load_Retry_Count        -O--CK   100   100   000    -    0
224 Load_Friction           -O---K   100   100   000    -    0
226 Load-in_Time            -OS--K   100   100   000    -    270
240 Head_Flying_Hours       P-----   100   100   001    -    0
                            ||||||_ K auto-keep
                            |||||__ C event count
                            ||||___ R error rate
                            |||____ S speed/performance
                            ||_____ O updated online
                            |______ P prefailure warning

General Purpose Log Directory Version 1
SMART           Log Directory Version 1 [multi-sector log support]
Address    Access  R/W   Size  Description
0x00       GPL,SL  R/O      1  Log Directory
0x01           SL  R/O      1  Summary SMART error log
0x02           SL  R/O     51  Comprehensive SMART error log
0x03       GPL     R/O     64  Ext. Comprehensive SMART error log
0x04       GPL,SL  R/O      8  Device Statistics log
0x06           SL  R/O      1  SMART self-test log
0x07       GPL     R/O      1  Extended self-test log
0x09           SL  R/W      1  Selective self-test log
0x0a       GPL     R/W      2  Device Statistics Notification
0x10       GPL     R/O      1  NCQ Command Error log
0x11       GPL     R/O      1  SATA Phy Event Counters log
0x24       GPL     R/O  32768  Current Device Internal Status Data log
0x30       GPL,SL  R/O      9  IDENTIFY DEVICE data log
0x80-0x9f  GPL,SL  R/W     16  Host vendor specific log
0xa7       GPL     VS       8  Device vendor specific log
0xe0       GPL,SL  R/W      1  SCT Command/Status
0xe1       GPL,SL  R/W      1  SCT Data Transfer

SMART Extended Comprehensive Error Log Version: 1 (64 sectors)
No Errors Logged

SMART Extended Self-test Log Version: 1 (1 sectors)
No self-tests have been logged.  [To run self-tests, use: smartctl -t]

SMART Selective self-test log data structure revision number 1
 SPAN  MIN_LBA  MAX_LBA  CURRENT_TEST_STATUS
    1        0        0  Not_testing
    2        0        0  Not_testing
    3        0        0  Not_testing
    4        0        0  Not_testing
    5        0        0  Not_testing
Selective self-test flags (0x0):
  After scanning selected spans, do NOT read-scan remainder of disk.
If Selective self-test is pending on power-up, resume after 0 minute delay.

SCT Status Version:                  3
SCT Version (vendor specific):       1 (0x0001)
SCT Support Level:                   1
Device State:                        Active (0)
Current Temperature:                    30 Celsius
Power Cycle Min/Max Temperature:     25/34 Celsius
Lifetime    Min/Max Temperature:     18/36 Celsius
Under/Over Temperature Limit Count:   0/0

SCT Temperature History Version:     2
Temperature Sampling Period:         1 minute
Temperature Logging Interval:        1 minute
Min/Max recommended Temperature:      0/60 Celsius
Min/Max Temperature Limit:            0/60 Celsius
Temperature History Size (Index):    478 (264)

Index    Estimated Time   Temperature Celsius
 265    2019-08-14 07:16    27  ********
 266    2019-08-14 07:17    28  *********
 267    2019-08-14 07:18    28  *********
 268    2019-08-14 07:19    28  *********
 269    2019-08-14 07:20    27  ********
 ...    ..( 14 skipped).    ..  ********
 284    2019-08-14 07:35    27  ********
 285    2019-08-14 07:36    28  *********
 ...    ..(  6 skipped).    ..  *********
 292    2019-08-14 07:43    28  *********
 293    2019-08-14 07:44    27  ********
 294    2019-08-14 07:45    28  *********
 ...    ..(  5 skipped).    ..  *********
 300    2019-08-14 07:51    28  *********
 301    2019-08-14 07:52    27  ********
 ...    ..( 23 skipped).    ..  ********
 325    2019-08-14 08:16    27  ********
 326    2019-08-14 08:17    28  *********
 ...    ..(  3 skipped).    ..  *********
 330    2019-08-14 08:21    28  *********
 331    2019-08-14 08:22    27  ********
 ...    ..( 23 skipped).    ..  ********
 355    2019-08-14 08:46    27  ********
 356    2019-08-14 08:47    28  *********
 357    2019-08-14 08:48    28  *********
 358    2019-08-14 08:49    28  *********
 359    2019-08-14 08:50    27  ********
 ...    ..( 10 skipped).    ..  ********
 370    2019-08-14 09:01    27  ********
 371    2019-08-14 09:02    26  *******
 ...    ..(  2 skipped).    ..  *******
 374    2019-08-14 09:05    26  *******
 375    2019-08-14 09:06    27  ********
 ...    ..(  4 skipped).    ..  ********
 380    2019-08-14 09:11    27  ********
 381    2019-08-14 09:12    28  *********
 382    2019-08-14 09:13    27  ********
 ...    ..(  2 skipped).    ..  ********
 385    2019-08-14 09:16    27  ********
 386    2019-08-14 09:17    28  *********
 ...    ..(  3 skipped).    ..  *********
 390    2019-08-14 09:21    28  *********
 391    2019-08-14 09:22    27  ********
 ...    ..( 16 skipped).    ..  ********
 408    2019-08-14 09:39    27  ********
 409    2019-08-14 09:40    28  *********
 410    2019-08-14 09:41    28  *********
 411    2019-08-14 09:42    28  *********
 412    2019-08-14 09:43    27  ********
 413    2019-08-14 09:44    27  ********
 414    2019-08-14 09:45    27  ********
 415    2019-08-14 09:46    28  *********
 ...    ..(  3 skipped).    ..  *********
 419    2019-08-14 09:50    28  *********
 420    2019-08-14 09:51    27  ********
 ...    ..( 15 skipped).    ..  ********
 436    2019-08-14 10:07    27  ********
 437    2019-08-14 10:08    28  *********
 438    2019-08-14 10:09    27  ********
 439    2019-08-14 10:10    28  *********
 440    2019-08-14 10:11    28  *********
 441    2019-08-14 10:12    28  *********
 442    2019-08-14 10:13    27  ********
 443    2019-08-14 10:14    27  ********
 444    2019-08-14 10:15    27  ********
 445    2019-08-14 10:16    28  *********
 446    2019-08-14 10:17    28  *********
 447    2019-08-14 10:18    29  **********
 ...    ..(  4 skipped).    ..  **********
 452    2019-08-14 10:23    29  **********
 453    2019-08-14 10:24    28  *********
 454    2019-08-14 10:25    28  *********
 455    2019-08-14 10:26    28  *********
 456    2019-08-14 10:27    29  **********
 457    2019-08-14 10:28    28  *********
 ...    ..( 15 skipped).    ..  *********
 473    2019-08-14 10:44    28  *********
 474    2019-08-14 10:45    27  ********
 475    2019-08-14 10:46    28  *********
 476    2019-08-14 10:47    29  **********
 477    2019-08-14 10:48    28  *********
 ...    ..(  2 skipped).    ..  *********
   2    2019-08-14 10:51    28  *********
   3    2019-08-14 10:52    27  ********
 ...    ..(  3 skipped).    ..  ********
   7    2019-08-14 10:56    27  ********
   8    2019-08-14 10:57    28  *********
   9    2019-08-14 10:58    27  ********
 ...    ..( 11 skipped).    ..  ********
  21    2019-08-14 11:10    27  ********
  22    2019-08-14 11:11    28  *********
  23    2019-08-14 11:12    27  ********
 ...    ..(  3 skipped).    ..  ********
  27    2019-08-14 11:16    27  ********
  28    2019-08-14 11:17    28  *********
 ...    ..(  4 skipped).    ..  *********
  33    2019-08-14 11:22    28  *********
  34    2019-08-14 11:23    27  ********
  35    2019-08-14 11:24    27  ********
  36    2019-08-14 11:25    27  ********
  37    2019-08-14 11:26    28  *********
  38    2019-08-14 11:27    28  *********
  39    2019-08-14 11:28    27  ********
  40    2019-08-14 11:29    27  ********
  41    2019-08-14 11:30    27  ********
  42    2019-08-14 11:31    28  *********
  43    2019-08-14 11:32    28  *********
  44    2019-08-14 11:33    27  ********
  45    2019-08-14 11:34    27  ********
  46    2019-08-14 11:35    27  ********
  47    2019-08-14 11:36    28  *********
  48    2019-08-14 11:37    28  *********
  49    2019-08-14 11:38    27  ********
  50    2019-08-14 11:39    27  ********
  51    2019-08-14 11:40    28  *********
 ...    ..(  2 skipped).    ..  *********
  54    2019-08-14 11:43    28  *********
  55    2019-08-14 11:44    27  ********
  56    2019-08-14 11:45    27  ********
  57    2019-08-14 11:46    28  *********
 ...    ..(  3 skipped).    ..  *********
  61    2019-08-14 11:50    28  *********
  62    2019-08-14 11:51    27  ********
 ...    ..(  4 skipped).    ..  ********
  67    2019-08-14 11:56    27  ********
  68    2019-08-14 11:57    28  *********
  69    2019-08-14 11:58    27  ********
  70    2019-08-14 11:59    27  ********
  71    2019-08-14 12:00    27  ********
  72    2019-08-14 12:01    28  *********
  73    2019-08-14 12:02    28  *********
  74    2019-08-14 12:03    27  ********
  75    2019-08-14 12:04    27  ********
  76    2019-08-14 12:05    27  ********
  77    2019-08-14 12:06    28  *********
  78    2019-08-14 12:07    28  *********
  79    2019-08-14 12:08    28  *********
  80    2019-08-14 12:09    27  ********
  81    2019-08-14 12:10    28  *********
  82    2019-08-14 12:11    28  *********
  83    2019-08-14 12:12    28  *********
  84    2019-08-14 12:13    27  ********
  85    2019-08-14 12:14    27  ********
  86    2019-08-14 12:15    27  ********
  87    2019-08-14 12:16    28  *********
 ...    ..(  5 skipped).    ..  *********
  93    2019-08-14 12:22    28  *********
  94    2019-08-14 12:23    27  ********
  95    2019-08-14 12:24    27  ********
  96    2019-08-14 12:25    27  ********
  97    2019-08-14 12:26    28  *********
  98    2019-08-14 12:27    28  *********
  99    2019-08-14 12:28    28  *********
 100    2019-08-14 12:29    29  **********
 101    2019-08-14 12:30    28  *********
 102    2019-08-14 12:31    29  **********
 ...    ..(  4 skipped).    ..  **********
 107    2019-08-14 12:36    29  **********
 108    2019-08-14 12:37    30  ***********
 109    2019-08-14 12:38    29  **********
 110    2019-08-14 12:39    29  **********
 111    2019-08-14 12:40    30  ***********
 112    2019-08-14 12:41    30  ***********
 113    2019-08-14 12:42    29  **********
 ...    ..(  3 skipped).    ..  **********
 117    2019-08-14 12:46    29  **********
 118    2019-08-14 12:47    30  ***********
 119    2019-08-14 12:48    30  ***********
 120    2019-08-14 12:49    30  ***********
 121    2019-08-14 12:50    29  **********
 122    2019-08-14 12:51    29  **********
 123    2019-08-14 12:52    29  **********
 124    2019-08-14 12:53    28  *********
 ...    ..(  6 skipped).    ..  *********
 131    2019-08-14 13:00    28  *********
 132    2019-08-14 13:01    27  ********
 ...    ..(  4 skipped).    ..  ********
 137    2019-08-14 13:06    27  ********
 138    2019-08-14 13:07    28  *********
 139    2019-08-14 13:08    27  ********
 140    2019-08-14 13:09    27  ********
 141    2019-08-14 13:10    28  *********
 142    2019-08-14 13:11    28  *********
 143    2019-08-14 13:12    28  *********
 144    2019-08-14 13:13    27  ********
 145    2019-08-14 13:14    27  ********
 146    2019-08-14 13:15    27  ********
 147    2019-08-14 13:16    28  *********
 ...    ..(  5 skipped).    ..  *********
 153    2019-08-14 13:22    28  *********
 154    2019-08-14 13:23    27  ********
 155    2019-08-14 13:24    27  ********
 156    2019-08-14 13:25    27  ********
 157    2019-08-14 13:26    28  *********
 158    2019-08-14 13:27    28  *********
 159    2019-08-14 13:28    27  ********
 160    2019-08-14 13:29    27  ********
 161    2019-08-14 13:30    28  *********
 ...    ..(  2 skipped).    ..  *********
 164    2019-08-14 13:33    28  *********
 165    2019-08-14 13:34    27  ********
 166    2019-08-14 13:35    28  *********
 ...    ..(  7 skipped).    ..  *********
 174    2019-08-14 13:43    28  *********
 175    2019-08-14 13:44    27  ********
 176    2019-08-14 13:45    27  ********
 177    2019-08-14 13:46    28  *********
 ...    ..(  3 skipped).    ..  *********
 181    2019-08-14 13:50    28  *********
 182    2019-08-14 13:51    27  ********
 ...    ..(  4 skipped).    ..  ********
 187    2019-08-14 13:56    27  ********
 188    2019-08-14 13:57    28  *********
 189    2019-08-14 13:58    27  ********
 ...    ..(  4 skipped).    ..  ********
 194    2019-08-14 14:03    27  ********
 195    2019-08-14 14:04    26  *******
 196    2019-08-14 14:05    27  ********
 ...    ..( 10 skipped).    ..  ********
 207    2019-08-14 14:16    27  ********
 208    2019-08-14 14:17    28  *********
 ...    ..(  3 skipped).    ..  *********
 212    2019-08-14 14:21    28  *********
 213    2019-08-14 14:22    27  ********
 ...    ..(  8 skipped).    ..  ********
 222    2019-08-14 14:31    27  ********
 223    2019-08-14 14:32    28  *********
 224    2019-08-14 14:33    27  ********
 225    2019-08-14 14:34    28  *********
 226    2019-08-14 14:35    28  *********
 227    2019-08-14 14:36    28  *********
 228    2019-08-14 14:37    29  **********
 ...    ..(  2 skipped).    ..  **********
 231    2019-08-14 14:40    29  **********
 232    2019-08-14 14:41    30  ***********
 ...    ..(  7 skipped).    ..  ***********
 240    2019-08-14 14:49    30  ***********
 241    2019-08-14 14:50    31  ************
 242    2019-08-14 14:51    31  ************
 243    2019-08-14 14:52    31  ************
 244    2019-08-14 14:53    30  ***********
 ...    ..(  2 skipped).    ..  ***********
 247    2019-08-14 14:56    30  ***********
 248    2019-08-14 14:57    29  **********
 249    2019-08-14 14:58    29  **********
 250    2019-08-14 14:59    29  **********
 251    2019-08-14 15:00    30  ***********
 ...    ..( 12 skipped).    ..  ***********
 264    2019-08-14 15:13    30  ***********

SCT Error Recovery Control:
           Read: Disabled
          Write: Disabled

Device Statistics (GP Log 0x04)
Page  Offset Size        Value Flags Description
0x01  =====  =               =  ===  == General Statistics (rev 1) ==
0x01  0x008  4              18  ---  Lifetime Power-On Resets
0x01  0x010  4            5199  ---  Power-on Hours
0x01  0x018  6      1111546840  ---  Logical Sectors Written
0x01  0x020  6         9720968  ---  Number of Write Commands
0x01  0x028  6      8374237716  ---  Logical Sectors Read
0x01  0x030  6       109843133  ---  Number of Read Commands
0x01  0x038  6     18717508955  ---  Date and Time TimeStamp
0x02  =====  =               =  ===  == Free-Fall Statistics (rev 1) ==
0x02  0x010  4               0  ---  Overlimit Shock Events
0x03  =====  =               =  ===  == Rotating Media Statistics (rev 1) ==
0x03  0x008  4            5199  ---  Spindle Motor Power-on Hours
0x03  0x010  4            5080  ---  Head Flying Hours
0x03  0x018  4            2252  ---  Head Load Events
0x03  0x020  4               0  -D-  Number of Reallocated Logical Sectors
0x03  0x028  4              15  ---  Read Recovery Attempts
0x03  0x030  4               0  ---  Number of Mechanical Start Failures
0x03  0x038  4               0  ---  Number of Realloc. Candidate Logical Sectors
0x03  0x040  4               7  ---  Number of High Priority Unload Events
0x04  =====  =               =  ===  == General Errors Statistics (rev 1) ==
0x04  0x008  4               0  ---  Number of Reported Uncorrectable Errors
0x04  0x010  4               0  ---  Resets Between Cmd Acceptance and Completion
0x05  =====  =               =  ===  == Temperature Statistics (rev 1) ==
0x05  0x008  1              30  ---  Current Temperature
0x05  0x010  1              27  N--  Average Short Term Temperature
0x05  0x018  1              31  N--  Average Long Term Temperature
0x05  0x020  1              36  ---  Highest Temperature
0x05  0x028  1              18  ---  Lowest Temperature
0x05  0x030  1              34  N--  Highest Average Short Term Temperature
0x05  0x038  1              25  N--  Lowest Average Short Term Temperature
0x05  0x040  1              31  N--  Highest Average Long Term Temperature
0x05  0x048  1              27  N--  Lowest Average Long Term Temperature
0x05  0x050  4               0  ---  Time in Over-Temperature
0x05  0x058  1              60  ---  Specified Maximum Operating Temperature
0x05  0x060  4               0  ---  Time in Under-Temperature
0x05  0x068  1               0  ---  Specified Minimum Operating Temperature
0x06  =====  =               =  ===  == Transport Statistics (rev 1) ==
0x06  0x008  4             314  ---  Number of Hardware Resets
0x06  0x010  4             164  ---  Number of ASR Events
0x06  0x018  4               0  ---  Number of Interface CRC Errors
0x07  =====  =               =  ===  == Solid State Device Statistics (rev 1) ==
                                |||_ C monitored condition met
                                ||__ D supports DSN
                                |___ N normalized value

Pending Defects log (GP Log 0x0c) not supported

SATA Phy Event Counters (GP Log 0x11)
ID      Size     Value  Description
0x0001  4            0  Command failed due to ICRC error
0x0002  4            0  R_ERR response for data FIS
0x0003  4            0  R_ERR response for device-to-host data FIS
0x0004  4            0  R_ERR response for host-to-device data FIS
0x0005  4            0  R_ERR response for non-data FIS
0x0006  4            0  R_ERR response for device-to-host non-data FIS
0x0007  4            0  R_ERR response for host-to-device non-data FIS
0x0008  4            0  Device-to-host non-data FIS retries
0x0009  4           21  Transition from drive PhyRdy to drive PhyNRdy
0x000a  4           21  Device-to-host register FISes sent due to a COMRESET
0x000b  4            0  CRC errors within host-to-device FIS
0x000d  4            0  Non-CRC errors within host-to-device FIS
0x000f  4            0  R_ERR response for host-to-device data FIS, CRC
0x0010  4            0  R_ERR response for host-to-device data FIS, non-CRC
0x0012  4            0  R_ERR response for host-to-device non-data FIS, CRC
0x0013  4            0  R_ERR response for host-to-device non-data FIS, non-CRC

