smartctl 7.4 2023-08-01 r5530 [x86_64-linux-5.15.0-79-generic] (local build)
Copyright (C) 2002-23, Bruce Allen, Christian Franke, www.smartmontools.org

=== START OF INFORMATION SECTION ===
Model Number:                       Samsung SSD 980 PRO 1TB
Serial Number:                      S5P2NG0N904954B
Firmware Version:                   5B2QGXA7
PCI Vendor/Subsystem ID:            0x144d
IEEE OUI Identifier:                0x002538
Total NVM Capacity:                 1,000,204,886,016 [1.00 TB]
Unallocated NVM Capacity:           0
Controller ID:                      6
NVMe Version:                       1.3
Number of Namespaces:               1
Namespace 1 Size/Capacity:          1,000,204,886,016 [1.00 TB]
Namespace 1 Utilization:            0
Namespace 1 Formatted LBA Size:     512
Namespace 1 IEEE EUI-64:            002538 b901511d97
Local Time is:                      Fri Sep  1 10:59:16 2023 PDT
Firmware Updates (0x16):            3 Slots, no Reset required
Optional Admin Commands (0x0017):   Security Format Frmw_DL Self_Test
Optional NVM Commands (0x0057):     Comp Wr_Unc DS_Mngmt Sav/Sel_Feat Timestmp
Log Page Attributes (0x0f):         S/H_per_NS Cmd_Eff_Lg Ext_Get_Lg Telmtry_Lg
Maximum Data Transfer Size:         128 Pages
Warning  Comp. Temp. Threshold:     82 Celsius
Critical Comp. Temp. Threshold:     85 Celsius

Supported Power States
St Op     Max   Active     Idle   RL RT WL WT  Ent_Lat  Ex_Lat
 0 +     8.49W       -        -    0  0  0  0        0       0
 1 +     4.48W       -        -    1  1  1  1        0     200
 2 +     3.18W       -        -    2  2  2  2        0    1000
 3 -   0.0400W       -        -    3  3  3  3     2000    1200
 4 -   0.0050W       -        -    4  4  4  4      500    9500

Supported LBA Sizes (NSID 0x1)
Id Fmt  Data  Metadt  Rel_Perf
 0 +     512       0         0

=== START OF SMART DATA SECTION ===
SMART overall-health self-assessment test result: PASSED

SMART/Health Information (NVMe Log 0x02)
Critical Warning:                   0x00
Temperature:                        27 Celsius
Available Spare:                    100%
Available Spare Threshold:          10%
Percentage Used:                    6%
Data Units Read:                    253,955,515 [130 TB]
Data Units Written:                 153,430,233 [78.5 TB]
Host Read Commands:                 4,088,331,692
Host Write Commands:                2,718,486,433
Controller Busy Time:               1,537
Power Cycles:                       122
Power On Hours:                     962
Unsafe Shutdowns:                   45
Media and Data Integrity Errors:    0
Error Information Log Entries:      0
Warning  Comp. Temperature Time:    74
Critical Comp. Temperature Time:    0
Temperature Sensor 1:               27 Celsius
Temperature Sensor 2:               33 Celsius
Thermal Temp. 1 Transition Count:   213
Thermal Temp. 2 Transition Count:   193
Thermal Temp. 1 Total Time:         7891
Thermal Temp. 2 Total Time:         4828

Error Information (NVMe Log 0x01, 16 of 64 entries)
No Errors Logged

Self-test Log (NVMe Log 0x06)
Self-test status: No self-test in progress
Num  Test_Description  Status                       Power_on_Hours  Failing_LBA  NSID Seg SCT Code
 0   Short             Completed without error                 962            -     -   -   -    -
 1   Short             Completed without error                 962            -     -   -   -    -
 2   Short             Completed without error                 962            -     -   -   -    -
 3   Short             Completed without error                 962            -     -   -   -    -
 4   Short             Completed without error                 962            -     -   -   -    -

