smartctl 7.2 2020-12-30 r5155 [x86_64-w64-mingw32-win7-sp1] (sf-7.2-1)
Copyright (C) 2002-20, Bruce Allen, Christian Franke, www.smartmontools.org

=== START OF INFORMATION SECTION ===
Model Family:     Indilinx Barefoot 3 based SSDs
Device Model:     TOSHIBA-VT180
Serial Number:    766P60AZP8TU
LU WWN Device Id: 5 e83a97 10009853c
Firmware Version: 1.00
User Capacity:    480 103 981 056 bytes [480 GB]
Sector Size:      512 bytes logical/physical
Rotation Rate:    Solid State Device
TRIM Command:     Available
Device is:        In smartctl database [for details use: -P show]
ATA Version is:   ATA8-ACS (minor revision not indicated)
SATA Version is:  SATA 3.1, 6.0 Gb/s (current: 6.0 Gb/s)
Local Time is:    Wed Mar 03 11:35:43 2021 RTZ
SMART support is: Available - device has SMART capability.
SMART support is: Enabled
AAM feature is:   Unavailable
APM feature is:   Unavailable
Rd look-ahead is: Enabled
Write cache is:   Enabled
DSN feature is:   Unavailable
ATA Security is:  Disabled, frozen [SEC2]
Wt Cache Reorder: Unavailable

=== START OF READ SMART DATA SECTION ===
SMART overall-health self-assessment test result: PASSED

General SMART Values:
Offline data collection status:  (0x00)	Offline data collection activity
					was never started.
					Auto Offline Data Collection: Disabled.
Self-test execution status:      (   0)	The previous self-test routine completed
					without error or no self-test has ever 
					been run.
Total time to complete Offline 
data collection: 		(    0) seconds.
Offline data collection
capabilities: 			 (0x1d) SMART execute Offline immediate.
					No Auto Offline data collection support.
					Abort Offline collection upon new
					command.
					Offline surface scan supported.
					Self-test supported.
					No Conveyance Self-test supported.
					No Selective Self-test supported.
SMART capabilities:            (0x0003)	Saves SMART data before entering
					power-saving mode.
					Supports SMART auto save timer.
Error logging capability:        (0x00)	Error logging NOT supported.
					General Purpose Logging supported.
Short self-test routine 
recommended polling time: 	 (   0) minutes.
Extended self-test routine
recommended polling time: 	 (   0) minutes.

SMART Attributes Data Structure revision number: 18
Vendor Specific SMART Attributes with Thresholds:
ID# ATTRIBUTE_NAME          FLAGS    VALUE WORST THRESH FAIL RAW_VALUE
  5 Runtime_Bad_Block       ------   000   000   000    -    0
  9 Power_On_Hours          ------   100   100   000    -    6569
 12 Power_Cycle_Count       ------   100   100   000    -    1090
171 Avail_OP_Block_Count    ------   100   100   000    -    163219792
174 Pwr_Cycle_Ct_Unplanned  ------   100   100   000    -    415
190 Airflow_Temperature_Cel ------   100   100   000    -    31
195 Total_Prog_Failures     ------   100   100   000    -    0
196 Total_Erase_Failures    ------   100   100   000    -    0
197 Total_Unc_Read_Failures ------   100   100   000    -    0
208 Average_Erase_Count     ------   100   100   000    -    307
210 SATA_CRC_Error_Count    ------   100   100   000    -    3
224 In_Warranty             ------   100   100   000    -    1
225 DAS_Polarity            ------   100   100   000    -    0
226 Partial_Pfail           ------   100   100   000    -    0
233 Remaining_Lifetime_Perc ------   090   090   000    -    90
241 Host_Writes_GiB         ------   100   100   000    -    11330
242 Host_Reads_GiB          ------   100   100   000    -    20368
249 Total_NAND_Prog_Ct_GiB  ------   100   100   000    -    598754251
                            ||||||_ K auto-keep
                            |||||__ C event count
                            ||||___ R error rate
                            |||____ S speed/performance
                            ||_____ O updated online
                            |______ P prefailure warning

General Purpose Log Directory Version 1
SMART           Log Directory Version 1 [multi-sector log support]
Address    Access  R/W   Size  Description
0x00       GPL,SL  R/O      1  Log Directory
0x01       GPL,SL  R/O      1  Summary SMART error log
0x02       GPL,SL  R/O     51  Comprehensive SMART error log
0x03       GPL,SL  R/O     77  Ext. Comprehensive SMART error log
0x06       GPL,SL  R/O      1  SMART self-test log
0x07       GPL,SL  R/O      1  Extended self-test log
0x09       GPL,SL  R/W      1  Selective self-test log
0x10       GPL,SL  R/O      1  NCQ Command Error log
0x11       GPL,SL  R/O      1  SATA Phy Event Counters log
0x80-0x9f  GPL,SL  R/W     16  Host vendor specific log
0xa0       GPL,SL  VS       1  Device vendor specific log

SMART Extended Comprehensive Error Log Version: 18 (77 sectors)
No Errors Logged

SMART Extended Self-test Log Version: 1 (1 sectors)
No self-tests have been logged.  [To run self-tests, use: smartctl -t]

Selective Self-tests/Logging not supported

SCT Commands not supported

Device Statistics (GP/SMART Log 0x04) not supported

Pending Defects log (GP Log 0x0c) not supported

SATA Phy Event Counters (GP Log 0x11)
[Reserved: 0x00 0x00 0x41 0x00]
ID      Size     Value  Description

