smartctl 6.6 2017-04-01 r4418 [x86_64-linux-3.10.0-514.16.1.el7.x86_64] (local build)
Copyright (C) 2002-17, Bruce Allen, Christian Franke, www.smartmontools.org

=== START OF INFORMATION SECTION ===
Model Family:     Western Digital Elements / My Passport (USB, AF)
Device Model:     WDC WD20NMVW-11EDZS6
Serial Number:    WD-WXV1E65AEVWU
LU WWN Device Id: 5 0014ee 2b7c0f46b
Firmware Version: 01.01A01
User Capacity:    2.000.365.380.096 bytes [2,00 TB]
Sector Sizes:     512 bytes logical, 4096 bytes physical
Rotation Rate:    5200 rpm
Device is:        In smartctl database [for details use: -P show]
ATA Version is:   ACS-2 (minor revision not indicated)
SATA Version is:  SATA 3.0, 3.0 Gb/s (current: 3.0 Gb/s)
Local Time is:    Sat Apr 15 14:26:08 2017 CEST
SMART support is: Available - device has SMART capability.
SMART support is: Enabled
AAM feature is:   Unavailable
APM level is:     128 (minimum power consumption without standby)
Rd look-ahead is: Enabled
Write cache is:   Enabled
DSN feature is:   Unavailable
ATA Security is:  Disabled, NOT FROZEN [SEC1]
Wt Cache Reorder: Unknown

=== START OF READ SMART DATA SECTION ===
SMART Status not supported: Incomplete response, ATA output registers missing
SMART overall-health self-assessment test result: PASSED
Warning: This result is based on an Attribute check.

General SMART Values:
Offline data collection status:  (0x00)	Offline data collection activity
					was never started.
					Auto Offline Data Collection: Disabled.
Self-test execution status:      (   0)	The previous self-test routine completed
					without error or no self-test has ever 
					been run.
Total time to complete Offline 
data collection: 		(36720) seconds.
Offline data collection
capabilities: 			 (0x7b) SMART execute Offline immediate.
					Auto Offline data collection on/off support.
					Suspend Offline collection upon new
					command.
					Offline surface scan supported.
					Self-test supported.
					Conveyance Self-test supported.
					Selective Self-test supported.
SMART capabilities:            (0x0003)	Saves SMART data before entering
					power-saving mode.
					Supports SMART auto save timer.
Error logging capability:        (0x01)	Error logging supported.
					General Purpose Logging supported.
Short self-test routine 
recommended polling time: 	 (   2) minutes.
Extended self-test routine
recommended polling time: 	 ( 405) minutes.
Conveyance self-test routine
recommended polling time: 	 (   5) minutes.
SCT capabilities: 	       (0x7035)	SCT Status supported.
					SCT Feature Control supported.
					SCT Data Table supported.

SMART Attributes Data Structure revision number: 16
Vendor Specific SMART Attributes with Thresholds:
ID# ATTRIBUTE_NAME          FLAGS    VALUE WORST THRESH FAIL RAW_VALUE
  1 Raw_Read_Error_Rate     POSR-K   100   253   051    -    0
  3 Spin_Up_Time            POS--K   100   253   021    -    0
  4 Start_Stop_Count        -O--CK   100   100   000    -    7
  5 Reallocated_Sector_Ct   PO--CK   200   200   140    -    0
  7 Seek_Error_Rate         -OSR-K   100   253   000    -    0
  9 Power_On_Hours          -O--CK   100   100   000    -    13
 10 Spin_Retry_Count        -O--CK   100   253   000    -    0
 11 Calibration_Retry_Count -O--CK   100   253   000    -    0
 12 Power_Cycle_Count       -O--CK   100   100   000    -    6
192 Power-Off_Retract_Count -O--CK   200   200   000    -    3
193 Load_Cycle_Count        -O--CK   200   200   000    -    22
194 Temperature_Celsius     -O---K   109   109   000    -    43
196 Reallocated_Event_Count -O--CK   200   200   000    -    0
197 Current_Pending_Sector  -O--CK   200   200   000    -    0
198 Offline_Uncorrectable   ----CK   100   253   000    -    0
199 UDMA_CRC_Error_Count    -O--CK   200   200   000    -    0
200 Multi_Zone_Error_Rate   ---R--   100   253   000    -    0
                            ||||||_ K auto-keep
                            |||||__ C event count
                            ||||___ R error rate
                            |||____ S speed/performance
                            ||_____ O updated online
                            |______ P prefailure warning

General Purpose Log Directory Version 1
SMART           Log Directory Version 1 [multi-sector log support]
Address    Access  R/W   Size  Description
0x00       GPL,SL  R/O      1  Log Directory
0x01           SL  R/O      1  Summary SMART error log
0x02           SL  R/O      5  Comprehensive SMART error log
0x03       GPL     R/O      6  Ext. Comprehensive SMART error log
0x06           SL  R/O      1  SMART self-test log
0x07       GPL     R/O      1  Extended self-test log
0x09           SL  R/W      1  Selective self-test log
0x10       GPL     R/O      1  NCQ Command Error log
0x11       GPL     R/O      1  SATA Phy Event Counters log
0x80-0x9f  GPL,SL  R/W     16  Host vendor specific log
0xa0-0xa7  GPL,SL  VS      16  Device vendor specific log
0xa8-0xb6  GPL,SL  VS       1  Device vendor specific log
0xb7       GPL,SL  VS      39  Device vendor specific log
0xbd       GPL,SL  VS       1  Device vendor specific log
0xc0       GPL,SL  VS       1  Device vendor specific log
0xc1       GPL     VS      93  Device vendor specific log
0xcf       GPL     VS   65535  Device vendor specific log
0xe0       GPL,SL  R/W      1  SCT Command/Status
0xe1       GPL,SL  R/W      1  SCT Data Transfer

SMART Extended Comprehensive Error Log Version: 1 (6 sectors)
No Errors Logged

SMART Error Log Version: 1
No Errors Logged

SMART Extended Self-test Log Version: 1 (1 sectors)
No self-tests have been logged.  [To run self-tests, use: smartctl -t]

SMART Self-test log structure revision number 1
No self-tests have been logged.  [To run self-tests, use: smartctl -t]

SMART Selective self-test log data structure revision number 1
 SPAN  MIN_LBA  MAX_LBA  CURRENT_TEST_STATUS
    1        0        0  Not_testing
    2        0        0  Not_testing
    3        0        0  Not_testing
    4        0        0  Not_testing
    5        0        0  Not_testing
Selective self-test flags (0x0):
  After scanning selected spans, do NOT read-scan remainder of disk.
If Selective self-test is pending on power-up, resume after 0 minute delay.

SCT Status Version:                  3
SCT Version (vendor specific):       258 (0x0102)
SCT Support Level:                   1
Device State:                        Active (0)
Current Temperature:                    43 Celsius
Power Cycle Min/Max Temperature:     23/43 Celsius
Lifetime    Min/Max Temperature:     21/43 Celsius
Under/Over Temperature Limit Count:   0/0
Vendor specific:
01 00 00 00 00 00 00 00 00 00 00 00 00 00 00 00
00 00 00 00 00 00 00 00 00 00 00 00 00 00 00 00

SCT Temperature History Version:     2
Temperature Sampling Period:         1 minute
Temperature Logging Interval:        1 minute
Min/Max recommended Temperature:      0/60 Celsius
Min/Max Temperature Limit:           -41/85 Celsius
Temperature History Size (Index):    128 (61)

Index    Estimated Time   Temperature Celsius
  62    2017-04-15 12:19    27  ********
 ...    ..( 55 skipped).    ..  ********
 118    2017-04-15 13:15    27  ********
 119    2017-04-15 13:16     ?  -
 120    2017-04-15 13:17    27  ********
 121    2017-04-15 13:18    27  ********
 122    2017-04-15 13:19    28  *********
 123    2017-04-15 13:20    28  *********
 124    2017-04-15 13:21    30  ***********
 125    2017-04-15 13:22    30  ***********
 126    2017-04-15 13:23    30  ***********
 127    2017-04-15 13:24    31  ************
   0    2017-04-15 13:25    31  ************
   1    2017-04-15 13:26    32  *************
   2    2017-04-15 13:27    33  **************
   3    2017-04-15 13:28    33  **************
   4    2017-04-15 13:29    33  **************
   5    2017-04-15 13:30    34  ***************
   6    2017-04-15 13:31    34  ***************
   7    2017-04-15 13:32    34  ***************
   8    2017-04-15 13:33    35  ****************
   9    2017-04-15 13:34    35  ****************
  10    2017-04-15 13:35    36  *****************
  11    2017-04-15 13:36    36  *****************
  12    2017-04-15 13:37    36  *****************
  13    2017-04-15 13:38    37  ******************
  14    2017-04-15 13:39    36  *****************
  15    2017-04-15 13:40    37  ******************
  16    2017-04-15 13:41    37  ******************
  17    2017-04-15 13:42    38  *******************
 ...    ..(  2 skipped).    ..  *******************
  20    2017-04-15 13:45    38  *******************
  21    2017-04-15 13:46    39  ********************
  22    2017-04-15 13:47    40  *********************
 ...    ..(  6 skipped).    ..  *********************
  29    2017-04-15 13:54    40  *********************
  30    2017-04-15 13:55    41  **********************
  31    2017-04-15 13:56    41  **********************
  32    2017-04-15 13:57    42  ***********************
 ...    ..(  7 skipped).    ..  ***********************
  40    2017-04-15 14:05    42  ***********************
  41    2017-04-15 14:06    41  **********************
 ...    ..(  8 skipped).    ..  **********************
  50    2017-04-15 14:15    41  **********************
  51    2017-04-15 14:16    42  ***********************
 ...    ..(  7 skipped).    ..  ***********************
  59    2017-04-15 14:24    42  ***********************
  60    2017-04-15 14:25    43  ************************
  61    2017-04-15 14:26    43  ************************

SCT Error Recovery Control command not supported

Device Statistics (GP/SMART Log 0x04) not supported

SATA Phy Event Counters (GP Log 0x11)
ID      Size     Value  Description
0x0001  2            0  Command failed due to ICRC error
0x0002  2            0  R_ERR response for data FIS
0x0003  2            0  R_ERR response for device-to-host data FIS
0x0004  2            0  R_ERR response for host-to-device data FIS
0x0005  2            0  R_ERR response for non-data FIS
0x0006  2            0  R_ERR response for device-to-host non-data FIS
0x0007  2            0  R_ERR response for host-to-device non-data FIS
0x0008  2            0  Device-to-host non-data FIS retries
0x0009  2            4  Transition from drive PhyRdy to drive PhyNRdy
0x000a  2            4  Device-to-host register FISes sent due to a COMRESET
0x000b  2            0  CRC errors within host-to-device FIS
0x000f  2            0  R_ERR response for host-to-device data FIS, CRC
0x0012  2            0  R_ERR response for host-to-device non-data FIS, CRC
0x8000  4        49061  Vendor specific

