smartctl 6.2 2013-07-26 r3841 [x86_64-linux-4.4.114-50] (local build)
Copyright (C) 2002-13, Bruce Allen, Christian Franke, www.smartmontools.org

=== START OF INFORMATION SECTION ===
Device Model:     ST240FN0021
Serial Number:    P3X013D8
LU WWN Device Id: 5 000c50 005a14845
Firmware Version: B560
User Capacity:    240 057 409 536 bytes [240 GB]
Sector Sizes:     512 bytes logical, 4096 bytes physical
Rotation Rate:    Solid State Device
Device is:        Not in smartctl database [for details use: -P showall]
ATA Version is:   ATA8-ACS T13/1699-D revision 4
SATA Version is:  SATA 3.0, 6.0 Gb/s (current: 6.0 Gb/s)
Local Time is:    Tue Sep 18 10:42:42 2018 MSK
SMART support is: Available - device has SMART capability.
SMART support is: Enabled
AAM feature is:   Unavailable
APM feature is:   Unavailable
Rd look-ahead is: Enabled
Write cache is:   Enabled
ATA Security is:  Disabled, NOT FROZEN [SEC1]
Wt Cache Reorder: Unavailable

=== START OF READ SMART DATA SECTION ===
SMART overall-health self-assessment test result: PASSED

General SMART Values:
Offline data collection status:  (0x02)	Offline data collection activity
					was completed without error.
					Auto Offline Data Collection: Disabled.
Self-test execution status:      (   0)	The previous self-test routine completed
					without error or no self-test has ever 
					been run.
Total time to complete Offline 
data collection: 		(    8) seconds.
Offline data collection
capabilities: 			 (0x19) SMART execute Offline immediate.
					No Auto Offline data collection support.
					Suspend Offline collection upon new
					command.
					Offline surface scan supported.
					Self-test supported.
					No Conveyance Self-test supported.
					No Selective Self-test supported.
SMART capabilities:            (0x0002)	Does not save SMART data before
					entering power-saving mode.
					Supports SMART auto save timer.
Error logging capability:        (0x01)	Error logging supported.
					General Purpose Logging supported.
Short self-test routine 
recommended polling time: 	 (   1) minutes.
Extended self-test routine
recommended polling time: 	 (  21) minutes.

SMART Attributes Data Structure revision number: 0
Vendor Specific SMART Attributes with Thresholds:
ID# ATTRIBUTE_NAME          FLAGS    VALUE WORST THRESH FAIL RAW_VALUE
  1 Raw_Read_Error_Rate     POSR--   166   166   006    -    0
  5 Reallocated_Sector_Ct   PO--CK   100   100   036    -    0
  9 Power_On_Hours          -O--CK   088   088   000    -    10937
 12 Power_Cycle_Count       -O--CK   100   100   020    -    7
171 Unknown_Attribute       -O--CK   100   100   000    -    0
172 Unknown_Attribute       -O--CK   100   100   000    -    0
181 Program_Fail_Cnt_Total  -O--CK   100   100   000    -    0
182 Erase_Fail_Count_Total  -O--CK   100   100   000    -    0
194 Temperature_Celsius     -O---K   022   000   000    -    22 (Min/Max 20/59)
201 Unknown_SSD_Attribute   -O--CK   100   100   000    -    0
204 Soft_ECC_Correction     -O--CK   100   100   000    -    0
231 Temperature_Celsius     PO--C-   099   099   010    -    2
234 Unknown_Attribute       -O--CK   100   100   000    -    29300
241 Total_LBAs_Written      -O--CK   100   100   000    -    3377
242 Total_LBAs_Read         -O--CK   100   100   000    -    1981
250 Read_Error_Retry_Rate   -O--CK   100   100   000    -    0
                            ||||||_ K auto-keep
                            |||||__ C event count
                            ||||___ R error rate
                            |||____ S speed/performance
                            ||_____ O updated online
                            |______ P prefailure warning

General Purpose Log Directory Version 1
SMART           Log Directory Version 1 [multi-sector log support]
Address    Access  R/W   Size  Description
0x00       GPL,SL  R/O      1  Log Directory
0x03       GPL,SL  R/O      5  Ext. Comprehensive SMART error log
0x04       GPL,SL  R/O      8  Device Statistics log
0x07       GPL,SL  R/O      2  Extended self-test log
0x10       GPL     R/O      1  NCQ Command Error log
0x11       GPL     R/O      1  SATA Phy Event Counters
0x80-0x9f  GPL,SL  R/W     16  Host vendor specific log
0xa8       GPL     VS    1041  Device vendor specific log
0xa8       SL      VS     255  Device vendor specific log
0xb7       GPL,SL  VS       4  Device vendor specific log

SMART Extended Comprehensive Error Log Version: 1 (5 sectors)
Device Error Count: 49466 (device log contains only the most recent 20 errors)
	CR     = Command Register
	FEATR  = Features Register
	COUNT  = Count (was: Sector Count) Register
	LBA_48 = Upper bytes of LBA High/Mid/Low Registers ]  ATA-8
	LH     = LBA High (was: Cylinder High) Register    ]   LBA
	LM     = LBA Mid (was: Cylinder Low) Register      ] Register
	LL     = LBA Low (was: Sector Number) Register     ]
	DV     = Device (was: Device/Head) Register
	DC     = Device Control Register
	ER     = Error register
	ST     = Status register
Powered_Up_Time is measured from power on, and printed as
DDd+hh:mm:SS.sss where DD=days, hh=hours, mm=minutes,
SS=sec, and sss=millisec. It "wraps" after 49.710 days.

Error 49466 [5] occurred at disk power-on lifetime: 9241 hours (385 days + 1 hours)
  When the command that caused the error occurred, the device was active or idle.

  After command completion occurred, registers were:
  ER -- ST COUNT  LBA_48  LH LM LL DV DC
  -- -- -- == -- == == == -- -- -- -- --
  04 -- 51 00 ff 00 00 00 00 00 00 e0 00  Error: ABRT

  Commands leading to the command that caused the error were:
  CR FEATR COUNT  LBA_48  LH LM LL DV DC  Powered_Up_Time  Command/Feature_Name
  -- == -- == -- == == == -- -- -- -- --  ---------------  --------------------
  b0 00 d1 00 01 00 00 00 c2 4f 01 00 00 23d+03:11:34.128  SMART READ ATTRIBUTE THRESHOLDS [OBS-4]
  b0 00 d0 00 01 00 00 00 c2 4f 00 00 00 23d+03:11:34.128  SMART READ DATA
  ec 00 00 00 01 00 00 00 00 00 00 00 00 23d+03:11:34.108  IDENTIFY DEVICE
  ec 00 00 00 01 00 00 00 00 00 00 00 00 23d+03:11:34.108  IDENTIFY DEVICE
  ec 00 00 00 00 00 00 00 00 00 00 00 00 23d+03:11:34.108  IDENTIFY DEVICE

Error 49465 [4] occurred at disk power-on lifetime: 9241 hours (385 days + 1 hours)
  When the command that caused the error occurred, the device was active or idle.

  After command completion occurred, registers were:
  ER -- ST COUNT  LBA_48  LH LM LL DV DC
  -- -- -- == -- == == == -- -- -- -- --
  04 -- 51 00 ff 00 00 00 00 00 00 e0 00  Error: ABRT

  Commands leading to the command that caused the error were:
  CR FEATR COUNT  LBA_48  LH LM LL DV DC  Powered_Up_Time  Command/Feature_Name
  -- == -- == -- == == == -- -- -- -- --  ---------------  --------------------
  b0 00 d1 00 01 00 00 00 c2 4f 01 00 00 23d+03:10:34.098  SMART READ ATTRIBUTE THRESHOLDS [OBS-4]
  b0 00 d0 00 01 00 00 00 c2 4f 00 00 00 23d+03:10:34.098  SMART READ DATA
  ec 00 00 00 01 00 00 00 00 00 00 00 00 23d+03:10:34.078  IDENTIFY DEVICE
  ec 00 00 00 01 00 00 00 00 00 00 00 00 23d+03:10:34.078  IDENTIFY DEVICE
  ec 00 00 00 00 00 00 00 00 00 00 00 00 23d+03:10:34.078  IDENTIFY DEVICE

Error 49464 [3] occurred at disk power-on lifetime: 9241 hours (385 days + 1 hours)
  When the command that caused the error occurred, the device was active or idle.

  After command completion occurred, registers were:
  ER -- ST COUNT  LBA_48  LH LM LL DV DC
  -- -- -- == -- == == == -- -- -- -- --
  04 -- 51 00 ff 00 00 00 00 00 00 e0 00  Error: ABRT

  Commands leading to the command that caused the error were:
  CR FEATR COUNT  LBA_48  LH LM LL DV DC  Powered_Up_Time  Command/Feature_Name
  -- == -- == -- == == == -- -- -- -- --  ---------------  --------------------
  b0 00 d1 00 01 00 00 00 c2 4f 01 00 00 23d+03:10:29.228  SMART READ ATTRIBUTE THRESHOLDS [OBS-4]
  b0 00 d0 00 01 00 00 00 c2 4f 00 00 00 23d+03:10:29.228  SMART READ DATA
  ec 00 00 00 01 00 00 00 00 00 00 00 00 23d+03:10:29.208  IDENTIFY DEVICE
  ec 00 00 00 01 00 00 00 00 00 00 00 00 23d+03:10:29.208  IDENTIFY DEVICE
  ec 00 00 00 00 00 00 00 00 00 00 00 00 23d+03:10:29.208  IDENTIFY DEVICE

Error 49463 [2] occurred at disk power-on lifetime: 9241 hours (385 days + 1 hours)
  When the command that caused the error occurred, the device was active or idle.

  After command completion occurred, registers were:
  ER -- ST COUNT  LBA_48  LH LM LL DV DC
  -- -- -- == -- == == == -- -- -- -- --
  04 -- 51 00 ff 00 00 00 00 00 00 e0 00  Error: ABRT

  Commands leading to the command that caused the error were:
  CR FEATR COUNT  LBA_48  LH LM LL DV DC  Powered_Up_Time  Command/Feature_Name
  -- == -- == -- == == == -- -- -- -- --  ---------------  --------------------
  b0 00 d1 00 01 00 00 00 c2 4f 01 00 00 23d+03:01:27.458  SMART READ ATTRIBUTE THRESHOLDS [OBS-4]
  b0 00 d0 00 01 00 00 00 c2 4f 00 00 00 23d+03:01:27.458  SMART READ DATA
  ec 00 00 00 01 00 00 00 00 00 00 00 00 23d+03:01:27.448  IDENTIFY DEVICE
  ec 00 00 00 01 00 00 00 00 00 00 00 00 23d+03:01:27.448  IDENTIFY DEVICE
  ec 00 00 00 00 00 00 00 00 00 00 00 00 23d+03:01:27.448  IDENTIFY DEVICE

Error 49462 [1] occurred at disk power-on lifetime: 9241 hours (385 days + 1 hours)
  When the command that caused the error occurred, the device was active or idle.

  After command completion occurred, registers were:
  ER -- ST COUNT  LBA_48  LH LM LL DV DC
  -- -- -- == -- == == == -- -- -- -- --
  04 -- 51 00 ff 00 00 00 00 00 00 e0 00  Error: ABRT

  Commands leading to the command that caused the error were:
  CR FEATR COUNT  LBA_48  LH LM LL DV DC  Powered_Up_Time  Command/Feature_Name
  -- == -- == -- == == == -- -- -- -- --  ---------------  --------------------
  b0 00 d1 00 01 00 00 00 c2 4f 01 00 00 23d+03:01:20.918  SMART READ ATTRIBUTE THRESHOLDS [OBS-4]
  b0 00 d0 00 01 00 00 00 c2 4f 00 00 00 23d+03:01:20.918  SMART READ DATA
  ec 00 00 00 01 00 00 00 00 00 00 00 00 23d+03:01:20.908  IDENTIFY DEVICE
  ec 00 00 00 01 00 00 00 00 00 00 00 00 23d+03:01:20.908  IDENTIFY DEVICE
  ec 00 00 00 00 00 00 00 00 00 00 00 00 23d+03:01:20.908  IDENTIFY DEVICE

Error 49461 [0] occurred at disk power-on lifetime: 9240 hours (385 days + 0 hours)
  When the command that caused the error occurred, the device was active or idle.

  After command completion occurred, registers were:
  ER -- ST COUNT  LBA_48  LH LM LL DV DC
  -- -- -- == -- == == == -- -- -- -- --
  04 -- 51 00 fe 00 00 00 00 00 00 40 00  Error: ABRT

  Commands leading to the command that caused the error were:
  CR FEATR COUNT  LBA_48  LH LM LL DV DC  Powered_Up_Time  Command/Feature_Name
  -- == -- == -- == == == -- -- -- -- --  ---------------  --------------------
  ef 00 05 00 fe 00 00 00 00 00 00 40 00 23d+02:59:16.988  SET FEATURES [Enable APM]
  e5 00 00 00 00 00 00 00 00 00 00 00 00 23d+02:59:16.868  CHECK POWER MODE
  60 00 08 00 00 00 00 00 00 00 08 40 00 23d+02:59:16.868  READ FPDMA QUEUED
  60 00 08 00 00 00 00 00 00 00 00 40 00 23d+02:59:16.868  READ FPDMA QUEUED
  60 00 08 00 00 00 00 1b f2 44 a0 40 00 23d+02:59:16.858  READ FPDMA QUEUED

Error 49460 [19] occurred at disk power-on lifetime: 9240 hours (385 days + 0 hours)
  When the command that caused the error occurred, the device was active or idle.

  After command completion occurred, registers were:
  ER -- ST COUNT  LBA_48  LH LM LL DV DC
  -- -- -- == -- == == == -- -- -- -- --
  04 -- 51 00 ff 00 00 00 00 00 00 e0 00  Error: ABRT

  Commands leading to the command that caused the error were:
  CR FEATR COUNT  LBA_48  LH LM LL DV DC  Powered_Up_Time  Command/Feature_Name
  -- == -- == -- == == == -- -- -- -- --  ---------------  --------------------
  b0 00 d1 00 01 00 00 00 c2 4f 01 00 00 23d+02:39:03.688  SMART READ ATTRIBUTE THRESHOLDS [OBS-4]
  b0 00 d0 00 01 00 00 00 c2 4f 00 00 00 23d+02:39:03.688  SMART READ DATA
  ec 00 00 00 01 00 00 00 00 00 00 00 00 23d+02:39:03.678  IDENTIFY DEVICE
  ec 00 00 00 01 00 00 00 00 00 00 00 00 23d+02:39:03.678  IDENTIFY DEVICE
  ec 00 00 00 00 00 00 00 00 00 00 00 00 23d+02:39:03.678  IDENTIFY DEVICE

Error 49459 [18] occurred at disk power-on lifetime: 9240 hours (385 days + 0 hours)
  When the command that caused the error occurred, the device was active or idle.

  After command completion occurred, registers were:
  ER -- ST COUNT  LBA_48  LH LM LL DV DC
  -- -- -- == -- == == == -- -- -- -- --
  04 -- 51 00 ff 00 00 00 00 00 00 e0 00  Error: ABRT

  Commands leading to the command that caused the error were:
  CR FEATR COUNT  LBA_48  LH LM LL DV DC  Powered_Up_Time  Command/Feature_Name
  -- == -- == -- == == == -- -- -- -- --  ---------------  --------------------
  b0 00 d1 00 01 00 00 00 c2 4f 01 00 00 23d+02:28:19.368  SMART READ ATTRIBUTE THRESHOLDS [OBS-4]
  b0 00 d0 00 01 00 00 00 c2 4f 00 00 00 23d+02:28:19.368  SMART READ DATA
  ec 00 00 00 01 00 00 00 00 00 00 00 00 23d+02:28:19.358  IDENTIFY DEVICE
  ec 00 00 00 01 00 00 00 00 00 00 00 00 23d+02:28:19.358  IDENTIFY DEVICE
  ec 00 00 00 00 00 00 00 00 00 00 00 00 23d+02:28:19.358  IDENTIFY DEVICE

SMART Extended Self-test Log Version: 1 (2 sectors)
Num  Test_Description    Status                  Remaining  LifeTime(hours)  LBA_of_first_error
# 1  Short offline       Completed without error       00%     10937         -

Selective Self-tests/Logging not supported

SCT Commands not supported

Device Statistics (GP Log 0x04)
Page Offset Size         Value  Description
  1  =====  =                =  == General Statistics (rev 2) ==
  1  0x008  4                7  Lifetime Power-On Resets

SATA Phy Event Counters (GP Log 0x11)
ID      Size     Value  Description
0x0001  2            0  Command failed due to ICRC error
0x0002  2            0  R_ERR response for data FIS
0x0003  2            0  R_ERR response for device-to-host data FIS
0x0004  2            0  R_ERR response for host-to-device data FIS
0x0005  2            0  R_ERR response for non-data FIS
0x0006  2            0  R_ERR response for device-to-host non-data FIS
0x0007  2            0  R_ERR response for host-to-device non-data FIS
0x0008  2            0  Device-to-host non-data FIS retries
0x0009  2            0  Transition from drive PhyRdy to drive PhyNRdy
0x000a  2           16  Device-to-host register FISes sent due to a COMRESET
0x000b  2            0  CRC errors within host-to-device FIS
0x000d  2            0  Non-CRC errors within host-to-device FIS
0x000f  2            0  R_ERR response for host-to-device data FIS, CRC
0x0010  2            0  R_ERR response for host-to-device data FIS, non-CRC
0x0012  2            0  R_ERR response for host-to-device non-data FIS, CRC
0x0013  2            0  R_ERR response for host-to-device non-data FIS, non-CRC

