smartctl 6.6 2017-11-05 r4594 [x86_64-linux-4.13.6-0.1-default] (SUSE RPM)
Copyright (C) 2002-17, Bruce Allen, Christian Franke, www.smartmontools.org

Warning: DEFAULT entry missing in drive database file(s)
=== START OF INFORMATION SECTION ===
Device Model:     INTEL SSDSC2KB960G7
Serial Number:    PHYS7356007L960CGN
LU WWN Device Id: 5 5cd2e4 14e26a3ec
Firmware Version: SCV10100
User Capacity:    960,197,124,096 bytes [960 GB]
Sector Sizes:     512 bytes logical, 4096 bytes physical
Rotation Rate:    Solid State Device
Form Factor:      2.5 inches
Device is:        Not in smartctl database [for details use: -P showall]
ATA Version is:   ACS-3 T13/2161-D revision 5
SATA Version is:  SATA 3.2, 6.0 Gb/s (current: 6.0 Gb/s)
Local Time is:    Tue Feb 20 11:30:48 2018 UTC
SMART support is: Available - device has SMART capability.
SMART support is: Enabled
AAM feature is:   Unavailable
APM feature is:   Unavailable
Rd look-ahead is: Enabled
Write cache is:   Enabled
DSN feature is:   Unavailable
ATA Security is:  Disabled, NOT FROZEN [SEC1]
Wt Cache Reorder: Unknown

=== START OF READ SMART DATA SECTION ===
SMART Status not supported: Incomplete response, ATA output registers missing
SMART overall-health self-assessment test result: PASSED
Warning: This result is based on an Attribute check.

General SMART Values:
Offline data collection status:  (0x03)	Offline data collection activity
					is in progress.
					Auto Offline Data Collection: Disabled.
Self-test execution status:      ( 246)	Self-test routine in progress...
					60% of test remaining.
Total time to complete Offline 
data collection: 		(    2) seconds.
Offline data collection
capabilities: 			 (0x79) SMART execute Offline immediate.
					No Auto Offline data collection support.
					Suspend Offline collection upon new
					command.
					Offline surface scan supported.
					Self-test supported.
					Conveyance Self-test supported.
					Selective Self-test supported.
SMART capabilities:            (0x0003)	Saves SMART data before entering
					power-saving mode.
					Supports SMART auto save timer.
Error logging capability:        (0x01)	Error logging supported.
					General Purpose Logging supported.
Short self-test routine 
recommended polling time: 	 (   1) minutes.
Extended self-test routine
recommended polling time: 	 (   2) minutes.
Conveyance self-test routine
recommended polling time: 	 (   2) minutes.
SCT capabilities: 	       (0x003d)	SCT Status supported.
					SCT Error Recovery Control supported.
					SCT Feature Control supported.
					SCT Data Table supported.

SMART Attributes Data Structure revision number: 1
Vendor Specific SMART Attributes with Thresholds:
ID# ATTRIBUTE_NAME          FLAGS    VALUE WORST THRESH FAIL RAW_VALUE
  5 Reallocated_Sector_Ct   -O--CK   100   100   000    -    0
  9 Power_On_Hours          -O--CK   100   100   000    -    282
 12 Power_Cycle_Count       -O--CK   100   100   000    -    2
170 Unknown_Attribute       PO--CK   100   100   010    -    0
171 Unknown_Attribute       -O--CK   100   100   000    -    0
172 Unknown_Attribute       -O--CK   100   100   000    -    0
174 Unknown_Attribute       -O--CK   100   100   000    -    0
175 Program_Fail_Count_Chip PO--CK   100   100   010    -    17630494745
183 Runtime_Bad_Block       -O--CK   100   100   000    -    0
184 End-to-End_Error        PO--CK   100   100   090    -    0
187 Reported_Uncorrect      -O--CK   100   100   000    -    0
190 Airflow_Temperature_Cel -O---K   074   068   000    -    26 (Min/Max 19/33)
192 Power-Off_Retract_Count -O--CK   100   100   000    -    0
194 Temperature_Celsius     -O---K   100   100   000    -    26
197 Current_Pending_Sector  -O--C-   100   100   000    -    0
199 UDMA_CRC_Error_Count    -OSRCK   100   100   000    -    0
225 Unknown_SSD_Attribute   -O--CK   100   100   000    -    17306
226 Unknown_SSD_Attribute   -O--CK   100   100   000    -    0
227 Unknown_SSD_Attribute   -O--CK   100   100   000    -    24
228 Power-off_Retract_Count -O--CK   100   100   000    -    16955
232 Available_Reservd_Space PO--CK   100   100   010    -    0
233 Media_Wearout_Indicator -O--CK   100   100   000    -    0
234 Unknown_Attribute       -O--CK   100   100   000    -    0
241 Total_LBAs_Written      -O--CK   100   100   000    -    17306
242 Total_LBAs_Read         -O--CK   100   100   000    -    5713
243 Unknown_Attribute       -O--CK   100   100   000    -    24254
                            ||||||_ K auto-keep
                            |||||__ C event count
                            ||||___ R error rate
                            |||____ S speed/performance
                            ||_____ O updated online
                            |______ P prefailure warning

General Purpose Log Directory Version 1
SMART           Log Directory Version 1 [multi-sector log support]
Address    Access  R/W   Size  Description
0x00       GPL,SL  R/O      1  Log Directory
0x01           SL  R/O      1  Summary SMART error log
0x02           SL  R/O      8  Comprehensive SMART error log
0x03       GPL     R/O     20  Ext. Comprehensive SMART error log
0x04       GPL,SL  R/O      8  Device Statistics log
0x06           SL  R/O      1  SMART self-test log
0x07       GPL     R/O      2  Extended self-test log
0x08       GPL     R/O      2  Power Conditions log
0x09           SL  R/W      1  Selective self-test log
0x10       GPL     R/O      1  NCQ Command Error log
0x11       GPL     R/O      1  SATA Phy Event Counters log
0x30       GPL,SL  R/O      9  IDENTIFY DEVICE data log
0x80-0x9f  GPL,SL  R/W     16  Host vendor specific log
0xb8       GPL,SL  VS       1  Device vendor specific log
0xb9       GPL     VS    3312  Device vendor specific log
0xb9       SL      VS     240  Device vendor specific log
0xba       GPL     VS    1280  Device vendor specific log
0xe0       GPL,SL  R/W      1  SCT Command/Status
0xe1       GPL,SL  R/W      8  SCT Data Transfer

SMART Extended Comprehensive Error Log Version: 1 (20 sectors)
No Errors Logged

SMART Extended Self-test Log Version: 1 (2 sectors)
No self-tests have been logged.  [To run self-tests, use: smartctl -t]

SMART Selective self-test log data structure revision number 1
 SPAN  MIN_LBA  MAX_LBA  CURRENT_TEST_STATUS
    1        0        0  Not_testing
    2        0        0  Not_testing
    3        0        0  Not_testing
    4        0        0  Not_testing
    5        0        0  Not_testing
Selective self-test flags (0x0):
  After scanning selected spans, do NOT read-scan remainder of disk.
If Selective self-test is pending on power-up, resume after 0 minute delay.

SCT Status Version:                  3
SCT Version (vendor specific):       1 (0x0001)
SCT Support Level:                   0
Device State:                        SMART Off-line Data Collection executing in background (4)
Current Temperature:                    26 Celsius
Power Cycle Min/Max Temperature:     19/33 Celsius
Lifetime    Min/Max Temperature:     19/33 Celsius
Under/Over Temperature Limit Count:   0/0
Vendor specific:
00 00 2c 01 00 00 00 00 00 00 00 00 00 00 00 00
00 00 00 00 00 00 00 00 00 00 00 00 00 00 00 00

SCT Temperature History Version:     2
Temperature Sampling Period:         1 minute
Temperature Logging Interval:        1 minute
Min/Max recommended Temperature:      0/75 Celsius
Min/Max Temperature Limit:            0/75 Celsius
Temperature History Size (Index):    478 (229)

Index    Estimated Time   Temperature Celsius
 230    2018-02-20 03:33    27  ********
 ...    ..( 44 skipped).    ..  ********
 275    2018-02-20 04:18    27  ********
 276    2018-02-20 04:19    26  *******
 ...    ..(  2 skipped).    ..  *******
 279    2018-02-20 04:22    26  *******
 280    2018-02-20 04:23    27  ********
 ...    ..( 17 skipped).    ..  ********
 298    2018-02-20 04:41    27  ********
 299    2018-02-20 04:42    26  *******
 ...    ..( 41 skipped).    ..  *******
 341    2018-02-20 05:24    26  *******
 342    2018-02-20 05:25    27  ********
 ...    ..( 13 skipped).    ..  ********
 356    2018-02-20 05:39    27  ********
 357    2018-02-20 05:40    26  *******
 358    2018-02-20 05:41    26  *******
 359    2018-02-20 05:42    27  ********
 360    2018-02-20 05:43    26  *******
 ...    ..(  3 skipped).    ..  *******
 364    2018-02-20 05:47    26  *******
 365    2018-02-20 05:48    27  ********
 ...    ..( 14 skipped).    ..  ********
 380    2018-02-20 06:03    27  ********
 381    2018-02-20 06:04    26  *******
 382    2018-02-20 06:05    27  ********
 383    2018-02-20 06:06    27  ********
 384    2018-02-20 06:07    26  *******
 ...    ..( 15 skipped).    ..  *******
 400    2018-02-20 06:23    26  *******
 401    2018-02-20 06:24    27  ********
 402    2018-02-20 06:25    26  *******
 403    2018-02-20 06:26    26  *******
 404    2018-02-20 06:27    26  *******
 405    2018-02-20 06:28    27  ********
 ...    ..(  7 skipped).    ..  ********
 413    2018-02-20 06:36    27  ********
 414    2018-02-20 06:37    28  *********
 415    2018-02-20 06:38    27  ********
 416    2018-02-20 06:39    27  ********
 417    2018-02-20 06:40    27  ********
 418    2018-02-20 06:41    28  *********
 419    2018-02-20 06:42    26  *******
 420    2018-02-20 06:43    27  ********
 421    2018-02-20 06:44    26  *******
 422    2018-02-20 06:45    27  ********
 ...    ..( 13 skipped).    ..  ********
 436    2018-02-20 06:59    27  ********
 437    2018-02-20 07:00    26  *******
 ...    ..( 11 skipped).    ..  *******
 449    2018-02-20 07:12    26  *******
 450    2018-02-20 07:13    27  ********
 ...    ..( 53 skipped).    ..  ********
  26    2018-02-20 08:07    27  ********
  27    2018-02-20 08:08    28  *********
  28    2018-02-20 08:09    28  *********
  29    2018-02-20 08:10    27  ********
 ...    ..( 29 skipped).    ..  ********
  59    2018-02-20 08:40    27  ********
  60    2018-02-20 08:41    28  *********
  61    2018-02-20 08:42    27  ********
 ...    ..( 89 skipped).    ..  ********
 151    2018-02-20 10:12    27  ********
 152    2018-02-20 10:13    26  *******
 ...    ..( 25 skipped).    ..  *******
 178    2018-02-20 10:39    26  *******
 179    2018-02-20 10:40    25  ******
 ...    ..(  5 skipped).    ..  ******
 185    2018-02-20 10:46    25  ******
 186    2018-02-20 10:47    26  *******
 ...    ..(  9 skipped).    ..  *******
 196    2018-02-20 10:57    26  *******
 197    2018-02-20 10:58    25  ******
 ...    ..( 12 skipped).    ..  ******
 210    2018-02-20 11:11    25  ******
 211    2018-02-20 11:12    26  *******
 ...    ..(  4 skipped).    ..  *******
 216    2018-02-20 11:17    26  *******
 217    2018-02-20 11:18    25  ******
 ...    ..( 10 skipped).    ..  ******
 228    2018-02-20 11:29    25  ******
 229    2018-02-20 11:30    26  *******

SMART WRITE LOG does not return COUNT and LBA_LOW register
SCT (Get) Error Recovery Control command failed

Device Statistics (GP Log 0x04)
Page  Offset Size        Value Flags Description
0x01  =====  =               =  ===  == General Statistics (rev 2) ==
0x01  0x008  4               2  ---  Lifetime Power-On Resets
0x01  0x018  6      1134190124  ---  Logical Sectors Written
0x01  0x020  6         8758768  ---  Number of Write Commands
0x01  0x028  6       374446454  ---  Logical Sectors Read
0x01  0x030  6         8746667  ---  Number of Read Commands
0x01  0x038  6      1017381330  ---  Date and Time TimeStamp
0x04  =====  =               =  ===  == General Errors Statistics (rev 1) ==
0x04  0x008  4               0  ---  Number of Reported Uncorrectable Errors
0x04  0x010  4               0  ---  Resets Between Cmd Acceptance and Completion
0x05  =====  =               =  ===  == Temperature Statistics (rev 1) ==
0x05  0x008  1              26  ---  Current Temperature
0x05  0x010  1              26  ---  Average Short Term Temperature
0x05  0x018  1               -  ---  Average Long Term Temperature
0x05  0x020  1              32  ---  Highest Temperature
0x05  0x028  1              23  ---  Lowest Temperature
0x05  0x030  1              28  ---  Highest Average Short Term Temperature
0x05  0x038  1              24  ---  Lowest Average Short Term Temperature
0x05  0x040  1               -  ---  Highest Average Long Term Temperature
0x05  0x048  1               -  ---  Lowest Average Long Term Temperature
0x05  0x050  4               0  ---  Time in Over-Temperature
0x05  0x058  1              75  ---  Specified Maximum Operating Temperature
0x05  0x060  4               0  ---  Time in Under-Temperature
0x05  0x068  1               0  ---  Specified Minimum Operating Temperature
0x06  =====  =               =  ===  == Transport Statistics (rev 1) ==
0x06  0x008  4               0  ---  Number of Hardware Resets
0x06  0x010  4              17  ---  Number of ASR Events
0x06  0x018  4               0  ---  Number of Interface CRC Errors
0x07  =====  =               =  ===  == Solid State Device Statistics (rev 1) ==
0x07  0x008  1               0  ---  Percentage Used Endurance Indicator
                                |||_ C monitored condition met
                                ||__ D supports DSN
                                |___ N normalized value

Pending Defects log (GP Log 0x0c) not supported

SATA Phy Event Counters (GP Log 0x11)
ID      Size     Value  Description
0x0001  4            0  Command failed due to ICRC error
0x0002  4            0  R_ERR response for data FIS
0x0003  4            0  R_ERR response for device-to-host data FIS
0x0004  4            0  R_ERR response for host-to-device data FIS
0x0005  4            0  R_ERR response for non-data FIS
0x0006  4            0  R_ERR response for device-to-host non-data FIS
0x0007  4            0  R_ERR response for host-to-device non-data FIS
0x000a  4           28  Device-to-host register FISes sent due to a COMRESET
0x000d  4            0  Non-CRC errors within host-to-device FIS
