smartctl 6.6 2017-11-05 r4594 [x86_64-linux-4.16.15-200.fc27.x86_64] (local build)
Copyright (C) 2002-17, Bruce Allen, Christian Franke, www.smartmontools.org

=== START OF INFORMATION SECTION ===
Device Model:     Samsung SSD 860 EVO 2TB
Serial Number:    S3YVNB0K501913J
LU WWN Device Id: 5 002538 e4039ab40
Firmware Version: RVT01B6Q
User Capacity:    2.000.398.934.016 bytes [2,00 TB]
Sector Size:      512 bytes logical/physical
Rotation Rate:    Solid State Device
Form Factor:      2.5 inches
Device is:        Not in smartctl database [for details use: -P showall]
ATA Version is:   ACS-4 T13/BSR INCITS 529 revision 5
SATA Version is:  SATA 3.1, 6.0 Gb/s (current: 6.0 Gb/s)
Local Time is:    Wed Jun 13 13:22:22 2018 CEST
SMART support is: Available - device has SMART capability.
SMART support is: Enabled
AAM feature is:   Unavailable
APM feature is:   Unavailable
Rd look-ahead is: Enabled
Write cache is:   Enabled
DSN feature is:   Unavailable
ATA Security is:  Disabled, frozen [SEC2]
Wt Cache Reorder: Enabled

=== START OF READ SMART DATA SECTION ===
SMART overall-health self-assessment test result: PASSED

General SMART Values:
Offline data collection status:  (0x02)	Offline data collection activity
					was completed without error.
					Auto Offline Data Collection: Disabled.
Self-test execution status:      ( 241)	Self-test routine in progress...
					10% of test remaining.
Total time to complete Offline 
data collection: 		(    0) seconds.
Offline data collection
capabilities: 			 (0x53) SMART execute Offline immediate.
					Auto Offline data collection on/off support.
					Suspend Offline collection upon new
					command.
					No Offline surface scan supported.
					Self-test supported.
					No Conveyance Self-test supported.
					Selective Self-test supported.
SMART capabilities:            (0x0003)	Saves SMART data before entering
					power-saving mode.
					Supports SMART auto save timer.
Error logging capability:        (0x01)	Error logging supported.
					General Purpose Logging supported.
Short self-test routine 
recommended polling time: 	 (   2) minutes.
Extended self-test routine
recommended polling time: 	 ( 160) minutes.
SCT capabilities: 	       (0x003d)	SCT Status supported.
					SCT Error Recovery Control supported.
					SCT Feature Control supported.
					SCT Data Table supported.

SMART Attributes Data Structure revision number: 1
Vendor Specific SMART Attributes with Thresholds:
ID# ATTRIBUTE_NAME          FLAGS    VALUE WORST THRESH FAIL RAW_VALUE
  5 Reallocated_Sector_Ct   PO--CK   100   100   010    -    0
  9 Power_On_Hours          -O--CK   099   099   000    -    139
 12 Power_Cycle_Count       -O--CK   099   099   000    -    3
177 Wear_Leveling_Count     PO--C-   099   099   000    -    1
179 Used_Rsvd_Blk_Cnt_Tot   PO--C-   100   100   010    -    0
181 Program_Fail_Cnt_Total  -O--CK   100   100   010    -    0
182 Erase_Fail_Count_Total  -O--CK   100   100   010    -    0
183 Runtime_Bad_Block       PO--C-   100   100   010    -    0
187 Reported_Uncorrect      -O--CK   100   100   000    -    0
190 Airflow_Temperature_Cel -O--CK   069   060   000    -    31
195 Hardware_ECC_Recovered  -O-RC-   200   200   000    -    0
199 UDMA_CRC_Error_Count    -OSRCK   100   100   000    -    0
235 Unknown_Attribute       -O--C-   100   100   000    -    0
241 Total_LBAs_Written      -O--CK   099   099   000    -    5760587913
                            ||||||_ K auto-keep
                            |||||__ C event count
                            ||||___ R error rate
                            |||____ S speed/performance
                            ||_____ O updated online
                            |______ P prefailure warning

General Purpose Log Directory Version 1
SMART           Log Directory Version 1 [multi-sector log support]
Address    Access  R/W   Size  Description
0x00       GPL,SL  R/O      1  Log Directory
0x01           SL  R/O      1  Summary SMART error log
0x02           SL  R/O      1  Comprehensive SMART error log
0x03       GPL     R/O      1  Ext. Comprehensive SMART error log
0x04       GPL,SL  R/O      8  Device Statistics log
0x06           SL  R/O      1  SMART self-test log
0x07       GPL     R/O      1  Extended self-test log
0x09           SL  R/W      1  Selective self-test log
0x10       GPL     R/O      1  NCQ Command Error log
0x11       GPL     R/O      1  SATA Phy Event Counters log
0x13       GPL     R/O      1  SATA NCQ Send and Receive log
0x30       GPL,SL  R/O      9  IDENTIFY DEVICE data log
0x80-0x9f  GPL,SL  R/W     16  Host vendor specific log
0xa1           SL  VS      16  Device vendor specific log
0xa5           SL  VS      16  Device vendor specific log
0xce-0xcf      SL  VS      16  Device vendor specific log
0xe0       GPL,SL  R/W      1  SCT Command/Status
0xe1       GPL,SL  R/W      1  SCT Data Transfer

SMART Extended Comprehensive Error Log Version: 1 (1 sectors)
No Errors Logged

SMART Extended Self-test Log Version: 1 (1 sectors)
Num  Test_Description    Status                  Remaining  LifeTime(hours)  LBA_of_first_error
# 1  Short offline       Completed without error       00%       131         -
# 2  Extended offline    Completed without error       00%       112         -
# 3  Short offline       Completed without error       00%       107         -
# 4  Short offline       Completed without error       00%        83         -
# 5  Short offline       Completed without error       00%        59         -
# 6  Short offline       Completed without error       00%        35         -
# 7  Short offline       Completed without error       00%        12         -

SMART Selective self-test log data structure revision number 1
 SPAN  MIN_LBA  MAX_LBA  CURRENT_TEST_STATUS
    1        0        0  Self_test_in_progress [10% left] (113076736-113142271)
    2        0        0  Not_testing
    3        0        0  Not_testing
    4        0        0  Not_testing
    5        0        0  Not_testing
Selective self-test flags (0x0):
  After scanning selected spans, do NOT read-scan remainder of disk.
If Selective self-test is pending on power-up, resume after 0 minute delay.

SCT Status Version:                  3
SCT Version (vendor specific):       256 (0x0100)
SCT Support Level:                   1
Device State:                        DST executing in background (3)
Current Temperature:                    31 Celsius
Power Cycle Min/Max Temperature:     26/40 Celsius
Lifetime    Min/Max Temperature:     26/40 Celsius
Under/Over Temperature Limit Count:   0/0
SMART Status:                        0xc24f (PASSED)

SCT Temperature History Version:     2
Temperature Sampling Period:         1 minute
Temperature Logging Interval:        10 minutes
Min/Max recommended Temperature:      0/70 Celsius
Min/Max Temperature Limit:            0/70 Celsius
Temperature History Size (Index):    128 (121)

Index    Estimated Time   Temperature Celsius
 122    2018-06-12 16:10     ?  -
 123    2018-06-12 16:20     ?  -
 124    2018-06-12 16:30     ?  -
 125    2018-06-12 16:40    27  ********
 126    2018-06-12 16:50     ?  -
 ...    ..(  2 skipped).    ..  -
   1    2018-06-12 17:20     ?  -
   2    2018-06-12 17:30    27  ********
   3    2018-06-12 17:40     ?  -
   4    2018-06-12 17:50     ?  -
   5    2018-06-12 18:00     ?  -
   6    2018-06-12 18:10    27  ********
   7    2018-06-12 18:20     ?  -
 ...    ..(  4 skipped).    ..  -
  12    2018-06-12 19:10     ?  -
  13    2018-06-12 19:20    27  ********
  14    2018-06-12 19:30     ?  -
 ...    ..(  2 skipped).    ..  -
  17    2018-06-12 20:00     ?  -
  18    2018-06-12 20:10    27  ********
  19    2018-06-12 20:20     ?  -
 ...    ..(  3 skipped).    ..  -
  23    2018-06-12 21:00     ?  -
  24    2018-06-12 21:10    27  ********
  25    2018-06-12 21:20     ?  -
 ...    ..(  3 skipped).    ..  -
  29    2018-06-12 22:00     ?  -
  30    2018-06-12 22:10    27  ********
  31    2018-06-12 22:20     ?  -
 ...    ..(  6 skipped).    ..  -
  38    2018-06-12 23:30     ?  -
  39    2018-06-12 23:40    27  ********
  40    2018-06-12 23:50     ?  -
 ...    ..(  4 skipped).    ..  -
  45    2018-06-13 00:40     ?  -
  46    2018-06-13 00:50    27  ********
  47    2018-06-13 01:00     ?  -
  48    2018-06-13 01:10     ?  -
  49    2018-06-13 01:20     ?  -
  50    2018-06-13 01:30    27  ********
  51    2018-06-13 01:40     ?  -
 ...    ..(  5 skipped).    ..  -
  57    2018-06-13 02:40     ?  -
  58    2018-06-13 02:50    27  ********
  59    2018-06-13 03:00     ?  -
 ...    ..(  3 skipped).    ..  -
  63    2018-06-13 03:40     ?  -
  64    2018-06-13 03:50    27  ********
  65    2018-06-13 04:00     ?  -
  66    2018-06-13 04:10     ?  -
  67    2018-06-13 04:20     ?  -
  68    2018-06-13 04:30    27  ********
  69    2018-06-13 04:40     ?  -
 ...    ..(  4 skipped).    ..  -
  74    2018-06-13 05:30     ?  -
  75    2018-06-13 05:40    27  ********
  76    2018-06-13 05:50     ?  -
  77    2018-06-13 06:00     ?  -
  78    2018-06-13 06:10     ?  -
  79    2018-06-13 06:20    27  ********
  80    2018-06-13 06:30     ?  -
 ...    ..(  2 skipped).    ..  -
  83    2018-06-13 07:00     ?  -
  84    2018-06-13 07:10    27  ********
  85    2018-06-13 07:20     ?  -
  86    2018-06-13 07:30     ?  -
  87    2018-06-13 07:40    28  *********
  88    2018-06-13 07:50     ?  -
  89    2018-06-13 08:00     ?  -
  90    2018-06-13 08:10    28  *********
  91    2018-06-13 08:20     ?  -
  92    2018-06-13 08:30     ?  -
  93    2018-06-13 08:40    32  *************
  94    2018-06-13 08:50    35  ****************
  95    2018-06-13 09:00    36  *****************
  96    2018-06-13 09:10    37  ******************
  97    2018-06-13 09:20    37  ******************
  98    2018-06-13 09:30    37  ******************
  99    2018-06-13 09:40    34  ***************
 100    2018-06-13 09:50    33  **************
 101    2018-06-13 10:00    29  **********
 102    2018-06-13 10:10    28  *********
 103    2018-06-13 10:20    28  *********
 104    2018-06-13 10:30     ?  -
 ...    ..(  3 skipped).    ..  -
 108    2018-06-13 11:10     ?  -
 109    2018-06-13 11:20    28  *********
 110    2018-06-13 11:30     ?  -
 ...    ..(  4 skipped).    ..  -
 115    2018-06-13 12:20     ?  -
 116    2018-06-13 12:30    28  *********
 117    2018-06-13 12:40     ?  -
 ...    ..(  2 skipped).    ..  -
 120    2018-06-13 13:10     ?  -
 121    2018-06-13 13:20    28  *********

SCT Error Recovery Control:
           Read: Disabled
          Write: Disabled

Device Statistics (GP Log 0x04)
Page  Offset Size        Value Flags Description
0x01  =====  =               =  ===  == General Statistics (rev 1) ==
0x01  0x008  4               3  ---  Lifetime Power-On Resets
0x01  0x010  4             139  ---  Power-on Hours
0x01  0x018  6      5760587913  ---  Logical Sectors Written
0x01  0x020  6        41099182  ---  Number of Write Commands
0x01  0x028  6     13147354581  ---  Logical Sectors Read
0x01  0x030  6        63594960  ---  Number of Read Commands
0x01  0x038  6         2414000  ---  Date and Time TimeStamp
0x04  =====  =               =  ===  == General Errors Statistics (rev 1) ==
0x04  0x008  4               0  ---  Number of Reported Uncorrectable Errors
0x04  0x010  4               0  ---  Resets Between Cmd Acceptance and Completion
0x05  =====  =               =  ===  == Temperature Statistics (rev 1) ==
0x05  0x008  1              31  ---  Current Temperature
0x05  0x020  1              40  ---  Highest Temperature
0x05  0x028  1              26  ---  Lowest Temperature
0x05  0x058  1              55  ---  Specified Maximum Operating Temperature
0x06  =====  =               =  ===  == Transport Statistics (rev 1) ==
0x06  0x008  4              40  ---  Number of Hardware Resets
0x06  0x010  4               0  ---  Number of ASR Events
0x06  0x018  4               0  ---  Number of Interface CRC Errors
0x07  =====  =               =  ===  == Solid State Device Statistics (rev 1) ==
0x07  0x008  1               0  N--  Percentage Used Endurance Indicator
                                |||_ C monitored condition met
                                ||__ D supports DSN
                                |___ N normalized value

Pending Defects log (GP Log 0x0c) not supported

SATA Phy Event Counters (GP Log 0x11)
ID      Size     Value  Description
0x0001  2            0  Command failed due to ICRC error
0x0002  2            0  R_ERR response for data FIS
0x0003  2            0  R_ERR response for device-to-host data FIS
0x0004  2            0  R_ERR response for host-to-device data FIS
0x0005  2            0  R_ERR response for non-data FIS
0x0006  2            0  R_ERR response for device-to-host non-data FIS
0x0007  2            0  R_ERR response for host-to-device non-data FIS
0x0008  2            0  Device-to-host non-data FIS retries
0x0009  2        65535+ Transition from drive PhyRdy to drive PhyNRdy
0x000a  2           19  Device-to-host register FISes sent due to a COMRESET
0x000b  2            0  CRC errors within host-to-device FIS
0x000d  2            0  Non-CRC errors within host-to-device FIS
0x000f  2            0  R_ERR response for host-to-device data FIS, CRC
0x0010  2            0  R_ERR response for host-to-device data FIS, non-CRC
0x0012  2            0  R_ERR response for host-to-device non-data FIS, CRC
0x0013  2            0  R_ERR response for host-to-device non-data FIS, non-CRC

