smartctl 7.1 2019-12-30 r5022 [x86_64-w64-mingw32-w10-b19043] (sf-7.1-1)
Copyright (C) 2002-19, Bruce Allen, Christian Franke, www.smartmontools.org

=== START OF INFORMATION SECTION ===
Device Model:     KINGSTON RBUSNS8180S3512GJ
Serial Number:    50026B7683143069
LU WWN Device Id: 5 0026b7 683143069
Firmware Version: SBFK61D1
User Capacity:    512.110.190.592 bytes [512 GB]
Sector Size:      512 bytes logical/physical
Rotation Rate:    Solid State Device
Device is:        Not in smartctl database [for details use: -P showall]
ATA Version is:   ACS-3 T13/2161-D revision 4
SATA Version is:  SATA 3.2, 6.0 Gb/s (current: 6.0 Gb/s)
Local Time is:    Mon Nov 22 22:24:05 2021 MZ
SMART support is: Available - device has SMART capability.
SMART support is: Enabled
AAM feature is:   Unavailable
APM feature is:   Disabled
Rd look-ahead is: Enabled
Write cache is:   Enabled
DSN feature is:   Unavailable
ATA Security is:  Disabled, frozen [SEC2]
Wt Cache Reorder: Unavailable

=== START OF READ SMART DATA SECTION ===
SMART overall-health self-assessment test result: PASSED

General SMART Values:
Offline data collection status:  (0x00) Offline data collection activity
                                        was never started.
                                        Auto Offline Data Collection: Disabled.
Total time to complete Offline
data collection:                (65535) seconds.
Offline data collection
capabilities:                    (0x00)         Offline data collection not supported.
SMART capabilities:            (0x0003) Saves SMART data before entering
                                        power-saving mode.
                                        Supports SMART auto save timer.
Error logging capability:        (0x01) Error logging supported.
                                        General Purpose Logging supported.

SMART Attributes Data Structure revision number: 16
Vendor Specific SMART Attributes with Thresholds:
ID# ATTRIBUTE_NAME          FLAGS    VALUE WORST THRESH FAIL RAW_VALUE
  9 Power_On_Hours          -O--C-   100   100   000    -    3676
 12 Power_Cycle_Count       -O--C-   100   100   000    -    2258
167 Unknown_Attribute       -O---K   100   100   000    -    0
168 Unknown_Attribute       -O--C-   100   100   000    -    0
172 Unknown_Attribute       -O--CK   100   100   000    -    0
173 Unknown_Attribute       ------   100   100   000    -    1048631
181 Program_Fail_Cnt_Total  -O--C-   100   100   000    -    0
187 Reported_Uncorrect      -O--CK   100   100   000    -    0
192 Power-Off_Retract_Count -O--C-   100   100   000    -    55
194 Temperature_Celsius     PO---K   043   014   000    -    57 (Min/Max 21/86)
196 Reallocated_Event_Count ------   100   100   000    -    0
218 Unknown_Attribute       ------   100   100   000    -    0
231 Temperature_Celsius     PO--C-   100   100   000    -    99
233 Media_Wearout_Indicator PO--C-   100   100   000    -    5621
241 Total_LBAs_Written      -O--C-   100   100   000    -    5694
242 Total_LBAs_Read         -O--C-   100   100   000    -    4877
244 Unknown_Attribute       ------   100   100   000    -    16
245 Unknown_Attribute       ------   100   100   000    -    55
246 Unknown_Attribute       ------   100   100   000    -    719456
                            ||||||_ K auto-keep
                            |||||__ C event count
                            ||||___ R error rate
                            |||____ S speed/performance
                            ||_____ O updated online
                            |______ P prefailure warning

General Purpose Log Directory Version 1
SMART           Log Directory Version 1 [multi-sector log support]
Address    Access  R/W   Size  Description
0x00       GPL,SL  R/O      1  Log Directory
0x01           SL  R/O      1  Summary SMART error log
0x02           SL  R/O     51  Comprehensive SMART error log
0x03       GPL     R/O     64  Ext. Comprehensive SMART error log
0x04       GPL,SL  R/O      8  Device Statistics log
0x06           SL  R/O      1  SMART self-test log
0x07       GPL     R/O      1  Extended self-test log
0x09           SL  R/W      1  Selective self-test log
0x10       GPL     R/O      1  NCQ Command Error log
0x11       GPL     R/O      1  SATA Phy Event Counters log
0x30       GPL,SL  R/O      9  IDENTIFY DEVICE data log
0x80-0x9f  GPL,SL  R/W     16  Host vendor specific log

SMART Extended Comprehensive Error Log Version: 1 (64 sectors)
No Errors Logged

SMART Extended Self-test Log Version: 1 (1 sectors)
No self-tests have been logged.  [To run self-tests, use: smartctl -t]

Selective Self-tests/Logging not supported

SCT Commands not supported

Device Statistics (GP Log 0x04)
Page  Offset Size        Value Flags Description
0x01  =====  =               =  ===  == General Statistics (rev 1) ==
0x01  0x008  4            2258  ---  Lifetime Power-On Resets
0x01  0x010  4            3676  ---  Power-on Hours
0x01  0x018  6     11942297747  ---  Logical Sectors Written
0x01  0x028  6     10228445819  ---  Logical Sectors Read
0x04  =====  =               =  ===  == General Errors Statistics (rev 1) ==
0x04  0x008  4               0  ---  Number of Reported Uncorrectable Errors
0x05  =====  =               =  ===  == Temperature Statistics (rev 1) ==
0x05  0x008  1              57  ---  Current Temperature
0x05  0x020  1              86  ---  Highest Temperature
0x05  0x028  1              21  ---  Lowest Temperature
0x06  =====  =               =  ===  == Transport Statistics (rev 1) ==
0x06  0x018  4               0  ---  Number of Interface CRC Errors
0x07  =====  =               =  ===  == Solid State Device Statistics (rev 1) ==
0x07  0x008  1               0  ---  Percentage Used Endurance Indicator
                                |||_ C monitored condition met
                                ||__ D supports DSN
                                |___ N normalized value

Pending Defects log (GP Log 0x0c) not supported

SATA Phy Event Counters (GP Log 0x11)
ID      Size     Value  Description
0x0001  2            0  Command failed due to ICRC error
0x0003  2            0  R_ERR response for device-to-host data FIS
0x0004  2            0  R_ERR response for host-to-device data FIS
0x0006  2            0  R_ERR response for device-to-host non-data FIS
0x0007  2            0  R_ERR response for host-to-device non-data FIS
0x0008  2            0  Device-to-host non-data FIS retries
0x0009  4            1  Transition from drive PhyRdy to drive PhyNRdy
0x000a  4            2  Device-to-host register FISes sent due to a COMRESET
0x000f  2            0  R_ERR response for host-to-device data FIS, CRC
0x0010  2            0  R_ERR response for host-to-device data FIS, non-CRC
0x0012  2            0  R_ERR response for host-to-device non-data FIS, CRC
0x0013  2            0  R_ERR response for host-to-device non-data FIS, non-CRC