smartctl 6.6 2016-05-31 r4324 [x86_64-linux-5.3.0-46-generic] (local build)
Copyright (C) 2002-16, Bruce Allen, Christian Franke, www.smartmontools.org

=== START OF INFORMATION SECTION ===
Device Model:     CT500MX500SSD4
Serial Number:    1821E13E97FF
LU WWN Device Id: 5 00a075 1e13e97ff
Firmware Version: M3CR020
User Capacity:    500,107,862,016 bytes [500 GB]
Sector Sizes:     512 bytes logical, 4096 bytes physical
Rotation Rate:    Solid State Device
Form Factor:      M.2
Device is:        Not in smartctl database [for details use: -P showall]
ATA Version is:   ACS-3 T13/2161-D revision 5
SATA Version is:  SATA >3.2 (0x1ff), 6.0 Gb/s (current: 6.0 Gb/s)
Local Time is:    Thu Apr 16 11:37:53 2020 BST
SMART support is: Available - device has SMART capability.
SMART support is: Enabled
AAM feature is:   Unavailable
APM level is:     254 (maximum performance)
Rd look-ahead is: Enabled
Write cache is:   Enabled
ATA Security is:  Disabled, frozen [SEC2]
Wt Cache Reorder: Unknown

=== START OF READ SMART DATA SECTION ===
SMART overall-health self-assessment test result: PASSED

General SMART Values:
Offline data collection status:  (0x82)	Offline data collection activity
					was completed without error.
					Auto Offline Data Collection: Enabled.
Self-test execution status:      (   0)	The previous self-test routine completed
					without error or no self-test has ever 
					been run.
Total time to complete Offline 
data collection: 		(    0) seconds.
Offline data collection
capabilities: 			 (0x7b) SMART execute Offline immediate.
					Auto Offline data collection on/off support.
					Suspend Offline collection upon new
					command.
					Offline surface scan supported.
					Self-test supported.
					Conveyance Self-test supported.
					Selective Self-test supported.
SMART capabilities:            (0x0003)	Saves SMART data before entering
					power-saving mode.
					Supports SMART auto save timer.
Error logging capability:        (0x01)	Error logging supported.
					General Purpose Logging supported.
Short self-test routine 
recommended polling time: 	 (   2) minutes.
Extended self-test routine
recommended polling time: 	 (  30) minutes.
Conveyance self-test routine
recommended polling time: 	 (   2) minutes.
SCT capabilities: 	       (0x0031)	SCT Status supported.
					SCT Feature Control supported.
					SCT Data Table supported.

SMART Attributes Data Structure revision number: 16
Vendor Specific SMART Attributes with Thresholds:
ID# ATTRIBUTE_NAME          FLAGS    VALUE WORST THRESH FAIL RAW_VALUE
  1 Raw_Read_Error_Rate     POSR-K   100   100   000    -    0
  5 Reallocated_Sector_Ct   -O--CK   100   100   010    -    0
  9 Power_On_Hours          -O--CK   100   100   000    -    5075
 12 Power_Cycle_Count       -O--CK   100   100   000    -    998
171 Unknown_Attribute       -O--CK   100   100   000    -    0
172 Unknown_Attribute       -O--CK   100   100   000    -    0
173 Unknown_Attribute       -O--CK   097   097   000    -    47
174 Unknown_Attribute       -O--CK   100   100   000    -    48
180 Unused_Rsvd_Blk_Cnt_Tot PO--CK   000   000   000    -    46
183 Runtime_Bad_Block       -O--CK   100   100   000    -    0
184 End-to-End_Error        -O--CK   100   100   000    -    0
187 Reported_Uncorrect      -O--CK   100   100   000    -    0
194 Temperature_Celsius     -O---K   048   010   000    -    52 (Min/Max 0/90)
196 Reallocated_Event_Count -O--CK   100   100   000    -    0
197 Current_Pending_Sector  -O--CK   100   100   000    -    0
198 Offline_Uncorrectable   ----CK   100   100   000    -    0
199 UDMA_CRC_Error_Count    -O--CK   100   100   000    -    0
202 Unknown_SSD_Attribute   ----CK   097   097   001    -    3
206 Unknown_SSD_Attribute   -OSR--   100   100   000    -    0
210 Unknown_Attribute       -O--CK   100   100   000    -    0
246 Unknown_Attribute       -O--CK   100   100   000    -    11290944858
247 Unknown_Attribute       -O--CK   100   100   000    -    205148553
248 Unknown_Attribute       -O--CK   100   100   000    -    295896511
                            ||||||_ K auto-keep
                            |||||__ C event count
                            ||||___ R error rate
                            |||____ S speed/performance
                            ||_____ O updated online
                            |______ P prefailure warning

General Purpose Log Directory Version 1
SMART           Log Directory Version 1 [multi-sector log support]
Address    Access  R/W   Size  Description
0x00       GPL,SL  R/O      1  Log Directory
0x01           SL  R/O      1  Summary SMART error log
0x02           SL  R/O      1  Comprehensive SMART error log
0x03       GPL     R/O      1  Ext. Comprehensive SMART error log
0x04       GPL,SL  R/O      8  Device Statistics log
0x06           SL  R/O      1  SMART self-test log
0x07       GPL     R/O      1  Extended self-test log
0x09           SL  R/W      1  Selective self-test log
0x10       GPL     R/O      1  SATA NCQ Queued Error log
0x11       GPL     R/O      1  SATA Phy Event Counters log
0x24       GPL     R/O     88  Current Device Internal Status Data log
0x25       GPL     R/O     64  Saved Device Internal Status Data log
0x30       GPL,SL  R/O      9  IDENTIFY DEVICE data log
0x80-0x9f  GPL,SL  R/W     16  Host vendor specific log
0xe0       GPL,SL  R/W      1  SCT Command/Status
0xe1       GPL,SL  R/W      1  SCT Data Transfer

SMART Extended Comprehensive Error Log Version: 1 (1 sectors)
No Errors Logged

SMART Extended Self-test Log Version: 1 (1 sectors)
Num  Test_Description    Status                  Remaining  LifeTime(hours)  LBA_of_first_error
# 1  Short offline       Completed without error       00%      5075         -

SMART Selective self-test log data structure revision number 1
 SPAN  MIN_LBA  MAX_LBA  CURRENT_TEST_STATUS
    1        0        0  Not_testing
    2        0        0  Not_testing
    3        0        0  Not_testing
    4        0        0  Not_testing
    5        0        0  Not_testing
Selective self-test flags (0x0):
  After scanning selected spans, do NOT read-scan remainder of disk.
If Selective self-test is pending on power-up, resume after 0 minute delay.

SCT Status Version:                  3
SCT Version (vendor specific):       1 (0x0001)
SCT Support Level:                   0
Device State:                        Active (0)
Current Temperature:                    52 Celsius
Power Cycle Min/Max Temperature:     48/76 Celsius
Lifetime    Min/Max Temperature:      0/90 Celsius
Under/Over Temperature Limit Count:   0/0

SCT Temperature History Version:     2
Temperature Sampling Period:         1 minute
Temperature Logging Interval:        1 minute
Min/Max recommended Temperature:      0/100 Celsius
Min/Max Temperature Limit:            0/100 Celsius
Temperature History Size (Index):    128 (15)

Index    Estimated Time   Temperature Celsius
  16    2020-04-16 09:30    57  **************************************
  17    2020-04-16 09:31    60  ***************************************+
  18    2020-04-16 09:32    62  ***************************************+
  19    2020-04-16 09:33    59  ****************************************
  20    2020-04-16 09:34    57  **************************************
  21    2020-04-16 09:35    55  ************************************
  22    2020-04-16 09:36    57  **************************************
  23    2020-04-16 09:37    60  ***************************************+
  24    2020-04-16 09:38    59  ****************************************
  25    2020-04-16 09:39    57  **************************************
  26    2020-04-16 09:40    55  ************************************
  27    2020-04-16 09:41    57  **************************************
 ...    ..(  2 skipped).    ..  **************************************
  30    2020-04-16 09:44    57  **************************************
  31    2020-04-16 09:45    55  ************************************
  32    2020-04-16 09:46    57  **************************************
  33    2020-04-16 09:47    57  **************************************
  34    2020-04-16 09:48    55  ************************************
  35    2020-04-16 09:49    57  **************************************
  36    2020-04-16 09:50    54  ***********************************
  37    2020-04-16 09:51    55  ************************************
  38    2020-04-16 09:52    55  ************************************
  39    2020-04-16 09:53    54  ***********************************
  40    2020-04-16 09:54    54  ***********************************
  41    2020-04-16 09:55    52  *********************************
  42    2020-04-16 09:56    54  ***********************************
  43    2020-04-16 09:57    52  *********************************
  44    2020-04-16 09:58    55  ************************************
  45    2020-04-16 09:59    54  ***********************************
  46    2020-04-16 10:00    52  *********************************
  47    2020-04-16 10:01    54  ***********************************
  48    2020-04-16 10:02    52  *********************************
  49    2020-04-16 10:03    59  ****************************************
  50    2020-04-16 10:04    54  ***********************************
  51    2020-04-16 10:05    54  ***********************************
  52    2020-04-16 10:06    55  ************************************
  53    2020-04-16 10:07    55  ************************************
  54    2020-04-16 10:08    52  *********************************
  55    2020-04-16 10:09    55  ************************************
  56    2020-04-16 10:10    54  ***********************************
  57    2020-04-16 10:11    54  ***********************************
  58    2020-04-16 10:12    52  *********************************
  59    2020-04-16 10:13    54  ***********************************
  60    2020-04-16 10:14    52  *********************************
  61    2020-04-16 10:15    54  ***********************************
  62    2020-04-16 10:16    54  ***********************************
  63    2020-04-16 10:17    52  *********************************
  64    2020-04-16 10:18    54  ***********************************
  65    2020-04-16 10:19    52  *********************************
  66    2020-04-16 10:20    52  *********************************
  67    2020-04-16 10:21    55  ************************************
  68    2020-04-16 10:22    52  *********************************
  69    2020-04-16 10:23    52  *********************************
  70    2020-04-16 10:24    55  ************************************
  71    2020-04-16 10:25    52  *********************************
  72    2020-04-16 10:26    52  *********************************
  73    2020-04-16 10:27    52  *********************************
  74    2020-04-16 10:28    54  ***********************************
  75    2020-04-16 10:29    55  ************************************
  76    2020-04-16 10:30    52  *********************************
  77    2020-04-16 10:31    54  ***********************************
  78    2020-04-16 10:32    54  ***********************************
  79    2020-04-16 10:33    54  ***********************************
  80    2020-04-16 10:34    52  *********************************
  81    2020-04-16 10:35    54  ***********************************
  82    2020-04-16 10:36    52  *********************************
  83    2020-04-16 10:37    52  *********************************
  84    2020-04-16 10:38    54  ***********************************
  85    2020-04-16 10:39    54  ***********************************
  86    2020-04-16 10:40    54  ***********************************
  87    2020-04-16 10:41    55  ************************************
  88    2020-04-16 10:42    54  ***********************************
  89    2020-04-16 10:43    52  *********************************
  90    2020-04-16 10:44    52  *********************************
  91    2020-04-16 10:45    54  ***********************************
  92    2020-04-16 10:46    52  *********************************
  93    2020-04-16 10:47    52  *********************************
  94    2020-04-16 10:48    54  ***********************************
  95    2020-04-16 10:49    52  *********************************
  96    2020-04-16 10:50    54  ***********************************
  97    2020-04-16 10:51    52  *********************************
  98    2020-04-16 10:52    54  ***********************************
  99    2020-04-16 10:53    54  ***********************************
 100    2020-04-16 10:54    54  ***********************************
 101    2020-04-16 10:55    52  *********************************
 102    2020-04-16 10:56    59  ****************************************
 103    2020-04-16 10:57    54  ***********************************
 104    2020-04-16 10:58    54  ***********************************
 105    2020-04-16 10:59    52  *********************************
 106    2020-04-16 11:00    54  ***********************************
 107    2020-04-16 11:01    52  *********************************
 108    2020-04-16 11:02    52  *********************************
 109    2020-04-16 11:03    54  ***********************************
 110    2020-04-16 11:04    54  ***********************************
 111    2020-04-16 11:05    52  *********************************
 112    2020-04-16 11:06    52  *********************************
 113    2020-04-16 11:07    54  ***********************************
 ...    ..(  2 skipped).    ..  ***********************************
 116    2020-04-16 11:10    54  ***********************************
 117    2020-04-16 11:11    52  *********************************
 118    2020-04-16 11:12    54  ***********************************
 119    2020-04-16 11:13    54  ***********************************
 120    2020-04-16 11:14    52  *********************************
 121    2020-04-16 11:15    54  ***********************************
 122    2020-04-16 11:16    52  *********************************
 123    2020-04-16 11:17    54  ***********************************
 124    2020-04-16 11:18    54  ***********************************
 125    2020-04-16 11:19    54  ***********************************
 126    2020-04-16 11:20    52  *********************************
 127    2020-04-16 11:21    54  ***********************************
   0    2020-04-16 11:22    54  ***********************************
   1    2020-04-16 11:23    52  *********************************
   2    2020-04-16 11:24    60  ***************************************+
   3    2020-04-16 11:25    64  ***************************************+
   4    2020-04-16 11:26    55  ************************************
   5    2020-04-16 11:27    55  ************************************
   6    2020-04-16 11:28    52  *********************************
   7    2020-04-16 11:29    55  ************************************
   8    2020-04-16 11:30    52  *********************************
 ...    ..(  3 skipped).    ..  *********************************
  12    2020-04-16 11:34    52  *********************************
  13    2020-04-16 11:35    54  ***********************************
  14    2020-04-16 11:36    54  ***********************************
  15    2020-04-16 11:37    54  ***********************************

SCT Error Recovery Control command not supported

Device Statistics (GP Log 0x04)
Page  Offset Size        Value Flags Description
0x01  =====  =               =  ===  == General Statistics (rev 1) ==
0x01  0x008  4             998  ---  Lifetime Power-On Resets
0x01  0x010  4            5075  ---  Power-on Hours
0x01  0x018  6      2701010266  ---  Logical Sectors Written
0x01  0x020  6       226665106  ---  Number of Write Commands
0x01  0x028  6       983406890  ---  Logical Sectors Read
0x01  0x030  6       158655670  ---  Number of Read Commands
0x01  0x038  6      4294967296  ---  Date and Time TimeStamp
0x04  =====  =               =  ===  == General Errors Statistics (rev 1) ==
0x04  0x008  4               0  ---  Number of Reported Uncorrectable Errors
0x04  0x010  4              48  ---  Resets Between Cmd Acceptance and Completion
0x05  =====  =               =  ===  == Temperature Statistics (rev 1) ==
0x05  0x008  1              52  ---  Current Temperature
0x05  0x010  1              53  ---  Average Short Term Temperature
0x05  0x018  1              53  ---  Average Long Term Temperature
0x05  0x020  1              90  ---  Highest Temperature
0x05  0x028  1               0  ---  Lowest Temperature
0x05  0x030  1              69  ---  Highest Average Short Term Temperature
0x05  0x038  1               0  ---  Lowest Average Short Term Temperature
0x05  0x040  1              69  ---  Highest Average Long Term Temperature
0x05  0x048  1               0  ---  Lowest Average Long Term Temperature
0x05  0x050  4              93  ---  Time in Over-Temperature
0x05  0x058  1              70  ---  Specified Maximum Operating Temperature
0x05  0x060  4               0  ---  Time in Under-Temperature
0x05  0x068  1               0  ---  Specified Minimum Operating Temperature
0x06  =====  =               =  ===  == Transport Statistics (rev 1) ==
0x06  0x008  4            3711  ---  Number of Hardware Resets
0x06  0x010  4             495  ---  Number of ASR Events
0x06  0x018  4               0  ---  Number of Interface CRC Errors
0x07  =====  =               =  ===  == Solid State Device Statistics (rev 1) ==
0x07  0x008  1               3  ---  Percentage Used Endurance Indicator
                                |||_ C monitored condition met
                                ||__ D supports DSN
                                |___ N normalized value

SATA Phy Event Counters (GP Log 0x11)
ID      Size     Value  Description
0x0001  2            0  Command failed due to ICRC error
0x0002  2            0  R_ERR response for data FIS
0x0003  2            0  R_ERR response for device-to-host data FIS
0x0004  2            0  R_ERR response for host-to-device data FIS
0x0005  2            0  R_ERR response for non-data FIS
0x0006  2            0  R_ERR response for device-to-host non-data FIS
0x0007  2            0  R_ERR response for host-to-device non-data FIS
0x0008  2            0  Device-to-host non-data FIS retries
0x0009  2            0  Transition from drive PhyRdy to drive PhyNRdy
0x000a  2            4  Device-to-host register FISes sent due to a COMRESET
0x000b  2            0  CRC errors within host-to-device FIS
0x000d  2            0  Non-CRC errors within host-to-device FIS
0x000f  2            0  R_ERR response for host-to-device data FIS, CRC
0x0010  2            0  R_ERR response for host-to-device data FIS, non-CRC
0x0012  2            0  R_ERR response for host-to-device non-data FIS, CRC
0x0013  2            0  R_ERR response for host-to-device non-data FIS, non-CRC

