-bash-4.1# ./smartctl -A /dev/sdd
smartctl 6.6 2017-03-11 r4410 [x86_64-linux-2.6.32-431.el6.x86_64] (local build)
Copyright (C) 2002-17, Bruce Allen, Christian Franke, www.smartmontools.org

=== START OF READ SMART DATA SECTION ===
SMART Attributes Data Structure revision number: 16
Vendor Specific SMART Attributes with Thresholds:
ID# ATTRIBUTE_NAME          FLAG     VALUE WORST THRESH TYPE      UPDATED  WHEN_FAILED RAW_VALUE
  5 Reallocated_Sector_Ct   0x0033   100   100   010    Pre-fail  Always       -       0
  9 Power_On_Hours          0x0032   096   096   000    Old_age   Always       -       3504 (0 5 0)
 13 Lifetime_UECC_Ct        0x0012   100   100   001    Old_age   Always       -       8
 32 Lifetime_Write_AmpFctr  0x0002   100   100   000    Old_age   Always       -       0
 33 Write_AmpFctr           0x0002   100   100   000    Old_age   Always       -       100
170 Reserve_Erase_BlkCt     0x0032   100   100   000    Old_age   Always       -       11379
171 Program_Fail_Ct         0x0032   100   100   000    Old_age   Always       -       0
172 Erase_Fail_Ct           0x0032   100   100   000    Old_age   Always       -       0
175 Lifetime_Die_Failure_Ct 0x0032   100   100   000    Old_age   Always       -       0
178 SSD_LifeLeft(0.01%)     0x0012   100   100   000    Old_age   Always       -       7178
183 LT_Link_Rate_DwnGrd_Ct  0x0032   100   100   000    Old_age   Always       -       0
191 Clean_Shutdown_Ct       0x0032   100   100   000    Old_age   Always       -       17
192 Unclean_Shutdown_Ct     0x0032   100   100   000    Old_age   Always       -       0
194 Temperature_Celsius     0x0022   066   051   030    Old_age   Always       -       34 (Min/Max 22/49)
196 Lifetime_Retried_Blk_Ct 0x001b   100   100   010    Pre-fail  Always       -       0
211 Read_Disturb_ReallocEvt 0x0032   100   100   000    Old_age   Always       -       0
233 Lifetime_Nand_Writes    0x0032   100   100   000    Old_age   Always       -       107648
235 Capacitor_Health        0x0032   100   100   000    Old_age   Always       -       0
241 Total_LBAs_Written      0x0032   100   100   000    Old_age   Always       -       0
242 Total_LBAs_Read         0x0032   100   100   000    Old_age   Always       -       0
244 Therm_Throt_Activation  0x0032   100   100   000    Old_age   Always       -       0
245 Drive_Life_Remaining%   0x0012   072   072   002    Old_age   Always       -       72
253 SPI_Test_Remaining      0x0012   100   100   001    Old_age   Always       -       0





-bash-4.1# ./smartctl -x /dev/sdd
smartctl 6.6 2017-03-11 r4410 [x86_64-linux-2.6.32-431.el6.x86_64] (local build)
Copyright (C) 2002-17, Bruce Allen, Christian Franke, www.smartmontools.org

=== START OF INFORMATION SECTION ===
Model Family:     Sandisk SATA Cloudspeed Max and GEN2 ESS SSDs
Device Model:     SDLF1DAR-480G-1HAW
Serial Number:    20010963
LU WWN Device Id: 5 001173 10073e534
Firmware Version: ZR07RE41
User Capacity:    480,103,981,056 bytes [480 GB]
Sector Sizes:     512 bytes logical, 4096 bytes physical
Rotation Rate:    Solid State Device
Device is:        In smartctl database [for details use: -P show]
ATA Version is:   ATA8-ACS T13/1699-D revision 4c
SATA Version is:  ATA8-AST, 6.0 Gb/s (current: 6.0 Gb/s)
Local Time is:    Mon Jul 10 19:32:55 2017 IST
SMART support is: Available - device has SMART capability.
SMART support is: Enabled
AAM feature is:   Unavailable
APM feature is:   Unavailable
Rd look-ahead is: Enabled
Write cache is:   Enabled
DSN feature is:   Unavailable
ATA Security is:  Disabled, NOT FROZEN [SEC1]
Wt Cache Reorder: Unknown

=== START OF READ SMART DATA SECTION ===
SMART Status not supported: Incomplete response, ATA output registers missing
SMART overall-health self-assessment test result: PASSED
Warning: This result is based on an Attribute check.

General SMART Values:
Offline data collection status:  (0x00) Offline data collection activity
                                        was never started.
                                        Auto Offline Data Collection: Disabled.
Self-test execution status:      (   0) The previous self-test routine completed
                                        without error or no self-test has ever
                                        been run.
Total time to complete Offline
data collection:                ( 5040) seconds.
Offline data collection
capabilities:                    (0x5d) SMART execute Offline immediate.
                                        No Auto Offline data collection support.
                                        Abort Offline collection upon new
                                        command.
                                        Offline surface scan supported.
                                        Self-test supported.
                                        No Conveyance Self-test supported.
                                        Selective Self-test supported.
SMART capabilities:            (0x0003) Saves SMART data before entering
                                        power-saving mode.
                                        Supports SMART auto save timer.
Error logging capability:        (0x01) Error logging supported.
                                        General Purpose Logging supported.
Short self-test routine
recommended polling time:        (   1) minutes.
Extended self-test routine
recommended polling time:        (   1) minutes.
SCT capabilities:              (0x003d) SCT Status supported.
                                        SCT Error Recovery Control supported.
                                        SCT Feature Control supported.
                                        SCT Data Table supported.

SMART Attributes Data Structure revision number: 16
Vendor Specific SMART Attributes with Thresholds:
ID# ATTRIBUTE_NAME          FLAGS    VALUE WORST THRESH FAIL RAW_VALUE
  5 Reallocated_Sector_Ct   PO--CK   100   100   010    -    0
  9 Power_On_Hours          -O--CK   096   096   000    -    3504 (2 25 0)
 13 Lifetime_UECC_Ct        -O--C-   100   100   001    -    8
 32 Lifetime_Write_AmpFctr  -O----   100   100   000    -    0
 33 Write_AmpFctr           -O----   100   100   000    -    100
170 Reserve_Erase_BlkCt     -O--CK   100   100   000    -    11379
171 Program_Fail_Ct         -O--CK   100   100   000    -    0
172 Erase_Fail_Ct           -O--CK   100   100   000    -    0
175 Lifetime_Die_Failure_Ct -O--CK   100   100   000    -    0
178 SSD_LifeLeft(0.01%)     -O--C-   100   100   000    -    7178
183 LT_Link_Rate_DwnGrd_Ct  -O--CK   100   100   000    -    0
191 Clean_Shutdown_Ct       -O--CK   100   100   000    -    17
192 Unclean_Shutdown_Ct     -O--CK   100   100   000    -    0
194 Temperature_Celsius     -O---K   066   051   030    -    34 (Min/Max 22/49)
196 Lifetime_Retried_Blk_Ct PO-RC-   100   100   010    -    0
211 Read_Disturb_ReallocEvt -O--CK   100   100   000    -    0
233 Lifetime_Nand_Writes    -O--CK   100   100   000    -    107648
235 Capacitor_Health        -O--CK   100   100   000    -    0
241 Total_LBAs_Written      -O--CK   100   100   000    -    0
242 Total_LBAs_Read         -O--CK   100   100   000    -    0
244 Therm_Throt_Activation  -O--CK   100   100   000    -    0
245 Drive_Life_Remaining%   -O--C-   072   072   002    -    72
253 SPI_Test_Remaining      -O--C-   100   100   001    -    0
                            ||||||_ K auto-keep
                            |||||__ C event count
                            ||||___ R error rate
                            |||____ S speed/performance
                            ||_____ O updated online
                            |______ P prefailure warning

General Purpose Log Directory Version 1
SMART           Log Directory Version 1 [multi-sector log support]
Address    Access  R/W   Size  Description
0x00       GPL,SL  R/O      1  Log Directory
0x01           SL  R/O      1  Summary SMART error log
0x02           SL  R/O      1  Comprehensive SMART error log
0x03       GPL     R/O      1  Ext. Comprehensive SMART error log
0x04       GPL,SL  R/O      6  Device Statistics log
0x06           SL  R/O      1  SMART self-test log
0x07       GPL     R/O      2  Extended self-test log
0x09           SL  R/W      1  Selective self-test log
0x10       GPL     R/O      1  SATA NCQ Queued Error log
0x11       GPL     R/O      1  SATA Phy Event Counters log
0x13       GPL,SL  R/O      1  SATA NCQ Send and Receive log
0x30       GPL,SL  R/O      8  IDENTIFY DEVICE data log
0x80-0x9f  GPL,SL  R/W      2  Host vendor specific log
0xe0       GPL,SL  R/W      1  SCT Command/Status
0xe1       GPL,SL  R/W      1  SCT Data Transfer

SMART Extended Comprehensive Error Log Version: 1 (1 sectors)
Device Error Count: 12192 (device log contains only the most recent 4 errors)
        CR     = Command Register
        FEATR  = Features Register
        COUNT  = Count (was: Sector Count) Register
        LBA_48 = Upper bytes of LBA High/Mid/Low Registers ]  ATA-8
        LH     = LBA High (was: Cylinder High) Register    ]   LBA
        LM     = LBA Mid (was: Cylinder Low) Register      ] Register
        LL     = LBA Low (was: Sector Number) Register     ]
        DV     = Device (was: Device/Head) Register
        DC     = Device Control Register
        ER     = Error register
        ST     = Status register
Powered_Up_Time is measured from power on, and printed as
DDd+hh:mm:SS.sss where DD=days, hh=hours, mm=minutes,
SS=sec, and sss=millisec. It "wraps" after 49.710 days.

Error 12192 [2] occurred at disk power-on lifetime: 3249 hours (135 days + 9 hours)
  When the command that caused the error occurred, the device was in an unknown state.

  After command completion occurred, registers were:
  ER -- ST COUNT  LBA_48  LH LM LL DV DC
  -- -- -- == -- == == == -- -- -- -- --
  40 -- 41 00 00 00 00 37 e4 36 00 00 00  Error: UNC at LBA = 0x37e43600 = 937702912

  Commands leading to the command that caused the error were:
  CR FEATR COUNT  LBA_48  LH LM LL DV DC  Powered_Up_Time  Command/Feature_Name
  -- == -- == -- == == == -- -- -- -- --  ---------------  --------------------
  60 00 08 00 00 00 00 37 e4 36 00 40 00     00:00:00.003  READ FPDMA QUEUED
  ec 00 00 00 00 00 00 00 00 00 00 00 00     00:00:00.003  IDENTIFY DEVICE
  ec 00 00 00 00 00 00 00 00 00 00 00 00     00:00:00.003  IDENTIFY DEVICE
  ec 00 00 00 00 00 00 00 00 00 00 00 00     00:00:00.003  IDENTIFY DEVICE
  ec 00 00 00 00 00 00 00 00 00 00 00 00     00:00:00.003  IDENTIFY DEVICE

Error 12191 [1] occurred at disk power-on lifetime: 1891 hours (78 days + 19 hours)
  When the command that caused the error occurred, the device was in an unknown state.

  After command completion occurred, registers were:
  ER -- ST COUNT  LBA_48  LH LM LL DV DC
  -- -- -- == -- == == == -- -- -- -- --
  04 -- 41 00 08 00 00 37 e4 36 08 00 00  Error: ABRT at LBA = 0x37e43608 = 937702920

  Commands leading to the command that caused the error were:
  CR FEATR COUNT  LBA_48  LH LM LL DV DC  Powered_Up_Time  Command/Feature_Name
  -- == -- == -- == == == -- -- -- -- --  ---------------  --------------------
  60 00 08 00 f8 00 00 37 e4 36 00 40 00     00:00:00.004  READ FPDMA QUEUED
  ec 00 00 00 01 00 00 00 00 00 00 00 00     00:00:00.004  IDENTIFY DEVICE
  b4 00 00 00 00 00 00 00 00 00 00 00 00     00:00:00.004  SANITIZE DEVICE
  ec 00 00 00 01 00 00 00 00 00 00 00 00     00:00:00.004  IDENTIFY DEVICE
  ec 00 00 00 01 00 00 00 00 00 00 00 00     00:00:00.004  IDENTIFY DEVICE

Error 12190 [0] occurred at disk power-on lifetime: 1891 hours (78 days + 19 hours)
  When the command that caused the error occurred, the device was in an unknown state.

  After command completion occurred, registers were:
  ER -- ST COUNT  LBA_48  LH LM LL DV DC
  -- -- -- == -- == == == -- -- -- -- --
  04 -- 41 00 08 00 00 37 e4 36 08 00 00  Error: ABRT at LBA = 0x37e43608 = 937702920

  Commands leading to the command that caused the error were:
  CR FEATR COUNT  LBA_48  LH LM LL DV DC  Powered_Up_Time  Command/Feature_Name
  -- == -- == -- == == == -- -- -- -- --  ---------------  --------------------
  60 00 08 00 58 00 00 37 e4 36 00 40 00     00:00:00.004  READ FPDMA QUEUED
  ec 00 00 00 01 00 00 00 00 00 00 00 00     00:00:00.004  IDENTIFY DEVICE
  b4 00 00 00 00 00 00 00 00 00 00 00 00     00:00:00.004  SANITIZE DEVICE
  ec 00 00 00 01 00 00 00 00 00 00 00 00     00:00:00.004  IDENTIFY DEVICE
  ec 00 00 00 01 00 00 00 00 00 00 00 00     00:00:00.004  IDENTIFY DEVICE

Error 12189 [3] occurred at disk power-on lifetime: 1887 hours (78 days + 15 hours)
  When the command that caused the error occurred, the device was in an unknown state.

  After command completion occurred, registers were:
  ER -- ST COUNT  LBA_48  LH LM LL DV DC
  -- -- -- == -- == == == -- -- -- -- --
  04 -- 51 00 01 00 00 00 c2 4f 00 00 00  Error: ABRT

  Commands leading to the command that caused the error were:
  CR FEATR COUNT  LBA_48  LH LM LL DV DC  Powered_Up_Time  Command/Feature_Name
  -- == -- == -- == == == -- -- -- -- --  ---------------  --------------------
  b0 00 d1 00 01 00 00 00 c2 4f 00 00 00     00:00:00.003  SMART READ ATTRIBUTE THRESHOLDS [OBS-4]
  b0 00 da 00 01 00 00 00 c2 4f 00 00 00     00:00:00.003  SMART RETURN STATUS
  b4 00 00 00 00 00 00 00 00 00 00 00 00     00:00:00.003  SANITIZE DEVICE
  b0 00 d0 00 01 00 00 00 c2 4f 00 00 00     00:00:00.003  SMART READ DATA
  ec 00 00 00 01 00 00 00 00 00 00 00 00     00:00:00.003  IDENTIFY DEVICE

SMART Extended Self-test Log Version: 1 (2 sectors)
No self-tests have been logged.  [To run self-tests, use: smartctl -t]

SMART Selective self-test log data structure revision number 1
 SPAN  MIN_LBA  MAX_LBA  CURRENT_TEST_STATUS
    1        0        0  Not_testing
    2        0        0  Not_testing
    3        0        0  Not_testing
    4        0        0  Not_testing
    5        0        0  Not_testing
Selective self-test flags (0x0):
  After scanning selected spans, do NOT read-scan remainder of disk.
If Selective self-test is pending on power-up, resume after 0 minute delay.

SCT Status Version:                  3
SCT Version (vendor specific):       0 (0x0000)
SCT Support Level:                   1
Device State:                        Active (0)
Current Temperature:                    34 Celsius
Power Cycle Min/Max Temperature:     33/41 Celsius
Lifetime    Min/Max Temperature:     22/49 Celsius
Under/Over Temperature Limit Count:   0/0
Vendor specific:
00 00 00 00 00 00 00 00 00 00 00 00 00 00 00 00
00 00 00 00 00 00 00 00 00 00 00 00 00 00 00 43

SCT Temperature History Version:     2
Temperature Sampling Period:         1 minute
Temperature Logging Interval:        1 minute
Min/Max recommended Temperature:      0/65 Celsius
Min/Max Temperature Limit:            0/70 Celsius
Temperature History Size (Index):    478 (457)

Index    Estimated Time   Temperature Celsius
 458    2017-07-10 11:35    34  ***************
 ...    ..( 27 skipped).    ..  ***************
   8    2017-07-10 12:03    34  ***************
   9    2017-07-10 12:04    35  ****************
  10    2017-07-10 12:05    34  ***************
 ...    ..(149 skipped).    ..  ***************
 160    2017-07-10 14:35    34  ***************
 161    2017-07-10 14:36    35  ****************
 162    2017-07-10 14:37    35  ****************
 163    2017-07-10 14:38    34  ***************
 ...    ..( 90 skipped).    ..  ***************
 254    2017-07-10 16:09    34  ***************
 255    2017-07-10 16:10    35  ****************
 ...    ..( 62 skipped).    ..  ****************
 318    2017-07-10 17:13    35  ****************
 319    2017-07-10 17:14    34  ***************
 320    2017-07-10 17:15    35  ****************
 ...    ..(  4 skipped).    ..  ****************
 325    2017-07-10 17:20    35  ****************
 326    2017-07-10 17:21    34  ***************
 ...    ..(130 skipped).    ..  ***************
 457    2017-07-10 19:32    34  ***************

SMART WRITE LOG does not return COUNT and LBA_LOW register
SCT (Get) Error Recovery Control command failed

Device Statistics (GP Log 0x04)
Page  Offset Size        Value Flags Description
0x01  =====  =               =  ===  == General Statistics (rev 1) ==
0x01  0x008  4              47  ---  Lifetime Power-On Resets
0x01  0x010  4            3504  ---  Power-on Hours
0x01  0x018  6         6000000  ---  Logical Sectors Written
0x01  0x020  6     60268553612  ---  Number of Write Commands
0x01  0x028  6         1042364  ---  Logical Sectors Read
0x01  0x030  6    682988664340  ---  Number of Read Commands
0x01  0x038  6      4024465408  ---  Date and Time TimeStamp
0x04  =====  =               =  ===  == General Errors Statistics (rev 1) ==
0x04  0x008  4           85812  ---  Number of Reported Uncorrectable Errors
0x04  0x010  4             480  ---  Resets Between Cmd Acceptance and Completion
0x05  =====  =               =  ===  == Temperature Statistics (rev 1) ==
0x05  0x008  1              34  ---  Current Temperature
0x05  0x010  1              34  ---  Average Short Term Temperature
0x05  0x018  1              34  ---  Average Long Term Temperature
0x05  0x020  1              49  ---  Highest Temperature
0x05  0x028  1              22  ---  Lowest Temperature
0x05  0x030  1              48  ---  Highest Average Short Term Temperature
0x05  0x038  1              21  ---  Lowest Average Short Term Temperature
0x05  0x040  1              48  ---  Highest Average Long Term Temperature
0x05  0x048  1              26  ---  Lowest Average Long Term Temperature
0x05  0x050  4               0  ---  Time in Over-Temperature
0x05  0x058  1              70  ---  Specified Maximum Operating Temperature
0x05  0x060  4              60  ---  Time in Under-Temperature
0x05  0x068  1               0  ---  Specified Minimum Operating Temperature
0x06  =====  =               =  ===  == Transport Statistics (rev 1) ==
0x06  0x008  4           12490  ---  Number of Hardware Resets
0x06  0x010  4             105  ---  Number of ASR Events
0x06  0x018  4               0  ---  Number of Interface CRC Errors
0x07  =====  =               =  ===  == Solid State Device Statistics (rev 1) ==
0x07  0x008  1              28  ---  Percentage Used Endurance Indicator
                                |||_ C monitored condition met
                                ||__ D supports DSN
                                |___ N normalized value

SATA Phy Event Counters (GP Log 0x11)
ID      Size     Value  Description
0x0001  2            0  Command failed due to ICRC error
0x000a  2          796  Device-to-host register FISes sent due to a COMRESET
0x0003  2            0  R_ERR response for device-to-host data FIS
0x0004  2            0  R_ERR response for host-to-device data FIS
0x0006  2            0  R_ERR response for device-to-host non-data FIS
0x000b  2            0  CRC errors within host-to-device FIS
0x000d  2            0  Non-CRC errors within host-to-device FIS

-bash-4.1#
