C:\Users\Administrator\Desktop\new\smartmontools\bin>smartctl.exe -A /dev/sdb
smartctl 6.6 2017-05-03 r4430 [x86_64-w64-mingw32-2012r2] (daily-20170503)
Copyright (C) 2002-17, Bruce Allen, Christian Franke, www.smartmontools.org

=== START OF READ SMART DATA SECTION ===
SMART Attributes Data Structure revision number: 16
Vendor Specific SMART Attributes with Thresholds:
ID# ATTRIBUTE_NAME          FLAG     VALUE WORST THRESH TYPE      UPDATED  WHEN_FAILED RAW_VALUE
  5 Reallocated_Sector_Ct   0x0033   100   100   010    Pre-fail  Always       -       0
  9 Power_On_Hours          0x0032   099   099   000    Old_age   Always       -       1190 (7 41 0)
 13 Read_Soft_Error_Rate    0x0012   100   100   001    Old_age   Always       -       0
 32 Unknown_Attribute       0x0002   100   100   000    Old_age   Always       -       0
 33 Unknown_Attribute       0x0002   100   100   000    Old_age   Always       -       100
170 Unknown_Attribute       0x0032   100   100   000    Old_age   Always       -       4298
171 Unknown_Attribute       0x0032   100   100   000    Old_age   Always       -       0
172 Unknown_Attribute       0x0032   100   100   000    Old_age   Always       -       0
175 Program_Fail_Count_Chip 0x0032   100   100   000    Old_age   Always       -       0
183 Runtime_Bad_Block       0x0032   100   100   000    Old_age   Always       -       0
191 Unknown_SSD_Attribute   0x0032   100   100   000    Old_age   Always       -       53
192 Power-Off_Retract_Count 0x0032   100   100   000    Old_age   Always       -       0
194 Temperature_Celsius     0x0022   066   054   030    Old_age   Always       -       34 (Min/Max 21/46)
196 Reallocated_Event_Count 0x001b   100   100   010    Pre-fail  Always       -       0
199 UDMA_CRC_Error_Count    0x003e   100   100   000    Old_age   Always       -       0
211 Unknown_Attribute       0x0032   100   100   000    Old_age   Always       -       0
233 Media_Wearout_Indicator 0x0032   100   100   000    Old_age   Always       -       0
235 Unknown_Attribute       0x0032   100   100   000    Old_age   Always       -       0
241 Total_LBAs_Written      0x0032   100   100   000    Old_age   Always       -       0
242 Total_LBAs_Read         0x0032   100   100   000    Old_age   Always       -       0
244 Unknown_Attribute       0x0032   100   100   000    Old_age   Always       -       0
245 Unknown_Attribute       0x0012   098   098   002    Old_age   Always       -       98
253 Unknown_Attribute       0x0012   100   100   001    Old_age   Always       -       0


C:\Users\Administrator\Desktop\new\smartmontools\bin>smartctl.exe -i /dev/sdb
smartctl 6.6 2017-05-03 r4430 [x86_64-w64-mingw32-2012r2] (daily-20170503)
Copyright (C) 2002-17, Bruce Allen, Christian Franke, www.smartmontools.org

=== START OF INFORMATION SECTION ===
Device Model:     SDLF1DAM-400G-1HA1
Serial Number:    2001A9A3
LU WWN Device Id: 5 001173 100764510
Firmware Version: Z30MRP41
User Capacity:    400,088,457,216 bytes [400 GB]
Sector Sizes:     512 bytes logical, 4096 bytes physical
Rotation Rate:    Solid State Device
Device is:        Not in smartctl database [for details use: -P showall]
ATA Version is:   ATA8-ACS T13/1699-D revision 4c
SATA Version is:  SATA 3.1, 6.0 Gb/s (current: 6.0 Gb/s)
Local Time is:    Thu Jun 08 00:02:55 2017 PDT
SMART support is: Available - device has SMART capability.
SMART support is: Enabled


C:\Users\Administrator\Desktop\new\smartmontools\bin>







