smartctl 7.4 2023-08-01 r5530 [x86_64-linux-6.10.9-zen1-2-zen] (local build)
Copyright (C) 2002-23, Bruce Allen, Christian Franke, www.smartmontools.org

=== START OF INFORMATION SECTION ===
Device Model:     ST20000NM007D-3DJ103
Firmware Version: SN03
User Capacity:    20,000,588,955,648 bytes [20.0 TB]
Sector Sizes:     512 bytes logical, 4096 bytes physical
Rotation Rate:    7200 rpm
Form Factor:      3.5 inches
Device is:        Not in smartctl database 7.3/5528
ATA Version is:   ACS-4 (minor revision not indicated)
SATA Version is:  SATA 3.3, 6.0 Gb/s (current: 6.0 Gb/s)
Local Time is:    Fri Sep 13 10:47:21 2024 PDT
SMART support is: Available - device has SMART capability.
SMART support is: Enabled
AAM feature is:   Unavailable
APM feature is:   Unavailable
Rd look-ahead is: Enabled
Write cache is:   Enabled
DSN feature is:   Disabled
ATA Security is:  Disabled, frozen [SEC2]
Write SCT (Get) Feature Control Command failed: Connection timed out
Wt Cache Reorder: Unknown (SCT Feature Control command failed)

=== START OF READ SMART DATA SECTION ===
SMART overall-health self-assessment test result: PASSED

General SMART Values:
Offline data collection status:  (0x82)	Offline data collection activity
					was completed without error.
					Auto Offline Data Collection: Enabled.
Self-test execution status:      (   0)	The previous self-test routine completed
					without error or no self-test has ever 
					been run.
Total time to complete Offline 
data collection: 		(  559) seconds.
Offline data collection
capabilities: 			 (0x7b) SMART execute Offline immediate.
					Auto Offline data collection on/off support.
					Suspend Offline collection upon new
					command.
					Offline surface scan supported.
					Self-test supported.
					Conveyance Self-test supported.
					Selective Self-test supported.
SMART capabilities:            (0x0003)	Saves SMART data before entering
					power-saving mode.
					Supports SMART auto save timer.
Error logging capability:        (0x01)	Error logging supported.
					General Purpose Logging supported.
Short self-test routine 
recommended polling time: 	 (   1) minutes.
Extended self-test routine
recommended polling time: 	 (1704) minutes.
Conveyance self-test routine
recommended polling time: 	 (   2) minutes.
SCT capabilities: 	       (0x70bd)	SCT Status supported.
					SCT Error Recovery Control supported.
					SCT Feature Control supported.
					SCT Data Table supported.

SMART Attributes Data Structure revision number: 10
Vendor Specific SMART Attributes with Thresholds:
ID# ATTRIBUTE_NAME          FLAGS    VALUE WORST THRESH FAIL RAW_VALUE
  1 Raw_Read_Error_Rate     POSR--   082   064   044    -    159201740
  3 Spin_Up_Time            PO----   095   091   000    -    0
  4 Start_Stop_Count        -O--CK   100   100   020    -    264
  5 Reallocated_Sector_Ct   PO--CK   100   100   010    -    0
  7 Seek_Error_Rate         POSR--   088   060   045    -    667781755
  9 Power_On_Hours          -O--CK   093   093   000    -    6951
 10 Spin_Retry_Count        PO--C-   100   100   097    -    0
 12 Power_Cycle_Count       -O--CK   100   100   020    -    263
 18 Unknown_Attribute       PO-R--   100   100   050    -    0
187 Reported_Uncorrect      -O--CK   100   100   000    -    0
188 Command_Timeout         -O--CK   100   100   000    -    0
190 Airflow_Temperature_Cel -O---K   066   051   000    -    34 (Min/Max 28/41)
192 Power-Off_Retract_Count -O--CK   100   100   000    -    167
193 Load_Cycle_Count        -O--CK   098   098   000    -    5490
194 Temperature_Celsius     -O---K   034   048   000    -    34 (0 20 0 0 0)
197 Current_Pending_Sector  -O--C-   100   100   000    -    0
198 Offline_Uncorrectable   ----C-   100   100   000    -    0
199 UDMA_CRC_Error_Count    -OSRCK   200   200   000    -    0
200 Multi_Zone_Error_Rate   PO---K   100   100   001    -    0
240 Head_Flying_Hours       ------   100   100   000    -    4658 (39 212 0)
241 Total_LBAs_Written      ------   100   253   000    -    113730280025
242 Total_LBAs_Read         ------   100   253   000    -    484264958014
                            ||||||_ K auto-keep
                            |||||__ C event count
                            ||||___ R error rate
                            |||____ S speed/performance
                            ||_____ O updated online
                            |______ P prefailure warning

General Purpose Log Directory Version 1
SMART           Log Directory Version 1 [multi-sector log support]
Address    Access  R/W   Size  Description
0x00       GPL,SL  R/O      1  Log Directory
0x01           SL  R/O      1  Summary SMART error log
0x02           SL  R/O      5  Comprehensive SMART error log
0x03       GPL     R/O      5  Ext. Comprehensive SMART error log
0x04       GPL     R/O    256  Device Statistics log
0x04       SL      R/O      8  Device Statistics log
0x06           SL  R/O      1  SMART self-test log
0x07       GPL     R/O      1  Extended self-test log
0x08       GPL     R/O      2  Power Conditions log
0x09           SL  R/W      1  Selective self-test log
0x0a       GPL     R/W      8  Device Statistics Notification
0x0c       GPL     R/O   2048  Pending Defects log
0x10       GPL     R/O      1  NCQ Command Error log
0x11       GPL     R/O      1  SATA Phy Event Counters log
0x13       GPL     R/O      1  SATA NCQ Send and Receive log
0x21       GPL     R/O      1  Write stream error log
0x22       GPL     R/O      1  Read stream error log
0x24       GPL     R/O    768  Current Device Internal Status Data log
0x2f       GPL     R/O      1  Set Sector Configuration
0x30       GPL,SL  R/O      9  IDENTIFY DEVICE data log
0x80-0x9f  GPL,SL  R/W     16  Host vendor specific log
0xa1       GPL,SL  VS     160  Device vendor specific log
0xa2       GPL     VS   16320  Device vendor specific log
0xa4       GPL,SL  VS     160  Device vendor specific log
0xa6       GPL     VS     192  Device vendor specific log
0xa8-0xa9  GPL,SL  VS     136  Device vendor specific log
0xab       GPL     VS       1  Device vendor specific log
0xad       GPL     VS      16  Device vendor specific log
0xb1       GPL,SL  VS     160  Device vendor specific log
0xb6       GPL     VS    1920  Device vendor specific log
0xbe-0xbf  GPL     VS   65535  Device vendor specific log
0xc1       GPL,SL  VS       8  Device vendor specific log
0xc3       GPL,SL  VS      24  Device vendor specific log
0xc6       GPL     VS    5184  Device vendor specific log
0xc7       GPL,SL  VS       8  Device vendor specific log
0xc9       GPL,SL  VS       8  Device vendor specific log
0xca       GPL,SL  VS      16  Device vendor specific log
0xcd       GPL,SL  VS       1  Device vendor specific log
0xce       GPL     VS       1  Device vendor specific log
0xcf       GPL     VS     512  Device vendor specific log
0xd1       GPL     VS     656  Device vendor specific log
0xd2       GPL     VS   10256  Device vendor specific log
0xd4       GPL     VS    2048  Device vendor specific log
0xda       GPL,SL  VS       1  Device vendor specific log
0xe0       GPL,SL  R/W      1  SCT Command/Status
0xe1       GPL,SL  R/W      1  SCT Data Transfer

SMART Extended Comprehensive Error Log Version: 1 (5 sectors)
No Errors Logged

SMART Extended Self-test Log Version: 1 (1 sectors)
Num  Test_Description    Status                  Remaining  LifeTime(hours)  LBA_of_first_error
# 1  Short offline       Completed without error       00%      6951         -
# 2  Extended offline    Interrupted (host reset)      90%      6949         -
# 3  Extended offline    Aborted by host               90%         0         -
# 4  Short offline       Completed without error       00%         0         -

SMART Selective self-test log data structure revision number 1
 SPAN  MIN_LBA  MAX_LBA  CURRENT_TEST_STATUS
    1        0        0  Not_testing
    2        0        0  Not_testing
    3        0        0  Not_testing
    4        0        0  Not_testing
    5        0        0  Not_testing
Selective self-test flags (0x0):
  After scanning selected spans, do NOT read-scan remainder of disk.
If Selective self-test is pending on power-up, resume after 0 minute delay.

SCT Status Version:                  3
SCT Version (vendor specific):       522 (0x020a)
Device State:                        Active (0)
Current Temperature:                    34 Celsius
Power Cycle Min/Max Temperature:     28/41 Celsius
Lifetime    Min/Max Temperature:     19/48 Celsius
Under/Over Temperature Limit Count:   0/0
SMART Status:                        0xc24f (PASSED)
Vendor specific:
00 00 00 00 00 00 00 00 00 00 00 00 00 00 00 00
00 00 00 00 02 00 00 00 00 00 00 00 00 00 00 00

SCT Temperature History Version:     2
Temperature Sampling Period:         4 minutes
Temperature Logging Interval:        59 minutes
Min/Max recommended Temperature:     10/40 Celsius
Min/Max Temperature Limit:            5/60 Celsius
Temperature History Size (Index):    128 (38)

Index    Estimated Time   Temperature Celsius
  39    2024-09-08 05:46    37  ******************
  40    2024-09-08 06:45    38  *******************
  41    2024-09-08 07:44    38  *******************
  42    2024-09-08 08:43    37  ******************
  43    2024-09-08 09:42    34  ***************
  44    2024-09-08 10:41    36  *****************
  45    2024-09-08 11:40    37  ******************
  46    2024-09-08 12:39    34  ***************
  47    2024-09-08 13:38    35  ****************
  48    2024-09-08 14:37    37  ******************
  49    2024-09-08 15:36    37  ******************
  50    2024-09-08 16:35    38  *******************
  51    2024-09-08 17:34    38  *******************
  52    2024-09-08 18:33    39  ********************
  53    2024-09-08 19:32    38  *******************
 ...    ..(  2 skipped).    ..  *******************
  56    2024-09-08 22:29    38  *******************
  57    2024-09-08 23:28    36  *****************
  58    2024-09-09 00:27    33  **************
  59    2024-09-09 01:26    30  ***********
  60    2024-09-09 02:25    31  ************
  61    2024-09-09 03:24    33  **************
  62    2024-09-09 04:23    32  *************
  63    2024-09-09 05:22    33  **************
 ...    ..(  8 skipped).    ..  **************
  72    2024-09-09 14:13    33  **************
  73    2024-09-09 15:12    32  *************
  74    2024-09-09 16:11    32  *************
  75    2024-09-09 17:10    30  ***********
  76    2024-09-09 18:09    29  **********
  77    2024-09-09 19:08    31  ************
  78    2024-09-09 20:07    31  ************
  79    2024-09-09 21:06    32  *************
  80    2024-09-09 22:05    33  **************
  81    2024-09-09 23:04    33  **************
  82    2024-09-10 00:03    34  ***************
  83    2024-09-10 01:02    34  ***************
  84    2024-09-10 02:01    32  *************
  85    2024-09-10 03:00    32  *************
  86    2024-09-10 03:59    31  ************
  87    2024-09-10 04:58    33  **************
  88    2024-09-10 05:57    33  **************
  89    2024-09-10 06:56    30  ***********
  90    2024-09-10 07:55    32  *************
  91    2024-09-10 08:54    29  **********
  92    2024-09-10 09:53    30  ***********
  93    2024-09-10 10:52    29  **********
  94    2024-09-10 11:51    30  ***********
  95    2024-09-10 12:50    29  **********
  96    2024-09-10 13:49    30  ***********
  97    2024-09-10 14:48    32  *************
  98    2024-09-10 15:47    33  **************
  99    2024-09-10 16:46    33  **************
 100    2024-09-10 17:45    35  ****************
 101    2024-09-10 18:44    35  ****************
 102    2024-09-10 19:43    36  *****************
 103    2024-09-10 20:42    34  ***************
 104    2024-09-10 21:41    34  ***************
 105    2024-09-10 22:40    34  ***************
 106    2024-09-10 23:39    36  *****************
 107    2024-09-11 00:38    36  *****************
 108    2024-09-11 01:37    37  ******************
 109    2024-09-11 02:36    38  *******************
 110    2024-09-11 03:35    38  *******************
 111    2024-09-11 04:34    39  ********************
 112    2024-09-11 05:33    39  ********************
 113    2024-09-11 06:32    37  ******************
 114    2024-09-11 07:31    36  *****************
 115    2024-09-11 08:30    37  ******************
 116    2024-09-11 09:29    38  *******************
 ...    ..(  3 skipped).    ..  *******************
 120    2024-09-11 13:25    38  *******************
 121    2024-09-11 14:24    33  **************
 122    2024-09-11 15:23    32  *************
 123    2024-09-11 16:22    32  *************
 124    2024-09-11 17:21    34  ***************
 125    2024-09-11 18:20    31  ************
 ...    ..(  2 skipped).    ..  ************
   0    2024-09-11 21:17    31  ************
   1    2024-09-11 22:16    34  ***************
   2    2024-09-11 23:15    36  *****************
   3    2024-09-12 00:14    38  *******************
   4    2024-09-12 01:13    38  *******************
   5    2024-09-12 02:12    39  ********************
   6    2024-09-12 03:11    38  *******************
   7    2024-09-12 04:10    39  ********************
   8    2024-09-12 05:09    38  *******************
   9    2024-09-12 06:08    34  ***************
  10    2024-09-12 07:07    34  ***************
  11    2024-09-12 08:06    36  *****************
 ...    ..(  3 skipped).    ..  *****************
  15    2024-09-12 12:02    36  *****************
  16    2024-09-12 13:01    37  ******************
 ...    ..(  5 skipped).    ..  ******************
  22    2024-09-12 18:55    37  ******************
  23    2024-09-12 19:54    36  *****************
  24    2024-09-12 20:53    37  ******************
  25    2024-09-12 21:52    33  **************
  26    2024-09-12 22:51    29  **********
  27    2024-09-12 23:50    35  ****************
  28    2024-09-13 00:49    35  ****************
  29    2024-09-13 01:48    36  *****************
 ...    ..(  2 skipped).    ..  *****************
  32    2024-09-13 04:45    36  *****************
  33    2024-09-13 05:44    29  **********
  34    2024-09-13 06:43    32  *************
  35    2024-09-13 07:42    37  ******************
  36    2024-09-13 08:41    39  ********************
  37    2024-09-13 09:40    36  *****************
  38    2024-09-13 10:39    33  **************

SCT Error Recovery Control:
           Read:    100 (10.0 seconds)
          Write:    100 (10.0 seconds)

Device Statistics (GP Log 0x04)
Page  Offset Size        Value Flags Description
0x01  =====  =               =  ===  == General Statistics (rev 1) ==
0x01  0x008  4             263  ---  Lifetime Power-On Resets
0x01  0x010  4            6951  ---  Power-on Hours
0x01  0x018  6    113640810201  ---  Logical Sectors Written
0x01  0x020  6       471063899  ---  Number of Write Commands
0x01  0x028  6    477092634470  ---  Logical Sectors Read
0x01  0x030  6       655864247  ---  Number of Read Commands
0x01  0x038  6   1726249701680  ---  Date and Time TimeStamp
0x03  =====  =               =  ===  == Rotating Media Statistics (rev 1) ==
0x03  0x008  4            6836  ---  Spindle Motor Power-on Hours
0x03  0x010  4            4644  ---  Head Flying Hours
0x03  0x018  4            5490  ---  Head Load Events
0x03  0x020  4               0  ---  Number of Reallocated Logical Sectors
0x03  0x028  4               0  ---  Read Recovery Attempts
0x03  0x030  4               0  ---  Number of Mechanical Start Failures
0x03  0x038  4               0  ---  Number of Realloc. Candidate Logical Sectors
0x03  0x040  4             167  ---  Number of High Priority Unload Events
0x04  =====  =               =  ===  == General Errors Statistics (rev 1) ==
0x04  0x008  4               0  ---  Number of Reported Uncorrectable Errors
0x04  0x010  4               0  ---  Resets Between Cmd Acceptance and Completion
0x04  0x018  4               0  -D-  Physical Element Status Changed
0x05  =====  =               =  ===  == Temperature Statistics (rev 1) ==
0x05  0x008  1              34  ---  Current Temperature
0x05  0x010  1              36  ---  Average Short Term Temperature
0x05  0x018  1              34  ---  Average Long Term Temperature
0x05  0x020  1              48  ---  Highest Temperature
0x05  0x028  1              24  ---  Lowest Temperature
0x05  0x030  1              44  ---  Highest Average Short Term Temperature
0x05  0x038  1              27  ---  Lowest Average Short Term Temperature
0x05  0x040  1              37  ---  Highest Average Long Term Temperature
0x05  0x048  1              31  ---  Lowest Average Long Term Temperature
0x05  0x050  4               0  ---  Time in Over-Temperature
0x05  0x058  1              60  ---  Specified Maximum Operating Temperature
0x05  0x060  4               0  ---  Time in Under-Temperature
0x05  0x068  1               5  ---  Specified Minimum Operating Temperature
0x06  =====  =               =  ===  == Transport Statistics (rev 1) ==
0x06  0x008  4            2346  ---  Number of Hardware Resets
0x06  0x010  4             885  ---  Number of ASR Events
0x06  0x018  4               0  ---  Number of Interface CRC Errors
0xff  =====  =               =  ===  == Vendor Specific Statistics (rev 1) ==
0xff  0x008  7               0  ---  Vendor Specific
0xff  0x010  7               0  ---  Vendor Specific
0xff  0x018  7               0  ---  Vendor Specific
                                |||_ C monitored condition met
                                ||__ D supports DSN
                                |___ N normalized value

Pending Defects log (GP Log 0x0c)
No Defects Logged

SATA Phy Event Counters (GP Log 0x11)
ID      Size     Value  Description
0x000a  2           30  Device-to-host register FISes sent due to a COMRESET
0x0001  2            0  Command failed due to ICRC error
0x0003  2            0  R_ERR response for device-to-host data FIS
0x0004  2            0  R_ERR response for host-to-device data FIS
0x0006  2            0  R_ERR response for device-to-host non-data FIS
0x0007  2            0  R_ERR response for host-to-device non-data FIS

Seagate FARM log (GP Log 0xa6) supported [try: -l farm]

