smartctl 7.0 2018-12-30 r4883 [x86_64-linux-3.10.0-1160.25.1.el7.x86_64] (local build)
Copyright (C) 2002-18, Bruce Allen, Christian Franke, www.smartmontools.org

=== START OF INFORMATION SECTION ===
Device Model:     WDC  WUH721816ALE6L4
Serial Number:    2BGE2JEN
LU WWN Device Id: 5 000cca 295c5f252
Firmware Version: PCGNW120
User Capacity:    16.000.900.661.248 bytes [16,0 TB]
Sector Sizes:     512 bytes logical, 4096 bytes physical
Rotation Rate:    7200 rpm
Form Factor:      3.5 inches
Device is:        Not in smartctl database [for details use: -P showall]
ATA Version is:   ACS-4 (unknown minor revision code: 0x009c)
SATA Version is:  SATA 3.3, 6.0 Gb/s (current: 6.0 Gb/s)
Local Time is:    Fri Jun 11 00:09:00 2021 CEST
SMART support is: Available - device has SMART capability.
SMART support is: Enabled
AAM feature is:   Unavailable
APM feature is:   Disabled
Rd look-ahead is: Enabled
Write cache is:   Enabled
DSN feature is:   Unavailable
ATA Security is:  Disabled, NOT FROZEN [SEC1]
Wt Cache Reorder: Enabled

=== START OF READ SMART DATA SECTION ===
SMART overall-health self-assessment test result: PASSED

General SMART Values:
Offline data collection status:  (0x82)	Offline data collection activity
					was completed without error.
					Auto Offline Data Collection: Enabled.
Self-test execution status:      (   0)	The previous self-test routine completed
					without error or no self-test has ever 
					been run.
Total time to complete Offline 
data collection: 		(  101) seconds.
Offline data collection
capabilities: 			 (0x5b) SMART execute Offline immediate.
					Auto Offline data collection on/off support.
					Suspend Offline collection upon new
					command.
					Offline surface scan supported.
					Self-test supported.
					No Conveyance Self-test supported.
					Selective Self-test supported.
SMART capabilities:            (0x0003)	Saves SMART data before entering
					power-saving mode.
					Supports SMART auto save timer.
Error logging capability:        (0x01)	Error logging supported.
					General Purpose Logging supported.
Short self-test routine 
recommended polling time: 	 (   2) minutes.
Extended self-test routine
recommended polling time: 	 (1739) minutes.
SCT capabilities: 	       (0x003d)	SCT Status supported.
					SCT Error Recovery Control supported.
					SCT Feature Control supported.
					SCT Data Table supported.

SMART Attributes Data Structure revision number: 16
Vendor Specific SMART Attributes with Thresholds:
ID# ATTRIBUTE_NAME          FLAGS    VALUE WORST THRESH FAIL RAW_VALUE
  1 Raw_Read_Error_Rate     PO-R--   100   100   001    -    0
  2 Throughput_Performance  P-S---   134   134   054    -    104
  3 Spin_Up_Time            POS---   083   083   001    -    350 (Average 350)
  4 Start_Stop_Count        -O--C-   100   100   000    -    6
  5 Reallocated_Sector_Ct   PO--CK   100   100   001    -    0
  7 Seek_Error_Rate         PO-R--   100   100   001    -    0
  8 Seek_Time_Performance   P-S---   140   140   020    -    15
  9 Power_On_Hours          -O--C-   100   100   000    -    2809
 10 Spin_Retry_Count        PO--C-   100   100   001    -    0
 12 Power_Cycle_Count       -O--CK   100   100   000    -    6
 22 Unknown_Attribute       PO---K   100   100   025    -    100
192 Power-Off_Retract_Count -O--CK   100   100   000    -    51
193 Load_Cycle_Count        -O--C-   100   100   000    -    51
194 Temperature_Celsius     -O----   049   049   000    -    44 (Min/Max 20/48)
196 Reallocated_Event_Count -O--CK   100   100   000    -    0
197 Current_Pending_Sector  -O---K   100   100   000    -    0
198 Offline_Uncorrectable   ---R--   100   100   000    -    0
199 UDMA_CRC_Error_Count    -O-R--   100   100   000    -    0
                            ||||||_ K auto-keep
                            |||||__ C event count
                            ||||___ R error rate
                            |||____ S speed/performance
                            ||_____ O updated online
                            |______ P prefailure warning

General Purpose Log Directory Version 1
SMART           Log Directory Version 1 [multi-sector log support]
Address    Access  R/W   Size  Description
0x00       GPL,SL  R/O      1  Log Directory
0x01           SL  R/O      1  Summary SMART error log
0x02           SL  R/O      1  Comprehensive SMART error log
0x03       GPL     R/O      1  Ext. Comprehensive SMART error log
0x04       GPL     R/O    256  Device Statistics log
0x04       SL      R/O    255  Device Statistics log
0x06           SL  R/O      1  SMART self-test log
0x07       GPL     R/O      1  Extended self-test log
0x08       GPL     R/O      2  Power Conditions log
0x09           SL  R/W      1  Selective self-test log
0x0c       GPL     R/O   7501  Pending Defects log
0x10       GPL     R/O      1  NCQ Command Error log
0x11       GPL     R/O      1  SATA Phy Event Counters log
0x12       GPL     R/O      1  SATA NCQ Non-Data log
0x13       GPL     R/O      1  SATA NCQ Send and Receive log
0x15       GPL     R/W      1  Rebuild Assist log
0x21       GPL     R/O      1  Write stream error log
0x22       GPL     R/O      1  Read stream error log
0x24       GPL     R/O    256  Current Device Internal Status Data log
0x25       GPL     R/O    256  Saved Device Internal Status Data log
0x2f       GPL     -        1  Set Sector Configuration
0x30       GPL,SL  R/O      9  IDENTIFY DEVICE data log
0x80-0x9f  GPL,SL  R/W     16  Host vendor specific log
0xe0       GPL,SL  R/W      1  SCT Command/Status
0xe1       GPL,SL  R/W      1  SCT Data Transfer

SMART Extended Comprehensive Error Log Version: 1 (1 sectors)
No Errors Logged

SMART Extended Self-test Log Version: 1 (1 sectors)
Num  Test_Description    Status                  Remaining  LifeTime(hours)  LBA_of_first_error
# 1  Short offline       Completed without error       00%      2768         -
# 2  Short offline       Completed without error       00%      2726         -
# 3  Short offline       Completed without error       00%      2673         -
# 4  Short offline       Completed without error       00%      2652         -
# 5  Short offline       Completed without error       00%      2622         -
# 6  Extended offline    Aborted by host               90%      2604         -
# 7  Short offline       Completed without error       00%      2574         -
# 8  Short offline       Completed without error       00%      2547         -
# 9  Short offline       Completed without error       00%      2523         -
#10  Short offline       Completed without error       00%      2502         -
#11  Short offline       Completed without error       00%      2475         -

SMART Selective self-test log data structure revision number 1
 SPAN  MIN_LBA  MAX_LBA  CURRENT_TEST_STATUS
    1        0        0  Not_testing
    2        0        0  Not_testing
    3        0        0  Not_testing
    4        0        0  Not_testing
    5        0        0  Not_testing
Selective self-test flags (0x0):
  After scanning selected spans, do NOT read-scan remainder of disk.
If Selective self-test is pending on power-up, resume after 0 minute delay.

SCT Status Version:                  3
SCT Version (vendor specific):       256 (0x0100)
Device State:                        Active (0)
Current Temperature:                    44 Celsius
Power Cycle Min/Max Temperature:     23/48 Celsius
Lifetime    Min/Max Temperature:     20/48 Celsius
Under/Over Temperature Limit Count:   0/0
SMART Status:                        0xc24f (PASSED)
Minimum supported ERC Time Limit:    65 (6,5 seconds)

SCT Temperature History Version:     2
Temperature Sampling Period:         1 minute
Temperature Logging Interval:        1 minute
Min/Max recommended Temperature:      0/60 Celsius
Min/Max Temperature Limit:           -40/70 Celsius
Temperature History Size (Index):    128 (4)

Index    Estimated Time   Temperature Celsius
   5    2021-06-10 22:02    43  ************************
 ...    ..(  2 skipped).    ..  ************************
   8    2021-06-10 22:05    43  ************************
   9    2021-06-10 22:06    44  *************************
  10    2021-06-10 22:07    43  ************************
  11    2021-06-10 22:08    43  ************************
  12    2021-06-10 22:09    43  ************************
  13    2021-06-10 22:10    44  *************************
  14    2021-06-10 22:11    43  ************************
  15    2021-06-10 22:12    44  *************************
 ...    ..( 12 skipped).    ..  *************************
  28    2021-06-10 22:25    44  *************************
  29    2021-06-10 22:26    43  ************************
  30    2021-06-10 22:27    44  *************************
 ...    ..(  2 skipped).    ..  *************************
  33    2021-06-10 22:30    44  *************************
  34    2021-06-10 22:31    43  ************************
 ...    ..(  3 skipped).    ..  ************************
  38    2021-06-10 22:35    43  ************************
  39    2021-06-10 22:36    44  *************************
  40    2021-06-10 22:37    43  ************************
  41    2021-06-10 22:38    43  ************************
  42    2021-06-10 22:39    43  ************************
  43    2021-06-10 22:40    44  *************************
  44    2021-06-10 22:41    43  ************************
 ...    ..(  3 skipped).    ..  ************************
  48    2021-06-10 22:45    43  ************************
  49    2021-06-10 22:46    44  *************************
  50    2021-06-10 22:47    43  ************************
 ...    ..(  5 skipped).    ..  ************************
  56    2021-06-10 22:53    43  ************************
  57    2021-06-10 22:54    44  *************************
  58    2021-06-10 22:55    43  ************************
 ...    ..(  6 skipped).    ..  ************************
  65    2021-06-10 23:02    43  ************************
  66    2021-06-10 23:03    44  *************************
  67    2021-06-10 23:04    43  ************************
 ...    ..(  3 skipped).    ..  ************************
  71    2021-06-10 23:08    43  ************************
  72    2021-06-10 23:09    44  *************************
 ...    ..( 32 skipped).    ..  *************************
 105    2021-06-10 23:42    44  *************************
 106    2021-06-10 23:43    45  **************************
 107    2021-06-10 23:44    45  **************************
 108    2021-06-10 23:45    44  *************************
 109    2021-06-10 23:46    44  *************************
 110    2021-06-10 23:47    44  *************************
 111    2021-06-10 23:48    45  **************************
 ...    ..(  2 skipped).    ..  **************************
 114    2021-06-10 23:51    45  **************************
 115    2021-06-10 23:52    44  *************************
 116    2021-06-10 23:53    45  **************************
 117    2021-06-10 23:54    45  **************************
 118    2021-06-10 23:55    44  *************************
 119    2021-06-10 23:56    45  **************************
 ...    ..(  7 skipped).    ..  **************************
 127    2021-06-11 00:04    45  **************************
   0    2021-06-11 00:05    44  *************************
 ...    ..(  2 skipped).    ..  *************************
   3    2021-06-11 00:08    44  *************************
   4    2021-06-11 00:09    43  ************************

SCT Error Recovery Control:
           Read: Disabled
          Write: Disabled

Device Statistics (GP Log 0x04)
Page  Offset Size        Value Flags Description
0x01  =====  =               =  ===  == General Statistics (rev 1) ==
0x01  0x008  4               6  ---  Lifetime Power-On Resets
0x01  0x010  4            2809  ---  Power-on Hours
0x01  0x018  6     28311373651  ---  Logical Sectors Written
0x01  0x020  6       135451664  ---  Number of Write Commands
0x01  0x028  6     55881736459  ---  Logical Sectors Read
0x01  0x030  6       140974052  ---  Number of Read Commands
0x01  0x038  6     10113987550  ---  Date and Time TimeStamp
0x03  =====  =               =  ===  == Rotating Media Statistics (rev 1) ==
0x03  0x008  4            2301  ---  Spindle Motor Power-on Hours
0x03  0x010  4            2301  ---  Head Flying Hours
0x03  0x018  4              51  ---  Head Load Events
0x03  0x020  4               0  ---  Number of Reallocated Logical Sectors
0x03  0x028  4               0  ---  Read Recovery Attempts
0x03  0x030  4               0  ---  Number of Mechanical Start Failures
0x04  =====  =               =  ===  == General Errors Statistics (rev 1) ==
0x04  0x008  4               0  ---  Number of Reported Uncorrectable Errors
0x04  0x010  4               0  ---  Resets Between Cmd Acceptance and Completion
0x04  0x018  4               0  ---  Physical Element Status Changed
0x05  =====  =               =  ===  == Temperature Statistics (rev 1) ==
0x05  0x008  1              44  ---  Current Temperature
0x05  0x010  1              43  N--  Average Short Term Temperature
0x05  0x018  1              42  N--  Average Long Term Temperature
0x05  0x020  1              48  ---  Highest Temperature
0x05  0x028  1              20  ---  Lowest Temperature
0x05  0x030  1              46  N--  Highest Average Short Term Temperature
0x05  0x038  1              24  N--  Lowest Average Short Term Temperature
0x05  0x040  1              43  N--  Highest Average Long Term Temperature
0x05  0x048  1              25  N--  Lowest Average Long Term Temperature
0x05  0x050  4               0  ---  Time in Over-Temperature
0x05  0x058  1              60  ---  Specified Maximum Operating Temperature
0x05  0x060  4               0  ---  Time in Under-Temperature
0x05  0x068  1               0  ---  Specified Minimum Operating Temperature
0x06  =====  =               =  ===  == Transport Statistics (rev 1) ==
0x06  0x008  4               0  ---  Number of Hardware Resets
0x06  0x010  4               0  ---  Number of ASR Events
0x06  0x018  4               0  ---  Number of Interface CRC Errors
0xff  =====  =               =  ===  == Vendor Specific Statistics (rev 1) ==
                                |||_ C monitored condition met
                                ||__ D supports DSN
                                |___ N normalized value

Pending Defects log (GP Log 0x0c)
No Defects Logged

SATA Phy Event Counters (GP Log 0x11)
ID      Size     Value  Description
0x0001  2            0  Command failed due to ICRC error
0x0002  2            0  R_ERR response for data FIS
0x0003  2            0  R_ERR response for device-to-host data FIS
0x0004  2            0  R_ERR response for host-to-device data FIS
0x0005  2            0  R_ERR response for non-data FIS
0x0006  2            0  R_ERR response for device-to-host non-data FIS
0x0007  2            0  R_ERR response for host-to-device non-data FIS
0x0008  2            0  Device-to-host non-data FIS retries
0x0009  2            0  Transition from drive PhyRdy to drive PhyNRdy
0x000a  2            1  Device-to-host register FISes sent due to a COMRESET
0x000b  2            0  CRC errors within host-to-device FIS
0x000d  2            0  Non-CRC errors within host-to-device FIS

