smartctl 6.6 2017-09-20 r4440 [x86_64-linux-4.9.0-0.bpo.3-amd64] (daily-20170920)
Copyright (C) 2002-17, Bruce Allen, Christian Franke, www.smartmontools.org

=== START OF INFORMATION SECTION ===
Device Model:     WDC WD3200BEVS-08VAT2
Firmware Version: 14.01A14
User Capacity:    320,072,933,376 bytes [320 GB]
Sector Size:      512 bytes logical/physical
Rotation Rate:    5400 rpm
Device is:        Not in smartctl database [for details use: -P showall]
ATA Version is:   ATA8-ACS (minor revision not indicated)
SATA Version is:  SATA 2.5, 1.5 Gb/s
Local Time is:    Sat Sep 23 18:28:36 2017 CEST
SMART support is: Available - device has SMART capability.
SMART support is: Enabled
AAM feature is:   Disabled
APM level is:     128 (minimum power consumption without standby)
Rd look-ahead is: Enabled
Write cache is:   Enabled
DSN feature is:   Unavailable
ATA Security is:  Disabled, NOT FROZEN [SEC1]
Wt Cache Reorder: Enabled

=== START OF READ SMART DATA SECTION ===
SMART overall-health self-assessment test result: PASSED

General SMART Values:
Offline data collection status:  (0x00)	Offline data collection activity
					was never started.
					Auto Offline Data Collection: Disabled.
Self-test execution status:      (   0)	The previous self-test routine completed
					without error or no self-test has ever 
					been run.
Total time to complete Offline 
data collection: 		(10380) seconds.
Offline data collection
capabilities: 			 (0x7b) SMART execute Offline immediate.
					Auto Offline data collection on/off support.
					Suspend Offline collection upon new
					command.
					Offline surface scan supported.
					Self-test supported.
					Conveyance Self-test supported.
					Selective Self-test supported.
SMART capabilities:            (0x0003)	Saves SMART data before entering
					power-saving mode.
					Supports SMART auto save timer.
Error logging capability:        (0x01)	Error logging supported.
					General Purpose Logging supported.
Short self-test routine 
recommended polling time: 	 (   2) minutes.
Extended self-test routine
recommended polling time: 	 ( 122) minutes.
Conveyance self-test routine
recommended polling time: 	 (   5) minutes.
SCT capabilities: 	       (0x303f)	SCT Status supported.
					SCT Error Recovery Control supported.
					SCT Feature Control supported.
					SCT Data Table supported.

SMART Attributes Data Structure revision number: 16
Vendor Specific SMART Attributes with Thresholds:
ID# ATTRIBUTE_NAME          FLAGS    VALUE WORST THRESH FAIL RAW_VALUE
  1 Raw_Read_Error_Rate     POSR-K   200   200   051    -    0
  3 Spin_Up_Time            POS--K   187   187   021    -    1633
  4 Start_Stop_Count        -O--CK   099   099   000    -    1517
  5 Reallocated_Sector_Ct   PO--CK   200   200   140    -    0
  7 Seek_Error_Rate         POSR-K   100   253   051    -    0
  9 Power_On_Hours          -O--CK   082   082   000    -    13555
 10 Spin_Retry_Count        PO--CK   100   100   051    -    0
 11 Calibration_Retry_Count -O--CK   100   100   000    -    0
 12 Power_Cycle_Count       -O--CK   100   100   000    -    985
192 Power-Off_Retract_Count -O--CK   200   200   000    -    59
193 Load_Cycle_Count        -O--CK   001   001   000    -    4855648
194 Temperature_Celsius     -O---K   116   098   000    -    31
196 Reallocated_Event_Count -O--CK   200   200   000    -    0
197 Current_Pending_Sector  -O--CK   200   200   000    -    0
198 Offline_Uncorrectable   ----CK   100   253   000    -    0
199 UDMA_CRC_Error_Count    -O--CK   200   200   000    -    0
200 Multi_Zone_Error_Rate   P--R--   200   200   051    -    0
240 Head_Flying_Hours       -O--CK   086   086   000    -    10942
                            ||||||_ K auto-keep
                            |||||__ C event count
                            ||||___ R error rate
                            |||____ S speed/performance
                            ||_____ O updated online
                            |______ P prefailure warning

General Purpose Log Directory Version 1
SMART           Log Directory Version 1 [multi-sector log support]
Address    Access  R/W   Size  Description
0x00       GPL,SL  R/O      1  Log Directory
0x01           SL  R/O      1  Summary SMART error log
0x02           SL  R/O      5  Comprehensive SMART error log
0x03       GPL     R/O      6  Ext. Comprehensive SMART error log
0x06           SL  R/O      1  SMART self-test log
0x07       GPL     R/O      1  Extended self-test log
0x09           SL  R/W      1  Selective self-test log
0x10       GPL     R/O      1  NCQ Command Error log
0x11       GPL     R/O      1  SATA Phy Event Counters log
0x80-0x9f  GPL,SL  R/W     16  Host vendor specific log
0xa0-0xa7  GPL,SL  VS      16  Device vendor specific log
0xa8-0xb7  GPL,SL  VS       1  Device vendor specific log
0xc0       GPL,SL  VS       1  Device vendor specific log
0xc1       GPL     VS      24  Device vendor specific log
0xe0       GPL,SL  R/W      1  SCT Command/Status
0xe1       GPL,SL  R/W      1  SCT Data Transfer

SMART Extended Comprehensive Error Log Version: 1 (6 sectors)
No Errors Logged

SMART Extended Self-test Log Version: 1 (1 sectors)
Num  Test_Description    Status                  Remaining  LifeTime(hours)  LBA_of_first_error
# 1  Short offline       Completed without error       00%     13555         -
# 2  Vendor (0x50)       Completed without error       00%         0         -

SMART Selective self-test log data structure revision number 1
 SPAN  MIN_LBA  MAX_LBA  CURRENT_TEST_STATUS
    1        0        0  Not_testing
    2        0        0  Not_testing
    3        0        0  Not_testing
    4        0        0  Not_testing
    5        0        0  Not_testing
Selective self-test flags (0x0):
  After scanning selected spans, do NOT read-scan remainder of disk.
If Selective self-test is pending on power-up, resume after 0 minute delay.

SCT Status Version:                  2
SCT Version (vendor specific):       258 (0x0102)
SCT Support Level:                   1
Device State:                        Active (0)
Current Temperature:                    31 Celsius
Power Cycle Min/Max Temperature:     27/31 Celsius
Lifetime    Min/Max Temperature:     31/49 Celsius
Under/Over Temperature Limit Count:   0/0
Vendor specific:
01 00 00 00 00 00 00 00 00 00 00 00 00 00 00 00
00 00 00 00 00 00 00 00 00 00 00 00 00 00 00 00

SCT Temperature History Version:     2
Temperature Sampling Period:         1 minute
Temperature Logging Interval:        1 minute
Min/Max recommended Temperature:      0/60 Celsius
Min/Max Temperature Limit:            1/85 Celsius
Temperature History Size (Index):    128 (86)

Index    Estimated Time   Temperature Celsius
  87    2017-09-23 16:21    40  *********************
 ...    ..(  3 skipped).    ..  *********************
  91    2017-09-23 16:25    40  *********************
  92    2017-09-23 16:26    41  **********************
 ...    ..(  9 skipped).    ..  **********************
 102    2017-09-23 16:36    41  **********************
 103    2017-09-23 16:37    40  *********************
 ...    ..(  2 skipped).    ..  *********************
 106    2017-09-23 16:40    40  *********************
 107    2017-09-23 16:41    39  ********************
 108    2017-09-23 16:42    39  ********************
 109    2017-09-23 16:43    38  *******************
 110    2017-09-23 16:44    38  *******************
 111    2017-09-23 16:45    37  ******************
 112    2017-09-23 16:46    36  *****************
 113    2017-09-23 16:47    36  *****************
 114    2017-09-23 16:48    35  ****************
 ...    ..(  2 skipped).    ..  ****************
 117    2017-09-23 16:51    35  ****************
 118    2017-09-23 16:52    34  ***************
 119    2017-09-23 16:53    34  ***************
 120    2017-09-23 16:54    34  ***************
 121    2017-09-23 16:55    35  ****************
 122    2017-09-23 16:56    34  ***************
 123    2017-09-23 16:57    34  ***************
 124    2017-09-23 16:58    33  **************
 ...    ..(  6 skipped).    ..  **************
   3    2017-09-23 17:05    33  **************
   4    2017-09-23 17:06     ?  -
   5    2017-09-23 17:07    26  *******
   6    2017-09-23 17:08    26  *******
   7    2017-09-23 17:09    26  *******
   8    2017-09-23 17:10    27  ********
   9    2017-09-23 17:11    27  ********
  10    2017-09-23 17:12    27  ********
  11    2017-09-23 17:13    28  *********
  12    2017-09-23 17:14    28  *********
  13    2017-09-23 17:15    29  **********
 ...    ..(  2 skipped).    ..  **********
  16    2017-09-23 17:18    29  **********
  17    2017-09-23 17:19    30  ***********
  18    2017-09-23 17:20     ?  -
  19    2017-09-23 17:21    31  ************
  20    2017-09-23 17:22     ?  -
  21    2017-09-23 17:23    28  *********
  22    2017-09-23 17:24    29  **********
  23    2017-09-23 17:25    31  ************
  24    2017-09-23 17:26    32  *************
  25    2017-09-23 17:27    34  ***************
  26    2017-09-23 17:28    35  ****************
  27    2017-09-23 17:29    35  ****************
  28    2017-09-23 17:30    35  ****************
  29    2017-09-23 17:31    37  ******************
  30    2017-09-23 17:32    36  *****************
  31    2017-09-23 17:33    36  *****************
  32    2017-09-23 17:34     ?  -
  33    2017-09-23 17:35    27  ********
  34    2017-09-23 17:36    27  ********
  35    2017-09-23 17:37    27  ********
  36    2017-09-23 17:38    28  *********
  37    2017-09-23 17:39    29  **********
  38    2017-09-23 17:40    31  ************
  39    2017-09-23 17:41    32  *************
  40    2017-09-23 17:42    33  **************
  41    2017-09-23 17:43    34  ***************
  42    2017-09-23 17:44    35  ****************
  43    2017-09-23 17:45    35  ****************
  44    2017-09-23 17:46    36  *****************
  45    2017-09-23 17:47    36  *****************
  46    2017-09-23 17:48    37  ******************
  47    2017-09-23 17:49    37  ******************
  48    2017-09-23 17:50    38  *******************
  49    2017-09-23 17:51    38  *******************
  50    2017-09-23 17:52    38  *******************
  51    2017-09-23 17:53    39  ********************
  52    2017-09-23 17:54    39  ********************
  53    2017-09-23 17:55    39  ********************
  54    2017-09-23 17:56    40  *********************
 ...    ..(  6 skipped).    ..  *********************
  61    2017-09-23 18:03    40  *********************
  62    2017-09-23 18:04    39  ********************
 ...    ..(  7 skipped).    ..  ********************
  70    2017-09-23 18:12    39  ********************
  71    2017-09-23 18:13    40  *********************
 ...    ..(  2 skipped).    ..  *********************
  74    2017-09-23 18:16    40  *********************
  75    2017-09-23 18:17    41  **********************
  76    2017-09-23 18:18     ?  -
  77    2017-09-23 18:19    40  *********************
  78    2017-09-23 18:20     ?  -
  79    2017-09-23 18:21    25  ******
  80    2017-09-23 18:22     ?  -
  81    2017-09-23 18:23    27  ********
  82    2017-09-23 18:24    28  *********
  83    2017-09-23 18:25    29  **********
  84    2017-09-23 18:26    31  ************
  85    2017-09-23 18:27    31  ************
  86    2017-09-23 18:28    31  ************

SCT Error Recovery Control:
           Read: Disabled
          Write: Disabled

Device Statistics (GP/SMART Log 0x04) not supported

SATA Phy Event Counters (GP Log 0x11)
ID      Size     Value  Description
0x0001  2            0  Command failed due to ICRC error
0x0002  2            0  R_ERR response for data FIS
0x0003  2            0  R_ERR response for device-to-host data FIS
0x0004  2            0  R_ERR response for host-to-device data FIS
0x0005  2            0  R_ERR response for non-data FIS
0x0006  2            0  R_ERR response for device-to-host non-data FIS
0x0007  2            0  R_ERR response for host-to-device non-data FIS
0x000a  2            0  Device-to-host register FISes sent due to a COMRESET
0x8000  4          318  Vendor specific

