smartctl 6.2 2013-07-26 r3841 [x86_64-linux-4.2.0-27-generic] (local build)
Copyright (C) 2002-13, Bruce Allen, Christian Franke, www.smartmontools.org

=== START OF INFORMATION SECTION ===
Device Model:     ST2000VN000-1HJ164
Serial Number:    W720E81F
LU WWN Device Id: 5 000c50 08b6ecb0b
Firmware Version: SC60
User Capacity:    2,000,398,934,016 bytes [2.00 TB]
Sector Sizes:     512 bytes logical, 4096 bytes physical
Rotation Rate:    5900 rpm
Device is:        Not in smartctl database [for details use: -P showall]
ATA Version is:   ACS-2, ACS-3 T13/2161-D revision 3b
SATA Version is:  SATA 3.1, 6.0 Gb/s (current: 6.0 Gb/s)
Local Time is:    Fri Feb  5 19:11:15 2016 EET
SMART support is: Available - device has SMART capability.
SMART support is: Enabled
AAM feature is:   Unavailable
APM level is:     254 (maximum performance)
Rd look-ahead is: Enabled
Write cache is:   Disabled
ATA Security is:  Disabled, frozen [SEC2]
Wt Cache Reorder: Enabled

=== START OF READ SMART DATA SECTION ===
SMART overall-health self-assessment test result: PASSED

General SMART Values:
Offline data collection status:  (0x82)	Offline data collection activity
					was completed without error.
					Auto Offline Data Collection: Enabled.
Self-test execution status:      (   0)	The previous self-test routine completed
					without error or no self-test has ever 
					been run.
Total time to complete Offline 
data collection: 		(  117) seconds.
Offline data collection
capabilities: 			 (0x7b) SMART execute Offline immediate.
					Auto Offline data collection on/off support.
					Suspend Offline collection upon new
					command.
					Offline surface scan supported.
					Self-test supported.
					Conveyance Self-test supported.
					Selective Self-test supported.
SMART capabilities:            (0x0003)	Saves SMART data before entering
					power-saving mode.
					Supports SMART auto save timer.
Error logging capability:        (0x01)	Error logging supported.
					General Purpose Logging supported.
Short self-test routine 
recommended polling time: 	 (   1) minutes.
Extended self-test routine
recommended polling time: 	 ( 259) minutes.
Conveyance self-test routine
recommended polling time: 	 (   2) minutes.
SCT capabilities: 	       (0x10bd)	SCT Status supported.
					SCT Error Recovery Control supported.
					SCT Feature Control supported.
					SCT Data Table supported.

SMART Attributes Data Structure revision number: 10
Vendor Specific SMART Attributes with Thresholds:
ID# ATTRIBUTE_NAME          FLAGS    VALUE WORST THRESH FAIL RAW_VALUE
  1 Raw_Read_Error_Rate     POSR--   116   099   006    -    114688496
  3 Spin_Up_Time            PO----   096   096   000    -    0
  4 Start_Stop_Count        -O--CK   100   100   020    -    38
  5 Reallocated_Sector_Ct   PO--CK   100   100   010    -    0
  7 Seek_Error_Rate         POSR--   066   060   030    -    4055988
  9 Power_On_Hours          -O--CK   099   099   000    -    1480
 10 Spin_Retry_Count        PO--C-   100   100   097    -    0
 12 Power_Cycle_Count       -O--CK   100   100   020    -    38
184 End-to-End_Error        -O--CK   100   100   099    -    0
187 Reported_Uncorrect      -O--CK   100   100   000    -    0
188 Command_Timeout         -O--CK   100   100   000    -    0
189 High_Fly_Writes         -O-RCK   090   090   000    -    10
190 Airflow_Temperature_Cel -O---K   069   069   045    -    31 (Min/Max 28/31)
191 G-Sense_Error_Rate      -O--CK   100   100   000    -    0
192 Power-Off_Retract_Count -O--CK   100   100   000    -    13
193 Load_Cycle_Count        -O--CK   100   100   000    -    88
194 Temperature_Celsius     -O---K   031   040   000    -    31 (0 21 0 0 0)
197 Current_Pending_Sector  -O--C-   100   100   000    -    0
198 Offline_Uncorrectable   ----C-   100   100   000    -    0
199 UDMA_CRC_Error_Count    -OSRCK   200   200   000    -    0
                            ||||||_ K auto-keep
                            |||||__ C event count
                            ||||___ R error rate
                            |||____ S speed/performance
                            ||_____ O updated online
                            |______ P prefailure warning

General Purpose Log Directory Version 1
SMART           Log Directory Version 1 [multi-sector log support]
Address    Access  R/W   Size  Description
0x00       GPL,SL  R/O      1  Log Directory
0x01           SL  R/O      1  Summary SMART error log
0x02           SL  R/O      5  Comprehensive SMART error log
0x03       GPL     R/O      5  Ext. Comprehensive SMART error log
0x06           SL  R/O      1  SMART self-test log
0x07       GPL     R/O      1  Extended self-test log
0x09           SL  R/W      1  Selective self-test log
0x10       GPL     R/O      1  NCQ Command Error log
0x11       GPL     R/O      1  SATA Phy Event Counters
0x15       GPL     -        1  Reserved for Serial ATA
0x21       GPL     R/O      1  Write stream error log
0x22       GPL     R/O      1  Read stream error log
0x80-0x9f  GPL,SL  R/W     16  Host vendor specific log
0xa1       GPL,SL  VS      20  Device vendor specific log
0xa2       GPL     VS    4496  Device vendor specific log
0xa8       GPL,SL  VS     129  Device vendor specific log
0xa9       GPL,SL  VS       1  Device vendor specific log
0xab       GPL     VS       1  Device vendor specific log
0xb0       GPL     VS    5176  Device vendor specific log
0xbe-0xbf  GPL     VS   65535  Device vendor specific log
0xc0       GPL,SL  VS       1  Device vendor specific log
0xc1       GPL,SL  VS      10  Device vendor specific log
0xc3       GPL,SL  VS       8  Device vendor specific log
0xc4       GPL,SL  VS       5  Device vendor specific log
0xd1       GPL,SL  VS       8  Device vendor specific log
0xe0       GPL,SL  R/W      1  SCT Command/Status
0xe1       GPL,SL  R/W      1  SCT Data Transfer

SMART Extended Comprehensive Error Log Version: 1 (5 sectors)
No Errors Logged

SMART Extended Self-test Log Version: 1 (1 sectors)
Num  Test_Description    Status                  Remaining  LifeTime(hours)  LBA_of_first_error
# 1  Short offline       Completed without error       00%      1480         -

SMART Selective self-test log data structure revision number 1
 SPAN  MIN_LBA  MAX_LBA  CURRENT_TEST_STATUS
    1        0        0  Not_testing
    2        0        0  Not_testing
    3        0        0  Not_testing
    4        0        0  Not_testing
    5        0        0  Not_testing
Selective self-test flags (0x0):
  After scanning selected spans, do NOT read-scan remainder of disk.
If Selective self-test is pending on power-up, resume after 0 minute delay.

SCT Status Version:                  3
SCT Version (vendor specific):       522 (0x020a)
SCT Support Level:                   1
Device State:                        Active (0)
Current Temperature:                    30 Celsius
Power Cycle Min/Max Temperature:     28/31 Celsius
Lifetime    Min/Max Temperature:     21/31 Celsius
Under/Over Temperature Limit Count:   0/0
SCT Temperature History Version:     2
Temperature Sampling Period:         1 minute
Temperature Logging Interval:        94 minutes
Min/Max recommended Temperature:      1/61 Celsius
Min/Max Temperature Limit:            2/60 Celsius
Temperature History Size (Index):    128 (112)

Index    Estimated Time   Temperature Celsius
 113    2016-01-28 11:58    30  ***********
 ...    ..(  2 skipped).    ..  ***********
 116    2016-01-28 16:40    30  ***********
 117    2016-01-28 18:14    31  ************
 118    2016-01-28 19:48    30  ***********
 ...    ..(  5 skipped).    ..  ***********
 124    2016-01-29 05:12    30  ***********
 125    2016-01-29 06:46    29  **********
 126    2016-01-29 08:20    30  ***********
 127    2016-01-29 09:54    30  ***********
   0    2016-01-29 11:28    30  ***********
   1    2016-01-29 13:02    31  ************
   2    2016-01-29 14:36    30  ***********
 ...    ..(  4 skipped).    ..  ***********
   7    2016-01-29 22:26    30  ***********
   8    2016-01-30 00:00    31  ************
   9    2016-01-30 01:34    30  ***********
 ...    ..(  2 skipped).    ..  ***********
  12    2016-01-30 06:16    30  ***********
  13    2016-01-30 07:50    29  **********
  14    2016-01-30 09:24    30  ***********
 ...    ..(  6 skipped).    ..  ***********
  21    2016-01-30 20:22    30  ***********
  22    2016-01-30 21:56    31  ************
  23    2016-01-30 23:30    31  ************
  24    2016-01-31 01:04    30  ***********
 ...    ..(  6 skipped).    ..  ***********
  31    2016-01-31 12:02    30  ***********
  32    2016-01-31 13:36    29  **********
  33    2016-01-31 15:10    30  ***********
  34    2016-01-31 16:44    30  ***********
  35    2016-01-31 18:18    30  ***********
  36    2016-01-31 19:52    29  **********
  37    2016-01-31 21:26    30  ***********
 ...    ..(  3 skipped).    ..  ***********
  41    2016-02-01 03:42    30  ***********
  42    2016-02-01 05:16    29  **********
 ...    ..(  3 skipped).    ..  **********
  46    2016-02-01 11:32    29  **********
  47    2016-02-01 13:06    30  ***********
 ...    ..( 13 skipped).    ..  ***********
  61    2016-02-02 11:02    30  ***********
  62    2016-02-02 12:36    31  ************
  63    2016-02-02 14:10    31  ************
  64    2016-02-02 15:44    30  ***********
 ...    ..(  2 skipped).    ..  ***********
  67    2016-02-02 20:26    30  ***********
  68    2016-02-02 22:00    31  ************
  69    2016-02-02 23:34    31  ************
  70    2016-02-03 01:08    30  ***********
  71    2016-02-03 02:42    30  ***********
  72    2016-02-03 04:16    31  ************
  73    2016-02-03 05:50    30  ***********
 ...    ..(  2 skipped).    ..  ***********
  76    2016-02-03 10:32    30  ***********
  77    2016-02-03 12:06    31  ************
  78    2016-02-03 13:40    31  ************
  79    2016-02-03 15:14    31  ************
  80    2016-02-03 16:48    30  ***********
  81    2016-02-03 18:22    30  ***********
  82    2016-02-03 19:56    31  ************
 ...    ..(  3 skipped).    ..  ************
  86    2016-02-04 02:12    31  ************
  87    2016-02-04 03:46    30  ***********
 ...    ..( 24 skipped).    ..  ***********
 112    2016-02-05 18:56    30  ***********

SCT Error Recovery Control:
           Read: Disabled
          Write: Disabled

Device Statistics (GP Log 0x04) not supported

SATA Phy Event Counters (GP Log 0x11)
ID      Size     Value  Description
0x000a  2           70  Device-to-host register FISes sent due to a COMRESET
0x0001  2            0  Command failed due to ICRC error
0x0003  2            0  R_ERR response for device-to-host data FIS
0x0004  2            0  R_ERR response for host-to-device data FIS
0x0006  2            0  R_ERR response for device-to-host non-data FIS
0x0007  2            0  R_ERR response for host-to-device non-data FIS

