smartctl 6.5 2016-01-24 r4214 [x86_64-linux-4.15.0-142-generic] (local build)
Copyright (C) 2002-16, Bruce Allen, Christian Franke, www.smartmontools.org

=== START OF INFORMATION SECTION ===
Device Model:     WDC  WUH722020ALN604
Serial Number:    2LG19YNM
LU WWN Device Id: 5 000cca 2b3c099bf
Firmware Version: PQGNW108
User Capacity:    20,000,588,955,648 bytes [20.0 TB]
Sector Size:      4096 bytes logical/physical
Rotation Rate:    7200 rpm
Form Factor:      3.5 inches
Device is:        Not in smartctl database [for details use: -P showall]
ATA Version is:   Unknown(0x1ffc) (minor revision not indicated)
SATA Version is:  SATA >3.2 (0x7ff), 6.0 Gb/s (current: 6.0 Gb/s)
Local Time is:    Mon Nov 15 15:15:33 2021 CST
SMART support is: Available - device has SMART capability.
SMART support is: Enabled
AAM feature is:   Unavailable
APM feature is:   Disabled
Rd look-ahead is: Enabled
Write cache is:   Enabled
ATA Security is:  Disabled, NOT FROZEN [SEC1]
Wt Cache Reorder: Enabled

=== START OF READ SMART DATA SECTION ===
SMART overall-health self-assessment test result: PASSED

General SMART Values:
Offline data collection status:  (0x80)	Offline data collection activity
					was never started.
					Auto Offline Data Collection: Enabled.
Self-test execution status:      (   0)	The previous self-test routine completed
					without error or no self-test has ever 
					been run.
Total time to complete Offline 
data collection: 		(  101) seconds.
Offline data collection
capabilities: 			 (0x5b) SMART execute Offline immediate.
					Auto Offline data collection on/off support.
					Suspend Offline collection upon new
					command.
					Offline surface scan supported.
					Self-test supported.
					No Conveyance Self-test supported.
					Selective Self-test supported.
SMART capabilities:            (0x0003)	Saves SMART data before entering
					power-saving mode.
					Supports SMART auto save timer.
Error logging capability:        (0x01)	Error logging supported.
					General Purpose Logging supported.
Short self-test routine 
recommended polling time: 	 (   2) minutes.
Extended self-test routine
recommended polling time: 	 (2171) minutes.
SCT capabilities: 	       (0x003d)	SCT Status supported.
					SCT Error Recovery Control supported.
					SCT Feature Control supported.
					SCT Data Table supported.

SMART Attributes Data Structure revision number: 16
Vendor Specific SMART Attributes with Thresholds:
ID# ATTRIBUTE_NAME          FLAGS    VALUE WORST THRESH FAIL RAW_VALUE
  1 Raw_Read_Error_Rate     PO-R--   100   100   001    -    0
  2 Throughput_Performance  P-S---   148   148   054    -    47
  3 Spin_Up_Time            POS---   098   098   001    -    144
  4 Start_Stop_Count        -O--C-   100   100   000    -    2
  5 Reallocated_Sector_Ct   PO--CK   100   100   001    -    0
  7 Seek_Error_Rate         PO-R--   100   100   001    -    0
  8 Seek_Time_Performance   P-S---   140   140   020    -    15
  9 Power_On_Hours          -O--C-   100   100   000    -    1133
 10 Spin_Retry_Count        PO--C-   100   100   001    -    0
 12 Power_Cycle_Count       -O--CK   100   100   000    -    2
 22 Unknown_Attribute       PO---K   100   100   025    -    6553700
 90 Unknown_Attribute       P---CK   100   100   001    -    304942678016
192 Power-Off_Retract_Count -O--CK   100   100   000    -    54
193 Load_Cycle_Count        -O--C-   100   100   000    -    54
194 Temperature_Celsius     -O----   057   057   000    -    38 (Min/Max 22/41)
196 Reallocated_Event_Count -O--CK   100   100   000    -    0
197 Current_Pending_Sector  -O---K   100   100   000    -    0
198 Offline_Uncorrectable   ---R--   100   100   000    -    0
199 UDMA_CRC_Error_Count    -O-R--   100   100   000    -    0
                            ||||||_ K auto-keep
                            |||||__ C event count
                            ||||___ R error rate
                            |||____ S speed/performance
                            ||_____ O updated online
                            |______ P prefailure warning

General Purpose Log Directory Version 1
SMART           Log Directory Version 1 [multi-sector log support]
Address    Access  R/W   Size  Description
0x00       GPL,SL  R/O      1  Log Directory
0x01           SL  R/O      1  Summary SMART error log
0x02           SL  R/O      1  Comprehensive SMART error log
0x03       GPL     R/O      1  Ext. Comprehensive SMART error log
0x04       GPL     R/O    256  Device Statistics log
0x04       SL      R/O    255  Device Statistics log
0x06           SL  R/O      1  SMART self-test log
0x07       GPL     R/O      1  Extended self-test log
0x08       GPL     R/O      2  Power Conditions log
0x09           SL  R/W      1  Selective self-test log
0x0c       GPL     R/O   2198  Pending Defects log
0x10       GPL     R/O      1  SATA NCQ Queued Error log
0x11       GPL     R/O      1  SATA Phy Event Counters log
0x12       GPL     R/O      1  SATA NCQ NON-DATA log
0x13       GPL     R/O      1  SATA NCQ Send and Receive log
0x15       GPL     R/W      1  SATA Rebuild Assist log
0x21       GPL     R/O      1  Write stream error log
0x22       GPL     R/O      1  Read stream error log
0x24       GPL     R/O    256  Current Device Internal Status Data log
0x25       GPL     R/O    256  Saved Device Internal Status Data log
0x2f       GPL     -        1  Reserved
0x30       GPL,SL  R/O      9  IDENTIFY DEVICE data log
0x80-0x9f  GPL,SL  R/W     16  Host vendor specific log
0xd8-0xd9  GPL,SL  VS       1  Device vendor specific log
0xe0       GPL,SL  R/W      1  SCT Command/Status
0xe1       GPL,SL  R/W      1  SCT Data Transfer

SMART Extended Comprehensive Error Log Version: 1 (1 sectors)
No Errors Logged

SMART Extended Self-test Log Version: 1 (1 sectors)
Num  Test_Description    Status                  Remaining  LifeTime(hours)  LBA_of_first_error
# 1  Short offline       Completed without error       00%      1133         -

SMART Selective self-test log data structure revision number 1
 SPAN  MIN_LBA  MAX_LBA  CURRENT_TEST_STATUS
    1        0        0  Not_testing
    2        0        0  Not_testing
    3        0        0  Not_testing
    4        0        0  Not_testing
    5        0        0  Not_testing
Selective self-test flags (0x0):
  After scanning selected spans, do NOT read-scan remainder of disk.
If Selective self-test is pending on power-up, resume after 0 minute delay.

SCT Status Version:                  3
SCT Version (vendor specific):       256 (0x0100)
SCT Support Level:                   0
Device State:                        Active (0)
Current Temperature:                    38 Celsius
Power Cycle Min/Max Temperature:     36/38 Celsius
Lifetime    Min/Max Temperature:     22/41 Celsius
Under/Over Temperature Limit Count:   0/0
SMART Status:                        0xc24f (PASSED)

SCT Temperature History Version:     2
Temperature Sampling Period:         1 minute
Temperature Logging Interval:        1 minute
Min/Max recommended Temperature:      0/60 Celsius
Min/Max Temperature Limit:           -40/70 Celsius
Temperature History Size (Index):    128 (109)

Index    Estimated Time   Temperature Celsius
 110    2021-11-15 13:08    37  ******************
 ...    ..(  4 skipped).    ..  ******************
 115    2021-11-15 13:13    37  ******************
 116    2021-11-15 13:14    36  *****************
 117    2021-11-15 13:15    37  ******************
 ...    ..(  7 skipped).    ..  ******************
 125    2021-11-15 13:23    37  ******************
 126    2021-11-15 13:24    38  *******************
 ...    ..( 16 skipped).    ..  *******************
  15    2021-11-15 13:41    38  *******************
  16    2021-11-15 13:42    37  ******************
 ...    ..(  4 skipped).    ..  ******************
  21    2021-11-15 13:47    37  ******************
  22    2021-11-15 13:48    38  *******************
 ...    ..( 12 skipped).    ..  *******************
  35    2021-11-15 14:01    38  *******************
  36    2021-11-15 14:02    37  ******************
 ...    ..(  8 skipped).    ..  ******************
  45    2021-11-15 14:11    37  ******************
  46    2021-11-15 14:12    36  *****************
 ...    ..(  2 skipped).    ..  *****************
  49    2021-11-15 14:15    36  *****************
  50    2021-11-15 14:16    37  ******************
 ...    ..( 17 skipped).    ..  ******************
  68    2021-11-15 14:34    37  ******************
  69    2021-11-15 14:35    36  *****************
 ...    ..( 12 skipped).    ..  *****************
  82    2021-11-15 14:48    36  *****************
  83    2021-11-15 14:49    37  ******************
 ...    ..(  9 skipped).    ..  ******************
  93    2021-11-15 14:59    37  ******************
  94    2021-11-15 15:00    36  *****************
 ...    ..(  2 skipped).    ..  *****************
  97    2021-11-15 15:03    36  *****************
  98    2021-11-15 15:04    37  ******************
 ...    ..(  8 skipped).    ..  ******************
 107    2021-11-15 15:13    37  ******************
 108    2021-11-15 15:14    38  *******************
 109    2021-11-15 15:15    37  ******************

SCT Error Recovery Control:
           Read: Disabled
          Write: Disabled

Device Statistics (GP/SMART Log 0x04) not supported

SATA Phy Event Counters (GP Log 0x11)
ID      Size     Value  Description
0x0001  2            0  Command failed due to ICRC error
0x0002  2            0  R_ERR response for data FIS
0x0003  2            0  R_ERR response for device-to-host data FIS
0x0004  2            0  R_ERR response for host-to-device data FIS
0x0005  2            0  R_ERR response for non-data FIS
0x0006  2            0  R_ERR response for device-to-host non-data FIS
0x0007  2            0  R_ERR response for host-to-device non-data FIS
0x0008  2            0  Device-to-host non-data FIS retries
0x0009  2            3  Transition from drive PhyRdy to drive PhyNRdy
0x000a  2            0  Device-to-host register FISes sent due to a COMRESET
0x000b  2            0  CRC errors within host-to-device FIS
0x000d  2            0  Non-CRC errors within host-to-device FIS

