smartctl 7.1 2019-12-30 r5022 [x86_64-linux-5.4.0-40-generic] (local build)
Copyright (C) 2002-19, Bruce Allen, Christian Franke, www.smartmontools.org

=== START OF INFORMATION SECTION ===
Device Model:     KINGSTON SUV500M8120G
Serial Number:    50026B7282047970
LU WWN Device Id: 5 0026b7 282047970
Firmware Version: 003056RI
User Capacity:    120,034,123,776 bytes [120 GB]
Sector Sizes:     512 bytes logical, 4096 bytes physical
Rotation Rate:    Solid State Device
Form Factor:      M.2
Device is:        Not in smartctl database [for details use: -P showall]
ATA Version is:   ACS-4, ATA8-ACS T13/1699-D revision 6
SATA Version is:  SATA 3.1, 6.0 Gb/s (current: 6.0 Gb/s)
Local Time is:    Mon Jul 13 13:44:32 2020 PDT
SMART support is: Available - device has SMART capability.
SMART support is: Enabled
AAM feature is:   Unavailable
APM level is:     0 (reserved)
Rd look-ahead is: Enabled
Write cache is:   Enabled
DSN feature is:   Disabled
ATA Security is:  Disabled, NOT FROZEN [SEC1]
Wt Cache Reorder: Enabled

=== START OF READ SMART DATA SECTION ===
SMART overall-health self-assessment test result: PASSED

General SMART Values:
Offline data collection status:  (0x00)	Offline data collection activity
					was never started.
					Auto Offline Data Collection: Disabled.
Self-test execution status:      (   0)	The previous self-test routine completed
					without error or no self-test has ever 
					been run.
Total time to complete Offline 
data collection: 		(    5) seconds.
Offline data collection
capabilities: 			 (0x71) SMART execute Offline immediate.
					No Auto Offline data collection support.
					Suspend Offline collection upon new
					command.
					No Offline surface scan supported.
					Self-test supported.
					Conveyance Self-test supported.
					Selective Self-test supported.
SMART capabilities:            (0x0003)	Saves SMART data before entering
					power-saving mode.
					Supports SMART auto save timer.
Error logging capability:        (0x01)	Error logging supported.
					General Purpose Logging supported.
Short self-test routine 
recommended polling time: 	 (   2) minutes.
Extended self-test routine
recommended polling time: 	 (   5) minutes.
Conveyance self-test routine
recommended polling time: 	 (   0) minutes.
SCT capabilities: 	       (0x003d)	SCT Status supported.
					SCT Error Recovery Control supported.
					SCT Feature Control supported.
					SCT Data Table supported.

SMART Attributes Data Structure revision number: 48
Vendor Specific SMART Attributes with Thresholds:
ID# ATTRIBUTE_NAME          FLAGS    VALUE WORST THRESH FAIL RAW_VALUE
  1 Raw_Read_Error_Rate     POSR-K   100   100   000    -    2101
  5 Reallocated_Sector_Ct   PO--CK   100   100   010    -    0
  9 Power_On_Hours          -O--CK   100   100   000    -    137
 12 Power_Cycle_Count       -O--CK   100   100   000    -    111
100 Unknown_Attribute       -O--CK   100   100   000    -    28200
101 Unknown_Attribute       -O--CK   100   100   000    -    2568
170 Unknown_Attribute       -O--CK   100   100   000    -    0
171 Unknown_Attribute       -O--CK   100   100   000    -    0
172 Unknown_Attribute       -O--CK   100   100   000    -    0
174 Unknown_Attribute       -O--CK   100   100   000    -    105
175 Program_Fail_Count_Chip -O--CK   100   100   000    -    0
176 Erase_Fail_Count_Chip   -O--CK   100   100   000    -    0
177 Wear_Leveling_Count     -O--CK   100   100   000    -    39
178 Used_Rsvd_Blk_Cnt_Chip  -O----   100   100   000    -    0
180 Unused_Rsvd_Blk_Cnt_Tot -O----   100   100   000    -    326
183 Runtime_Bad_Block       -O--CK   100   100   000    -    0
187 Reported_Uncorrect      PO--CK   100   100   000    -    0
194 Temperature_Celsius     -O---K   030   100   000    -    30 (Min/Max 22/42)
195 Hardware_ECC_Recovered  -O--CK   100   100   000    -    2101
196 Reallocated_Event_Count -O--CK   100   100   000    -    0
197 Current_Pending_Sector  -O--CK   100   100   000    -    0
199 UDMA_CRC_Error_Count    -O--C-   100   100   000    -    0
201 Unknown_SSD_Attribute   -O--CK   100   100   000    -    0
204 Soft_ECC_Correction     -O--CK   100   100   000    -    2101
231 Temperature_Celsius     -O--CK   100   100   000    -    0
233 Media_Wearout_Indicator -O--CK   100   100   000    -    40
234 Unknown_Attribute       -O--CK   100   100   000    -    27
241 Total_LBAs_Written      -O--CK   100   100   000    -    32
242 Total_LBAs_Read         -O--CK   100   100   000    -    47
250 Read_Error_Retry_Rate   -O--CK   100   100   000    -    2101
                            ||||||_ K auto-keep
                            |||||__ C event count
                            ||||___ R error rate
                            |||____ S speed/performance
                            ||_____ O updated online
                            |______ P prefailure warning

General Purpose Log Directory Version 1
SMART           Log Directory Version 1 [multi-sector log support]
Address    Access  R/W   Size  Description
0x00       GPL,SL  R/O      1  Log Directory
0x01           SL  R/O      1  Summary SMART error log
0x02           SL  R/O      1  Comprehensive SMART error log
0x03       GPL     R/O      1  Ext. Comprehensive SMART error log
0x04       GPL,SL  R/O      8  Device Statistics log
0x06           SL  R/O      1  SMART self-test log
0x07       GPL,SL  R/O      1  Extended self-test log
0x09           SL  R/W      1  Selective self-test log
0x0a       GPL     R/W      5  Device Statistics Notification
0x10       GPL     R/O      1  NCQ Command Error log
0x11       GPL     R/O      1  SATA Phy Event Counters log
0x30       GPL,SL  R/O      9  IDENTIFY DEVICE data log
0x80-0x9f  GPL,SL  R/W     16  Host vendor specific log
0xa1           SL  VS       9  Device vendor specific log
0xab           SL  VS       1  Device vendor specific log
0xe0       GPL,SL  R/W      1  SCT Command/Status
0xe1       GPL,SL  R/W      1  SCT Data Transfer

SMART Extended Comprehensive Error Log Version: 0 (1 sectors)
No Errors Logged

SMART Extended Self-test Log Version: 0 (1 sectors)
Num  Test_Description    Status                  Remaining  LifeTime(hours)  LBA_of_first_error
# 1  Short offline       Completed without error       00%       137         -

SMART Selective self-test log data structure revision number 0
Note: revision number not 1 implies that no selective self-test has ever been run
 SPAN  MIN_LBA  MAX_LBA  CURRENT_TEST_STATUS
    1        0        0  Not_testing
    2        0        0  Not_testing
    3        0        0  Not_testing
    4        0        0  Not_testing
    5        0        0  Not_testing
Selective self-test flags (0x0):
  After scanning selected spans, do NOT read-scan remainder of disk.
If Selective self-test is pending on power-up, resume after 0 minute delay.

SCT Status Version:                  3
SCT Version (vendor specific):       1 (0x0001)
Device State:                        Active (0)
Current Temperature:                    30 Celsius
Power Cycle Min/Max Temperature:     25/30 Celsius
Lifetime    Min/Max Temperature:     22/42 Celsius
Under/Over Temperature Limit Count:   0/0
SMART Status:                        0xc24f (PASSED)

SCT Temperature History Version:     2
Temperature Sampling Period:         1 minute
Temperature Logging Interval:        1 minute
Min/Max recommended Temperature:      0/70 Celsius
Min/Max Temperature Limit:            0/85 Celsius
Temperature History Size (Index):    478 (9)

Index    Estimated Time   Temperature Celsius
  10    2020-07-13 05:47     ?  -
 ...    ..(466 skipped).    ..  -
 477    2020-07-13 13:34     ?  -
   0    2020-07-13 13:35    40  *********************
   1    2020-07-13 13:36    40  *********************
   2    2020-07-13 13:37    41  **********************
   3    2020-07-13 13:38     ?  -
   4    2020-07-13 13:39    25  ******
   5    2020-07-13 13:40    27  ********
   6    2020-07-13 13:41    28  *********
   7    2020-07-13 13:42    29  **********
   8    2020-07-13 13:43    29  **********
   9    2020-07-13 13:44    30  ***********

SCT Error Recovery Control:
           Read: Disabled
          Write: Disabled

Device Statistics (GP Log 0x04)
Page  Offset Size        Value Flags Description
0x01  =====  =               =  ===  == General Statistics (rev 1) ==
0x01  0x008  4             111  ---  Lifetime Power-On Resets
0x01  0x010  4             137  ---  Power-on Hours
0x01  0x018  6        68705204  ---  Logical Sectors Written
0x01  0x020  6          693333  ---  Number of Write Commands
0x01  0x028  6       100474813  ---  Logical Sectors Read
0x01  0x030  6         1261451  ---  Number of Read Commands
0x01  0x038  6       494919940  ---  Date and Time TimeStamp
0x02  =====  =               =  ===  == Free-Fall Statistics (empty) ==
0x03  =====  =               =  ===  == Rotating Media Statistics (empty) ==
0x04  =====  =               =  ===  == General Errors Statistics (rev 1) ==
0x04  0x008  4               0  ---  Number of Reported Uncorrectable Errors
0x04  0x010  4             240  ---  Resets Between Cmd Acceptance and Completion
0x05  =====  =               =  ===  == Temperature Statistics (rev 1) ==
0x05  0x008  1              23  -D-  Current Temperature
0x05  0x010  1               0  -D-  Average Short Term Temperature
0x05  0x018  1               0  -D-  Average Long Term Temperature
0x05  0x020  1              42  ---  Highest Temperature
0x05  0x028  1              22  ---  Lowest Temperature
0x05  0x030  1               0  -D-  Highest Average Short Term Temperature
0x05  0x038  1               0  -D-  Lowest Average Short Term Temperature
0x05  0x040  1               0  -D-  Highest Average Long Term Temperature
0x05  0x048  1               0  -D-  Lowest Average Long Term Temperature
0x05  0x050  4               0  -D-  Time in Over-Temperature
0x05  0x058  1              70  ---  Specified Maximum Operating Temperature
0x05  0x060  4               0  -D-  Time in Under-Temperature
0x05  0x068  1               0  ---  Specified Minimum Operating Temperature
0x06  =====  =               =  ===  == Transport Statistics (rev 1) ==
0x06  0x008  4             240  ---  Number of Hardware Resets
0x06  0x018  4               0  ---  Number of Interface CRC Errors
0x07  =====  =               =  ===  == Solid State Device Statistics (rev 1) ==
0x07  0x008  1               0  ---  Percentage Used Endurance Indicator
                                |||_ C monitored condition met
                                ||__ D supports DSN
                                |___ N normalized value

Pending Defects log (GP Log 0x0c) not supported

SATA Phy Event Counters (GP Log 0x11)
ID      Size     Value  Description
0x0001  4            0  Command failed due to ICRC error
0x000a  4            2  Device-to-host register FISes sent due to a COMRESET

