smartctl 6.6 2016-05-31 r4324 [x86_64-linux-4.9.0-8-amd64] (local build)
Copyright (C) 2002-16, Bruce Allen, Christian Franke, www.smartmontools.org

=== START OF INFORMATION SECTION ===
Device Model:     INTEL SSDSC2BB480H4
Firmware Version: D2010380
User Capacity:    480 103 981 056 bytes [480 GB]
Sector Sizes:     512 bytes logical, 4096 bytes physical
Rotation Rate:    Solid State Device
Form Factor:      2.5 inches
Device is:        Not in smartctl database [for details use: -P showall]
ATA Version is:   ACS-2 T13/2015-D revision 3
SATA Version is:  SATA 2.6, 6.0 Gb/s (current: 6.0 Gb/s)
Local Time is:    Sat Jun 22 23:34:51 2019 CEST
SMART support is: Available - device has SMART capability.
SMART support is: Enabled

=== START OF READ SMART DATA SECTION ===
SMART overall-health self-assessment test result: PASSED

General SMART Values:
Offline data collection status:  (0x02)	Offline data collection activity
					was completed without error.
					Auto Offline Data Collection: Disabled.
Self-test execution status:      (   0)	The previous self-test routine completed
					without error or no self-test has ever 
					been run.
Total time to complete Offline 
data collection: 		(    2) seconds.
Offline data collection
capabilities: 			 (0x79) SMART execute Offline immediate.
					No Auto Offline data collection support.
					Suspend Offline collection upon new
					command.
					Offline surface scan supported.
					Self-test supported.
					Conveyance Self-test supported.
					Selective Self-test supported.
SMART capabilities:            (0x0003)	Saves SMART data before entering
					power-saving mode.
					Supports SMART auto save timer.
Error logging capability:        (0x01)	Error logging supported.
					General Purpose Logging supported.
Short self-test routine 
recommended polling time: 	 (   1) minutes.
Extended self-test routine
recommended polling time: 	 (   2) minutes.
Conveyance self-test routine
recommended polling time: 	 (   2) minutes.
SCT capabilities: 	       (0x003d)	SCT Status supported.
					SCT Error Recovery Control supported.
					SCT Feature Control supported.
					SCT Data Table supported.

SMART Attributes Data Structure revision number: 1
Vendor Specific SMART Attributes with Thresholds:
ID# ATTRIBUTE_NAME          FLAG     VALUE WORST THRESH TYPE      UPDATED  WHEN_FAILED RAW_VALUE
  5 Reallocated_Sector_Ct   0x0032   100   100   000    Old_age   Always       -       0
  9 Power_On_Hours          0x0032   100   100   000    Old_age   Always       -       20130
 12 Power_Cycle_Count       0x0032   100   100   000    Old_age   Always       -       24
170 Unknown_Attribute       0x0033   100   100   010    Pre-fail  Always       -       0
171 Unknown_Attribute       0x0032   100   100   000    Old_age   Always       -       0
172 Unknown_Attribute       0x0032   100   100   000    Old_age   Always       -       0
174 Unknown_Attribute       0x0032   100   100   000    Old_age   Always       -       23
175 Program_Fail_Count_Chip 0x0033   100   100   010    Pre-fail  Always       -       498389615237
183 Runtime_Bad_Block       0x0032   100   100   000    Old_age   Always       -       0
184 End-to-End_Error        0x0033   100   100   090    Pre-fail  Always       -       0
187 Reported_Uncorrect      0x0032   100   100   000    Old_age   Always       -       0
190 Airflow_Temperature_Cel 0x0022   081   074   000    Old_age   Always       -       19 (Min/Max 15/29)
192 Power-Off_Retract_Count 0x0032   100   100   000    Old_age   Always       -       23
194 Temperature_Celsius     0x0022   100   100   000    Old_age   Always       -       30
197 Current_Pending_Sector  0x0032   100   100   000    Old_age   Always       -       0
199 UDMA_CRC_Error_Count    0x003e   100   100   000    Old_age   Always       -       0
225 Unknown_SSD_Attribute   0x0032   100   100   000    Old_age   Always       -       3386678
226 Unknown_SSD_Attribute   0x0032   100   100   000    Old_age   Always       -       7710
227 Unknown_SSD_Attribute   0x0032   100   100   000    Old_age   Always       -       11
228 Power-off_Retract_Count 0x0032   100   100   000    Old_age   Always       -       1207758
232 Available_Reservd_Space 0x0033   100   100   010    Pre-fail  Always       -       0
233 Media_Wearout_Indicator 0x0032   093   093   000    Old_age   Always       -       0
234 Unknown_Attribute       0x0032   100   100   000    Old_age   Always       -       0
241 Total_LBAs_Written      0x0032   100   100   000    Old_age   Always       -       3386678
242 Total_LBAs_Read         0x0032   100   100   000    Old_age   Always       -       454202

SMART Error Log Version: 1
No Errors Logged

SMART Self-test log structure revision number 1
Num  Test_Description    Status                  Remaining  LifeTime(hours)  LBA_of_first_error
# 1  Short offline       Completed without error       00%     20130         -
# 2  Short offline       Completed without error       00%     13323         -
# 3  Short offline       Completed without error       00%     13320         -
# 4  Short offline       Completed without error       00%     13320         -
# 5  Short offline       Completed without error       00%     13298         -
# 6  Short offline       Completed without error       00%     13297         -
# 7  Short offline       Completed without error       00%     13258         -
# 8  Short offline       Completed without error       00%     13257         -
# 9  Short offline       Completed without error       00%      3166         -
#10  Short offline       Completed without error       00%      3165         -
#11  Short offline       Completed without error       00%      3165         -
#12  Short offline       Completed without error       00%      3161         -
#13  Short offline       Completed without error       00%        17         -
#14  Short offline       Completed without error       00%         1         -
#15  Short offline       Completed without error       00%         1         -

SMART Selective self-test log data structure revision number 1
 SPAN  MIN_LBA  MAX_LBA  CURRENT_TEST_STATUS
    1        0        0  Not_testing
    2        0        0  Not_testing
    3        0        0  Not_testing
    4        0        0  Not_testing
    5        0        0  Not_testing
Selective self-test flags (0x0):
  After scanning selected spans, do NOT read-scan remainder of disk.
If Selective self-test is pending on power-up, resume after 0 minute delay.

