smartctl 5.43 2012-06-30 r3573 [x86_64-linux-2.6.32-279.el6.x86_64] (local build)
Copyright (C) 2002-12 by Bruce Allen, http://smartmontools.sourceforge.net

=== START OF INFORMATION SECTION ===
Device Model:     CT2000MX500SSD1
Firmware Version: M3CR010
User Capacity:    2,000,398,934,016 bytes [2.00 TB]
Sector Sizes:     512 bytes logical, 4096 bytes physical
Device is:        Not in smartctl database [for details use: -P showall]
ATA Version is:   8
ATA Standard is:  ACS-3 (unknown minor revision code: 0x006d)
Local Time is:    Wed Feb 14 20:49:56 2018 JST
SMART support is: Available - device has SMART capability.
SMART support is: Enabled
AAM feature is:   Unavailable
APM level is:     254 (maximum performance)
Rd look-ahead is: Enabled
Write cache is:   Enabled
ATA Security is:  Disabled, frozen [SEC2]

=== START OF READ SMART DATA SECTION ===
SMART overall-health self-assessment test result: PASSED

General SMART Values:
Offline data collection status:  (0x82)	Offline data collection activity
					was completed without error.
					Auto Offline Data Collection: Enabled.
Self-test execution status:      (   0)	The previous self-test routine completed
					without error or no self-test has ever 
					been run.
Total time to complete Offline 
data collection: 		(    0) seconds.
Offline data collection
capabilities: 			 (0x7b) SMART execute Offline immediate.
					Auto Offline data collection on/off support.
					Suspend Offline collection upon new
					command.
					Offline surface scan supported.
					Self-test supported.
					Conveyance Self-test supported.
					Selective Self-test supported.
SMART capabilities:            (0x0003)	Saves SMART data before entering
					power-saving mode.
					Supports SMART auto save timer.
Error logging capability:        (0x01)	Error logging supported.
					General Purpose Logging supported.
Short self-test routine 
recommended polling time: 	 (   2) minutes.
Extended self-test routine
recommended polling time: 	 (  30) minutes.
Conveyance self-test routine
recommended polling time: 	 (   2) minutes.
SCT capabilities: 	       (0x0031)	SCT Status supported.
					SCT Feature Control supported.
					SCT Data Table supported.

SMART Attributes Data Structure revision number: 16
Vendor Specific SMART Attributes with Thresholds:
ID# ATTRIBUTE_NAME          FLAGS    VALUE WORST THRESH FAIL RAW_VALUE
  1 Raw_Read_Error_Rate     POSR-K   100   100   000    -    0
  5 Reallocated_Sector_Ct   -O--CK   100   100   010    -    0
  9 Power_On_Hours          -O--CK   100   100   000    -    0
 12 Power_Cycle_Count       -O--CK   100   100   000    -    4
171 Unknown_Attribute       -O--CK   100   100   000    -    0
172 Unknown_Attribute       -O--CK   100   100   000    -    0
173 Unknown_Attribute       -O--CK   100   100   000    -    0
174 Unknown_Attribute       -O--CK   100   100   000    -    0
180 Unused_Rsvd_Blk_Cnt_Tot PO--CK   000   000   000    -    81
183 Runtime_Bad_Block       -O--CK   100   100   000    -    0
184 End-to-End_Error        -O--CK   100   100   000    -    0
187 Reported_Uncorrect      -O--CK   100   100   000    -    0
194 Temperature_Celsius     -O---K   067   058   000    -    33 (0 42 0 0 0)
196 Reallocated_Event_Count -O--CK   100   100   000    -    0
197 Current_Pending_Sector  -O--CK   100   100   000    -    0
198 Offline_Uncorrectable   ----CK   100   100   000    -    0
199 UDMA_CRC_Error_Count    -O--CK   100   100   000    -    0
202 Data_Address_Mark_Errs  ----CK   100   100   001    -    0
206 Flying_Height           -OSR--   100   100   000    -    0
210 Unknown_Attribute       -O--CK   100   100   000    -    0
246 Unknown_Attribute       -O--CK   100   100   000    -    61346952
247 Unknown_Attribute       -O--CK   100   100   000    -    973772
248 Unknown_Attribute       -O--CK   100   100   000    -    3524
                            ||||||_ K auto-keep
                            |||||__ C event count
                            ||||___ R error rate
                            |||____ S speed/performance
                            ||_____ O updated online
                            |______ P prefailure warning

General Purpose Log Directory Version 1
SMART           Log Directory Version 1 [multi-sector log support]
GP/S  Log at address 0x00 has    1 sectors [Log Directory]
SMART Log at address 0x01 has    1 sectors [Summary SMART error log]
SMART Log at address 0x02 has    1 sectors [Comprehensive SMART error log]
GP    Log at address 0x03 has    1 sectors [Ext. Comprehensive SMART error log]
GP/S  Log at address 0x04 has    8 sectors [Device Statistics log]
SMART Log at address 0x06 has    1 sectors [SMART self-test log]
GP    Log at address 0x07 has    1 sectors [Extended self-test log]
SMART Log at address 0x09 has    1 sectors [Selective self-test log]
GP    Log at address 0x10 has    1 sectors [NCQ Command Error log]
GP    Log at address 0x11 has    1 sectors [SATA Phy Event Counters]
GP    Log at address 0x24 has   88 sectors [Current Device Internal Status Data log]
GP    Log at address 0x25 has   64 sectors [Saved Device Internal Status Data log]
GP/S  Log at address 0x30 has    9 sectors [IDENTIFY DEVICE data log]
GP/S  Log at address 0x80 has   16 sectors [Host vendor specific log]
GP/S  Log at address 0x81 has   16 sectors [Host vendor specific log]
GP/S  Log at address 0x82 has   16 sectors [Host vendor specific log]
GP/S  Log at address 0x83 has   16 sectors [Host vendor specific log]
GP/S  Log at address 0x84 has   16 sectors [Host vendor specific log]
GP/S  Log at address 0x85 has   16 sectors [Host vendor specific log]
GP/S  Log at address 0x86 has   16 sectors [Host vendor specific log]
GP/S  Log at address 0x87 has   16 sectors [Host vendor specific log]
GP/S  Log at address 0x88 has   16 sectors [Host vendor specific log]
GP/S  Log at address 0x89 has   16 sectors [Host vendor specific log]
GP/S  Log at address 0x8a has   16 sectors [Host vendor specific log]
GP/S  Log at address 0x8b has   16 sectors [Host vendor specific log]
GP/S  Log at address 0x8c has   16 sectors [Host vendor specific log]
GP/S  Log at address 0x8d has   16 sectors [Host vendor specific log]
GP/S  Log at address 0x8e has   16 sectors [Host vendor specific log]
GP/S  Log at address 0x8f has   16 sectors [Host vendor specific log]
GP/S  Log at address 0x90 has   16 sectors [Host vendor specific log]
GP/S  Log at address 0x91 has   16 sectors [Host vendor specific log]
GP/S  Log at address 0x92 has   16 sectors [Host vendor specific log]
GP/S  Log at address 0x93 has   16 sectors [Host vendor specific log]
GP/S  Log at address 0x94 has   16 sectors [Host vendor specific log]
GP/S  Log at address 0x95 has   16 sectors [Host vendor specific log]
GP/S  Log at address 0x96 has   16 sectors [Host vendor specific log]
GP/S  Log at address 0x97 has   16 sectors [Host vendor specific log]
GP/S  Log at address 0x98 has   16 sectors [Host vendor specific log]
GP/S  Log at address 0x99 has   16 sectors [Host vendor specific log]
GP/S  Log at address 0x9a has   16 sectors [Host vendor specific log]
GP/S  Log at address 0x9b has   16 sectors [Host vendor specific log]
GP/S  Log at address 0x9c has   16 sectors [Host vendor specific log]
GP/S  Log at address 0x9d has   16 sectors [Host vendor specific log]
GP/S  Log at address 0x9e has   16 sectors [Host vendor specific log]
GP/S  Log at address 0x9f has   16 sectors [Host vendor specific log]
GP/S  Log at address 0xe0 has    1 sectors [SCT Command/Status]
GP/S  Log at address 0xe1 has    1 sectors [SCT Data Transfer]

SMART Extended Comprehensive Error Log Version: 1 (1 sectors)
No Errors Logged

SMART Extended Self-test Log Version: 1 (1 sectors)
Num  Test_Description    Status                  Remaining  LifeTime(hours)  LBA_of_first_error
# 1  Short offline       Completed without error       00%         0         -

SMART Selective self-test log data structure revision number 1
 SPAN  MIN_LBA  MAX_LBA  CURRENT_TEST_STATUS
    1        0        0  Not_testing
    2        0        0  Not_testing
    3        0        0  Not_testing
    4        0        0  Not_testing
    5        0        0  Not_testing
Selective self-test flags (0x0):
  After scanning selected spans, do NOT read-scan remainder of disk.
If Selective self-test is pending on power-up, resume after 0 minute delay.

SCT Status Version:                  3
SCT Version (vendor specific):       1 (0x0001)
SCT Support Level:                   0
Device State:                        Active (0)
Current Temperature:                    33 Celsius
Power Cycle Min/Max Temperature:     33/39 Celsius
Lifetime    Min/Max Temperature:      0/42 Celsius
Under/Over Temperature Limit Count:   0/0
SCT Temperature History Version:     2
Temperature Sampling Period:         1 minute
Temperature Logging Interval:        1 minute
Min/Max recommended Temperature:      0/100 Celsius
Min/Max Temperature Limit:            0/100 Celsius
Temperature History Size (Index):    128 (10)

Index    Estimated Time   Temperature Celsius
  11    2018-02-14 18:42     0  -
 ...    ..(115 skipped).    ..  -
 127    2018-02-14 20:38     0  -
   0    2018-02-14 20:39     ?  -
 ...    ..(  2 skipped).    ..  -
   3    2018-02-14 20:42     ?  -
   4    2018-02-14 20:43    33  **************
   5    2018-02-14 20:44    42  ***********************
   6    2018-02-14 20:45     ?  -
   7    2018-02-14 20:46     ?  -
   8    2018-02-14 20:47    34  ***************
   9    2018-02-14 20:48    39  ********************
  10    2018-02-14 20:49    33  **************

Warning: device does not support SCT Error Recovery Control command
SATA Phy Event Counters (GP Log 0x11)
ID      Size     Value  Description
0x0001  2            0  Command failed due to ICRC error
0x0002  2            0  R_ERR response for data FIS
0x0003  2            0  R_ERR response for device-to-host data FIS
0x0004  2            0  R_ERR response for host-to-device data FIS
0x0005  2            0  R_ERR response for non-data FIS
0x0006  2            0  R_ERR response for device-to-host non-data FIS
0x0007  2            0  R_ERR response for host-to-device non-data FIS
0x0008  2            0  Device-to-host non-data FIS retries
0x0009  2            0  Transition from drive PhyRdy to drive PhyNRdy
0x000a  2            3  Device-to-host register FISes sent due to a COMRESET
0x000b  2            0  CRC errors within host-to-device FIS
0x000d  2            0  Non-CRC errors within host-to-device FIS
0x000f  2            0  R_ERR response for host-to-device data FIS, CRC
0x0010  2            0  R_ERR response for host-to-device data FIS, non-CRC
0x0012  2            0  R_ERR response for host-to-device non-data FIS, CRC
0x0013  2            0  R_ERR response for host-to-device non-data FIS, non-CRC

