[liveuser@usbstick ~]$ su
[root@usbstick liveuser]# smartctl -x /dev/sda
smartctl 6.1 2013-03-16 r3800 [x86_64-linux-3.9.5-301.fc19.x86_64] (local build)
Copyright (C) 2002-13, Bruce Allen, Christian Franke, www.smartmontools.org

=== START OF INFORMATION SECTION ===
Device Model:     APPLE HDD HTS547550A9E384
Serial Number:    J2260056GRWJAC
LU WWN Device Id: 5 000cca 715ca677f
Firmware Version: JE3AD70F
User Capacity:    500,107,862,016 bytes [500 GB]
Sector Sizes:     512 bytes logical, 4096 bytes physical
Rotation Rate:    5400 rpm
Device is:        Not in smartctl database [for details use: -P showall]
ATA Version is:   ATA8-ACS T13/1699-D revision 6
SATA Version is:  SATA 2.6, 3.0 Gb/s
Local Time is:    Sat Jul  6 15:10:00 2013 EDT
SMART support is: Available - device has SMART capability.
SMART support is: Enabled
AAM feature is:   Unavailable
APM level is:     128 (minimum power consumption without standby)
Rd look-ahead is: Enabled
Write cache is:   Enabled
ATA Security is:  Disabled, frozen [SEC2]

=== START OF READ SMART DATA SECTION ===
SMART overall-health self-assessment test result: PASSED

General SMART Values:
Offline data collection status:  (0x00)	Offline data collection activity
					was never started.
					Auto Offline Data Collection: Disabled.
Self-test execution status:      (   0)	The previous self-test routine completed
					without error or no self-test has ever 
					been run.
Total time to complete Offline 
data collection: 		(   45) seconds.
Offline data collection
capabilities: 			 (0x5b) SMART execute Offline immediate.
					Auto Offline data collection on/off support.
					Suspend Offline collection upon new
					command.
					Offline surface scan supported.
					Self-test supported.
					No Conveyance Self-test supported.
					Selective Self-test supported.
SMART capabilities:            (0x0003)	Saves SMART data before entering
					power-saving mode.
					Supports SMART auto save timer.
Error logging capability:        (0x01)	Error logging supported.
					General Purpose Logging supported.
Short self-test routine 
recommended polling time: 	 (   2) minutes.
Extended self-test routine
recommended polling time: 	 ( 132) minutes.
SCT capabilities: 	       (0x003d)	SCT Status supported.
					SCT Error Recovery Control supported.
					SCT Feature Control supported.
					SCT Data Table supported.

SMART Attributes Data Structure revision number: 16
Vendor Specific SMART Attributes with Thresholds:
ID# ATTRIBUTE_NAME          FLAGS    VALUE WORST THRESH FAIL RAW_VALUE
  1 Raw_Read_Error_Rate     PO-R--   100   100   062    -    0
  2 Throughput_Performance  P-S---   100   100   040    -    0
  3 Spin_Up_Time            POS---   177   177   033    -    1
  4 Start_Stop_Count        -O--C-   100   100   000    -    977
  5 Reallocated_Sector_Ct   PO--CK   100   100   005    -    0
  7 Seek_Error_Rate         PO-R--   100   100   067    -    0
  8 Seek_Time_Performance   P-S---   100   100   040    -    0
  9 Power_On_Hours          -O--C-   100   100   000    -    437
 10 Spin_Retry_Count        PO--C-   100   100   060    -    0
 12 Power_Cycle_Count       -O--CK   100   100   000    -    972
160 Unknown_Attribute       -O--CK   100   100   000    -    0
191 G-Sense_Error_Rate      -O-R--   097   097   000    -    196611
192 Power-Off_Retract_Count -O--CK   100   100   000    -    34359738376
193 Load_Cycle_Count        -O--C-   098   098   000    -    27591
194 Temperature_Celsius     -O----   214   214   000    -    28 (Min/Max 17/43)
195 Hardware_ECC_Recovered  -O-R--   081   081   000    -    4718616
196 Reallocated_Event_Count -O--CK   100   100   000    -    0
197 Current_Pending_Sector  -O---K   100   100   000    -    0
198 Offline_Uncorrectable   ---R--   100   100   000    -    0
199 UDMA_CRC_Error_Count    -O-R--   200   200   000    -    0
223 Load_Retry_Count        -O-R--   100   100   000    -    0
254 Free_Fall_Sensor        -O--CK   100   100   000    -    85
                            ||||||_ K auto-keep
                            |||||__ C event count
                            ||||___ R error rate
                            |||____ S speed/performance
                            ||_____ O updated online
                            |______ P prefailure warning

General Purpose Log Directory Version 1
SMART           Log Directory Version 1 [multi-sector log support]
Address    Access  R/W   Size  Description
0x00       GPL,SL  R/O      1  Log Directory
0x01           SL  R/O      1  Summary SMART error log
0x02           SL  R/O      1  Comprehensive SMART error log
0x03       GPL     R/O      1  Ext. Comprehensive SMART error log
0x06           SL  R/O      1  SMART self-test log
0x07       GPL     R/O      1  Extended self-test log
0x09           SL  R/W      1  Selective self-test log
0x10       GPL     R/O      1  NCQ Command Error log
0x11       GPL     R/O      1  SATA Phy Event Counters
0x80-0x9f  GPL,SL  R/W     16  Host vendor specific log
0xe0       GPL,SL  R/W      1  SCT Command/Status
0xe1       GPL,SL  R/W      1  SCT Data Transfer

SMART Extended Comprehensive Error Log Version: 1 (1 sectors)
No Errors Logged

SMART Extended Self-test Log Version: 1 (1 sectors)
Num  Test_Description    Status                  Remaining  LifeTime(hours)  LBA_of_first_error
# 1  Extended offline    Completed without error       00%       434         -
# 2  Short offline       Completed without error       00%       142         -

SMART Selective self-test log data structure revision number 1
 SPAN  MIN_LBA  MAX_LBA  CURRENT_TEST_STATUS
    1        0        0  Not_testing
    2        0        0  Not_testing
    3        0        0  Not_testing
    4        0        0  Not_testing
    5        0        0  Not_testing
Selective self-test flags (0x0):
  After scanning selected spans, do NOT read-scan remainder of disk.
If Selective self-test is pending on power-up, resume after 0 minute delay.

SCT Status Version:                  3
SCT Version (vendor specific):       256 (0x0100)
SCT Support Level:                   1
Device State:                        Active (0)
Current Temperature:                    28 Celsius
Power Cycle Min/Max Temperature:     24/28 Celsius
Lifetime    Min/Max Temperature:     17/43 Celsius
Lifetime    Average Temperature:        29 Celsius
Under/Over Temperature Limit Count:   0/0
SCT Temperature History Version:     2
Temperature Sampling Period:         1 minute
Temperature Logging Interval:        1 minute
Min/Max recommended Temperature:      0/60 Celsius
Min/Max Temperature Limit:           -40/65 Celsius
Temperature History Size (Index):    128 (46)

Index    Estimated Time   Temperature Celsius
  47    2013-07-06 13:03    30  ***********
 ...    ..( 44 skipped).    ..  ***********
  92    2013-07-06 13:48    30  ***********
  93    2013-07-06 13:49    29  **********
  94    2013-07-06 13:50    30  ***********
  95    2013-07-06 13:51    30  ***********
  96    2013-07-06 13:52    29  **********
  97    2013-07-06 13:53    30  ***********
  98    2013-07-06 13:54    29  **********
  99    2013-07-06 13:55    29  **********
 100    2013-07-06 13:56    30  ***********
 101    2013-07-06 13:57    29  **********
 102    2013-07-06 13:58    29  **********
 103    2013-07-06 13:59    30  ***********
 104    2013-07-06 14:00    30  ***********
 105    2013-07-06 14:01    29  **********
 106    2013-07-06 14:02    30  ***********
 ...    ..(  3 skipped).    ..  ***********
 110    2013-07-06 14:06    30  ***********
 111    2013-07-06 14:07    29  **********
 112    2013-07-06 14:08    30  ***********
 113    2013-07-06 14:09    29  **********
 ...    ..(  3 skipped).    ..  **********
 117    2013-07-06 14:13    29  **********
 118    2013-07-06 14:14    30  ***********
 119    2013-07-06 14:15    29  **********
 ...    ..(  3 skipped).    ..  **********
 123    2013-07-06 14:19    29  **********
 124    2013-07-06 14:20    30  ***********
 125    2013-07-06 14:21    29  **********
 126    2013-07-06 14:22    29  **********
 127    2013-07-06 14:23    30  ***********
   0    2013-07-06 14:24    30  ***********
   1    2013-07-06 14:25    30  ***********
   2    2013-07-06 14:26    29  **********
 ...    ..(  3 skipped).    ..  **********
   6    2013-07-06 14:30    29  **********
   7    2013-07-06 14:31    30  ***********
   8    2013-07-06 14:32    29  **********
   9    2013-07-06 14:33    30  ***********
  10    2013-07-06 14:34    30  ***********
  11    2013-07-06 14:35    30  ***********
  12    2013-07-06 14:36    29  **********
  13    2013-07-06 14:37    30  ***********
 ...    ..(  7 skipped).    ..  ***********
  21    2013-07-06 14:45    30  ***********
  22    2013-07-06 14:46    29  **********
  23    2013-07-06 14:47    30  ***********
 ...    ..(  2 skipped).    ..  ***********
  26    2013-07-06 14:50    30  ***********
  27    2013-07-06 14:51    31  ************
 ...    ..(  5 skipped).    ..  ************
  33    2013-07-06 14:57    31  ************
  34    2013-07-06 14:58    32  *************
 ...    ..(  3 skipped).    ..  *************
  38    2013-07-06 15:02    32  *************
  39    2013-07-06 15:03     ?  -
  40    2013-07-06 15:04    25  ******
  41    2013-07-06 15:05    26  *******
  42    2013-07-06 15:06    27  ********
  43    2013-07-06 15:07    27  ********
  44    2013-07-06 15:08    28  *********
  45    2013-07-06 15:09    28  *********
  46    2013-07-06 15:10    28  *********

SCT Error Recovery Control:
           Read: Disabled
          Write: Disabled

Device Statistics (GP Log 0x04) not supported

SATA Phy Event Counters (GP Log 0x11)
ID      Size     Value  Description
0x0001  2            0  Command failed due to ICRC error
0x0002  2            0  R_ERR response for data FIS
0x0003  2            0  R_ERR response for device-to-host data FIS
0x0004  2            0  R_ERR response for host-to-device data FIS
0x0005  2            0  R_ERR response for non-data FIS
0x0006  2            0  R_ERR response for device-to-host non-data FIS
0x0007  2            0  R_ERR response for host-to-device non-data FIS
0x0009  2        35628  Transition from drive PhyRdy to drive PhyNRdy
0x000a  2            4  Device-to-host register FISes sent due to a COMRESET
0x000b  2            0  CRC errors within host-to-device FIS
0x000d  2            0  Non-CRC errors within host-to-device FIS

[root@usbstick liveuser]# 

