smartctl 7.0 2018-12-30 r4883 [x86_64-linux-3.10.0-1062.1.2.el7.x86_64] (local build)
Copyright (C) 2002-18, Bruce Allen, Christian Franke, www.smartmontools.org

=== START OF INFORMATION SECTION ===
Device Model:     MB012000GWDFE
Serial Number:    AAH0YTVH
LU WWN Device Id: 5 000cca 278ce8760
Firmware Version: HPG2
User Capacity:    12,000,138,625,024 bytes [12.0 TB]
Sector Sizes:     512 bytes logical, 4096 bytes physical
Rotation Rate:    7200 rpm
Form Factor:      3.5 inches
Device is:        Not in smartctl database [for details use: -P showall]
ATA Version is:   ACS-4, ACS-3 T13/2161-D revision 5
SATA Version is:  SATA 3.2, 6.0 Gb/s (current: 6.0 Gb/s)
Local Time is:    Wed Dec  4 12:19:01 2019 CET
SMART support is: Available - device has SMART capability.
SMART support is: Enabled
AAM feature is:   Unavailable
APM feature is:   Unavailable
Rd look-ahead is: Enabled
Write cache is:   Disabled
DSN feature is:   Unavailable
ATA Security is:  Unavailable
Wt Cache Reorder: Unavailable

=== START OF READ SMART DATA SECTION ===
SMART overall-health self-assessment test result: PASSED

General SMART Values:
Offline data collection status:  (0x82)	Offline data collection activity
					was completed without error.
					Auto Offline Data Collection: Enabled.
Self-test execution status:      (   0)	The previous self-test routine completed
					without error or no self-test has ever 
					been run.
Total time to complete Offline 
data collection: 		(   87) seconds.
Offline data collection
capabilities: 			 (0x5b) SMART execute Offline immediate.
					Auto Offline data collection on/off support.
					Suspend Offline collection upon new
					command.
					Offline surface scan supported.
					Self-test supported.
					No Conveyance Self-test supported.
					Selective Self-test supported.
SMART capabilities:            (0x0003)	Saves SMART data before entering
					power-saving mode.
					Supports SMART auto save timer.
Error logging capability:        (0x01)	Error logging supported.
					General Purpose Logging supported.
Short self-test routine 
recommended polling time: 	 (   2) minutes.
Extended self-test routine
recommended polling time: 	 (1305) minutes.
SCT capabilities: 	       (0x0025)	SCT Status supported.
					SCT Data Table supported.

SMART Attributes Data Structure revision number: 16
Vendor Specific SMART Attributes with Thresholds:
ID# ATTRIBUTE_NAME          FLAGS    VALUE WORST THRESH FAIL RAW_VALUE
  1 Raw_Read_Error_Rate     POSR--   100   100   016    -    0
  2 Throughput_Performance  POS---   132   100   054    -    96
  3 Spin_Up_Time            PO----   165   100   024    -    397 (Average 403)
  5 Reallocated_Sector_Ct   PO--CK   100   100   005    -    0
  7 Seek_Error_Rate         POSR--   100   100   067    -    0
  8 Seek_Time_Performance   P-S---   128   100   020    -    18
  9 Power_On_Hours          -O--CK   099   099   000    -    7403
 10 Spin_Retry_Count        PO--C-   100   100   060    -    0
 22 Unknown_Attribute       PO---K   100   100   025    -    100
169 Unknown_Attribute       PO--CK   100   100   099    -    0
180 Unknown_HDD_Attribute   PO-RCK   100   100   098    -    0
194 Temperature_Celsius     -O---K   222   214   000    -    27 (Min/Max 19/29)
196 Reallocated_Event_Count PO--CK   100   100   000    -    0
                            ||||||_ K auto-keep
                            |||||__ C event count
                            ||||___ R error rate
                            |||____ S speed/performance
                            ||_____ O updated online
                            |______ P prefailure warning

General Purpose Log Directory Version 1
SMART           Log Directory Version 1 [multi-sector log support]
Address    Access  R/W   Size  Description
0x00       GPL,SL  R/O      1  Log Directory
0x03       GPL     R/O      1  Ext. Comprehensive SMART error log
0x04       GPL,SL  R/O      7  Device Statistics log
0x07       GPL     R/O      1  Extended self-test log
0x08       GPL     R/O      2  Power Conditions log
0x09           SL  R/W      1  Selective self-test log
0x0c       GPL     R/O   5501  Pending Defects log
0x0d       GPL     R/O      7  LPS Mis-alignment log
0x10       GPL     R/O      1  NCQ Command Error log
0x11       GPL     R/O      1  SATA Phy Event Counters log
0x30       GPL     R/O      9  IDENTIFY DEVICE data log
0x80       GPL     R/W     16  Host vendor specific log
0x81-0x9f  GPL,SL  R/W     16  Host vendor specific log
0xb5           SL  VS       1  Device vendor specific log
0xb6       GPL     VS     127  Device vendor specific log
0xbb       GPL     VS       1  Device vendor specific log
0xd0       GPL     VS       1  Device vendor specific log
0xd7       GPL     VS       1  Device vendor specific log
0xe0       GPL,SL  R/W      1  SCT Command/Status
0xe1       GPL,SL  R/W      1  SCT Data Transfer

SMART Extended Comprehensive Error Log Version: 1 (1 sectors)
No Errors Logged

SMART Extended Self-test Log Version: 1 (1 sectors)
No self-tests have been logged.  [To run self-tests, use: smartctl -t]

SMART Selective self-test log data structure revision number 1
 SPAN  MIN_LBA  MAX_LBA  CURRENT_TEST_STATUS
    1        0        0  Not_testing
    2        0        0  Not_testing
    3        0        0  Not_testing
    4        0        0  Not_testing
    5        0        0  Not_testing
Selective self-test flags (0x0):
  After scanning selected spans, do NOT read-scan remainder of disk.
If Selective self-test is pending on power-up, resume after 0 minute delay.

SCT Status Version:                  3
SCT Version (vendor specific):       256 (0x0100)
Device State:                        Active (0)
Current Temperature:                    27 Celsius
Power Cycle Min/Max Temperature:     23/29 Celsius
Lifetime    Min/Max Temperature:     19/29 Celsius
Specified Max Operating Temperature:    60 Celsius
Under/Over Temperature Limit Count:   0/0

SCT Temperature History Version:     2
Temperature Sampling Period:         1 minute
Temperature Logging Interval:        1 minute
Min/Max recommended Temperature:      0/60 Celsius
Min/Max Temperature Limit:           -40/70 Celsius
Temperature History Size (Index):    128 (69)

Index    Estimated Time   Temperature Celsius
  70    2019-12-04 10:12    27  ********
  71    2019-12-04 10:13    26  *******
 ...    ..(  3 skipped).    ..  *******
  75    2019-12-04 10:17    26  *******
  76    2019-12-04 10:18    27  ********
 ...    ..(  9 skipped).    ..  ********
  86    2019-12-04 10:28    27  ********
  87    2019-12-04 10:29    26  *******
 ...    ..(  4 skipped).    ..  *******
  92    2019-12-04 10:34    26  *******
  93    2019-12-04 10:35    27  ********
 ...    ..(  9 skipped).    ..  ********
 103    2019-12-04 10:45    27  ********
 104    2019-12-04 10:46    26  *******
 105    2019-12-04 10:47    26  *******
 106    2019-12-04 10:48    26  *******
 107    2019-12-04 10:49    27  ********
 ...    ..( 12 skipped).    ..  ********
 120    2019-12-04 11:02    27  ********
 121    2019-12-04 11:03    26  *******
 122    2019-12-04 11:04    26  *******
 123    2019-12-04 11:05    27  ********
 ...    ..( 13 skipped).    ..  ********
   9    2019-12-04 11:19    27  ********
  10    2019-12-04 11:20    26  *******
  11    2019-12-04 11:21    27  ********
 ...    ..( 12 skipped).    ..  ********
  24    2019-12-04 11:34    27  ********
  25    2019-12-04 11:35    26  *******
  26    2019-12-04 11:36    26  *******
  27    2019-12-04 11:37    27  ********
 ...    ..( 12 skipped).    ..  ********
  40    2019-12-04 11:50    27  ********
  41    2019-12-04 11:51    26  *******
  42    2019-12-04 11:52    27  ********
 ...    ..( 12 skipped).    ..  ********
  55    2019-12-04 12:05    27  ********
  56    2019-12-04 12:06    26  *******
  57    2019-12-04 12:07    27  ********
 ...    ..( 11 skipped).    ..  ********
  69    2019-12-04 12:19    27  ********

SCT Error Recovery Control command not supported

Device Statistics (GP Log 0x04)
Page  Offset Size        Value Flags Description
0x01  =====  =               =  ===  == General Statistics (rev 1) ==
0x01  0x008  4              27  ---  Lifetime Power-On Resets
0x01  0x010  4            7403  ---  Power-on Hours
0x01  0x018  6       778061185  ---  Logical Sectors Written
0x01  0x020  6         1642197  ---  Number of Write Commands
0x01  0x028  6       434529307  ---  Logical Sectors Read
0x01  0x030  6          903549  ---  Number of Read Commands
0x01  0x038  6     26651183950  ---  Date and Time TimeStamp
0x03  =====  =               =  ===  == Rotating Media Statistics (rev 1) ==
0x03  0x008  4            7401  ---  Spindle Motor Power-on Hours
0x03  0x010  4            7401  ---  Head Flying Hours
0x03  0x018  4             334  ---  Head Load Events
0x03  0x020  4               0  ---  Number of Reallocated Logical Sectors
0x03  0x028  4               0  ---  Read Recovery Attempts
0x03  0x030  4               0  ---  Number of Mechanical Start Failures
0x04  =====  =               =  ===  == General Errors Statistics (rev 1) ==
0x04  0x008  4               0  ---  Number of Reported Uncorrectable Errors
0x04  0x010  4               0  ---  Resets Between Cmd Acceptance and Completion
0x05  =====  =               =  ===  == Temperature Statistics (rev 1) ==
0x05  0x008  1              27  ---  Current Temperature
0x05  0x010  1              26  N--  Average Short Term Temperature
0x05  0x018  1              26  N--  Average Long Term Temperature
0x05  0x020  1              29  ---  Highest Temperature
0x05  0x028  1              19  ---  Lowest Temperature
0x05  0x030  1              28  N--  Highest Average Short Term Temperature
0x05  0x038  1              23  N--  Lowest Average Short Term Temperature
0x05  0x040  1              27  N--  Highest Average Long Term Temperature
0x05  0x048  1              24  N--  Lowest Average Long Term Temperature
0x05  0x050  4               0  ---  Time in Over-Temperature
0x05  0x058  1              60  ---  Specified Maximum Operating Temperature
0x05  0x060  4               0  ---  Time in Under-Temperature
0x05  0x068  1               0  ---  Specified Minimum Operating Temperature
0x06  =====  =               =  ===  == Transport Statistics (rev 1) ==
0x06  0x008  4              12  ---  Number of Hardware Resets
0x06  0x010  4               0  ---  Number of ASR Events
0x06  0x018  4               0  ---  Number of Interface CRC Errors
                                |||_ C monitored condition met
                                ||__ D supports DSN
                                |___ N normalized value

Pending Defects log (GP Log 0x0c)
No Defects Logged

SATA Phy Event Counters (GP Log 0x11)
ID      Size     Value  Description
0x0001  2            0  Command failed due to ICRC error
0x0002  2            0  R_ERR response for data FIS
0x0003  2            0  R_ERR response for device-to-host data FIS
0x0004  2            0  R_ERR response for host-to-device data FIS
0x0005  2            0  R_ERR response for non-data FIS
0x0006  2            0  R_ERR response for device-to-host non-data FIS
0x0007  2            0  R_ERR response for host-to-device non-data FIS
0x0008  2            0  Device-to-host non-data FIS retries
0x0009  2           12  Transition from drive PhyRdy to drive PhyNRdy
0x000a  2           13  Device-to-host register FISes sent due to a COMRESET
0x000b  2            0  CRC errors within host-to-device FIS
0x000d  2            0  Non-CRC errors within host-to-device FIS

