smartctl 7.1 2019-12-30 r5022 [x86_64-linux-5.8.0-43-generic] (local build)
Copyright (C) 2002-19, Bruce Allen, Christian Franke, www.smartmontools.org

=== START OF INFORMATION SECTION ===
Device Model:     INTEL SSDSC2KB480GZ
Serial Number:    PHYI127100JU480BGN
LU WWN Device Id: 5 5cd2e4 1536814d2
Firmware Version: 7CV10100
User Capacity:    480,103,981,056 bytes [480 GB]
Sector Sizes:     512 bytes logical, 4096 bytes physical
Rotation Rate:    Solid State Device
Form Factor:      2.5 inches
Device is:        Not in smartctl database [for details use: -P showall]
ATA Version is:   ACS-3 T13/2161-D revision 5
SATA Version is:  SATA 3.2, 6.0 Gb/s (current: 6.0 Gb/s)
Local Time is:    Wed Dec  1 15:35:23 2021 PST
SMART support is: Available - device has SMART capability.
SMART support is: Enabled
AAM feature is:   Unavailable
APM feature is:   Unavailable
Rd look-ahead is: Enabled
Write cache is:   Enabled
DSN feature is:   Unavailable
ATA Security is:  Disabled, NOT FROZEN [SEC1]
Wt Cache Reorder: Enabled

=== START OF READ SMART DATA SECTION ===
SMART overall-health self-assessment test result: PASSED

General SMART Values:
Offline data collection status:  (0x02) Offline data collection activity
                                        was completed without error.
                                        Auto Offline Data Collection: Disabled.
Self-test execution status:      (   0) The previous self-test routine completed
                                        without error or no self-test has ever
                                        been run.
Total time to complete Offline
data collection:                (    2) seconds.
Offline data collection
capabilities:                    (0x79) SMART execute Offline immediate.
                                        No Auto Offline data collection support.
                                        Suspend Offline collection upon new
                                        command.
                                        Offline surface scan supported.
                                        Self-test supported.
                                        Conveyance Self-test supported.
                                        Selective Self-test supported.
SMART capabilities:            (0x0003) Saves SMART data before entering
                                        power-saving mode.
                                        Supports SMART auto save timer.
Error logging capability:        (0x01) Error logging supported.
                                        General Purpose Logging supported.
Short self-test routine
recommended polling time:        (   1) minutes.
Extended self-test routine
recommended polling time:        (   2) minutes.
Conveyance self-test routine
recommended polling time:        (   2) minutes.
SCT capabilities:              (0x003d) SCT Status supported.
                                        SCT Error Recovery Control supported.
                                        SCT Feature Control supported.
                                        SCT Data Table supported.

SMART Attributes Data Structure revision number: 1
Vendor Specific SMART Attributes with Thresholds:
ID# ATTRIBUTE_NAME          FLAGS    VALUE WORST THRESH FAIL RAW_VALUE
  5 Reallocated_Sector_Ct   -O--CK   066   066   000    -    0
  9 Power_On_Hours          -O--CK   100   100   000    -    3
12 Power_Cycle_Count       -O--CK   100   100   000    -    7
170 Unknown_Attribute       PO--CK   100   100   010    -    0
171 Unknown_Attribute       -O--CK   100   100   000    -    0
172 Unknown_Attribute       -O--CK   100   100   000    -    0
174 Unknown_Attribute       -O--CK   100   100   000    -    6
175 Program_Fail_Count_Chip PO--CK   100   100   010    -    34359675103
183 Runtime_Bad_Block       -O--CK   100   100   000    -    0
184 End-to-End_Error        PO--CK   100   100   090    -    0
187 Reported_Uncorrect      -O--CK   100   100   000    -    0
190 Airflow_Temperature_Cel -O---K   072   072   000    -    28 (Min/Max 26/28)
192 Power-Off_Retract_Count -O--CK   100   100   000    -    6
194 Temperature_Celsius     -O---K   100   100   000    -    28
197 Current_Pending_Sector  -O--C-   100   100   000    -    0
199 UDMA_CRC_Error_Count    -OSRCK   100   100   000    -    0
225 Unknown_SSD_Attribute   -O--CK   100   100   000    -    353
226 Unknown_SSD_Attribute   -O--CK   100   100   000    -    0
227 Unknown_SSD_Attribute   -O--CK   100   100   000    -    38
228 Power-off_Retract_Count -O--CK   100   100   000    -    70
229 Unknown_Attribute       -O--CK   100   100   000    -    0
230 Unknown_SSD_Attribute   -O--CK   100   100   000    -    0
232 Available_Reservd_Space PO--CK   100   100   010    -    0
233 Media_Wearout_Indicator -O--CK   100   100   000    -    0
234 Unknown_Attribute       -O--CK   100   100   000    -    0
235 Unknown_Attribute       PO--CK   100   100   010    -    34359675103
241 Total_LBAs_Written      -O--CK   100   100   000    -    353
242 Total_LBAs_Read         -O--CK   100   100   000    -    361
243 Unknown_Attribute       -O--CK   100   100   000    -    626
246 Unknown_Attribute       -O--CK   100   100   000    -    0
                            ||||||_ K auto-keep
                            |||||__ C event count
                            ||||___ R error rate
                            |||____ S speed/performance
                            ||_____ O updated online
                            |______ P prefailure warning

General Purpose Log Directory Version 1
SMART           Log Directory Version 1 [multi-sector log support]
Address    Access  R/W   Size  Description
0x00       GPL,SL  R/O      1  Log Directory
0x01           SL  R/O      1  Summary SMART error log
0x02           SL  R/O      8  Comprehensive SMART error log
0x03       GPL     R/O     20  Ext. Comprehensive SMART error log
0x04       GPL,SL  R/O      8  Device Statistics log
0x06           SL  R/O      1  SMART self-test log
0x07       GPL     R/O      2  Extended self-test log
0x08       GPL     R/O      2  Power Conditions log
0x09           SL  R/W      1  Selective self-test log
0x10       GPL     R/O      1  NCQ Command Error log
0x11       GPL     R/O      1  SATA Phy Event Counters log
0x24       GPL     R/O    512  Current Device Internal Status Data log
0x25       GPL     R/O    512  Saved Device Internal Status Data log
0x30       GPL,SL  R/O      9  IDENTIFY DEVICE data log
0x80-0x9f  GPL,SL  R/W     16  Host vendor specific log
0xb8       GPL,SL  VS       1  Device vendor specific log
0xb9       GPL     VS    3712  Device vendor specific log
0xb9       SL      VS     128  Device vendor specific log
0xba       GPL     VS    1280  Device vendor specific log
0xc8-0xc9  GPL     VS       1  Device vendor specific log
0xe0       GPL,SL  R/W      1  SCT Command/Status
0xe1       GPL,SL  R/W      8  SCT Data Transfer
0xf6       GPL,SL  -       19  Reserved

SMART Extended Comprehensive Error Log Version: 1 (20 sectors)
No Errors Logged

SMART Extended Self-test Log Version: 1 (2 sectors)
Num  Test_Description    Status                  Remaining  LifeTime(hours)  LBA_of_first_error
# 1  Short offline       Completed without error       00%         3         -

SMART Selective self-test log data structure revision number 1
SPAN  MIN_LBA  MAX_LBA  CURRENT_TEST_STATUS
    1        0        0  Not_testing
    2        0        0  Not_testing
    3        0        0  Not_testing
    4        0        0  Not_testing
    5        0        0  Not_testing
Selective self-test flags (0x0):
  After scanning selected spans, do NOT read-scan remainder of disk.
If Selective self-test is pending on power-up, resume after 0 minute delay.

SCT Status Version:                  3
SCT Version (vendor specific):       1 (0x0001)
Device State:                        Active (0)
Current Temperature:                    28 Celsius
Power Cycle Min/Max Temperature:     26/28 Celsius
Lifetime    Min/Max Temperature:     25/31 Celsius
Specified Max Operating Temperature:    73 Celsius
Under/Over Temperature Limit Count:   0/0
SMART Status:                        0xc24f (PASSED)
Vendor specific:
00 00 2c 01 00 00 00 00 00 00 00 00 00 00 00 00
00 00 00 00 00 00 00 00 00 00 00 00 00 00 00 00

SCT Temperature History Version:     2
Temperature Sampling Period:         1 minute
Temperature Logging Interval:        1 minute
Min/Max recommended Temperature:      0/73 Celsius
Min/Max Temperature Limit:            0/73 Celsius
Temperature History Size (Index):    478 (185)

Index    Estimated Time   Temperature Celsius
186    2021-12-01 07:38     ?  -
...    ..(290 skipped).    ..  -
477    2021-12-01 12:29     ?  -
   0    2021-12-01 12:30    31  ************
   1    2021-12-01 12:31    31  ************
   2    2021-12-01 12:32     ?  -
   3    2021-12-01 12:33    29  **********
   4    2021-12-01 12:34    28  *********
   5    2021-12-01 12:35    28  *********
   6    2021-12-01 12:36     ?  -
   7    2021-12-01 12:37    28  *********
...    ..(  5 skipped).    ..  *********
  13    2021-12-01 12:43    28  *********
  14    2021-12-01 12:44    29  **********
  15    2021-12-01 12:45    28  *********
  16    2021-12-01 12:46    29  **********
  17    2021-12-01 12:47    29  **********
  18    2021-12-01 12:48    28  *********
...    ..(  7 skipped).    ..  *********
  26    2021-12-01 12:56    28  *********
  27    2021-12-01 12:57    29  **********
  28    2021-12-01 12:58    29  **********
  29    2021-12-01 12:59    28  *********
  30    2021-12-01 13:00    29  **********
  31    2021-12-01 13:01    29  **********
  32    2021-12-01 13:02    29  **********
  33    2021-12-01 13:03    28  *********
  34    2021-12-01 13:04    28  *********
  35    2021-12-01 13:05    29  **********
  36    2021-12-01 13:06    28  *********
  37    2021-12-01 13:07    29  **********
  38    2021-12-01 13:08    29  **********
  39    2021-12-01 13:09    29  **********
  40    2021-12-01 13:10    28  *********
  41    2021-12-01 13:11    29  **********
  42    2021-12-01 13:12    29  **********
  43    2021-12-01 13:13    28  *********
  44    2021-12-01 13:14    29  **********
  45    2021-12-01 13:15    29  **********
  46    2021-12-01 13:16    28  *********
  47    2021-12-01 13:17    29  **********
  48    2021-12-01 13:18    28  *********
 49    2021-12-01 13:19    28  *********
  50    2021-12-01 13:20    29  **********
  51    2021-12-01 13:21    28  *********
  52    2021-12-01 13:22    28  *********
  53    2021-12-01 13:23    29  **********
  54    2021-12-01 13:24    29  **********
  55    2021-12-01 13:25    28  *********
...    ..(  3 skipped).    ..  *********
  59    2021-12-01 13:29    28  *********
  60    2021-12-01 13:30     ?  -
  61    2021-12-01 13:31    28  *********
  62    2021-12-01 13:32    27  ********
  63    2021-12-01 13:33    27  ********
  64    2021-12-01 13:34    26  *******
...    ..(  5 skipped).    ..  *******
  70    2021-12-01 13:40    26  *******
  71    2021-12-01 13:41    27  ********
  72    2021-12-01 13:42    26  *******
...    ..(  7 skipped).    ..  *******
  80    2021-12-01 13:50    26  *******
  81    2021-12-01 13:51    25  ******
  82    2021-12-01 13:52    25  ******
  83    2021-12-01 13:53    26  *******
...    ..( 17 skipped).    ..  *******
101    2021-12-01 14:11    26  *******
102    2021-12-01 14:12    27  ********
103    2021-12-01 14:13    27  ********
104    2021-12-01 14:14    27  ********
105    2021-12-01 14:15    26  *******
...    ..(  7 skipped).    ..  *******
113    2021-12-01 14:23    26  *******
114    2021-12-01 14:24    27  ********
115    2021-12-01 14:25    26  *******
...    ..(  4 skipped).    ..  *******
120    2021-12-01 14:30    26  *******
121    2021-12-01 14:31    27  ********
...    ..(  2 skipped).    ..  ********
124    2021-12-01 14:34    27  ********
125    2021-12-01 14:35    26  *******
126    2021-12-01 14:36    27  ********
127    2021-12-01 14:37    27  ********
128    2021-12-01 14:38    26  *******
129    2021-12-01 14:39    27  ********
130    2021-12-01 14:40     ?  -
131    2021-12-01 14:41    28  *********
132    2021-12-01 14:42    28  *********
133    2021-12-01 14:43    29  **********
...    ..( 38 skipped).    ..  **********
172    2021-12-01 15:22    29  **********
173    2021-12-01 15:23     ?  -
174    2021-12-01 15:24    29  **********
175    2021-12-01 15:25     ?  -
176    2021-12-01 15:26    28  *********
...    ..(  8 skipped).    ..  *********
185    2021-12-01 15:35    28  *********

SCT Error Recovery Control:
           Read: Disabled
          Write: Disabled

Device Statistics (GP Log 0x04)
Page  Offset Size        Value Flags Description
0x01  =====  =               =  ===  == General Statistics (rev 2) ==
0x01  0x008  4               7  ---  Lifetime Power-On Resets
0x01  0x018  6        23156873  ---  Logical Sectors Written
0x01  0x020  6         7991751  ---  Number of Write Commands
0x01  0x028  6        23692708  ---  Logical Sectors Read
0x01  0x030  6        11481844  ---  Number of Read Commands
0x01  0x038  6        10972483  ---  Date and Time TimeStamp
0x04  =====  =               =  ===  == General Errors Statistics (rev 1) ==
0x04  0x008  4               0  ---  Number of Reported Uncorrectable Errors
0x04  0x010  4               0  ---  Resets Between Cmd Acceptance and Completion
0x05  =====  =               =  ===  == Temperature Statistics (rev 1) ==
0x05  0x008  1              28  ---  Current Temperature
0x05  0x010  1               -  ---  Average Short Term Temperature
0x05  0x018  1               -  ---  Average Long Term Temperature
0x05  0x020  1              29  ---  Highest Temperature
0x05  0x028  1              26  ---  Lowest Temperature
0x05  0x030  1               -  ---  Highest Average Short Term Temperature
0x05  0x038  1               -  ---  Lowest Average Short Term Temperature
0x05  0x040  1               -  ---  Highest Average Long Term Temperature
0x05  0x048  1               -  ---  Lowest Average Long Term Temperature
0x05  0x050  4               0  ---  Time in Over-Temperature
0x05  0x058  1              73  ---  Specified Maximum Operating Temperature
0x05  0x060  4               0  ---  Time in Under-Temperature
0x05  0x068  1               0  ---  Specified Minimum Operating Temperature
0x06  =====  =               =  ===  == Transport Statistics (rev 1) ==
0x06  0x008  4              46  ---  Number of Hardware Resets
0x06  0x010  4              39  ---  Number of ASR Events
0x06  0x018  4               0  ---  Number of Interface CRC Errors
0x07  =====  =               =  ===  == Solid State Device Statistics (rev 1) ==
0x07  0x008  1               0  ---  Percentage Used Endurance Indicator
                                |||_ C monitored condition met
                                ||__ D supports DSN
                                |___ N normalized value

Pending Defects log (GP Log 0x0c) not supported

SATA Phy Event Counters (GP Log 0x11)
ID      Size     Value  Description
0x0001  4            0  Command failed due to ICRC error
0x0002  4            0  R_ERR response for data FIS
0x0003  4            0  R_ERR response for device-to-host data FIS
0x0004  4            0  R_ERR response for host-to-device data FIS
0x0005  4            0  R_ERR response for non-data FIS
0x0006  4            0  R_ERR response for device-to-host non-data FIS
0x0007  4            0  R_ERR response for host-to-device non-data FIS
0x000a  4            1  Device-to-host register FISes sent due to a COMRESET
0x000b  4            0  CRC errors within host-to-device FIS
0x000d  4            0  Non-CRC errors within host-to-device FIS
