smartctl 7.1 2019-12-30 r5022 [x86_64-linux-5.4.0-54-generic] (local build)
Copyright (C) 2002-19, Bruce Allen, Christian Franke, www.smartmontools.org

=== START OF INFORMATION SECTION ===
Device Model:     TOSHIBA MQ04UBB400
Serial Number:    70S7T04ZT
LU WWN Device Id: 0 000000 000000000
Firmware Version: JS000U
User Capacity:    4,000,787,030,016 bytes [4.00 TB]
Sector Sizes:     512 bytes logical, 4096 bytes physical
Rotation Rate:    5400 rpm
Form Factor:      2.5 inches
Device is:        Not in smartctl database [for details use: -P showall]
ATA Version is:   ACS-3 T13/2161-D revision 5
SATA Version is:  SATA 3.3, 3.0 Gb/s (current: 3.0 Gb/s)
Local Time is:    Fri Nov 27 03:38:34 2020 AEDT
SMART support is: Available - device has SMART capability.
SMART support is: Enabled
AAM feature is:   Unavailable
APM level is:     254 (maximum performance)
Rd look-ahead is: Enabled
Write cache is:   Enabled
DSN feature is:   Disabled
ATA Security is:  Disabled, NOT FROZEN [SEC1]
Wt Cache Reorder: Unknown

=== START OF READ SMART DATA SECTION ===
SMART Status not supported: Incomplete response, ATA output registers missing
SMART overall-health self-assessment test result: PASSED
Warning: This result is based on an Attribute check.

General SMART Values:
Offline data collection status:  (0x00)	Offline data collection activity
					was never started.
					Auto Offline Data Collection: Disabled.
Self-test execution status:      (   0)	The previous self-test routine completed
					without error or no self-test has ever 
					been run.
Total time to complete Offline 
data collection: 		(  120) seconds.
Offline data collection
capabilities: 			 (0x5b) SMART execute Offline immediate.
					Auto Offline data collection on/off support.
					Suspend Offline collection upon new
					command.
					Offline surface scan supported.
					Self-test supported.
					No Conveyance Self-test supported.
					Selective Self-test supported.
SMART capabilities:            (0x0003)	Saves SMART data before entering
					power-saving mode.
					Supports SMART auto save timer.
Error logging capability:        (0x01)	Error logging supported.
					General Purpose Logging supported.
Short self-test routine 
recommended polling time: 	 (   2) minutes.
Extended self-test routine
recommended polling time: 	 ( 666) minutes.
SCT capabilities: 	       (0x003d)	SCT Status supported.
					SCT Error Recovery Control supported.
					SCT Feature Control supported.
					SCT Data Table supported.

SMART Attributes Data Structure revision number: 16
Vendor Specific SMART Attributes with Thresholds:
ID# ATTRIBUTE_NAME          FLAGS    VALUE WORST THRESH FAIL RAW_VALUE
  1 Raw_Read_Error_Rate     PO-R--   100   100   050    -    0
  2 Throughput_Performance  P-S---   100   100   050    -    0
  3 Spin_Up_Time            POS--K   100   100   001    -    5288
  4 Start_Stop_Count        -O--CK   100   100   000    -    39
  5 Reallocated_Sector_Ct   PO--CK   100   100   050    -    0
  7 Seek_Error_Rate         PO-R--   100   100   050    -    0
  8 Seek_Time_Performance   P-S---   100   100   050    -    0
  9 Power_On_Hours          -O--CK   100   100   000    -    60
 10 Spin_Retry_Count        PO--CK   100   100   030    -    0
 12 Power_Cycle_Count       -O--CK   100   100   000    -    5
191 G-Sense_Error_Rate      -O--CK   100   100   000    -    0
192 Power-Off_Retract_Count -O--CK   100   100   000    -    0
193 Load_Cycle_Count        -O--CK   100   100   000    -    50
194 Temperature_Celsius     -O---K   100   100   000    -    28 (Min/Max 24/38)
196 Reallocated_Event_Count -O--CK   100   100   000    -    0
197 Current_Pending_Sector  -O--CK   100   100   000    -    0
198 Offline_Uncorrectable   ----CK   100   100   000    -    0
199 UDMA_CRC_Error_Count    -O--CK   200   200   000    -    0
220 Disk_Shift              -O----   100   100   000    -    0
222 Loaded_Hours            -O--CK   100   100   000    -    29
223 Load_Retry_Count        -O--CK   100   100   000    -    0
224 Load_Friction           -O---K   100   100   000    -    0
226 Load-in_Time            -OS--K   100   100   000    -    270
240 Head_Flying_Hours       P-----   100   100   001    -    0
                            ||||||_ K auto-keep
                            |||||__ C event count
                            ||||___ R error rate
                            |||____ S speed/performance
                            ||_____ O updated online
                            |______ P prefailure warning

General Purpose Log Directory Version 1
SMART           Log Directory Version 1 [multi-sector log support]
Address    Access  R/W   Size  Description
0x00       GPL,SL  R/O      1  Log Directory
0x01           SL  R/O      1  Summary SMART error log
0x02           SL  R/O     51  Comprehensive SMART error log
0x03       GPL     R/O     64  Ext. Comprehensive SMART error log
0x04       GPL,SL  R/O      8  Device Statistics log
0x06           SL  R/O      1  SMART self-test log
0x07       GPL     R/O      1  Extended self-test log
0x09           SL  R/W      1  Selective self-test log
0x0a       GPL     R/W      2  Device Statistics Notification
0x10       GPL     R/O      1  NCQ Command Error log
0x11       GPL     R/O      1  SATA Phy Event Counters log
0x24       GPL     R/O  32768  Current Device Internal Status Data log
0x30       GPL,SL  R/O      9  IDENTIFY DEVICE data log
0x80-0x9f  GPL,SL  R/W     16  Host vendor specific log
0xa7       GPL     VS       8  Device vendor specific log
0xe0       GPL,SL  R/W      1  SCT Command/Status
0xe1       GPL,SL  R/W      1  SCT Data Transfer

SMART Extended Comprehensive Error Log Version: 1 (64 sectors)
No Errors Logged

SMART Extended Self-test Log Version: 1 (1 sectors)
Num  Test_Description    Status                  Remaining  LifeTime(hours)  LBA_of_first_error
# 1  Short offline       Completed without error       00%        60         -

SMART Selective self-test log data structure revision number 1
 SPAN  MIN_LBA  MAX_LBA  CURRENT_TEST_STATUS
    1        0        0  Not_testing
    2        0        0  Not_testing
    3        0        0  Not_testing
    4        0        0  Not_testing
    5        0        0  Not_testing
Selective self-test flags (0x0):
  After scanning selected spans, do NOT read-scan remainder of disk.
If Selective self-test is pending on power-up, resume after 0 minute delay.

SCT Status Version:                  3
SCT Version (vendor specific):       1 (0x0001)
Device State:                        Active (0)
Current Temperature:                    28 Celsius
Power Cycle Min/Max Temperature:     24/28 Celsius
Lifetime    Min/Max Temperature:     24/38 Celsius
Under/Over Temperature Limit Count:   0/0

SCT Temperature History Version:     2
Temperature Sampling Period:         1 minute
Temperature Logging Interval:        1 minute
Min/Max recommended Temperature:      0/60 Celsius
Min/Max Temperature Limit:            0/60 Celsius
Temperature History Size (Index):    478 (115)

Index    Estimated Time   Temperature Celsius
 116    2020-11-26 19:41    37  ******************
 117    2020-11-26 19:42    37  ******************
 118    2020-11-26 19:43    37  ******************
 119    2020-11-26 19:44    36  *****************
 ...    ..( 83 skipped).    ..  *****************
 203    2020-11-26 21:08    36  *****************
 204    2020-11-26 21:09    35  ****************
 ...    ..( 23 skipped).    ..  ****************
 228    2020-11-26 21:33    35  ****************
 229    2020-11-26 21:34    36  *****************
 ...    ..( 75 skipped).    ..  *****************
 305    2020-11-26 22:50    36  *****************
 306    2020-11-26 22:51    35  ****************
 ...    ..( 10 skipped).    ..  ****************
 317    2020-11-26 23:02    35  ****************
 318    2020-11-26 23:03    36  *****************
 319    2020-11-26 23:04    35  ****************
 320    2020-11-26 23:05    36  *****************
 321    2020-11-26 23:06    35  ****************
 ...    ..( 17 skipped).    ..  ****************
 339    2020-11-26 23:24    35  ****************
 340    2020-11-26 23:25    36  *****************
 ...    ..(  4 skipped).    ..  *****************
 345    2020-11-26 23:30    36  *****************
 346    2020-11-26 23:31    37  ******************
 ...    ..( 39 skipped).    ..  ******************
 386    2020-11-27 00:11    37  ******************
 387    2020-11-27 00:12    38  *******************
 388    2020-11-27 00:13    37  ******************
 389    2020-11-27 00:14    38  *******************
 ...    ..(  4 skipped).    ..  *******************
 394    2020-11-27 00:19    38  *******************
 395    2020-11-27 00:20    37  ******************
 ...    ..(  8 skipped).    ..  ******************
 404    2020-11-27 00:29    37  ******************
 405    2020-11-27 00:30    38  *******************
 ...    ..(  9 skipped).    ..  *******************
 415    2020-11-27 00:40    38  *******************
 416    2020-11-27 00:41    37  ******************
 ...    ..( 12 skipped).    ..  ******************
 429    2020-11-27 00:54    37  ******************
 430    2020-11-27 00:55     ?  -
 431    2020-11-27 00:56    24  *****
 432    2020-11-27 00:57    25  ******
 433    2020-11-27 00:58    26  *******
 434    2020-11-27 00:59    27  ********
 435    2020-11-27 01:00    27  ********
 436    2020-11-27 01:01    28  *********
 437    2020-11-27 01:02    29  **********
 438    2020-11-27 01:03    30  ***********
 439    2020-11-27 01:04    30  ***********
 440    2020-11-27 01:05    31  ************
 441    2020-11-27 01:06    31  ************
 442    2020-11-27 01:07    32  *************
 443    2020-11-27 01:08    34  ***************
 444    2020-11-27 01:09    34  ***************
 445    2020-11-27 01:10    34  ***************
 446    2020-11-27 01:11     ?  -
 447    2020-11-27 01:12    26  *******
 448    2020-11-27 01:13    27  ********
 449    2020-11-27 01:14    28  *********
 450    2020-11-27 01:15    28  *********
 451    2020-11-27 01:16     ?  -
 452    2020-11-27 01:17    25  ******
 453    2020-11-27 01:18    26  *******
 454    2020-11-27 01:19    27  ********
 455    2020-11-27 01:20    28  *********
 456    2020-11-27 01:21     ?  -
 457    2020-11-27 01:22    28  *********
 458    2020-11-27 01:23    28  *********
 459    2020-11-27 01:24    29  **********
 460    2020-11-27 01:25    30  ***********
 461    2020-11-27 01:26     ?  -
 462    2020-11-27 01:27    24  *****
 463    2020-11-27 01:28     ?  -
 464    2020-11-27 01:29    25  ******
 465    2020-11-27 01:30     ?  -
 466    2020-11-27 01:31    28  *********
 467    2020-11-27 01:32    29  **********
 468    2020-11-27 01:33    29  **********
 469    2020-11-27 01:34    30  ***********
 470    2020-11-27 01:35     ?  -
 471    2020-11-27 01:36    30  ***********
 472    2020-11-27 01:37    31  ************
 473    2020-11-27 01:38    31  ************
 474    2020-11-27 01:39    32  *************
 475    2020-11-27 01:40     ?  -
 476    2020-11-27 01:41    32  *************
 477    2020-11-27 01:42    32  *************
   0    2020-11-27 01:43    33  **************
   1    2020-11-27 01:44     ?  -
   2    2020-11-27 01:45    33  **************
   3    2020-11-27 01:46    33  **************
   4    2020-11-27 01:47    33  **************
   5    2020-11-27 01:48    34  ***************
   6    2020-11-27 01:49     ?  -
   7    2020-11-27 01:50    34  ***************
 ...    ..(  2 skipped).    ..  ***************
  10    2020-11-27 01:53    34  ***************
  11    2020-11-27 01:54     ?  -
  12    2020-11-27 01:55    33  **************
  13    2020-11-27 01:56    33  **************
  14    2020-11-27 01:57    33  **************
  15    2020-11-27 01:58    34  ***************
  16    2020-11-27 01:59     ?  -
  17    2020-11-27 02:00    33  **************
  18    2020-11-27 02:01    33  **************
  19    2020-11-27 02:02    33  **************
  20    2020-11-27 02:03    34  ***************
  21    2020-11-27 02:04     ?  -
  22    2020-11-27 02:05    33  **************
  23    2020-11-27 02:06    33  **************
  24    2020-11-27 02:07    33  **************
  25    2020-11-27 02:08    34  ***************
  26    2020-11-27 02:09     ?  -
  27    2020-11-27 02:10    33  **************
  28    2020-11-27 02:11    33  **************
  29    2020-11-27 02:12    33  **************
  30    2020-11-27 02:13    34  ***************
  31    2020-11-27 02:14     ?  -
  32    2020-11-27 02:15    33  **************
 ...    ..(  2 skipped).    ..  **************
  35    2020-11-27 02:18    33  **************
  36    2020-11-27 02:19     ?  -
  37    2020-11-27 02:20    32  *************
  38    2020-11-27 02:21    33  **************
  39    2020-11-27 02:22    33  **************
  40    2020-11-27 02:23    33  **************
  41    2020-11-27 02:24     ?  -
  42    2020-11-27 02:25    33  **************
 ...    ..(  2 skipped).    ..  **************
  45    2020-11-27 02:28    33  **************
  46    2020-11-27 02:29     ?  -
  47    2020-11-27 02:30    32  *************
  48    2020-11-27 02:31    33  **************
  49    2020-11-27 02:32    33  **************
  50    2020-11-27 02:33    33  **************
  51    2020-11-27 02:34     ?  -
  52    2020-11-27 02:35    32  *************
  53    2020-11-27 02:36    33  **************
  54    2020-11-27 02:37    33  **************
  55    2020-11-27 02:38    33  **************
  56    2020-11-27 02:39     ?  -
  57    2020-11-27 02:40    33  **************
 ...    ..(  2 skipped).    ..  **************
  60    2020-11-27 02:43    33  **************
  61    2020-11-27 02:44     ?  -
  62    2020-11-27 02:45    29  **********
  63    2020-11-27 02:46     ?  -
  64    2020-11-27 02:47    30  ***********
  65    2020-11-27 02:48    30  ***********
  66    2020-11-27 02:49    30  ***********
  67    2020-11-27 02:50     ?  -
  68    2020-11-27 02:51    30  ***********
  69    2020-11-27 02:52    31  ************
  70    2020-11-27 02:53    31  ************
  71    2020-11-27 02:54    31  ************
  72    2020-11-27 02:55     ?  -
  73    2020-11-27 02:56    30  ***********
  74    2020-11-27 02:57    30  ***********
  75    2020-11-27 02:58    31  ************
  76    2020-11-27 02:59    31  ************
  77    2020-11-27 03:00    32  *************
  78    2020-11-27 03:01     ?  -
  79    2020-11-27 03:02    32  *************
  80    2020-11-27 03:03    32  *************
  81    2020-11-27 03:04    33  **************
  82    2020-11-27 03:05     ?  -
  83    2020-11-27 03:06    32  *************
  84    2020-11-27 03:07     ?  -
  85    2020-11-27 03:08    33  **************
  86    2020-11-27 03:09    33  **************
  87    2020-11-27 03:10    33  **************
  88    2020-11-27 03:11     ?  -
  89    2020-11-27 03:12    32  *************
  90    2020-11-27 03:13    33  **************
  91    2020-11-27 03:14    33  **************
  92    2020-11-27 03:15    33  **************
  93    2020-11-27 03:16     ?  -
  94    2020-11-27 03:17    33  **************
  95    2020-11-27 03:18    33  **************
  96    2020-11-27 03:19    33  **************
  97    2020-11-27 03:20    34  ***************
  98    2020-11-27 03:21    34  ***************
  99    2020-11-27 03:22    34  ***************
 100    2020-11-27 03:23     ?  -
 101    2020-11-27 03:24    24  *****
 102    2020-11-27 03:25    24  *****
 103    2020-11-27 03:26    24  *****
 104    2020-11-27 03:27    25  ******
 105    2020-11-27 03:28     ?  -
 106    2020-11-27 03:29    24  *****
 107    2020-11-27 03:30    25  ******
 108    2020-11-27 03:31    25  ******
 109    2020-11-27 03:32    26  *******
 110    2020-11-27 03:33     ?  -
 111    2020-11-27 03:34    26  *******
 112    2020-11-27 03:35    27  ********
 113    2020-11-27 03:36    28  *********
 114    2020-11-27 03:37     ?  -
 115    2020-11-27 03:38    28  *********

SMART WRITE LOG does not return COUNT and LBA_LOW register
SCT (Get) Error Recovery Control command failed

Device Statistics (GP Log 0x04)
Page  Offset Size        Value Flags Description
0x01  =====  =               =  ===  == General Statistics (rev 1) ==
0x01  0x008  4               5  ---  Lifetime Power-On Resets
0x01  0x010  4              60  ---  Power-on Hours
0x01  0x018  6      5323443041  ---  Logical Sectors Written
0x01  0x020  6         3245062  ---  Number of Write Commands
0x01  0x028  6         2400008  ---  Logical Sectors Read
0x01  0x030  6           44083  ---  Number of Read Commands
0x01  0x038  6       219193426  ---  Date and Time TimeStamp
0x02  =====  =               =  ===  == Free-Fall Statistics (rev 1) ==
0x02  0x010  4               0  ---  Overlimit Shock Events
0x03  =====  =               =  ===  == Rotating Media Statistics (rev 1) ==
0x03  0x008  4              29  ---  Spindle Motor Power-on Hours
0x03  0x010  4              29  ---  Head Flying Hours
0x03  0x018  4              51  ---  Head Load Events
0x03  0x020  4               0  -D-  Number of Reallocated Logical Sectors
0x03  0x028  4               2  ---  Read Recovery Attempts
0x03  0x030  4               0  ---  Number of Mechanical Start Failures
0x03  0x038  4               0  ---  Number of Realloc. Candidate Logical Sectors
0x03  0x040  4               0  ---  Number of High Priority Unload Events
0x04  =====  =               =  ===  == General Errors Statistics (rev 1) ==
0x04  0x008  4               0  ---  Number of Reported Uncorrectable Errors
0x04  0x010  4               1  ---  Resets Between Cmd Acceptance and Completion
0x05  =====  =               =  ===  == Temperature Statistics (rev 1) ==
0x05  0x008  1              28  ---  Current Temperature
0x05  0x010  1              30  N--  Average Short Term Temperature
0x05  0x018  1               -  N--  Average Long Term Temperature
0x05  0x020  1              38  ---  Highest Temperature
0x05  0x028  1              24  ---  Lowest Temperature
0x05  0x030  1              36  N--  Highest Average Short Term Temperature
0x05  0x038  1              30  N--  Lowest Average Short Term Temperature
0x05  0x040  1               -  N--  Highest Average Long Term Temperature
0x05  0x048  1               -  N--  Lowest Average Long Term Temperature
0x05  0x050  4               0  ---  Time in Over-Temperature
0x05  0x058  1              60  ---  Specified Maximum Operating Temperature
0x05  0x060  4               0  ---  Time in Under-Temperature
0x05  0x068  1               0  ---  Specified Minimum Operating Temperature
0x06  =====  =               =  ===  == Transport Statistics (rev 1) ==
0x06  0x008  4              53  ---  Number of Hardware Resets
0x06  0x010  4               9  ---  Number of ASR Events
0x06  0x018  4               0  ---  Number of Interface CRC Errors
0x07  =====  =               =  ===  == Solid State Device Statistics (rev 1) ==
                                |||_ C monitored condition met
                                ||__ D supports DSN
                                |___ N normalized value

Pending Defects log (GP Log 0x0c) not supported

SATA Phy Event Counters (GP Log 0x11)
ID      Size     Value  Description
0x0001  4            0  Command failed due to ICRC error
0x0002  4            0  R_ERR response for data FIS
0x0003  4            0  R_ERR response for device-to-host data FIS
0x0004  4            0  R_ERR response for host-to-device data FIS
0x0005  4            0  R_ERR response for non-data FIS
0x0006  4            0  R_ERR response for device-to-host non-data FIS
0x0007  4            0  R_ERR response for host-to-device non-data FIS
0x0008  4            0  Device-to-host non-data FIS retries
0x0009  4           25  Transition from drive PhyRdy to drive PhyNRdy
0x000a  4           18  Device-to-host register FISes sent due to a COMRESET
0x000b  4            0  CRC errors within host-to-device FIS
0x000d  4            0  Non-CRC errors within host-to-device FIS
0x000f  4            0  R_ERR response for host-to-device data FIS, CRC
0x0010  4            0  R_ERR response for host-to-device data FIS, non-CRC
0x0012  4            0  R_ERR response for host-to-device non-data FIS, CRC
0x0013  4            0  R_ERR response for host-to-device non-data FIS, non-CRC

