smartctl 7.0 2018-12-30 r4883 [x86_64-linux-3.10.0-1160.15.2.el7.x86_64] (local build)
Copyright (C) 2002-18, Bruce Allen, Christian Franke, www.smartmontools.org

=== START OF INFORMATION SECTION ===
Device Model:     WDC WD101EMAZ-11G7DA0
Serial Number:    VCGKVV7P
LU WWN Device Id: 5 000cca 0b0c81f16
Firmware Version: 81.00A81
User Capacity:    10,000,831,348,736 bytes [10.0 TB]
Sector Sizes:     512 bytes logical, 4096 bytes physical
Rotation Rate:    5400 rpm
Form Factor:      3.5 inches
Device is:        Not in smartctl database [for details use: -P showall]
ATA Version is:   ACS-2, ATA8-ACS T13/1699-D revision 4
SATA Version is:  SATA 3.2, 6.0 Gb/s (current: 6.0 Gb/s)
Local Time is:    Thu Mar 18 16:33:43 2021 CET
SMART support is: Available - device has SMART capability.
SMART support is: Enabled
AAM feature is:   Unavailable
APM level is:     164 (intermediate level without standby)
Rd look-ahead is: Enabled
Write cache is:   Enabled
DSN feature is:   Unavailable
ATA Security is:  Disabled, NOT FROZEN [SEC1]
Wt Cache Reorder: Enabled

=== START OF READ SMART DATA SECTION ===
SMART overall-health self-assessment test result: PASSED

General SMART Values:
Offline data collection status:  (0x80)	Offline data collection activity
					was never started.
					Auto Offline Data Collection: Enabled.
Self-test execution status:      (   0)	The previous self-test routine completed
					without error or no self-test has ever 
					been run.
Total time to complete Offline 
data collection: 		(   87) seconds.
Offline data collection
capabilities: 			 (0x5b) SMART execute Offline immediate.
					Auto Offline data collection on/off support.
					Suspend Offline collection upon new
					command.
					Offline surface scan supported.
					Self-test supported.
					No Conveyance Self-test supported.
					Selective Self-test supported.
SMART capabilities:            (0x0003)	Saves SMART data before entering
					power-saving mode.
					Supports SMART auto save timer.
Error logging capability:        (0x01)	Error logging supported.
					General Purpose Logging supported.
Short self-test routine 
recommended polling time: 	 (   2) minutes.
Extended self-test routine
recommended polling time: 	 (1093) minutes.
SCT capabilities: 	       (0x003d)	SCT Status supported.
					SCT Error Recovery Control supported.
					SCT Feature Control supported.
					SCT Data Table supported.

SMART Attributes Data Structure revision number: 16
Vendor Specific SMART Attributes with Thresholds:
ID# ATTRIBUTE_NAME          FLAGS    VALUE WORST THRESH FAIL RAW_VALUE
  1 Raw_Read_Error_Rate     PO-R--   100   100   016    -    0
  2 Throughput_Performance  --S---   100   100   054    -    0
  3 Spin_Up_Time            POS---   100   100   024    -    0
  4 Start_Stop_Count        -O--C-   100   100   000    -    7
  5 Reallocated_Sector_Ct   PO--CK   100   100   005    -    0
  7 Seek_Error_Rate         -O-R--   100   100   067    -    0
  8 Seek_Time_Performance   --S---   100   100   020    -    0
  9 Power_On_Hours          -O--C-   100   100   000    -    1
 10 Spin_Retry_Count        -O--C-   100   100   060    -    0
 12 Power_Cycle_Count       -O--CK   100   100   000    -    7
192 Power-Off_Retract_Count -O--CK   100   100   000    -    7
193 Load_Cycle_Count        -O--C-   100   100   000    -    7
194 Temperature_Celsius     -O----   209   209   000    -    31 (Min/Max 20/51)
196 Reallocated_Event_Count -O--CK   100   100   000    -    0
197 Current_Pending_Sector  -O---K   100   100   000    -    0
198 Offline_Uncorrectable   ---R--   100   100   000    -    0
199 UDMA_CRC_Error_Count    -O-R--   200   200   000    -    0
                            ||||||_ K auto-keep
                            |||||__ C event count
                            ||||___ R error rate
                            |||____ S speed/performance
                            ||_____ O updated online
                            |______ P prefailure warning

General Purpose Log Directory Version 1
SMART           Log Directory Version 1 [multi-sector log support]
Address    Access  R/W   Size  Description
0x00       GPL,SL  R/O      1  Log Directory
0x01           SL  R/O      1  Summary SMART error log
0x02           SL  R/O      1  Comprehensive SMART error log
0x03       GPL     R/O      1  Ext. Comprehensive SMART error log
0x04       GPL     R/O    256  Device Statistics log
0x04       SL      R/O    255  Device Statistics log
0x06           SL  R/O      1  SMART self-test log
0x07       GPL     R/O      1  Extended self-test log
0x08       GPL     R/O      2  Power Conditions log
0x09           SL  R/W      1  Selective self-test log
0x0c       GPL     R/O   5501  Pending Defects log
0x10       GPL     R/O      1  NCQ Command Error log
0x11       GPL     R/O      1  SATA Phy Event Counters log
0x12       GPL     R/O      1  SATA NCQ Non-Data log
0x13       GPL     R/O      1  SATA NCQ Send and Receive log
0x15       GPL     R/W      1  Rebuild Assist log
0x21       GPL     R/O      1  Write stream error log
0x22       GPL     R/O      1  Read stream error log
0x24       GPL     R/O    256  Current Device Internal Status Data log
0x25       GPL     R/O    256  Saved Device Internal Status Data log
0x2f       GPL     -        1  Set Sector Configuration
0x30       GPL,SL  R/O      9  IDENTIFY DEVICE data log
0x80-0x9f  GPL,SL  R/W     16  Host vendor specific log
0xe0       GPL,SL  R/W      1  SCT Command/Status
0xe1       GPL,SL  R/W      1  SCT Data Transfer

SMART Extended Comprehensive Error Log Version: 1 (1 sectors)
No Errors Logged

SMART Extended Self-test Log Version: 1 (1 sectors)
Num  Test_Description    Status                  Remaining  LifeTime(hours)  LBA_of_first_error
# 1  Short offline       Completed without error       00%         0         -

SMART Selective self-test log data structure revision number 1
 SPAN  MIN_LBA  MAX_LBA  CURRENT_TEST_STATUS
    1        0        0  Not_testing
    2        0        0  Not_testing
    3        0        0  Not_testing
    4        0        0  Not_testing
    5        0        0  Not_testing
Selective self-test flags (0x0):
  After scanning selected spans, do NOT read-scan remainder of disk.
If Selective self-test is pending on power-up, resume after 0 minute delay.

SCT Status Version:                  3
SCT Version (vendor specific):       256 (0x0100)
Device State:                        Active (0)
Current Temperature:                    31 Celsius
Power Cycle Min/Max Temperature:     24/31 Celsius
Lifetime    Min/Max Temperature:     20/51 Celsius
Under/Over Temperature Limit Count:   0/0

SCT Temperature History Version:     2
Temperature Sampling Period:         1 minute
Temperature Logging Interval:        1 minute
Min/Max recommended Temperature:      0/65 Celsius
Min/Max Temperature Limit:           -40/70 Celsius
Temperature History Size (Index):    128 (95)

Index    Estimated Time   Temperature Celsius
  96    2021-03-18 14:26     0  -
 ...    ..( 30 skipped).    ..  -
 127    2021-03-18 14:57     0  -
   0    2021-03-18 14:58    27  ********
   1    2021-03-18 14:59    27  ********
   2    2021-03-18 15:00    20  *
   3    2021-03-18 15:01    21  **
   4    2021-03-18 15:02    22  ***
   5    2021-03-18 15:03    23  ****
   6    2021-03-18 15:04    24  *****
   7    2021-03-18 15:05    25  ******
   8    2021-03-18 15:06    25  ******
   9    2021-03-18 15:07    26  *******
  10    2021-03-18 15:08    27  ********
  11    2021-03-18 15:09    28  *********
  12    2021-03-18 15:10    28  *********
  13    2021-03-18 15:11    29  **********
  14    2021-03-18 15:12    30  ***********
  15    2021-03-18 15:13    30  ***********
  16    2021-03-18 15:14    31  ************
  17    2021-03-18 15:15    32  *************
  18    2021-03-18 15:16    32  *************
  19    2021-03-18 15:17    33  **************
  20    2021-03-18 15:18    33  **************
  21    2021-03-18 15:19    34  ***************
  22    2021-03-18 15:20    34  ***************
  23    2021-03-18 15:21    35  ****************
  24    2021-03-18 15:22    35  ****************
  25    2021-03-18 15:23    36  *****************
  26    2021-03-18 15:24    36  *****************
  27    2021-03-18 15:25    37  ******************
  28    2021-03-18 15:26    37  ******************
  29    2021-03-18 15:27    38  *******************
  30    2021-03-18 15:28    38  *******************
  31    2021-03-18 15:29    39  ********************
  32    2021-03-18 15:30    39  ********************
  33    2021-03-18 15:31    39  ********************
  34    2021-03-18 15:32    40  *********************
  35    2021-03-18 15:33    40  *********************
  36    2021-03-18 15:34    41  **********************
  37    2021-03-18 15:35    41  **********************
  38    2021-03-18 15:36    41  **********************
  39    2021-03-18 15:37    42  ***********************
  40    2021-03-18 15:38    42  ***********************
  41    2021-03-18 15:39    42  ***********************
  42    2021-03-18 15:40    43  ************************
 ...    ..(  2 skipped).    ..  ************************
  45    2021-03-18 15:43    43  ************************
  46    2021-03-18 15:44    44  *************************
  47    2021-03-18 15:45    44  *************************
  48    2021-03-18 15:46    44  *************************
  49    2021-03-18 15:47    45  **************************
 ...    ..(  2 skipped).    ..  **************************
  52    2021-03-18 15:50    45  **************************
  53    2021-03-18 15:51    46  ***************************
 ...    ..(  2 skipped).    ..  ***************************
  56    2021-03-18 15:54    46  ***************************
  57    2021-03-18 15:55    47  ****************************
 ...    ..(  4 skipped).    ..  ****************************
  62    2021-03-18 16:00    47  ****************************
  63    2021-03-18 16:01    48  *****************************
 ...    ..(  3 skipped).    ..  *****************************
  67    2021-03-18 16:05    48  *****************************
  68    2021-03-18 16:06    49  ******************************
 ...    ..(  5 skipped).    ..  ******************************
  74    2021-03-18 16:12    49  ******************************
  75    2021-03-18 16:13    50  *******************************
 ...    ..(  6 skipped).    ..  *******************************
  82    2021-03-18 16:20    50  *******************************
  83    2021-03-18 16:21    51  ********************************
  84    2021-03-18 16:22    24  *****
  85    2021-03-18 16:23    24  *****
  86    2021-03-18 16:24    24  *****
  87    2021-03-18 16:25    25  ******
  88    2021-03-18 16:26    26  *******
  89    2021-03-18 16:27    27  ********
  90    2021-03-18 16:28    28  *********
  91    2021-03-18 16:29    28  *********
  92    2021-03-18 16:30    29  **********
  93    2021-03-18 16:31    30  ***********
  94    2021-03-18 16:32    31  ************
  95    2021-03-18 16:33     0  -

SCT Error Recovery Control:
           Read:     70 (7.0 seconds)
          Write:     70 (7.0 seconds)

Device Statistics (GP Log 0x04)
Page  Offset Size        Value Flags Description
0x01  =====  =               =  ===  == General Statistics (rev 1) ==
0x01  0x008  4               7  ---  Lifetime Power-On Resets
0x01  0x010  4               1  ---  Power-on Hours
0x01  0x018  6          773365  ---  Logical Sectors Written
0x01  0x020  6            6309  ---  Number of Write Commands
0x01  0x028  6         1937363  ---  Logical Sectors Read
0x01  0x030  6           13504  ---  Number of Read Commands
0x01  0x038  6         5731400  ---  Date and Time TimeStamp
0x03  =====  =               =  ===  == Rotating Media Statistics (rev 1) ==
0x03  0x008  4               1  ---  Spindle Motor Power-on Hours
0x03  0x010  4               1  ---  Head Flying Hours
0x03  0x018  4               7  ---  Head Load Events
0x03  0x020  4               0  ---  Number of Reallocated Logical Sectors
0x03  0x028  4               0  ---  Read Recovery Attempts
0x03  0x030  4               0  ---  Number of Mechanical Start Failures
0x04  =====  =               =  ===  == General Errors Statistics (rev 1) ==
0x04  0x008  4               0  ---  Number of Reported Uncorrectable Errors
0x04  0x010  4               0  ---  Resets Between Cmd Acceptance and Completion
0x05  =====  =               =  ===  == Temperature Statistics (rev 1) ==
0x05  0x008  1              31  ---  Current Temperature
0x05  0x010  1               -  N--  Average Short Term Temperature
0x05  0x018  1               -  N--  Average Long Term Temperature
0x05  0x020  1              51  ---  Highest Temperature
0x05  0x028  1              20  ---  Lowest Temperature
0x05  0x030  1               -  N--  Highest Average Short Term Temperature
0x05  0x038  1               -  N--  Lowest Average Short Term Temperature
0x05  0x040  1               -  N--  Highest Average Long Term Temperature
0x05  0x048  1               -  N--  Lowest Average Long Term Temperature
0x05  0x050  4               0  ---  Time in Over-Temperature
0x05  0x058  1              65  ---  Specified Maximum Operating Temperature
0x05  0x060  4               0  ---  Time in Under-Temperature
0x05  0x068  1               0  ---  Specified Minimum Operating Temperature
0x06  =====  =               =  ===  == Transport Statistics (rev 1) ==
0x06  0x008  4               1  ---  Number of Hardware Resets
0x06  0x010  4               0  ---  Number of ASR Events
0x06  0x018  4               0  ---  Number of Interface CRC Errors
0xff  =====  =               =  ===  == Vendor Specific Statistics (rev 1) ==
                                |||_ C monitored condition met
                                ||__ D supports DSN
                                |___ N normalized value

Pending Defects log (GP Log 0x0c)
No Defects Logged

SATA Phy Event Counters (GP Log 0x11)
ID      Size     Value  Description
0x0001  2            0  Command failed due to ICRC error
0x0002  2            0  R_ERR response for data FIS
0x0003  2            0  R_ERR response for device-to-host data FIS
0x0004  2            0  R_ERR response for host-to-device data FIS
0x0005  2            0  R_ERR response for non-data FIS
0x0006  2            0  R_ERR response for device-to-host non-data FIS
0x0007  2            0  R_ERR response for host-to-device non-data FIS
0x0008  2            0  Device-to-host non-data FIS retries
0x0009  2            0  Transition from drive PhyRdy to drive PhyNRdy
0x000a  2            1  Device-to-host register FISes sent due to a COMRESET
0x000b  2            0  CRC errors within host-to-device FIS
0x000d  2            0  Non-CRC errors within host-to-device FIS

