smartctl 6.6 2017-09-20 r4440 [x86_64-linux-4.9.0-0.bpo.3-amd64] (daily-20170920)
Copyright (C) 2002-17, Bruce Allen, Christian Franke, www.smartmontools.org

=== START OF INFORMATION SECTION ===
Device Model:     ST2000LM015-2E8174
Firmware Version: SDM1
User Capacity:    2,000,398,934,016 bytes [2.00 TB]
Sector Sizes:     512 bytes logical, 4096 bytes physical
Rotation Rate:    5400 rpm
Form Factor:      2.5 inches
Device is:        Not in smartctl database [for details use: -P showall]
ATA Version is:   ACS-3 T13/2161-D revision 3b
SATA Version is:  SATA 3.1, 6.0 Gb/s (current: 3.0 Gb/s)
Local Time is:    Sat Sep 23 00:22:54 2017 CEST
SMART support is: Available - device has SMART capability.
SMART support is: Enabled
AAM feature is:   Unavailable
APM level is:     254 (maximum performance)
Rd look-ahead is: Enabled
Write cache is:   Enabled
DSN feature is:   Unavailable
ATA Security is:  Disabled, NOT FROZEN [SEC1]
Wt Cache Reorder: Enabled

=== START OF READ SMART DATA SECTION ===
SMART overall-health self-assessment test result: PASSED

General SMART Values:
Offline data collection status:  (0x82)	Offline data collection activity
					was completed without error.
					Auto Offline Data Collection: Enabled.
Self-test execution status:      (   0)	The previous self-test routine completed
					without error or no self-test has ever 
					been run.
Total time to complete Offline 
data collection: 		(    0) seconds.
Offline data collection
capabilities: 			 (0x79) SMART execute Offline immediate.
					No Auto Offline data collection support.
					Suspend Offline collection upon new
					command.
					Offline surface scan supported.
					Self-test supported.
					Conveyance Self-test supported.
					Selective Self-test supported.
SMART capabilities:            (0x0003)	Saves SMART data before entering
					power-saving mode.
					Supports SMART auto save timer.
Error logging capability:        (0x01)	Error logging supported.
					General Purpose Logging supported.
Short self-test routine 
recommended polling time: 	 (   1) minutes.
Extended self-test routine
recommended polling time: 	 ( 329) minutes.
Conveyance self-test routine
recommended polling time: 	 (   2) minutes.
SCT capabilities: 	       (0x3035)	SCT Status supported.
					SCT Feature Control supported.
					SCT Data Table supported.

SMART Attributes Data Structure revision number: 10
Vendor Specific SMART Attributes with Thresholds:
ID# ATTRIBUTE_NAME          FLAGS    VALUE WORST THRESH FAIL RAW_VALUE
  1 Raw_Read_Error_Rate     POSR--   084   064   006    -    225867056
  3 Spin_Up_Time            PO----   098   098   000    -    0
  4 Start_Stop_Count        -O--CK   100   100   020    -    294
  5 Reallocated_Sector_Ct   PO--CK   100   100   036    -    0
  7 Seek_Error_Rate         POSR--   072   060   045    -    16982676
  9 Power_On_Hours          -O--CK   097   097   000    -    2807 (177 24 0)
 10 Spin_Retry_Count        PO--C-   100   100   097    -    0
 12 Power_Cycle_Count       -O--CK   100   100   020    -    291
184 End-to-End_Error        -O--CK   100   100   099    -    0
187 Reported_Uncorrect      -O--CK   100   100   000    -    0
188 Command_Timeout         -O--CK   100   100   000    -    0
189 High_Fly_Writes         -O-RCK   100   100   000    -    0
190 Airflow_Temperature_Cel -O---K   065   051   040    -    35 (Min/Max 22/36)
191 G-Sense_Error_Rate      -O--CK   100   100   000    -    0
192 Power-Off_Retract_Count -O--CK   100   100   000    -    46
193 Load_Cycle_Count        -O--CK   100   100   000    -    313
194 Temperature_Celsius     -O---K   035   049   000    -    35 (0 20 0 0 0)
197 Current_Pending_Sector  -O--C-   100   100   000    -    0
198 Offline_Uncorrectable   ----C-   100   100   000    -    0
199 UDMA_CRC_Error_Count    -OSRCK   200   200   000    -    0
240 Head_Flying_Hours       ------   100   253   000    -    2779 (240 153 0)
241 Total_LBAs_Written      ------   100   253   000    -    12537869208
242 Total_LBAs_Read         ------   100   253   000    -    3830687177
254 Free_Fall_Sensor        -O--CK   100   100   000    -    0
                            ||||||_ K auto-keep
                            |||||__ C event count
                            ||||___ R error rate
                            |||____ S speed/performance
                            ||_____ O updated online
                            |______ P prefailure warning

General Purpose Log Directory Version 1
SMART           Log Directory Version 1 [multi-sector log support]
Address    Access  R/W   Size  Description
0x00       GPL,SL  R/O      1  Log Directory
0x01           SL  R/O      1  Summary SMART error log
0x02           SL  R/O      5  Comprehensive SMART error log
0x03       GPL     R/O      5  Ext. Comprehensive SMART error log
0x04       GPL,SL  R/O      8  Device Statistics log
0x06           SL  R/O      1  SMART self-test log
0x07       GPL     R/O      1  Extended self-test log
0x09           SL  R/W      1  Selective self-test log
0x10       GPL     R/O      1  NCQ Command Error log
0x11       GPL     R/O      1  SATA Phy Event Counters log
0x21       GPL     R/O      1  Write stream error log
0x22       GPL     R/O      1  Read stream error log
0x24       GPL     R/O    512  Current Device Internal Status Data log
0x30       GPL,SL  R/O      9  IDENTIFY DEVICE data log
0x80-0x9f  GPL,SL  R/W     16  Host vendor specific log
0xa1       GPL,SL  VS      24  Device vendor specific log
0xa2       GPL     VS    8160  Device vendor specific log
0xa8       GPL,SL  VS     136  Device vendor specific log
0xa9       GPL,SL  VS       1  Device vendor specific log
0xab       GPL     VS       1  Device vendor specific log
0xb0       GPL     VS    8920  Device vendor specific log
0xbe-0xbf  GPL     VS   65535  Device vendor specific log
0xc0       GPL,SL  VS       1  Device vendor specific log
0xc1       GPL,SL  VS      16  Device vendor specific log
0xc2       GPL,SL  VS     240  Device vendor specific log
0xc3       GPL,SL  VS       8  Device vendor specific log
0xc4       GPL,SL  VS      24  Device vendor specific log
0xc9       GPL,SL  VS       1  Device vendor specific log
0xca       GPL,SL  VS      16  Device vendor specific log
0xd3       GPL     VS    1920  Device vendor specific log
0xe0       GPL,SL  R/W      1  SCT Command/Status
0xe1       GPL,SL  R/W      1  SCT Data Transfer

SMART Extended Comprehensive Error Log Version: 1 (5 sectors)
No Errors Logged

SMART Extended Self-test Log Version: 1 (1 sectors)
Num  Test_Description    Status                  Remaining  LifeTime(hours)  LBA_of_first_error
# 1  Short offline       Completed without error       00%      2807         -
# 2  Extended offline    Completed without error       00%      1886         -
# 3  Extended offline    Completed without error       00%        80         -

SMART Selective self-test log data structure revision number 1
 SPAN  MIN_LBA  MAX_LBA  CURRENT_TEST_STATUS
    1        0        0  Not_testing
    2        0        0  Not_testing
    3        0        0  Not_testing
    4        0        0  Not_testing
    5        0        0  Not_testing
Selective self-test flags (0x0):
  After scanning selected spans, do NOT read-scan remainder of disk.
If Selective self-test is pending on power-up, resume after 0 minute delay.

SCT Status Version:                  3
SCT Version (vendor specific):       522 (0x020a)
SCT Support Level:                   1
Device State:                        Active (0)
Current Temperature:                    35 Celsius
Power Cycle Min/Max Temperature:     22/37 Celsius
Lifetime    Min/Max Temperature:     19/49 Celsius
Lifetime    Average Temperature:        34 Celsius
Under/Over Temperature Limit Count:   0/0

SCT Temperature History Version:     2
Temperature Sampling Period:         1 minute
Temperature Logging Interval:        30 minutes
Min/Max recommended Temperature:     14/55 Celsius
Min/Max Temperature Limit:           10/60 Celsius
Temperature History Size (Index):    128 (113)

Index    Estimated Time   Temperature Celsius
 114    2017-09-20 08:30    33  **************
 ...    ..(  5 skipped).    ..  **************
 120    2017-09-20 11:30    33  **************
 121    2017-09-20 12:00    32  *************
 122    2017-09-20 12:30    32  *************
 123    2017-09-20 13:00    33  **************
 124    2017-09-20 13:30    33  **************
 125    2017-09-20 14:00    33  **************
 126    2017-09-20 14:30     ?  -
 127    2017-09-20 15:00    22  ***
   0    2017-09-20 15:30    31  ************
   1    2017-09-20 16:00    33  **************
 ...    ..(  4 skipped).    ..  **************
   6    2017-09-20 18:30    33  **************
   7    2017-09-20 19:00    32  *************
   8    2017-09-20 19:30    31  ************
   9    2017-09-20 20:00    31  ************
  10    2017-09-20 20:30    32  *************
  11    2017-09-20 21:00    33  **************
 ...    ..( 14 skipped).    ..  **************
  26    2017-09-21 04:30    33  **************
  27    2017-09-21 05:00    32  *************
  28    2017-09-21 05:30    33  **************
  29    2017-09-21 06:00    32  *************
 ...    ..(  3 skipped).    ..  *************
  33    2017-09-21 08:00    32  *************
  34    2017-09-21 08:30    33  **************
  35    2017-09-21 09:00    33  **************
  36    2017-09-21 09:30    33  **************
  37    2017-09-21 10:00    30  ***********
  38    2017-09-21 10:30    29  **********
  39    2017-09-21 11:00    31  ************
  40    2017-09-21 11:30    32  *************
  41    2017-09-21 12:00    32  *************
  42    2017-09-21 12:30    32  *************
  43    2017-09-21 13:00    33  **************
 ...    ..( 16 skipped).    ..  **************
  60    2017-09-21 21:30    33  **************
  61    2017-09-21 22:00    34  ***************
 ...    ..( 16 skipped).    ..  ***************
  78    2017-09-22 06:30    34  ***************
  79    2017-09-22 07:00    33  **************
  80    2017-09-22 07:30    32  *************
 ...    ..(  6 skipped).    ..  *************
  87    2017-09-22 11:00    32  *************
  88    2017-09-22 11:30    33  **************
 ...    ..( 10 skipped).    ..  **************
  99    2017-09-22 17:00    33  **************
 100    2017-09-22 17:30    34  ***************
 ...    ..( 12 skipped).    ..  ***************
 113    2017-09-23 00:00    34  ***************

SCT Error Recovery Control command not supported

Device Statistics (GP Log 0x04)
Page  Offset Size        Value Flags Description
0x01  =====  =               =  ===  == General Statistics (rev 1) ==
0x01  0x008  4             291  ---  Lifetime Power-On Resets
0x01  0x010  4            2807  ---  Power-on Hours
0x01  0x018  6     12537869208  ---  Logical Sectors Written
0x01  0x020  6         9634991  ---  Number of Write Commands
0x01  0x028  6      3830687177  ---  Logical Sectors Read
0x01  0x030  6         3219463  ---  Number of Read Commands
0x01  0x038  6               -  ---  Date and Time TimeStamp
0x03  =====  =               =  ===  == Rotating Media Statistics (rev 1) ==
0x03  0x008  4            2780  ---  Spindle Motor Power-on Hours
0x03  0x010  4            2774  ---  Head Flying Hours
0x03  0x018  4             313  ---  Head Load Events
0x03  0x020  4               0  ---  Number of Reallocated Logical Sectors
0x03  0x028  4               0  ---  Read Recovery Attempts
0x03  0x030  4               0  ---  Number of Mechanical Start Failures
0x03  0x038  4               0  ---  Number of Realloc. Candidate Logical Sectors
0x04  =====  =               =  ===  == General Errors Statistics (rev 1) ==
0x04  0x008  4               0  ---  Number of Reported Uncorrectable Errors
0x04  0x010  4               0  ---  Resets Between Cmd Acceptance and Completion
                                |||_ C monitored condition met
                                ||__ D supports DSN
                                |___ N normalized value

SATA Phy Event Counters (GP Log 0x11)
ID      Size     Value  Description
0x000a  2            2  Device-to-host register FISes sent due to a COMRESET
0x0001  2            0  Command failed due to ICRC error
0x0003  2            0  R_ERR response for device-to-host data FIS
0x0004  2            0  R_ERR response for host-to-device data FIS
0x0006  2            0  R_ERR response for device-to-host non-data FIS
0x0007  2            0  R_ERR response for host-to-device non-data FIS

