smartctl 6.6 2017-11-05 r4594 [x86_64-w64-mingw32-2016-1607] (sf-6.6-1)
Copyright (C) 2002-17, Bruce Allen, Christian Franke, www.smartmontools.org

=== START OF INFORMATION SECTION ===
Model Family:     Dell Certified Intel S3520 Series SSDs
Device Model:     SSDSC2BB120G7R
Serial Number:    PHDV715602G4150MGN
LU WWN Device Id: 5 5cd2e4 14d79c22b
Add. Product Id:  DELL(tm)
Firmware Version: N201DL42
User Capacity:    120,034,123,776 bytes [120 GB]
Sector Sizes:     512 bytes logical, 4096 bytes physical
Rotation Rate:    Solid State Device
Form Factor:      2.5 inches
Device is:        In smartctl database [for details use: -P show]
ATA Version is:   ACS-3 T13/2161-D revision 5
SATA Version is:  SATA 3.1, 6.0 Gb/s (current: 6.0 Gb/s)
Local Time is:    Tue Dec 18 11:18:35 2018 PST
SMART support is: Available - device has SMART capability.
SMART support is: Enabled
AAM feature is:   Unavailable
APM feature is:   Unavailable
Rd look-ahead is: Enabled
Write cache is:   Enabled
DSN feature is:   Unavailable
ATA Security is:  Unavailable
Wt Cache Reorder: Enabled

=== START OF READ SMART DATA SECTION ===
SMART overall-health self-assessment test result: PASSED

General SMART Values:
Offline data collection status:  (0x02)	Offline data collection activity
					was completed without error.
					Auto Offline Data Collection: Disabled.
Self-test execution status:      (   0)	The previous self-test routine completed
					without error or no self-test has ever 
					been run.
Total time to complete Offline 
data collection: 		(    2) seconds.
Offline data collection
capabilities: 			 (0x79) SMART execute Offline immediate.
					No Auto Offline data collection support.
					Suspend Offline collection upon new
					command.
					Offline surface scan supported.
					Self-test supported.
					Conveyance Self-test supported.
					Selective Self-test supported.
SMART capabilities:            (0x0003)	Saves SMART data before entering
					power-saving mode.
					Supports SMART auto save timer.
Error logging capability:        (0x01)	Error logging supported.
					General Purpose Logging supported.
Short self-test routine 
recommended polling time: 	 (   1) minutes.
Extended self-test routine
recommended polling time: 	 (  60) minutes.
Conveyance self-test routine
recommended polling time: 	 (  60) minutes.
SCT capabilities: 	       (0x003d)	SCT Status supported.
					SCT Error Recovery Control supported.
					SCT Feature Control supported.
					SCT Data Table supported.

SMART Attributes Data Structure revision number: 1
Vendor Specific SMART Attributes with Thresholds:
ID# ATTRIBUTE_NAME          FLAGS    VALUE WORST THRESH FAIL RAW_VALUE
  1 Raw_Read_Error_Rate     -OSR--   130   130   039    -    11727480
  5 Reallocated_Sector_Ct   PO--CK   100   100   001    -    0
  9 Power_On_Hours          -O--CK   100   100   000    -    1005
 12 Power_Cycle_Count       -O--CK   100   100   000    -    50
 13 Read_Soft_Error_Rate    -OSRC-   130   130   000    -    11727480
170 Available_Reserved_SpacePO--CK   100   100   010    -    0
174 Unsafe_Shutdown_Count   -O--CK   100   100   000    -    49
179 Used_Rsvd_Blk_Cnt_Tot   PO--CK   100   100   010    -    0
180 Unused_Rsvd_Blk_Cnt_Tot -O--CK   100   100   000    -    5794
181 Program_Fail_Cnt_Total  -O-RCK   100   100   000    -    0
182 Erase_Fail_Count_Total  -O-RCK   100   100   000    -    0
184 End-to-End_Error        -O--CK   100   100   000    -    0
194 Temperature_Celsius     -O---K   100   100   000    -    27
195 Uncorrectable_Error_Cnt -O--CK   100   100   000    -    0
197 Current_Pending_Sector  -O--C-   100   100   000    -    0
198 Offline_Uncorrectable   ----C-   100   100   000    -    0
199 CRC_Error_Count         -OSRCK   100   100   000    -    0
201 Power_Loss_Cap_Test     PO--CK   100   100   010    -    15030 (62 5)
202 End_of_Life             POS--K   100   100   000    -    0
225 Host_Writes_32MiB       -O--CK   100   100   000    -    2
226 Workld_Media_Wear_Indic -O--CK   100   100   000    -    102400
227 Workld_Host_Reads_Perc  -O--CK   100   100   000    -    0
228 Workload_Minutes        -O--CK   100   100   000    -    4169854476
232 Available_Reservd_Space PO--CK   100   100   010    -    0
233 Total_LBAs_Written      -O--CK   100   100   000    -    2
234 Thermal_Throttle_Status -O--CK   100   100   000    -    0/0
241 Total_LBAs_Written      -O--CK   100   100   000    -    2
242 Total_LBAs_Read         -O--CK   100   100   000    -    6122
245 Percent_Life_Remaining  -O--CK   100   100   000    -    100
                            ||||||_ K auto-keep
                            |||||__ C event count
                            ||||___ R error rate
                            |||____ S speed/performance
                            ||_____ O updated online
                            |______ P prefailure warning

General Purpose Log Directory Version 1
SMART           Log Directory Version 1 [multi-sector log support]
Address    Access  R/W   Size  Description
0x00       GPL,SL  R/O      1  Log Directory
0x02           SL  R/O      8  Comprehensive SMART error log
0x03       GPL     R/O     20  Ext. Comprehensive SMART error log
0x06           SL  R/O      1  SMART self-test log
0x07       GPL     R/O      2  Extended self-test log
0x08       GPL     R/O      2  Power Conditions log
0x10       GPL     R/O      1  NCQ Command Error log
0x11       GPL     R/O      1  SATA Phy Event Counters log
0x30       GPL,SL  R/O      9  IDENTIFY DEVICE data log
0x99-0x9a  GPL,SL  R/W      1  Host vendor specific log
0xb8           SL  VS       1  Device vendor specific log
0xb9           SL  VS     168  Device vendor specific log
0xba       GPL     VS    1280  Device vendor specific log
0xe0       GPL,SL  R/W      1  SCT Command/Status
0xe1       GPL,SL  R/W      8  SCT Data Transfer

SMART Extended Comprehensive Error Log Version: 1 (20 sectors)
No Errors Logged

SMART Extended Self-test Log Version: 1 (2 sectors)
Num  Test_Description    Status                  Remaining  LifeTime(hours)  LBA_of_first_error
# 1  Short offline       Completed without error       00%      1005         -
# 2  Short offline       Completed without error       00%      1005         -
# 3  Short offline       Completed without error       00%        50         -
# 4  Abort offline test  Aborted by host               00%        50         -
# 5  Extended offline    Completed without error       00%        50         -
# 6  Abort offline test  Aborted by host               00%        50         -

SMART Selective self-test log data structure revision number 1
 SPAN  MIN_LBA  MAX_LBA  CURRENT_TEST_STATUS
    1        0        0  Not_testing
    2        0        0  Not_testing
    3        0        0  Not_testing
    4        0        0  Not_testing
    5        0        0  Not_testing
Selective self-test flags (0x0):
  After scanning selected spans, do NOT read-scan remainder of disk.
If Selective self-test is pending on power-up, resume after 0 minute delay.

SCT Status Version:                  3
SCT Version (vendor specific):       1 (0x0001)
SCT Support Level:                   0
Device State:                        Active (0)
Current Temperature:                    27 Celsius
Power Cycle Min/Max Temperature:     22/27 Celsius
Lifetime    Min/Max Temperature:     15/28 Celsius
Under/Over Temperature Limit Count:   0/0
Vendor specific:
00 00 64 00 00 00 00 00 00 00 00 00 00 00 00 00
00 00 00 00 00 00 00 00 00 00 00 00 00 00 00 00

SCT Temperature History Version:     2
Temperature Sampling Period:         1 minute
Temperature Logging Interval:        1 minute
Min/Max recommended Temperature:      0/70 Celsius
Min/Max Temperature Limit:            0/70 Celsius
Temperature History Size (Index):    478 (139)

Index    Estimated Time   Temperature Celsius
 140    2018-12-18 03:21    25  ******
 ...    ..( 27 skipped).    ..  ******
 168    2018-12-18 03:49    25  ******
 169    2018-12-18 03:50    26  *******
 170    2018-12-18 03:51    26  *******
 171    2018-12-18 03:52    25  ******
 ...    ..(261 skipped).    ..  ******
 433    2018-12-18 08:14    25  ******
 434    2018-12-18 08:15    26  *******
 435    2018-12-18 08:16    26  *******
 436    2018-12-18 08:17    25  ******
 437    2018-12-18 08:18    25  ******
 438    2018-12-18 08:19    26  *******
 439    2018-12-18 08:20    25  ******
 ...    ..( 18 skipped).    ..  ******
 458    2018-12-18 08:39    25  ******
 459    2018-12-18 08:40    26  *******
 460    2018-12-18 08:41    25  ******
 461    2018-12-18 08:42    26  *******
 ...    ..(  2 skipped).    ..  *******
 464    2018-12-18 08:45    26  *******
 465    2018-12-18 08:46    25  ******
 ...    ..(  7 skipped).    ..  ******
 473    2018-12-18 08:54    25  ******
 474    2018-12-18 08:55    26  *******
 475    2018-12-18 08:56    26  *******
 476    2018-12-18 08:57    25  ******
 ...    ..( 88 skipped).    ..  ******
  87    2018-12-18 10:26    25  ******
  88    2018-12-18 10:27     ?  -
  89    2018-12-18 10:28    24  *****
  90    2018-12-18 10:29     ?  -
  91    2018-12-18 10:30    24  *****
  92    2018-12-18 10:31    25  ******
  93    2018-12-18 10:32    26  *******
 ...    ..(  2 skipped).    ..  *******
  96    2018-12-18 10:35    26  *******
  97    2018-12-18 10:36    27  ********
  98    2018-12-18 10:37     ?  -
  99    2018-12-18 10:38    25  ******
 100    2018-12-18 10:39    25  ******
 101    2018-12-18 10:40     ?  -
 102    2018-12-18 10:41    24  *****
 103    2018-12-18 10:42    24  *****
 104    2018-12-18 10:43    25  ******
 ...    ..(  2 skipped).    ..  ******
 107    2018-12-18 10:46    25  ******
 108    2018-12-18 10:47    26  *******
 ...    ..( 12 skipped).    ..  *******
 121    2018-12-18 11:00    26  *******
 122    2018-12-18 11:01    27  ********
 ...    ..( 10 skipped).    ..  ********
 133    2018-12-18 11:12    27  ********
 134    2018-12-18 11:13     ?  -
 135    2018-12-18 11:14    27  ********
 ...    ..(  3 skipped).    ..  ********
 139    2018-12-18 11:18    27  ********

SCT Error Recovery Control:
           Read:     80 (8.0 seconds)
          Write:     80 (8.0 seconds)

Device Statistics (GP/SMART Log 0x04) not supported

Pending Defects log (GP Log 0x0c) not supported

SATA Phy Event Counters (GP Log 0x11)
ID      Size     Value  Description
0x0001  4            0  Command failed due to ICRC error
0x0003  4            0  R_ERR response for device-to-host data FIS
0x0004  4            0  R_ERR response for host-to-device data FIS
0x0006  4            0  R_ERR response for device-to-host non-data FIS
0x000a  4            1  Device-to-host register FISes sent due to a COMRESET
0x000b  4            0  CRC errors within host-to-device FIS
0x000d  4            0  Non-CRC errors within host-to-device FIS

