smartctl 7.3 2022-02-28 r5338 [x86_64-linux-5.14.0-378.el9.x86_64] (local build)
Copyright (C) 2002-22, Bruce Allen, Christian Franke, www.smartmontools.org

=== START OF INFORMATION SECTION ===
Model Family:     Seagate Mobile HDD
Device Model:     ST2000LM007-1R8174
Firmware Version: EB01
User Capacity:    2,000,398,934,016 bytes [2.00 TB]
Sector Sizes:     512 bytes logical, 4096 bytes physical
Rotation Rate:    5400 rpm
Form Factor:      2.5 inches
TRIM Command:     Available
Device is:        In smartctl database 7.3/5533
ATA Version is:   ACS-3 T13/2161-D revision 3b
SATA Version is:  SATA 3.1, 6.0 Gb/s (current: 6.0 Gb/s)
Local Time is:    Wed Nov  1 09:36:13 2023 UTC
SMART support is: Available - device has SMART capability.
SMART support is: Enabled
AAM feature is:   Unavailable
APM level is:     128 (minimum power consumption without standby)
Rd look-ahead is: Enabled
Write cache is:   Enabled
DSN feature is:   Unavailable
ATA Security is:  Disabled, NOT FROZEN [SEC1]
Wt Cache Reorder: Enabled

=== START OF READ SMART DATA SECTION ===
SMART overall-health self-assessment test result: PASSED
See vendor-specific Attribute list for marginal Attributes.

General SMART Values:
Offline data collection status:  (0x00)	Offline data collection activity
					was never started.
					Auto Offline Data Collection: Disabled.
Self-test execution status:      (   0)	The previous self-test routine completed
					without error or no self-test has ever 
					been run.
Total time to complete Offline 
data collection: 		(    0) seconds.
Offline data collection
capabilities: 			 (0x71) SMART execute Offline immediate.
					No Auto Offline data collection support.
					Suspend Offline collection upon new
					command.
					No Offline surface scan supported.
					Self-test supported.
					Conveyance Self-test supported.
					Selective Self-test supported.
SMART capabilities:            (0x0003)	Saves SMART data before entering
					power-saving mode.
					Supports SMART auto save timer.
Error logging capability:        (0x01)	Error logging supported.
					General Purpose Logging supported.
Short self-test routine 
recommended polling time: 	 (   1) minutes.
Extended self-test routine
recommended polling time: 	 ( 326) minutes.
Conveyance self-test routine
recommended polling time: 	 (   2) minutes.
SCT capabilities: 	       (0x3035)	SCT Status supported.
					SCT Feature Control supported.
					SCT Data Table supported.

SMART Attributes Data Structure revision number: 10
Vendor Specific SMART Attributes with Thresholds:
ID# ATTRIBUTE_NAME          FLAGS    VALUE WORST THRESH FAIL RAW_VALUE
  1 Raw_Read_Error_Rate     POSR--   083   064   006    -    195811139
  3 Spin_Up_Time            PO----   098   098   000    -    0
  4 Start_Stop_Count        -O--CK   100   100   020    -    263
  5 Reallocated_Sector_Ct   PO--CK   100   100   036    -    0
  7 Seek_Error_Rate         POSR--   082   060   045    -    154907854
  9 Power_On_Hours          -O--CK   071   071   000    -    26151 (19 35 0)
 10 Spin_Retry_Count        PO--C-   100   100   097    -    0
 12 Power_Cycle_Count       -O--CK   100   100   020    -    237
184 End-to-End_Error        -O--CK   100   100   099    -    0
187 Reported_Uncorrect      -O--CK   100   100   000    -    0
188 Command_Timeout         -O--CK   100   100   000    -    1
189 High_Fly_Writes         -O-RCK   100   100   000    -    0
190 Airflow_Temperature_Cel -O---K   054   036   040    Past 46 (Min/Max 37/46 #4)
191 G-Sense_Error_Rate      -O--CK   100   100   000    -    0
192 Power-Off_Retract_Count -O--CK   100   100   000    -    58
193 Load_Cycle_Count        -O--CK   001   001   000    -    305321
194 Temperature_Celsius     -O---K   046   064   000    -    46 (0 13 0 0 0)
197 Current_Pending_Sector  -O--C-   100   100   000    -    0
198 Offline_Uncorrectable   ----C-   100   100   000    -    0
199 UDMA_CRC_Error_Count    -OSRCK   200   200   000    -    0
240 Head_Flying_Hours       ------   100   253   000    -    5728 (8 146 0)
241 Total_LBAs_Written      ------   100   253   000    -    27262431461
242 Total_LBAs_Read         ------   100   253   000    -    25433413072
254 Free_Fall_Sensor        -O--CK   100   100   000    -    0
                            ||||||_ K auto-keep
                            |||||__ C event count
                            ||||___ R error rate
                            |||____ S speed/performance
                            ||_____ O updated online
                            |______ P prefailure warning

General Purpose Log Directory Version 1
SMART           Log Directory Version 1 [multi-sector log support]
Address    Access  R/W   Size  Description
0x00       GPL,SL  R/O      1  Log Directory
0x01           SL  R/O      1  Summary SMART error log
0x02           SL  R/O      5  Comprehensive SMART error log
0x03       GPL     R/O      5  Ext. Comprehensive SMART error log
0x04       GPL,SL  R/O      8  Device Statistics log
0x06           SL  R/O      1  SMART self-test log
0x07       GPL     R/O      1  Extended self-test log
0x09           SL  R/W      1  Selective self-test log
0x10       GPL     R/O      1  NCQ Command Error log
0x11       GPL     R/O      1  SATA Phy Event Counters log
0x21       GPL     R/O      1  Write stream error log
0x22       GPL     R/O      1  Read stream error log
0x24       GPL     R/O    512  Current Device Internal Status Data log
0x30       GPL,SL  R/O      9  IDENTIFY DEVICE data log
0x80-0x9f  GPL,SL  R/W     16  Host vendor specific log
0xa1       GPL,SL  VS      24  Device vendor specific log
0xa2       GPL     VS    8160  Device vendor specific log
0xa8       GPL,SL  VS     136  Device vendor specific log
0xa9       GPL,SL  VS       1  Device vendor specific log
0xab       GPL     VS       1  Device vendor specific log
0xb0       GPL     VS    8920  Device vendor specific log
0xbe-0xbf  GPL     VS   65535  Device vendor specific log
0xc0       GPL,SL  VS       1  Device vendor specific log
0xc1       GPL,SL  VS      16  Device vendor specific log
0xc2       GPL,SL  VS     240  Device vendor specific log
0xc3       GPL,SL  VS       8  Device vendor specific log
0xc4       GPL,SL  VS      24  Device vendor specific log
0xd3       GPL     VS    1920  Device vendor specific log
0xe0       GPL,SL  R/W      1  SCT Command/Status
0xe1       GPL,SL  R/W      1  SCT Data Transfer

SMART Extended Comprehensive Error Log Version: 1 (5 sectors)
No Errors Logged

SMART Extended Self-test Log Version: 1 (1 sectors)
No self-tests have been logged.  [To run self-tests, use: smartctl -t]

SMART Selective self-test log data structure revision number 1
 SPAN  MIN_LBA  MAX_LBA  CURRENT_TEST_STATUS
    1        0        0  Not_testing
    2        0        0  Not_testing
    3        0        0  Not_testing
    4        0        0  Not_testing
    5        0        0  Not_testing
Selective self-test flags (0x0):
  After scanning selected spans, do NOT read-scan remainder of disk.
If Selective self-test is pending on power-up, resume after 0 minute delay.

SCT Status Version:                  3
SCT Version (vendor specific):       522 (0x020a)
Device State:                        Active (0)
Current Temperature:                    46 Celsius
Power Cycle Min/Max Temperature:     37/48 Celsius
Lifetime    Min/Max Temperature:     12/64 Celsius
Specified Max Operating Temperature:    39 Celsius
Under/Over Temperature Limit Count:   0/0

SCT Temperature History Version:     2
Temperature Sampling Period:         1 minute
Temperature Logging Interval:        30 minutes
Min/Max recommended Temperature:     14/55 Celsius
Min/Max Temperature Limit:           10/60 Celsius
Temperature History Size (Index):    128 (80)

Index    Estimated Time   Temperature Celsius
  81    2023-10-29 18:00    46  ***************************
  82    2023-10-29 18:30    45  **************************
  83    2023-10-29 19:00    45  **************************
  84    2023-10-29 19:30    47  ****************************
  85    2023-10-29 20:00    49  ******************************
  86    2023-10-29 20:30    45  **************************
  87    2023-10-29 21:00    45  **************************
  88    2023-10-29 21:30    44  *************************
  89    2023-10-29 22:00    45  **************************
  90    2023-10-29 22:30    42  ***********************
  91    2023-10-29 23:00    42  ***********************
  92    2023-10-29 23:30    42  ***********************
  93    2023-10-30 00:00    43  ************************
  94    2023-10-30 00:30    41  **********************
  95    2023-10-30 01:00    41  **********************
  96    2023-10-30 01:30    42  ***********************
  97    2023-10-30 02:00    40  *********************
  98    2023-10-30 02:30    39  ********************
 ...    ..(  2 skipped).    ..  ********************
 101    2023-10-30 04:00    39  ********************
 102    2023-10-30 04:30    38  *******************
 ...    ..(  4 skipped).    ..  *******************
 107    2023-10-30 07:00    38  *******************
 108    2023-10-30 07:30    39  ********************
 109    2023-10-30 08:00    40  *********************
 110    2023-10-30 08:30    41  **********************
 111    2023-10-30 09:00    42  ***********************
 112    2023-10-30 09:30    42  ***********************
 113    2023-10-30 10:00    43  ************************
 ...    ..(  2 skipped).    ..  ************************
 116    2023-10-30 11:30    43  ************************
 117    2023-10-30 12:00    45  **************************
 118    2023-10-30 12:30    45  **************************
 119    2023-10-30 13:00    46  ***************************
 120    2023-10-30 13:30    45  **************************
 121    2023-10-30 14:00    46  ***************************
 122    2023-10-30 14:30    47  ****************************
 123    2023-10-30 15:00    45  **************************
 124    2023-10-30 15:30    44  *************************
 125    2023-10-30 16:00    42  ***********************
 126    2023-10-30 16:30    43  ************************
 127    2023-10-30 17:00    41  **********************
   0    2023-10-30 17:30    40  *********************
   1    2023-10-30 18:00    43  ************************
   2    2023-10-30 18:30    43  ************************
   3    2023-10-30 19:00    42  ***********************
   4    2023-10-30 19:30    43  ************************
   5    2023-10-30 20:00    44  *************************
   6    2023-10-30 20:30    43  ************************
   7    2023-10-30 21:00    42  ***********************
   8    2023-10-30 21:30    42  ***********************
   9    2023-10-30 22:00    42  ***********************
  10    2023-10-30 22:30    41  **********************
 ...    ..(  2 skipped).    ..  **********************
  13    2023-10-31 00:00    41  **********************
  14    2023-10-31 00:30    40  *********************
  15    2023-10-31 01:00    40  *********************
  16    2023-10-31 01:30    39  ********************
  17    2023-10-31 02:00    40  *********************
  18    2023-10-31 02:30    39  ********************
  19    2023-10-31 03:00    38  *******************
  20    2023-10-31 03:30    39  ********************
  21    2023-10-31 04:00    40  *********************
  22    2023-10-31 04:30    39  ********************
  23    2023-10-31 05:00    40  *********************
  24    2023-10-31 05:30    42  ***********************
  25    2023-10-31 06:00    42  ***********************
  26    2023-10-31 06:30    43  ************************
 ...    ..(  3 skipped).    ..  ************************
  30    2023-10-31 08:30    43  ************************
  31    2023-10-31 09:00    45  **************************
  32    2023-10-31 09:30    46  ***************************
  33    2023-10-31 10:00    46  ***************************
  34    2023-10-31 10:30    45  **************************
  35    2023-10-31 11:00    46  ***************************
  36    2023-10-31 11:30    47  ****************************
  37    2023-10-31 12:00    46  ***************************
  38    2023-10-31 12:30    46  ***************************
  39    2023-10-31 13:00    47  ****************************
  40    2023-10-31 13:30    41  **********************
  41    2023-10-31 14:00    41  **********************
  42    2023-10-31 14:30    42  ***********************
  43    2023-10-31 15:00    43  ************************
  44    2023-10-31 15:30    43  ************************
  45    2023-10-31 16:00    43  ************************
  46    2023-10-31 16:30    42  ***********************
  47    2023-10-31 17:00    43  ************************
  48    2023-10-31 17:30    43  ************************
  49    2023-10-31 18:00    42  ***********************
  50    2023-10-31 18:30    42  ***********************
  51    2023-10-31 19:00     ?  -
  52    2023-10-31 19:30    39  ********************
  53    2023-10-31 20:00     ?  -
  54    2023-10-31 20:30    38  *******************
  55    2023-10-31 21:00    37  ******************
  56    2023-10-31 21:30    40  *********************
 ...    ..(  2 skipped).    ..  *********************
  59    2023-10-31 23:00    40  *********************
  60    2023-10-31 23:30    39  ********************
  61    2023-11-01 00:00    39  ********************
  62    2023-11-01 00:30    42  ***********************
  63    2023-11-01 01:00    40  *********************
  64    2023-11-01 01:30    41  **********************
  65    2023-11-01 02:00    39  ********************
  66    2023-11-01 02:30    39  ********************
  67    2023-11-01 03:00    42  ***********************
  68    2023-11-01 03:30    42  ***********************
  69    2023-11-01 04:00    42  ***********************
  70    2023-11-01 04:30    43  ************************
  71    2023-11-01 05:00    43  ************************
  72    2023-11-01 05:30    43  ************************
  73    2023-11-01 06:00    45  **************************
 ...    ..(  2 skipped).    ..  **************************
  76    2023-11-01 07:30    45  **************************
  77    2023-11-01 08:00    44  *************************
  78    2023-11-01 08:30    46  ***************************
  79    2023-11-01 09:00    46  ***************************
  80    2023-11-01 09:30    47  ****************************

SCT Error Recovery Control command not supported

Device Statistics (GP Log 0x04)
Page  Offset Size        Value Flags Description
0x01  =====  =               =  ===  == General Statistics (rev 1) ==
0x01  0x008  4             237  ---  Lifetime Power-On Resets
0x01  0x010  4           26151  ---  Power-on Hours
0x01  0x018  6     27275441557  ---  Logical Sectors Written
0x01  0x020  6        35966116  ---  Number of Write Commands
0x01  0x028  6     25437937208  ---  Logical Sectors Read
0x01  0x030  6       316106593  ---  Number of Read Commands
0x01  0x038  6               -  ---  Date and Time TimeStamp
0x03  =====  =               =  ===  == Rotating Media Statistics (rev 1) ==
0x03  0x008  4      2280597706  N--  Spindle Motor Power-on Hours
0x03  0x010  4      2280577294  N--  Head Flying Hours
0x03  0x018  4          305321  ---  Head Load Events
0x03  0x020  4               0  ---  Number of Reallocated Logical Sectors
0x03  0x028  4               0  ---  Read Recovery Attempts
0x03  0x030  4               0  ---  Number of Mechanical Start Failures
0x03  0x038  4               0  ---  Number of Realloc. Candidate Logical Sectors
0x04  =====  =               =  ===  == General Errors Statistics (rev 1) ==
0x04  0x008  4               0  ---  Number of Reported Uncorrectable Errors
0x04  0x010  4               1  ---  Resets Between Cmd Acceptance and Completion
                                |||_ C monitored condition met
                                ||__ D supports DSN
                                |___ N normalized value

Pending Defects log (GP Log 0x0c) not supported

SATA Phy Event Counters (GP Log 0x11)
ID      Size     Value  Description
0x000a  2            2  Device-to-host register FISes sent due to a COMRESET
0x0001  2            0  Command failed due to ICRC error
0x0003  2            0  R_ERR response for device-to-host data FIS
0x0004  2            0  R_ERR response for host-to-device data FIS
0x0006  2            0  R_ERR response for device-to-host non-data FIS
0x0007  2            0  R_ERR response for host-to-device non-data FIS

