smartctl 7.1 2019-12-30 r5022 [x86_64-linux-5.15.0-125-generic] (local build)
Copyright (C) 2002-19, Bruce Allen, Christian Franke, www.smartmontools.org

=== START OF INFORMATION SECTION ===
Device Model:     BIWIN CSE25Y51Q10-960G
Serial Number:    2340017001000
LU WWN Device Id: 5 50c68e 000100000
Firmware Version: 5.2.8.05
User Capacity:    960,197,124,096 bytes [960 GB]
Sector Sizes:     512 bytes logical, 4096 bytes physical
Rotation Rate:    Solid State Device
Form Factor:      2.5 inches
Device is:        Not in smartctl database [for details use: -P showall]
ATA Version is:   ACS-3 T13/2161-D revision 5
SATA Version is:  SATA 3.2, 6.0 Gb/s (current: 6.0 Gb/s)
Local Time is:    Wed Jan 22 11:09:55 2025 CST
SMART support is: Available - device has SMART capability.
SMART support is: Enabled
AAM feature is:   Unavailable
APM feature is:   Unavailable
Rd look-ahead is: Enabled
Write cache is:   Enabled
DSN feature is:   Unavailable
ATA Security is:  Disabled, NOT FROZEN [SEC1]
Wt Cache Reorder: Unavailable

=== START OF READ SMART DATA SECTION ===
SMART Status command failed: scsi error aborted command
SMART overall-health self-assessment test result: PASSED
Warning: This result is based on an Attribute check.

General SMART Values:
Offline data collection status:  (0x02)	Offline data collection activity
					was completed without error.
					Auto Offline Data Collection: Disabled.
Self-test execution status:      (   0)	The previous self-test routine completed
					without error or no self-test has ever 
					been run.
Total time to complete Offline 
data collection: 		(    0) seconds.
Offline data collection
capabilities: 			 (0x31) SMART execute Offline immediate.
					No Auto Offline data collection support.
					Suspend Offline collection upon new
					command.
					No Offline surface scan supported.
					Self-test supported.
					Conveyance Self-test supported.
					No Selective Self-test supported.
SMART capabilities:            (0x0002)	Does not save SMART data before
					entering power-saving mode.
					Supports SMART auto save timer.
Error logging capability:        (0x00)	Error logging NOT supported.
					General Purpose Logging supported.
Short self-test routine 
recommended polling time: 	 (   1) minutes.
Extended self-test routine
recommended polling time: 	 (   1) minutes.
Conveyance self-test routine
recommended polling time: 	 (   1) minutes.
SCT capabilities: 	       (0x0001)	SCT Status supported.

SMART Attributes Data Structure revision number: 1
Vendor Specific SMART Attributes with Thresholds:
ID# ATTRIBUTE_NAME          FLAGS    VALUE WORST THRESH FAIL RAW_VALUE
  1 Raw_Read_Error_Rate     -O----   100   100   000    -    51539607698
  5 Reallocated_Sector_Ct   -O----   100   100   000    -    0
  9 Power_On_Hours          -O----   100   100   000    -    2613
 12 Power_Cycle_Count       -O----   100   100   000    -    45
160 Unknown_Attribute       -O----   100   100   000    -    0
161 Unknown_Attribute       -O----   100   100   000    -    92
163 Unknown_Attribute       ------   100   100   000    -    8
164 Unknown_Attribute       -O----   100   100   000    -    433897
165 Unknown_Attribute       -O----   100   100   000    -    959
166 Unknown_Attribute       -O----   100   100   000    -    908
167 Unknown_Attribute       -O----   100   100   000    -    927
168 Unknown_Attribute       PO----   100   100   060    -    0
170 Unknown_Attribute       -O----   100   100   000    -    1
177 Wear_Leveling_Count     -O----   100   100   000    -    105
181 Program_Fail_Cnt_Total  -O----   100   100   000    -    0
182 Erase_Fail_Count_Total  -O----   100   100   000    -    0
192 Power-Off_Retract_Count -O----   100   100   000    -    37
194 Temperature_Celsius     -O----   100   100   060    -    30 (Min/Max 17/37)
195 Hardware_ECC_Recovered  -O----   100   100   000    -    1484
197 Current_Pending_Sector  -O----   100   100   000    -    0
198 Offline_Uncorrectable   -O----   100   100   000    -    0
199 UDMA_CRC_Error_Count    -O----   100   100   000    -    1
231 Temperature_Celsius     PO----   087   100   001    -    87
232 Available_Reservd_Space PO----   100   100   060    -    100
241 Total_LBAs_Written      -O----   100   100   000    -    12328483
242 Total_LBAs_Read         -O----   100   100   000    -    23520990
245 Unknown_Attribute       -O----   100   100   000    -    34692306
250 Read_Error_Retry_Rate   -O----   100   100   000    -    4295032932
252 Unknown_Attribute       -O----   100   100   000    -    0
200 Unknown_SSD_Attribute   PO----   100   100   060    -    2095944499215
                            ||||||_ K auto-keep
                            |||||__ C event count
                            ||||___ R error rate
                            |||____ S speed/performance
                            ||_____ O updated online
                            |______ P prefailure warning

General Purpose Log Directory Version 1
SMART           Log Directory Version 1 [multi-sector log support]
Address    Access  R/W   Size  Description
0x00       GPL,SL  R/O      1  Log Directory
0x04       GPL,SL  R/O      8  Device Statistics log
0x06           SL  R/O      1  SMART self-test log
0x07       GPL     R/O      1  Extended self-test log
0x10       GPL     R/O      1  NCQ Command Error log
0x11       GPL     R/O      1  SATA Phy Event Counters log
0x30       GPL,SL  R/O      9  IDENTIFY DEVICE data log
0x80-0x9f  GPL,SL  R/W     16  Host vendor specific log
0xc0-0xc1  GPL     VS   65408  Device vendor specific log
0xc2       GPL     VS   48640  Device vendor specific log
0xe0       GPL,SL  R/W      1  SCT Command/Status
0xe1       GPL,SL  R/W      1  SCT Data Transfer

SMART Extended Comprehensive Error Log (GP Log 0x03) not supported

SMART Error Log not supported

SMART Extended Self-test Log Version: 1 (1 sectors)
Num  Test_Description    Status                  Remaining  LifeTime(hours)  LBA_of_first_error
# 1  Short offline       Completed without error       00%      2613         -

Selective Self-tests/Logging not supported

SCT Status Version:                  3
SCT Version (vendor specific):       0 (0x0000)
Device State:                        Active (0)
Current Temperature:                    30 Celsius
Power Cycle Min/Max Temperature:     23/30 Celsius
Lifetime    Min/Max Temperature:     17/37 Celsius
Under/Over Temperature Limit Count:   0/0

SCT Data Table command not supported

SCT Error Recovery Control command not supported

Device Statistics (GP Log 0x04)
Page  Offset Size        Value Flags Description
0x01  =====  =               =  ===  == General Statistics (rev 1) ==
0x01  0x008  4              45  ---  Lifetime Power-On Resets
0x01  0x010  4            2613  ---  Power-on Hours
0x03  =====  =               =  ===  == Rotating Media Statistics (rev 1) ==
0x03  0x028  4               0  ---  Read Recovery Attempts
0x04  =====  =               =  ===  == General Errors Statistics (rev 1) ==
0x04  0x008  4               0  ---  Number of Reported Uncorrectable Errors
0x05  =====  =               =  ===  == Temperature Statistics (rev 1) ==
0x05  0x008  1              30  ---  Current Temperature
0x05  0x010  1              24  ---  Average Short Term Temperature
0x05  0x018  1              23  ---  Average Long Term Temperature
0x05  0x020  1              36  ---  Highest Temperature
0x05  0x028  1              20  ---  Lowest Temperature
0x05  0x030  1              35  ---  Highest Average Short Term Temperature
0x05  0x038  1              20  ---  Lowest Average Short Term Temperature
0x05  0x040  1              31  ---  Highest Average Long Term Temperature
0x05  0x048  1              23  ---  Lowest Average Long Term Temperature
0x05  0x050  4               0  ---  Time in Over-Temperature
0x05  0x058  1              75  ---  Specified Maximum Operating Temperature
0x05  0x060  4               0  ---  Time in Under-Temperature
0x05  0x068  1               0  ---  Specified Minimum Operating Temperature
0x06  =====  =               =  ===  == Transport Statistics (rev 1) ==
0x06  0x008  4               0  ---  Number of Hardware Resets
0x06  0x018  4               1  ---  Number of Interface CRC Errors
0x07  =====  =               =  ===  == Solid State Device Statistics (rev 1) ==
0x07  0x008  1              13  ---  Percentage Used Endurance Indicator
                                |||_ C monitored condition met
                                ||__ D supports DSN
                                |___ N normalized value

Pending Defects log (GP Log 0x0c) not supported

SATA Phy Event Counters (GP Log 0x11)
ID      Size     Value  Description
0x0001  4            0  Command failed due to ICRC error
0x0005  2            0  R_ERR response for non-data FIS
0x000a  4            1  Device-to-host register FISes sent due to a COMRESET

