smartctl 7.5 2025-04-30 r5714 [x86_64-linux-6.12.54-Unraid] (local build)
Copyright (C) 2002-25, Bruce Allen, Christian Franke, www.smartmontools.org

=== START OF INFORMATION SECTION ===
Device Model:     T-FORCE 2TB
Serial Number:    TPBF2503250040100308
LU WWN Device Id: 0 000000 000000000
Firmware Version: HP3C09BA
User Capacity:    2,048,408,248,320 bytes [2.04 TB]
Sector Size:      512 bytes logical/physical
Rotation Rate:    Solid State Device
Form Factor:      2.5 inches
TRIM Command:     Available, deterministic, zeroed
Device is:        Not in smartctl database 7.5/6045
ATA Version is:   ACS-4 T13/BSR INCITS 529 revision 5
SATA Version is:  SATA 3.2, 6.0 Gb/s (current: 6.0 Gb/s)
Local Time is:    Tue Jan  6 16:57:12 2026 MST
SMART support is: Available - device has SMART capability.
SMART support is: Enabled
AAM feature is:   Unavailable
APM feature is:   Unavailable
Rd look-ahead is: Enabled
Write cache is:   Enabled
DSN feature is:   Unavailable
ATA Security is:  Disabled, frozen [SEC2]

=== START OF READ SMART DATA SECTION ===
SMART overall-health self-assessment test result: PASSED

General SMART Values:
Offline data collection status:  (0x00)	Offline data collection activity
					was never started.
					Auto Offline Data Collection: Disabled.
Self-test execution status:      (   0)	The previous self-test routine completed
					without error or no self-test has ever 
					been run.
Total time to complete Offline 
data collection: 		(  120) seconds.
Offline data collection
capabilities: 			 (0x1d) SMART execute Offline immediate.
					No Auto Offline data collection support.
					Abort Offline collection upon new
					command.
					Offline surface scan supported.
					Self-test supported.
					No Conveyance Self-test supported.
					No Selective Self-test supported.
SMART capabilities:            (0x0002)	Does not save SMART data before
					entering power-saving mode.
					Supports SMART auto save timer.
Error logging capability:        (0x01)	Error logging supported.
					General Purpose Logging supported.
Short self-test routine 
recommended polling time: 	 (  30) minutes.
Extended self-test routine
recommended polling time: 	 (  60) minutes.

SMART Attributes Data Structure revision number: 1
Vendor Specific SMART Attributes with Thresholds:
ID# ATTRIBUTE_NAME          FLAGS    VALUE WORST THRESH FAIL RAW_VALUE
  1 Raw_Read_Error_Rate     -O--CK   100   100   050    -    0
  5 Reallocated_Sector_Ct   -O--CK   100   100   050    -    0
  9 Power_On_Hours          -O--CK   100   100   050    -    2974
 12 Power_Cycle_Count       -O--CK   100   100   050    -    12
160 Unknown_Attribute       -O--CK   100   100   050    -    0
161 Unknown_Attribute       -O--CK   100   100   050    -    17764
163 Unknown_Attribute       -O--CK   100   100   050    -    524
164 Unknown_Attribute       -O--CK   100   100   050    -    28
165 Unknown_Attribute       -O--CK   100   100   050    -    78
166 Unknown_Attribute       -O--CK   100   100   050    -    1
167 Unknown_Attribute       -O--CK   100   100   050    -    20
168 Unknown_Attribute       -O--CK   100   100   050    -    0
169 Unknown_Attribute       -O--CK   100   100   050    -    100
175 Program_Fail_Count_Chip -O--CK   100   100   050    -    0
176 Erase_Fail_Count_Chip   -O--CK   100   100   050    -    291704
177 Wear_Leveling_Count     -O--CK   100   100   050    -    2676428
178 Used_Rsvd_Blk_Cnt_Chip  -O--CK   100   100   050    -    0
181 Program_Fail_Cnt_Total  -O--CK   100   100   050    -    0
182 Erase_Fail_Count_Total  -O--CK   100   100   050    -    0
192 Power-Off_Retract_Count -O--CK   100   100   050    -    2
194 Temperature_Celsius     -O--CK   100   100   050    -    39
195 Hardware_ECC_Recovered  -O--CK   100   100   050    -    0
196 Reallocated_Event_Count -O--CK   100   100   050    -    0
197 Current_Pending_Sector  -O--CK   100   100   050    -    0
198 Offline_Uncorrectable   -O--CK   100   100   050    -    0
199 UDMA_CRC_Error_Count    -O--CK   100   100   050    -    0
232 Available_Reservd_Space -O--CK   100   100   050    -    100
241 Total_LBAs_Written      -O--CK   100   100   050    -    409097
242 Total_LBAs_Read         -O--CK   100   100   050    -    113242
                            ||||||_ K auto-keep
                            |||||__ C event count
                            ||||___ R error rate
                            |||____ S speed/performance
                            ||_____ O updated online
                            |______ P prefailure warning

General Purpose Log Directory Version 1
SMART           Log Directory Version 1 [multi-sector log support]
Address    Access  R/W   Size  Description
0x00       GPL,SL  R/O      1  Log Directory
0x01       GPL,SL  R/O      1  Summary SMART error log
0x02       GPL,SL  R/O      1  Comprehensive SMART error log
0x03       GPL,SL  R/O      1  Ext. Comprehensive SMART error log
0x04       GPL,SL  R/O      8  Device Statistics log
0x06       GPL,SL  R/O      1  SMART self-test log
0x07       GPL,SL  R/O      1  Extended self-test log
0x09       GPL,SL  R/W      1  Selective self-test log
0x10       GPL,SL  R/O      1  NCQ Command Error log
0x11       GPL,SL  R/O      1  SATA Phy Event Counters log
0x30       GPL,SL  R/O      9  IDENTIFY DEVICE data log
0x80-0x9f  GPL,SL  R/W     16  Host vendor specific log
0xa0       GPL,SL  VS      16  Device vendor specific log
0xe0       GPL,SL  R/W      1  SCT Command/Status
0xe1       GPL,SL  R/W      1  SCT Data Transfer

SMART Extended Comprehensive Error Log Version: 0 (1 sectors)
No Errors Logged

SMART Extended Self-test Log Version: 1 (1 sectors)
Num  Test_Description    Status                  Remaining  LifeTime(hours)  LBA_of_first_error
# 1  Short offline       Completed without error       00%      2415         -
# 2  Short offline       Completed without error       00%       145         -
# 3  Short offline       Completed without error       00%        52         -

Selective Self-tests/Logging not supported

SCT Commands not supported

Device Statistics (GP Log 0x04)
Page  Offset Size        Value Flags Description
0x01  =====  =               =  ===  == General Statistics (rev 1) ==
0x01  0x008  4              12  ---  Lifetime Power-On Resets
0x01  0x010  4            2974  ---  Power-on Hours
0x01  0x018  6     26810580992  ---  Logical Sectors Written
0x01  0x020  6        26948623  ---  Number of Write Commands
0x01  0x028  6      7421427712  ---  Logical Sectors Read
0x01  0x030  6         7753314  ---  Number of Read Commands
0x01  =====  =               =  ===  == General Statistics (rev 1) ==
0x01  0x008  4              12  ---  Lifetime Power-On Resets
0x01  0x010  4            2974  ---  Power-on Hours
0x01  0x018  6     26810580992  ---  Logical Sectors Written
0x01  0x020  6        26948623  ---  Number of Write Commands
0x01  0x028  6      7421427712  ---  Logical Sectors Read
0x01  0x030  6         7753314  ---  Number of Read Commands
0x01  =====  =               =  ===  == General Statistics (rev 1) ==
0x01  0x008  4              12  ---  Lifetime Power-On Resets
0x01  0x010  4            2974  ---  Power-on Hours
0x01  0x018  6     26810580992  ---  Logical Sectors Written
0x01  0x020  6        26948623  ---  Number of Write Commands
0x01  0x028  6      7421427712  ---  Logical Sectors Read
0x01  0x030  6         7753314  ---  Number of Read Commands
0x01  =====  =               =  ===  == General Statistics (rev 1) ==
0x01  0x008  4              12  ---  Lifetime Power-On Resets
0x01  0x010  4            2974  ---  Power-on Hours
0x01  0x018  6     26810580992  ---  Logical Sectors Written
0x01  0x020  6        26948623  ---  Number of Write Commands
0x01  0x028  6      7421427712  ---  Logical Sectors Read
0x01  0x030  6         7753314  ---  Number of Read Commands
0x01  =====  =               =  ===  == General Statistics (rev 1) ==
0x01  0x008  4              12  ---  Lifetime Power-On Resets
0x01  0x010  4            2974  ---  Power-on Hours
0x01  0x018  6     26810580992  ---  Logical Sectors Written
0x01  0x020  6        26948623  ---  Number of Write Commands
0x01  0x028  6      7421427712  ---  Logical Sectors Read
0x01  0x030  6         7753314  ---  Number of Read Commands
0x01  =====  =               =  ===  == General Statistics (rev 1) ==
0x01  0x008  4              12  ---  Lifetime Power-On Resets
0x01  0x010  4            2974  ---  Power-on Hours
0x01  0x018  6     26810580992  ---  Logical Sectors Written
0x01  0x020  6        26948623  ---  Number of Write Commands
0x01  0x028  6      7421427712  ---  Logical Sectors Read
0x01  0x030  6         7753314  ---  Number of Read Commands
0x01  =====  =               =  ===  == General Statistics (rev 1) ==
0x01  0x008  4              12  ---  Lifetime Power-On Resets
0x01  0x010  4            2974  ---  Power-on Hours
0x01  0x018  6     26810580992  ---  Logical Sectors Written
0x01  0x020  6        26948623  ---  Number of Write Commands
0x01  0x028  6      7421427712  ---  Logical Sectors Read
0x01  0x030  6         7753314  ---  Number of Read Commands
0x01  =====  =               =  ===  == General Statistics (rev 1) ==
0x01  0x008  4              12  ---  Lifetime Power-On Resets
0x01  0x010  4            2974  ---  Power-on Hours
0x01  0x018  6     26810580992  ---  Logical Sectors Written
0x01  0x020  6        26948623  ---  Number of Write Commands
0x01  0x028  6      7421427712  ---  Logical Sectors Read
0x01  0x030  6         7753314  ---  Number of Read Commands
                                |||_ C monitored condition met
                                ||__ D supports DSN
                                |___ N normalized value

Pending Defects log (GP Log 0x0c) not supported

SATA Phy Event Counters (GP Log 0x11)
ID      Size     Value  Description
0x0001  2            0  Command failed due to ICRC error
0x0009  2           20  Transition from drive PhyRdy to drive PhyNRdy
0x000a  2           32  Device-to-host register FISes sent due to a COMRESET
0x000b  2            0  CRC errors within host-to-device FIS
0x000d  2            0  Non-CRC errors within host-to-device FIS


