smartctl 6.7 2018-11-13 r4834 [x86_64-w64-mingw32-w10-1803] (CircleCI)
Copyright (C) 2002-18, Bruce Allen, Christian Franke, www.smartmontools.org

=== START OF INFORMATION SECTION ===
Model Family:     Intel S4510/S4610/S4500/S4600 Series SSDs
Device Model:     INTEL SSDSCKKB480G8
Serial Number:    PHYH836500JW480K
LU WWN Device Id: 5 5cd2e4 14fbddadd
Firmware Version: XC311001
User Capacity:    480,103,981,056 bytes [480 GB]
Sector Sizes:     512 bytes logical, 4096 bytes physical
Rotation Rate:    Solid State Device
Form Factor:      M.2
Device is:        In smartctl database [for details use: -P show]
ATA Version is:   ACS-3 T13/2161-D revision 5
SATA Version is:  SATA 3.2, 6.0 Gb/s (current: 6.0 Gb/s)
Local Time is:    Thu Nov 15 08:24:58 2018 PST
SMART support is: Available - device has SMART capability.
SMART support is: Enabled
AAM feature is:   Unavailable
APM feature is:   Unavailable
Rd look-ahead is: Enabled
Write cache is:   Enabled
DSN feature is:   Unavailable
ATA Security is:  Disabled, frozen [SEC2]
Wt Cache Reorder: Enabled

=== START OF READ SMART DATA SECTION ===
SMART overall-health self-assessment test result: PASSED

General SMART Values:
Offline data collection status:  (0x02)	Offline data collection activity
					was completed without error.
					Auto Offline Data Collection: Disabled.
Self-test execution status:      (   0)	The previous self-test routine completed
					without error or no self-test has ever 
					been run.
Total time to complete Offline 
data collection: 		(    2) seconds.
Offline data collection
capabilities: 			 (0x79) SMART execute Offline immediate.
					No Auto Offline data collection support.
					Suspend Offline collection upon new
					command.
					Offline surface scan supported.
					Self-test supported.
					Conveyance Self-test supported.
					Selective Self-test supported.
SMART capabilities:            (0x0003)	Saves SMART data before entering
					power-saving mode.
					Supports SMART auto save timer.
Error logging capability:        (0x01)	Error logging supported.
					General Purpose Logging supported.
Short self-test routine 
recommended polling time: 	 (   1) minutes.
Extended self-test routine
recommended polling time: 	 (   2) minutes.
Conveyance self-test routine
recommended polling time: 	 (   2) minutes.
SCT capabilities: 	       (0x003d)	SCT Status supported.
					SCT Error Recovery Control supported.
					SCT Feature Control supported.
					SCT Data Table supported.

SMART Attributes Data Structure revision number: 1
Vendor Specific SMART Attributes with Thresholds:
ID# ATTRIBUTE_NAME          FLAGS    VALUE WORST THRESH FAIL RAW_VALUE
  5 Reallocated_Sector_Ct   -O--CK   100   100   000    -    0
  9 Power_On_Hours          -O--CK   100   100   000    -    0
 12 Power_Cycle_Count       -O--CK   100   100   000    -    9
170 Available_Reservd_Space PO--CK   100   100   010    -    0
171 Program_Fail_Count      -O--CK   100   100   000    -    0
172 Erase_Fail_Count        -O--CK   100   100   000    -    0
174 Unsafe_Shutdown_Count   -O--CK   100   100   000    -    8
175 Power_Loss_Cap_Test     PO--CK   100   100   010    -    2187 (9 30)
183 SATA_Downshift_Count    -O--CK   100   100   000    -    0
184 End-to-End_Error_Count  PO--CK   100   100   090    -    0
187 Uncorrectable_Error_Cnt -O--CK   100   100   000    -    0
190 Drive_Temperature       -O---K   079   079   000    -    21 (Min/Max 12/21)
192 Unsafe_Shutdown_Count   -O--CK   100   100   000    -    8
194 Temperature_Celsius     -O---K   100   100   000    -    21
197 Pending_Sector_Count    -O--C-   100   100   000    -    0
199 CRC_Error_Count         -OSRCK   100   100   000    -    0
225 Host_Writes_32MiB       -O--CK   100   100   000    -    0
226 Workld_Media_Wear_Indic -O--CK   100   100   000    -    65535
227 Workld_Host_Reads_Perc  -O--CK   100   100   000    -    65535
228 Workload_Minutes        -O--CK   100   100   000    -    65535
232 Available_Reservd_Space PO--CK   100   100   010    -    0
233 Media_Wearout_Indicator -O--CK   100   100   000    -    0
234 Thermal_Throttle_Status -O--CK   100   100   000    -    0/0
235 Power_Loss_Cap_Test     PO--CK   100   100   010    -    2187 (9 30)
241 Host_Writes_32MiB       -O--CK   100   100   000    -    0
242 Host_Reads_32MiB        -O--CK   100   100   000    -    715
243 NAND_Writes_32MiB       -O--CK   100   100   000    -    121
                            ||||||_ K auto-keep
                            |||||__ C event count
                            ||||___ R error rate
                            |||____ S speed/performance
                            ||_____ O updated online
                            |______ P prefailure warning

General Purpose Log Directory Version 1
SMART           Log Directory Version 1 [multi-sector log support]
Address    Access  R/W   Size  Description
0x00       GPL,SL  R/O      1  Log Directory
0x01           SL  R/O      1  Summary SMART error log
0x02           SL  R/O      8  Comprehensive SMART error log
0x03       GPL     R/O     20  Ext. Comprehensive SMART error log
0x04       GPL,SL  R/O      8  Device Statistics log
0x06           SL  R/O      1  SMART self-test log
0x07       GPL     R/O      2  Extended self-test log
0x08       GPL     R/O      2  Power Conditions log
0x09           SL  R/W      1  Selective self-test log
0x10       GPL     R/O      1  NCQ Command Error log
0x11       GPL     R/O      1  SATA Phy Event Counters log
0x30       GPL,SL  R/O      9  IDENTIFY DEVICE data log
0x80-0x9f  GPL,SL  R/W     16  Host vendor specific log
0xb8       GPL,SL  VS       1  Device vendor specific log
0xb9       GPL     VS    3336  Device vendor specific log
0xb9       SL      VS       8  Device vendor specific log
0xba       GPL     VS    1280  Device vendor specific log
0xe0       GPL,SL  R/W      1  SCT Command/Status
0xe1       GPL,SL  R/W      8  SCT Data Transfer

SMART Extended Comprehensive Error Log Version: 1 (20 sectors)
No Errors Logged

SMART Extended Self-test Log Version: 1 (2 sectors)
Num  Test_Description    Status                  Remaining  LifeTime(hours)  LBA_of_first_error
# 1  Short offline       Completed without error       00%         0         -
# 2  Short offline       Completed without error       00%         0         -
# 3  Short offline       Completed without error       00%         0         -
# 4  Short offline       Completed without error       00%         0         -

SMART Selective self-test log data structure revision number 1
 SPAN  MIN_LBA  MAX_LBA  CURRENT_TEST_STATUS
    1        0        0  Not_testing
    2        0        0  Not_testing
    3        0        0  Not_testing
    4        0        0  Not_testing
    5        0        0  Not_testing
Selective self-test flags (0x0):
  After scanning selected spans, do NOT read-scan remainder of disk.
If Selective self-test is pending on power-up, resume after 0 minute delay.

SCT Status Version:                  3
SCT Version (vendor specific):       1 (0x0001)
Device State:                        Active (0)
Current Temperature:                    21 Celsius
Power Cycle Min/Max Temperature:     12/21 Celsius
Lifetime    Min/Max Temperature:     10/26 Celsius
Specified Max Operating Temperature:    73 Celsius
Under/Over Temperature Limit Count:   0/0

SCT Temperature History Version:     2
Temperature Sampling Period:         1 minute
Temperature Logging Interval:        1 minute
Min/Max recommended Temperature:      0/73 Celsius
Min/Max Temperature Limit:            0/73 Celsius
Temperature History Size (Index):    478 (38)

Index    Estimated Time   Temperature Celsius
  39    2018-11-15 00:27     ?  -
 ...    ..(437 skipped).    ..  -
 477    2018-11-15 07:45     ?  -
   0    2018-11-15 07:46    26  *******
   1    2018-11-15 07:47     ?  -
   2    2018-11-15 07:48    25  ******
   3    2018-11-15 07:49     ?  -
   4    2018-11-15 07:50    21  **
   5    2018-11-15 07:51     ?  -
   6    2018-11-15 07:52    20  *
   7    2018-11-15 07:53    23  ****
   8    2018-11-15 07:54    25  ******
   9    2018-11-15 07:55     ?  -
  10    2018-11-15 07:56    20  *
  11    2018-11-15 07:57     ?  -
  12    2018-11-15 07:58    22  ***
  13    2018-11-15 07:59    25  ******
  14    2018-11-15 08:00     ?  -
  15    2018-11-15 08:01    20  *
  16    2018-11-15 08:02    22  ***
  17    2018-11-15 08:03    23  ****
  18    2018-11-15 08:04    23  ****
  19    2018-11-15 08:05     ?  -
  20    2018-11-15 08:06    19  -
  21    2018-11-15 08:07    21  **
  22    2018-11-15 08:08    22  ***
  23    2018-11-15 08:09    23  ****
 ...    ..(  3 skipped).    ..  ****
  27    2018-11-15 08:13    23  ****
  28    2018-11-15 08:14    22  ***
 ...    ..(  2 skipped).    ..  ***
  31    2018-11-15 08:17    22  ***
  32    2018-11-15 08:18    23  ****
 ...    ..(  3 skipped).    ..  ****
  36    2018-11-15 08:22    23  ****
  37    2018-11-15 08:23     ?  -
  38    2018-11-15 08:24    20  *

SCT Error Recovery Control:
           Read: Disabled
          Write: Disabled

Device Statistics (GP Log 0x04)
Page  Offset Size        Value Flags Description
0x01  =====  =               =  ===  == General Statistics (rev 2) ==
0x01  0x008  4               9  ---  Lifetime Power-On Resets
0x01  0x018  6               0  ---  Logical Sectors Written
0x01  0x020  6         2977705  ---  Number of Write Commands
0x01  0x028  6        46875913  ---  Logical Sectors Read
0x01  0x030  6         2457414  ---  Number of Read Commands
0x01  0x038  6   1542018297474  ---  Date and Time TimeStamp
0x04  =====  =               =  ===  == General Errors Statistics (rev 1) ==
0x04  0x008  4               0  ---  Number of Reported Uncorrectable Errors
0x04  0x010  4               0  ---  Resets Between Cmd Acceptance and Completion
0x05  =====  =               =  ===  == Temperature Statistics (rev 1) ==
0x05  0x008  1              21  ---  Current Temperature
0x05  0x010  1               -  ---  Average Short Term Temperature
0x05  0x018  1               -  ---  Average Long Term Temperature
0x05  0x020  1              22  ---  Highest Temperature
0x05  0x028  1              22  ---  Lowest Temperature
0x05  0x030  1               -  ---  Highest Average Short Term Temperature
0x05  0x038  1               -  ---  Lowest Average Short Term Temperature
0x05  0x040  1               -  ---  Highest Average Long Term Temperature
0x05  0x048  1               -  ---  Lowest Average Long Term Temperature
0x05  0x050  4               0  ---  Time in Over-Temperature
0x05  0x058  1              73  ---  Specified Maximum Operating Temperature
0x05  0x060  4               0  ---  Time in Under-Temperature
0x05  0x068  1               0  ---  Specified Minimum Operating Temperature
0x06  =====  =               =  ===  == Transport Statistics (rev 1) ==
0x06  0x008  4               0  ---  Number of Hardware Resets
0x06  0x010  4               0  ---  Number of ASR Events
0x06  0x018  4               0  ---  Number of Interface CRC Errors
0x07  =====  =               =  ===  == Solid State Device Statistics (rev 1) ==
0x07  0x008  1               0  ---  Percentage Used Endurance Indicator
                                |||_ C monitored condition met
                                ||__ D supports DSN
                                |___ N normalized value

Pending Defects log (GP Log 0x0c) not supported

SATA Phy Event Counters (GP Log 0x11)
ID      Size     Value  Description
0x0001  4            0  Command failed due to ICRC error
0x0002  4            0  R_ERR response for data FIS
0x0003  4            0  R_ERR response for device-to-host data FIS
0x0004  4            0  R_ERR response for host-to-device data FIS
0x0005  4            0  R_ERR response for non-data FIS
0x0006  4            0  R_ERR response for device-to-host non-data FIS
0x0007  4            0  R_ERR response for host-to-device non-data FIS
0x000a  4            1  Device-to-host register FISes sent due to a COMRESET
0x000b  4            0  CRC errors within host-to-device FIS
0x000d  4            0  Non-CRC errors within host-to-device FIS

