smartctl 6.6 2016-11-12 r4366 [x86_64-linux-3.16.0-4-amd64] (daily-20161112)
Copyright (C) 2002-16, Bruce Allen, Christian Franke, www.smartmontools.org

=== START OF INFORMATION SECTION ===
Device Model:     CT1000MX500SSD1
Firmware Version: M3CR022
User Capacity:    1,000,204,886,016 bytes [1.00 TB]
Sector Sizes:     512 bytes logical, 4096 bytes physical
Rotation Rate:    Solid State Device
Form Factor:      2.5 inches
Device is:        Not in smartctl database [for details use: -P showall]
ATA Version is:   ACS-3 T13/2161-D revision 5
SATA Version is:  SATA >3.2 (0x1ff), 6.0 Gb/s (current: 3.0 Gb/s)
Local Time is:    Mon Aug 20 21:55:53 2018 PDT
SMART support is: Available - device has SMART capability.
SMART support is: Enabled
AAM feature is:   Unavailable
APM level is:     254 (maximum performance)
Rd look-ahead is: Enabled
Write cache is:   Enabled
ATA Security is:  Disabled, frozen [SEC2]
Wt Cache Reorder: Unknown

=== START OF READ SMART DATA SECTION ===
SMART overall-health self-assessment test result: PASSED

General SMART Values:
Offline data collection status:  (0x82)	Offline data collection activity
					was completed without error.
					Auto Offline Data Collection: Enabled.
Self-test execution status:      (   0)	The previous self-test routine completed
					without error or no self-test has ever 
					been run.
Total time to complete Offline 
data collection: 		(    0) seconds.
Offline data collection
capabilities: 			 (0x7b) SMART execute Offline immediate.
					Auto Offline data collection on/off support.
					Suspend Offline collection upon new
					command.
					Offline surface scan supported.
					Self-test supported.
					Conveyance Self-test supported.
					Selective Self-test supported.
SMART capabilities:            (0x0003)	Saves SMART data before entering
					power-saving mode.
					Supports SMART auto save timer.
Error logging capability:        (0x01)	Error logging supported.
					General Purpose Logging supported.
Short self-test routine 
recommended polling time: 	 (   2) minutes.
Extended self-test routine
recommended polling time: 	 (  30) minutes.
Conveyance self-test routine
recommended polling time: 	 (   2) minutes.
SCT capabilities: 	       (0x0031)	SCT Status supported.
					SCT Feature Control supported.
					SCT Data Table supported.

SMART Attributes Data Structure revision number: 16
Vendor Specific SMART Attributes with Thresholds:
ID# ATTRIBUTE_NAME          FLAGS    VALUE WORST THRESH FAIL RAW_VALUE
  1 Raw_Read_Error_Rate     POSR-K   100   100   000    -    0
  5 Reallocated_Sector_Ct   -O--CK   100   100   010    -    0
  9 Power_On_Hours          -O--CK   100   100   000    -    24
 12 Power_Cycle_Count       -O--CK   100   100   000    -    25
171 Unknown_Attribute       -O--CK   100   100   000    -    0
172 Unknown_Attribute       -O--CK   100   100   000    -    0
173 Unknown_Attribute       -O--CK   100   100   000    -    0
174 Unknown_Attribute       -O--CK   100   100   000    -    10
180 Unused_Rsvd_Blk_Cnt_Tot PO--CK   000   000   000    -    43
183 Runtime_Bad_Block       -O--CK   100   100   000    -    0
184 End-to-End_Error        -O--CK   100   100   000    -    0
187 Reported_Uncorrect      -O--CK   100   100   000    -    0
194 Temperature_Celsius     -O---K   060   045   000    -    40 (Min/Max 0/55)
196 Reallocated_Event_Count -O--CK   100   100   000    -    0
197 Current_Pending_Sector  -O--CK   100   100   000    -    0
198 Offline_Uncorrectable   ----CK   100   100   000    -    0
199 UDMA_CRC_Error_Count    -O--CK   100   100   000    -    0
202 Unknown_SSD_Attribute   ----CK   100   100   001    -    0
206 Unknown_SSD_Attribute   -OSR--   100   100   000    -    0
210 Unknown_Attribute       -O--CK   100   100   000    -    0
246 Unknown_Attribute       -O--CK   100   100   000    -    777029911
247 Unknown_Attribute       -O--CK   100   100   000    -    12370614
248 Unknown_Attribute       -O--CK   100   100   000    -    2547708
                            ||||||_ K auto-keep
                            |||||__ C event count
                            ||||___ R error rate
                            |||____ S speed/performance
                            ||_____ O updated online
                            |______ P prefailure warning

General Purpose Log Directory Version 1
SMART           Log Directory Version 1 [multi-sector log support]
Address    Access  R/W   Size  Description
0x00       GPL,SL  R/O      1  Log Directory
0x01           SL  R/O      1  Summary SMART error log
0x02           SL  R/O      1  Comprehensive SMART error log
0x03       GPL     R/O      1  Ext. Comprehensive SMART error log
0x04       GPL,SL  R/O      8  Device Statistics log
0x06           SL  R/O      1  SMART self-test log
0x07       GPL     R/O      1  Extended self-test log
0x09           SL  R/W      1  Selective self-test log
0x10       GPL     R/O      1  SATA NCQ Queued Error log
0x11       GPL     R/O      1  SATA Phy Event Counters log
0x24       GPL     R/O     88  Current Device Internal Status Data log
0x25       GPL     R/O     64  Saved Device Internal Status Data log
0x30       GPL,SL  R/O      9  IDENTIFY DEVICE data log
0x80-0x9f  GPL,SL  R/W     16  Host vendor specific log
0xe0       GPL,SL  R/W      1  SCT Command/Status
0xe1       GPL,SL  R/W      1  SCT Data Transfer

SMART Extended Comprehensive Error Log Version: 1 (1 sectors)
No Errors Logged

SMART Extended Self-test Log Version: 1 (1 sectors)
Num  Test_Description    Status                  Remaining  LifeTime(hours)  LBA_of_first_error
# 1  Short offline       Completed without error       00%        24         -

SMART Selective self-test log data structure revision number 1
 SPAN  MIN_LBA  MAX_LBA  CURRENT_TEST_STATUS
    1        0        0  Not_testing
    2        0        0  Not_testing
    3        0        0  Not_testing
    4        0        0  Not_testing
    5        0        0  Not_testing
Selective self-test flags (0x0):
  After scanning selected spans, do NOT read-scan remainder of disk.
If Selective self-test is pending on power-up, resume after 0 minute delay.

SCT Status Version:                  3
SCT Version (vendor specific):       1 (0x0001)
SCT Support Level:                   0
Device State:                        Active (0)
Current Temperature:                    40 Celsius
Power Cycle Min/Max Temperature:     33/52 Celsius
Lifetime    Min/Max Temperature:      0/55 Celsius
Under/Over Temperature Limit Count:   0/0

SCT Temperature History Version:     2
Temperature Sampling Period:         1 minute
Temperature Logging Interval:        1 minute
Min/Max recommended Temperature:      0/100 Celsius
Min/Max Temperature Limit:            0/100 Celsius
Temperature History Size (Index):    128 (61)

Index    Estimated Time   Temperature Celsius
  62    2018-08-20 19:48    38  *******************
  63    2018-08-20 19:49    40  *********************
  64    2018-08-20 19:50    38  *******************
 ...    ..(  2 skipped).    ..  *******************
  67    2018-08-20 19:53    38  *******************
  68    2018-08-20 19:54    41  **********************
  69    2018-08-20 19:55    48  *****************************
  70    2018-08-20 19:56    40  *********************
  71    2018-08-20 19:57    48  *****************************
  72    2018-08-20 19:58    50  *******************************
  73    2018-08-20 19:59    50  *******************************
  74    2018-08-20 20:00    52  *********************************
  75    2018-08-20 20:01    52  *********************************
  76    2018-08-20 20:02    43  ************************
  77    2018-08-20 20:03    43  ************************
  78    2018-08-20 20:04    48  *****************************
  79    2018-08-20 20:05    41  **********************
  80    2018-08-20 20:06    50  *******************************
  81    2018-08-20 20:07    54  ***********************************
  82    2018-08-20 20:08    47  ****************************
  83    2018-08-20 20:09    52  *********************************
  84    2018-08-20 20:10    50  *******************************
  85    2018-08-20 20:11    41  **********************
  86    2018-08-20 20:12    52  *********************************
  87    2018-08-20 20:13    50  *******************************
  88    2018-08-20 20:14    41  **********************
  89    2018-08-20 20:15    45  **************************
  90    2018-08-20 20:16    50  *******************************
  91    2018-08-20 20:17    41  **********************
  92    2018-08-20 20:18    43  ************************
  93    2018-08-20 20:19    43  ************************
  94    2018-08-20 20:20     ?  -
  95    2018-08-20 20:21    41  **********************
  96    2018-08-20 20:22    40  *********************
 ...    ..(  2 skipped).    ..  *********************
  99    2018-08-20 20:25    40  *********************
 100    2018-08-20 20:26    38  *******************
 ...    ..(  3 skipped).    ..  *******************
 104    2018-08-20 20:30    38  *******************
 105    2018-08-20 20:31    36  *****************
 ...    ..(  3 skipped).    ..  *****************
 109    2018-08-20 20:35    36  *****************
 110    2018-08-20 20:36    35  ****************
 ...    ..( 13 skipped).    ..  ****************
 124    2018-08-20 20:50    35  ****************
 125    2018-08-20 20:51    33  **************
 ...    ..( 24 skipped).    ..  **************
  22    2018-08-20 21:16    33  **************
  23    2018-08-20 21:17    35  ****************
  24    2018-08-20 21:18    33  **************
 ...    ..(  3 skipped).    ..  **************
  28    2018-08-20 21:22    33  **************
  29    2018-08-20 21:23    35  ****************
 ...    ..( 10 skipped).    ..  ****************
  40    2018-08-20 21:34    35  ****************
  41    2018-08-20 21:35    36  *****************
 ...    ..( 14 skipped).    ..  *****************
  56    2018-08-20 21:50    36  *****************
  57    2018-08-20 21:51    47  ****************************
  58    2018-08-20 21:52    48  *****************************
  59    2018-08-20 21:53    38  *******************
  60    2018-08-20 21:54    38  *******************
  61    2018-08-20 21:55    38  *******************

SCT Error Recovery Control command not supported

Device Statistics (GP Log 0x04)
Page  Offset Size        Value Flags Description
0x01  =====  =               =  ===  == General Statistics (rev 1) ==
0x01  0x008  4              25  ---  Lifetime Power-On Resets
0x01  0x010  4              24  ---  Power-on Hours
0x01  0x018  6       777029911  ---  Logical Sectors Written
0x01  0x020  6         3249798  ---  Number of Write Commands
0x01  0x028  6        86899717  ---  Logical Sectors Read
0x01  0x030  6         1549607  ---  Number of Read Commands
0x01  0x038  6               0  ---  Date and Time TimeStamp
0x04  =====  =               =  ===  == General Errors Statistics (rev 1) ==
0x04  0x008  4               0  ---  Number of Reported Uncorrectable Errors
0x04  0x010  4              10  ---  Resets Between Cmd Acceptance and Completion
0x05  =====  =               =  ===  == Temperature Statistics (rev 1) ==
0x05  0x008  1              40  ---  Current Temperature
0x05  0x010  1              35  ---  Average Short Term Temperature
0x05  0x018  1              34  ---  Average Long Term Temperature
0x05  0x020  1              55  ---  Highest Temperature
0x05  0x028  1               0  ---  Lowest Temperature
0x05  0x030  1              47  ---  Highest Average Short Term Temperature
0x05  0x038  1               0  ---  Lowest Average Short Term Temperature
0x05  0x040  1              43  ---  Highest Average Long Term Temperature
0x05  0x048  1               0  ---  Lowest Average Long Term Temperature
0x05  0x050  4               0  ---  Time in Over-Temperature
0x05  0x058  1              70  ---  Specified Maximum Operating Temperature
0x05  0x060  4               0  ---  Time in Under-Temperature
0x05  0x068  1               0  ---  Specified Minimum Operating Temperature
0x06  =====  =               =  ===  == Transport Statistics (rev 1) ==
0x06  0x008  4              50  ---  Number of Hardware Resets
0x06  0x010  4               2  ---  Number of ASR Events
0x06  0x018  4               0  ---  Number of Interface CRC Errors
0x07  =====  =               =  ===  == Solid State Device Statistics (rev 1) ==
0x07  0x008  1               0  ---  Percentage Used Endurance Indicator
                                |||_ C monitored condition met
                                ||__ D supports DSN
                                |___ N normalized value

SATA Phy Event Counters (GP Log 0x11)
ID      Size     Value  Description
0x0001  2            0  Command failed due to ICRC error
0x0002  2            0  R_ERR response for data FIS
0x0003  2            0  R_ERR response for device-to-host data FIS
0x0004  2            0  R_ERR response for host-to-device data FIS
0x0005  2            0  R_ERR response for non-data FIS
0x0006  2            0  R_ERR response for device-to-host non-data FIS
0x0007  2            0  R_ERR response for host-to-device non-data FIS
0x0008  2            0  Device-to-host non-data FIS retries
0x0009  2            0  Transition from drive PhyRdy to drive PhyNRdy
0x000a  2            4  Device-to-host register FISes sent due to a COMRESET
0x000b  2            0  CRC errors within host-to-device FIS
0x000d  2            0  Non-CRC errors within host-to-device FIS
0x000f  2            0  R_ERR response for host-to-device data FIS, CRC
0x0010  2            0  R_ERR response for host-to-device data FIS, non-CRC
0x0012  2            0  R_ERR response for host-to-device non-data FIS, CRC
0x0013  2            0  R_ERR response for host-to-device non-data FIS, non-CRC

