smartctl 7.3 2022-02-28 r5338 [x86_64-linux-6.8.12-12-pve] (local build)
Copyright (C) 2002-22, Bruce Allen, Christian Franke, www.smartmontools.org

=== START OF INFORMATION SECTION ===
Device Model:     VK001920GXAWN
Serial Number:    21303066F97C
LU WWN Device Id: 5 00a075 13066f97c
Firmware Version: HPG1
User Capacity:    1,920,383,410,176 bytes [1.92 TB]
Sector Sizes:     512 bytes logical, 4096 bytes physical
Rotation Rate:    Solid State Device
Form Factor:      2.5 inches
TRIM Command:     Available, deterministic, zeroed
Device is:        Not in smartctl database 7.3/5787
ATA Version is:   ACS-4 (minor revision not indicated)
SATA Version is:  SATA 3.3, 6.0 Gb/s (current: 6.0 Gb/s)
Local Time is:    Tue Jul 22 10:04:19 2025 PDT
SMART support is: Available - device has SMART capability.
SMART support is: Enabled
AAM feature is:   Unavailable
APM feature is:   Unavailable
Rd look-ahead is: Enabled
Write cache is:   Disabled
DSN feature is:   Unavailable
ATA Security is:  Unavailable
Wt Cache Reorder: Enabled

=== START OF READ SMART DATA SECTION ===
SMART overall-health self-assessment test result: PASSED

General SMART Values:
Offline data collection status:  (0x00)	Offline data collection activity
					was never started.
					Auto Offline Data Collection: Disabled.
Self-test execution status:      (   0)	The previous self-test routine completed
					without error or no self-test has ever
					been run.
Total time to complete Offline
data collection: 		( 3706) seconds.
Offline data collection
capabilities: 			 (0x7b) SMART execute Offline immediate.
					Auto Offline data collection on/off support.
					Suspend Offline collection upon new
					command.
					Offline surface scan supported.
					Self-test supported.
					Conveyance Self-test supported.
					Selective Self-test supported.
SMART capabilities:            (0x0003)	Saves SMART data before entering
					power-saving mode.
					Supports SMART auto save timer.
Error logging capability:        (0x01)	Error logging supported.
					General Purpose Logging supported.
Short self-test routine
recommended polling time: 	 (   2) minutes.
Extended self-test routine
recommended polling time: 	 (  14) minutes.
Conveyance self-test routine
recommended polling time: 	 (   3) minutes.
SCT capabilities: 	       (0x0035)	SCT Status supported.
					SCT Feature Control supported.
					SCT Data Table supported.

SMART Attributes Data Structure revision number: 16
Vendor Specific SMART Attributes with Thresholds:
ID# ATTRIBUTE_NAME          FLAGS    VALUE WORST THRESH FAIL RAW_VALUE
  1 Raw_Read_Error_Rate     POSR--   100   100   050    -    0
  5 Reallocated_Sector_Ct   PO--CK   100   100   010    -    0
  9 Power_On_Hours          -O--CK   100   100   000    -    17618
 11 Unknown_SSD_Attribute   -O--C-   100   100   000    -    6
 12 Power_Cycle_Count       -O--CK   100   100   000    -    7
171 Unknown_Attribute       -O--CK   100   100   000    -    0
172 Unknown_Attribute       -O--CK   100   100   000    -    0
173 Unknown_Attribute       PO--CK   100   100   010    -    52
174 Unknown_Attribute       -O--CK   100   100   000    -    6
175 Program_Fail_Count_Chip PO--CK   100   100   001    -    0
180 Unused_Rsvd_Blk_Cnt_Tot PO-RCK   100   100   001    -    0
184 End-to-End_Error        -O--CK   100   100   000    -    0
187 Reported_Uncorrect      -O--CK   100   100   000    -    0
188 Command_Timeout         -O--CK   100   100   000    -    30
194 Temperature_Celsius     -O---K   062   062   000    -    38 (Min/Max 19/38)
196 Reallocated_Event_Count PO--CK   100   100   001    -    0
197 Current_Pending_Sector  -O--C-   100   100   000    -    0
198 Offline_Uncorrectable   ----C-   100   100   000    -    0
199 UDMA_CRC_Error_Count    -OSRCK   100   100   000    -    0
                            ||||||_ K auto-keep
                            |||||__ C event count
                            ||||___ R error rate
                            |||____ S speed/performance
                            ||_____ O updated online
                            |______ P prefailure warning

General Purpose Log Directory Version 1
SMART           Log Directory Version 1 [multi-sector log support]
Address    Access  R/W   Size  Description
0x00       GPL,SL  R/O      1  Log Directory
0x03       GPL     R/O  16383  Ext. Comprehensive SMART error log
0x04       GPL,SL  R/O      8  Device Statistics log
0x07       GPL     R/O      1  Extended self-test log
0x08       GPL     R/O      2  Power Conditions log
0x09           SL  R/W      1  Selective self-test log
0x0c       GPL     R/O     16  Pending Defects log
0x10       GPL     R/O      1  NCQ Command Error log
0x11       GPL     R/O      1  SATA Phy Event Counters log
0x30       GPL     R/O      9  IDENTIFY DEVICE data log
0x80       GPL     R/W     16  Host vendor specific log
0x81-0x9f  GPL,SL  R/W     16  Host vendor specific log
0xa0       GPL     VS   35328  Device vendor specific log
0xa1       GPL,SL  VS       4  Device vendor specific log
0xa3       GPL     VS   13824  Device vendor specific log
0xa4       GPL     VS     354  Device vendor specific log
0xa4       SL      VS      98  Device vendor specific log
0xa5       GPL     VS    8000  Device vendor specific log
0xa5       SL      VS      64  Device vendor specific log
0xa6       GPL     VS    8000  Device vendor specific log
0xa6       SL      VS      64  Device vendor specific log
0xa7       GPL     VS   32768  Device vendor specific log
0xb5           SL  VS       1  Device vendor specific log
0xb6       GPL     VS    8193  Device vendor specific log
0xbb       GPL     VS       1  Device vendor specific log
0xd0       GPL     VS       1  Device vendor specific log
0xd7       GPL     VS       1  Device vendor specific log
0xe0       GPL,SL  R/W      1  SCT Command/Status
0xe1       GPL,SL  R/W      1  SCT Data Transfer

SMART Extended Comprehensive Error Log Version: 1 (16383 sectors)
No Errors Logged

SMART Error Log not supported

SMART Extended Self-test Log Version: 1 (1 sectors)
Num  Test_Description    Status                  Remaining  LifeTime(hours)  LBA_of_first_error
# 1  Short offline       Completed without error       00%     17617         -
# 2  Short offline       Completed without error       00%     17616         -

SMART Self-test Log not supported

SMART Selective self-test log data structure revision number 1
 SPAN  MIN_LBA  MAX_LBA  CURRENT_TEST_STATUS
    1        0        0  Not_testing
    2        0        0  Not_testing
    3        0        0  Completed [00% left] (132395008-132460543)
    4        0        0  Not_testing
    5        0        0  Not_testing
Selective self-test flags (0x0):
  After scanning selected spans, do NOT read-scan remainder of disk.
If Selective self-test is pending on power-up, resume after 0 minute delay.

SCT Status Version:                  3
SCT Version (vendor specific):       1 (0x0001)
Device State:                        Active (0)
Current Temperature:                    38 Celsius
Power Cycle Min/Max Temperature:     20/38 Celsius
Lifetime    Min/Max Temperature:     19/38 Celsius
Specified Max Operating Temperature:    60 Celsius
Under/Over Temperature Limit Count:   0/0
Minimum supported ERC Time Limit:    50 (5.0 seconds)

SCT Temperature History Version:     2
Temperature Sampling Period:         1 minute
Temperature Logging Interval:        1 minute
Min/Max recommended Temperature:      0/60 Celsius
Min/Max Temperature Limit:            0/70 Celsius
Temperature History Size (Index):    478 (79)

Index    Estimated Time   Temperature Celsius
  80    2025-07-22 02:07    29  **********
 ...    ..(  6 skipped).    ..  **********
  87    2025-07-22 02:14    29  **********
  88    2025-07-22 02:15    28  *********
  89    2025-07-22 02:16    29  **********
 ...    ..(  3 skipped).    ..  **********
  93    2025-07-22 02:20    29  **********
  94    2025-07-22 02:21    28  *********
 ...    ..(  2 skipped).    ..  *********
  97    2025-07-22 02:24    28  *********
  98    2025-07-22 02:25    29  **********
 ...    ..(281 skipped).    ..  **********
 380    2025-07-22 07:07    29  **********
 381    2025-07-22 07:08     ?  -
 382    2025-07-22 07:09    29  **********
 ...    ..( 27 skipped).    ..  **********
 410    2025-07-22 07:37    29  **********
 411    2025-07-22 07:38    30  ***********
 412    2025-07-22 07:39    30  ***********
 413    2025-07-22 07:40    29  **********
 414    2025-07-22 07:41    29  **********
 415    2025-07-22 07:42     ?  -
 416    2025-07-22 07:43    27  ********
 417    2025-07-22 07:44    29  **********
 418    2025-07-22 07:45    30  ***********
 419    2025-07-22 07:46    31  ************
 420    2025-07-22 07:47    32  *************
 421    2025-07-22 07:48    33  **************
 422    2025-07-22 07:49    34  ***************
 423    2025-07-22 07:50    35  ****************
 424    2025-07-22 07:51    35  ****************
 425    2025-07-22 07:52    36  *****************
 426    2025-07-22 07:53    36  *****************
 427    2025-07-22 07:54    36  *****************
 428    2025-07-22 07:55    37  ******************
 ...    ..(  3 skipped).    ..  ******************
 432    2025-07-22 07:59    37  ******************
 433    2025-07-22 08:00    38  *******************
 ...    ..( 16 skipped).    ..  *******************
 450    2025-07-22 08:17    38  *******************
 451    2025-07-22 08:18    37  ******************
 ...    ..( 22 skipped).    ..  ******************
 474    2025-07-22 08:41    37  ******************
 475    2025-07-22 08:42    38  *******************
 476    2025-07-22 08:43    38  *******************
 477    2025-07-22 08:44    38  *******************
   0    2025-07-22 08:45    29  **********
 ...    ..( 74 skipped).    ..  **********
  75    2025-07-22 10:00    29  **********
  76    2025-07-22 10:01    28  *********
  77    2025-07-22 10:02    29  **********
  78    2025-07-22 10:03    29  **********
  79    2025-07-22 10:04    29  **********

SCT Error Recovery Control command not supported

Device Statistics (GP Log 0x04)
Page  Offset Size        Value Flags Description
0x01  =====  =               =  ===  == General Statistics (rev 3) ==
0x01  0x008  4               7  ---  Lifetime Power-On Resets
0x01  0x010  4           17618  ---  Power-on Hours
0x01  0x018  6     70448601867  ---  Logical Sectors Written
0x01  0x020  6       567646412  ---  Number of Write Commands
0x01  0x028  6    461363122416  ---  Logical Sectors Read
0x01  0x030  6      4116202809  ---  Number of Read Commands
0x01  0x038  6     63424871130  ---  Date and Time TimeStamp
0x04  =====  =               =  ===  == General Errors Statistics (rev 1) ==
0x04  0x008  4               0  ---  Number of Reported Uncorrectable Errors
0x04  0x010  4              30  ---  Resets Between Cmd Acceptance and Completion
0x05  =====  =               =  ===  == Temperature Statistics (rev 1) ==
0x05  0x008  1              38  ---  Current Temperature
0x05  0x010  1              28  ---  Average Short Term Temperature
0x05  0x018  1              28  ---  Average Long Term Temperature
0x05  0x020  1              38  ---  Highest Temperature
0x05  0x028  1              19  ---  Lowest Temperature
0x05  0x030  1              29  ---  Highest Average Short Term Temperature
0x05  0x038  1              22  ---  Lowest Average Short Term Temperature
0x05  0x040  1              28  ---  Highest Average Long Term Temperature
0x05  0x048  1              24  ---  Lowest Average Long Term Temperature
0x05  0x050  4               0  ---  Time in Over-Temperature
0x05  0x058  1              60  ---  Specified Maximum Operating Temperature
0x05  0x060  4               0  ---  Time in Under-Temperature
0x05  0x068  1               0  ---  Specified Minimum Operating Temperature
0x06  =====  =               =  ===  == Transport Statistics (rev 1) ==
0x06  0x008  4              55  ---  Number of Hardware Resets
0x06  0x010  4              46  ---  Number of ASR Events
0x06  0x018  4               0  ---  Number of Interface CRC Errors
0x07  =====  =               =  ===  == Solid State Device Statistics (rev 1) ==
0x07  0x008  1               0  ---  Percentage Used Endurance Indicator
                                |||_ C monitored condition met
                                ||__ D supports DSN
                                |___ N normalized value

Pending Defects log (GP Log 0x0c)
No Defects Logged

SATA Phy Event Counters (GP Log 0x11)
ID      Size     Value  Description
0x0001  4            0  Command failed due to ICRC error
0x0003  4            0  R_ERR response for device-to-host data FIS
0x0004  4            0  R_ERR response for host-to-device data FIS
0x0006  4            0  R_ERR response for device-to-host non-data FIS
0x000a  4            6  Device-to-host register FISes sent due to a COMRESET
0x000b  4            0  CRC errors within host-to-device FIS
0x000d  4            0  Non-CRC errors within host-to-device FIS
