smartctl 6.6 2017-11-05 r4594 [x86_64-linux-4.19.10-VANILLA] (local build)
Copyright (C) 2002-17, Bruce Allen, Christian Franke, www.smartmontools.org

=== START OF INFORMATION SECTION ===
Device Model:     ST1000LM035-1RK172
Serial Number:    ZDE2QLXL
LU WWN Device Id: 5 000c50 0a3f878f0
Firmware Version: ACM1
User Capacity:    1,000,204,886,016 bytes [1.00 TB]
Sector Sizes:     512 bytes logical, 4096 bytes physical
Rotation Rate:    5400 rpm
Form Factor:      2.5 inches
Device is:        Not in smartctl database [for details use: -P showall]
ATA Version is:   ACS-3 T13/2161-D revision 3b
SATA Version is:  SATA 3.1, 6.0 Gb/s (current: 6.0 Gb/s)
Local Time is:    Tue Dec 18 12:50:51 2018 IST
SMART support is: Available - device has SMART capability.
SMART support is: Enabled
AAM feature is:   Unavailable
APM level is:     1 (minimum power consumption with standby)
Rd look-ahead is: Enabled
Write cache is:   Enabled
DSN feature is:   Unavailable
ATA Security is:  Disabled, NOT FROZEN [SEC1]
Wt Cache Reorder: Enabled

=== START OF READ SMART DATA SECTION ===
SMART overall-health self-assessment test result: PASSED

General SMART Values:
Offline data collection status:  (0x00)	Offline data collection activity
					was never started.
					Auto Offline Data Collection: Disabled.
Self-test execution status:      (   0)	The previous self-test routine completed
					without error or no self-test has ever 
					been run.
Total time to complete Offline 
data collection: 		(    0) seconds.
Offline data collection
capabilities: 			 (0x71) SMART execute Offline immediate.
					No Auto Offline data collection support.
					Suspend Offline collection upon new
					command.
					No Offline surface scan supported.
					Self-test supported.
					Conveyance Self-test supported.
					Selective Self-test supported.
SMART capabilities:            (0x0003)	Saves SMART data before entering
					power-saving mode.
					Supports SMART auto save timer.
Error logging capability:        (0x01)	Error logging supported.
					General Purpose Logging supported.
Short self-test routine 
recommended polling time: 	 (   1) minutes.
Extended self-test routine
recommended polling time: 	 ( 159) minutes.
Conveyance self-test routine
recommended polling time: 	 (   2) minutes.
SCT capabilities: 	       (0x3035)	SCT Status supported.
					SCT Feature Control supported.
					SCT Data Table supported.

SMART Attributes Data Structure revision number: 10
Vendor Specific SMART Attributes with Thresholds:
ID# ATTRIBUTE_NAME          FLAGS    VALUE WORST THRESH FAIL RAW_VALUE
  1 Raw_Read_Error_Rate     POSR--   077   064   006    -    46271891
  3 Spin_Up_Time            PO----   099   099   000    -    0
  4 Start_Stop_Count        -O--CK   095   095   020    -    5386
  5 Reallocated_Sector_Ct   PO--CK   100   100   036    -    0
  7 Seek_Error_Rate         POSR--   075   060   045    -    4328926440
  9 Power_On_Hours          -O--CK   098   098   000    -    2234 (105 2 0)
 10 Spin_Retry_Count        PO--C-   100   100   097    -    0
 12 Power_Cycle_Count       -O--CK   098   098   020    -    2222
184 End-to-End_Error        -O--CK   100   100   099    -    0
187 Reported_Uncorrect      -O--CK   100   100   000    -    0
188 Command_Timeout         -O--CK   100   099   000    -    27
189 High_Fly_Writes         -O-RCK   100   100   000    -    0
190 Airflow_Temperature_Cel -O---K   072   048   040    -    28 (Min/Max 25/29)
191 G-Sense_Error_Rate      -O--CK   100   100   000    -    61
192 Power-Off_Retract_Count -O--CK   100   100   000    -    106
193 Load_Cycle_Count        -O--CK   092   092   000    -    17555
194 Temperature_Celsius     -O---K   028   052   000    -    28 (0 19 0 0 0)
197 Current_Pending_Sector  -O--C-   100   100   000    -    0
198 Offline_Uncorrectable   ----C-   100   100   000    -    0
199 UDMA_CRC_Error_Count    -OSRCK   200   200   000    -    0
240 Head_Flying_Hours       ------   100   253   000    -    1462 (62 73 0)
241 Total_LBAs_Written      ------   100   253   000    -    7180016249
242 Total_LBAs_Read         ------   100   253   000    -    11179599897
254 Free_Fall_Sensor        -O--CK   100   100   000    -    0
                            ||||||_ K auto-keep
                            |||||__ C event count
                            ||||___ R error rate
                            |||____ S speed/performance
                            ||_____ O updated online
                            |______ P prefailure warning

General Purpose Log Directory Version 1
SMART           Log Directory Version 1 [multi-sector log support]
Address    Access  R/W   Size  Description
0x00       GPL,SL  R/O      1  Log Directory
0x01           SL  R/O      1  Summary SMART error log
0x02           SL  R/O      5  Comprehensive SMART error log
0x03       GPL     R/O      5  Ext. Comprehensive SMART error log
0x04       GPL,SL  R/O      8  Device Statistics log
0x06           SL  R/O      1  SMART self-test log
0x07       GPL     R/O      1  Extended self-test log
0x09           SL  R/W      1  Selective self-test log
0x10       GPL     R/O      1  NCQ Command Error log
0x11       GPL     R/O      1  SATA Phy Event Counters log
0x21       GPL     R/O      1  Write stream error log
0x22       GPL     R/O      1  Read stream error log
0x24       GPL     R/O    512  Current Device Internal Status Data log
0x30       GPL,SL  R/O      9  IDENTIFY DEVICE data log
0x80-0x9f  GPL,SL  R/W     16  Host vendor specific log
0xa1       GPL,SL  VS      24  Device vendor specific log
0xa2       GPL     VS    8160  Device vendor specific log
0xa8       GPL,SL  VS     136  Device vendor specific log
0xa9       GPL,SL  VS       1  Device vendor specific log
0xab       GPL     VS       1  Device vendor specific log
0xb0       GPL     VS    8920  Device vendor specific log
0xbe-0xbf  GPL     VS   65535  Device vendor specific log
0xc0       GPL,SL  VS       1  Device vendor specific log
0xc1       GPL,SL  VS      16  Device vendor specific log
0xc2       GPL,SL  VS     240  Device vendor specific log
0xc3       GPL,SL  VS       8  Device vendor specific log
0xc4       GPL,SL  VS      24  Device vendor specific log
0xc9       GPL,SL  VS       1  Device vendor specific log
0xca       GPL,SL  VS      16  Device vendor specific log
0xd3       GPL     VS    1920  Device vendor specific log
0xe0       GPL,SL  R/W      1  SCT Command/Status
0xe1       GPL,SL  R/W      1  SCT Data Transfer

SMART Extended Comprehensive Error Log Version: 1 (5 sectors)
No Errors Logged

SMART Extended Self-test Log Version: 1 (1 sectors)
Num  Test_Description    Status                  Remaining  LifeTime(hours)  LBA_of_first_error
# 1  Short offline       Completed without error       00%      2234         -

SMART Selective self-test log data structure revision number 1
 SPAN  MIN_LBA  MAX_LBA  CURRENT_TEST_STATUS
    1        0        0  Not_testing
    2        0        0  Not_testing
    3        0        0  Not_testing
    4        0        0  Not_testing
    5        0        0  Not_testing
Selective self-test flags (0x0):
  After scanning selected spans, do NOT read-scan remainder of disk.
If Selective self-test is pending on power-up, resume after 0 minute delay.

SCT Status Version:                  3
SCT Version (vendor specific):       522 (0x020a)
SCT Support Level:                   1
Device State:                        Active (0)
Current Temperature:                    29 Celsius
Power Cycle Min/Max Temperature:     25/29 Celsius
Lifetime    Min/Max Temperature:     19/52 Celsius
Lifetime    Average Temperature:        36 Celsius
Under/Over Temperature Limit Count:   0/0

SCT Temperature History Version:     2
Temperature Sampling Period:         1 minute
Temperature Logging Interval:        30 minutes
Min/Max recommended Temperature:     14/55 Celsius
Min/Max Temperature Limit:           10/60 Celsius
Temperature History Size (Index):    128 (114)

Index    Estimated Time   Temperature Celsius
 115    2018-12-15 21:00    25  ******
 116    2018-12-15 21:30     ?  -
 117    2018-12-15 22:00    24  *****
 118    2018-12-15 22:30     ?  -
 119    2018-12-15 23:00    23  ****
 120    2018-12-15 23:30     ?  -
 121    2018-12-16 00:00    24  *****
 122    2018-12-16 00:30     ?  -
 123    2018-12-16 01:00    25  ******
 124    2018-12-16 01:30     ?  -
 125    2018-12-16 02:00    23  ****
 126    2018-12-16 02:30     ?  -
 127    2018-12-16 03:00    24  *****
   0    2018-12-16 03:30     ?  -
   1    2018-12-16 04:00    26  *******
   2    2018-12-16 04:30     ?  -
   3    2018-12-16 05:00    23  ****
   4    2018-12-16 05:30     ?  -
   5    2018-12-16 06:00    24  *****
   6    2018-12-16 06:30     ?  -
   7    2018-12-16 07:00    24  *****
   8    2018-12-16 07:30     ?  -
   9    2018-12-16 08:00    24  *****
  10    2018-12-16 08:30     ?  -
  11    2018-12-16 09:00    23  ****
  12    2018-12-16 09:30     ?  -
  13    2018-12-16 10:00    33  **************
  14    2018-12-16 10:30     ?  -
  15    2018-12-16 11:00    24  *****
  16    2018-12-16 11:30     ?  -
  17    2018-12-16 12:00    24  *****
  18    2018-12-16 12:30     ?  -
  19    2018-12-16 13:00    28  *********
  20    2018-12-16 13:30     ?  -
  21    2018-12-16 14:00    26  *******
  22    2018-12-16 14:30    35  ****************
  23    2018-12-16 15:00     ?  -
  24    2018-12-16 15:30    23  ****
  25    2018-12-16 16:00     ?  -
  26    2018-12-16 16:30    29  **********
  27    2018-12-16 17:00     ?  -
  28    2018-12-16 17:30    29  **********
  29    2018-12-16 18:00     ?  -
  30    2018-12-16 18:30    29  **********
  31    2018-12-16 19:00     ?  -
  32    2018-12-16 19:30    25  ******
  33    2018-12-16 20:00     ?  -
  34    2018-12-16 20:30    27  ********
  35    2018-12-16 21:00     ?  -
  36    2018-12-16 21:30    30  ***********
  37    2018-12-16 22:00    41  **********************
  38    2018-12-16 22:30    39  ********************
  39    2018-12-16 23:00    38  *******************
  40    2018-12-16 23:30     ?  -
  41    2018-12-17 00:00    23  ****
  42    2018-12-17 00:30     ?  -
  43    2018-12-17 01:00    29  **********
  44    2018-12-17 01:30     ?  -
  45    2018-12-17 02:00    27  ********
  46    2018-12-17 02:30     ?  -
  47    2018-12-17 03:00    24  *****
  48    2018-12-17 03:30     ?  -
  49    2018-12-17 04:00    25  ******
  50    2018-12-17 04:30     ?  -
  51    2018-12-17 05:00    26  *******
  52    2018-12-17 05:30     ?  -
  53    2018-12-17 06:00    24  *****
  54    2018-12-17 06:30     ?  -
  55    2018-12-17 07:00    22  ***
  56    2018-12-17 07:30     ?  -
  57    2018-12-17 08:00    24  *****
  58    2018-12-17 08:30    36  *****************
  59    2018-12-17 09:00     ?  -
  60    2018-12-17 09:30    25  ******
  61    2018-12-17 10:00     ?  -
  62    2018-12-17 10:30    25  ******
  63    2018-12-17 11:00     ?  -
  64    2018-12-17 11:30    29  **********
  65    2018-12-17 12:00     ?  -
  66    2018-12-17 12:30    29  **********
  67    2018-12-17 13:00     ?  -
  68    2018-12-17 13:30    25  ******
  69    2018-12-17 14:00     ?  -
  70    2018-12-17 14:30    25  ******
  71    2018-12-17 15:00     ?  -
  72    2018-12-17 15:30    24  *****
  73    2018-12-17 16:00     ?  -
  74    2018-12-17 16:30    28  *********
  75    2018-12-17 17:00     ?  -
  76    2018-12-17 17:30    26  *******
  77    2018-12-17 18:00     ?  -
  78    2018-12-17 18:30    27  ********
  79    2018-12-17 19:00     ?  -
  80    2018-12-17 19:30    28  *********
  81    2018-12-17 20:00     ?  -
  82    2018-12-17 20:30    22  ***
  83    2018-12-17 21:00     ?  -
  84    2018-12-17 21:30    23  ****
  85    2018-12-17 22:00     ?  -
  86    2018-12-17 22:30    24  *****
  87    2018-12-17 23:00     ?  -
  88    2018-12-17 23:30    27  ********
  89    2018-12-18 00:00     ?  -
  90    2018-12-18 00:30    24  *****
  91    2018-12-18 01:00     ?  -
  92    2018-12-18 01:30    23  ****
  93    2018-12-18 02:00     ?  -
  94    2018-12-18 02:30    24  *****
  95    2018-12-18 03:00     ?  -
  96    2018-12-18 03:30    25  ******
  97    2018-12-18 04:00     ?  -
  98    2018-12-18 04:30    27  ********
  99    2018-12-18 05:00     ?  -
 100    2018-12-18 05:30    27  ********
 101    2018-12-18 06:00     ?  -
 102    2018-12-18 06:30    26  *******
 103    2018-12-18 07:00     ?  -
 104    2018-12-18 07:30    21  **
 105    2018-12-18 08:00     ?  -
 106    2018-12-18 08:30    23  ****
 107    2018-12-18 09:00     ?  -
 108    2018-12-18 09:30    23  ****
 109    2018-12-18 10:00     ?  -
 110    2018-12-18 10:30    24  *****
 111    2018-12-18 11:00     ?  -
 112    2018-12-18 11:30    24  *****
 113    2018-12-18 12:00     ?  -
 114    2018-12-18 12:30    25  ******

SCT Error Recovery Control command not supported

Device Statistics (GP Log 0x04)
Page  Offset Size        Value Flags Description
0x01  =====  =               =  ===  == General Statistics (rev 1) ==
0x01  0x008  4            2222  ---  Lifetime Power-On Resets
0x01  0x010  4            2234  ---  Power-on Hours
0x01  0x018  6      7197745641  ---  Logical Sectors Written
0x01  0x020  6        14566708  ---  Number of Write Commands
0x01  0x028  6     11184752434  ---  Logical Sectors Read
0x01  0x030  6        50117526  ---  Number of Read Commands
0x01  0x038  6               -  ---  Date and Time TimeStamp
0x03  =====  =               =  ===  == Rotating Media Statistics (rev 1) ==
0x03  0x008  4            1628  ---  Spindle Motor Power-on Hours
0x03  0x010  4            1247  ---  Head Flying Hours
0x03  0x018  4           17555  ---  Head Load Events
0x03  0x020  4               0  ---  Number of Reallocated Logical Sectors
0x03  0x028  4               0  ---  Read Recovery Attempts
0x03  0x030  4               0  ---  Number of Mechanical Start Failures
0x03  0x038  4               0  ---  Number of Realloc. Candidate Logical Sectors
0x04  =====  =               =  ===  == General Errors Statistics (rev 1) ==
0x04  0x008  4               1  ---  Number of Reported Uncorrectable Errors
0x04  0x010  4              27  ---  Resets Between Cmd Acceptance and Completion
                                |||_ C monitored condition met
                                ||__ D supports DSN
                                |___ N normalized value

Pending Defects log (GP Log 0x0c) not supported

SATA Phy Event Counters (GP Log 0x11)
ID      Size     Value  Description
0x000a  2            1  Device-to-host register FISes sent due to a COMRESET
0x0001  2            0  Command failed due to ICRC error
0x0003  2            0  R_ERR response for device-to-host data FIS
0x0004  2            0  R_ERR response for host-to-device data FIS
0x0006  2            0  R_ERR response for device-to-host non-data FIS
0x0007  2            0  R_ERR response for host-to-device non-data FIS

