smartctl 7.3 2022-02-28 r5338 [x86_64-linux-6.1.0-17-amd64] (local build)
Copyright (C) 2002-22, Bruce Allen, Christian Franke, www.smartmontools.org

=== START OF INFORMATION SECTION ===
Model Family:     Toshiba MG06ACA... Enterprise Capacity HDD
Device Model:     TOSHIBA MG06ACA800E
Firmware Version: 0109
User Capacity:    8.001.563.222.016 bytes [8,00 TB]
Sector Sizes:     512 bytes logical, 4096 bytes physical
Rotation Rate:    7200 rpm
Form Factor:      3.5 inches
Device is:        In smartctl database 7.3/5571
ATA Version is:   ACS-3 T13/2161-D revision 5
SATA Version is:  SATA 3.3, 6.0 Gb/s (current: 6.0 Gb/s)
Local Time is:    Mon Jan  8 21:08:05 2024 CET
SMART support is: Available - device has SMART capability.
SMART support is: Enabled
AAM feature is:   Unavailable
APM level is:     128 (minimum power consumption without standby)
Rd look-ahead is: Enabled
Write cache is:   Enabled
DSN feature is:   Unavailable
ATA Security is:  Disabled, NOT FROZEN [SEC1]
Wt Cache Reorder: Unknown

=== START OF READ SMART DATA SECTION ===
SMART Status not supported: Incomplete response, ATA output registers missing
SMART overall-health self-assessment test result: PASSED
Warning: This result is based on an Attribute check.

General SMART Values:
Offline data collection status:  (0x80)	Offline data collection activity
					was never started.
					Auto Offline Data Collection: Enabled.
Self-test execution status:      (   0)	The previous self-test routine completed
					without error or no self-test has ever 
					been run.
Total time to complete Offline 
data collection: 		(  120) seconds.
Offline data collection
capabilities: 			 (0x5b) SMART execute Offline immediate.
					Auto Offline data collection on/off support.
					Suspend Offline collection upon new
					command.
					Offline surface scan supported.
					Self-test supported.
					No Conveyance Self-test supported.
					Selective Self-test supported.
SMART capabilities:            (0x0003)	Saves SMART data before entering
					power-saving mode.
					Supports SMART auto save timer.
Error logging capability:        (0x01)	Error logging supported.
					General Purpose Logging supported.
Short self-test routine 
recommended polling time: 	 (   2) minutes.
Extended self-test routine
recommended polling time: 	 ( 834) minutes.
SCT capabilities: 	       (0x003d)	SCT Status supported.
					SCT Error Recovery Control supported.
					SCT Feature Control supported.
					SCT Data Table supported.

SMART Attributes Data Structure revision number: 16
Vendor Specific SMART Attributes with Thresholds:
ID# ATTRIBUTE_NAME          FLAGS    VALUE WORST THRESH FAIL RAW_VALUE
  1 Raw_Read_Error_Rate     PO-R--   100   100   050    -    0
  2 Throughput_Performance  P-S---   100   100   050    -    0
  3 Spin_Up_Time            POS--K   100   100   001    -    7873
  4 Start_Stop_Count        -O--CK   100   100   000    -    28
  5 Reallocated_Sector_Ct   PO--CK   100   100   010    -    0
  7 Seek_Error_Rate         PO-R--   100   100   050    -    0
  8 Seek_Time_Performance   P-S---   100   100   050    -    0
  9 Power_On_Hours          -O--CK   100   100   000    -    102
 10 Spin_Retry_Count        PO--CK   100   100   030    -    0
 12 Power_Cycle_Count       -O--CK   100   100   000    -    28
191 G-Sense_Error_Rate      -O--CK   100   100   000    -    0
192 Power-Off_Retract_Count -O--CK   100   100   000    -    27
193 Load_Cycle_Count        -O--CK   100   100   000    -    54
194 Temperature_Celsius     -O---K   100   100   000    -    27 (Min/Max 21/53)
196 Reallocated_Event_Count -O--CK   100   100   000    -    0
197 Current_Pending_Sector  -O--CK   100   100   000    -    0
198 Offline_Uncorrectable   ----CK   100   100   000    -    0
199 UDMA_CRC_Error_Count    -O--CK   200   200   000    -    0
220 Disk_Shift              -O----   100   100   000    -    168558625
222 Loaded_Hours            -O--CK   100   100   000    -    60
223 Load_Retry_Count        -O--CK   100   100   000    -    0
224 Load_Friction           -O---K   100   100   000    -    0
226 Load-in_Time            -OS--K   100   100   000    -    531
240 Head_Flying_Hours       P-----   100   100   001    -    0
                            ||||||_ K auto-keep
                            |||||__ C event count
                            ||||___ R error rate
                            |||____ S speed/performance
                            ||_____ O updated online
                            |______ P prefailure warning

General Purpose Log Directory Version 1
SMART           Log Directory Version 1 [multi-sector log support]
Address    Access  R/W   Size  Description
0x00       GPL,SL  R/O      1  Log Directory
0x01           SL  R/O      1  Summary SMART error log
0x02           SL  R/O     51  Comprehensive SMART error log
0x03       GPL     R/O      5  Ext. Comprehensive SMART error log
0x04       GPL,SL  R/O      8  Device Statistics log
0x06           SL  R/O      1  SMART self-test log
0x07       GPL     R/O      1  Extended self-test log
0x08       GPL     R/O      2  Power Conditions log
0x09           SL  R/W      1  Selective self-test log
0x0c       GPL     R/O    513  Pending Defects log
0x10       GPL     R/O      1  NCQ Command Error log
0x11       GPL     R/O      1  SATA Phy Event Counters log
0x24       GPL     R/O  49152  Current Device Internal Status Data log
0x25       GPL     R/O  49152  Saved Device Internal Status Data log
0x30       GPL,SL  R/O      9  IDENTIFY DEVICE data log
0x80-0x9f  GPL,SL  R/W     16  Host vendor specific log
0xe0       GPL,SL  R/W      1  SCT Command/Status
0xe1       GPL,SL  R/W      1  SCT Data Transfer

SMART Extended Comprehensive Error Log Version: 1 (5 sectors)
No Errors Logged

SMART Extended Self-test Log Version: 1 (1 sectors)
Num  Test_Description    Status                  Remaining  LifeTime(hours)  LBA_of_first_error
# 1  Short offline       Completed without error       00%       102         -

SMART Selective self-test log data structure revision number 1
 SPAN  MIN_LBA  MAX_LBA  CURRENT_TEST_STATUS
    1        0        0  Not_testing
    2        0        0  Not_testing
    3        0        0  Not_testing
    4        0        0  Not_testing
    5        0        0  Not_testing
Selective self-test flags (0x0):
  After scanning selected spans, do NOT read-scan remainder of disk.
If Selective self-test is pending on power-up, resume after 0 minute delay.

SCT Status Version:                  3
SCT Version (vendor specific):       1 (0x0001)
Device State:                        Active (0)
Current Temperature:                    27 Celsius
Power Cycle Min/Max Temperature:     23/27 Celsius
Lifetime    Min/Max Temperature:     21/53 Celsius
Specified Max Operating Temperature:    55 Celsius
Under/Over Temperature Limit Count:   0/0

SCT Temperature History Version:     2
Temperature Sampling Period:         1 minute
Temperature Logging Interval:        1 minute
Min/Max recommended Temperature:      5/55 Celsius
Min/Max Temperature Limit:           -40/70 Celsius
Temperature History Size (Index):    478 (356)

Index    Estimated Time   Temperature Celsius
 357    2024-01-08 13:11    34  ***************
 358    2024-01-08 13:12    34  ***************
 359    2024-01-08 13:13    34  ***************
 360    2024-01-08 13:14    35  ****************
 ...    ..(  2 skipped).    ..  ****************
 363    2024-01-08 13:17    35  ****************
 364    2024-01-08 13:18    36  *****************
 ...    ..(  3 skipped).    ..  *****************
 368    2024-01-08 13:22    36  *****************
 369    2024-01-08 13:23    37  ******************
 ...    ..(  6 skipped).    ..  ******************
 376    2024-01-08 13:30    37  ******************
 377    2024-01-08 13:31    38  *******************
 ...    ..(  2 skipped).    ..  *******************
 380    2024-01-08 13:34    38  *******************
 381    2024-01-08 13:35    39  ********************
 ...    ..(  4 skipped).    ..  ********************
 386    2024-01-08 13:40    39  ********************
 387    2024-01-08 13:41    40  *********************
 ...    ..(  4 skipped).    ..  *********************
 392    2024-01-08 13:46    40  *********************
 393    2024-01-08 13:47     ?  -
 394    2024-01-08 13:48    25  ******
 395    2024-01-08 13:49    25  ******
 396    2024-01-08 13:50    25  ******
 397    2024-01-08 13:51    26  *******
 398    2024-01-08 13:52    27  ********
 399    2024-01-08 13:53    28  *********
 400    2024-01-08 13:54    29  **********
 401    2024-01-08 13:55    30  ***********
 402    2024-01-08 13:56    30  ***********
 403    2024-01-08 13:57    31  ************
 404    2024-01-08 13:58    31  ************
 405    2024-01-08 13:59    32  *************
 406    2024-01-08 14:00    32  *************
 407    2024-01-08 14:01    33  **************
 408    2024-01-08 14:02    33  **************
 409    2024-01-08 14:03    34  ***************
 410    2024-01-08 14:04    34  ***************
 411    2024-01-08 14:05    35  ****************
 412    2024-01-08 14:06    35  ****************
 413    2024-01-08 14:07    36  *****************
 414    2024-01-08 14:08    36  *****************
 415    2024-01-08 14:09    37  ******************
 416    2024-01-08 14:10    37  ******************
 417    2024-01-08 14:11    37  ******************
 418    2024-01-08 14:12    38  *******************
 ...    ..(  2 skipped).    ..  *******************
 421    2024-01-08 14:15    38  *******************
 422    2024-01-08 14:16    39  ********************
 ...    ..(  3 skipped).    ..  ********************
 426    2024-01-08 14:20    39  ********************
 427    2024-01-08 14:21    40  *********************
 ...    ..(  3 skipped).    ..  *********************
 431    2024-01-08 14:25    40  *********************
 432    2024-01-08 14:26    41  **********************
 ...    ..(  8 skipped).    ..  **********************
 441    2024-01-08 14:35    41  **********************
 442    2024-01-08 14:36    42  ***********************
 ...    ..(  8 skipped).    ..  ***********************
 451    2024-01-08 14:45    42  ***********************
 452    2024-01-08 14:46     ?  -
 453    2024-01-08 14:47    24  *****
 454    2024-01-08 14:48    24  *****
 455    2024-01-08 14:49    25  ******
 456    2024-01-08 14:50    26  *******
 457    2024-01-08 14:51    26  *******
 458    2024-01-08 14:52    27  ********
 459    2024-01-08 14:53    28  *********
 460    2024-01-08 14:54    29  **********
 461    2024-01-08 14:55    29  **********
 462    2024-01-08 14:56    30  ***********
 463    2024-01-08 14:57    31  ************
 464    2024-01-08 14:58    31  ************
 465    2024-01-08 14:59    32  *************
 466    2024-01-08 15:00    32  *************
 467    2024-01-08 15:01    33  **************
 468    2024-01-08 15:02    33  **************
 469    2024-01-08 15:03    34  ***************
 470    2024-01-08 15:04    34  ***************
 471    2024-01-08 15:05    35  ****************
 472    2024-01-08 15:06    35  ****************
 473    2024-01-08 15:07    36  *****************
 474    2024-01-08 15:08    36  *****************
 475    2024-01-08 15:09    37  ******************
 476    2024-01-08 15:10    37  ******************
 477    2024-01-08 15:11    37  ******************
   0    2024-01-08 15:12    38  *******************
   1    2024-01-08 15:13    38  *******************
   2    2024-01-08 15:14    38  *******************
   3    2024-01-08 15:15    39  ********************
   4    2024-01-08 15:16    39  ********************
   5    2024-01-08 15:17    39  ********************
   6    2024-01-08 15:18    40  *********************
 ...    ..(  4 skipped).    ..  *********************
  11    2024-01-08 15:23    40  *********************
  12    2024-01-08 15:24    41  **********************
 ...    ..(  5 skipped).    ..  **********************
  18    2024-01-08 15:30    41  **********************
  19    2024-01-08 15:31    42  ***********************
 ...    ..( 31 skipped).    ..  ***********************
  51    2024-01-08 16:03    42  ***********************
  52    2024-01-08 16:04    43  ************************
 ...    ..( 79 skipped).    ..  ************************
 132    2024-01-08 17:24    43  ************************
 133    2024-01-08 17:25    44  *************************
 ...    ..(  6 skipped).    ..  *************************
 140    2024-01-08 17:32    44  *************************
 141    2024-01-08 17:33    45  **************************
 142    2024-01-08 17:34    45  **************************
 143    2024-01-08 17:35    44  *************************
 144    2024-01-08 17:36    45  **************************
 ...    ..( 15 skipped).    ..  **************************
 160    2024-01-08 17:52    45  **************************
 161    2024-01-08 17:53    44  *************************
 ...    ..( 37 skipped).    ..  *************************
 199    2024-01-08 18:31    44  *************************
 200    2024-01-08 18:32     ?  -
 201    2024-01-08 18:33    24  *****
 202    2024-01-08 18:34    24  *****
 203    2024-01-08 18:35    24  *****
 204    2024-01-08 18:36    25  ******
 205    2024-01-08 18:37    25  ******
 206    2024-01-08 18:38    26  *******
 207    2024-01-08 18:39    27  ********
 208    2024-01-08 18:40    28  *********
 209    2024-01-08 18:41    29  **********
 210    2024-01-08 18:42    29  **********
 211    2024-01-08 18:43    30  ***********
 212    2024-01-08 18:44    30  ***********
 213    2024-01-08 18:45    31  ************
 214    2024-01-08 18:46    31  ************
 215    2024-01-08 18:47    32  *************
 216    2024-01-08 18:48    32  *************
 217    2024-01-08 18:49    32  *************
 218    2024-01-08 18:50    33  **************
 219    2024-01-08 18:51    33  **************
 220    2024-01-08 18:52    33  **************
 221    2024-01-08 18:53    34  ***************
 222    2024-01-08 18:54    34  ***************
 223    2024-01-08 18:55    34  ***************
 224    2024-01-08 18:56    35  ****************
 ...    ..(  3 skipped).    ..  ****************
 228    2024-01-08 19:00    35  ****************
 229    2024-01-08 19:01    36  *****************
 ...    ..(  3 skipped).    ..  *****************
 233    2024-01-08 19:05    36  *****************
 234    2024-01-08 19:06    37  ******************
 ...    ..(  5 skipped).    ..  ******************
 240    2024-01-08 19:12    37  ******************
 241    2024-01-08 19:13    38  *******************
 ...    ..(  7 skipped).    ..  *******************
 249    2024-01-08 19:21    38  *******************
 250    2024-01-08 19:22    39  ********************
 ...    ..(  7 skipped).    ..  ********************
 258    2024-01-08 19:30    39  ********************
 259    2024-01-08 19:31    40  *********************
 ...    ..( 12 skipped).    ..  *********************
 272    2024-01-08 19:44    40  *********************
 273    2024-01-08 19:45    41  **********************
 ...    ..( 22 skipped).    ..  **********************
 296    2024-01-08 20:08    41  **********************
 297    2024-01-08 20:09    42  ***********************
 ...    ..( 47 skipped).    ..  ***********************
 345    2024-01-08 20:57    42  ***********************
 346    2024-01-08 20:58     ?  -
 347    2024-01-08 20:59    21  **
 348    2024-01-08 21:00    21  **
 349    2024-01-08 21:01     ?  -
 350    2024-01-08 21:02    23  ****
 351    2024-01-08 21:03    23  ****
 352    2024-01-08 21:04    24  *****
 353    2024-01-08 21:05    25  ******
 354    2024-01-08 21:06    26  *******
 355    2024-01-08 21:07    26  *******
 356    2024-01-08 21:08    27  ********

SMART WRITE LOG does not return COUNT and LBA_LOW register
SCT (Get) Error Recovery Control command failed

Device Statistics (GP Log 0x04)
Page  Offset Size        Value Flags Description
0x01  =====  =               =  ===  == General Statistics (rev 3) ==
0x01  0x008  4              28  ---  Lifetime Power-On Resets
0x01  0x010  4             102  ---  Power-on Hours
0x01  0x018  6      9428868808  ---  Logical Sectors Written
0x01  0x020  6         6077861  ---  Number of Write Commands
0x01  0x028  6     13530719630  ---  Logical Sectors Read
0x01  0x030  6         9115012  ---  Number of Read Commands
0x01  0x038  6       367200000  ---  Date and Time TimeStamp
0x02  =====  =               =  ===  == Free-Fall Statistics (rev 1) ==
0x02  0x010  4               0  ---  Overlimit Shock Events
0x03  =====  =               =  ===  == Rotating Media Statistics (rev 1) ==
0x03  0x008  4             102  ---  Spindle Motor Power-on Hours
0x03  0x010  4              60  ---  Head Flying Hours
0x03  0x018  4              54  ---  Head Load Events
0x03  0x020  4               0  ---  Number of Reallocated Logical Sectors
0x03  0x028  4               0  ---  Read Recovery Attempts
0x03  0x030  4               0  ---  Number of Mechanical Start Failures
0x03  0x038  4               0  ---  Number of Realloc. Candidate Logical Sectors
0x03  0x040  4              27  ---  Number of High Priority Unload Events
0x04  =====  =               =  ===  == General Errors Statistics (rev 1) ==
0x04  0x008  4               0  ---  Number of Reported Uncorrectable Errors
0x04  0x010  4               0  ---  Resets Between Cmd Acceptance and Completion
0x05  =====  =               =  ===  == Temperature Statistics (rev 1) ==
0x05  0x008  1              27  ---  Current Temperature
0x05  0x010  1              40  N--  Average Short Term Temperature
0x05  0x018  1               -  N--  Average Long Term Temperature
0x05  0x020  1              53  ---  Highest Temperature
0x05  0x028  1              21  ---  Lowest Temperature
0x05  0x030  1              46  N--  Highest Average Short Term Temperature
0x05  0x038  1              40  N--  Lowest Average Short Term Temperature
0x05  0x040  1               -  N--  Highest Average Long Term Temperature
0x05  0x048  1               -  N--  Lowest Average Long Term Temperature
0x05  0x050  4               0  ---  Time in Over-Temperature
0x05  0x058  1              55  ---  Specified Maximum Operating Temperature
0x05  0x060  4               0  ---  Time in Under-Temperature
0x05  0x068  1               5  ---  Specified Minimum Operating Temperature
0x06  =====  =               =  ===  == Transport Statistics (rev 1) ==
0x06  0x008  4               0  ---  Number of Hardware Resets
0x06  0x010  4               0  ---  Number of ASR Events
0x06  0x018  4               0  ---  Number of Interface CRC Errors
0x07  =====  =               =  ===  == Solid State Device Statistics (rev 1) ==
                                |||_ C monitored condition met
                                ||__ D supports DSN
                                |___ N normalized value

Pending Defects log (GP Log 0x0c)
No Defects Logged

SATA Phy Event Counters (GP Log 0x11)
ID      Size     Value  Description
0x0001  4            0  Command failed due to ICRC error
0x0002  4            0  R_ERR response for data FIS
0x0003  4            0  R_ERR response for device-to-host data FIS
0x0004  4            0  R_ERR response for host-to-device data FIS
0x0005  4            0  R_ERR response for non-data FIS
0x0006  4            0  R_ERR response for device-to-host non-data FIS
0x0007  4            0  R_ERR response for host-to-device non-data FIS
0x0008  4            0  Device-to-host non-data FIS retries
0x0009  4            0  Transition from drive PhyRdy to drive PhyNRdy
0x000a  4            0  Device-to-host register FISes sent due to a COMRESET
0x000b  4            0  CRC errors within host-to-device FIS
0x000d  4            0  Non-CRC errors within host-to-device FIS
0x000f  4            0  R_ERR response for host-to-device data FIS, CRC
0x0010  4            0  R_ERR response for host-to-device data FIS, non-CRC
0x0012  4            0  R_ERR response for host-to-device non-data FIS, CRC
0x0013  4            0  R_ERR response for host-to-device non-data FIS, non-CRC

