smartctl 7.4 2023-08-01 r5530 [FreeBSD 14.0-RELEASE-p3 amd64] (local build)
Copyright (C) 2002-23, Bruce Allen, Christian Franke, www.smartmontools.org

=== START OF INFORMATION SECTION ===
Model Family:     Toshiba MG08-Series Enterprise Capacity HDD (Air/CMR)
Device Model:     TOSHIBA MG08ADA800E
Firmware Version: 4304
User Capacity:    8,001,563,222,016 bytes [8.00 TB]
Sector Sizes:     512 bytes logical, 4096 bytes physical
Rotation Rate:    7200 rpm
Form Factor:      3.5 inches
Device is:        In smartctl database 7.3/5571
ATA Version is:   ACS-3 T13/2161-D revision 5
SATA Version is:  SATA 3.3, 6.0 Gb/s (current: 6.0 Gb/s)
Local Time is:    Mon Jan  8 20:20:24 2024 CET
SMART support is: Available - device has SMART capability.
SMART support is: Enabled
AAM feature is:   Unavailable
APM level is:     128 (minimum power consumption without standby)
Rd look-ahead is: Enabled
Write cache is:   Enabled
DSN feature is:   Unavailable
ATA Security is:  Disabled, frozen [SEC2]
Wt Cache Reorder: Enabled

=== START OF READ SMART DATA SECTION ===
SMART overall-health self-assessment test result: PASSED

General SMART Values:
Offline data collection status:  (0x80)	Offline data collection activity
					was never started.
					Auto Offline Data Collection: Enabled.
Self-test execution status:      ( 243)	Self-test routine in progress...
					30% of test remaining.
Total time to complete Offline 
data collection: 		(  120) seconds.
Offline data collection
capabilities: 			 (0x5b) SMART execute Offline immediate.
					Auto Offline data collection on/off support.
					Suspend Offline collection upon new
					command.
					Offline surface scan supported.
					Self-test supported.
					No Conveyance Self-test supported.
					Selective Self-test supported.
SMART capabilities:            (0x0003)	Saves SMART data before entering
					power-saving mode.
					Supports SMART auto save timer.
Error logging capability:        (0x01)	Error logging supported.
					General Purpose Logging supported.
Short self-test routine 
recommended polling time: 	 (   2) minutes.
Extended self-test routine
recommended polling time: 	 ( 677) minutes.
SCT capabilities: 	       (0x003d)	SCT Status supported.
					SCT Error Recovery Control supported.
					SCT Feature Control supported.
					SCT Data Table supported.

SMART Attributes Data Structure revision number: 16
Vendor Specific SMART Attributes with Thresholds:
ID# ATTRIBUTE_NAME          FLAGS    VALUE WORST THRESH FAIL RAW_VALUE
  1 Raw_Read_Error_Rate     PO-R--   100   100   050    -    0
  2 Throughput_Performance  P-S---   100   100   050    -    0
  3 Spin_Up_Time            POS--K   100   100   001    -    11952
  4 Start_Stop_Count        -O--CK   100   100   000    -    3
  5 Reallocated_Sector_Ct   PO--CK   100   100   010    -    0
  7 Seek_Error_Rate         PO-R--   100   100   050    -    0
  8 Seek_Time_Performance   P-S---   100   100   050    -    0
  9 Power_On_Hours          -O--CK   100   100   000    -    56
 10 Spin_Retry_Count        PO--CK   100   100   030    -    0
 12 Power_Cycle_Count       -O--CK   100   100   000    -    3
191 G-Sense_Error_Rate      -O--CK   100   100   000    -    0
192 Power-Off_Retract_Count -O--CK   100   100   000    -    0
193 Load_Cycle_Count        -O--CK   100   100   000    -    14
194 Temperature_Celsius     -O---K   100   100   000    -    42 (Min/Max 21/44)
196 Reallocated_Event_Count -O--CK   100   100   000    -    0
197 Current_Pending_Sector  -O--CK   100   100   000    -    0
198 Offline_Uncorrectable   ----CK   100   100   000    -    0
199 UDMA_CRC_Error_Count    -O--CK   200   200   000    -    0
220 Disk_Shift              -O----   100   100   000    -    51380226
222 Loaded_Hours            -O--CK   100   100   000    -    41
223 Load_Retry_Count        -O--CK   100   100   000    -    0
224 Load_Friction           -O---K   100   100   000    -    0
226 Load-in_Time            -OS--K   100   100   000    -    509
240 Head_Flying_Hours       P-----   100   100   001    -    0
                            ||||||_ K auto-keep
                            |||||__ C event count
                            ||||___ R error rate
                            |||____ S speed/performance
                            ||_____ O updated online
                            |______ P prefailure warning

General Purpose Log Directory Version 1
SMART           Log Directory Version 1 [multi-sector log support]
Address    Access  R/W   Size  Description
0x00       GPL,SL  R/O      1  Log Directory
0x01           SL  R/O      1  Summary SMART error log
0x02           SL  R/O     51  Comprehensive SMART error log
0x03       GPL     R/O      5  Ext. Comprehensive SMART error log
0x04       GPL,SL  R/O      8  Device Statistics log
0x06           SL  R/O      1  SMART self-test log
0x07       GPL     R/O      1  Extended self-test log
0x08       GPL     R/O      2  Power Conditions log
0x09           SL  R/W      1  Selective self-test log
0x0c       GPL     R/O    513  Pending Defects log
0x10       GPL     R/O      1  NCQ Command Error log
0x11       GPL     R/O      1  SATA Phy Event Counters log
0x24       GPL     R/O  53248  Current Device Internal Status Data log
0x25       GPL     R/O  53248  Saved Device Internal Status Data log
0x30       GPL,SL  R/O      9  IDENTIFY DEVICE data log
0x80-0x9f  GPL,SL  R/W     16  Host vendor specific log
0xae       GPL     VS      25  Device vendor specific log
0xe0       GPL,SL  R/W      1  SCT Command/Status
0xe1       GPL,SL  R/W      1  SCT Data Transfer

SMART Extended Comprehensive Error Log Version: 1 (5 sectors)
No Errors Logged

SMART Extended Self-test Log Version: 1 (1 sectors)
No self-tests have been logged.  [To run self-tests, use: smartctl -t]

SMART Selective self-test log data structure revision number 1
 SPAN  MIN_LBA  MAX_LBA  CURRENT_TEST_STATUS
    1        0        0  Not_testing
    2        0        0  Not_testing
    3        0        0  Not_testing
    4        0        0  Not_testing
    5        0        0  Not_testing
Selective self-test flags (0x0):
  After scanning selected spans, do NOT read-scan remainder of disk.
If Selective self-test is pending on power-up, resume after 0 minute delay.

SCT Status Version:                  3
SCT Version (vendor specific):       1 (0x0001)
Device State:                        DST executing in background (3)
Current Temperature:                    42 Celsius
Power Cycle Min/Max Temperature:     35/44 Celsius
Lifetime    Min/Max Temperature:     21/44 Celsius
Specified Max Operating Temperature:    55 Celsius
Under/Over Temperature Limit Count:   0/0
Vendor specific:
00 00 02 00 00 00 00 00 00 00 00 00 00 00 00 00
00 00 00 00 00 00 00 00 00 00 00 00 00 00 00 00

SCT Temperature History Version:     2
Temperature Sampling Period:         1 minute
Temperature Logging Interval:        1 minute
Min/Max recommended Temperature:      5/55 Celsius
Min/Max Temperature Limit:           -40/70 Celsius
Temperature History Size (Index):    478 (53)

Index    Estimated Time   Temperature Celsius
  54    2024-01-08 12:23    42  ***********************
 ...    ..(159 skipped).    ..  ***********************
 214    2024-01-08 15:03    42  ***********************
 215    2024-01-08 15:04    43  ************************
 ...    ..( 68 skipped).    ..  ************************
 284    2024-01-08 16:13    43  ************************
 285    2024-01-08 16:14    42  ***********************
 286    2024-01-08 16:15    43  ************************
 287    2024-01-08 16:16    42  ***********************
 ...    ..(  4 skipped).    ..  ***********************
 292    2024-01-08 16:21    42  ***********************
 293    2024-01-08 16:22    43  ************************
 294    2024-01-08 16:23    42  ***********************
 ...    ..( 22 skipped).    ..  ***********************
 317    2024-01-08 16:46    42  ***********************
 318    2024-01-08 16:47    43  ************************
 319    2024-01-08 16:48    42  ***********************
 320    2024-01-08 16:49    42  ***********************
 321    2024-01-08 16:50    43  ************************
 322    2024-01-08 16:51    42  ***********************
 323    2024-01-08 16:52    43  ************************
 324    2024-01-08 16:53    43  ************************
 325    2024-01-08 16:54    42  ***********************
 326    2024-01-08 16:55    43  ************************
 ...    ..( 11 skipped).    ..  ************************
 338    2024-01-08 17:07    43  ************************
 339    2024-01-08 17:08    42  ***********************
 ...    ..(  3 skipped).    ..  ***********************
 343    2024-01-08 17:12    42  ***********************
 344    2024-01-08 17:13    43  ************************
 ...    ..(  7 skipped).    ..  ************************
 352    2024-01-08 17:21    43  ************************
 353    2024-01-08 17:22    42  ***********************
 354    2024-01-08 17:23    43  ************************
 ...    ..(  5 skipped).    ..  ************************
 360    2024-01-08 17:29    43  ************************
 361    2024-01-08 17:30    42  ***********************
 ...    ..( 31 skipped).    ..  ***********************
 393    2024-01-08 18:02    42  ***********************
 394    2024-01-08 18:03    43  ************************
 395    2024-01-08 18:04    42  ***********************
 396    2024-01-08 18:05    43  ************************
 ...    ..(  4 skipped).    ..  ************************
 401    2024-01-08 18:10    43  ************************
 402    2024-01-08 18:11    42  ***********************
 403    2024-01-08 18:12    43  ************************
 404    2024-01-08 18:13    43  ************************
 405    2024-01-08 18:14    43  ************************
 406    2024-01-08 18:15    42  ***********************
 407    2024-01-08 18:16    43  ************************
 408    2024-01-08 18:17    42  ***********************
 409    2024-01-08 18:18    43  ************************
 410    2024-01-08 18:19    43  ************************
 411    2024-01-08 18:20    42  ***********************
 412    2024-01-08 18:21    43  ************************
 413    2024-01-08 18:22    43  ************************
 414    2024-01-08 18:23    42  ***********************
 415    2024-01-08 18:24    43  ************************
 416    2024-01-08 18:25    42  ***********************
 ...    ..( 16 skipped).    ..  ***********************
 433    2024-01-08 18:42    42  ***********************
 434    2024-01-08 18:43    43  ************************
 435    2024-01-08 18:44    42  ***********************
 ...    ..(  5 skipped).    ..  ***********************
 441    2024-01-08 18:50    42  ***********************
 442    2024-01-08 18:51    43  ************************
 443    2024-01-08 18:52    42  ***********************
 444    2024-01-08 18:53    42  ***********************
 445    2024-01-08 18:54    42  ***********************
 446    2024-01-08 18:55    43  ************************
 447    2024-01-08 18:56    43  ************************
 448    2024-01-08 18:57    42  ***********************
 449    2024-01-08 18:58    43  ************************
 ...    ..( 11 skipped).    ..  ************************
 461    2024-01-08 19:10    43  ************************
 462    2024-01-08 19:11    42  ***********************
 ...    ..( 11 skipped).    ..  ***********************
 474    2024-01-08 19:23    42  ***********************
 475    2024-01-08 19:24    43  ************************
 476    2024-01-08 19:25    42  ***********************
 477    2024-01-08 19:26    43  ************************
   0    2024-01-08 19:27    43  ************************
   1    2024-01-08 19:28    43  ************************
   2    2024-01-08 19:29    42  ***********************
   3    2024-01-08 19:30    43  ************************
 ...    ..(  7 skipped).    ..  ************************
  11    2024-01-08 19:38    43  ************************
  12    2024-01-08 19:39    42  ***********************
  13    2024-01-08 19:40    43  ************************
  14    2024-01-08 19:41    43  ************************
  15    2024-01-08 19:42    42  ***********************
  16    2024-01-08 19:43    43  ************************
 ...    ..(  2 skipped).    ..  ************************
  19    2024-01-08 19:46    43  ************************
  20    2024-01-08 19:47    42  ***********************
  21    2024-01-08 19:48    42  ***********************
  22    2024-01-08 19:49    43  ************************
 ...    ..(  2 skipped).    ..  ************************
  25    2024-01-08 19:52    43  ************************
  26    2024-01-08 19:53    42  ***********************
  27    2024-01-08 19:54    42  ***********************
  28    2024-01-08 19:55    43  ************************
  29    2024-01-08 19:56    42  ***********************
 ...    ..(  3 skipped).    ..  ***********************
  33    2024-01-08 20:00    42  ***********************
  34    2024-01-08 20:01    43  ************************
  35    2024-01-08 20:02    42  ***********************
  36    2024-01-08 20:03    43  ************************
  37    2024-01-08 20:04    43  ************************
  38    2024-01-08 20:05    42  ***********************
  39    2024-01-08 20:06    43  ************************
  40    2024-01-08 20:07    42  ***********************
 ...    ..( 12 skipped).    ..  ***********************
  53    2024-01-08 20:20    42  ***********************

SCT Error Recovery Control:
           Read: Disabled
          Write: Disabled

Device Statistics (GP Log 0x04)
Page  Offset Size        Value Flags Description
0x01  =====  =               =  ===  == General Statistics (rev 3) ==
0x01  0x008  4               3  ---  Lifetime Power-On Resets
0x01  0x010  4              56  ---  Power-on Hours
0x01  0x018  6      7704464363  ---  Logical Sectors Written
0x01  0x020  6        19589442  ---  Number of Write Commands
0x01  0x028  6     15503790698  ---  Logical Sectors Read
0x01  0x030  6        48911203  ---  Number of Read Commands
0x01  0x038  6       201600000  ---  Date and Time TimeStamp
0x02  =====  =               =  ===  == Free-Fall Statistics (rev 1) ==
0x02  0x010  4               0  ---  Overlimit Shock Events
0x03  =====  =               =  ===  == Rotating Media Statistics (rev 1) ==
0x03  0x008  4              56  ---  Spindle Motor Power-on Hours
0x03  0x010  4              41  ---  Head Flying Hours
0x03  0x018  4              14  ---  Head Load Events
0x03  0x020  4               0  ---  Number of Reallocated Logical Sectors
0x03  0x028  4               0  ---  Read Recovery Attempts
0x03  0x030  4               0  ---  Number of Mechanical Start Failures
0x03  0x038  4               0  ---  Number of Realloc. Candidate Logical Sectors
0x03  0x040  4               0  ---  Number of High Priority Unload Events
0x04  =====  =               =  ===  == General Errors Statistics (rev 1) ==
0x04  0x008  4               0  ---  Number of Reported Uncorrectable Errors
0x04  0x010  4               0  ---  Resets Between Cmd Acceptance and Completion
0x05  =====  =               =  ===  == Temperature Statistics (rev 1) ==
0x05  0x008  1              42  ---  Current Temperature
0x05  0x010  1              39  N--  Average Short Term Temperature
0x05  0x018  1               -  N--  Average Long Term Temperature
0x05  0x020  1              44  ---  Highest Temperature
0x05  0x028  1              21  ---  Lowest Temperature
0x05  0x030  1              40  N--  Highest Average Short Term Temperature
0x05  0x038  1              39  N--  Lowest Average Short Term Temperature
0x05  0x040  1               -  N--  Highest Average Long Term Temperature
0x05  0x048  1               -  N--  Lowest Average Long Term Temperature
0x05  0x050  4               0  ---  Time in Over-Temperature
0x05  0x058  1              55  ---  Specified Maximum Operating Temperature
0x05  0x060  4               0  ---  Time in Under-Temperature
0x05  0x068  1               5  ---  Specified Minimum Operating Temperature
0x06  =====  =               =  ===  == Transport Statistics (rev 1) ==
0x06  0x008  4               6  ---  Number of Hardware Resets
0x06  0x010  4               3  ---  Number of ASR Events
0x06  0x018  4               0  ---  Number of Interface CRC Errors
0x07  =====  =               =  ===  == Solid State Device Statistics (rev 1) ==
                                |||_ C monitored condition met
                                ||__ D supports DSN
                                |___ N normalized value

Pending Defects log (GP Log 0x0c)
No Defects Logged

SATA Phy Event Counters (GP Log 0x11)
ID      Size     Value  Description
0x0001  4            0  Command failed due to ICRC error
0x0002  4            0  R_ERR response for data FIS
0x0003  4            0  R_ERR response for device-to-host data FIS
0x0004  4            0  R_ERR response for host-to-device data FIS
0x0005  4            0  R_ERR response for non-data FIS
0x0006  4            0  R_ERR response for device-to-host non-data FIS
0x0007  4            0  R_ERR response for host-to-device non-data FIS
0x0008  4            0  Device-to-host non-data FIS retries
0x0009  4            2  Transition from drive PhyRdy to drive PhyNRdy
0x000a  4            2  Device-to-host register FISes sent due to a COMRESET
0x000b  4            0  CRC errors within host-to-device FIS
0x000d  4            0  Non-CRC errors within host-to-device FIS
0x000f  4            0  R_ERR response for host-to-device data FIS, CRC
0x0010  4            0  R_ERR response for host-to-device data FIS, non-CRC
0x0012  4            0  R_ERR response for host-to-device non-data FIS, CRC
0x0013  4            0  R_ERR response for host-to-device non-data FIS, non-CRC

