smartctl 7.3 2022-02-28 r5338 [x86_64-w64-mingw32-w11-21H2] (sf-7.3-1)
Copyright (C) 2002-22, Bruce Allen, Christian Franke, www.smartmontools.org

=== START OF INFORMATION SECTION ===
Device Model:     ASMT109x- Fast
Serial Number:    S34SJ9FGC00697
LU WWN Device Id: 5 0004cf 2116c59ba
Firmware Version: 402220F0
User Capacity:    4,000,797,859,840 bytes [4.00 TB]
Sector Sizes:     512 bytes logical, 4096 bytes physical
Rotation Rate:    5400 rpm
Form Factor:      2.5 inches
Device is:        Not in smartctl database 7.3/5319
ATA Version is:   ATA8-ACS T13/1699-D revision 6
SATA Version is:  SATA 3.0, 6.0 Gb/s (current: 3.0 Gb/s)
Local Time is:    Fri Apr 01 20:27:21 2022 EDT
SMART support is: Available - device has SMART capability.
SMART support is: Enabled
AAM feature is:   Disabled
APM feature is:   Disabled
Rd look-ahead is: Enabled
Write cache is:   Enabled
DSN feature is:   Unavailable
ATA Security is:  Disabled, NOT FROZEN [SEC1]
Wt Cache Reorder: Enabled

=== START OF READ SMART DATA SECTION ===
SMART overall-health self-assessment test result: PASSED

General SMART Values:
Offline data collection status:  (0x00)	Offline data collection activity
					was never started.
					Auto Offline Data Collection: Disabled.
Self-test execution status:      (   0)	The previous self-test routine completed
					without error or no self-test has ever 
					been run.
Total time to complete Offline 
data collection: 		(22320) seconds.
Offline data collection
capabilities: 			 (0x5b) SMART execute Offline immediate.
					Auto Offline data collection on/off support.
					Suspend Offline collection upon new
					command.
					Offline surface scan supported.
					Self-test supported.
					No Conveyance Self-test supported.
					Selective Self-test supported.
SMART capabilities:            (0x0003)	Saves SMART data before entering
					power-saving mode.
					Supports SMART auto save timer.
Error logging capability:        (0x01)	Error logging supported.
					General Purpose Logging supported.
Short self-test routine 
recommended polling time: 	 (   1) minutes.
Extended self-test routine
recommended polling time: 	 ( 372) minutes.
SCT capabilities: 	       (0x003f)	SCT Status supported.
					SCT Error Recovery Control supported.
					SCT Feature Control supported.
					SCT Data Table supported.

SMART Attributes Data Structure revision number: 16
Vendor Specific SMART Attributes with Thresholds:
ID# ATTRIBUTE_NAME          FLAGS    VALUE WORST THRESH FAIL RAW_VALUE
  1 Raw_Read_Error_Rate     POSR-K   100   100   051    -    0
  2 Throughput_Performance  -OS--K   252   252   000    -    0
  3 Spin_Up_Time            PO---K   087   083   025    -    4083
  4 Start_Stop_Count        -O--CK   033   033   000    -    67762
  5 Reallocated_Sector_Ct   PO--CK   252   252   010    -    0
  7 Seek_Error_Rate         -OSR-K   252   252   051    -    0
  8 Seek_Time_Performance   --S--K   252   252   015    -    0
  9 Power_On_Hours          -O--CK   100   100   000    -    3396
 10 Spin_Retry_Count        -O--CK   252   252   051    -    0
 12 Power_Cycle_Count       -O--CK   100   100   000    -    234
191 G-Sense_Error_Rate      -O---K   252   252   000    -    0
192 Power-Off_Retract_Count -O---K   252   252   000    -    0
194 Temperature_Celsius     -O----   064   045   000    -    29 (Min/Max 16/70)
195 Hardware_ECC_Recovered  -O-RCK   100   100   000    -    0
196 Reallocated_Event_Count -O--CK   252   252   000    -    0
197 Current_Pending_Sector  -O--CK   252   252   000    -    0
198 Offline_Uncorrectable   ----CK   252   252   000    -    0
199 UDMA_CRC_Error_Count    -OS-CK   200   200   000    -    0
200 Multi_Zone_Error_Rate   -O-R-K   100   100   000    -    4
223 Load_Retry_Count        -O--CK   100   100   000    -    12
225 Load_Cycle_Count        -O--CK   088   088   000    -    125659
241 Total_LBAs_Written      -O--CK   097   090   000    -    4650233
242 Total_LBAs_Read         -O--CK   091   090   000    -    12700056
                            ||||||_ K auto-keep
                            |||||__ C event count
                            ||||___ R error rate
                            |||____ S speed/performance
                            ||_____ O updated online
                            |______ P prefailure warning

ATA_READ_LOG_EXT (addr=0x00:0x00, page=0, n=1) failed: scsi error aborted command
Read GP Log Directory failed

SMART Log Directory Version 1 [multi-sector log support]
Address    Access  R/W   Size  Description
0x00           SL  R/O      1  Log Directory
0x01           SL  R/O      1  Summary SMART error log
0x02           SL  R/O      2  Comprehensive SMART error log
0x06           SL  R/O      1  SMART self-test log
0x09           SL  R/W      1  Selective self-test log
0x80-0x9f      SL  R/W     16  Host vendor specific log
0xc0-0xdf      SL  VS      16  Device vendor specific log
0xe0           SL  R/W      1  SCT Command/Status
0xe1           SL  R/W      1  SCT Data Transfer

SMART Extended Comprehensive Error Log (GP Log 0x03) not supported

Read SMART Error Log failed: SAT command failed

SMART Extended Self-test Log (GP Log 0x07) not supported

SMART Self-test log structure revision number 1
Num  Test_Description    Status                  Remaining  LifeTime(hours)  LBA_of_first_error
# 1  Short offline       Completed without error       00%      3396         -

SMART Selective self-test log data structure revision number 0
Note: revision number not 1 implies that no selective self-test has ever been run
 SPAN  MIN_LBA  MAX_LBA  CURRENT_TEST_STATUS
    1        0        0  Completed [00% left] (0-65535)
    2        0        0  Not_testing
    3        0        0  Not_testing
    4        0        0  Not_testing
    5        0        0  Not_testing
Selective self-test flags (0x0):
  After scanning selected spans, do NOT read-scan remainder of disk.
If Selective self-test is pending on power-up, resume after 0 minute delay.

SCT Status Version:                  2
SCT Version (vendor specific):       256 (0x0100)
Device State:                        Active (0)
Current Temperature:                    31 Celsius
Power Cycle Min/Max Temperature:     25/31 Celsius
Lifetime    Min/Max Temperature:     19/70 Celsius
Specified Max Operating Temperature:    80 Celsius
Under/Over Temperature Limit Count:   0/0

SCT Temperature History Version:     2
Temperature Sampling Period:         5 minutes
Temperature Logging Interval:        5 minutes
Min/Max recommended Temperature:     -5/80 Celsius
Min/Max Temperature Limit:           -10/85 Celsius
Temperature History Size (Index):    128 (100)

Index    Estimated Time   Temperature Celsius
 101    2022-04-01 09:50    31  ************
 102    2022-04-01 09:55    38  *******************
 ...    ..(  6 skipped).    ..  *******************
 109    2022-04-01 10:30    38  *******************
 110    2022-04-01 10:35    39  ********************
 111    2022-04-01 10:40    38  *******************
 ...    ..(  6 skipped).    ..  *******************
 118    2022-04-01 11:15    38  *******************
 119    2022-04-01 11:20    37  ******************
 ...    ..(  7 skipped).    ..  ******************
 127    2022-04-01 12:00    37  ******************
   0    2022-04-01 12:05    38  *******************
 ...    ..( 48 skipped).    ..  *******************
  49    2022-04-01 16:10    38  *******************
  50    2022-04-01 16:15    33  **************
  51    2022-04-01 16:20    34  ***************
  52    2022-04-01 16:25    36  *****************
  53    2022-04-01 16:30    36  *****************
  54    2022-04-01 16:35    37  ******************
  55    2022-04-01 16:40    37  ******************
  56    2022-04-01 16:45    37  ******************
  57    2022-04-01 16:50    38  *******************
 ...    ..(  5 skipped).    ..  *******************
  63    2022-04-01 17:20    38  *******************
  64    2022-04-01 17:25    39  ********************
  65    2022-04-01 17:30    38  *******************
  66    2022-04-01 17:35    38  *******************
  67    2022-04-01 17:40    39  ********************
 ...    ..( 28 skipped).    ..  ********************
  96    2022-04-01 20:05    39  ********************
  97    2022-04-01 20:10    32  *************
  98    2022-04-01 20:15    35  ****************
  99    2022-04-01 20:20    38  *******************
 100    2022-04-01 20:25    39  ********************

Write SCT (Get) Error Recovery Control Command failed: scsi error aborted command
SCT (Get) Error Recovery Control command failed

Device Statistics (GP/SMART Log 0x04) not supported

Pending Defects log (GP Log 0x0c) not supported

SATA Phy Event Counters (GP Log 0x11) not supported

