smartctl pre-7.5 2024-05-08 r5613 [x86_64-w64-mingw32-w10-22H2] (CircleCI)
Copyright (C) 2002-24, Bruce Allen, Christian Franke, www.smartmontools.org

=== START OF INFORMATION SECTION ===
Device Model:     HUH721212ALE601
Firmware Version: LEGL0002
User Capacity:    12,000,138,625,024 bytes [12.0 TB]
Sector Sizes:     512 bytes logical, 4096 bytes physical
Rotation Rate:    7200 rpm
Form Factor:      3.5 inches
Device is:        Not in smartctl database 7.3/5610
ATA Version is:   ACS-2, ATA8-ACS T13/1699-D revision 4
SATA Version is:  SATA 3.2, 6.0 Gb/s (current: 6.0 Gb/s)
Local Time is:    Wed Aug 21 01:40:43 2024 GMTST
SMART support is: Available - device has SMART capability.
SMART support is: Enabled
AAM feature is:   Unavailable
APM feature is:   Disabled
Rd look-ahead is: Enabled
Write cache is:   Enabled
DSN feature is:   Unavailable
ATA Security is:  Disabled, NOT FROZEN [SEC1], Master PW ID: 0xfffd
Wt Cache Reorder: Enabled

=== START OF READ SMART DATA SECTION ===
SMART overall-health self-assessment test result: PASSED

General SMART Values:
Offline data collection status:  (0x80)	Offline data collection activity
					was never started.
					Auto Offline Data Collection: Enabled.
Self-test execution status:      (   0)	The previous self-test routine completed
					without error or no self-test has ever 
					been run.
Total time to complete Offline 
data collection: 		(   87) seconds.
Offline data collection
capabilities: 			 (0x5b) SMART execute Offline immediate.
					Auto Offline data collection on/off support.
					Suspend Offline collection upon new
					command.
					Offline surface scan supported.
					Self-test supported.
					No Conveyance Self-test supported.
					Selective Self-test supported.
SMART capabilities:            (0x0003)	Saves SMART data before entering
					power-saving mode.
					Supports SMART auto save timer.
Error logging capability:        (0x01)	Error logging supported.
					General Purpose Logging supported.
Short self-test routine 
recommended polling time: 	 (   1) minutes.
Extended self-test routine
recommended polling time: 	 (   1) minutes.
SCT capabilities: 	       (0x003d)	SCT Status supported.
					SCT Error Recovery Control supported.
					SCT Feature Control supported.
					SCT Data Table supported.

SMART Attributes Data Structure revision number: 16
Vendor Specific SMART Attributes with Thresholds:
ID# ATTRIBUTE_NAME          FLAGS    VALUE WORST THRESH FAIL RAW_VALUE
  1 Raw_Read_Error_Rate     PO-R--   100   100   016    -    0
  2 Throughput_Performance  P-S---   133   133   054    -    93
  3 Spin_Up_Time            POS---   157   157   024    -    418 (Average 417)
  4 Start_Stop_Count        -O--C-   100   100   000    -    788
  5 Reallocated_Sector_Ct   PO--CK   100   100   005    -    0
  7 Seek_Error_Rate         PO-R--   100   100   067    -    0
  8 Seek_Time_Performance   P-S---   140   140   020    -    15
  9 Power_On_Hours          -O--C-   097   097   000    -    27887
 10 Spin_Retry_Count        PO--C-   100   100   060    -    0
 12 Power_Cycle_Count       -O--CK   100   100   000    -    81
 22 Helium_Level            PO---K   100   100   025    -    100
 45 Unknown_Attribute       PO---K   100   100   001    -    1095233372415
192 Power-Off_Retract_Count -O--CK   100   100   000    -    1198
193 Load_Cycle_Count        -O--C-   100   100   000    -    1198
194 Temperature_Celsius     -O----   200   200   000    -    30 (Min/Max 22/57)
196 Reallocated_Event_Count -O--CK   100   100   000    -    0
197 Current_Pending_Sector  -O---K   100   100   000    -    0
198 Offline_Uncorrectable   ---R--   100   100   000    -    0
199 UDMA_CRC_Error_Count    -O-R--   200   200   000    -    0
231 Temperature_Celsius     -O--CK   100   100   000    -    0
241 Total_LBAs_Written      -O--C-   100   100   000    -    3096374605125
242 Total_LBAs_Read         -O--C-   100   100   000    -    3193293119392
                            ||||||_ K auto-keep
                            |||||__ C event count
                            ||||___ R error rate
                            |||____ S speed/performance
                            ||_____ O updated online
                            |______ P prefailure warning

General Purpose Log Directory Version 1
SMART           Log Directory Version 1 [multi-sector log support]
Address    Access  R/W   Size  Description
0x00       GPL,SL  R/O      1  Log Directory
0x01           SL  R/O      1  Summary SMART error log
0x02           SL  R/O      1  Comprehensive SMART error log
0x03       GPL     R/O      1  Ext. Comprehensive SMART error log
0x04       GPL     R/O    256  Device Statistics log
0x04       SL      R/O    255  Device Statistics log
0x06           SL  R/O      1  SMART self-test log
0x07       GPL     R/O      1  Extended self-test log
0x08       GPL     R/O      2  Power Conditions log
0x09           SL  R/W      1  Selective self-test log
0x0c       GPL     R/O   5501  Pending Defects log
0x10       GPL     R/O      1  NCQ Command Error log
0x11       GPL     R/O      1  SATA Phy Event Counters log
0x12       GPL     R/O      1  SATA NCQ Non-Data log
0x13       GPL     R/O      1  SATA NCQ Send and Receive log
0x15       GPL     R/W      1  Rebuild Assist log
0x21       GPL     R/O      1  Write stream error log
0x22       GPL     R/O      1  Read stream error log
0x24       GPL     R/O    256  Current Device Internal Status Data log
0x25       GPL     R/O    256  Saved Device Internal Status Data log
0x30       GPL,SL  R/O      9  IDENTIFY DEVICE data log
0x80       GPL     R/W    688  Host vendor specific log
0x81-0x9f  GPL,SL  R/W     16  Host vendor specific log
0xb2       GPL     VS     688  Device vendor specific log
0xc8       GPL     VS      12  Device vendor specific log
0xe0       GPL,SL  R/W      1  SCT Command/Status
0xe1       GPL,SL  R/W      1  SCT Data Transfer

SMART Extended Comprehensive Error Log Version: 1 (1 sectors)
No Errors Logged

SMART Extended Self-test Log Version: 1 (1 sectors)
Num  Test_Description    Status                  Remaining  LifeTime(hours)  LBA_of_first_error
# 1  Vendor (0x70)       Completed without error       00%     26781         -
# 2  Vendor (0x71)       Completed without error       00%     26781         -

SMART Selective self-test log data structure revision number 1
 SPAN  MIN_LBA  MAX_LBA  CURRENT_TEST_STATUS
    1        0        0  Not_testing
    2        0        0  Not_testing
    3        0        0  Not_testing
    4        0        0  Not_testing
    5        0        0  Not_testing
Selective self-test flags (0x0):
  After scanning selected spans, do NOT read-scan remainder of disk.
If Selective self-test is pending on power-up, resume after 0 minute delay.

SCT Status Version:                  3
SCT Version (vendor specific):       256 (0x0100)
Device State:                        Active (0)
Current Temperature:                    30 Celsius
Power Cycle Min/Max Temperature:     22/32 Celsius
Lifetime    Min/Max Temperature:     22/57 Celsius
Under/Over Temperature Limit Count:   0/0

SCT Temperature History Version:     2
Temperature Sampling Period:         1 minute
Temperature Logging Interval:        1 minute
Min/Max recommended Temperature:      0/60 Celsius
Min/Max Temperature Limit:           -40/70 Celsius
Temperature History Size (Index):    128 (85)

Index    Estimated Time   Temperature Celsius
  86    2024-08-20 23:33    23  ****
 ...    ..( 49 skipped).    ..  ****
   8    2024-08-21 00:23    23  ****
   9    2024-08-21 00:24    24  *****
  10    2024-08-21 00:25    24  *****
  11    2024-08-21 00:26    25  ******
  12    2024-08-21 00:27    26  *******
  13    2024-08-21 00:28    26  *******
  14    2024-08-21 00:29    27  ********
  15    2024-08-21 00:30    27  ********
  16    2024-08-21 00:31    28  *********
  17    2024-08-21 00:32    28  *********
  18    2024-08-21 00:33    28  *********
  19    2024-08-21 00:34    29  **********
  20    2024-08-21 00:35    29  **********
  21    2024-08-21 00:36    30  ***********
 ...    ..(  6 skipped).    ..  ***********
  28    2024-08-21 00:43    30  ***********
  29    2024-08-21 00:44    29  **********
  30    2024-08-21 00:45    29  **********
  31    2024-08-21 00:46    28  *********
 ...    ..(  2 skipped).    ..  *********
  34    2024-08-21 00:49    28  *********
  35    2024-08-21 00:50    27  ********
 ...    ..(  2 skipped).    ..  ********
  38    2024-08-21 00:53    27  ********
  39    2024-08-21 00:54    26  *******
 ...    ..(  4 skipped).    ..  *******
  44    2024-08-21 00:59    26  *******
  45    2024-08-21 01:00    25  ******
 ...    ..(  2 skipped).    ..  ******
  48    2024-08-21 01:03    25  ******
  49    2024-08-21 01:04    26  *******
  50    2024-08-21 01:05    26  *******
  51    2024-08-21 01:06    27  ********
  52    2024-08-21 01:07    27  ********
  53    2024-08-21 01:08    28  *********
  54    2024-08-21 01:09    28  *********
  55    2024-08-21 01:10    29  **********
 ...    ..(  2 skipped).    ..  **********
  58    2024-08-21 01:13    29  **********
  59    2024-08-21 01:14    30  ***********
 ...    ..(  5 skipped).    ..  ***********
  65    2024-08-21 01:20    30  ***********
  66    2024-08-21 01:21    29  **********
  67    2024-08-21 01:22    29  **********
  68    2024-08-21 01:23    28  *********
  69    2024-08-21 01:24    28  *********
  70    2024-08-21 01:25    28  *********
  71    2024-08-21 01:26    27  ********
  72    2024-08-21 01:27    27  ********
  73    2024-08-21 01:28    27  ********
  74    2024-08-21 01:29    26  *******
  75    2024-08-21 01:30    27  ********
  76    2024-08-21 01:31    27  ********
  77    2024-08-21 01:32    27  ********
  78    2024-08-21 01:33    28  *********
  79    2024-08-21 01:34    28  *********
  80    2024-08-21 01:35    28  *********
  81    2024-08-21 01:36    29  **********
  82    2024-08-21 01:37    29  **********
  83    2024-08-21 01:38    29  **********
  84    2024-08-21 01:39    30  ***********
  85    2024-08-21 01:40    23  ****

SCT Error Recovery Control:
           Read: Disabled
          Write: Disabled

Device Statistics (GP Log 0x04)
Page  Offset Size        Value Flags Description
0x01  =====  =               =  ===  == General Statistics (rev 1) ==
0x01  0x008  4              81  ---  Lifetime Power-On Resets
0x01  0x010  4           27887  ---  Power-on Hours
0x01  0x018  6   3096374605125  ---  Logical Sectors Written
0x01  0x020  6      4690484813  ---  Number of Write Commands
0x01  0x028  6   3193293119392  ---  Logical Sectors Read
0x01  0x030  6      5052219852  ---  Number of Read Commands
0x01  0x038  6    100395918250  ---  Date and Time TimeStamp
0x03  =====  =               =  ===  == Rotating Media Statistics (rev 1) ==
0x03  0x008  4           27003  ---  Spindle Motor Power-on Hours
0x03  0x010  4           27003  ---  Head Flying Hours
0x03  0x018  4            1198  ---  Head Load Events
0x03  0x020  4               0  ---  Number of Reallocated Logical Sectors
0x03  0x028  4            2802  ---  Read Recovery Attempts
0x03  0x030  4               0  ---  Number of Mechanical Start Failures
0x04  =====  =               =  ===  == General Errors Statistics (rev 1) ==
0x04  0x008  4               0  ---  Number of Reported Uncorrectable Errors
0x04  0x010  4               0  ---  Resets Between Cmd Acceptance and Completion
0x05  =====  =               =  ===  == Temperature Statistics (rev 1) ==
0x05  0x008  1              30  ---  Current Temperature
0x05  0x010  1              25  N--  Average Short Term Temperature
0x05  0x018  1              27  N--  Average Long Term Temperature
0x05  0x020  1              57  ---  Highest Temperature
0x05  0x028  1              22  ---  Lowest Temperature
0x05  0x030  1              55  N--  Highest Average Short Term Temperature
0x05  0x038  1              23  N--  Lowest Average Short Term Temperature
0x05  0x040  1              53  N--  Highest Average Long Term Temperature
0x05  0x048  1              25  N--  Lowest Average Long Term Temperature
0x05  0x050  4               0  ---  Time in Over-Temperature
0x05  0x058  1              60  ---  Specified Maximum Operating Temperature
0x05  0x060  4               0  ---  Time in Under-Temperature
0x05  0x068  1               0  ---  Specified Minimum Operating Temperature
0x06  =====  =               =  ===  == Transport Statistics (rev 1) ==
0x06  0x008  4             378  ---  Number of Hardware Resets
0x06  0x010  4             334  ---  Number of ASR Events
0x06  0x018  4               0  ---  Number of Interface CRC Errors
0xff  =====  =               =  ===  == Vendor Specific Statistics (rev 1) ==
                                |||_ C monitored condition met
                                ||__ D supports DSN
                                |___ N normalized value

Pending Defects log (GP Log 0x0c)
No Defects Logged

SATA Phy Event Counters (GP Log 0x11)
ID      Size     Value  Description
0x0001  2            0  Command failed due to ICRC error
0x0002  2            0  R_ERR response for data FIS
0x0003  2            0  R_ERR response for device-to-host data FIS
0x0004  2            0  R_ERR response for host-to-device data FIS
0x0005  2            0  R_ERR response for non-data FIS
0x0006  2            0  R_ERR response for device-to-host non-data FIS
0x0007  2            0  R_ERR response for host-to-device non-data FIS
0x0008  2            0  Device-to-host non-data FIS retries
0x0009  2            3  Transition from drive PhyRdy to drive PhyNRdy
0x000a  2            4  Device-to-host register FISes sent due to a COMRESET
0x000b  2            0  CRC errors within host-to-device FIS
0x000d  2            0  Non-CRC errors within host-to-device FIS

