smartctl 6.6 2017-11-05 r4594 [FreeBSD 11.1-RELEASE amd64] (local build)
Copyright (C) 2002-17, Bruce Allen, Christian Franke, www.smartmontools.org

=== START OF INFORMATION SECTION ===
Device Model:     WDC WD101KFBX-68R56N0
Firmware Version: 83.H0A03
User Capacity:    10,000,831,348,736 bytes [10.0 TB]
Sector Sizes:     512 bytes logical, 4096 bytes physical
Rotation Rate:    7200 rpm
Form Factor:      3.5 inches
Device is:        Not in smartctl database [for details use: -P showall]
ATA Version is:   ACS-2, ATA8-ACS T13/1699-D revision 4
SATA Version is:  SATA 3.2, 6.0 Gb/s (current: 6.0 Gb/s)
Local Time is:    Fri May  4 12:03:20 2018 AEST
SMART support is: Available - device has SMART capability.
SMART support is: Enabled
AAM feature is:   Unavailable
APM level is:     164 (intermediate level without standby)
Rd look-ahead is: Enabled
Write cache is:   Enabled
DSN feature is:   Unavailable
ATA Security is:  Disabled, NOT FROZEN [SEC1]
Wt Cache Reorder: Enabled

=== START OF READ SMART DATA SECTION ===
SMART overall-health self-assessment test result: PASSED

General SMART Values:
Offline data collection status:  (0x82)	Offline data collection activity
					was completed without error.
					Auto Offline Data Collection: Enabled.
Self-test execution status:      (   0)	The previous self-test routine completed
					without error or no self-test has ever 
					been run.
Total time to complete Offline 
data collection: 		(   93) seconds.
Offline data collection
capabilities: 			 (0x5b) SMART execute Offline immediate.
					Auto Offline data collection on/off support.
					Suspend Offline collection upon new
					command.
					Offline surface scan supported.
					Self-test supported.
					No Conveyance Self-test supported.
					Selective Self-test supported.
SMART capabilities:            (0x0003)	Saves SMART data before entering
					power-saving mode.
					Supports SMART auto save timer.
Error logging capability:        (0x01)	Error logging supported.
					General Purpose Logging supported.
Short self-test routine 
recommended polling time: 	 (   2) minutes.
Extended self-test routine
recommended polling time: 	 (1095) minutes.
SCT capabilities: 	       (0x003d)	SCT Status supported.
					SCT Error Recovery Control supported.
					SCT Feature Control supported.
					SCT Data Table supported.

SMART Attributes Data Structure revision number: 16
Vendor Specific SMART Attributes with Thresholds:
ID# ATTRIBUTE_NAME          FLAGS    VALUE WORST THRESH FAIL RAW_VALUE
  1 Raw_Read_Error_Rate     PO-R--   100   100   016    -    0
  2 Throughput_Performance  --S---   134   134   054    -    96
  3 Spin_Up_Time            POS---   100   100   024    -    0
  4 Start_Stop_Count        -O--C-   100   100   000    -    8
  5 Reallocated_Sector_Ct   PO--CK   100   100   005    -    0
  7 Seek_Error_Rate         -O-R--   100   100   067    -    0
  8 Seek_Time_Performance   --S---   128   128   020    -    18
  9 Power_On_Hours          -O--C-   100   100   000    -    574
 10 Spin_Retry_Count        -O--C-   100   100   060    -    0
 12 Power_Cycle_Count       -O--CK   100   100   000    -    8
 22 Unknown_Attribute       PO---K   100   100   025    -    100
192 Power-Off_Retract_Count -O--CK   100   100   000    -    139
193 Load_Cycle_Count        -O--C-   100   100   000    -    139
194 Temperature_Celsius     -O----   166   166   000    -    36 (Min/Max 21/46)
196 Reallocated_Event_Count -O--CK   100   100   000    -    0
197 Current_Pending_Sector  -O---K   100   100   000    -    0
198 Offline_Uncorrectable   ---R--   100   100   000    -    0
199 UDMA_CRC_Error_Count    -O-R--   200   200   000    -    0
                            ||||||_ K auto-keep
                            |||||__ C event count
                            ||||___ R error rate
                            |||____ S speed/performance
                            ||_____ O updated online
                            |______ P prefailure warning

General Purpose Log Directory Version 1
SMART           Log Directory Version 1 [multi-sector log support]
Address    Access  R/W   Size  Description
0x00       GPL,SL  R/O      1  Log Directory
0x01           SL  R/O      1  Summary SMART error log
0x02           SL  R/O      1  Comprehensive SMART error log
0x03       GPL     R/O      1  Ext. Comprehensive SMART error log
0x04       GPL     R/O    256  Device Statistics log
0x04       SL      R/O    255  Device Statistics log
0x06           SL  R/O      1  SMART self-test log
0x07       GPL     R/O      1  Extended self-test log
0x08       GPL     R/O      2  Power Conditions log
0x09           SL  R/W      1  Selective self-test log
0x0c       GPL     R/O   5501  Pending Defects log
0x10       GPL     R/O      1  NCQ Command Error log
0x11       GPL     R/O      1  SATA Phy Event Counters log
0x12       GPL     R/O      1  SATA NCQ Non-Data log
0x13       GPL     R/O      1  SATA NCQ Send and Receive log
0x15       GPL     R/W      1  Rebuild Assist log
0x21       GPL     R/O      1  Write stream error log
0x22       GPL     R/O      1  Read stream error log
0x24       GPL     R/O    256  Current Device Internal Status Data log
0x25       GPL     R/O    256  Saved Device Internal Status Data log
0x30       GPL,SL  R/O      9  IDENTIFY DEVICE data log
0x80-0x9f  GPL,SL  R/W     16  Host vendor specific log
0xe0       GPL,SL  R/W      1  SCT Command/Status
0xe1       GPL,SL  R/W      1  SCT Data Transfer

SMART Extended Comprehensive Error Log Version: 1 (1 sectors)
No Errors Logged

SMART Extended Self-test Log Version: 1 (1 sectors)
Num  Test_Description    Status                  Remaining  LifeTime(hours)  LBA_of_first_error
# 1  Short offline       Completed without error       00%       573         -

SMART Selective self-test log data structure revision number 1
 SPAN  MIN_LBA  MAX_LBA  CURRENT_TEST_STATUS
    1        0        0  Not_testing
    2        0        0  Not_testing
    3        0        0  Not_testing
    4        0        0  Not_testing
    5        0        0  Not_testing
Selective self-test flags (0x0):
  After scanning selected spans, do NOT read-scan remainder of disk.
If Selective self-test is pending on power-up, resume after 0 minute delay.

SCT Status Version:                  3
SCT Version (vendor specific):       256 (0x0100)
SCT Support Level:                   0
Device State:                        Active (0)
Current Temperature:                    36 Celsius
Power Cycle Min/Max Temperature:     21/42 Celsius
Lifetime    Min/Max Temperature:     21/46 Celsius
Under/Over Temperature Limit Count:   0/0

SCT Temperature History Version:     2
Temperature Sampling Period:         1 minute
Temperature Logging Interval:        1 minute
Min/Max recommended Temperature:      0/60 Celsius
Min/Max Temperature Limit:           -40/70 Celsius
Temperature History Size (Index):    128 (124)

Index    Estimated Time   Temperature Celsius
 125    2018-05-04 09:56    32  *************
 ...    ..(  3 skipped).    ..  *************
   1    2018-05-04 10:00    32  *************
   2    2018-05-04 10:01    33  **************
 ...    ..(  8 skipped).    ..  **************
  11    2018-05-04 10:10    33  **************
  12    2018-05-04 10:11    34  ***************
 ...    ..(  8 skipped).    ..  ***************
  21    2018-05-04 10:20    34  ***************
  22    2018-05-04 10:21    35  ****************
 ...    ..( 11 skipped).    ..  ****************
  34    2018-05-04 10:33    35  ****************
  35    2018-05-04 10:34    34  ***************
 ...    ..(  9 skipped).    ..  ***************
  45    2018-05-04 10:44    34  ***************
  46    2018-05-04 10:45    35  ****************
 ...    ..(  2 skipped).    ..  ****************
  49    2018-05-04 10:48    35  ****************
  50    2018-05-04 10:49    36  *****************
 ...    ..(  2 skipped).    ..  *****************
  53    2018-05-04 10:52    36  *****************
  54    2018-05-04 10:53    35  ****************
 ...    ..( 46 skipped).    ..  ****************
 101    2018-05-04 11:40    35  ****************
 102    2018-05-04 11:41    34  ***************
 103    2018-05-04 11:42    35  ****************
 ...    ..(  2 skipped).    ..  ****************
 106    2018-05-04 11:45    35  ****************
 107    2018-05-04 11:46    36  *****************
 ...    ..( 10 skipped).    ..  *****************
 118    2018-05-04 11:57    36  *****************
 119    2018-05-04 11:58    35  ****************
 ...    ..(  2 skipped).    ..  ****************
 122    2018-05-04 12:01    35  ****************
 123    2018-05-04 12:02    36  *****************
 124    2018-05-04 12:03    32  *************

SCT Error Recovery Control:
           Read:     70 (7.0 seconds)
          Write:     70 (7.0 seconds)

Device Statistics (GP/SMART Log 0x04) not supported

Pending Defects log (GP Log 0x0c) supported [please try: '-l defects']

SATA Phy Event Counters (GP Log 0x11)
ID      Size     Value  Description
0x0001  2            0  Command failed due to ICRC error
0x0002  2            0  R_ERR response for data FIS
0x0003  2            0  R_ERR response for device-to-host data FIS
0x0004  2            0  R_ERR response for host-to-device data FIS
0x0005  2            0  R_ERR response for non-data FIS
0x0006  2            0  R_ERR response for device-to-host non-data FIS
0x0007  2            0  R_ERR response for host-to-device non-data FIS
0x0008  2            0  Device-to-host non-data FIS retries
0x0009  2            1  Transition from drive PhyRdy to drive PhyNRdy
0x000a  2            2  Device-to-host register FISes sent due to a COMRESET
0x000b  2            0  CRC errors within host-to-device FIS
0x000d  2            0  Non-CRC errors within host-to-device FIS

