smartctl 7.0 2018-12-30 r4883 [x86_64-linux-5.10.46_p4-debian-sources] (local build)
Copyright (C) 2002-18, Bruce Allen, Christian Franke, www.smartmontools.org

=== START OF INFORMATION SECTION ===
Device Model:     ST16000NM001G-2KK103
Firmware Version: SN02
User Capacity:    16,000,900,661,248 bytes [16.0 TB]
Sector Sizes:     512 bytes logical, 4096 bytes physical
Rotation Rate:    7200 rpm
Form Factor:      3.5 inches
Device is:        Not in smartctl database [for details use: -P showall]
ATA Version is:   ACS-4 (minor revision not indicated)
SATA Version is:  SATA 3.3, 6.0 Gb/s (current: 6.0 Gb/s)
Local Time is:    Tue Sep 14 20:00:05 2021 CEST
SMART support is: Available - device has SMART capability.
SMART support is: Enabled
AAM feature is:   Unavailable
APM feature is:   Unavailable
Rd look-ahead is: Enabled
Write cache is:   Enabled
DSN feature is:   Disabled
ATA Security is:  Disabled, frozen [SEC2]
Write SCT (Get) Feature Control Command failed: scsi error badly formed scsi parameters
Wt Cache Reorder: Unknown (SCT Feature Control command failed)

=== START OF READ SMART DATA SECTION ===
SMART overall-health self-assessment test result: PASSED

General SMART Values:
Offline data collection status:  (0x82)	Offline data collection activity
					was completed without error.
					Auto Offline Data Collection: Enabled.
Self-test execution status:      (   0)	The previous self-test routine completed
					without error or no self-test has ever 
					been run.
Total time to complete Offline 
data collection: 		(  567) seconds.
Offline data collection
capabilities: 			 (0x7b) SMART execute Offline immediate.
					Auto Offline data collection on/off support.
					Suspend Offline collection upon new
					command.
					Offline surface scan supported.
					Self-test supported.
					Conveyance Self-test supported.
					Selective Self-test supported.
SMART capabilities:            (0x0003)	Saves SMART data before entering
					power-saving mode.
					Supports SMART auto save timer.
Error logging capability:        (0x01)	Error logging supported.
					General Purpose Logging supported.
Short self-test routine 
recommended polling time: 	 (   1) minutes.
Extended self-test routine
recommended polling time: 	 (1417) minutes.
Conveyance self-test routine
recommended polling time: 	 (   2) minutes.
SCT capabilities: 	       (0x70bd)	SCT Status supported.
					SCT Error Recovery Control supported.
					SCT Feature Control supported.
					SCT Data Table supported.

SMART Attributes Data Structure revision number: 10
Vendor Specific SMART Attributes with Thresholds:
ID# ATTRIBUTE_NAME          FLAGS    VALUE WORST THRESH FAIL RAW_VALUE
  1 Raw_Read_Error_Rate     POSR--   076   064   044    -    42130374
  3 Spin_Up_Time            PO----   092   091   000    -    0
  4 Start_Stop_Count        -O--CK   100   100   020    -    19
  5 Reallocated_Sector_Ct   PO--CK   100   100   010    -    0
  7 Seek_Error_Rate         POSR--   073   060   045    -    22126678
  9 Power_On_Hours          -O--CK   098   098   000    -    2418
 10 Spin_Retry_Count        PO--C-   100   100   097    -    0
 12 Power_Cycle_Count       -O--CK   100   100   020    -    18
 18 Unknown_Attribute       PO-R--   100   100   050    -    0
187 Reported_Uncorrect      -O--CK   100   100   000    -    0
188 Command_Timeout         -O--CK   100   100   000    -    0
190 Airflow_Temperature_Cel -O---K   070   045   040    -    30 (Min/Max 29/41)
192 Power-Off_Retract_Count -O--CK   100   100   000    -    4
193 Load_Cycle_Count        -O--CK   097   097   000    -    6065
194 Temperature_Celsius     -O---K   030   055   000    -    30 (0 22 0 0 0)
197 Current_Pending_Sector  -O--C-   100   100   000    -    0
198 Offline_Uncorrectable   ----C-   100   100   000    -    0
199 UDMA_CRC_Error_Count    -OSRCK   200   200   000    -    0
200 Multi_Zone_Error_Rate   PO---K   100   100   001    -    0
240 Head_Flying_Hours       ------   100   253   000    -    1042 (47 242 0)
241 Total_LBAs_Written      ------   100   253   000    -    31737709495
242 Total_LBAs_Read         ------   100   253   000    -    101456676
                            ||||||_ K auto-keep
                            |||||__ C event count
                            ||||___ R error rate
                            |||____ S speed/performance
                            ||_____ O updated online
                            |______ P prefailure warning

General Purpose Log Directory Version 1
SMART           Log Directory Version 1 [multi-sector log support]
Address    Access  R/W   Size  Description
0x00       GPL,SL  R/O      1  Log Directory
0x01           SL  R/O      1  Summary SMART error log
0x02           SL  R/O      5  Comprehensive SMART error log
0x03       GPL     R/O      5  Ext. Comprehensive SMART error log
0x04       GPL     R/O    256  Device Statistics log
0x04       SL      R/O      8  Device Statistics log
0x06           SL  R/O      1  SMART self-test log
0x07       GPL     R/O      1  Extended self-test log
0x08       GPL     R/O      2  Power Conditions log
0x09           SL  R/W      1  Selective self-test log
0x0a       GPL     R/W      8  Device Statistics Notification
0x0c       GPL     R/O   2048  Pending Defects log
0x10       GPL     R/O      1  NCQ Command Error log
0x11       GPL     R/O      1  SATA Phy Event Counters log
0x13       GPL     R/O      1  SATA NCQ Send and Receive log
0x21       GPL     R/O      1  Write stream error log
0x22       GPL     R/O      1  Read stream error log
0x24       GPL     R/O    768  Current Device Internal Status Data log
0x2f       GPL     -        1  Set Sector Configuration
0x30       GPL,SL  R/O      9  IDENTIFY DEVICE data log
0x80-0x9f  GPL,SL  R/W     16  Host vendor specific log
0xa1       GPL,SL  VS     160  Device vendor specific log
0xa2       GPL     VS   16320  Device vendor specific log
0xa4       GPL,SL  VS     160  Device vendor specific log
0xa6       GPL     VS     192  Device vendor specific log
0xa8-0xa9  GPL,SL  VS     136  Device vendor specific log
0xab       GPL     VS       1  Device vendor specific log
0xad       GPL     VS      16  Device vendor specific log
0xbe-0xbf  GPL     VS   65535  Device vendor specific log
0xc1       GPL,SL  VS       8  Device vendor specific log
0xc3       GPL,SL  VS      56  Device vendor specific log
0xc7       GPL,SL  VS       8  Device vendor specific log
0xc9       GPL,SL  VS       8  Device vendor specific log
0xca       GPL,SL  VS      16  Device vendor specific log
0xcd       GPL,SL  VS       1  Device vendor specific log
0xce       GPL     VS       1  Device vendor specific log
0xcf       GPL     VS     512  Device vendor specific log
0xd1       GPL     VS     656  Device vendor specific log
0xd2       GPL     VS   10000  Device vendor specific log
0xd4       GPL     VS    2048  Device vendor specific log
0xda       GPL,SL  VS       1  Device vendor specific log
0xe0       GPL,SL  R/W      1  SCT Command/Status
0xe1       GPL,SL  R/W      1  SCT Data Transfer
0xe2       GPL,SL  -      160  Reserved

SMART Extended Comprehensive Error Log Version: 1 (5 sectors)
No Errors Logged

SMART Extended Self-test Log Version: 1 (1 sectors)
Num  Test_Description    Status                  Remaining  LifeTime(hours)  LBA_of_first_error
# 1  Short offline       Completed without error       00%      2418         -
# 2  Extended offline    Completed without error       00%      2368         -
# 3  Extended offline    Aborted by host               90%      2347         -

SMART Selective self-test log data structure revision number 1
 SPAN  MIN_LBA  MAX_LBA  CURRENT_TEST_STATUS
    1        0        0  Not_testing
    2        0        0  Not_testing
    3        0        0  Not_testing
    4        0        0  Not_testing
    5        0        0  Not_testing
Selective self-test flags (0x0):
  After scanning selected spans, do NOT read-scan remainder of disk.
If Selective self-test is pending on power-up, resume after 0 minute delay.

SCT Status Version:                  3
SCT Version (vendor specific):       522 (0x020a)
Device State:                        Active (0)
Current Temperature:                    30 Celsius
Power Cycle Min/Max Temperature:     29/41 Celsius
Lifetime    Min/Max Temperature:     22/57 Celsius
Under/Over Temperature Limit Count:   0/1
SMART Status:                        0xc24f (PASSED)
Vendor specific:
00 00 00 00 00 00 00 00 00 00 00 00 00 00 00 00
00 00 00 00 02 00 00 00 00 00 00 00 00 00 00 00

SCT Temperature History Version:     2
Temperature Sampling Period:         4 minutes
Temperature Logging Interval:        59 minutes
Min/Max recommended Temperature:     10/40 Celsius
Min/Max Temperature Limit:            5/60 Celsius
Temperature History Size (Index):    128 (18)

Index    Estimated Time   Temperature Celsius
  19    2021-09-09 14:12    50  *******************************
  20    2021-09-09 15:11    50  *******************************
  21    2021-09-09 16:10    51  ********************************
  22    2021-09-09 17:09    49  ******************************
  23    2021-09-09 18:08    48  *****************************
  24    2021-09-09 19:07    50  *******************************
  25    2021-09-09 20:06    50  *******************************
  26    2021-09-09 21:05    50  *******************************
  27    2021-09-09 22:04    49  ******************************
  28    2021-09-09 23:03    49  ******************************
  29    2021-09-10 00:02    49  ******************************
  30    2021-09-10 01:01    48  *****************************
  31    2021-09-10 02:00    48  *****************************
  32    2021-09-10 02:59    49  ******************************
  33    2021-09-10 03:58    48  *****************************
  34    2021-09-10 04:57    48  *****************************
  35    2021-09-10 05:56    49  ******************************
  36    2021-09-10 06:55    50  *******************************
  37    2021-09-10 07:54    50  *******************************
  38    2021-09-10 08:53    48  *****************************
  39    2021-09-10 09:52    49  ******************************
  40    2021-09-10 10:51    50  *******************************
 ...    ..(  3 skipped).    ..  *******************************
  44    2021-09-10 14:47    50  *******************************
  45    2021-09-10 15:46    49  ******************************
 ...    ..(  2 skipped).    ..  ******************************
  48    2021-09-10 18:43    49  ******************************
  49    2021-09-10 19:42    50  *******************************
  50    2021-09-10 20:41    49  ******************************
  51    2021-09-10 21:40    48  *****************************
  52    2021-09-10 22:39    49  ******************************
  53    2021-09-10 23:38    50  *******************************
  54    2021-09-11 00:37     ?  -
  55    2021-09-11 01:36    22  ***
  56    2021-09-11 02:35    37  ******************
  57    2021-09-11 03:34     ?  -
  58    2021-09-11 04:33    24  *****
  59    2021-09-11 05:32     ?  -
  60    2021-09-11 06:31    24  *****
  61    2021-09-11 07:30    46  ***************************
  62    2021-09-11 08:29     ?  -
  63    2021-09-11 09:28    43  ************************
  64    2021-09-11 10:27     ?  -
  65    2021-09-11 11:26    43  ************************
  66    2021-09-11 12:25     ?  -
  67    2021-09-11 13:24    43  ************************
  68    2021-09-11 14:23    55  ************************************
  69    2021-09-11 15:22    41  **********************
  70    2021-09-11 16:21    36  *****************
  71    2021-09-11 17:20    34  ***************
  72    2021-09-11 18:19    33  **************
  73    2021-09-11 19:18    35  ****************
  74    2021-09-11 20:17    36  *****************
 ...    ..( 12 skipped).    ..  *****************
  87    2021-09-12 09:04    36  *****************
  88    2021-09-12 10:03    29  **********
  89    2021-09-12 11:02     ?  -
  90    2021-09-12 12:01    29  **********
  91    2021-09-12 13:00     ?  -
  92    2021-09-12 13:59    34  ***************
  93    2021-09-12 14:58     ?  -
  94    2021-09-12 15:57    35  ****************
  95    2021-09-12 16:56    34  ***************
  96    2021-09-12 17:55    33  **************
  97    2021-09-12 18:54    34  ***************
  98    2021-09-12 19:53    34  ***************
  99    2021-09-12 20:52    33  **************
 100    2021-09-12 21:51    28  *********
 101    2021-09-12 22:50    27  ********
 102    2021-09-12 23:49    25  ******
 ...    ..(  2 skipped).    ..  ******
 105    2021-09-13 02:46    25  ******
 106    2021-09-13 03:45    26  *******
 107    2021-09-13 04:44    26  *******
 108    2021-09-13 05:43    27  ********
 109    2021-09-13 06:42    27  ********
 110    2021-09-13 07:41    26  *******
 111    2021-09-13 08:40    29  **********
 112    2021-09-13 09:39    35  ****************
 113    2021-09-13 10:38    38  *******************
 114    2021-09-13 11:37    39  ********************
 115    2021-09-13 12:36    39  ********************
 116    2021-09-13 13:35    39  ********************
 117    2021-09-13 14:34    38  *******************
 118    2021-09-13 15:33    39  ********************
 119    2021-09-13 16:32    38  *******************
 120    2021-09-13 17:31    39  ********************
 121    2021-09-13 18:30    39  ********************
 122    2021-09-13 19:29    38  *******************
 123    2021-09-13 20:28    39  ********************
 ...    ..( 15 skipped).    ..  ********************
  11    2021-09-14 12:12    39  ********************
  12    2021-09-14 13:11    40  *********************
  13    2021-09-14 14:10    40  *********************
  14    2021-09-14 15:09     ?  -
  15    2021-09-14 16:08    39  ********************
  16    2021-09-14 17:07     ?  -
  17    2021-09-14 18:06    41  **********************
  18    2021-09-14 19:05    32  *************

SCT Error Recovery Control:
           Read:    100 (10.0 seconds)
          Write:    100 (10.0 seconds)

Device Statistics (GP Log 0x04)
Page  Offset Size        Value Flags Description
0x01  =====  =               =  ===  == General Statistics (rev 1) ==
0x01  0x008  4              18  ---  Lifetime Power-On Resets
0x01  0x010  4            2418  ---  Power-on Hours
0x01  0x018  6     31736248466  ---  Logical Sectors Written
0x01  0x020  6        31069169  ---  Number of Write Commands
0x01  0x028  6        99129853  ---  Logical Sectors Read
0x01  0x030  6         3298221  ---  Number of Read Commands
0x01  0x038  6               -  ---  Date and Time TimeStamp
0x03  =====  =               =  ===  == Rotating Media Statistics (rev 1) ==
0x03  0x008  4            2367  ---  Spindle Motor Power-on Hours
0x03  0x010  4            1722  ---  Head Flying Hours
0x03  0x018  4            6065  ---  Head Load Events
0x03  0x020  4               0  ---  Number of Reallocated Logical Sectors
0x03  0x028  4               0  ---  Read Recovery Attempts
0x03  0x030  4               0  ---  Number of Mechanical Start Failures
0x03  0x038  4               0  ---  Number of Realloc. Candidate Logical Sectors
0x03  0x040  4               4  ---  Number of High Priority Unload Events
0x04  =====  =               =  ===  == General Errors Statistics (rev 1) ==
0x04  0x008  4               0  ---  Number of Reported Uncorrectable Errors
0x04  0x010  4               0  ---  Resets Between Cmd Acceptance and Completion
0x04  0x018  4               0  -D-  Physical Element Status Changed
0x05  =====  =               =  ===  == Temperature Statistics (rev 1) ==
0x05  0x008  1              30  ---  Current Temperature
0x05  0x010  1              36  ---  Average Short Term Temperature
0x05  0x018  1              45  ---  Average Long Term Temperature
0x05  0x020  1              57  ---  Highest Temperature
0x05  0x028  1              25  ---  Lowest Temperature
0x05  0x030  1              49  ---  Highest Average Short Term Temperature
0x05  0x038  1              32  ---  Lowest Average Short Term Temperature
0x05  0x040  1              46  ---  Highest Average Long Term Temperature
0x05  0x048  1              40  ---  Lowest Average Long Term Temperature
0x05  0x050  4               0  ---  Time in Over-Temperature
0x05  0x058  1              60  ---  Specified Maximum Operating Temperature
0x05  0x060  4               0  ---  Time in Under-Temperature
0x05  0x068  1               5  ---  Specified Minimum Operating Temperature
0x06  =====  =               =  ===  == Transport Statistics (rev 1) ==
0x06  0x008  4              31  ---  Number of Hardware Resets
0x06  0x010  4               4  ---  Number of ASR Events
0x06  0x018  4               0  ---  Number of Interface CRC Errors
0xff  =====  =               =  ===  == Vendor Specific Statistics (rev 1) ==
0xff  0x008  7               0  ---  Vendor Specific
0xff  0x010  7               0  ---  Vendor Specific
0xff  0x018  7               0  ---  Vendor Specific
                                |||_ C monitored condition met
                                ||__ D supports DSN
                                |___ N normalized value

Pending Defects log (GP Log 0x0c)
No Defects Logged

SATA Phy Event Counters (GP Log 0x11)
ID      Size     Value  Description
0x000a  2            3  Device-to-host register FISes sent due to a COMRESET
0x0001  2            0  Command failed due to ICRC error
0x0003  2            0  R_ERR response for device-to-host data FIS
0x0004  2            0  R_ERR response for host-to-device data FIS
0x0006  2            0  R_ERR response for device-to-host non-data FIS
0x0007  2            0  R_ERR response for host-to-device non-data FIS

