smartctl 7.2 2020-12-30 r5155 [x86_64-linux-5.15.74-1-pve] (local build)
Copyright (C) 2002-20, Bruce Allen, Christian Franke, www.smartmontools.org

=== START OF INFORMATION SECTION ===
Device Model:     SPCC Solid State Disk
Serial Number:    30041226481
LU WWN Device Id: 5 000000 000016646
Firmware Version: SN08921
User Capacity:    128 035 676 160 bytes [128 GB]
Sector Size:      512 bytes logical/physical
Rotation Rate:    Solid State Device
Form Factor:      2.5 inches
TRIM Command:     Available, deterministic, zeroed
Device is:        Not in smartctl database [for details use: -P showall]
ATA Version is:   ACS-4 (minor revision not indicated)
SATA Version is:  SATA 3.2, 6.0 Gb/s (current: 6.0 Gb/s)
Local Time is:    Tue Jan 31 12:22:52 2023 CET
SMART support is: Available - device has SMART capability.
SMART support is: Enabled
AAM feature is:   Unavailable
APM feature is:   Unavailable
Rd look-ahead is: Enabled
Write cache is:   Enabled
DSN feature is:   Unavailable
ATA Security is:  Disabled, NOT FROZEN [SEC1]
Wt Cache Reorder: Enabled

=== START OF READ SMART DATA SECTION ===
SMART overall-health self-assessment test result: PASSED

General SMART Values:
Offline data collection status:  (0x02)	Offline data collection activity
					was completed without error.
					Auto Offline Data Collection: Disabled.
Self-test execution status:      (   0)	The previous self-test routine completed
					without error or no self-test has ever 
					been run.
Total time to complete Offline 
data collection: 		(   33) seconds.
Offline data collection
capabilities: 			 (0x7b) SMART execute Offline immediate.
					Auto Offline data collection on/off support.
					Suspend Offline collection upon new
					command.
					Offline surface scan supported.
					Self-test supported.
					Conveyance Self-test supported.
					Selective Self-test supported.
SMART capabilities:            (0x0003)	Saves SMART data before entering
					power-saving mode.
					Supports SMART auto save timer.
Error logging capability:        (0x01)	Error logging supported.
					General Purpose Logging supported.
Short self-test routine 
recommended polling time: 	 (   2) minutes.
Extended self-test routine
recommended polling time: 	 (   2) minutes.
Conveyance self-test routine
recommended polling time: 	 (   2) minutes.
SCT capabilities: 	       (0x0031)	SCT Status supported.
					SCT Feature Control supported.
					SCT Data Table supported.

SMART Attributes Data Structure revision number: 20
Vendor Specific SMART Attributes with Thresholds:
ID# ATTRIBUTE_NAME          FLAGS    VALUE WORST THRESH FAIL RAW_VALUE
  5 Reallocated_Sector_Ct   PO--C-   100   100   050    -    0
  9 Power_On_Hours          -O--C-   100   100   000    -    10887
 12 Power_Cycle_Count       -O--C-   100   100   000    -    12
167 Unknown_Attribute       -O---K   100   100   000    -    0
168 Unknown_Attribute       -O--C-   100   100   000    -    0
169 Unknown_Attribute       PO--C-   100   100   010    -    0
171 Unknown_Attribute       -O--CK   100   100   000    -    1
172 Unknown_Attribute       -O--CK   100   100   000    -    4
173 Unknown_Attribute       -O--C-   200   200   000    -    7486127935372
174 Unknown_Attribute       -O---K   100   100   000    -    8
175 Program_Fail_Count_Chip -O---K   100   100   010    -    0
180 Unused_Rsvd_Blk_Cnt_Tot PO--CK   099   099   000    -    88
187 Reported_Uncorrect      -O--CK   099   000   000    -    29
192 Power-Off_Retract_Count -O--C-   100   100   000    -    12
194 Temperature_Celsius     -O---K   040   040   000    -    40 (Min/Max 40/40)
206 Unknown_SSD_Attribute   -O--CK   200   200   000    -    1742
207 Unknown_SSD_Attribute   -O--CK   200   200   000    -    254833
208 Unknown_SSD_Attribute   -O--CK   200   200   000    -    3980
209 Unknown_SSD_Attribute   -O--CK   200   200   000    -    1
210 Unknown_Attribute       -O--CK   200   200   000    -    254917
211 Unknown_Attribute       -O--CK   200   200   000    -    158019
231 Unknown_SSD_Attribute   PO---K   091   091   005    -    9
241 Total_LBAs_Written      -O--CK   100   100   000    -    131164
242 Total_LBAs_Read         -O--CK   100   100   000    -    1226
245 Unknown_Attribute       -O--CK   100   100   000    -    4290772927
                            ||||||_ K auto-keep
                            |||||__ C event count
                            ||||___ R error rate
                            |||____ S speed/performance
                            ||_____ O updated online
                            |______ P prefailure warning

General Purpose Log Directory Version 1
SMART           Log Directory Version 1 [multi-sector log support]
Address    Access  R/W   Size  Description
0x00       GPL,SL  R/O      1  Log Directory
0x01           SL  R/O      1  Summary SMART error log
0x02           SL  R/O     51  Comprehensive SMART error log
0x03       GPL     R/O     64  Ext. Comprehensive SMART error log
0x04       GPL,SL  R/O      8  Device Statistics log
0x06           SL  R/O      1  SMART self-test log
0x07       GPL     R/O      1  Extended self-test log
0x09           SL  R/W      1  Selective self-test log
0x10       GPL     R/O      1  NCQ Command Error log
0x11       GPL     R/O      1  SATA Phy Event Counters log
0x30       GPL,SL  R/O      9  IDENTIFY DEVICE data log
0x80-0x9f  GPL,SL  R/W     16  Host vendor specific log
0xe0       GPL,SL  R/W      1  SCT Command/Status
0xe1       GPL,SL  R/W      1  SCT Data Transfer

SMART Extended Comprehensive Error Log Version: 1 (64 sectors)
Device Error Count: 29
	CR     = Command Register
	FEATR  = Features Register
	COUNT  = Count (was: Sector Count) Register
	LBA_48 = Upper bytes of LBA High/Mid/Low Registers ]  ATA-8
	LH     = LBA High (was: Cylinder High) Register    ]   LBA
	LM     = LBA Mid (was: Cylinder Low) Register      ] Register
	LL     = LBA Low (was: Sector Number) Register     ]
	DV     = Device (was: Device/Head) Register
	DC     = Device Control Register
	ER     = Error register
	ST     = Status register
Powered_Up_Time is measured from power on, and printed as
DDd+hh:mm:SS.sss where DD=days, hh=hours, mm=minutes,
SS=sec, and sss=millisec. It "wraps" after 49.710 days.

Error 29 [28] occurred at disk power-on lifetime: 10886 hours (453 days + 14 hours)
  When the command that caused the error occurred, the device was in an unknown state.

  After command completion occurred, registers were:
  ER -- ST COUNT  LBA_48  LH LM LL DV DC
  -- -- -- == -- == == == -- -- -- -- --
  40 -- 41 00 08 00 00 00 00 1a 80 40 00  Error: UNC at LBA = 0x00001a80 = 6784

  Commands leading to the command that caused the error were:
  CR FEATR COUNT  LBA_48  LH LM LL DV DC  Powered_Up_Time  Command/Feature_Name
  -- == -- == -- == == == -- -- -- -- --  ---------------  --------------------
  60 00 08 00 00 00 00 00 00 1a 80 00 80 44d+07:51:09.412  READ FPDMA QUEUED
  2f 00 00 00 01 00 00 00 00 00 10 00 80 44d+07:51:06.812  READ LOG EXT
  60 00 08 00 00 00 00 00 00 1a 80 00 80 44d+07:51:06.812  READ FPDMA QUEUED
  2f 00 00 00 01 00 00 00 00 00 10 00 80 44d+07:51:04.212  READ LOG EXT
  60 00 80 00 00 00 00 00 00 1a 80 00 80 44d+07:51:04.212  READ FPDMA QUEUED

Error 28 [27] occurred at disk power-on lifetime: 10886 hours (453 days + 14 hours)
  When the command that caused the error occurred, the device was in an unknown state.

  After command completion occurred, registers were:
  ER -- ST COUNT  LBA_48  LH LM LL DV DC
  -- -- -- == -- == == == -- -- -- -- --
  40 -- 41 00 08 00 00 00 00 1a 80 40 00  Error: UNC at LBA = 0x00001a80 = 6784

  Commands leading to the command that caused the error were:
  CR FEATR COUNT  LBA_48  LH LM LL DV DC  Powered_Up_Time  Command/Feature_Name
  -- == -- == -- == == == -- -- -- -- --  ---------------  --------------------
  60 00 08 00 00 00 00 00 00 1a 80 00 80 44d+07:51:06.812  READ FPDMA QUEUED
  2f 00 00 00 01 00 00 00 00 00 10 00 80 44d+07:51:04.212  READ LOG EXT
  60 00 80 00 00 00 00 00 00 1a 80 00 80 44d+07:51:04.212  READ FPDMA QUEUED
  2f 00 00 00 01 00 00 00 00 00 03 00 80 44d+07:51:01.512  READ LOG EXT
  b0 00 d5 00 01 00 00 00 c2 4f 01 00 80 44d+07:51:01.512  SMART READ LOG

Error 27 [26] occurred at disk power-on lifetime: 10886 hours (453 days + 14 hours)
  When the command that caused the error occurred, the device was in an unknown state.

  After command completion occurred, registers were:
  ER -- ST COUNT  LBA_48  LH LM LL DV DC
  -- -- -- == -- == == == -- -- -- -- --
  40 -- 41 00 80 00 00 00 00 1a 80 40 00  Error: UNC at LBA = 0x00001a80 = 6784

  Commands leading to the command that caused the error were:
  CR FEATR COUNT  LBA_48  LH LM LL DV DC  Powered_Up_Time  Command/Feature_Name
  -- == -- == -- == == == -- -- -- -- --  ---------------  --------------------
  60 00 80 00 00 00 00 00 00 1a 80 00 80 44d+07:51:04.212  READ FPDMA QUEUED
  2f 00 00 00 01 00 00 00 00 00 03 00 80 44d+07:51:01.512  READ LOG EXT
  b0 00 d5 00 01 00 00 00 c2 4f 01 00 80 44d+07:51:01.512  SMART READ LOG
  b0 00 d5 00 01 00 00 00 c2 4f 06 00 80 44d+07:51:01.512  SMART READ LOG
  b0 00 d0 00 01 00 00 00 c2 4f 00 00 80 44d+07:51:01.512  SMART READ DATA

Error 26 [25] occurred at disk power-on lifetime: 10860 hours (452 days + 12 hours)
  When the command that caused the error occurred, the device was in an unknown state.

  After command completion occurred, registers were:
  ER -- ST COUNT  LBA_48  LH LM LL DV DC
  -- -- -- == -- == == == -- -- -- -- --
  40 -- 41 00 08 00 00 06 19 ea c8 40 00  Error: 

  Commands leading to the command that caused the error were:
  CR FEATR COUNT  LBA_48  LH LM LL DV DC  Powered_Up_Time  Command/Feature_Name
  -- == -- == -- == == == -- -- -- -- --  ---------------  --------------------
  00 00 00 00 00 00 00 0c 8f 30 28 40 00 44d+07:41:26.812  NOP [Abort queued commands]
  ea 00 00 00 00 00 00 00 00 00 00 00 80 44d+07:41:24.112  FLUSH CACHE EXT
  ea 00 00 00 00 00 00 00 00 00 00 00 80 44d+07:41:23.512  FLUSH CACHE EXT
  ea 00 00 00 00 00 00 00 00 00 00 00 80 44d+07:41:23.512  FLUSH CACHE EXT
  ea 00 00 00 00 00 00 00 00 00 00 00 80 44d+07:41:23.512  FLUSH CACHE EXT

Error 25 [24] occurred at disk power-on lifetime: 10860 hours (452 days + 12 hours)
  When the command that caused the error occurred, the device was in an unknown state.

  After command completion occurred, registers were:
  ER -- ST COUNT  LBA_48  LH LM LL DV DC
  -- -- -- == -- == == == -- -- -- -- --
  40 -- 41 00 08 00 00 06 18 b6 20 40 00  Error: 

  Commands leading to the command that caused the error were:
  CR FEATR COUNT  LBA_48  LH LM LL DV DC  Powered_Up_Time  Command/Feature_Name
  -- == -- == -- == == == -- -- -- -- --  ---------------  --------------------
  00 00 00 00 00 00 00 0e d7 4d a8 40 00 44d+07:41:17.112  NOP [Abort queued commands]
  ea 00 00 00 00 00 00 00 00 00 00 00 80 44d+07:41:14.512  FLUSH CACHE EXT
  ea 00 00 00 00 00 00 00 00 00 00 00 80 44d+07:41:14.512  FLUSH CACHE EXT
  ea 00 00 00 00 00 00 00 00 00 00 00 80 44d+07:41:14.512  FLUSH CACHE EXT
  ea 00 00 00 00 00 00 00 00 00 00 00 80 44d+07:41:14.512  FLUSH CACHE EXT

Error 24 [23] occurred at disk power-on lifetime: 10860 hours (452 days + 12 hours)
  When the command that caused the error occurred, the device was in an unknown state.

  After command completion occurred, registers were:
  ER -- ST COUNT  LBA_48  LH LM LL DV DC
  -- -- -- == -- == == == -- -- -- -- --
  40 -- 41 00 10 00 00 06 18 76 00 40 00  Error: 

  Commands leading to the command that caused the error were:
  CR FEATR COUNT  LBA_48  LH LM LL DV DC  Powered_Up_Time  Command/Feature_Name
  -- == -- == -- == == == -- -- -- -- --  ---------------  --------------------
  00 00 00 00 00 00 00 0c ed d1 b8 40 00 44d+07:41:10.712  NOP [Abort queued commands]
  ea 00 00 00 00 00 00 00 00 00 00 00 80 44d+07:41:08.112  FLUSH CACHE EXT
  ea 00 00 00 00 00 00 00 00 00 00 00 80 44d+07:41:08.012  FLUSH CACHE EXT
  ea 00 00 00 00 00 00 00 00 00 00 00 80 44d+07:41:08.012  FLUSH CACHE EXT
  ea 00 00 00 00 00 00 00 00 00 00 00 80 44d+07:41:07.912  FLUSH CACHE EXT

Error 23 [22] occurred at disk power-on lifetime: 10860 hours (452 days + 12 hours)
  When the command that caused the error occurred, the device was in an unknown state.

  After command completion occurred, registers were:
  ER -- ST COUNT  LBA_48  LH LM LL DV DC
  -- -- -- == -- == == == -- -- -- -- --
  40 -- 41 00 18 00 00 0c 82 93 98 40 00  Error: 

  Commands leading to the command that caused the error were:
  CR FEATR COUNT  LBA_48  LH LM LL DV DC  Powered_Up_Time  Command/Feature_Name
  -- == -- == -- == == == -- -- -- -- --  ---------------  --------------------
  00 00 00 00 00 00 00 0c ef 8c 78 40 00 44d+07:40:44.512  NOP [Abort queued commands]
  ea 00 00 00 00 00 00 00 00 00 00 00 80 44d+07:40:41.012  FLUSH CACHE EXT
  ea 00 00 00 00 00 00 00 00 00 00 00 80 44d+07:40:41.012  FLUSH CACHE EXT
  ea 00 00 00 00 00 00 00 00 00 00 00 80 44d+07:40:39.512  FLUSH CACHE EXT
  ea 00 00 00 00 00 00 00 00 00 00 00 80 44d+07:40:39.012  FLUSH CACHE EXT

Error 22 [21] occurred at disk power-on lifetime: 10860 hours (452 days + 12 hours)
  When the command that caused the error occurred, the device was in an unknown state.

  After command completion occurred, registers were:
  ER -- ST COUNT  LBA_48  LH LM LL DV DC
  -- -- -- == -- == == == -- -- -- -- --
  40 -- 41 00 10 00 00 0c 74 a9 90 40 00  Error: 

  Commands leading to the command that caused the error were:
  CR FEATR COUNT  LBA_48  LH LM LL DV DC  Powered_Up_Time  Command/Feature_Name
  -- == -- == -- == == == -- -- -- -- --  ---------------  --------------------
  00 00 00 00 00 00 00 0d d0 d7 a8 40 00 44d+07:40:35.712  NOP [Abort queued commands]
  ea 00 00 00 00 00 00 00 00 00 00 00 80 44d+07:40:32.612  FLUSH CACHE EXT
  ea 00 00 00 00 00 00 00 00 00 00 00 80 44d+07:40:32.312  FLUSH CACHE EXT
  ea 00 00 00 00 00 00 00 00 00 00 00 80 44d+07:40:32.212  FLUSH CACHE EXT
  ea 00 00 00 00 00 00 00 00 00 00 00 80 44d+07:40:31.212  FLUSH CACHE EXT

SMART Extended Self-test Log Version: 1 (1 sectors)
Num  Test_Description    Status                  Remaining  LifeTime(hours)  LBA_of_first_error
# 1  Short offline       Completed without error       00%     10887         -
# 2  Extended offline    Completed without error       00%     10887         -
# 3  Extended offline    Completed without error       00%     10860         -
# 4  Short offline       Completed without error       00%     10853         -
# 5  Short offline       Completed without error       00%     10829         -
# 6  Short offline       Completed without error       00%     10805         -
# 7  Extended offline    Completed without error       00%     10804         -
# 8  Short offline       Completed without error       00%     10781         -
# 9  Short offline       Completed without error       00%     10757         -
#10  Short offline       Completed without error       00%     10733         -
#11  Short offline       Completed without error       00%     10709         -
#12  Short offline       Completed without error       00%     10685         -
#13  Short offline       Completed without error       00%     10661         -
#14  Short offline       Completed without error       00%     10637         -
#15  Extended offline    Completed without error       00%     10636         -
#16  Short offline       Completed without error       00%     10613         -
#17  Short offline       Completed without error       00%     10589         -
#18  Short offline       Completed without error       00%     10565         -
#19  Short offline       Completed without error       00%     10541         -

SMART Selective self-test log data structure revision number 1
 SPAN  MIN_LBA  MAX_LBA  CURRENT_TEST_STATUS
    1        0        0  Not_testing
    2        0        0  Not_testing
    3        0        0  Not_testing
    4        0        0  Not_testing
    5        0        0  Not_testing
Selective self-test flags (0x0):
  After scanning selected spans, do NOT read-scan remainder of disk.
If Selective self-test is pending on power-up, resume after 0 minute delay.

SCT Status Version:                  3
SCT Version (vendor specific):       1 (0x0001)
Device State:                        Active (0)
Current Temperature:                    40 Celsius
Power Cycle Min/Max Temperature:      ?/40 Celsius
Lifetime    Min/Max Temperature:      ?/ ? Celsius
Under/Over Temperature Limit Count:   0/0

SCT Temperature History Version:     2
Temperature Sampling Period:         1 minute
Temperature Logging Interval:        1 minute
Min/Max recommended Temperature:     -127/127 Celsius
Min/Max Temperature Limit:           -127/127 Celsius
Temperature History Size (Index):    478 (304)

Index    Estimated Time   Temperature Celsius
 305    2023-01-31 04:25    40  *********************
 ...    ..(476 skipped).    ..  *********************
 304    2023-01-31 12:22    40  *********************

SCT Error Recovery Control command not supported

Device Statistics (GP Log 0x04)
Page  Offset Size        Value Flags Description
0x01  =====  =               =  ===  == General Statistics (rev 1) ==
0x01  0x008  4              12  ---  Lifetime Power-On Resets
0x01  0x010  4           10887  ---  Power-on Hours
0x01  0x018  6    275070941645  ---  Logical Sectors Written
0x01  0x020  6      4200007657  ---  Number of Write Commands
0x01  0x028  6      2571899608  ---  Logical Sectors Read
0x01  0x030  6       117258488  ---  Number of Read Commands
0x01  0x038  6  10007715304616  ---  Date and Time TimeStamp
0x07  =====  =               =  ===  == Solid State Device Statistics (rev 1) ==
0x07  0x008  1             255  N--  Percentage Used Endurance Indicator
                                |||_ C monitored condition met
                                ||__ D supports DSN
                                |___ N normalized value

Pending Defects log (GP Log 0x0c) not supported

SATA Phy Event Counters (GP Log 0x11)
ID      Size     Value  Description
0x0001  2           29  Command failed due to ICRC error
0x0003  2            0  R_ERR response for device-to-host data FIS
0x0004  2            0  R_ERR response for host-to-device data FIS
0x0006  2            0  R_ERR response for device-to-host non-data FIS
0x0007  2            0  R_ERR response for host-to-device non-data FIS
0x0008  2            0  Device-to-host non-data FIS retries
0x0009  4            0  Transition from drive PhyRdy to drive PhyNRdy
0x000a  4           46  Device-to-host register FISes sent due to a COMRESET
0x000f  2            0  R_ERR response for host-to-device data FIS, CRC
0x0010  2            0  R_ERR response for host-to-device data FIS, non-CRC
0x0012  2            0  R_ERR response for host-to-device non-data FIS, CRC
0x0013  2            0  R_ERR response for host-to-device non-data FIS, non-CRC

