smartctl 7.0 2018-12-30 r4883 [x86_64-linux-4.4.0-150-generic] (local build)
Copyright (C) 2002-18, Bruce Allen, Christian Franke, www.smartmontools.org

=== START OF INFORMATION SECTION ===
Device Model:     MZ7LM240HMHQ0D3
Add. Product Id:  DELL(tm)
Firmware Version: GC5B
User Capacity:    240,057,409,536 bytes [240 GB]
Sector Size:      512 bytes logical/physical
Rotation Rate:    Solid State Device
Form Factor:      2.5 inches
Device is:        Not in smartctl database [for details use: -P showall]
ATA Version is:   ACS-3 T13/2161-D revision 5
SATA Version is:  SATA 3.2, 6.0 Gb/s (current: 6.0 Gb/s)
Local Time is:    Wed Jun  5 20:05:37 2019 CDT
SMART support is: Available - device has SMART capability.
SMART support is: Enabled
AAM feature is:   Unavailable
APM feature is:   Unavailable
Rd look-ahead is: Enabled
Write cache is:   Enabled
DSN feature is:   Unavailable
ATA Security is:  Disabled, NOT FROZEN [SEC1]
Wt Cache Reorder: Enabled

=== START OF READ SMART DATA SECTION ===
SMART overall-health self-assessment test result: PASSED

General SMART Values:
Offline data collection status:  (0x82)	Offline data collection activity
					was completed without error.
					Auto Offline Data Collection: Enabled.
Self-test execution status:      (   0)	The previous self-test routine completed
					without error or no self-test has ever 
					been run.
Total time to complete Offline 
data collection: 		( 1740) seconds.
Offline data collection
capabilities: 			 (0x5b) SMART execute Offline immediate.
					Auto Offline data collection on/off support.
					Suspend Offline collection upon new
					command.
					Offline surface scan supported.
					Self-test supported.
					No Conveyance Self-test supported.
					Selective Self-test supported.
SMART capabilities:            (0x0003)	Saves SMART data before entering
					power-saving mode.
					Supports SMART auto save timer.
Error logging capability:        (0x01)	Error logging supported.
					General Purpose Logging supported.
Short self-test routine 
recommended polling time: 	 (   2) minutes.
Extended self-test routine
recommended polling time: 	 (  29) minutes.
SCT capabilities: 	       (0x003d)	SCT Status supported.
					SCT Error Recovery Control supported.
					SCT Feature Control supported.
					SCT Data Table supported.

SMART Attributes Data Structure revision number: 1
Vendor Specific SMART Attributes with Thresholds:
ID# ATTRIBUTE_NAME          FLAGS    VALUE WORST THRESH FAIL RAW_VALUE
  1 Raw_Read_Error_Rate     -O-RC-   200   200   000    -    0
  5 Reallocated_Sector_Ct   PO--CK   100   100   010    -    0
  9 Power_On_Hours          -O--CK   099   099   000    -    24
 12 Power_Cycle_Count       -O--CK   099   099   000    -    30
 13 Read_Soft_Error_Rate    -O-RC-   200   200   000    -    0
177 Wear_Leveling_Count     PO--C-   100   099   005    -    0
179 Used_Rsvd_Blk_Cnt_Tot   PO--C-   100   100   010    -    0
180 Unused_Rsvd_Blk_Cnt_Tot -O--C-   100   100   000    -    813
181 Program_Fail_Cnt_Total  -O--CK   100   100   000    -    0
182 Erase_Fail_Count_Total  -O--CK   100   100   000    -    0
184 End-to-End_Error        PO--CK   100   100   097    -    0
194 Temperature_Celsius     -O---K   067   063   000    -    33
195 Hardware_ECC_Recovered  -O-RC-   100   100   000    -    0
198 Offline_Uncorrectable   ----CK   100   100   000    -    0
199 UDMA_CRC_Error_Count    -OSRCK   100   100   000    -    0
201 Unknown_SSD_Attribute   PO--CK   100   100   001    -    0
202 Unknown_SSD_Attribute   PO--CK   100   100   010    -    0
233 Media_Wearout_Indicator -O--CK   099   099   000    -    42837179
235 Unknown_Attribute       -O--C-   099   099   000    -    22
242 Total_LBAs_Read         -O--CK   099   099   000    -    17245423
243 Unknown_Attribute       -O--CK   100   100   000    -    0
244 Unknown_Attribute       -O--CK   100   100   000    -    0
245 Unknown_Attribute       -O-RCK   100   100   000    -    100
246 Unknown_Attribute       -O--CK   100   100   000    -    65535
247 Unknown_Attribute       -O--CK   100   100   000    -    65535
248 Unknown_Attribute       -O--CK   100   100   000    -    65535
251 Unknown_Attribute       -O--CK   100   100   000    -    52299520
                            ||||||_ K auto-keep
                            |||||__ C event count
                            ||||___ R error rate
                            |||____ S speed/performance
                            ||_____ O updated online
                            |______ P prefailure warning

General Purpose Log Directory Version 1
SMART           Log Directory Version 1 [multi-sector log support]
Address    Access  R/W   Size  Description
0x00       GPL,SL  R/O      1  Log Directory
0x01           SL  R/O      1  Summary SMART error log
0x02           SL  R/O      1  Comprehensive SMART error log
0x03       GPL     R/O      1  Ext. Comprehensive SMART error log
0x04       GPL,SL  R/O      8  Device Statistics log
0x06           SL  R/O      1  SMART self-test log
0x07       GPL     R/O      1  Extended self-test log
0x09           SL  R/W      1  Selective self-test log
0x10       GPL     R/O      1  NCQ Command Error log
0x11       GPL     R/O      1  SATA Phy Event Counters log
0x13       GPL     R/O      1  SATA NCQ Send and Receive log
0x24       GPL     R/O      8  Current Device Internal Status Data log
0x30       GPL,SL  R/O      9  IDENTIFY DEVICE data log
0x80-0x98  GPL,SL  R/W     16  Host vendor specific log
0x99-0x9a  GPL,SL  R/W      1  Host vendor specific log
0x9b-0x9f  GPL,SL  R/W     16  Host vendor specific log
0xa0       GPL     VS      16  Device vendor specific log
0xce           SL  VS      16  Device vendor specific log
0xe0       GPL,SL  R/W      1  SCT Command/Status
0xe1       GPL,SL  R/W      1  SCT Data Transfer

SMART Extended Comprehensive Error Log Version: 1 (1 sectors)
No Errors Logged

SMART Extended Self-test Log Version: 1 (1 sectors)
Num  Test_Description    Status                  Remaining  LifeTime(hours)  LBA_of_first_error
# 1  Short offline       Completed without error       00%        24         -
# 2  Short offline       Completed without error       00%        12         -
# 3  Extended offline    Completed without error       00%         1         -
# 4  Short offline       Completed without error       00%         1         -

SMART Selective self-test log data structure revision number 1
 SPAN  MIN_LBA  MAX_LBA  CURRENT_TEST_STATUS
    1        0        0  Not_testing
    2        0        0  Not_testing
    3        0        0  Not_testing
    4        0        0  Not_testing
    5        0        0  Not_testing
  255        0    65535  Read_scanning was completed without error
Selective self-test flags (0x0):
  After scanning selected spans, do NOT read-scan remainder of disk.
If Selective self-test is pending on power-up, resume after 0 minute delay.

SCT Status Version:                  3
SCT Version (vendor specific):       256 (0x0100)
Device State:                        SCT command executing in background (5)
Current Temperature:                    33 Celsius
Power Cycle Min/Max Temperature:     24/34 Celsius
Lifetime    Min/Max Temperature:     21/37 Celsius
Under/Over Temperature Limit Count:   0/0

SCT Temperature History Version:     2
Temperature Sampling Period:         1 minute
Temperature Logging Interval:        10 minutes
Min/Max recommended Temperature:      0/70 Celsius
Min/Max Temperature Limit:            0/70 Celsius
Temperature History Size (Index):    128 (18)

Index    Estimated Time   Temperature Celsius
  19    2019-06-04 22:50     ?  -
  20    2019-06-04 23:00    36  *****************
  21    2019-06-04 23:10    36  *****************
  22    2019-06-04 23:20    36  *****************
  23    2019-06-04 23:30    37  ******************
  24    2019-06-04 23:40    37  ******************
  25    2019-06-04 23:50    37  ******************
  26    2019-06-05 00:00     ?  -
  27    2019-06-05 00:10    37  ******************
  28    2019-06-05 00:20     ?  -
  29    2019-06-05 00:30    35  ****************
  30    2019-06-05 00:40    35  ****************
  31    2019-06-05 00:50    35  ****************
  32    2019-06-05 01:00     ?  -
  33    2019-06-05 01:10    35  ****************
 ...    ..(  4 skipped).    ..  ****************
  38    2019-06-05 02:00    35  ****************
  39    2019-06-05 02:10     ?  -
  40    2019-06-05 02:20    36  *****************
  41    2019-06-05 02:30    35  ****************
  42    2019-06-05 02:40    36  *****************
 ...    ..(  5 skipped).    ..  *****************
  48    2019-06-05 03:40    36  *****************
  49    2019-06-05 03:50    35  ****************
 ...    ..( 15 skipped).    ..  ****************
  65    2019-06-05 06:30    35  ****************
  66    2019-06-05 06:40    36  *****************
  67    2019-06-05 06:50    36  *****************
  68    2019-06-05 07:00    35  ****************
  69    2019-06-05 07:10    35  ****************
  70    2019-06-05 07:20     ?  -
  71    2019-06-05 07:30    34  ***************
  72    2019-06-05 07:40    31  ************
  73    2019-06-05 07:50    30  ***********
  74    2019-06-05 08:00    31  ************
  75    2019-06-05 08:10    32  *************
  76    2019-06-05 08:20    33  **************
  77    2019-06-05 08:30    34  ***************
  78    2019-06-05 08:40    34  ***************
  79    2019-06-05 08:50    33  **************
  80    2019-06-05 09:00    32  *************
  81    2019-06-05 09:10    32  *************
  82    2019-06-05 09:20    33  **************
  83    2019-06-05 09:30    34  ***************
  84    2019-06-05 09:40    32  *************
  85    2019-06-05 09:50    32  *************
  86    2019-06-05 10:00    32  *************
  87    2019-06-05 10:10    33  **************
  88    2019-06-05 10:20    34  ***************
  89    2019-06-05 10:30    33  **************
  90    2019-06-05 10:40    32  *************
  91    2019-06-05 10:50    32  *************
  92    2019-06-05 11:00    33  **************
  93    2019-06-05 11:10    34  ***************
  94    2019-06-05 11:20    33  **************
  95    2019-06-05 11:30    32  *************
  96    2019-06-05 11:40    32  *************
  97    2019-06-05 11:50    33  **************
 ...    ..(  2 skipped).    ..  **************
 100    2019-06-05 12:20    33  **************
 101    2019-06-05 12:30    32  *************
 102    2019-06-05 12:40    32  *************
 103    2019-06-05 12:50    32  *************
 104    2019-06-05 13:00    33  **************
 105    2019-06-05 13:10    34  ***************
 106    2019-06-05 13:20    33  **************
 ...    ..(  6 skipped).    ..  **************
 113    2019-06-05 14:30    33  **************
 114    2019-06-05 14:40    32  *************
 115    2019-06-05 14:50    32  *************
 116    2019-06-05 15:00    33  **************
 117    2019-06-05 15:10    34  ***************
 118    2019-06-05 15:20    33  **************
 ...    ..(  5 skipped).    ..  **************
 124    2019-06-05 16:20    33  **************
 125    2019-06-05 16:30    32  *************
 126    2019-06-05 16:40    32  *************
 127    2019-06-05 16:50    33  **************
   0    2019-06-05 17:00    34  ***************
   1    2019-06-05 17:10    33  **************
 ...    ..(  4 skipped).    ..  **************
   6    2019-06-05 18:00    33  **************
   7    2019-06-05 18:10    32  *************
   8    2019-06-05 18:20    32  *************
   9    2019-06-05 18:30    32  *************
  10    2019-06-05 18:40    34  ***************
  11    2019-06-05 18:50    33  **************
 ...    ..(  3 skipped).    ..  **************
  15    2019-06-05 19:30    33  **************
  16    2019-06-05 19:40    32  *************
  17    2019-06-05 19:50    32  *************
  18    2019-06-05 20:00    31  ************

SCT Error Recovery Control:
           Read:     80 (8.0 seconds)
          Write:     80 (8.0 seconds)

Device Statistics (GP Log 0x04)
Page  Offset Size        Value Flags Description
0x01  =====  =               =  ===  == General Statistics (rev 1) ==
0x01  0x008  4              30  ---  Lifetime Power-On Resets
0x01  0x010  4              24  ---  Power-on Hours
0x01  0x018  6        42837179  ---  Logical Sectors Written
0x01  0x020  6          363147  ---  Number of Write Commands
0x01  0x028  6        17245423  ---  Logical Sectors Read
0x01  0x030  6          269060  ---  Number of Read Commands
0x01  0x038  6         1129000  ---  Date and Time TimeStamp
0x04  =====  =               =  ===  == General Errors Statistics (rev 1) ==
0x04  0x008  4               0  ---  Number of Reported Uncorrectable Errors
0x04  0x010  4               0  ---  Resets Between Cmd Acceptance and Completion
0x05  =====  =               =  ===  == Temperature Statistics (rev 1) ==
0x05  0x008  1              33  ---  Current Temperature
0x05  0x020  1              37  ---  Highest Temperature
0x05  0x028  1              21  ---  Lowest Temperature
0x05  0x058  1              70  ---  Specified Maximum Operating Temperature
0x06  =====  =               =  ===  == Transport Statistics (rev 1) ==
0x06  0x008  4               9  ---  Number of Hardware Resets
0x06  0x010  4               0  ---  Number of ASR Events
0x06  0x018  4               0  ---  Number of Interface CRC Errors
0x07  =====  =               =  ===  == Solid State Device Statistics (rev 1) ==
0x07  0x008  1               0  N--  Percentage Used Endurance Indicator
                                |||_ C monitored condition met
                                ||__ D supports DSN
                                |___ N normalized value

Pending Defects log (GP Log 0x0c) not supported

SATA Phy Event Counters (GP Log 0x11)
ID      Size     Value  Description
0x0001  2            0  Command failed due to ICRC error
0x0002  2            0  R_ERR response for data FIS
0x0003  2            0  R_ERR response for device-to-host data FIS
0x0004  2            0  R_ERR response for host-to-device data FIS
0x0005  2            0  R_ERR response for non-data FIS
0x0006  2            0  R_ERR response for device-to-host non-data FIS
0x0007  2            0  R_ERR response for host-to-device non-data FIS
0x0008  2            0  Device-to-host non-data FIS retries
0x0009  2            0  Transition from drive PhyRdy to drive PhyNRdy
0x000a  2            0  Device-to-host register FISes sent due to a COMRESET
0x000b  2            0  CRC errors within host-to-device FIS
0x000d  2            0  Non-CRC errors within host-to-device FIS
0x000f  2            0  R_ERR response for host-to-device data FIS, CRC
0x0010  2            0  R_ERR response for host-to-device data FIS, non-CRC
0x0012  2            0  R_ERR response for host-to-device non-data FIS, CRC
0x0013  2            0  R_ERR response for host-to-device non-data FIS, non-CRC

