smartctl 7.1 2019-12-30 r5022 [x86_64-linux-5.8.0-53-generic] (local build)
Copyright (C) 2002-19, Bruce Allen, Christian Franke, www.smartmontools.org

=== START OF INFORMATION SECTION ===
Device Model:     MTFDDAK256TDL-1AW1ZABFA
Serial Number:    2010278E113D
LU WWN Device Id: 5 00a075 1278e113d
Firmware Version: M5MA030
User Capacity:    256.060.514.304 bytes [256 GB]
Sector Size:      512 bytes logical/physical
Rotation Rate:    Solid State Device
Form Factor:      2.5 inches
Device is:        Not in smartctl database [for details use: -P showall]
ATA Version is:   ACS-4 T13/BSR INCITS 529 revision 5
SATA Version is:  SATA 3.3, 6.0 Gb/s (current: 6.0 Gb/s)
Local Time is:    Tue May 18 11:11:37 2021 CEST
SMART support is: Available - device has SMART capability.
SMART support is: Enabled
AAM feature is:   Unavailable
APM feature is:   Unavailable
Rd look-ahead is: Enabled
Write cache is:   Enabled
DSN feature is:   Unavailable
ATA Security is:  Disabled, frozen [SEC2]
Wt Cache Reorder: Enabled

=== START OF READ SMART DATA SECTION ===
SMART overall-health self-assessment test result: PASSED

General SMART Values:
Offline data collection status:  (0x00)	Offline data collection activity
					was never started.
					Auto Offline Data Collection: Disabled.
Self-test execution status:      (   0)	The previous self-test routine completed
					without error or no self-test has ever 
					been run.
Total time to complete Offline 
data collection: 		(  605) seconds.
Offline data collection
capabilities: 			 (0x7b) SMART execute Offline immediate.
					Auto Offline data collection on/off support.
					Suspend Offline collection upon new
					command.
					Offline surface scan supported.
					Self-test supported.
					Conveyance Self-test supported.
					Selective Self-test supported.
SMART capabilities:            (0x0003)	Saves SMART data before entering
					power-saving mode.
					Supports SMART auto save timer.
Error logging capability:        (0x01)	Error logging supported.
					General Purpose Logging supported.
Short self-test routine 
recommended polling time: 	 (   2) minutes.
Extended self-test routine
recommended polling time: 	 (   4) minutes.
Conveyance self-test routine
recommended polling time: 	 (   3) minutes.
SCT capabilities: 	       (0x0035)	SCT Status supported.
					SCT Feature Control supported.
					SCT Data Table supported.

SMART Attributes Data Structure revision number: 16
Vendor Specific SMART Attributes with Thresholds:
ID# ATTRIBUTE_NAME          FLAGS    VALUE WORST THRESH FAIL RAW_VALUE
  1 Raw_Read_Error_Rate     POSR-K   100   100   000    -    0
  5 Reallocated_Sector_Ct   -O--CK   100   100   010    -    0
  9 Power_On_Hours          -O--CK   100   100   000    -    523
 12 Power_Cycle_Count       -O--CK   100   100   000    -    20
171 Unknown_Attribute       -O--CK   100   100   000    -    0
172 Unknown_Attribute       -O--CK   100   100   000    -    0
173 Unknown_Attribute       -O--CK   100   100   000    -    1
174 Unknown_Attribute       -O--CK   100   100   000    -    14
183 Runtime_Bad_Block       -O--CK   100   100   000    -    0
184 End-to-End_Error        -O--CK   100   100   000    -    0
187 Reported_Uncorrect      -O--CK   100   100   000    -    0
194 Temperature_Celsius     -O---K   068   060   000    -    32 (Min/Max 19/40)
196 Reallocated_Event_Count -O--CK   100   100   000    -    0
197 Current_Pending_Sector  -O--CK   100   100   000    -    0
198 Offline_Uncorrectable   ----CK   100   100   000    -    0
199 UDMA_CRC_Error_Count    -O--CK   100   100   000    -    0
202 Unknown_SSD_Attribute   ----CK   100   100   001    -    0
206 Unknown_SSD_Attribute   -OSR--   100   100   000    -    0
246 Unknown_Attribute       -O--CK   100   100   000    -    145884601
247 Unknown_Attribute       -O--CK   100   100   000    -    4559812
248 Unknown_Attribute       -O--CK   100   100   000    -    1959875
180 Unused_Rsvd_Blk_Cnt_Tot PO--CK   000   000   000    -    308
210 Unknown_Attribute       -O--CK   100   100   000    -    0
                            ||||||_ K auto-keep
                            |||||__ C event count
                            ||||___ R error rate
                            |||____ S speed/performance
                            ||_____ O updated online
                            |______ P prefailure warning

General Purpose Log Directory Version 1
SMART           Log Directory Version 1 [multi-sector log support]
Address    Access  R/W   Size  Description
0x00       GPL,SL  R/O      1  Log Directory
0x01           SL  R/O      1  Summary SMART error log
0x02           SL  R/O     51  Comprehensive SMART error log
0x03       GPL     R/O  16383  Ext. Comprehensive SMART error log
0x04       GPL,SL  R/O      8  Device Statistics log
0x06           SL  R/O      1  SMART self-test log
0x07       GPL     R/O      1  Extended self-test log
0x09           SL  R/W      1  Selective self-test log
0x10       GPL     R/O      1  NCQ Command Error log
0x11       GPL     R/O      1  SATA Phy Event Counters log
0x13       GPL     R/O      1  SATA NCQ Send and Receive log
0x24       GPL     R/O   8000  Current Device Internal Status Data log
0x25       GPL     R/O   8000  Saved Device Internal Status Data log
0x30       GPL,SL  R/O      9  IDENTIFY DEVICE data log
0x80-0x9f  GPL,SL  R/W     16  Host vendor specific log
0xa0       GPL     VS   35328  Device vendor specific log
0xa0       SL      VS     255  Device vendor specific log
0xa1       GPL,SL  VS       4  Device vendor specific log
0xa2       GPL,SL  VS       1  Device vendor specific log
0xa3       GPL     VS   38400  Device vendor specific log
0xa3       SL      VS     255  Device vendor specific log
0xa4       GPL     VS   16477  Device vendor specific log
0xa4       SL      VS     255  Device vendor specific log
0xa5       GPL     VS    8000  Device vendor specific log
0xa5       SL      VS     255  Device vendor specific log
0xa6       GPL     VS    8000  Device vendor specific log
0xa6       SL      VS     255  Device vendor specific log
0xa7       GPL     VS   32768  Device vendor specific log
0xa7       SL      VS     255  Device vendor specific log
0xa8-0xdf  GPL,SL  VS       1  Device vendor specific log
0xe0       GPL,SL  R/W      1  SCT Command/Status
0xe1       GPL,SL  R/W      1  SCT Data Transfer

SMART Extended Comprehensive Error Log Version: 1 (16383 sectors)
No Errors Logged

SMART Extended Self-test Log Version: 1 (1 sectors)
Num  Test_Description    Status                  Remaining  LifeTime(hours)  LBA_of_first_error
# 1  Short offline       Completed without error       00%       523         -
# 2  Short offline       Completed without error       00%       514         -
# 3  Extended offline    Completed without error       00%       501         -
# 4  Short offline       Completed without error       00%       495         -
# 5  Short offline       Completed without error       00%       471         -
# 6  Short offline       Completed without error       00%       447         -
# 7  Extended offline    Completed without error       00%       424         -
# 8  Short offline       Completed without error       00%       423         -
# 9  Short offline       Completed without error       00%       399         -
#10  Short offline       Completed without error       00%       375         -
#11  Short offline       Completed without error       00%       351         -
#12  Short offline       Completed without error       00%       327         -
#13  Short offline       Completed without error       00%       303         -
#14  Short offline       Completed without error       00%       279         -
#15  Extended offline    Completed without error       00%       256         -
#16  Short offline       Completed without error       00%       255         -
#17  Short offline       Completed without error       00%       231         -
#18  Short offline       Completed without error       00%       207         -
#19  Short offline       Completed without error       00%       183         -

SMART Selective self-test log data structure revision number 1
 SPAN  MIN_LBA  MAX_LBA  CURRENT_TEST_STATUS
    1        0        0  Not_testing
    2        0        0  Not_testing
    3        0        0  Completed [00% left] (57881389-57946924)
    4        0        0  Not_testing
    5        0        0  Not_testing
Selective self-test flags (0x0):
  After scanning selected spans, do NOT read-scan remainder of disk.
If Selective self-test is pending on power-up, resume after 0 minute delay.

SCT Status Version:                  3
SCT Version (vendor specific):       1 (0x0001)
Device State:                        Active (0)
Current Temperature:                    32 Celsius
Power Cycle Min/Max Temperature:     21/34 Celsius
Lifetime    Min/Max Temperature:     19/40 Celsius
Specified Max Operating Temperature:    70 Celsius
Under/Over Temperature Limit Count:   0/0
SMART Status:                        0xc24f (PASSED)
Minimum supported ERC Time Limit:    50 (5,0 seconds)

SCT Temperature History Version:     2
Temperature Sampling Period:         1 minute
Temperature Logging Interval:        1 minute
Min/Max recommended Temperature:      0/70 Celsius
Min/Max Temperature Limit:           -1/71 Celsius
Temperature History Size (Index):    478 (258)

Index    Estimated Time   Temperature Celsius
 259    2021-05-18 03:14    30  ***********
 260    2021-05-18 03:15    30  ***********
 261    2021-05-18 03:16    29  **********
 262    2021-05-18 03:17    30  ***********
 ...    ..( 42 skipped).    ..  ***********
 305    2021-05-18 04:00    30  ***********
 306    2021-05-18 04:01    31  ************
 307    2021-05-18 04:02    31  ************
 308    2021-05-18 04:03    30  ***********
 ...    ..(  4 skipped).    ..  ***********
 313    2021-05-18 04:08    30  ***********
 314    2021-05-18 04:09    31  ************
 ...    ..(  5 skipped).    ..  ************
 320    2021-05-18 04:15    31  ************
 321    2021-05-18 04:16    30  ***********
 322    2021-05-18 04:17    30  ***********
 323    2021-05-18 04:18    31  ************
 324    2021-05-18 04:19    31  ************
 325    2021-05-18 04:20    31  ************
 326    2021-05-18 04:21    30  ***********
 327    2021-05-18 04:22    31  ************
 328    2021-05-18 04:23    30  ***********
 329    2021-05-18 04:24    30  ***********
 330    2021-05-18 04:25    31  ************
 331    2021-05-18 04:26    31  ************
 332    2021-05-18 04:27    30  ***********
 333    2021-05-18 04:28    31  ************
 334    2021-05-18 04:29    30  ***********
 335    2021-05-18 04:30    31  ************
 ...    ..( 87 skipped).    ..  ************
 423    2021-05-18 05:58    31  ************
 424    2021-05-18 05:59    30  ***********
 425    2021-05-18 06:00    31  ************
 ...    ..( 11 skipped).    ..  ************
 437    2021-05-18 06:12    31  ************
 438    2021-05-18 06:13    33  **************
 439    2021-05-18 06:14    34  ***************
 440    2021-05-18 06:15    33  **************
 441    2021-05-18 06:16    32  *************
 442    2021-05-18 06:17    33  **************
 443    2021-05-18 06:18    33  **************
 444    2021-05-18 06:19    32  *************
 445    2021-05-18 06:20    31  ************
 446    2021-05-18 06:21    32  *************
 447    2021-05-18 06:22    31  ************
 448    2021-05-18 06:23    34  ***************
 449    2021-05-18 06:24    32  *************
 450    2021-05-18 06:25    32  *************
 451    2021-05-18 06:26    31  ************
 ...    ..( 22 skipped).    ..  ************
 474    2021-05-18 06:49    31  ************
 475    2021-05-18 06:50    33  **************
 476    2021-05-18 06:51    33  **************
 477    2021-05-18 06:52    32  *************
   0    2021-05-18 06:53    30  ***********
 ...    ..( 11 skipped).    ..  ***********
  12    2021-05-18 07:05    30  ***********
  13    2021-05-18 07:06    29  **********
  14    2021-05-18 07:07    30  ***********
  15    2021-05-18 07:08    29  **********
 ...    ..( 13 skipped).    ..  **********
  29    2021-05-18 07:22    29  **********
  30    2021-05-18 07:23    30  ***********
  31    2021-05-18 07:24    29  **********
  32    2021-05-18 07:25    30  ***********
  33    2021-05-18 07:26    29  **********
  34    2021-05-18 07:27    30  ***********
  35    2021-05-18 07:28    29  **********
  36    2021-05-18 07:29    30  ***********
  37    2021-05-18 07:30    29  **********
  38    2021-05-18 07:31    30  ***********
  39    2021-05-18 07:32    29  **********
  40    2021-05-18 07:33    30  ***********
  41    2021-05-18 07:34    29  **********
  42    2021-05-18 07:35    30  ***********
 ...    ..(  3 skipped).    ..  ***********
  46    2021-05-18 07:39    30  ***********
  47    2021-05-18 07:40    29  **********
  48    2021-05-18 07:41    30  ***********
  49    2021-05-18 07:42    30  ***********
  50    2021-05-18 07:43    30  ***********
  51    2021-05-18 07:44    29  **********
  52    2021-05-18 07:45    29  **********
  53    2021-05-18 07:46    29  **********
  54    2021-05-18 07:47    30  ***********
  55    2021-05-18 07:48    29  **********
 ...    ..(  3 skipped).    ..  **********
  59    2021-05-18 07:52    29  **********
  60    2021-05-18 07:53    30  ***********
  61    2021-05-18 07:54    29  **********
  62    2021-05-18 07:55    30  ***********
  63    2021-05-18 07:56    29  **********
  64    2021-05-18 07:57    30  ***********
  65    2021-05-18 07:58    29  **********
  66    2021-05-18 07:59    30  ***********
  67    2021-05-18 08:00    30  ***********
  68    2021-05-18 08:01    30  ***********
  69    2021-05-18 08:02    29  **********
  70    2021-05-18 08:03    29  **********
  71    2021-05-18 08:04    29  **********
  72    2021-05-18 08:05    30  ***********
  73    2021-05-18 08:06    29  **********
  74    2021-05-18 08:07    29  **********
  75    2021-05-18 08:08    30  ***********
 ...    ..(  4 skipped).    ..  ***********
  80    2021-05-18 08:13    30  ***********
  81    2021-05-18 08:14    29  **********
 ...    ..(  3 skipped).    ..  **********
  85    2021-05-18 08:18    29  **********
  86    2021-05-18 08:19    30  ***********
  87    2021-05-18 08:20    29  **********
 ...    ..(  7 skipped).    ..  **********
  95    2021-05-18 08:28    29  **********
  96    2021-05-18 08:29    30  ***********
  97    2021-05-18 08:30    29  **********
  98    2021-05-18 08:31    29  **********
  99    2021-05-18 08:32    29  **********
 100    2021-05-18 08:33    30  ***********
 101    2021-05-18 08:34    29  **********
 102    2021-05-18 08:35    29  **********
 103    2021-05-18 08:36    29  **********
 104    2021-05-18 08:37    30  ***********
 105    2021-05-18 08:38    30  ***********
 106    2021-05-18 08:39    30  ***********
 107    2021-05-18 08:40    29  **********
 108    2021-05-18 08:41    30  ***********
 109    2021-05-18 08:42    30  ***********
 110    2021-05-18 08:43    30  ***********
 111    2021-05-18 08:44    29  **********
 ...    ..(  3 skipped).    ..  **********
 115    2021-05-18 08:48    29  **********
 116    2021-05-18 08:49    30  ***********
 117    2021-05-18 08:50    29  **********
 118    2021-05-18 08:51    29  **********
 119    2021-05-18 08:52    29  **********
 120    2021-05-18 08:53    30  ***********
 121    2021-05-18 08:54    29  **********
 122    2021-05-18 08:55    30  ***********
 123    2021-05-18 08:56    29  **********
 124    2021-05-18 08:57    29  **********
 125    2021-05-18 08:58    29  **********
 126    2021-05-18 08:59    30  ***********
 127    2021-05-18 09:00    29  **********
 128    2021-05-18 09:01    30  ***********
 129    2021-05-18 09:02    29  **********
 ...    ..(  9 skipped).    ..  **********
 139    2021-05-18 09:12    29  **********
 140    2021-05-18 09:13    30  ***********
 141    2021-05-18 09:14    29  **********
 142    2021-05-18 09:15    30  ***********
 143    2021-05-18 09:16    29  **********
 144    2021-05-18 09:17    30  ***********
 145    2021-05-18 09:18    29  **********
 ...    ..(  3 skipped).    ..  **********
 149    2021-05-18 09:22    29  **********
 150    2021-05-18 09:23    30  ***********
 151    2021-05-18 09:24    29  **********
 152    2021-05-18 09:25    30  ***********
 153    2021-05-18 09:26    29  **********
 154    2021-05-18 09:27    30  ***********
 155    2021-05-18 09:28    29  **********
 ...    ..(  9 skipped).    ..  **********
 165    2021-05-18 09:38    29  **********
 166    2021-05-18 09:39    30  ***********
 167    2021-05-18 09:40    29  **********
 168    2021-05-18 09:41    29  **********
 169    2021-05-18 09:42    30  ***********
 170    2021-05-18 09:43    30  ***********
 171    2021-05-18 09:44    29  **********
 ...    ..(  3 skipped).    ..  **********
 175    2021-05-18 09:48    29  **********
 176    2021-05-18 09:49    31  ************
 177    2021-05-18 09:50    32  *************
 178    2021-05-18 09:51    31  ************
 179    2021-05-18 09:52    30  ***********
 ...    ..( 16 skipped).    ..  ***********
 196    2021-05-18 10:09    30  ***********
 197    2021-05-18 10:10    29  **********
 198    2021-05-18 10:11    30  ***********
 199    2021-05-18 10:12    30  ***********
 200    2021-05-18 10:13    30  ***********
 201    2021-05-18 10:14    29  **********
 202    2021-05-18 10:15    29  **********
 203    2021-05-18 10:16    29  **********
 204    2021-05-18 10:17    30  ***********
 205    2021-05-18 10:18    29  **********
 206    2021-05-18 10:19    30  ***********
 207    2021-05-18 10:20    29  **********
 ...    ..(  5 skipped).    ..  **********
 213    2021-05-18 10:26    29  **********
 214    2021-05-18 10:27    30  ***********
 215    2021-05-18 10:28    30  ***********
 216    2021-05-18 10:29    29  **********
 217    2021-05-18 10:30    29  **********
 218    2021-05-18 10:31    30  ***********
 219    2021-05-18 10:32    29  **********
 220    2021-05-18 10:33    29  **********
 221    2021-05-18 10:34    29  **********
 222    2021-05-18 10:35    30  ***********
 223    2021-05-18 10:36    29  **********
 224    2021-05-18 10:37    30  ***********
 225    2021-05-18 10:38    30  ***********
 226    2021-05-18 10:39    30  ***********
 227    2021-05-18 10:40    29  **********
 228    2021-05-18 10:41    30  ***********
 229    2021-05-18 10:42    30  ***********
 230    2021-05-18 10:43    30  ***********
 231    2021-05-18 10:44    29  **********
 232    2021-05-18 10:45    30  ***********
 233    2021-05-18 10:46    29  **********
 234    2021-05-18 10:47    30  ***********
 235    2021-05-18 10:48    30  ***********
 236    2021-05-18 10:49    30  ***********
 237    2021-05-18 10:50    29  **********
 238    2021-05-18 10:51    30  ***********
 239    2021-05-18 10:52    29  **********
 240    2021-05-18 10:53    30  ***********
 241    2021-05-18 10:54    29  **********
 242    2021-05-18 10:55    30  ***********
 243    2021-05-18 10:56    29  **********
 244    2021-05-18 10:57    29  **********
 245    2021-05-18 10:58    30  ***********
 ...    ..(  4 skipped).    ..  ***********
 250    2021-05-18 11:03    30  ***********
 251    2021-05-18 11:04    29  **********
 252    2021-05-18 11:05    30  ***********
 ...    ..(  5 skipped).    ..  ***********
 258    2021-05-18 11:11    30  ***********

SCT Error Recovery Control command not supported

Device Statistics (GP Log 0x04)
Page  Offset Size        Value Flags Description
0x01  =====  =               =  ===  == General Statistics (rev 3) ==
0x01  0x008  4              20  ---  Lifetime Power-On Resets
0x01  0x010  4             523  ---  Power-on Hours
0x01  0x018  6       145884601  ---  Logical Sectors Written
0x01  0x020  6         1618732  ---  Number of Write Commands
0x01  0x028  6       100371145  ---  Logical Sectors Read
0x01  0x030  6          685975  ---  Number of Read Commands
0x04  =====  =               =  ===  == General Errors Statistics (rev 1) ==
0x04  0x008  4               0  ---  Number of Reported Uncorrectable Errors
0x04  0x010  4              12  ---  Resets Between Cmd Acceptance and Completion
0x05  =====  =               =  ===  == Temperature Statistics (rev 1) ==
0x05  0x008  1              32  ---  Current Temperature
0x05  0x010  1              30  ---  Average Short Term Temperature
0x05  0x018  1               -  ---  Average Long Term Temperature
0x05  0x020  1              40  ---  Highest Temperature
0x05  0x028  1              19  ---  Lowest Temperature
0x05  0x030  1              30  ---  Highest Average Short Term Temperature
0x05  0x038  1              30  ---  Lowest Average Short Term Temperature
0x05  0x040  1               -  ---  Highest Average Long Term Temperature
0x05  0x048  1               -  ---  Lowest Average Long Term Temperature
0x05  0x050  4               0  ---  Time in Over-Temperature
0x05  0x058  1              70  ---  Specified Maximum Operating Temperature
0x05  0x060  4               0  ---  Time in Under-Temperature
0x05  0x068  1               0  ---  Specified Minimum Operating Temperature
0x06  =====  =               =  ===  == Transport Statistics (rev 1) ==
0x06  0x008  4              52  ---  Number of Hardware Resets
0x06  0x010  4               8  ---  Number of ASR Events
0x06  0x018  4               0  ---  Number of Interface CRC Errors
0x07  =====  =               =  ===  == Solid State Device Statistics (rev 1) ==
0x07  0x008  1               0  ---  Percentage Used Endurance Indicator
                                |||_ C monitored condition met
                                ||__ D supports DSN
                                |___ N normalized value

Pending Defects log (GP Log 0x0c) not supported

SATA Phy Event Counters (GP Log 0x11)
ID      Size     Value  Description
0x0001  4            0  Command failed due to ICRC error
0x000a  4            6  Device-to-host register FISes sent due to a COMRESET

