smartctl 6.6 2016-05-31 r4324 [x86_64-linux-4.20.0-042000-generic] (local build)
Copyright (C) 2002-16, Bruce Allen, Christian Franke, www.smartmontools.org

=== START OF INFORMATION SECTION ===
Model Number:                       KINGSTON SKC1000480G
Serial Number:                      50026B7282069555
Firmware Version:                   E7FT04.6
PCI Vendor/Subsystem ID:            0x1987
IEEE OUI Identifier:                0x6479a7
Controller ID:                      0
Number of Namespaces:               1
Namespace 1 Size/Capacity:          480,103,981,056 [480 GB]
Namespace 1 Formatted LBA Size:     512
Local Time is:                      Sat Mar  9 15:25:11 2019 CET
Firmware Updates (0x02):            1 Slot
Optional Admin Commands (0x0007):   Security Format Frmw_DL
Optional NVM Commands (0x001e):     Wr_Unc DS_Mngmt Wr_Zero Sav/Sel_Feat
Maximum Data Transfer Size:         512 Pages
Warning  Comp. Temp. Threshold:     110 Celsius
Critical Comp. Temp. Threshold:     130 Celsius

Supported Power States
St Op     Max   Active     Idle   RL RT WL WT  Ent_Lat  Ex_Lat
 0 +     7.90W       -        -    0  0  0  0        0       0
 1 +     2.40W       -        -    1  1  1  1      600     600
 2 +     1.90W       -        -    2  2  2  2      600     600
 3 -   0.1100W       -        -    3  3  3  3      600     600
 4 -   0.0050W       -        -    4  4  4  4   100000  160000

Supported LBA Sizes (NSID 0x1)
Id Fmt  Data  Metadt  Rel_Perf
 0 +     512       0         1
 1 -    4096       0         0

=== START OF SMART DATA SECTION ===
SMART overall-health self-assessment test result: PASSED

SMART/Health Information (NVMe Log 0x02, NSID 0x1)
Critical Warning:                   0x00
Temperature:                        39 Celsius
Available Spare:                    100%
Available Spare Threshold:          1%
Percentage Used:                    0%
Data Units Read:                    4,462,910 [2.28 TB]
Data Units Written:                 5,226,935 [2.67 TB]
Host Read Commands:                 55,495,167
Host Write Commands:                44,615,778
Controller Busy Time:               171
Power Cycles:                       437
Power On Hours:                     1,415
Unsafe Shutdowns:                   75
Media and Data Integrity Errors:    0
Error Information Log Entries:      768
Warning  Comp. Temperature Time:    0
Critical Comp. Temperature Time:    0
Temperature Sensor 2:               90 Celsius

Error Information (NVMe Log 0x01, max 64 entries)
Num   ErrCount  SQId   CmdId  Status  PELoc          LBA  NSID    VS
  0        768     0  0x000b  0x4004      - 8796109799680     1     -
  1        767     0  0x001b  0x4004      - 8796109799680     1     -
  2        766     0  0x0000  0x4004      - 8796109799680     1     -
  3        765     0  0x0000  0x4004      - 8796109799680     1     -
  4        764     0  0x000f  0x4004      - 8796109799680     1     -
  5        763     0  0x000a  0x4004      - 8796109799680     1     -
  6        762     0  0x000b  0x4004      - 8796109799680     1     -
  7        761     0  0x000f  0x4004      - 8796109799680     1     -
  8        760     0  0x0012  0x4004      - 8796109799680     1     -
  9        759     0  0x0001  0x4004      - 8796109799680     1     -
 10        758     0  0x0015  0x4004      - 8796109799680     1     -
 11        757     0  0x001a  0x4004      - 8796109799680     1     -
 12        756     0  0x0016  0x4004      - 8796109799680     1     -
 13        755     0  0x0008  0x4004      - 8796109799680     1     -
 14        754     0  0x0004  0x4004      - 8796109799680     1     -
 15        753     0  0x0012  0x4004      - 8796109799680     1     -
... (47 entries not shown)

