smartctl 7.3 2022-02-28 r5338 [x86_64-linux-6.6.0-custom] (local build)
Copyright (C) 2002-22, Bruce Allen, Christian Franke, www.smartmontools.org

=== START OF INFORMATION SECTION ===
Device Model:     SFSA160GM2AK1TA-I-8C-11P-STD
Firmware Version: SBR15103
User Capacity:    160,041,885,696 bytes [160 GB]
Sector Size:      512 bytes logical/physical
Rotation Rate:    Solid State Device
Form Factor:      2.5 inches
TRIM Command:     Available, deterministic, zeroed
Device is:        Not in smartctl database
ATA Version is:   ACS-3 (minor revision not indicated)
SATA Version is:  SATA 3.2, 6.0 Gb/s (current: 6.0 Gb/s)
Local Time is:    Tue Dec  5 19:18:21 2023 EET
SMART support is: Available - device has SMART capability.
SMART support is: Enabled
AAM feature is:   Unavailable
APM feature is:   Unavailable
Rd look-ahead is: Enabled
Write cache is:   Enabled
DSN feature is:   Unavailable
ATA Security is:  Disabled, NOT FROZEN [SEC1]
Write SCT (Get) Feature Control Command failed: scsi error badly formed scsi parameters
Wt Cache Reorder: Unknown (SCT Feature Control command failed)

=== START OF READ SMART DATA SECTION ===
SMART overall-health self-assessment test result: PASSED

General SMART Values:
Offline data collection status:  (0x02)	Offline data collection activity
					was completed without error.
					Auto Offline Data Collection: Disabled.
Self-test execution status:      (   0)	The previous self-test routine completed
					without error or no self-test has ever 
					been run.
Total time to complete Offline 
data collection: 		(    0) seconds.
Offline data collection
capabilities: 			 (0x53) SMART execute Offline immediate.
					Auto Offline data collection on/off support.
					Suspend Offline collection upon new
					command.
					No Offline surface scan supported.
					Self-test supported.
					No Conveyance Self-test supported.
					Selective Self-test supported.
SMART capabilities:            (0x0003)	Saves SMART data before entering
					power-saving mode.
					Supports SMART auto save timer.
Error logging capability:        (0x01)	Error logging supported.
					General Purpose Logging supported.
Short self-test routine 
recommended polling time: 	 (   2) minutes.
Extended self-test routine
recommended polling time: 	 (  15) minutes.
SCT capabilities: 	       (0x0031)	SCT Status supported.
					SCT Feature Control supported.
					SCT Data Table supported.

SMART Attributes Data Structure revision number: 1
Vendor Specific SMART Attributes with Thresholds:
ID# ATTRIBUTE_NAME          FLAGS    VALUE WORST THRESH FAIL RAW_VALUE
  1 Raw_Read_Error_Rate     PO-R--   100   100   000    -    0
  5 Reallocated_Sector_Ct   PO--C-   100   100   000    -    0
  9 Power_On_Hours          -O--C-   100   100   000    -    1
 12 Power_Cycle_Count       -O--C-   100   100   000    -    24
 16 Unknown_Attribute       -O--C-+  100   100   001    -    1
 17 Unknown_Attribute       -O--C-   100   100   000    -    80000
160 Unknown_Attribute       -O----   100   100   000    -    0
161 Unknown_Attribute       -O--C-   100   100   000    -    20971840
163 Unknown_Attribute       PO----   100   100   000    -    29
164 Unknown_Attribute       -O--C-   100   100   000    -    3815
165 Unknown_Attribute       -O----   100   100   000    -    3
166 Unknown_Attribute       -O--C-   100   100   000    -    0
167 Unknown_Attribute       -O--C-   100   100   000    -    1
168 Unknown_Attribute       -O--C-   100   100   000    -    80000
169 Unknown_Attribute       PO----   100   100   000    -    0
193 Unknown_SSD_Attribute   -O--C-   100   100   000    -    0
194 Temperature_Celsius     PO---K   100   100   000    -    45 (Min/Max 23/70)
195 Hardware_ECC_Recovered  -O--C-   100   100   000    -    0
196 Reallocated_Event_Count -O--C-   000   000   000    -    0
198 Offline_Uncorrectable   -O--C-   100   100   000    -    0
199 UDMA_CRC_Error_Count    PO-R--   100   100   000    -    0
215 Unknown_Attribute       -O--C-   100   100   000    -    755
231 Unknown_SSD_Attribute   PO--C-+  100   100   025    -    100
235 Unknown_Attribute       -O--C-   100   100   000    -    662575936
237 Unknown_Attribute       -O--C-   100   100   000    -    0
241 Total_LBAs_Written      -O--C-   100   100   000    -    656432974
242 Total_LBAs_Read         -O--C-   100   100   000    -    1941930045
243 Unknown_Attribute       -O--C-   100   100   000    -    0
244 Unknown_Attribute       -O--C-   100   100   000    -    0
248 Unknown_Attribute       -O--C-+  100   100   001    -    100
                            ||||||_ K auto-keep
                            |||||__ C event count
                            ||||___ R error rate
                            |||____ S speed/performance
                            ||_____ O updated online
                            |______ P prefailure warning

General Purpose Log Directory Version 1
SMART           Log Directory Version 1 [multi-sector log support]
Address    Access  R/W   Size  Description
0x00       GPL,SL  R/O      1  Log Directory
0x01       GPL,SL  R/O      1  Summary SMART error log
0x02       GPL,SL  R/O      1  Comprehensive SMART error log
0x03       GPL,SL  R/O      1  Ext. Comprehensive SMART error log
0x04       GPL,SL  R/O      8  Device Statistics log
0x06       GPL,SL  R/O      1  SMART self-test log
0x07       GPL,SL  R/O      1  Extended self-test log
0x09       GPL,SL  R/W      1  Selective self-test log
0x10       GPL,SL  R/O      1  NCQ Command Error log
0x11       GPL,SL  R/O      1  SATA Phy Event Counters log
0x30       GPL,SL  R/O      9  IDENTIFY DEVICE data log
0x80-0x9f  GPL,SL  R/W     16  Host vendor specific log
0xdf       GPL,SL  VS       1  Device vendor specific log
0xe0       GPL,SL  R/W      1  SCT Command/Status
0xe1       GPL,SL  R/W      1  SCT Data Transfer

SMART Extended Comprehensive Error Log Version: 1 (1 sectors)
No Errors Logged

SMART Extended Self-test Log Version: 1 (1 sectors)
Num  Test_Description    Status                  Remaining  LifeTime(hours)  LBA_of_first_error
# 1  Short offline       Completed without error       00%         1         -

SMART Selective self-test log data structure revision number 1
 SPAN  MIN_LBA  MAX_LBA  CURRENT_TEST_STATUS
    1        0        0  Not_testing
    2        0        0  Not_testing
    3        0        0  Not_testing
    4        0        0  Not_testing
    5        0        0  Not_testing
Selective self-test flags (0x0):
  After scanning selected spans, do NOT read-scan remainder of disk.
If Selective self-test is pending on power-up, resume after 0 minute delay.

SCT Status Version:                  3
SCT Version (vendor specific):       0 (0x0000)
Device State:                        Active (0)
Current Temperature:                    45 Celsius
Power Cycle Min/Max Temperature:     23/70 Celsius
Lifetime    Min/Max Temperature:     23/70 Celsius
Under/Over Temperature Limit Count:   0/0

SCT Temperature History Version:     2
Temperature Sampling Period:         1 minute
Temperature Logging Interval:        1 minute
Min/Max recommended Temperature:      0/100 Celsius
Min/Max Temperature Limit:            0/100 Celsius
Temperature History Size (Index):    128 (61)

Index    Estimated Time   Temperature Celsius
  62    2023-12-05 17:11    25  ******
  63    2023-12-05 17:12    25  ******
  64    2023-12-05 17:13    27  ********
  65    2023-12-05 17:14    26  *******
  66    2023-12-05 17:15    26  *******
  67    2023-12-05 17:16    27  ********
  68    2023-12-05 17:17    27  ********
  69    2023-12-05 17:18    28  *********
  70    2023-12-05 17:19    27  ********
  71    2023-12-05 17:20    28  *********
 ...    ..(  4 skipped).    ..  *********
  76    2023-12-05 17:25    28  *********
  77    2023-12-05 17:26    29  **********
  78    2023-12-05 17:27    28  *********
  79    2023-12-05 17:28    29  **********
  80    2023-12-05 17:29    29  **********
  81    2023-12-05 17:30    29  **********
  82    2023-12-05 17:31    28  *********
 ...    ..(  4 skipped).    ..  *********
  87    2023-12-05 17:36    28  *********
  88    2023-12-05 17:37    29  **********
 ...    ..( 14 skipped).    ..  **********
 103    2023-12-05 17:52    29  **********
 104    2023-12-05 17:53    30  ***********
 105    2023-12-05 17:54    36  *****************
 106    2023-12-05 17:55    37  ******************
 107    2023-12-05 17:56    37  ******************
 108    2023-12-05 17:57    42  ***********************
 109    2023-12-05 17:58    37  ******************
 110    2023-12-05 17:59    38  *******************
 111    2023-12-05 18:00    37  ******************
 112    2023-12-05 18:01    38  *******************
 113    2023-12-05 18:02    37  ******************
 114    2023-12-05 18:03    38  *******************
 115    2023-12-05 18:04    37  ******************
 116    2023-12-05 18:05    38  *******************
 ...    ..(  8 skipped).    ..  *******************
 125    2023-12-05 18:14    38  *******************
 126    2023-12-05 18:15    39  ********************
 127    2023-12-05 18:16    38  *******************
   0    2023-12-05 18:17    39  ********************
 ...    ..( 13 skipped).    ..  ********************
  14    2023-12-05 18:31    39  ********************
  15    2023-12-05 18:32    38  *******************
  16    2023-12-05 18:33    39  ********************
 ...    ..(  7 skipped).    ..  ********************
  24    2023-12-05 18:41    39  ********************
  25    2023-12-05 18:42    70  ***************************************+
  26    2023-12-05 18:43    49  ******************************
 ...    ..(  6 skipped).    ..  ******************************
  33    2023-12-05 18:50    49  ******************************
  34    2023-12-05 18:51    50  *******************************
  35    2023-12-05 18:52    47  ****************************
  36    2023-12-05 18:53    48  *****************************
 ...    ..(  4 skipped).    ..  *****************************
  41    2023-12-05 18:58    48  *****************************
  42    2023-12-05 18:59    49  ******************************
 ...    ..(  9 skipped).    ..  ******************************
  52    2023-12-05 19:09    49  ******************************
  53    2023-12-05 19:10    44  *************************
  54    2023-12-05 19:11    45  **************************
 ...    ..(  5 skipped).    ..  **************************
  60    2023-12-05 19:17    45  **************************
  61    2023-12-05 19:18    24  *****

SCT Error Recovery Control command not supported

Device Statistics (GP Log 0x04)
Page  Offset Size        Value Flags Description
0x01  =====  =               =  ===  == General Statistics (rev 1) ==
0x01  0x008  4              24  ---  Lifetime Power-On Resets
0x01  0x010  4               1  ---  Power-on Hours
0x01  0x018  6       656432974  ---  Logical Sectors Written
0x01  0x020  6         2564410  ---  Number of Write Commands
0x01  0x028  6      1941930045  ---  Logical Sectors Read
0x01  0x030  6         7625368  ---  Number of Read Commands
0x04  =====  =               =  ===  == General Errors Statistics (rev 1) ==
0x04  0x008  4               0  ---  Number of Reported Uncorrectable Errors
0x04  0x010  4               0  ---  Resets Between Cmd Acceptance and Completion
0x05  =====  =               =  ===  == Temperature Statistics (rev 1) ==
0x05  0x008  1              45  ---  Current Temperature
0x05  0x010  1               -  ---  Average Short Term Temperature
0x05  0x018  1               -  ---  Average Long Term Temperature
0x05  0x020  1               -  ---  Highest Temperature
0x05  0x028  1               -  ---  Lowest Temperature
0x05  0x030  1               -  ---  Highest Average Short Term Temperature
0x05  0x038  1               -  ---  Lowest Average Short Term Temperature
0x05  0x040  1               -  ---  Highest Average Long Term Temperature
0x05  0x048  1               -  ---  Lowest Average Long Term Temperature
0x05  0x050  4               0  ---  Time in Over-Temperature
0x05  0x058  1              85  ---  Specified Maximum Operating Temperature
0x05  0x060  4               0  ---  Time in Under-Temperature
0x05  0x068  1               0  ---  Specified Minimum Operating Temperature
0x06  =====  =               =  ===  == Transport Statistics (rev 1) ==
0x06  0x008  4              81  ---  Number of Hardware Resets
0x06  0x018  4               0  ---  Number of Interface CRC Errors
0x07  =====  =               =  ===  == Solid State Device Statistics (rev 1) ==
0x07  0x008  1             103  ---  Percentage Used Endurance Indicator
                                |||_ C monitored condition met
                                ||__ D supports DSN
                                |___ N normalized value

Pending Defects log (GP Log 0x0c) not supported

SATA Phy Event Counters (GP Log 0x11)
ID      Size     Value  Description
0x0001  2            0  Command failed due to ICRC error
0x0005  2            0  R_ERR response for non-data FIS
0x000a  2            7  Device-to-host register FISes sent due to a COMRESET

