smartctl 7.2 2020-12-30 r5155 [x86_64-linux-5.10.0-18-amd64] (local build)
Copyright (C) 2002-20, Bruce Allen, Christian Franke, www.smartmontools.org

=== START OF INFORMATION SECTION ===
Device Model:     LITEON CV3-8D128-HP
Serial Number:    0027281001S3
LU WWN Device Id: 5 002303 100f051c9
Firmware Version: V381
User Capacity:    128,035,676,160 bytes [128 GB]
Sector Sizes:     512 bytes logical, 4096 bytes physical
Rotation Rate:    Solid State Device
Form Factor:      M.2
TRIM Command:     Available, deterministic, zeroed
Device is:        Not in smartctl database [for details use: -P showall]
ATA Version is:   ACS-4, ATA/ATAPI-7 T13/1532D revision 4a
SATA Version is:  SATA 3.2, 6.0 Gb/s (current: 6.0 Gb/s)
Local Time is:    Mon Nov  7 00:17:44 2022 CET
SMART support is: Available - device has SMART capability.
SMART support is: Enabled
AAM feature is:   Unavailable
APM level is:     254 (maximum performance)
Rd look-ahead is: Enabled
Write cache is:   Enabled
DSN feature is:   Disabled
ATA Security is:  Disabled, frozen [SEC2]
Wt Cache Reorder: Disabled

=== START OF READ SMART DATA SECTION ===
SMART overall-health self-assessment test result: PASSED

General SMART Values:
Offline data collection status:  (0x02)	Offline data collection activity
					was completed without error.
					Auto Offline Data Collection: Disabled.
Self-test execution status:      (   0)	The previous self-test routine completed
					without error or no self-test has ever 
					been run.
Total time to complete Offline 
data collection: 		(   10) seconds.
Offline data collection
capabilities: 			 (0x5b) SMART execute Offline immediate.
					Auto Offline data collection on/off support.
					Suspend Offline collection upon new
					command.
					Offline surface scan supported.
					Self-test supported.
					No Conveyance Self-test supported.
					Selective Self-test supported.
SMART capabilities:            (0x0003)	Saves SMART data before entering
					power-saving mode.
					Supports SMART auto save timer.
Error logging capability:        (0x01)	Error logging supported.
					General Purpose Logging supported.
Short self-test routine 
recommended polling time: 	 (   2) minutes.
Extended self-test routine
recommended polling time: 	 (   5) minutes.
SCT capabilities: 	       (0x003d)	SCT Status supported.
					SCT Error Recovery Control supported.
					SCT Feature Control supported.
					SCT Data Table supported.

SMART Attributes Data Structure revision number: 1
Vendor Specific SMART Attributes with Thresholds:
ID# ATTRIBUTE_NAME          FLAGS    VALUE WORST THRESH FAIL RAW_VALUE
  1 Raw_Read_Error_Rate     POSR-K   100   100   050    -    0
  5 Reallocated_Sector_Ct   PO--CK   100   100   005    -    0
  9 Power_On_Hours          -O--CK   100   100   000    -    113
 12 Power_Cycle_Count       -O--CK   100   100   000    -    163
171 Unknown_Attribute       -O--CK   100   100   000    -    0
172 Unknown_Attribute       -O--CK   100   100   000    -    0
173 Unknown_Attribute       -O--CK   100   100   005    -    9
174 Unknown_Attribute       -O--CK   100   100   000    -    33
176 Erase_Fail_Count_Chip   -O---K   100   100   000    -    0
181 Program_Fail_Cnt_Total  -O---K   100   100   000    -    0
183 Runtime_Bad_Block       -O--CK   100   100   000    -    0
184 End-to-End_Error        PO-RCK   100   100   097    -    0
187 Reported_Uncorrect      -O--CK   100   100   000    -    0
188 Command_Timeout         -O--CK   100   100   000    -    0
194 Temperature_Celsius     -O---K   100   100   000    -    59 (Min/Max 46/63)
198 Offline_Uncorrectable   ----CK   100   100   000    -    0
199 UDMA_CRC_Error_Count    -O--CK   100   100   000    -    0
241 Total_LBAs_Written      -O--CK   100   100   000    -    81541
242 Total_LBAs_Read         -O--CK   100   100   000    -    57405
243 Unknown_Attribute       -O--CK   100   100   000    -    76096
                            ||||||_ K auto-keep
                            |||||__ C event count
                            ||||___ R error rate
                            |||____ S speed/performance
                            ||_____ O updated online
                            |______ P prefailure warning

General Purpose Log Directory Version 1
SMART           Log Directory Version 1 [multi-sector log support]
Address    Access  R/W   Size  Description
0x00       GPL,SL  R/O      1  Log Directory
0x01       GPL,SL  R/O      1  Summary SMART error log
0x02       GPL,SL  R/O      2  Comprehensive SMART error log
0x03       GPL,SL  R/O      1  Ext. Comprehensive SMART error log
0x04       GPL,SL  R/O      6  Device Statistics log
0x06       GPL,SL  R/O      1  SMART self-test log
0x07       GPL,SL  R/O      1  Extended self-test log
0x09       GPL,SL  R/W      1  Selective self-test log
0x0a       GPL,SL  R/W      8  Device Statistics Notification
0x10       GPL,SL  R/O      1  NCQ Command Error log
0x11       GPL,SL  R/O      1  SATA Phy Event Counters log
0x30       GPL,SL  R/O      9  IDENTIFY DEVICE data log
0x80-0x9f  GPL,SL  R/W     16  Host vendor specific log
0xe0       GPL,SL  R/W      1  SCT Command/Status
0xe1       GPL,SL  R/W      1  SCT Data Transfer

SMART Extended Comprehensive Error Log Version: 1 (1 sectors)
No Errors Logged

SMART Extended Self-test Log Version: 1 (1 sectors)
Num  Test_Description    Status                  Remaining  LifeTime(hours)  LBA_of_first_error
# 1  Short offline       Completed without error       00%       113         -
# 2  Short offline       Completed without error       00%         2         -

SMART Selective self-test log data structure revision number 0
Note: revision number not 1 implies that no selective self-test has ever been run
 SPAN  MIN_LBA  MAX_LBA  CURRENT_TEST_STATUS
    1        0        0  Not_testing
    2        0        0  Completed [00% left] (0-65535)
    3        0        0  Not_testing
    4        0        0  Not_testing
    5        0        0  Not_testing
Selective self-test flags (0x0):
  After scanning selected spans, do NOT read-scan remainder of disk.
If Selective self-test is pending on power-up, resume after 0 minute delay.

SCT Status Version:                  3
SCT Version (vendor specific):       1 (0x0001)
Device State:                        Active (0)
Current Temperature:                    59 Celsius
Power Cycle Min/Max Temperature:      ?/ ? Celsius
Lifetime    Min/Max Temperature:     46/63 Celsius
Under/Over Temperature Limit Count:   0/0

SCT Temperature History Version:     2
Temperature Sampling Period:         1 minute
Temperature Logging Interval:        1 minute
Min/Max recommended Temperature:      0/70 Celsius
Min/Max Temperature Limit:            0/70 Celsius
Temperature History Size (Index):    128 (118)

Index    Estimated Time   Temperature Celsius
 119    2022-11-06 22:10     ?  -
 ...    ..( 70 skipped).    ..  -
  62    2022-11-06 23:21     ?  -
  63    2022-11-06 23:22    70  ***************************************+
  64    2022-11-06 23:23    75  ***************************************+
  65    2022-11-06 23:24    77  ***************************************+
  66    2022-11-06 23:25    77  ***************************************+
  67    2022-11-06 23:26    78  ***************************************+
  68    2022-11-06 23:27    79  ***************************************+
 ...    ..(  4 skipped).    ..  ***************************************+
  73    2022-11-06 23:32    79  ***************************************+
  74    2022-11-06 23:33    80  ***************************************+
  75    2022-11-06 23:34    80  ***************************************+
  76    2022-11-06 23:35    80  ***************************************+
  77    2022-11-06 23:36    77  ***************************************+
  78    2022-11-06 23:37    78  ***************************************+
  79    2022-11-06 23:38    79  ***************************************+
  80    2022-11-06 23:39    80  ***************************************+
  81    2022-11-06 23:40    81  ***************************************+
 ...    ..(  9 skipped).    ..  ***************************************+
  91    2022-11-06 23:50    81  ***************************************+
  92    2022-11-06 23:51    79  ***************************************+
  93    2022-11-06 23:52     ?  -
 ...    ..(  2 skipped).    ..  -
  96    2022-11-06 23:55     ?  -
  97    2022-11-06 23:56    59  ****************************************
  98    2022-11-06 23:57    61  ***************************************+
  99    2022-11-06 23:58    62  ***************************************+
 100    2022-11-06 23:59    62  ***************************************+
 101    2022-11-07 00:00    62  ***************************************+
 102    2022-11-07 00:01    63  ***************************************+
 ...    ..(  6 skipped).    ..  ***************************************+
 109    2022-11-07 00:08    63  ***************************************+
 110    2022-11-07 00:09    62  ***************************************+
 ...    ..(  2 skipped).    ..  ***************************************+
 113    2022-11-07 00:12    62  ***************************************+
 114    2022-11-07 00:13    61  ***************************************+
 115    2022-11-07 00:14    60  ***************************************+
 116    2022-11-07 00:15    60  ***************************************+
 117    2022-11-07 00:16    60  ***************************************+
 118    2022-11-07 00:17    59  ****************************************

SCT Error Recovery Control:
           Read:      2 (0.2 seconds)
          Write:      2 (0.2 seconds)

Device Statistics (GP Log 0x04)
Page  Offset Size        Value Flags Description
0x01  =====  =               =  ===  == General Statistics (rev 1) ==
0x04  =====  =               =  ===  == General Errors Statistics (rev 1) ==
0x05  =====  =               =  ===  == Temperature Statistics (rev 1) ==
0x06  =====  =               =  ===  == Transport Statistics (rev 1) ==
0x07  =====  =               =  ===  == Solid State Device Statistics (rev 1) ==
                                |||_ C monitored condition met
                                ||__ D supports DSN
                                |___ N normalized value

Pending Defects log (GP Log 0x0c) not supported

SATA Phy Event Counters (GP Log 0x11)
ID      Size     Value  Description
0x0001  2            0  Command failed due to ICRC error
0x0002  2            0  R_ERR response for data FIS
0x0005  2            0  R_ERR response for non-data FIS
0x000a  2            3  Device-to-host register FISes sent due to a COMRESET

