smartctl 7.3 2022-02-28 r5338 [x86_64-w64-mingw32-w10-b19045] (sf-7.3-1)
Copyright (C) 2002-22, Bruce Allen, Christian Franke, www.smartmontools.org

=== START OF INFORMATION SECTION ===
Device Model:     Patriot Burst Elite 120GB
Firmware Version: SN08979
User Capacity:    120.034.123.776 bytes [120 GB]
Sector Size:      512 bytes logical/physical
Rotation Rate:    Solid State Device
Form Factor:      2.5 inches
TRIM Command:     Available, deterministic, zeroed
Device is:        Not in smartctl database 7.3/5440
ATA Version is:   ACS-4 (minor revision not indicated)
SATA Version is:  SATA 3.2, 6.0 Gb/s (current: 3.0 Gb/s)
Local Time is:    Thu Mar 30 00:21:45 2023 FLE
SMART support is: Available - device has SMART capability.
SMART support is: Enabled
AAM feature is:   Unavailable
APM feature is:   Unavailable
Rd look-ahead is: Enabled
Write cache is:   Enabled
DSN feature is:   Unavailable
ATA Security is:  Disabled, frozen [SEC2]
Wt Cache Reorder: Unknown (0xe001)

=== START OF READ SMART DATA SECTION ===
SMART overall-health self-assessment test result: PASSED

General SMART Values:
Offline data collection status:  (0x00)	Offline data collection activity
					was never started.
					Auto Offline Data Collection: Disabled.
Self-test execution status:      (   0)	The previous self-test routine completed
					without error or no self-test has ever 
					been run.
Total time to complete Offline 
data collection: 		(   33) seconds.
Offline data collection
capabilities: 			 (0x7b) SMART execute Offline immediate.
					Auto Offline data collection on/off support.
					Suspend Offline collection upon new
					command.
					Offline surface scan supported.
					Self-test supported.
					Conveyance Self-test supported.
					Selective Self-test supported.
SMART capabilities:            (0x0003)	Saves SMART data before entering
					power-saving mode.
					Supports SMART auto save timer.
Error logging capability:        (0x01)	Error logging supported.
					General Purpose Logging supported.
Short self-test routine 
recommended polling time: 	 (   2) minutes.
Extended self-test routine
recommended polling time: 	 (   2) minutes.
Conveyance self-test routine
recommended polling time: 	 (   2) minutes.
SCT capabilities: 	       (0x0031)	SCT Status supported.
					SCT Feature Control supported.
					SCT Data Table supported.

SMART Attributes Data Structure revision number: 20
Vendor Specific SMART Attributes with Thresholds:
ID# ATTRIBUTE_NAME          FLAGS    VALUE WORST THRESH FAIL RAW_VALUE
  5 Reallocated_Sector_Ct   PO--C-   100   100   050    -    0
  9 Power_On_Hours          -O--C-   100   100   000    -    1352
 12 Power_Cycle_Count       -O--C-   100   100   000    -    1144
167 Unknown_Attribute       -O---K   100   100   000    -    0
168 Unknown_Attribute       -O--C-   100   100   000    -    0
169 Unknown_Attribute       PO--C-   100   100   010    -    0
171 Unknown_Attribute       -O--CK   100   100   000    -    0
172 Unknown_Attribute       -O--CK   100   100   000    -    0
173 Unknown_Attribute       -O--C-   200   200   000    -    12894929008
174 Unknown_Attribute       -O---K   100   100   000    -    0
175 Program_Fail_Count_Chip -O---K   100   100   010    -    0
180 Unused_Rsvd_Blk_Cnt_Tot PO--CK   100   100   000    -    169
187 Reported_Uncorrect      -O--CK   100   000   000    -    0
192 Power-Off_Retract_Count -O--C-   100   100   000    -    7
194 Temperature_Celsius     -O---K   019   019   000    -    19 (Min/Max 14/27)
206 Unknown_SSD_Attribute   -O--CK   200   200   000    -    3
207 Unknown_SSD_Attribute   -O--CK   200   200   000    -    153
208 Unknown_SSD_Attribute   -O--CK   200   200   000    -    112
209 Unknown_SSD_Attribute   -O--CK   200   200   000    -    2
210 Unknown_Attribute       -O--CK   200   200   000    -    1310
211 Unknown_Attribute       -O--CK   200   200   000    -    1161
231 Unknown_SSD_Attribute   PO---K   093   093   005    -    7
241 Total_LBAs_Written      -O--CK   100   100   000    -    1885
242 Total_LBAs_Read         -O--CK   100   100   000    -    1798
245 Unknown_Attribute       -O--CK   100   100   000    -    656811814
                            ||||||_ K auto-keep
                            |||||__ C event count
                            ||||___ R error rate
                            |||____ S speed/performance
                            ||_____ O updated online
                            |______ P prefailure warning

General Purpose Log Directory Version 1
SMART           Log Directory Version 1 [multi-sector log support]
Address    Access  R/W   Size  Description
0x00       GPL,SL  R/O      1  Log Directory
0x01           SL  R/O      1  Summary SMART error log
0x02           SL  R/O     51  Comprehensive SMART error log
0x03       GPL     R/O     64  Ext. Comprehensive SMART error log
0x04       GPL,SL  R/O      8  Device Statistics log
0x06           SL  R/O      1  SMART self-test log
0x07       GPL     R/O      1  Extended self-test log
0x09           SL  R/W      1  Selective self-test log
0x10       GPL     R/O      1  NCQ Command Error log
0x11       GPL     R/O      1  SATA Phy Event Counters log
0x30       GPL,SL  R/O      9  IDENTIFY DEVICE data log
0x80-0x9f  GPL,SL  R/W     16  Host vendor specific log
0xe0       GPL,SL  R/W      1  SCT Command/Status
0xe1       GPL,SL  R/W      1  SCT Data Transfer

SMART Extended Comprehensive Error Log Version: 1 (64 sectors)
Device Error Count: 3
	CR     = Command Register
	FEATR  = Features Register
	COUNT  = Count (was: Sector Count) Register
	LBA_48 = Upper bytes of LBA High/Mid/Low Registers ]  ATA-8
	LH     = LBA High (was: Cylinder High) Register    ]   LBA
	LM     = LBA Mid (was: Cylinder Low) Register      ] Register
	LL     = LBA Low (was: Sector Number) Register     ]
	DV     = Device (was: Device/Head) Register
	DC     = Device Control Register
	ER     = Error register
	ST     = Status register
Powered_Up_Time is measured from power on, and printed as
DDd+hh:mm:SS.sss where DD=days, hh=hours, mm=minutes,
SS=sec, and sss=millisec. It "wraps" after 49.710 days.

Error 3 [2] occurred at disk power-on lifetime: 0 hours (0 days + 0 hours)
  When the command that caused the error occurred, the device was in an unknown state.

  After command completion occurred, registers were:
  ER -- ST COUNT  LBA_48  LH LM LL DV DC
  -- -- -- == -- == == == -- -- -- -- --
  84 -- 41 00 00 00 00 07 59 09 9e 40 00  Error: ABRT

  Commands leading to the command that caused the error were:
  CR FEATR COUNT  LBA_48  LH LM LL DV DC  Powered_Up_Time  Command/Feature_Name
  -- == -- == -- == == == -- -- -- -- --  ---------------  --------------------
  b0 00 da 00 00 00 00 00 c2 4f 00 00 80     00:00:21.200  SMART RETURN STATUS
  b0 00 d8 00 00 00 00 00 c2 4f 00 00 80     00:00:21.100  SMART ENABLE OPERATIONS
  40 00 00 00 01 00 00 00 00 00 01 00 80     00:00:21.100  READ VERIFY SECTOR(S)
  ec 00 00 00 00 00 00 00 00 00 00 00 80     00:00:21.100  IDENTIFY DEVICE
  e5 00 00 00 00 00 00 00 00 00 00 00 80     00:00:21.100  CHECK POWER MODE

Error 2 [1] occurred at disk power-on lifetime: 0 hours (0 days + 0 hours)
  When the command that caused the error occurred, the device was in an unknown state.

  After command completion occurred, registers were:
  ER -- ST COUNT  LBA_48  LH LM LL DV DC
  -- -- -- == -- == == == -- -- -- -- --
  84 -- 41 00 00 00 00 07 57 b3 9e 40 00  Error: ABRT

  Commands leading to the command that caused the error were:
  CR FEATR COUNT  LBA_48  LH LM LL DV DC  Powered_Up_Time  Command/Feature_Name
  -- == -- == -- == == == -- -- -- -- --  ---------------  --------------------
  b0 00 da 00 00 00 00 00 c2 4f 00 00 80     00:00:19.700  SMART RETURN STATUS
  b0 00 d8 00 00 00 00 00 c2 4f 00 00 80     00:00:19.600  SMART ENABLE OPERATIONS
  40 00 00 00 01 00 00 00 00 00 01 00 80     00:00:19.600  READ VERIFY SECTOR(S)
  ec 00 00 00 00 00 00 00 00 00 00 00 80     00:00:19.600  IDENTIFY DEVICE
  e5 00 00 00 00 00 00 00 00 00 00 00 80     00:00:19.600  CHECK POWER MODE

Error 1 [0] occurred at disk power-on lifetime: 0 hours (0 days + 0 hours)
  When the command that caused the error occurred, the device was in an unknown state.

  After command completion occurred, registers were:
  ER -- ST COUNT  LBA_48  LH LM LL DV DC
  -- -- -- == -- == == == -- -- -- -- --
  84 -- 41 00 00 00 00 07 57 a4 9e 40 00

  Commands leading to the command that caused the error were:
  CR FEATR COUNT  LBA_48  LH LM LL DV DC  Powered_Up_Time  Command/Feature_Name
  -- == -- == -- == == == -- -- -- -- --  ---------------  --------------------
  ea 00 00 00 00 00 00 00 00 00 00 00 80     00:00:18.800  FLUSH CACHE EXT
  ea 00 00 00 00 00 00 00 00 00 00 00 80     00:00:18.800  FLUSH CACHE EXT
  b0 00 da 00 00 00 00 00 c2 4f 00 00 80     00:00:18.100  SMART RETURN STATUS
  b0 00 d8 00 00 00 00 00 c2 4f 00 00 80     00:00:18.100  SMART ENABLE OPERATIONS
  40 00 00 00 01 00 00 00 00 00 01 00 80     00:00:18.100  READ VERIFY SECTOR(S)

SMART Extended Self-test Log Version: 1 (1 sectors)
Num  Test_Description    Status                  Remaining  LifeTime(hours)  LBA_of_first_error
# 1  Short offline       Completed without error       00%      1352         -

SMART Selective self-test log data structure revision number 1
 SPAN  MIN_LBA  MAX_LBA  CURRENT_TEST_STATUS
    1        0        0  Not_testing
    2        0        0  Not_testing
    3        0        0  Not_testing
    4        0        0  Not_testing
    5        0        0  Not_testing
Selective self-test flags (0x0):
  After scanning selected spans, do NOT read-scan remainder of disk.
If Selective self-test is pending on power-up, resume after 0 minute delay.

SCT Status Version:                  3
SCT Version (vendor specific):       1 (0x0001)
Device State:                        Active (0)
Current Temperature:                    20 Celsius
Power Cycle Min/Max Temperature:      ?/20 Celsius
Lifetime    Min/Max Temperature:      ?/ ? Celsius
Under/Over Temperature Limit Count:   0/0

SCT Temperature History Version:     2
Temperature Sampling Period:         1 minute
Temperature Logging Interval:        1 minute
Min/Max recommended Temperature:     -127/127 Celsius
Min/Max Temperature Limit:           -127/127 Celsius
Temperature History Size (Index):    478 (463)

Index    Estimated Time   Temperature Celsius
 464    2023-03-29 16:24    21  **
 465    2023-03-29 16:25    20  *
 466    2023-03-29 16:26    21  **
 467    2023-03-29 16:27    20  *
 468    2023-03-29 16:28    19  -
 469    2023-03-29 16:29    20  *
 470    2023-03-29 16:30    20  *
 471    2023-03-29 16:31    19  -
 472    2023-03-29 16:32    20  *
 473    2023-03-29 16:33    19  -
 474    2023-03-29 16:34     ?  -
 475    2023-03-29 16:35    19  -
 476    2023-03-29 16:36    19  -
 477    2023-03-29 16:37    20  *
   0    2023-03-29 16:38    20  *
   1    2023-03-29 16:39    21  **
 ...    ..(  3 skipped).    ..  **
   5    2023-03-29 16:43    21  **
   6    2023-03-29 16:44    20  *
   7    2023-03-29 16:45    21  **
 ...    ..(  4 skipped).    ..  **
  12    2023-03-29 16:50    21  **
  13    2023-03-29 16:51    19  -
  14    2023-03-29 16:52    20  *
 ...    ..(  3 skipped).    ..  *
  18    2023-03-29 16:56    20  *
  19    2023-03-29 16:57     ?  -
  20    2023-03-29 16:58    19  -
  21    2023-03-29 16:59    20  *
  22    2023-03-29 17:00    19  -
  23    2023-03-29 17:01    19  -
  24    2023-03-29 17:02    21  **
  25    2023-03-29 17:03    20  *
  26    2023-03-29 17:04    20  *
  27    2023-03-29 17:05     ?  -
  28    2023-03-29 17:06    20  *
 ...    ..(  4 skipped).    ..  *
  33    2023-03-29 17:11    20  *
  34    2023-03-29 17:12    18  -
  35    2023-03-29 17:13    20  *
 ...    ..(  3 skipped).    ..  *
  39    2023-03-29 17:17    20  *
  40    2023-03-29 17:18    21  **
  41    2023-03-29 17:19    21  **
  42    2023-03-29 17:20    21  **
  43    2023-03-29 17:21    20  *
  44    2023-03-29 17:22    20  *
  45    2023-03-29 17:23    21  **
  46    2023-03-29 17:24    21  **
  47    2023-03-29 17:25    21  **
  48    2023-03-29 17:26    20  *
  49    2023-03-29 17:27    21  **
  50    2023-03-29 17:28    20  *
  51    2023-03-29 17:29    20  *
  52    2023-03-29 17:30    21  **
 ...    ..(  2 skipped).    ..  **
  55    2023-03-29 17:33    21  **
  56    2023-03-29 17:34    20  *
  57    2023-03-29 17:35    20  *
  58    2023-03-29 17:36    21  **
  59    2023-03-29 17:37    20  *
  60    2023-03-29 17:38    20  *
  61    2023-03-29 17:39    20  *
  62    2023-03-29 17:40    21  **
  63    2023-03-29 17:41    21  **
  64    2023-03-29 17:42    20  *
  65    2023-03-29 17:43    20  *
  66    2023-03-29 17:44    19  -
  67    2023-03-29 17:45    20  *
  68    2023-03-29 17:46    20  *
  69    2023-03-29 17:47    21  **
 ...    ..(  4 skipped).    ..  **
  74    2023-03-29 17:52    21  **
  75    2023-03-29 17:53    20  *
  76    2023-03-29 17:54    20  *
  77    2023-03-29 17:55    20  *
  78    2023-03-29 17:56    21  **
 ...    ..(  6 skipped).    ..  **
  85    2023-03-29 18:03    21  **
  86    2023-03-29 18:04    20  *
  87    2023-03-29 18:05    21  **
 ...    ..(  3 skipped).    ..  **
  91    2023-03-29 18:09    21  **
  92    2023-03-29 18:10    19  -
  93    2023-03-29 18:11    20  *
  94    2023-03-29 18:12    20  *
  95    2023-03-29 18:13    19  -
  96    2023-03-29 18:14    21  **
  97    2023-03-29 18:15     ?  -
  98    2023-03-29 18:16    19  -
  99    2023-03-29 18:17    19  -
 100    2023-03-29 18:18    20  *
 101    2023-03-29 18:19    20  *
 102    2023-03-29 18:20    21  **
 103    2023-03-29 18:21    20  *
 104    2023-03-29 18:22    20  *
 105    2023-03-29 18:23    21  **
 106    2023-03-29 18:24    21  **
 107    2023-03-29 18:25    20  *
 108    2023-03-29 18:26    20  *
 109    2023-03-29 18:27    19  -
 110    2023-03-29 18:28    20  *
 111    2023-03-29 18:29     ?  -
 112    2023-03-29 18:30    19  -
 113    2023-03-29 18:31    18  -
 114    2023-03-29 18:32     ?  -
 115    2023-03-29 18:33    19  -
 116    2023-03-29 18:34    19  -
 117    2023-03-29 18:35    20  *
 118    2023-03-29 18:36    20  *
 119    2023-03-29 18:37    20  *
 120    2023-03-29 18:38    19  -
 ...    ..(  2 skipped).    ..  -
 123    2023-03-29 18:41    19  -
 124    2023-03-29 18:42     ?  -
 125    2023-03-29 18:43    19  -
 ...    ..(  2 skipped).    ..  -
 128    2023-03-29 18:46    19  -
 129    2023-03-29 18:47    20  *
 130    2023-03-29 18:48    20  *
 131    2023-03-29 18:49    19  -
 132    2023-03-29 18:50    20  *
 133    2023-03-29 18:51    20  *
 134    2023-03-29 18:52    19  -
 135    2023-03-29 18:53    19  -
 136    2023-03-29 18:54     ?  -
 137    2023-03-29 18:55    19  -
 ...    ..(  2 skipped).    ..  -
 140    2023-03-29 18:58    19  -
 141    2023-03-29 18:59    20  *
 142    2023-03-29 19:00    19  -
 143    2023-03-29 19:01    19  -
 144    2023-03-29 19:02     ?  -
 145    2023-03-29 19:03    19  -
 ...    ..(  8 skipped).    ..  -
 154    2023-03-29 19:12    19  -
 155    2023-03-29 19:13    20  *
 156    2023-03-29 19:14    20  *
 157    2023-03-29 19:15    20  *
 158    2023-03-29 19:16    19  -
 159    2023-03-29 19:17    19  -
 160    2023-03-29 19:18    20  *
 161    2023-03-29 19:19    20  *
 162    2023-03-29 19:20    20  *
 163    2023-03-29 19:21    18  -
 164    2023-03-29 19:22    20  *
 165    2023-03-29 19:23    19  -
 ...    ..( 10 skipped).    ..  -
 176    2023-03-29 19:34    19  -
 177    2023-03-29 19:35    20  *
 178    2023-03-29 19:36    19  -
 179    2023-03-29 19:37    19  -
 180    2023-03-29 19:38    18  -
 181    2023-03-29 19:39    19  -
 182    2023-03-29 19:40    20  *
 ...    ..(  2 skipped).    ..  *
 185    2023-03-29 19:43    20  *
 186    2023-03-29 19:44    19  -
 187    2023-03-29 19:45    20  *
 188    2023-03-29 19:46    20  *
 189    2023-03-29 19:47    19  -
 190    2023-03-29 19:48    20  *
 191    2023-03-29 19:49    19  -
 192    2023-03-29 19:50    20  *
 193    2023-03-29 19:51     ?  -
 194    2023-03-29 19:52    19  -
 ...    ..(  3 skipped).    ..  -
 198    2023-03-29 19:56    19  -
 199    2023-03-29 19:57    20  *
 200    2023-03-29 19:58    19  -
 201    2023-03-29 19:59    19  -
 202    2023-03-29 20:00    20  *
 ...    ..(  4 skipped).    ..  *
 207    2023-03-29 20:05    20  *
 208    2023-03-29 20:06    21  **
 ...    ..(  2 skipped).    ..  **
 211    2023-03-29 20:09    21  **
 212    2023-03-29 20:10    20  *
 213    2023-03-29 20:11    20  *
 214    2023-03-29 20:12    21  **
 215    2023-03-29 20:13    20  *
 ...    ..(  2 skipped).    ..  *
 218    2023-03-29 20:16    20  *
 219    2023-03-29 20:17    21  **
 220    2023-03-29 20:18    20  *
 ...    ..(  3 skipped).    ..  *
 224    2023-03-29 20:22    20  *
 225    2023-03-29 20:23    21  **
 226    2023-03-29 20:24    20  *
 ...    ..( 10 skipped).    ..  *
 237    2023-03-29 20:35    20  *
 238    2023-03-29 20:36    19  -
 239    2023-03-29 20:37    20  *
 240    2023-03-29 20:38    20  *
 241    2023-03-29 20:39    20  *
 242    2023-03-29 20:40    19  -
 243    2023-03-29 20:41    20  *
 244    2023-03-29 20:42    19  -
 245    2023-03-29 20:43    19  -
 246    2023-03-29 20:44    20  *
 247    2023-03-29 20:45    20  *
 248    2023-03-29 20:46    19  -
 249    2023-03-29 20:47    19  -
 250    2023-03-29 20:48    20  *
 251    2023-03-29 20:49    19  -
 252    2023-03-29 20:50    20  *
 253    2023-03-29 20:51    20  *
 254    2023-03-29 20:52    19  -
 255    2023-03-29 20:53    19  -
 256    2023-03-29 20:54    20  *
 257    2023-03-29 20:55    19  -
 258    2023-03-29 20:56    20  *
 ...    ..(  3 skipped).    ..  *
 262    2023-03-29 21:00    20  *
 263    2023-03-29 21:01    19  -
 264    2023-03-29 21:02    19  -
 265    2023-03-29 21:03    19  -
 266    2023-03-29 21:04    20  *
 267    2023-03-29 21:05    20  *
 268    2023-03-29 21:06    20  *
 269    2023-03-29 21:07    19  -
 270    2023-03-29 21:08    20  *
 271    2023-03-29 21:09    19  -
 272    2023-03-29 21:10    20  *
 ...    ..(  4 skipped).    ..  *
 277    2023-03-29 21:15    20  *
 278    2023-03-29 21:16    21  **
 ...    ..(  8 skipped).    ..  **
 287    2023-03-29 21:25    21  **
 288    2023-03-29 21:26    20  *
 289    2023-03-29 21:27    19  -
 290    2023-03-29 21:28    19  -
 291    2023-03-29 21:29    20  *
 292    2023-03-29 21:30    20  *
 293    2023-03-29 21:31    19  -
 294    2023-03-29 21:32    19  -
 295    2023-03-29 21:33    20  *
 296    2023-03-29 21:34     ?  -
 297    2023-03-29 21:35    19  -
 298    2023-03-29 21:36    19  -
 299    2023-03-29 21:37    19  -
 300    2023-03-29 21:38    21  **
 301    2023-03-29 21:39    19  -
 302    2023-03-29 21:40    20  *
 303    2023-03-29 21:41    20  *
 304    2023-03-29 21:42    21  **
 305    2023-03-29 21:43    20  *
 ...    ..(  5 skipped).    ..  *
 311    2023-03-29 21:49    20  *
 312    2023-03-29 21:50    18  -
 313    2023-03-29 21:51    19  -
 ...    ..(  3 skipped).    ..  -
 317    2023-03-29 21:55    19  -
 318    2023-03-29 21:56    20  *
 319    2023-03-29 21:57    20  *
 320    2023-03-29 21:58    19  -
 321    2023-03-29 21:59    20  *
 322    2023-03-29 22:00    19  -
 323    2023-03-29 22:01    20  *
 324    2023-03-29 22:02    19  -
 325    2023-03-29 22:03    19  -
 326    2023-03-29 22:04    19  -
 327    2023-03-29 22:05     ?  -
 328    2023-03-29 22:06    19  -
 329    2023-03-29 22:07    20  *
 330    2023-03-29 22:08    19  -
 331    2023-03-29 22:09    20  *
 332    2023-03-29 22:10    20  *
 333    2023-03-29 22:11    20  *
 334    2023-03-29 22:12    19  -
 335    2023-03-29 22:13     ?  -
 336    2023-03-29 22:14    19  -
 337    2023-03-29 22:15    20  *
 338    2023-03-29 22:16    19  -
 339    2023-03-29 22:17    19  -
 340    2023-03-29 22:18    20  *
 ...    ..(  7 skipped).    ..  *
 348    2023-03-29 22:26    20  *
 349    2023-03-29 22:27    19  -
 350    2023-03-29 22:28     ?  -
 351    2023-03-29 22:29     ?  -
 352    2023-03-29 22:30    19  -
 353    2023-03-29 22:31    19  -
 354    2023-03-29 22:32     ?  -
 355    2023-03-29 22:33    18  -
 356    2023-03-29 22:34    20  *
 357    2023-03-29 22:35    19  -
 358    2023-03-29 22:36    19  -
 359    2023-03-29 22:37    20  *
 360    2023-03-29 22:38    21  **
 361    2023-03-29 22:39    21  **
 362    2023-03-29 22:40    20  *
 363    2023-03-29 22:41    20  *
 364    2023-03-29 22:42    20  *
 365    2023-03-29 22:43    21  **
 366    2023-03-29 22:44    21  **
 367    2023-03-29 22:45    20  *
 ...    ..(  2 skipped).    ..  *
 370    2023-03-29 22:48    20  *
 371    2023-03-29 22:49    21  **
 372    2023-03-29 22:50    20  *
 373    2023-03-29 22:51    19  -
 374    2023-03-29 22:52    20  *
 375    2023-03-29 22:53    21  **
 376    2023-03-29 22:54    20  *
 377    2023-03-29 22:55    19  -
 378    2023-03-29 22:56    19  -
 379    2023-03-29 22:57    20  *
 380    2023-03-29 22:58    19  -
 381    2023-03-29 22:59    19  -
 382    2023-03-29 23:00    19  -
 383    2023-03-29 23:01    20  *
 384    2023-03-29 23:02     ?  -
 385    2023-03-29 23:03    19  -
 386    2023-03-29 23:04    19  -
 387    2023-03-29 23:05    20  *
 388    2023-03-29 23:06    20  *
 389    2023-03-29 23:07    19  -
 390    2023-03-29 23:08     ?  -
 391    2023-03-29 23:09    19  -
 ...    ..(  3 skipped).    ..  -
 395    2023-03-29 23:13    19  -
 396    2023-03-29 23:14     ?  -
 397    2023-03-29 23:15    19  -
 398    2023-03-29 23:16    19  -
 399    2023-03-29 23:17    19  -
 400    2023-03-29 23:18    20  *
 ...    ..(  9 skipped).    ..  *
 410    2023-03-29 23:28    20  *
 411    2023-03-29 23:29    19  -
 412    2023-03-29 23:30    20  *
 413    2023-03-29 23:31    20  *
 414    2023-03-29 23:32    19  -
 415    2023-03-29 23:33    21  **
 416    2023-03-29 23:34    21  **
 417    2023-03-29 23:35    20  *
 418    2023-03-29 23:36    20  *
 419    2023-03-29 23:37    19  -
 420    2023-03-29 23:38    20  *
 421    2023-03-29 23:39    21  **
 422    2023-03-29 23:40    21  **
 423    2023-03-29 23:41    21  **
 424    2023-03-29 23:42    20  *
 ...    ..(  6 skipped).    ..  *
 431    2023-03-29 23:49    20  *
 432    2023-03-29 23:50    19  -
 433    2023-03-29 23:51    20  *
 434    2023-03-29 23:52    21  **
 435    2023-03-29 23:53    20  *
 436    2023-03-29 23:54    21  **
 437    2023-03-29 23:55    21  **
 438    2023-03-29 23:56    20  *
 439    2023-03-29 23:57    19  -
 440    2023-03-29 23:58    21  **
 441    2023-03-29 23:59    21  **
 442    2023-03-30 00:00    20  *
 443    2023-03-30 00:01    21  **
 ...    ..(  3 skipped).    ..  **
 447    2023-03-30 00:05    21  **
 448    2023-03-30 00:06    20  *
 449    2023-03-30 00:07    21  **
 450    2023-03-30 00:08    21  **
 451    2023-03-30 00:09    20  *
 452    2023-03-30 00:10    19  -
 453    2023-03-30 00:11    20  *
 454    2023-03-30 00:12    19  -
 455    2023-03-30 00:13    20  *
 456    2023-03-30 00:14    20  *
 457    2023-03-30 00:15    19  -
 458    2023-03-30 00:16    20  *
 459    2023-03-30 00:17     ?  -
 460    2023-03-30 00:18    19  -
 461    2023-03-30 00:19    20  *
 462    2023-03-30 00:20    20  *
 463    2023-03-30 00:21    20  *

SCT Error Recovery Control command not supported

Device Statistics (GP Log 0x04)
Page  Offset Size        Value Flags Description
0x01  =====  =               =  ===  == General Statistics (rev 1) ==
0x01  0x008  4            1144  ---  Lifetime Power-On Resets
0x01  0x010  4            1352  ---  Power-on Hours
0x01  0x018  6      3953744745  ---  Logical Sectors Written
0x01  0x020  6        68689029  ---  Number of Write Commands
0x01  0x028  6      3771333434  ---  Logical Sectors Read
0x01  0x030  6        69085046  ---  Number of Read Commands
0x01  0x038  6   1241814508348  ---  Date and Time TimeStamp
0x07  =====  =               =  ===  == Solid State Device Statistics (rev 1) ==
0x07  0x008  1              20  N--  Percentage Used Endurance Indicator
                                |||_ C monitored condition met
                                ||__ D supports DSN
                                |___ N normalized value

Pending Defects log (GP Log 0x0c) not supported

SATA Phy Event Counters (GP Log 0x11)
ID      Size     Value  Description
0x0001  2            3  Command failed due to ICRC error
0x0003  2            0  R_ERR response for device-to-host data FIS
0x0004  2            0  R_ERR response for host-to-device data FIS
0x0006  2            0  R_ERR response for device-to-host non-data FIS
0x0007  2            0  R_ERR response for host-to-device non-data FIS
0x0008  2            0  Device-to-host non-data FIS retries
0x0009  4            0  Transition from drive PhyRdy to drive PhyNRdy
0x000a  4            3  Device-to-host register FISes sent due to a COMRESET
0x000f  2            0  R_ERR response for host-to-device data FIS, CRC
0x0010  2            0  R_ERR response for host-to-device data FIS, non-CRC
0x0012  2            0  R_ERR response for host-to-device non-data FIS, CRC
0x0013  2            0  R_ERR response for host-to-device non-data FIS, non-CRC

