$ sudo smartctl -i /dev/sdb
smartctl 7.4 2023-08-01 r5530 [x86_64-linux-5.15.0-144-generic] (local build)
Copyright (C) 2002-23, Bruce Allen, Christian Franke, www.smartmontools.org

=== START OF INFORMATION SECTION ===
Device Model:     MK000480GWCEV
Serial Number:    S3EBNX0K600403
LU WWN Device Id: 5 002538 c40aa834b
Firmware Version: HPG3
User Capacity:    480,103,981,056 bytes [480 GB]
Sector Size:      512 bytes logical/physical
Rotation Rate:    Solid State Device
Form Factor:      2.5 inches
TRIM Command:     Available, deterministic, zeroed
Device is:        Not in smartctl database 7.3/5528
ATA Version is:   ACS-3 T13/2161-D revision 5
SATA Version is:  SATA 3.2, 6.0 Gb/s (current: 6.0 Gb/s)
Local Time is:    Fri Aug  1 15:13:04 2025 UTC
SMART support is: Available - device has SMART capability.
SMART support is: Enabled

$ sudo smartctl -A /dev/sdb
smartctl 7.4 2023-08-01 r5530 [x86_64-linux-5.15.0-144-generic] (local build)
Copyright (C) 2002-23, Bruce Allen, Christian Franke, www.smartmontools.org

=== START OF READ SMART DATA SECTION ===
SMART Attributes Data Structure revision number: 1
Vendor Specific SMART Attributes with Thresholds:
ID# ATTRIBUTE_NAME          FLAG     VALUE WORST THRESH TYPE      UPDATED  WHEN_FAILED RAW_VALUE
  1 Raw_Read_Error_Rate     0x000f   200   200   002    Pre-fail  Always       -       0
  5 Reallocated_Sector_Ct   0x0033   100   100   005    Pre-fail  Always       -       0
  9 Power_On_Hours          0x0032   091   091   000    Old_age   Always       -       41963
173 Unknown_Attribute       0x0033   096   096   005    Pre-fail  Always       -       1464
175 Program_Fail_Count_Chip 0x0033   100   100   001    Pre-fail  Always       -       0
180 Unused_Rsvd_Blk_Cnt_Tot 0x003b   200   200   097    Pre-fail  Always       -       0
194 Temperature_Celsius     0x0022   084   074   000    Old_age   Always       -       16
196 Reallocated_Event_Count 0x0033   100   100   005    Pre-fail  Always       -       0
202 Unknown_SSD_Attribute   0x0033   100   100   010    Pre-fail  Always       -       0

