smartctl 6.5 2016-05-07 r4318 [x86_64-linux-4.9.0-2-default] (SUSE RPM)
Copyright (C) 2002-16, Bruce Allen, Christian Franke, www.smartmontools.org

=== START OF INFORMATION SECTION ===
Device Model:     INTEL SSDSCKKW480H6
Serial Number:    CVLY6154011M480F
LU WWN Device Id: 5 5cd2e4 14cb9e1d0
Firmware Version: LSBG100
User Capacity:    480.103.981.056 bytes [480 GB]
Sector Size:      512 bytes logical/physical
Rotation Rate:    Solid State Device
Form Factor:      M.2
Device is:        Not in smartctl database [for details use: -P showall]
ATA Version is:   ACS-3 (minor revision not indicated)
SATA Version is:  SATA 3.2, 6.0 Gb/s (current: 6.0 Gb/s)
Local Time is:    Mon Jan  9 15:43:11 2017 CET
SMART support is: Available - device has SMART capability.
SMART support is: Enabled
AAM feature is:   Unavailable
APM level is:     254 (maximum performance)
Rd look-ahead is: Enabled
Write cache is:   Enabled
ATA Security is:  Disabled, NOT FROZEN [SEC1]
Write SCT (Get) Feature Control Command failed: scsi error badly formed scsi parameters
Wt Cache Reorder: Unknown (SCT Feature Control command failed)

=== START OF READ SMART DATA SECTION ===
SMART overall-health self-assessment test result: PASSED

General SMART Values:
Offline data collection status:  (0x02)	Offline data collection activity
					was completed without error.
					Auto Offline Data Collection: Disabled.
Self-test execution status:      (   0)	The previous self-test routine completed
					without error or no self-test has ever 
					been run.
Total time to complete Offline 
data collection: 		(    0) seconds.
Offline data collection
capabilities: 			 (0x53) SMART execute Offline immediate.
					Auto Offline data collection on/off support.
					Suspend Offline collection upon new
					command.
					No Offline surface scan supported.
					Self-test supported.
					No Conveyance Self-test supported.
					Selective Self-test supported.
SMART capabilities:            (0x0003)	Saves SMART data before entering
					power-saving mode.
					Supports SMART auto save timer.
Error logging capability:        (0x01)	Error logging supported.
					General Purpose Logging supported.
Short self-test routine 
recommended polling time: 	 (   2) minutes.
Extended self-test routine
recommended polling time: 	 (  30) minutes.
SCT capabilities: 	       (0x0039)	SCT Status supported.
					SCT Error Recovery Control supported.
					SCT Feature Control supported.
					SCT Data Table supported.

SMART Attributes Data Structure revision number: 1
Vendor Specific SMART Attributes with Thresholds:
ID# ATTRIBUTE_NAME          FLAGS    VALUE WORST THRESH FAIL RAW_VALUE
  5 Reallocated_Sector_Ct   -O--CK   100   100   000    -    0
  9 Power_On_Hours          -O--CK   100   100   000    -    44
 12 Power_Cycle_Count       -O--CK   100   100   000    -    361
170 Unknown_Attribute       PO--CK   100   100   010    -    0
171 Unknown_Attribute       -O--CK   100   100   010    -    0
172 Unknown_Attribute       -O--CK   100   100   010    -    0
174 Unknown_Attribute       -O--CK   100   100   000    -    11
183 Runtime_Bad_Block       -O--CK   100   100   000    -    0
184 End-to-End_Error        PO--CK   100   100   090    -    0
187 Reported_Uncorrect      -O--CK   100   100   000    -    0
190 Airflow_Temperature_Cel -O--CK   040   062   000    -    40 (Min/Max 25/62)
192 Power-Off_Retract_Count -O--CK   100   100   000    -    11
199 UDMA_CRC_Error_Count    -O--CK   100   100   000    -    0
225 Unknown_SSD_Attribute   -O--CK   100   100   000    -    52782
226 Unknown_SSD_Attribute   -O--CK   100   100   000    -    0
227 Unknown_SSD_Attribute   -O--CK   100   100   000    -    0
228 Power-off_Retract_Count -O--CK   100   100   000    -    0
232 Available_Reservd_Space PO--CK   100   100   010    -    0
233 Media_Wearout_Indicator -O--CK   100   100   000    -    0
241 Total_LBAs_Written      -O--CK   100   100   000    -    52782
242 Total_LBAs_Read         -O--CK   100   100   000    -    37514
249 Unknown_Attribute       -O--CK   100   100   000    -    1045
252 Unknown_Attribute       -O--CK   100   100   000    -    3
                            ||||||_ K auto-keep
                            |||||__ C event count
                            ||||___ R error rate
                            |||____ S speed/performance
                            ||_____ O updated online
                            |______ P prefailure warning

General Purpose Log Directory Version 1
SMART           Log Directory Version 1 [multi-sector log support]
Address    Access  R/W   Size  Description
0x00       GPL,SL  R/O      1  Log Directory
0x01       GPL,SL  R/O      1  Summary SMART error log
0x02       GPL,SL  R/O      1  Comprehensive SMART error log
0x03       GPL,SL  R/O      1  Ext. Comprehensive SMART error log
0x04       GPL,SL  R/O      8  Device Statistics log
0x06       GPL,SL  R/O      1  SMART self-test log
0x07       GPL,SL  R/O      1  Extended self-test log
0x09       GPL,SL  R/W      1  Selective self-test log
0x10       GPL,SL  R/O      1  SATA NCQ Queued Error log
0x11       GPL,SL  R/O      1  SATA Phy Event Counters log
0x30       GPL,SL  R/O      9  IDENTIFY DEVICE data log
0x80-0x9f  GPL,SL  R/W     16  Host vendor specific log
0xdf       GPL,SL  VS       1  Device vendor specific log
0xe0       GPL,SL  R/W      1  SCT Command/Status
0xe1       GPL,SL  R/W      1  SCT Data Transfer

SMART Extended Comprehensive Error Log Version: 1 (1 sectors)
No Errors Logged

SMART Extended Self-test Log Version: 1 (1 sectors)
Num  Test_Description    Status                  Remaining  LifeTime(hours)  LBA_of_first_error
# 1  Short offline       Completed without error       00%        44         -

SMART Selective self-test log data structure revision number 1
 SPAN         MIN_LBA         MAX_LBA  CURRENT_TEST_STATUS
    1  70403103932424  70403103932424  Not_testing
    2  70403103932424  70403103932424  Not_testing
    3  70403103932424  70403103932424  Not_testing
    4  70403103932424  70403103932424  Not_testing
    5  70403103932424  70403103932424  Not_testing
Selective self-test flags (0x4008):
  After scanning selected spans, do NOT read-scan remainder of disk.
If Selective self-test is pending on power-up, resume after 0 minute delay.

SCT Status Version:                  3
SCT Version (vendor specific):       0 (0x0000)
SCT Support Level:                   0
Device State:                        Active (0)
Current Temperature:                    50 Celsius
Power Cycle Min/Max Temperature:     37/50 Celsius
Lifetime    Min/Max Temperature:     33/77 Celsius
Under/Over Temperature Limit Count:   0/0

SCT Temperature History Version:     2
Temperature Sampling Period:         1 minute
Temperature Logging Interval:        1 minute
Min/Max recommended Temperature:      0/100 Celsius
Min/Max Temperature Limit:            0/100 Celsius
Temperature History Size (Index):    128 (103)

Index    Estimated Time   Temperature Celsius
 104    2017-01-09 13:36    55  ************************************
 105    2017-01-09 13:37    53  **********************************
 106    2017-01-09 13:38    53  **********************************
 107    2017-01-09 13:39    56  *************************************
 108    2017-01-09 13:40    55  ************************************
 109    2017-01-09 13:41    56  *************************************
 110    2017-01-09 13:42    57  **************************************
 111    2017-01-09 13:43    58  ***************************************
 112    2017-01-09 13:44    57  **************************************
 113    2017-01-09 13:45    53  **********************************
 114    2017-01-09 13:46    52  *********************************
 115    2017-01-09 13:47    52  *********************************
 116    2017-01-09 13:48    52  *********************************
 117    2017-01-09 13:49    51  ********************************
 118    2017-01-09 13:50    51  ********************************
 119    2017-01-09 13:51    51  ********************************
 120    2017-01-09 13:52    50  *******************************
 ...    ..(  3 skipped).    ..  *******************************
 124    2017-01-09 13:56    50  *******************************
 125    2017-01-09 13:57    48  *****************************
 126    2017-01-09 13:58    48  *****************************
 127    2017-01-09 13:59    48  *****************************
   0    2017-01-09 14:00    50  *******************************
   1    2017-01-09 14:01    50  *******************************
   2    2017-01-09 14:02    50  *******************************
   3    2017-01-09 14:03    48  *****************************
   4    2017-01-09 14:04    48  *****************************
   5    2017-01-09 14:05    48  *****************************
   6    2017-01-09 14:06    50  *******************************
   7    2017-01-09 14:07    50  *******************************
   8    2017-01-09 14:08    48  *****************************
 ...    ..(  9 skipped).    ..  *****************************
  18    2017-01-09 14:18    48  *****************************
  19    2017-01-09 14:19    50  *******************************
  20    2017-01-09 14:20    48  *****************************
 ...    ..(  8 skipped).    ..  *****************************
  29    2017-01-09 14:29    48  *****************************
  30    2017-01-09 14:30    50  *******************************
  31    2017-01-09 14:31    50  *******************************
  32    2017-01-09 14:32    48  *****************************
  33    2017-01-09 14:33    48  *****************************
  34    2017-01-09 14:34    48  *****************************
  35    2017-01-09 14:35    50  *******************************
  36    2017-01-09 14:36    50  *******************************
  37    2017-01-09 14:37    50  *******************************
  38    2017-01-09 14:38    48  *****************************
 ...    ..(  3 skipped).    ..  *****************************
  42    2017-01-09 14:42    48  *****************************
  43    2017-01-09 14:43    50  *******************************
  44    2017-01-09 14:44    50  *******************************
  45    2017-01-09 14:45    48  *****************************
  46    2017-01-09 14:46    50  *******************************
  47    2017-01-09 14:47    38  *******************
  48    2017-01-09 14:48    42  ***********************
  49    2017-01-09 14:49    37  ******************
  50    2017-01-09 14:50    37  ******************
  51    2017-01-09 14:51    38  *******************
  52    2017-01-09 14:52    41  **********************
 ...    ..(  3 skipped).    ..  **********************
  56    2017-01-09 14:56    41  **********************
  57    2017-01-09 14:57    42  ***********************
  58    2017-01-09 14:58    48  *****************************
  59    2017-01-09 14:59    45  **************************
  60    2017-01-09 15:00    42  ***********************
 ...    ..(  3 skipped).    ..  ***********************
  64    2017-01-09 15:04    42  ***********************
  65    2017-01-09 15:05    40  *********************
  66    2017-01-09 15:06    38  *******************
  67    2017-01-09 15:07    40  *********************
  68    2017-01-09 15:08    38  *******************
  69    2017-01-09 15:09    38  *******************
  70    2017-01-09 15:10    40  *********************
  71    2017-01-09 15:11    41  **********************
  72    2017-01-09 15:12    41  **********************
  73    2017-01-09 15:13    38  *******************
  74    2017-01-09 15:14    41  **********************
  75    2017-01-09 15:15    52  *********************************
  76    2017-01-09 15:16    51  ********************************
  77    2017-01-09 15:17    51  ********************************
  78    2017-01-09 15:18    51  ********************************
  79    2017-01-09 15:19    50  *******************************
  80    2017-01-09 15:20    51  ********************************
  81    2017-01-09 15:21    52  *********************************
  82    2017-01-09 15:22    52  *********************************
  83    2017-01-09 15:23    51  ********************************
  84    2017-01-09 15:24    50  *******************************
  85    2017-01-09 15:25    41  **********************
  86    2017-01-09 15:26    48  *****************************
  87    2017-01-09 15:27    50  *******************************
  88    2017-01-09 15:28    48  *****************************
  89    2017-01-09 15:29    48  *****************************
  90    2017-01-09 15:30    37  ******************
  91    2017-01-09 15:31    47  ****************************
  92    2017-01-09 15:32    48  *****************************
  93    2017-01-09 15:33    48  *****************************
  94    2017-01-09 15:34    37  ******************
  95    2017-01-09 15:35    43  ************************
  96    2017-01-09 15:36    46  ***************************
  97    2017-01-09 15:37    47  ****************************
  98    2017-01-09 15:38    48  *****************************
  99    2017-01-09 15:39    48  *****************************
 100    2017-01-09 15:40    50  *******************************
 ...    ..(  2 skipped).    ..  *******************************
 103    2017-01-09 15:43    50  *******************************

SCT Error Recovery Control:
           Read: Disabled
          Write: Disabled

Device Statistics (GP Log 0x04)
Page  Offset Size        Value Flags Description
0x01  =====  =               =  ===  == General Statistics (rev 2) ==
0x01  0x008  4             361  ---  Lifetime Power-On Resets
0x01  0x010  4              44  ---  Power-on Hours
0x01  0x018  6      3459152805  ---  Logical Sectors Written
0x01  0x020  6        27064433  ---  Number of Write Commands
0x01  0x028  6      2458544884  ---  Logical Sectors Read
0x01  0x030  6        19676822  ---  Number of Read Commands
0x02  =====  =               =  ===  == Free-Fall Statistics (empty) ==
0x03  =====  =               =  ===  == Rotating Media Statistics (empty) ==
0x04  =====  =               =  ===  == General Errors Statistics (rev 1) ==
0x04  0x008  4               0  ---  Number of Reported Uncorrectable Errors
0x04  0x010  4              11  ---  Resets Between Cmd Acceptance and Completion
0x05  =====  =               =  ===  == Temperature Statistics (rev 1) ==
0x05  0x008  1              50  ---  Current Temperature
0x05  0x010  1               -  ---  Average Short Term Temperature
0x05  0x018  1               -  ---  Average Long Term Temperature
0x05  0x020  1              76  ---  Highest Temperature
0x05  0x028  1              56  ---  Lowest Temperature
0x05  0x030  1               -  ---  Highest Average Short Term Temperature
0x05  0x038  1               -  ---  Lowest Average Short Term Temperature
0x05  0x040  1               -  ---  Highest Average Long Term Temperature
0x05  0x048  1               -  ---  Lowest Average Long Term Temperature
0x05  0x050  4               0  ---  Time in Over-Temperature
0x05  0x058  1              85  ---  Specified Maximum Operating Temperature
0x05  0x060  4               0  ---  Time in Under-Temperature
0x05  0x068  1               0  ---  Specified Minimum Operating Temperature
0x06  =====  =               =  ===  == Transport Statistics (rev 1) ==
0x06  0x008  4            1779  ---  Number of Hardware Resets
0x06  0x018  4               0  ---  Number of Interface CRC Errors
0x07  =====  =               =  ===  == Solid State Device Statistics (rev 1) ==
0x07  0x008  1               0  ---  Percentage Used Endurance Indicator
                                |||_ C monitored condition met
                                ||__ D supports DSN
                                |___ N normalized value

SATA Phy Event Counters (GP Log 0x11)
ID      Size     Value  Description
0x0001  2            0  Command failed due to ICRC error
0x0005  2            0  R_ERR response for non-data FIS
0x000a  2            2  Device-to-host register FISes sent due to a COMRESET

