smartctl 6.5 2016-01-24 r4214 [x86_64-linux-4.4.0-109-generic] (local build)
Copyright (C) 2002-16, Bruce Allen, Christian Franke, www.smartmontools.org

=== START OF INFORMATION SECTION ===
Device Model:     MB4000GVYZA
Serial Number:    ZAD277CL
LU WWN Device Id: 5 000c50 0a47140ba
Firmware Version: HPG3
User Capacity:    4.000.787.030.016 bytes [4,00 TB]
Sector Sizes:     512 bytes logical, 4096 bytes physical
Rotation Rate:    7200 rpm
Form Factor:      3.5 inches
Device is:        Not in smartctl database [for details use: -P showall]
ATA Version is:   ACS-3 T13/2161-D revision 5
SATA Version is:  SATA 3.1, 6.0 Gb/s (current: 6.0 Gb/s)
Local Time is:    Sun Jan 21 01:09:36 2018 CET
SMART support is: Available - device has SMART capability.
SMART support is: Enabled
AAM feature is:   Unavailable
APM feature is:   Unavailable
Rd look-ahead is: Enabled
Write cache is:   Disabled
ATA Security is:  Unavailable
Wt Cache Reorder: Unavailable

=== START OF READ SMART DATA SECTION ===
SMART overall-health self-assessment test result: PASSED

General SMART Values:
Offline data collection status:  (0x82)	Offline data collection activity
					was completed without error.
					Auto Offline Data Collection: Enabled.
Self-test execution status:      (   0)	The previous self-test routine completed
					without error or no self-test has ever 
					been run.
Total time to complete Offline 
data collection: 		(  575) seconds.
Offline data collection
capabilities: 			 (0x7b) SMART execute Offline immediate.
					Auto Offline data collection on/off support.
					Suspend Offline collection upon new
					command.
					Offline surface scan supported.
					Self-test supported.
					Conveyance Self-test supported.
					Selective Self-test supported.
SMART capabilities:            (0x0003)	Saves SMART data before entering
					power-saving mode.
					Supports SMART auto save timer.
Error logging capability:        (0x01)	Error logging supported.
					General Purpose Logging supported.
Short self-test routine 
recommended polling time: 	 (   2) minutes.
Extended self-test routine
recommended polling time: 	 ( 434) minutes.
Conveyance self-test routine
recommended polling time: 	 (   3) minutes.
SCT capabilities: 	       (0x1025)	SCT Status supported.
					SCT Data Table supported.

SMART Attributes Data Structure revision number: 10
Vendor Specific SMART Attributes with Thresholds:
ID# ATTRIBUTE_NAME          FLAGS    VALUE WORST THRESH FAIL RAW_VALUE
  1 Raw_Read_Error_Rate     POSR--   069   065   044    -    7920644
  3 Spin_Up_Time            PO----   099   099   070    -    0
  5 Reallocated_Sector_Ct   PO--CK   100   100   010    -    0
  7 Seek_Error_Rate         POSR--   078   060   045    -    63425217
  9 Power_On_Hours          -O--CK   100   100   000    -    224
 10 Spin_Retry_Count        PO--C-   100   100   097    -    0
180 Unknown_HDD_Attribute   PO-RCK   100   100   030    -    111029276
194 Temperature_Celsius     -O---K   027   040   000    -    27 (0 18 0 0 0)
196 Reallocated_Event_Count PO--CK   100   100   010    -    0
                            ||||||_ K auto-keep
                            |||||__ C event count
                            ||||___ R error rate
                            |||____ S speed/performance
                            ||_____ O updated online
                            |______ P prefailure warning

General Purpose Log Directory Version 1
SMART           Log Directory Version 1 [multi-sector log support]
Address    Access  R/W   Size  Description
0x00       GPL,SL  R/O      1  Log Directory
0x03       GPL     R/O      5  Ext. Comprehensive SMART error log
0x04       GPL,SL  R/O      8  Device Statistics log
0x07       GPL     R/O      1  Extended self-test log
0x08       GPL     R/O      2  Power Conditions log
0x09           SL  R/W      1  Selective self-test log
0x0c       GPL     R/O   2048  Pending Defects log
0x10       GPL     R/O      1  SATA NCQ Queued Error log
0x11       GPL     R/O      1  SATA Phy Event Counters log
0x21       GPL     R/O      1  Write stream error log
0x22       GPL     R/O      1  Read stream error log
0x24       GPL     R/O    512  Current Device Internal Status Data log
0x30       GPL     R/O      9  IDENTIFY DEVICE data log
0x80-0x9f  GPL     R/W     16  Host vendor specific log
0xa1       GPL,SL  VS      24  Device vendor specific log
0xa2       GPL     VS    8160  Device vendor specific log
0xa6       GPL     VS     192  Device vendor specific log
0xa8-0xa9  GPL,SL  VS     136  Device vendor specific log
0xab       GPL     VS       1  Device vendor specific log
0xad       GPL     VS      16  Device vendor specific log
0xb0       GPL     VS    9048  Device vendor specific log
0xb5           SL  VS       1  Device vendor specific log
0xb6       GPL     VS    1920  Device vendor specific log
0xbe-0xbf  GPL     VS   65535  Device vendor specific log
0xc1       GPL,SL  VS      16  Device vendor specific log
0xc3       GPL,SL  VS       8  Device vendor specific log
0xd0       GPL     VS       1  Device vendor specific log
0xd1       GPL     VS     264  Device vendor specific log
0xd2       GPL     VS   10000  Device vendor specific log
0xd4       GPL     VS    2048  Device vendor specific log
0xd7       GPL     VS       1  Device vendor specific log
0xda       GPL,SL  VS       1  Device vendor specific log
0xe0       GPL,SL  R/W      1  SCT Command/Status
0xe1       GPL,SL  R/W      1  SCT Data Transfer

SMART Extended Comprehensive Error Log Version: 1 (5 sectors)
No Errors Logged

SMART Extended Self-test Log Version: 1 (1 sectors)
Num  Test_Description    Status                  Remaining  LifeTime(hours)  LBA_of_first_error
# 1  Short offline       Completed without error       00%       224         -
# 2  Short offline       Completed without error       00%         0         -

SMART Selective self-test log data structure revision number 1
 SPAN  MIN_LBA  MAX_LBA  CURRENT_TEST_STATUS
    1        0        0  Not_testing
    2        0        0  Not_testing
    3        0        0  Not_testing
    4        0        0  Not_testing
    5        0        0  Not_testing
Selective self-test flags (0x0):
  After scanning selected spans, do NOT read-scan remainder of disk.
If Selective self-test is pending on power-up, resume after 0 minute delay.

SCT Status Version:                  3
SCT Version (vendor specific):       522 (0x020a)
SCT Support Level:                   0
Device State:                        Active (0)
Current Temperature:                    27 Celsius
Power Cycle Min/Max Temperature:     18/32 Celsius
Lifetime    Min/Max Temperature:     18/32 Celsius
Under/Over Temperature Limit Count:   0/0

SCT Temperature History Version:     2
Temperature Sampling Period:         3 minutes
Temperature Logging Interval:        59 minutes
Min/Max recommended Temperature:     10/40 Celsius
Min/Max Temperature Limit:            5/60 Celsius
Temperature History Size (Index):    128 (100)

Index    Estimated Time   Temperature Celsius
 101    2018-01-15 19:20    30  ***********
 102    2018-01-15 20:19    30  ***********
 103    2018-01-15 21:18    29  **********
 104    2018-01-15 22:17    29  **********
 105    2018-01-15 23:16    30  ***********
 ...    ..( 10 skipped).    ..  ***********
 116    2018-01-16 10:05    30  ***********
 117    2018-01-16 11:04    29  **********
 118    2018-01-16 12:03    28  *********
 119    2018-01-16 13:02    29  **********
 ...    ..(  3 skipped).    ..  **********
 123    2018-01-16 16:58    29  **********
 124    2018-01-16 17:57    28  *********
 ...    ..(  4 skipped).    ..  *********
   1    2018-01-16 22:52    28  *********
   2    2018-01-16 23:51    29  **********
   3    2018-01-17 00:50    29  **********
   4    2018-01-17 01:49    29  **********
   5    2018-01-17 02:48    28  *********
   6    2018-01-17 03:47    27  ********
   7    2018-01-17 04:46    28  *********
 ...    ..(  3 skipped).    ..  *********
  11    2018-01-17 08:42    28  *********
  12    2018-01-17 09:41    27  ********
  13    2018-01-17 10:40    27  ********
  14    2018-01-17 11:39    28  *********
 ...    ..(  3 skipped).    ..  *********
  18    2018-01-17 15:35    28  *********
  19    2018-01-17 16:34    29  **********
  20    2018-01-17 17:33    30  ***********
  21    2018-01-17 18:32    30  ***********
  22    2018-01-17 19:31    31  ************
  23    2018-01-17 20:30    31  ************
  24    2018-01-17 21:29    30  ***********
 ...    ..(  2 skipped).    ..  ***********
  27    2018-01-18 00:26    30  ***********
  28    2018-01-18 01:25    29  **********
 ...    ..(  3 skipped).    ..  **********
  32    2018-01-18 05:21    29  **********
  33    2018-01-18 06:20    28  *********
  34    2018-01-18 07:19    28  *********
  35    2018-01-18 08:18    30  ***********
  36    2018-01-18 09:17    30  ***********
  37    2018-01-18 10:16    29  **********
  38    2018-01-18 11:15    29  **********
  39    2018-01-18 12:14    28  *********
 ...    ..(  8 skipped).    ..  *********
  48    2018-01-18 21:05    28  *********
  49    2018-01-18 22:04    27  ********
  50    2018-01-18 23:03    27  ********
  51    2018-01-19 00:02    28  *********
 ...    ..(  2 skipped).    ..  *********
  54    2018-01-19 02:59    28  *********
  55    2018-01-19 03:58    27  ********
 ...    ..(  9 skipped).    ..  ********
  65    2018-01-19 13:48    27  ********
  66    2018-01-19 14:47    28  *********
  67    2018-01-19 15:46    28  *********
  68    2018-01-19 16:45    27  ********
  69    2018-01-19 17:44    28  *********
  70    2018-01-19 18:43    27  ********
 ...    ..(  6 skipped).    ..  ********
  77    2018-01-20 01:36    27  ********
  78    2018-01-20 02:35    26  *******
 ...    ..(  4 skipped).    ..  *******
  83    2018-01-20 07:30    26  *******
  84    2018-01-20 08:29    27  ********
  85    2018-01-20 09:28    27  ********
  86    2018-01-20 10:27    27  ********
  87    2018-01-20 11:26    29  **********
  88    2018-01-20 12:25    30  ***********
  89    2018-01-20 13:24    29  **********
  90    2018-01-20 14:23    28  *********
  91    2018-01-20 15:22    29  **********
  92    2018-01-20 16:21    29  **********
  93    2018-01-20 17:20    28  *********
  94    2018-01-20 18:19    27  ********
 ...    ..(  5 skipped).    ..  ********
 100    2018-01-21 00:13    27  ********

SCT Error Recovery Control command not supported

Device Statistics (GP Log 0x04)
Page  Offset Size        Value Flags Description
0x01  =====  =               =  ===  == General Statistics (rev 1) ==
0x01  0x008  4               1  ---  Lifetime Power-On Resets
0x01  0x010  4             224  ---  Power-on Hours
0x01  0x018  6     13220809550  ---  Logical Sectors Written
0x01  0x020  6        23347668  ---  Number of Write Commands
0x01  0x028  6     17842730789  ---  Logical Sectors Read
0x01  0x030  6        29456912  ---  Number of Read Commands
0x01  0x038  6               -  ---  Date and Time TimeStamp
0x03  =====  =               =  ===  == Rotating Media Statistics (rev 1) ==
0x03  0x008  4             224  ---  Spindle Motor Power-on Hours
0x03  0x010  4             224  ---  Head Flying Hours
0x03  0x018  4              10  ---  Head Load Events
0x03  0x020  4               0  ---  Number of Reallocated Logical Sectors
0x03  0x028  4               0  ---  Read Recovery Attempts
0x03  0x030  4               0  ---  Number of Mechanical Start Failures
0x03  0x038  4               0  ---  Number of Realloc. Candidate Logical Sectors
0x03  0x040  4               1  ---  Number of High Priority Unload Events
0x04  =====  =               =  ===  == General Errors Statistics (rev 1) ==
0x04  0x008  4               0  ---  Number of Reported Uncorrectable Errors
0x04  0x010  4               0  ---  Resets Between Cmd Acceptance and Completion
0x05  =====  =               =  ===  == Temperature Statistics (rev 1) ==
0x05  0x008  1              27  ---  Current Temperature
0x05  0x010  1              27  ---  Average Short Term Temperature
0x05  0x018  1               -  ---  Average Long Term Temperature
0x05  0x020  1              32  ---  Highest Temperature
0x05  0x028  1               0  ---  Lowest Temperature
0x05  0x030  1              29  ---  Highest Average Short Term Temperature
0x05  0x038  1              26  ---  Lowest Average Short Term Temperature
0x05  0x040  1               -  ---  Highest Average Long Term Temperature
0x05  0x048  1               -  ---  Lowest Average Long Term Temperature
0x05  0x050  4               0  ---  Time in Over-Temperature
0x05  0x058  1              60  ---  Specified Maximum Operating Temperature
0x05  0x060  4              10  ---  Time in Under-Temperature
0x05  0x068  1               5  ---  Specified Minimum Operating Temperature
0x06  =====  =               =  ===  == Transport Statistics (rev 1) ==
0x06  0x008  4              50  ---  Number of Hardware Resets
0x06  0x010  4              11  ---  Number of ASR Events
0x06  0x018  4               0  ---  Number of Interface CRC Errors
                                |||_ C monitored condition met
                                ||__ D supports DSN
                                |___ N normalized value

SATA Phy Event Counters (GP Log 0x11)
ID      Size     Value  Description
0x000a  2           51  Device-to-host register FISes sent due to a COMRESET
0x0001  2            0  Command failed due to ICRC error
0x0003  2            0  R_ERR response for device-to-host data FIS
0x0004  2            0  R_ERR response for host-to-device data FIS
0x0006  2            0  R_ERR response for device-to-host non-data FIS
0x0007  2            0  R_ERR response for host-to-device non-data FIS

