smartctl 6.4 2014-10-07 r4002 [x86_64-linux-4.9.0-0.bpo.11-amd64] (local build)
Copyright (C) 2002-14, Bruce Allen, Christian Franke, www.smartmontools.org

=== START OF INFORMATION SECTION ===
Device Model:     ST12000VN0008-2JH101
Serial Number:    ZHZ3TN6G
LU WWN Device Id: 5 000c50 0c2c906cb
Firmware Version: SC60
User Capacity:    12,000,138,625,024 bytes [12.0 TB]
Sector Sizes:     512 bytes logical, 4096 bytes physical
Rotation Rate:    7200 rpm
Form Factor:      3.5 inches
Device is:        Not in smartctl database [for details use: -P showall]
ATA Version is:   Unknown(0x0fe0) (minor revision not indicated)
SATA Version is:  SATA >3.2, 6.0 Gb/s (current: 6.0 Gb/s)
Local Time is:    Mon Nov 25 11:39:52 2019 CET
SMART support is: Available - device has SMART capability.
SMART support is: Enabled
AAM feature is:   Unavailable
APM feature is:   Unavailable
Rd look-ahead is: Enabled
Write cache is:   Enabled
ATA Security is:  Disabled, frozen [SEC2]
Write SCT (Get) Feature Control Command failed: scsi error badly formed scsi parameters
Wt Cache Reorder: Unknown (SCT Feature Control command failed)

=== START OF READ SMART DATA SECTION ===
SMART overall-health self-assessment test result: PASSED

General SMART Values:
Offline data collection status:  (0x82)	Offline data collection activity
					was completed without error.
					Auto Offline Data Collection: Enabled.
Self-test execution status:      ( 249)	Self-test routine in progress...
					90% of test remaining.
Total time to complete Offline 
data collection: 		(  567) seconds.
Offline data collection
capabilities: 			 (0x7b) SMART execute Offline immediate.
					Auto Offline data collection on/off support.
					Suspend Offline collection upon new
					command.
					Offline surface scan supported.
					Self-test supported.
					Conveyance Self-test supported.
					Selective Self-test supported.
SMART capabilities:            (0x0003)	Saves SMART data before entering
					power-saving mode.
					Supports SMART auto save timer.
Error logging capability:        (0x01)	Error logging supported.
					General Purpose Logging supported.
Short self-test routine 
recommended polling time: 	 (   1) minutes.
Extended self-test routine
recommended polling time: 	 (1173) minutes.
Conveyance self-test routine
recommended polling time: 	 (   2) minutes.
SCT capabilities: 	       (0x50bd)	SCT Status supported.
					SCT Error Recovery Control supported.
					SCT Feature Control supported.
					SCT Data Table supported.

SMART Attributes Data Structure revision number: 10
Vendor Specific SMART Attributes with Thresholds:
ID# ATTRIBUTE_NAME          FLAGS    VALUE WORST THRESH FAIL RAW_VALUE
  1 Raw_Read_Error_Rate     POSR--   078   065   044    -    63329392
  3 Spin_Up_Time            PO----   089   087   000    -    0
  4 Start_Stop_Count        -O--CK   100   100   020    -    65
  5 Reallocated_Sector_Ct   PO--CK   100   100   010    -    0
  7 Seek_Error_Rate         POSR--   067   060   045    -    4630461
  9 Power_On_Hours          -O--CK   100   100   000    -    135
 10 Spin_Retry_Count        PO--C-   100   100   097    -    0
 12 Power_Cycle_Count       -O--CK   100   100   020    -    2
 18 Unknown_Attribute       PO-R--   100   100   050    -    0
187 Reported_Uncorrect      -O--CK   100   100   000    -    0
188 Command_Timeout         -O--CK   098   062   000    -    219046674483
190 Airflow_Temperature_Cel -O---K   072   063   040    -    28 (Min/Max 21/28)
192 Power-Off_Retract_Count -O--CK   100   100   000    -    0
193 Load_Cycle_Count        -O--CK   100   100   000    -    1168
194 Temperature_Celsius     -O---K   028   040   000    -    28 (0 21 0 0 0)
195 Hardware_ECC_Recovered  -O-RC-   078   065   000    -    63329392
197 Current_Pending_Sector  -O--C-   100   100   000    -    0
198 Offline_Uncorrectable   ----C-   100   100   000    -    0
199 UDMA_CRC_Error_Count    -OSRCK   200   200   000    -    0
200 Multi_Zone_Error_Rate   PO---K   100   100   001    -    0
240 Head_Flying_Hours       ------   100   253   000    -    19 (167 5 0)
241 Total_LBAs_Written      ------   100   253   000    -    12993595056
242 Total_LBAs_Read         ------   100   253   000    -    499193477
                            ||||||_ K auto-keep
                            |||||__ C event count
                            ||||___ R error rate
                            |||____ S speed/performance
                            ||_____ O updated online
                            |______ P prefailure warning

General Purpose Log Directory Version 1
SMART           Log Directory Version 1 [multi-sector log support]
Address    Access  R/W   Size  Description
0x00       GPL,SL  R/O      1  Log Directory
0x01           SL  R/O      1  Summary SMART error log
0x02           SL  R/O      5  Comprehensive SMART error log
0x03       GPL     R/O      5  Ext. Comprehensive SMART error log
0x04       GPL     R/O    256  Device Statistics log
0x04       SL      R/O      8  Device Statistics log
0x06           SL  R/O      1  SMART self-test log
0x07       GPL     R/O      1  Extended self-test log
0x08       GPL     R/O      2  Power Conditions log
0x09           SL  R/W      1  Selective self-test log
0x0a       GPL     R/W      8  Device Statistics Notification
0x0c       GPL     R/O   2048  Pending Defects log
0x10       GPL     R/O      1  SATA NCQ Queued Error log
0x11       GPL     R/O      1  SATA Phy Event Counters log
0x13       GPL     R/O      1  SATA NCQ Send and Receive log
0x15       GPL     R/W      1  SATA Rebuild Assist log
0x21       GPL     R/O      1  Write stream error log
0x22       GPL     R/O      1  Read stream error log
0x24       GPL     R/O    768  Current Device Internal Status Data log
0x2f       GPL     -        1  Reserved
0x30       GPL,SL  R/O      9  IDENTIFY DEVICE data log
0x80-0x9f  GPL,SL  R/W     16  Host vendor specific log
0xa1       GPL,SL  VS      24  Device vendor specific log
0xa2       GPL     VS   16320  Device vendor specific log
0xa4       GPL,SL  VS     160  Device vendor specific log
0xa6       GPL     VS     192  Device vendor specific log
0xa8-0xa9  GPL,SL  VS     136  Device vendor specific log
0xab       GPL     VS       1  Device vendor specific log
0xad       GPL     VS      16  Device vendor specific log
0xbe-0xbf  GPL     VS   65535  Device vendor specific log
0xc1       GPL,SL  VS       8  Device vendor specific log
0xc3       GPL,SL  VS      32  Device vendor specific log
0xc9       GPL,SL  VS       8  Device vendor specific log
0xca       GPL,SL  VS      16  Device vendor specific log
0xd1       GPL     VS     336  Device vendor specific log
0xd2       GPL     VS   10000  Device vendor specific log
0xd4       GPL     VS    2048  Device vendor specific log
0xda       GPL,SL  VS       1  Device vendor specific log
0xe0       GPL,SL  R/W      1  SCT Command/Status
0xe1       GPL,SL  R/W      1  SCT Data Transfer

SMART Extended Comprehensive Error Log Version: 1 (5 sectors)
No Errors Logged

SMART Extended Self-test Log Version: 1 (1 sectors)
Num  Test_Description    Status                  Remaining  LifeTime(hours)  LBA_of_first_error
# 1  Extended offline    Self-test routine in progress 90%       135         -
# 2  Short offline       Completed without error       00%       135         -

SMART Selective self-test log data structure revision number 1
 SPAN  MIN_LBA  MAX_LBA  CURRENT_TEST_STATUS
    1        0        0  Not_testing
    2        0        0  Not_testing
    3        0        0  Not_testing
    4        0        0  Not_testing
    5        0        0  Not_testing
Selective self-test flags (0x0):
  After scanning selected spans, do NOT read-scan remainder of disk.
If Selective self-test is pending on power-up, resume after 0 minute delay.

SCT Status Version:                  3
SCT Version (vendor specific):       522 (0x020a)
SCT Support Level:                   1
Device State:                        Active (0)
Current Temperature:                    28 Celsius
Power Cycle Min/Max Temperature:     21/28 Celsius
Lifetime    Min/Max Temperature:     21/37 Celsius
Under/Over Temperature Limit Count:   0/4
SMART Status:                        0xc24f (PASSED)
Vendor specific:
00 00 00 00 00 00 00 00 00 00 00 00 00 00 00 00
00 00 00 00 03 00 00 00 00 00 00 00 00 00 00 00

SCT Temperature History Version:     2
Temperature Sampling Period:         3 minutes
Temperature Logging Interval:        59 minutes
Min/Max recommended Temperature:     10/25 Celsius
Min/Max Temperature Limit:            5/70 Celsius
Temperature History Size (Index):    128 (10)

Index    Estimated Time   Temperature Celsius
  11    2019-11-20 06:23    36  *****************
 ...    ..(  2 skipped).    ..  *****************
  14    2019-11-20 09:20    36  *****************
  15    2019-11-20 10:19    35  ****************
  16    2019-11-20 11:18    34  ***************
  17    2019-11-20 12:17    30  ***********
  18    2019-11-20 13:16    25  ******
  19    2019-11-20 14:15    22  ***
  20    2019-11-20 15:14    21  **
 ...    ..(  3 skipped).    ..  **
  24    2019-11-20 19:10    21  **
  25    2019-11-20 20:09    27  ********
  26    2019-11-20 21:08    24  *****
  27    2019-11-20 22:07    22  ***
  28    2019-11-20 23:06    21  **
  29    2019-11-21 00:05     ?  -
  30    2019-11-21 01:04    22  ***
  31    2019-11-21 02:03    23  ****
  32    2019-11-21 03:02    25  ******
  33    2019-11-21 04:01    22  ***
  34    2019-11-21 05:00    25  ******
  35    2019-11-21 05:59    22  ***
  36    2019-11-21 06:58    25  ******
  37    2019-11-21 07:57    22  ***
  38    2019-11-21 08:56    25  ******
  39    2019-11-21 09:55    22  ***
  40    2019-11-21 10:54    25  ******
  41    2019-11-21 11:53    22  ***
  42    2019-11-21 12:52    25  ******
  43    2019-11-21 13:51    24  *****
  44    2019-11-21 14:50    25  ******
  45    2019-11-21 15:49    22  ***
  46    2019-11-21 16:48    25  ******
  47    2019-11-21 17:47    22  ***
  48    2019-11-21 18:46    25  ******
  49    2019-11-21 19:45    22  ***
  50    2019-11-21 20:44    25  ******
  51    2019-11-21 21:43    22  ***
  52    2019-11-21 22:42    25  ******
  53    2019-11-21 23:41    22  ***
  54    2019-11-22 00:40    25  ******
  55    2019-11-22 01:39    22  ***
  56    2019-11-22 02:38    25  ******
  57    2019-11-22 03:37    22  ***
  58    2019-11-22 04:36    25  ******
  59    2019-11-22 05:35    22  ***
  60    2019-11-22 06:34    25  ******
  61    2019-11-22 07:33    21  **
  62    2019-11-22 08:32    25  ******
  63    2019-11-22 09:31    21  **
  64    2019-11-22 10:30    25  ******
  65    2019-11-22 11:29    21  **
  66    2019-11-22 12:28    25  ******
  67    2019-11-22 13:27    22  ***
  68    2019-11-22 14:26    25  ******
  69    2019-11-22 15:25    21  **
  70    2019-11-22 16:24    25  ******
  71    2019-11-22 17:23    21  **
  72    2019-11-22 18:22    25  ******
  73    2019-11-22 19:21    22  ***
  74    2019-11-22 20:20    25  ******
  75    2019-11-22 21:19    21  **
  76    2019-11-22 22:18    25  ******
  77    2019-11-22 23:17    21  **
  78    2019-11-23 00:16    25  ******
  79    2019-11-23 01:15    22  ***
  80    2019-11-23 02:14    25  ******
  81    2019-11-23 03:13    22  ***
  82    2019-11-23 04:12    25  ******
  83    2019-11-23 05:11    22  ***
  84    2019-11-23 06:10    25  ******
  85    2019-11-23 07:09    22  ***
  86    2019-11-23 08:08    25  ******
  87    2019-11-23 09:07    22  ***
  88    2019-11-23 10:06    25  ******
  89    2019-11-23 11:05    22  ***
  90    2019-11-23 12:04    25  ******
  91    2019-11-23 13:03    22  ***
  92    2019-11-23 14:02    25  ******
  93    2019-11-23 15:01    22  ***
  94    2019-11-23 16:00    25  ******
  95    2019-11-23 16:59    22  ***
  96    2019-11-23 17:58    25  ******
  97    2019-11-23 18:57    22  ***
  98    2019-11-23 19:56    25  ******
  99    2019-11-23 20:55    22  ***
 100    2019-11-23 21:54    25  ******
 101    2019-11-23 22:53    22  ***
 102    2019-11-23 23:52    25  ******
 103    2019-11-24 00:51    22  ***
 104    2019-11-24 01:50    25  ******
 105    2019-11-24 02:49    22  ***
 106    2019-11-24 03:48    25  ******
 107    2019-11-24 04:47    22  ***
 108    2019-11-24 05:46    25  ******
 109    2019-11-24 06:45    22  ***
 110    2019-11-24 07:44    25  ******
 111    2019-11-24 08:43    22  ***
 112    2019-11-24 09:42    25  ******
 113    2019-11-24 10:41    22  ***
 114    2019-11-24 11:40    25  ******
 115    2019-11-24 12:39    22  ***
 116    2019-11-24 13:38    25  ******
 117    2019-11-24 14:37    22  ***
 118    2019-11-24 15:36    25  ******
 119    2019-11-24 16:35    22  ***
 120    2019-11-24 17:34    25  ******
 121    2019-11-24 18:33    22  ***
 122    2019-11-24 19:32    25  ******
 123    2019-11-24 20:31    22  ***
 124    2019-11-24 21:30    25  ******
 125    2019-11-24 22:29    22  ***
 126    2019-11-24 23:28    25  ******
 127    2019-11-25 00:27    22  ***
   0    2019-11-25 01:26    25  ******
   1    2019-11-25 02:25    22  ***
   2    2019-11-25 03:24    26  *******
   3    2019-11-25 04:23    25  ******
   4    2019-11-25 05:22    27  ********
   5    2019-11-25 06:21    26  *******
   6    2019-11-25 07:20    27  ********
   7    2019-11-25 08:19    22  ***
   8    2019-11-25 09:18    25  ******
   9    2019-11-25 10:17    22  ***
  10    2019-11-25 11:16    25  ******

SCT Error Recovery Control:
           Read:     70 (7.0 seconds)
          Write:     70 (7.0 seconds)

Device Statistics (GP/SMART Log 0x04) not supported

SATA Phy Event Counters (GP Log 0x11)
ID      Size     Value  Description
0x000a  2           53  Device-to-host register FISes sent due to a COMRESET
0x0001  2            0  Command failed due to ICRC error
0x0003  2            0  R_ERR response for device-to-host data FIS
0x0004  2            0  R_ERR response for host-to-device data FIS
0x0006  2            0  R_ERR response for device-to-host non-data FIS
0x0007  2            0  R_ERR response for host-to-device non-data FIS

