smartctl 6.5 2016-05-07 r4318 [x86_64-linux-3.10.0-862.14.4.el7.x86_64] (local build)
Copyright (C) 2002-16, Bruce Allen, Christian Franke, www.smartmontools.org

=== START OF INFORMATION SECTION ===
Device Model:     KINGSTON SUV500120G
Firmware Version: 003056R6
User Capacity:    120,034,123,776 bytes [120 GB]
Sector Sizes:     512 bytes logical, 4096 bytes physical
Rotation Rate:    Solid State Device
Form Factor:      2.5 inches
Device is:        Not in smartctl database [for details use: -P showall]
ATA Version is:   Unknown(0x0ffe), ATA8-ACS T13/1699-D revision 6
SATA Version is:  SATA 3.1, 6.0 Gb/s (current: 6.0 Gb/s)
Local Time is:    Wed Oct 24 19:37:27 2018 EDT
SMART support is: Available - device has SMART capability.
SMART support is: Enabled
AAM feature is:   Unavailable
APM feature is:   Disabled
Rd look-ahead is: Enabled
Write cache is:   Enabled
ATA Security is:  Disabled, frozen [SEC2]
Wt Cache Reorder: Enabled

=== START OF READ SMART DATA SECTION ===
SMART overall-health self-assessment test result: PASSED

General SMART Values:
Offline data collection status:  (0x00)	Offline data collection activity
					was never started.
					Auto Offline Data Collection: Disabled.
Self-test execution status:      (   0)	The previous self-test routine completed
					without error or no self-test has ever 
					been run.
Total time to complete Offline 
data collection: 		(    5) seconds.
Offline data collection
capabilities: 			 (0x71) SMART execute Offline immediate.
					No Auto Offline data collection support.
					Suspend Offline collection upon new
					command.
					No Offline surface scan supported.
					Self-test supported.
					Conveyance Self-test supported.
					Selective Self-test supported.
SMART capabilities:            (0x0003)	Saves SMART data before entering
					power-saving mode.
					Supports SMART auto save timer.
Error logging capability:        (0x01)	Error logging supported.
					General Purpose Logging supported.
Short self-test routine 
recommended polling time: 	 (   2) minutes.
Extended self-test routine
recommended polling time: 	 (   5) minutes.
Conveyance self-test routine
recommended polling time: 	 (   0) minutes.
SCT capabilities: 	       (0x003d)	SCT Status supported.
					SCT Error Recovery Control supported.
					SCT Feature Control supported.
					SCT Data Table supported.

SMART Attributes Data Structure revision number: 48
Vendor Specific SMART Attributes with Thresholds:
ID# ATTRIBUTE_NAME          FLAGS    VALUE WORST THRESH FAIL RAW_VALUE
  1 Raw_Read_Error_Rate     POSR-K   100   100   000    -    145
  5 Reallocated_Sector_Ct   PO--CK   100   100   010    -    0
  9 Power_On_Hours          -O--CK   100   100   000    -    642
 12 Power_Cycle_Count       -O--CK   100   100   000    -    7
100 Unknown_Attribute       -O--CK   100   100   000    -    7744
101 Unknown_Attribute       -O--CK   100   100   000    -    976
170 Unknown_Attribute       -O--CK   100   100   000    -    0
171 Unknown_Attribute       -O--CK   100   100   000    -    0
172 Unknown_Attribute       -O--CK   100   100   000    -    0
174 Unknown_Attribute       -O--CK   100   100   000    -    6
175 Program_Fail_Count_Chip -O--CK   100   100   000    -    0
176 Erase_Fail_Count_Chip   -O--CK   100   100   000    -    0
177 Wear_Leveling_Count     -O--CK   100   100   000    -    10
178 Used_Rsvd_Blk_Cnt_Chip  -O----   100   100   000    -    0
180 Unused_Rsvd_Blk_Cnt_Tot -O----   100   100   000    -    329
183 Runtime_Bad_Block       -O--CK   100   100   000    -    0
187 Reported_Uncorrect      PO--CK   100   100   000    -    0
194 Temperature_Celsius     -O---K   035   100   000    -    35 (Min/Max 19/39)
195 Hardware_ECC_Recovered  -O--CK   100   100   000    -    145
196 Reallocated_Event_Count -O--CK   100   100   000    -    0
197 Current_Pending_Sector  -O--CK   100   100   000    -    0
199 UDMA_CRC_Error_Count    -O--C-   100   100   000    -    0
201 Unknown_SSD_Attribute   -O--CK   100   100   000    -    0
204 Soft_ECC_Correction     -O--CK   100   100   000    -    145
231 Temperature_Celsius     -O--CK   100   100   000    -    0
233 Media_Wearout_Indicator -O--CK   100   100   000    -    24
234 Unknown_Attribute       -O--CK   100   100   000    -    11
241 Total_LBAs_Written      -O--CK   100   100   000    -    11
242 Total_LBAs_Read         -O--CK   100   100   000    -    211
250 Read_Error_Retry_Rate   -O--CK   100   100   000    -    145
                            ||||||_ K auto-keep
                            |||||__ C event count
                            ||||___ R error rate
                            |||____ S speed/performance
                            ||_____ O updated online
                            |______ P prefailure warning

General Purpose Log Directory Version 1
SMART           Log Directory Version 1 [multi-sector log support]
Address    Access  R/W   Size  Description
0x00       GPL,SL  R/O      1  Log Directory
0x01           SL  R/O      1  Summary SMART error log
0x02           SL  R/O      1  Comprehensive SMART error log
0x03       GPL     R/O      1  Ext. Comprehensive SMART error log
0x04       GPL,SL  R/O      8  Device Statistics log
0x06           SL  R/O      1  SMART self-test log
0x07       GPL,SL  R/O      1  Extended self-test log
0x09           SL  R/W      1  Selective self-test log
0x0a       GPL     R/W      5  Device Statistics Notification
0x10       GPL     R/O      1  SATA NCQ Queued Error log
0x11       GPL     R/O      1  SATA Phy Event Counters log
0x30       GPL     R/O      9  IDENTIFY DEVICE data log
0x80-0x9f  GPL,SL  R/W     16  Host vendor specific log
0xa1           SL  VS       9  Device vendor specific log
0xab           SL  VS       1  Device vendor specific log
0xe0       GPL,SL  R/W      1  SCT Command/Status
0xe1       GPL,SL  R/W      1  SCT Data Transfer

SMART Extended Comprehensive Error Log Version: 0 (1 sectors)
No Errors Logged

SMART Extended Self-test Log Version: 0 (1 sectors)
Num  Test_Description    Status                  Remaining  LifeTime(hours)  LBA_of_first_error
# 1  Short offline       Completed without error       00%       640         -

SMART Selective self-test log data structure revision number 0
Note: revision number not 1 implies that no selective self-test has ever been run
 SPAN  MIN_LBA  MAX_LBA  CURRENT_TEST_STATUS
    1        0        0  Not_testing
    2        0        0  Not_testing
    3        0        0  Not_testing
    4        0        0  Not_testing
    5        0        0  Not_testing
Selective self-test flags (0x0):
  After scanning selected spans, do NOT read-scan remainder of disk.
If Selective self-test is pending on power-up, resume after 0 minute delay.

SCT Status Version:                  3
SCT Version (vendor specific):       1 (0x0001)
SCT Support Level:                   0
Device State:                        Active (0)
Current Temperature:                    35 Celsius
Power Cycle Min/Max Temperature:     34/36 Celsius
Lifetime    Min/Max Temperature:     19/39 Celsius
Under/Over Temperature Limit Count:   0/0
SMART Status:                        0xc24f (PASSED)

SCT Temperature History Version:     2
Temperature Sampling Period:         1 minute
Temperature Logging Interval:        1 minute
Min/Max recommended Temperature:      0/70 Celsius
Min/Max Temperature Limit:            0/85 Celsius
Temperature History Size (Index):    478 (146)

Index    Estimated Time   Temperature Celsius
 147    2018-10-24 11:40    35  ****************
 ...    ..( 80 skipped).    ..  ****************
 228    2018-10-24 13:01    35  ****************
 229    2018-10-24 13:02    34  ***************
 230    2018-10-24 13:03    35  ****************
 231    2018-10-24 13:04    35  ****************
 232    2018-10-24 13:05    35  ****************
 233    2018-10-24 13:06    34  ***************
 234    2018-10-24 13:07    35  ****************
 ...    ..(  2 skipped).    ..  ****************
 237    2018-10-24 13:10    35  ****************
 238    2018-10-24 13:11    34  ***************
 239    2018-10-24 13:12    34  ***************
 240    2018-10-24 13:13    34  ***************
 241    2018-10-24 13:14    35  ****************
 ...    ..(  2 skipped).    ..  ****************
 244    2018-10-24 13:17    35  ****************
 245    2018-10-24 13:18    34  ***************
 246    2018-10-24 13:19    35  ****************
 247    2018-10-24 13:20    35  ****************
 248    2018-10-24 13:21    34  ***************
 249    2018-10-24 13:22    35  ****************
 ...    ..(  2 skipped).    ..  ****************
 252    2018-10-24 13:25    35  ****************
 253    2018-10-24 13:26    34  ***************
 ...    ..(  2 skipped).    ..  ***************
 256    2018-10-24 13:29    34  ***************
 257    2018-10-24 13:30    35  ****************
 258    2018-10-24 13:31    34  ***************
 259    2018-10-24 13:32    34  ***************
 260    2018-10-24 13:33    34  ***************
 261    2018-10-24 13:34    35  ****************
 262    2018-10-24 13:35    34  ***************
 263    2018-10-24 13:36    35  ****************
 264    2018-10-24 13:37    34  ***************
 ...    ..(115 skipped).    ..  ***************
 380    2018-10-24 15:33    34  ***************
 381    2018-10-24 15:34    35  ****************
 382    2018-10-24 15:35    34  ***************
 383    2018-10-24 15:36    34  ***************
 384    2018-10-24 15:37    35  ****************
 ...    ..(239 skipped).    ..  ****************
 146    2018-10-24 19:37    35  ****************

SCT Error Recovery Control:
           Read: Disabled
          Write: Disabled

Device Statistics (GP Log 0x04)
Page  Offset Size        Value Flags Description
0x01  =====  =               =  ===  == General Statistics (rev 1) ==
0x01  0x008  4               7  ---  Lifetime Power-On Resets
0x01  0x010  4             642  ---  Power-on Hours
0x01  0x018  6        24845514  ---  Logical Sectors Written
0x01  0x020  6          438089  ---  Number of Write Commands
0x01  0x028  6       442999463  ---  Logical Sectors Read
0x01  0x030  6         2020009  ---  Number of Read Commands
0x01  0x038  6      2311501160  ---  Date and Time TimeStamp
0x02  =====  =               =  ===  == Free-Fall Statistics (empty) ==
0x03  =====  =               =  ===  == Rotating Media Statistics (empty) ==
0x04  =====  =               =  ===  == General Errors Statistics (rev 1) ==
0x04  0x008  4               0  ---  Number of Reported Uncorrectable Errors
0x04  0x010  4             160  ---  Resets Between Cmd Acceptance and Completion
0x05  =====  =               =  ===  == Temperature Statistics (rev 1) ==
0x05  0x008  1              35  -D-  Current Temperature
0x05  0x010  1               -  -D-  Average Short Term Temperature
0x05  0x018  1               0  -D-  Average Long Term Temperature
0x05  0x020  1              39  ---  Highest Temperature
0x05  0x028  1              19  ---  Lowest Temperature
0x05  0x030  1              36  -D-  Highest Average Short Term Temperature
0x05  0x038  1              23  -D-  Lowest Average Short Term Temperature
0x05  0x040  1               -  -D-  Highest Average Long Term Temperature
0x05  0x048  1               -  -D-  Lowest Average Long Term Temperature
0x05  0x050  4               0  -D-  Time in Over-Temperature
0x05  0x058  1              70  ---  Specified Maximum Operating Temperature
0x05  0x060  4               0  -D-  Time in Under-Temperature
0x05  0x068  1               0  ---  Specified Minimum Operating Temperature
0x06  =====  =               =  ===  == Transport Statistics (rev 1) ==
0x06  0x008  4             160  ---  Number of Hardware Resets
0x06  0x018  4               0  ---  Number of Interface CRC Errors
0x07  =====  =               =  ===  == Solid State Device Statistics (rev 1) ==
0x07  0x008  1               0  ---  Percentage Used Endurance Indicator
                                |||_ C monitored condition met
                                ||__ D supports DSN
                                |___ N normalized value

SATA Phy Event Counters (GP Log 0x11)
ID      Size     Value  Description
0x0001  4            0  Command failed due to ICRC error
0x000a  4           21  Device-to-host register FISes sent due to a COMRESET

