smartctl 6.5 2016-01-01 r4194 [x86_64-linux-4.2.3-300.fc23.x86_64] (local build)
Copyright (C) 2002-16, Bruce Allen, Christian Franke, www.smartmontools.org

=== START OF INFORMATION SECTION ===
Model Family:     Intel 730 and DC S35x0/3610/3700 Series SSDs
Device Model:     INTEL SSDSC2BB480G4
Serial Number:    PHWL537000AH480QGN
LU WWN Device Id: 5 5cd2e4 04c5f4ff7
Firmware Version: D2010370
User Capacity:    480,103,981,056 bytes [480 GB]
Sector Sizes:     512 bytes logical, 4096 bytes physical
Rotation Rate:    Solid State Device
Form Factor:      2.5 inches
Device is:        In smartctl database [for details use: -P show]
ATA Version is:   ACS-2 T13/2015-D revision 3
SATA Version is:  SATA 2.6, 6.0 Gb/s (current: 6.0 Gb/s)
Local Time is:    Tue Jan  5 16:35:05 2016 CET
SMART support is: Available - device has SMART capability.
SMART support is: Enabled
AAM feature is:   Unavailable
APM feature is:   Unavailable
Rd look-ahead is: Enabled
Write cache is:   Enabled
ATA Security is:  Disabled, frozen [SEC2]
Wt Cache Reorder: Enabled

=== START OF READ SMART DATA SECTION ===
SMART overall-health self-assessment test result: PASSED

General SMART Values:
Offline data collection status:  (0x00)	Offline data collection activity
					was never started.
					Auto Offline Data Collection: Disabled.
Self-test execution status:      (   0)	The previous self-test routine completed
					without error or no self-test has ever 
					been run.
Total time to complete Offline 
data collection: 		(    0) seconds.
Offline data collection
capabilities: 			 (0x79) SMART execute Offline immediate.
					No Auto Offline data collection support.
					Suspend Offline collection upon new
					command.
					Offline surface scan supported.
					Self-test supported.
					Conveyance Self-test supported.
					Selective Self-test supported.
SMART capabilities:            (0x0003)	Saves SMART data before entering
					power-saving mode.
					Supports SMART auto save timer.
Error logging capability:        (0x01)	Error logging supported.
					General Purpose Logging supported.
Short self-test routine 
recommended polling time: 	 (   1) minutes.
Extended self-test routine
recommended polling time: 	 (   2) minutes.
Conveyance self-test routine
recommended polling time: 	 (   2) minutes.
SCT capabilities: 	       (0x003d)	SCT Status supported.
					SCT Error Recovery Control supported.
					SCT Feature Control supported.
					SCT Data Table supported.

SMART Attributes Data Structure revision number: 1
Vendor Specific SMART Attributes with Thresholds:
ID# ATTRIBUTE_NAME          FLAGS    VALUE WORST THRESH FAIL RAW_VALUE
  5 Reallocated_Sector_Ct   -O--CK   100   100   000    -    0
  9 Power_On_Hours          -O--CK   100   100   000    -    11
 12 Power_Cycle_Count       -O--CK   100   100   000    -    32
170 Available_Reservd_Space PO--CK   100   100   010    -    0
171 Program_Fail_Count      -O--CK   100   100   000    -    0
172 Erase_Fail_Count        -O--CK   100   100   000    -    0
174 Unsafe_Shutdown_Count   -O--CK   100   100   000    -    16
175 Power_Loss_Cap_Test     PO--CK   100   100   010    -    651 (1 22)
183 SATA_Downshift_Count    -O--CK   100   100   000    -    0
184 End-to-End_Error        PO--CK   100   100   090    -    0
187 Reported_Uncorrect      -O--CK   100   100   000    -    0
190 Temperature_Case        -O---K   081   081   000    -    19 (Min/Max 12/19)
192 Unsafe_Shutdown_Count   -O--CK   100   100   000    -    16
194 Temperature_Internal    -O---K   100   100   000    -    30
197 Current_Pending_Sector  -O--CK   100   100   000    -    0
199 CRC_Error_Count         -OSRCK   100   100   000    -    0
225 Host_Writes_32MiB       -O--CK   100   100   000    -    2191
226 Workld_Media_Wear_Indic -O--CK   100   100   000    -    0
227 Workld_Host_Reads_Perc  -O--CK   100   100   000    -    28
228 Workload_Minutes        -O--CK   100   100   000    -    442
232 Available_Reservd_Space PO--CK   100   100   010    -    0
233 Media_Wearout_Indicator -O--CK   100   100   000    -    0
234 Thermal_Throttle        -O--CK   100   100   000    -    0/0
241 Host_Writes_32MiB       -O--CK   100   100   000    -    2191
242 Host_Reads_32MiB        -O--CK   100   100   000    -    2044
                            ||||||_ K auto-keep
                            |||||__ C event count
                            ||||___ R error rate
                            |||____ S speed/performance
                            ||_____ O updated online
                            |______ P prefailure warning

General Purpose Log Directory Version 1
SMART           Log Directory Version 1 [multi-sector log support]
Address    Access  R/W   Size  Description
0x00       GPL,SL  R/O      1  Log Directory
0x01       GPL,SL  R/O      1  Summary SMART error log
0x02       GPL,SL  R/O      8  Comprehensive SMART error log
0x03       GPL,SL  R/O     20  Ext. Comprehensive SMART error log
0x04       GPL,SL  R/O      8  Device Statistics log
0x06       GPL,SL  R/O      1  SMART self-test log
0x07       GPL,SL  R/O      2  Extended self-test log
0x09       GPL,SL  R/W      1  Selective self-test log
0x10       GPL,SL  R/O      1  SATA NCQ Queued Error log
0x11       GPL,SL  R/O      1  SATA Phy Event Counters log
0x80-0x9f  GPL,SL  R/W     16  Host vendor specific log
0xb0       GPL,SL  VS       1  Device vendor specific log
0xb1       GPL,SL  VS      33  Device vendor specific log
0xdd       GPL,SL  VS       1  Device vendor specific log
0xde       GPL     VS     768  Device vendor specific log
0xdf       GPL     VS    1152  Device vendor specific log
0xdf       SL      VS     128  Device vendor specific log
0xe0       GPL,SL  R/W      1  SCT Command/Status
0xe1       GPL,SL  R/W      1  SCT Data Transfer

SMART Extended Comprehensive Error Log Version: 1 (20 sectors)
No Errors Logged

SMART Extended Self-test Log Version: 1 (2 sectors)
No self-tests have been logged.  [To run self-tests, use: smartctl -t]

SMART Selective self-test log data structure revision number 1
 SPAN  MIN_LBA  MAX_LBA  CURRENT_TEST_STATUS
    1        0        0  Not_testing
    2        0        0  Not_testing
    3        0        0  Not_testing
    4        0        0  Not_testing
    5        0        0  Not_testing
Selective self-test flags (0x0):
  After scanning selected spans, do NOT read-scan remainder of disk.
If Selective self-test is pending on power-up, resume after 0 minute delay.

SCT Status Version:                  3
SCT Version (vendor specific):       1 (0x0001)
SCT Support Level:                   0
Device State:                        Active (0)
Current Temperature:                    19 Celsius
Power Cycle Min/Max Temperature:     12/19 Celsius
Lifetime    Min/Max Temperature:      4/24 Celsius
Under/Over Temperature Limit Count:   0/0
Vendor specific:
00 00 63 00 00 00 00 00 00 00 00 00 00 00 00 00
00 00 00 00 00 00 00 00 00 00 00 00 00 00 00 00

SCT Temperature History Version:     2
Temperature Sampling Period:         1 minute
Temperature Logging Interval:        1 minute
Min/Max recommended Temperature:      0/70 Celsius
Min/Max Temperature Limit:            0/70 Celsius
Temperature History Size (Index):    478 (226)

Index    Estimated Time   Temperature Celsius
 227    2016-01-05 08:38    18  -
 ...    ..( 57 skipped).    ..  -
 285    2016-01-05 09:36    18  -
 286    2016-01-05 09:37    21  **
 287    2016-01-05 09:38    20  *
 ...    ..(  5 skipped).    ..  *
 293    2016-01-05 09:44    20  *
 294    2016-01-05 09:45    21  **
 295    2016-01-05 09:46    20  *
 296    2016-01-05 09:47    20  *
 297    2016-01-05 09:48    20  *
 298    2016-01-05 09:49    19  -
 ...    ..( 11 skipped).    ..  -
 310    2016-01-05 10:01    19  -
 311    2016-01-05 10:02     ?  -
 312    2016-01-05 10:03    20  *
 313    2016-01-05 10:04    21  **
 314    2016-01-05 10:05    21  **
 315    2016-01-05 10:06    21  **
 316    2016-01-05 10:07    20  *
 317    2016-01-05 10:08     ?  -
 318    2016-01-05 10:09    18  -
 319    2016-01-05 10:10    19  -
 ...    ..( 20 skipped).    ..  -
 340    2016-01-05 10:31    19  -
 341    2016-01-05 10:32    20  *
 342    2016-01-05 10:33    20  *
 343    2016-01-05 10:34    19  -
 344    2016-01-05 10:35    19  -
 345    2016-01-05 10:36    20  *
 ...    ..(  4 skipped).    ..  *
 350    2016-01-05 10:41    20  *
 351    2016-01-05 10:42    19  -
 352    2016-01-05 10:43    20  *
 ...    ..(  3 skipped).    ..  *
 356    2016-01-05 10:47    20  *
 357    2016-01-05 10:48    21  **
 358    2016-01-05 10:49    20  *
 ...    ..(  9 skipped).    ..  *
 368    2016-01-05 10:59    20  *
 369    2016-01-05 11:00    19  -
 ...    ..(  6 skipped).    ..  -
 376    2016-01-05 11:07    19  -
 377    2016-01-05 11:08    20  *
 378    2016-01-05 11:09    21  **
 379    2016-01-05 11:10    20  *
 ...    ..(  2 skipped).    ..  *
 382    2016-01-05 11:13    20  *
 383    2016-01-05 11:14    21  **
 384    2016-01-05 11:15    20  *
 ...    ..(  5 skipped).    ..  *
 390    2016-01-05 11:21    20  *
 391    2016-01-05 11:22    21  **
 392    2016-01-05 11:23    21  **
 393    2016-01-05 11:24    20  *
 394    2016-01-05 11:25    20  *
 395    2016-01-05 11:26    20  *
 396    2016-01-05 11:27     ?  -
 397    2016-01-05 11:28    20  *
 ...    ..(  2 skipped).    ..  *
 400    2016-01-05 11:31    20  *
 401    2016-01-05 11:32    21  **
 402    2016-01-05 11:33    20  *
 ...    ..(  8 skipped).    ..  *
 411    2016-01-05 11:42    20  *
 412    2016-01-05 11:43    19  -
 ...    ..( 19 skipped).    ..  -
 432    2016-01-05 12:03    19  -
 433    2016-01-05 12:04    20  *
 434    2016-01-05 12:05    21  **
 435    2016-01-05 12:06    21  **
 436    2016-01-05 12:07    22  ***
 437    2016-01-05 12:08    21  **
 438    2016-01-05 12:09    20  *
 ...    ..(  3 skipped).    ..  *
 442    2016-01-05 12:13    20  *
 443    2016-01-05 12:14    21  **
 ...    ..(  2 skipped).    ..  **
 446    2016-01-05 12:17    21  **
 447    2016-01-05 12:18    20  *
 ...    ..(  5 skipped).    ..  *
 453    2016-01-05 12:24    20  *
 454    2016-01-05 12:25     ?  -
 455    2016-01-05 12:26    20  *
 ...    ..(  4 skipped).    ..  *
 460    2016-01-05 12:31    20  *
 461    2016-01-05 12:32     ?  -
 462    2016-01-05 12:33    20  *
 ...    ..(  5 skipped).    ..  *
 468    2016-01-05 12:39    20  *
 469    2016-01-05 12:40    19  -
 ...    ..(  6 skipped).    ..  -
 476    2016-01-05 12:47    19  -
 477    2016-01-05 12:48    20  *
   0    2016-01-05 12:49    22  ***
   1    2016-01-05 12:50    22  ***
   2    2016-01-05 12:51    23  ****
   3    2016-01-05 12:52    23  ****
   4    2016-01-05 12:53    24  *****
   5    2016-01-05 12:54    24  *****
   6    2016-01-05 12:55    24  *****
   7    2016-01-05 12:56    22  ***
   8    2016-01-05 12:57    22  ***
   9    2016-01-05 12:58    21  **
  10    2016-01-05 12:59    21  **
  11    2016-01-05 13:00    20  *
 ...    ..(  4 skipped).    ..  *
  16    2016-01-05 13:05    20  *
  17    2016-01-05 13:06    19  -
 ...    ..(  3 skipped).    ..  -
  21    2016-01-05 13:10    19  -
  22    2016-01-05 13:11     ?  -
  23    2016-01-05 13:12    20  *
  24    2016-01-05 13:13    20  *
  25    2016-01-05 13:14    19  -
 ...    ..( 11 skipped).    ..  -
  37    2016-01-05 13:26    19  -
  38    2016-01-05 13:27     ?  -
  39    2016-01-05 13:28    12  -
  40    2016-01-05 13:29    13  -
  41    2016-01-05 13:30    13  -
  42    2016-01-05 13:31    14  -
  43    2016-01-05 13:32    15  -
 ...    ..(  6 skipped).    ..  -
  50    2016-01-05 13:39    15  -
  51    2016-01-05 13:40    16  -
 ...    ..( 30 skipped).    ..  -
  82    2016-01-05 14:11    16  -
  83    2016-01-05 14:12    17  -
  84    2016-01-05 14:13    17  -
  85    2016-01-05 14:14    17  -
  86    2016-01-05 14:15    16  -
  87    2016-01-05 14:16     ?  -
  88    2016-01-05 14:17    12  -
  89    2016-01-05 14:18    14  -
  90    2016-01-05 14:19     ?  -
  91    2016-01-05 14:20     7  -
  92    2016-01-05 14:21     8  -
  93    2016-01-05 14:22    10  -
  94    2016-01-05 14:23    11  -
  95    2016-01-05 14:24    12  -
  96    2016-01-05 14:25    12  -
  97    2016-01-05 14:26    13  -
  98    2016-01-05 14:27     ?  -
  99    2016-01-05 14:28    14  -
 100    2016-01-05 14:29     ?  -
 101    2016-01-05 14:30    14  -
 102    2016-01-05 14:31    15  -
 103    2016-01-05 14:32    16  -
 104    2016-01-05 14:33    16  -
 105    2016-01-05 14:34    16  -
 106    2016-01-05 14:35    17  -
 ...    ..(  2 skipped).    ..  -
 109    2016-01-05 14:38    17  -
 110    2016-01-05 14:39    18  -
 ...    ..(  2 skipped).    ..  -
 113    2016-01-05 14:42    18  -
 114    2016-01-05 14:43    19  -
 ...    ..(  3 skipped).    ..  -
 118    2016-01-05 14:47    19  -
 119    2016-01-05 14:48    20  *
 ...    ..(  7 skipped).    ..  *
 127    2016-01-05 14:56    20  *
 128    2016-01-05 14:57    21  **
 ...    ..( 19 skipped).    ..  **
 148    2016-01-05 15:17    21  **
 149    2016-01-05 15:18    22  ***
 ...    ..( 10 skipped).    ..  ***
 160    2016-01-05 15:29    22  ***
 161    2016-01-05 15:30     ?  -
 162    2016-01-05 15:31    15  -
 163    2016-01-05 15:32    16  -
 164    2016-01-05 15:33    17  -
 165    2016-01-05 15:34    18  -
 ...    ..(  4 skipped).    ..  -
 170    2016-01-05 15:39    18  -
 171    2016-01-05 15:40    19  -
 172    2016-01-05 15:41     ?  -
 173    2016-01-05 15:42    19  -
 174    2016-01-05 15:43    20  *
 175    2016-01-05 15:44     ?  -
 176    2016-01-05 15:45    20  *
 177    2016-01-05 15:46     ?  -
 178    2016-01-05 15:47    20  *
 179    2016-01-05 15:48    20  *
 180    2016-01-05 15:49    20  *
 181    2016-01-05 15:50     ?  -
 182    2016-01-05 15:51    20  *
 183    2016-01-05 15:52    21  **
 ...    ..(  3 skipped).    ..  **
 187    2016-01-05 15:56    21  **
 188    2016-01-05 15:57     ?  -
 189    2016-01-05 15:58    20  *
 190    2016-01-05 15:59    21  **
 ...    ..(  7 skipped).    ..  **
 198    2016-01-05 16:07    21  **
 199    2016-01-05 16:08     ?  -
 200    2016-01-05 16:09    16  -
 201    2016-01-05 16:10    17  -
 202    2016-01-05 16:11    18  -
 203    2016-01-05 16:12    18  -
 204    2016-01-05 16:13     ?  -
 205    2016-01-05 16:14    15  -
 206    2016-01-05 16:15    16  -
 207    2016-01-05 16:16    16  -
 208    2016-01-05 16:17    17  -
 209    2016-01-05 16:18    17  -
 210    2016-01-05 16:19    17  -
 211    2016-01-05 16:20    18  -
 ...    ..(  3 skipped).    ..  -
 215    2016-01-05 16:24    18  -
 216    2016-01-05 16:25    19  -
 ...    ..(  9 skipped).    ..  -
 226    2016-01-05 16:35    19  -

SCT Error Recovery Control:
           Read: Disabled
          Write: Disabled

Device Statistics (GP Log 0x04)
Page  Offset Size        Value Flags Description
0x01  =====  =               =  ===  == General Statistics (rev 2) ==
0x01  0x008  4              32  ---  Lifetime Power-On Resets
0x01  0x018  6       143594944  ---  Logical Sectors Written
0x01  0x020  6         1665212  ---  Number of Write Commands
0x01  0x028  6       133958624  ---  Logical Sectors Read
0x01  0x030  6         2262253  ---  Number of Read Commands
0x04  =====  =               =  ===  == General Errors Statistics (rev 1) ==
0x04  0x008  4               0  ---  Number of Reported Uncorrectable Errors
0x04  0x010  4               0  ---  Resets Between Cmd Acceptance and Completion
0x05  =====  =               =  ===  == Temperature Statistics (rev 1) ==
0x05  0x008  1              19  ---  Current Temperature
0x05  0x010  1               -  ---  Average Short Term Temperature
0x05  0x018  1               -  ---  Average Long Term Temperature
0x05  0x020  1              23  ---  Highest Temperature
0x05  0x028  1              15  ---  Lowest Temperature
0x05  0x030  1               -  ---  Highest Average Short Term Temperature
0x05  0x038  1               -  ---  Lowest Average Short Term Temperature
0x05  0x040  1               -  ---  Highest Average Long Term Temperature
0x05  0x048  1               -  ---  Lowest Average Long Term Temperature
0x05  0x050  4               0  ---  Time in Over-Temperature
0x05  0x058  1              70  ---  Specified Maximum Operating Temperature
0x05  0x060  4               0  ---  Time in Under-Temperature
0x05  0x068  1               0  ---  Specified Minimum Operating Temperature
0x06  =====  =               =  ===  == Transport Statistics (rev 1) ==
0x06  0x008  4              50  ---  Number of Hardware Resets
0x06  0x010  4              47  ---  Number of ASR Events
0x06  0x018  4               0  ---  Number of Interface CRC Errors
0x07  =====  =               =  ===  == Solid State Device Statistics (rev 1) ==
0x07  0x008  1               0  ---  Percentage Used Endurance Indicator
                                |||_ C monitored condition met
                                ||__ D supports DSN
                                |___ N normalized value

SATA Phy Event Counters (GP Log 0x11)
ID      Size     Value  Description
0x0001  4            0  Command failed due to ICRC error
0x0003  4            0  R_ERR response for device-to-host data FIS
0x0004  4            0  R_ERR response for host-to-device data FIS
0x0006  4            0  R_ERR response for device-to-host non-data FIS
0x000a  4            3  Device-to-host register FISes sent due to a COMRESET
0x000b  4            0  CRC errors within host-to-device FIS
0x000d  4            0  Non-CRC errors within host-to-device FIS

