smartctl 7.4 2023-08-01 r5530 [x86_64-linux-6.10.7-200.fc40.x86_64] (local build)
Copyright (C) 2002-23, Bruce Allen, Christian Franke, www.smartmontools.org

=== START OF INFORMATION SECTION ===
Device Model:     MG09ACA12TE          01GV181D7A01906LEN
Serial Number:    Y3B0A0PF
LU WWN Device Id: 5 000039 ce8c98508
Firmware Version: TJA3
User Capacity:    12,000,138,625,024 bytes [12.0 TB]
Sector Sizes:     512 bytes logical, 4096 bytes physical
Rotation Rate:    7200 rpm
Form Factor:      3.5 inches
Device is:        Not in smartctl database 7.3/5610
ATA Version is:   ACS-4 T13/BSR INCITS 529 revision 5
SATA Version is:  SATA 3.3, 6.0 Gb/s (current: 6.0 Gb/s)
Local Time is:    Mon Sep  9 05:56:58 2024 EDT
SMART support is: Available - device has SMART capability.
SMART support is: Enabled
AAM feature is:   Unavailable
APM level is:     128 (minimum power consumption without standby)
Rd look-ahead is: Enabled
Write cache is:   Disabled
DSN feature is:   Unavailable
ATA Security is:  Disabled, NOT FROZEN [SEC1]
Wt Cache Reorder: Enabled

=== START OF READ SMART DATA SECTION ===
SMART overall-health self-assessment test result: PASSED

General SMART Values:
Offline data collection status:  (0x82)	Offline data collection activity
					was completed without error.
					Auto Offline Data Collection: Enabled.
Self-test execution status:      (   0)	The previous self-test routine completed
					without error or no self-test has ever 
					been run.
Total time to complete Offline 
data collection: 		(  120) seconds.
Offline data collection
capabilities: 			 (0x5b) SMART execute Offline immediate.
					Auto Offline data collection on/off support.
					Suspend Offline collection upon new
					command.
					Offline surface scan supported.
					Self-test supported.
					No Conveyance Self-test supported.
					Selective Self-test supported.
SMART capabilities:            (0x0003)	Saves SMART data before entering
					power-saving mode.
					Supports SMART auto save timer.
Error logging capability:        (0x01)	Error logging supported.
					General Purpose Logging supported.
Short self-test routine 
recommended polling time: 	 (   2) minutes.
Extended self-test routine
recommended polling time: 	 (1020) minutes.
SCT capabilities: 	       (0x003d)	SCT Status supported.
					SCT Error Recovery Control supported.
					SCT Feature Control supported.
					SCT Data Table supported.

SMART Attributes Data Structure revision number: 16
Vendor Specific SMART Attributes with Thresholds:
ID# ATTRIBUTE_NAME          FLAGS    VALUE WORST THRESH FAIL RAW_VALUE
  1 Raw_Read_Error_Rate     PO-R--   100   100   050    -    0
  3 Spin_Up_Time            POS--K   100   100   001    -    5785
  4 Start_Stop_Count        -O--CK   100   100   000    -    19
  5 Reallocated_Sector_Ct   PO--CK   100   100   010    -    0
  7 Seek_Error_Rate         PO-R--   100   100   050    -    0
  8 Seek_Time_Performance   P-S---   100   100   050    -    0
  9 Power_On_Hours          -O--CK   092   092   000    -    3565
 10 Spin_Retry_Count        PO--CK   100   100   030    -    0
 12 Power_Cycle_Count       -O--CK   100   100   000    -    19
 23 Helium_Condition_Lower  PO---K   100   100   075    -    0
 24 Helium_Condition_Upper  PO---K   100   100   075    -    0
 27 Unknown_Attribute       PO---K   100   100   030    -    329025
187 Reported_Uncorrect      -O--CK   100   100   000    -    0
189 High_Fly_Writes         -O-RCK   100   100   001    -    0
190 Airflow_Temperature_Cel -O---K   076   072   045    -    24 (Min/Max 18/28)
192 Power-Off_Retract_Count -O--CK   100   100   000    -    12
193 Load_Cycle_Count        -O--CK   100   100   000    -    31
194 Temperature_Celsius     -O---K   100   100   000    -    24 (Min/Max 17/29)
196 Reallocated_Event_Count PO--CK   100   100   010    -    0
197 Current_Pending_Sector  -O--CK   100   100   000    -    0
198 Offline_Uncorrectable   ----CK   100   100   000    -    0
199 UDMA_CRC_Error_Count    -O--CK   200   200   000    -    0
212 Unknown_Attribute       -O--CK   100   100   000    -    0
220 Disk_Shift              -O----   100   100   000    -    84148225
241 Total_LBAs_Written      -O--CK   100   100   000    -    12623140339
242 Total_LBAs_Read         -O--CK   100   100   000    -    10832744693
                            ||||||_ K auto-keep
                            |||||__ C event count
                            ||||___ R error rate
                            |||____ S speed/performance
                            ||_____ O updated online
                            |______ P prefailure warning

General Purpose Log Directory Version 1
SMART           Log Directory Version 1 [multi-sector log support]
Address    Access  R/W   Size  Description
0x00       GPL,SL  R/O      1  Log Directory
0x01           SL  R/O      1  Summary SMART error log
0x02           SL  R/O     51  Comprehensive SMART error log
0x03       GPL     R/O      5  Ext. Comprehensive SMART error log
0x04       GPL,SL  R/O      8  Device Statistics log
0x06           SL  R/O      1  SMART self-test log
0x07       GPL     R/O      1  Extended self-test log
0x08       GPL     R/O      2  Power Conditions log
0x09           SL  R/W      1  Selective self-test log
0x0c       GPL     R/O    513  Pending Defects log
0x10       GPL     R/O      1  NCQ Command Error log
0x11       GPL     R/O      1  SATA Phy Event Counters log
0x24       GPL     R/O  65520  Current Device Internal Status Data log
0x25       GPL     R/O  65520  Saved Device Internal Status Data log
0x30       GPL,SL  R/O      9  IDENTIFY DEVICE data log
0x80-0x9f  GPL,SL  R/W     16  Host vendor specific log
0xa8       GPL     VS    3751  Device vendor specific log
0xae       GPL     VS      25  Device vendor specific log
0xb0       GPL,SL  VS       1  Device vendor specific log
0xb1       GPL     VS      63  Device vendor specific log
0xe0       GPL,SL  R/W      1  SCT Command/Status
0xe1       GPL,SL  R/W      1  SCT Data Transfer

SMART Extended Comprehensive Error Log Version: 1 (5 sectors)
No Errors Logged

SMART Extended Self-test Log Version: 1 (1 sectors)
Num  Test_Description    Status                  Remaining  LifeTime(hours)  LBA_of_first_error
# 1  Short offline       Completed without error       00%      3565         -

SMART Selective self-test log data structure revision number 1
 SPAN  MIN_LBA  MAX_LBA  CURRENT_TEST_STATUS
    1        0        0  Not_testing
    2        0        0  Not_testing
    3        0        0  Not_testing
    4        0        0  Not_testing
    5        0        0  Not_testing
Selective self-test flags (0x0):
  After scanning selected spans, do NOT read-scan remainder of disk.
If Selective self-test is pending on power-up, resume after 0 minute delay.

SCT Status Version:                  3
SCT Version (vendor specific):       1 (0x0001)
Device State:                        Active (0)
Current Temperature:                    24 Celsius
Power Cycle Min/Max Temperature:     18/28 Celsius
Lifetime    Min/Max Temperature:     17/29 Celsius
Specified Max Operating Temperature:    55 Celsius
Under/Over Temperature Limit Count:   0/0
SMART Status:                        0xc24f (PASSED)

SCT Temperature History Version:     2
Temperature Sampling Period:         1 minute
Temperature Logging Interval:        1 minute
Min/Max recommended Temperature:      5/55 Celsius
Min/Max Temperature Limit:           -40/70 Celsius
Temperature History Size (Index):    478 (388)

Index    Estimated Time   Temperature Celsius
 389    2024-09-08 21:59    24  *****
 ...    ..(195 skipped).    ..  *****
 107    2024-09-09 01:15    24  *****
 108    2024-09-09 01:16    23  ****
 ...    ..(  5 skipped).    ..  ****
 114    2024-09-09 01:22    23  ****
 115    2024-09-09 01:23    24  *****
 116    2024-09-09 01:24    23  ****
 117    2024-09-09 01:25    23  ****
 118    2024-09-09 01:26    23  ****
 119    2024-09-09 01:27    24  *****
 120    2024-09-09 01:28    23  ****
 121    2024-09-09 01:29    24  *****
 122    2024-09-09 01:30    23  ****
 ...    ..(  3 skipped).    ..  ****
 126    2024-09-09 01:34    23  ****
 127    2024-09-09 01:35    24  *****
 ...    ..(  2 skipped).    ..  *****
 130    2024-09-09 01:38    24  *****
 131    2024-09-09 01:39    23  ****
 132    2024-09-09 01:40    24  *****
 133    2024-09-09 01:41    23  ****
 134    2024-09-09 01:42    24  *****
 135    2024-09-09 01:43    23  ****
 136    2024-09-09 01:44    24  *****
 137    2024-09-09 01:45    23  ****
 ...    ..(  4 skipped).    ..  ****
 142    2024-09-09 01:50    23  ****
 143    2024-09-09 01:51    24  *****
 144    2024-09-09 01:52    23  ****
 145    2024-09-09 01:53    23  ****
 146    2024-09-09 01:54    23  ****
 147    2024-09-09 01:55    24  *****
 148    2024-09-09 01:56    23  ****
 149    2024-09-09 01:57    23  ****
 150    2024-09-09 01:58    24  *****
 151    2024-09-09 01:59    23  ****
 ...    ..(  2 skipped).    ..  ****
 154    2024-09-09 02:02    23  ****
 155    2024-09-09 02:03    24  *****
 156    2024-09-09 02:04    24  *****
 157    2024-09-09 02:05    23  ****
 ...    ..(  2 skipped).    ..  ****
 160    2024-09-09 02:08    23  ****
 161    2024-09-09 02:09    24  *****
 162    2024-09-09 02:10    23  ****
 ...    ..( 14 skipped).    ..  ****
 177    2024-09-09 02:25    23  ****
 178    2024-09-09 02:26    24  *****
 ...    ..(  5 skipped).    ..  *****
 184    2024-09-09 02:32    24  *****
 185    2024-09-09 02:33    23  ****
 186    2024-09-09 02:34    24  *****
 ...    ..(198 skipped).    ..  *****
 385    2024-09-09 05:53    24  *****
 386    2024-09-09 05:54    25  ******
 387    2024-09-09 05:55    24  *****
 388    2024-09-09 05:56    24  *****

SCT Error Recovery Control:
           Read:     75 (7.5 seconds)
          Write:     75 (7.5 seconds)

Device Statistics (GP Log 0x04)
Page  Offset Size        Value Flags Description
0x01  =====  =               =  ===  == General Statistics (rev 3) ==
0x01  0x008  4              19  ---  Lifetime Power-On Resets
0x01  0x010  4            3565  ---  Power-on Hours
0x01  0x018  6     12623140339  ---  Logical Sectors Written
0x01  0x020  6        33103854  ---  Number of Write Commands
0x01  0x028  6     10832744693  ---  Logical Sectors Read
0x01  0x030  6        35016194  ---  Number of Read Commands
0x01  0x038  6     12834000000  ---  Date and Time TimeStamp
0x01  0x040  4               0  ---  Pending Error Count
0x02  =====  =               =  ===  == Free-Fall Statistics (rev 1) ==
0x02  0x010  4               0  ---  Overlimit Shock Events
0x03  =====  =               =  ===  == Rotating Media Statistics (rev 1) ==
0x03  0x008  4            1179  ---  Spindle Motor Power-on Hours
0x03  0x010  4            1178  ---  Head Flying Hours
0x03  0x018  4              31  ---  Head Load Events
0x03  0x020  4               0  ---  Number of Reallocated Logical Sectors
0x03  0x028  4               0  ---  Read Recovery Attempts
0x03  0x030  4               0  ---  Number of Mechanical Start Failures
0x03  0x038  4               0  ---  Number of Realloc. Candidate Logical Sectors
0x03  0x040  4              12  ---  Number of High Priority Unload Events
0x04  =====  =               =  ===  == General Errors Statistics (rev 1) ==
0x04  0x008  4               0  ---  Number of Reported Uncorrectable Errors
0x04  0x010  4               0  ---  Resets Between Cmd Acceptance and Completion
0x05  =====  =               =  ===  == Temperature Statistics (rev 1) ==
0x05  0x008  1              24  ---  Current Temperature
0x05  0x010  1              23  N--  Average Short Term Temperature
0x05  0x018  1              23  N--  Average Long Term Temperature
0x05  0x020  1              29  ---  Highest Temperature
0x05  0x028  1              17  ---  Lowest Temperature
0x05  0x030  1              26  N--  Highest Average Short Term Temperature
0x05  0x038  1              17  N--  Lowest Average Short Term Temperature
0x05  0x040  1              24  N--  Highest Average Long Term Temperature
0x05  0x048  1              19  N--  Lowest Average Long Term Temperature
0x05  0x050  4               0  ---  Time in Over-Temperature
0x05  0x058  1              55  ---  Specified Maximum Operating Temperature
0x05  0x060  4               0  ---  Time in Under-Temperature
0x05  0x068  1               5  ---  Specified Minimum Operating Temperature
0x06  =====  =               =  ===  == Transport Statistics (rev 1) ==
0x06  0x008  4             146  ---  Number of Hardware Resets
0x06  0x010  4              40  ---  Number of ASR Events
0x06  0x018  4               0  ---  Number of Interface CRC Errors
0x07  =====  =               =  ===  == Solid State Device Statistics (rev 1) ==
                                |||_ C monitored condition met
                                ||__ D supports DSN
                                |___ N normalized value

Pending Defects log (GP Log 0x0c)
No Defects Logged

SATA Phy Event Counters (GP Log 0x11)
ID      Size     Value  Description
0x0001  4            0  Command failed due to ICRC error
0x0002  4            0  R_ERR response for data FIS
0x0003  4            0  R_ERR response for device-to-host data FIS
0x0004  4            0  R_ERR response for host-to-device data FIS
0x0005  4            0  R_ERR response for non-data FIS
0x0006  4            0  R_ERR response for device-to-host non-data FIS
0x0007  4            0  R_ERR response for host-to-device non-data FIS
0x0008  4            0  Device-to-host non-data FIS retries
0x0009  4           79  Transition from drive PhyRdy to drive PhyNRdy
0x000a  4           79  Device-to-host register FISes sent due to a COMRESET
0x000b  4            0  CRC errors within host-to-device FIS
0x000d  4            0  Non-CRC errors within host-to-device FIS
0x000f  4            0  R_ERR response for host-to-device data FIS, CRC
0x0010  4            0  R_ERR response for host-to-device data FIS, non-CRC
0x0012  4            0  R_ERR response for host-to-device non-data FIS, CRC
0x0013  4            0  R_ERR response for host-to-device non-data FIS, non-CRC

