smartctl 6.6 2017-11-05 r4594 [x86_64-linux-4.19.6-gentoo] (local build)
Copyright (C) 2002-17, Bruce Allen, Christian Franke, www.smartmontools.org

=== START OF INFORMATION SECTION ===
Device Model:     TOSHIBA HDWN160
Serial Number:    78OBK05YFAXG
LU WWN Device Id: 5 000039 8abc028dc
Firmware Version: FS1M
User Capacity:    6,001,175,126,016 bytes [6.00 TB]
Sector Sizes:     512 bytes logical, 4096 bytes physical
Rotation Rate:    7200 rpm
Form Factor:      3.5 inches
Device is:        Not in smartctl database [for details use: -P showall]
ATA Version is:   ATA8-ACS (minor revision not indicated)
SATA Version is:  SATA 3.0, 6.0 Gb/s (current: 6.0 Gb/s)
Local Time is:    Sat Dec  8 17:50:04 2018 PST
SMART support is: Available - device has SMART capability.
SMART support is: Enabled
AAM feature is:   Unavailable
APM level is:     128 (minimum power consumption without standby)
Rd look-ahead is: Enabled
Write cache is:   Enabled
DSN feature is:   Unavailable
ATA Security is:  Disabled, NOT FROZEN [SEC1]
Wt Cache Reorder: Enabled

=== START OF READ SMART DATA SECTION ===
SMART overall-health self-assessment test result: PASSED

General SMART Values:
Offline data collection status:  (0x80)	Offline data collection activity
					was never started.
					Auto Offline Data Collection: Enabled.
Self-test execution status:      (   0)	The previous self-test routine completed
					without error or no self-test has ever 
					been run.
Total time to complete Offline 
data collection: 		(  120) seconds.
Offline data collection
capabilities: 			 (0x5b) SMART execute Offline immediate.
					Auto Offline data collection on/off support.
					Suspend Offline collection upon new
					command.
					Offline surface scan supported.
					Self-test supported.
					No Conveyance Self-test supported.
					Selective Self-test supported.
SMART capabilities:            (0x0003)	Saves SMART data before entering
					power-saving mode.
					Supports SMART auto save timer.
Error logging capability:        (0x01)	Error logging supported.
					General Purpose Logging supported.
Short self-test routine 
recommended polling time: 	 (   2) minutes.
Extended self-test routine
recommended polling time: 	 ( 631) minutes.
SCT capabilities: 	       (0x003d)	SCT Status supported.
					SCT Error Recovery Control supported.
					SCT Feature Control supported.
					SCT Data Table supported.

SMART Attributes Data Structure revision number: 16
Vendor Specific SMART Attributes with Thresholds:
ID# ATTRIBUTE_NAME          FLAGS    VALUE WORST THRESH FAIL RAW_VALUE
  1 Raw_Read_Error_Rate     PO-R--   100   100   050    -    0
  2 Throughput_Performance  P-S---   100   100   050    -    0
  3 Spin_Up_Time            POS--K   100   100   001    -    11149
  4 Start_Stop_Count        -O--CK   100   100   000    -    1
  5 Reallocated_Sector_Ct   PO--CK   100   100   050    -    0
  7 Seek_Error_Rate         PO-R--   100   100   050    -    0
  8 Seek_Time_Performance   P-S---   100   100   050    -    0
  9 Power_On_Hours          -O--CK   100   100   000    -    2
 10 Spin_Retry_Count        PO--CK   100   100   030    -    0
 12 Power_Cycle_Count       -O--CK   100   100   000    -    1
191 G-Sense_Error_Rate      -O--CK   100   100   000    -    11
192 Power-Off_Retract_Count -O--CK   100   100   000    -    0
193 Load_Cycle_Count        -O--CK   100   100   000    -    1
194 Temperature_Celsius     -O---K   100   100   000    -    33 (Min/Max 9/42)
196 Reallocated_Event_Count -O--CK   100   100   000    -    0
197 Current_Pending_Sector  -O--CK   100   100   000    -    0
198 Offline_Uncorrectable   ----CK   100   100   000    -    0
199 UDMA_CRC_Error_Count    -O--CK   200   253   000    -    0
220 Disk_Shift              -O----   100   100   000    -    0
222 Loaded_Hours            -O--CK   100   100   000    -    2
223 Load_Retry_Count        -O--CK   100   100   000    -    0
224 Load_Friction           -O---K   100   100   000    -    0
226 Load-in_Time            -OS--K   100   100   000    -    545
240 Head_Flying_Hours       P-----   100   100   001    -    0
                            ||||||_ K auto-keep
                            |||||__ C event count
                            ||||___ R error rate
                            |||____ S speed/performance
                            ||_____ O updated online
                            |______ P prefailure warning

General Purpose Log Directory Version 1
SMART           Log Directory Version 1 [multi-sector log support]
Address    Access  R/W   Size  Description
0x00       GPL,SL  R/O      1  Log Directory
0x01           SL  R/O      1  Summary SMART error log
0x02           SL  R/O     51  Comprehensive SMART error log
0x03       GPL     R/O     64  Ext. Comprehensive SMART error log
0x04       GPL,SL  R/O      8  Device Statistics log
0x06           SL  R/O      1  SMART self-test log
0x07       GPL     R/O      1  Extended self-test log
0x08       GPL     R/O      2  Power Conditions log
0x09           SL  R/W      1  Selective self-test log
0x0c       GPL     R/O   2048  Pending Defects log
0x10       GPL     R/O      1  NCQ Command Error log
0x11       GPL     R/O      1  SATA Phy Event Counters log
0x24       GPL     R/O  12288  Current Device Internal Status Data log
0x30       GPL,SL  R/O      9  IDENTIFY DEVICE data log
0x80-0x9f  GPL,SL  R/W     16  Host vendor specific log
0xa7       GPL     VS       8  Device vendor specific log
0xe0       GPL,SL  R/W      1  SCT Command/Status
0xe1       GPL,SL  R/W      1  SCT Data Transfer

SMART Extended Comprehensive Error Log Version: 1 (64 sectors)
No Errors Logged

SMART Extended Self-test Log Version: 1 (1 sectors)
Num  Test_Description    Status                  Remaining  LifeTime(hours)  LBA_of_first_error
# 1  Short offline       Completed without error       00%         2         -
# 2  Short offline       Completed without error       00%         1         -

SMART Selective self-test log data structure revision number 1
 SPAN  MIN_LBA  MAX_LBA  CURRENT_TEST_STATUS
    1        0        0  Not_testing
    2        0        0  Not_testing
    3        0        0  Not_testing
    4        0        0  Not_testing
    5        0        0  Not_testing
Selective self-test flags (0x0):
  After scanning selected spans, do NOT read-scan remainder of disk.
If Selective self-test is pending on power-up, resume after 0 minute delay.

SCT Status Version:                  3
SCT Version (vendor specific):       1 (0x0001)
SCT Support Level:                   1
Device State:                        Active (0)
Current Temperature:                    33 Celsius
Power Cycle Min/Max Temperature:      9/42 Celsius
Lifetime    Min/Max Temperature:      9/42 Celsius
Under/Over Temperature Limit Count:   0/0

SCT Temperature History Version:     2
Temperature Sampling Period:         1 minute
Temperature Logging Interval:        1 minute
Min/Max recommended Temperature:      5/55 Celsius
Min/Max Temperature Limit:            5/55 Celsius
Temperature History Size (Index):    478 (126)

Index    Estimated Time   Temperature Celsius
 127    2018-12-08 09:53     ?  -
 ...    ..(350 skipped).    ..  -
   0    2018-12-08 15:44     ?  -
   1    2018-12-08 15:45    10  -
   2    2018-12-08 15:46    11  -
   3    2018-12-08 15:47    12  -
   4    2018-12-08 15:48    13  -
   5    2018-12-08 15:49    14  -
   6    2018-12-08 15:50    15  -
   7    2018-12-08 15:51    16  -
   8    2018-12-08 15:52    17  -
   9    2018-12-08 15:53    18  -
  10    2018-12-08 15:54    19  -
  11    2018-12-08 15:55    19  -
  12    2018-12-08 15:56    20  *
  13    2018-12-08 15:57    21  **
  14    2018-12-08 15:58    22  ***
  15    2018-12-08 15:59    22  ***
  16    2018-12-08 16:00    23  ****
  17    2018-12-08 16:01    23  ****
  18    2018-12-08 16:02    24  *****
  19    2018-12-08 16:03    25  ******
  20    2018-12-08 16:04    26  *******
  21    2018-12-08 16:05    26  *******
  22    2018-12-08 16:06    27  ********
  23    2018-12-08 16:07    27  ********
  24    2018-12-08 16:08    27  ********
  25    2018-12-08 16:09    28  *********
  26    2018-12-08 16:10    29  **********
  27    2018-12-08 16:11    29  **********
  28    2018-12-08 16:12    30  ***********
  29    2018-12-08 16:13    30  ***********
  30    2018-12-08 16:14    30  ***********
  31    2018-12-08 16:15    31  ************
  32    2018-12-08 16:16    31  ************
  33    2018-12-08 16:17    32  *************
 ...    ..(  2 skipped).    ..  *************
  36    2018-12-08 16:20    32  *************
  37    2018-12-08 16:21    33  **************
  38    2018-12-08 16:22    33  **************
  39    2018-12-08 16:23    33  **************
  40    2018-12-08 16:24    34  ***************
 ...    ..(  4 skipped).    ..  ***************
  45    2018-12-08 16:29    34  ***************
  46    2018-12-08 16:30    35  ****************
 ...    ..(  3 skipped).    ..  ****************
  50    2018-12-08 16:34    35  ****************
  51    2018-12-08 16:35    36  *****************
 ...    ..(  6 skipped).    ..  *****************
  58    2018-12-08 16:42    36  *****************
  59    2018-12-08 16:43    37  ******************
 ...    ..( 10 skipped).    ..  ******************
  70    2018-12-08 16:54    37  ******************
  71    2018-12-08 16:55    38  *******************
 ...    ..( 21 skipped).    ..  *******************
  93    2018-12-08 17:17    38  *******************
  94    2018-12-08 17:18    39  ********************
 ...    ..(  2 skipped).    ..  ********************
  97    2018-12-08 17:21    39  ********************
  98    2018-12-08 17:22    40  *********************
 ...    ..(  3 skipped).    ..  *********************
 102    2018-12-08 17:26    40  *********************
 103    2018-12-08 17:27    41  **********************
 ...    ..(  6 skipped).    ..  **********************
 110    2018-12-08 17:34    41  **********************
 111    2018-12-08 17:35    42  ***********************
 ...    ..(  9 skipped).    ..  ***********************
 121    2018-12-08 17:45    42  ***********************
 122    2018-12-08 17:46    41  **********************
 123    2018-12-08 17:47    38  *******************
 124    2018-12-08 17:48    37  ******************
 125    2018-12-08 17:49    35  ****************
 126    2018-12-08 17:50    34  ***************

SCT Error Recovery Control:
           Read: Disabled
          Write: Disabled

Device Statistics (GP Log 0x04)
Page  Offset Size        Value Flags Description
0x01  =====  =               =  ===  == General Statistics (rev 2) ==
0x01  0x008  4               1  ---  Lifetime Power-On Resets
0x01  0x010  4               2  ---  Power-on Hours
0x01  0x018  6       594295963  ---  Logical Sectors Written
0x01  0x020  6         2611970  ---  Number of Write Commands
0x01  0x028  6           39605  ---  Logical Sectors Read
0x01  0x030  6            2247  ---  Number of Read Commands
0x02  =====  =               =  ===  == Free-Fall Statistics (rev 1) ==
0x02  0x010  4              11  ---  Overlimit Shock Events
0x03  =====  =               =  ===  == Rotating Media Statistics (rev 1) ==
0x03  0x008  4               2  ---  Spindle Motor Power-on Hours
0x03  0x010  4               2  ---  Head Flying Hours
0x03  0x018  4               1  ---  Head Load Events
0x03  0x020  4               0  ---  Number of Reallocated Logical Sectors
0x03  0x028  4               0  ---  Read Recovery Attempts
0x03  0x030  4               0  ---  Number of Mechanical Start Failures
0x04  =====  =               =  ===  == General Errors Statistics (rev 1) ==
0x04  0x008  4               0  ---  Number of Reported Uncorrectable Errors
0x04  0x010  4               0  ---  Resets Between Cmd Acceptance and Completion
0x05  =====  =               =  ===  == Temperature Statistics (rev 1) ==
0x05  0x008  1              33  ---  Current Temperature
0x05  0x010  1               -  N--  Average Short Term Temperature
0x05  0x018  1               -  N--  Average Long Term Temperature
0x05  0x020  1              42  ---  Highest Temperature
0x05  0x028  1               9  ---  Lowest Temperature
0x05  0x030  1               -  N--  Highest Average Short Term Temperature
0x05  0x038  1               -  N--  Lowest Average Short Term Temperature
0x05  0x040  1               -  N--  Highest Average Long Term Temperature
0x05  0x048  1               -  N--  Lowest Average Long Term Temperature
0x05  0x050  4               0  ---  Time in Over-Temperature
0x05  0x058  1              55  ---  Specified Maximum Operating Temperature
0x05  0x060  4               0  ---  Time in Under-Temperature
0x05  0x068  1               5  ---  Specified Minimum Operating Temperature
0x06  =====  =               =  ===  == Transport Statistics (rev 1) ==
0x06  0x008  4               0  ---  Number of Hardware Resets
0x06  0x018  4               0  ---  Number of Interface CRC Errors
0x07  =====  =               =  ===  == Solid State Device Statistics (rev 1) ==
                                |||_ C monitored condition met
                                ||__ D supports DSN
                                |___ N normalized value

Pending Defects log (GP Log 0x0c) supported [please try: '-l defects']

SATA Phy Event Counters (GP Log 0x11)
ID      Size     Value  Description
0x0001  4            0  Command failed due to ICRC error
0x0002  4            0  R_ERR response for data FIS
0x0003  4            0  R_ERR response for device-to-host data FIS
0x0004  4            0  R_ERR response for host-to-device data FIS
0x0005  4            0  R_ERR response for non-data FIS
0x0006  4            0  R_ERR response for device-to-host non-data FIS
0x0007  4            0  R_ERR response for host-to-device non-data FIS
0x0008  4            0  Device-to-host non-data FIS retries
0x0009  4            2  Transition from drive PhyRdy to drive PhyNRdy
0x000a  4            0  Device-to-host register FISes sent due to a COMRESET
0x000b  4            0  CRC errors within host-to-device FIS
0x000d  4            0  Non-CRC errors within host-to-device FIS
0x000f  4            0  R_ERR response for host-to-device data FIS, CRC
0x0010  4            0  R_ERR response for host-to-device data FIS, non-CRC
0x0012  4            0  R_ERR response for host-to-device non-data FIS, CRC
0x0013  4            0  R_ERR response for host-to-device non-data FIS, non-CRC

