smartctl 6.6 2017-11-05 r4594 [armv7l-linux-4.9.61-1-ARCH] (local build)
Copyright (C) 2002-17, Bruce Allen, Christian Franke, www.smartmontools.org

=== START OF INFORMATION SECTION ===
Model Family:     Western Digital Red Pro
Device Model:     WDC WD6001FFWX-68Z39N0
Firmware Version: 81.00A81
User Capacity:    6,001,175,126,016 bytes [6.00 TB]
Sector Sizes:     512 bytes logical, 4096 bytes physical
Rotation Rate:    7200 rpm
Form Factor:      3.5 inches
Device is:        In smartctl database [for details use: -P show]
ATA Version is:   ACS-3 T13/2161-D revision 5
SATA Version is:  SATA 3.1, 6.0 Gb/s (current: 6.0 Gb/s)
Local Time is:    Mon Nov 20 14:52:09 2017 GMT
SMART support is: Available - device has SMART capability.
SMART support is: Enabled
AAM feature is:   Unavailable
APM level is:     128 (minimum power consumption without standby)
Rd look-ahead is: Enabled
Write cache is:   Enabled
DSN feature is:   Disabled
ATA Security is:  Disabled, NOT FROZEN [SEC1]
Wt Cache Reorder: Unknown

=== START OF READ SMART DATA SECTION ===
SMART Status not supported: Incomplete response, ATA output registers missing
SMART overall-health self-assessment test result: PASSED
Warning: This result is based on an Attribute check.

General SMART Values:
Offline data collection status:  (0x82)	Offline data collection activity
					was completed without error.
					Auto Offline Data Collection: Enabled.
Self-test execution status:      (   0)	The previous self-test routine completed
					without error or no self-test has ever 
					been run.
Total time to complete Offline 
data collection: 		(   90) seconds.
Offline data collection
capabilities: 			 (0x7b) SMART execute Offline immediate.
					Auto Offline data collection on/off support.
					Suspend Offline collection upon new
					command.
					Offline surface scan supported.
					Self-test supported.
					Conveyance Self-test supported.
					Selective Self-test supported.
SMART capabilities:            (0x0003)	Saves SMART data before entering
					power-saving mode.
					Supports SMART auto save timer.
Error logging capability:        (0x01)	Error logging supported.
					General Purpose Logging supported.
Short self-test routine 
recommended polling time: 	 (   2) minutes.
Extended self-test routine
recommended polling time: 	 ( 563) minutes.
Conveyance self-test routine
recommended polling time: 	 (   6) minutes.
SCT capabilities: 	       (0x003d)	SCT Status supported.
					SCT Error Recovery Control supported.
					SCT Feature Control supported.
					SCT Data Table supported.

SMART Attributes Data Structure revision number: 16
Vendor Specific SMART Attributes with Thresholds:
ID# ATTRIBUTE_NAME          FLAGS    VALUE WORST THRESH FAIL RAW_VALUE
  1 Raw_Read_Error_Rate     POSR-K   200   100   051    -    0
  3 Spin_Up_Time            POS--K   184   100   021    -    9758
  4 Start_Stop_Count        -O--CK   097   097   000    -    3763
  5 Reallocated_Sector_Ct   PO--CK   200   200   140    -    0
  7 Seek_Error_Rate         -OSR-K   100   100   000    -    0
  9 Power_On_Hours          -O--CK   082   082   000    -    13453
 10 Spin_Retry_Count        -O--CK   100   100   000    -    0
 11 Calibration_Retry_Count -O--CK   100   100   000    -    0
 12 Power_Cycle_Count       -O--CK   100   100   000    -    218
 16 Unknown_Attribute       -O---K   003   197   000    -    55859582177
183 Runtime_Bad_Block       -O--CK   100   100   000    -    0
192 Power-Off_Retract_Count -O--CK   200   100   000    -    3
193 Load_Cycle_Count        -O--CK   199   100   000    -    3745
194 Temperature_Celsius     -O---K   117   099   000    -    35
196 Reallocated_Event_Count -O--CK   200   100   000    -    0
197 Current_Pending_Sector  -O--CK   200   100   000    -    0
198 Offline_Uncorrectable   ----CK   200   100   000    -    0
199 UDMA_CRC_Error_Count    -O--CK   200   200   000    -    0
200 Multi_Zone_Error_Rate   ---R--   200   100   000    -    0
                            ||||||_ K auto-keep
                            |||||__ C event count
                            ||||___ R error rate
                            |||____ S speed/performance
                            ||_____ O updated online
                            |______ P prefailure warning

General Purpose Log Directory Version 1
SMART           Log Directory Version 1 [multi-sector log support]
Address    Access  R/W   Size  Description
0x00       GPL,SL  R/O      1  Log Directory
0x01           SL  R/O      1  Summary SMART error log
0x02           SL  R/O      5  Comprehensive SMART error log
0x03       GPL     R/O      6  Ext. Comprehensive SMART error log
0x04       GPL,SL  R/O      8  Device Statistics log
0x06           SL  R/O      1  SMART self-test log
0x07       GPL     R/O      1  Extended self-test log
0x08       GPL     R/O      2  Power Conditions log
0x09           SL  R/W      1  Selective self-test log
0x0a       GPL     R/W      8  Device Statistics Notification
0x10       GPL     R/O      1  NCQ Command Error log
0x11       GPL     R/O      1  SATA Phy Event Counters log
0x12       GPL     R/O      1  SATA NCQ Non-Data log
0x13       GPL     R/O      1  SATA NCQ Send and Receive log
0x24       GPL     R/O    171  Current Device Internal Status Data log
0x30       GPL,SL  R/O      9  IDENTIFY DEVICE data log
0x80-0x9f  GPL,SL  R/W     16  Host vendor specific log
0xa0-0xaf  GPL,SL  VS      16  Device vendor specific log
0xb0       GPL,SL  VS       1  Device vendor specific log
0xb1-0xb5  GPL,SL  VS      16  Device vendor specific log
0xb6           SL  VS      16  Device vendor specific log
0xb7       GPL,SL  VS      40  Device vendor specific log
0xb8-0xbf  GPL,SL  VS      16  Device vendor specific log
0xc0       GPL,SL  VS       1  Device vendor specific log
0xde       GPL     VS    5502  Device vendor specific log
0xe0       GPL,SL  R/W      1  SCT Command/Status
0xe1       GPL,SL  R/W      1  SCT Data Transfer

SMART Extended Comprehensive Error Log Version: 1 (6 sectors)
Device Error Count: 1
	CR     = Command Register
	FEATR  = Features Register
	COUNT  = Count (was: Sector Count) Register
	LBA_48 = Upper bytes of LBA High/Mid/Low Registers ]  ATA-8
	LH     = LBA High (was: Cylinder High) Register    ]   LBA
	LM     = LBA Mid (was: Cylinder Low) Register      ] Register
	LL     = LBA Low (was: Sector Number) Register     ]
	DV     = Device (was: Device/Head) Register
	DC     = Device Control Register
	ER     = Error register
	ST     = Status register
Powered_Up_Time is measured from power on, and printed as
DDd+hh:mm:SS.sss where DD=days, hh=hours, mm=minutes,
SS=sec, and sss=millisec. It "wraps" after 49.710 days.

Error 1 [0] occurred at disk power-on lifetime: 13453 hours (560 days + 13 hours)
  When the command that caused the error occurred, the device was in standby mode.

  After command completion occurred, registers were:
  ER -- ST COUNT  LBA_48  LH LM LL DV DC
  -- -- -- == -- == == == -- -- -- -- --
  04 -- 51 00 01 01 00 00 00 00 00 00 00  Error: ABRT

  Commands leading to the command that caused the error were:
  CR FEATR COUNT  LBA_48  LH LM LL DV DC  Powered_Up_Time  Command/Feature_Name
  -- == -- == -- == == == -- -- -- -- --  ---------------  --------------------
  2f 00 00 00 01 00 00 00 00 00 00 00 00  4d+00:05:51.046  READ LOG EXT
  b0 00 d5 00 01 00 00 00 c2 4f 00 00 00  4d+00:05:45.939  SMART READ LOG
  ec 00 00 00 01 00 00 00 00 00 00 00 00  4d+00:05:45.868  IDENTIFY DEVICE
  e0 00 00 00 00 00 00 00 00 00 00 00 00  4d+00:03:15.618  STANDBY IMMEDIATE
  ea 00 00 00 00 00 00 00 00 00 00 00 00  4d+00:03:15.617  FLUSH CACHE EXT

SMART Extended Self-test Log Version: 1 (1 sectors)
Num  Test_Description    Status                  Remaining  LifeTime(hours)  LBA_of_first_error
# 1  Short offline       Completed without error       00%     13453         -
# 2  Extended offline    Completed without error       00%     13290         -
# 3  Extended offline    Interrupted (host reset)      70%         0         -
# 4  Extended offline    Completed without error       00%     13031         -
# 5  Extended offline    Completed without error       00%     12765         -
# 6  Extended offline    Interrupted (host reset)      10%         0         -
# 7  Extended offline    Interrupted (host reset)      90%         0         -
# 8  Extended offline    Completed without error       00%     11430         -
# 9  Extended offline    Completed without error       00%     11275         -
#10  Extended offline    Completed without error       00%     11107         -
#11  Extended offline    Completed without error       00%     10938         -
#12  Extended offline    Completed without error       00%     10770         -
#13  Extended offline    Completed without error       00%     10601         -
#14  Extended offline    Completed without error       00%     10435         -
#15  Extended offline    Completed without error       00%     10266         -
#16  Extended offline    Completed without error       00%     10099         -
#17  Extended offline    Completed without error       00%      9931         -
#18  Extended offline    Completed without error       00%      9764         -
#19  Extended offline    Completed without error       00%      9595         -

SMART Selective self-test log data structure revision number 1
 SPAN  MIN_LBA  MAX_LBA  CURRENT_TEST_STATUS
    1        0        0  Not_testing
    2        0        0  Not_testing
    3        0        0  Not_testing
    4        0        0  Not_testing
    5        0        0  Not_testing
Selective self-test flags (0x0):
  After scanning selected spans, do NOT read-scan remainder of disk.
If Selective self-test is pending on power-up, resume after 0 minute delay.

SCT Status Version:                  3
SCT Version (vendor specific):       258 (0x0102)
SCT Support Level:                   1
Device State:                        Active (0)
Current Temperature:                    35 Celsius
Power Cycle Min/Max Temperature:      9/35 Celsius
Lifetime    Min/Max Temperature:      9/55 Celsius
Under/Over Temperature Limit Count:   0/0
Vendor specific:
01 00 00 00 00 00 00 00 00 00 00 00 00 00 00 00
00 00 00 00 00 00 00 00 00 00 00 00 00 00 00 00

SCT Temperature History Version:     2
Temperature Sampling Period:         1 minute
Temperature Logging Interval:        1 minute
Min/Max recommended Temperature:      0/60 Celsius
Min/Max Temperature Limit:           -41/85 Celsius
Temperature History Size (Index):    478 (389)

Index    Estimated Time   Temperature Celsius
 390    2017-11-20 06:55    13  -
 ...    ..( 98 skipped).    ..  -
  11    2017-11-20 08:34    13  -
  12    2017-11-20 08:35    14  -
  13    2017-11-20 08:36    14  -
  14    2017-11-20 08:37    15  -
  15    2017-11-20 08:38    15  -
  16    2017-11-20 08:39    16  -
  17    2017-11-20 08:40    16  -
  18    2017-11-20 08:41    16  -
  19    2017-11-20 08:42    17  -
 ...    ..(  2 skipped).    ..  -
  22    2017-11-20 08:45    17  -
  23    2017-11-20 08:46    18  -
 ...    ..(  4 skipped).    ..  -
  28    2017-11-20 08:51    18  -
  29    2017-11-20 08:52    19  -
  30    2017-11-20 08:53    20  *
  31    2017-11-20 08:54    20  *
  32    2017-11-20 08:55    19  -
 ...    ..( 14 skipped).    ..  -
  47    2017-11-20 09:10    19  -
  48    2017-11-20 09:11    20  *
 ...    ..( 12 skipped).    ..  *
  61    2017-11-20 09:24    20  *
  62    2017-11-20 09:25    21  **
 ...    ..(  2 skipped).    ..  **
  65    2017-11-20 09:28    21  **
  66    2017-11-20 09:29    20  *
  67    2017-11-20 09:30    20  *
  68    2017-11-20 09:31    20  *
  69    2017-11-20 09:32    19  -
  70    2017-11-20 09:33    19  -
  71    2017-11-20 09:34    19  -
  72    2017-11-20 09:35    18  -
 ...    ..(  2 skipped).    ..  -
  75    2017-11-20 09:38    18  -
  76    2017-11-20 09:39    17  -
 ...    ..(  4 skipped).    ..  -
  81    2017-11-20 09:44    17  -
  82    2017-11-20 09:45    16  -
 ...    ..( 10 skipped).    ..  -
  93    2017-11-20 09:56    16  -
  94    2017-11-20 09:57    15  -
 ...    ..( 42 skipped).    ..  -
 137    2017-11-20 10:40    15  -
 138    2017-11-20 10:41    16  -
 139    2017-11-20 10:42    16  -
 140    2017-11-20 10:43    17  -
 141    2017-11-20 10:44    17  -
 142    2017-11-20 10:45    17  -
 143    2017-11-20 10:46    18  -
 144    2017-11-20 10:47    18  -
 145    2017-11-20 10:48    19  -
 ...    ..(  3 skipped).    ..  -
 149    2017-11-20 10:52    19  -
 150    2017-11-20 10:53    20  *
 ...    ..(  3 skipped).    ..  *
 154    2017-11-20 10:57    20  *
 155    2017-11-20 10:58    21  **
 ...    ..( 14 skipped).    ..  **
 170    2017-11-20 11:13    21  **
 171    2017-11-20 11:14    22  ***
 ...    ..(  8 skipped).    ..  ***
 180    2017-11-20 11:23    22  ***
 181    2017-11-20 11:24    23  ****
 182    2017-11-20 11:25    23  ****
 183    2017-11-20 11:26    22  ***
 184    2017-11-20 11:27    22  ***
 185    2017-11-20 11:28    22  ***
 186    2017-11-20 11:29    21  **
 187    2017-11-20 11:30    21  **
 188    2017-11-20 11:31    21  **
 189    2017-11-20 11:32    20  *
 ...    ..(  2 skipped).    ..  *
 192    2017-11-20 11:35    20  *
 193    2017-11-20 11:36    19  -
 ...    ..(  9 skipped).    ..  -
 203    2017-11-20 11:46    19  -
 204    2017-11-20 11:47    20  *
 ...    ..(  4 skipped).    ..  *
 209    2017-11-20 11:52    20  *
 210    2017-11-20 11:53    21  **
 ...    ..( 12 skipped).    ..  **
 223    2017-11-20 12:06    21  **
 224    2017-11-20 12:07    22  ***
 ...    ..( 10 skipped).    ..  ***
 235    2017-11-20 12:18    22  ***
 236    2017-11-20 12:19    23  ****
 237    2017-11-20 12:20    22  ***
 ...    ..(  2 skipped).    ..  ***
 240    2017-11-20 12:23    22  ***
 241    2017-11-20 12:24    21  **
 242    2017-11-20 12:25    21  **
 243    2017-11-20 12:26    21  **
 244    2017-11-20 12:27    20  *
 245    2017-11-20 12:28    20  *
 246    2017-11-20 12:29    20  *
 247    2017-11-20 12:30    19  -
 ...    ..(  6 skipped).    ..  -
 254    2017-11-20 12:37    19  -
 255    2017-11-20 12:38    20  *
 ...    ..(  4 skipped).    ..  *
 260    2017-11-20 12:43    20  *
 261    2017-11-20 12:44    21  **
 ...    ..(  5 skipped).    ..  **
 267    2017-11-20 12:50    21  **
 268    2017-11-20 12:51    22  ***
 ...    ..(  2 skipped).    ..  ***
 271    2017-11-20 12:54    22  ***
 272    2017-11-20 12:55    21  **
 ...    ..(  2 skipped).    ..  **
 275    2017-11-20 12:58    21  **
 276    2017-11-20 12:59    20  *
 ...    ..(  2 skipped).    ..  *
 279    2017-11-20 13:02    20  *
 280    2017-11-20 13:03    19  -
 ...    ..(  6 skipped).    ..  -
 287    2017-11-20 13:10    19  -
 288    2017-11-20 13:11    18  -
 ...    ..( 10 skipped).    ..  -
 299    2017-11-20 13:22    18  -
 300    2017-11-20 13:23    19  -
 301    2017-11-20 13:24    19  -
 302    2017-11-20 13:25    20  *
 ...    ..(  2 skipped).    ..  *
 305    2017-11-20 13:28    20  *
 306    2017-11-20 13:29    21  **
 ...    ..(  4 skipped).    ..  **
 311    2017-11-20 13:34    21  **
 312    2017-11-20 13:35    22  ***
 313    2017-11-20 13:36    22  ***
 314    2017-11-20 13:37    22  ***
 315    2017-11-20 13:38    23  ****
 316    2017-11-20 13:39    23  ****
 317    2017-11-20 13:40    23  ****
 318    2017-11-20 13:41    22  ***
 ...    ..(  2 skipped).    ..  ***
 321    2017-11-20 13:44    22  ***
 322    2017-11-20 13:45    21  **
 ...    ..(  2 skipped).    ..  **
 325    2017-11-20 13:48    21  **
 326    2017-11-20 13:49    20  *
 ...    ..(  5 skipped).    ..  *
 332    2017-11-20 13:55    20  *
 333    2017-11-20 13:56    19  -
 ...    ..( 11 skipped).    ..  -
 345    2017-11-20 14:08    19  -
 346    2017-11-20 14:09    20  *
 ...    ..(  2 skipped).    ..  *
 349    2017-11-20 14:12    20  *
 350    2017-11-20 14:13    21  **
 351    2017-11-20 14:14    21  **
 352    2017-11-20 14:15    22  ***
 ...    ..(  2 skipped).    ..  ***
 355    2017-11-20 14:18    22  ***
 356    2017-11-20 14:19    23  ****
 ...    ..(  4 skipped).    ..  ****
 361    2017-11-20 14:24    23  ****
 362    2017-11-20 14:25    24  *****
 363    2017-11-20 14:26    24  *****
 364    2017-11-20 14:27    25  ******
 365    2017-11-20 14:28    26  *******
 366    2017-11-20 14:29    26  *******
 367    2017-11-20 14:30    27  ********
 368    2017-11-20 14:31    27  ********
 369    2017-11-20 14:32    28  *********
 370    2017-11-20 14:33    28  *********
 371    2017-11-20 14:34    29  **********
 372    2017-11-20 14:35    29  **********
 373    2017-11-20 14:36    30  ***********
 374    2017-11-20 14:37    30  ***********
 375    2017-11-20 14:38    30  ***********
 376    2017-11-20 14:39    32  *************
 ...    ..(  5 skipped).    ..  *************
 382    2017-11-20 14:45    32  *************
 383    2017-11-20 14:46    33  **************
 384    2017-11-20 14:47    33  **************
 385    2017-11-20 14:48    34  ***************
 ...    ..(  2 skipped).    ..  ***************
 388    2017-11-20 14:51    34  ***************
 389    2017-11-20 14:52    35  ****************

SMART WRITE LOG does not return COUNT and LBA_LOW register
SCT (Get) Error Recovery Control command failed

Device Statistics (GP Log 0x04)
Page  Offset Size        Value Flags Description
0x01  =====  =               =  ===  == General Statistics (rev 1) ==
0x01  0x008  4             218  -D-  Lifetime Power-On Resets
0x01  0x010  4           13453  -D-  Power-on Hours
0x01  0x018  6     21778793621  -D-  Logical Sectors Written
0x01  0x020  6        50696114  -D-  Number of Write Commands
0x01  0x028  6     34080788556  -D-  Logical Sectors Read
0x01  0x030  6        65586918  -D-  Number of Read Commands
0x01  0x038  6      1186159744  -D-  Date and Time TimeStamp
0x01  0x048  2             317  ND-  Workload Utilization
0x03  =====  =               =  ===  == Rotating Media Statistics (rev 1) ==
0x03  0x008  4            7078  -D-  Spindle Motor Power-on Hours
0x03  0x010  4            7078  -D-  Head Flying Hours
0x03  0x018  4            3749  -D-  Head Load Events
0x03  0x020  4             200  ND-  Number of Reallocated Logical Sectors
0x03  0x028  4               0  -D-  Read Recovery Attempts
0x03  0x030  4               0  -D-  Number of Mechanical Start Failures
0x03  0x038  4               0  -D-  Number of Realloc. Candidate Logical Sectors
0x03  0x040  4               3  -D-  Number of High Priority Unload Events
0x04  =====  =               =  ===  == General Errors Statistics (rev 1) ==
0x04  0x008  4               0  -D-  Number of Reported Uncorrectable Errors
0x04  0x010  4               0  -D-  Resets Between Cmd Acceptance and Completion
0x05  =====  =               =  ===  == Temperature Statistics (rev 1) ==
0x05  0x008  1              35  -D-  Current Temperature
0x05  0x010  1              16  -D-  Average Short Term Temperature
0x05  0x018  1              44  -D-  Average Long Term Temperature
0x05  0x020  1              54  -D-  Highest Temperature
0x05  0x028  1               9  -D-  Lowest Temperature
0x05  0x030  1              52  -D-  Highest Average Short Term Temperature
0x05  0x038  1              14  -D-  Lowest Average Short Term Temperature
0x05  0x040  1              50  -D-  Highest Average Long Term Temperature
0x05  0x048  1              25  -D-  Lowest Average Long Term Temperature
0x05  0x050  4               0  -D-  Time in Over-Temperature
0x05  0x058  1              60  -D-  Specified Maximum Operating Temperature
0x05  0x060  4               0  -D-  Time in Under-Temperature
0x05  0x068  1               0  -D-  Specified Minimum Operating Temperature
0x06  =====  =               =  ===  == Transport Statistics (rev 1) ==
0x06  0x008  4             559  -D-  Number of Hardware Resets
0x06  0x010  4             316  -D-  Number of ASR Events
0x06  0x018  4               0  -D-  Number of Interface CRC Errors
                                |||_ C monitored condition met
                                ||__ D supports DSN
                                |___ N normalized value

Pending Defects log (GP Log 0x0c) not supported

SATA Phy Event Counters (GP Log 0x11)
ID      Size     Value  Description
0x0001  2            0  Command failed due to ICRC error
0x0002  2            0  R_ERR response for data FIS
0x0003  2            0  R_ERR response for device-to-host data FIS
0x0004  2            0  R_ERR response for host-to-device data FIS
0x0005  2            0  R_ERR response for non-data FIS
0x0006  2            0  R_ERR response for device-to-host non-data FIS
0x0007  2            0  R_ERR response for host-to-device non-data FIS
0x0008  2            0  Device-to-host non-data FIS retries
0x0009  2           26  Transition from drive PhyRdy to drive PhyNRdy
0x000a  2           27  Device-to-host register FISes sent due to a COMRESET
0x000b  2            0  CRC errors within host-to-device FIS
0x000d  2            0  Non-CRC errors within host-to-device FIS
0x000f  2            0  R_ERR response for host-to-device data FIS, CRC
0x0012  2            0  R_ERR response for host-to-device non-data FIS, CRC
0x8000  4            0  Vendor specific

