smartctl 6.5 2016-10-23 r4352 [x86_64-linux-4.4.36-218-x86_64] (local build)
Copyright (C) 2002-16, Bruce Allen, Christian Franke, www.smartmontools.org

=== START OF INFORMATION SECTION ===
Device Model:     MB4000GCWLV
Firmware Version: HPG3
User Capacity:    4,000,787,030,016 bytes [4.00 TB]
Sector Size:      512 bytes logical/physical
Rotation Rate:    7200 rpm
Form Factor:      3.5 inches
Device is:        Not in smartctl database [for details use: -P showall]
ATA Version is:   ATA8-ACS T13/1699-D revision 6
SATA Version is:  SATA 3.0, 6.0 Gb/s (current: 6.0 Gb/s)
Local Time is:    Thu Dec  8 18:57:48 2016 IST
SMART support is: Available - device has SMART capability.
SMART support is: Enabled
AAM feature is:   Unavailable
APM feature is:   Unavailable
Rd look-ahead is: Enabled
Write cache is:   Disabled
ATA Security is:  Unavailable
Wt Cache Reorder: Enabled

=== START OF READ SMART DATA SECTION ===
SMART overall-health self-assessment test result: PASSED

General SMART Values:
Offline data collection status:  (0x85)	Offline data collection activity
					was aborted by an interrupting command from host.
					Auto Offline Data Collection: Enabled.
Self-test execution status:      (   0)	The previous self-test routine completed
					without error or no self-test has ever 
					been run.
Total time to complete Offline 
data collection: 		(   24) seconds.
Offline data collection
capabilities: 			 (0x5b) SMART execute Offline immediate.
					Auto Offline data collection on/off support.
					Suspend Offline collection upon new
					command.
					Offline surface scan supported.
					Self-test supported.
					No Conveyance Self-test supported.
					Selective Self-test supported.
SMART capabilities:            (0x0003)	Saves SMART data before entering
					power-saving mode.
					Supports SMART auto save timer.
Error logging capability:        (0x01)	Error logging supported.
					General Purpose Logging supported.
Short self-test routine 
recommended polling time: 	 (   2) minutes.
Extended self-test routine
recommended polling time: 	 ( 540) minutes.
SCT capabilities: 	       (0x003d)	SCT Status supported.
					SCT Error Recovery Control supported.
					SCT Feature Control supported.
					SCT Data Table supported.

SMART Attributes Data Structure revision number: 16
Vendor Specific SMART Attributes with Thresholds:
ID# ATTRIBUTE_NAME          FLAGS    VALUE WORST THRESH FAIL RAW_VALUE
  1 Raw_Read_Error_Rate     POSR-K   100   100   016    -    0
  2 Throughput_Performance  POS--K   138   100   054    -    74
  3 Spin_Up_Time            PO---K   144   100   024    -    582 (Average 494)
  4 Start_Stop_Count        -O--CK   100   100   000    -    13
  5 Reallocated_Sector_Ct   PO--CK   100   100   005    -    4 (0 4)
  7 Seek_Error_Rate         POSR-K   100   100   067    -    0
  8 Seek_Time_Performance   P-S--K   140   100   020    -    26
  9 Power_On_Hours          -O--CK   100   100   000    -    2771
 10 Spin_Retry_Count        PO--CK   100   100   060    -    0
 12 Power_Cycle_Count       -O--CK   100   100   000    -    13
180 Unknown_HDD_Attribute   PO-R-K   100   100   098    -    0
183 Runtime_Bad_Block       -O--CK   100   100   000    -    0
185 Unknown_Attribute       -O--CK   099   099   000    -    102366
187 Reported_Uncorrect      -O--CK   100   100   000    -    0
188 Command_Timeout         -O--CK   100   100   000    -    0
189 High_Fly_Writes         -O-RCK   100   100   000    -    0
190 Airflow_Temperature_Cel -O---K   070   061   000    -    30 (Min/Max 28/36)
192 Power-Off_Retract_Count -O--CK   100   100   000    -    124
193 Load_Cycle_Count        -O--CK   100   100   000    -    124
194 Temperature_Celsius     -O---K   200   166   000    -    30 (Min/Max 20/39)
196 Reallocated_Event_Count PO--CK   100   100   000    -    4
197 Current_Pending_Sector  -O--CK   100   100   000    -    0
198 Offline_Uncorrectable   ----CK   100   100   000    -    0
199 UDMA_CRC_Error_Count    -O--CK   200   200   000    -    0
                            ||||||_ K auto-keep
                            |||||__ C event count
                            ||||___ R error rate
                            |||____ S speed/performance
                            ||_____ O updated online
                            |______ P prefailure warning

General Purpose Log Directory Version 1
SMART           Log Directory Version 1 [multi-sector log support]
Address    Access  R/W   Size  Description
0x00       GPL,SL  R/O      1  Log Directory
0x01           SL  R/O      1  Summary SMART error log
0x02           SL  R/O      1  Comprehensive SMART error log
0x03       GPL     R/O      1  Ext. Comprehensive SMART error log
0x04       GPL,SL  R/O      7  Device Statistics log
0x06           SL  R/O      1  SMART self-test log
0x07       GPL     R/O      1  Extended self-test log
0x08       GPL     R/O      2  Power Conditions log
0x09           SL  R/W      1  Selective self-test log
0x10       GPL     R/O      1  SATA NCQ Queued Error log
0x11       GPL     R/O      1  SATA Phy Event Counters log
0x80-0x9f  GPL,SL  R/W     16  Host vendor specific log
0xb6       GPL     VS     127  Device vendor specific log
0xe0       GPL,SL  R/W      1  SCT Command/Status
0xe1       GPL,SL  R/W      1  SCT Data Transfer

SMART Extended Comprehensive Error Log Version: 1 (1 sectors)
Device Error Count: 35 (device log contains only the most recent 4 errors)
	CR     = Command Register
	FEATR  = Features Register
	COUNT  = Count (was: Sector Count) Register
	LBA_48 = Upper bytes of LBA High/Mid/Low Registers ]  ATA-8
	LH     = LBA High (was: Cylinder High) Register    ]   LBA
	LM     = LBA Mid (was: Cylinder Low) Register      ] Register
	LL     = LBA Low (was: Sector Number) Register     ]
	DV     = Device (was: Device/Head) Register
	DC     = Device Control Register
	ER     = Error register
	ST     = Status register
Powered_Up_Time is measured from power on, and printed as
DDd+hh:mm:SS.sss where DD=days, hh=hours, mm=minutes,
SS=sec, and sss=millisec. It "wraps" after 49.710 days.

Error 35 [2] occurred at disk power-on lifetime: 2696 hours (112 days + 8 hours)
  When the command that caused the error occurred, the device was active or idle.

  After command completion occurred, registers were:
  ER -- ST COUNT  LBA_48  LH LM LL DV DC
  -- -- -- == -- == == == -- -- -- -- --
  04 -- 51 00 00 00 00 00 00 00 00 00 00  Error: ABRT

  Commands leading to the command that caused the error were:
  CR FEATR COUNT  LBA_48  LH LM LL DV DC  Powered_Up_Time  Command/Feature_Name
  -- == -- == -- == == == -- -- -- -- --  ---------------  --------------------
  ef 00 90 00 03 00 00 00 00 00 00 00 00  4d+10:23:49.054  SET FEATURES [Disable SATA feature]
  ef 00 03 00 45 00 00 00 00 00 00 00 00  4d+10:23:49.054  SET FEATURES [Set transfer mode]
  c6 00 00 00 10 00 00 00 00 00 00 00 00  4d+10:23:49.053  SET MULTIPLE MODE
  ef 00 03 00 0c 00 00 00 00 00 00 00 00  4d+10:23:49.052  SET FEATURES [Set transfer mode]
  ec 00 00 00 00 00 00 00 00 00 00 00 00  4d+10:23:49.050  IDENTIFY DEVICE

Error 34 [1] occurred at disk power-on lifetime: 2603 hours (108 days + 11 hours)
  When the command that caused the error occurred, the device was active or idle.

  After command completion occurred, registers were:
  ER -- ST COUNT  LBA_48  LH LM LL DV DC
  -- -- -- == -- == == == -- -- -- -- --
  04 -- 51 00 00 00 00 00 00 00 00 00 00  Error: ABRT

  Commands leading to the command that caused the error were:
  CR FEATR COUNT  LBA_48  LH LM LL DV DC  Powered_Up_Time  Command/Feature_Name
  -- == -- == -- == == == -- -- -- -- --  ---------------  --------------------
  ef 00 90 00 03 00 00 00 00 00 00 00 00     13:47:37.093  SET FEATURES [Disable SATA feature]
  ef 00 03 00 45 00 00 00 00 00 00 00 00     13:47:37.092  SET FEATURES [Set transfer mode]
  c6 00 00 00 10 00 00 00 00 00 00 00 00     13:47:37.092  SET MULTIPLE MODE
  ef 00 03 00 0c 00 00 00 00 00 00 00 00     13:47:37.091  SET FEATURES [Set transfer mode]
  ec 00 00 00 00 00 00 00 00 00 00 00 00     13:47:37.089  IDENTIFY DEVICE

Error 33 [0] occurred at disk power-on lifetime: 2572 hours (107 days + 4 hours)
  When the command that caused the error occurred, the device was active or idle.

  After command completion occurred, registers were:
  ER -- ST COUNT  LBA_48  LH LM LL DV DC
  -- -- -- == -- == == == -- -- -- -- --
  04 -- 51 00 00 00 00 00 00 00 00 00 00  Error: ABRT

  Commands leading to the command that caused the error were:
  CR FEATR COUNT  LBA_48  LH LM LL DV DC  Powered_Up_Time  Command/Feature_Name
  -- == -- == -- == == == -- -- -- -- --  ---------------  --------------------
  ef 00 90 00 03 00 00 00 00 00 00 00 00  5d+11:50:20.052  SET FEATURES [Disable SATA feature]
  ef 00 03 00 45 00 00 00 00 00 00 00 00  5d+11:50:20.052  SET FEATURES [Set transfer mode]
  c6 00 00 00 10 00 00 00 00 00 00 00 00  5d+11:50:20.051  SET MULTIPLE MODE
  ef 00 03 00 0c 00 00 00 00 00 00 00 00  5d+11:50:20.051  SET FEATURES [Set transfer mode]
  ec 00 00 00 00 00 00 00 00 00 00 00 00  5d+11:50:20.048  IDENTIFY DEVICE

Error 32 [3] occurred at disk power-on lifetime: 2552 hours (106 days + 8 hours)
  When the command that caused the error occurred, the device was active or idle.

  After command completion occurred, registers were:
  ER -- ST COUNT  LBA_48  LH LM LL DV DC
  -- -- -- == -- == == == -- -- -- -- --
  04 -- 51 00 00 00 00 00 00 00 00 00 00  Error: ABRT

  Commands leading to the command that caused the error were:
  CR FEATR COUNT  LBA_48  LH LM LL DV DC  Powered_Up_Time  Command/Feature_Name
  -- == -- == -- == == == -- -- -- -- --  ---------------  --------------------
  ef 00 90 00 03 00 00 00 00 00 00 00 00  4d+15:35:14.471  SET FEATURES [Disable SATA feature]
  ef 00 03 00 45 00 00 00 00 00 00 00 00  4d+15:35:14.470  SET FEATURES [Set transfer mode]
  c6 00 00 00 10 00 00 00 00 00 00 00 00  4d+15:35:14.470  SET MULTIPLE MODE
  ef 00 03 00 0c 00 00 00 00 00 00 00 00  4d+15:35:14.469  SET FEATURES [Set transfer mode]
  ec 00 00 00 00 00 00 00 00 00 00 00 00  4d+15:35:14.467  IDENTIFY DEVICE

SMART Extended Self-test Log Version: 1 (1 sectors)
Num  Test_Description    Status                  Remaining  LifeTime(hours)  LBA_of_first_error
# 1  Short offline       Completed without error       00%      2771         -
# 2  Short offline       Completed without error       00%      2757         -
# 3  Short offline       Completed without error       00%      2733         -
# 4  Short offline       Completed without error       00%      2709         -
# 5  Short offline       Completed without error       00%      2685         -
# 6  Short offline       Completed without error       00%      2661         -
# 7  Short offline       Completed without error       00%      2637         -
# 8  Short offline       Completed without error       00%      2613         -
# 9  Short offline       Completed without error       00%      2589         -
#10  Short offline       Completed without error       00%      2565         -
#11  Short offline       Completed without error       00%      2541         -
#12  Short offline       Completed without error       00%      2517         -
#13  Short offline       Completed without error       00%      2493         -
#14  Short offline       Completed without error       00%      2469         -
#15  Short offline       Completed without error       00%      2445         -
#16  Short offline       Completed without error       00%      2421         -
#17  Short offline       Completed without error       00%      2397         -
#18  Short offline       Completed without error       00%      2379         -
#19  Short offline       Completed without error       00%      2354         -

SMART Selective self-test log data structure revision number 1
 SPAN  MIN_LBA  MAX_LBA  CURRENT_TEST_STATUS
    1        0        0  Not_testing
    2        0        0  Not_testing
    3        0        0  Not_testing
    4        0        0  Not_testing
    5        0        0  Not_testing
Selective self-test flags (0x0):
  After scanning selected spans, do NOT read-scan remainder of disk.
If Selective self-test is pending on power-up, resume after 0 minute delay.

SCT Status Version:                  3
SCT Version (vendor specific):       256 (0x0100)
SCT Support Level:                   1
Device State:                        Active (0)
Current Temperature:                    30 Celsius
Power Cycle Min/Max Temperature:     28/36 Celsius
Lifetime    Min/Max Temperature:     20/39 Celsius
Under/Over Temperature Limit Count:   0/0

SCT Temperature History Version:     2
Temperature Sampling Period:         1 minute
Temperature Logging Interval:        1 minute
Min/Max recommended Temperature:      0/60 Celsius
Min/Max Temperature Limit:           -40/70 Celsius
Temperature History Size (Index):    128 (101)

Index    Estimated Time   Temperature Celsius
 102    2016-12-08 16:50    31  ************
 ...    ..( 88 skipped).    ..  ************
  63    2016-12-08 18:19    31  ************
  64    2016-12-08 18:20    30  ***********
 ...    ..( 15 skipped).    ..  ***********
  80    2016-12-08 18:36    30  ***********
  81    2016-12-08 18:37    29  **********
  82    2016-12-08 18:38    29  **********
  83    2016-12-08 18:39    29  **********
  84    2016-12-08 18:40    30  ***********
 ...    ..( 16 skipped).    ..  ***********
 101    2016-12-08 18:57    30  ***********

SCT Error Recovery Control:
           Read:     50 (5.0 seconds)
          Write:     50 (5.0 seconds)

Device Statistics (GP Log 0x04)
Page  Offset Size        Value Flags Description
0x01  =====  =               =  ===  == General Statistics (rev 2) ==
0x01  0x008  4              13  ---  Lifetime Power-On Resets
0x01  0x018  6      3447478760  ---  Logical Sectors Written
0x01  0x020  6        28470735  ---  Number of Write Commands
0x01  0x028  6      2042655127  ---  Logical Sectors Read
0x01  0x030  6         8359900  ---  Number of Read Commands
0x03  =====  =               =  ===  == Rotating Media Statistics (rev 1) ==
0x03  0x008  4            2770  ---  Spindle Motor Power-on Hours
0x03  0x010  4            2770  ---  Head Flying Hours
0x03  0x018  4             124  ---  Head Load Events
0x03  0x020  4               4  ---  Number of Reallocated Logical Sectors
0x03  0x028  4               0  ---  Read Recovery Attempts
0x03  0x030  4               0  ---  Number of Mechanical Start Failures
0x04  =====  =               =  ===  == General Errors Statistics (rev 1) ==
0x04  0x008  4               0  ---  Number of Reported Uncorrectable Errors
0x04  0x010  4               0  ---  Resets Between Cmd Acceptance and Completion
0x05  =====  =               =  ===  == Temperature Statistics (rev 1) ==
0x05  0x008  1              30  ---  Current Temperature
0x05  0x010  1              30  N--  Average Short Term Temperature
0x05  0x018  1              30  N--  Average Long Term Temperature
0x05  0x020  1              39  ---  Highest Temperature
0x05  0x028  1              20  ---  Lowest Temperature
0x05  0x030  1              34  N--  Highest Average Short Term Temperature
0x05  0x038  1              25  N--  Lowest Average Short Term Temperature
0x05  0x040  1              33  N--  Highest Average Long Term Temperature
0x05  0x048  1              25  N--  Lowest Average Long Term Temperature
0x05  0x050  4               0  ---  Time in Over-Temperature
0x05  0x058  1              60  ---  Specified Maximum Operating Temperature
0x05  0x060  4               0  ---  Time in Under-Temperature
0x05  0x068  1               0  ---  Specified Minimum Operating Temperature
0x06  =====  =               =  ===  == Transport Statistics (rev 1) ==
0x06  0x008  4              84  ---  Number of Hardware Resets
0x06  0x010  4              82  ---  Number of ASR Events
0x06  0x018  4               0  ---  Number of Interface CRC Errors
                                |||_ C monitored condition met
                                ||__ D supports DSN
                                |___ N normalized value

SATA Phy Event Counters (GP Log 0x11)
ID      Size     Value  Description
0x0001  2            0  Command failed due to ICRC error
0x0002  2            0  R_ERR response for data FIS
0x0003  2            0  R_ERR response for device-to-host data FIS
0x0004  2            0  R_ERR response for host-to-device data FIS
0x0005  2            0  R_ERR response for non-data FIS
0x0006  2            0  R_ERR response for device-to-host non-data FIS
0x0007  2            0  R_ERR response for host-to-device non-data FIS
0x0009  2           21  Transition from drive PhyRdy to drive PhyNRdy
0x000a  2           20  Device-to-host register FISes sent due to a COMRESET
0x000b  2            0  CRC errors within host-to-device FIS
0x000d  2            0  Non-CRC errors within host-to-device FIS

