smartctl 6.5 2016-05-07 r4318 [x86_64-linux-4.4.0-137-generic] (local build)
Copyright (C) 2002-16, Bruce Allen, Christian Franke, www.smartmontools.org

=== START OF INFORMATION SECTION ===
Device Model:     WDC WD121KRYZ-01W0RB0
Firmware Version: 01.01H01
User Capacity:    12,000,138,625,024 bytes [12.0 TB]
Sector Sizes:     512 bytes logical, 4096 bytes physical
Rotation Rate:    7200 rpm
Form Factor:      3.5 inches
Device is:        Not in smartctl database [for details use: -P showall]
ATA Version is:   ACS-2, ATA8-ACS T13/1699-D revision 4
SATA Version is:  SATA 3.2, 6.0 Gb/s (current: 3.0 Gb/s)
Local Time is:    Mon Oct 22 18:12:10 2018 CDT
SMART support is: Available - device has SMART capability.
SMART support is: Enabled
AAM feature is:   Unavailable
APM level is:     254 (maximum performance)
Rd look-ahead is: Enabled
Write cache is:   Enabled
ATA Security is:  Disabled, NOT FROZEN [SEC1]
Wt Cache Reorder: Enabled

=== START OF READ SMART DATA SECTION ===
SMART overall-health self-assessment test result: PASSED

General SMART Values:
Offline data collection status:  (0x80)	Offline data collection activity
					was never started.
					Auto Offline Data Collection: Enabled.
Self-test execution status:      (   0)	The previous self-test routine completed
					without error or no self-test has ever 
					been run.
Total time to complete Offline 
data collection: 		(   87) seconds.
Offline data collection
capabilities: 			 (0x5b) SMART execute Offline immediate.
					Auto Offline data collection on/off support.
					Suspend Offline collection upon new
					command.
					Offline surface scan supported.
					Self-test supported.
					No Conveyance Self-test supported.
					Selective Self-test supported.
SMART capabilities:            (0x0003)	Saves SMART data before entering
					power-saving mode.
					Supports SMART auto save timer.
Error logging capability:        (0x01)	Error logging supported.
					General Purpose Logging supported.
Short self-test routine 
recommended polling time: 	 (   2) minutes.
Extended self-test routine
recommended polling time: 	 (1326) minutes.
SCT capabilities: 	       (0x003d)	SCT Status supported.
					SCT Error Recovery Control supported.
					SCT Feature Control supported.
					SCT Data Table supported.

SMART Attributes Data Structure revision number: 16
Vendor Specific SMART Attributes with Thresholds:
ID# ATTRIBUTE_NAME          FLAGS    VALUE WORST THRESH FAIL RAW_VALUE
  1 Raw_Read_Error_Rate     PO-R--   100   100   016    -    0
  2 Throughput_Performance  P-S---   100   100   054    -    0
  3 Spin_Up_Time            POS---   100   100   024    -    0
  4 Start_Stop_Count        -O--C-   100   100   000    -    1
  5 Reallocated_Sector_Ct   PO--CK   100   100   005    -    0
  7 Seek_Error_Rate         PO-R--   100   100   067    -    0
  8 Seek_Time_Performance   P-S---   100   100   020    -    0
  9 Power_On_Hours          -O--C-   100   100   000    -    1
 10 Spin_Retry_Count        PO--C-   100   100   060    -    0
 12 Power_Cycle_Count       -O--CK   100   100   000    -    1
 22 Unknown_Attribute       PO---K   100   100   025    -    100
192 Power-Off_Retract_Count -O--CK   100   100   000    -    1
193 Load_Cycle_Count        -O--C-   100   100   000    -    1
194 Temperature_Celsius     -O----   120   120   000    -    50 (Min/Max 24/50)
196 Reallocated_Event_Count -O--CK   100   100   000    -    0
197 Current_Pending_Sector  -O---K   100   100   000    -    0
198 Offline_Uncorrectable   ---R--   100   100   000    -    0
199 UDMA_CRC_Error_Count    -O-R--   200   200   000    -    0
                            ||||||_ K auto-keep
                            |||||__ C event count
                            ||||___ R error rate
                            |||____ S speed/performance
                            ||_____ O updated online
                            |______ P prefailure warning

General Purpose Log Directory Version 1
SMART           Log Directory Version 1 [multi-sector log support]
Address    Access  R/W   Size  Description
0x00       GPL,SL  R/O      1  Log Directory
0x01           SL  R/O      1  Summary SMART error log
0x02           SL  R/O      1  Comprehensive SMART error log
0x03       GPL     R/O      1  Ext. Comprehensive SMART error log
0x04       GPL     R/O    256  Device Statistics log
0x04       SL      R/O    255  Device Statistics log
0x06           SL  R/O      1  SMART self-test log
0x07       GPL     R/O      1  Extended self-test log
0x08       GPL     R/O      2  Power Conditions log
0x09           SL  R/W      1  Selective self-test log
0x0c       GPL     R/O   5501  Pending Defects log
0x10       GPL     R/O      1  SATA NCQ Queued Error log
0x11       GPL     R/O      1  SATA Phy Event Counters log
0x12       GPL     R/O      1  SATA NCQ NON-DATA log
0x13       GPL     R/O      1  SATA NCQ Send and Receive log
0x15       GPL     R/W      1  SATA Rebuild Assist log
0x21       GPL     R/O      1  Write stream error log
0x22       GPL     R/O      1  Read stream error log
0x24       GPL     R/O    256  Current Device Internal Status Data log
0x25       GPL     R/O    256  Saved Device Internal Status Data log
0x30       GPL,SL  R/O      9  IDENTIFY DEVICE data log
0x80-0x9f  GPL,SL  R/W     16  Host vendor specific log
0xe0       GPL,SL  R/W      1  SCT Command/Status
0xe1       GPL,SL  R/W      1  SCT Data Transfer

SMART Extended Comprehensive Error Log Version: 1 (1 sectors)
No Errors Logged

SMART Extended Self-test Log Version: 1 (1 sectors)
Num  Test_Description    Status                  Remaining  LifeTime(hours)  LBA_of_first_error
# 1  Short offline       Completed without error       00%         1         -

SMART Selective self-test log data structure revision number 1
 SPAN  MIN_LBA  MAX_LBA  CURRENT_TEST_STATUS
    1        0        0  Not_testing
    2        0        0  Not_testing
    3        0        0  Not_testing
    4        0        0  Not_testing
    5        0        0  Not_testing
Selective self-test flags (0x0):
  After scanning selected spans, do NOT read-scan remainder of disk.
If Selective self-test is pending on power-up, resume after 0 minute delay.

SCT Status Version:                  3
SCT Version (vendor specific):       256 (0x0100)
SCT Support Level:                   0
Device State:                        Active (0)
Current Temperature:                    50 Celsius
Power Cycle Min/Max Temperature:     24/50 Celsius
Lifetime    Min/Max Temperature:     24/50 Celsius
Under/Over Temperature Limit Count:   0/0

SCT Temperature History Version:     2
Temperature Sampling Period:         1 minute
Temperature Logging Interval:        1 minute
Min/Max recommended Temperature:      0/60 Celsius
Min/Max Temperature Limit:           -40/70 Celsius
Temperature History Size (Index):    128 (66)

Index    Estimated Time   Temperature Celsius
  67    2018-10-22 16:05     0  -
 ...    ..( 59 skipped).    ..  -
 127    2018-10-22 17:05     0  -
   0    2018-10-22 17:06    25  ******
   1    2018-10-22 17:07    25  ******
   2    2018-10-22 17:08    26  *******
   3    2018-10-22 17:09    27  ********
   4    2018-10-22 17:10    27  ********
   5    2018-10-22 17:11    28  *********
   6    2018-10-22 17:12    29  **********
   7    2018-10-22 17:13    29  **********
   8    2018-10-22 17:14    30  ***********
   9    2018-10-22 17:15    30  ***********
  10    2018-10-22 17:16    31  ************
  11    2018-10-22 17:17    31  ************
  12    2018-10-22 17:18    32  *************
  13    2018-10-22 17:19    32  *************
  14    2018-10-22 17:20    33  **************
  15    2018-10-22 17:21    33  **************
  16    2018-10-22 17:22    33  **************
  17    2018-10-22 17:23    34  ***************
  18    2018-10-22 17:24    34  ***************
  19    2018-10-22 17:25    35  ****************
  20    2018-10-22 17:26    35  ****************
  21    2018-10-22 17:27    35  ****************
  22    2018-10-22 17:28    36  *****************
  23    2018-10-22 17:29    36  *****************
  24    2018-10-22 17:30    36  *****************
  25    2018-10-22 17:31    37  ******************
  26    2018-10-22 17:32    37  ******************
  27    2018-10-22 17:33    37  ******************
  28    2018-10-22 17:34    38  *******************
  29    2018-10-22 17:35    38  *******************
  30    2018-10-22 17:36    38  *******************
  31    2018-10-22 17:37    39  ********************
  32    2018-10-22 17:38    39  ********************
  33    2018-10-22 17:39    39  ********************
  34    2018-10-22 17:40    40  *********************
 ...    ..(  2 skipped).    ..  *********************
  37    2018-10-22 17:43    40  *********************
  38    2018-10-22 17:44    41  **********************
 ...    ..(  2 skipped).    ..  **********************
  41    2018-10-22 17:47    41  **********************
  42    2018-10-22 17:48    42  ***********************
  43    2018-10-22 17:49    42  ***********************
  44    2018-10-22 17:50    42  ***********************
  45    2018-10-22 17:51    43  ************************
  46    2018-10-22 17:52    43  ************************
  47    2018-10-22 17:53    43  ************************
  48    2018-10-22 17:54    44  *************************
  49    2018-10-22 17:55    44  *************************
  50    2018-10-22 17:56    45  **************************
  51    2018-10-22 17:57    45  **************************
  52    2018-10-22 17:58    46  ***************************
  53    2018-10-22 17:59    46  ***************************
  54    2018-10-22 18:00    46  ***************************
  55    2018-10-22 18:01    47  ****************************
 ...    ..(  2 skipped).    ..  ****************************
  58    2018-10-22 18:04    47  ****************************
  59    2018-10-22 18:05    48  *****************************
  60    2018-10-22 18:06    48  *****************************
  61    2018-10-22 18:07    48  *****************************
  62    2018-10-22 18:08    49  ******************************
 ...    ..(  2 skipped).    ..  ******************************
  65    2018-10-22 18:11    49  ******************************
  66    2018-10-22 18:12     0  -

SCT Error Recovery Control:
           Read: Disabled
          Write: Disabled

Device Statistics (GP/SMART Log 0x04) not supported

SATA Phy Event Counters (GP Log 0x11)
ID      Size     Value  Description
0x0001  2            0  Command failed due to ICRC error
0x0002  2            0  R_ERR response for data FIS
0x0003  2            0  R_ERR response for device-to-host data FIS
0x0004  2            0  R_ERR response for host-to-device data FIS
0x0005  2            0  R_ERR response for non-data FIS
0x0006  2            0  R_ERR response for device-to-host non-data FIS
0x0007  2            0  R_ERR response for host-to-device non-data FIS
0x0008  2            0  Device-to-host non-data FIS retries
0x0009  2            1  Transition from drive PhyRdy to drive PhyNRdy
0x000a  2            1  Device-to-host register FISes sent due to a COMRESET
0x000b  2            0  CRC errors within host-to-device FIS
0x000d  2            0  Non-CRC errors within host-to-device FIS

