smartctl 5.40 2010-07-12 r3124 [x86_64-unknown-linux-gnu] (local build)
Copyright (C) 2002-10 by Bruce Allen, http://smartmontools.sourceforge.net

=== START OF INFORMATION SECTION ===
Device Model:     ST1000NM0008-2F2100
Firmware Version: SN01
User Capacity:    1,000,204,886,016 bytes
Device is:        Not in smartctl database [for details use: -P showall]
ATA Version is:   10
ATA Standard is:  Not recognized. Minor revision code: 0x006d
Local Time is:    Thu Sep  6 01:04:24 2018 EDT
SMART support is: Available - device has SMART capability.
SMART support is: Enabled

=== START OF READ SMART DATA SECTION ===
SMART overall-health self-assessment test result: PASSED

General SMART Values:
Offline data collection status:  (0x82)	Offline data collection activity
					was completed without error.
					Auto Offline Data Collection: Enabled.
Self-test execution status:      (   0)	The previous self-test routine completed
					without error or no self-test has ever 
					been run.
Total time to complete Offline 
data collection: 		 ( 575) seconds.
Offline data collection
capabilities: 			 (0x7b) SMART execute Offline immediate.
					Auto Offline data collection on/off support.
					Suspend Offline collection upon new
					command.
					Offline surface scan supported.
					Self-test supported.
					Conveyance Self-test supported.
					Selective Self-test supported.
SMART capabilities:            (0x0003)	Saves SMART data before entering
					power-saving mode.
					Supports SMART auto save timer.
Error logging capability:        (0x01)	Error logging supported.
					General Purpose Logging supported.
Short self-test routine 
recommended polling time: 	 (   1) minutes.
Extended self-test routine
recommended polling time: 	 ( 110) minutes.
Conveyance self-test routine
recommended polling time: 	 (   2) minutes.
SCT capabilities: 	       (0x50bd)	SCT Status supported.
					SCT Error Recovery Control supported.
					SCT Feature Control supported.
					SCT Data Table supported.

SMART Attributes Data Structure revision number: 10
Vendor Specific SMART Attributes with Thresholds:
ID# ATTRIBUTE_NAME          FLAG     VALUE WORST THRESH TYPE      UPDATED  WHEN_FAILED RAW_VALUE
  1 Raw_Read_Error_Rate     0x000f   100   100   044    Pre-fail  Always       -       269443
  3 Spin_Up_Time            0x0003   099   099   000    Pre-fail  Always       -       0
  4 Start_Stop_Count        0x0032   100   100   020    Old_age   Always       -       4
  5 Reallocated_Sector_Ct   0x0033   100   100   010    Pre-fail  Always       -       0
  7 Seek_Error_Rate         0x000f   100   253   045    Pre-fail  Always       -       36004
  9 Power_On_Hours          0x0032   100   100   000    Old_age   Always       -       276132037394433
 10 Spin_Retry_Count        0x0013   100   100   097    Pre-fail  Always       -       0
 12 Power_Cycle_Count       0x0032   100   100   020    Old_age   Always       -       4
184 End-to-End_Error        0x0032   100   100   099    Old_age   Always       -       0
187 Reported_Uncorrect      0x0032   100   100   000    Old_age   Always       -       0
188 Command_Timeout         0x0032   100   253   000    Old_age   Always       -       0
189 High_Fly_Writes         0x003a   100   100   000    Old_age   Always       -       0
190 Airflow_Temperature_Cel 0x0022   075   074   040    Old_age   Always       -       25 (Lifetime Min/Max 24/25)
191 G-Sense_Error_Rate      0x0032   100   100   000    Old_age   Always       -       0
192 Power-Off_Retract_Count 0x0032   100   100   000    Old_age   Always       -       1
193 Load_Cycle_Count        0x0032   100   100   000    Old_age   Always       -       14
194 Temperature_Celsius     0x0022   025   040   000    Old_age   Always       -       25 (0 24 0 0)
195 Hardware_ECC_Recovered  0x001a   100   100   000    Old_age   Always       -       269443
197 Current_Pending_Sector  0x0012   100   100   000    Old_age   Always       -       0
198 Offline_Uncorrectable   0x0010   100   100   000    Old_age   Offline      -       0
199 UDMA_CRC_Error_Count    0x003e   200   200   000    Old_age   Always       -       0
240 Head_Flying_Hours       0x0000   100   253   000    Old_age   Offline      -       40020505264128
241 Total_LBAs_Written      0x0000   100   253   000    Old_age   Offline      -       80
242 Total_LBAs_Read         0x0000   100   253   000    Old_age   Offline      -       269363

General Purpose Logging (GPL) feature set supported
General Purpose Log Directory Version 1
SMART           Log Directory Version 1 [multi-sector log support]
GP/S  Log at address 0x00 has    1 sectors [Log Directory]
SMART Log at address 0x01 has    1 sectors [Summary SMART error log]
SMART Log at address 0x02 has    5 sectors [Comprehensive SMART error log]
GP    Log at address 0x03 has    5 sectors [Ext. Comprehensive SMART error log]
GP/S  Log at address 0x04 has    8 sectors [Device Statistics]
SMART Log at address 0x06 has    1 sectors [SMART self-test log]
GP    Log at address 0x07 has    1 sectors [Extended self-test log]
GP    Log at address 0x08 has    2 sectors [Reserved]
SMART Log at address 0x09 has    1 sectors [Selective self-test log]
GP    Log at address 0x0c has 2048 sectors [Reserved]
GP    Log at address 0x10 has    1 sectors [NCQ Command Error]
GP    Log at address 0x11 has    1 sectors [SATA Phy Event Counters]
GP    Log at address 0x13 has    1 sectors [Reserved for Serial ATA]
GP    Log at address 0x15 has    1 sectors [Reserved for Serial ATA]
GP    Log at address 0x21 has    1 sectors [Write stream error log]
GP    Log at address 0x22 has    1 sectors [Read stream error log]
GP    Log at address 0x24 has  512 sectors [Reserved]
GP/S  Log at address 0x30 has    9 sectors [Reserved]
GP/S  Log at address 0x80 has   16 sectors [Host vendor specific log]
GP/S  Log at address 0x81 has   16 sectors [Host vendor specific log]
GP/S  Log at address 0x82 has   16 sectors [Host vendor specific log]
GP/S  Log at address 0x83 has   16 sectors [Host vendor specific log]
GP/S  Log at address 0x84 has   16 sectors [Host vendor specific log]
GP/S  Log at address 0x85 has   16 sectors [Host vendor specific log]
GP/S  Log at address 0x86 has   16 sectors [Host vendor specific log]
GP/S  Log at address 0x87 has   16 sectors [Host vendor specific log]
GP/S  Log at address 0x88 has   16 sectors [Host vendor specific log]
GP/S  Log at address 0x89 has   16 sectors [Host vendor specific log]
GP/S  Log at address 0x8a has   16 sectors [Host vendor specific log]
GP/S  Log at address 0x8b has   16 sectors [Host vendor specific log]
GP/S  Log at address 0x8c has   16 sectors [Host vendor specific log]
GP/S  Log at address 0x8d has   16 sectors [Host vendor specific log]
GP/S  Log at address 0x8e has   16 sectors [Host vendor specific log]
GP/S  Log at address 0x8f has   16 sectors [Host vendor specific log]
GP/S  Log at address 0x90 has   16 sectors [Host vendor specific log]
GP/S  Log at address 0x91 has   16 sectors [Host vendor specific log]
GP/S  Log at address 0x92 has   16 sectors [Host vendor specific log]
GP/S  Log at address 0x93 has   16 sectors [Host vendor specific log]
GP/S  Log at address 0x94 has   16 sectors [Host vendor specific log]
GP/S  Log at address 0x95 has   16 sectors [Host vendor specific log]
GP/S  Log at address 0x96 has   16 sectors [Host vendor specific log]
GP/S  Log at address 0x97 has   16 sectors [Host vendor specific log]
GP/S  Log at address 0x98 has   16 sectors [Host vendor specific log]
GP/S  Log at address 0x99 has   16 sectors [Host vendor specific log]
GP/S  Log at address 0x9a has   16 sectors [Host vendor specific log]
GP/S  Log at address 0x9b has   16 sectors [Host vendor specific log]
GP/S  Log at address 0x9c has   16 sectors [Host vendor specific log]
GP/S  Log at address 0x9d has   16 sectors [Host vendor specific log]
GP/S  Log at address 0x9e has   16 sectors [Host vendor specific log]
GP/S  Log at address 0x9f has   16 sectors [Host vendor specific log]
GP/S  Log at address 0xa1 has   20 sectors [Device vendor specific log]
GP    Log at address 0xa2 has 4120 sectors [Device vendor specific log]
GP    Log at address 0xa6 has  192 sectors [Device vendor specific log]
GP/S  Log at address 0xa8 has  136 sectors [Device vendor specific log]
GP/S  Log at address 0xa9 has  136 sectors [Device vendor specific log]
GP    Log at address 0xbe has 65535 sectors [Device vendor specific log]
GP    Log at address 0xbf has 65535 sectors [Device vendor specific log]
GP/S  Log at address 0xc1 has   10 sectors [Device vendor specific log]
GP/S  Log at address 0xc3 has    8 sectors [Device vendor specific log]
GP    Log at address 0xd1 has   41 sectors [Device vendor specific log]
GP/S  Log at address 0xda has    1 sectors [Device vendor specific log]
GP/S  Log at address 0xe0 has    1 sectors [SCT Command/Status]
GP/S  Log at address 0xe1 has    1 sectors [SCT Data Transfer]

SMART Extended Comprehensive Error Log Version: 1 (5 sectors)
No Errors Logged

SMART Extended Self-test Log Version: 1 (1 sectors)
Num  Test_Description    Status                  Remaining  LifeTime(hours)  LBA_of_first_error
# 1  Short offline       Completed without error       00%         1         -
# 2  Extended offline    Interrupted (host reset)      00%         0         -

SMART Selective self-test log data structure revision number 1
 SPAN  MIN_LBA  MAX_LBA  CURRENT_TEST_STATUS
    1        0        0  Not_testing
    2        0        0  Not_testing
    3        0        0  Not_testing
    4        0        0  Not_testing
    5        0        0  Not_testing
Selective self-test flags (0x0):
  After scanning selected spans, do NOT read-scan remainder of disk.
If Selective self-test is pending on power-up, resume after 0 minute delay.

SCT Status Version:                  3
SCT Version (vendor specific):       522 (0x020a)
SCT Support Level:                   1
Device State:                        Active (0)
Current Temperature:                    24 Celsius
Power Cycle Min/Max Temperature:     24/25 Celsius
Lifetime    Min/Max Temperature:     22/41 Celsius
Under/Over Temperature Limit Count:   0/0
SCT Temperature History Version:     2
Temperature Sampling Period:         3 minutes
Temperature Logging Interval:        59 minutes
Min/Max recommended Temperature:     10/40 Celsius
Min/Max Temperature Limit:            5/60 Celsius
Temperature History Size (Index):    128 (8)

Index    Estimated Time   Temperature Celsius
   9    2018-08-31 19:30     ?  -
 ...    ..(117 skipped).    ..  -
 127    2018-09-05 15:32     ?  -
   0    2018-09-05 16:31    41  **********************
   1    2018-09-05 17:30     ?  -
   2    2018-09-05 18:29    22  ***
   3    2018-09-05 19:28     ?  -
   4    2018-09-05 20:27    23  ****
   5    2018-09-05 21:26     ?  -
   6    2018-09-05 22:25    24  *****
   7    2018-09-05 23:24     ?  -
   8    2018-09-06 00:23    24  *****

SCT Error Recovery Control:
           Read:    100 (10.0 seconds)
          Write:    100 (10.0 seconds)

SATA Phy Event Counters (GP Log 0x11)
ID      Size     Value  Description
0x000a  2            1  Device-to-host register FISes sent due to a COMRESET
0x0001  2            0  Command failed due to ICRC error
0x0003  2            0  R_ERR response for device-to-host data FIS
0x0004  2            0  R_ERR response for host-to-device data FIS
0x0006  2            0  R_ERR response for device-to-host non-data FIS
0x0007  2            0  R_ERR response for host-to-device non-data FIS

