smartctl 6.4 2015-06-04 r4109 [x86_64-linux-4.3.3-2-ARCH] (local build)
Copyright (C) 2002-15, Bruce Allen, Christian Franke, www.smartmontools.org

=== START OF INFORMATION SECTION ===
Device Model:     Samsung SSD 850 EVO mSATA 120GB
Firmware Version: EMT41B6Q
User Capacity:    120,034,123,776 bytes [120 GB]
Sector Size:      512 bytes logical/physical
Rotation Rate:    Solid State Device
Device is:        Not in smartctl database [for details use: -P showall]
ATA Version is:   ACS-2, ATA8-ACS T13/1699-D revision 4c
SATA Version is:  SATA 3.1, 6.0 Gb/s (current: 6.0 Gb/s)
Local Time is:    Sun Jan 17 00:34:36 2016 UTC
SMART support is: Available - device has SMART capability.
SMART support is: Enabled
AAM feature is:   Unavailable
APM feature is:   Unavailable
Rd look-ahead is: Enabled
Write cache is:   Enabled
ATA Security is:  Disabled, frozen [SEC2]
Wt Cache Reorder: Enabled

=== START OF READ SMART DATA SECTION ===
SMART overall-health self-assessment test result: PASSED

General SMART Values:
Offline data collection status:  (0x00)	Offline data collection activity
					was never started.
					Auto Offline Data Collection: Disabled.
Self-test execution status:      (   0)	The previous self-test routine completed
					without error or no self-test has ever 
					been run.
Total time to complete Offline 
data collection: 		(    0) seconds.
Offline data collection
capabilities: 			 (0x53) SMART execute Offline immediate.
					Auto Offline data collection on/off support.
					Suspend Offline collection upon new
					command.
					No Offline surface scan supported.
					Self-test supported.
					No Conveyance Self-test supported.
					Selective Self-test supported.
SMART capabilities:            (0x0003)	Saves SMART data before entering
					power-saving mode.
					Supports SMART auto save timer.
Error logging capability:        (0x01)	Error logging supported.
					General Purpose Logging supported.
Short self-test routine 
recommended polling time: 	 (   2) minutes.
Extended self-test routine
recommended polling time: 	 (  64) minutes.
SCT capabilities: 	       (0x003d)	SCT Status supported.
					SCT Error Recovery Control supported.
					SCT Feature Control supported.
					SCT Data Table supported.

SMART Attributes Data Structure revision number: 1
Vendor Specific SMART Attributes with Thresholds:
ID# ATTRIBUTE_NAME          FLAGS    VALUE WORST THRESH FAIL RAW_VALUE
  5 Reallocated_Sector_Ct   PO--CK   100   100   010    -    0
  9 Power_On_Hours          -O--CK   099   099   000    -    99
 12 Power_Cycle_Count       -O--CK   099   099   000    -    2
177 Wear_Leveling_Count     PO--C-   100   100   000    -    0
179 Used_Rsvd_Blk_Cnt_Tot   PO--C-   100   100   010    -    0
181 Program_Fail_Cnt_Total  -O--CK   100   100   010    -    0
182 Erase_Fail_Count_Total  -O--CK   100   100   010    -    0
183 Runtime_Bad_Block       PO--C-   100   100   010    -    0
187 Reported_Uncorrect      -O--CK   100   100   000    -    0
190 Airflow_Temperature_Cel -O--CK   043   031   000    -    57
195 Hardware_ECC_Recovered  -O-RC-   200   200   000    -    0
199 UDMA_CRC_Error_Count    -OSRCK   100   100   000    -    0
235 Unknown_Attribute       -O--C-   100   100   000    -    0
241 Total_LBAs_Written      -O--CK   099   099   000    -    17903403
                            ||||||_ K auto-keep
                            |||||__ C event count
                            ||||___ R error rate
                            |||____ S speed/performance
                            ||_____ O updated online
                            |______ P prefailure warning

General Purpose Log Directory Version 1
SMART           Log Directory Version 1 [multi-sector log support]
Address    Access  R/W   Size  Description
0x00       GPL,SL  R/O      1  Log Directory
0x01           SL  R/O      1  Summary SMART error log
0x02           SL  R/O      1  Comprehensive SMART error log
0x03       GPL     R/O      1  Ext. Comprehensive SMART error log
0x06           SL  R/O      1  SMART self-test log
0x07       GPL     R/O      1  Extended self-test log
0x09           SL  R/W      1  Selective self-test log
0x10       GPL     R/O      1  SATA NCQ Queued Error log
0x11       GPL     R/O      1  SATA Phy Event Counters log
0x13       GPL     R/O      1  SATA NCQ Send and Receive log
0x30       GPL,SL  R/O      9  IDENTIFY DEVICE data log
0x80-0x9f  GPL,SL  R/W     16  Host vendor specific log
0xa1           SL  VS      16  Device vendor specific log
0xa5           SL  VS      16  Device vendor specific log
0xce           SL  VS      16  Device vendor specific log
0xe0       GPL,SL  R/W      1  SCT Command/Status
0xe1       GPL,SL  R/W      1  SCT Data Transfer

SMART Extended Comprehensive Error Log Version: 1 (1 sectors)
No Errors Logged

SMART Extended Self-test Log Version: 1 (1 sectors)
No self-tests have been logged.  [To run self-tests, use: smartctl -t]

Warning! SMART Selective Self-Test Log Structure error: invalid SMART checksum.
SMART Selective self-test log data structure revision number 1
 SPAN  MIN_LBA  MAX_LBA  CURRENT_TEST_STATUS
    1        0        0  Not_testing
    2        0        0  Not_testing
    3        0        0  Not_testing
    4        0        0  Not_testing
    5        0        0  Not_testing
  255        0    65535  Read_scanning was never started
Selective self-test flags (0x0):
  After scanning selected spans, do NOT read-scan remainder of disk.
If Selective self-test is pending on power-up, resume after 0 minute delay.

SCT Status Version:                  3
SCT Version (vendor specific):       256 (0x0100)
SCT Support Level:                   1
Device State:                        SCT command executing in background (5)
Current Temperature:                    54 Celsius
Power Cycle Min/Max Temperature:     40/69 Celsius
Lifetime    Min/Max Temperature:      0/70 Celsius
Under/Over Temperature Limit Count:   8/0

SCT Temperature History Version:     3 (Unknown, should be 2)
Temperature Sampling Period:         1 minute
Temperature Logging Interval:        10 minutes
Min/Max recommended Temperature:      0/70 Celsius
Min/Max Temperature Limit:            0/70 Celsius
Temperature History Size (Index):    128 (94)

Index    Estimated Time   Temperature Celsius
  95    2016-01-16 03:20    62  ***************************************+
 ...    ..( 37 skipped).    ..  ***************************************+
   5    2016-01-16 09:40    62  ***************************************+
   6    2016-01-16 09:50    61  ***************************************+
   7    2016-01-16 10:00    60  ***************************************+
   8    2016-01-16 10:10    60  ***************************************+
   9    2016-01-16 10:20    59  ****************************************
  10    2016-01-16 10:30    59  ****************************************
  11    2016-01-16 10:40    59  ****************************************
  12    2016-01-16 10:50    58  ***************************************
 ...    ..(  4 skipped).    ..  ***************************************
  17    2016-01-16 11:40    58  ***************************************
  18    2016-01-16 11:50    57  **************************************
 ...    ..(  8 skipped).    ..  **************************************
  27    2016-01-16 13:20    57  **************************************
  28    2016-01-16 13:30    56  *************************************
 ...    ..( 13 skipped).    ..  *************************************
  42    2016-01-16 15:50    56  *************************************
  43    2016-01-16 16:00    57  **************************************
  44    2016-01-16 16:10    58  ***************************************
  45    2016-01-16 16:20    58  ***************************************
  46    2016-01-16 16:30    58  ***************************************
  47    2016-01-16 16:40    57  **************************************
 ...    ..(  2 skipped).    ..  **************************************
  50    2016-01-16 17:10    57  **************************************
  51    2016-01-16 17:20    58  ***************************************
  52    2016-01-16 17:30    58  ***************************************
  53    2016-01-16 17:40    58  ***************************************
  54    2016-01-16 17:50    59  ****************************************
  55    2016-01-16 18:00    60  ***************************************+
  56    2016-01-16 18:10    59  ****************************************
  57    2016-01-16 18:20    58  ***************************************
  58    2016-01-16 18:30    59  ****************************************
  59    2016-01-16 18:40    60  ***************************************+
  60    2016-01-16 18:50    59  ****************************************
 ...    ..(  2 skipped).    ..  ****************************************
  63    2016-01-16 19:20    59  ****************************************
  64    2016-01-16 19:30    60  ***************************************+
  65    2016-01-16 19:40    61  ***************************************+
 ...    ..(  2 skipped).    ..  ***************************************+
  68    2016-01-16 20:10    61  ***************************************+
  69    2016-01-16 20:20    62  ***************************************+
  70    2016-01-16 20:30    64  ***************************************+
  71    2016-01-16 20:40    64  ***************************************+
  72    2016-01-16 20:50    64  ***************************************+
  73    2016-01-16 21:00    65  ***************************************+
  74    2016-01-16 21:10    64  ***************************************+
  75    2016-01-16 21:20    63  ***************************************+
  76    2016-01-16 21:30    63  ***************************************+
  77    2016-01-16 21:40    62  ***************************************+
  78    2016-01-16 21:50    62  ***************************************+
  79    2016-01-16 22:00    62  ***************************************+
  80    2016-01-16 22:10    61  ***************************************+
  81    2016-01-16 22:20    63  ***************************************+
  82    2016-01-16 22:30    64  ***************************************+
  83    2016-01-16 22:40    64  ***************************************+
  84    2016-01-16 22:50    63  ***************************************+
  85    2016-01-16 23:00    62  ***************************************+
  86    2016-01-16 23:10    60  ***************************************+
  87    2016-01-16 23:20    59  ****************************************
 ...    ..(  4 skipped).    ..  ****************************************
  92    2016-01-17 00:10    59  ****************************************
  93    2016-01-17 00:20    50  *******************************
  94    2016-01-17 00:30    54  ***********************************

SCT Error Recovery Control:
           Read: Disabled
          Write: Disabled

Device Statistics (GP/SMART Log 0x04) not supported

SATA Phy Event Counters (GP Log 0x11)
ID      Size     Value  Description
0x0001  2            0  Command failed due to ICRC error
0x0002  2            0  R_ERR response for data FIS
0x0003  2            0  R_ERR response for device-to-host data FIS
0x0004  2            0  R_ERR response for host-to-device data FIS
0x0005  2            0  R_ERR response for non-data FIS
0x0006  2            0  R_ERR response for device-to-host non-data FIS
0x0007  2            0  R_ERR response for host-to-device non-data FIS
0x0008  2            0  Device-to-host non-data FIS retries
0x0009  2           90  Transition from drive PhyRdy to drive PhyNRdy
0x000a  2           89  Device-to-host register FISes sent due to a COMRESET
0x000b  2            0  CRC errors within host-to-device FIS
0x000d  2            0  Non-CRC errors within host-to-device FIS
0x000f  2            0  R_ERR response for host-to-device data FIS, CRC
0x0010  2            0  R_ERR response for host-to-device data FIS, non-CRC
0x0012  2            0  R_ERR response for host-to-device non-data FIS, CRC
0x0013  2            0  R_ERR response for host-to-device non-data FIS, non-CRC

