smartctl 5.41 2011-02-04 r3253 [i686-w64-mingw32-win7(64)-sp1] (cf-win32-20110204)
Copyright (C) 2002-11 by Bruce Allen, http://smartmontools.sourceforge.net

=== START OF INFORMATION SECTION ===
Model Family:     Seagate Barracuda 7200.9 family
Device Model:     ST3250824AS
Serial Number:    4ND1X24H
Firmware Version: 3.AAD
User Capacity:    250,059,350,016 bytes
Device is:        In smartctl database [for details use: -P show]
ATA Version is:   7
ATA Standard is:  Exact ATA specification draft version not indicated
Local Time is:    Sat Apr 23 14:39:32 2011 GST
SMART support is: Available - device has SMART capability.
                  Enabled status cached by OS, trying SMART RETURN STATUS cmd.
SMART support is: Enabled

=== START OF READ SMART DATA SECTION ===
SMART overall-health self-assessment test result: PASSED

General SMART Values:
Offline data collection status:  (0x82)	Offline data collection activity
					was completed without error.
					Auto Offline Data Collection: Enabled.
Self-test execution status:      (  25)	The self-test routine was aborted by
					the host.
Total time to complete Offline 
data collection: 		(  430) seconds.
Offline data collection
capabilities: 			 (0x5b) SMART execute Offline immediate.
					Auto Offline data collection on/off support.
					Suspend Offline collection upon new
					command.
					Offline surface scan supported.
					Self-test supported.
					No Conveyance Self-test supported.
					Selective Self-test supported.
SMART capabilities:            (0x0003)	Saves SMART data before entering
					power-saving mode.
					Supports SMART auto save timer.
Error logging capability:        (0x01)	Error logging supported.
					General Purpose Logging supported.
Short self-test routine 
recommended polling time: 	 (   1) minutes.
Extended self-test routine
recommended polling time: 	 ( 100) minutes.

SMART Attributes Data Structure revision number: 10
Vendor Specific SMART Attributes with Thresholds:
ID# ATTRIBUTE_NAME          FLAG     VALUE WORST THRESH TYPE      UPDATED  WHEN_FAILED RAW_VALUE
  1 Raw_Read_Error_Rate     0x000f   114   093   006    Pre-fail  Always       -       79528687
  3 Spin_Up_Time            0x0003   098   098   000    Pre-fail  Always       -       0
  4 Start_Stop_Count        0x0032   100   100   020    Old_age   Always       -       539
  5 Reallocated_Sector_Ct   0x0033   100   100   036    Pre-fail  Always       -       0
  7 Seek_Error_Rate         0x000f   078   060   030    Pre-fail  Always       -       8735248635
  9 Power_On_Hours          0x0032   096   096   000    Old_age   Always       -       4324
 10 Spin_Retry_Count        0x0013   100   100   097    Pre-fail  Always       -       0
 12 Power_Cycle_Count       0x0032   100   100   020    Old_age   Always       -       634
187 Reported_Uncorrect      0x0032   100   100   000    Old_age   Always       -       0
189 High_Fly_Writes         0x003a   100   100   000    Old_age   Always       -       0
190 Airflow_Temperature_Cel 0x0022   062   049   045    Old_age   Always       -       38 (Min/Max 25/38)
194 Temperature_Celsius     0x0022   038   051   000    Old_age   Always       -       38 (0 13 0 0)
195 Hardware_ECC_Recovered  0x001a   058   052   000    Old_age   Always       -       162820778
197 Current_Pending_Sector  0x0012   100   100   000    Old_age   Always       -       0
198 Offline_Uncorrectable   0x0010   100   100   000    Old_age   Offline      -       0
199 UDMA_CRC_Error_Count    0x003e   200   200   000    Old_age   Always       -       0
200 Multi_Zone_Error_Rate   0x0000   100   253   000    Old_age   Offline      -       0
202 Data_Address_Mark_Errs  0x0032   100   253   000    Old_age   Always       -       0

ATA_READ_LOG_EXT (addr=0x00:0x00, page=0, n=1) failed: Function not implemented
Read GP Log Directory failed.

SMART Log Directory Version 0
SMART Log at address 0x00 has    1 sectors [Log Directory]
SMART Log at address 0x08 has    1 sectors [Power Conditions]
SMART Log at address 0x09 has    1 sectors [Selective self-test log]
SMART Log at address 0x0a has    5 sectors [Reserved]
SMART Log at address 0x0b has    5 sectors [Reserved]
SMART Log at address 0x0e has    1 sectors [Reserved]
SMART Log at address 0x0f has    1 sectors [Reserved]
SMART Log at address 0x11 has    1 sectors [SATA Phy Event Counters]
SMART Log at address 0x18 has    1 sectors [Reserved]
SMART Log at address 0x19 has    1 sectors [Reserved]
SMART Log at address 0x28 has    1 sectors [Reserved]
SMART Log at address 0x29 has    1 sectors [Reserved]
SMART Log at address 0x2a has    1 sectors [Reserved]
SMART Log at address 0x2b has    1 sectors [Reserved]
SMART Log at address 0x88 has   16 sectors [Host vendor specific log]
SMART Log at address 0x89 has   16 sectors [Host vendor specific log]
SMART Log at address 0x8a has   16 sectors [Host vendor specific log]
SMART Log at address 0x8b has   16 sectors [Host vendor specific log]
SMART Log at address 0x8c has   16 sectors [Host vendor specific log]
SMART Log at address 0x8d has   16 sectors [Host vendor specific log]
SMART Log at address 0x8e has   16 sectors [Host vendor specific log]
SMART Log at address 0x8f has   16 sectors [Host vendor specific log]
SMART Log at address 0x90 has   16 sectors [Host vendor specific log]
SMART Log at address 0x91 has   16 sectors [Host vendor specific log]
SMART Log at address 0x92 has   16 sectors [Host vendor specific log]
SMART Log at address 0x93 has   16 sectors [Host vendor specific log]
SMART Log at address 0x94 has   16 sectors [Host vendor specific log]
SMART Log at address 0x95 has   16 sectors [Host vendor specific log]
SMART Log at address 0x96 has   16 sectors [Host vendor specific log]
SMART Log at address 0x97 has   16 sectors [Host vendor specific log]
SMART Log at address 0x98 has   16 sectors [Host vendor specific log]
SMART Log at address 0x99 has   16 sectors [Host vendor specific log]
SMART Log at address 0x9a has   16 sectors [Host vendor specific log]
SMART Log at address 0x9b has   16 sectors [Host vendor specific log]
SMART Log at address 0x9c has   16 sectors [Host vendor specific log]
SMART Log at address 0x9d has   16 sectors [Host vendor specific log]
SMART Log at address 0x9e has   16 sectors [Host vendor specific log]
SMART Log at address 0x9f has   16 sectors [Host vendor specific log]
SMART Log at address 0xa0 has   16 sectors [Device vendor specific log]
SMART Log at address 0xa1 has   16 sectors [Device vendor specific log]
SMART Log at address 0xa2 has   16 sectors [Device vendor specific log]
SMART Log at address 0xa3 has   16 sectors [Device vendor specific log]
SMART Log at address 0xa4 has   16 sectors [Device vendor specific log]
SMART Log at address 0xa5 has   16 sectors [Device vendor specific log]
SMART Log at address 0xa6 has   16 sectors [Device vendor specific log]
SMART Log at address 0xa7 has   16 sectors [Device vendor specific log]
SMART Log at address 0xa8 has    1 sectors [Device vendor specific log]
SMART Log at address 0xa9 has   20 sectors [Device vendor specific log]
SMART Log at address 0xaa has  101 sectors [Device vendor specific log]
SMART Log at address 0xb0 has   20 sectors [Device vendor specific log]
SMART Log at address 0xb1 has    1 sectors [Device vendor specific log]
SMART Log at address 0xe8 has    1 sectors [Reserved]
SMART Log at address 0xe9 has    1 sectors [Reserved]

SMART Extended Comprehensive Error Log (GP Log 0x03) not supported
SMART Error Log not supported
SMART Extended Self-test Log (GP Log 0x07) not supported
SMART Self-test Log not supported
Warning! SMART Selective Self-Test Log Structure error: invalid SMART checksum.
Note: selective self-test log revision number (0) not 1 implies that no selective self-test has ever been run
SMART Selective self-test log data structure revision number 0
Note: revision number not 1 implies that no selective self-test has ever been run
 SPAN  MIN_LBA          MAX_LBA  CURRENT_TEST_STATUS
    1        0  281474976710656  Not_testing
    2        0                0  Not_testing
    3        0                0  Not_testing
    4        0                0  Not_testing
    5        0                0  Not_testing
Selective self-test flags (0x0):
  After scanning selected spans, do NOT read-scan remainder of disk.
If Selective self-test is pending on power-up, resume after 0 minute delay.

Warning: device does not support SCT Commands
SATA Phy Event Counters (GP Log 0x11) not supported
