smartctl 7.3 2022-02-28 r5338 [x86_64-linux-6.1.0-17-amd64] (local build)
Copyright (C) 2002-22, Bruce Allen, Christian Franke, www.smartmontools.org

=== START OF INFORMATION SECTION ===
Device Model:     HITACHI HUS724040ALE640
Serial Number:    PAKXUH6T
LU WWN Device Id: 5 000cca 22bf76097
Firmware Version: MJAONS04
User Capacity:    4,000,787,030,016 bytes [4.00 TB]
Sector Sizes:     512 bytes logical, 4096 bytes physical
Rotation Rate:    7200 rpm
Form Factor:      3.5 inches
Device is:        Not in smartctl database 7.3/5571
ATA Version is:   ATA8-ACS T13/1699-D revision 4
SATA Version is:  SATA 3.0, 6.0 Gb/s (current: 6.0 Gb/s)
Local Time is:    Mon Jan  1 19:18:57 2024 EST
SMART support is: Available - device has SMART capability.
SMART support is: Enabled
AAM feature is:   Unavailable
APM feature is:   Disabled
Rd look-ahead is: Enabled
Write cache is:   Enabled
DSN feature is:   Unavailable
ATA Security is:  Disabled, NOT FROZEN [SEC1]
Wt Cache Reorder: Unknown

=== START OF READ SMART DATA SECTION ===
SMART Status not supported: Incomplete response, ATA output registers missing
SMART overall-health self-assessment test result: PASSED
Warning: This result is based on an Attribute check.

General SMART Values:
Offline data collection status:  (0x00)	Offline data collection activity
					was never started.
					Auto Offline Data Collection: Disabled.
Self-test execution status:      (   0)	The previous self-test routine completed
					without error or no self-test has ever 
					been run.
Total time to complete Offline 
data collection: 		(34525) seconds.
Offline data collection
capabilities: 			 (0x5b) SMART execute Offline immediate.
					Auto Offline data collection on/off support.
					Suspend Offline collection upon new
					command.
					Offline surface scan supported.
					Self-test supported.
					No Conveyance Self-test supported.
					Selective Self-test supported.
SMART capabilities:            (0x0003)	Saves SMART data before entering
					power-saving mode.
					Supports SMART auto save timer.
Error logging capability:        (0x01)	Error logging supported.
					General Purpose Logging supported.
Short self-test routine 
recommended polling time: 	 (   1) minutes.
Extended self-test routine
recommended polling time: 	 ( 576) minutes.
SCT capabilities: 	       (0x003d)	SCT Status supported.
					SCT Error Recovery Control supported.
					SCT Feature Control supported.
					SCT Data Table supported.

SMART Attributes Data Structure revision number: 16
Vendor Specific SMART Attributes with Thresholds:
ID# ATTRIBUTE_NAME          FLAGS    VALUE WORST THRESH FAIL RAW_VALUE
  1 Raw_Read_Error_Rate     PO-R--   100   100   016    -    0
  2 Throughput_Performance  P-S---   100   100   054    -    0
  3 Spin_Up_Time            POS---   116   116   024    -    663 (Average 663)
  4 Start_Stop_Count        -O--C-   092   092   000    -    33623
  5 Reallocated_Sector_Ct   PO--CK   100   100   005    -    0
  7 Seek_Error_Rate         PO-R--   100   100   067    -    0
  8 Seek_Time_Performance   P-S---   100   100   020    -    0
  9 Power_On_Hours          -O--C-   097   097   000    -    27384
 10 Spin_Retry_Count        PO--C-   100   100   060    -    0
 12 Power_Cycle_Count       -O--CK   100   100   000    -    192
192 Power-Off_Retract_Count -O--CK   072   072   000    -    33771
193 Load_Cycle_Count        -O--C-   072   072   000    -    33771
194 Temperature_Celsius     -O----   125   125   000    -    48 (Min/Max 23/70)
196 Reallocated_Event_Count -O--CK   100   100   000    -    0
197 Current_Pending_Sector  -O---K   100   100   000    -    0
198 Offline_Uncorrectable   ---R--   100   100   000    -    0
199 UDMA_CRC_Error_Count    -O-R--   200   200   000    -    31
                            ||||||_ K auto-keep
                            |||||__ C event count
                            ||||___ R error rate
                            |||____ S speed/performance
                            ||_____ O updated online
                            |______ P prefailure warning

General Purpose Log Directory Version 1
SMART           Log Directory Version 1 [multi-sector log support]
Address    Access  R/W   Size  Description
0x00       GPL,SL  R/O      1  Log Directory
0x01           SL  R/O      1  Summary SMART error log
0x03       GPL     R/O      1  Ext. Comprehensive SMART error log
0x04       GPL     R/O      7  Device Statistics log
0x06           SL  R/O      1  SMART self-test log
0x07       GPL     R/O      1  Extended self-test log
0x08       GPL     R/O      2  Power Conditions log
0x09           SL  R/W      1  Selective self-test log
0x10       GPL     R/O      1  NCQ Command Error log
0x11       GPL     R/O      1  SATA Phy Event Counters log
0x20       GPL     R/O      1  Streaming performance log [OBS-8]
0x21       GPL     R/O      1  Write stream error log
0x22       GPL     R/O      1  Read stream error log
0x24       GPL     R/O    256  Current Device Internal Status Data log
0x25       GPL     R/O    256  Saved Device Internal Status Data log
0x80       GPL     R/W     63  Host vendor specific log
0x81-0x9f  GPL,SL  R/W     16  Host vendor specific log
0xa2       GPL     VS       1  Device vendor specific log
0xb2       GPL     VS      63  Device vendor specific log
0xe0       GPL,SL  R/W      1  SCT Command/Status
0xe1       GPL,SL  R/W      1  SCT Data Transfer

SMART Extended Comprehensive Error Log Version: 1 (1 sectors)
Device Error Count: 31 (device log contains only the most recent 4 errors)
	CR     = Command Register
	FEATR  = Features Register
	COUNT  = Count (was: Sector Count) Register
	LBA_48 = Upper bytes of LBA High/Mid/Low Registers ]  ATA-8
	LH     = LBA High (was: Cylinder High) Register    ]   LBA
	LM     = LBA Mid (was: Cylinder Low) Register      ] Register
	LL     = LBA Low (was: Sector Number) Register     ]
	DV     = Device (was: Device/Head) Register
	DC     = Device Control Register
	ER     = Error register
	ST     = Status register
Powered_Up_Time is measured from power on, and printed as
DDd+hh:mm:SS.sss where DD=days, hh=hours, mm=minutes,
SS=sec, and sss=millisec. It "wraps" after 49.710 days.

Error 31 [2] occurred at disk power-on lifetime: 26827 hours (1117 days + 19 hours)
  When the command that caused the error occurred, the device was active or idle.

  After command completion occurred, registers were:
  ER -- ST COUNT  LBA_48  LH LM LL DV DC
  -- -- -- == -- == == == -- -- -- -- --
  84 -- 51 01 4e 00 01 11 c8 7e b2 01 00  Error: ICRC, ABRT 334 sectors at LBA = 0x111c87eb2 = 4593319602

  Commands leading to the command that caused the error were:
  CR FEATR COUNT  LBA_48  LH LM LL DV DC  Powered_Up_Time  Command/Feature_Name
  -- == -- == -- == == == -- -- -- -- --  ---------------  --------------------
  35 00 00 04 00 00 01 11 c8 7c 00 40 00     01:16:05.429  WRITE DMA EXT
  35 00 00 04 00 00 01 11 c8 78 00 40 00     01:16:05.417  WRITE DMA EXT
  35 00 00 00 08 00 01 11 c7 d7 f8 40 00     01:16:05.417  WRITE DMA EXT
  35 00 00 02 d8 00 01 11 c8 68 00 40 00     01:16:05.409  WRITE DMA EXT
  35 00 00 01 c8 00 01 11 c7 d6 30 40 00     01:16:05.403  WRITE DMA EXT

Error 30 [1] occurred at disk power-on lifetime: 15550 hours (647 days + 22 hours)
  When the command that caused the error occurred, the device was active or idle.

  After command completion occurred, registers were:
  ER -- ST COUNT  LBA_48  LH LM LL DV DC
  -- -- -- == -- == == == -- -- -- -- --
  84 -- 51 00 01 00 00 c4 da 96 87 04 00  Error: ICRC, ABRT at LBA = 0xc4da9687 = 3302659719

  Commands leading to the command that caused the error were:
  CR FEATR COUNT  LBA_48  LH LM LL DV DC  Powered_Up_Time  Command/Feature_Name
  -- == -- == -- == == == -- -- -- -- --  ---------------  --------------------
  61 00 08 00 08 00 00 c4 da 96 90 40 00  1d+10:47:53.078  WRITE FPDMA QUEUED
  61 00 08 00 00 00 00 c4 da 96 80 40 00  1d+10:47:53.077  WRITE FPDMA QUEUED
  61 00 10 00 00 00 00 c4 da 96 70 40 00  1d+10:47:53.074  WRITE FPDMA QUEUED
  60 00 08 00 00 00 00 c4 9e 89 70 40 00  1d+10:47:51.510  READ FPDMA QUEUED
  60 00 80 00 00 00 00 c4 9e 88 88 40 00  1d+10:47:51.502  READ FPDMA QUEUED

Error 29 [0] occurred at disk power-on lifetime: 15506 hours (646 days + 2 hours)
  When the command that caused the error occurred, the device was active or idle.

  After command completion occurred, registers were:
  ER -- ST COUNT  LBA_48  LH LM LL DV DC
  -- -- -- == -- == == == -- -- -- -- --
  84 -- 51 01 51 00 00 c4 ad b3 af 04 00  Error: ICRC, ABRT at LBA = 0xc4adb3af = 3299718063

  Commands leading to the command that caused the error were:
  CR FEATR COUNT  LBA_48  LH LM LL DV DC  Powered_Up_Time  Command/Feature_Name
  -- == -- == -- == == == -- -- -- -- --  ---------------  --------------------
  61 04 00 00 08 00 00 c4 ad b1 00 40 00  5d+19:21:44.282  WRITE FPDMA QUEUED
  61 04 00 00 00 00 00 c4 ad ad 00 40 00  5d+19:21:44.281  WRITE FPDMA QUEUED
  61 00 30 00 30 00 00 bb 1c 30 48 40 00  5d+19:21:42.802  WRITE FPDMA QUEUED
  61 04 00 00 08 00 00 bb 1c 2c 48 40 00  5d+19:21:42.802  WRITE FPDMA QUEUED
  61 04 00 00 00 00 00 bb 1c 28 48 40 00  5d+19:21:42.801  WRITE FPDMA QUEUED

Error 28 [3] occurred at disk power-on lifetime: 15490 hours (645 days + 10 hours)
  When the command that caused the error occurred, the device was active or idle.

  After command completion occurred, registers were:
  ER -- ST COUNT  LBA_48  LH LM LL DV DC
  -- -- -- == -- == == == -- -- -- -- --
  84 -- 51 00 01 00 00 6b 49 da b7 0b 00  Error: ICRC, ABRT at LBA = 0x6b49dab7 = 1800002231

  Commands leading to the command that caused the error were:
  CR FEATR COUNT  LBA_48  LH LM LL DV DC  Powered_Up_Time  Command/Feature_Name
  -- == -- == -- == == == -- -- -- -- --  ---------------  --------------------
  61 00 10 00 50 00 00 6b 49 dd 58 40 00  5d+03:25:33.824  WRITE FPDMA QUEUED
  61 00 20 00 48 00 00 6b 49 dd 28 40 00  5d+03:25:33.824  WRITE FPDMA QUEUED
  61 00 10 00 40 00 00 6b 49 dc e8 40 00  5d+03:25:33.824  WRITE FPDMA QUEUED
  61 00 10 00 38 00 00 6b 49 dc b8 40 00  5d+03:25:33.823  WRITE FPDMA QUEUED
  61 00 10 00 30 00 00 6b 49 dc 98 40 00  5d+03:25:33.823  WRITE FPDMA QUEUED

SMART Extended Self-test Log Version: 1 (1 sectors)
Num  Test_Description    Status                  Remaining  LifeTime(hours)  LBA_of_first_error
# 1  Short offline       Completed without error       00%     27384         -

SMART Selective self-test log data structure revision number 1
 SPAN  MIN_LBA  MAX_LBA  CURRENT_TEST_STATUS
    1        0        0  Not_testing
    2        0        0  Not_testing
    3        0        0  Not_testing
    4        0        0  Not_testing
    5        0        0  Not_testing
Selective self-test flags (0x0):
  After scanning selected spans, do NOT read-scan remainder of disk.
If Selective self-test is pending on power-up, resume after 0 minute delay.

SCT Status Version:                  3
SCT Version (vendor specific):       256 (0x0100)
Device State:                        Active (0)
Current Temperature:                    48 Celsius
Power Cycle Min/Max Temperature:     36/55 Celsius
Lifetime    Min/Max Temperature:     23/70 Celsius
Under/Over Temperature Limit Count:   0/0

SCT Temperature History Version:     2
Temperature Sampling Period:         1 minute
Temperature Logging Interval:        1 minute
Min/Max recommended Temperature:      0/60 Celsius
Min/Max Temperature Limit:           -40/70 Celsius
Temperature History Size (Index):    128 (101)

Index    Estimated Time   Temperature Celsius
 102    2024-01-01 17:11    41  **********************
 103    2024-01-01 17:12    40  *********************
 ...    ..(  3 skipped).    ..  *********************
 107    2024-01-01 17:16    40  *********************
 108    2024-01-01 17:17    39  ********************
 109    2024-01-01 17:18    39  ********************
 110    2024-01-01 17:19    39  ********************
 111    2024-01-01 17:20    38  *******************
 112    2024-01-01 17:21    39  ********************
 113    2024-01-01 17:22    39  ********************
 114    2024-01-01 17:23    40  *********************
 115    2024-01-01 17:24    40  *********************
 116    2024-01-01 17:25    41  **********************
 117    2024-01-01 17:26    41  **********************
 118    2024-01-01 17:27    41  **********************
 119    2024-01-01 17:28    42  ***********************
 120    2024-01-01 17:29    42  ***********************
 121    2024-01-01 17:30    43  ************************
 ...    ..(  2 skipped).    ..  ************************
 124    2024-01-01 17:33    43  ************************
 125    2024-01-01 17:34    42  ***********************
 126    2024-01-01 17:35    42  ***********************
 127    2024-01-01 17:36    42  ***********************
   0    2024-01-01 17:37    41  **********************
 ...    ..(  3 skipped).    ..  **********************
   4    2024-01-01 17:41    41  **********************
   5    2024-01-01 17:42    40  *********************
 ...    ..(  2 skipped).    ..  *********************
   8    2024-01-01 17:45    40  *********************
   9    2024-01-01 17:46    39  ********************
 ...    ..(  5 skipped).    ..  ********************
  15    2024-01-01 17:52    39  ********************
  16    2024-01-01 17:53    40  *********************
  17    2024-01-01 17:54    40  *********************
  18    2024-01-01 17:55    41  **********************
  19    2024-01-01 17:56    41  **********************
  20    2024-01-01 17:57    41  **********************
  21    2024-01-01 17:58    42  ***********************
  22    2024-01-01 17:59    42  ***********************
  23    2024-01-01 18:00    42  ***********************
  24    2024-01-01 18:01    43  ************************
  25    2024-01-01 18:02    43  ************************
  26    2024-01-01 18:03    43  ************************
  27    2024-01-01 18:04    42  ***********************
 ...    ..(  2 skipped).    ..  ***********************
  30    2024-01-01 18:07    42  ***********************
  31    2024-01-01 18:08    41  **********************
 ...    ..(  2 skipped).    ..  **********************
  34    2024-01-01 18:11    41  **********************
  35    2024-01-01 18:12    40  *********************
 ...    ..(  3 skipped).    ..  *********************
  39    2024-01-01 18:16    40  *********************
  40    2024-01-01 18:17    39  ********************
 ...    ..(  4 skipped).    ..  ********************
  45    2024-01-01 18:22    39  ********************
  46    2024-01-01 18:23    40  *********************
  47    2024-01-01 18:24    40  *********************
  48    2024-01-01 18:25    41  **********************
  49    2024-01-01 18:26    41  **********************
  50    2024-01-01 18:27    42  ***********************
 ...    ..(  2 skipped).    ..  ***********************
  53    2024-01-01 18:30    42  ***********************
  54    2024-01-01 18:31    43  ************************
  55    2024-01-01 18:32    43  ************************
  56    2024-01-01 18:33    43  ************************
  57    2024-01-01 18:34    42  ***********************
 ...    ..(  2 skipped).    ..  ***********************
  60    2024-01-01 18:37    42  ***********************
  61    2024-01-01 18:38    41  **********************
 ...    ..(  2 skipped).    ..  **********************
  64    2024-01-01 18:41    41  **********************
  65    2024-01-01 18:42    40  *********************
 ...    ..(  3 skipped).    ..  *********************
  69    2024-01-01 18:46    40  *********************
  70    2024-01-01 18:47    39  ********************
 ...    ..(  4 skipped).    ..  ********************
  75    2024-01-01 18:52    39  ********************
  76    2024-01-01 18:53    40  *********************
  77    2024-01-01 18:54    40  *********************
  78    2024-01-01 18:55    41  **********************
  79    2024-01-01 18:56    41  **********************
  80    2024-01-01 18:57    41  **********************
  81    2024-01-01 18:58    42  ***********************
  82    2024-01-01 18:59    42  ***********************
  83    2024-01-01 19:00    42  ***********************
  84    2024-01-01 19:01    43  ************************
  85    2024-01-01 19:02    43  ************************
  86    2024-01-01 19:03    44  *************************
 ...    ..(  2 skipped).    ..  *************************
  89    2024-01-01 19:06    44  *************************
  90    2024-01-01 19:07    45  **************************
  91    2024-01-01 19:08    45  **************************
  92    2024-01-01 19:09    45  **************************
  93    2024-01-01 19:10    46  ***************************
 ...    ..(  2 skipped).    ..  ***************************
  96    2024-01-01 19:13    46  ***************************
  97    2024-01-01 19:14    47  ****************************
 ...    ..(  2 skipped).    ..  ****************************
 100    2024-01-01 19:17    47  ****************************
 101    2024-01-01 19:18    48  *****************************

SMART WRITE LOG does not return COUNT and LBA_LOW register
SCT (Get) Error Recovery Control command failed

Device Statistics (GP Log 0x04)
Page  Offset Size        Value Flags Description
0x01  =====  =               =  ===  == General Statistics (rev 2) ==
0x01  0x008  4             192  ---  Lifetime Power-On Resets
0x01  0x018  6     38183189824  ---  Logical Sectors Written
0x01  0x020  6       663176277  ---  Number of Write Commands
0x01  0x028  6     15270156184  ---  Logical Sectors Read
0x01  0x030  6       653885827  ---  Number of Read Commands
0x03  =====  =               =  ===  == Rotating Media Statistics (rev 1) ==
0x03  0x008  4           13914  ---  Spindle Motor Power-on Hours
0x03  0x010  4           13911  ---  Head Flying Hours
0x03  0x018  4           33771  ---  Head Load Events
0x03  0x020  4               0  ---  Number of Reallocated Logical Sectors
0x03  0x028  4               4  ---  Read Recovery Attempts
0x03  0x030  4               0  ---  Number of Mechanical Start Failures
0x04  =====  =               =  ===  == General Errors Statistics (rev 1) ==
0x04  0x008  4               0  ---  Number of Reported Uncorrectable Errors
0x04  0x010  4              33  ---  Resets Between Cmd Acceptance and Completion
0x05  =====  =               =  ===  == Temperature Statistics (rev 1) ==
0x05  0x008  1              48  ---  Current Temperature
0x05  0x010  1              40  N--  Average Short Term Temperature
0x05  0x018  1              42  N--  Average Long Term Temperature
0x05  0x020  1              70  ---  Highest Temperature
0x05  0x028  1              23  ---  Lowest Temperature
0x05  0x030  1              65  N--  Highest Average Short Term Temperature
0x05  0x038  1              25  N--  Lowest Average Short Term Temperature
0x05  0x040  1              60  N--  Highest Average Long Term Temperature
0x05  0x048  1              25  N--  Lowest Average Long Term Temperature
0x05  0x050  4           10190  ---  Time in Over-Temperature
0x05  0x058  1              60  ---  Specified Maximum Operating Temperature
0x05  0x060  4               0  ---  Time in Under-Temperature
0x05  0x068  1               0  ---  Specified Minimum Operating Temperature
0x06  =====  =               =  ===  == Transport Statistics (rev 1) ==
0x06  0x008  4           69316  ---  Number of Hardware Resets
0x06  0x010  4           67092  ---  Number of ASR Events
0x06  0x018  4              31  ---  Number of Interface CRC Errors
                                |||_ C monitored condition met
                                ||__ D supports DSN
                                |___ N normalized value

Pending Defects log (GP Log 0x0c) not supported

SATA Phy Event Counters (GP Log 0x11)
ID      Size     Value  Description
0x0001  2            0  Command failed due to ICRC error
0x0002  2            0  R_ERR response for data FIS
0x0003  2            0  R_ERR response for device-to-host data FIS
0x0004  2            0  R_ERR response for host-to-device data FIS
0x0005  2            0  R_ERR response for non-data FIS
0x0006  2            0  R_ERR response for device-to-host non-data FIS
0x0007  2            0  R_ERR response for host-to-device non-data FIS
0x0009  2          987  Transition from drive PhyRdy to drive PhyNRdy
0x000a  2          986  Device-to-host register FISes sent due to a COMRESET
0x000b  2            0  CRC errors within host-to-device FIS
0x000d  2            0  Non-CRC errors within host-to-device FIS

