smartctl 7.3 2022-02-28 r5338 [aarch64-linux-6.6.28+rpt-rpi-v8] (local build)
Copyright (C) 2002-22, Bruce Allen, Christian Franke, www.smartmontools.org

=== START OF INFORMATION SECTION ===
Device Model:     XS1000
Firmware Version: S9M00101
User Capacity:    2,000,398,933,504 bytes [2.00 TB]
Sector Size:      512 bytes logical/physical
Rotation Rate:    Solid State Device
TRIM Command:     Available
Device is:        Not in smartctl database 7.3/5610
ATA Version is:   ACS-2, ATA8-ACS T13/1699-D revision 4c
SATA Version is:  SATA 3.1, >6.0 Gb/s (4)
Local Time is:    Thu May 23 22:54:23 2024 CEST
SMART support is: Available - device has SMART capability.
SMART support is: Enabled
AAM feature is:   Unavailable
APM feature is:   Unavailable
Rd look-ahead is: Enabled
Write cache is:   Enabled
DSN feature is:   Unavailable
ATA Security is:  Disabled, NOT FROZEN [SEC1]
Wt Cache Reorder: Unavailable

=== START OF READ SMART DATA SECTION ===
SMART Status command failed: scsi error unsupported field in scsi command
SMART overall-health self-assessment test result: PASSED
Warning: This result is based on an Attribute check.

General SMART Values:
Offline data collection status:  (0x00)	Offline data collection activity
					was never started.
					Auto Offline Data Collection: Disabled.
Total time to complete Offline 
data collection: 		(    0) seconds.
Offline data collection
capabilities: 			 (0x00) 	Offline data collection not supported.
SMART capabilities:            (0x0000)	Automatic saving of SMART data					is not implemented.
Error logging capability:        (0x00)	Error logging NOT supported.
					General Purpose Logging supported.

SMART Attributes Data Structure revision number: 1
Vendor Specific SMART Attributes with Thresholds:
ID# ATTRIBUTE_NAME          FLAGS    VALUE WORST THRESH FAIL RAW_VALUE
  1 Raw_Read_Error_Rate     -O--CK   100   100   000    -    0
  9 Power_On_Hours          -O--CK   100   100   000    -    4
 12 Power_Cycle_Count       -O--CK   100   100   000    -    9
148 Unknown_Attribute       ------   100   100   000    -    0
149 Unknown_Attribute       ------   100   100   000    -    0
161 Unknown_Attribute       ------   100   100   000    -    100
167 Unknown_Attribute       ------   100   100   000    -    0
168 Unknown_Attribute       -O--C-   100   100   000    -    0
169 Unknown_Attribute       ------   053   071   010    -    304942678069
170 Unknown_Attribute       ------   100   100   000    -    0
172 Unknown_Attribute       -O--CK   100   100   000    -    0
173 Unknown_Attribute       ------   100   100   000    -    0
181 Program_Fail_Cnt_Total  -O--CK   100   100   000    -    0
182 Erase_Fail_Count_Total  ------   100   100   000    -    0
187 Reported_Uncorrect      -O--CK   100   100   000    -    0
192 Power-Off_Retract_Count -O--C-   100   100   000    -    9
194 Temperature_Celsius     -O---K   041   075   000    -    41 (Min/Max 0/75)
196 Reallocated_Event_Count -O--CK   100   100   000    -    0
199 UDMA_CRC_Error_Count    -O--CK   100   100   000    -    0
218 Unknown_Attribute       -O--CK   100   100   000    -    0
231 Unknown_SSD_Attribute   ------   100   100   000    -    100
233 Media_Wearout_Indicator -O--CK   100   100   000    -    13245
241 Total_LBAs_Written      -O--CK   100   100   000    -    10967
242 Total_LBAs_Read         -O--CK   100   100   000    -    366
244 Unknown_Attribute       ------   100   100   000    -    0
245 Unknown_Attribute       ------   100   100   000    -    1
246 Unknown_Attribute       ------   100   100   000    -    167
                            ||||||_ K auto-keep
                            |||||__ C event count
                            ||||___ R error rate
                            |||____ S speed/performance
                            ||_____ O updated online
                            |______ P prefailure warning

Read SMART Log Directory failed: scsi error unsupported scsi opcode

ATA_READ_LOG_EXT (addr=0x00:0x00, page=0, n=1) failed: scsi error unsupported field in scsi command
Read GP Log Directory failed

SMART Extended Comprehensive Error Log (GP Log 0x03) not supported

SMART Error Log not supported

SMART Extended Self-test Log (GP Log 0x07) not supported

SMART Self-test Log not supported

Selective Self-tests/Logging not supported

SCT Commands not supported

Device Statistics (GP/SMART Log 0x04) not supported

Pending Defects log (GP Log 0x0c) not supported

ATA_READ_LOG_EXT (addr=0x11:0x00, page=0, n=1) failed: scsi error unsupported field in scsi command
Read SATA Phy Event Counters failed

