smartctl 7.5 2025-04-30 r5714 [FreeBSD 14.3-RELEASE i386] (local build)
Copyright (C) 2002-25, Bruce Allen, Christian Franke, www.smartmontools.org

=== START OF INFORMATION SECTION ===
Device Model:     WD5003ABYX-23        00W1141 00W1445IBM
Serial Number:    WD-WMAYP0M30WE0
LU WWN Device Id: 5 0014ee 65c64cae6
Firmware Version: WC38
User Capacity:    500,107,862,016 bytes [500 GB]
Sector Size:      512 bytes logical/physical
Rotation Rate:    7200 rpm
Device is:        Not in smartctl database 7.5/5816
ATA Version is:   ATA8-ACS (minor revision not indicated)
SATA Version is:  SATA 3.0, 6.0 Gb/s (current: 1.5 Gb/s)
Local Time is:    Sat Aug 16 01:13:42 2025 +05
SMART support is: Available - device has SMART capability.
SMART support is: Enabled
AAM feature is:   Unavailable
APM level is:     128 (minimum power consumption without standby)
Rd look-ahead is: Enabled
Write cache is:   Enabled
DSN feature is:   Unavailable
ATA Security is:  Disabled, NOT FROZEN [SEC1]

=== START OF READ SMART DATA SECTION ===
SMART overall-health self-assessment test result: PASSED

General SMART Values:
Offline data collection status:  (0x82)	Offline data collection activity
					was completed without error.
					Auto Offline Data Collection: Enabled.
Self-test execution status:      (   0)	The previous self-test routine completed
					without error or no self-test has ever 
					been run.
Total time to complete Offline 
data collection: 		( 8160) seconds.
Offline data collection
capabilities: 			 (0x7b) SMART execute Offline immediate.
					Auto Offline data collection on/off support.
					Suspend Offline collection upon new
					command.
					Offline surface scan supported.
					Self-test supported.
					Conveyance Self-test supported.
					Selective Self-test supported.
SMART capabilities:            (0x0003)	Saves SMART data before entering
					power-saving mode.
					Supports SMART auto save timer.
Error logging capability:        (0x01)	Error logging supported.
					General Purpose Logging supported.
Short self-test routine 
recommended polling time: 	 (   2) minutes.
Extended self-test routine
recommended polling time: 	 (  83) minutes.
Conveyance self-test routine
recommended polling time: 	 (   5) minutes.
SCT capabilities: 	       (0x303f)	SCT Status supported.
					SCT Error Recovery Control supported.
					SCT Feature Control supported.
					SCT Data Table supported.

SMART Attributes Data Structure revision number: 16
Vendor Specific SMART Attributes with Thresholds:
ID# ATTRIBUTE_NAME          FLAGS    VALUE WORST THRESH FAIL RAW_VALUE
  1 Raw_Read_Error_Rate     POSR-K   200   200   051    -    5
  3 Spin_Up_Time            POS--K   133   132   021    -    4350
  4 Start_Stop_Count        -O--CK   098   098   000    -    2730
  5 Reallocated_Sector_Ct   PO--CK   200   200   140    -    0
  7 Seek_Error_Rate         -OSR-K   200   200   000    -    0
  9 Power_On_Hours          -O--CK   048   048   000    -    38253
 10 Spin_Retry_Count        -O--CK   100   100   000    -    0
 11 Calibration_Retry_Count -O--CK   100   100   000    -    0
 12 Power_Cycle_Count       -O--CK   098   098   000    -    2728
192 Power-Off_Retract_Count -O--CK   200   200   000    -    86
193 Load_Cycle_Count        -O--CK   200   200   000    -    2643
194 Temperature_Celsius     -O---K   112   097   000    -    31
196 Reallocated_Event_Count -O--CK   200   200   000    -    0
197 Current_Pending_Sector  -O--CK   200   200   000    -    0
198 Offline_Uncorrectable   ----CK   200   200   000    -    0
199 UDMA_CRC_Error_Count    -O--CK   200   200   000    -    0
200 Multi_Zone_Error_Rate   ---R--   200   200   000    -    0
                            ||||||_ K auto-keep
                            |||||__ C event count
                            ||||___ R error rate
                            |||____ S speed/performance
                            ||_____ O updated online
                            |______ P prefailure warning

General Purpose Log Directory Version 1
SMART           Log Directory Version 1 [multi-sector log support]
Address    Access  R/W   Size  Description
0x00       GPL,SL  R/O      1  Log Directory
0x01           SL  R/O      1  Summary SMART error log
0x02           SL  R/O      5  Comprehensive SMART error log
0x03       GPL     R/O      6  Ext. Comprehensive SMART error log
0x04       GPL,SL  R/O      8  Device Statistics log
0x06           SL  R/O      1  SMART self-test log
0x07       GPL     R/O      1  Extended self-test log
0x09           SL  R/W      1  Selective self-test log
0x10       GPL     R/O      1  NCQ Command Error log
0x11       GPL     R/O      1  SATA Phy Event Counters log
0x80       GPL     R/W  65535  Host vendor specific log
0x80       SL      R/W    255  Host vendor specific log
0x81-0x9f  GPL,SL  R/W     16  Host vendor specific log
0xa0-0xa7  GPL,SL  VS      16  Device vendor specific log
0xa8-0xb0  GPL,SL  VS       1  Device vendor specific log
0xb1       GPL,SL  VS       8  Device vendor specific log
0xb2-0xb5  GPL,SL  VS       1  Device vendor specific log
0xb6       GPL     VS       1  Device vendor specific log
0xb7       GPL,SL  VS       1  Device vendor specific log
0xbd       GPL,SL  VS       1  Device vendor specific log
0xc0       GPL,SL  VS       1  Device vendor specific log
0xc1       GPL     VS      24  Device vendor specific log
0xe0       GPL,SL  R/W      1  SCT Command/Status
0xe1       GPL,SL  R/W      1  SCT Data Transfer

SMART Extended Comprehensive Error Log Version: 1 (6 sectors)
No Errors Logged

SMART Error Log Version: 1
No Errors Logged

SMART Extended Self-test Log Version: 1 (1 sectors)
Num  Test_Description    Status                  Remaining  LifeTime(hours)  LBA_of_first_error
# 1  Extended offline    Completed without error       00%     38245         -
# 2  Short offline       Completed without error       00%     38225         -

SMART Self-test log structure revision number 1
Num  Test_Description    Status                  Remaining  LifeTime(hours)  LBA_of_first_error
# 1  Extended offline    Completed without error       00%     38245         -
# 2  Short offline       Completed without error       00%     38225         -

SMART Selective self-test log data structure revision number 1
 SPAN  MIN_LBA  MAX_LBA  CURRENT_TEST_STATUS
    1        0        0  Not_testing
    2        0        0  Not_testing
    3        0        0  Not_testing
    4        0        0  Not_testing
    5        0        0  Not_testing
Selective self-test flags (0x0):
  After scanning selected spans, do NOT read-scan remainder of disk.
If Selective self-test is pending on power-up, resume after 0 minute delay.

SCT Status Version:                  3
SCT Version (vendor specific):       258 (0x0102)
Device State:                        Active (0)
Current Temperature:                    31 Celsius
Power Cycle Min/Max Temperature:     27/31 Celsius
Lifetime    Min/Max Temperature:      0/46 Celsius
Specified Max Operating Temperature:    60 Celsius
Under/Over Temperature Limit Count:   0/0

SCT Temperature History Version:     2
Temperature Sampling Period:         1 minute
Temperature Logging Interval:        1 minute
Min/Max recommended Temperature:      0/60 Celsius
Min/Max Temperature Limit:           -41/85 Celsius
Temperature History Size (Index):    478 (122)

Index    Estimated Time   Temperature Celsius
 123    2025-08-15 17:16    32  *************
 ...    ..(111 skipped).    ..  *************
 235    2025-08-15 19:08    32  *************
 236    2025-08-15 19:09     ?  -
 237    2025-08-15 19:10    28  *********
 238    2025-08-15 19:11    30  ***********
 ...    ..(  3 skipped).    ..  ***********
 242    2025-08-15 19:15    30  ***********
 243    2025-08-15 19:16    31  ************
 ...    ..(  4 skipped).    ..  ************
 248    2025-08-15 19:21    31  ************
 249    2025-08-15 19:22    32  *************
 ...    ..( 26 skipped).    ..  *************
 276    2025-08-15 19:49    32  *************
 277    2025-08-15 19:50    33  **************
 278    2025-08-15 19:51    32  *************
 ...    ..(115 skipped).    ..  *************
 394    2025-08-15 21:47    32  *************
 395    2025-08-15 21:48     ?  -
 396    2025-08-15 21:49    27  ********
 397    2025-08-15 21:50    28  *********
 398    2025-08-15 21:51    29  **********
 399    2025-08-15 21:52    29  **********
 400    2025-08-15 21:53    30  ***********
 ...    ..(  8 skipped).    ..  ***********
 409    2025-08-15 22:02    30  ***********
 410    2025-08-15 22:03    31  ************
 ...    ..( 27 skipped).    ..  ************
 438    2025-08-15 22:31    31  ************
 439    2025-08-15 22:32    33  **************
 ...    ..( 19 skipped).    ..  **************
 459    2025-08-15 22:52    33  **************
 460    2025-08-15 22:53    34  ***************
 ...    ..(  3 skipped).    ..  ***************
 464    2025-08-15 22:57    34  ***************
 465    2025-08-15 22:58    33  **************
 ...    ..( 15 skipped).    ..  **************
   3    2025-08-15 23:14    33  **************
   4    2025-08-15 23:15    32  *************
   5    2025-08-15 23:16    33  **************
 ...    ..(  2 skipped).    ..  **************
   8    2025-08-15 23:19    33  **************
   9    2025-08-15 23:20    32  *************
  10    2025-08-15 23:21    33  **************
  11    2025-08-15 23:22    33  **************
  12    2025-08-15 23:23    33  **************
  13    2025-08-15 23:24    32  *************
  14    2025-08-15 23:25    33  **************
  15    2025-08-15 23:26    32  *************
  16    2025-08-15 23:27    33  **************
  17    2025-08-15 23:28    32  *************
  18    2025-08-15 23:29    33  **************
  19    2025-08-15 23:30    32  *************
  20    2025-08-15 23:31    32  *************
  21    2025-08-15 23:32    32  *************
  22    2025-08-15 23:33    33  **************
  23    2025-08-15 23:34    33  **************
  24    2025-08-15 23:35    32  *************
  25    2025-08-15 23:36    32  *************
  26    2025-08-15 23:37    32  *************
  27    2025-08-15 23:38    33  **************
  28    2025-08-15 23:39    32  *************
  29    2025-08-15 23:40    32  *************
  30    2025-08-15 23:41    33  **************
 ...    ..( 74 skipped).    ..  **************
 105    2025-08-16 00:56    33  **************
 106    2025-08-16 00:57     ?  -
 107    2025-08-16 00:58    28  *********
 108    2025-08-16 00:59    30  ***********
 ...    ..(  3 skipped).    ..  ***********
 112    2025-08-16 01:03    30  ***********
 113    2025-08-16 01:04    31  ************
 ...    ..(  3 skipped).    ..  ************
 117    2025-08-16 01:08    31  ************
 118    2025-08-16 01:09    32  *************
 ...    ..(  3 skipped).    ..  *************
 122    2025-08-16 01:13    32  *************

SCT Error Recovery Control:
           Read:     70 (7.0 seconds)
          Write:     70 (7.0 seconds)

Device Statistics (GP Log 0x04)
Page  Offset Size        Value Flags Description
0x01  =====  =               =  ===  == General Statistics (rev 2) ==
0x01  0x008  4            2728  ---  Lifetime Power-On Resets
0x01  0x010  4           38253  ---  Power-on Hours
0x01  0x018  6     31146116515  ---  Logical Sectors Written
0x01  0x020  6       441840332  ---  Number of Write Commands
0x01  0x028  6     48193456465  ---  Logical Sectors Read
0x01  0x030  6       570231731  ---  Number of Read Commands
0x03  =====  =               =  ===  == Rotating Media Statistics (rev 1) ==
0x03  0x008  4           35509  ---  Spindle Motor Power-on Hours
0x03  0x010  4           35486  ---  Head Flying Hours
0x03  0x018  4            2730  ---  Head Load Events
0x03  0x020  4             200  N--  Number of Reallocated Logical Sectors
0x03  0x028  4              32  ---  Read Recovery Attempts
0x03  0x030  4               0  ---  Number of Mechanical Start Failures
0x04  =====  =               =  ===  == General Errors Statistics (rev 1) ==
0x04  0x008  4               0  ---  Number of Reported Uncorrectable Errors
0x04  0x010  4               0  ---  Resets Between Cmd Acceptance and Completion
0x05  =====  =               =  ===  == Temperature Statistics (rev 1) ==
0x05  0x008  1              31  ---  Current Temperature
0x05  0x010  1              32  ---  Average Short Term Temperature
0x05  0x018  1              36  ---  Average Long Term Temperature
0x05  0x020  1              46  ---  Highest Temperature
0x05  0x028  1              28  ---  Lowest Temperature
0x05  0x030  1              43  ---  Highest Average Short Term Temperature
0x05  0x038  1              32  ---  Lowest Average Short Term Temperature
0x05  0x040  1              41  ---  Highest Average Long Term Temperature
0x05  0x048  1              36  ---  Lowest Average Long Term Temperature
0x05  0x050  4               0  ---  Time in Over-Temperature
0x05  0x058  1              60  ---  Specified Maximum Operating Temperature
0x05  0x060  4               0  ---  Time in Under-Temperature
0x05  0x068  1               0  ---  Specified Minimum Operating Temperature
0x06  =====  =               =  ===  == Transport Statistics (rev 1) ==
0x06  0x008  4            2980  ---  Number of Hardware Resets
0x06  0x010  4            4243  ---  Number of ASR Events
0x06  0x018  4               0  ---  Number of Interface CRC Errors
                                |||_ C monitored condition met
                                ||__ D supports DSN
                                |___ N normalized value

Pending Defects log (GP Log 0x0c) not supported

SATA Phy Event Counters (GP Log 0x11)
ID      Size     Value  Description
0x0001  2            0  Command failed due to ICRC error
0x0002  2            0  R_ERR response for data FIS
0x0003  2            0  R_ERR response for device-to-host data FIS
0x0004  2            0  R_ERR response for host-to-device data FIS
0x0005  2            0  R_ERR response for non-data FIS
0x0006  2            0  R_ERR response for device-to-host non-data FIS
0x0007  2            0  R_ERR response for host-to-device non-data FIS
0x0008  2            0  Device-to-host non-data FIS retries
0x0009  2            1  Transition from drive PhyRdy to drive PhyNRdy
0x000a  2            2  Device-to-host register FISes sent due to a COMRESET
0x000b  2            0  CRC errors within host-to-device FIS
0x000f  2            0  R_ERR response for host-to-device data FIS, CRC
0x0012  2            0  R_ERR response for host-to-device non-data FIS, CRC
0x8000  4         2612  Vendor specific

