smartctl 7.4 2023-08-01 r5530 [x86_64-linux-6.1.69-1-lts] (local build)
Copyright (C) 2002-23, Bruce Allen, Christian Franke, www.smartmontools.org

=== START OF INFORMATION SECTION ===
Device Model:     WDC WD6003FZBX-00K5WB0
Firmware Version: 01.01A01
User Capacity:    6,001,175,126,016 bytes [6.00 TB]
Sector Sizes:     512 bytes logical, 4096 bytes physical
Rotation Rate:    7200 rpm
Form Factor:      3.5 inches
Device is:        Not in smartctl database 7.3/5563
ATA Version is:   ACS-2, ATA8-ACS T13/1699-D revision 4
SATA Version is:  SATA 3.2, 6.0 Gb/s (current: 6.0 Gb/s)
Local Time is:    Sat Dec 30 07:27:52 2023 CET
SMART support is: Available - device has SMART capability.
SMART support is: Enabled
AAM feature is:   Unavailable
APM level is:     254 (maximum performance)
Rd look-ahead is: Enabled
Write cache is:   Enabled
DSN feature is:   Unavailable
ATA Security is:  Disabled, NOT FROZEN [SEC1]
Wt Cache Reorder: Enabled

=== START OF READ SMART DATA SECTION ===
SMART overall-health self-assessment test result: PASSED

General SMART Values:
Offline data collection status:  (0x80)	Offline data collection activity
					was never started.
					Auto Offline Data Collection: Enabled.
Self-test execution status:      (   0)	The previous self-test routine completed
					without error or no self-test has ever 
					been run.
Total time to complete Offline 
data collection: 		(   87) seconds.
Offline data collection
capabilities: 			 (0x5b) SMART execute Offline immediate.
					Auto Offline data collection on/off support.
					Suspend Offline collection upon new
					command.
					Offline surface scan supported.
					Self-test supported.
					No Conveyance Self-test supported.
					Selective Self-test supported.
SMART capabilities:            (0x0003)	Saves SMART data before entering
					power-saving mode.
					Supports SMART auto save timer.
Error logging capability:        (0x01)	Error logging supported.
					General Purpose Logging supported.
Short self-test routine 
recommended polling time: 	 (   2) minutes.
Extended self-test routine
recommended polling time: 	 ( 707) minutes.
SCT capabilities: 	       (0x0035)	SCT Status supported.
					SCT Feature Control supported.
					SCT Data Table supported.

SMART Attributes Data Structure revision number: 16
Vendor Specific SMART Attributes with Thresholds:
ID# ATTRIBUTE_NAME          FLAGS    VALUE WORST THRESH FAIL RAW_VALUE
  1 Raw_Read_Error_Rate     PO-R--   100   100   016    -    0
  2 Throughput_Performance  --S---   132   132   054    -    96
  3 Spin_Up_Time            POS---   154   154   024    -    392 (Average 393)
  4 Start_Stop_Count        -O--C-   100   100   000    -    1183
  5 Reallocated_Sector_Ct   PO--CK   100   100   005    -    0
  7 Seek_Error_Rate         -O-R--   100   100   067    -    0
  8 Seek_Time_Performance   --S---   128   128   020    -    18
  9 Power_On_Hours          -O--C-   095   095   000    -    36114
 10 Spin_Retry_Count        -O--C-   100   100   060    -    0
 12 Power_Cycle_Count       -O--CK   100   100   000    -    992
192 Power-Off_Retract_Count -O--CK   098   098   000    -    2663
193 Load_Cycle_Count        -O--C-   098   098   000    -    2663
194 Temperature_Celsius     -O----   148   148   000    -    37 (Min/Max 21/56)
196 Reallocated_Event_Count -O--CK   100   100   000    -    0
197 Current_Pending_Sector  -O---K   100   100   000    -    0
198 Offline_Uncorrectable   ---R--   100   100   000    -    1
199 UDMA_CRC_Error_Count    -O-R--   200   200   000    -    0
                            ||||||_ K auto-keep
                            |||||__ C event count
                            ||||___ R error rate
                            |||____ S speed/performance
                            ||_____ O updated online
                            |______ P prefailure warning

General Purpose Log Directory Version 1
SMART           Log Directory Version 1 [multi-sector log support]
Address    Access  R/W   Size  Description
0x00       GPL,SL  R/O      1  Log Directory
0x01           SL  R/O      1  Summary SMART error log
0x02           SL  R/O      1  Comprehensive SMART error log
0x03       GPL     R/O      1  Ext. Comprehensive SMART error log
0x04       GPL     R/O    256  Device Statistics log
0x04       SL      R/O    255  Device Statistics log
0x06           SL  R/O      1  SMART self-test log
0x07       GPL     R/O      1  Extended self-test log
0x08       GPL     R/O      2  Power Conditions log
0x09           SL  R/W      1  Selective self-test log
0x0c       GPL     R/O   5501  Pending Defects log
0x10       GPL     R/O      1  NCQ Command Error log
0x11       GPL     R/O      1  SATA Phy Event Counters log
0x12       GPL     R/O      1  SATA NCQ Non-Data log
0x13       GPL     R/O      1  SATA NCQ Send and Receive log
0x15       GPL     R/W      1  Rebuild Assist log
0x21       GPL     R/O      1  Write stream error log
0x22       GPL     R/O      1  Read stream error log
0x24       GPL     R/O    256  Current Device Internal Status Data log
0x25       GPL     R/O    256  Saved Device Internal Status Data log
0x30       GPL,SL  R/O      9  IDENTIFY DEVICE data log
0x80-0x9f  GPL,SL  R/W     16  Host vendor specific log
0xe0       GPL,SL  R/W      1  SCT Command/Status
0xe1       GPL,SL  R/W      1  SCT Data Transfer

SMART Extended Comprehensive Error Log Version: 1 (1 sectors)
No Errors Logged

SMART Extended Self-test Log Version: 1 (1 sectors)
Num  Test_Description    Status                  Remaining  LifeTime(hours)  LBA_of_first_error
# 1  Short offline       Completed without error       00%     36114         -
# 2  Short offline       Completed without error       00%     36103         -
# 3  Short offline       Completed without error       00%     36089         -
# 4  Short offline       Completed without error       00%     36075         -
# 5  Short offline       Completed without error       00%     36058         -
# 6  Short offline       Completed without error       00%     36045         -
# 7  Short offline       Completed without error       00%     36032         -
# 8  Short offline       Completed without error       00%     36031         -
# 9  Short offline       Completed without error       00%     36004         -
#10  Short offline       Completed without error       00%     35988         -
#11  Short offline       Completed without error       00%     35972         -
#12  Short offline       Completed without error       00%     35958         -
#13  Short offline       Completed without error       00%     35941         -
#14  Short offline       Completed without error       00%     35925         -
#15  Short offline       Completed without error       00%     35911         -
#16  Short offline       Completed without error       00%     35888         -
#17  Short offline       Completed without error       00%     35875         -
#18  Short offline       Completed without error       00%     35863         -
#19  Short offline       Completed without error       00%     35847         -

SMART Selective self-test log data structure revision number 1
 SPAN  MIN_LBA  MAX_LBA  CURRENT_TEST_STATUS
    1        0        0  Not_testing
    2        0        0  Not_testing
    3        0        0  Not_testing
    4        0        0  Not_testing
    5        0        0  Not_testing
Selective self-test flags (0x0):
  After scanning selected spans, do NOT read-scan remainder of disk.
If Selective self-test is pending on power-up, resume after 0 minute delay.

SCT Status Version:                  3
SCT Version (vendor specific):       256 (0x0100)
Device State:                        Active (0)
Current Temperature:                    37 Celsius
Power Cycle Min/Max Temperature:     24/37 Celsius
Lifetime    Min/Max Temperature:     21/56 Celsius
Under/Over Temperature Limit Count:   0/0

SCT Temperature History Version:     2
Temperature Sampling Period:         1 minute
Temperature Logging Interval:        1 minute
Min/Max recommended Temperature:      0/55 Celsius
Min/Max Temperature Limit:           -40/70 Celsius
Temperature History Size (Index):    128 (69)

Index    Estimated Time   Temperature Celsius
  70    2023-12-30 05:20    43  ************************
 ...    ..( 30 skipped).    ..  ************************
 101    2023-12-30 05:51    43  ************************
 102    2023-12-30 05:52    44  *************************
 103    2023-12-30 05:53    44  *************************
 104    2023-12-30 05:54    44  *************************
 105    2023-12-30 05:55    43  ************************
 ...    ..(  5 skipped).    ..  ************************
 111    2023-12-30 06:01    43  ************************
 112    2023-12-30 06:02    44  *************************
 ...    ..( 36 skipped).    ..  *************************
  21    2023-12-30 06:39    44  *************************
  22    2023-12-30 06:40    45  **************************
 ...    ..(  5 skipped).    ..  **************************
  28    2023-12-30 06:46    45  **************************
  29    2023-12-30 06:47    46  ***************************
 ...    ..(  4 skipped).    ..  ***************************
  34    2023-12-30 06:52    46  ***************************
  35    2023-12-30 06:53    47  ****************************
 ...    ..(  3 skipped).    ..  ****************************
  39    2023-12-30 06:57    47  ****************************
  40    2023-12-30 06:58    24  *****
  41    2023-12-30 06:59    25  ******
  42    2023-12-30 07:00    26  *******
  43    2023-12-30 07:01    26  *******
  44    2023-12-30 07:02    27  ********
  45    2023-12-30 07:03    28  *********
  46    2023-12-30 07:04    28  *********
  47    2023-12-30 07:05    29  **********
  48    2023-12-30 07:06    29  **********
  49    2023-12-30 07:07    30  ***********
  50    2023-12-30 07:08    30  ***********
  51    2023-12-30 07:09    31  ************
  52    2023-12-30 07:10    31  ************
  53    2023-12-30 07:11    32  *************
  54    2023-12-30 07:12    32  *************
  55    2023-12-30 07:13    32  *************
  56    2023-12-30 07:14    33  **************
  57    2023-12-30 07:15    33  **************
  58    2023-12-30 07:16    34  ***************
  59    2023-12-30 07:17    34  ***************
  60    2023-12-30 07:18    34  ***************
  61    2023-12-30 07:19    35  ****************
  62    2023-12-30 07:20    35  ****************
  63    2023-12-30 07:21    35  ****************
  64    2023-12-30 07:22    36  *****************
  65    2023-12-30 07:23    36  *****************
  66    2023-12-30 07:24    36  *****************
  67    2023-12-30 07:25    37  ******************
  68    2023-12-30 07:26    37  ******************
  69    2023-12-30 07:27    43  ************************

SCT Error Recovery Control command not supported

Device Statistics (GP Log 0x04)
Page  Offset Size        Value Flags Description
0x01  =====  =               =  ===  == General Statistics (rev 1) ==
0x01  0x008  4             992  ---  Lifetime Power-On Resets
0x01  0x010  4           36114  ---  Power-on Hours
0x01  0x018  6    118584325056  ---  Logical Sectors Written
0x01  0x020  6      1353368142  ---  Number of Write Commands
0x01  0x028  6     28120665710  ---  Logical Sectors Read
0x01  0x030  6       265244183  ---  Number of Read Commands
0x01  0x038  6    130011813450  ---  Date and Time TimeStamp
0x03  =====  =               =  ===  == Rotating Media Statistics (rev 1) ==
0x03  0x008  4           35273  ---  Spindle Motor Power-on Hours
0x03  0x010  4           35273  ---  Head Flying Hours
0x03  0x018  4            2663  ---  Head Load Events
0x03  0x020  4               0  ---  Number of Reallocated Logical Sectors
0x03  0x028  4               6  ---  Read Recovery Attempts
0x03  0x030  4               0  ---  Number of Mechanical Start Failures
0x04  =====  =               =  ===  == General Errors Statistics (rev 1) ==
0x04  0x008  4               0  ---  Number of Reported Uncorrectable Errors
0x04  0x010  4               0  ---  Resets Between Cmd Acceptance and Completion
0x05  =====  =               =  ===  == Temperature Statistics (rev 1) ==
0x05  0x008  1              37  ---  Current Temperature
0x05  0x010  1              42  N--  Average Short Term Temperature
0x05  0x018  1              41  N--  Average Long Term Temperature
0x05  0x020  1              56  ---  Highest Temperature
0x05  0x028  1              21  ---  Lowest Temperature
0x05  0x030  1              54  N--  Highest Average Short Term Temperature
0x05  0x038  1              25  N--  Lowest Average Short Term Temperature
0x05  0x040  1              49  N--  Highest Average Long Term Temperature
0x05  0x048  1              25  N--  Lowest Average Long Term Temperature
0x05  0x050  4              58  ---  Time in Over-Temperature
0x05  0x058  1              55  ---  Specified Maximum Operating Temperature
0x05  0x060  4               0  ---  Time in Under-Temperature
0x05  0x068  1               0  ---  Specified Minimum Operating Temperature
0x06  =====  =               =  ===  == Transport Statistics (rev 1) ==
0x06  0x008  4               2  ---  Number of Hardware Resets
0x06  0x010  4             771  ---  Number of ASR Events
0x06  0x018  4               0  ---  Number of Interface CRC Errors
0xff  =====  =               =  ===  == Vendor Specific Statistics (rev 1) ==
                                |||_ C monitored condition met
                                ||__ D supports DSN
                                |___ N normalized value

Pending Defects log (GP Log 0x0c)
No Defects Logged

SATA Phy Event Counters (GP Log 0x11)
ID      Size     Value  Description
0x0001  2            0  Command failed due to ICRC error
0x0002  2            0  R_ERR response for data FIS
0x0003  2            0  R_ERR response for device-to-host data FIS
0x0004  2            0  R_ERR response for host-to-device data FIS
0x0005  2            0  R_ERR response for non-data FIS
0x0006  2            0  R_ERR response for device-to-host non-data FIS
0x0007  2            0  R_ERR response for host-to-device non-data FIS
0x0008  2            0  Device-to-host non-data FIS retries
0x0009  2        17485  Transition from drive PhyRdy to drive PhyNRdy
0x000a  2            1  Device-to-host register FISes sent due to a COMRESET
0x000b  2            0  CRC errors within host-to-device FIS
0x000d  2            0  Non-CRC errors within host-to-device FIS

