smartctl 7.2 2020-12-30 r5155 [x86_64-linux-6.8.0-79-generic] (local build)
Copyright (C) 2002-20, Bruce Allen, Christian Franke, www.smartmontools.org

=== START OF INFORMATION SECTION ===
Model Number:                       Seagate ZP1000GM30063
Serial Number:                      REDACTED
Firmware Version:                   SU6SX030
PCI Vendor/Subsystem ID:            0x1bb1
IEEE OUI Identifier:                0x6479a7
Total NVM Capacity:                 1,000,204,886,016 [1.00 TB]
Unallocated NVM Capacity:           0
Controller ID:                      1
NVMe Version:                       1.4
Number of Namespaces:               1
Namespace 1 Size/Capacity:          1,000,204,886,016 [1.00 TB]
Namespace 1 Formatted LBA Size:     512
Namespace 1 IEEE EUI-64:            6479a7 903f005573
Local Time is:                      Thu Sep 11 23:45:37 2025 EDT
Firmware Updates (0x18):            4 Slots, no Reset required
Optional Admin Commands (0x0017):   Security Format Frmw_DL Self_Test
Optional NVM Commands (0x005d):     Comp DS_Mngmt Wr_Zero Sav/Sel_Feat Timestmp
Log Page Attributes (0x08):         Telmtry_Lg
Maximum Data Transfer Size:         128 Pages
Warning  Comp. Temp. Threshold:     86 Celsius
Critical Comp. Temp. Threshold:     87 Celsius

Supported Power States
St Op     Max   Active     Idle   RL RT WL WT  Ent_Lat  Ex_Lat
 0 +     8.80W       -        -    0  0  0  0        0       0
 1 +     7.10W       -        -    1  1  1  1        0       0
 2 +     5.20W       -        -    2  2  2  2        0       0
 3 -   0.0620W       -        -    3  3  3  3     2500    7500
 4 -   0.0440W       -        -    4  4  4  4    10500   75000

Supported LBA Sizes (NSID 0x1)
Id Fmt  Data  Metadt  Rel_Perf
 0 +     512       0         2
 1 -    4096       0         1

=== START OF SMART DATA SECTION ===
SMART overall-health self-assessment test result: PASSED

SMART/Health Information (NVMe Log 0x02)
Critical Warning:                   0x00
Temperature:                        34 Celsius
Available Spare:                    100%
Available Spare Threshold:          3%
Percentage Used:                    0%
Data Units Read:                    156,793 [80.2 GB]
Data Units Written:                 887,064 [454 GB]
Host Read Commands:                 1,500,800
Host Write Commands:                2,660,165
Controller Busy Time:               45
Power Cycles:                       9
Power On Hours:                     320
Unsafe Shutdowns:                   3
Media and Data Integrity Errors:    0
Error Information Log Entries:      1,067
Warning  Comp. Temperature Time:    0
Critical Comp. Temperature Time:    0

Error Information (NVMe Log 0x01, 16 of 63 entries)
Num   ErrCount  SQId   CmdId  Status  PELoc          LBA  NSID    VS
  0       1067     0  0x000a  0x4004  0x02b            0     0     -
  1       1066     0  0x2008  0x4004  0x028            0     -     -
  2       1065     0  0xf009  0x4016  0x004            0     0     -
  3       1064     0  0x1008  0x4016  0x004            0     0     -
  4       1063     0  0xc00b  0x4004  0x02b            0     0     -


