smartctl 6.5 2016-05-07 r4318 [x86_64-linux-4.11.4-1-ck-nehalem] (local build)
Copyright (C) 2002-16, Bruce Allen, Christian Franke, www.smartmontools.org

=== START OF INFORMATION SECTION ===
Device Model:     KINGSTON SUV400S37120G
Firmware Version: 0C3J96R9
User Capacity:    120,034,123,776 bytes [120 GB]
Sector Sizes:     512 bytes logical, 4096 bytes physical
Rotation Rate:    Solid State Device
Form Factor:      M.2
Device is:        Not in smartctl database [for details use: -P showall]
ATA Version is:   Unknown(0x0ffe), ATA8-ACS T13/1699-D revision 6
SATA Version is:  SATA 3.1, 6.0 Gb/s (current: 3.0 Gb/s)
Local Time is:    Mon Jun 12 13:38:20 2017 +08
SMART support is: Available - device has SMART capability.
SMART support is: Enabled
AAM feature is:   Unavailable
APM feature is:   Disabled
Rd look-ahead is: Enabled
Write cache is:   Enabled
ATA Security is:  Disabled, frozen [SEC2]
Wt Cache Reorder: Enabled

=== START OF READ SMART DATA SECTION ===
SMART overall-health self-assessment test result: PASSED

General SMART Values:
Offline data collection status:  (0x00)	Offline data collection activity
					was never started.
					Auto Offline Data Collection: Disabled.
Self-test execution status:      (   0)	The previous self-test routine completed
					without error or no self-test has ever 
					been run.
Total time to complete Offline 
data collection: 		(    5) seconds.
Offline data collection
capabilities: 			 (0x71) SMART execute Offline immediate.
					No Auto Offline data collection support.
					Suspend Offline collection upon new
					command.
					No Offline surface scan supported.
					Self-test supported.
					Conveyance Self-test supported.
					Selective Self-test supported.
SMART capabilities:            (0x0003)	Saves SMART data before entering
					power-saving mode.
					Supports SMART auto save timer.
Error logging capability:        (0x01)	Error logging supported.
					General Purpose Logging supported.
Short self-test routine 
recommended polling time: 	 (   2) minutes.
Extended self-test routine
recommended polling time: 	 (   5) minutes.
Conveyance self-test routine
recommended polling time: 	 (   0) minutes.
SCT capabilities: 	       (0x003d)	SCT Status supported.
					SCT Error Recovery Control supported.
					SCT Feature Control supported.
					SCT Data Table supported.

SMART Attributes Data Structure revision number: 48
Vendor Specific SMART Attributes with Thresholds:
ID# ATTRIBUTE_NAME          FLAGS    VALUE WORST THRESH FAIL RAW_VALUE
  1 Raw_Read_Error_Rate     POSR-K   100   100   000    -    0
  5 Reallocated_Sector_Ct   PO--CK   100   100   010    -    0
  9 Power_On_Hours          -O--CK   100   100   000    -    21
 12 Power_Cycle_Count       -O--CK   100   100   000    -    16
100 Unknown_Attribute       -O--CK   100   100   000    -    17728
101 Unknown_Attribute       -O--CK   100   100   000    -    3632
170 Unknown_Attribute       -O--CK   100   100   000    -    0
171 Unknown_Attribute       -O--CK   100   100   000    -    0
172 Unknown_Attribute       -O--CK   100   100   000    -    0
174 Unknown_Attribute       -O--CK   100   100   000    -    9
175 Program_Fail_Count_Chip -O--CK   100   100   000    -    0
176 Erase_Fail_Count_Chip   -O--CK   100   100   000    -    0
177 Wear_Leveling_Count     -O--CK   100   100   000    -    10
178 Used_Rsvd_Blk_Cnt_Chip  -O----   100   100   000    -    0
180 Unused_Rsvd_Blk_Cnt_Tot -O----   100   100   000    -    695
183 Runtime_Bad_Block       -O--CK   100   100   000    -    0
187 Reported_Uncorrect      PO--CK   100   100   000    -    0
194 Temperature_Celsius     -O---K   046   100   000    -    46 (Min/Max 21/51)
195 Hardware_ECC_Recovered  -O--CK   100   100   000    -    0
196 Reallocated_Event_Count -O--CK   100   100   000    -    0
197 Current_Pending_Sector  -O--CK   100   100   000    -    0
199 UDMA_CRC_Error_Count    -O--C-   100   100   000    -    0
201 Unknown_SSD_Attribute   -O--CK   100   100   000    -    0
204 Soft_ECC_Correction     -O--CK   100   100   000    -    0
231 Temperature_Celsius     -O--CK   100   100   000    -    0
233 Media_Wearout_Indicator -O--CK   100   100   000    -    30
234 Unknown_Attribute       -O--CK   100   100   000    -    24
241 Total_LBAs_Written      -O--CK   100   100   000    -    28
242 Total_LBAs_Read         -O--CK   100   100   000    -    16
250 Read_Error_Retry_Rate   -O--CK   100   100   000    -    0
                            ||||||_ K auto-keep
                            |||||__ C event count
                            ||||___ R error rate
                            |||____ S speed/performance
                            ||_____ O updated online
                            |______ P prefailure warning

General Purpose Log Directory Version 1
SMART           Log Directory Version 1 [multi-sector log support]
Address    Access  R/W   Size  Description
0x00       GPL,SL  R/O      1  Log Directory
0x01           SL  R/O      1  Summary SMART error log
0x02           SL  R/O      1  Comprehensive SMART error log
0x03       GPL     R/O      1  Ext. Comprehensive SMART error log
0x04       GPL,SL  R/O      8  Device Statistics log
0x06           SL  R/O      1  SMART self-test log
0x07       GPL,SL  R/O      1  Extended self-test log
0x09           SL  R/W      1  Selective self-test log
0x0a       GPL     R/W      5  Device Statistics Notification
0x10       GPL     R/O      1  SATA NCQ Queued Error log
0x11       GPL     R/O      1  SATA Phy Event Counters log
0x30       GPL     R/O      9  IDENTIFY DEVICE data log
0x80-0x9f  GPL,SL  R/W     16  Host vendor specific log
0xa1           SL  VS       9  Device vendor specific log
0xab           SL  VS       1  Device vendor specific log
0xe0       GPL,SL  R/W      1  SCT Command/Status
0xe1       GPL,SL  R/W      1  SCT Data Transfer

SMART Extended Comprehensive Error Log Version: 0 (1 sectors)
No Errors Logged

SMART Extended Self-test Log Version: 0 (1 sectors)
Num  Test_Description    Status                  Remaining  LifeTime(hours)  LBA_of_first_error
# 1  Short offline       Completed without error       00%        21         -

SMART Selective self-test log data structure revision number 0
Note: revision number not 1 implies that no selective self-test has ever been run
 SPAN  MIN_LBA  MAX_LBA  CURRENT_TEST_STATUS
    1        0        0  Not_testing
    2        0        0  Not_testing
    3        0        0  Not_testing
    4        0        0  Not_testing
    5        0        0  Not_testing
Selective self-test flags (0x0):
  After scanning selected spans, do NOT read-scan remainder of disk.
If Selective self-test is pending on power-up, resume after 0 minute delay.

SCT Status Version:                  3
SCT Version (vendor specific):       1 (0x0001)
SCT Support Level:                   0
Device State:                        Active (0)
Current Temperature:                    45 Celsius
Power Cycle Min/Max Temperature:     36/45 Celsius
Lifetime    Min/Max Temperature:     21/51 Celsius
Under/Over Temperature Limit Count:   0/0
SMART Status:                        0xc24f (PASSED)

SCT Temperature History Version:     2
Temperature Sampling Period:         1 minute
Temperature Logging Interval:        1 minute
Min/Max recommended Temperature:      0/70 Celsius
Min/Max Temperature Limit:            0/85 Celsius
Temperature History Size (Index):    478 (344)

Index    Estimated Time   Temperature Celsius
 345    2017-06-12 05:41    50  *******************************
 ...    ..( 11 skipped).    ..  *******************************
 357    2017-06-12 05:53    50  *******************************
 358    2017-06-12 05:54    49  ******************************
 ...    ..( 16 skipped).    ..  ******************************
 375    2017-06-12 06:11    49  ******************************
 376    2017-06-12 06:12    48  *****************************
 ...    ..( 12 skipped).    ..  *****************************
 389    2017-06-12 06:25    48  *****************************
 390    2017-06-12 06:26    47  ****************************
 ...    ..( 18 skipped).    ..  ****************************
 409    2017-06-12 06:45    47  ****************************
 410    2017-06-12 06:46    48  *****************************
 ...    ..( 26 skipped).    ..  *****************************
 437    2017-06-12 07:13    48  *****************************
 438    2017-06-12 07:14    49  ******************************
 ...    ..(  3 skipped).    ..  ******************************
 442    2017-06-12 07:18    49  ******************************
 443    2017-06-12 07:19    48  *****************************
 ...    ..( 12 skipped).    ..  *****************************
 456    2017-06-12 07:32    48  *****************************
 457    2017-06-12 07:33    49  ******************************
 ...    ..( 19 skipped).    ..  ******************************
 477    2017-06-12 07:53    49  ******************************
   0    2017-06-12 07:54    48  *****************************
   1    2017-06-12 07:55    49  ******************************
   2    2017-06-12 07:56    48  *****************************
 ...    ..( 22 skipped).    ..  *****************************
  25    2017-06-12 08:19    48  *****************************
  26    2017-06-12 08:20     ?  -
  27    2017-06-12 08:21    48  *****************************
 ...    ..( 16 skipped).    ..  *****************************
  44    2017-06-12 08:38    48  *****************************
  45    2017-06-12 08:39    47  ****************************
 ...    ..( 10 skipped).    ..  ****************************
  56    2017-06-12 08:50    47  ****************************
  57    2017-06-12 08:51     ?  -
  58    2017-06-12 08:52    30  ***********
  59    2017-06-12 08:53    32  *************
  60    2017-06-12 08:54    33  **************
  61    2017-06-12 08:55    34  ***************
  62    2017-06-12 08:56    36  *****************
  63    2017-06-12 08:57    37  ******************
  64    2017-06-12 08:58    38  *******************
  65    2017-06-12 08:59    38  *******************
  66    2017-06-12 09:00    39  ********************
  67    2017-06-12 09:01    40  *********************
  68    2017-06-12 09:02    40  *********************
  69    2017-06-12 09:03    41  **********************
  70    2017-06-12 09:04    42  ***********************
  71    2017-06-12 09:05    42  ***********************
  72    2017-06-12 09:06    42  ***********************
  73    2017-06-12 09:07    43  ************************
 ...    ..(  3 skipped).    ..  ************************
  77    2017-06-12 09:11    43  ************************
  78    2017-06-12 09:12    44  *************************
 ...    ..( 18 skipped).    ..  *************************
  97    2017-06-12 09:31    44  *************************
  98    2017-06-12 09:32    45  **************************
 ...    ..(  3 skipped).    ..  **************************
 102    2017-06-12 09:36    45  **************************
 103    2017-06-12 09:37    46  ***************************
 ...    ..( 27 skipped).    ..  ***************************
 131    2017-06-12 10:05    46  ***************************
 132    2017-06-12 10:06    47  ****************************
 ...    ..( 21 skipped).    ..  ****************************
 154    2017-06-12 10:28    47  ****************************
 155    2017-06-12 10:29    48  *****************************
 ...    ..( 71 skipped).    ..  *****************************
 227    2017-06-12 11:41    48  *****************************
 228    2017-06-12 11:42     ?  -
 229    2017-06-12 11:43    48  *****************************
 ...    ..( 58 skipped).    ..  *****************************
 288    2017-06-12 12:42    48  *****************************
 289    2017-06-12 12:43    49  ******************************
 ...    ..( 37 skipped).    ..  ******************************
 327    2017-06-12 13:21    49  ******************************
 328    2017-06-12 13:22     ?  -
 329    2017-06-12 13:23    36  *****************
 330    2017-06-12 13:24    37  ******************
 331    2017-06-12 13:25    38  *******************
 332    2017-06-12 13:26    39  ********************
 333    2017-06-12 13:27    40  *********************
 334    2017-06-12 13:28    40  *********************
 335    2017-06-12 13:29    41  **********************
 336    2017-06-12 13:30    42  ***********************
 337    2017-06-12 13:31    42  ***********************
 338    2017-06-12 13:32    43  ************************
 339    2017-06-12 13:33    43  ************************
 340    2017-06-12 13:34    44  *************************
 341    2017-06-12 13:35    44  *************************
 342    2017-06-12 13:36    45  **************************
 343    2017-06-12 13:37    45  **************************
 344    2017-06-12 13:38    45  **************************

SCT Error Recovery Control:
           Read: Disabled
          Write: Disabled

Device Statistics (GP Log 0x04)
Page  Offset Size        Value Flags Description
0x01  =====  =               =  ===  == General Statistics (rev 1) ==
0x01  0x008  4              16  ---  Lifetime Power-On Resets
0x01  0x010  4              21  ---  Power-on Hours
0x01  0x018  6        58750455  ---  Logical Sectors Written
0x01  0x020  6          480592  ---  Number of Write Commands
0x01  0x028  6        35102724  ---  Logical Sectors Read
0x01  0x030  6          670945  ---  Number of Read Commands
0x01  0x038  6        77449450  ---  Date and Time TimeStamp
0x02  =====  =               =  ===  == Free-Fall Statistics (empty) ==
0x03  =====  =               =  ===  == Rotating Media Statistics (empty) ==
0x04  =====  =               =  ===  == General Errors Statistics (rev 1) ==
0x04  0x008  4               0  ---  Number of Reported Uncorrectable Errors
0x04  0x010  4             103  ---  Resets Between Cmd Acceptance and Completion
0x05  =====  =               =  ===  == Temperature Statistics (rev 1) ==
0x05  0x008  1              43  -D-  Current Temperature
0x05  0x010  1               -  -D-  Average Short Term Temperature
0x05  0x018  1               0  -D-  Average Long Term Temperature
0x05  0x020  1              51  ---  Highest Temperature
0x05  0x028  1              21  ---  Lowest Temperature
0x05  0x030  1               -  -D-  Highest Average Short Term Temperature
0x05  0x038  1               -  -D-  Lowest Average Short Term Temperature
0x05  0x040  1               -  -D-  Highest Average Long Term Temperature
0x05  0x048  1               -  -D-  Lowest Average Long Term Temperature
0x05  0x050  4               0  -D-  Time in Over-Temperature
0x05  0x058  1              70  ---  Specified Maximum Operating Temperature
0x05  0x060  4               0  -D-  Time in Under-Temperature
0x05  0x068  1               0  ---  Specified Minimum Operating Temperature
0x06  =====  =               =  ===  == Transport Statistics (rev 1) ==
0x06  0x008  4             103  ---  Number of Hardware Resets
0x06  0x018  4               0  ---  Number of Interface CRC Errors
0x07  =====  =               =  ===  == Solid State Device Statistics (rev 1) ==
0x07  0x008  1               0  ---  Percentage Used Endurance Indicator
                                |||_ C monitored condition met
                                ||__ D supports DSN
                                |___ N normalized value

SATA Phy Event Counters (GP Log 0x11)
ID      Size     Value  Description
0x0001  4            0  Command failed due to ICRC error
0x000a  4            4  Device-to-host register FISes sent due to a COMRESET

