smartctl 6.5 2016-05-07 r4318 [x86_64-linux-3.10.0-327.28.3.el7.x86_64] (local build)
Copyright (C) 2002-16, Bruce Allen, Christian Franke, www.smartmontools.org

=== START OF INFORMATION SECTION ===
Device Model:     Crucial_CT2050MX300SSD1
Firmware Version: M0CR031
User Capacity:    2,050,408,636,416 bytes [2.05 TB]
Sector Size:      512 bytes logical/physical
Rotation Rate:    Solid State Device
Form Factor:      2.5 inches
Device is:        Not in smartctl database [for details use: -P showall]
ATA Version is:   ACS-3 T13/2161-D revision 5
SATA Version is:  SATA 3.2, 6.0 Gb/s (current: 6.0 Gb/s)
Local Time is:    Wed Jan 11 10:56:03 2017 JST
SMART support is: Available - device has SMART capability.
SMART support is: Enabled
AAM feature is:   Unavailable
APM level is:     254 (maximum performance)
Rd look-ahead is: Enabled
Write cache is:   Enabled
ATA Security is:  Disabled, frozen [SEC2]
Wt Cache Reorder: Enabled

=== START OF READ SMART DATA SECTION ===
SMART overall-health self-assessment test result: PASSED

General SMART Values:
Offline data collection status:  (0x00)	Offline data collection activity
					was never started.
					Auto Offline Data Collection: Disabled.
Self-test execution status:      (   0)	The previous self-test routine completed
					without error or no self-test has ever 
					been run.
Total time to complete Offline 
data collection: 		( 4439) seconds.
Offline data collection
capabilities: 			 (0x7b) SMART execute Offline immediate.
					Auto Offline data collection on/off support.
					Suspend Offline collection upon new
					command.
					Offline surface scan supported.
					Self-test supported.
					Conveyance Self-test supported.
					Selective Self-test supported.
SMART capabilities:            (0x0003)	Saves SMART data before entering
					power-saving mode.
					Supports SMART auto save timer.
Error logging capability:        (0x01)	Error logging supported.
					General Purpose Logging supported.
Short self-test routine 
recommended polling time: 	 (   2) minutes.
Extended self-test routine
recommended polling time: 	 (  20) minutes.
Conveyance self-test routine
recommended polling time: 	 (   3) minutes.
SCT capabilities: 	       (0x0035)	SCT Status supported.
					SCT Feature Control supported.
					SCT Data Table supported.

SMART Attributes Data Structure revision number: 16
Vendor Specific SMART Attributes with Thresholds:
ID# ATTRIBUTE_NAME          FLAGS    VALUE WORST THRESH FAIL RAW_VALUE
  1 Raw_Read_Error_Rate     POSR-K   100   100   000    -    0
  5 Reallocated_Sector_Ct   -O--CK   100   100   010    -    0
  9 Power_On_Hours          -O--CK   100   100   000    -    398
 12 Power_Cycle_Count       -O--CK   100   100   000    -    1
171 Unknown_Attribute       -O--CK   100   100   000    -    0
172 Unknown_Attribute       -O--CK   100   100   000    -    0
173 Unknown_Attribute       -O--CK   100   100   000    -    3
174 Unknown_Attribute       -O--CK   100   100   000    -    0
183 Runtime_Bad_Block       -O--CK   100   100   000    -    0
184 End-to-End_Error        -O--CK   100   100   000    -    0
187 Reported_Uncorrect      -O--CK   100   100   000    -    0
194 Temperature_Celsius     -O---K   080   066   000    -    20 (Min/Max 17/34)
196 Reallocated_Event_Count -O--CK   100   100   000    -    0
197 Current_Pending_Sector  -O--CK   100   100   000    -    0
198 Offline_Uncorrectable   ----CK   100   100   000    -    0
199 UDMA_CRC_Error_Count    -O--CK   100   100   000    -    3
202 Unknown_SSD_Attribute   ----CK   100   100   001    -    0
206 Unknown_SSD_Attribute   -OSR--   100   100   000    -    0
246 Unknown_Attribute       -O--CK   100   100   000    -    9059139770
247 Unknown_Attribute       -O--CK   100   100   000    -    283196228
248 Unknown_Attribute       -O--CK   100   100   000    -    118724233
180 Unused_Rsvd_Blk_Cnt_Tot PO--CK   000   000   000    -    9101
210 Unknown_Attribute       -O--CK   100   100   000    -    0
                            ||||||_ K auto-keep
                            |||||__ C event count
                            ||||___ R error rate
                            |||____ S speed/performance
                            ||_____ O updated online
                            |______ P prefailure warning

General Purpose Log Directory Version 1
SMART           Log Directory Version 1 [multi-sector log support]
Address    Access  R/W   Size  Description
0x00       GPL,SL  R/O      1  Log Directory
0x01           SL  R/O      1  Summary SMART error log
0x02           SL  R/O     51  Comprehensive SMART error log
0x03       GPL     R/O  16383  Ext. Comprehensive SMART error log
0x04       GPL,SL  R/O      8  Device Statistics log
0x06           SL  R/O      1  SMART self-test log
0x07       GPL     R/O      1  Extended self-test log
0x09           SL  R/W      1  Selective self-test log
0x10       GPL     R/O      1  SATA NCQ Queued Error log
0x11       GPL     R/O      1  SATA Phy Event Counters log
0x13       GPL     R/O      1  SATA NCQ Send and Receive log
0x24       GPL     R/O   8000  Current Device Internal Status Data log
0x25       GPL     R/O   8000  Saved Device Internal Status Data log
0x30       GPL,SL  R/O      9  IDENTIFY DEVICE data log
0x80-0x9f  GPL,SL  R/W     16  Host vendor specific log
0xa0       GPL     VS   35328  Device vendor specific log
0xa1       GPL,SL  VS       3  Device vendor specific log
0xa2       GPL,SL  VS       1  Device vendor specific log
0xa3       GPL     VS   13824  Device vendor specific log
0xa4       GPL     VS     354  Device vendor specific log
0xa4       SL      VS      98  Device vendor specific log
0xa5       GPL     VS    8000  Device vendor specific log
0xa5       SL      VS      64  Device vendor specific log
0xa6       GPL     VS    8000  Device vendor specific log
0xa6       SL      VS      64  Device vendor specific log
0xa7-0xdf  GPL,SL  VS       1  Device vendor specific log
0xe0       GPL,SL  R/W      1  SCT Command/Status
0xe1       GPL,SL  R/W      1  SCT Data Transfer

SMART Extended Comprehensive Error Log Version: 1 (16383 sectors)
No Errors Logged

SMART Extended Self-test Log Version: 1 (1 sectors)
Num  Test_Description    Status                  Remaining  LifeTime(hours)  LBA_of_first_error
# 1  Short offline       Completed without error       00%       398         -

SMART Selective self-test log data structure revision number 1
 SPAN  MIN_LBA  MAX_LBA  CURRENT_TEST_STATUS
    1        0        0  Not_testing
    2        0        0  Not_testing
    3        0        0  Completed [00% left] (57881389-57946924)
    4        0        0  Not_testing
    5        0        0  Not_testing
Selective self-test flags (0x0):
  After scanning selected spans, do NOT read-scan remainder of disk.
If Selective self-test is pending on power-up, resume after 0 minute delay.

SCT Status Version:                  3
SCT Version (vendor specific):       1 (0x0001)
SCT Support Level:                   0
Device State:                        Active (0)
Current Temperature:                    20 Celsius
Power Cycle Min/Max Temperature:     17/29 Celsius
Lifetime    Min/Max Temperature:     17/34 Celsius
Under/Over Temperature Limit Count:   0/0

SCT Temperature History Version:     2
Temperature Sampling Period:         1 minute
Temperature Logging Interval:        1 minute
Min/Max recommended Temperature:      0/70 Celsius
Min/Max Temperature Limit:           -5/75 Celsius
Temperature History Size (Index):    478 (309)

Index    Estimated Time   Temperature Celsius
 310    2017-01-11 02:59    21  **
 311    2017-01-11 03:00    21  **
 312    2017-01-11 03:01    22  ***
 ...    ..(  2 skipped).    ..  ***
 315    2017-01-11 03:04    22  ***
 316    2017-01-11 03:05    21  **
 317    2017-01-11 03:06    21  **
 318    2017-01-11 03:07    22  ***
 319    2017-01-11 03:08    22  ***
 320    2017-01-11 03:09    22  ***
 321    2017-01-11 03:10    21  **
 322    2017-01-11 03:11    22  ***
 323    2017-01-11 03:12    21  **
 324    2017-01-11 03:13    21  **
 325    2017-01-11 03:14    22  ***
 326    2017-01-11 03:15    21  **
 ...    ..(  3 skipped).    ..  **
 330    2017-01-11 03:19    21  **
 331    2017-01-11 03:20    22  ***
 332    2017-01-11 03:21    21  **
 ...    ..( 25 skipped).    ..  **
 358    2017-01-11 03:47    21  **
 359    2017-01-11 03:48    22  ***
 360    2017-01-11 03:49    22  ***
 361    2017-01-11 03:50    23  ****
 362    2017-01-11 03:51    23  ****
 363    2017-01-11 03:52    23  ****
 364    2017-01-11 03:53    24  *****
 365    2017-01-11 03:54    23  ****
 ...    ..(  2 skipped).    ..  ****
 368    2017-01-11 03:57    23  ****
 369    2017-01-11 03:58    21  **
 370    2017-01-11 03:59    21  **
 371    2017-01-11 04:00    22  ***
 372    2017-01-11 04:01    21  **
 ...    ..(  5 skipped).    ..  **
 378    2017-01-11 04:07    21  **
 379    2017-01-11 04:08    20  *
 380    2017-01-11 04:09    21  **
 381    2017-01-11 04:10    22  ***
 382    2017-01-11 04:11    20  *
 383    2017-01-11 04:12    20  *
 384    2017-01-11 04:13    20  *
 385    2017-01-11 04:14    21  **
 386    2017-01-11 04:15    20  *
 387    2017-01-11 04:16    20  *
 388    2017-01-11 04:17    21  **
 389    2017-01-11 04:18    20  *
 390    2017-01-11 04:19    20  *
 391    2017-01-11 04:20    21  **
 392    2017-01-11 04:21    20  *
 ...    ..(  2 skipped).    ..  *
 395    2017-01-11 04:24    20  *
 396    2017-01-11 04:25    21  **
 ...    ..(  2 skipped).    ..  **
 399    2017-01-11 04:28    21  **
 400    2017-01-11 04:29    20  *
 ...    ..( 19 skipped).    ..  *
 420    2017-01-11 04:49    20  *
 421    2017-01-11 04:50    21  **
 422    2017-01-11 04:51    20  *
 ...    ..( 22 skipped).    ..  *
 445    2017-01-11 05:14    20  *
 446    2017-01-11 05:15    21  **
 447    2017-01-11 05:16    20  *
 ...    ..(  2 skipped).    ..  *
 450    2017-01-11 05:19    20  *
 451    2017-01-11 05:20    21  **
 452    2017-01-11 05:21    21  **
 453    2017-01-11 05:22    20  *
 ...    ..(  4 skipped).    ..  *
 458    2017-01-11 05:27    20  *
 459    2017-01-11 05:28    21  **
 460    2017-01-11 05:29    20  *
 461    2017-01-11 05:30    20  *
 462    2017-01-11 05:31    21  **
 463    2017-01-11 05:32    21  **
 464    2017-01-11 05:33    20  *
 ...    ..( 10 skipped).    ..  *
 475    2017-01-11 05:44    20  *
 476    2017-01-11 05:45    21  **
 477    2017-01-11 05:46    20  *
   0    2017-01-11 05:47    22  ***
   1    2017-01-11 05:48    23  ****
   2    2017-01-11 05:49    22  ***
 ...    ..( 23 skipped).    ..  ***
  26    2017-01-11 06:13    22  ***
  27    2017-01-11 06:14    23  ****
  28    2017-01-11 06:15    22  ***
 ...    ..( 17 skipped).    ..  ***
  46    2017-01-11 06:33    22  ***
  47    2017-01-11 06:34    21  **
  48    2017-01-11 06:35    21  **
  49    2017-01-11 06:36    22  ***
 ...    ..(  2 skipped).    ..  ***
  52    2017-01-11 06:39    22  ***
  53    2017-01-11 06:40    21  **
  54    2017-01-11 06:41    21  **
  55    2017-01-11 06:42    22  ***
  56    2017-01-11 06:43    21  **
  57    2017-01-11 06:44    22  ***
  58    2017-01-11 06:45    21  **
  59    2017-01-11 06:46    21  **
  60    2017-01-11 06:47    21  **
  61    2017-01-11 06:48    22  ***
  62    2017-01-11 06:49    21  **
  63    2017-01-11 06:50    21  **
  64    2017-01-11 06:51    21  **
  65    2017-01-11 06:52    23  ****
  66    2017-01-11 06:53    21  **
  67    2017-01-11 06:54    21  **
  68    2017-01-11 06:55    21  **
  69    2017-01-11 06:56    22  ***
 ...    ..(  2 skipped).    ..  ***
  72    2017-01-11 06:59    22  ***
  73    2017-01-11 07:00    21  **
  74    2017-01-11 07:01    21  **
  75    2017-01-11 07:02    22  ***
 ...    ..(  2 skipped).    ..  ***
  78    2017-01-11 07:05    22  ***
  79    2017-01-11 07:06    21  **
  80    2017-01-11 07:07    21  **
  81    2017-01-11 07:08    22  ***
  82    2017-01-11 07:09    22  ***
  83    2017-01-11 07:10    21  **
  84    2017-01-11 07:11    22  ***
  85    2017-01-11 07:12    21  **
  86    2017-01-11 07:13    21  **
  87    2017-01-11 07:14    22  ***
  88    2017-01-11 07:15    22  ***
  89    2017-01-11 07:16    21  **
  90    2017-01-11 07:17    22  ***
  91    2017-01-11 07:18    23  ****
  92    2017-01-11 07:19    22  ***
  93    2017-01-11 07:20    21  **
  94    2017-01-11 07:21    21  **
  95    2017-01-11 07:22    21  **
  96    2017-01-11 07:23    22  ***
  97    2017-01-11 07:24    21  **
 ...    ..( 16 skipped).    ..  **
 114    2017-01-11 07:41    21  **
 115    2017-01-11 07:42    22  ***
 116    2017-01-11 07:43    21  **
 ...    ..( 10 skipped).    ..  **
 127    2017-01-11 07:54    21  **
 128    2017-01-11 07:55    22  ***
 129    2017-01-11 07:56    21  **
 130    2017-01-11 07:57    22  ***
 131    2017-01-11 07:58    22  ***
 132    2017-01-11 07:59    22  ***
 133    2017-01-11 08:00    21  **
 134    2017-01-11 08:01    21  **
 135    2017-01-11 08:02    21  **
 136    2017-01-11 08:03    22  ***
 137    2017-01-11 08:04    21  **
 ...    ..(  3 skipped).    ..  **
 141    2017-01-11 08:08    21  **
 142    2017-01-11 08:09    22  ***
 143    2017-01-11 08:10    21  **
 144    2017-01-11 08:11    21  **
 145    2017-01-11 08:12    22  ***
 146    2017-01-11 08:13    21  **
 147    2017-01-11 08:14    22  ***
 148    2017-01-11 08:15    21  **
 149    2017-01-11 08:16    21  **
 150    2017-01-11 08:17    22  ***
 151    2017-01-11 08:18    21  **
 152    2017-01-11 08:19    22  ***
 153    2017-01-11 08:20    21  **
 ...    ..( 22 skipped).    ..  **
 176    2017-01-11 08:43    21  **
 177    2017-01-11 08:44    20  *
 178    2017-01-11 08:45    21  **
 179    2017-01-11 08:46    20  *
 180    2017-01-11 08:47    20  *
 181    2017-01-11 08:48    21  **
 182    2017-01-11 08:49    20  *
 183    2017-01-11 08:50    20  *
 184    2017-01-11 08:51    21  **
 ...    ..(  3 skipped).    ..  **
 188    2017-01-11 08:55    21  **
 189    2017-01-11 08:56    22  ***
 190    2017-01-11 08:57    21  **
 ...    ..( 45 skipped).    ..  **
 236    2017-01-11 09:43    21  **
 237    2017-01-11 09:44    22  ***
 238    2017-01-11 09:45    21  **
 239    2017-01-11 09:46    22  ***
 240    2017-01-11 09:47    21  **
 ...    ..(  2 skipped).    ..  **
 243    2017-01-11 09:50    21  **
 244    2017-01-11 09:51    22  ***
 245    2017-01-11 09:52    21  **
 246    2017-01-11 09:53    21  **
 247    2017-01-11 09:54    22  ***
 248    2017-01-11 09:55    22  ***
 249    2017-01-11 09:56    21  **
 250    2017-01-11 09:57    21  **
 251    2017-01-11 09:58    21  **
 252    2017-01-11 09:59    22  ***
 253    2017-01-11 10:00    21  **
 254    2017-01-11 10:01    22  ***
 ...    ..(  5 skipped).    ..  ***
 260    2017-01-11 10:07    22  ***
 261    2017-01-11 10:08    21  **
 262    2017-01-11 10:09    21  **
 263    2017-01-11 10:10    21  **
 264    2017-01-11 10:11    22  ***
 265    2017-01-11 10:12    22  ***
 266    2017-01-11 10:13    22  ***
 267    2017-01-11 10:14    21  **
 268    2017-01-11 10:15    23  ****
 269    2017-01-11 10:16    21  **
 270    2017-01-11 10:17    21  **
 271    2017-01-11 10:18    22  ***
 272    2017-01-11 10:19    22  ***
 273    2017-01-11 10:20    22  ***
 274    2017-01-11 10:21    21  **
 275    2017-01-11 10:22    22  ***
 276    2017-01-11 10:23    21  **
 277    2017-01-11 10:24    21  **
 278    2017-01-11 10:25    22  ***
 279    2017-01-11 10:26    21  **
 ...    ..( 12 skipped).    ..  **
 292    2017-01-11 10:39    21  **
 293    2017-01-11 10:40    22  ***
 294    2017-01-11 10:41    21  **
 ...    ..(  9 skipped).    ..  **
 304    2017-01-11 10:51    21  **
 305    2017-01-11 10:52    22  ***
 ...    ..(  3 skipped).    ..  ***
 309    2017-01-11 10:56    22  ***

SCT Error Recovery Control command not supported

Device Statistics (GP Log 0x04)
Page  Offset Size        Value Flags Description
0x01  =====  =               =  ===  == General Statistics (rev 1) ==
0x01  0x008  4               1  ---  Lifetime Power-On Resets
0x01  0x010  4             398  ---  Power-on Hours
0x01  0x018  6      9059139770  ---  Logical Sectors Written
0x01  0x020  6       107362085  ---  Number of Write Commands
0x01  0x028  6     14696222899  ---  Logical Sectors Read
0x01  0x030  6       119532796  ---  Number of Read Commands
0x04  =====  =               =  ===  == General Errors Statistics (rev 1) ==
0x04  0x008  4               0  ---  Number of Reported Uncorrectable Errors
0x04  0x010  4               1  ---  Resets Between Cmd Acceptance and Completion
0x05  =====  =               =  ===  == Temperature Statistics (rev 1) ==
0x05  0x008  1              20  ---  Current Temperature
0x05  0x010  1              20  ---  Average Short Term Temperature
0x05  0x018  1               -  ---  Average Long Term Temperature
0x05  0x020  1              34  ---  Highest Temperature
0x05  0x028  1              17  ---  Lowest Temperature
0x05  0x030  1              22  ---  Highest Average Short Term Temperature
0x05  0x038  1              19  ---  Lowest Average Short Term Temperature
0x05  0x040  1               -  ---  Highest Average Long Term Temperature
0x05  0x048  1               -  ---  Lowest Average Long Term Temperature
0x05  0x050  4               0  ---  Time in Over-Temperature
0x05  0x058  1              70  ---  Specified Maximum Operating Temperature
0x05  0x060  4               0  ---  Time in Under-Temperature
0x05  0x068  1               0  ---  Specified Minimum Operating Temperature
0x06  =====  =               =  ===  == Transport Statistics (rev 1) ==
0x06  0x008  4               7  ---  Number of Hardware Resets
0x06  0x010  4               1  ---  Number of ASR Events
0x06  0x018  4               3  ---  Number of Interface CRC Errors
0x07  =====  =               =  ===  == Solid State Device Statistics (rev 1) ==
0x07  0x008  1               0  N--  Percentage Used Endurance Indicator
                                |||_ C monitored condition met
                                ||__ D supports DSN
                                |___ N normalized value

SATA Phy Event Counters (GP Log 0x11)
ID      Size     Value  Description
0x0001  4            3  Command failed due to ICRC error
0x000a  4            7  Device-to-host register FISes sent due to a COMRESET

