smartctl 7.3 2022-02-28 r5338 [x86_64-w64-mingw32-w10-b19045] (sf-7.3-1)
Copyright (C) 2002-22, Bruce Allen, Christian Franke, www.smartmontools.org

=== START OF INFORMATION SECTION ===
Device Model:     WDC WD101EFAX-68LDBN0
Firmware Version: 81.00A81
User Capacity:    10,000,831,348,736 bytes [10.0 TB]
Sector Sizes:     512 bytes logical, 4096 bytes physical
Rotation Rate:    5400 rpm
Form Factor:      3.5 inches
Device is:        Not in smartctl database 7.3/5440
ATA Version is:   ACS-2, ATA8-ACS T13/1699-D revision 4
SATA Version is:  SATA 3.2, 6.0 Gb/s (current: 6.0 Gb/s)
Local Time is:    Mon Mar 20 22:53:03 2023 GMTST
SMART support is: Available - device has SMART capability.
SMART support is: Enabled
AAM feature is:   Unavailable
APM level is:     164 (intermediate level without standby)
Rd look-ahead is: Enabled
Write cache is:   Enabled
DSN feature is:   Unavailable
ATA Security is:  Disabled, frozen [SEC2]
Wt Cache Reorder: Enabled

=== START OF READ SMART DATA SECTION ===
SMART overall-health self-assessment test result: PASSED

General SMART Values:
Offline data collection status:  (0x80)	Offline data collection activity
					was never started.
					Auto Offline Data Collection: Enabled.
Self-test execution status:      (   0)	The previous self-test routine completed
					without error or no self-test has ever 
					been run.
Total time to complete Offline 
data collection: 		(   87) seconds.
Offline data collection
capabilities: 			 (0x5b) SMART execute Offline immediate.
					Auto Offline data collection on/off support.
					Suspend Offline collection upon new
					command.
					Offline surface scan supported.
					Self-test supported.
					No Conveyance Self-test supported.
					Selective Self-test supported.
SMART capabilities:            (0x0003)	Saves SMART data before entering
					power-saving mode.
					Supports SMART auto save timer.
Error logging capability:        (0x01)	Error logging supported.
					General Purpose Logging supported.
Short self-test routine 
recommended polling time: 	 (   2) minutes.
Extended self-test routine
recommended polling time: 	 (1049) minutes.
SCT capabilities: 	       (0x003d)	SCT Status supported.
					SCT Error Recovery Control supported.
					SCT Feature Control supported.
					SCT Data Table supported.

SMART Attributes Data Structure revision number: 16
Vendor Specific SMART Attributes with Thresholds:
ID# ATTRIBUTE_NAME          FLAGS    VALUE WORST THRESH FAIL RAW_VALUE
  1 Raw_Read_Error_Rate     PO-R--   100   100   016    -    0
  2 Throughput_Performance  --S---   128   128   054    -    108
  3 Spin_Up_Time            POS---   133   133   024    -    611 (Average 611)
  4 Start_Stop_Count        -O--C-   100   100   000    -    1330
  5 Reallocated_Sector_Ct   PO--CK   100   100   005    -    0
  7 Seek_Error_Rate         -O-R--   100   100   067    -    0
  8 Seek_Time_Performance   --S---   128   128   020    -    18
  9 Power_On_Hours          -O--C-   100   100   000    -    1928
 10 Spin_Retry_Count        -O--C-   100   100   060    -    0
 12 Power_Cycle_Count       -O--CK   100   100   000    -    193
192 Power-Off_Retract_Count -O--CK   099   099   000    -    1826
193 Load_Cycle_Count        -O--C-   099   099   000    -    1826
194 Temperature_Celsius     -O----   151   151   000    -    43 (Min/Max 12/52)
196 Reallocated_Event_Count -O--CK   100   100   000    -    0
197 Current_Pending_Sector  -O---K   100   100   000    -    0
198 Offline_Uncorrectable   ---R--   100   100   000    -    0
199 UDMA_CRC_Error_Count    -O-R--   200   200   000    -    0
                            ||||||_ K auto-keep
                            |||||__ C event count
                            ||||___ R error rate
                            |||____ S speed/performance
                            ||_____ O updated online
                            |______ P prefailure warning

General Purpose Log Directory Version 1
SMART           Log Directory Version 1 [multi-sector log support]
Address    Access  R/W   Size  Description
0x00       GPL,SL  R/O      1  Log Directory
0x01           SL  R/O      1  Summary SMART error log
0x02           SL  R/O      1  Comprehensive SMART error log
0x03       GPL     R/O      1  Ext. Comprehensive SMART error log
0x04       GPL     R/O    256  Device Statistics log
0x04       SL      R/O    255  Device Statistics log
0x06           SL  R/O      1  SMART self-test log
0x07       GPL     R/O      1  Extended self-test log
0x08       GPL     R/O      2  Power Conditions log
0x09           SL  R/W      1  Selective self-test log
0x0c       GPL     R/O   5501  Pending Defects log
0x10       GPL     R/O      1  NCQ Command Error log
0x11       GPL     R/O      1  SATA Phy Event Counters log
0x12       GPL     R/O      1  SATA NCQ Non-Data log
0x13       GPL     R/O      1  SATA NCQ Send and Receive log
0x15       GPL     R/W      1  Rebuild Assist log
0x21       GPL     R/O      1  Write stream error log
0x22       GPL     R/O      1  Read stream error log
0x24       GPL     R/O    256  Current Device Internal Status Data log
0x25       GPL     R/O    256  Saved Device Internal Status Data log
0x2f       GPL     -        1  Set Sector Configuration
0x30       GPL,SL  R/O      9  IDENTIFY DEVICE data log
0x80-0x9f  GPL,SL  R/W     16  Host vendor specific log
0xe0       GPL,SL  R/W      1  SCT Command/Status
0xe1       GPL,SL  R/W      1  SCT Data Transfer

SMART Extended Comprehensive Error Log Version: 1 (1 sectors)
No Errors Logged

SMART Extended Self-test Log Version: 1 (1 sectors)
Num  Test_Description    Status                  Remaining  LifeTime(hours)  LBA_of_first_error
# 1  Short offline       Completed without error       00%      1928         -
# 2  Short offline       Completed without error       00%      1922         -
# 3  Short offline       Completed without error       00%      1922         -
# 4  Short offline       Completed without error       00%       849         -
# 5  Short offline       Completed without error       00%       781         -
# 6  Short offline       Completed without error       00%       525         -
# 7  Short offline       Completed without error       00%       477         -
# 8  Extended offline    Completed without error       00%       160         -
# 9  Extended offline    Aborted by host               10%       141         -
#10  Short offline       Completed without error       00%       127         -
#11  Extended offline    Completed without error       00%        46         -
#12  Short offline       Completed without error       00%        15         -
#13  Extended offline    Aborted by host               80%         1         -
#14  Short offline       Completed without error       00%         0         -

SMART Selective self-test log data structure revision number 1
 SPAN  MIN_LBA  MAX_LBA  CURRENT_TEST_STATUS
    1        0        0  Not_testing
    2        0        0  Not_testing
    3        0        0  Not_testing
    4        0        0  Not_testing
    5        0        0  Not_testing
Selective self-test flags (0x0):
  After scanning selected spans, do NOT read-scan remainder of disk.
If Selective self-test is pending on power-up, resume after 0 minute delay.

SCT Status Version:                  3
SCT Version (vendor specific):       256 (0x0100)
Device State:                        Active (0)
Current Temperature:                    43 Celsius
Power Cycle Min/Max Temperature:     20/47 Celsius
Lifetime    Min/Max Temperature:     12/52 Celsius
Under/Over Temperature Limit Count:   0/0

SCT Temperature History Version:     2
Temperature Sampling Period:         1 minute
Temperature Logging Interval:        1 minute
Min/Max recommended Temperature:      0/65 Celsius
Min/Max Temperature Limit:           -40/70 Celsius
Temperature History Size (Index):    128 (39)

Index    Estimated Time   Temperature Celsius
  40    2023-03-20 20:46    46  ***************************
 ...    ..( 12 skipped).    ..  ***************************
  53    2023-03-20 20:59    46  ***************************
  54    2023-03-20 21:00    47  ****************************
  55    2023-03-20 21:01    47  ****************************
  56    2023-03-20 21:02    47  ****************************
  57    2023-03-20 21:03    46  ***************************
 ...    ..(  9 skipped).    ..  ***************************
  67    2023-03-20 21:13    46  ***************************
  68    2023-03-20 21:14    47  ****************************
 ...    ..(  3 skipped).    ..  ****************************
  72    2023-03-20 21:18    47  ****************************
  73    2023-03-20 21:19    46  ***************************
  74    2023-03-20 21:20    45  **************************
  75    2023-03-20 21:21    44  *************************
  76    2023-03-20 21:22    44  *************************
  77    2023-03-20 21:23    43  ************************
  78    2023-03-20 21:24    42  ***********************
  79    2023-03-20 21:25    42  ***********************
  80    2023-03-20 21:26    41  **********************
  81    2023-03-20 21:27    41  **********************
  82    2023-03-20 21:28    40  *********************
  83    2023-03-20 21:29    40  *********************
  84    2023-03-20 21:30    39  ********************
  85    2023-03-20 21:31    39  ********************
  86    2023-03-20 21:32    39  ********************
  87    2023-03-20 21:33    38  *******************
 ...    ..(  2 skipped).    ..  *******************
  90    2023-03-20 21:36    38  *******************
  91    2023-03-20 21:37    37  ******************
 ...    ..(  3 skipped).    ..  ******************
  95    2023-03-20 21:41    37  ******************
  96    2023-03-20 21:42    36  *****************
 ...    ..(  4 skipped).    ..  *****************
 101    2023-03-20 21:47    36  *****************
 102    2023-03-20 21:48    35  ****************
 ...    ..(  9 skipped).    ..  ****************
 112    2023-03-20 21:58    35  ****************
 113    2023-03-20 21:59    34  ***************
 ...    ..( 12 skipped).    ..  ***************
 126    2023-03-20 22:12    34  ***************
 127    2023-03-20 22:13    33  **************
 ...    ..( 18 skipped).    ..  **************
  18    2023-03-20 22:32    33  **************
  19    2023-03-20 22:33    34  ***************
  20    2023-03-20 22:34    34  ***************
  21    2023-03-20 22:35    35  ****************
  22    2023-03-20 22:36    35  ****************
  23    2023-03-20 22:37    36  *****************
  24    2023-03-20 22:38    37  ******************
  25    2023-03-20 22:39    37  ******************
  26    2023-03-20 22:40    38  *******************
  27    2023-03-20 22:41    39  ********************
  28    2023-03-20 22:42    39  ********************
  29    2023-03-20 22:43    40  *********************
  30    2023-03-20 22:44    40  *********************
  31    2023-03-20 22:45    40  *********************
  32    2023-03-20 22:46    41  **********************
  33    2023-03-20 22:47    41  **********************
  34    2023-03-20 22:48    42  ***********************
 ...    ..(  2 skipped).    ..  ***********************
  37    2023-03-20 22:51    42  ***********************
  38    2023-03-20 22:52    43  ************************
  39    2023-03-20 22:53    46  ***************************

SCT Error Recovery Control:
           Read:     70 (7.0 seconds)
          Write:     70 (7.0 seconds)

Device Statistics (GP Log 0x04)
Page  Offset Size        Value Flags Description
0x01  =====  =               =  ===  == General Statistics (rev 1) ==
0x01  0x008  4             193  ---  Lifetime Power-On Resets
0x01  0x010  4            1928  ---  Power-on Hours
0x01  0x018  6     37208317550  ---  Logical Sectors Written
0x01  0x020  6        83826461  ---  Number of Write Commands
0x01  0x028  6     20086059493  ---  Logical Sectors Read
0x01  0x030  6        21586682  ---  Number of Read Commands
0x01  0x038  6   1679057756322  ---  Date and Time TimeStamp
0x03  =====  =               =  ===  == Rotating Media Statistics (rev 1) ==
0x03  0x008  4             508  ---  Spindle Motor Power-on Hours
0x03  0x010  4             508  ---  Head Flying Hours
0x03  0x018  4            1826  ---  Head Load Events
0x03  0x020  4               0  ---  Number of Reallocated Logical Sectors
0x03  0x028  4               0  ---  Read Recovery Attempts
0x03  0x030  4               0  ---  Number of Mechanical Start Failures
0x04  =====  =               =  ===  == General Errors Statistics (rev 1) ==
0x04  0x008  4               0  ---  Number of Reported Uncorrectable Errors
0x04  0x010  4               0  ---  Resets Between Cmd Acceptance and Completion
0x05  =====  =               =  ===  == Temperature Statistics (rev 1) ==
0x05  0x008  1              43  ---  Current Temperature
0x05  0x010  1              37  N--  Average Short Term Temperature
0x05  0x018  1              33  N--  Average Long Term Temperature
0x05  0x020  1              52  ---  Highest Temperature
0x05  0x028  1              12  ---  Lowest Temperature
0x05  0x030  1              45  N--  Highest Average Short Term Temperature
0x05  0x038  1              21  N--  Lowest Average Short Term Temperature
0x05  0x040  1              35  N--  Highest Average Long Term Temperature
0x05  0x048  1              25  N--  Lowest Average Long Term Temperature
0x05  0x050  4               0  ---  Time in Over-Temperature
0x05  0x058  1              65  ---  Specified Maximum Operating Temperature
0x05  0x060  4               0  ---  Time in Under-Temperature
0x05  0x068  1               0  ---  Specified Minimum Operating Temperature
0x06  =====  =               =  ===  == Transport Statistics (rev 1) ==
0x06  0x008  4            1912  ---  Number of Hardware Resets
0x06  0x010  4             260  ---  Number of ASR Events
0x06  0x018  4               0  ---  Number of Interface CRC Errors
0xff  =====  =               =  ===  == Vendor Specific Statistics (rev 1) ==
                                |||_ C monitored condition met
                                ||__ D supports DSN
                                |___ N normalized value

Pending Defects log (GP Log 0x0c)
No Defects Logged

SATA Phy Event Counters (GP Log 0x11)
ID      Size     Value  Description
0x0001  2            0  Command failed due to ICRC error
0x0002  2            0  R_ERR response for data FIS
0x0003  2            0  R_ERR response for device-to-host data FIS
0x0004  2            0  R_ERR response for host-to-device data FIS
0x0005  2            0  R_ERR response for non-data FIS
0x0006  2            0  R_ERR response for device-to-host non-data FIS
0x0007  2            0  R_ERR response for host-to-device non-data FIS
0x0008  2            0  Device-to-host non-data FIS retries
0x0009  2            4  Transition from drive PhyRdy to drive PhyNRdy
0x000a  2            4  Device-to-host register FISes sent due to a COMRESET
0x000b  2            0  CRC errors within host-to-device FIS
0x000d  2            0  Non-CRC errors within host-to-device FIS

