smartctl 6.6 2017-11-05 r4594 [x86_64-linux-4.19.0-5-amd64] (local build)
Copyright (C) 2002-17, Bruce Allen, Christian Franke, www.smartmontools.org

=== START OF INFORMATION SECTION ===
Device Model:     INTEL SSDSC2BF240A5L
Serial Number:    CVTR541402JT240CGN
LU WWN Device Id: 5 5cd2e4 14c98be14
Firmware Version: LUDi
User Capacity:    240 057 409 536 bytes [240 GB]
Sector Size:      512 bytes logical/physical
Rotation Rate:    Solid State Device
Device is:        Not in smartctl database [for details use: -P showall]
ATA Version is:   ACS-3 (minor revision not indicated)
SATA Version is:  SATA 3.2, 6.0 Gb/s (current: 6.0 Gb/s)
Local Time is:    Tue Aug 27 12:45:13 2019 MSK
SMART support is: Available - device has SMART capability.
SMART support is: Enabled
AAM feature is:   Unavailable
APM level is:     254 (maximum performance)
Rd look-ahead is: Enabled
Write cache is:   Enabled
DSN feature is:   Unavailable
ATA Security is:  Disabled, frozen [SEC2]
Wt Cache Reorder: Unavailable

=== START OF READ SMART DATA SECTION ===
SMART overall-health self-assessment test result: PASSED

General SMART Values:
Offline data collection status:  (0x00)	Offline data collection activity
					was never started.
					Auto Offline Data Collection: Disabled.
Self-test execution status:      (   0)	The previous self-test routine completed
					without error or no self-test has ever 
					been run.
Total time to complete Offline 
data collection: 		( 5860) seconds.
Offline data collection
capabilities: 			 (0x7b) SMART execute Offline immediate.
					Auto Offline data collection on/off support.
					Suspend Offline collection upon new
					command.
					Offline surface scan supported.
					Self-test supported.
					Conveyance Self-test supported.
					Selective Self-test supported.
SMART capabilities:            (0x0003)	Saves SMART data before entering
					power-saving mode.
					Supports SMART auto save timer.
Error logging capability:        (0x01)	Error logging supported.
					General Purpose Logging supported.
Short self-test routine 
recommended polling time: 	 (   2) minutes.
Extended self-test routine
recommended polling time: 	 (  58) minutes.
Conveyance self-test routine
recommended polling time: 	 (   4) minutes.
SCT capabilities: 	       (0x0025)	SCT Status supported.
					SCT Data Table supported.

SMART Attributes Data Structure revision number: 10
Vendor Specific SMART Attributes with Thresholds:
ID# ATTRIBUTE_NAME          FLAGS    VALUE WORST THRESH FAIL RAW_VALUE
  5 Reallocated_Sector_Ct   -O--CK   100   100   000    -    71
  9 Power_On_Hours          -O--CK   100   100   000    -    3523
 12 Power_Cycle_Count       -O--CK   100   100   000    -    2070
170 Unknown_Attribute       PO--CK   100   100   010    -    71
171 Unknown_Attribute       -O--CK   100   100   000    -    0
172 Unknown_Attribute       -O--CK   100   100   000    -    0
173 Unknown_Attribute       -O--CK   100   100   000    -    131
174 Unknown_Attribute       -O--CK   100   100   000    -    19
183 Runtime_Bad_Block       -O--CK   100   100   000    -    0
184 End-to-End_Error        PO--CK   100   100   090    -    0
187 Reported_Uncorrect      -O--CK   100   100   000    -    0
190 Airflow_Temperature_Cel -O--CK   034   100   000    -    34 (Min/Max 6/49)
192 Power-Off_Retract_Count -O--CK   100   100   000    -    19
194 Temperature_Celsius     -O--CK   034   100   000    -    34 (Min/Max 6/49)
199 UDMA_CRC_Error_Count    -O--CK   100   100   000    -    0
225 Unknown_SSD_Attribute   -O--CK   100   100   000    -    2349
226 Unknown_SSD_Attribute   -O--CK   100   100   000    -    65535
227 Unknown_SSD_Attribute   -O--CK   100   100   000    -    43
228 Power-off_Retract_Count -O--CK   100   100   000    -    65535
232 Available_Reservd_Space PO--CK   036   100   010    -    0
233 Media_Wearout_Indicator -O--CK   092   100   000    -    0
241 Total_LBAs_Written      -O--CK   100   100   000    -    2349
242 Total_LBAs_Read         -O--CK   100   100   000    -    1833
249 Unknown_Attribute       -O--CK   100   100   000    -    30003
                            ||||||_ K auto-keep
                            |||||__ C event count
                            ||||___ R error rate
                            |||____ S speed/performance
                            ||_____ O updated online
                            |______ P prefailure warning

General Purpose Log Directory Version 1
SMART           Log Directory Version 1 [multi-sector log support]
Address    Access  R/W   Size  Description
0x00       GPL,SL  R/O      1  Log Directory
0x04       GPL,SL  R/O      1  Device Statistics log
0x06           SL  R/O      1  SMART self-test log
0x07       GPL     R/O      1  Extended self-test log
0x09           SL  R/W      1  Selective self-test log
0x10       GPL     R/O      1  NCQ Command Error log
0x11       GPL     R/O      1  SATA Phy Event Counters log
0x30       GPL,SL  R/O     16  IDENTIFY DEVICE data log
0x80-0x9f  GPL,SL  R/W     16  Host vendor specific log
0xb7       GPL,SL  VS      16  Device vendor specific log
0xdf       GPL,SL  VS       1  Device vendor specific log
0xe0       GPL,SL  R/W      1  SCT Command/Status
0xe1       GPL,SL  R/W      1  SCT Data Transfer

SMART Extended Comprehensive Error Log (GP Log 0x03) not supported

SMART Error Log not supported

SMART Extended Self-test Log Version: 1 (1 sectors)
Num  Test_Description    Status                  Remaining  LifeTime(hours)  LBA_of_first_error
# 1  Short offline       Completed without error       00%      3523         -

SMART Selective self-test log data structure revision number 1
 SPAN  MIN_LBA  MAX_LBA  CURRENT_TEST_STATUS
    1        0        0  Not_testing
    2        0        0  Not_testing
    3        0        0  Not_testing
    4        0        0  Not_testing
    5        0        0  Not_testing
Selective self-test flags (0x0):
  After scanning selected spans, do NOT read-scan remainder of disk.
If Selective self-test is pending on power-up, resume after 0 minute delay.

SCT Status Version:                  3
SCT Version (vendor specific):       0 (0x0000)
SCT Support Level:                   1
Device State:                        Active (0)
Current Temperature:                    34 Celsius
Power Cycle Min/Max Temperature:      6/49 Celsius
Lifetime    Min/Max Temperature:      6/69 Celsius
Under/Over Temperature Limit Count:   0/0

SCT Temperature History Version:     2
Temperature Sampling Period:         1 minute
Temperature Logging Interval:        10 minutes
Min/Max recommended Temperature:      0/70 Celsius
Min/Max Temperature Limit:            0/75 Celsius
Temperature History Size (Index):    478 (397)

Index    Estimated Time   Temperature Celsius
 398    2019-08-24 05:10     ?  -
 ...    ..(120 skipped).    ..  -
  41    2019-08-25 01:20     ?  -
  42    2019-08-25 01:30    38  *******************
  43    2019-08-25 01:40     ?  -
 ...    ..( 34 skipped).    ..  -
  78    2019-08-25 07:30     ?  -
  79    2019-08-25 07:40    39  ********************
  80    2019-08-25 07:50     ?  -
 ...    ..( 34 skipped).    ..  -
 115    2019-08-25 13:40     ?  -
 116    2019-08-25 13:50    37  ******************
 117    2019-08-25 14:00     ?  -
 ...    ..( 78 skipped).    ..  -
 196    2019-08-26 03:10     ?  -
 197    2019-08-26 03:20    33  **************
 198    2019-08-26 03:30    39  ********************
 199    2019-08-26 03:40    41  **********************
 200    2019-08-26 03:50    37  ******************
 201    2019-08-26 04:00    41  **********************
 202    2019-08-26 04:10    42  ***********************
 203    2019-08-26 04:20     ?  -
 ...    ..(  7 skipped).    ..  -
 211    2019-08-26 05:40     ?  -
 212    2019-08-26 05:50    31  ************
 213    2019-08-26 06:00     ?  -
 ...    ..(  4 skipped).    ..  -
 218    2019-08-26 06:50     ?  -
 219    2019-08-26 07:00    40  *********************
 220    2019-08-26 07:10    43  ************************
 221    2019-08-26 07:20     ?  -
 222    2019-08-26 07:30    39  ********************
 223    2019-08-26 07:40    47  ****************************
 224    2019-08-26 07:50    40  *********************
 225    2019-08-26 08:00     ?  -
 ...    ..(  2 skipped).    ..  -
 228    2019-08-26 08:30     ?  -
 229    2019-08-26 08:40    38  *******************
 230    2019-08-26 08:50    41  **********************
 231    2019-08-26 09:00    43  ************************
 232    2019-08-26 09:10     ?  -
 233    2019-08-26 09:20     ?  -
 234    2019-08-26 09:30    37  ******************
 235    2019-08-26 09:40    39  ********************
 236    2019-08-26 09:50    41  **********************
 237    2019-08-26 10:00    42  ***********************
 238    2019-08-26 10:10    42  ***********************
 239    2019-08-26 10:20    39  ********************
 240    2019-08-26 10:30    41  **********************
 241    2019-08-26 10:40    42  ***********************
 242    2019-08-26 10:50    42  ***********************
 243    2019-08-26 11:00     ?  -
 244    2019-08-26 11:10    37  ******************
 245    2019-08-26 11:20    39  ********************
 246    2019-08-26 11:30    39  ********************
 247    2019-08-26 11:40    40  *********************
 248    2019-08-26 11:50    39  ********************
 249    2019-08-26 12:00    39  ********************
 250    2019-08-26 12:10    40  *********************
 251    2019-08-26 12:20    41  **********************
 252    2019-08-26 12:30     ?  -
 253    2019-08-26 12:40    32  *************
 254    2019-08-26 12:50    36  *****************
 255    2019-08-26 13:00    38  *******************
 256    2019-08-26 13:10    39  ********************
 257    2019-08-26 13:20    39  ********************
 258    2019-08-26 13:30    39  ********************
 259    2019-08-26 13:40    40  *********************
 260    2019-08-26 13:50    41  **********************
 261    2019-08-26 14:00    41  **********************
 262    2019-08-26 14:10    39  ********************
 263    2019-08-26 14:20    40  *********************
 264    2019-08-26 14:30    41  **********************
 265    2019-08-26 14:40    41  **********************
 266    2019-08-26 14:50    37  ******************
 267    2019-08-26 15:00    41  **********************
 268    2019-08-26 15:10    42  ***********************
 269    2019-08-26 15:20    42  ***********************
 270    2019-08-26 15:30    43  ************************
 271    2019-08-26 15:40    33  **************
 272    2019-08-26 15:50    33  **************
 273    2019-08-26 16:00    32  *************
 ...    ..(  5 skipped).    ..  *************
 279    2019-08-26 17:00    32  *************
 280    2019-08-26 17:10    37  ******************
 281    2019-08-26 17:20    40  *********************
 282    2019-08-26 17:30    40  *********************
 283    2019-08-26 17:40    41  **********************
 284    2019-08-26 17:50    42  ***********************
 285    2019-08-26 18:00    37  ******************
 286    2019-08-26 18:10    40  *********************
 287    2019-08-26 18:20    40  *********************
 288    2019-08-26 18:30    40  *********************
 289    2019-08-26 18:40    41  **********************
 290    2019-08-26 18:50    42  ***********************
 291    2019-08-26 19:00    42  ***********************
 292    2019-08-26 19:10     ?  -
 293    2019-08-26 19:20    36  *****************
 294    2019-08-26 19:30    37  ******************
 295    2019-08-26 19:40    35  ****************
 296    2019-08-26 19:50    35  ****************
 297    2019-08-26 20:00    36  *****************
 298    2019-08-26 20:10    36  *****************
 299    2019-08-26 20:20     ?  -
 300    2019-08-26 20:30    39  ********************
 301    2019-08-26 20:40    41  **********************
 302    2019-08-26 20:50    42  ***********************
 303    2019-08-26 21:00    42  ***********************
 304    2019-08-26 21:10    38  *******************
 305    2019-08-26 21:20    41  **********************
 306    2019-08-26 21:30    42  ***********************
 307    2019-08-26 21:40    42  ***********************
 308    2019-08-26 21:50    37  ******************
 309    2019-08-26 22:00    40  *********************
 310    2019-08-26 22:10    41  **********************
 311    2019-08-26 22:20    42  ***********************
 312    2019-08-26 22:30    32  *************
 313    2019-08-26 22:40    32  *************
 314    2019-08-26 22:50    33  **************
 315    2019-08-26 23:00    33  **************
 316    2019-08-26 23:10    38  *******************
 317    2019-08-26 23:20    38  *******************
 318    2019-08-26 23:30    40  *********************
 319    2019-08-26 23:40    39  ********************
 320    2019-08-26 23:50    41  **********************
 321    2019-08-27 00:00    41  **********************
 322    2019-08-27 00:10    34  ***************
 323    2019-08-27 00:20    39  ********************
 324    2019-08-27 00:30    38  *******************
 325    2019-08-27 00:40    37  ******************
 326    2019-08-27 00:50    40  *********************
 327    2019-08-27 01:00    41  **********************
 328    2019-08-27 01:10    39  ********************
 329    2019-08-27 01:20    39  ********************
 330    2019-08-27 01:30    41  **********************
 331    2019-08-27 01:40    41  **********************
 332    2019-08-27 01:50    39  ********************
 333    2019-08-27 02:00    41  **********************
 334    2019-08-27 02:10    42  ***********************
 335    2019-08-27 02:20    42  ***********************
 336    2019-08-27 02:30    40  *********************
 337    2019-08-27 02:40    42  ***********************
 338    2019-08-27 02:50    42  ***********************
 339    2019-08-27 03:00    42  ***********************
 340    2019-08-27 03:10     ?  -
 341    2019-08-27 03:20    37  ******************
 342    2019-08-27 03:30     ?  -
 343    2019-08-27 03:40     ?  -
 344    2019-08-27 03:50     ?  -
 345    2019-08-27 04:00    36  *****************
 346    2019-08-27 04:10    39  ********************
 347    2019-08-27 04:20    38  *******************
 348    2019-08-27 04:30    40  *********************
 349    2019-08-27 04:40     ?  -
 ...    ..( 10 skipped).    ..  -
 360    2019-08-27 06:30     ?  -
 361    2019-08-27 06:40    32  *************
 362    2019-08-27 06:50    36  *****************
 363    2019-08-27 07:00    38  *******************
 364    2019-08-27 07:10     ?  -
 ...    ..(  7 skipped).    ..  -
 372    2019-08-27 08:30     ?  -
 373    2019-08-27 08:40    35  ****************
 374    2019-08-27 08:50    40  *********************
 375    2019-08-27 09:00    41  **********************
 376    2019-08-27 09:10    42  ***********************
 377    2019-08-27 09:20    42  ***********************
 378    2019-08-27 09:30     ?  -
 379    2019-08-27 09:40    34  ***************
 380    2019-08-27 09:50    35  ****************
 381    2019-08-27 10:00    36  *****************
 382    2019-08-27 10:10     ?  -
 383    2019-08-27 10:20     ?  -
 384    2019-08-27 10:30    39  ********************
 385    2019-08-27 10:40    41  **********************
 386    2019-08-27 10:50    42  ***********************
 387    2019-08-27 11:00     ?  -
 ...    ..(  9 skipped).    ..  -
 397    2019-08-27 12:40     ?  -

SCT Error Recovery Control command not supported

Device Statistics (GP Log 0x04)
Page  Offset Size        Value Flags Description
0x01  =====  =               =  ===  == General Statistics (rev 2) ==
0x01  0x008  4            2070  ---  Lifetime Power-On Resets
0x01  0x010  4            3523  ---  Power-on Hours
0x01  0x018  6      4926950574  ---  Logical Sectors Written
0x01  0x020  6        77568789  ---  Number of Write Commands
0x01  0x028  6      3845506160  ---  Logical Sectors Read
0x01  0x030  6        64295828  ---  Number of Read Commands
0x04  =====  =               =  ===  == General Errors Statistics (rev 1) ==
0x04  0x008  4               0  ---  Number of Reported Uncorrectable Errors
0x04  0x010  4               0  ---  Resets Between Cmd Acceptance and Completion
0x05  =====  =               =  ===  == Temperature Statistics (rev 1) ==
0x05  0x008  1              34  ---  Current Temperature
0x05  0x010  1              37  ---  Average Short Term Temperature
0x05  0x018  1               -  ---  Average Long Term Temperature
0x05  0x020  1              47  ---  Highest Temperature
0x05  0x028  1              30  ---  Lowest Temperature
0x05  0x030  1              37  ---  Highest Average Short Term Temperature
0x05  0x038  1              37  ---  Lowest Average Short Term Temperature
0x05  0x040  1               -  ---  Highest Average Long Term Temperature
0x05  0x048  1               -  ---  Lowest Average Long Term Temperature
0x05  0x050  4               0  ---  Time in Over-Temperature
0x05  0x058  1              70  ---  Specified Maximum Operating Temperature
0x05  0x060  4               0  ---  Time in Under-Temperature
0x05  0x068  1               0  ---  Specified Minimum Operating Temperature
0x06  =====  =               =  ===  == Transport Statistics (rev 1) ==
0x06  0x008  4            9322  ---  Number of Hardware Resets
0x06  0x010  4             482  ---  Number of ASR Events
0x06  0x018  4               0  ---  Number of Interface CRC Errors
0x07  =====  =               =  ===  == Solid State Device Statistics (rev 1) ==
0x07  0x008  1              13  ---  Percentage Used Endurance Indicator
                                |||_ C monitored condition met
                                ||__ D supports DSN
                                |___ N normalized value

Pending Defects log (GP Log 0x0c) not supported

SATA Phy Event Counters (GP Log 0x11)
ID      Size     Value  Description
0x0001  2            0  Command failed due to ICRC error
0x0003  2            0  R_ERR response for device-to-host data FIS
0x0004  2            0  R_ERR response for host-to-device data FIS
0x0006  2            0  R_ERR response for device-to-host non-data FIS
0x0007  2            0  R_ERR response for host-to-device non-data FIS
0x0008  2            0  Device-to-host non-data FIS retries
0x0009  2            3  Transition from drive PhyRdy to drive PhyNRdy
0x000a  2            4  Device-to-host register FISes sent due to a COMRESET
0x000f  2            0  R_ERR response for host-to-device data FIS, CRC
0x0010  2            0  R_ERR response for host-to-device data FIS, non-CRC
0x0012  2            0  R_ERR response for host-to-device non-data FIS, CRC
0x0013  2            0  R_ERR response for host-to-device non-data FIS, non-CRC
0x0002  2            0  R_ERR response for data FIS
0x0005  2            0  R_ERR response for non-data FIS
0x000b  2            0  CRC errors within host-to-device FIS
0x000d  2            0  Non-CRC errors within host-to-device FIS

