# smartctl -x /dev/sdc
smartctl 6.5 2016-05-07 r4318 [x86_64-linux-4.6.0-1-ARCH] (local build)
Copyright (C) 2002-16, Bruce Allen, Christian Franke, www.smartmontools.org

/dev/sdc: Unknown USB bridge [0x1058:0x0837 (0x1072)]
Please specify device type with the -d option.

Use smartctl -h to get a usage summary

# smartctl -d sat -x /dev/sdc
smartctl 6.5 2016-05-07 r4318 [x86_64-linux-4.6.0-1-ARCH] (local build)
Copyright (C) 2002-16, Bruce Allen, Christian Franke, www.smartmontools.org

=== START OF INFORMATION SECTION ===
Model Family:     Western Digital Elements / My Passport (USB, AF)
Device Model:     WDC WD20NMVW-11AV3S3
Serial Number:    WD-WXC1A25P9LZH
LU WWN Device Id: 5 0014ee 20bf99d03
Firmware Version: 01.01A01
User Capacity:    2,000,365,380,096 bytes [2.00 TB]
Sector Sizes:     512 bytes logical, 4096 bytes physical
Rotation Rate:    5200 rpm
Device is:        In smartctl database [for details use: -P show]
ATA Version is:   ACS-2 (minor revision not indicated)
SATA Version is:  SATA 3.0, 3.0 Gb/s (current: 3.0 Gb/s)
Local Time is:    Fri May 20 19:47:32 2016 EEST
SMART support is: Available - device has SMART capability.
SMART support is: Enabled
AAM feature is:   Unavailable
APM level is:     128 (minimum power consumption without standby)
Rd look-ahead is: Enabled
Write cache is:   Enabled
ATA Security is:  Disabled, NOT FROZEN [SEC1]
Wt Cache Reorder: Enabled

=== START OF READ SMART DATA SECTION ===
SMART overall-health self-assessment test result: PASSED

General SMART Values:
Offline data collection status:  (0x00)	Offline data collection activity
					was never started.
					Auto Offline Data Collection: Disabled.
Self-test execution status:      (   0)	The previous self-test routine completed
					without error or no self-test has ever 
					been run.
Total time to complete Offline 
data collection: 		(35760) seconds.
Offline data collection
capabilities: 			 (0x7b) SMART execute Offline immediate.
					Auto Offline data collection on/off support.
					Suspend Offline collection upon new
					command.
					Offline surface scan supported.
					Self-test supported.
					Conveyance Self-test supported.
					Selective Self-test supported.
SMART capabilities:            (0x0003)	Saves SMART data before entering
					power-saving mode.
					Supports SMART auto save timer.
Error logging capability:        (0x01)	Error logging supported.
					General Purpose Logging supported.
Short self-test routine 
recommended polling time: 	 (   2) minutes.
Extended self-test routine
recommended polling time: 	 ( 396) minutes.
Conveyance self-test routine
recommended polling time: 	 (   5) minutes.
SCT capabilities: 	       (0x7035)	SCT Status supported.
					SCT Feature Control supported.
					SCT Data Table supported.

SMART Attributes Data Structure revision number: 16
Vendor Specific SMART Attributes with Thresholds:
ID# ATTRIBUTE_NAME          FLAGS    VALUE WORST THRESH FAIL RAW_VALUE
  1 Raw_Read_Error_Rate     POSR-K   200   200   051    -    0
  3 Spin_Up_Time            POS--K   214   198   021    -    4283
  4 Start_Stop_Count        -O--CK   100   100   000    -    355
  5 Reallocated_Sector_Ct   PO--CK   200   200   140    -    0
  7 Seek_Error_Rate         -OSR-K   200   200   000    -    0
  9 Power_On_Hours          -O--CK   100   100   000    -    169
 10 Spin_Retry_Count        -O--CK   100   100   000    -    0
 11 Calibration_Retry_Count -O--CK   100   100   000    -    0
 12 Power_Cycle_Count       -O--CK   100   100   000    -    287
192 Power-Off_Retract_Count -O--CK   200   200   000    -    193
193 Load_Cycle_Count        -O--CK   199   199   000    -    3608
194 Temperature_Celsius     -O---K   127   105   000    -    25
196 Reallocated_Event_Count -O--CK   200   200   000    -    0
197 Current_Pending_Sector  -O--CK   200   200   000    -    0
198 Offline_Uncorrectable   ----CK   100   253   000    -    0
199 UDMA_CRC_Error_Count    -O--CK   200   200   000    -    0
200 Multi_Zone_Error_Rate   ---R--   100   253   000    -    0
                            ||||||_ K auto-keep
                            |||||__ C event count
                            ||||___ R error rate
                            |||____ S speed/performance
                            ||_____ O updated online
                            |______ P prefailure warning

General Purpose Log Directory Version 1
SMART           Log Directory Version 1 [multi-sector log support]
Address    Access  R/W   Size  Description
0x00       GPL,SL  R/O      1  Log Directory
0x01           SL  R/O      1  Summary SMART error log
0x02           SL  R/O      5  Comprehensive SMART error log
0x03       GPL     R/O      6  Ext. Comprehensive SMART error log
0x06           SL  R/O      1  SMART self-test log
0x07       GPL     R/O      1  Extended self-test log
0x09           SL  R/W      1  Selective self-test log
0x10       GPL     R/O      1  SATA NCQ Queued Error log
0x11       GPL     R/O      1  SATA Phy Event Counters log
0x80-0x9f  GPL,SL  R/W     16  Host vendor specific log
0xa0-0xa7  GPL,SL  VS      16  Device vendor specific log
0xa8-0xb6  GPL,SL  VS       1  Device vendor specific log
0xb7       GPL,SL  VS      39  Device vendor specific log
0xbd       GPL,SL  VS       1  Device vendor specific log
0xc0       GPL,SL  VS       1  Device vendor specific log
0xc1       GPL     VS      93  Device vendor specific log
0xcf       GPL     VS   65535  Device vendor specific log
0xe0       GPL,SL  R/W      1  SCT Command/Status
0xe1       GPL,SL  R/W      1  SCT Data Transfer

SMART Extended Comprehensive Error Log Version: 1 (6 sectors)
No Errors Logged

SMART Extended Self-test Log Version: 1 (1 sectors)
Num  Test_Description    Status                  Remaining  LifeTime(hours)  LBA_of_first_error
# 1  Short offline       Completed without error       00%       169         -
# 2  Short offline       Interrupted (host reset)      10%        41         -
# 3  Short offline       Interrupted (host reset)      10%        41         -

SMART Selective self-test log data structure revision number 1
 SPAN  MIN_LBA  MAX_LBA  CURRENT_TEST_STATUS
    1        0        0  Not_testing
    2        0        0  Not_testing
    3        0        0  Not_testing
    4        0        0  Not_testing
    5        0        0  Not_testing
Selective self-test flags (0x0):
  After scanning selected spans, do NOT read-scan remainder of disk.
If Selective self-test is pending on power-up, resume after 0 minute delay.

SCT Status Version:                  3
SCT Version (vendor specific):       258 (0x0102)
SCT Support Level:                   1
Device State:                        Active (0)
Current Temperature:                    25 Celsius
Power Cycle Min/Max Temperature:     20/25 Celsius
Lifetime    Min/Max Temperature:     14/47 Celsius
Under/Over Temperature Limit Count:   0/0
Vendor specific:
01 00 00 00 00 00 00 00 00 00 00 00 00 00 00 00
00 00 00 00 00 00 00 00 00 00 00 00 00 00 00 00

SCT Temperature History Version:     2
Temperature Sampling Period:         1 minute
Temperature Logging Interval:        1 minute
Min/Max recommended Temperature:      0/60 Celsius
Min/Max Temperature Limit:           -41/85 Celsius
Temperature History Size (Index):    128 (121)

Index    Estimated Time   Temperature Celsius
 122    2016-05-20 17:40    25  ******
 123    2016-05-20 17:41    26  *******
 124    2016-05-20 17:42    26  *******
 125    2016-05-20 17:43    26  *******
 126    2016-05-20 17:44    27  ********
 127    2016-05-20 17:45    27  ********
   0    2016-05-20 17:46    27  ********
   1    2016-05-20 17:47    28  *********
   2    2016-05-20 17:48    27  ********
   3    2016-05-20 17:49    28  *********
   4    2016-05-20 17:50    28  *********
   5    2016-05-20 17:51    28  *********
   6    2016-05-20 17:52    29  **********
   7    2016-05-20 17:53    30  ***********
   8    2016-05-20 17:54    30  ***********
   9    2016-05-20 17:55     ?  -
  10    2016-05-20 17:56    23  ****
  11    2016-05-20 17:57    23  ****
  12    2016-05-20 17:58     ?  -
  13    2016-05-20 17:59    23  ****
  14    2016-05-20 18:00     ?  -
  15    2016-05-20 18:01    21  **
  16    2016-05-20 18:02    21  **
  17    2016-05-20 18:03    21  **
  18    2016-05-20 18:04    22  ***
  19    2016-05-20 18:05    22  ***
  20    2016-05-20 18:06    22  ***
  21    2016-05-20 18:07    23  ****
  22    2016-05-20 18:08    24  *****
  23    2016-05-20 18:09    24  *****
  24    2016-05-20 18:10    26  *******
  25    2016-05-20 18:11    26  *******
  26    2016-05-20 18:12    26  *******
  27    2016-05-20 18:13    27  ********
 ...    ..(  7 skipped).    ..  ********
  35    2016-05-20 18:21    27  ********
  36    2016-05-20 18:22    28  *********
 ...    ..(  6 skipped).    ..  *********
  43    2016-05-20 18:29    28  *********
  44    2016-05-20 18:30    29  **********
 ...    ..( 13 skipped).    ..  **********
  58    2016-05-20 18:44    29  **********
  59    2016-05-20 18:45    30  ***********
 ...    ..( 12 skipped).    ..  ***********
  72    2016-05-20 18:58    30  ***********
  73    2016-05-20 18:59    31  ************
 ...    ..( 10 skipped).    ..  ************
  84    2016-05-20 19:10    31  ************
  85    2016-05-20 19:11    32  *************
  86    2016-05-20 19:12    31  ************
  87    2016-05-20 19:13    32  *************
 ...    ..(  3 skipped).    ..  *************
  91    2016-05-20 19:17    32  *************
  92    2016-05-20 19:18    33  **************
 ...    ..(  3 skipped).    ..  **************
  96    2016-05-20 19:22    33  **************
  97    2016-05-20 19:23    34  ***************
  98    2016-05-20 19:24    33  **************
  99    2016-05-20 19:25    33  **************
 100    2016-05-20 19:26    33  **************
 101    2016-05-20 19:27    34  ***************
 102    2016-05-20 19:28    33  **************
 103    2016-05-20 19:29    33  **************
 104    2016-05-20 19:30    34  ***************
 ...    ..(  4 skipped).    ..  ***************
 109    2016-05-20 19:35    34  ***************
 110    2016-05-20 19:36     ?  -
 111    2016-05-20 19:37    19  -
 112    2016-05-20 19:38     ?  -
 113    2016-05-20 19:39    20  *
 114    2016-05-20 19:40    21  **
 115    2016-05-20 19:41    22  ***
 116    2016-05-20 19:42    22  ***
 117    2016-05-20 19:43    22  ***
 118    2016-05-20 19:44    23  ****
 119    2016-05-20 19:45    23  ****
 120    2016-05-20 19:46    25  ******
 121    2016-05-20 19:47    25  ******

SCT Error Recovery Control command not supported

Device Statistics (GP/SMART Log 0x04) not supported

SATA Phy Event Counters (GP Log 0x11)
ID      Size     Value  Description
0x0001  2            0  Command failed due to ICRC error
0x0002  2            0  R_ERR response for data FIS
0x0003  2            0  R_ERR response for device-to-host data FIS
0x0004  2            0  R_ERR response for host-to-device data FIS
0x0005  2            0  R_ERR response for non-data FIS
0x0006  2            0  R_ERR response for device-to-host non-data FIS
0x0007  2            0  R_ERR response for host-to-device non-data FIS
0x0008  2            0  Device-to-host non-data FIS retries
0x0009  2            0  Transition from drive PhyRdy to drive PhyNRdy
0x000a  2            1  Device-to-host register FISes sent due to a COMRESET
0x000b  2            0  CRC errors within host-to-device FIS
0x000f  2            0  R_ERR response for host-to-device data FIS, CRC
0x0012  2            0  R_ERR response for host-to-device non-data FIS, CRC
0x8000  4          494  Vendor specific

