smartctl 7.2 2020-12-30 r5155 [x86_64-linux-5.15.0-86-generic] (local build)
Copyright (C) 2002-20, Bruce Allen, Christian Franke, www.smartmontools.org

=== START OF INFORMATION SECTION ===
Model Number:                       HP SSD EX950 512GB
Serial Number:                      HBSE39310100756
Firmware Version:                   SS0411B
PCI Vendor/Subsystem ID:            0x126f
IEEE OUI Identifier:                0x000000
Controller ID:                      1
NVMe Version:                       1.3
Number of Namespaces:               1
Namespace 1 Size/Capacity:          512,110,190,592 [512 GB]
Namespace 1 Utilization:            386,681,499,648 [386 GB]
Namespace 1 Formatted LBA Size:     512
Local Time is:                      Mon Oct 16 15:33:07 2023 EDT
Firmware Updates (0x14):            2 Slots, no Reset required
Optional Admin Commands (0x0017):   Security Format Frmw_DL Self_Test
Optional NVM Commands (0x005f):     Comp Wr_Unc DS_Mngmt Wr_Zero Sav/Sel_Feat Timestmp
Log Page Attributes (0x0f):         S/H_per_NS Cmd_Eff_Lg Ext_Get_Lg Telmtry_Lg
Maximum Data Transfer Size:         64 Pages
Warning  Comp. Temp. Threshold:     75 Celsius
Critical Comp. Temp. Threshold:     80 Celsius

Supported Power States
St Op     Max   Active     Idle   RL RT WL WT  Ent_Lat  Ex_Lat
 0 +     9.00W       -        -    0  0  0  0        0       0
 1 +     4.60W       -        -    1  1  1  1        0       0
 2 +     3.80W       -        -    2  2  2  2        0       0
 3 -   0.0450W       -        -    3  3  3  3     2000    2000
 4 -   0.0040W       -        -    4  4  4  4    15000   15000

Supported LBA Sizes (NSID 0x1)
Id Fmt  Data  Metadt  Rel_Perf
 0 +     512       0         0

=== START OF SMART DATA SECTION ===
SMART overall-health self-assessment test result: PASSED

SMART/Health Information (NVMe Log 0x02)
Critical Warning:                   0x00
Temperature:                        30 Celsius
Available Spare:                    100%
Available Spare Threshold:          10%
Percentage Used:                    3%
Data Units Read:                    69,337,083 [35.5 TB]
Data Units Written:                 54,569,290 [27.9 TB]
Host Read Commands:                 590,186,585
Host Write Commands:                688,113,092
Controller Busy Time:               14,011
Power Cycles:                       8,563
Power On Hours:                     4,149
Unsafe Shutdowns:                   91
Media and Data Integrity Errors:    0
Error Information Log Entries:      0
Warning  Comp. Temperature Time:    0
Critical Comp. Temperature Time:    0
Thermal Temp. 1 Transition Count:   74
Thermal Temp. 1 Total Time:         402

Error Information (NVMe Log 0x01, 16 of 256 entries)
No Errors Logged

