smartctl 6.6 2017-11-05 r4594 [x86_64-linux-4.17.4-gentoo_groetzner] (local build)
Copyright (C) 2002-17, Bruce Allen, Christian Franke, www.smartmontools.org

=== START OF INFORMATION SECTION ===
Device Model:     Samsung SSD 860 PRO 256GB
Firmware Version: RVM01B6Q
User Capacity:    256.060.514.304 bytes [256 GB]
Sector Size:      512 bytes logical/physical
Rotation Rate:    Solid State Device
Form Factor:      2.5 inches
Device is:        Not in smartctl database [for details use: -P showall]
ATA Version is:   ACS-4 T13/BSR INCITS 529 revision 5
SATA Version is:  SATA 3.1, 6.0 Gb/s (current: 6.0 Gb/s)
Local Time is:    Sun Jul  8 19:44:32 2018 CEST
SMART support is: Available - device has SMART capability.
SMART support is: Enabled
AAM feature is:   Unavailable
APM feature is:   Unavailable
Rd look-ahead is: Enabled
Write cache is:   Enabled
DSN feature is:   Unavailable
ATA Security is:  Disabled, NOT FROZEN [SEC1]
Wt Cache Reorder: Enabled

=== START OF READ SMART DATA SECTION ===
SMART overall-health self-assessment test result: PASSED

General SMART Values:
Offline data collection status:  (0x80)	Offline data collection activity
					was never started.
					Auto Offline Data Collection: Enabled.
Self-test execution status:      (   0)	The previous self-test routine completed
					without error or no self-test has ever 
					been run.
Total time to complete Offline 
data collection: 		(    0) seconds.
Offline data collection
capabilities: 			 (0x53) SMART execute Offline immediate.
					Auto Offline data collection on/off support.
					Suspend Offline collection upon new
					command.
					No Offline surface scan supported.
					Self-test supported.
					No Conveyance Self-test supported.
					Selective Self-test supported.
SMART capabilities:            (0x0003)	Saves SMART data before entering
					power-saving mode.
					Supports SMART auto save timer.
Error logging capability:        (0x01)	Error logging supported.
					General Purpose Logging supported.
Short self-test routine 
recommended polling time: 	 (   2) minutes.
Extended self-test routine
recommended polling time: 	 (  85) minutes.
SCT capabilities: 	       (0x003d)	SCT Status supported.
					SCT Error Recovery Control supported.
					SCT Feature Control supported.
					SCT Data Table supported.

SMART Attributes Data Structure revision number: 1
Vendor Specific SMART Attributes with Thresholds:
ID# ATTRIBUTE_NAME          FLAGS    VALUE WORST THRESH FAIL RAW_VALUE
  5 Reallocated_Sector_Ct   PO--CK   100   100   010    -    0
  9 Power_On_Hours          -O--CK   099   099   000    -    1130
 12 Power_Cycle_Count       -O--CK   099   099   000    -    13
177 Wear_Leveling_Count     PO--C-   098   098   000    -    29
179 Used_Rsvd_Blk_Cnt_Tot   PO--C-   100   100   010    -    0
181 Program_Fail_Cnt_Total  -O--CK   100   100   010    -    0
182 Erase_Fail_Count_Total  -O--CK   100   100   010    -    0
183 Runtime_Bad_Block       PO--C-   100   100   010    -    0
187 Reported_Uncorrect      -O--CK   100   100   000    -    0
190 Airflow_Temperature_Cel -O--CK   060   057   000    -    40
195 Hardware_ECC_Recovered  -O-RC-   200   200   000    -    0
199 UDMA_CRC_Error_Count    -OSRCK   100   100   000    -    0
235 Unknown_Attribute       -O--C-   099   099   000    -    10
241 Total_LBAs_Written      -O--CK   099   099   000    -    3766799120
                            ||||||_ K auto-keep
                            |||||__ C event count
                            ||||___ R error rate
                            |||____ S speed/performance
                            ||_____ O updated online
                            |______ P prefailure warning

General Purpose Log Directory Version 1
SMART           Log Directory Version 1 [multi-sector log support]
Address    Access  R/W   Size  Description
0x00       GPL,SL  R/O      1  Log Directory
0x01           SL  R/O      1  Summary SMART error log
0x02           SL  R/O      1  Comprehensive SMART error log
0x03       GPL     R/O      1  Ext. Comprehensive SMART error log
0x04       GPL,SL  R/O      8  Device Statistics log
0x06           SL  R/O      1  SMART self-test log
0x07       GPL     R/O      1  Extended self-test log
0x09           SL  R/W      1  Selective self-test log
0x10       GPL     R/O      1  NCQ Command Error log
0x11       GPL     R/O      1  SATA Phy Event Counters log
0x13       GPL     R/O      1  SATA NCQ Send and Receive log
0x30       GPL,SL  R/O      9  IDENTIFY DEVICE data log
0x80-0x9f  GPL,SL  R/W     16  Host vendor specific log
0xa1           SL  VS      16  Device vendor specific log
0xa5           SL  VS      16  Device vendor specific log
0xce-0xcf      SL  VS      16  Device vendor specific log
0xe0       GPL,SL  R/W      1  SCT Command/Status
0xe1       GPL,SL  R/W      1  SCT Data Transfer

SMART Extended Comprehensive Error Log Version: 1 (1 sectors)
No Errors Logged

SMART Extended Self-test Log Version: 1 (1 sectors)
Num  Test_Description    Status                  Remaining  LifeTime(hours)  LBA_of_first_error
# 1  Short offline       Completed without error       00%      1130         -
# 2  Short offline       Completed without error       00%      1112         -
# 3  Extended offline    Completed without error       00%      1091         -
# 4  Short offline       Completed without error       00%      1088         -

SMART Selective self-test log data structure revision number 1
 SPAN  MIN_LBA  MAX_LBA  CURRENT_TEST_STATUS
    1        0        0  Not_testing
    2        0        0  Not_testing
    3        0        0  Not_testing
    4        0        0  Not_testing
    5        0        0  Not_testing
Selective self-test flags (0x0):
  After scanning selected spans, do NOT read-scan remainder of disk.
If Selective self-test is pending on power-up, resume after 0 minute delay.

SCT Status Version:                  3
SCT Version (vendor specific):       256 (0x0100)
SCT Support Level:                   1
Device State:                        Active (0)
Current Temperature:                    40 Celsius
Power Cycle Min/Max Temperature:     39/42 Celsius
Lifetime    Min/Max Temperature:     21/43 Celsius
Under/Over Temperature Limit Count:   0/0
SMART Status:                        0xc24f (PASSED)

SCT Temperature History Version:     2
Temperature Sampling Period:         1 minute
Temperature Logging Interval:        10 minutes
Min/Max recommended Temperature:      0/70 Celsius
Min/Max Temperature Limit:            0/70 Celsius
Temperature History Size (Index):    128 (21)

Index    Estimated Time   Temperature Celsius
  22    2018-07-07 22:30    31  ************
  23    2018-07-07 22:40    30  ***********
 ...    ..(  4 skipped).    ..  ***********
  28    2018-07-07 23:30    30  ***********
  29    2018-07-07 23:40    31  ************
  30    2018-07-07 23:50    30  ***********
 ...    ..( 11 skipped).    ..  ***********
  42    2018-07-08 01:50    30  ***********
  43    2018-07-08 02:00    32  *************
  44    2018-07-08 02:10    38  *******************
  45    2018-07-08 02:20    33  **************
  46    2018-07-08 02:30    31  ************
  47    2018-07-08 02:40    31  ************
  48    2018-07-08 02:50    30  ***********
  49    2018-07-08 03:00    31  ************
 ...    ..(  2 skipped).    ..  ************
  52    2018-07-08 03:30    31  ************
  53    2018-07-08 03:40    30  ***********
 ...    ..(  5 skipped).    ..  ***********
  59    2018-07-08 04:40    30  ***********
  60    2018-07-08 04:50    31  ************
  61    2018-07-08 05:00    33  **************
  62    2018-07-08 05:10    30  ***********
  63    2018-07-08 05:20    29  **********
  64    2018-07-08 05:30    29  **********
  65    2018-07-08 05:40    30  ***********
  66    2018-07-08 05:50    29  **********
 ...    ..( 11 skipped).    ..  **********
  78    2018-07-08 07:50    29  **********
  79    2018-07-08 08:00    30  ***********
 ...    ..(  8 skipped).    ..  ***********
  88    2018-07-08 09:30    30  ***********
  89    2018-07-08 09:40    31  ************
  90    2018-07-08 09:50    30  ***********
  91    2018-07-08 10:00    30  ***********
  92    2018-07-08 10:10    31  ************
  93    2018-07-08 10:20    30  ***********
  94    2018-07-08 10:30    30  ***********
  95    2018-07-08 10:40    31  ************
 ...    ..(  2 skipped).    ..  ************
  98    2018-07-08 11:10    31  ************
  99    2018-07-08 11:20    34  ***************
 100    2018-07-08 11:30    32  *************
 101    2018-07-08 11:40    33  **************
 102    2018-07-08 11:50    32  *************
 ...    ..(  6 skipped).    ..  *************
 109    2018-07-08 13:00    32  *************
 110    2018-07-08 13:10    33  **************
 111    2018-07-08 13:20    37  ******************
 112    2018-07-08 13:30    33  **************
 113    2018-07-08 13:40    32  *************
 114    2018-07-08 13:50    32  *************
 115    2018-07-08 14:00    33  **************
 116    2018-07-08 14:10    35  ****************
 117    2018-07-08 14:20    34  ***************
 118    2018-07-08 14:30    32  *************
 119    2018-07-08 14:40    32  *************
 120    2018-07-08 14:50    32  *************
 121    2018-07-08 15:00    31  ************
 122    2018-07-08 15:10    33  **************
 123    2018-07-08 15:20    35  ****************
 124    2018-07-08 15:30    34  ***************
 125    2018-07-08 15:40    33  **************
 126    2018-07-08 15:50    33  **************
 127    2018-07-08 16:00    33  **************
   0    2018-07-08 16:10    32  *************
 ...    ..(  8 skipped).    ..  *************
   9    2018-07-08 17:40    32  *************
  10    2018-07-08 17:50    35  ****************
  11    2018-07-08 18:00    34  ***************
  12    2018-07-08 18:10    34  ***************
  13    2018-07-08 18:20    33  **************
  14    2018-07-08 18:30    32  *************
  15    2018-07-08 18:40    31  ************
  16    2018-07-08 18:50    32  *************
  17    2018-07-08 19:00     ?  -
  18    2018-07-08 19:10    40  *********************
  19    2018-07-08 19:20    39  ********************
  20    2018-07-08 19:30    42  ***********************
  21    2018-07-08 19:40    40  *********************

SCT Error Recovery Control:
           Read: Disabled
          Write: Disabled

Device Statistics (GP Log 0x04)
Page  Offset Size        Value Flags Description
0x01  =====  =               =  ===  == General Statistics (rev 1) ==
0x01  0x008  4              13  ---  Lifetime Power-On Resets
0x01  0x010  4            1130  ---  Power-on Hours
0x01  0x018  6      3766799428  ---  Logical Sectors Written
0x01  0x020  6        60426650  ---  Number of Write Commands
0x01  0x028  6      1715831003  ---  Logical Sectors Read
0x01  0x030  6        12770115  ---  Number of Read Commands
0x01  0x038  6         1358000  ---  Date and Time TimeStamp
0x04  =====  =               =  ===  == General Errors Statistics (rev 1) ==
0x04  0x008  4               0  ---  Number of Reported Uncorrectable Errors
0x04  0x010  4               0  ---  Resets Between Cmd Acceptance and Completion
0x05  =====  =               =  ===  == Temperature Statistics (rev 1) ==
0x05  0x008  1              40  ---  Current Temperature
0x05  0x020  1              43  ---  Highest Temperature
0x05  0x028  1              21  ---  Lowest Temperature
0x05  0x058  1              55  ---  Specified Maximum Operating Temperature
0x06  =====  =               =  ===  == Transport Statistics (rev 1) ==
0x06  0x008  4              25  ---  Number of Hardware Resets
0x06  0x010  4               0  ---  Number of ASR Events
0x06  0x018  4               0  ---  Number of Interface CRC Errors
0x07  =====  =               =  ===  == Solid State Device Statistics (rev 1) ==
0x07  0x008  1               1  N--  Percentage Used Endurance Indicator
                                |||_ C monitored condition met
                                ||__ D supports DSN
                                |___ N normalized value

Pending Defects log (GP Log 0x0c) not supported

SATA Phy Event Counters (GP Log 0x11)
ID      Size     Value  Description
0x0001  2            0  Command failed due to ICRC error
0x0002  2            0  R_ERR response for data FIS
0x0003  2            0  R_ERR response for device-to-host data FIS
0x0004  2            0  R_ERR response for host-to-device data FIS
0x0005  2            0  R_ERR response for non-data FIS
0x0006  2            0  R_ERR response for device-to-host non-data FIS
0x0007  2            0  R_ERR response for host-to-device non-data FIS
0x0008  2            0  Device-to-host non-data FIS retries
0x0009  2            0  Transition from drive PhyRdy to drive PhyNRdy
0x000a  2            0  Device-to-host register FISes sent due to a COMRESET
0x000b  2            0  CRC errors within host-to-device FIS
0x000d  2            0  Non-CRC errors within host-to-device FIS
0x000f  2            0  R_ERR response for host-to-device data FIS, CRC
0x0010  2            0  R_ERR response for host-to-device data FIS, non-CRC
0x0012  2            0  R_ERR response for host-to-device non-data FIS, CRC
0x0013  2            0  R_ERR response for host-to-device non-data FIS, non-CRC

