smartctl 7.1 2019-12-30 r5022 [FreeBSD 12.1-AXCIENT1 amd64] (local build)
Copyright (C) 2002-19, Bruce Allen, Christian Franke, www.smartmontools.org

=== START OF INFORMATION SECTION ===
Device Model:     OCZ-OCTANE
Serial Number:    OCZ-Q39206J4K5RHUAW4
Firmware Version: 1.13
User Capacity:    512,110,190,592 bytes [512 GB]
Sector Size:      512 bytes logical/physical
Rotation Rate:    Solid State Device
Device is:        Not in smartctl database [for details use: -P showall]
ATA Version is:   ATA8-ACS (minor revision not indicated)
Local Time is:    Mon Aug  3 14:15:45 2020 UTC
SMART support is: Available - device has SMART capability.
SMART support is: Enabled
AAM feature is:   Unavailable
APM feature is:   Unavailable
Rd look-ahead is: Enabled
Write cache is:   Enabled
DSN feature is:   Unavailable
ATA Security is:  Disabled, NOT FROZEN [SEC1]
Wt Cache Reorder: Unavailable

=== START OF READ SMART DATA SECTION ===
SMART Status command failed: Input/output error
SMART overall-health self-assessment test result: PASSED
Warning: This result is based on an Attribute check.

General SMART Values:
Offline data collection status:  (0x00)	Offline data collection activity
					was never started.
					Auto Offline Data Collection: Disabled.
Self-test execution status:      ( 121)	The previous self-test completed having
					the read element of the test failed.
Total time to complete Offline 
data collection: 		(    0) seconds.
Offline data collection
capabilities: 			 (0x1d) SMART execute Offline immediate.
					No Auto Offline data collection support.
					Abort Offline collection upon new
					command.
					Offline surface scan supported.
					Self-test supported.
					No Conveyance Self-test supported.
					No Selective Self-test supported.
SMART capabilities:            (0x0003)	Saves SMART data before entering
					power-saving mode.
					Supports SMART auto save timer.
Error logging capability:        (0x00)	Error logging supported.
					General Purpose Logging supported.
Short self-test routine 
recommended polling time: 	 (   0) minutes.
Extended self-test routine
recommended polling time: 	 (   0) minutes.

SMART Attributes Data Structure revision number: 18
Vendor Specific SMART Attributes with Thresholds:
ID# ATTRIBUTE_NAME          FLAGS    VALUE WORST THRESH FAIL RAW_VALUE
  1 Raw_Read_Error_Rate     ------   010   000   000    -    10
  3 Spin_Up_Time            ------   100   100   000    -    0
  4 Start_Stop_Count        ------   100   100   000    -    0
  5 Reallocated_Sector_Ct   ------   100   100   000    -    21
  9 Power_On_Hours          ------   100   100   000    -    67
 12 Power_Cycle_Count       ------   100   100   000    -    57
232 Available_Reservd_Space ------   100   100   000    -    640
233 Media_Wearout_Indicator ------   089   000   000    -    89
                            ||||||_ K auto-keep
                            |||||__ C event count
                            ||||___ R error rate
                            |||____ S speed/performance
                            ||_____ O updated online
                            |______ P prefailure warning

ATA_READ_LOG_EXT (addr=0x00:0x00, page=0, n=1) failed: Input/output error
Read GP Log Directory failed

SMART Log Directory Version 0
Address    Access  R/W   Size  Description
0x00           SL  R/O      1  Log Directory

SMART Extended Comprehensive Error Log (GP Log 0x03) not supported

SMART Error Log not supported

SMART Extended Self-test Log (GP Log 0x07) not supported

SMART Self-test Log not supported

Selective Self-tests/Logging not supported

SCT Commands not supported

Device Statistics (GP/SMART Log 0x04) not supported

Pending Defects log (GP Log 0x0c) not supported

ATA_READ_LOG_EXT (addr=0x11:0x00, page=0, n=1) failed: scsi error aborted command
Read SATA Phy Event Counters failed

