smartctl 7.0 2018-12-30 r4883 [x86_64-linux-6.4.11-1.el7.elrepo.x86_64] (local build)
Copyright (C) 2002-18, Bruce Allen, Christian Franke, www.smartmontools.org

=== START OF INFORMATION SECTION ===
Device Model:     ST12000NM000J-2TY103
Firmware Version: SN02
User Capacity:    12,000,138,625,024 bytes [12.0 TB]
Sector Sizes:     512 bytes logical, 4096 bytes physical
Rotation Rate:    7200 rpm
Form Factor:      3.5 inches
Device is:        Not in smartctl database [for details use: -P showall]
ATA Version is:   ACS-4 (minor revision not indicated)
SATA Version is:  SATA 3.3, 6.0 Gb/s (current: 6.0 Gb/s)
Local Time is:    Fri Sep  1 19:18:17 2023 EEST
SMART support is: Available - device has SMART capability.
SMART support is: Enabled
AAM feature is:   Unavailable
APM feature is:   Unavailable
Rd look-ahead is: Enabled
Write cache is:   Enabled
DSN feature is:   Disabled
ATA Security is:  Disabled, NOT FROZEN [SEC1]
Write SCT (Get) Feature Control Command failed: scsi error badly formed scsi parameters
Wt Cache Reorder: Unknown (SCT Feature Control command failed)

=== START OF READ SMART DATA SECTION ===
SMART overall-health self-assessment test result: PASSED

General SMART Values:
Offline data collection status:  (0x82)	Offline data collection activity
					was completed without error.
					Auto Offline Data Collection: Enabled.
Self-test execution status:      (   0)	The previous self-test routine completed
					without error or no self-test has ever 
					been run.
Total time to complete Offline 
data collection: 		(  567) seconds.
Offline data collection
capabilities: 			 (0x7b) SMART execute Offline immediate.
					Auto Offline data collection on/off support.
					Suspend Offline collection upon new
					command.
					Offline surface scan supported.
					Self-test supported.
					Conveyance Self-test supported.
					Selective Self-test supported.
SMART capabilities:            (0x0003)	Saves SMART data before entering
					power-saving mode.
					Supports SMART auto save timer.
Error logging capability:        (0x01)	Error logging supported.
					General Purpose Logging supported.
Short self-test routine 
recommended polling time: 	 (   1) minutes.
Extended self-test routine
recommended polling time: 	 (1058) minutes.
Conveyance self-test routine
recommended polling time: 	 (   2) minutes.
SCT capabilities: 	       (0x70bd)	SCT Status supported.
					SCT Error Recovery Control supported.
					SCT Feature Control supported.
					SCT Data Table supported.

SMART Attributes Data Structure revision number: 10
Vendor Specific SMART Attributes with Thresholds:
ID# ATTRIBUTE_NAME          FLAGS    VALUE WORST THRESH FAIL RAW_VALUE
  1 Raw_Read_Error_Rate     POSR--   081   064   044    -    125357635
  3 Spin_Up_Time            PO----   094   094   000    -    0
  4 Start_Stop_Count        -O--CK   100   100   020    -    6
  5 Reallocated_Sector_Ct   PO--CK   100   100   010    -    0
  7 Seek_Error_Rate         POSR--   087   060   045    -    486722692
  9 Power_On_Hours          -O--CK   093   093   000    -    6732
 10 Spin_Retry_Count        PO--C-   100   100   097    -    0
 12 Power_Cycle_Count       -O--CK   100   100   020    -    6
 18 Unknown_Attribute       PO-R--   100   100   050    -    0
187 Reported_Uncorrect      -O--CK   100   100   000    -    0
188 Command_Timeout         -O--CK   100   100   000    -    0
190 Airflow_Temperature_Cel -O---K   071   052   000    -    29 (Min/Max 28/37)
192 Power-Off_Retract_Count -O--CK   100   100   000    -    1
193 Load_Cycle_Count        -O--CK   094   094   000    -    13865
194 Temperature_Celsius     -O---K   029   048   000    -    29 (0 26 0 0 0)
197 Current_Pending_Sector  -O--C-   100   100   000    -    0
198 Offline_Uncorrectable   ----C-   100   100   000    -    0
199 UDMA_CRC_Error_Count    -OSRCK   200   200   000    -    0
200 Multi_Zone_Error_Rate   PO---K   100   100   001    -    0
240 Head_Flying_Hours       ------   100   253   000    -    1952 (191 94 0)
241 Total_LBAs_Written      ------   100   253   000    -    65433005000
242 Total_LBAs_Read         ------   100   253   000    -    8859028553953
                            ||||||_ K auto-keep
                            |||||__ C event count
                            ||||___ R error rate
                            |||____ S speed/performance
                            ||_____ O updated online
                            |______ P prefailure warning

General Purpose Log Directory Version 1
SMART           Log Directory Version 1 [multi-sector log support]
Address    Access  R/W   Size  Description
0x00       GPL,SL  R/O      1  Log Directory
0x01           SL  R/O      1  Summary SMART error log
0x02           SL  R/O      5  Comprehensive SMART error log
0x03       GPL     R/O      5  Ext. Comprehensive SMART error log
0x04       GPL     R/O    256  Device Statistics log
0x04       SL      R/O      8  Device Statistics log
0x06           SL  R/O      1  SMART self-test log
0x07       GPL     R/O      1  Extended self-test log
0x08       GPL     R/O      2  Power Conditions log
0x09           SL  R/W      1  Selective self-test log
0x0a       GPL     R/W      8  Device Statistics Notification
0x0c       GPL     R/O   2048  Pending Defects log
0x10       GPL     R/O      1  NCQ Command Error log
0x11       GPL     R/O      1  SATA Phy Event Counters log
0x13       GPL     R/O      1  SATA NCQ Send and Receive log
0x21       GPL     R/O      1  Write stream error log
0x22       GPL     R/O      1  Read stream error log
0x24       GPL     R/O    768  Current Device Internal Status Data log
0x2f       GPL     -        1  Set Sector Configuration
0x30       GPL,SL  R/O      9  IDENTIFY DEVICE data log
0x80-0x9f  GPL,SL  R/W     16  Host vendor specific log
0xa1       GPL,SL  VS     160  Device vendor specific log
0xa2       GPL     VS   16320  Device vendor specific log
0xa4       GPL,SL  VS     160  Device vendor specific log
0xa6       GPL     VS     192  Device vendor specific log
0xa8-0xa9  GPL,SL  VS     136  Device vendor specific log
0xab       GPL     VS       1  Device vendor specific log
0xad       GPL     VS      16  Device vendor specific log
0xb1       GPL,SL  VS     160  Device vendor specific log
0xb6       GPL     VS    1920  Device vendor specific log
0xbe-0xbf  GPL     VS   65535  Device vendor specific log
0xc1       GPL,SL  VS       8  Device vendor specific log
0xc3       GPL,SL  VS      24  Device vendor specific log
0xc6       GPL     VS    5184  Device vendor specific log
0xc7       GPL,SL  VS       8  Device vendor specific log
0xc9       GPL,SL  VS       8  Device vendor specific log
0xca       GPL,SL  VS      16  Device vendor specific log
0xcd       GPL,SL  VS       1  Device vendor specific log
0xce       GPL     VS       1  Device vendor specific log
0xcf       GPL     VS     512  Device vendor specific log
0xd1       GPL     VS     656  Device vendor specific log
0xd2       GPL     VS   10256  Device vendor specific log
0xd4       GPL     VS    2048  Device vendor specific log
0xda       GPL,SL  VS       1  Device vendor specific log
0xe0       GPL,SL  R/W      1  SCT Command/Status
0xe1       GPL,SL  R/W      1  SCT Data Transfer

SMART Extended Comprehensive Error Log Version: 1 (5 sectors)
No Errors Logged

SMART Extended Self-test Log Version: 1 (1 sectors)
Num  Test_Description    Status                  Remaining  LifeTime(hours)  LBA_of_first_error
# 1  Short offline       Completed without error       00%      6666         -
# 2  Short offline       Completed without error       00%      6594         -
# 3  Short offline       Completed without error       00%      6522         -
# 4  Short offline       Completed without error       00%      6450         -
# 5  Short offline       Completed without error       00%      6379         -
# 6  Extended offline    Completed without error       00%      6323         -
# 7  Short offline       Completed without error       00%      6259         -
# 8  Short offline       Completed without error       00%      6187         -
# 9  Short offline       Completed without error       00%      6115         -
#10  Short offline       Completed without error       00%      6043         -
#11  Short offline       Completed without error       00%      5923         -
#12  Short offline       Completed without error       00%      5851         -
#13  Short offline       Completed without error       00%      5779         -
#14  Short offline       Completed without error       00%      5707         -
#15  Short offline       Completed without error       00%      5635         -
#16  Extended offline    Completed without error       00%      5619         -
#17  Short offline       Completed without error       00%      5515         -
#18  Short offline       Completed without error       00%      5443         -
#19  Short offline       Completed without error       00%      5371         -

SMART Selective self-test log data structure revision number 1
 SPAN  MIN_LBA  MAX_LBA  CURRENT_TEST_STATUS
    1        0        0  Not_testing
    2        0        0  Not_testing
    3        0        0  Not_testing
    4        0        0  Not_testing
    5        0        0  Not_testing
Selective self-test flags (0x0):
  After scanning selected spans, do NOT read-scan remainder of disk.
If Selective self-test is pending on power-up, resume after 0 minute delay.

SCT Status Version:                  3
SCT Version (vendor specific):       522 (0x020a)
Device State:                        Active (0)
Current Temperature:                    29 Celsius
Power Cycle Min/Max Temperature:     28/37 Celsius
Lifetime    Min/Max Temperature:     25/55 Celsius
Under/Over Temperature Limit Count:   0/0
SMART Status:                        0xc24f (PASSED)
Vendor specific:
00 00 00 00 00 00 00 00 00 00 00 00 00 00 00 00
00 00 00 00 02 00 00 00 00 00 00 00 00 00 00 00

SCT Temperature History Version:     2
Temperature Sampling Period:         4 minutes
Temperature Logging Interval:        59 minutes
Min/Max recommended Temperature:     10/40 Celsius
Min/Max Temperature Limit:            5/60 Celsius
Temperature History Size (Index):    128 (52)

Index    Estimated Time   Temperature Celsius
  53    2023-08-27 13:34    31  ************
 ...    ..(  2 skipped).    ..  ************
  56    2023-08-27 16:31    31  ************
  57    2023-08-27 17:30    30  ***********
  58    2023-08-27 18:29    30  ***********
  59    2023-08-27 19:28    31  ************
  60    2023-08-27 20:27    30  ***********
  61    2023-08-27 21:26    30  ***********
  62    2023-08-27 22:25    30  ***********
  63    2023-08-27 23:24    29  **********
  64    2023-08-28 00:23    30  ***********
  65    2023-08-28 01:22    29  **********
  66    2023-08-28 02:21    30  ***********
  67    2023-08-28 03:20    30  ***********
  68    2023-08-28 04:19    29  **********
  69    2023-08-28 05:18    31  ************
  70    2023-08-28 06:17    30  ***********
  71    2023-08-28 07:16    30  ***********
  72    2023-08-28 08:15    30  ***********
  73    2023-08-28 09:14    31  ************
  74    2023-08-28 10:13    31  ************
  75    2023-08-28 11:12    30  ***********
  76    2023-08-28 12:11    30  ***********
  77    2023-08-28 13:10    30  ***********
  78    2023-08-28 14:09    31  ************
  79    2023-08-28 15:08    31  ************
  80    2023-08-28 16:07    29  **********
  81    2023-08-28 17:06    30  ***********
  82    2023-08-28 18:05    30  ***********
  83    2023-08-28 19:04    31  ************
  84    2023-08-28 20:03    29  **********
  85    2023-08-28 21:02    30  ***********
  86    2023-08-28 22:01    29  **********
 ...    ..(  4 skipped).    ..  **********
  91    2023-08-29 02:56    29  **********
  92    2023-08-29 03:55    31  ************
  93    2023-08-29 04:54    29  **********
  94    2023-08-29 05:53    29  **********
  95    2023-08-29 06:52    30  ***********
  96    2023-08-29 07:51    29  **********
  97    2023-08-29 08:50    29  **********
  98    2023-08-29 09:49    29  **********
  99    2023-08-29 10:48    31  ************
 100    2023-08-29 11:47    30  ***********
 101    2023-08-29 12:46    29  **********
 102    2023-08-29 13:45    30  ***********
 103    2023-08-29 14:44    29  **********
 104    2023-08-29 15:43    30  ***********
 105    2023-08-29 16:42    32  *************
 106    2023-08-29 17:41    30  ***********
 107    2023-08-29 18:40    30  ***********
 108    2023-08-29 19:39    29  **********
 ...    ..(  2 skipped).    ..  **********
 111    2023-08-29 22:36    29  **********
 112    2023-08-29 23:35    31  ************
 113    2023-08-30 00:34    32  *************
 114    2023-08-30 01:33    30  ***********
 115    2023-08-30 02:32    31  ************
 116    2023-08-30 03:31    31  ************
 117    2023-08-30 04:30    30  ***********
 118    2023-08-30 05:29    30  ***********
 119    2023-08-30 06:28    30  ***********
 120    2023-08-30 07:27    29  **********
 121    2023-08-30 08:26    29  **********
 122    2023-08-30 09:25    31  ************
 123    2023-08-30 10:24    31  ************
 124    2023-08-30 11:23    30  ***********
 125    2023-08-30 12:22    30  ***********
 126    2023-08-30 13:21    30  ***********
 127    2023-08-30 14:20    31  ************
   0    2023-08-30 15:19    30  ***********
   1    2023-08-30 16:18    31  ************
   2    2023-08-30 17:17    29  **********
 ...    ..(  2 skipped).    ..  **********
   5    2023-08-30 20:14    29  **********
   6    2023-08-30 21:13    30  ***********
   7    2023-08-30 22:12    29  **********
 ...    ..(  2 skipped).    ..  **********
  10    2023-08-31 01:09    29  **********
  11    2023-08-31 02:08    31  ************
  12    2023-08-31 03:07    29  **********
  13    2023-08-31 04:06    30  ***********
  14    2023-08-31 05:05    31  ************
  15    2023-08-31 06:04    29  **********
  16    2023-08-31 07:03    31  ************
  17    2023-08-31 08:02    32  *************
  18    2023-08-31 09:01    30  ***********
  19    2023-08-31 10:00    31  ************
  20    2023-08-31 10:59    32  *************
  21    2023-08-31 11:58    30  ***********
  22    2023-08-31 12:57    30  ***********
  23    2023-08-31 13:56    30  ***********
  24    2023-08-31 14:55    31  ************
  25    2023-08-31 15:54    29  **********
  26    2023-08-31 16:53    29  **********
  27    2023-08-31 17:52    29  **********
  28    2023-08-31 18:51    28  *********
  29    2023-08-31 19:50    29  **********
  30    2023-08-31 20:49    29  **********
  31    2023-08-31 21:48    29  **********
  32    2023-08-31 22:47    28  *********
  33    2023-08-31 23:46    28  *********
  34    2023-09-01 00:45    33  **************
 ...    ..(  8 skipped).    ..  **************
  43    2023-09-01 09:36    33  **************
  44    2023-09-01 10:35    34  ***************
  45    2023-09-01 11:34    34  ***************
  46    2023-09-01 12:33    33  **************
  47    2023-09-01 13:32    33  **************
  48    2023-09-01 14:31    34  ***************
  49    2023-09-01 15:30    33  **************
  50    2023-09-01 16:29    33  **************
  51    2023-09-01 17:28    33  **************
  52    2023-09-01 18:27    29  **********

SCT Error Recovery Control:
           Read:    100 (10.0 seconds)
          Write:    100 (10.0 seconds)

Device Statistics (GP Log 0x04)
Page  Offset Size        Value Flags Description
0x01  =====  =               =  ===  == General Statistics (rev 1) ==
0x01  0x008  4               6  ---  Lifetime Power-On Resets
0x01  0x010  4            6732  ---  Power-on Hours
0x01  0x018  6     65433005000  ---  Logical Sectors Written
0x01  0x020  6       125851114  ---  Number of Write Commands
0x01  0x028  6   8859028553953  ---  Logical Sectors Read
0x01  0x030  6      1302310044  ---  Number of Read Commands
0x01  0x038  6               -  ---  Date and Time TimeStamp
0x03  =====  =               =  ===  == Rotating Media Statistics (rev 1) ==
0x03  0x008  4            6732  ---  Spindle Motor Power-on Hours
0x03  0x010  4            2432  ---  Head Flying Hours
0x03  0x018  4           13865  ---  Head Load Events
0x03  0x020  4               0  ---  Number of Reallocated Logical Sectors
0x03  0x028  4               0  ---  Read Recovery Attempts
0x03  0x030  4               0  ---  Number of Mechanical Start Failures
0x03  0x038  4               0  ---  Number of Realloc. Candidate Logical Sectors
0x03  0x040  4               1  ---  Number of High Priority Unload Events
0x04  =====  =               =  ===  == General Errors Statistics (rev 1) ==
0x04  0x008  4               0  ---  Number of Reported Uncorrectable Errors
0x04  0x010  4               0  ---  Resets Between Cmd Acceptance and Completion
0x04  0x018  4               0  -D-  Physical Element Status Changed
0x05  =====  =               =  ===  == Temperature Statistics (rev 1) ==
0x05  0x008  1              29  ---  Current Temperature
0x05  0x010  1              31  ---  Average Short Term Temperature
0x05  0x018  1              29  ---  Average Long Term Temperature
0x05  0x020  1              48  ---  Highest Temperature
0x05  0x028  1              27  ---  Lowest Temperature
0x05  0x030  1              37  ---  Highest Average Short Term Temperature
0x05  0x038  1              29  ---  Lowest Average Short Term Temperature
0x05  0x040  1              34  ---  Highest Average Long Term Temperature
0x05  0x048  1              29  ---  Lowest Average Long Term Temperature
0x05  0x050  4               0  ---  Time in Over-Temperature
0x05  0x058  1              60  ---  Specified Maximum Operating Temperature
0x05  0x060  4               0  ---  Time in Under-Temperature
0x05  0x068  1               5  ---  Specified Minimum Operating Temperature
0x06  =====  =               =  ===  == Transport Statistics (rev 1) ==
0x06  0x008  4              55  ---  Number of Hardware Resets
0x06  0x010  4              14  ---  Number of ASR Events
0x06  0x018  4               0  ---  Number of Interface CRC Errors
0xff  =====  =               =  ===  == Vendor Specific Statistics (rev 1) ==
0xff  0x008  7               0  ---  Vendor Specific
0xff  0x010  7               0  ---  Vendor Specific
0xff  0x018  7               0  ---  Vendor Specific
                                |||_ C monitored condition met
                                ||__ D supports DSN
                                |___ N normalized value

Pending Defects log (GP Log 0x0c)
No Defects Logged

SATA Phy Event Counters (GP Log 0x11)
ID      Size     Value  Description
0x000a  2           19  Device-to-host register FISes sent due to a COMRESET
0x0001  2            0  Command failed due to ICRC error
0x0003  2            0  R_ERR response for device-to-host data FIS
0x0004  2            0  R_ERR response for host-to-device data FIS
0x0006  2            0  R_ERR response for device-to-host non-data FIS
0x0007  2            0  R_ERR response for host-to-device non-data FIS

