smartctl 6.5 (build date Aug 21 2020) [x86_64-linux-4.4.59+] (local build)
Copyright (C) 2002-16, Bruce Allen, Christian Franke, www.smartmontools.org

=== START OF INFORMATION SECTION ===
Device Model:     Seagate IronWolfPro ZA3840NX10001-2ZH104
Serial Number:    7TK002EG
LU WWN Device Id: 5 000c50 0bb219834
Firmware Version: SU4SC01B
User Capacity:    3,840,755,982,336 bytes [3.84 TB]
Sector Size:      512 bytes logical/physical
Rotation Rate:    Solid State Device
Form Factor:      2.5 inches
Device is:        Not in smartctl database [for details use: -P showall]
ATA Version is:   ACS-3 (minor revision not indicated)
SATA Version is:  SATA 3.1, 6.0 Gb/s (current: 6.0 Gb/s)
Local Time is:    Tue Nov 17 18:48:03 2020 AEDT
SMART support is: Available - device has SMART capability.
SMART support is: Enabled
AAM feature is:   Unavailable
APM feature is:   Disabled
Rd look-ahead is: Enabled
Write cache is:   Enabled
ATA Security is:  Disabled, NOT FROZEN [SEC1]
Wt Cache Reorder: Unavailable

=== START OF READ SMART DATA SECTION ===
SMART overall-health self-assessment test result: PASSED
See vendor-specific Attribute list for marginal Attributes.

General SMART Values:
Offline data collection status:  (0x00)	Offline data collection activity
					was never started.
					Auto Offline Data Collection: Disabled.
Self-test execution status:      (   0)	The previous self-test routine completed
					without error or no self-test has ever 
					been run.
Total time to complete Offline 
data collection: 		(   30) seconds.
Offline data collection
capabilities: 			 (0x79) SMART execute Offline immediate.
					No Auto Offline data collection support.
					Suspend Offline collection upon new
					command.
					Offline surface scan supported.
					Self-test supported.
					Conveyance Self-test supported.
					Selective Self-test supported.
SMART capabilities:            (0x0003)	Saves SMART data before entering
					power-saving mode.
					Supports SMART auto save timer.
Error logging capability:        (0x01)	Error logging supported.
					General Purpose Logging supported.
Short self-test routine 
recommended polling time: 	 (   1) minutes.
Extended self-test routine
recommended polling time: 	 (   2) minutes.
Conveyance self-test routine
recommended polling time: 	 (   3) minutes.

SMART Attributes Data Structure revision number: 16
Vendor Specific SMART Attributes with Thresholds:
ID# ATTRIBUTE_NAME                                                   FLAGS    VALUE WORST THRESH FAIL RAW_VALUE
  1 Raw_Read_Error_Rate                                              PO-R--   100   100   050    -    0
  9 Power_On_Hours                                                   -O--C-   100   100   000    -    2
 12 Power_Cycle_Count                                                -O--C-   100   100   000    -    2
 16 Unknown_Attribute                                                -O--C-   100   100   000    -    28864
 17 Unknown_Attribute                                                -O--C-   100   100   000    -    28864
168 Unknown_Attribute                                                -O--C-   100   100   000    -    0
170 Unknown_Attribute                                                PO----   100   100   010    -    1409
173 Unknown_Attribute                                                -O--C-   100   100   000    -    65538
174 Unknown_Attribute                                                -O--C-   100   100   000    -    0
177 Wear_Leveling_Count                                              ------   100   100   000    -    0
192 Power-Off_Retract_Count                                          -O--C-   100   100   000    -    0
194 Temperature_Celsius                                              PO---K   099   086   000    -    28 (Min/Max 20/41)
218 Unknown_Attribute                                                PO-R--   100   100   050    -    0
231 Unknown_SSD_Attribute                                            PO--C-   100   100   000    -    99
232 Available_Reservd_Space                                          PO--C-   100   100   000    -    0
233 Media_Wearout_Indicator                                          PO-R--   100   100   000    -    3
234 Unknown_Attribute                                                PO-R--   100   100   000    -    13556496
235 Unknown_Attribute                                                PO-R--   100   100   000    -    7894464
241 Total_LBAs_Written                                               -O--C-   100   100   000    -    2
242 Total_LBAs_Read                                                  -O--C-   100   100   000    -    2
246 Unknown_Attribute                                                PO----   255   255   255    NOW  0
247 Unknown_Attribute                                                -O----   100   100   000    -    179
                            ||||||_ K auto-keep
                            |||||__ C event count
                            ||||___ R error rate
                            |||____ S speed/performance
                            ||_____ O updated online
                            |______ P prefailure warning

ATA_READ_LOG_EXT (addr=0x00:0x00, page=0, n=1) failed: 48-bit ATA commands not implemented
Read GP Log Directory failed

SMART Log Directory Version 1 [multi-sector log support]
Address    Access  R/W   Size  Description
0x00           SL  R/O      1  Log Directory
0x01           SL  R/O      1  Summary SMART error log
0x02           SL  R/O     51  Comprehensive SMART error log
0x04           SL  R/O      8  Device Statistics log
0x06           SL  R/O      1  SMART self-test log
0x09           SL  R/W      1  Selective self-test log
0x30           SL  R/O      9  IDENTIFY DEVICE data log
0x80-0x9f      SL  R/W     16  Host vendor specific log

SMART Extended Comprehensive Error Log (GP Log 0x03) not supported

SMART Error Log Version: 1
No Errors Logged

SMART Extended Self-test Log (GP Log 0x07) not supported

SMART Self-test log structure revision number 1
Num  Test_Description    Status                  Remaining  LifeTime(hours)  LBA_of_first_error
# 1  Short offline       Completed without error       00%         2         -
# 2  Extended offline    Completed without error       00%         2         -
# 3  Short offline       Completed without error       00%         2         -
# 4  Short offline       Completed without error       00%         0         -

SMART Selective self-test log data structure revision number 1
 SPAN  MIN_LBA  MAX_LBA  CURRENT_TEST_STATUS
    1        0        0  Not_testing
    2        0        0  Not_testing
    3        0        0  Not_testing
    4        0        0  Not_testing
    5        0        0  Not_testing
Selective self-test flags (0x0):
  After scanning selected spans, do NOT read-scan remainder of disk.
If Selective self-test is pending on power-up, resume after 0 minute delay.

SCT Commands not supported

Device Statistics (SMART Log 0x04)
Page  Offset Size        Value Flags Description
ATA_SMART_READ_LOG failed: Multi-sector ATA commands not implemented
Read Device Statistics pages 0x00-0x07 failed

ATA_READ_LOG_EXT (addr=0x11:0x00, page=0, n=1) failed: 48-bit ATA commands not implemented
Read SATA Phy Event Counters failed

