smartctl 7.4 2023-08-01 r5530 [x86_64-linux-6.8.0-58-generic] (local build)
Copyright (C) 2002-23, Bruce Allen, Christian Franke, www.smartmontools.org

=== START OF INFORMATION SECTION ===
Device Model:     WDC WD8002FZWX-00BKUA0
Serial Number:    WD-AW00H6YF
LU WWN Device Id: 5 0014ee 2bf5a344b
Firmware Version: 02.01A02
User Capacity:    8,001,563,222,016 bytes [8.00 TB]
Sector Sizes:     512 bytes logical, 4096 bytes physical
Rotation Rate:    7200 rpm
Form Factor:      3.5 inches
Device is:        Not in smartctl database 7.3/5671
ATA Version is:   ACS-3 T13/2161-D revision 5
SATA Version is:  SATA 3.1, 6.0 Gb/s (current: 6.0 Gb/s)
Local Time is:    Thu Apr 24 12:51:16 2025 PDT
SMART support is: Available - device has SMART capability.
SMART support is: Enabled
AAM feature is:   Unavailable
APM feature is:   Unavailable
Rd look-ahead is: Enabled
Write cache is:   Enabled
DSN feature is:   Unavailable
ATA Security is:  Disabled, frozen [SEC2]
Wt Cache Reorder: Enabled

=== START OF READ SMART DATA SECTION ===
SMART overall-health self-assessment test result: PASSED

General SMART Values:
Offline data collection status:  (0x00)	Offline data collection activity
					was never started.
					Auto Offline Data Collection: Disabled.
Self-test execution status:      (   0)	The previous self-test routine completed
					without error or no self-test has ever 
					been run.
Total time to complete Offline 
data collection: 		( 1844) seconds.
Offline data collection
capabilities: 			 (0x11) SMART execute Offline immediate.
					No Auto Offline data collection support.
					Suspend Offline collection upon new
					command.
					No Offline surface scan supported.
					Self-test supported.
					No Conveyance Self-test supported.
					No Selective Self-test supported.
SMART capabilities:            (0x0003)	Saves SMART data before entering
					power-saving mode.
					Supports SMART auto save timer.
Error logging capability:        (0x01)	Error logging supported.
					General Purpose Logging supported.
Short self-test routine 
recommended polling time: 	 (   2) minutes.
Extended self-test routine
recommended polling time: 	 ( 712) minutes.
SCT capabilities: 	       (0x303d)	SCT Status supported.
					SCT Error Recovery Control supported.
					SCT Feature Control supported.
					SCT Data Table supported.

SMART Attributes Data Structure revision number: 16
Vendor Specific SMART Attributes with Thresholds:
ID# ATTRIBUTE_NAME          FLAGS    VALUE WORST THRESH FAIL RAW_VALUE
  1 Raw_Read_Error_Rate     POSR-K   200   200   051    -    0
  3 Spin_Up_Time            POS--K   121   121   021    -    12933
  4 Start_Stop_Count        -O--CK   100   100   000    -    6
  5 Reallocated_Sector_Ct   PO--CK   200   200   140    -    0
  7 Seek_Error_Rate         -OSR-K   100   253   000    -    0
  9 Power_On_Hours          -O--CK   100   100   000    -    47
 10 Spin_Retry_Count        -O--CK   100   253   000    -    0
 11 Calibration_Retry_Count -O--CK   100   253   000    -    0
 12 Power_Cycle_Count       -O--CK   100   100   000    -    3
192 Power-Off_Retract_Count -O--CK   200   200   000    -    0
193 Load_Cycle_Count        -O--CK   200   200   000    -    5
194 Temperature_Celsius     -O---K   112   086   000    -    40
196 Reallocated_Event_Count -O--CK   200   200   000    -    0
197 Current_Pending_Sector  -O--CK   200   200   000    -    0
198 Offline_Uncorrectable   ----CK   100   253   000    -    0
199 UDMA_CRC_Error_Count    -O--CK   200   200   000    -    0
200 Multi_Zone_Error_Rate   ---R--   100   253   000    -    0
                            ||||||_ K auto-keep
                            |||||__ C event count
                            ||||___ R error rate
                            |||____ S speed/performance
                            ||_____ O updated online
                            |______ P prefailure warning

General Purpose Log Directory Version 1
SMART           Log Directory Version 1 [multi-sector log support]
Address    Access  R/W   Size  Description
0x00       GPL,SL  R/O      1  Log Directory
0x01           SL  R/O      1  Summary SMART error log
0x02           SL  R/O      5  Comprehensive SMART error log
0x03       GPL     R/O      6  Ext. Comprehensive SMART error log
0x04       GPL,SL  R/O      8  Device Statistics log
0x06           SL  R/O      1  SMART self-test log
0x07       GPL     R/O      1  Extended self-test log
0x09           SL  R/W      1  Selective self-test log
0x10       GPL     R/O      1  NCQ Command Error log
0x11       GPL     R/O      1  SATA Phy Event Counters log
0x30       GPL,SL  R/O      9  IDENTIFY DEVICE data log
0x80-0x9f  GPL,SL  R/W     16  Host vendor specific log
0xa0-0xa7  GPL,SL  VS      16  Device vendor specific log
0xa8-0xb6  GPL,SL  VS       1  Device vendor specific log
0xb7       GPL,SL  VS      82  Device vendor specific log
0xbd       GPL,SL  VS       1  Device vendor specific log
0xc0       GPL,SL  VS       1  Device vendor specific log
0xc1       GPL     VS      93  Device vendor specific log
0xe0       GPL,SL  R/W      1  SCT Command/Status
0xe1       GPL,SL  R/W      1  SCT Data Transfer

SMART Extended Comprehensive Error Log Version: 1 (6 sectors)
No Errors Logged

SMART Extended Self-test Log Version: 1 (1 sectors)
Num  Test_Description    Status                  Remaining  LifeTime(hours)  LBA_of_first_error
# 1  Short offline       Completed without error       00%        47         -

Selective Self-tests/Logging not supported

SCT Status Version:                  3
SCT Version (vendor specific):       258 (0x0102)
Device State:                        Active (0)
Current Temperature:                    40 Celsius
Power Cycle Min/Max Temperature:     26/40 Celsius
Lifetime    Min/Max Temperature:     23/66 Celsius
Under/Over Temperature Limit Count:   0/0
Vendor specific:
01 00 00 00 00 00 00 00 00 00 00 00 00 00 00 00
00 00 00 00 00 00 00 00 00 00 00 00 00 00 00 00

SCT Temperature History Version:     2
Temperature Sampling Period:         1 minute
Temperature Logging Interval:        1 minute
Min/Max recommended Temperature:      0/60 Celsius
Min/Max Temperature Limit:           -41/85 Celsius
Temperature History Size (Index):    478 (4)

Index    Estimated Time   Temperature Celsius
   5    2025-04-24 04:54    59  ****************************************
   6    2025-04-24 04:55    58  ***************************************
   7    2025-04-24 04:56    58  ***************************************
   8    2025-04-24 04:57    57  **************************************
   9    2025-04-24 04:58    56  *************************************
  10    2025-04-24 04:59    56  *************************************
  11    2025-04-24 05:00    55  ************************************
  12    2025-04-24 05:01    55  ************************************
  13    2025-04-24 05:02    54  ***********************************
  14    2025-04-24 05:03    54  ***********************************
  15    2025-04-24 05:04    53  **********************************
  16    2025-04-24 05:05    53  **********************************
  17    2025-04-24 05:06    52  *********************************
  18    2025-04-24 05:07    52  *********************************
  19    2025-04-24 05:08    52  *********************************
  20    2025-04-24 05:09    51  ********************************
  21    2025-04-24 05:10    51  ********************************
  22    2025-04-24 05:11    51  ********************************
  23    2025-04-24 05:12    50  *******************************
  24    2025-04-24 05:13    50  *******************************
  25    2025-04-24 05:14    49  ******************************
  26    2025-04-24 05:15    49  ******************************
  27    2025-04-24 05:16    49  ******************************
  28    2025-04-24 05:17    48  *****************************
 ...    ..(  2 skipped).    ..  *****************************
  31    2025-04-24 05:20    48  *****************************
  32    2025-04-24 05:21    47  ****************************
  33    2025-04-24 05:22    47  ****************************
  34    2025-04-24 05:23    47  ****************************
  35    2025-04-24 05:24    46  ***************************
 ...    ..(  2 skipped).    ..  ***************************
  38    2025-04-24 05:27    46  ***************************
  39    2025-04-24 05:28    45  **************************
 ...    ..(  2 skipped).    ..  **************************
  42    2025-04-24 05:31    45  **************************
  43    2025-04-24 05:32    44  *************************
 ...    ..(  3 skipped).    ..  *************************
  47    2025-04-24 05:36    44  *************************
  48    2025-04-24 05:37    43  ************************
 ...    ..(  4 skipped).    ..  ************************
  53    2025-04-24 05:42    43  ************************
  54    2025-04-24 05:43    42  ***********************
 ...    ..(  4 skipped).    ..  ***********************
  59    2025-04-24 05:48    42  ***********************
  60    2025-04-24 05:49    41  **********************
 ...    ..(  5 skipped).    ..  **********************
  66    2025-04-24 05:55    41  **********************
  67    2025-04-24 05:56    40  *********************
 ...    ..(  6 skipped).    ..  *********************
  74    2025-04-24 06:03    40  *********************
  75    2025-04-24 06:04    39  ********************
 ...    ..(  7 skipped).    ..  ********************
  83    2025-04-24 06:12    39  ********************
  84    2025-04-24 06:13    38  *******************
 ...    ..(  9 skipped).    ..  *******************
  94    2025-04-24 06:23    38  *******************
  95    2025-04-24 06:24    37  ******************
 ...    ..( 12 skipped).    ..  ******************
 108    2025-04-24 06:37    37  ******************
 109    2025-04-24 06:38    36  *****************
 ...    ..( 16 skipped).    ..  *****************
 126    2025-04-24 06:55    36  *****************
 127    2025-04-24 06:56    35  ****************
 ...    ..( 25 skipped).    ..  ****************
 153    2025-04-24 07:22    35  ****************
 154    2025-04-24 07:23    34  ***************
 ...    ..( 64 skipped).    ..  ***************
 219    2025-04-24 08:28    34  ***************
 220    2025-04-24 08:29    33  **************
 ...    ..( 92 skipped).    ..  **************
 313    2025-04-24 10:02    33  **************
 314    2025-04-24 10:03     ?  -
 315    2025-04-24 10:04    33  **************
 316    2025-04-24 10:05    33  **************
 317    2025-04-24 10:06    33  **************
 318    2025-04-24 10:07    34  ***************
 319    2025-04-24 10:08    34  ***************
 320    2025-04-24 10:09    35  ****************
 321    2025-04-24 10:10    36  *****************
 322    2025-04-24 10:11    36  *****************
 323    2025-04-24 10:12    37  ******************
 324    2025-04-24 10:13    37  ******************
 325    2025-04-24 10:14    38  *******************
 326    2025-04-24 10:15    39  ********************
 327    2025-04-24 10:16    39  ********************
 328    2025-04-24 10:17    40  *********************
 329    2025-04-24 10:18     ?  -
 330    2025-04-24 10:19    23  ****
 331    2025-04-24 10:20    24  *****
 332    2025-04-24 10:21     ?  -
 333    2025-04-24 10:22    26  *******
 334    2025-04-24 10:23    26  *******
 335    2025-04-24 10:24    26  *******
 336    2025-04-24 10:25    27  ********
 337    2025-04-24 10:26    28  *********
 338    2025-04-24 10:27    28  *********
 339    2025-04-24 10:28    29  **********
 340    2025-04-24 10:29    29  **********
 341    2025-04-24 10:30    30  ***********
 342    2025-04-24 10:31    31  ************
 343    2025-04-24 10:32    31  ************
 344    2025-04-24 10:33    32  *************
 345    2025-04-24 10:34    32  *************
 346    2025-04-24 10:35    32  *************
 347    2025-04-24 10:36    33  **************
 348    2025-04-24 10:37    33  **************
 349    2025-04-24 10:38    33  **************
 350    2025-04-24 10:39    34  ***************
 ...    ..(  2 skipped).    ..  ***************
 353    2025-04-24 10:42    34  ***************
 354    2025-04-24 10:43    35  ****************
 ...    ..(  2 skipped).    ..  ****************
 357    2025-04-24 10:46    35  ****************
 358    2025-04-24 10:47    36  *****************
 ...    ..(  4 skipped).    ..  *****************
 363    2025-04-24 10:52    36  *****************
 364    2025-04-24 10:53    37  ******************
 ...    ..(  6 skipped).    ..  ******************
 371    2025-04-24 11:00    37  ******************
 372    2025-04-24 11:01    38  *******************
 ...    ..( 10 skipped).    ..  *******************
 383    2025-04-24 11:12    38  *******************
 384    2025-04-24 11:13    39  ********************
 ...    ..( 35 skipped).    ..  ********************
 420    2025-04-24 11:49    39  ********************
 421    2025-04-24 11:50    40  *********************
 ...    ..( 60 skipped).    ..  *********************
   4    2025-04-24 12:51    40  *********************

SCT Error Recovery Control:
           Read:     70 (7.0 seconds)
          Write:     70 (7.0 seconds)

Device Statistics (GP Log 0x04)
Page  Offset Size        Value Flags Description
0x01  =====  =               =  ===  == General Statistics (rev 1) ==
0x01  0x008  4               3  ---  Lifetime Power-On Resets
0x01  0x010  4              47  ---  Power-on Hours
0x01  0x018  6      9575166005  ---  Logical Sectors Written
0x01  0x020  6        40133818  ---  Number of Write Commands
0x01  0x028  6     10131091038  ---  Logical Sectors Read
0x01  0x030  6        79640408  ---  Number of Read Commands
0x01  0x038  6       169200000  ---  Date and Time TimeStamp
0x03  =====  =               =  ===  == Rotating Media Statistics (rev 1) ==
0x03  0x008  4              21  ---  Spindle Motor Power-on Hours
0x03  0x010  4              21  ---  Head Flying Hours
0x03  0x018  4               6  ---  Head Load Events
0x03  0x020  4               0  ---  Number of Reallocated Logical Sectors
0x03  0x028  4               0  ---  Read Recovery Attempts
0x03  0x030  4               0  ---  Number of Mechanical Start Failures
0x03  0x038  4               0  ---  Number of Realloc. Candidate Logical Sectors
0x03  0x040  4               0  ---  Number of High Priority Unload Events
0x04  =====  =               =  ===  == General Errors Statistics (rev 1) ==
0x04  0x008  4               0  ---  Number of Reported Uncorrectable Errors
0x04  0x010  4               0  ---  Resets Between Cmd Acceptance and Completion
0x05  =====  =               =  ===  == Temperature Statistics (rev 1) ==
0x05  0x008  1              40  ---  Current Temperature
0x05  0x010  1              46  ---  Average Short Term Temperature
0x05  0x018  1               -  ---  Average Long Term Temperature
0x05  0x020  1              66  ---  Highest Temperature
0x05  0x028  1              31  ---  Lowest Temperature
0x05  0x030  1              46  ---  Highest Average Short Term Temperature
0x05  0x038  1              37  ---  Lowest Average Short Term Temperature
0x05  0x040  1               -  ---  Highest Average Long Term Temperature
0x05  0x048  1               -  ---  Lowest Average Long Term Temperature
0x05  0x050  4             920  ---  Time in Over-Temperature
0x05  0x058  1              60  ---  Specified Maximum Operating Temperature
0x05  0x060  4               0  ---  Time in Under-Temperature
0x05  0x068  1               0  ---  Specified Minimum Operating Temperature
0x06  =====  =               =  ===  == Transport Statistics (rev 1) ==
0x06  0x008  4               7  ---  Number of Hardware Resets
0x06  0x010  4               4  ---  Number of ASR Events
0x06  0x018  4               0  ---  Number of Interface CRC Errors
                                |||_ C monitored condition met
                                ||__ D supports DSN
                                |___ N normalized value

Pending Defects log (GP Log 0x0c) not supported

SATA Phy Event Counters (GP Log 0x11)
ID      Size     Value  Description
0x0001  2            0  Command failed due to ICRC error
0x0002  2            0  R_ERR response for data FIS
0x0003  2            0  R_ERR response for device-to-host data FIS
0x0004  2            0  R_ERR response for host-to-device data FIS
0x0005  2            0  R_ERR response for non-data FIS
0x0006  2            0  R_ERR response for device-to-host non-data FIS
0x0007  2            0  R_ERR response for host-to-device non-data FIS
0x0008  2            0  Device-to-host non-data FIS retries
0x0009  2            2  Transition from drive PhyRdy to drive PhyNRdy
0x000a  2            3  Device-to-host register FISes sent due to a COMRESET
0x000b  2            0  CRC errors within host-to-device FIS
0x000d  2            0  Non-CRC errors within host-to-device FIS
0x000f  2            0  R_ERR response for host-to-device data FIS, CRC
0x0012  2            0  R_ERR response for host-to-device non-data FIS, CRC
0x8000  4         8986  Vendor specific

