smartctl 7.5 2025-04-30 r5714 [FreeBSD 14.3-RELEASE i386] (local build)
Copyright (C) 2002-25, Bruce Allen, Christian Franke, www.smartmontools.org

=== START OF INFORMATION SECTION ===
Device Model:     WDC WD100BB-00CLB0
Serial Number:    WD-WMAAS1159745
Firmware Version: 05.04E05
User Capacity:    10,003,955,200 bytes [10.0 GB]
Sector Size:      512 bytes logical/physical
Device is:        Not in smartctl database 7.5/5816
ATA Version is:   ATA/ATAPI-5 (minor revision not indicated)
Local Time is:    Sat Aug 16 01:11:03 2025 +05
SMART support is: Available - device has SMART capability.
SMART support is: Enabled
AAM feature is:   Disabled
APM feature is:   Unavailable
Rd look-ahead is: Enabled
Write cache is:   Enabled
DSN feature is:   Unavailable
ATA Security is:  Disabled, frozen [SEC2]

=== START OF READ SMART DATA SECTION ===
SMART overall-health self-assessment test result: PASSED

General SMART Values:
Offline data collection status:  (0x85)	Offline data collection activity
					was aborted by an interrupting command from host.
					Auto Offline Data Collection: Enabled.
Self-test execution status:      (   0)	The previous self-test routine completed
					without error or no self-test has ever 
					been run.
Total time to complete Offline 
data collection: 		(  792) seconds.
Offline data collection
capabilities: 			 (0x3b) SMART execute Offline immediate.
					Auto Offline data collection on/off support.
					Suspend Offline collection upon new
					command.
					Offline surface scan supported.
					Self-test supported.
					Conveyance Self-test supported.
					No Selective Self-test supported.
SMART capabilities:            (0x0003)	Saves SMART data before entering
					power-saving mode.
					Supports SMART auto save timer.
Error logging capability:        (0x01)	Error logging supported.
					No General Purpose Logging support.
Short self-test routine 
recommended polling time: 	 (   2) minutes.
Extended self-test routine
recommended polling time: 	 (  14) minutes.
Conveyance self-test routine
recommended polling time: 	 (   5) minutes.

SMART Attributes Data Structure revision number: 16
Vendor Specific SMART Attributes with Thresholds:
ID# ATTRIBUTE_NAME          FLAGS    VALUE WORST THRESH FAIL RAW_VALUE
  1 Raw_Read_Error_Rate     PO-R--   200   200   051    -    0
  3 Spin_Up_Time            POS---   091   090   021    -    2808
  4 Start_Stop_Count        -O--CK   098   098   040    -    2074
  5 Reallocated_Sector_Ct   PO--CK   200   200   140    -    0
  7 Seek_Error_Rate         PO-R--   200   200   051    -    0
  9 Power_On_Hours          -O--CK   078   078   000    -    16288
 10 Spin_Retry_Count        PO--C-   100   100   051    -    0
 11 Calibration_Retry_Count PO--C-   100   100   051    -    0
 12 Power_Cycle_Count       -O--CK   099   099   000    -    1619
196 Reallocated_Event_Count -O--CK   200   200   000    -    0
197 Current_Pending_Sector  -O--C-   200   200   000    -    0
198 Offline_Uncorrectable   -O--C-   200   200   000    -    0
199 UDMA_CRC_Error_Count    -O-R--   200   253   000    -    0
200 Multi_Zone_Error_Rate   P--R--   200   200   051    -    0
                            ||||||_ K auto-keep
                            |||||__ C event count
                            ||||___ R error rate
                            |||____ S speed/performance
                            ||_____ O updated online
                            |______ P prefailure warning

Read SMART Log Directory failed: Input/output error

General Purpose Log Directory not supported

SMART Extended Comprehensive Error Log (GP Log 0x03) not supported

SMART Error Log Version: 1
No Errors Logged

SMART Extended Self-test Log (GP Log 0x07) not supported

SMART Self-test log structure revision number 1
Num  Test_Description    Status                  Remaining  LifeTime(hours)  LBA_of_first_error
# 1  Short offline       Completed without error       00%       997         -
# 2  Extended offline    Completed without error       00%       988         -
# 3  Extended offline    Completed without error       00%       964         -
# 4  Short offline       Completed without error       00%       940         -
# 5  Short offline       Completed without error       00%       917         -
# 6  Short offline       Completed without error       00%       899         -
# 7  Extended offline    Completed without error       00%       811         -
# 8  Short offline       Completed without error       00%       716         -

Selective Self-tests/Logging not supported

SCT Commands not supported

Device Statistics (GP/SMART Log 0x04) not supported

Pending Defects log (GP Log 0x0c) not supported

SATA Phy Event Counters (GP Log 0x11) not supported

