smartctl 6.5 2016-05-07 r4318 [x86_64-linux-3.10.0-327.22.2.el7.x86_64] (local build)
Copyright (C) 2002-16, Bruce Allen, Christian Franke, www.smartmontools.org

=== START OF INFORMATION SECTION ===
Device Model:     ST10000NM0016-1TT101
Firmware Version: SNB0
User Capacity:    10,000,831,348,736 bytes [10.0 TB]
Sector Sizes:     512 bytes logical, 4096 bytes physical
Rotation Rate:    7200 rpm
Form Factor:      3.5 inches
Device is:        Not in smartctl database [for details use: -P showall]
ATA Version is:   ACS-3 T13/2161-D revision 5
SATA Version is:  SATA 3.1, 6.0 Gb/s (current: 6.0 Gb/s)
Local Time is:    Mon Jul 25 11:04:00 2016 MSK
SMART support is: Available - device has SMART capability.
SMART support is: Enabled
AAM feature is:   Unavailable
APM feature is:   Unavailable
Rd look-ahead is: Enabled
Write cache is:   Enabled
ATA Security is:  Disabled, NOT FROZEN [SEC1]
Wt Cache Reorder: Unknown

=== START OF READ SMART DATA SECTION ===
SMART overall-health self-assessment test result: PASSED

General SMART Values:
Offline data collection status:  (0x82)	Offline data collection activity
					was completed without error.
					Auto Offline Data Collection: Enabled.
Self-test execution status:      (   0)	The previous self-test routine completed
					without error or no self-test has ever 
					been run.
Total time to complete Offline 
data collection: 		(  567) seconds.
Offline data collection
capabilities: 			 (0x7b) SMART execute Offline immediate.
					Auto Offline data collection on/off support.
					Suspend Offline collection upon new
					command.
					Offline surface scan supported.
					Self-test supported.
					Conveyance Self-test supported.
					Selective Self-test supported.
SMART capabilities:            (0x0003)	Saves SMART data before entering
					power-saving mode.
					Supports SMART auto save timer.
Error logging capability:        (0x01)	Error logging supported.
					General Purpose Logging supported.
Short self-test routine 
recommended polling time: 	 (   1) minutes.
Extended self-test routine
recommended polling time: 	 ( 898) minutes.
Conveyance self-test routine
recommended polling time: 	 (   2) minutes.
SCT capabilities: 	       (0x50bd)	SCT Status supported.
					SCT Error Recovery Control supported.
					SCT Feature Control supported.
					SCT Data Table supported.

SMART Attributes Data Structure revision number: 10
Vendor Specific SMART Attributes with Thresholds:
ID# ATTRIBUTE_NAME          FLAGS    VALUE WORST THRESH FAIL RAW_VALUE
  1 Raw_Read_Error_Rate     POSR--   081   068   044    -    138487336
  3 Spin_Up_Time            PO----   094   094   000    -    0
  4 Start_Stop_Count        -O--CK   100   100   020    -    27
  5 Reallocated_Sector_Ct   PO--CK   100   100   010    -    0
  7 Seek_Error_Rate         POSR--   067   060   045    -    4860200
  9 Power_On_Hours          -O--CK   100   100   000    -    556 (250 142 0)
 10 Spin_Retry_Count        PO--C-   100   100   097    -    0
 12 Power_Cycle_Count       -O--CK   100   100   020    -    8
184 End-to-End_Error        -O--CK   100   100   099    -    0
187 Reported_Uncorrect      -O--CK   100   100   000    -    0
188 Command_Timeout         -O--CK   100   100   000    -    0
189 High_Fly_Writes         -O-RCK   097   097   000    -    3
190 Airflow_Temperature_Cel -O---K   068   059   040    -    32 (Min/Max 32/34)
191 G-Sense_Error_Rate      -O--CK   100   100   000    -    9
192 Power-Off_Retract_Count -O--CK   100   100   000    -    3
193 Load_Cycle_Count        -O--CK   100   100   000    -    1858
194 Temperature_Celsius     -O---K   032   041   000    -    32 (0 22 0 0 0)
195 Hardware_ECC_Recovered  -O-RC-   001   001   000    -    138487336
197 Current_Pending_Sector  -O--C-   100   100   000    -    0
198 Offline_Uncorrectable   ----C-   100   100   000    -    0
199 UDMA_CRC_Error_Count    -OSRCK   200   200   000    -    0
240 Head_Flying_Hours       ------   100   253   000    -    551 (192 45 0)
241 Total_LBAs_Written      ------   100   253   000    -    109815227
242 Total_LBAs_Read         ------   100   253   000    -    28672117
                            ||||||_ K auto-keep
                            |||||__ C event count
                            ||||___ R error rate
                            |||____ S speed/performance
                            ||_____ O updated online
                            |______ P prefailure warning

General Purpose Log Directory Version 1
SMART           Log Directory Version 1 [multi-sector log support]
Address    Access  R/W   Size  Description
0x00       GPL,SL  R/O      1  Log Directory
0x01           SL  R/O      1  Summary SMART error log
0x02           SL  R/O      5  Comprehensive SMART error log
0x03       GPL     R/O      5  Ext. Comprehensive SMART error log
0x04       GPL     R/O    256  Device Statistics log
0x04       SL      R/O      8  Device Statistics log
0x06           SL  R/O      1  SMART self-test log
0x07       GPL     R/O      1  Extended self-test log
0x08       GPL     R/O      2  Power Conditions log
0x09           SL  R/W      1  Selective self-test log
0x0c       GPL     R/O   2048  Pending Defects log
0x10       GPL     R/O      1  SATA NCQ Queued Error log
0x11       GPL     R/O      1  SATA Phy Event Counters log
0x13       GPL     R/O      1  SATA NCQ Send and Receive log
0x15       GPL     R/W      1  SATA Rebuild Assist log
0x21       GPL     R/O      1  Write stream error log
0x22       GPL     R/O      1  Read stream error log
0x24       GPL     R/O    768  Current Device Internal Status Data log
0x30       GPL,SL  R/O      9  IDENTIFY DEVICE data log
0x80-0x9f  GPL,SL  R/W     16  Host vendor specific log
0xa1       GPL,SL  VS      24  Device vendor specific log
0xa2       GPL     VS   16320  Device vendor specific log
0xa6       GPL     VS     192  Device vendor specific log
0xa8-0xa9  GPL,SL  VS     136  Device vendor specific log
0xab       GPL     VS       1  Device vendor specific log
0xad       GPL     VS      16  Device vendor specific log
0xb0       GPL     VS   17208  Device vendor specific log
0xbe-0xbf  GPL     VS   65535  Device vendor specific log
0xc1       GPL,SL  VS      16  Device vendor specific log
0xc3       GPL,SL  VS       8  Device vendor specific log
0xd1       GPL     VS     304  Device vendor specific log
0xd2       GPL     VS   10000  Device vendor specific log
0xd4       GPL     VS    2048  Device vendor specific log
0xe0       GPL,SL  R/W      1  SCT Command/Status
0xe1       GPL,SL  R/W      1  SCT Data Transfer

SMART Extended Comprehensive Error Log Version: 1 (5 sectors)
No Errors Logged

SMART Extended Self-test Log Version: 1 (1 sectors)
Num  Test_Description    Status                  Remaining  LifeTime(hours)  LBA_of_first_error
# 1  Short offline       Completed without error       00%       556         -

SMART Selective self-test log data structure revision number 1
 SPAN  MIN_LBA  MAX_LBA  CURRENT_TEST_STATUS
    1        0        0  Not_testing
    2        0        0  Not_testing
    3        0        0  Not_testing
    4        0        0  Not_testing
    5        0        0  Not_testing
Selective self-test flags (0x0):
  After scanning selected spans, do NOT read-scan remainder of disk.
If Selective self-test is pending on power-up, resume after 0 minute delay.

SCT Status Version:                  3
SCT Version (vendor specific):       522 (0x020a)
SCT Support Level:                   1
Device State:                        Active (0)
Current Temperature:                    32 Celsius
Power Cycle Min/Max Temperature:     32/35 Celsius
Lifetime    Min/Max Temperature:     22/51 Celsius
Under/Over Temperature Limit Count:   0/2

SCT Temperature History Version:     2
Temperature Sampling Period:         3 minutes
Temperature Logging Interval:        59 minutes
Min/Max recommended Temperature:      0/ 0 Celsius
Min/Max Temperature Limit:            0/ 0 Celsius
Temperature History Size (Index):    128 (109)

Index    Estimated Time   Temperature Celsius
 110    2016-07-20 05:53     ?  -
 ...    ..( 16 skipped).    ..  -
 127    2016-07-20 22:36     ?  -
   0    2016-07-20 23:35    51  ********************************
   1    2016-07-21 00:34     ?  -
   2    2016-07-21 01:33    22  ***
   3    2016-07-21 02:32    38  *******************
   4    2016-07-21 03:31    36  *****************
   5    2016-07-21 04:30    36  *****************
   6    2016-07-21 05:29     ?  -
   7    2016-07-21 06:28    27  ********
   8    2016-07-21 07:27    31  ************
   9    2016-07-21 08:26    35  ****************
 ...    ..( 19 skipped).    ..  ****************
  29    2016-07-22 04:06    35  ****************
  30    2016-07-22 05:05    34  ***************
  31    2016-07-22 06:04    34  ***************
  32    2016-07-22 07:03    33  **************
  33    2016-07-22 08:02    32  *************
 ...    ..( 12 skipped).    ..  *************
  46    2016-07-22 20:49    32  *************
  47    2016-07-22 21:48    37  ******************
  48    2016-07-22 22:47     ?  -
  49    2016-07-22 23:46    22  ***
  50    2016-07-23 00:45     ?  -
  51    2016-07-23 01:44    36  *****************
  52    2016-07-23 02:43     ?  -
  53    2016-07-23 03:42    36  *****************
  54    2016-07-23 04:41     ?  -
  55    2016-07-23 05:40    35  ****************
  56    2016-07-23 06:39     ?  -
  57    2016-07-23 07:38    30  ***********
  58    2016-07-23 08:37     ?  -
  59    2016-07-23 09:36    31  ************
  60    2016-07-23 10:35    34  ***************
  61    2016-07-23 11:34     ?  -
  62    2016-07-23 12:33    33  **************
  63    2016-07-23 13:32    34  ***************
  64    2016-07-23 14:31     ?  -
  65    2016-07-23 15:30    34  ***************
  66    2016-07-23 16:29    34  ***************
  67    2016-07-23 17:28     ?  -
  68    2016-07-23 18:27    34  ***************
  69    2016-07-23 19:26    34  ***************
  70    2016-07-23 20:25     ?  -
  71    2016-07-23 21:24    34  ***************
  72    2016-07-23 22:23    34  ***************
  73    2016-07-23 23:22     ?  -
  74    2016-07-24 00:21    34  ***************
  75    2016-07-24 01:20    35  ****************
  76    2016-07-24 02:19     ?  -
  77    2016-07-24 03:18    34  ***************
  78    2016-07-24 04:17    34  ***************
  79    2016-07-24 05:16     ?  -
  80    2016-07-24 06:15    30  ***********
  81    2016-07-24 07:14    32  *************
  82    2016-07-24 08:13     ?  -
  83    2016-07-24 09:12    32  *************
  84    2016-07-24 10:11    32  *************
  85    2016-07-24 11:10     ?  -
  86    2016-07-24 12:09    32  *************
  87    2016-07-24 13:08    32  *************
  88    2016-07-24 14:07     ?  -
  89    2016-07-24 15:06    32  *************
  90    2016-07-24 16:05    32  *************
  91    2016-07-24 17:04     ?  -
  92    2016-07-24 18:03    32  *************
  93    2016-07-24 19:02     ?  -
  94    2016-07-24 20:01    28  *********
  95    2016-07-24 21:00     ?  -
  96    2016-07-24 21:59    29  **********
  97    2016-07-24 22:58     ?  -
  98    2016-07-24 23:57    22  ***
  99    2016-07-25 00:56     ?  -
 100    2016-07-25 01:55    22  ***
 101    2016-07-25 02:54     ?  -
 102    2016-07-25 03:53    23  ****
 103    2016-07-25 04:52     ?  -
 104    2016-07-25 05:51    30  ***********
 105    2016-07-25 06:50     ?  -
 106    2016-07-25 07:49    41  **********************
 107    2016-07-25 08:48     ?  -
 108    2016-07-25 09:47    32  *************
 109    2016-07-25 10:46    33  **************

SCT Error Recovery Control:
           Read: Disabled
          Write: Disabled

Device Statistics (GP/SMART Log 0x04) not supported

SATA Phy Event Counters (GP Log 0x11)
ID      Size     Value  Description
0x000a  2            4  Device-to-host register FISes sent due to a COMRESET
0x0001  2            0  Command failed due to ICRC error
0x0003  2            0  R_ERR response for device-to-host data FIS
0x0004  2            0  R_ERR response for host-to-device data FIS
0x0006  2            0  R_ERR response for device-to-host non-data FIS
0x0007  2            0  R_ERR response for host-to-device non-data FIS

