smartctl 6.6 2016-05-31 r4324 [x86_64-linux-4.11.0-041100rc7-generic] (local build)
Copyright (C) 2002-16, Bruce Allen, Christian Franke, www.smartmontools.org

=== START OF INFORMATION SECTION ===
Device Model:     Crucial_CT1050MX300SSD1
Serial Number:    1710161C669E
LU WWN Device Id: 5 00a075 1161c669e
Firmware Version: M0CR040
User Capacity:    1 050 214 588 416 bytes [1,05 TB]
Sector Size:      512 bytes logical/physical
Rotation Rate:    Solid State Device
Form Factor:      2.5 inches
Device is:        Not in smartctl database [for details use: -P showall]
ATA Version is:   ACS-3 T13/2161-D revision 5
SATA Version is:  SATA 3.2, 6.0 Gb/s (current: 6.0 Gb/s)
Local Time is:    Mon Aug 28 07:25:51 2017 CEST
SMART support is: Available - device has SMART capability.
SMART support is: Enabled
AAM feature is:   Unavailable
APM level is:     254 (maximum performance)
Rd look-ahead is: Enabled
Write cache is:   Enabled
ATA Security is:  Unavailable
Wt Cache Reorder: Enabled

=== START OF READ SMART DATA SECTION ===
SMART overall-health self-assessment test result: PASSED

General SMART Values:
Offline data collection status:  (0x00)	Offline data collection activity
					was never started.
					Auto Offline Data Collection: Disabled.
Self-test execution status:      (   0)	The previous self-test routine completed
					without error or no self-test has ever 
					been run.
Total time to complete Offline 
data collection: 		( 2078) seconds.
Offline data collection
capabilities: 			 (0x7b) SMART execute Offline immediate.
					Auto Offline data collection on/off support.
					Suspend Offline collection upon new
					command.
					Offline surface scan supported.
					Self-test supported.
					Conveyance Self-test supported.
					Selective Self-test supported.
SMART capabilities:            (0x0003)	Saves SMART data before entering
					power-saving mode.
					Supports SMART auto save timer.
Error logging capability:        (0x01)	Error logging supported.
					General Purpose Logging supported.
Short self-test routine 
recommended polling time: 	 (   2) minutes.
Extended self-test routine
recommended polling time: 	 (  10) minutes.
Conveyance self-test routine
recommended polling time: 	 (   3) minutes.
SCT capabilities: 	       (0x0035)	SCT Status supported.
					SCT Feature Control supported.
					SCT Data Table supported.

SMART Attributes Data Structure revision number: 16
Vendor Specific SMART Attributes with Thresholds:
ID# ATTRIBUTE_NAME          FLAGS    VALUE WORST THRESH FAIL RAW_VALUE
  1 Raw_Read_Error_Rate     POSR-K   100   100   000    -    0
  5 Reallocated_Sector_Ct   -O--CK   100   100   010    -    0
  9 Power_On_Hours          -O--CK   100   100   000    -    2339
 12 Power_Cycle_Count       -O--CK   100   100   000    -    31
171 Unknown_Attribute       -O--CK   100   100   000    -    0
172 Unknown_Attribute       -O--CK   100   100   000    -    0
173 Unknown_Attribute       -O--CK   100   100   000    -    4
174 Unknown_Attribute       -O--CK   100   100   000    -    19
183 Runtime_Bad_Block       -O--CK   100   100   000    -    0
184 End-to-End_Error        -O--CK   100   100   000    -    0
187 Reported_Uncorrect      -O--CK   100   100   000    -    0
194 Temperature_Celsius     -O---K   069   049   000    -    31 (Min/Max 23/51)
196 Reallocated_Event_Count -O--CK   100   100   000    -    0
197 Current_Pending_Sector  -O--CK   100   100   000    -    0
198 Offline_Uncorrectable   ----CK   100   100   000    -    0
199 UDMA_CRC_Error_Count    -O--CK   100   100   000    -    0
202 Unknown_SSD_Attribute   ----CK   100   100   001    -    0
206 Unknown_SSD_Attribute   -OSR--   100   100   000    -    0
246 Unknown_Attribute       -O--CK   100   100   000    -    4110346924
247 Unknown_Attribute       -O--CK   100   100   000    -    128467946
248 Unknown_Attribute       -O--CK   100   100   000    -    83223710
180 Unused_Rsvd_Blk_Cnt_Tot PO--CK   000   000   000    -    4412
210 Unknown_Attribute       -O--CK   100   100   000    -    0
                            ||||||_ K auto-keep
                            |||||__ C event count
                            ||||___ R error rate
                            |||____ S speed/performance
                            ||_____ O updated online
                            |______ P prefailure warning

General Purpose Log Directory Version 1
SMART           Log Directory Version 1 [multi-sector log support]
Address    Access  R/W   Size  Description
0x00       GPL,SL  R/O      1  Log Directory
0x01           SL  R/O      1  Summary SMART error log
0x02           SL  R/O     51  Comprehensive SMART error log
0x03       GPL     R/O  16383  Ext. Comprehensive SMART error log
0x04       GPL,SL  R/O      8  Device Statistics log
0x06           SL  R/O      1  SMART self-test log
0x07       GPL     R/O      1  Extended self-test log
0x09           SL  R/W      1  Selective self-test log
0x10       GPL     R/O      1  SATA NCQ Queued Error log
0x11       GPL     R/O      1  SATA Phy Event Counters log
0x13       GPL     R/O      1  SATA NCQ Send and Receive log
0x24       GPL     R/O   8000  Current Device Internal Status Data log
0x25       GPL     R/O   8000  Saved Device Internal Status Data log
0x30       GPL,SL  R/O      9  IDENTIFY DEVICE data log
0x80-0x9f  GPL,SL  R/W     16  Host vendor specific log
0xa0       GPL     VS   35328  Device vendor specific log
0xa1       GPL,SL  VS       3  Device vendor specific log
0xa2       GPL,SL  VS       1  Device vendor specific log
0xa3       GPL     VS   13824  Device vendor specific log
0xa4       GPL     VS     354  Device vendor specific log
0xa4       SL      VS      98  Device vendor specific log
0xa5       GPL     VS    8000  Device vendor specific log
0xa5       SL      VS      64  Device vendor specific log
0xa6       GPL     VS    8000  Device vendor specific log
0xa6       SL      VS      64  Device vendor specific log
0xa7-0xdf  GPL,SL  VS       1  Device vendor specific log
0xe0       GPL,SL  R/W      1  SCT Command/Status
0xe1       GPL,SL  R/W      1  SCT Data Transfer

SMART Extended Comprehensive Error Log Version: 1 (16383 sectors)
No Errors Logged

SMART Extended Self-test Log Version: 1 (1 sectors)
Num  Test_Description    Status                  Remaining  LifeTime(hours)  LBA_of_first_error
# 1  Short offline       Completed without error       00%      2339         -
# 2  Vendor (0xff)       Completed without error       00%      2325         -
# 3  Extended offline    Completed without error       00%      2224         -
# 4  Vendor (0xff)       Completed without error       00%      2223         -
# 5  Vendor (0xff)       Completed without error       00%      2127         -
# 6  Vendor (0xff)       Completed without error       00%      2049         -
# 7  Vendor (0xff)       Completed without error       00%      1968         -
# 8  Extended offline    Completed without error       00%      1903         -
# 9  Short offline       Completed without error       00%      1903         -
#10  Vendor (0xff)       Completed without error       00%      1859         -
#11  Vendor (0xff)       Completed without error       00%      1782         -
#12  Vendor (0xff)       Completed without error       00%      1288         -
#13  Vendor (0xff)       Completed without error       00%      1076         -
#14  Vendor (0xff)       Completed without error       00%       859         -
#15  Vendor (0xff)       Completed without error       00%       643         -

SMART Selective self-test log data structure revision number 1
 SPAN  MIN_LBA  MAX_LBA  CURRENT_TEST_STATUS
    1        0        0  Not_testing
    2        0        0  Not_testing
    3        0        0  Completed [00% left] (57881389-57946924)
    4        0        0  Not_testing
    5        0        0  Not_testing
Selective self-test flags (0x0):
  After scanning selected spans, do NOT read-scan remainder of disk.
If Selective self-test is pending on power-up, resume after 0 minute delay.

SCT Status Version:                  3
SCT Version (vendor specific):       1 (0x0001)
SCT Support Level:                   0
Device State:                        Active (0)
Current Temperature:                    31 Celsius
Power Cycle Min/Max Temperature:     30/43 Celsius
Lifetime    Min/Max Temperature:     23/51 Celsius
Under/Over Temperature Limit Count:   0/0

SCT Temperature History Version:     2
Temperature Sampling Period:         1 minute
Temperature Logging Interval:        1 minute
Min/Max recommended Temperature:      0/70 Celsius
Min/Max Temperature Limit:           -5/75 Celsius
Temperature History Size (Index):    478 (438)

Index    Estimated Time   Temperature Celsius
 439    2017-08-27 23:28    31  ************
 ...    ..( 27 skipped).    ..  ************
 467    2017-08-27 23:56    31  ************
 468    2017-08-27 23:57    30  ***********
 ...    ..(  4 skipped).    ..  ***********
 473    2017-08-28 00:02    30  ***********
 474    2017-08-28 00:03    32  *************
 475    2017-08-28 00:04    33  **************
 476    2017-08-28 00:05    32  *************
 477    2017-08-28 00:06    31  ************
   0    2017-08-28 00:07    32  *************
 ...    ..(139 skipped).    ..  *************
 140    2017-08-28 02:27    32  *************
 141    2017-08-28 02:28    31  ************
 ...    ..(146 skipped).    ..  ************
 288    2017-08-28 04:55    31  ************
 289    2017-08-28 04:56    30  ***********
 290    2017-08-28 04:57    31  ************
 291    2017-08-28 04:58    30  ***********
 ...    ..( 77 skipped).    ..  ***********
 369    2017-08-28 06:16    30  ***********
 370    2017-08-28 06:17    35  ****************
 371    2017-08-28 06:18    38  *******************
 372    2017-08-28 06:19    39  ********************
 373    2017-08-28 06:20    40  *********************
 374    2017-08-28 06:21    41  **********************
 375    2017-08-28 06:22    41  **********************
 376    2017-08-28 06:23    41  **********************
 377    2017-08-28 06:24    42  ***********************
 ...    ..(  4 skipped).    ..  ***********************
 382    2017-08-28 06:29    42  ***********************
 383    2017-08-28 06:30    43  ************************
 ...    ..( 10 skipped).    ..  ************************
 394    2017-08-28 06:41    43  ************************
 395    2017-08-28 06:42    39  ********************
 396    2017-08-28 06:43    37  ******************
 397    2017-08-28 06:44    35  ****************
 398    2017-08-28 06:45    34  ***************
 399    2017-08-28 06:46    33  **************
 400    2017-08-28 06:47    32  *************
 401    2017-08-28 06:48    32  *************
 402    2017-08-28 06:49    32  *************
 403    2017-08-28 06:50    31  ************
 ...    ..( 34 skipped).    ..  ************
 438    2017-08-28 07:25    31  ************

SCT Error Recovery Control command not supported

Device Statistics (GP Log 0x04)
Page  Offset Size        Value Flags Description
0x01  =====  =               =  ===  == General Statistics (rev 1) ==
0x01  0x008  4              31  ---  Lifetime Power-On Resets
0x01  0x010  4            2339  ---  Power-on Hours
0x01  0x018  6      4110346924  ---  Logical Sectors Written
0x01  0x020  6         3711297  ---  Number of Write Commands
0x01  0x028  6      3768862943  ---  Logical Sectors Read
0x01  0x030  6        17617914  ---  Number of Read Commands
0x04  =====  =               =  ===  == General Errors Statistics (rev 1) ==
0x04  0x008  4               0  ---  Number of Reported Uncorrectable Errors
0x04  0x010  4              48  ---  Resets Between Cmd Acceptance and Completion
0x05  =====  =               =  ===  == Temperature Statistics (rev 1) ==
0x05  0x008  1              31  ---  Current Temperature
0x05  0x010  1              33  ---  Average Short Term Temperature
0x05  0x018  1               -  ---  Average Long Term Temperature
0x05  0x020  1              51  ---  Highest Temperature
0x05  0x028  1              23  ---  Lowest Temperature
0x05  0x030  1              37  ---  Highest Average Short Term Temperature
0x05  0x038  1              27  ---  Lowest Average Short Term Temperature
0x05  0x040  1               -  ---  Highest Average Long Term Temperature
0x05  0x048  1               -  ---  Lowest Average Long Term Temperature
0x05  0x050  4               0  ---  Time in Over-Temperature
0x05  0x058  1              70  ---  Specified Maximum Operating Temperature
0x05  0x060  4               0  ---  Time in Under-Temperature
0x05  0x068  1               0  ---  Specified Minimum Operating Temperature
0x06  =====  =               =  ===  == Transport Statistics (rev 1) ==
0x06  0x008  4             352  ---  Number of Hardware Resets
0x06  0x010  4             119  ---  Number of ASR Events
0x06  0x018  4               0  ---  Number of Interface CRC Errors
0x07  =====  =               =  ===  == Solid State Device Statistics (rev 1) ==
0x07  0x008  1               0  N--  Percentage Used Endurance Indicator
                                |||_ C monitored condition met
                                ||__ D supports DSN
                                |___ N normalized value

SATA Phy Event Counters (GP Log 0x11)
ID      Size     Value  Description
0x0001  4            0  Command failed due to ICRC error
0x000a  4            3  Device-to-host register FISes sent due to a COMRESET

