smartctl 6.6 2017-11-05 r4594 [x86_64-w64-mingw32-2016-1607] (sf-6.6-1)
Copyright (C) 2002-17, Bruce Allen, Christian Franke, www.smartmontools.org

=== START OF INFORMATION SECTION ===
Device Model:     SAMSUNG MZ7LM960HMJP-00005
Firmware Version: GXT5104Q
User Capacity:    960,197,124,096 bytes [960 GB]
Sector Size:      512 bytes logical/physical
Rotation Rate:    Solid State Device
Form Factor:      2.5 inches
Device is:        Not in smartctl database [for details use: -P showall]
ATA Version is:   ACS-2, ATA8-ACS T13/1699-D revision 4c
SATA Version is:  SATA 3.1, 6.0 Gb/s (current: 6.0 Gb/s)
Local Time is:    Sun Dec 03 17:20:24 2017 EST
SMART support is: Available - device has SMART capability.
SMART support is: Enabled
AAM feature is:   Unavailable
APM feature is:   Disabled
Rd look-ahead is: Enabled
Write cache is:   Enabled
DSN feature is:   Unavailable
ATA Security is:  Disabled, frozen [SEC2]
Wt Cache Reorder: Unknown (0xe001)

=== START OF READ SMART DATA SECTION ===
SMART overall-health self-assessment test result: PASSED

General SMART Values:
Offline data collection status:  (0x02)	Offline data collection activity
					was completed without error.
					Auto Offline Data Collection: Disabled.
Self-test execution status:      (   0)	The previous self-test routine completed
					without error or no self-test has ever 
					been run.
Total time to complete Offline 
data collection: 		( 3600) seconds.
Offline data collection
capabilities: 			 (0x53) SMART execute Offline immediate.
					Auto Offline data collection on/off support.
					Suspend Offline collection upon new
					command.
					No Offline surface scan supported.
					Self-test supported.
					No Conveyance Self-test supported.
					Selective Self-test supported.
SMART capabilities:            (0x0003)	Saves SMART data before entering
					power-saving mode.
					Supports SMART auto save timer.
Error logging capability:        (0x01)	Error logging supported.
					General Purpose Logging supported.
Short self-test routine 
recommended polling time: 	 (   2) minutes.
Extended self-test routine
recommended polling time: 	 (  60) minutes.
SCT capabilities: 	       (0x003d)	SCT Status supported.
					SCT Error Recovery Control supported.
					SCT Feature Control supported.
					SCT Data Table supported.

SMART Attributes Data Structure revision number: 1
Vendor Specific SMART Attributes with Thresholds:
ID# ATTRIBUTE_NAME          FLAGS    VALUE WORST THRESH FAIL RAW_VALUE
  5 Reallocated_Sector_Ct   PO--CK   100   100   010    -    0
  9 Power_On_Hours          -O--CK   099   099   000    -    2850
 12 Power_Cycle_Count       -O--CK   099   099   000    -    48
177 Wear_Leveling_Count     PO--C-   099   099   005    -    5
179 Used_Rsvd_Blk_Cnt_Tot   PO--C-   100   100   010    -    0
180 Unused_Rsvd_Blk_Cnt_Tot PO--C-   100   100   010    -    3235
181 Program_Fail_Cnt_Total  -O--CK   100   100   010    -    0
182 Erase_Fail_Count_Total  -O--CK   100   100   010    -    0
183 Runtime_Bad_Block       PO--C-   100   100   010    -    0
184 End-to-End_Error        PO--CK   100   100   097    -    0
187 Reported_Uncorrect      -O--CK   100   100   000    -    0
190 Airflow_Temperature_Cel -O--CK   077   059   000    -    23
194 Temperature_Celsius     -O---K   077   059   000    -    23 (Min/Max 22/41)
195 Hardware_ECC_Recovered  -O-RC-   200   200   000    -    0
197 Current_Pending_Sector  -O--CK   100   100   000    -    0
199 UDMA_CRC_Error_Count    -OSRCK   100   100   000    -    0
202 Unknown_SSD_Attribute   PO--CK   100   100   010    -    0
235 Unknown_Attribute       -O--C-   099   099   000    -    26
241 Total_LBAs_Written      -O--CK   099   099   000    -    2258524170
242 Total_LBAs_Read         -O--CK   099   099   000    -    683679447
243 Unknown_Attribute       -O--CK   100   100   000    -    0
244 Unknown_Attribute       -O--CK   100   100   000    -    0
245 Unknown_Attribute       -O--CK   100   100   000    -    65535
246 Unknown_Attribute       -O--CK   100   100   000    -    65535
247 Unknown_Attribute       -O--CK   100   100   000    -    65535
251 Unknown_Attribute       -O--CK   100   100   000    -    9107368960
                            ||||||_ K auto-keep
                            |||||__ C event count
                            ||||___ R error rate
                            |||____ S speed/performance
                            ||_____ O updated online
                            |______ P prefailure warning

General Purpose Log Directory Version 1
SMART           Log Directory Version 1 [multi-sector log support]
Address    Access  R/W   Size  Description
0x00       GPL,SL  R/O      1  Log Directory
0x01           SL  R/O      1  Summary SMART error log
0x02           SL  R/O      1  Comprehensive SMART error log
0x03       GPL     R/O      1  Ext. Comprehensive SMART error log
0x04       GPL,SL  R/O      8  Device Statistics log
0x06           SL  R/O      1  SMART self-test log
0x07       GPL     R/O      1  Extended self-test log
0x08       GPL     R/O      2  Power Conditions log
0x09           SL  R/W      1  Selective self-test log
0x10       GPL     R/O      1  NCQ Command Error log
0x11       GPL     R/O      1  SATA Phy Event Counters log
0x13       GPL     R/O      1  SATA NCQ Send and Receive log
0x30       GPL,SL  R/O      9  IDENTIFY DEVICE data log
0x80-0x9f  GPL,SL  R/W     16  Host vendor specific log
0xa0       GPL     VS      16  Device vendor specific log
0xce           SL  VS      16  Device vendor specific log
0xe0       GPL,SL  R/W      1  SCT Command/Status
0xe1       GPL,SL  R/W      1  SCT Data Transfer

SMART Extended Comprehensive Error Log Version: 1 (1 sectors)
No Errors Logged

SMART Extended Self-test Log Version: 1 (1 sectors)
Num  Test_Description    Status                  Remaining  LifeTime(hours)  LBA_of_first_error
# 1  Short offline       Completed without error       00%      2850         -

SMART Selective self-test log data structure revision number 1
 SPAN  MIN_LBA  MAX_LBA  CURRENT_TEST_STATUS
    1        0        0  Not_testing
    2        0        0  Not_testing
    3        0        0  Not_testing
    4        0        0  Not_testing
    5        0        0  Not_testing
  255        0    65535  Read_scanning was completed without error
Selective self-test flags (0x0):
  After scanning selected spans, do NOT read-scan remainder of disk.
If Selective self-test is pending on power-up, resume after 0 minute delay.

SCT Status Version:                  3
SCT Version (vendor specific):       256 (0x0100)
SCT Support Level:                   1
Device State:                        SCT command executing in background (5)
Current Temperature:                    23 Celsius
Power Cycle Min/Max Temperature:     22/29 Celsius
Lifetime    Min/Max Temperature:     22/41 Celsius
Under/Over Temperature Limit Count:   0/0

SCT Temperature History Version:     2
Temperature Sampling Period:         1 minute
Temperature Logging Interval:        10 minutes
Min/Max recommended Temperature:      0/70 Celsius
Min/Max Temperature Limit:            0/70 Celsius
Temperature History Size (Index):    128 (114)

Index    Estimated Time   Temperature Celsius
 115    2017-12-02 20:10    24  *****
 116    2017-12-02 20:20    26  *******
 117    2017-12-02 20:30    25  ******
 118    2017-12-02 20:40    23  ****
 119    2017-12-02 20:50    25  ******
 120    2017-12-02 21:00    26  *******
 121    2017-12-02 21:10    25  ******
 122    2017-12-02 21:20    24  *****
 123    2017-12-02 21:30    26  *******
 124    2017-12-02 21:40    25  ******
 125    2017-12-02 21:50    23  ****
 126    2017-12-02 22:00    25  ******
 127    2017-12-02 22:10    26  *******
   0    2017-12-02 22:20    26  *******
   1    2017-12-02 22:30    24  *****
   2    2017-12-02 22:40    25  ******
   3    2017-12-02 22:50    26  *******
   4    2017-12-02 23:00    25  ******
   5    2017-12-02 23:10    23  ****
   6    2017-12-02 23:20    25  ******
   7    2017-12-02 23:30    26  *******
   8    2017-12-02 23:40    24  *****
   9    2017-12-02 23:50    26  *******
  10    2017-12-03 00:00    24  *****
  11    2017-12-03 00:10    25  ******
  12    2017-12-03 00:20    26  *******
  13    2017-12-03 00:30    26  *******
  14    2017-12-03 00:40    23  ****
  15    2017-12-03 00:50    26  *******
  16    2017-12-03 01:00    25  ******
  17    2017-12-03 01:10    23  ****
  18    2017-12-03 01:20    25  ******
  19    2017-12-03 01:30    26  *******
  20    2017-12-03 01:40    26  *******
  21    2017-12-03 01:50    23  ****
  22    2017-12-03 02:00    26  *******
  23    2017-12-03 02:10    26  *******
  24    2017-12-03 02:20    23  ****
  25    2017-12-03 02:30    25  ******
  26    2017-12-03 02:40    26  *******
  27    2017-12-03 02:50    26  *******
  28    2017-12-03 03:00    26  *******
  29    2017-12-03 03:10    24  *****
  30    2017-12-03 03:20    24  *****
  31    2017-12-03 03:30    26  *******
  32    2017-12-03 03:40    27  ********
  33    2017-12-03 03:50    23  ****
  34    2017-12-03 04:00    25  ******
  35    2017-12-03 04:10    26  *******
  36    2017-12-03 04:20    26  *******
  37    2017-12-03 04:30    26  *******
  38    2017-12-03 04:40    23  ****
  39    2017-12-03 04:50    26  *******
  40    2017-12-03 05:00    27  ********
  41    2017-12-03 05:10    24  *****
  42    2017-12-03 05:20    22  ***
  43    2017-12-03 05:30    25  ******
  44    2017-12-03 05:40    26  *******
  45    2017-12-03 05:50    24  *****
  46    2017-12-03 06:00    25  ******
  47    2017-12-03 06:10    26  *******
  48    2017-12-03 06:20    26  *******
  49    2017-12-03 06:30    25  ******
  50    2017-12-03 06:40    24  *****
  51    2017-12-03 06:50    26  *******
  52    2017-12-03 07:00    24  *****
  53    2017-12-03 07:10    25  ******
  54    2017-12-03 07:20    26  *******
  55    2017-12-03 07:30    26  *******
  56    2017-12-03 07:40    24  *****
  57    2017-12-03 07:50    26  *******
  58    2017-12-03 08:00    26  *******
  59    2017-12-03 08:10    24  *****
  60    2017-12-03 08:20    26  *******
 ...    ..(  3 skipped).    ..  *******
  64    2017-12-03 09:00    26  *******
  65    2017-12-03 09:10    24  *****
  66    2017-12-03 09:20    25  ******
  67    2017-12-03 09:30    27  ********
  68    2017-12-03 09:40    27  ********
  69    2017-12-03 09:50    24  *****
  70    2017-12-03 10:00    22  ***
  71    2017-12-03 10:10    25  ******
  72    2017-12-03 10:20    26  *******
  73    2017-12-03 10:30    25  ******
  74    2017-12-03 10:40    24  *****
  75    2017-12-03 10:50    26  *******
 ...    ..(  2 skipped).    ..  *******
  78    2017-12-03 11:20    26  *******
  79    2017-12-03 11:30    23  ****
  80    2017-12-03 11:40    26  *******
  81    2017-12-03 11:50    25  ******
  82    2017-12-03 12:00    24  *****
  83    2017-12-03 12:10    26  *******
  84    2017-12-03 12:20    26  *******
  85    2017-12-03 12:30    24  *****
  86    2017-12-03 12:40    26  *******
  87    2017-12-03 12:50    27  ********
  88    2017-12-03 13:00    24  *****
  89    2017-12-03 13:10    25  ******
  90    2017-12-03 13:20    26  *******
  91    2017-12-03 13:30    26  *******
  92    2017-12-03 13:40    24  *****
  93    2017-12-03 13:50    25  ******
  94    2017-12-03 14:00    26  *******
  95    2017-12-03 14:10    24  *****
  96    2017-12-03 14:20    24  *****
  97    2017-12-03 14:30    26  *******
  98    2017-12-03 14:40    26  *******
  99    2017-12-03 14:50    24  *****
 100    2017-12-03 15:00    26  *******
 101    2017-12-03 15:10    26  *******
 102    2017-12-03 15:20    23  ****
 103    2017-12-03 15:30    25  ******
 104    2017-12-03 15:40    26  *******
 105    2017-12-03 15:50    26  *******
 106    2017-12-03 16:00    26  *******
 107    2017-12-03 16:10    23  ****
 108    2017-12-03 16:20    26  *******
 109    2017-12-03 16:30    27  ********
 110    2017-12-03 16:40    23  ****
 111    2017-12-03 16:50    25  ******
 112    2017-12-03 17:00    26  *******
 113    2017-12-03 17:10    26  *******
 114    2017-12-03 17:20    26  *******

SMART WRITE LOG returns COUNT and LBA_LOW register unchanged
SCT (Get) Error Recovery Control command failed

Device Statistics (GP Log 0x04)
Page  Offset Size        Value Flags Description
0x01  =====  =               =  ===  == General Statistics (rev 1) ==
0x01  0x008  4              48  ---  Lifetime Power-On Resets
0x01  0x010  4            2850  ---  Power-on Hours
0x01  0x018  6      2258524170  ---  Logical Sectors Written
0x01  0x020  6         7167783  ---  Number of Write Commands
0x01  0x028  6       683679447  ---  Logical Sectors Read
0x01  0x030  6        14048344  ---  Number of Read Commands
0x01  0x038  6         2237000  ---  Date and Time TimeStamp
0x04  =====  =               =  ===  == General Errors Statistics (rev 1) ==
0x04  0x008  4               0  ---  Number of Reported Uncorrectable Errors
0x04  0x010  4               0  ---  Resets Between Cmd Acceptance and Completion
0x05  =====  =               =  ===  == Temperature Statistics (rev 1) ==
0x05  0x008  1              23  ---  Current Temperature
0x05  0x020  1              41  ---  Highest Temperature
0x05  0x028  1              22  ---  Lowest Temperature
0x05  0x058  1              55  ---  Specified Maximum Operating Temperature
0x06  =====  =               =  ===  == Transport Statistics (rev 1) ==
0x06  0x008  4             174  ---  Number of Hardware Resets
0x06  0x010  4               0  ---  Number of ASR Events
0x06  0x018  4               0  ---  Number of Interface CRC Errors
0x07  =====  =               =  ===  == Solid State Device Statistics (rev 1) ==
0x07  0x008  1               0  N--  Percentage Used Endurance Indicator
                                |||_ C monitored condition met
                                ||__ D supports DSN
                                |___ N normalized value

Pending Defects log (GP Log 0x0c) not supported

SATA Phy Event Counters (GP Log 0x11)
ID      Size     Value  Description
0x0001  2            0  Command failed due to ICRC error
0x0002  2            0  R_ERR response for data FIS
0x0003  2            0  R_ERR response for device-to-host data FIS
0x0004  2            0  R_ERR response for host-to-device data FIS
0x0005  2            0  R_ERR response for non-data FIS
0x0006  2            0  R_ERR response for device-to-host non-data FIS
0x0007  2            0  R_ERR response for host-to-device non-data FIS
0x0008  2            0  Device-to-host non-data FIS retries
0x0009  2           24  Transition from drive PhyRdy to drive PhyNRdy
0x000a  2           24  Device-to-host register FISes sent due to a COMRESET
0x000b  2            0  CRC errors within host-to-device FIS
0x000d  2            0  Non-CRC errors within host-to-device FIS
0x000f  2            0  R_ERR response for host-to-device data FIS, CRC
0x0010  2            0  R_ERR response for host-to-device data FIS, non-CRC
0x0012  2            0  R_ERR response for host-to-device non-data FIS, CRC
0x0013  2            0  R_ERR response for host-to-device non-data FIS, non-CRC

