smartctl 7.3 2022-02-28 r5338 [x86_64-w64-mingw32-win7-sp1] (sf-7.3-1)
Copyright (C) 2002-22, Bruce Allen, Christian Franke, www.smartmontools.org

=== START OF INFORMATION SECTION ===
Device Model:     PNY 1TB SATA SSD
Serial Number:    PNF49228034140916487
LU WWN Device Id: 5 f8db4c 492203414
Firmware Version: H220916a
User Capacity:    1,000,204,886,016 bytes [1.00 TB]
Sector Size:      512 bytes logical/physical
Rotation Rate:    Solid State Device
Form Factor:      2.5 inches
TRIM Command:     Available, deterministic, zeroed
Device is:        Not in smartctl database 7.3/5440
ATA Version is:   ACS-4 (minor revision not indicated)
SATA Version is:  SATA 3.2, 6.0 Gb/s (current: 3.0 Gb/s)
Local Time is:    Fri Mar 31 23:31:08 2023 WEDT
SMART support is: Available - device has SMART capability.
SMART support is: Enabled
AAM feature is:   Unavailable
APM feature is:   Unavailable
Rd look-ahead is: Enabled
Write cache is:   Enabled
DSN feature is:   Unavailable
ATA Security is:  Disabled, frozen [SEC2]
Wt Cache Reorder: Enabled

=== START OF READ SMART DATA SECTION ===
SMART overall-health self-assessment test result: PASSED

General SMART Values:
Offline data collection status:  (0x00)	Offline data collection activity
					was never started.
					Auto Offline Data Collection: Disabled.
Self-test execution status:      (   0)	The previous self-test routine completed
					without error or no self-test has ever 
					been run.
Total time to complete Offline 
data collection: 		(   33) seconds.
Offline data collection
capabilities: 			 (0x7b) SMART execute Offline immediate.
					Auto Offline data collection on/off support.
					Suspend Offline collection upon new
					command.
					Offline surface scan supported.
					Self-test supported.
					Conveyance Self-test supported.
					Selective Self-test supported.
SMART capabilities:            (0x0003)	Saves SMART data before entering
					power-saving mode.
					Supports SMART auto save timer.
Error logging capability:        (0x01)	Error logging supported.
					General Purpose Logging supported.
Short self-test routine 
recommended polling time: 	 (   2) minutes.
Extended self-test routine
recommended polling time: 	 (  85) minutes.
Conveyance self-test routine
recommended polling time: 	 (   2) minutes.
SCT capabilities: 	       (0x0031)	SCT Status supported.
					SCT Feature Control supported.
					SCT Data Table supported.

SMART Attributes Data Structure revision number: 20
Vendor Specific SMART Attributes with Thresholds:
ID# ATTRIBUTE_NAME          FLAGS    VALUE WORST THRESH FAIL RAW_VALUE
  5 Reallocated_Sector_Ct   PO--C-   100   100   050    -    0
  9 Power_On_Hours          -O--C-   100   100   000    -    2
 12 Power_Cycle_Count       -O--C-   100   100   000    -    7
164 Unknown_Attribute       -O--C-   200   200   000    -    4295098369
165 Unknown_Attribute       -O--CK   200   200   000    -    2
166 Unknown_Attribute       -O--CK   200   200   000    -    1
167 Unknown_Attribute       -O--CK   200   200   000    -    1
168 Unknown_Attribute       -O--C-   100   100   000    -    0
169 Unknown_Attribute       PO--C-   100   100   010    -    196614
170 Unknown_Attribute       -O---K   100   100   000    -    0
171 Unknown_Attribute       -O--CK   000   000   000    -    0
172 Unknown_Attribute       -O--CK   000   000   000    -    0
174 Unknown_Attribute       -O---K   100   100   000    -    0
175 Program_Fail_Count_Chip -O---K   100   100   010    -    0
180 Unused_Rsvd_Blk_Cnt_Tot PO--CK   100   100   000    -    309
187 Reported_Uncorrect      -O--CK   100   000   000    -    0
192 Power-Off_Retract_Count -O--C-   100   100   000    -    7
194 Temperature_Celsius     -O---K   031   031   000    -    31 (Min/Max 23/34)
199 UDMA_CRC_Error_Count    -O--C-   100   100   000    -    0
209 Unknown_SSD_Attribute   -O--CK   200   200   000    -    1
210 Unknown_Attribute       -O--CK   200   200   000    -    3
211 Unknown_Attribute       -O--CK   200   200   000    -    1
231 Unknown_SSD_Attribute   PO---K   100   100   005    -    0
241 Total_LBAs_Written      -O--CK   100   100   000    -    147
242 Total_LBAs_Read         -O--CK   100   100   000    -    0
243 Unknown_Attribute       -O--CK   050   050   000    -    34
245 Unknown_Attribute       -O--CK   100   100   000    -    0
                            ||||||_ K auto-keep
                            |||||__ C event count
                            ||||___ R error rate
                            |||____ S speed/performance
                            ||_____ O updated online
                            |______ P prefailure warning

General Purpose Log Directory Version 1
SMART           Log Directory Version 1 [multi-sector log support]
Address    Access  R/W   Size  Description
0x00       GPL,SL  R/O      1  Log Directory
0x01           SL  R/O      1  Summary SMART error log
0x02           SL  R/O     51  Comprehensive SMART error log
0x03       GPL     R/O     64  Ext. Comprehensive SMART error log
0x04       GPL,SL  R/O      8  Device Statistics log
0x06           SL  R/O      1  SMART self-test log
0x07       GPL     R/O      1  Extended self-test log
0x09           SL  R/W      1  Selective self-test log
0x10       GPL     R/O      1  NCQ Command Error log
0x11       GPL     R/O      1  SATA Phy Event Counters log
0x30       GPL,SL  R/O      9  IDENTIFY DEVICE data log
0x80-0x9f  GPL,SL  R/W     16  Host vendor specific log
0xe0       GPL,SL  R/W      1  SCT Command/Status
0xe1       GPL,SL  R/W      1  SCT Data Transfer

SMART Extended Comprehensive Error Log Version: 1 (64 sectors)
No Errors Logged

SMART Extended Self-test Log Version: 1 (1 sectors)
No self-tests have been logged.  [To run self-tests, use: smartctl -t]

SMART Selective self-test log data structure revision number 1
 SPAN  MIN_LBA  MAX_LBA  CURRENT_TEST_STATUS
    1        0        0  Not_testing
    2        0        0  Not_testing
    3        0        0  Not_testing
    4        0        0  Not_testing
    5        0        0  Not_testing
Selective self-test flags (0x0):
  After scanning selected spans, do NOT read-scan remainder of disk.
If Selective self-test is pending on power-up, resume after 0 minute delay.

SCT Status Version:                  3
SCT Version (vendor specific):       1 (0x0001)
Device State:                        Active (0)
Current Temperature:                    30 Celsius
Power Cycle Min/Max Temperature:      ?/32 Celsius
Lifetime    Min/Max Temperature:      ?/ ? Celsius
Under/Over Temperature Limit Count:   0/0

SCT Temperature History Version:     2
Temperature Sampling Period:         1 minute
Temperature Logging Interval:        1 minute
Min/Max recommended Temperature:     -127/127 Celsius
Min/Max Temperature Limit:           -127/127 Celsius
Temperature History Size (Index):    478 (136)

Index    Estimated Time   Temperature Celsius
 137    2023-03-31 15:34     ?  -
 ...    ..(345 skipped).    ..  -
   5    2023-03-31 21:20     ?  -
   6    2023-03-31 21:21    31  ************
   7    2023-03-31 21:22    31  ************
   8    2023-03-31 21:23    32  *************
 ...    ..(  7 skipped).    ..  *************
  16    2023-03-31 21:31    32  *************
  17    2023-03-31 21:32     ?  -
  18    2023-03-31 21:33    28  *********
  19    2023-03-31 21:34    29  **********
  20    2023-03-31 21:35    30  ***********
  21    2023-03-31 21:36    30  ***********
  22    2023-03-31 21:37    30  ***********
  23    2023-03-31 21:38    31  ************
 ...    ..( 25 skipped).    ..  ************
  49    2023-03-31 22:04    31  ************
  50    2023-03-31 22:05    29  **********
  51    2023-03-31 22:06    31  ************
 ...    ..(  6 skipped).    ..  ************
  58    2023-03-31 22:13    31  ************
  59    2023-03-31 22:14     ?  -
 ...    ..(  8 skipped).    ..  -
  68    2023-03-31 22:23     ?  -
  69    2023-03-31 22:24    31  ************
  70    2023-03-31 22:25     ?  -
 ...    ..(  3 skipped).    ..  -
  74    2023-03-31 22:29     ?  -
  75    2023-03-31 22:30    32  *************
  76    2023-03-31 22:31    32  *************
  77    2023-03-31 22:32     ?  -
 ...    ..(  2 skipped).    ..  -
  80    2023-03-31 22:35     ?  -
  81    2023-03-31 22:36    31  ************
  82    2023-03-31 22:37     ?  -
 ...    ..(  9 skipped).    ..  -
  92    2023-03-31 22:47     ?  -
  93    2023-03-31 22:48    31  ************
  94    2023-03-31 22:49     ?  -
  95    2023-03-31 22:50    31  ************
 ...    ..( 22 skipped).    ..  ************
 118    2023-03-31 23:13    31  ************
 119    2023-03-31 23:14    30  ***********
 120    2023-03-31 23:15    31  ************
 121    2023-03-31 23:16    31  ************
 122    2023-03-31 23:17    30  ***********
 ...    ..(  2 skipped).    ..  ***********
 125    2023-03-31 23:20    30  ***********
 126    2023-03-31 23:21    31  ************
 127    2023-03-31 23:22    31  ************
 128    2023-03-31 23:23    31  ************
 129    2023-03-31 23:24    30  ***********
 130    2023-03-31 23:25    31  ************
 131    2023-03-31 23:26    31  ************
 132    2023-03-31 23:27    30  ***********
 133    2023-03-31 23:28    31  ************
 134    2023-03-31 23:29    30  ***********
 135    2023-03-31 23:30    31  ************
 136    2023-03-31 23:31    30  ***********

SCT Error Recovery Control command not supported

Device Statistics (GP Log 0x04)
Page  Offset Size        Value Flags Description
0x01  =====  =               =  ===  == General Statistics (rev 1) ==
0x01  0x008  4               7  ---  Lifetime Power-On Resets
0x01  0x010  4               2  ---  Power-on Hours
0x01  0x018  6       309944495  ---  Logical Sectors Written
0x01  0x020  6         1275399  ---  Number of Write Commands
0x01  0x028  6          196938  ---  Logical Sectors Read
0x01  0x030  6            1916  ---  Number of Read Commands
0x01  0x038  6         7153600  ---  Date and Time TimeStamp
0x07  =====  =               =  ===  == Solid State Device Statistics (rev 1) ==
0x07  0x008  1               0  N--  Percentage Used Endurance Indicator
                                |||_ C monitored condition met
                                ||__ D supports DSN
                                |___ N normalized value

Pending Defects log (GP Log 0x0c) not supported

SATA Phy Event Counters (GP Log 0x11)
ID      Size     Value  Description
0x0001  2            0  Command failed due to ICRC error
0x0003  2            0  R_ERR response for device-to-host data FIS
0x0004  2            0  R_ERR response for host-to-device data FIS
0x0006  2            0  R_ERR response for device-to-host non-data FIS
0x0007  2            0  R_ERR response for host-to-device non-data FIS
0x0008  2            0  Device-to-host non-data FIS retries
0x0009  4            0  Transition from drive PhyRdy to drive PhyNRdy
0x000a  4            3  Device-to-host register FISes sent due to a COMRESET
0x000f  2            0  R_ERR response for host-to-device data FIS, CRC
0x0010  2            0  R_ERR response for host-to-device data FIS, non-CRC
0x0012  2            0  R_ERR response for host-to-device non-data FIS, CRC
0x0013  2            0  R_ERR response for host-to-device non-data FIS, non-CRC

