# smartctl -d sat -q noserial -x /dev/sdb
smartctl 6.6 2016-05-31 r4324 [x86_64-linux-4.14.0-2-amd64] (local build)
Copyright (C) 2002-16, Bruce Allen, Christian Franke, www.smartmontools.org

=== START OF INFORMATION SECTION ===
Model Family:     Western Digital Blue
Device Model:     WDC WD30EZRZ-00Z5HB0
Firmware Version: 80.00A80
User Capacity:    3,000,592,982,016 bytes [3.00 TB]
Sector Sizes:     512 bytes logical, 4096 bytes physical
Rotation Rate:    5400 rpm
Device is:        In smartctl database [for details use: -P show]
ATA Version is:   ACS-2 (minor revision not indicated)
SATA Version is:  SATA 3.0, 6.0 Gb/s (current: 6.0 Gb/s)
Local Time is:    Sat Jan  6 20:25:43 2018 CET
SMART support is: Available - device has SMART capability.
SMART support is: Enabled
AAM feature is:   Unavailable
APM feature is:   Unavailable
Rd look-ahead is: Enabled
Write cache is:   Enabled
ATA Security is:  Disabled, NOT FROZEN [SEC1]
Wt Cache Reorder: Unknown

=== START OF READ SMART DATA SECTION ===
SMART Status not supported: Incomplete response, ATA output registers missing
SMART overall-health self-assessment test result: PASSED
Warning: This result is based on an Attribute check.

General SMART Values:
Offline data collection status:  (0x80)	Offline data collection activity
					was never started.
					Auto Offline Data Collection: Enabled.
Self-test execution status:      (   0)	The previous self-test routine completed
					without error or no self-test has ever 
					been run.
Total time to complete Offline 
data collection: 		(40080) seconds.
Offline data collection
capabilities: 			 (0x7b) SMART execute Offline immediate.
					Auto Offline data collection on/off support.
					Suspend Offline collection upon new
					command.
					Offline surface scan supported.
					Self-test supported.
					Conveyance Self-test supported.
					Selective Self-test supported.
SMART capabilities:            (0x0003)	Saves SMART data before entering
					power-saving mode.
					Supports SMART auto save timer.
Error logging capability:        (0x01)	Error logging supported.
					General Purpose Logging supported.
Short self-test routine 
recommended polling time: 	 (   2) minutes.
Extended self-test routine
recommended polling time: 	 ( 402) minutes.
Conveyance self-test routine
recommended polling time: 	 (   5) minutes.
SCT capabilities: 	       (0x7035)	SCT Status supported.
					SCT Feature Control supported.
					SCT Data Table supported.

SMART Attributes Data Structure revision number: 16
Vendor Specific SMART Attributes with Thresholds:
ID# ATTRIBUTE_NAME          FLAGS    VALUE WORST THRESH FAIL RAW_VALUE
  1 Raw_Read_Error_Rate     POSR-K   200   200   051    -    0
  3 Spin_Up_Time            POS--K   182   181   021    -    5891
  4 Start_Stop_Count        -O--CK   100   100   000    -    7
  5 Reallocated_Sector_Ct   PO--CK   200   200   140    -    0
  7 Seek_Error_Rate         -OSR-K   200   200   000    -    0
  9 Power_On_Hours          -O--CK   100   100   000    -    7
 10 Spin_Retry_Count        -O--CK   100   253   000    -    0
 11 Calibration_Retry_Count -O--CK   100   253   000    -    0
 12 Power_Cycle_Count       -O--CK   100   100   000    -    6
192 Power-Off_Retract_Count -O--CK   200   200   000    -    0
193 Load_Cycle_Count        -O--CK   200   200   000    -    17
194 Temperature_Celsius     -O---K   109   108   000    -    41
196 Reallocated_Event_Count -O--CK   200   200   000    -    0
197 Current_Pending_Sector  -O--CK   200   200   000    -    0
198 Offline_Uncorrectable   ----CK   100   253   000    -    0
199 UDMA_CRC_Error_Count    -O--CK   200   200   000    -    0
200 Multi_Zone_Error_Rate   ---R--   100   253   000    -    0
                            ||||||_ K auto-keep
                            |||||__ C event count
                            ||||___ R error rate
                            |||____ S speed/performance
                            ||_____ O updated online
                            |______ P prefailure warning

General Purpose Log Directory Version 1
SMART           Log Directory Version 1 [multi-sector log support]
Address    Access  R/W   Size  Description
0x00       GPL,SL  R/O      1  Log Directory
0x01           SL  R/O      1  Summary SMART error log
0x02           SL  R/O      5  Comprehensive SMART error log
0x03       GPL     R/O      6  Ext. Comprehensive SMART error log
0x06           SL  R/O      1  SMART self-test log
0x07       GPL     R/O      1  Extended self-test log
0x09           SL  R/W      1  Selective self-test log
0x10       GPL     R/O      1  SATA NCQ Queued Error log
0x11       GPL     R/O      1  SATA Phy Event Counters log
0x80-0x9f  GPL,SL  R/W     16  Host vendor specific log
0xa0-0xa7  GPL,SL  VS      16  Device vendor specific log
0xa8-0xb6  GPL,SL  VS       1  Device vendor specific log
0xb7       GPL,SL  VS      39  Device vendor specific log
0xbd       GPL,SL  VS       1  Device vendor specific log
0xc0       GPL,SL  VS       1  Device vendor specific log
0xc1       GPL     VS      93  Device vendor specific log
0xe0       GPL,SL  R/W      1  SCT Command/Status
0xe1       GPL,SL  R/W      1  SCT Data Transfer

SMART Extended Comprehensive Error Log Version: 1 (6 sectors)
No Errors Logged

SMART Extended Self-test Log Version: 1 (1 sectors)
Num  Test_Description    Status                  Remaining  LifeTime(hours)  LBA_of_first_error
# 1  Conveyance offline  Completed without error       00%         0         -
# 2  Short offline       Completed without error       00%         0         -

SMART Selective self-test log data structure revision number 1
 SPAN  MIN_LBA  MAX_LBA  CURRENT_TEST_STATUS
    1        0        0  Not_testing
    2        0        0  Not_testing
    3        0        0  Not_testing
    4        0        0  Not_testing
    5        0        0  Not_testing
Selective self-test flags (0x0):
  After scanning selected spans, do NOT read-scan remainder of disk.
If Selective self-test is pending on power-up, resume after 0 minute delay.

SCT Status Version:                  3
SCT Version (vendor specific):       258 (0x0102)
SCT Support Level:                   1
Device State:                        Active (0)
Current Temperature:                    42 Celsius
Power Cycle Min/Max Temperature:     20/42 Celsius
Lifetime    Min/Max Temperature:     18/42 Celsius
Under/Over Temperature Limit Count:   0/0
Vendor specific:
01 00 00 00 00 00 00 00 00 00 00 00 00 00 00 00
00 00 00 00 00 00 00 00 00 00 00 00 00 00 00 00

SCT Temperature History Version:     2
Temperature Sampling Period:         1 minute
Temperature Logging Interval:        1 minute
Min/Max recommended Temperature:      0/60 Celsius
Min/Max Temperature Limit:           -41/85 Celsius
Temperature History Size (Index):    478 (474)

Index    Estimated Time   Temperature Celsius
 475    2018-01-06 12:28     ?  -
 ...    ..(  2 skipped).    ..  -
   0    2018-01-06 12:31     ?  -
   1    2018-01-06 12:32    20  *
   2    2018-01-06 12:33     ?  -
   3    2018-01-06 12:34    20  *
   4    2018-01-06 12:35    21  **
   5    2018-01-06 12:36     ?  -
   6    2018-01-06 12:37    18  -
 ...    ..(  2 skipped).    ..  -
   9    2018-01-06 12:40    18  -
  10    2018-01-06 12:41     ?  -
  11    2018-01-06 12:42    19  -
  12    2018-01-06 12:43    19  -
  13    2018-01-06 12:44    19  -
  14    2018-01-06 12:45    20  *
  15    2018-01-06 12:46    21  **
  16    2018-01-06 12:47    21  **
  17    2018-01-06 12:48    21  **
  18    2018-01-06 12:49     ?  -
  19    2018-01-06 12:50    22  ***
  20    2018-01-06 12:51    22  ***
  21    2018-01-06 12:52    22  ***
  22    2018-01-06 12:53     ?  -
  23    2018-01-06 12:54    21  **
  24    2018-01-06 12:55    20  *
  25    2018-01-06 12:56    21  **
  26    2018-01-06 12:57    21  **
  27    2018-01-06 12:58    22  ***
  28    2018-01-06 12:59    22  ***
  29    2018-01-06 13:00    23  ****
  30    2018-01-06 13:01    23  ****
  31    2018-01-06 13:02    23  ****
  32    2018-01-06 13:03     ?  -
  33    2018-01-06 13:04    24  *****
  34    2018-01-06 13:05    24  *****
  35    2018-01-06 13:06    24  *****
  36    2018-01-06 13:07    25  ******
  37    2018-01-06 13:08    25  ******
  38    2018-01-06 13:09    25  ******
  39    2018-01-06 13:10    26  *******
  40    2018-01-06 13:11    26  *******
  41    2018-01-06 13:12    27  ********
 ...    ..(  2 skipped).    ..  ********
  44    2018-01-06 13:15    27  ********
  45    2018-01-06 13:16    28  *********
 ...    ..(  2 skipped).    ..  *********
  48    2018-01-06 13:19    28  *********
  49    2018-01-06 13:20    29  **********
  50    2018-01-06 13:21    29  **********
  51    2018-01-06 13:22    29  **********
  52    2018-01-06 13:23    30  ***********
  53    2018-01-06 13:24    30  ***********
  54    2018-01-06 13:25    31  ************
 ...    ..(  4 skipped).    ..  ************
  59    2018-01-06 13:30    31  ************
  60    2018-01-06 13:31    32  *************
 ...    ..(  2 skipped).    ..  *************
  63    2018-01-06 13:34    32  *************
  64    2018-01-06 13:35    33  **************
 ...    ..(  2 skipped).    ..  **************
  67    2018-01-06 13:38    33  **************
  68    2018-01-06 13:39    34  ***************
 ...    ..(  2 skipped).    ..  ***************
  71    2018-01-06 13:42    34  ***************
  72    2018-01-06 13:43    35  ****************
 ...    ..(  3 skipped).    ..  ****************
  76    2018-01-06 13:47    35  ****************
  77    2018-01-06 13:48    36  *****************
 ...    ..( 10 skipped).    ..  *****************
  88    2018-01-06 13:59    36  *****************
  89    2018-01-06 14:00    37  ******************
 ...    ..(  5 skipped).    ..  ******************
  95    2018-01-06 14:06    37  ******************
  96    2018-01-06 14:07    38  *******************
 ...    ..(  7 skipped).    ..  *******************
 104    2018-01-06 14:15    38  *******************
 105    2018-01-06 14:16    39  ********************
 ...    ..(  9 skipped).    ..  ********************
 115    2018-01-06 14:26    39  ********************
 116    2018-01-06 14:27    40  *********************
 ...    ..( 13 skipped).    ..  *********************
 130    2018-01-06 14:41    40  *********************
 131    2018-01-06 14:42    41  **********************
 ...    ..( 80 skipped).    ..  **********************
 212    2018-01-06 16:03    41  **********************
 213    2018-01-06 16:04    42  ***********************
 ...    ..(260 skipped).    ..  ***********************
 474    2018-01-06 20:25    42  ***********************

SCT Error Recovery Control command not supported

Device Statistics (GP/SMART Log 0x04) not supported

SATA Phy Event Counters (GP Log 0x11)
ID      Size     Value  Description
0x0001  2            0  Command failed due to ICRC error
0x0002  2            0  R_ERR response for data FIS
0x0003  2            0  R_ERR response for device-to-host data FIS
0x0004  2            0  R_ERR response for host-to-device data FIS
0x0005  2            0  R_ERR response for non-data FIS
0x0006  2            0  R_ERR response for device-to-host non-data FIS
0x0007  2            0  R_ERR response for host-to-device non-data FIS
0x0008  2            0  Device-to-host non-data FIS retries
0x0009  2            3  Transition from drive PhyRdy to drive PhyNRdy
0x000a  2            3  Device-to-host register FISes sent due to a COMRESET
0x000b  2            0  CRC errors within host-to-device FIS
0x000f  2            0  R_ERR response for host-to-device data FIS, CRC
0x0012  2            0  R_ERR response for host-to-device non-data FIS, CRC
0x8000  4        27042  Vendor specific

