smartctl 6.5 2016-05-07 r4318 [x86_64-linux-4.13.4-300.fc27.x86_64] (local build)
Copyright (C) 2002-16, Bruce Allen, Christian Franke, www.smartmontools.org

=== START OF INFORMATION SECTION ===
Device Model:     HGST HDN726040ALE614
Firmware Version: APGNW7JH
User Capacity:    4,000,787,030,016 bytes [4,00 TB]
Sector Sizes:     512 bytes logical, 4096 bytes physical
Rotation Rate:    7200 rpm
Form Factor:      3.5 inches
Device is:        Not in smartctl database [for details use: -P showall]
ATA Version is:   ACS-2, ATA8-ACS T13/1699-D revision 4
SATA Version is:  SATA 3.1, 6.0 Gb/s (current: 3.0 Gb/s)
Local Time is:    Thu Oct  5 17:51:33 2017 CEST
SMART support is: Available - device has SMART capability.
SMART support is: Enabled
AAM feature is:   Unavailable
APM feature is:   Disabled
Rd look-ahead is: Enabled
Write cache is:   Enabled
ATA Security is:  Disabled, frozen [SEC2]
Wt Cache Reorder: Enabled

=== START OF READ SMART DATA SECTION ===
SMART overall-health self-assessment test result: PASSED

General SMART Values:
Offline data collection status:  (0x80)	Offline data collection activity
					was never started.
					Auto Offline Data Collection: Enabled.
Self-test execution status:      (   0)	The previous self-test routine completed
					without error or no self-test has ever 
					been run.
Total time to complete Offline 
data collection: 		(  113) seconds.
Offline data collection
capabilities: 			 (0x5b) SMART execute Offline immediate.
					Auto Offline data collection on/off support.
					Suspend Offline collection upon new
					command.
					Offline surface scan supported.
					Self-test supported.
					No Conveyance Self-test supported.
					Selective Self-test supported.
SMART capabilities:            (0x0003)	Saves SMART data before entering
					power-saving mode.
					Supports SMART auto save timer.
Error logging capability:        (0x01)	Error logging supported.
					General Purpose Logging supported.
Short self-test routine 
recommended polling time: 	 (   2) minutes.
Extended self-test routine
recommended polling time: 	 ( 571) minutes.
SCT capabilities: 	       (0x003d)	SCT Status supported.
					SCT Error Recovery Control supported.
					SCT Feature Control supported.
					SCT Data Table supported.

SMART Attributes Data Structure revision number: 16
Vendor Specific SMART Attributes with Thresholds:
ID# ATTRIBUTE_NAME          FLAGS    VALUE WORST THRESH FAIL RAW_VALUE
  1 Raw_Read_Error_Rate     PO-R--   100   100   016    -    0
  2 Throughput_Performance  P-S---   135   135   054    -    112
  3 Spin_Up_Time            POS---   136   136   024    -    391 (Average 394)
  4 Start_Stop_Count        -O--C-   100   100   000    -    12
  5 Reallocated_Sector_Ct   PO--CK   100   100   005    -    0
  7 Seek_Error_Rate         PO-R--   100   100   067    -    0
  8 Seek_Time_Performance   P-S---   128   128   020    -    18
  9 Power_On_Hours          -O--C-   100   100   000    -    568
 10 Spin_Retry_Count        PO--C-   100   100   060    -    0
 12 Power_Cycle_Count       -O--CK   100   100   000    -    12
192 Power-Off_Retract_Count -O--CK   100   100   000    -    66
193 Load_Cycle_Count        -O--C-   100   100   000    -    66
194 Temperature_Celsius     -O----   136   136   000    -    44 (Min/Max 25/57)
196 Reallocated_Event_Count -O--CK   100   100   000    -    0
197 Current_Pending_Sector  -O---K   100   100   000    -    0
198 Offline_Uncorrectable   ---R--   100   100   000    -    0
199 UDMA_CRC_Error_Count    -O-R--   200   200   000    -    0
                            ||||||_ K auto-keep
                            |||||__ C event count
                            ||||___ R error rate
                            |||____ S speed/performance
                            ||_____ O updated online
                            |______ P prefailure warning

General Purpose Log Directory Version 1
SMART           Log Directory Version 1 [multi-sector log support]
Address    Access  R/W   Size  Description
0x00       GPL,SL  R/O      1  Log Directory
0x01           SL  R/O      1  Summary SMART error log
0x02           SL  R/O      1  Comprehensive SMART error log
0x03       GPL     R/O      1  Ext. Comprehensive SMART error log
0x04       GPL,SL  R/O      8  Device Statistics log
0x06           SL  R/O      1  SMART self-test log
0x07       GPL     R/O      1  Extended self-test log
0x08       GPL     R/O      2  Power Conditions log
0x09           SL  R/W      1  Selective self-test log
0x10       GPL     R/O      1  SATA NCQ Queued Error log
0x11       GPL     R/O      1  SATA Phy Event Counters log
0x12       GPL     R/O      1  SATA NCQ NON-DATA log
0x15       GPL,SL  R/W      1  SATA Rebuild Assist log
0x21       GPL     R/O      1  Write stream error log
0x22       GPL     R/O      1  Read stream error log
0x24       GPL     R/O    256  Current Device Internal Status Data log
0x25       GPL     R/O    256  Saved Device Internal Status Data log
0x30       GPL,SL  R/O      9  IDENTIFY DEVICE data log
0x80-0x9f  GPL,SL  R/W     16  Host vendor specific log
0xe0       GPL,SL  R/W      1  SCT Command/Status
0xe1       GPL,SL  R/W      1  SCT Data Transfer

SMART Extended Comprehensive Error Log Version: 1 (1 sectors)
No Errors Logged

SMART Extended Self-test Log Version: 1 (1 sectors)
Num  Test_Description    Status                  Remaining  LifeTime(hours)  LBA_of_first_error
# 1  Short offline       Completed without error       00%       568         -

SMART Selective self-test log data structure revision number 1
 SPAN  MIN_LBA  MAX_LBA  CURRENT_TEST_STATUS
    1        0        0  Not_testing
    2        0        0  Not_testing
    3        0        0  Not_testing
    4        0        0  Not_testing
    5        0        0  Not_testing
Selective self-test flags (0x0):
  After scanning selected spans, do NOT read-scan remainder of disk.
If Selective self-test is pending on power-up, resume after 0 minute delay.

SCT Status Version:                  3
SCT Version (vendor specific):       256 (0x0100)
SCT Support Level:                   1
Device State:                        Active (0)
Current Temperature:                    44 Celsius
Power Cycle Min/Max Temperature:     41/45 Celsius
Lifetime    Min/Max Temperature:     25/57 Celsius
Under/Over Temperature Limit Count:   0/0

SCT Temperature History Version:     2
Temperature Sampling Period:         1 minute
Temperature Logging Interval:        1 minute
Min/Max recommended Temperature:      0/60 Celsius
Min/Max Temperature Limit:           -40/70 Celsius
Temperature History Size (Index):    128 (23)

Index    Estimated Time   Temperature Celsius
  24    2017-10-05 15:44    45  **************************
  25    2017-10-05 15:45    45  **************************
  26    2017-10-05 15:46    45  **************************
  27    2017-10-05 15:47    44  *************************
  28    2017-10-05 15:48    44  *************************
  29    2017-10-05 15:49    44  *************************
  30    2017-10-05 15:50    43  ************************
  31    2017-10-05 15:51    44  *************************
 ...    ..( 12 skipped).    ..  *************************
  44    2017-10-05 16:04    44  *************************
  45    2017-10-05 16:05    43  ************************
  46    2017-10-05 16:06    43  ************************
  47    2017-10-05 16:07    44  *************************
 ...    ..( 12 skipped).    ..  *************************
  60    2017-10-05 16:20    44  *************************
  61    2017-10-05 16:21    43  ************************
  62    2017-10-05 16:22    43  ************************
  63    2017-10-05 16:23    44  *************************
 ...    ..( 13 skipped).    ..  *************************
  77    2017-10-05 16:37    44  *************************
  78    2017-10-05 16:38    41  **********************
  79    2017-10-05 16:39    42  ***********************
 ...    ..(  5 skipped).    ..  ***********************
  85    2017-10-05 16:45    42  ***********************
  86    2017-10-05 16:46    43  ************************
 ...    ..(  5 skipped).    ..  ************************
  92    2017-10-05 16:52    43  ************************
  93    2017-10-05 16:53    44  *************************
 ...    ..(  3 skipped).    ..  *************************
  97    2017-10-05 16:57    44  *************************
  98    2017-10-05 16:58    43  ************************
 ...    ..(  4 skipped).    ..  ************************
 103    2017-10-05 17:03    43  ************************
 104    2017-10-05 17:04    44  *************************
 ...    ..( 10 skipped).    ..  *************************
 115    2017-10-05 17:15    44  *************************
 116    2017-10-05 17:16    43  ************************
 ...    ..(  4 skipped).    ..  ************************
 121    2017-10-05 17:21    43  ************************
 122    2017-10-05 17:22    44  *************************
 ...    ..( 10 skipped).    ..  *************************
   5    2017-10-05 17:33    44  *************************
   6    2017-10-05 17:34    43  ************************
 ...    ..(  2 skipped).    ..  ************************
   9    2017-10-05 17:37    43  ************************
  10    2017-10-05 17:38    44  *************************
 ...    ..(  3 skipped).    ..  *************************
  14    2017-10-05 17:42    44  *************************
  15    2017-10-05 17:43    45  **************************
  16    2017-10-05 17:44    45  **************************
  17    2017-10-05 17:45    45  **************************
  18    2017-10-05 17:46    44  *************************
  19    2017-10-05 17:47    45  **************************
  20    2017-10-05 17:48    45  **************************
  21    2017-10-05 17:49    44  *************************
  22    2017-10-05 17:50    44  *************************
  23    2017-10-05 17:51    45  **************************

SCT Error Recovery Control:
           Read: Disabled
          Write: Disabled

Device Statistics (GP Log 0x04)
Page  Offset Size        Value Flags Description
0x01  =====  =               =  ===  == General Statistics (rev 2) ==
0x01  0x008  4              12  ---  Lifetime Power-On Resets
0x01  0x018  6     13044125096  ---  Logical Sectors Written
0x01  0x020  6        12063093  ---  Number of Write Commands
0x01  0x028  6      5770537299  ---  Logical Sectors Read
0x01  0x030  6        29607420  ---  Number of Read Commands
0x01  0x038  6      2045085200  ---  Date and Time TimeStamp
0x03  =====  =               =  ===  == Rotating Media Statistics (rev 1) ==
0x03  0x008  4             557  ---  Spindle Motor Power-on Hours
0x03  0x010  4             557  ---  Head Flying Hours
0x03  0x018  4              66  ---  Head Load Events
0x03  0x020  4               0  ---  Number of Reallocated Logical Sectors
0x03  0x028  4          187362  ---  Read Recovery Attempts
0x03  0x030  4               0  ---  Number of Mechanical Start Failures
0x04  =====  =               =  ===  == General Errors Statistics (rev 1) ==
0x04  0x008  4               0  ---  Number of Reported Uncorrectable Errors
0x04  0x010  4               0  ---  Resets Between Cmd Acceptance and Completion
0x05  =====  =               =  ===  == Temperature Statistics (rev 1) ==
0x05  0x008  1              44  ---  Current Temperature
0x05  0x010  1              42  N--  Average Short Term Temperature
0x05  0x018  1              40  N--  Average Long Term Temperature
0x05  0x020  1              57  ---  Highest Temperature
0x05  0x028  1              25  ---  Lowest Temperature
0x05  0x030  1              53  N--  Highest Average Short Term Temperature
0x05  0x038  1              25  N--  Lowest Average Short Term Temperature
0x05  0x040  1              52  N--  Highest Average Long Term Temperature
0x05  0x048  1              25  N--  Lowest Average Long Term Temperature
0x05  0x050  4               0  ---  Time in Over-Temperature
0x05  0x058  1              60  ---  Specified Maximum Operating Temperature
0x05  0x060  4               0  ---  Time in Under-Temperature
0x05  0x068  1               0  ---  Specified Minimum Operating Temperature
0x06  =====  =               =  ===  == Transport Statistics (rev 1) ==
0x06  0x008  4               1  ---  Number of Hardware Resets
0x06  0x010  4              56  ---  Number of ASR Events
0x06  0x018  4               0  ---  Number of Interface CRC Errors
                                |||_ C monitored condition met
                                ||__ D supports DSN
                                |___ N normalized value

SATA Phy Event Counters (GP Log 0x11)
ID      Size     Value  Description
0x0001  2            0  Command failed due to ICRC error
0x0002  2            0  R_ERR response for data FIS
0x0003  2            0  R_ERR response for device-to-host data FIS
0x0004  2            0  R_ERR response for host-to-device data FIS
0x0005  2            0  R_ERR response for non-data FIS
0x0006  2            0  R_ERR response for device-to-host non-data FIS
0x0007  2            0  R_ERR response for host-to-device non-data FIS
0x0008  2            0  Device-to-host non-data FIS retries
0x0009  2            1  Transition from drive PhyRdy to drive PhyNRdy
0x000a  2            2  Device-to-host register FISes sent due to a COMRESET
0x000b  2            0  CRC errors within host-to-device FIS
0x000d  2            0  Non-CRC errors within host-to-device FIS

