smartctl 6.5 2016-05-07 r4318 [x86_64-linux-3.10.0-693.5.2.el7.x86_64] (local build)
Copyright (C) 2002-16, Bruce Allen, Christian Franke, www.smartmontools.org

=== START OF INFORMATION SECTION ===
Device Model:     ST6000VN0001-1SF17Z
Firmware Version: AN02
User Capacity:    6,001,175,126,016 bytes [6.00 TB]
Sector Sizes:     512 bytes logical, 4096 bytes physical
Rotation Rate:    7200 rpm
Form Factor:      3.5 inches
Device is:        Not in smartctl database [for details use: -P showall]
ATA Version is:   ACS-3 T13/2161-D revision 3b
SATA Version is:  SATA 3.1, 6.0 Gb/s (current: 3.0 Gb/s)
Local Time is:    Thu Feb  1 11:21:39 2018 CET
SMART support is: Available - device has SMART capability.
SMART support is: Enabled
AAM feature is:   Unavailable
APM feature is:   Unavailable
Rd look-ahead is: Enabled
Write cache is:   Enabled
ATA Security is:  Disabled, frozen [SEC2]
Wt Cache Reorder: Enabled

=== START OF READ SMART DATA SECTION ===
SMART overall-health self-assessment test result: PASSED

General SMART Values:
Offline data collection status:  (0x82) Offline data collection activity
                                        was completed without error.
                                        Auto Offline Data Collection: Enabled.
Self-test execution status:      (   0) The previous self-test routine completed
                                        without error or no self-test has ever 
                                        been run.
Total time to complete Offline 
data collection:                (  584) seconds.
Offline data collection
capabilities:                    (0x7b) SMART execute Offline immediate.
                                        Auto Offline data collection on/off support.
                                        Suspend Offline collection upon new
                                        command.
                                        Offline surface scan supported.
                                        Self-test supported.
                                        Conveyance Self-test supported.
                                        Selective Self-test supported.
SMART capabilities:            (0x0003) Saves SMART data before entering
                                        power-saving mode.
                                        Supports SMART auto save timer.
Error logging capability:        (0x01) Error logging supported.
                                        General Purpose Logging supported.
Short self-test routine 
recommended polling time:        (   1) minutes.
Extended self-test routine
recommended polling time:        ( 637) minutes.
Conveyance self-test routine
recommended polling time:        (   2) minutes.
SCT capabilities:              (0x10bd) SCT Status supported.
                                        SCT Error Recovery Control supported.
                                        SCT Feature Control supported.
                                        SCT Data Table supported.

SMART Attributes Data Structure revision number: 10
Vendor Specific SMART Attributes with Thresholds:
ID# ATTRIBUTE_NAME          FLAGS    VALUE WORST THRESH FAIL RAW_VALUE
  1 Raw_Read_Error_Rate     POSR--   075   063   006    -    41924504
  3 Spin_Up_Time            PO----   091   091   000    -    0
  4 Start_Stop_Count        -O--CK   100   100   020    -    6
  5 Reallocated_Sector_Ct   PO--CK   100   100   010    -    0
  7 Seek_Error_Rate         POSR--   092   060   030    -    1741455616
  9 Power_On_Hours          -O--CK   087   087   000    -    12227
 10 Spin_Retry_Count        PO--C-   100   100   097    -    0
 12 Power_Cycle_Count       -O--CK   100   100   020    -    6
183 Runtime_Bad_Block       -O--CK   100   100   000    -    0
184 End-to-End_Error        -O--CK   100   100   099    -    0
187 Reported_Uncorrect      -O--CK   100   100   000    -    0
188 Command_Timeout         -O--CK   100   100   000    -    0
189 High_Fly_Writes         -O-RCK   100   100   000    -    0
190 Airflow_Temperature_Cel -O---K   067   064   040    -    33 (Min/Max 21/36)
191 G-Sense_Error_Rate      -O--CK   100   100   000    -    0
192 Power-Off_Retract_Count -O--CK   100   100   000    -    3
193 Load_Cycle_Count        -O--CK   080   080   000    -    41961
194 Temperature_Celsius     -O---K   033   040   000    -    33 (0 20 0 0 0)
195 Hardware_ECC_Recovered  -O-RC-   027   009   000    -    41924504
197 Current_Pending_Sector  -O--C-   100   100   000    -    0
198 Offline_Uncorrectable   ----C-   100   100   000    -    0
199 UDMA_CRC_Error_Count    -OSRCK   200   200   000    -    0
240 Head_Flying_Hours       ------   100   253   000    -    8935 (110 41 0)
241 Total_LBAs_Written      ------   100   253   000    -    129118361663
242 Total_LBAs_Read         ------   100   253   000    -    529677896058
                            ||||||_ K auto-keep
                            |||||__ C event count
                            ||||___ R error rate
                            |||____ S speed/performance
                            ||_____ O updated online
                            |______ P prefailure warning

General Purpose Log Directory Version 1
SMART           Log Directory Version 1 [multi-sector log support]
Address    Access  R/W   Size  Description
0x00       GPL,SL  R/O      1  Log Directory
0x01           SL  R/O      1  Summary SMART error log
0x02           SL  R/O      5  Comprehensive SMART error log
0x03       GPL     R/O      5  Ext. Comprehensive SMART error log
0x06           SL  R/O      1  SMART self-test log
0x07       GPL     R/O      1  Extended self-test log
0x08       GPL,SL  R/O      2  Power Conditions log
0x09           SL  R/W      1  Selective self-test log
0x10       GPL     R/O      1  SATA NCQ Queued Error log
0x11       GPL     R/O      1  SATA Phy Event Counters log
0x15       GPL     R/W      1  SATA Rebuild Assist log
0x21       GPL     R/O      1  Write stream error log
0x22       GPL     R/O      1  Read stream error log
0x24       GPL     R/O    512  Current Device Internal Status Data log
0x30       GPL,SL  R/O      9  IDENTIFY DEVICE data log
0x80-0x9f  GPL,SL  R/W     16  Host vendor specific log
0xa1       GPL,SL  VS      20  Device vendor specific log
0xa2       GPL     VS    8160  Device vendor specific log
0xa8-0xa9  GPL,SL  VS     136  Device vendor specific log
0xab       GPL     VS       1  Device vendor specific log
0xb0       GPL     VS    8982  Device vendor specific log
0xbe-0xbf  GPL     VS   65535  Device vendor specific log
0xc0       GPL,SL  VS       1  Device vendor specific log
0xc1       GPL,SL  VS      10  Device vendor specific log
0xd1       GPL     VS      78  Device vendor specific log
0xd2       GPL     VS   10000  Device vendor specific log
0xd3       GPL     VS    1918  Device vendor specific log
0xe0       GPL,SL  R/W      1  SCT Command/Status
0xe1       GPL,SL  R/W      1  SCT Data Transfer

SMART Extended Comprehensive Error Log Version: 1 (5 sectors)
No Errors Logged

SMART Extended Self-test Log Version: 1 (1 sectors)
Num  Test_Description    Status                  Remaining  LifeTime(hours)  LBA_of_first_error
# 1  Short offline       Completed without error       00%     12226         -
# 2  Short offline       Completed without error       00%     12078         -

SMART Selective self-test log data structure revision number 1
 SPAN  MIN_LBA  MAX_LBA  CURRENT_TEST_STATUS
    1        0        0  Not_testing
    2        0        0  Not_testing
    3        0        0  Not_testing
    4        0        0  Not_testing
    5        0        0  Not_testing
Selective self-test flags (0x0):
  After scanning selected spans, do NOT read-scan remainder of disk.
If Selective self-test is pending on power-up, resume after 0 minute delay.

SCT Status Version:                  3
SCT Version (vendor specific):       522 (0x020a)
SCT Support Level:                   1
Device State:                        Active (0)
Current Temperature:                    33 Celsius
Power Cycle Min/Max Temperature:     21/36 Celsius
Lifetime    Min/Max Temperature:     20/36 Celsius
Under/Over Temperature Limit Count:   0/0

SCT Temperature History Version:     2
Temperature Sampling Period:         3 minutes
Temperature Logging Interval:        59 minutes
Min/Max recommended Temperature:     14/55 Celsius
Min/Max Temperature Limit:           10/60 Celsius
Temperature History Size (Index):    128 (24)

Index    Estimated Time   Temperature Celsius
  25    2018-01-27 05:41    27  ********
 ...    ..( 22 skipped).    ..  ********
  48    2018-01-28 04:18    27  ********
  49    2018-01-28 05:17    26  *******
  50    2018-01-28 06:16    27  ********
 ...    ..( 15 skipped).    ..  ********
  66    2018-01-28 22:00    27  ********
  67    2018-01-28 22:59    26  *******
 ...    ..(  7 skipped).    ..  *******
  75    2018-01-29 06:51    26  *******
  76    2018-01-29 07:50    27  ********
 ...    ..( 25 skipped).    ..  ********
 102    2018-01-30 09:24    27  ********
 103    2018-01-30 10:23     ?  -
 104    2018-01-30 11:22    21  **
 105    2018-01-30 12:21    36  *****************
 ...    ..(  2 skipped).    ..  *****************
 108    2018-01-30 15:18    36  *****************
 109    2018-01-30 16:17    35  ****************
 110    2018-01-30 17:16    35  ****************
 111    2018-01-30 18:15    36  *****************
 112    2018-01-30 19:14    36  *****************
 113    2018-01-30 20:13    36  *****************
 114    2018-01-30 21:12    35  ****************
 ...    ..(  4 skipped).    ..  ****************
 119    2018-01-31 02:07    35  ****************
 120    2018-01-31 03:06    34  ***************
 121    2018-01-31 04:05    34  ***************
 122    2018-01-31 05:04    35  ****************
 123    2018-01-31 06:03    35  ****************
 124    2018-01-31 07:02    34  ***************
 125    2018-01-31 08:01    34  ***************
 126    2018-01-31 09:00    33  **************
 ...    ..(  9 skipped).    ..  **************
   8    2018-01-31 18:50    33  **************
   9    2018-01-31 19:49    34  ***************
  10    2018-01-31 20:48    33  **************
  11    2018-01-31 21:47    33  **************
  12    2018-01-31 22:46    34  ***************
  13    2018-01-31 23:45    35  ****************
  14    2018-02-01 00:44    33  **************
 ...    ..(  2 skipped).    ..  **************
  17    2018-02-01 03:41    33  **************
  18    2018-02-01 04:40    35  ****************
  19    2018-02-01 05:39    35  ****************
  20    2018-02-01 06:38    34  ***************
  21    2018-02-01 07:37    34  ***************
  22    2018-02-01 08:36    34  ***************
  23    2018-02-01 09:35    32  *************
  24    2018-02-01 10:34    32  *************

SCT Error Recovery Control:
           Read:     70 (7.0 seconds)
          Write:     70 (7.0 seconds)

Device Statistics (GP/SMART Log 0x04) not supported

SATA Phy Event Counters (GP Log 0x11)
ID      Size     Value  Description
0x000a  2            2  Device-to-host register FISes sent due to a COMRESET
0x0001  2            0  Command failed due to ICRC error
0x0003  2            0  R_ERR response for device-to-host data FIS
0x0004  2            0  R_ERR response for host-to-device data FIS
0x0006  2            0  R_ERR response for device-to-host non-data FIS
0x0007  2            0  R_ERR response for host-to-device non-data FIS

