smartctl 7.0 2019-06-19 r4923 [x86_64-linux-3.10.0-957.12.2.el7.x86_64] (local build)
Copyright (C) 2002-18, Bruce Allen, Christian Franke, www.smartmontools.org

=== START OF INFORMATION SECTION ===
Device Model:     THNSF8800CCSE
Add. Product Id:  DELL(tm)
Firmware Version: DAC9
User Capacity:    800,166,076,416 bytes [800 GB]
Sector Size:      512 bytes logical/physical
Rotation Rate:    Solid State Device
Form Factor:      2.5 inches
Device is:        Not in smartctl database [for details use: -P showall]
ATA Version is:   ACS-3 (minor revision not indicated)
SATA Version is:  SATA 3.2, 6.0 Gb/s (current: 6.0 Gb/s)
Local Time is:    Thu Jul 18 11:56:05 2019 PDT
SMART support is: Available - device has SMART capability.
SMART support is: Enabled
AAM feature is:   Unavailable
APM level is:     254 (maximum performance)
Rd look-ahead is: Enabled
Write cache is:   Disabled
DSN feature is:   Unavailable
ATA Security is:  Unavailable
Wt Cache Reorder: Enabled

=== START OF READ SMART DATA SECTION ===
SMART overall-health self-assessment test result: PASSED

General SMART Values:
Offline data collection status:  (0x00)	Offline data collection activity
					was never started.
					Auto Offline Data Collection: Disabled.
Self-test execution status:      (   0)	The previous self-test routine completed
					without error or no self-test has ever 
					been run.
Total time to complete Offline 
data collection: 		(   30) seconds.
Offline data collection
capabilities: 			 (0x5b) SMART execute Offline immediate.
					Auto Offline data collection on/off support.
					Suspend Offline collection upon new
					command.
					Offline surface scan supported.
					Self-test supported.
					No Conveyance Self-test supported.
					Selective Self-test supported.
SMART capabilities:            (0x0003)	Saves SMART data before entering
					power-saving mode.
					Supports SMART auto save timer.
Error logging capability:        (0x01)	Error logging supported.
					General Purpose Logging supported.
Short self-test routine 
recommended polling time: 	 (   1) minutes.
Extended self-test routine
recommended polling time: 	 (   5) minutes.
SCT capabilities: 	       (0x003d)	SCT Status supported.
					SCT Error Recovery Control supported.
					SCT Feature Control supported.
					SCT Data Table supported.

SMART Attributes Data Structure revision number: 16
Vendor Specific SMART Attributes with Thresholds:
ID# ATTRIBUTE_NAME          FLAGS    VALUE WORST THRESH FAIL RAW_VALUE
  1 Raw_Read_Error_Rate     -O-R--   100   100   000    -    0
  5 Reallocated_Sector_Ct   PO--C-   100   100   010    -    0
  9 Power_On_Hours          -O--C-   100   100   000    -    6484
 12 Power_Cycle_Count       -O--CK   100   100   000    -    20
 13 Read_Soft_Error_Rate    -O-R--   100   100   000    -    0
179 Used_Rsvd_Blk_Cnt_Tot   PO--C-   100   100   010    -    0
180 Unused_Rsvd_Blk_Cnt_Tot -O--C-   100   100   000    -    100
181 Program_Fail_Cnt_Total  -O--CK   100   100   000    -    0
182 Erase_Fail_Count_Total  -O--CK   100   100   000    -    0
194 Temperature_Celsius     -O---K   077   064   000    -    23 (Min/Max 19/36)
195 Hardware_ECC_Recovered  -O--CK   100   100   000    -    0
198 Offline_Uncorrectable   ----CK   100   100   000    -    0
199 UDMA_CRC_Error_Count    -O-R--   100   100   000    -    0
201 Unknown_SSD_Attribute   PO---K   100   100   004    -    0
202 Unknown_SSD_Attribute   PO----   100   100   099    -    0
233 Media_Wearout_Indicator -O--C-   100   100   000    -    7189318
245 Unknown_Attribute       -O--C-   098   098   000    -    98
                            ||||||_ K auto-keep
                            |||||__ C event count
                            ||||___ R error rate
                            |||____ S speed/performance
                            ||_____ O updated online
                            |______ P prefailure warning

General Purpose Log Directory Version 1
SMART           Log Directory Version 1 [multi-sector log support]
Address    Access  R/W   Size  Description
0x00       GPL,SL  R/O      1  Log Directory
0x01           SL  R/O      1  Summary SMART error log
0x02           SL  R/O     51  Comprehensive SMART error log
0x03       GPL     R/O     64  Ext. Comprehensive SMART error log
0x04       GPL,SL  R/O      8  Device Statistics log
0x06           SL  R/O      1  SMART self-test log
0x07       GPL     R/O      1  Extended self-test log
0x09           SL  R/W      1  Selective self-test log
0x10       GPL     R/O      1  NCQ Command Error log
0x11       GPL     R/O      1  SATA Phy Event Counters log
0x24       GPL     R/O   1536  Current Device Internal Status Data log
0x25       GPL     R/O  49216  Saved Device Internal Status Data log
0x30       GPL,SL  R/O      9  IDENTIFY DEVICE data log
0x80-0x9f  GPL,SL  R/W     16  Host vendor specific log
0xe0       GPL,SL  R/W      1  SCT Command/Status
0xe1       GPL,SL  R/W      1  SCT Data Transfer

SMART Extended Comprehensive Error Log Version: 1 (64 sectors)
No Errors Logged

SMART Extended Self-test Log Version: 1 (1 sectors)
Num  Test_Description    Status                  Remaining  LifeTime(hours)  LBA_of_first_error
# 1  Short offline       Completed without error       00%      6484         -
# 2  Short offline       Completed without error       00%      6484         -
# 3  Extended offline    Completed without error       00%         1         -
# 4  Short offline       Completed without error       00%         1         -

SMART Selective self-test log data structure revision number 1
 SPAN  MIN_LBA  MAX_LBA  CURRENT_TEST_STATUS
    1        0        0  Not_testing
    2        0        0  Not_testing
    3        0        0  Not_testing
    4        0        0  Not_testing
    5        0        0  Not_testing
Selective self-test flags (0x0):
  After scanning selected spans, do NOT read-scan remainder of disk.
If Selective self-test is pending on power-up, resume after 0 minute delay.

SCT Status Version:                  3
SCT Version (vendor specific):       3 (0x0003)
Device State:                        Active (0)
Current Temperature:                    23 Celsius
Power Cycle Min/Max Temperature:     19/40 Celsius
Lifetime    Min/Max Temperature:     19/36 Celsius
Under/Over Temperature Limit Count:   0/0
Vendor specific:
00 00 04 00 01 01 00 05 05 00 00 00 00 00 00 00
00 01 00 00 42 37 64 01 04 04 00 00 00 00 00 0b

SCT Temperature History Version:     2
Temperature Sampling Period:         1 minute
Temperature Logging Interval:        1 minute
Min/Max recommended Temperature:      5/55 Celsius
Min/Max Temperature Limit:            0/80 Celsius
Temperature History Size (Index):    128 (55)

Index    Estimated Time   Temperature Celsius
  56    2019-07-18 09:49    23  ****
 ...    ..(  3 skipped).    ..  ****
  60    2019-07-18 09:53    23  ****
  61    2019-07-18 09:54    24  *****
  62    2019-07-18 09:55    23  ****
 ...    ..( 22 skipped).    ..  ****
  85    2019-07-18 10:18    23  ****
  86    2019-07-18 10:19    24  *****
  87    2019-07-18 10:20    23  ****
 ...    ..(  7 skipped).    ..  ****
  95    2019-07-18 10:28    23  ****
  96    2019-07-18 10:29    24  *****
  97    2019-07-18 10:30    24  *****
  98    2019-07-18 10:31    24  *****
  99    2019-07-18 10:32    23  ****
 ...    ..( 17 skipped).    ..  ****
 117    2019-07-18 10:50    23  ****
 118    2019-07-18 10:51    24  *****
 119    2019-07-18 10:52    24  *****
 120    2019-07-18 10:53    23  ****
 ...    ..( 15 skipped).    ..  ****
   8    2019-07-18 11:09    23  ****
   9    2019-07-18 11:10    24  *****
  10    2019-07-18 11:11    25  ******
  11    2019-07-18 11:12    24  *****
  12    2019-07-18 11:13    23  ****
 ...    ..(  2 skipped).    ..  ****
  15    2019-07-18 11:16    23  ****
  16    2019-07-18 11:17    24  *****
  17    2019-07-18 11:18    25  ******
  18    2019-07-18 11:19    23  ****
 ...    ..( 22 skipped).    ..  ****
  41    2019-07-18 11:42    23  ****
  42    2019-07-18 11:43    22  ***
  43    2019-07-18 11:44    23  ****
 ...    ..( 11 skipped).    ..  ****
  55    2019-07-18 11:56    23  ****

SCT Error Recovery Control:
           Read:     80 (8.0 seconds)
          Write:     80 (8.0 seconds)

Device Statistics (GP Log 0x04)
Page  Offset Size        Value Flags Description
0x01  =====  =               =  ===  == General Statistics (rev 1) ==
0x01  0x008  4              20  ---  Lifetime Power-On Resets
0x01  0x010  4            6484  ---  Power-on Hours
0x01  0x018  6    471159169567  ---  Logical Sectors Written
0x01  0x020  6      1104940588  ---  Number of Write Commands
0x01  0x028  6    341901685167  ---  Logical Sectors Read
0x01  0x030  6      2800625950  ---  Number of Read Commands
0x04  =====  =               =  ===  == General Errors Statistics (rev 1) ==
0x04  0x008  4               0  ---  Number of Reported Uncorrectable Errors
0x04  0x010  4               0  ---  Resets Between Cmd Acceptance and Completion
0x05  =====  =               =  ===  == Temperature Statistics (rev 1) ==
0x05  0x008  1              23  ---  Current Temperature
0x05  0x010  1              24  ---  Average Short Term Temperature
0x05  0x018  1              24  ---  Average Long Term Temperature
0x05  0x020  1              29  ---  Highest Temperature
0x05  0x028  1              20  ---  Lowest Temperature
0x05  0x030  1              27  ---  Highest Average Short Term Temperature
0x05  0x038  1              21  ---  Lowest Average Short Term Temperature
0x05  0x040  1              24  ---  Highest Average Long Term Temperature
0x05  0x048  1              22  ---  Lowest Average Long Term Temperature
0x05  0x050  4               0  ---  Time in Over-Temperature
0x05  0x058  1              55  ---  Specified Maximum Operating Temperature
0x05  0x060  4               0  ---  Time in Under-Temperature
0x05  0x068  1               5  ---  Specified Minimum Operating Temperature
0x06  =====  =               =  ===  == Transport Statistics (rev 1) ==
0x06  0x008  4             105  ---  Number of Hardware Resets
0x06  0x018  4               0  ---  Number of Interface CRC Errors
0x07  =====  =               =  ===  == Solid State Device Statistics (rev 1) ==
0x07  0x008  1               2  N--  Percentage Used Endurance Indicator
                                |||_ C monitored condition met
                                ||__ D supports DSN
                                |___ N normalized value

Pending Defects log (GP Log 0x0c) not supported

SATA Phy Event Counters (GP Log 0x11)
ID      Size     Value  Description
0x0001  2            0  Command failed due to ICRC error
0x0002  4            0  R_ERR response for data FIS
0x0003  2            0  R_ERR response for device-to-host data FIS
0x0004  2            0  R_ERR response for host-to-device data FIS
0x0005  4            0  R_ERR response for non-data FIS
0x0006  2            0  R_ERR response for device-to-host non-data FIS
0x0007  2            0  R_ERR response for host-to-device non-data FIS
0x0008  2            0  Device-to-host non-data FIS retries
0x0009  4           34  Transition from drive PhyRdy to drive PhyNRdy
0x000a  4           35  Device-to-host register FISes sent due to a COMRESET
0x000b  4            0  CRC errors within host-to-device FIS
0x000d  4            0  Non-CRC errors within host-to-device FIS
0x000f  2            0  R_ERR response for host-to-device data FIS, CRC
0x0010  2            0  R_ERR response for host-to-device data FIS, non-CRC
0x0012  2            0  R_ERR response for host-to-device non-data FIS, CRC
0x0013  2            0  R_ERR response for host-to-device non-data FIS, non-CRC

