smartctl 6.5 2016-05-07 r4318 [x86_64-linux-3.10.0-514.26.1.el7.x86_64] (local build)
Copyright (C) 2002-16, Bruce Allen, Christian Franke, www.smartmontools.org

=== START OF INFORMATION SECTION ===
Device Model:     Micron_5100_MTFDDAK480TCC
Serial Number:    1633143E0C4B
LU WWN Device Id: 5 00a075 1143e0c4b
Firmware Version: D0MU021
User Capacity:    480,103,981,056 bytes [480 GB]
Sector Sizes:     512 bytes logical, 4096 bytes physical
Rotation Rate:    Solid State Device
Form Factor:      2.5 inches
Device is:        Not in smartctl database [for details use: -P showall]
ATA Version is:   ACS-3 T13/2161-D revision 5
SATA Version is:  SATA 3.2, 6.0 Gb/s (current: 6.0 Gb/s)
Local Time is:    Thu Aug  3 15:41:51 2017 MDT
SMART support is: Available - device has SMART capability.
SMART support is: Enabled
AAM feature is:   Unavailable
APM level is:     254 (maximum performance)
Rd look-ahead is: Enabled
Write cache is:   Enabled
ATA Security is:  Disabled, NOT FROZEN [SEC1]
Wt Cache Reorder: Enabled

=== START OF READ SMART DATA SECTION ===
SMART overall-health self-assessment test result: PASSED

General SMART Values:
Offline data collection status:  (0x00)	Offline data collection activity
					was never started.
					Auto Offline Data Collection: Disabled.
Self-test execution status:      (   0)	The previous self-test routine completed
					without error or no self-test has ever 
					been run.
Total time to complete Offline 
data collection: 		( 1137) seconds.
Offline data collection
capabilities: 			 (0x7b) SMART execute Offline immediate.
					Auto Offline data collection on/off support.
					Suspend Offline collection upon new
					command.
					Offline surface scan supported.
					Self-test supported.
					Conveyance Self-test supported.
					Selective Self-test supported.
SMART capabilities:            (0x0003)	Saves SMART data before entering
					power-saving mode.
					Supports SMART auto save timer.
Error logging capability:        (0x01)	Error logging supported.
					General Purpose Logging supported.
Short self-test routine 
recommended polling time: 	 (   2) minutes.
Extended self-test routine
recommended polling time: 	 (   6) minutes.
Conveyance self-test routine
recommended polling time: 	 (   3) minutes.
SCT capabilities: 	       (0x0035)	SCT Status supported.
					SCT Feature Control supported.
					SCT Data Table supported.

SMART Attributes Data Structure revision number: 16
Vendor Specific SMART Attributes with Thresholds:
ID# ATTRIBUTE_NAME          FLAGS    VALUE WORST THRESH FAIL RAW_VALUE
  1 Raw_Read_Error_Rate     POSR-K   100   100   050    -    0
  5 Reallocated_Sector_Ct   -O--CK   100   100   001    -    0
  9 Power_On_Hours          -O--CK   100   100   001    -    1001
 12 Power_Cycle_Count       -O--CK   100   100   001    -    6
170 Unknown_Attribute       PO--CK   100   100   010    -    0
171 Unknown_Attribute       -O--CK   100   100   000    -    0
172 Unknown_Attribute       -O--CK   100   100   001    -    0
173 Unknown_Attribute       -O--CK   093   093   000    -    561
174 Unknown_Attribute       -O--CK   100   100   000    -    2
183 Runtime_Bad_Block       -O--CK   100   100   000    -    0
184 End-to-End_Error        -O--CK   100   100   000    -    0
187 Reported_Uncorrect      -O--CK   100   100   000    -    0
188 Command_Timeout         -O--CK   100   100   000    -    1
194 Temperature_Celsius     -O---K   070   064   000    -    30 (Min/Max 22/36)
195 Hardware_ECC_Recovered  -O--CK   100   100   000    -    0
196 Reallocated_Event_Count -O--CK   100   100   000    -    0
197 Current_Pending_Sector  -O--CK   100   100   000    -    0
198 Offline_Uncorrectable   ----CK   100   100   000    -    0
199 UDMA_CRC_Error_Count    -O--CK   100   100   000    -    0
202 Unknown_SSD_Attribute   ----CK   093   093   001    -    7
206 Unknown_SSD_Attribute   -OSR--   100   100   000    -    0
246 Unknown_Attribute       -O--CK   100   100   000    -    848223987710
247 Unknown_Attribute       -O--CK   100   100   000    -    27093598188
248 Unknown_Attribute       -O--CK   100   100   000    -    4668680259
180 Unused_Rsvd_Blk_Cnt_Tot PO--CK   000   000   000    -    14601
210 Unknown_Attribute       -O--CK   100   100   000    -    0
                            ||||||_ K auto-keep
                            |||||__ C event count
                            ||||___ R error rate
                            |||____ S speed/performance
                            ||_____ O updated online
                            |______ P prefailure warning

General Purpose Log Directory Version 1
SMART           Log Directory Version 1 [multi-sector log support]
Address    Access  R/W   Size  Description
0x00       GPL,SL  R/O      1  Log Directory
0x01           SL  R/O      1  Summary SMART error log
0x02           SL  R/O     51  Comprehensive SMART error log
0x03       GPL     R/O  16383  Ext. Comprehensive SMART error log
0x04       GPL,SL  R/O      8  Device Statistics log
0x06           SL  R/O      1  SMART self-test log
0x07       GPL     R/O      1  Extended self-test log
0x09           SL  R/W      1  Selective self-test log
0x10       GPL     R/O      1  SATA NCQ Queued Error log
0x11       GPL     R/O      1  SATA Phy Event Counters log
0x13       GPL     R/O      1  SATA NCQ Send and Receive log
0x24       GPL     R/O   8000  Current Device Internal Status Data log
0x25       GPL     R/O   8000  Saved Device Internal Status Data log
0x30       GPL,SL  R/O      9  IDENTIFY DEVICE data log
0x80-0x9f  GPL,SL  R/W     16  Host vendor specific log
0xa0       GPL     VS   35328  Device vendor specific log
0xa1       GPL,SL  VS       3  Device vendor specific log
0xa3       GPL     VS   13824  Device vendor specific log
0xa4       GPL     VS     354  Device vendor specific log
0xa4       SL      VS      98  Device vendor specific log
0xa5       GPL     VS    8000  Device vendor specific log
0xa5       SL      VS      64  Device vendor specific log
0xa6       GPL     VS    8000  Device vendor specific log
0xa6       SL      VS      64  Device vendor specific log
0xe0       GPL,SL  R/W      1  SCT Command/Status
0xe1       GPL,SL  R/W      1  SCT Data Transfer

SMART Extended Comprehensive Error Log Version: 1 (16383 sectors)
No Errors Logged

SMART Extended Self-test Log Version: 1 (1 sectors)
Num  Test_Description    Status                  Remaining  LifeTime(hours)  LBA_of_first_error
# 1  Short offline       Completed without error       00%      1001         -
# 2  Vendor (0xff)       Completed without error       00%      1001         -
# 3  Vendor (0xff)       Completed without error       00%       883         -
# 4  Vendor (0xff)       Completed without error       00%       763         -
# 5  Vendor (0xff)       Completed without error       00%        46         -

SMART Selective self-test log data structure revision number 1
 SPAN  MIN_LBA  MAX_LBA  CURRENT_TEST_STATUS
    1        0        0  Not_testing
    2        0        0  Not_testing
    3        0        0  Completed [00% left] (107678848-107744383)
    4        0        0  Not_testing
    5        0        0  Not_testing
Selective self-test flags (0x0):
  After scanning selected spans, do NOT read-scan remainder of disk.
If Selective self-test is pending on power-up, resume after 0 minute delay.

SCT Status Version:                  3
SCT Version (vendor specific):       1 (0x0001)
SCT Support Level:                   0
Device State:                        Active (0)
Current Temperature:                    30 Celsius
Power Cycle Min/Max Temperature:     21/31 Celsius
Lifetime    Min/Max Temperature:     21/36 Celsius
Under/Over Temperature Limit Count:   0/0

SCT Temperature History Version:     2
Temperature Sampling Period:         1 minute
Temperature Logging Interval:        1 minute
Min/Max recommended Temperature:      0/70 Celsius
Min/Max Temperature Limit:           -5/75 Celsius
Temperature History Size (Index):    478 (435)

Index    Estimated Time   Temperature Celsius
 436    2017-08-03 07:44    25  ******
 ...    ..( 13 skipped).    ..  ******
 450    2017-08-03 07:58    25  ******
 451    2017-08-03 07:59    24  *****
 452    2017-08-03 08:00    24  *****
 453    2017-08-03 08:01    24  *****
 454    2017-08-03 08:02    25  ******
 ...    ..( 14 skipped).    ..  ******
 469    2017-08-03 08:17    25  ******
 470    2017-08-03 08:18    24  *****
 471    2017-08-03 08:19    25  ******
 472    2017-08-03 08:20     ?  -
 473    2017-08-03 08:21    26  *******
 474    2017-08-03 08:22     ?  -
 475    2017-08-03 08:23     ?  -
 476    2017-08-03 08:24     ?  -
 477    2017-08-03 08:25    31  ************
   0    2017-08-03 08:26    24  *****
   1    2017-08-03 08:27    24  *****
   2    2017-08-03 08:28    25  ******
   3    2017-08-03 08:29    24  *****
 ...    ..(  2 skipped).    ..  *****
   6    2017-08-03 08:32    24  *****
   7    2017-08-03 08:33    25  ******
 ...    ..(  8 skipped).    ..  ******
  16    2017-08-03 08:42    25  ******
  17    2017-08-03 08:43    24  *****
  18    2017-08-03 08:44    25  ******
  19    2017-08-03 08:45    24  *****
 ...    ..(  2 skipped).    ..  *****
  22    2017-08-03 08:48    24  *****
  23    2017-08-03 08:49    25  ******
 ...    ..(  4 skipped).    ..  ******
  28    2017-08-03 08:54    25  ******
  29    2017-08-03 08:55    26  *******
  30    2017-08-03 08:56    27  ********
  31    2017-08-03 08:57    27  ********
  32    2017-08-03 08:58    27  ********
  33    2017-08-03 08:59    28  *********
 ...    ..( 14 skipped).    ..  *********
  48    2017-08-03 09:14    28  *********
  49    2017-08-03 09:15    27  ********
  50    2017-08-03 09:16    26  *******
  51    2017-08-03 09:17    26  *******
  52    2017-08-03 09:18    26  *******
  53    2017-08-03 09:19    25  ******
 ...    ..( 16 skipped).    ..  ******
  70    2017-08-03 09:36    25  ******
  71    2017-08-03 09:37    24  *****
 ...    ..(  6 skipped).    ..  *****
  78    2017-08-03 09:44    24  *****
  79    2017-08-03 09:45    25  ******
  80    2017-08-03 09:46    25  ******
  81    2017-08-03 09:47    24  *****
 ...    ..( 11 skipped).    ..  *****
  93    2017-08-03 09:59    24  *****
  94    2017-08-03 10:00    25  ******
  95    2017-08-03 10:01    25  ******
  96    2017-08-03 10:02    24  *****
 ...    ..( 11 skipped).    ..  *****
 108    2017-08-03 10:14    24  *****
 109    2017-08-03 10:15    25  ******
 110    2017-08-03 10:16    24  *****
 ...    ..(  5 skipped).    ..  *****
 116    2017-08-03 10:22    24  *****
 117    2017-08-03 10:23    25  ******
 118    2017-08-03 10:24    24  *****
 119    2017-08-03 10:25    25  ******
 120    2017-08-03 10:26    25  ******
 121    2017-08-03 10:27    24  *****
 122    2017-08-03 10:28    24  *****
 123    2017-08-03 10:29    24  *****
 124    2017-08-03 10:30    25  ******
 125    2017-08-03 10:31    24  *****
 ...    ..( 12 skipped).    ..  *****
 138    2017-08-03 10:44    24  *****
 139    2017-08-03 10:45    25  ******
 140    2017-08-03 10:46    25  ******
 141    2017-08-03 10:47    25  ******
 142    2017-08-03 10:48    24  *****
 ...    ..(  2 skipped).    ..  *****
 145    2017-08-03 10:51    24  *****
 146    2017-08-03 10:52    25  ******
 147    2017-08-03 10:53    25  ******
 148    2017-08-03 10:54    25  ******
 149    2017-08-03 10:55    24  *****
 ...    ..(  3 skipped).    ..  *****
 153    2017-08-03 10:59    24  *****
 154    2017-08-03 11:00    25  ******
 155    2017-08-03 11:01    25  ******
 156    2017-08-03 11:02    24  *****
 ...    ..( 11 skipped).    ..  *****
 168    2017-08-03 11:14    24  *****
 169    2017-08-03 11:15    25  ******
 170    2017-08-03 11:16    25  ******
 171    2017-08-03 11:17    25  ******
 172    2017-08-03 11:18    24  *****
 ...    ..(  7 skipped).    ..  *****
 180    2017-08-03 11:26    24  *****
 181    2017-08-03 11:27    25  ******
 182    2017-08-03 11:28    24  *****
 183    2017-08-03 11:29    24  *****
 184    2017-08-03 11:30    25  ******
 185    2017-08-03 11:31    25  ******
 186    2017-08-03 11:32    24  *****
 ...    ..( 11 skipped).    ..  *****
 198    2017-08-03 11:44    24  *****
 199    2017-08-03 11:45    25  ******
 200    2017-08-03 11:46    25  ******
 201    2017-08-03 11:47    24  *****
 ...    ..( 11 skipped).    ..  *****
 213    2017-08-03 11:59    24  *****
 214    2017-08-03 12:00    25  ******
 215    2017-08-03 12:01    25  ******
 216    2017-08-03 12:02    24  *****
 ...    ..( 11 skipped).    ..  *****
 228    2017-08-03 12:14    24  *****
 229    2017-08-03 12:15    25  ******
 230    2017-08-03 12:16    25  ******
 231    2017-08-03 12:17    24  *****
 ...    ..( 11 skipped).    ..  *****
 243    2017-08-03 12:29    24  *****
 244    2017-08-03 12:30    25  ******
 ...    ..( 24 skipped).    ..  ******
 269    2017-08-03 12:55    25  ******
 270    2017-08-03 12:56    24  *****
 ...    ..(  2 skipped).    ..  *****
 273    2017-08-03 12:59    24  *****
 274    2017-08-03 13:00    25  ******
 ...    ..( 27 skipped).    ..  ******
 302    2017-08-03 13:28    25  ******
 303    2017-08-03 13:29    24  *****
 304    2017-08-03 13:30    25  ******
 ...    ..( 24 skipped).    ..  ******
 329    2017-08-03 13:55    25  ******
 330    2017-08-03 13:56    24  *****
 ...    ..(  2 skipped).    ..  *****
 333    2017-08-03 13:59    24  *****
 334    2017-08-03 14:00    25  ******
 ...    ..( 26 skipped).    ..  ******
 361    2017-08-03 14:27    25  ******
 362    2017-08-03 14:28    24  *****
 363    2017-08-03 14:29    24  *****
 364    2017-08-03 14:30    25  ******
 ...    ..( 25 skipped).    ..  ******
 390    2017-08-03 14:56    25  ******
 391    2017-08-03 14:57    24  *****
 392    2017-08-03 14:58    24  *****
 393    2017-08-03 14:59    24  *****
 394    2017-08-03 15:00    25  ******
 ...    ..( 40 skipped).    ..  ******
 435    2017-08-03 15:41    25  ******

SCT Error Recovery Control command not supported

Device Statistics (GP Log 0x04)
Page  Offset Size        Value Flags Description
0x01  =====  =               =  ===  == General Statistics (rev 1) ==
0x01  0x008  4               6  ---  Lifetime Power-On Resets
0x01  0x010  4            1001  ---  Power-on Hours
0x01  0x018  6    848223987710  ---  Logical Sectors Written
0x01  0x020  6     17367958770  ---  Number of Write Commands
0x01  0x028  6    440976649431  ---  Logical Sectors Read
0x01  0x030  6     22355827300  ---  Number of Read Commands
0x01  0x038  6      3606840000  ---  Date and Time TimeStamp
0x04  =====  =               =  ===  == General Errors Statistics (rev 1) ==
0x04  0x008  4               0  ---  Number of Reported Uncorrectable Errors
0x04  0x010  4               1  ---  Resets Between Cmd Acceptance and Completion
0x05  =====  =               =  ===  == Temperature Statistics (rev 1) ==
0x05  0x008  1              30  ---  Current Temperature
0x05  0x010  1              24  ---  Average Short Term Temperature
0x05  0x018  1               -  ---  Average Long Term Temperature
0x05  0x020  1              36  ---  Highest Temperature
0x05  0x028  1              22  ---  Lowest Temperature
0x05  0x030  1              31  ---  Highest Average Short Term Temperature
0x05  0x038  1              24  ---  Lowest Average Short Term Temperature
0x05  0x040  1               -  ---  Highest Average Long Term Temperature
0x05  0x048  1               -  ---  Lowest Average Long Term Temperature
0x05  0x050  4               0  ---  Time in Over-Temperature
0x05  0x058  1              70  ---  Specified Maximum Operating Temperature
0x05  0x060  4               0  ---  Time in Under-Temperature
0x05  0x068  1               0  ---  Specified Minimum Operating Temperature
0x06  =====  =               =  ===  == Transport Statistics (rev 1) ==
0x06  0x008  4               6  ---  Number of Hardware Resets
0x06  0x010  4               1  ---  Number of ASR Events
0x06  0x018  4               0  ---  Number of Interface CRC Errors
0x07  =====  =               =  ===  == Solid State Device Statistics (rev 1) ==
0x07  0x008  1               7  N--  Percentage Used Endurance Indicator
                                |||_ C monitored condition met
                                ||__ D supports DSN
                                |___ N normalized value

SATA Phy Event Counters (GP Log 0x11)
ID      Size     Value  Description
0x0001  4            0  Command failed due to ICRC error
0x0003  4            0  R_ERR response for device-to-host data FIS
0x0004  4            0  R_ERR response for host-to-device data FIS
0x0006  4            0  R_ERR response for device-to-host non-data FIS
0x000a  4            2  Device-to-host register FISes sent due to a COMRESET
0x000b  4            0  CRC errors within host-to-device FIS
0x000d  4            0  Non-CRC errors within host-to-device FIS

