smartctl 6.6 2016-05-31 r4324 [x86_64-linux-4.18.0-1-amd64] (local build)
Copyright (C) 2002-16, Bruce Allen, Christian Franke, www.smartmontools.org

=== START OF INFORMATION SECTION ===
Device Model:     ST2000DL004 HD204UI
Firmware Version: 1AQ10001
User Capacity:    2.000.398.934.016 bytes [2,00 TB]
Sector Size:      512 bytes logical/physical
Rotation Rate:    5400 rpm
Form Factor:      3.5 inches
Device is:        Not in smartctl database [for details use: -P showall]
ATA Version is:   ATA8-ACS T13/1699-D revision 6
SATA Version is:  SATA 2.6, 3.0 Gb/s
Local Time is:    Wed Sep 12 19:47:50 2018 CEST
SMART support is: Available - device has SMART capability.
SMART support is: Enabled
AAM feature is:   Disabled
APM level is:     254 (maximum performance)
Rd look-ahead is: Enabled
Write cache is:   Enabled
ATA Security is:  Disabled, NOT FROZEN [SEC1]
Wt Cache Reorder: Enabled

=== START OF READ SMART DATA SECTION ===
SMART overall-health self-assessment test result: PASSED

General SMART Values:
Offline data collection status:  (0x00)	Offline data collection activity
					was never started.
					Auto Offline Data Collection: Disabled.
Self-test execution status:      (   0)	The previous self-test routine completed
					without error or no self-test has ever 
					been run.
Total time to complete Offline 
data collection: 		(20580) seconds.
Offline data collection
capabilities: 			 (0x5b) SMART execute Offline immediate.
					Auto Offline data collection on/off support.
					Suspend Offline collection upon new
					command.
					Offline surface scan supported.
					Self-test supported.
					No Conveyance Self-test supported.
					Selective Self-test supported.
SMART capabilities:            (0x0003)	Saves SMART data before entering
					power-saving mode.
					Supports SMART auto save timer.
Error logging capability:        (0x01)	Error logging supported.
					General Purpose Logging supported.
Short self-test routine 
recommended polling time: 	 (   2) minutes.
Extended self-test routine
recommended polling time: 	 ( 343) minutes.
SCT capabilities: 	       (0x003f)	SCT Status supported.
					SCT Error Recovery Control supported.
					SCT Feature Control supported.
					SCT Data Table supported.

SMART Attributes Data Structure revision number: 16
Vendor Specific SMART Attributes with Thresholds:
ID# ATTRIBUTE_NAME          FLAGS    VALUE WORST THRESH FAIL RAW_VALUE
  1 Raw_Read_Error_Rate     POSR-K   100   100   051    -    1478
  2 Throughput_Performance  -OS--K   252   252   000    -    0
  3 Spin_Up_Time            PO---K   067   064   025    -    10134
  4 Start_Stop_Count        -O--CK   099   099   000    -    1976
  5 Reallocated_Sector_Ct   PO--CK   252   252   010    -    0
  7 Seek_Error_Rate         -OSR-K   252   252   051    -    0
  8 Seek_Time_Performance   --S--K   252   252   015    -    0
  9 Power_On_Hours          -O--CK   100   100   000    -    11682
 10 Spin_Retry_Count        -O--CK   252   252   051    -    0
 11 Calibration_Retry_Count -O--CK   252   252   000    -    0
 12 Power_Cycle_Count       -O--CK   099   099   000    -    1987
181 Program_Fail_Cnt_Total  -O---K   100   100   000    -    545380
191 G-Sense_Error_Rate      -O---K   100   100   000    -    39
192 Power-Off_Retract_Count -O---K   252   252   000    -    0
194 Temperature_Celsius     -O----   064   057   000    -    26 (Min/Max 8/45)
195 Hardware_ECC_Recovered  -O-RCK   100   100   000    -    0
196 Reallocated_Event_Count -O--CK   252   252   000    -    0
197 Current_Pending_Sector  -O--CK   100   100   000    -    5
198 Offline_Uncorrectable   ----CK   252   252   000    -    0
199 UDMA_CRC_Error_Count    -OS-CK   200   200   000    -    0
200 Multi_Zone_Error_Rate   -O-R-K   100   100   000    -    883
223 Load_Retry_Count        -O--CK   252   252   000    -    0
225 Load_Cycle_Count        -O--CK   100   100   000    -    1987
                            ||||||_ K auto-keep
                            |||||__ C event count
                            ||||___ R error rate
                            |||____ S speed/performance
                            ||_____ O updated online
                            |______ P prefailure warning

General Purpose Log Directory Version 1
SMART           Log Directory Version 1 [multi-sector log support]
Address    Access  R/W   Size  Description
0x00       GPL,SL  R/O      1  Log Directory
0x01           SL  R/O      1  Summary SMART error log
0x02           SL  R/O      2  Comprehensive SMART error log
0x03       GPL     R/O      2  Ext. Comprehensive SMART error log
0x06           SL  R/O      1  SMART self-test log
0x07       GPL     R/O      2  Extended self-test log
0x08       GPL     R/O      2  Power Conditions log
0x09           SL  R/W      1  Selective self-test log
0x10       GPL     R/O      1  SATA NCQ Queued Error log
0x11       GPL     R/O      1  SATA Phy Event Counters log
0x80-0x9f  GPL,SL  R/W     16  Host vendor specific log
0xe0       GPL,SL  R/W      1  SCT Command/Status
0xe1       GPL,SL  R/W      1  SCT Data Transfer

SMART Extended Comprehensive Error Log Version: 1 (2 sectors)
No Errors Logged

SMART Extended Self-test Log Version: 1 (2 sectors)
Num  Test_Description    Status                  Remaining  LifeTime(hours)  LBA_of_first_error
# 1  Short offline       Completed without error       00%     11682         -
# 2  Short offline       Completed: read failure       10%     11681         3906319048
# 3  Extended offline    Completed: read failure       90%     11678         147601232
# 4  Extended offline    Completed: read failure       80%     11678         147972768
# 5  Extended offline    Completed: read failure       90%     11673         147597416
# 6  Extended offline    Completed: read failure       90%     11672         147641968
# 7  Extended offline    Interrupted (host reset)      90%     11672         -
# 8  Extended offline    Completed: read failure       40%     11671         167262552
# 9  Short offline       Completed without error       00%     11665         -

SMART Selective self-test log data structure revision number 0
Note: revision number not 1 implies that no selective self-test has ever been run
 SPAN  MIN_LBA  MAX_LBA  CURRENT_TEST_STATUS
    1        0        0  Completed [00% left] (0-65535)
    2        0        0  Not_testing
    3        0        0  Not_testing
    4        0        0  Not_testing
    5        0        0  Not_testing
Selective self-test flags (0x0):
  After scanning selected spans, do NOT read-scan remainder of disk.
If Selective self-test is pending on power-up, resume after 0 minute delay.

SCT Status Version:                  2
SCT Version (vendor specific):       256 (0x0100)
SCT Support Level:                   1
Device State:                        Active (0)
Current Temperature:                    26 Celsius
Power Cycle Min/Max Temperature:     17/26 Celsius
Lifetime    Min/Max Temperature:      8/62 Celsius
Under/Over Temperature Limit Count:   0/0

SCT Temperature History Version:     2
Temperature Sampling Period:         5 minutes
Temperature Logging Interval:        5 minutes
Min/Max recommended Temperature:     -5/80 Celsius
Min/Max Temperature Limit:           -10/85 Celsius
Temperature History Size (Index):    128 (56)

Index    Estimated Time   Temperature Celsius
  57    2018-09-12 09:10    26  *******
  58    2018-09-12 09:15    30  ***********
  59    2018-09-12 09:20    29  **********
  60    2018-09-12 09:25    30  ***********
  61    2018-09-12 09:30    28  *********
  62    2018-09-12 09:35    29  **********
 ...    ..( 14 skipped).    ..  **********
  77    2018-09-12 10:50    29  **********
  78    2018-09-12 10:55    28  *********
  79    2018-09-12 11:00    28  *********
  80    2018-09-12 11:05    28  *********
  81    2018-09-12 11:10    20  *
  82    2018-09-12 11:15    22  ***
  83    2018-09-12 11:20    24  *****
  84    2018-09-12 11:25    26  *******
  85    2018-09-12 11:30    27  ********
  86    2018-09-12 11:35    28  *********
  87    2018-09-12 11:40    28  *********
  88    2018-09-12 11:45    28  *********
  89    2018-09-12 11:50    29  **********
  90    2018-09-12 11:55    30  ***********
  91    2018-09-12 12:00    29  **********
  92    2018-09-12 12:05    28  *********
  93    2018-09-12 12:10    28  *********
  94    2018-09-12 12:15    28  *********
  95    2018-09-12 12:20    27  ********
 ...    ..(  2 skipped).    ..  ********
  98    2018-09-12 12:35    27  ********
  99    2018-09-12 12:40    28  *********
 100    2018-09-12 12:45    27  ********
 101    2018-09-12 12:50    27  ********
 102    2018-09-12 12:55    26  *******
 103    2018-09-12 13:00    27  ********
 ...    ..( 24 skipped).    ..  ********
   0    2018-09-12 15:05    27  ********
   1    2018-09-12 15:10    28  *********
   2    2018-09-12 15:15    29  **********
   3    2018-09-12 15:20    28  *********
   4    2018-09-12 15:25    28  *********
   5    2018-09-12 15:30    27  ********
   6    2018-09-12 15:35    20  *
   7    2018-09-12 15:40    22  ***
   8    2018-09-12 15:45    23  ****
   9    2018-09-12 15:50    25  ******
  10    2018-09-12 15:55    26  *******
  11    2018-09-12 16:00    26  *******
  12    2018-09-12 16:05    28  *********
 ...    ..(  5 skipped).    ..  *********
  18    2018-09-12 16:35    28  *********
  19    2018-09-12 16:40    29  **********
  20    2018-09-12 16:45    29  **********
  21    2018-09-12 16:50    29  **********
  22    2018-09-12 16:55    28  *********
 ...    ..(  3 skipped).    ..  *********
  26    2018-09-12 17:15    28  *********
  27    2018-09-12 17:20    27  ********
 ...    ..(  2 skipped).    ..  ********
  30    2018-09-12 17:35    27  ********
  31    2018-09-12 17:40    28  *********
  32    2018-09-12 17:45    27  ********
 ...    ..(  4 skipped).    ..  ********
  37    2018-09-12 18:10    27  ********
  38    2018-09-12 18:15    26  *******
  39    2018-09-12 18:20    27  ********
  40    2018-09-12 18:25    27  ********
  41    2018-09-12 18:30    28  *********
  42    2018-09-12 18:35    27  ********
  43    2018-09-12 18:40    27  ********
  44    2018-09-12 18:45    27  ********
  45    2018-09-12 18:50    28  *********
  46    2018-09-12 18:55    27  ********
  47    2018-09-12 19:00    19  -
  48    2018-09-12 19:05    21  **
  49    2018-09-12 19:10    22  ***
  50    2018-09-12 19:15    23  ****
  51    2018-09-12 19:20    24  *****
  52    2018-09-12 19:25    24  *****
  53    2018-09-12 19:30    25  ******
  54    2018-09-12 19:35    25  ******
  55    2018-09-12 19:40    26  *******
  56    2018-09-12 19:45    26  *******

SCT Error Recovery Control:
           Read: Disabled
          Write: Disabled

Device Statistics (GP/SMART Log 0x04) not supported

SATA Phy Event Counters (GP Log 0x11)
ID      Size     Value  Description
0x0001  4            0  Command failed due to ICRC error
0x0002  4            0  R_ERR response for data FIS
0x0003  4            0  R_ERR response for device-to-host data FIS
0x0004  4            0  R_ERR response for host-to-device data FIS
0x0005  4            0  R_ERR response for non-data FIS
0x0006  4            0  R_ERR response for device-to-host non-data FIS
0x0007  4            0  R_ERR response for host-to-device non-data FIS
0x0008  4            0  Device-to-host non-data FIS retries
0x0009  4            4  Transition from drive PhyRdy to drive PhyNRdy
0x000a  4            1  Device-to-host register FISes sent due to a COMRESET
0x000b  4            0  CRC errors within host-to-device FIS
0x000d  4            0  Non-CRC errors within host-to-device FIS
0x000f  4            0  R_ERR response for host-to-device data FIS, CRC
0x0010  4            0  R_ERR response for host-to-device data FIS, non-CRC
0x0012  4            0  R_ERR response for host-to-device non-data FIS, CRC
0x0013  4            0  R_ERR response for host-to-device non-data FIS, non-CRC
0x8e00  4            0  Vendor specific
0x8e01  4            0  Vendor specific
0x8e02  4            0  Vendor specific
0x8e03  4            0  Vendor specific
0x8e04  4            0  Vendor specific
0x8e05  4            0  Vendor specific
0x8e06  4            0  Vendor specific
0x8e07  4            0  Vendor specific
0x8e08  4            0  Vendor specific
0x8e09  4            0  Vendor specific
0x8e0a  4            0  Vendor specific
0x8e0b  4            0  Vendor specific
0x8e0c  4            0  Vendor specific
0x8e0d  4            0  Vendor specific
0x8e0e  4            0  Vendor specific
0x8e0f  4            0  Vendor specific
0x8e10  4            0  Vendor specific
0x8e11  4            0  Vendor specific

