
/dev/sdb:

ATA device, with non-removable media
	Model Number:       TOSHIBA HDWG11A                         
	Serial Number:      X8A0A04<snip>
	Firmware Revision:  0603    
	Transport:          Serial, ATA8-AST, SATA 1.0a, SATA II Extensions, SATA Rev 2.5, SATA Rev 2.6, SATA Rev 3.0
Standards:
	Used: unknown (minor revision code 0x006d) 
	Supported: 10 9 8 7 6 5 
	Likely used: 10
Configuration:
	Logical		max	current
	cylinders	16383	16383
	heads		16	16
	sectors/track	63	63
	--
	CHS current addressable sectors:    16514064
	LBA    user addressable sectors:   268435455
	LBA48  user addressable sectors: 19532873728
	Logical  Sector size:                   512 bytes
	Physical Sector size:                  4096 bytes
	Logical Sector-0 offset:                  0 bytes
	device size with M = 1024*1024:     9537536 MBytes
	device size with M = 1000*1000:    10000831 MBytes (10000 GB)
	cache/buffer size  = unknown
	Form Factor: 3.5 inch
	Nominal Media Rotation Rate: 7200
Capabilities:
	LBA, IORDY(can be disabled)
	Queue depth: 32
	Standby timer values: spec'd by Standard, no device specific minimum
	R/W multiple sector transfer: Max = 16	Current = 16
	Advanced power management level: 254
	DMA: sdma0 sdma1 sdma2 mdma0 mdma1 mdma2 udma0 udma1 udma2 udma3 udma4 udma5 *udma6 
	     Cycle time: min=120ns recommended=120ns
	PIO: pio0 pio1 pio2 pio3 pio4 
	     Cycle time: no flow control=120ns  IORDY flow control=120ns
Commands/features:
	Enabled	Supported:
	   *	SMART feature set
	    	Security Mode feature set
	   *	Power Management feature set
	   *	Write cache
	   *	Look-ahead
	   *	Host Protected Area feature set
	   *	WRITE_BUFFER command
	   *	READ_BUFFER command
	   *	NOP cmd
	   *	DOWNLOAD_MICROCODE
	   *	Advanced Power Management feature set
	    	SET_MAX security extension
	   *	48-bit Address feature set
	   *	Mandatory FLUSH_CACHE
	   *	FLUSH_CACHE_EXT
	   *	SMART error logging
	   *	SMART self-test
	   *	General Purpose Logging feature set
	   *	WRITE_{DMA|MULTIPLE}_FUA_EXT
	   *	64-bit World wide name
	   *	WRITE_UNCORRECTABLE_EXT command
	   *	{READ,WRITE}_DMA_EXT_GPL commands
	   *	Segmented DOWNLOAD_MICROCODE
	   *	unknown 119[6]
	    	unknown 119[7]
	   *	Gen1 signaling speed (1.5Gb/s)
	   *	Gen2 signaling speed (3.0Gb/s)
	   *	Gen3 signaling speed (6.0Gb/s)
	   *	Native Command Queueing (NCQ)
	   *	Host-initiated interface power management
	   *	Phy event counters
	   *	Host automatic Partial to Slumber transitions
	   *	Device automatic Partial to Slumber transitions
	   *	READ_LOG_DMA_EXT equivalent to READ_LOG_EXT
	   *	DMA Setup Auto-Activate optimization
	    	Device-initiated interface power management
	   *	Software settings preservation
	    	unknown 78[7]
	   *	SMART Command Transport (SCT) feature set
	   *	SCT Write Same (AC2)
	   *	SCT Error Recovery Control (AC3)
	   *	SCT Features Control (AC4)
	   *	SCT Data Tables (AC5)
	   *	SANITIZE_ANTIFREEZE_LOCK_EXT command
	   *	SANITIZE feature set
	   *	OVERWRITE_EXT command
	   *	reserved 69[3]
	   *	DOWNLOAD MICROCODE DMA command
Security: 
	Master password revision code = 65534
		supported
	not	enabled
	not	locked
		frozen
	not	expired: security count
		supported: enhanced erase
	948min for SECURITY ERASE UNIT. 948min for ENHANCED SECURITY ERASE UNIT.
Logical Unit WWN Device Identifier: 50000<snip>
	NAA		: 5
	IEEE OUI	: 000039
	Unique ID	: 8f<snip>
Checksum: correct
