smartctl 6.6 (build date Mar 28 2017) [x86_64-linux-3.13.0-39-generic] (local build)
Copyright (C) 2002-17, Bruce Allen, Christian Franke, www.smartmontools.org

=== START OF INFORMATION SECTION ===
Device Model:     INTEL SSDSC2BA200G4R
Add. Product Id:  DELL(tm)
Firmware Version: G201DL2B
User Capacity:    200,049,647,616 bytes [200 GB]
Sector Sizes:     512 bytes logical, 4096 bytes physical
Rotation Rate:    Solid State Device
Form Factor:      2.5 inches
Device is:        Not in smartctl database [for details use: -P showall]
ATA Version is:   ACS-3 T13/2161-D revision 5
SATA Version is:  SATA 3.1, 6.0 Gb/s (current: 6.0 Gb/s)
Local Time is:    Wed Mar 29 08:22:42 2017 CEST
SMART support is: Available - device has SMART capability.
SMART support is: Enabled
AAM feature is:   Unavailable
APM feature is:   Unavailable
Rd look-ahead is: Enabled
Write cache is:   Enabled
DSN feature is:   Unavailable
ATA Security is:  Disabled, NOT FROZEN [SEC1]
Write SCT (Get) Feature Control Command failed: ATA return descriptor not supported by controller firmware
Wt Cache Reorder: Unknown (SCT Feature Control command failed)

=== START OF READ SMART DATA SECTION ===
SMART Status not supported: ATA return descriptor not supported by controller firmware
SMART overall-health self-assessment test result: PASSED
Warning: This result is based on an Attribute check.

General SMART Values:
Offline data collection status:  (0x02)	Offline data collection activity
					was completed without error.
					Auto Offline Data Collection: Disabled.
Self-test execution status:      (   0)	The previous self-test routine completed
					without error or no self-test has ever 
					been run.
Total time to complete Offline 
data collection: 		(    2) seconds.
Offline data collection
capabilities: 			 (0x79) SMART execute Offline immediate.
					No Auto Offline data collection support.
					Suspend Offline collection upon new
					command.
					Offline surface scan supported.
					Self-test supported.
					Conveyance Self-test supported.
					Selective Self-test supported.
SMART capabilities:            (0x0003)	Saves SMART data before entering
					power-saving mode.
					Supports SMART auto save timer.
Error logging capability:        (0x01)	Error logging supported.
					General Purpose Logging supported.
Short self-test routine 
recommended polling time: 	 (   1) minutes.
Extended self-test routine
recommended polling time: 	 (  60) minutes.
Conveyance self-test routine
recommended polling time: 	 (  60) minutes.
SCT capabilities: 	       (0x003d)	SCT Status supported.
					SCT Error Recovery Control supported.
					SCT Feature Control supported.
					SCT Data Table supported.

SMART Attributes Data Structure revision number: 273
Vendor Specific SMART Attributes with Thresholds:
ID# ATTRIBUTE_NAME          FLAGS    VALUE WORST THRESH FAIL RAW_VALUE
  1 Raw_Read_Error_Rate     -OSR--   130   130   039    -    37013334
  5 Reallocated_Sector_Ct   PO--CK   100   100   001    -    0
  9 Power_On_Hours          -O--CK   100   100   000    -    6164
 12 Power_Cycle_Count       -O--CK   100   100   000    -    5300
 13 Read_Soft_Error_Rate    -OSRC-   130   100   000    -    8626947926
179 Used_Rsvd_Blk_Cnt_Tot   PO--CK   100   100   010    -    0
180 Unused_Rsvd_Blk_Cnt_Tot -O--CK   100   100   000    -    17180
181 Program_Fail_Cnt_Total  -O-RCK   100   100   000    -    0
182 Erase_Fail_Count_Total  -O-RCK   100   100   000    -    0
184 End-to-End_Error        -O--CK   100   100   000    -    0
194 Temperature_Celsius     -O---K   100   100   000    -    25
195 Hardware_ECC_Recovered  -O--CK   100   100   000    -    0
198 Offline_Uncorrectable   ----C-   100   100   000    -    0
199 UDMA_CRC_Error_Count    -OSRCK   100   100   000    -    0
201 Unknown_SSD_Attribute   PO--CK   100   100   010    -    193273795554
202 Unknown_SSD_Attribute   POS--K   100   100   000    -    0
226 Unknown_SSD_Attribute   -O--CK   100   100   000    -    65535
227 Unknown_SSD_Attribute   -O--CK   100   100   000    -    65535
228 Power-off_Retract_Count -O--CK   100   100   000    -    65535
233 Media_Wearout_Indicator -O--CK   100   100   000    -    1708023
245 Unknown_Attribute       -O--CK   100   100   000    -    0
                            ||||||_ K auto-keep
                            |||||__ C event count
                            ||||___ R error rate
                            |||____ S speed/performance
                            ||_____ O updated online
                            |______ P prefailure warning

General Purpose Log Directory Version 1
SMART           Log Directory Version 1 [multi-sector log support]
Address    Access  R/W   Size  Description
0x00       GPL,SL  R/O      1  Log Directory
0x01       GPL,SL  R/O      1  Summary SMART error log
0x02       GPL,SL  R/O      8  Comprehensive SMART error log
0x03       GPL,SL  R/O     20  Ext. Comprehensive SMART error log
0x04       GPL,SL  R/O      8  Device Statistics log
0x06       GPL,SL  R/O      1  SMART self-test log
0x07       GPL,SL  R/O      2  Extended self-test log
0x08       GPL,SL  R/O      2  Power Conditions log
0x09       GPL,SL  R/W      1  Selective self-test log
0x10       GPL,SL  R/O      1  SATA NCQ Queued Error log
0x11       GPL,SL  R/O      1  SATA Phy Event Counters log
0x30       GPL,SL  R/O      9  IDENTIFY DEVICE data log
0x80-0x9f  GPL,SL  R/W     16  Host vendor specific log
0xb0       GPL,SL  VS       1  Device vendor specific log
0xb1       GPL,SL  VS      33  Device vendor specific log
0xb8       GPL,SL  VS       1  Device vendor specific log
0xb9       GPL     VS    1544  Device vendor specific log
0xb9       SL      VS       8  Device vendor specific log
0xba       GPL     VS    1280  Device vendor specific log
0xdf       GPL,SL  VS       1  Device vendor specific log
0xe0       GPL,SL  R/W      1  SCT Command/Status
0xe1       GPL,SL  R/W      1  SCT Data Transfer

SMART Extended Comprehensive Error Log Version: 1 (20 sectors)
No Errors Logged

SMART Extended Self-test Log Version: 1 (2 sectors)
Num  Test_Description    Status                  Remaining  LifeTime(hours)  LBA_of_first_error
# 1  Short offline       Completed without error       00%      6164         -
# 2  Short offline       Completed without error       00%      6139         -
# 3  Short offline       Completed without error       00%      6123         -

SMART Selective self-test log data structure revision number 1
 SPAN              MIN_LBA              MAX_LBA  CURRENT_TEST_STATUS
    1    58581440543067649  7205815500444532762  Not_testing
    2   360287970189639780        7028244230665  Not_testing
    3  7205814430997676032   360287970189644388  Not_testing
    4    58581182140390925  7205816247768842266  Not_testing
    5   360287970189639780    18890040939655860  Not_testing
Selective self-test flags (0x0):
  After scanning selected spans, do NOT read-scan remainder of disk.
If Selective self-test is pending on power-up, resume after 0 minute delay.

SCT Status Version:                  3
SCT Version (vendor specific):       1 (0x0001)
SCT Support Level:                   0
Device State:                        Active (0)
Current Temperature:                    25 Celsius
Power Cycle Min/Max Temperature:     19/31 Celsius
Lifetime    Min/Max Temperature:     19/31 Celsius
Under/Over Temperature Limit Count:   0/0
Vendor specific:
00 00 64 00 00 00 00 00 00 00 00 00 00 00 00 00
00 00 00 00 00 00 00 00 00 00 00 00 00 00 00 00

Write SCT Data Table failed: SMART WRITE LOG SECTOR may cause problems, try with -T permissive to force
Read SCT Temperature History failed

Write SCT (Get) Error Recovery Control Command failed: ATA return descriptor not supported by controller firmware
SCT (Get) Error Recovery Control command failed

Device Statistics (GP Log 0x04)
Page  Offset Size        Value Flags Description
0x01  =====  =               =  ===  == General Statistics (rev 2) ==
0x01  0x008  4            5300  ---  Lifetime Power-On Resets
0x01  0x018  6    111937049168  ---  Logical Sectors Written
0x01  0x020  6      1005510373  ---  Number of Write Commands
0x01  0x028  6       485158753  ---  Logical Sectors Read
0x01  0x030  6          161204  ---  Number of Read Commands
0x04  =====  =               =  ===  == General Errors Statistics (rev 1) ==
0x04  0x008  4               0  ---  Number of Reported Uncorrectable Errors
0x04  0x010  4               0  ---  Resets Between Cmd Acceptance and Completion
0x05  =====  =               =  ===  == Temperature Statistics (rev 1) ==
0x05  0x008  1              25  ---  Current Temperature
0x05  0x010  1              24  ---  Average Short Term Temperature
0x05  0x018  1              23  ---  Average Long Term Temperature
0x05  0x020  1              31  ---  Highest Temperature
0x05  0x028  1              20  ---  Lowest Temperature
0x05  0x030  1              25  ---  Highest Average Short Term Temperature
0x05  0x038  1              20  ---  Lowest Average Short Term Temperature
0x05  0x040  1              23  ---  Highest Average Long Term Temperature
0x05  0x048  1              20  ---  Lowest Average Long Term Temperature
0x05  0x050  4               0  ---  Time in Over-Temperature
0x05  0x058  1              70  ---  Specified Maximum Operating Temperature
0x05  0x060  4               0  ---  Time in Under-Temperature
0x05  0x068  1               0  ---  Specified Minimum Operating Temperature
0x06  =====  =               =  ===  == Transport Statistics (rev 1) ==
0x06  0x008  4               0  ---  Number of Hardware Resets
0x06  0x010  4               0  ---  Number of ASR Events
0x06  0x018  4               0  ---  Number of Interface CRC Errors
0x07  =====  =               =  ===  == Solid State Device Statistics (rev 1) ==
0x07  0x008  1               0  ---  Percentage Used Endurance Indicator
                                |||_ C monitored condition met
                                ||__ D supports DSN
                                |___ N normalized value

SATA Phy Event Counters (GP Log 0x11)
ID      Size     Value  Description
0x0001  4            0  Command failed due to ICRC error
0x0003  4            0  R_ERR response for device-to-host data FIS
0x0004  4            0  R_ERR response for host-to-device data FIS
0x0006  4            0  R_ERR response for device-to-host non-data FIS
0x000a  4            1  Device-to-host register FISes sent due to a COMRESET
0x000b  4            0  CRC errors within host-to-device FIS
0x000d  4            0  Non-CRC errors within host-to-device FIS

