smartctl 6.5 2016-01-23 r4210 [Darwin 12.6.0 x86_64] (daily-20160123)
Copyright (C) 2002-16, Bruce Allen, Christian Franke, www.smartmontools.org

=== START OF INFORMATION SECTION ===
Device Model:     Corsair CMFSSD-128D1
Serial Number:    84004582W73A67JPWCYN
Firmware Version: 1.0
User Capacity:    128,035,676,160 bytes [128 GB]
Sector Size:      512 bytes logical/physical
Rotation Rate:    Solid State Device
Device is:        Not in smartctl database [for details use: -P showall]
ATA Version is:   ATA/ATAPI-7 (minor revision not indicated)
Local Time is:    Sun Jan 24 09:33:33 2016 PST
SMART support is: Available - device has SMART capability.
SMART support is: Enabled
AAM feature is:   Unavailable
APM feature is:   Unavailable
Rd look-ahead is: Enabled
Write cache is:   Enabled
ATA Security is:  Disabled, NOT FROZEN [SEC1]
Wt Cache Reorder: Unavailable

=== START OF READ SMART DATA SECTION ===
SMART overall-health self-assessment test result: PASSED

General SMART Values:
Offline data collection status:  (0x00)	Offline data collection activity
					was never started.
					Auto Offline Data Collection: Disabled.
Self-test execution status:      ( 240)	Self-test routine in progress...
					00% of test remaining.
Total time to complete Offline 
data collection: 		(    0) seconds.
Offline data collection
capabilities: 			 (0x1d) SMART execute Offline immediate.
					No Auto Offline data collection support.
					Abort Offline collection upon new
					command.
					Offline surface scan supported.
					Self-test supported.
					No Conveyance Self-test supported.
					No Selective Self-test supported.
SMART capabilities:            (0x0003)	Saves SMART data before entering
					power-saving mode.
					Supports SMART auto save timer.
Error logging capability:        (0x00)	Error logging NOT supported.
					General Purpose Logging supported.
Short self-test routine 
recommended polling time: 	 (   0) minutes.
Extended self-test routine
recommended polling time: 	 (   0) minutes.

SMART Attributes Data Structure revision number: 16
Vendor Specific SMART Attributes with Thresholds:
ID# ATTRIBUTE_NAME          FLAGS    VALUE WORST THRESH FAIL RAW_VALUE
  1 Raw_Read_Error_Rate     ------   006   000   000    -    0
  9 Power_On_Hours          ------   034   008   000    -    0
 12 Power_Cycle_Count       ------   224   008   000    -    0
184 End-to-End_Error        ------   061   000   000    -    0
195 Hardware_ECC_Recovered  ------   003   000   000    -    0
196 Reallocated_Event_Count ------   000   000   000    -    0
197 Current_Pending_Sector  ------   000   000   000    -    0
198 Offline_Uncorrectable   ------   072   108   000    -    23125
199 UDMA_CRC_Error_Count    ------   255   176   000    -    119578
200 Unknown_SSD_Attribute   ------   220   098   000    -    344
201 Unknown_SSD_Attribute   ------   056   082   000    -    937
202 Unknown_SSD_Attribute   ------   001   107   000    -    23
203 Run_Out_Cancel          ------   105   072   000    -    18
204 Soft_ECC_Correction     ------   000   000   000    -    0
205 Thermal_Asperity_Rate   ------   160   134   000    -    1
206 Unknown_SSD_Attribute   ------   001   000   000    -    0
207 Unknown_SSD_Attribute   ------   129   044   000    -    0
208 Unknown_SSD_Attribute   ------   156   002   000    -    0
209 Unknown_SSD_Attribute   ------   100   000   000    -    0
210 Unknown_Attribute       ------   238   000   000    -    0
211 Unknown_Attribute       ------   000   000   000    -    0
                            ||||||_ K auto-keep
                            |||||__ C event count
                            ||||___ R error rate
                            |||____ S speed/performance
                            ||_____ O updated online
                            |______ P prefailure warning

ATA_READ_LOG_EXT (addr=0x00:0x00, page=0, n=1) failed: 48-bit ATA commands not implemented
Read GP Log Directory failed

SMART Log Directory Version 1 [multi-sector log support]
Address    Access  R/W   Size  Description
0x00           SL  R/O      1  Log Directory
0x01           SL  R/O      1  Summary SMART error log
0x02           SL  R/O     51  Comprehensive SMART error log
0x03           SL  R/O     77  Ext. Comprehensive SMART error log
0x06           SL  R/O      1  SMART self-test log
0x07           SL  R/O      1  Extended self-test log
0x09           SL  R/W      1  Selective self-test log
0x10           SL  R/O      1  SATA NCQ Queued Error log
0x11           SL  R/O      1  SATA Phy Event Counters log

SMART Extended Comprehensive Error Log (GP Log 0x03) not supported

Warning! SMART ATA Error Log Structure error: invalid SMART checksum.
SMART Error Log Version: 1
No Errors Logged

SMART Extended Self-test Log (GP Log 0x07) not supported

Warning! SMART Self-Test Log Structure error: invalid SMART checksum.
SMART Self-test log structure revision number 1
No self-tests have been logged.  [To run self-tests, use: smartctl -t]

Selective Self-tests/Logging not supported

SCT Commands not supported

Device Statistics (GP/SMART Log 0x04) not supported

ATA_READ_LOG_EXT (addr=0x11:0x00, page=0, n=1) failed: 48-bit ATA commands not implemented
Read SATA Phy Event Counters failed

