smartctl 6.6 2016-05-31 r4324 [x86_64-linux-4.10.0-28-generic] (local build)
Copyright (C) 2002-16, Bruce Allen, Christian Franke, www.smartmontools.org

=== START OF INFORMATION SECTION ===
Device Model:     WDC WD4000FDYZ-27YA5B0
Serial Number:    WD-WCC132156748
LU WWN Device Id: 5 0014ee 25f86430e
Firmware Version: 01.01K06
User Capacity:    4,000,787,030,016 bytes [4.00 TB]
Sector Size:      512 bytes logical/physical
Rotation Rate:    7200 rpm
Device is:        Not in smartctl database [for details use: -P showall]
ATA Version is:   ATA8-ACS (minor revision not indicated)
SATA Version is:  SATA 3.0, 6.0 Gb/s (current: 6.0 Gb/s)
Local Time is:    Thu Jul 27 16:17:44 2017 PDT
SMART support is: Available - device has SMART capability.
SMART support is: Enabled
AAM feature is:   Unavailable
APM level is:     254 (maximum performance)
Rd look-ahead is: Enabled
Write cache is:   Enabled
ATA Security is:  Disabled, frozen [SEC2]
Wt Cache Reorder: Enabled

=== START OF READ SMART DATA SECTION ===
SMART overall-health self-assessment test result: PASSED

General SMART Values:
Offline data collection status:  (0x84)	Offline data collection activity
					was suspended by an interrupting command from host.
					Auto Offline Data Collection: Enabled.
Self-test execution status:      (   0)	The previous self-test routine completed
					without error or no self-test has ever 
					been run.
Total time to complete Offline 
data collection: 		(47400) seconds.
Offline data collection
capabilities: 			 (0x7b) SMART execute Offline immediate.
					Auto Offline data collection on/off support.
					Suspend Offline collection upon new
					command.
					Offline surface scan supported.
					Self-test supported.
					Conveyance Self-test supported.
					Selective Self-test supported.
SMART capabilities:            (0x0003)	Saves SMART data before entering
					power-saving mode.
					Supports SMART auto save timer.
Error logging capability:        (0x01)	Error logging supported.
					General Purpose Logging supported.
Short self-test routine 
recommended polling time: 	 (   2) minutes.
Extended self-test routine
recommended polling time: 	 ( 513) minutes.
Conveyance self-test routine
recommended polling time: 	 (   5) minutes.
SCT capabilities: 	       (0x70b9)	SCT Status supported.
					SCT Error Recovery Control supported.
					SCT Feature Control supported.
					SCT Data Table supported.

SMART Attributes Data Structure revision number: 16
Vendor Specific SMART Attributes with Thresholds:
ID# ATTRIBUTE_NAME          FLAGS    VALUE WORST THRESH FAIL RAW_VALUE
  1 Raw_Read_Error_Rate     POSR-K   200   196   051    -    0
  3 Spin_Up_Time            POS--K   253   227   021    -    5541
  4 Start_Stop_Count        -O--CK   100   100   000    -    160
  5 Reallocated_Sector_Ct   PO--CK   198   198   140    -    85
  7 Seek_Error_Rate         -OSR-K   200   200   000    -    0
  9 Power_On_Hours          -O--CK   068   068   000    -    23929
 10 Spin_Retry_Count        -O--CK   100   100   000    -    0
 11 Calibration_Retry_Count -O--CK   100   100   000    -    0
 12 Power_Cycle_Count       -O--CK   100   100   000    -    148
183 Runtime_Bad_Block       -O--CK   100   100   000    -    0
192 Power-Off_Retract_Count -O--CK   200   200   000    -    123
193 Load_Cycle_Count        -O--CK   200   200   000    -    49
194 Temperature_Celsius     -O---K   108   098   000    -    44
196 Reallocated_Event_Count -O--CK   190   190   000    -    10
197 Current_Pending_Sector  -O--CK   200   200   000    -    0
198 Offline_Uncorrectable   ----CK   200   200   000    -    0
199 UDMA_CRC_Error_Count    -O--CK   200   200   000    -    0
200 Multi_Zone_Error_Rate   ---R--   200   200   000    -    0
                            ||||||_ K auto-keep
                            |||||__ C event count
                            ||||___ R error rate
                            |||____ S speed/performance
                            ||_____ O updated online
                            |______ P prefailure warning

General Purpose Log Directory Version 1
SMART           Log Directory Version 1 [multi-sector log support]
Address    Access  R/W   Size  Description
0x00       GPL,SL  R/O      1  Log Directory
0x01           SL  R/O      1  Summary SMART error log
0x02           SL  R/O      5  Comprehensive SMART error log
0x03       GPL     R/O      6  Ext. Comprehensive SMART error log
0x06           SL  R/O      1  SMART self-test log
0x07       GPL     R/O      1  Extended self-test log
0x08       GPL     R/O      2  Power Conditions log
0x09           SL  R/W      1  Selective self-test log
0x10       GPL     R/O      1  SATA NCQ Queued Error log
0x11       GPL     R/O      1  SATA Phy Event Counters log
0x24       GPL     R/O      1  Current Device Internal Status Data log
0x80-0x9f  GPL,SL  R/W     16  Host vendor specific log
0xa0-0xa7  GPL,SL  VS      16  Device vendor specific log
0xa8-0xb1  GPL,SL  VS       1  Device vendor specific log
0xb2       GPL     VS   65535  Device vendor specific log
0xb2       SL      VS     255  Device vendor specific log
0xb3-0xb7  GPL,SL  VS       1  Device vendor specific log
0xbd       GPL,SL  VS       1  Device vendor specific log
0xc0       GPL,SL  VS       1  Device vendor specific log
0xc1       GPL     VS      24  Device vendor specific log
0xe0       GPL,SL  R/W      1  SCT Command/Status
0xe1       GPL,SL  R/W      1  SCT Data Transfer

SMART Extended Comprehensive Error Log Version: 1 (6 sectors)
Device Error Count: 151 (device log contains only the most recent 24 errors)
	CR     = Command Register
	FEATR  = Features Register
	COUNT  = Count (was: Sector Count) Register
	LBA_48 = Upper bytes of LBA High/Mid/Low Registers ]  ATA-8
	LH     = LBA High (was: Cylinder High) Register    ]   LBA
	LM     = LBA Mid (was: Cylinder Low) Register      ] Register
	LL     = LBA Low (was: Sector Number) Register     ]
	DV     = Device (was: Device/Head) Register
	DC     = Device Control Register
	ER     = Error register
	ST     = Status register
Powered_Up_Time is measured from power on, and printed as
DDd+hh:mm:SS.sss where DD=days, hh=hours, mm=minutes,
SS=sec, and sss=millisec. It "wraps" after 49.710 days.

Error 151 [6] occurred at disk power-on lifetime: 23084 hours (961 days + 20 hours)
  When the command that caused the error occurred, the device was active or idle.

  After command completion occurred, registers were:
  ER -- ST COUNT  LBA_48  LH LM LL DV DC
  -- -- -- == -- == == == -- -- -- -- --
  40 -- 51 00 08 00 01 9e 04 0f 7a e0 00  Error: UNC 8 sectors at LBA = 0x19e040f7a = 6946033530

  Commands leading to the command that caused the error were:
  CR FEATR COUNT  LBA_48  LH LM LL DV DC  Powered_Up_Time  Command/Feature_Name
  -- == -- == -- == == == -- -- -- -- --  ---------------  --------------------
  25 00 00 00 08 00 01 9e 04 0f 78 e0 0a  2d+09:42:59.972  READ DMA EXT
  25 00 00 00 08 00 01 9e 04 0f 70 e0 0a  2d+09:42:59.972  READ DMA EXT
  25 00 00 00 08 00 01 9e 04 0f 68 e0 0a  2d+09:42:59.972  READ DMA EXT
  25 00 00 00 08 00 01 9e 04 0f 60 e0 0a  2d+09:42:59.972  READ DMA EXT
  25 00 00 00 08 00 01 9e 04 0f 58 e0 0a  2d+09:42:59.972  READ DMA EXT

Error 150 [5] occurred at disk power-on lifetime: 23084 hours (961 days + 20 hours)
  When the command that caused the error occurred, the device was active or idle.

  After command completion occurred, registers were:
  ER -- ST COUNT  LBA_48  LH LM LL DV DC
  -- -- -- == -- == == == -- -- -- -- --
  40 -- 51 08 00 00 01 9e 04 0f 7a e0 00  Error: UNC 2048 sectors at LBA = 0x19e040f7a = 6946033530

  Commands leading to the command that caused the error were:
  CR FEATR COUNT  LBA_48  LH LM LL DV DC  Powered_Up_Time  Command/Feature_Name
  -- == -- == -- == == == -- -- -- -- --  ---------------  --------------------
  25 00 00 08 00 00 01 9e 04 08 00 e0 0a  2d+09:42:56.533  READ DMA EXT
  25 00 00 04 00 00 01 9e 04 04 00 e0 0a  2d+09:42:56.478  READ DMA EXT
  25 00 00 04 00 00 01 9e 04 00 00 e0 0a  2d+09:42:56.472  READ DMA EXT
  25 00 00 02 50 00 01 9e 03 fd b0 e0 0a  2d+09:42:56.469  READ DMA EXT
  25 00 00 05 b0 00 01 9e 03 f8 00 e0 0a  2d+09:42:56.462  READ DMA EXT

Error 149 [4] occurred at disk power-on lifetime: 23082 hours (961 days + 18 hours)
  When the command that caused the error occurred, the device was active or idle.

  After command completion occurred, registers were:
  ER -- ST COUNT  LBA_48  LH LM LL DV DC
  -- -- -- == -- == == == -- -- -- -- --
  40 -- 51 00 08 00 01 41 b5 ac 12 e0 00  Error: UNC 8 sectors at LBA = 0x141b5ac12 = 5397392402

  Commands leading to the command that caused the error were:
  CR FEATR COUNT  LBA_48  LH LM LL DV DC  Powered_Up_Time  Command/Feature_Name
  -- == -- == -- == == == -- -- -- -- --  ---------------  --------------------
  25 00 00 00 08 00 01 41 b5 ac 10 e0 0a  2d+07:43:42.001  READ DMA EXT
  25 00 00 00 08 00 01 41 b5 ac 08 e0 0a  2d+07:43:42.001  READ DMA EXT
  25 00 00 00 08 00 01 41 b5 ac 00 e0 0a  2d+07:43:42.001  READ DMA EXT
  25 00 00 00 08 00 01 41 b5 ab f8 e0 0a  2d+07:43:42.000  READ DMA EXT
  25 00 00 00 08 00 01 41 b5 ab f0 e0 0a  2d+07:43:42.000  READ DMA EXT

Error 148 [3] occurred at disk power-on lifetime: 23082 hours (961 days + 18 hours)
  When the command that caused the error occurred, the device was active or idle.

  After command completion occurred, registers were:
  ER -- ST COUNT  LBA_48  LH LM LL DV DC
  -- -- -- == -- == == == -- -- -- -- --
  40 -- 51 00 08 00 01 41 b5 a3 8a e0 00  Error: UNC 8 sectors at LBA = 0x141b5a38a = 5397390218

  Commands leading to the command that caused the error were:
  CR FEATR COUNT  LBA_48  LH LM LL DV DC  Powered_Up_Time  Command/Feature_Name
  -- == -- == -- == == == -- -- -- -- --  ---------------  --------------------
  25 00 00 00 08 00 01 41 b5 a3 88 e0 0a  2d+07:43:40.148  READ DMA EXT
  25 00 00 00 08 00 01 41 b5 a3 80 e0 0a  2d+07:43:40.148  READ DMA EXT
  25 00 00 00 08 00 01 41 b5 a3 78 e0 0a  2d+07:43:40.148  READ DMA EXT
  25 00 00 00 08 00 01 41 b5 a3 70 e0 0a  2d+07:43:40.148  READ DMA EXT
  25 00 00 00 08 00 01 41 b5 a3 68 e0 0a  2d+07:43:40.148  READ DMA EXT

Error 147 [2] occurred at disk power-on lifetime: 23082 hours (961 days + 18 hours)
  When the command that caused the error occurred, the device was active or idle.

  After command completion occurred, registers were:
  ER -- ST COUNT  LBA_48  LH LM LL DV DC
  -- -- -- == -- == == == -- -- -- -- --
  40 -- 51 00 08 00 01 41 b5 9b 02 e0 00  Error: UNC 8 sectors at LBA = 0x141b59b02 = 5397388034

  Commands leading to the command that caused the error were:
  CR FEATR COUNT  LBA_48  LH LM LL DV DC  Powered_Up_Time  Command/Feature_Name
  -- == -- == -- == == == -- -- -- -- --  ---------------  --------------------
  25 00 00 00 08 00 01 41 b5 9b 00 e0 0a  2d+07:43:38.263  READ DMA EXT
  25 00 00 00 08 00 01 41 b5 9a f8 e0 0a  2d+07:43:38.262  READ DMA EXT
  25 00 00 00 08 00 01 41 b5 9a f0 e0 0a  2d+07:43:38.262  READ DMA EXT
  25 00 00 00 08 00 01 41 b5 9a e8 e0 0a  2d+07:43:38.262  READ DMA EXT
  25 00 00 00 08 00 01 41 b5 9a e0 e0 0a  2d+07:43:38.262  READ DMA EXT

Error 146 [1] occurred at disk power-on lifetime: 23082 hours (961 days + 18 hours)
  When the command that caused the error occurred, the device was active or idle.

  After command completion occurred, registers were:
  ER -- ST COUNT  LBA_48  LH LM LL DV DC
  -- -- -- == -- == == == -- -- -- -- --
  40 -- 51 00 08 00 01 41 b5 92 79 e0 00  Error: UNC 8 sectors at LBA = 0x141b59279 = 5397385849

  Commands leading to the command that caused the error were:
  CR FEATR COUNT  LBA_48  LH LM LL DV DC  Powered_Up_Time  Command/Feature_Name
  -- == -- == -- == == == -- -- -- -- --  ---------------  --------------------
  25 00 00 00 08 00 01 41 b5 92 78 e0 0a  2d+07:43:36.413  READ DMA EXT
  25 00 00 00 08 00 01 41 b5 92 70 e0 0a  2d+07:43:36.413  READ DMA EXT
  25 00 00 00 08 00 01 41 b5 92 68 e0 0a  2d+07:43:36.413  READ DMA EXT
  25 00 00 00 08 00 01 41 b5 92 60 e0 0a  2d+07:43:36.413  READ DMA EXT
  25 00 00 00 08 00 01 41 b5 92 58 e0 0a  2d+07:43:36.413  READ DMA EXT

Error 145 [0] occurred at disk power-on lifetime: 23082 hours (961 days + 18 hours)
  When the command that caused the error occurred, the device was active or idle.

  After command completion occurred, registers were:
  ER -- ST COUNT  LBA_48  LH LM LL DV DC
  -- -- -- == -- == == == -- -- -- -- --
  40 -- 51 00 08 00 01 41 b5 89 f1 e0 00  Error: UNC 8 sectors at LBA = 0x141b589f1 = 5397383665

  Commands leading to the command that caused the error were:
  CR FEATR COUNT  LBA_48  LH LM LL DV DC  Powered_Up_Time  Command/Feature_Name
  -- == -- == -- == == == -- -- -- -- --  ---------------  --------------------
  25 00 00 00 08 00 01 41 b5 89 f0 e0 0a  2d+07:43:34.558  READ DMA EXT
  25 00 00 00 08 00 01 41 b5 89 e8 e0 0a  2d+07:43:34.558  READ DMA EXT
  25 00 00 00 08 00 01 41 b5 89 e0 e0 0a  2d+07:43:34.558  READ DMA EXT
  25 00 00 00 08 00 01 41 b5 89 d8 e0 0a  2d+07:43:34.558  READ DMA EXT
  25 00 00 00 08 00 01 41 b5 89 d0 e0 0a  2d+07:43:34.558  READ DMA EXT

Error 144 [23] occurred at disk power-on lifetime: 23082 hours (961 days + 18 hours)
  When the command that caused the error occurred, the device was active or idle.

  After command completion occurred, registers were:
  ER -- ST COUNT  LBA_48  LH LM LL DV DC
  -- -- -- == -- == == == -- -- -- -- --
  40 -- 51 00 08 00 01 41 b5 81 69 e0 00  Error: UNC 8 sectors at LBA = 0x141b58169 = 5397381481

  Commands leading to the command that caused the error were:
  CR FEATR COUNT  LBA_48  LH LM LL DV DC  Powered_Up_Time  Command/Feature_Name
  -- == -- == -- == == == -- -- -- -- --  ---------------  --------------------
  25 00 00 00 08 00 01 41 b5 81 68 e0 0a  2d+07:43:32.677  READ DMA EXT
  25 00 00 00 08 00 01 41 b5 81 60 e0 0a  2d+07:43:32.677  READ DMA EXT
  25 00 00 00 08 00 01 41 b5 81 58 e0 0a  2d+07:43:32.677  READ DMA EXT
  25 00 00 00 08 00 01 41 b5 81 50 e0 0a  2d+07:43:32.677  READ DMA EXT
  25 00 00 00 08 00 01 41 b5 81 48 e0 0a  2d+07:43:32.677  READ DMA EXT

SMART Extended Self-test Log Version: 1 (1 sectors)
Num  Test_Description    Status                  Remaining  LifeTime(hours)  LBA_of_first_error
# 1  Short offline       Completed without error       00%     23926         -
# 2  Extended offline    Completed without error       00%     23115         -
# 3  Extended offline    Aborted by host               90%     23105         -
# 4  Short offline       Completed without error       00%     23105         -
# 5  Extended offline    Aborted by host               90%     22935         -
# 6  Short offline       Completed without error       00%     22911         -
# 7  Short captive       Interrupted (host reset)      90%     22911         -
# 8  Extended captive    Interrupted (host reset)      90%     22901         -
# 9  Extended offline    Aborted by host               90%     22901         -
#10  Short captive       Completed without error       00%     22890         -

SMART Selective self-test log data structure revision number 1
 SPAN  MIN_LBA  MAX_LBA  CURRENT_TEST_STATUS
    1        0        0  Not_testing
    2        0        0  Not_testing
    3        0        0  Not_testing
    4        0        0  Not_testing
    5        0        0  Not_testing
Selective self-test flags (0x0):
  After scanning selected spans, do NOT read-scan remainder of disk.
If Selective self-test is pending on power-up, resume after 0 minute delay.

SCT Status Version:                  3
SCT Version (vendor specific):       258 (0x0102)
SCT Support Level:                   1
Device State:                        Active (0)
Current Temperature:                    44 Celsius
Power Cycle Min/Max Temperature:     40/45 Celsius
Lifetime    Min/Max Temperature:     19/54 Celsius
Under/Over Temperature Limit Count:   0/0
Vendor specific:
01 00 00 00 00 00 00 00 00 00 00 00 00 00 00 00
00 00 00 00 00 00 00 00 00 00 00 00 00 00 00 00

SCT Temperature History Version:     2
Temperature Sampling Period:         1 minute
Temperature Logging Interval:        1 minute
Min/Max recommended Temperature:      0/60 Celsius
Min/Max Temperature Limit:           -41/85 Celsius
Temperature History Size (Index):    478 (78)

Index    Estimated Time   Temperature Celsius
  79    2017-07-27 08:20    44  *************************
 ...    ..( 48 skipped).    ..  *************************
 128    2017-07-27 09:09    44  *************************
 129    2017-07-27 09:10    41  **********************
 ...    ..(178 skipped).    ..  **********************
 308    2017-07-27 12:09    41  **********************
 309    2017-07-27 12:10    42  ***********************
 ...    ..(150 skipped).    ..  ***********************
 460    2017-07-27 14:41    42  ***********************
 461    2017-07-27 14:42    43  ************************
 ...    ..( 67 skipped).    ..  ************************
  51    2017-07-27 15:50    43  ************************
  52    2017-07-27 15:51    44  *************************
 ...    ..( 25 skipped).    ..  *************************
  78    2017-07-27 16:17    44  *************************

SCT Error Recovery Control:
           Read:     70 (7.0 seconds)
          Write:     70 (7.0 seconds)

Device Statistics (GP/SMART Log 0x04) not supported

SATA Phy Event Counters (GP Log 0x11)
ID      Size     Value  Description
0x0001  2            0  Command failed due to ICRC error
0x0002  2            0  R_ERR response for data FIS
0x0003  2            0  R_ERR response for device-to-host data FIS
0x0004  2            0  R_ERR response for host-to-device data FIS
0x0005  2            0  R_ERR response for non-data FIS
0x0006  2            0  R_ERR response for device-to-host non-data FIS
0x0007  2            0  R_ERR response for host-to-device non-data FIS
0x0008  2            0  Device-to-host non-data FIS retries
0x0009  2            9  Transition from drive PhyRdy to drive PhyNRdy
0x000a  2            8  Device-to-host register FISes sent due to a COMRESET
0x000b  2            0  CRC errors within host-to-device FIS
0x000f  2            0  R_ERR response for host-to-device data FIS, CRC
0x0012  2            0  R_ERR response for host-to-device non-data FIS, CRC
0x8000  4      1653355  Vendor specific

