smartctl 6.6 2017-11-05 r4594 [x86_64-linux-4.14.22] (local build)
Copyright (C) 2002-17, Bruce Allen, Christian Franke, www.smartmontools.org

=== START OF INFORMATION SECTION ===
Device Model:     ST1000LM035-1RK172
Firmware Version: LCM2
User Capacity:    1,000,204,886,016 bytes [1.00 TB]
Sector Sizes:     512 bytes logical, 4096 bytes physical
Rotation Rate:    5400 rpm
Form Factor:      2.5 inches
Device is:        Not in smartctl database [for details use: -P showall]
ATA Version is:   ACS-3 T13/2161-D revision 3b
SATA Version is:  SATA 3.1, 6.0 Gb/s (current: 6.0 Gb/s)
Local Time is:    Thu Mar  1 11:51:14 2018 CET
SMART support is: Available - device has SMART capability.
SMART support is: Enabled
AAM feature is:   Unavailable
APM level is:     128 (minimum power consumption without standby)
Rd look-ahead is: Enabled
Write cache is:   Enabled
DSN feature is:   Unavailable
ATA Security is:  Disabled, frozen [SEC2]
Wt Cache Reorder: Enabled

=== START OF READ SMART DATA SECTION ===
SMART overall-health self-assessment test result: PASSED

General SMART Values:
Offline data collection status:  (0x00)	Offline data collection activity
					was never started.
					Auto Offline Data Collection: Disabled.
Self-test execution status:      (   0)	The previous self-test routine completed
					without error or no self-test has ever 
					been run.
Total time to complete Offline 
data collection: 		(    0) seconds.
Offline data collection
capabilities: 			 (0x71) SMART execute Offline immediate.
					No Auto Offline data collection support.
					Suspend Offline collection upon new
					command.
					No Offline surface scan supported.
					Self-test supported.
					Conveyance Self-test supported.
					Selective Self-test supported.
SMART capabilities:            (0x0003)	Saves SMART data before entering
					power-saving mode.
					Supports SMART auto save timer.
Error logging capability:        (0x01)	Error logging supported.
					General Purpose Logging supported.
Short self-test routine 
recommended polling time: 	 (   1) minutes.
Extended self-test routine
recommended polling time: 	 ( 164) minutes.
Conveyance self-test routine
recommended polling time: 	 (   2) minutes.
SCT capabilities: 	       (0x3035)	SCT Status supported.
					SCT Feature Control supported.
					SCT Data Table supported.

SMART Attributes Data Structure revision number: 10
Vendor Specific SMART Attributes with Thresholds:
ID# ATTRIBUTE_NAME          FLAGS    VALUE WORST THRESH FAIL RAW_VALUE
  1 Raw_Read_Error_Rate     POSR--   081   064   034    -    129373073
  3 Spin_Up_Time            PO----   099   099   000    -    0
  4 Start_Stop_Count        -O--CK   100   100   020    -    44
  5 Reallocated_Sector_Ct   PO--CK   100   100   036    -    0
  7 Seek_Error_Rate         POSR--   100   253   045    -    991957
  9 Power_On_Hours          -O--CK   100   100   000    -    98 (232 244 0)
 10 Spin_Retry_Count        PO--C-   100   100   097    -    0
 12 Power_Cycle_Count       -O--CK   100   100   020    -    36
184 End-to-End_Error        -O--CK   100   100   099    -    0
187 Reported_Uncorrect      -O--CK   100   100   000    -    0
188 Command_Timeout         -O--CK   100   100   000    -    0
189 High_Fly_Writes         -O-RCK   100   100   000    -    0
190 Airflow_Temperature_Cel -O---K   071   052   040    -    29 (Min/Max 19/31)
191 G-Sense_Error_Rate      -O--CK   100   100   000    -    1
192 Power-Off_Retract_Count -O--CK   100   100   000    -    4
193 Load_Cycle_Count        -O--CK   097   097   000    -    7185
194 Temperature_Celsius     -O---K   029   048   000    -    29 (0 18 0 0 0)
196 Reallocated_Event_Count -O--CK   100   100   000    -    0
197 Current_Pending_Sector  -O--C-   100   100   000    -    0
198 Offline_Uncorrectable   ----C-   100   100   000    -    0
199 UDMA_CRC_Error_Count    -OSRCK   200   200   000    -    0
240 Head_Flying_Hours       POSR--   100   100   030    -    62 (110 215 0)
254 Free_Fall_Sensor        -O--CK   100   100   000    -    0
                            ||||||_ K auto-keep
                            |||||__ C event count
                            ||||___ R error rate
                            |||____ S speed/performance
                            ||_____ O updated online
                            |______ P prefailure warning

General Purpose Log Directory Version 1
SMART           Log Directory Version 1 [multi-sector log support]
Address    Access  R/W   Size  Description
0x00       GPL,SL  R/O      1  Log Directory
0x01           SL  R/O      1  Summary SMART error log
0x02           SL  R/O      5  Comprehensive SMART error log
0x03       GPL     R/O      5  Ext. Comprehensive SMART error log
0x04       GPL,SL  R/O      8  Device Statistics log
0x06           SL  R/O      1  SMART self-test log
0x07       GPL     R/O      1  Extended self-test log
0x09           SL  R/W      1  Selective self-test log
0x10       GPL     R/O      1  NCQ Command Error log
0x11       GPL     R/O      1  SATA Phy Event Counters log
0x21       GPL     R/O      1  Write stream error log
0x22       GPL     R/O      1  Read stream error log
0x24       GPL     R/O    512  Current Device Internal Status Data log
0x30       GPL,SL  R/O      9  IDENTIFY DEVICE data log
0x80-0x9f  GPL,SL  R/W     16  Host vendor specific log
0xa1       GPL,SL  VS      24  Device vendor specific log
0xa2       GPL     VS    8160  Device vendor specific log
0xa8       GPL,SL  VS     136  Device vendor specific log
0xa9       GPL,SL  VS       1  Device vendor specific log
0xab       GPL     VS       1  Device vendor specific log
0xb0       GPL     VS    8920  Device vendor specific log
0xbe-0xbf  GPL     VS   65535  Device vendor specific log
0xc0       GPL,SL  VS       1  Device vendor specific log
0xc1       GPL,SL  VS      16  Device vendor specific log
0xc2       GPL,SL  VS     240  Device vendor specific log
0xc3       GPL,SL  VS       8  Device vendor specific log
0xc4       GPL,SL  VS      24  Device vendor specific log
0xc9       GPL,SL  VS       1  Device vendor specific log
0xca       GPL,SL  VS      16  Device vendor specific log
0xd3       GPL     VS    1920  Device vendor specific log
0xdf       GPL,SL  VS       1  Device vendor specific log
0xe0       GPL,SL  R/W      1  SCT Command/Status
0xe1       GPL,SL  R/W      1  SCT Data Transfer

SMART Extended Comprehensive Error Log Version: 1 (5 sectors)
No Errors Logged

SMART Extended Self-test Log Version: 1 (1 sectors)
Num  Test_Description    Status                  Remaining  LifeTime(hours)  LBA_of_first_error
# 1  Short offline       Completed without error       00%        98         -

SMART Selective self-test log data structure revision number 1
 SPAN  MIN_LBA  MAX_LBA  CURRENT_TEST_STATUS
    1        0        0  Not_testing
    2        0        0  Not_testing
    3        0        0  Not_testing
    4        0        0  Not_testing
    5        0        0  Not_testing
Selective self-test flags (0x0):
  After scanning selected spans, do NOT read-scan remainder of disk.
If Selective self-test is pending on power-up, resume after 0 minute delay.

SCT Status Version:                  3
SCT Version (vendor specific):       522 (0x020a)
SCT Support Level:                   1
Device State:                        Active (0)
Current Temperature:                    29 Celsius
Power Cycle Min/Max Temperature:     19/31 Celsius
Lifetime    Min/Max Temperature:     18/51 Celsius
Under/Over Temperature Limit Count:   0/19
Vendor specific:
00 00 00 00 00 00 00 00 00 00 02 00 00 00 00 00
00 00 00 00 00 00 00 00 00 00 00 00 00 00 00 00

SCT Temperature History Version:     2
Temperature Sampling Period:         1 minute
Temperature Logging Interval:        11 minutes
Min/Max recommended Temperature:      0/ 0 Celsius
Min/Max Temperature Limit:            0/ 0 Celsius
Temperature History Size (Index):    128 (61)

Index    Estimated Time   Temperature Celsius
  62    2018-02-28 12:34    29  **********
  63    2018-02-28 12:45    30  ***********
 ...    ..(  3 skipped).    ..  ***********
  67    2018-02-28 13:29    30  ***********
  68    2018-02-28 13:40    29  **********
 ...    ..( 10 skipped).    ..  **********
  79    2018-02-28 15:41    29  **********
  80    2018-02-28 15:52    30  ***********
  81    2018-02-28 16:03    30  ***********
  82    2018-02-28 16:14     ?  -
  83    2018-02-28 16:25    19  -
  84    2018-02-28 16:36    24  *****
  85    2018-02-28 16:47    26  *******
  86    2018-02-28 16:58    27  ********
 ...    ..(  7 skipped).    ..  ********
  94    2018-02-28 18:26    27  ********
  95    2018-02-28 18:37    28  *********
 ...    ..(  4 skipped).    ..  *********
 100    2018-02-28 19:32    28  *********
 101    2018-02-28 19:43    29  **********
 102    2018-02-28 19:54    29  **********
 103    2018-02-28 20:05    30  ***********
 104    2018-02-28 20:16    29  **********
 105    2018-02-28 20:27    29  **********
 106    2018-02-28 20:38    29  **********
 107    2018-02-28 20:49    28  *********
 108    2018-02-28 21:00    28  *********
 109    2018-02-28 21:11    28  *********
 110    2018-02-28 21:22    29  **********
 ...    ..(  3 skipped).    ..  **********
 114    2018-02-28 22:06    29  **********
 115    2018-02-28 22:17    30  ***********
 116    2018-02-28 22:28    29  **********
 117    2018-02-28 22:39    29  **********
 118    2018-02-28 22:50    29  **********
 119    2018-02-28 23:01    30  ***********
 120    2018-02-28 23:12    29  **********
 121    2018-02-28 23:23    29  **********
 122    2018-02-28 23:34    30  ***********
 123    2018-02-28 23:45    33  **************
 124    2018-02-28 23:56     ?  -
 125    2018-03-01 00:07    19  -
 126    2018-03-01 00:18    24  *****
 127    2018-03-01 00:29    26  *******
   0    2018-03-01 00:40    27  ********
   1    2018-03-01 00:51    27  ********
   2    2018-03-01 01:02    30  ***********
   3    2018-03-01 01:13    30  ***********
   4    2018-03-01 01:24    32  *************
   5    2018-03-01 01:35    30  ***********
   6    2018-03-01 01:46    29  **********
   7    2018-03-01 01:57    30  ***********
   8    2018-03-01 02:08    31  ************
 ...    ..(  3 skipped).    ..  ************
  12    2018-03-01 02:52    31  ************
  13    2018-03-01 03:03    30  ***********
 ...    ..(  4 skipped).    ..  ***********
  18    2018-03-01 03:58    30  ***********
  19    2018-03-01 04:09    29  **********
  20    2018-03-01 04:20    29  **********
  21    2018-03-01 04:31    30  ***********
  22    2018-03-01 04:42    30  ***********
  23    2018-03-01 04:53    29  **********
  24    2018-03-01 05:04    29  **********
  25    2018-03-01 05:15    30  ***********
  26    2018-03-01 05:26    29  **********
  27    2018-03-01 05:37    30  ***********
  28    2018-03-01 05:48    30  ***********
  29    2018-03-01 05:59    30  ***********
  30    2018-03-01 06:10    29  **********
  31    2018-03-01 06:21    30  ***********
  32    2018-03-01 06:32     ?  -
  33    2018-03-01 06:43    29  **********
  34    2018-03-01 06:54    31  ************
  35    2018-03-01 07:05    31  ************
  36    2018-03-01 07:16    31  ************
  37    2018-03-01 07:27    30  ***********
  38    2018-03-01 07:38    29  **********
  39    2018-03-01 07:49    29  **********
  40    2018-03-01 08:00    30  ***********
  41    2018-03-01 08:11    30  ***********
  42    2018-03-01 08:22     ?  -
  43    2018-03-01 08:33    19  -
  44    2018-03-01 08:44    24  *****
  45    2018-03-01 08:55    27  ********
  46    2018-03-01 09:06    27  ********
  47    2018-03-01 09:17    28  *********
 ...    ..(  2 skipped).    ..  *********
  50    2018-03-01 09:50    28  *********
  51    2018-03-01 10:01    27  ********
  52    2018-03-01 10:12    28  *********
  53    2018-03-01 10:23    28  *********
  54    2018-03-01 10:34    29  **********
 ...    ..(  5 skipped).    ..  **********
  60    2018-03-01 11:40    29  **********
  61    2018-03-01 11:51    30  ***********

SCT Error Recovery Control command not supported

Device Statistics (GP Log 0x04)
Page  Offset Size        Value Flags Description
0x01  =====  =               =  ===  == General Statistics (rev 1) ==
0x01  0x008  4              36  ---  Lifetime Power-On Resets
0x01  0x010  4              98  ---  Power-on Hours
0x01  0x018  6       345425630  ---  Logical Sectors Written
0x01  0x020  6         1518895  ---  Number of Write Commands
0x01  0x028  6       272235415  ---  Logical Sectors Read
0x01  0x030  6         1744496  ---  Number of Read Commands
0x01  0x038  6               -  ---  Date and Time TimeStamp
0x03  =====  =               =  ===  == Rotating Media Statistics (rev 1) ==
0x03  0x008  4              97  ---  Spindle Motor Power-on Hours
0x03  0x010  4               1  ---  Head Flying Hours
0x03  0x018  4            7185  ---  Head Load Events
0x03  0x020  4               0  ---  Number of Reallocated Logical Sectors
0x03  0x028  4               0  ---  Read Recovery Attempts
0x03  0x030  4               0  ---  Number of Mechanical Start Failures
0x03  0x038  4               0  ---  Number of Realloc. Candidate Logical Sectors
0x04  =====  =               =  ===  == General Errors Statistics (rev 1) ==
0x04  0x008  4               0  ---  Number of Reported Uncorrectable Errors
0x04  0x010  4               0  ---  Resets Between Cmd Acceptance and Completion
                                |||_ C monitored condition met
                                ||__ D supports DSN
                                |___ N normalized value

Pending Defects log (GP Log 0x0c) not supported

SATA Phy Event Counters (GP Log 0x11)
ID      Size     Value  Description
0x000a  2            3  Device-to-host register FISes sent due to a COMRESET
0x0001  2            0  Command failed due to ICRC error
0x0003  2            0  R_ERR response for device-to-host data FIS
0x0004  2            0  R_ERR response for host-to-device data FIS
0x0006  2            0  R_ERR response for device-to-host non-data FIS
0x0007  2            0  R_ERR response for host-to-device non-data FIS

