smartctl 7.1 2019-12-30 r5022 [x86_64-linux-5.3.0-40-generic] (local build)
Copyright (C) 2002-19, Bruce Allen, Christian Franke, www.smartmontools.org

=== START OF INFORMATION SECTION ===
Device Model:     KINGSTON SKC600256G
Serial Number:    50026B72824E946B
LU WWN Device Id: 5 0026b7 2824e946b
Firmware Version: S4500105
User Capacity:    256,060,514,304 bytes [256 GB]
Sector Sizes:     512 bytes logical, 4096 bytes physical
Rotation Rate:    Solid State Device
Form Factor:      2.5 inches
Device is:        Not in smartctl database [for details use: -P showall]
ATA Version is:   ACS-3 T13/2161-D revision 5
SATA Version is:  SATA 3.3, 6.0 Gb/s (current: 6.0 Gb/s)
Local Time is:    Thu Mar  5 10:04:03 2020 PST
SMART support is: Available - device has SMART capability.
SMART support is: Enabled
AAM feature is:   Unavailable
APM level is:     254 (maximum performance)
Rd look-ahead is: Enabled
Write cache is:   Enabled
DSN feature is:   Unavailable
ATA Security is:  Disabled, NOT FROZEN [SEC1]
Wt Cache Reorder: Unknown

=== START OF READ SMART DATA SECTION ===
SMART overall-health self-assessment test result: PASSED

General SMART Values:
Offline data collection status:  (0x82)	Offline data collection activity
					was completed without error.
					Auto Offline Data Collection: Enabled.
Self-test execution status:      (   0)	The previous self-test routine completed
					without error or no self-test has ever 
					been run.
Total time to complete Offline 
data collection: 		(    0) seconds.
Offline data collection
capabilities: 			 (0x7b) SMART execute Offline immediate.
					Auto Offline data collection on/off support.
					Suspend Offline collection upon new
					command.
					Offline surface scan supported.
					Self-test supported.
					Conveyance Self-test supported.
					Selective Self-test supported.
SMART capabilities:            (0x0002)	Does not save SMART data before
					entering power-saving mode.
					Supports SMART auto save timer.
Error logging capability:        (0x01)	Error logging supported.
					General Purpose Logging supported.
Short self-test routine 
recommended polling time: 	 (   2) minutes.
Extended self-test routine
recommended polling time: 	 (  30) minutes.
Conveyance self-test routine
recommended polling time: 	 (   2) minutes.
SCT capabilities: 	       (0x0031)	SCT Status supported.
					SCT Feature Control supported.
					SCT Data Table supported.

SMART Attributes Data Structure revision number: 16
Vendor Specific SMART Attributes with Thresholds:
ID# ATTRIBUTE_NAME          FLAGS    VALUE WORST THRESH FAIL RAW_VALUE
  1 Raw_Read_Error_Rate     ------   100   100   000    -    0
  5 Reallocated_Sector_Ct   ------   100   100   000    -    0
  9 Power_On_Hours          ------   100   100   000    -    89
 12 Power_Cycle_Count       ------   100   100   000    -    333
148 Unknown_Attribute       ------   100   100   000    -    242
149 Unknown_Attribute       ------   100   100   000    -    33
150 Unknown_Attribute       ------   100   100   000    -    21
151 Unknown_Attribute       ------   100   100   000    -    26
159 Unknown_Attribute       ------   100   100   000    -    0
160 Unknown_Attribute       ------   100   100   000    -    0
161 Unknown_Attribute       ------   100   100   000    -    11
164 Unknown_Attribute       ------   100   100   000    -    8435
165 Unknown_Attribute       ------   100   100   000    -    49
166 Unknown_Attribute       ------   100   100   000    -    32
167 Unknown_Attribute       ------   100   100   000    -    39
169 Unknown_Attribute       ------   099   099   000    -    99
177 Wear_Leveling_Count     ------   100   100   050    -    0
181 Program_Fail_Cnt_Total  ------   100   100   000    -    0
182 Erase_Fail_Count_Total  ------   100   100   000    -    0
192 Power-Off_Retract_Count ------   100   100   000    -    64
194 Temperature_Celsius     ------   026   054   000    -    26
195 Hardware_ECC_Recovered  ------   100   100   000    -    0
196 Reallocated_Event_Count ------   100   100   016    -    0
199 UDMA_CRC_Error_Count    ------   100   100   050    -    0
231 Temperature_Celsius     ------   099   099   000    -    99
232 Available_Reservd_Space ------   100   100   000    -    100
241 Total_LBAs_Written      ------   100   100   000    -    111947
242 Total_LBAs_Read         ------   100   100   000    -    50119
245 Unknown_Attribute       ------   100   100   000    -    341617
                            ||||||_ K auto-keep
                            |||||__ C event count
                            ||||___ R error rate
                            |||____ S speed/performance
                            ||_____ O updated online
                            |______ P prefailure warning

General Purpose Log Directory Version 1
SMART           Log Directory Version 1 [multi-sector log support]
Address    Access  R/W   Size  Description
0x00       GPL,SL  R/O      1  Log Directory
0x01           SL  R/O      1  Summary SMART error log
0x02           SL  R/O      1  Comprehensive SMART error log
0x03       GPL     R/O      1  Ext. Comprehensive SMART error log
0x04       GPL,SL  R/O      8  Device Statistics log
0x06           SL  R/O      1  SMART self-test log
0x07       GPL     R/O      1  Extended self-test log
0x09           SL  R/W      1  Selective self-test log
0x10       GPL     R/O      1  NCQ Command Error log
0x11       GPL     R/O      1  SATA Phy Event Counters log
0x24       GPL     R/O     88  Current Device Internal Status Data log
0x25       GPL     R/O    128  Saved Device Internal Status Data log
0x30       GPL,SL  R/O      9  IDENTIFY DEVICE data log
0x80-0x9f  GPL,SL  R/W     16  Host vendor specific log
0xd1       GPL,SL  VS     128  Device vendor specific log
0xd2       GPL,SL  VS       8  Device vendor specific log
0xe0       GPL,SL  R/W      1  SCT Command/Status
0xe1       GPL,SL  R/W      1  SCT Data Transfer

SMART Extended Comprehensive Error Log Version: 1 (1 sectors)
No Errors Logged

SMART Extended Self-test Log Version: 1 (1 sectors)
Num  Test_Description    Status                  Remaining  LifeTime(hours)  LBA_of_first_error
# 1  Short offline       Completed without error       00%        89         -

SMART Selective self-test log data structure revision number 1
 SPAN  MIN_LBA  MAX_LBA  CURRENT_TEST_STATUS
    1        0        0  Not_testing
    2        0        0  Not_testing
    3        0        0  Not_testing
    4        0        0  Not_testing
    5        0        0  Not_testing
Selective self-test flags (0x0):
  After scanning selected spans, do NOT read-scan remainder of disk.
If Selective self-test is pending on power-up, resume after 0 minute delay.

SCT Status Version:                  3
SCT Version (vendor specific):       1 (0x0001)
Device State:                        Active (0)
Current Temperature:                    26 Celsius
Power Cycle Min/Max Temperature:     20/27 Celsius
Lifetime    Min/Max Temperature:     20/54 Celsius
Under/Over Temperature Limit Count:   0/0

SCT Temperature History Version:     2
Temperature Sampling Period:         1 minute
Temperature Logging Interval:        1 minute
Min/Max recommended Temperature:      0/100 Celsius
Min/Max Temperature Limit:            0/100 Celsius
Temperature History Size (Index):    128 (108)

Index    Estimated Time   Temperature Celsius
 109    2020-03-05 07:57    33  **************
 110    2020-03-05 07:58    33  **************
 111    2020-03-05 07:59    32  *************
 112    2020-03-05 08:00    35  ****************
 113    2020-03-05 08:01    42  ***********************
 114    2020-03-05 08:02    38  *******************
 115    2020-03-05 08:03    41  **********************
 116    2020-03-05 08:04    38  *******************
 117    2020-03-05 08:05    37  ******************
 118    2020-03-05 08:06    38  *******************
 119    2020-03-05 08:07    37  ******************
 120    2020-03-05 08:08    38  *******************
 121    2020-03-05 08:09    39  ********************
 122    2020-03-05 08:10    38  *******************
 123    2020-03-05 08:11    38  *******************
 124    2020-03-05 08:12    41  **********************
 125    2020-03-05 08:13    42  ***********************
 126    2020-03-05 08:14    43  ************************
 ...    ..(  4 skipped).    ..  ************************
   3    2020-03-05 08:19    43  ************************
   4    2020-03-05 08:20    44  *************************
 ...    ..( 11 skipped).    ..  *************************
  16    2020-03-05 08:32    44  *************************
  17    2020-03-05 08:33    45  **************************
  18    2020-03-05 08:34    45  **************************
  19    2020-03-05 08:35    44  *************************
  20    2020-03-05 08:36    44  *************************
  21    2020-03-05 08:37    45  **************************
  22    2020-03-05 08:38    44  *************************
  23    2020-03-05 08:39    45  **************************
 ...    ..(  6 skipped).    ..  **************************
  30    2020-03-05 08:46    45  **************************
  31    2020-03-05 08:47    47  ****************************
  32    2020-03-05 08:48    47  ****************************
  33    2020-03-05 08:49    39  ********************
  34    2020-03-05 08:50    41  **********************
  35    2020-03-05 08:51     ?  -
  36    2020-03-05 08:52     ?  -
  37    2020-03-05 08:53    38  *******************
  38    2020-03-05 08:54     ?  -
  39    2020-03-05 08:55     ?  -
  40    2020-03-05 08:56    36  *****************
  41    2020-03-05 08:57     ?  -
  42    2020-03-05 08:58     ?  -
  43    2020-03-05 08:59    37  ******************
  44    2020-03-05 09:00     ?  -
  45    2020-03-05 09:01     ?  -
  46    2020-03-05 09:02    36  *****************
  47    2020-03-05 09:03     ?  -
  48    2020-03-05 09:04     ?  -
  49    2020-03-05 09:05    38  *******************
  50    2020-03-05 09:06     ?  -
  51    2020-03-05 09:07     ?  -
  52    2020-03-05 09:08    36  *****************
  53    2020-03-05 09:09     ?  -
  54    2020-03-05 09:10     ?  -
  55    2020-03-05 09:11    37  ******************
  56    2020-03-05 09:12     ?  -
  57    2020-03-05 09:13     ?  -
  58    2020-03-05 09:14    38  *******************
  59    2020-03-05 09:15     ?  -
  60    2020-03-05 09:16     ?  -
  61    2020-03-05 09:17    37  ******************
  62    2020-03-05 09:18     ?  -
  63    2020-03-05 09:19     ?  -
  64    2020-03-05 09:20    37  ******************
  65    2020-03-05 09:21    32  *************
  66    2020-03-05 09:22    31  ************
 ...    ..(  3 skipped).    ..  ************
  70    2020-03-05 09:26    31  ************
  71    2020-03-05 09:27    30  ***********
  72    2020-03-05 09:28    31  ************
  73    2020-03-05 09:29    32  *************
 ...    ..( 10 skipped).    ..  *************
  84    2020-03-05 09:40    32  *************
  85    2020-03-05 09:41    31  ************
  86    2020-03-05 09:42    31  ************
  87    2020-03-05 09:43    31  ************
  88    2020-03-05 09:44    30  ***********
 ...    ..(  6 skipped).    ..  ***********
  95    2020-03-05 09:51    30  ***********
  96    2020-03-05 09:52    31  ************
  97    2020-03-05 09:53    30  ***********
  98    2020-03-05 09:54    32  *************
  99    2020-03-05 09:55    33  **************
 100    2020-03-05 09:56    32  *************
 101    2020-03-05 09:57    32  *************
 102    2020-03-05 09:58    31  ************
 103    2020-03-05 09:59    32  *************
 104    2020-03-05 10:00    31  ************
 105    2020-03-05 10:01    30  ***********
 106    2020-03-05 10:02    31  ************
 107    2020-03-05 10:03     ?  -
 108    2020-03-05 10:04     ?  -

SCT Error Recovery Control command not supported

Device Statistics (GP Log 0x04)
Page  Offset Size        Value Flags Description
0x01  =====  =               =  ===  == General Statistics (rev 1) ==
0x01  0x008  4             333  ---  Lifetime Power-On Resets
0x01  0x010  4              89  ---  Power-on Hours
0x01  0x018  6      3041592294  ---  Logical Sectors Written
0x01  0x020  6        85364626  ---  Number of Write Commands
0x01  0x028  6      3284657829  ---  Logical Sectors Read
0x01  0x030  6        72517476  ---  Number of Read Commands
0x01  0x038  6       322373294  ---  Date and Time TimeStamp
0x04  =====  =               =  ===  == General Errors Statistics (rev 1) ==
0x04  0x008  4               0  ---  Number of Reported Uncorrectable Errors
0x04  0x010  4              64  ---  Resets Between Cmd Acceptance and Completion
0x05  =====  =               =  ===  == Temperature Statistics (rev 1) ==
0x05  0x008  1              26  ---  Current Temperature
0x05  0x010  1              27  ---  Average Short Term Temperature
0x05  0x018  1              25  ---  Average Long Term Temperature
0x05  0x020  1              54  ---  Highest Temperature
0x05  0x028  1              20  ---  Lowest Temperature
0x05  0x030  1              30  ---  Highest Average Short Term Temperature
0x05  0x038  1               0  ---  Lowest Average Short Term Temperature
0x05  0x040  1              29  ---  Highest Average Long Term Temperature
0x05  0x048  1               0  ---  Lowest Average Long Term Temperature
0x05  0x050  4               0  ---  Time in Over-Temperature
0x05  0x058  1              70  ---  Specified Maximum Operating Temperature
0x05  0x060  4               0  ---  Time in Under-Temperature
0x05  0x068  1               0  ---  Specified Minimum Operating Temperature
0x06  =====  =               =  ===  == Transport Statistics (rev 1) ==
0x06  0x008  4            1224  ---  Number of Hardware Resets
0x06  0x010  4             122  ---  Number of ASR Events
0x06  0x018  4               0  ---  Number of Interface CRC Errors
0x07  =====  =               =  ===  == Solid State Device Statistics (rev 1) ==
0x07  0x008  1               1  ---  Percentage Used Endurance Indicator
                                |||_ C monitored condition met
                                ||__ D supports DSN
                                |___ N normalized value

Pending Defects log (GP Log 0x0c) not supported

SATA Phy Event Counters (GP Log 0x11)
ID      Size     Value  Description
0x0001  2            0  Command failed due to ICRC error
0x0002  2            0  R_ERR response for data FIS
0x0003  2            0  R_ERR response for device-to-host data FIS
0x0004  2            0  R_ERR response for host-to-device data FIS
0x0005  2            0  R_ERR response for non-data FIS
0x0006  2            0  R_ERR response for device-to-host non-data FIS
0x0007  2            0  R_ERR response for host-to-device non-data FIS
0x0008  2            0  Device-to-host non-data FIS retries
0x0009  2            0  Transition from drive PhyRdy to drive PhyNRdy
0x000a  2            2  Device-to-host register FISes sent due to a COMRESET
0x000b  2            0  CRC errors within host-to-device FIS
0x000d  2            0  Non-CRC errors within host-to-device FIS
0x000f  2            0  R_ERR response for host-to-device data FIS, CRC
0x0010  2            0  R_ERR response for host-to-device data FIS, non-CRC
0x0012  2            0  R_ERR response for host-to-device non-data FIS, CRC
0x0013  2            0  R_ERR response for host-to-device non-data FIS, non-CRC

