smartctl 7.3 2022-02-28 r5338 [x86_64-linux-5.17.1-arch1-1] (local build)
Copyright (C) 2002-22, Bruce Allen, Christian Franke, www.smartmontools.org

=== START OF INFORMATION SECTION ===
Device Model:     WDC WD40EFZX-68AWUN0
Serial Number:    WD-WXB2D714HNC8
LU WWN Device Id: 5 0014ee 269cc2bf2
Firmware Version: 81.00B81
User Capacity:    4,000,787,030,016 bytes [4.00 TB]
Sector Sizes:     512 bytes logical, 4096 bytes physical
Rotation Rate:    5400 rpm
Form Factor:      3.5 inches
Device is:        Not in smartctl database 7.3/5319
ATA Version is:   ACS-3 T13/2161-D revision 5
SATA Version is:  SATA 3.1, 6.0 Gb/s (current: 6.0 Gb/s)
Local Time is:    Mon Apr  4 00:46:30 2022 CEST
SMART support is: Available - device has SMART capability.
SMART support is: Enabled
AAM feature is:   Unavailable
APM feature is:   Unavailable
Rd look-ahead is: Enabled
Write cache is:   Enabled
DSN feature is:   Unavailable
ATA Security is:  Disabled, frozen [SEC2]
Wt Cache Reorder: Enabled

=== START OF READ SMART DATA SECTION ===
SMART overall-health self-assessment test result: PASSED

General SMART Values:
Offline data collection status:  (0x00)	Offline data collection activity
					was never started.
					Auto Offline Data Collection: Disabled.
Self-test execution status:      (   0)	The previous self-test routine completed
					without error or no self-test has ever 
					been run.
Total time to complete Offline 
data collection: 		(41640) seconds.
Offline data collection
capabilities: 			 (0x11) SMART execute Offline immediate.
					No Auto Offline data collection support.
					Suspend Offline collection upon new
					command.
					No Offline surface scan supported.
					Self-test supported.
					No Conveyance Self-test supported.
					No Selective Self-test supported.
SMART capabilities:            (0x0003)	Saves SMART data before entering
					power-saving mode.
					Supports SMART auto save timer.
Error logging capability:        (0x01)	Error logging supported.
					General Purpose Logging supported.
Short self-test routine 
recommended polling time: 	 (   2) minutes.
Extended self-test routine
recommended polling time: 	 ( 443) minutes.
SCT capabilities: 	       (0x303d)	SCT Status supported.
					SCT Error Recovery Control supported.
					SCT Feature Control supported.
					SCT Data Table supported.

SMART Attributes Data Structure revision number: 16
Vendor Specific SMART Attributes with Thresholds:
ID# ATTRIBUTE_NAME          FLAGS    VALUE WORST THRESH FAIL RAW_VALUE
  1 Raw_Read_Error_Rate     POSR-K   200   200   051    -    0
  3 Spin_Up_Time            POS--K   221   220   021    -    3933
  4 Start_Stop_Count        -O--CK   100   100   000    -    31
  5 Reallocated_Sector_Ct   PO--CK   200   200   140    -    0
  7 Seek_Error_Rate         -OSR-K   200   200   000    -    0
  9 Power_On_Hours          -O--CK   096   096   000    -    2927
 10 Spin_Retry_Count        -O--CK   100   253   000    -    0
 11 Calibration_Retry_Count -O--CK   100   253   000    -    0
 12 Power_Cycle_Count       -O--CK   100   100   000    -    31
192 Power-Off_Retract_Count -O--CK   200   200   000    -    12
193 Load_Cycle_Count        -O--CK   200   200   000    -    31
194 Temperature_Celsius     -O---K   117   110   000    -    33
196 Reallocated_Event_Count -O--CK   200   200   000    -    0
197 Current_Pending_Sector  -O--CK   200   200   000    -    0
198 Offline_Uncorrectable   ----CK   100   253   000    -    0
199 UDMA_CRC_Error_Count    -O--CK   200   200   000    -    0
200 Multi_Zone_Error_Rate   ---R--   100   253   000    -    0
                            ||||||_ K auto-keep
                            |||||__ C event count
                            ||||___ R error rate
                            |||____ S speed/performance
                            ||_____ O updated online
                            |______ P prefailure warning

General Purpose Log Directory Version 1
SMART           Log Directory Version 1 [multi-sector log support]
Address    Access  R/W   Size  Description
0x00       GPL,SL  R/O      1  Log Directory
0x01           SL  R/O      1  Summary SMART error log
0x02           SL  R/O      5  Comprehensive SMART error log
0x03       GPL     R/O      6  Ext. Comprehensive SMART error log
0x04       GPL,SL  R/O      8  Device Statistics log
0x06           SL  R/O      1  SMART self-test log
0x07       GPL     R/O      1  Extended self-test log
0x09           SL  R/W      1  Selective self-test log
0x10       GPL     R/O      1  NCQ Command Error log
0x11       GPL     R/O      1  SATA Phy Event Counters log
0x30       GPL,SL  R/O      9  IDENTIFY DEVICE data log
0x80-0x9f  GPL,SL  R/W     16  Host vendor specific log
0xa0-0xa7  GPL,SL  VS      16  Device vendor specific log
0xa8-0xb6  GPL,SL  VS       1  Device vendor specific log
0xb7       GPL,SL  VS      78  Device vendor specific log
0xbd       GPL,SL  VS       1  Device vendor specific log
0xc0       GPL,SL  VS       1  Device vendor specific log
0xc1       GPL     VS      93  Device vendor specific log
0xe0       GPL,SL  R/W      1  SCT Command/Status
0xe1       GPL,SL  R/W      1  SCT Data Transfer

SMART Extended Comprehensive Error Log Version: 1 (6 sectors)
No Errors Logged

SMART Extended Self-test Log Version: 1 (1 sectors)
No self-tests have been logged.  [To run self-tests, use: smartctl -t]

Selective Self-tests/Logging not supported

SCT Status Version:                  3
SCT Version (vendor specific):       258 (0x0102)
Device State:                        Active (0)
Current Temperature:                    33 Celsius
Power Cycle Min/Max Temperature:     29/35 Celsius
Lifetime    Min/Max Temperature:     21/40 Celsius
Under/Over Temperature Limit Count:   0/0
Vendor specific:
01 00 00 00 00 00 00 00 00 00 00 00 00 00 00 00
00 00 00 00 00 00 00 00 00 00 00 00 00 00 00 00

SCT Temperature History Version:     2
Temperature Sampling Period:         1 minute
Temperature Logging Interval:        1 minute
Min/Max recommended Temperature:      0/65 Celsius
Min/Max Temperature Limit:           -41/85 Celsius
Temperature History Size (Index):    478 (58)

Index    Estimated Time   Temperature Celsius
  59    2022-04-03 16:49    33  **************
  60    2022-04-03 16:50    33  **************
  61    2022-04-03 16:51    33  **************
  62    2022-04-03 16:52    32  *************
  63    2022-04-03 16:53    33  **************
 ...    ..(  3 skipped).    ..  **************
  67    2022-04-03 16:57    33  **************
  68    2022-04-03 16:58    32  *************
  69    2022-04-03 16:59    33  **************
  70    2022-04-03 17:00    33  **************
  71    2022-04-03 17:01    33  **************
  72    2022-04-03 17:02    32  *************
  73    2022-04-03 17:03    33  **************
 ...    ..( 48 skipped).    ..  **************
 122    2022-04-03 17:52    33  **************
 123    2022-04-03 17:53    32  *************
 124    2022-04-03 17:54    33  **************
 ...    ..( 24 skipped).    ..  **************
 149    2022-04-03 18:19    33  **************
 150    2022-04-03 18:20    32  *************
 151    2022-04-03 18:21    33  **************
 ...    ..(  3 skipped).    ..  **************
 155    2022-04-03 18:25    33  **************
 156    2022-04-03 18:26    32  *************
 157    2022-04-03 18:27    33  **************
 ...    ..( 59 skipped).    ..  **************
 217    2022-04-03 19:27    33  **************
 218    2022-04-03 19:28    32  *************
 219    2022-04-03 19:29    32  *************
 220    2022-04-03 19:30    33  **************
 221    2022-04-03 19:31    32  *************
 222    2022-04-03 19:32    33  **************
 223    2022-04-03 19:33    32  *************
 ...    ..(  3 skipped).    ..  *************
 227    2022-04-03 19:37    32  *************
 228    2022-04-03 19:38    33  **************
 229    2022-04-03 19:39    32  *************
 230    2022-04-03 19:40    32  *************
 231    2022-04-03 19:41    33  **************
 232    2022-04-03 19:42    33  **************
 233    2022-04-03 19:43    32  *************
 234    2022-04-03 19:44    32  *************
 235    2022-04-03 19:45    32  *************
 236    2022-04-03 19:46    33  **************
 237    2022-04-03 19:47    32  *************
 238    2022-04-03 19:48    32  *************
 239    2022-04-03 19:49    32  *************
 240    2022-04-03 19:50    33  **************
 241    2022-04-03 19:51    33  **************
 242    2022-04-03 19:52    32  *************
 243    2022-04-03 19:53    32  *************
 244    2022-04-03 19:54    32  *************
 245    2022-04-03 19:55    33  **************
 246    2022-04-03 19:56    33  **************
 247    2022-04-03 19:57    32  *************
 ...    ..(  5 skipped).    ..  *************
 253    2022-04-03 20:03    32  *************
 254    2022-04-03 20:04    33  **************
 255    2022-04-03 20:05    32  *************
 256    2022-04-03 20:06    32  *************
 257    2022-04-03 20:07    33  **************
 258    2022-04-03 20:08    32  *************
 ...    ..( 78 skipped).    ..  *************
 337    2022-04-03 21:27    32  *************
 338    2022-04-03 21:28    33  **************
 339    2022-04-03 21:29    33  **************
 340    2022-04-03 21:30    32  *************
 341    2022-04-03 21:31    33  **************
 342    2022-04-03 21:32    33  **************
 343    2022-04-03 21:33    32  *************
 344    2022-04-03 21:34    33  **************
 ...    ..( 73 skipped).    ..  **************
 418    2022-04-03 22:48    33  **************
 419    2022-04-03 22:49    32  *************
 420    2022-04-03 22:50    33  **************
 ...    ..( 66 skipped).    ..  **************
   9    2022-04-03 23:57    33  **************
  10    2022-04-03 23:58    32  *************
  11    2022-04-03 23:59    32  *************
  12    2022-04-04 00:00    33  **************
 ...    ..( 26 skipped).    ..  **************
  39    2022-04-04 00:27    33  **************
  40    2022-04-04 00:28    32  *************
  41    2022-04-04 00:29    32  *************
  42    2022-04-04 00:30    33  **************
 ...    ..(  9 skipped).    ..  **************
  52    2022-04-04 00:40    33  **************
  53    2022-04-04 00:41    32  *************
  54    2022-04-04 00:42    33  **************
 ...    ..(  3 skipped).    ..  **************
  58    2022-04-04 00:46    33  **************

SCT Error Recovery Control:
           Read:     70 (7.0 seconds)
          Write:     70 (7.0 seconds)

Device Statistics (GP Log 0x04)
Page  Offset Size        Value Flags Description
0x01  =====  =               =  ===  == General Statistics (rev 1) ==
0x01  0x008  4              31  ---  Lifetime Power-On Resets
0x01  0x010  4            2927  ---  Power-on Hours
0x01  0x018  6     30681598557  ---  Logical Sectors Written
0x01  0x020  6       148880546  ---  Number of Write Commands
0x01  0x028  6      5548494134  ---  Logical Sectors Read
0x01  0x030  6        10700790  ---  Number of Read Commands
0x01  0x038  6      1947265408  ---  Date and Time TimeStamp
0x03  =====  =               =  ===  == Rotating Media Statistics (rev 1) ==
0x03  0x008  4            2914  ---  Spindle Motor Power-on Hours
0x03  0x010  4            2906  ---  Head Flying Hours
0x03  0x018  4              44  ---  Head Load Events
0x03  0x020  4               0  ---  Number of Reallocated Logical Sectors
0x03  0x028  4               0  ---  Read Recovery Attempts
0x03  0x030  4               0  ---  Number of Mechanical Start Failures
0x03  0x038  4               0  ---  Number of Realloc. Candidate Logical Sectors
0x03  0x040  4              12  ---  Number of High Priority Unload Events
0x04  =====  =               =  ===  == General Errors Statistics (rev 1) ==
0x04  0x008  4               0  ---  Number of Reported Uncorrectable Errors
0x04  0x010  4               0  ---  Resets Between Cmd Acceptance and Completion
0x05  =====  =               =  ===  == Temperature Statistics (rev 1) ==
0x05  0x008  1              33  ---  Current Temperature
0x05  0x010  1              32  ---  Average Short Term Temperature
0x05  0x018  1              32  ---  Average Long Term Temperature
0x05  0x020  1              40  ---  Highest Temperature
0x05  0x028  1              25  ---  Lowest Temperature
0x05  0x030  1              37  ---  Highest Average Short Term Temperature
0x05  0x038  1              30  ---  Lowest Average Short Term Temperature
0x05  0x040  1              35  ---  Highest Average Long Term Temperature
0x05  0x048  1              32  ---  Lowest Average Long Term Temperature
0x05  0x050  4               0  ---  Time in Over-Temperature
0x05  0x058  1              65  ---  Specified Maximum Operating Temperature
0x05  0x060  4               0  ---  Time in Under-Temperature
0x05  0x068  1               0  ---  Specified Minimum Operating Temperature
0x06  =====  =               =  ===  == Transport Statistics (rev 1) ==
0x06  0x008  4             459  ---  Number of Hardware Resets
0x06  0x010  4             240  ---  Number of ASR Events
0x06  0x018  4               0  ---  Number of Interface CRC Errors
                                |||_ C monitored condition met
                                ||__ D supports DSN
                                |___ N normalized value

Pending Defects log (GP Log 0x0c) not supported

SATA Phy Event Counters (GP Log 0x11)
ID      Size     Value  Description
0x0001  2            0  Command failed due to ICRC error
0x0002  2            0  R_ERR response for data FIS
0x0003  2            0  R_ERR response for device-to-host data FIS
0x0004  2            0  R_ERR response for host-to-device data FIS
0x0005  2            0  R_ERR response for non-data FIS
0x0006  2            0  R_ERR response for device-to-host non-data FIS
0x0007  2            0  R_ERR response for host-to-device non-data FIS
0x0008  2            0  Device-to-host non-data FIS retries
0x0009  2            8  Transition from drive PhyRdy to drive PhyNRdy
0x000a  2            9  Device-to-host register FISes sent due to a COMRESET
0x000b  2            0  CRC errors within host-to-device FIS
0x000d  2            0  Non-CRC errors within host-to-device FIS
0x000f  2            0  R_ERR response for host-to-device data FIS, CRC
0x0012  2            0  R_ERR response for host-to-device non-data FIS, CRC
0x8000  4      2893483  Vendor specific

