smartctl 7.4 2023-08-01 r5530 [FreeBSD 14.0-RELEASE-p3 amd64] (local build)
Copyright (C) 2002-23, Bruce Allen, Christian Franke, www.smartmontools.org

=== START OF INFORMATION SECTION ===
Model Family:     Seagate IronWolf Pro
Device Model:     ST8000NE001-2M7101
Firmware Version: EN01
User Capacity:    8,001,563,222,016 bytes [8.00 TB]
Sector Sizes:     512 bytes logical, 4096 bytes physical
Rotation Rate:    7200 rpm
Form Factor:      3.5 inches
Device is:        In smartctl database 7.3/5577
ATA Version is:   ACS-4 (minor revision not indicated)
SATA Version is:  SATA 3.3, 6.0 Gb/s (current: 6.0 Gb/s)
Local Time is:    Sun Jan 14 16:57:06 2024 CET
SMART support is: Available - device has SMART capability.
SMART support is: Enabled
AAM feature is:   Unavailable
APM feature is:   Unavailable
Rd look-ahead is: Enabled
Write cache is:   Enabled
DSN feature is:   Disabled
ATA Security is:  Disabled, frozen [SEC2]
Write SCT (Get) Feature Control Command failed: Input/output error
Wt Cache Reorder: Unknown (SCT Feature Control command failed)

=== START OF READ SMART DATA SECTION ===
SMART overall-health self-assessment test result: PASSED

General SMART Values:
Offline data collection status:  (0x82)	Offline data collection activity
					was completed without error.
					Auto Offline Data Collection: Enabled.
Self-test execution status:      (   0)	The previous self-test routine completed
					without error or no self-test has ever 
					been run.
Total time to complete Offline 
data collection: 		(  559) seconds.
Offline data collection
capabilities: 			 (0x7b) SMART execute Offline immediate.
					Auto Offline data collection on/off support.
					Suspend Offline collection upon new
					command.
					Offline surface scan supported.
					Self-test supported.
					Conveyance Self-test supported.
					Selective Self-test supported.
SMART capabilities:            (0x0003)	Saves SMART data before entering
					power-saving mode.
					Supports SMART auto save timer.
Error logging capability:        (0x01)	Error logging supported.
					General Purpose Logging supported.
Short self-test routine 
recommended polling time: 	 (   1) minutes.
Extended self-test routine
recommended polling time: 	 ( 711) minutes.
Conveyance self-test routine
recommended polling time: 	 (   2) minutes.
SCT capabilities: 	       (0x50bd)	SCT Status supported.
					SCT Error Recovery Control supported.
					SCT Feature Control supported.
					SCT Data Table supported.

SMART Attributes Data Structure revision number: 10
Vendor Specific SMART Attributes with Thresholds:
ID# ATTRIBUTE_NAME          FLAGS    VALUE WORST THRESH FAIL RAW_VALUE
  1 Raw_Read_Error_Rate     POSR--   082   064   044    -    160639576
  3 Spin_Up_Time            PO----   086   086   000    -    0
  4 Start_Stop_Count        -O--CK   100   100   020    -    42
  5 Reallocated_Sector_Ct   PO--CK   100   100   010    -    0
  7 Seek_Error_Rate         POSR--   072   060   045    -    16645041
  9 Power_On_Hours          -O--CK   100   100   000    -    148
 10 Spin_Retry_Count        PO--C-   100   100   097    -    0
 12 Power_Cycle_Count       -O--CK   100   100   020    -    19
 18 Head_Health             PO-R--   100   100   050    -    0
187 Reported_Uncorrect      -O--CK   100   100   000    -    0
188 Command_Timeout         -O--CK   100   100   000    -    8590065666
190 Airflow_Temperature_Cel -O---K   055   050   040    -    45 (Min/Max 23/47)
192 Power-Off_Retract_Count -O--CK   100   100   000    -    11
193 Load_Cycle_Count        -O--CK   100   100   000    -    115
194 Temperature_Celsius     -O---K   045   050   000    -    45 (0 20 0 0 0)
195 Hardware_ECC_Recovered  -O-RC-   082   064   000    -    160639576
197 Current_Pending_Sector  -O--C-   100   100   000    -    0
198 Offline_Uncorrectable   ----C-   100   100   000    -    0
199 UDMA_CRC_Error_Count    -OSRCK   200   200   000    -    0
240 Head_Flying_Hours       ------   100   253   000    -    106h+35m+13.525s
241 Total_LBAs_Written      ------   100   253   000    -    21314261376
242 Total_LBAs_Read         ------   100   253   000    -    3755518853
                            ||||||_ K auto-keep
                            |||||__ C event count
                            ||||___ R error rate
                            |||____ S speed/performance
                            ||_____ O updated online
                            |______ P prefailure warning

General Purpose Log Directory Version 1
SMART           Log Directory Version 1 [multi-sector log support]
Address    Access  R/W   Size  Description
0x00       GPL,SL  R/O      1  Log Directory
0x01           SL  R/O      1  Summary SMART error log
0x02           SL  R/O      5  Comprehensive SMART error log
0x03       GPL     R/O      5  Ext. Comprehensive SMART error log
0x04       GPL     R/O    256  Device Statistics log
0x04       SL      R/O      8  Device Statistics log
0x06           SL  R/O      1  SMART self-test log
0x07       GPL     R/O      1  Extended self-test log
0x08       GPL     R/O      2  Power Conditions log
0x09           SL  R/W      1  Selective self-test log
0x0a       GPL     R/W      8  Device Statistics Notification
0x0c       GPL     R/O   2048  Pending Defects log
0x10       GPL     R/O      1  NCQ Command Error log
0x11       GPL     R/O      1  SATA Phy Event Counters log
0x13       GPL     R/O      1  SATA NCQ Send and Receive log
0x15       GPL     R/W      1  Rebuild Assist log
0x21       GPL     R/O      1  Write stream error log
0x22       GPL     R/O      1  Read stream error log
0x24       GPL     R/O    768  Current Device Internal Status Data log
0x2f       GPL     R/O      1  Set Sector Configuration
0x30       GPL,SL  R/O      9  IDENTIFY DEVICE data log
0x80-0x9f  GPL,SL  R/W     16  Host vendor specific log
0xa1       GPL,SL  VS      24  Device vendor specific log
0xa2       GPL     VS   16320  Device vendor specific log
0xa4       GPL,SL  VS     160  Device vendor specific log
0xa6       GPL     VS     192  Device vendor specific log
0xa8-0xa9  GPL,SL  VS     136  Device vendor specific log
0xab       GPL     VS       1  Device vendor specific log
0xad       GPL     VS      16  Device vendor specific log
0xb6       GPL     VS    1920  Device vendor specific log
0xbe-0xbf  GPL     VS   65535  Device vendor specific log
0xc1       GPL,SL  VS       8  Device vendor specific log
0xc3       GPL,SL  VS      32  Device vendor specific log
0xc9       GPL,SL  VS       8  Device vendor specific log
0xca       GPL,SL  VS      16  Device vendor specific log
0xcd       GPL,SL  VS       8  Device vendor specific log
0xd1       GPL     VS     336  Device vendor specific log
0xd2       GPL     VS   10000  Device vendor specific log
0xd4       GPL     VS    2048  Device vendor specific log
0xda       GPL,SL  VS       1  Device vendor specific log
0xe0       GPL,SL  R/W      1  SCT Command/Status
0xe1       GPL,SL  R/W      1  SCT Data Transfer

SMART Extended Comprehensive Error Log Version: 1 (5 sectors)
No Errors Logged

SMART Extended Self-test Log Version: 1 (1 sectors)
Num  Test_Description    Status                  Remaining  LifeTime(hours)  LBA_of_first_error
# 1  Short offline       Completed without error       00%        83         -

SMART Selective self-test log data structure revision number 1
 SPAN  MIN_LBA  MAX_LBA  CURRENT_TEST_STATUS
    1        0        0  Not_testing
    2        0        0  Not_testing
    3        0        0  Not_testing
    4        0        0  Not_testing
    5        0        0  Not_testing
Selective self-test flags (0x0):
  After scanning selected spans, do NOT read-scan remainder of disk.
If Selective self-test is pending on power-up, resume after 0 minute delay.

SCT Status Version:                  3
SCT Version (vendor specific):       522 (0x020a)
Device State:                        Active (0)
Current Temperature:                    45 Celsius
Power Cycle Min/Max Temperature:     23/47 Celsius
Lifetime    Min/Max Temperature:     20/51 Celsius
Under/Over Temperature Limit Count:   0/44
SMART Status:                        0xc24f (PASSED)
Vendor specific:
00 00 00 00 00 00 00 00 00 00 00 00 00 00 00 00
00 00 00 00 01 00 00 00 00 00 00 00 00 00 00 00

SCT Temperature History Version:     2
Temperature Sampling Period:         3 minutes
Temperature Logging Interval:        59 minutes
Min/Max recommended Temperature:     10/40 Celsius
Min/Max Temperature Limit:            5/60 Celsius
Temperature History Size (Index):    128 (45)

Index    Estimated Time   Temperature Celsius
  46    2024-01-09 11:39    22  ***
  47    2024-01-09 12:38     ?  -
  48    2024-01-09 13:37    22  ***
  49    2024-01-09 14:36    45  **************************
  50    2024-01-09 15:35    49  ******************************
 ...    ..(  4 skipped).    ..  ******************************
  55    2024-01-09 20:30    49  ******************************
  56    2024-01-09 21:29    50  *******************************
  57    2024-01-09 22:28    50  *******************************
  58    2024-01-09 23:27    50  *******************************
  59    2024-01-10 00:26    49  ******************************
  60    2024-01-10 01:25    48  *****************************
  61    2024-01-10 02:24    46  ***************************
  62    2024-01-10 03:23    48  *****************************
  63    2024-01-10 04:22    49  ******************************
  64    2024-01-10 05:21    49  ******************************
  65    2024-01-10 06:20    50  *******************************
 ...    ..(  4 skipped).    ..  *******************************
  70    2024-01-10 11:15    50  *******************************
  71    2024-01-10 12:14    49  ******************************
  72    2024-01-10 13:13    50  *******************************
 ...    ..(  4 skipped).    ..  *******************************
  77    2024-01-10 18:08    50  *******************************
  78    2024-01-10 19:07     ?  -
  79    2024-01-10 20:06    22  ***
  80    2024-01-10 21:05    39  ********************
  81    2024-01-10 22:04    47  ****************************
  82    2024-01-10 23:03    39  ********************
  83    2024-01-11 00:02    35  ****************
  84    2024-01-11 01:01    28  *********
  85    2024-01-11 02:00    28  *********
  86    2024-01-11 02:59    28  *********
  87    2024-01-11 03:58    27  ********
  88    2024-01-11 04:57    28  *********
  89    2024-01-11 05:56    27  ********
  90    2024-01-11 06:55    27  ********
  91    2024-01-11 07:54     ?  -
  92    2024-01-11 08:53    21  **
  93    2024-01-11 09:52     ?  -
  94    2024-01-11 10:51    23  ****
  95    2024-01-11 11:50     ?  -
  96    2024-01-11 12:49    22  ***
  97    2024-01-11 13:48    45  **************************
  98    2024-01-11 14:47    48  *****************************
  99    2024-01-11 15:46    49  ******************************
 100    2024-01-11 16:45    49  ******************************
 101    2024-01-11 17:44    49  ******************************
 102    2024-01-11 18:43    48  *****************************
 ...    ..(  6 skipped).    ..  *****************************
 109    2024-01-12 01:36    48  *****************************
 110    2024-01-12 02:35     ?  -
 111    2024-01-12 03:34    20  *
 112    2024-01-12 04:33     ?  -
 113    2024-01-12 05:32    20  *
 114    2024-01-12 06:31    42  ***********************
 115    2024-01-12 07:30    46  ***************************
 116    2024-01-12 08:29     ?  -
 117    2024-01-12 09:28    20  *
 118    2024-01-12 10:27     ?  -
 119    2024-01-12 11:26    23  ****
 120    2024-01-12 12:25    41  **********************
 121    2024-01-12 13:24    47  ****************************
 ...    ..(  4 skipped).    ..  ****************************
 126    2024-01-12 18:19    47  ****************************
 127    2024-01-12 19:18    46  ***************************
   0    2024-01-12 20:17    45  **************************
   1    2024-01-12 21:16    46  ***************************
   2    2024-01-12 22:15    46  ***************************
   3    2024-01-12 23:14    45  **************************
 ...    ..(  4 skipped).    ..  **************************
   8    2024-01-13 04:09    45  **************************
   9    2024-01-13 05:08    44  *************************
  10    2024-01-13 06:07    43  ************************
 ...    ..(  6 skipped).    ..  ************************
  17    2024-01-13 13:00    43  ************************
  18    2024-01-13 13:59    44  *************************
  19    2024-01-13 14:58    45  **************************
  20    2024-01-13 15:57    44  *************************
  21    2024-01-13 16:56    43  ************************
  22    2024-01-13 17:55    41  **********************
  23    2024-01-13 18:54    41  **********************
  24    2024-01-13 19:53    40  *********************
  25    2024-01-13 20:52    41  **********************
  26    2024-01-13 21:51    40  *********************
  27    2024-01-13 22:50    39  ********************
  28    2024-01-13 23:49    43  ************************
  29    2024-01-14 00:48    42  ***********************
  30    2024-01-14 01:47    41  **********************
  31    2024-01-14 02:46    44  *************************
  32    2024-01-14 03:45    41  **********************
  33    2024-01-14 04:44    40  *********************
 ...    ..(  5 skipped).    ..  *********************
  39    2024-01-14 10:38    40  *********************
  40    2024-01-14 11:37    44  *************************
  41    2024-01-14 12:36    45  **************************
 ...    ..(  3 skipped).    ..  **************************
  45    2024-01-14 16:32    45  **************************

SCT Error Recovery Control:
           Read:     70 (7.0 seconds)
          Write:     70 (7.0 seconds)

Device Statistics (GP Log 0x04)
Page  Offset Size        Value Flags Description
0x01  =====  =               =  ===  == General Statistics (rev 1) ==
0x01  0x008  4              19  ---  Lifetime Power-On Resets
0x01  0x010  4             148  ---  Power-on Hours
0x01  0x018  6     21217721988  ---  Logical Sectors Written
0x01  0x020  6        32470151  ---  Number of Write Commands
0x01  0x028  6      3732176169  ---  Logical Sectors Read
0x01  0x030  6       225728956  ---  Number of Read Commands
0x01  0x038  6               -  ---  Date and Time TimeStamp
0x03  =====  =               =  ===  == Rotating Media Statistics (rev 1) ==
0x03  0x008  4             125  ---  Spindle Motor Power-on Hours
0x03  0x010  4             108  ---  Head Flying Hours
0x03  0x018  4             115  ---  Head Load Events
0x03  0x020  4               0  ---  Number of Reallocated Logical Sectors
0x03  0x028  4               0  ---  Read Recovery Attempts
0x03  0x030  4               0  ---  Number of Mechanical Start Failures
0x03  0x038  4               0  ---  Number of Realloc. Candidate Logical Sectors
0x03  0x040  4              11  ---  Number of High Priority Unload Events
0x04  =====  =               =  ===  == General Errors Statistics (rev 1) ==
0x04  0x008  4               0  ---  Number of Reported Uncorrectable Errors
0x04  0x010  4               1  ---  Resets Between Cmd Acceptance and Completion
0x05  =====  =               =  ===  == Temperature Statistics (rev 1) ==
0x05  0x008  1              45  ---  Current Temperature
0x05  0x010  1              42  ---  Average Short Term Temperature
0x05  0x018  1               -  ---  Average Long Term Temperature
0x05  0x020  1              50  ---  Highest Temperature
0x05  0x028  1              26  ---  Lowest Temperature
0x05  0x030  1              48  ---  Highest Average Short Term Temperature
0x05  0x038  1              40  ---  Lowest Average Short Term Temperature
0x05  0x040  1               -  ---  Highest Average Long Term Temperature
0x05  0x048  1               -  ---  Lowest Average Long Term Temperature
0x05  0x050  4               0  ---  Time in Over-Temperature
0x05  0x058  1              60  ---  Specified Maximum Operating Temperature
0x05  0x060  4               0  ---  Time in Under-Temperature
0x05  0x068  1               5  ---  Specified Minimum Operating Temperature
0x06  =====  =               =  ===  == Transport Statistics (rev 1) ==
0x06  0x008  4              62  ---  Number of Hardware Resets
0x06  0x010  4              21  ---  Number of ASR Events
0x06  0x018  4               0  ---  Number of Interface CRC Errors
0xff  =====  =               =  ===  == Vendor Specific Statistics (rev 1) ==
0xff  0x010  7               0  ---  Vendor Specific
0xff  0x018  7               0  ---  Vendor Specific
                                |||_ C monitored condition met
                                ||__ D supports DSN
                                |___ N normalized value

Pending Defects log (GP Log 0x0c)
No Defects Logged

SATA Phy Event Counters (GP Log 0x11)
ID      Size     Value  Description
0x000a  2            6  Device-to-host register FISes sent due to a COMRESET
0x0001  2            0  Command failed due to ICRC error
0x0003  2            0  R_ERR response for device-to-host data FIS
0x0004  2            0  R_ERR response for host-to-device data FIS
0x0006  2            0  R_ERR response for device-to-host non-data FIS
0x0007  2            0  R_ERR response for host-to-device non-data FIS

Seagate FARM log (GP Log 0xa6) supported [try: -l farm]

