smartctl 6.2 2013-07-26 r3841 [x86_64-linux-4.4.0-96-generic] (local build)
Copyright (C) 2002-13, Bruce Allen, Christian Franke, www.smartmontools.org

=== START OF INFORMATION SECTION ===
Device Model:     ADATA SP580
Firmware Version: V3.10
User Capacity:    120,034,123,776 bytes [120 GB]
Sector Size:      512 bytes logical/physical
Rotation Rate:    Solid State Device
Device is:        Not in smartctl database [for details use: -P showall]
ATA Version is:   ACS-3 (unknown minor revision code: 0x011b)
SATA Version is:  SATA >3.1, 6.0 Gb/s (current: 6.0 Gb/s)
Local Time is:    Sat Sep 30 22:47:41 2017 EDT
SMART support is: Available - device has SMART capability.
SMART support is: Enabled
AAM feature is:   Unavailable
APM level is:     254 (maximum performance)
Rd look-ahead is: Enabled
Write cache is:   Enabled
ATA Security is:  Disabled, NOT FROZEN [SEC1]
Wt Cache Reorder: Unavailable

=== START OF READ SMART DATA SECTION ===
SMART overall-health self-assessment test result: PASSED

General SMART Values:
Offline data collection status:  (0x02)	Offline data collection activity
					was completed without error.
					Auto Offline Data Collection: Disabled.
Self-test execution status:      (   0)	The previous self-test routine completed
					without error or no self-test has ever 
					been run.
Total time to complete Offline 
data collection: 		(    0) seconds.
Offline data collection
capabilities: 			 (0x35) SMART execute Offline immediate.
					No Auto Offline data collection support.
					Abort Offline collection upon new
					command.
					No Offline surface scan supported.
					Self-test supported.
					Conveyance Self-test supported.
					No Selective Self-test supported.
SMART capabilities:            (0x0002)	Does not save SMART data before
					entering power-saving mode.
					Supports SMART auto save timer.
Error logging capability:        (0x00)	Error logging NOT supported.
					General Purpose Logging supported.
Short self-test routine 
recommended polling time: 	 (   1) minutes.
Extended self-test routine
recommended polling time: 	 (   1) minutes.
Conveyance self-test routine
recommended polling time: 	 (   1) minutes.

SMART Attributes Data Structure revision number: 5
Vendor Specific SMART Attributes with Thresholds:
ID# ATTRIBUTE_NAME          FLAGS    VALUE WORST THRESH FAIL RAW_VALUE
  5 Reallocated_Sector_Ct   PO--CK   100   100   010    -    0
  9 Power_On_Hours          PO--CK   100   100   010    -    0
 12 Power_Cycle_Count       PO--CK   100   100   010    -    1
161 Unknown_Attribute       PO--CK   100   100   010    -    0
164 Unknown_Attribute       PO--CK   100   100   010    -    0
165 Unknown_Attribute       PO--CK   100   100   010    -    0
166 Unknown_Attribute       PO--CK   100   100   010    -    0
167 Unknown_Attribute       PO--CK   100   100   010    -    0
169 Unknown_Attribute       PO--CK   100   100   010    -    0
176 Erase_Fail_Count_Chip   PO--CK   100   100   010    -    0
177 Wear_Leveling_Count     PO--CK   100   100   010    -    0
178 Used_Rsvd_Blk_Cnt_Chip  PO--CK   100   100   010    -    0
192 Power-Off_Retract_Count PO--CK   100   100   010    -    0
194 Temperature_Celsius     PO--CK   100   100   010    -    43
195 Hardware_ECC_Recovered  PO--CK   100   100   010    -    0
199 UDMA_CRC_Error_Count    PO--CK   100   100   010    -    0
241 Total_LBAs_Written      PO--CK   100   100   010    -    0
242 Total_LBAs_Read         PO--CK   100   100   010    -    69
243 Unknown_Attribute       PO--CK   100   100   010    -    0
244 Unknown_Attribute       PO--CK   100   100   010    -    0
245 Unknown_Attribute       PO--CK   100   100   010    -    0
246 Unknown_Attribute       PO--CK   100   100   010    -    0
250 Read_Error_Retry_Rate   PO--CK   100   100   010    -    0
251 Unknown_Attribute       PO--CK   100   100   010    -    0
252 Unknown_Attribute       PO--CK   100   100   010    -    0
253 Unknown_Attribute       PO--CK   100   100   010    -    0
254 Unknown_SSD_Attribute   PO--CK   100   100   010    -    0
                            ||||||_ K auto-keep
                            |||||__ C event count
                            ||||___ R error rate
                            |||____ S speed/performance
                            ||_____ O updated online
                            |______ P prefailure warning

General Purpose Log Directory Version 1
SMART           Log Directory Version 1 [multi-sector log support]
Address    Access  R/W   Size  Description
0x00       GPL,SL  R/O      1  Log Directory
0x10       GPL,SL  R/O      1  NCQ Command Error log
0x30       GPL,SL  R/O      9  IDENTIFY DEVICE data log
0x80-0x9f  GPL,SL  R/W     16  Host vendor specific log

SMART Extended Comprehensive Error Log (GP Log 0x03) not supported

SMART Error Log not supported

SMART Extended Self-test Log (GP Log 0x07) not supported

SMART Self-test Log not supported

Selective Self-tests/Logging not supported

SCT Commands not supported

Device Statistics (GP Log 0x04) not supported

SATA Phy Event Counters (GP Log 0x11) not supported

