smartctl 6.6 2016-05-31 r4324 [x86_64-linux-4.15.0-76-generic] (local build)
Copyright (C) 2002-16, Bruce Allen, Christian Franke, www.smartmontools.org

=== START OF INFORMATION SECTION ===
Device Model:     IM2S3138E-128GM-B
Serial Number:    2G4720060371
LU WWN Device Id: 5 707c18 1003e2907
Firmware Version: DA002
User Capacity:    128.035.676.160 bytes [128 GB]
Sector Size:      512 bytes logical/physical
Rotation Rate:    Solid State Device
Form Factor:      M.2
Device is:        Not in smartctl database [for details use: -P showall]
ATA Version is:   ACS-2 (minor revision not indicated)
SATA Version is:  SATA 3.1, 6.0 Gb/s (current: 3.0 Gb/s)
Local Time is:    Mon Feb 10 00:31:53 2020 CET
SMART support is: Available - device has SMART capability.
SMART support is: Enabled
AAM feature is:   Unavailable
APM level is:     254 (maximum performance)
Rd look-ahead is: Enabled
Write cache is:   Enabled
ATA Security is:  Disabled, NOT FROZEN [SEC1]
Wt Cache Reorder: Unknown

=== START OF READ SMART DATA SECTION ===
SMART Status not supported: Incomplete response, ATA output registers missing
SMART overall-health self-assessment test result: PASSED
Warning: This result is based on an Attribute check.

General SMART Values:
Offline data collection status:  (0x00)	Offline data collection activity
					was never started.
					Auto Offline Data Collection: Disabled.
Self-test execution status:      (   0)	The previous self-test routine completed
					without error or no self-test has ever 
					been run.
Total time to complete Offline 
data collection: 		(   32) seconds.
Offline data collection
capabilities: 			 (0x5b) SMART execute Offline immediate.
					Auto Offline data collection on/off support.
					Suspend Offline collection upon new
					command.
					Offline surface scan supported.
					Self-test supported.
					No Conveyance Self-test supported.
					Selective Self-test supported.
SMART capabilities:            (0x0003)	Saves SMART data before entering
					power-saving mode.
					Supports SMART auto save timer.
Error logging capability:        (0x01)	Error logging supported.
					General Purpose Logging supported.
Short self-test routine 
recommended polling time: 	 (   1) minutes.
Extended self-test routine
recommended polling time: 	 (   1) minutes.
SCT capabilities: 	       (0x003d)	SCT Status supported.
					SCT Error Recovery Control supported.
					SCT Feature Control supported.
					SCT Data Table supported.

SMART Attributes Data Structure revision number: 16
Vendor Specific SMART Attributes with Thresholds:
ID# ATTRIBUTE_NAME          FLAGS    VALUE WORST THRESH FAIL RAW_VALUE
  5 Reallocated_Sector_Ct   PO--CK   100   100   010    -    5
  9 Power_On_Hours          -O--CK   100   100   001    -    4570
 12 Power_Cycle_Count       -O--CK   100   100   001    -    1612
175 Program_Fail_Count_Chip -O--CK   100   100   001    -    0
176 Erase_Fail_Count_Chip   -O--CK   100   100   001    -    0
177 Wear_Leveling_Count     PO--CK   092   092   005    -    77324484715
178 Used_Rsvd_Blk_Cnt_Chip  PO--CK   100   100   005    -    1
179 Used_Rsvd_Blk_Cnt_Tot   PO--CK   100   100   005    -    4
180 Unused_Rsvd_Blk_Cnt_Tot PO--CK   100   100   010    -    0
181 Program_Fail_Cnt_Total  -O--CK   100   100   001    -    0
182 Erase_Fail_Count_Total  -O--CK   100   100   001    -    0
187 Reported_Uncorrect      -O--CK   100   100   001    -    0
194 Temperature_Celsius     -O--CK   041   039   030    -    59 (Min/Max 27/63)
195 Hardware_ECC_Recovered  -O--CK   100   100   001    -    281474976710655
241 Total_LBAs_Written      -O--CK   100   100   000    -    14574498453
242 Total_LBAs_Read         -O--CK   100   100   000    -    30997378097
                            ||||||_ K auto-keep
                            |||||__ C event count
                            ||||___ R error rate
                            |||____ S speed/performance
                            ||_____ O updated online
                            |______ P prefailure warning

ATA_READ_LOG_EXT (addr=0x00:0x00, page=0, n=1) failed: scsi error unsupported scsi opcode
Read GP Log Directory failed

SMART Log Directory Version 1 [multi-sector log support]
Address    Access  R/W   Size  Description
0x00           SL  R/O      1  Log Directory
0x01           SL  R/O      1  Summary SMART error log
0x02           SL  R/O     51  Comprehensive SMART error log
0x04           SL  R/O      8  Device Statistics log
0x06           SL  R/O      1  SMART self-test log
0x09           SL  R/W      1  Selective self-test log
0x0a           SL  R/W      2  Device Statistics Notification
0x30           SL  R/O      9  IDENTIFY DEVICE data log
0x80-0x9f      SL  R/W     16  Host vendor specific log
0xe0           SL  R/W      1  SCT Command/Status
0xe1           SL  R/W      1  SCT Data Transfer

SMART Extended Comprehensive Error Log (GP Log 0x03) not supported

SMART Error Log Version: 1
No Errors Logged

SMART Extended Self-test Log (GP Log 0x07) not supported

SMART Self-test log structure revision number 1
Num  Test_Description    Status                  Remaining  LifeTime(hours)  LBA_of_first_error
# 1  Short offline       Completed without error       00%      4570         -
# 2  Short offline       Completed without error       00%      4310         -
# 3  Extended offline    Completed without error       00%      4276         -
# 4  Short offline       Completed without error       00%      4264         -
# 5  Short offline       Aborted by host               00%      1728         -
# 6  Short offline       Aborted by host               00%      1728         -
# 7  Short offline       Aborted by host               00%      1728         -
# 8  Short offline       Aborted by host               00%      1728         -
# 9  Short offline       Aborted by host               00%      1727         -
#10  Short offline       Completed without error       00%      1726         -
#11  Short offline       Aborted by host               00%      1726         -
#12  Short offline       Completed without error       00%      1149         -
#13  Short offline       Completed without error       00%       812         -
#14  Short offline       Completed without error       00%       759         -
#15  Short offline       Completed without error       00%       422         -
#16  Extended offline    Completed without error       00%       211         -
#17  Extended offline    Completed without error       00%       210         -
#18  Short offline       Completed without error       00%       210         -
#19  Extended offline    Completed without error       00%       210         -
#20  Extended offline    Completed without error       00%       210         -
#21  Short offline       Completed without error       00%       210         -

SMART Selective self-test log data structure revision number 1
 SPAN  MIN_LBA  MAX_LBA  CURRENT_TEST_STATUS
    1        0        0  Not_testing
    2        0        0  Not_testing
    3        0        0  Not_testing
    4        0        0  Not_testing
    5        0        0  Not_testing
Selective self-test flags (0x0):
  After scanning selected spans, do NOT read-scan remainder of disk.
If Selective self-test is pending on power-up, resume after 0 minute delay.

SCT Status Version:                  3
SCT Version (vendor specific):       1 (0x0001)
SCT Support Level:                   0
Device State:                        Active (0)
Current Temperature:                    59 Celsius
Power Cycle Min/Max Temperature:     45/59 Celsius
Lifetime    Min/Max Temperature:     18/59 Celsius
Under/Over Temperature Limit Count:   0/0

SCT Temperature History Version:     2
Temperature Sampling Period:         1 minute
Temperature Logging Interval:        10 minutes
Min/Max recommended Temperature:      0/70 Celsius
Min/Max Temperature Limit:            0/70 Celsius
Temperature History Size (Index):    478 (66)

Index    Estimated Time   Temperature Celsius
  67    2020-02-06 17:00     ?  -
 ...    ..( 32 skipped).    ..  -
 100    2020-02-06 22:30     ?  -
 101    2020-02-06 22:40    33  **************
 102    2020-02-06 22:50     ?  -
 ...    ..(118 skipped).    ..  -
 221    2020-02-07 18:40     ?  -
 222    2020-02-07 18:50    38  *******************
 223    2020-02-07 19:00    39  ********************
 224    2020-02-07 19:10    39  ********************
 225    2020-02-07 19:20     ?  -
 ...    ..( 82 skipped).    ..  -
 308    2020-02-08 09:10     ?  -
 309    2020-02-08 09:20    40  *********************
 310    2020-02-08 09:30    40  *********************
 311    2020-02-08 09:40     ?  -
 312    2020-02-08 09:50     ?  -
 313    2020-02-08 10:00    38  *******************
 314    2020-02-08 10:10    39  ********************
 315    2020-02-08 10:20    38  *******************
 316    2020-02-08 10:30    41  **********************
 317    2020-02-08 10:40    43  ************************
 318    2020-02-08 10:50    42  ***********************
 319    2020-02-08 11:00    41  **********************
 320    2020-02-08 11:10    41  **********************
 321    2020-02-08 11:20    42  ***********************
 322    2020-02-08 11:30     ?  -
 323    2020-02-08 11:40    43  ************************
 324    2020-02-08 11:50    42  ***********************
 325    2020-02-08 12:00    43  ************************
 326    2020-02-08 12:10    40  *********************
 327    2020-02-08 12:20     ?  -
 328    2020-02-08 12:30    37  ******************
 329    2020-02-08 12:40    39  ********************
 330    2020-02-08 12:50     ?  -
 331    2020-02-08 13:00    49  ******************************
 332    2020-02-08 13:10    37  ******************
 333    2020-02-08 13:20    37  ******************
 334    2020-02-08 13:30    36  *****************
 335    2020-02-08 13:40     ?  -
 336    2020-02-08 13:50    36  *****************
 337    2020-02-08 14:00    40  *********************
 338    2020-02-08 14:10    39  ********************
 339    2020-02-08 14:20     ?  -
 340    2020-02-08 14:30    38  *******************
 341    2020-02-08 14:40    40  *********************
 342    2020-02-08 14:50    42  ***********************
 343    2020-02-08 15:00    41  **********************
 344    2020-02-08 15:10    42  ***********************
 345    2020-02-08 15:20    42  ***********************
 346    2020-02-08 15:30    41  **********************
 347    2020-02-08 15:40     ?  -
 ...    ..( 13 skipped).    ..  -
 361    2020-02-08 18:00     ?  -
 362    2020-02-08 18:10    37  ******************
 363    2020-02-08 18:20    42  ***********************
 364    2020-02-08 18:30    39  ********************
 365    2020-02-08 18:40    36  *****************
 366    2020-02-08 18:50    42  ***********************
 367    2020-02-08 19:00    41  **********************
 368    2020-02-08 19:10    39  ********************
 369    2020-02-08 19:20    37  ******************
 370    2020-02-08 19:30     ?  -
 371    2020-02-08 19:40    31  ************
 372    2020-02-08 19:50    30  ***********
 373    2020-02-08 20:00    29  **********
 ...    ..( 10 skipped).    ..  **********
 384    2020-02-08 21:50    29  **********
 385    2020-02-08 22:00     ?  -
 386    2020-02-08 22:10    29  **********
 387    2020-02-08 22:20    31  ************
 388    2020-02-08 22:30     ?  -
 389    2020-02-08 22:40    32  *************
 390    2020-02-08 22:50    30  ***********
 391    2020-02-08 23:00    28  *********
 392    2020-02-08 23:10    28  *********
 393    2020-02-08 23:20    30  ***********
 394    2020-02-08 23:30    29  **********
 395    2020-02-08 23:40    29  **********
 396    2020-02-08 23:50    34  ***************
 397    2020-02-09 00:00    39  ********************
 398    2020-02-09 00:10    34  ***************
 399    2020-02-09 00:20    31  ************
 400    2020-02-09 00:30    29  **********
 401    2020-02-09 00:40    29  **********
 402    2020-02-09 00:50     ?  -
 403    2020-02-09 01:00    36  *****************
 404    2020-02-09 01:10    37  ******************
 405    2020-02-09 01:20    37  ******************
 406    2020-02-09 01:30    39  ********************
 407    2020-02-09 01:40    33  **************
 408    2020-02-09 01:50    30  ***********
 409    2020-02-09 02:00    34  ***************
 410    2020-02-09 02:10    31  ************
 411    2020-02-09 02:20    32  *************
 412    2020-02-09 02:30    33  **************
 413    2020-02-09 02:40    34  ***************
 414    2020-02-09 02:50    32  *************
 415    2020-02-09 03:00     ?  -
 416    2020-02-09 03:10    30  ***********
 417    2020-02-09 03:20     ?  -
 418    2020-02-09 03:30    32  *************
 419    2020-02-09 03:40     ?  -
 420    2020-02-09 03:50    33  **************
 421    2020-02-09 04:00    30  ***********
 422    2020-02-09 04:10    31  ************
 423    2020-02-09 04:20    31  ************
 424    2020-02-09 04:30    32  *************
 425    2020-02-09 04:40    35  ****************
 426    2020-02-09 04:50     ?  -
 427    2020-02-09 05:00    28  *********
 428    2020-02-09 05:10    39  ********************
 429    2020-02-09 05:20    39  ********************
 430    2020-02-09 05:30    36  *****************
 431    2020-02-09 05:40    35  ****************
 432    2020-02-09 05:50    30  ***********
 433    2020-02-09 06:00    29  **********
 434    2020-02-09 06:10    30  ***********
 435    2020-02-09 06:20    32  *************
 436    2020-02-09 06:30     ?  -
 ...    ..(  3 skipped).    ..  -
 440    2020-02-09 07:10     ?  -
 441    2020-02-09 07:20    34  ***************
 442    2020-02-09 07:30    37  ******************
 443    2020-02-09 07:40    40  *********************
 444    2020-02-09 07:50    38  *******************
 445    2020-02-09 08:00    38  *******************
 446    2020-02-09 08:10     ?  -
 447    2020-02-09 08:20    36  *****************
 448    2020-02-09 08:30    48  *****************************
 449    2020-02-09 08:40    35  ****************
 450    2020-02-09 08:50    36  *****************
 451    2020-02-09 09:00     ?  -
 452    2020-02-09 09:10     ?  -
 453    2020-02-09 09:20    34  ***************
 454    2020-02-09 09:30    36  *****************
 455    2020-02-09 09:40    34  ***************
 456    2020-02-09 09:50    35  ****************
 457    2020-02-09 10:00    36  *****************
 458    2020-02-09 10:10    35  ****************
 459    2020-02-09 10:20    36  *****************
 460    2020-02-09 10:30     ?  -
 461    2020-02-09 10:40     ?  -
 462    2020-02-09 10:50    32  *************
 463    2020-02-09 11:00    35  ****************
 464    2020-02-09 11:10    37  ******************
 465    2020-02-09 11:20    37  ******************
 466    2020-02-09 11:30    35  ****************
 467    2020-02-09 11:40    30  ***********
 468    2020-02-09 11:50    33  **************
 469    2020-02-09 12:00    31  ************
 470    2020-02-09 12:10    36  *****************
 471    2020-02-09 12:20    42  ***********************
 472    2020-02-09 12:30     ?  -
 473    2020-02-09 12:40    36  *****************
 474    2020-02-09 12:50     ?  -
 475    2020-02-09 13:00     ?  -
 476    2020-02-09 13:10     ?  -
 477    2020-02-09 13:20    36  *****************
   0    2020-02-09 13:30     ?  -
 ...    ..( 45 skipped).    ..  -
  46    2020-02-09 21:10     ?  -
  47    2020-02-09 21:20    27  ********
  48    2020-02-09 21:30    28  *********
  49    2020-02-09 21:40     ?  -
 ...    ..(  9 skipped).    ..  -
  59    2020-02-09 23:20     ?  -
  60    2020-02-09 23:30    45  **************************
  61    2020-02-09 23:40    48  *****************************
  62    2020-02-09 23:50    49  ******************************
  63    2020-02-10 00:00    51  ********************************
  64    2020-02-10 00:10    54  ***********************************
  65    2020-02-10 00:20    59  ****************************************
  66    2020-02-10 00:30    59  ****************************************

SMART WRITE LOG does not return COUNT and LBA_LOW register
SCT (Get) Error Recovery Control command failed

Device Statistics (SMART Log 0x04)
Page  Offset Size        Value Flags Description
0x01  =====  =               =  ===  == General Statistics (invalid page 0xff in header) ==
0x04  =====  =               =  ===  == General Errors Statistics (invalid page 0xff in header) ==
0x05  =====  =               =  ===  == Temperature Statistics (invalid page 0xff in header) ==
0x06  =====  =               =  ===  == Transport Statistics (invalid page 0xff in header) ==
0x07  =====  =               =  ===  == Solid State Device Statistics (invalid page 0xff in header) ==
                                |||_ C monitored condition met
                                ||__ D supports DSN
                                |___ N normalized value

ATA_READ_LOG_EXT (addr=0x11:0x00, page=0, n=1) failed: scsi error unsupported scsi opcode
Read SATA Phy Event Counters failed

