smartctl 7.1 2019-12-30 r5022 [x86_64-linux-4.19.0-12-amd64] (local build)
Copyright (C) 2002-19, Bruce Allen, Christian Franke, www.smartmontools.org

=== START OF INFORMATION SECTION ===
Device Model:     ST1500LM003-9YH148
Firmware Version: CC94
User Capacity:    1,500,301,910,016 bytes [1.50 TB]
Sector Sizes:     512 bytes logical, 4096 bytes physical
Rotation Rate:    5400 rpm
Device is:        Not in smartctl database [for details use: -P showall]
ATA Version is:   ATA8-ACS T13/1699-D revision 4
SATA Version is:  SATA 3.0, 3.0 Gb/s (current: 3.0 Gb/s)
Local Time is:    Tue Dec  1 23:53:10 2020 CET
SMART support is: Available - device has SMART capability.
SMART support is: Enabled
AAM level is:     208 (intermediate), recommended: 208
APM feature is:   Unavailable
Rd look-ahead is: Enabled
Write cache is:   Enabled
DSN feature is:   Unavailable
ATA Security is:  Disabled, NOT FROZEN [SEC1]
Wt Cache Reorder: Enabled

=== START OF READ SMART DATA SECTION ===
SMART overall-health self-assessment test result: PASSED

General SMART Values:
Offline data collection status:  (0x82)	Offline data collection activity
					was completed without error.
					Auto Offline Data Collection: Enabled.
Self-test execution status:      ( 249)	Self-test routine in progress...
					90% of test remaining.
Total time to complete Offline 
data collection: 		(  667) seconds.
Offline data collection
capabilities: 			 (0x7b) SMART execute Offline immediate.
					Auto Offline data collection on/off support.
					Suspend Offline collection upon new
					command.
					Offline surface scan supported.
					Self-test supported.
					Conveyance Self-test supported.
					Selective Self-test supported.
SMART capabilities:            (0x0003)	Saves SMART data before entering
					power-saving mode.
					Supports SMART auto save timer.
Error logging capability:        (0x01)	Error logging supported.
					General Purpose Logging supported.
Short self-test routine 
recommended polling time: 	 (   1) minutes.
Extended self-test routine
recommended polling time: 	 ( 383) minutes.
Conveyance self-test routine
recommended polling time: 	 (   2) minutes.
SCT capabilities: 	       (0x103b)	SCT Status supported.
					SCT Error Recovery Control supported.
					SCT Feature Control supported.
					SCT Data Table supported.

SMART Attributes Data Structure revision number: 10
Vendor Specific SMART Attributes with Thresholds:
ID# ATTRIBUTE_NAME          FLAGS    VALUE WORST THRESH FAIL RAW_VALUE
  1 Raw_Read_Error_Rate     POSR--   126   099   006    -    996253560
  3 Spin_Up_Time            PO----   094   088   000    -    0
  4 Start_Stop_Count        -O--CK   100   100   020    -    724
  5 Reallocated_Sector_Ct   PO--CK   100   100   036    -    0
  7 Seek_Error_Rate         POSR--   065   060   030    -    3323730
  9 Power_On_Hours          -O--CK   100   100   000    -    219
 10 Spin_Retry_Count        PO--C-   100   100   097    -    0
 12 Power_Cycle_Count       -O--CK   100   100   020    -    250
183 Runtime_Bad_Block       -O--CK   100   100   000    -    0
184 End-to-End_Error        -O--CK   100   100   099    -    0
187 Reported_Uncorrect      -O--CK   100   100   000    -    0
188 Command_Timeout         -O--CK   100   100   000    -    65537
189 High_Fly_Writes         -O-RCK   100   100   000    -    0
190 Airflow_Temperature_Cel -O---K   058   049   045    -    42 (Min/Max 27/43)
191 G-Sense_Error_Rate      -O--CK   100   100   000    -    0
192 Power-Off_Retract_Count -O--CK   100   100   000    -    53
193 Load_Cycle_Count        -O--CK   100   100   000    -    1092
194 Temperature_Celsius     -O---K   042   051   000    -    42 (0 12 0 0 0)
195 Hardware_ECC_Recovered  -O-RC-   126   099   000    -    996253560
197 Current_Pending_Sector  -O--C-   100   100   000    -    0
198 Offline_Uncorrectable   ----C-   100   100   000    -    0
199 UDMA_CRC_Error_Count    -OSRCK   200   200   000    -    0
240 Head_Flying_Hours       ------   100   253   000    -    360 (49 45 0)
241 Total_LBAs_Written      ------   100   253   000    -    3036319903
242 Total_LBAs_Read         ------   100   253   000    -    2403354824
                            ||||||_ K auto-keep
                            |||||__ C event count
                            ||||___ R error rate
                            |||____ S speed/performance
                            ||_____ O updated online
                            |______ P prefailure warning

General Purpose Log Directory Version 1
SMART           Log Directory Version 1 [multi-sector log support]
Address    Access  R/W   Size  Description
0x00       GPL,SL  R/O      1  Log Directory
0x01           SL  R/O      1  Summary SMART error log
0x02           SL  R/O      5  Comprehensive SMART error log
0x03       GPL     R/O      5  Ext. Comprehensive SMART error log
0x06           SL  R/O      1  SMART self-test log
0x07       GPL     R/O      1  Extended self-test log
0x09           SL  R/W      1  Selective self-test log
0x10       GPL     R/O      1  NCQ Command Error log
0x11       GPL     R/O      1  SATA Phy Event Counters log
0x21       GPL     R/O      1  Write stream error log
0x22       GPL     R/O      1  Read stream error log
0x80-0x9f  GPL,SL  R/W     16  Host vendor specific log
0xa1       GPL,SL  VS      20  Device vendor specific log
0xa2       GPL     VS    4496  Device vendor specific log
0xa8       GPL,SL  VS      20  Device vendor specific log
0xa9       GPL,SL  VS       1  Device vendor specific log
0xab       GPL     VS       1  Device vendor specific log
0xb0       GPL     VS    5067  Device vendor specific log
0xbd       GPL     VS     252  Device vendor specific log
0xbe-0xbf  GPL     VS   65535  Device vendor specific log
0xc0       GPL,SL  VS       1  Device vendor specific log
0xe0       GPL,SL  R/W      1  SCT Command/Status
0xe1       GPL,SL  R/W      1  SCT Data Transfer

SMART Extended Comprehensive Error Log Version: 1 (5 sectors)
No Errors Logged

SMART Extended Self-test Log Version: 1 (1 sectors)
Num  Test_Description    Status                  Remaining  LifeTime(hours)  LBA_of_first_error
# 1  Extended offline    Self-test routine in progress 90%       219         -
# 2  Short offline       Completed without error       00%       214         -

SMART Selective self-test log data structure revision number 1
 SPAN  MIN_LBA  MAX_LBA  CURRENT_TEST_STATUS
    1        0        0  Not_testing
    2        0        0  Not_testing
    3        0        0  Not_testing
    4        0        0  Not_testing
    5        0        0  Not_testing
Selective self-test flags (0x0):
  After scanning selected spans, do NOT read-scan remainder of disk.
If Selective self-test is pending on power-up, resume after 0 minute delay.

SCT Status Version:                  3
SCT Version (vendor specific):       522 (0x020a)
Device State:                        Active (0)
Current Temperature:                    42 Celsius
Power Cycle Min/Max Temperature:     27/43 Celsius
Lifetime    Min/Max Temperature:     12/50 Celsius
Under/Over Temperature Limit Count:   0/0

SCT Temperature History Version:     2
Temperature Sampling Period:         1 minute
Temperature Logging Interval:        59 minutes
Min/Max recommended Temperature:     14/55 Celsius
Min/Max Temperature Limit:           10/60 Celsius
Temperature History Size (Index):    128 (109)

Index    Estimated Time   Temperature Celsius
 110    2020-11-26 18:51     ?  -
 111    2020-11-26 19:50    21  **
 112    2020-11-26 20:49     ?  -
 113    2020-11-26 21:48    16  -
 114    2020-11-26 22:47     ?  -
 115    2020-11-26 23:46    14  -
 116    2020-11-27 00:45     ?  -
 117    2020-11-27 01:44    19  -
 118    2020-11-27 02:43    19  -
 119    2020-11-27 03:42    44  *************************
 120    2020-11-27 04:41     ?  -
 121    2020-11-27 05:40    18  -
 122    2020-11-27 06:39     ?  -
 123    2020-11-27 07:38    29  **********
 124    2020-11-27 08:37     ?  -
 125    2020-11-27 09:36    15  -
 126    2020-11-27 10:35     ?  -
 127    2020-11-27 11:34    28  *********
   0    2020-11-27 12:33     ?  -
   1    2020-11-27 13:32    34  ***************
   2    2020-11-27 14:31     ?  -
   3    2020-11-27 15:30    34  ***************
   4    2020-11-27 16:29     ?  -
   5    2020-11-27 17:28    34  ***************
   6    2020-11-27 18:27    34  ***************
   7    2020-11-27 19:26     ?  -
   8    2020-11-27 20:25    16  -
   9    2020-11-27 21:24     ?  -
  10    2020-11-27 22:23    21  **
  11    2020-11-27 23:22     ?  -
  12    2020-11-28 00:21    21  **
  13    2020-11-28 01:20     ?  -
  14    2020-11-28 02:19    24  *****
  15    2020-11-28 03:18     ?  -
  16    2020-11-28 04:17    24  *****
  17    2020-11-28 05:16     ?  -
  18    2020-11-28 06:15    24  *****
  19    2020-11-28 07:14     ?  -
  20    2020-11-28 08:13    24  *****
  21    2020-11-28 09:12     ?  -
  22    2020-11-28 10:11    21  **
  23    2020-11-28 11:10     ?  -
  24    2020-11-28 12:09    36  *****************
  25    2020-11-28 13:08     ?  -
  26    2020-11-28 14:07    18  -
  27    2020-11-28 15:06     ?  -
  28    2020-11-28 16:05    19  -
  29    2020-11-28 17:04     ?  -
  30    2020-11-28 18:03    18  -
  31    2020-11-28 19:02     ?  -
  32    2020-11-28 20:01    15  -
  33    2020-11-28 21:00     ?  -
  34    2020-11-28 21:59    23  ****
  35    2020-11-28 22:58     ?  -
  36    2020-11-28 23:57    24  *****
  37    2020-11-29 00:56     ?  -
  38    2020-11-29 01:55    25  ******
  39    2020-11-29 02:54     ?  -
  40    2020-11-29 03:53    25  ******
  41    2020-11-29 04:52     ?  -
  42    2020-11-29 05:51    26  *******
  43    2020-11-29 06:50     ?  -
  44    2020-11-29 07:49    27  ********
  45    2020-11-29 08:48     ?  -
  46    2020-11-29 09:47    27  ********
  47    2020-11-29 10:46     ?  -
  48    2020-11-29 11:45    27  ********
  49    2020-11-29 12:44     ?  -
  50    2020-11-29 13:43    28  *********
  51    2020-11-29 14:42     ?  -
  52    2020-11-29 15:41    15  -
  53    2020-11-29 16:40     ?  -
  54    2020-11-29 17:39    16  -
  55    2020-11-29 18:38     ?  -
  56    2020-11-29 19:37    17  -
  57    2020-11-29 20:36     ?  -
  58    2020-11-29 21:35    21  **
  59    2020-11-29 22:34     ?  -
  60    2020-11-29 23:33    21  **
  61    2020-11-30 00:32     ?  -
  62    2020-11-30 01:31    27  ********
  63    2020-11-30 02:30     ?  -
  64    2020-11-30 03:29    29  **********
  65    2020-11-30 04:28     ?  -
  66    2020-11-30 05:27    27  ********
  67    2020-11-30 06:26     ?  -
  68    2020-11-30 07:25    32  *************
  69    2020-11-30 08:24     ?  -
  70    2020-11-30 09:23    26  *******
  71    2020-11-30 10:22     ?  -
  72    2020-11-30 11:21    26  *******
  73    2020-11-30 12:20     ?  -
  74    2020-11-30 13:19    27  ********
  75    2020-11-30 14:18     ?  -
  76    2020-11-30 15:17    15  -
  77    2020-11-30 16:16     ?  -
  78    2020-11-30 17:15    18  -
  79    2020-11-30 18:14    18  -
  80    2020-11-30 19:13     ?  -
  81    2020-11-30 20:12    16  -
  82    2020-11-30 21:11     ?  -
  83    2020-11-30 22:10    21  **
  84    2020-11-30 23:09     ?  -
  85    2020-12-01 00:08    12  -
  86    2020-12-01 01:07     ?  -
  87    2020-12-01 02:06    12  -
  88    2020-12-01 03:05     ?  -
  89    2020-12-01 04:04    14  -
  90    2020-12-01 05:03     ?  -
  91    2020-12-01 06:02    14  -
  92    2020-12-01 07:01     ?  -
  93    2020-12-01 08:00    16  -
  94    2020-12-01 08:59     ?  -
  95    2020-12-01 09:58    14  -
  96    2020-12-01 10:57     ?  -
  97    2020-12-01 11:56    14  -
  98    2020-12-01 12:55     ?  -
  99    2020-12-01 13:54    15  -
 100    2020-12-01 14:53     ?  -
 101    2020-12-01 15:52    20  *
 102    2020-12-01 16:51     ?  -
 103    2020-12-01 17:50    27  ********
 104    2020-12-01 18:49    27  ********
 105    2020-12-01 19:48    42  ***********************
 106    2020-12-01 20:47    43  ************************
 107    2020-12-01 21:46    43  ************************
 108    2020-12-01 22:45    42  ***********************
 109    2020-12-01 23:44    42  ***********************

SCT Error Recovery Control:
           Read: Disabled
          Write: Disabled

Device Statistics (GP/SMART Log 0x04) not supported

Pending Defects log (GP Log 0x0c) not supported

SATA Phy Event Counters (GP Log 0x11)
ID      Size     Value  Description
0x000a  2            1  Device-to-host register FISes sent due to a COMRESET
0x0001  2            0  Command failed due to ICRC error
0x0003  2            0  R_ERR response for device-to-host data FIS
0x0004  2            0  R_ERR response for host-to-device data FIS
0x0006  2            0  R_ERR response for device-to-host non-data FIS
0x0007  2            0  R_ERR response for host-to-device non-data FIS

