root@aa-Z170X-Gaming-3:~/Desktop/smartmontools-7.1-ori# ./smartctl -x /dev/sdb
smartctl 7.1 2019-12-30 r5022 [x86_64-linux-4.15.0-29-generic] (local build)
Copyright (C) 2002-19, Bruce Allen, Christian Franke, www.smartmontools.org

=== START OF INFORMATION SECTION ===
Device Model:     AF2MA31DTDLT240A
Serial Number:    0022221Y001W
LU WWN Device Id: 5 38f601 610556736
Firmware Version: F2M96T0
User Capacity:    240,057,409,536 bytes [240 GB]
Sector Sizes:     512 bytes logical, 4096 bytes physical
Rotation Rate:    Solid State Device
Form Factor:      M.2
Device is:        Not in smartctl database [for details use: -P showall]
ATA Version is:   ACS-3 T13/2161-D revision 5
SATA Version is:  SATA 3.2, 6.0 Gb/s (current: 6.0 Gb/s)
Local Time is:    Sat Oct 29 14:59:58 2022 EDT
SMART support is: Available - device has SMART capability.
SMART support is: Enabled
AAM feature is:   Unavailable
APM feature is:   Unavailable
Rd look-ahead is: Enabled
Write cache is:   Enabled
DSN feature is:   Unavailable
ATA Security is:  Disabled, NOT FROZEN [SEC1]
Wt Cache Reorder: Enabled

=== START OF READ SMART DATA SECTION ===
SMART overall-health self-assessment test result: PASSED

General SMART Values:
Offline data collection status:  (0x00) Offline data collection activity
                                        was never started.
                                        Auto Offline Data Collection: Disabled.
Self-test execution status:      (   0) The previous self-test routine completed
                                        without error or no self-test has ever 
                                        been run.
Total time to complete Offline 
data collection:                (   10) seconds.
Offline data collection
capabilities:                    (0x15) SMART execute Offline immediate.
                                        No Auto Offline data collection support.
                                        Abort Offline collection upon new
                                        command.
                                        No Offline surface scan supported.
                                        Self-test supported.
                                        No Conveyance Self-test supported.
                                        No Selective Self-test supported.
SMART capabilities:            (0x0003) Saves SMART data before entering
                                        power-saving mode.
                                        Supports SMART auto save timer.
Error logging capability:        (0x01) Error logging supported.
                                        General Purpose Logging supported.
Short self-test routine 
recommended polling time:        (   2) minutes.
Extended self-test routine
recommended polling time:        (   8) minutes.
SCT capabilities:              (0x0039) SCT Status supported.
                                        SCT Error Recovery Control supported.
                                        SCT Feature Control supported.
                                        SCT Data Table supported.

SMART Attributes Data Structure revision number: 1
Vendor Specific SMART Attributes with Thresholds:
ID# ATTRIBUTE_NAME          FLAGS    VALUE WORST THRESH FAIL RAW_VALUE
  5 Reallocated_Sector_Ct   -O----   100   100   000    -    0
  9 Power_On_Hours          -O----   100   100   000    -    476
 12 Power_Cycle_Count       -O----   100   100   000    -    12
170 Unknown_Attribute       PO----   100   100   010    -    0
171 Unknown_Attribute       -O----   100   100   000    -    0
172 Unknown_Attribute       -O----   100   100   000    -    0
173 Unknown_Attribute       -O----   100   100   000    -    239
174 Unknown_Attribute       -O----   100   100   000    -    11
175 Program_Fail_Count_Chip PO----   100   100   001    -    0
180 Unused_Rsvd_Blk_Cnt_Tot -O--CK   100   100   000    -    13
181 Program_Fail_Cnt_Total  -O----   075   075   005    -    0
182 Erase_Fail_Count_Total  -O----   000   000   000    -    0
183 Runtime_Bad_Block       -O----   100   100   000    -    0
184 End-to-End_Error        -O----   100   100   000    -    0
187 Reported_Uncorrect      -O----   100   100   000    -    0
188 Command_Timeout         -O----   100   100   000    -    0
194 Temperature_Celsius     -O----   100   100   000    -    36
198 Offline_Uncorrectable   -O----   100   100   000    -    0
199 UDMA_CRC_Error_Count    -O----   100   100   000    -    0
210 Unknown_Attribute       -O----   100   100   000    -    0
233 Media_Wearout_Indicator PO----   097   097   005    -    0
234 Unknown_Attribute       -O----   100   100   000    -    0
241 Total_LBAs_Written      -O----   100   100   000    -    2054402
242 Total_LBAs_Read         -O----   100   100   000    -    137282
243 Unknown_Attribute       -O----   100   100   000    -    2054524
                            ||||||_ K auto-keep
                            |||||__ C event count
                            ||||___ R error rate
                            |||____ S speed/performance
                            ||_____ O updated online
                            |______ P prefailure warning

General Purpose Log Directory Version 1
SMART           Log Directory Version 1 [multi-sector log support]
Address    Access  R/W   Size  Description
0x00       GPL,SL  R/O      1  Log Directory
0x01       GPL,SL  R/O      1  Summary SMART error log
0x02       GPL,SL  R/O      2  Comprehensive SMART error log
0x03       GPL,SL  R/O      1  Ext. Comprehensive SMART error log
0x04       GPL,SL  R/O      6  Device Statistics log
0x06       GPL,SL  R/O      1  SMART self-test log
0x07       GPL,SL  R/O      1  Extended self-test log
0x09       GPL,SL  R/W      1  Selective self-test log
0x10       GPL,SL  R/O      1  NCQ Command Error log
0x11       GPL,SL  R/O      1  SATA Phy Event Counters log
0x30       GPL,SL  R/O      9  IDENTIFY DEVICE data log
0x80-0x9f  GPL,SL  R/W     16  Host vendor specific log
0xe0       GPL,SL  R/W      1  SCT Command/Status
0xe1       GPL,SL  R/W      1  SCT Data Transfer

SMART Extended Comprehensive Error Log Version: 1 (1 sectors)
No Errors Logged

SMART Extended Self-test Log Version: 1 (1 sectors)
No self-tests have been logged.  [To run self-tests, use: smartctl -t]

Selective Self-tests/Logging not supported

SCT Status Version:                  3
SCT Version (vendor specific):       1 (0x0001)
Device State:                        Active (0)
Current Temperature:                    36 Celsius
Power Cycle Min/Max Temperature:      ?/ ? Celsius
Lifetime    Min/Max Temperature:     31/60 Celsius
Under/Over Temperature Limit Count:   0/0

SCT Temperature History Version:     2
Temperature Sampling Period:         1 minute
Temperature Logging Interval:        1 minute
Min/Max recommended Temperature:      0/70 Celsius
Min/Max Temperature Limit:            0/70 Celsius
Temperature History Size (Index):    128 (110)

Index    Estimated Time   Temperature Celsius
 111    2022-10-29 12:52    57  **************************************
 112    2022-10-29 12:53    58  ***************************************
 113    2022-10-29 12:54    56  *************************************
 114    2022-10-29 12:55    57  **************************************
 115    2022-10-29 12:56    56  *************************************
 116    2022-10-29 12:57    56  *************************************
 117    2022-10-29 12:58    57  **************************************
 118    2022-10-29 12:59    57  **************************************
 119    2022-10-29 13:00    56  *************************************
 120    2022-10-29 13:01    56  *************************************
 121    2022-10-29 13:02    56  *************************************
 122    2022-10-29 13:03    58  ***************************************
 123    2022-10-29 13:04    57  **************************************
 124    2022-10-29 13:05    57  **************************************
 125    2022-10-29 13:06    58  ***************************************
 126    2022-10-29 13:07    58  ***************************************
 127    2022-10-29 13:08    57  **************************************
   0    2022-10-29 13:09    56  *************************************
   1    2022-10-29 13:10    56  *************************************
   2    2022-10-29 13:11    56  *************************************
   3    2022-10-29 13:12    58  ***************************************
   4    2022-10-29 13:13    57  **************************************
   5    2022-10-29 13:14    57  **************************************
   6    2022-10-29 13:15    57  **************************************
   7    2022-10-29 13:16    58  ***************************************
   8    2022-10-29 13:17    57  **************************************
   9    2022-10-29 13:18    57  **************************************
  10    2022-10-29 13:19    56  *************************************
  11    2022-10-29 13:20    58  ***************************************
  12    2022-10-29 13:21    57  **************************************
 ...    ..(  3 skipped).    ..  **************************************
  16    2022-10-29 13:25    57  **************************************
  17    2022-10-29 13:26    56  *************************************
  18    2022-10-29 13:27    57  **************************************
 ...    ..(  4 skipped).    ..  **************************************
  23    2022-10-29 13:32    57  **************************************
  24    2022-10-29 13:33    58  ***************************************
  25    2022-10-29 13:34    57  **************************************
  26    2022-10-29 13:35    57  **************************************
  27    2022-10-29 13:36    58  ***************************************
  28    2022-10-29 13:37    57  **************************************
  29    2022-10-29 13:38    57  **************************************
  30    2022-10-29 13:39    56  *************************************
  31    2022-10-29 13:40    56  *************************************
  32    2022-10-29 13:41    57  **************************************
 ...    ..( 10 skipped).    ..  **************************************
  43    2022-10-29 13:52    57  **************************************
  44    2022-10-29 13:53    58  ***************************************
  45    2022-10-29 13:54    58  ***************************************
  46    2022-10-29 13:55    58  ***************************************
  47    2022-10-29 13:56    57  **************************************
  48    2022-10-29 13:57    58  ***************************************
  49    2022-10-29 13:58    57  **************************************
  50    2022-10-29 13:59    57  **************************************
  51    2022-10-29 14:00    56  *************************************
  52    2022-10-29 14:01    57  **************************************
 ...    ..(  2 skipped).    ..  **************************************
  55    2022-10-29 14:04    57  **************************************
  56    2022-10-29 14:05    58  ***************************************
  57    2022-10-29 14:06    57  **************************************
  58    2022-10-29 14:07    58  ***************************************
  59    2022-10-29 14:08    57  **************************************
  60    2022-10-29 14:09    58  ***************************************
  61    2022-10-29 14:10    58  ***************************************
  62    2022-10-29 14:11    57  **************************************
  63    2022-10-29 14:12    58  ***************************************
  64    2022-10-29 14:13    58  ***************************************
  65    2022-10-29 14:14    57  **************************************
  66    2022-10-29 14:15    59  ****************************************
  67    2022-10-29 14:16    57  **************************************
  68    2022-10-29 14:17    57  **************************************
  69    2022-10-29 14:18    58  ***************************************
 ...    ..(  9 skipped).    ..  ***************************************
  79    2022-10-29 14:28    58  ***************************************
  80    2022-10-29 14:29    57  **************************************
  81    2022-10-29 14:30    60  ***************************************+
  82    2022-10-29 14:31    58  ***************************************
 ...    ..( 12 skipped).    ..  ***************************************
  95    2022-10-29 14:44    58  ***************************************
  96    2022-10-29 14:45    57  **************************************
  97    2022-10-29 14:46    58  ***************************************
  98    2022-10-29 14:47    58  ***************************************
  99    2022-10-29 14:48    58  ***************************************
 100    2022-10-29 14:49    59  ****************************************
 101    2022-10-29 14:50    58  ***************************************
 102    2022-10-29 14:51    59  ****************************************
 103    2022-10-29 14:52    60  ***************************************+
 104    2022-10-29 14:53    59  ****************************************
 105    2022-10-29 14:54    59  ****************************************
 106    2022-10-29 14:55    58  ***************************************
 107    2022-10-29 14:56    58  ***************************************
 108    2022-10-29 14:57    59  ****************************************
 109    2022-10-29 14:58    60  ***************************************+
 110    2022-10-29 14:59    59  ****************************************

SCT Error Recovery Control:
           Read:      2 (0.2 seconds)
          Write:      2 (0.2 seconds)

Device Statistics (GP Log 0x04)
Page  Offset Size        Value Flags Description
0x01  =====  =               =  ===  == General Statistics (rev 1) ==
0x01  0x008  4              12  ---  Lifetime Power-On Resets
0x01  0x010  4             476  ---  Power-on Hours
0x01  0x018  6       541065216  ---  Logical Sectors Written
0x01  0x028  6    287901220864  ---  Logical Sectors Read
0x04  =====  =               =  ===  == General Errors Statistics (rev 1) ==
0x04  0x008  4               0  ---  Number of Reported Uncorrectable Errors
0x04  0x010  4              16  ---  Resets Between Cmd Acceptance and Completion
0x05  =====  =               =  ===  == Temperature Statistics (rev 1) ==
0x05  0x008  1              36  ---  Current Temperature
0x05  0x020  1              60  ---  Highest Temperature
0x05  0x028  1              31  ---  Lowest Temperature
0x05  0x038  1               0  ---  Lowest Average Short Term Temperature
0x05  0x058  1              70  ---  Specified Maximum Operating Temperature
0x06  =====  =               =  ===  == Transport Statistics (rev 1) ==
0x06  0x008  4               1  ---  Number of Hardware Resets
0x06  0x010  4              16  ---  Number of ASR Events
0x06  0x018  4               0  ---  Number of Interface CRC Errors
0x07  =====  =               =  ===  == Solid State Device Statistics (rev 1) ==
0x07  0x008  1               3  ---  Percentage Used Endurance Indicator
                                |||_ C monitored condition met
                                ||__ D supports DSN
                                |___ N normalized value

Pending Defects log (GP Log 0x0c) not supported

SATA Phy Event Counters (GP Log 0x11)
ID      Size     Value  Description
0x0001  2            0  Command failed due to ICRC error
0x0002  2            0  R_ERR response for data FIS
0x0003  2            0  R_ERR response for device-to-host data FIS
0x0004  2            0  R_ERR response for host-to-device data FIS
0x0005  2            0  R_ERR response for non-data FIS
0x0006  2            0  R_ERR response for device-to-host non-data FIS
0x0007  2            0  R_ERR response for host-to-device non-data FIS
0x0008  2            0  Device-to-host non-data FIS retries
0x0009  2            0  Transition from drive PhyRdy to drive PhyNRdy
0x000a  2            1  Device-to-host register FISes sent due to a COMRESET
0x000b  2            0  CRC errors within host-to-device FIS
0x000d  2            0  Non-CRC errors within host-to-device FIS
0x000f  2            0  R_ERR response for host-to-device data FIS, CRC
0x0010  2            0  R_ERR response for host-to-device data FIS, non-CRC
0x0012  2            0  R_ERR response for host-to-device non-data FIS, CRC
0x0013  2            0  R_ERR response for host-to-device non-data FIS, non-CRC

root@aa-Z170X-Gaming-3:~/Desktop/smartmontools-7.1-ori# 
