smartctl 6.3 2014-07-26 r3976 [x86_64-linux-3.11.10-21-desktop] (SUSE RPM)
Copyright (C) 2002-14, Bruce Allen, Christian Franke, www.smartmontools.org

=== START OF INFORMATION SECTION ===
Device Model:     WDC WD60EZRX-00MVLB1
Serial Number:    WD-WX41D3404227
LU WWN Device Id: 5 0014ee 2b54a4503
Firmware Version: 80.00A80
User Capacity:    6.001.175.126.016 bytes [6,00 TB]
Sector Sizes:     512 bytes logical, 4096 bytes physical
Rotation Rate:    5700 rpm
Device is:        Not in smartctl database [for details use: -P showall]
ATA Version is:   ACS-2, ACS-3 T13/2161-D revision 3b
SATA Version is:  SATA 3.1, 6.0 Gb/s (current: 1.5 Gb/s)
Local Time is:    Mon Oct 13 06:40:07 2014 CEST
SMART support is: Available - device has SMART capability.
SMART support is: Enabled
AAM feature is:   Unavailable
APM feature is:   Unavailable
Rd look-ahead is: Enabled
Write cache is:   Enabled
ATA Security is:  Disabled, NOT FROZEN [SEC1]
Wt Cache Reorder: Enabled

=== START OF READ SMART DATA SECTION ===
SMART overall-health self-assessment test result: PASSED

General SMART Values:
Offline data collection status:  (0x80) Offline data collection activity
                                        was never started.
                                        Auto Offline Data Collection: Enabled.
Self-test execution status:      (   0) The previous self-test routine completed
                                        without error or no self-test has ever 
                                        been run.
Total time to complete Offline 
data collection:                ( 5024) seconds.
Offline data collection
capabilities:                    (0x7b) SMART execute Offline immediate.
                                        Auto Offline data collection on/off support.
                                        Suspend Offline collection upon new
                                        command.
                                        Offline surface scan supported.
                                        Self-test supported.
                                        Conveyance Self-test supported.
                                        Selective Self-test supported.
SMART capabilities:            (0x0003) Saves SMART data before entering
                                        power-saving mode.
                                        Supports SMART auto save timer.
Error logging capability:        (0x01) Error logging supported.
                                        General Purpose Logging supported.
Short self-test routine 
recommended polling time:        (   2) minutes.
Extended self-test routine
recommended polling time:        ( 703) minutes.
Conveyance self-test routine
recommended polling time:        (   5) minutes.
SCT capabilities:              (0x3035) SCT Status supported.
                                        SCT Feature Control supported.
                                        SCT Data Table supported.

SMART Attributes Data Structure revision number: 16
Vendor Specific SMART Attributes with Thresholds:
ID# ATTRIBUTE_NAME          FLAGS    VALUE WORST THRESH FAIL RAW_VALUE
  1 Raw_Read_Error_Rate     POSR-K   200   200   051    -    0
  3 Spin_Up_Time            POS--K   100   253   021    -    0
  4 Start_Stop_Count        -O--CK   100   100   000    -    5
  5 Reallocated_Sector_Ct   PO--CK   200   200   140    -    0
  7 Seek_Error_Rate         -OSR-K   100   253   000    -    0
  9 Power_On_Hours          -O--CK   100   100   000    -    53
 10 Spin_Retry_Count        -O--CK   100   253   000    -    0
 11 Calibration_Retry_Count -O--CK   100   253   000    -    0
 12 Power_Cycle_Count       -O--CK   100   100   000    -    5
192 Power-Off_Retract_Count -O--CK   200   200   000    -    0
193 Load_Cycle_Count        -O--CK   200   200   000    -    59
194 Temperature_Celsius     -O---K   127   108   000    -    25
196 Reallocated_Event_Count -O--CK   200   200   000    -    0
197 Current_Pending_Sector  -O--CK   200   200   000    -    0
198 Offline_Uncorrectable   ----CK   100   253   000    -    0
199 UDMA_CRC_Error_Count    -O--CK   200   200   000    -    0
200 Multi_Zone_Error_Rate   ---R--   200   200   000    -    0
                            ||||||_ K auto-keep
                            |||||__ C event count
                            ||||___ R error rate
                            |||____ S speed/performance
                            ||_____ O updated online
                            |______ P prefailure warning

General Purpose Log Directory Version 1
SMART           Log Directory Version 1 [multi-sector log support]
Address    Access  R/W   Size  Description
0x00       GPL,SL  R/O      1  Log Directory
0x01           SL  R/O      1  Summary SMART error log
0x02           SL  R/O      5  Comprehensive SMART error log
0x03       GPL     R/O      6  Ext. Comprehensive SMART error log
0x06           SL  R/O      1  SMART self-test log
0x07       GPL     R/O      1  Extended self-test log
0x09           SL  R/W      1  Selective self-test log
0x10       GPL     R/O      1  NCQ Command Error log
0x11       GPL     R/O      1  SATA Phy Event Counters
0x30       GPL,SL  R/O      9  IDENTIFY DEVICE data log
0x80-0x9f  GPL,SL  R/W     16  Host vendor specific log
0xa0-0xa7  GPL,SL  VS      16  Device vendor specific log
0xa8-0xb6  GPL,SL  VS       1  Device vendor specific log
0xb7       GPL,SL  VS      40  Device vendor specific log
0xbd       GPL,SL  VS       1  Device vendor specific log
0xc0       GPL,SL  VS       1  Device vendor specific log
0xc1       GPL     VS      93  Device vendor specific log
0xe0       GPL,SL  R/W      1  SCT Command/Status
0xe1       GPL,SL  R/W      1  SCT Data Transfer

SMART Extended Comprehensive Error Log Version: 1 (6 sectors)
No Errors Logged

SMART Extended Self-test Log Version: 1 (1 sectors)
Num  Test_Description    Status                  Remaining  LifeTime(hours)  LBA_of_first_error
# 1  Short offline       Completed without error       00%        53         -
# 2  Short offline       Completed without error       00%        46         -
# 3  Selective offline   Completed without error       00%        45         -
# 4  Short offline       Completed without error       00%        45         -
# 5  Short offline       Completed without error       00%        45         -
# 6  Selective offline   Completed without error       00%        44         -
# 7  Extended offline    Completed without error       00%        44         -
# 8  Selective offline   Aborted by host               10%         4         -
# 9  Short offline       Completed without error       00%         2         -
#10  Conveyance offline  Completed without error       00%         0         -
#11  Short offline       Completed without error       00%         0         -

SMART Selective self-test log data structure revision number 1
 SPAN  MIN_LBA  MAX_LBA  CURRENT_TEST_STATUS
    1        0        0  Not_testing
    2        0        0  Not_testing
    3        0        0  Not_testing
    4        0        0  Not_testing
    5        0        0  Not_testing
Selective self-test flags (0x0):
  After scanning selected spans, do NOT read-scan remainder of disk.
If Selective self-test is pending on power-up, resume after 0 minute delay.

SCT Status Version:                  3
SCT Version (vendor specific):       258 (0x0102)
SCT Support Level:                   1
Device State:                        Active (0)
Current Temperature:                    25 Celsius
Power Cycle Min/Max Temperature:     25/25 Celsius
Lifetime    Min/Max Temperature:     23/44 Celsius
Under/Over Temperature Limit Count:   0/0

SCT Temperature History Version:     2
Temperature Sampling Period:         1 minute
Temperature Logging Interval:        1 minute
Min/Max recommended Temperature:      0/60 Celsius
Min/Max Temperature Limit:           -41/85 Celsius
Temperature History Size (Index):    478 (372)

Index    Estimated Time   Temperature Celsius
 373    2014-10-12 22:43    32  *************
 374    2014-10-12 22:44    32  *************
 375    2014-10-12 22:45    32  *************
 376    2014-10-12 22:46    33  **************
 ...    ..(  3 skipped).    ..  **************
 380    2014-10-12 22:50    33  **************
 381    2014-10-12 22:51    34  ***************
 ...    ..(  2 skipped).    ..  ***************
 384    2014-10-12 22:54    34  ***************
 385    2014-10-12 22:55    35  ****************
 ...    ..(  3 skipped).    ..  ****************
 389    2014-10-12 22:59    35  ****************
 390    2014-10-12 23:00    36  *****************
 ...    ..(  3 skipped).    ..  *****************
 394    2014-10-12 23:04    36  *****************
 395    2014-10-12 23:05    37  ******************
 ...    ..(  7 skipped).    ..  ******************
 403    2014-10-12 23:13    37  ******************
 404    2014-10-12 23:14    38  *******************
 ...    ..(  7 skipped).    ..  *******************
 412    2014-10-12 23:22    38  *******************
 413    2014-10-12 23:23    39  ********************
 ...    ..( 10 skipped).    ..  ********************
 424    2014-10-12 23:34    39  ********************
 425    2014-10-12 23:35    40  *********************
 ...    ..( 26 skipped).    ..  *********************
 452    2014-10-13 00:02    40  *********************
 453    2014-10-13 00:03    41  **********************
 ...    ..(192 skipped).    ..  **********************
 168    2014-10-13 03:16    41  **********************
 169    2014-10-13 03:17    40  *********************
 ...    ..(  8 skipped).    ..  *********************
 178    2014-10-13 03:26    40  *********************
 179    2014-10-13 03:27    39  ********************
 ...    ..( 20 skipped).    ..  ********************
 200    2014-10-13 03:48    39  ********************
 201    2014-10-13 03:49    38  *******************
 ...    ..( 74 skipped).    ..  *******************
 276    2014-10-13 05:04    38  *******************
 277    2014-10-13 05:05    37  ******************
 ...    ..( 82 skipped).    ..  ******************
 360    2014-10-13 06:28    37  ******************
 361    2014-10-13 06:29    38  *******************
 362    2014-10-13 06:30     ?  -
 363    2014-10-13 06:31    25  ******
 364    2014-10-13 06:32    26  *******
 365    2014-10-13 06:33    26  *******
 366    2014-10-13 06:34    26  *******
 367    2014-10-13 06:35    27  ********
 368    2014-10-13 06:36    27  ********
 369    2014-10-13 06:37    27  ********
 370    2014-10-13 06:38     ?  -
 371    2014-10-13 06:39    25  ******
 372    2014-10-13 06:40    25  ******

SCT Error Recovery Control command not supported

Device Statistics (GP Log 0x04) not supported

SATA Phy Event Counters (GP Log 0x11)
ID      Size     Value  Description
0x0001  2            0  Command failed due to ICRC error
0x0002  2            0  R_ERR response for data FIS
0x0003  2            0  R_ERR response for device-to-host data FIS
0x0004  2            0  R_ERR response for host-to-device data FIS
0x0005  2            0  R_ERR response for non-data FIS
0x0006  2            0  R_ERR response for device-to-host non-data FIS
0x0007  2            0  R_ERR response for host-to-device non-data FIS
0x0008  2            0  Device-to-host non-data FIS retries
0x0009  2            0  Transition from drive PhyRdy to drive PhyNRdy
0x000a  2            1  Device-to-host register FISes sent due to a COMRESET
0x000b  2            0  CRC errors within host-to-device FIS
0x000f  2            0  R_ERR response for host-to-device data FIS, CRC
0x0012  2            0  R_ERR response for host-to-device non-data FIS, CRC
0x8000  4           65  Vendor specific