smartctl 6.2 2013-07-26 r3841 [x86_64-linux-3.11-2-amd64] (local build)
Copyright (C) 2002-13, Bruce Allen, Christian Franke, www.smartmontools.org

=== ATA IDENTIFY DATA ===
Word     Bit     Value   Description

   0      -     0x0040   General configuration
   0      6          1   Not removable controller and/or device [OBS-6]

   1      -     0x3fff   Cylinders [OBS-6]

   2      -     0xc837   Specific configuration (0x37c8/738c/8c73/c837)

   3      -     0x0010   Heads [OBS-6]

   6      -     0x003f   Sectors per track [OBS-6]

  10-19   -     .        Serial number (String)
  10-13   .     0x5858:5858:5858:5858  "XXXXXXXX"
  14-17   .     0x5858:5858:5858:5858  "XXXXXXXX"
  18-19   .     0x5858:5858            "XXXX"

  23-26   -     .        Firmware revision (String)
  23-26   .     0x4443:3132:2020:2020  "DC12    "

  27-46   -     .        Model number (String)
  27-30   .     0x494e:5445:4c20:5353  "INTEL SS"
  31-34   .     0x4453:4332:4257:3138  "DSC2BW18"
  35-38   .     0x3041:3420:2020:2020  "0A4     "
  39-42   .     0x2020:2020:2020:2020  "        "
  43-46   .     0x2020:2020:2020:2020  "        "

  47      -     0x8010   READ/WRITE MULTIPLE support
  47     15:8     0x80   Must be set to 0x80
  47      7:0     0x10   Maximum sectors per DRQ on READ/WRITE MULTIPLE

  48      -     0x4000   Trusted Computing feature set options
  48     15:14     0x1   Must be set to 0x1

  49      -     0x2f00   Capabilities
  49     13          1   Standard standby timer values supported
  49     11          1   IORDY supported
  49     10          1   IORDY may be disabled
  49      9          1   LBA supported
  49      8          1   DMA supported

  50      -     0x4000   Capabilities
  50     15:14     0x1   Must be set to 0x1

  53      -     0x0007   Field validity / Free-fall Control
  53      2          1   Word 88 (Ultra DMA modes) is valid
  53      1          1   Words 64-70 (PIO modes) are valid
  53      0          1   Words 54-58 (CHS) are valid [OBS-6]

  54      -     0x3fff   Current cylinders [OBS-6]

  55      -     0x0010   Current heads [OBS-6]

  56      -     0x003f   Current sectors per track [OBS-6]

  57-58   -     .        Current capacity in sectors (DWord) [OBS-6]
  57-58   .     0xfc10:00fb  (16514064)

  59      -     0x0110   Sanitize Device - READ/WRITE MULTIPLE support
  59      8          1   Bits 7:0 are valid
  59      7:0     0x10   Current sectors per DRQ on READ/WRITE MULTIPLE

  60-61   -     .        User addressable sectors for 28-bit commands (DWord)
  60-61   .     0xffff:0fff  (268435455)

  63      -     0x0007   Multiword DMA modes
  63      2          1   Multiword DMA mode 2 and below supported
  63      1          1   Multiword DMA mode 1 and below supported
  63      0          1   Multiword DMA mode 0 supported

  64      -     0x0003   PIO modes
  64      1          1   PIO mode 4 supported
  64      0          1   PIO mode 3 supported

  65      -     0x0078   Minimum Multiword DMA cycle time per word in ns

  66      -     0x0078   Recommended Multiword DMA cycle time in ns

  67      -     0x0078   Minimum PIO cycle time without flow control in ns

  68      -     0x0078   Minimum PIO cycle time with IORDY flow control in ns

  69      -     0x4010   Additional support
  69     14          1   Deterministic data after trim supported
  69      4          1   Device encrypts all user data

  75      -     0x001f   Queue depth
  75      4:0     0x1f   Maximum queue depth - 1

  76      -     0x070e   Serial ATA capabilities
  76     10          1   Phy Event Counters supported
  76      9          1   Receipt of host initiated PM requests supported
  76      8          1   NCQ feature set supported
  76      3          1   SATA Gen3 signaling speed (6.0 Gb/s) supported
  76      2          1   SATA Gen2 signaling speed (3.0 Gb/s) supported
  76      1          1   SATA Gen1 signaling speed (1.5 Gb/s) supported

  77      -     0x0086   Serial ATA additional capabilities
  77     15:7    0x001   Reserved for Serial ATA
  77      3:1      0x3   Current Serial ATA signal speed

  78      -     0x054c   Serial ATA features supported
  78     15:8     0x05   Reserved for Serial ATA
  78      6          1   Software Settings Preservation supported
  78      3          1   Device initiated power management supported
  78      2          1   DMA Setup auto-activation supported

  79      -     0x0044   Serial ATA features enabled
  79      6          1   Software Settings Preservation enabled
  79      2          1   DMA Setup auto-activation enabled

  80      -     0x03fc   Major version number
  80      9          1   ACS-2 supported
  80      8          1   ATA8-ACS supported
  80      7          1   ATA/ATAPI-7 supported
  80      6          1   ATA/ATAPI-6 supported
  80      5          1   ATA/ATAPI-5 supported
  80      4          1   ATA/ATAPI-4 supported [OBS-8]
  80      3          1   ATA-3 supported [OBS-7]
  80      2          1   ATA-2 supported [OBS-6]

  82      -     0x746b   Commands and feature sets supported
  82     14          1   NOP supported
  82     13          1   READ BUFFER supported
  82     12          1   WRITE BUFFER supported
  82     10          1   HPA feature set supported [OBS-ACS-3]
  82      6          1   Read look-ahead supported
  82      5          1   Volatile write cache supported
  82      3          1   Power Management feature set supported
  82      1          1   Security feature set supported
  82      0          1   SMART feature set supported

  83      -     0x7429   Commands and feature sets supported
  83     15:14     0x1   Must be set to 0x1
  83     13          1   FLUSH CACHE EXT supported
  83     12          1   FLUSH CACHE supported
  83     10          1   48-bit Address feature set supported
  83      5          1   PUIS feature set supported
  83      3          1   APM feature set supported
  83      0          1   DOWNLOAD MICROCODE supported

  84      -     0x6163   Commands and feature sets supported
  84     15:14     0x1   Must be set to 0x1
  84     13          1   IDLE IMMEDIATE with UNLOAD feature supported
  84      8          1   64-bit World Wide Name supported
  84      6          1   WRITE DMA/MULTIPLE FUA EXT supported
  84      5          1   GPL feature set supported
  84      1          1   SMART self-test supported
  84      0          1   SMART error logging supported

  85      -     0x7469   Commands and feature sets supported or enabled
  85     14          1   NOP supported
  85     13          1   READ BUFFER supported
  85     12          1   WRITE BUFFER supported
  85     10          1   HPA feature set supported [OBS-ACS-3]
  85      6          1   Read look-ahead enabled
  85      5          1   Write cache enabled
  85      3          1   Power Management feature set supported
  85      0          1   SMART feature set enabled

  86      -     0xb409   Commands and feature sets supported or enabled
  86     15          1   Words 119-120 are valid
  86     13          1   FLUSH CACHE EXT supported
  86     12          1   FLUSH CACHE supported
  86     10          1   48-bit Address features set supported
  86      3          1   APM feature set enabled
  86      0          1   DOWNLOAD MICROCODE supported

  87      -     0x6163   Commands and feature sets supported or enabled
  87     15:14     0x1   Must be set to 0x1
  87     13          1   IDLE IMMEDIATE with UNLOAD FEATURE supported
  87      8          1   64-bit World Wide Name supported
  87      6          1   WRITE DMA/MULTIPLE FUA EXT supported
  87      5          1   GPL feature set supported
  87      1          1   SMART self-test supported
  87      0          1   SMART error logging supported

  88      -     0x407f   Ultra DMA modes
  88     14          1   Ultra DMA mode 6 selected
  88      6          1   Ultra DMA mode 6 and below supported
  88      5          1   Ultra DMA mode 5 and below supported
  88      4          1   Ultra DMA mode 4 and below supported
  88      3          1   Ultra DMA mode 3 and below supported
  88      2          1   Ultra DMA mode 2 and below supported
  88      1          1   Ultra DMA mode 1 and below supported
  88      0          1   Ultra DMA mode 0 supported

  89      -     0x0002   SECURITY ERASE UNIT time

  90      -     0x0001   ENHANCED SECURITY ERASE UNIT time

  91      -     0x00fe   Current APM level

  92      -     0xfffe   Master password revision code

 100-103  -     .        User addressable sectors for 48-bit commands (QWord)
 100-103  .     0xc830:14f5:0000:0000  (351651888)

 105      -     0x0001   Max blocks of LBA Range Entries per DS MANAGEMENT cmd

 106      -     0x4000   Physical sector size / logical sector size
 106     15:14     0x1   Must be set to 0x1

 119      -     0x401c   Commands and feature sets supported
 119     15:14     0x1   Must be set to 0x1
 119      4          1   DOWNLOAD MICROCODE with mode 3 supported
 119      3          1   READ/WRITE LOG DMA EXT supported
 119      2          1   WRITE UNCORRECTABLE EXT supported

 120      -     0x401c   Commands and feature sets supported or enabled
 120     15:14     0x1   Must be set to 0x1
 120      4          1   DOWNLOAD MICROCODE with mode 3 supported
 120      3          1   READ/WRITE LOG DMA EXT supported
 120      2          1   WRITE UNCORRECTABLE EXT supported

 128      -     0x0021   Security status
 128      5          1   Enhanced security erase supported
 128      0          1   Security supported

 169      -     0x0001   Data Set Management support
 169      0          1   Trim bit in DATA SET MANAGEMENT command supported

 206      -     0x0025   SCT Command Transport
 206      5          1   SCT Data Tables supported
 206      2          1   SCT Write Same supported
 206      0          1   SCT Command Transport supported

 209      -     0x4000   Alignment of logical sectors
 209     15:14     0x1   Must be set to 0x1

 217      -     0x0001   Nominal media rotation rate

 222      -     0x103f   Transport major version number
 222     15:12     0x1   Transport type: 0x0 = Parallel, 0x1 = Serial
 222      5          1   Reserved    | SATA 3.0
 222      4          1   Reserved    | SATA 2.6
 222      3          1   Reserved    | SATA 2.5
 222      2          1   Reserved    | SATA II: Extensions
 222      1          1   ATA/ATAPI-7 | SATA 1.0a
 222      0          1   ATA8-APT    | ATA8-AST

 234      -     0x0002   Minimum blocks per DOWNLOAD MICROCODE mode 3 command

 235      -     0x0400   Maximum blocks per DOWNLOAD MICROCODE mode 3 command

 255      -     0x01a5   Integrity word
 255     15:8     0x01   Checksum
 255      7:0     0xa5   Signature

=== START OF INFORMATION SECTION ===
Model Family:     Intel 530 Series SSDs
Device Model:     INTEL SSDSC2BW180A4
Firmware Version: DC12
User Capacity:    180,045,766,656 bytes [180 GB]
Sector Size:      512 bytes logical/physical
Rotation Rate:    Solid State Device
Device is:        In smartctl database [for details use: -P show]
ATA Version is:   ACS-2 (minor revision not indicated)
SATA Version is:  SATA 3.0, 6.0 Gb/s (current: 6.0 Gb/s)
Local Time is:    Mon Dec  9 15:41:07 2013 EET
SMART support is: Available - device has SMART capability.
SMART support is: Enabled
AAM feature is:   Unavailable
APM level is:     254 (maximum performance)
Rd look-ahead is: Enabled
Write cache is:   Enabled
ATA Security is:  Disabled, NOT FROZEN [SEC1]
Unexpected SCT status 0x0010 (action_code=4, function_code=2)
Wt Cache Reorder: N/A

=== START OF READ SMART DATA SECTION ===
SMART overall-health self-assessment test result: PASSED

General SMART Values:
Offline data collection status:  (0x05)	Offline data collection activity
					was aborted by an interrupting command from host.
					Auto Offline Data Collection: Disabled.
Self-test execution status:      (  33)	The self-test routine was interrupted
					by the host with a hard or soft reset.
Total time to complete Offline 
data collection: 		( 4395) seconds.
Offline data collection
capabilities: 			 (0x7f) SMART execute Offline immediate.
					Auto Offline data collection on/off support.
					Abort Offline collection upon new
					command.
					Offline surface scan supported.
					Self-test supported.
					Conveyance Self-test supported.
					Selective Self-test supported.
SMART capabilities:            (0x0003)	Saves SMART data before entering
					power-saving mode.
					Supports SMART auto save timer.
Error logging capability:        (0x01)	Error logging supported.
					General Purpose Logging supported.
Short self-test routine 
recommended polling time: 	 (   1) minutes.
Extended self-test routine
recommended polling time: 	 (  48) minutes.
Conveyance self-test routine
recommended polling time: 	 (   2) minutes.
SCT capabilities: 	       (0x0025)	SCT Status supported.
					SCT Data Table supported.

SMART Attributes Data Structure revision number: 10
Vendor Specific SMART Attributes with Thresholds:
ID# ATTRIBUTE_NAME          FLAGS    VALUE WORST THRESH FAIL RAW_VALUE
  5 Reallocated_Sector_Ct   -O--CK   100   100   000    -    0
  9 Power_On_Hours_and_Msec -O--CK   100   100   000    -    46h+56m+47.430s
 12 Power_Cycle_Count       -O--CK   100   100   000    -    4
170 Available_Reservd_Space PO--CK   100   100   010    -    0
171 Program_Fail_Count      -O--CK   100   100   000    -    0
172 Erase_Fail_Count        -O--CK   100   100   000    -    0
174 Unexpect_Power_Loss_Ct  -O--CK   100   100   000    -    2
183 SATA_Downshift_Ct       -O--CK   100   100   000    -    0
184 End-to-End_Error        PO--CK   100   100   090    -    0
187 Reported_Uncorrect      -O--CK   100   100   000    -    0
190 Airflow_Temperature_Cel -O--CK   035   044   000    -    35 (Min/Max 23/44)
192 Power-Off_Retract_Count -O--CK   100   100   000    -    2
199 UDMA_CRC_Error_Count    -O--CK   100   100   000    -    0
225 Host_Writes_32MiB       -O--CK   100   100   000    -    1351
226 Workld_Media_Wear_Indic -O--CK   100   100   000    -    65535
227 Workld_Host_Reads_Perc  -O--CK   100   100   000    -    21
228 Timed_Workload_Timer    -O--CK   100   100   000    -    65535
232 Available_Reservd_Space PO--CK   100   100   010    -    0
233 Media_Wearout_Indicator -O--CK   100   100   000    -    0
241 Host_Writes_32MiB       -O--CK   100   100   000    -    1351
242 Host_Reads_32MiB        -O--CK   100   100   000    -    375
249 NAND_Writes_1GiB        -O--CK   100   100   000    -    136
                            ||||||_ K auto-keep
                            |||||__ C event count
                            ||||___ R error rate
                            |||____ S speed/performance
                            ||_____ O updated online
                            |______ P prefailure warning

General Purpose Log Directory Version 1
SMART           Log Directory Version 1 [multi-sector log support]
Address    Access  R/W   Size  Description
0x00       GPL,SL  R/O      1  Log Directory
0x04       GPL,SL  R/O      1  Device Statistics log
0x06           SL  R/O      1  SMART self-test log
0x07       GPL     R/O      1  Extended self-test log
0x09           SL  R/W      1  Selective self-test log
0x10       GPL     R/O      1  NCQ Command Error log
0x11       GPL,SL  R/O      1  SATA Phy Event Counters
0x30       GPL,SL  R/O     16  IDENTIFY DEVICE data log
0x80-0x9f  GPL,SL  R/W     16  Host vendor specific log
0xb7       GPL,SL  VS      16  Device vendor specific log
0xe0       GPL,SL  R/W      1  SCT Command/Status
0xe1       GPL,SL  R/W      1  SCT Data Transfer

SMART Extended Comprehensive Error Log (GP Log 0x03) not supported

SMART Error Log not supported

SMART Extended Self-test Log Version: 0 (1 sectors)
Num  Test_Description    Status                  Remaining  LifeTime(hours)  LBA_of_first_error
# 1  Offline             Interrupted (host reset)      10%        41         -
# 2  Offline             Interrupted (host reset)      10%        28         -
# 3  Offline             Interrupted (host reset)      10%         5         -
# 4  Offline             Interrupted (host reset)      10%         0         -

SMART Self-test log structure revision number 1
Num  Test_Description    Status                  Remaining  LifeTime(hours)  LBA_of_first_error
# 1  Offline             Interrupted (host reset)      10%        41         -
# 2  Offline             Interrupted (host reset)      10%        28         -
# 3  Offline             Interrupted (host reset)      10%         5         -
# 4  Offline             Interrupted (host reset)      10%         0         -

SMART Selective self-test log data structure revision number 0
Note: revision number not 1 implies that no selective self-test has ever been run
 SPAN  MIN_LBA  MAX_LBA  CURRENT_TEST_STATUS
    1        0        0  Not_testing
    2        0        0  Not_testing
    3        0        0  Not_testing
    4        0        0  Not_testing
    5        0        0  Not_testing
Selective self-test flags (0x0):
  After scanning selected spans, do NOT read-scan remainder of disk.
If Selective self-test is pending on power-up, resume after 0 minute delay.

SCT Status Version:                  3
SCT Version (vendor specific):       0 (0x0000)
SCT Support Level:                   1
Device State:                        Active (0)
Current Temperature:                    35 Celsius
Power Cycle Min/Max Temperature:     23/44 Celsius
Lifetime    Min/Max Temperature:     23/67 Celsius
Under/Over Temperature Limit Count:   0/0
SCT Temperature History Version:     0 (Unknown, should be 2)
Temperature Sampling Period:         1 minute
Temperature Logging Interval:        10 minutes
Min/Max recommended Temperature:      0/ 0 Celsius
Min/Max Temperature Limit:            0/ 0 Celsius
Temperature History Size (Index):    0 (6)
Temperature History is empty

SCT Error Recovery Control command not supported

Device Statistics (GP Log 0x04)
Page Offset Size         Value  Description
  1  =====  =                =  == General Statistics (rev 2) ==
  1  0x008  4                6  Lifetime Power-On Resets
  1  0x010  4               55  Power-on Hours
  1  0x018  6        288292409  Logical Sectors Written
  1  0x028  6        218813206  Logical Sectors Read
  4  =====  =                =  == General Errors Statistics (rev 1) ==
  4  0x008  4                0  Number of Reported Uncorrectable Errors
  4  0x010  4               30  Resets Between Cmd Acceptance and Completion
  5  =====  =                =  == Temperature Statistics (rev 1) ==
  5  0x008  1               35  Current Temperature
  5  0x010  1                -  Average Short Term Temperature
  5  0x018  1                -  Average Long Term Temperature
  5  0x020  1               44  Highest Temperature
  5  0x028  1               39  Lowest Temperature
  5  0x030  1                -  Highest Average Short Term Temperature
  5  0x038  1                -  Lowest Average Short Term Temperature
  5  0x040  1                -  Highest Average Long Term Temperature
  5  0x048  1                -  Lowest Average Long Term Temperature
  5  0x050  4                0  Time in Over-Temperature
  5  0x058  1               70  Specified Maximum Operating Temperature
  5  0x060  4                0  Time in Under-Temperature
  5  0x068  1                0  Specified Minimum Operating Temperature
  6  =====  =                =  == Transport Statistics (rev 1) ==
  6  0x008  4               30  Number of Hardware Resets
  6  0x010  4                1  Number of ASR Events
  6  0x018  4                0  Number of Interface CRC Errors
  7  =====  =                =  == Solid State Device Statistics (rev 1) ==
  7  0x008  1                0  Percentage Used Endurance Indicator

SATA Phy Event Counters (GP Log 0x11)
ID      Size     Value  Description
0x0001  2            0  Command failed due to ICRC error
0x0003  2            0  R_ERR response for device-to-host data FIS
0x0004  2            0  R_ERR response for host-to-device data FIS
0x0006  2            0  R_ERR response for device-to-host non-data FIS
0x0007  2            0  R_ERR response for host-to-device non-data FIS
0x0008  2            0  Device-to-host non-data FIS retries
0x0009  2            2  Transition from drive PhyRdy to drive PhyNRdy
0x000a  2            3  Device-to-host register FISes sent due to a COMRESET
0x000f  2            0  R_ERR response for host-to-device data FIS, CRC
0x0010  2            0  R_ERR response for host-to-device data FIS, non-CRC
0x0012  2            0  R_ERR response for host-to-device non-data FIS, CRC
0x0013  2            0  R_ERR response for host-to-device non-data FIS, non-CRC
0x0002  2            0  R_ERR response for data FIS
0x0005  2            0  R_ERR response for non-data FIS
0x000b  2            0  CRC errors within host-to-device FIS
0x000d  2            0  Non-CRC errors within host-to-device FIS

