smartctl 6.6 2016-05-31 r4324 [x86_64-linux-4.9.0-0.bpo.4-amd64] (local build)
Copyright (C) 2002-16, Bruce Allen, Christian Franke, www.smartmontools.org

=== START OF INFORMATION SECTION ===
Device Model:     ST4000LM016-1N2170
Firmware Version: 0003
User Capacity:    4,000,787,030,016 bytes [4.00 TB]
Sector Sizes:     512 bytes logical, 4096 bytes physical
Rotation Rate:    5400 rpm
Form Factor:      2.5 inches
Device is:        Not in smartctl database [for details use: -P showall]
ATA Version is:   ACS-2, ACS-3 T13/2161-D revision 3b
SATA Version is:  SATA 3.1, 6.0 Gb/s (current: 3.0 Gb/s)
Local Time is:    Tue Dec 12 19:28:22 2017 CET
SMART support is: Available - device has SMART capability.
SMART support is: Enabled
AAM feature is:   Unavailable
APM level is:     254 (maximum performance)
Rd look-ahead is: Enabled
Write cache is:   Enabled
ATA Security is:  Disabled, NOT FROZEN [SEC1]
Wt Cache Reorder: Enabled

=== START OF READ SMART DATA SECTION ===
SMART overall-health self-assessment test result: PASSED

General SMART Values:
Offline data collection status:  (0x82)	Offline data collection activity
					was completed without error.
					Auto Offline Data Collection: Enabled.
Self-test execution status:      (   0)	The previous self-test routine completed
					without error or no self-test has ever 
					been run.
Total time to complete Offline 
data collection: 		(    0) seconds.
Offline data collection
capabilities: 			 (0x7b) SMART execute Offline immediate.
					Auto Offline data collection on/off support.
					Suspend Offline collection upon new
					command.
					Offline surface scan supported.
					Self-test supported.
					Conveyance Self-test supported.
					Selective Self-test supported.
SMART capabilities:            (0x0003)	Saves SMART data before entering
					power-saving mode.
					Supports SMART auto save timer.
Error logging capability:        (0x01)	Error logging supported.
					General Purpose Logging supported.
Short self-test routine 
recommended polling time: 	 (   1) minutes.
Extended self-test routine
recommended polling time: 	 ( 678) minutes.
Conveyance self-test routine
recommended polling time: 	 (   2) minutes.
SCT capabilities: 	       (0x3035)	SCT Status supported.
					SCT Feature Control supported.
					SCT Data Table supported.

SMART Attributes Data Structure revision number: 10
Vendor Specific SMART Attributes with Thresholds:
ID# ATTRIBUTE_NAME          FLAGS    VALUE WORST THRESH FAIL RAW_VALUE
  1 Raw_Read_Error_Rate     POSR--   118   099   006    -    192987054
  3 Spin_Up_Time            PO----   096   095   000    -    0
  4 Start_Stop_Count        -O--CK   099   099   020    -    1904
  5 Reallocated_Sector_Ct   PO--CK   100   100   036    -    0
  7 Seek_Error_Rate         POSR--   067   060   030    -    25810398155
  9 Power_On_Hours          -O--CK   096   096   000    -    4301 (214 170 0)
 10 Spin_Retry_Count        PO--C-   100   100   097    -    0
 12 Power_Cycle_Count       -O--CK   099   099   020    -    1356
184 End-to-End_Error        -O--CK   100   100   099    -    0
187 Reported_Uncorrect      -O--CK   100   100   000    -    0
188 Command_Timeout         -O--CK   100   100   000    -    0
189 High_Fly_Writes         -O-RCK   100   100   000    -    0
190 Airflow_Temperature_Cel -O---K   070   048   045    -    30 (Min/Max 26/30)
191 G-Sense_Error_Rate      -O--CK   100   100   000    -    0
192 Power-Off_Retract_Count -O--CK   100   100   000    -    5
193 Load_Cycle_Count        -O--CK   099   099   000    -    2195
194 Temperature_Celsius     -O---K   030   052   000    -    30 (0 18 0 0 0)
197 Current_Pending_Sector  -O--C-   100   100   000    -    0
198 Offline_Uncorrectable   ----C-   100   100   000    -    0
199 UDMA_CRC_Error_Count    -OSRCK   200   200   000    -    0
240 Head_Flying_Hours       ------   100   253   000    -    4269 (147 13 0)
241 Total_LBAs_Written      ------   100   253   000    -    20353069149
242 Total_LBAs_Read         ------   100   253   000    -    621883216
                            ||||||_ K auto-keep
                            |||||__ C event count
                            ||||___ R error rate
                            |||____ S speed/performance
                            ||_____ O updated online
                            |______ P prefailure warning

General Purpose Log Directory Version 1
SMART           Log Directory Version 1 [multi-sector log support]
Address    Access  R/W   Size  Description
0x00       GPL,SL  R/O      1  Log Directory
0x01           SL  R/O      1  Summary SMART error log
0x02           SL  R/O      5  Comprehensive SMART error log
0x03       GPL     R/O      5  Ext. Comprehensive SMART error log
0x06           SL  R/O      1  SMART self-test log
0x07       GPL     R/O      1  Extended self-test log
0x09           SL  R/W      1  Selective self-test log
0x10       GPL     R/O      1  SATA NCQ Queued Error log
0x11       GPL     R/O      1  SATA Phy Event Counters log
0x21       GPL     R/O      1  Write stream error log
0x22       GPL     R/O      1  Read stream error log
0x24       GPL     R/O    512  Current Device Internal Status Data log
0x30       GPL,SL  R/O      9  IDENTIFY DEVICE data log
0x80-0x9f  GPL,SL  R/W     16  Host vendor specific log
0xa1       GPL,SL  VS      24  Device vendor specific log
0xa2       GPL     VS    4496  Device vendor specific log
0xa8       GPL,SL  VS     129  Device vendor specific log
0xa9       GPL,SL  VS       1  Device vendor specific log
0xab       GPL     VS       1  Device vendor specific log
0xb0       GPL     VS    5180  Device vendor specific log
0xbe-0xbf  GPL     VS   65535  Device vendor specific log
0xc0       GPL,SL  VS       1  Device vendor specific log
0xc1       GPL,SL  VS      10  Device vendor specific log
0xc2       GPL,SL  VS      50  Device vendor specific log
0xc3       GPL,SL  VS       8  Device vendor specific log
0xc4       GPL,SL  VS       5  Device vendor specific log
0xc7       GPL,SL  VS       1  Device vendor specific log
0xd3       GPL     VS   16385  Device vendor specific log
0xe0       GPL,SL  R/W      1  SCT Command/Status
0xe1       GPL,SL  R/W      1  SCT Data Transfer

SMART Extended Comprehensive Error Log Version: 1 (5 sectors)
No Errors Logged

SMART Extended Self-test Log Version: 1 (1 sectors)
Num  Test_Description    Status                  Remaining  LifeTime(hours)  LBA_of_first_error
# 1  Short offline       Completed without error       00%      4301         -
# 2  Short offline       Completed without error       00%      4188         -
# 3  Short offline       Completed without error       00%      3737         -
# 4  Short offline       Completed without error       00%      3285         -
# 5  Short offline       Completed without error       00%      2710         -
# 6  Short offline       Completed without error       00%      2283         -
# 7  Short offline       Completed without error       00%      1856         -
# 8  Short offline       Completed without error       00%      1433         -
# 9  Short offline       Completed without error       00%      1151         -
#10  Short offline       Completed without error       00%       839         -
#11  Short offline       Completed without error       00%       663         -
#12  Short offline       Completed without error       00%       519         -
#13  Short offline       Completed without error       00%       466         -

SMART Selective self-test log data structure revision number 1
 SPAN  MIN_LBA  MAX_LBA  CURRENT_TEST_STATUS
    1        0        0  Not_testing
    2        0        0  Not_testing
    3        0        0  Not_testing
    4        0        0  Not_testing
    5        0        0  Not_testing
Selective self-test flags (0x0):
  After scanning selected spans, do NOT read-scan remainder of disk.
If Selective self-test is pending on power-up, resume after 0 minute delay.

SCT Status Version:                  3
SCT Version (vendor specific):       522 (0x020a)
SCT Support Level:                   1
Device State:                        Active (0)
Current Temperature:                    30 Celsius
Power Cycle Min/Max Temperature:     26/30 Celsius
Lifetime    Min/Max Temperature:     18/52 Celsius
Lifetime    Average Temperature:        45 Celsius
Under/Over Temperature Limit Count:   0/0

SCT Temperature History Version:     2
Temperature Sampling Period:         1 minute
Temperature Logging Interval:        30 minutes
Min/Max recommended Temperature:     14/55 Celsius
Min/Max Temperature Limit:           10/60 Celsius
Temperature History Size (Index):    128 (126)

Index    Estimated Time   Temperature Celsius
 127    2017-12-10 03:30    28  *********
   0    2017-12-10 04:00    43  ************************
   1    2017-12-10 04:30    46  ***************************
   2    2017-12-10 05:00    47  ****************************
 ...    ..(  6 skipped).    ..  ****************************
   9    2017-12-10 08:30    47  ****************************
  10    2017-12-10 09:00     ?  -
  11    2017-12-10 09:30    28  *********
  12    2017-12-10 10:00    41  **********************
  13    2017-12-10 10:30    46  ***************************
  14    2017-12-10 11:00    46  ***************************
  15    2017-12-10 11:30     ?  -
  16    2017-12-10 12:00    28  *********
  17    2017-12-10 12:30    41  **********************
  18    2017-12-10 13:00    46  ***************************
  19    2017-12-10 13:30     ?  -
  20    2017-12-10 14:00    27  ********
  21    2017-12-10 14:30    40  *********************
  22    2017-12-10 15:00    45  **************************
  23    2017-12-10 15:30     ?  -
  24    2017-12-10 16:00    31  ************
  25    2017-12-10 16:30    43  ************************
  26    2017-12-10 17:00    46  ***************************
 ...    ..(  2 skipped).    ..  ***************************
  29    2017-12-10 18:30    46  ***************************
  30    2017-12-10 19:00    47  ****************************
  31    2017-12-10 19:30    46  ***************************
 ...    ..(  2 skipped).    ..  ***************************
  34    2017-12-10 21:00    46  ***************************
  35    2017-12-10 21:30    47  ****************************
  36    2017-12-10 22:00    46  ***************************
 ...    ..( 17 skipped).    ..  ***************************
  54    2017-12-11 07:00    46  ***************************
  55    2017-12-11 07:30    47  ****************************
  56    2017-12-11 08:00    47  ****************************
  57    2017-12-11 08:30    46  ***************************
  58    2017-12-11 09:00    46  ***************************
  59    2017-12-11 09:30    46  ***************************
  60    2017-12-11 10:00    47  ****************************
  61    2017-12-11 10:30    46  ***************************
  62    2017-12-11 11:00    46  ***************************
  63    2017-12-11 11:30    47  ****************************
  64    2017-12-11 12:00    46  ***************************
 ...    ..(  4 skipped).    ..  ***************************
  69    2017-12-11 14:30    46  ***************************
  70    2017-12-11 15:00    47  ****************************
  71    2017-12-11 15:30    46  ***************************
  72    2017-12-11 16:00    47  ****************************
  73    2017-12-11 16:30    47  ****************************
  74    2017-12-11 17:00    46  ***************************
 ...    ..(  6 skipped).    ..  ***************************
  81    2017-12-11 20:30    46  ***************************
  82    2017-12-11 21:00    47  ****************************
  83    2017-12-11 21:30    46  ***************************
  84    2017-12-11 22:00    47  ****************************
  85    2017-12-11 22:30    46  ***************************
  86    2017-12-11 23:00    46  ***************************
  87    2017-12-11 23:30    47  ****************************
  88    2017-12-12 00:00    46  ***************************
 ...    ..(  4 skipped).    ..  ***************************
  93    2017-12-12 02:30    46  ***************************
  94    2017-12-12 03:00     ?  -
  95    2017-12-12 03:30    46  ***************************
  96    2017-12-12 04:00    46  ***************************
  97    2017-12-12 04:30    46  ***************************
  98    2017-12-12 05:00     ?  -
  99    2017-12-12 05:30    24  *****
 100    2017-12-12 06:00     ?  -
 101    2017-12-12 06:30    32  *************
 102    2017-12-12 07:00    39  ********************
 103    2017-12-12 07:30    40  *********************
 104    2017-12-12 08:00    40  *********************
 105    2017-12-12 08:30    40  *********************
 106    2017-12-12 09:00    39  ********************
 ...    ..( 11 skipped).    ..  ********************
 118    2017-12-12 15:00    39  ********************
 119    2017-12-12 15:30    38  *******************
 ...    ..(  2 skipped).    ..  *******************
 122    2017-12-12 17:00    38  *******************
 123    2017-12-12 17:30     ?  -
 124    2017-12-12 18:00    21  **
 125    2017-12-12 18:30     ?  -
 126    2017-12-12 19:00    26  *******

SCT Error Recovery Control command not supported

Device Statistics (GP/SMART Log 0x04) not supported

SATA Phy Event Counters (GP Log 0x11)
ID      Size     Value  Description
0x000a  2            1  Device-to-host register FISes sent due to a COMRESET
0x0001  2            0  Command failed due to ICRC error
0x0003  2            0  R_ERR response for device-to-host data FIS
0x0004  2            0  R_ERR response for host-to-device data FIS
0x0006  2            0  R_ERR response for device-to-host non-data FIS
0x0007  2            0  R_ERR response for host-to-device non-data FIS

