smartctl 7.0 2018-12-30 r4883 [x86_64-linux-3.10.0-957.5.1.el7.x86_64] (local build)
Copyright (C) 2002-18, Bruce Allen, Christian Franke, www.smartmontools.org

=== START OF INFORMATION SECTION ===
Device Model:     MB2000GCWDA
Serial Number:    Z1X1GYS7
LU WWN Device Id: 5 000c50 065c56810
Firmware Version: HPGD
User Capacity:    2,000,398,934,016 bytes [2.00 TB]
Sector Size:      512 bytes logical/physical
Rotation Rate:    7200 rpm
Form Factor:      3.5 inches
Device is:        Not in smartctl database [for details use: -P showall]
ATA Version is:   ACS-2, ATA8-ACS T13/1699-D revision 6
SATA Version is:  SATA 3.0, 6.0 Gb/s (current: 3.0 Gb/s)
Local Time is:    Sat Mar 30 00:32:16 2019 GMT
SMART support is: Available - device has SMART capability.
SMART support is: Enabled
AAM feature is:   Unavailable
APM feature is:   Unavailable
Rd look-ahead is: Enabled
Write cache is:   Disabled
DSN feature is:   Unavailable
ATA Security is:  Unavailable
Wt Cache Reorder: Enabled

=== START OF READ SMART DATA SECTION ===
SMART overall-health self-assessment test result: PASSED

General SMART Values:
Offline data collection status:  (0x82)	Offline data collection activity
					was completed without error.
					Auto Offline Data Collection: Enabled.
Self-test execution status:      (   0)	The previous self-test routine completed
					without error or no self-test has ever 
					been run.
Total time to complete Offline 
data collection: 		(  592) seconds.
Offline data collection
capabilities: 			 (0x7b) SMART execute Offline immediate.
					Auto Offline data collection on/off support.
					Suspend Offline collection upon new
					command.
					Offline surface scan supported.
					Self-test supported.
					Conveyance Self-test supported.
					Selective Self-test supported.
SMART capabilities:            (0x0003)	Saves SMART data before entering
					power-saving mode.
					Supports SMART auto save timer.
Error logging capability:        (0x01)	Error logging supported.
					General Purpose Logging supported.
Short self-test routine 
recommended polling time: 	 (   2) minutes.
Extended self-test routine
recommended polling time: 	 ( 250) minutes.
Conveyance self-test routine
recommended polling time: 	 (   3) minutes.
SCT capabilities: 	       (0x103d)	SCT Status supported.
					SCT Error Recovery Control supported.
					SCT Feature Control supported.
					SCT Data Table supported.

SMART Attributes Data Structure revision number: 10
Vendor Specific SMART Attributes with Thresholds:
ID# ATTRIBUTE_NAME          FLAGS    VALUE WORST THRESH FAIL RAW_VALUE
  1 Raw_Read_Error_Rate     POSR--   077   063   044    -    57487674
  3 Spin_Up_Time            PO----   095   095   070    -    0
  5 Reallocated_Sector_Ct   PO--CK   100   100   010    -    0
  7 Seek_Error_Rate         POSR--   095   060   030    -    3646935977
  9 Power_On_Hours          -O--CK   059   059   000    -    36317
 10 Spin_Retry_Count        PO--C-   100   100   097    -    0
180 Unknown_HDD_Attribute   PO-RCK   100   100   030    -    143296754
194 Temperature_Celsius     -O---K   034   042   000    -    34 (0 22 0 0 0)
196 Reallocated_Event_Count PO--CK   100   100   010    -    0
                            ||||||_ K auto-keep
                            |||||__ C event count
                            ||||___ R error rate
                            |||____ S speed/performance
                            ||_____ O updated online
                            |______ P prefailure warning

General Purpose Log Directory Version 1
SMART           Log Directory Version 1 [multi-sector log support]
Address    Access  R/W   Size  Description
0x00       GPL,SL  R/O      1  Log Directory
0x01           SL  R/O      1  Summary SMART error log
0x02           SL  R/O      5  Comprehensive SMART error log
0x03       GPL     R/O      5  Ext. Comprehensive SMART error log
0x04       GPL,SL  R/O      8  Device Statistics log
0x06           SL  R/O      1  SMART self-test log
0x07       GPL     R/O      1  Extended self-test log
0x08       GPL,SL  R/O      2  Power Conditions log
0x09           SL  R/W      1  Selective self-test log
0x10       GPL     R/O      1  NCQ Command Error log
0x11       GPL     R/O      1  SATA Phy Event Counters log
0x21       GPL     R/O      1  Write stream error log
0x22       GPL     R/O      1  Read stream error log
0x24       GPL     R/O    512  Current Device Internal Status Data log
0x30       GPL,SL  R/O      9  IDENTIFY DEVICE data log
0x80-0x9f  GPL,SL  R/W     16  Host vendor specific log
0xa1       GPL,SL  VS      20  Device vendor specific log
0xa2       GPL     VS    4496  Device vendor specific log
0xa8       GPL,SL  VS     129  Device vendor specific log
0xa9       GPL,SL  VS       1  Device vendor specific log
0xb0       GPL     VS    5176  Device vendor specific log
0xb5           SL  VS       1  Device vendor specific log
0xb6       GPL     VS    1918  Device vendor specific log
0xbd       GPL     VS     512  Device vendor specific log
0xbe-0xbf  GPL     VS   65535  Device vendor specific log
0xc1       GPL,SL  VS      10  Device vendor specific log
0xc2       GPL,SL  VS      50  Device vendor specific log
0xc3       GPL,SL  VS       8  Device vendor specific log
0xc4       GPL,SL  VS       5  Device vendor specific log
0xd0       GPL     VS       1  Device vendor specific log
0xe0       GPL,SL  R/W      1  SCT Command/Status
0xe1       GPL,SL  R/W      1  SCT Data Transfer

SMART Extended Comprehensive Error Log Version: 1 (5 sectors)
No Errors Logged

SMART Extended Self-test Log Version: 1 (1 sectors)
Num  Test_Description    Status                  Remaining  LifeTime(hours)  LBA_of_first_error
# 1  Extended offline    Completed without error       00%     36316         -
# 2  Short offline       Completed without error       00%     36304         -
# 3  Short offline       Completed without error       00%     33207         -
# 4  Short offline       Completed without error       00%     31340         -
# 5  Short offline       Completed without error       00%     28795         -
# 6  Short offline       Completed without error       00%     27236         -
# 7  Short offline       Completed without error       00%     24266         -
# 8  Short offline       Completed without error       00%     21271         -
# 9  Short offline       Completed without error       00%     19688         -
#10  Short offline       Completed without error       00%     18884         -
#11  Short offline       Completed without error       00%     17981         -
#12  Short offline       Completed without error       00%     17078         -
#13  Short offline       Interrupted (host reset)      20%     17078         -

SMART Selective self-test log data structure revision number 1
 SPAN  MIN_LBA  MAX_LBA  CURRENT_TEST_STATUS
    1        0        0  Not_testing
    2        0        0  Not_testing
    3        0        0  Not_testing
    4        0        0  Not_testing
    5        0        0  Not_testing
Selective self-test flags (0x0):
  After scanning selected spans, do NOT read-scan remainder of disk.
If Selective self-test is pending on power-up, resume after 0 minute delay.

SCT Status Version:                  3
SCT Version (vendor specific):       522 (0x020a)
Device State:                        Active (0)
Current Temperature:                    34 Celsius
Power Cycle Min/Max Temperature:     25/35 Celsius
Lifetime    Min/Max Temperature:     22/42 Celsius
Specified Max Operating Temperature:    60 Celsius
Under/Over Temperature Limit Count:   0/49

SCT Temperature History Version:     2
Temperature Sampling Period:         1 minute
Temperature Logging Interval:        10 minutes
Min/Max recommended Temperature:      0/ 0 Celsius
Min/Max Temperature Limit:            0/ 0 Celsius
Temperature History Size (Index):    128 (1)

Index    Estimated Time   Temperature Celsius
   2    2019-03-29 03:20    33  **************
   3    2019-03-29 03:30    32  *************
   4    2019-03-29 03:40    33  **************
 ...    ..(  8 skipped).    ..  **************
  13    2019-03-29 05:10    33  **************
  14    2019-03-29 05:20    32  *************
  15    2019-03-29 05:30    33  **************
  16    2019-03-29 05:40    32  *************
 ...    ..(  3 skipped).    ..  *************
  20    2019-03-29 06:20    32  *************
  21    2019-03-29 06:30    33  **************
 ...    ..(  5 skipped).    ..  **************
  27    2019-03-29 07:30    33  **************
  28    2019-03-29 07:40    32  *************
  29    2019-03-29 07:50    33  **************
 ...    ..(  8 skipped).    ..  **************
  38    2019-03-29 09:20    33  **************
  39    2019-03-29 09:30    32  *************
 ...    ..(  3 skipped).    ..  *************
  43    2019-03-29 10:10    32  *************
  44    2019-03-29 10:20    31  ************
  45    2019-03-29 10:30    32  *************
  46    2019-03-29 10:40    32  *************
  47    2019-03-29 10:50    33  **************
  48    2019-03-29 11:00    32  *************
  49    2019-03-29 11:10    33  **************
 ...    ..(  2 skipped).    ..  **************
  52    2019-03-29 11:40    33  **************
  53    2019-03-29 11:50    32  *************
 ...    ..(  4 skipped).    ..  *************
  58    2019-03-29 12:40    32  *************
  59    2019-03-29 12:50    31  ************
 ...    ..( 19 skipped).    ..  ************
  79    2019-03-29 16:10    31  ************
  80    2019-03-29 16:20     ?  -
  81    2019-03-29 16:30    25  ******
  82    2019-03-29 16:40    28  *********
  83    2019-03-29 16:50    31  ************
  84    2019-03-29 17:00    32  *************
  85    2019-03-29 17:10    34  ***************
  86    2019-03-29 17:20    34  ***************
  87    2019-03-29 17:30    35  ****************
 ...    ..(  5 skipped).    ..  ****************
  93    2019-03-29 18:30    35  ****************
  94    2019-03-29 18:40    34  ***************
 ...    ..(  5 skipped).    ..  ***************
 100    2019-03-29 19:40    34  ***************
 101    2019-03-29 19:50    35  ****************
 102    2019-03-29 20:00    34  ***************
 103    2019-03-29 20:10    34  ***************
 104    2019-03-29 20:20    35  ****************
 ...    ..(  6 skipped).    ..  ****************
 111    2019-03-29 21:30    35  ****************
 112    2019-03-29 21:40    34  ***************
 ...    ..(  4 skipped).    ..  ***************
 117    2019-03-29 22:30    34  ***************
 118    2019-03-29 22:40    35  ****************
 ...    ..(  4 skipped).    ..  ****************
 123    2019-03-29 23:30    35  ****************
 124    2019-03-29 23:40    34  ***************
 125    2019-03-29 23:50    35  ****************
 126    2019-03-30 00:00    34  ***************
 127    2019-03-30 00:10    35  ****************
   0    2019-03-30 00:20    34  ***************
   1    2019-03-30 00:30    34  ***************

SCT Error Recovery Control:
           Read:    100 (10.0 seconds)
          Write:    100 (10.0 seconds)

Device Statistics (GP Log 0x04)
Page  Offset Size        Value Flags Description
0x01  =====  =               =  ===  == General Statistics (rev 2) ==
0x01  0x008  4              35  ---  Lifetime Power-On Resets
0x01  0x010  4           36317  ---  Power-on Hours
0x01  0x018  6    196431661133  ---  Logical Sectors Written
0x01  0x020  6      4858271204  ---  Number of Write Commands
0x01  0x028  6    298409281968  ---  Logical Sectors Read
0x01  0x030  6      2329683813  ---  Number of Read Commands
0x01  0x038  6               -  ---  Date and Time TimeStamp
0x03  =====  =               =  ===  == Rotating Media Statistics (rev 1) ==
0x03  0x008  4           36222  ---  Spindle Motor Power-on Hours
0x03  0x010  4           36222  ---  Head Flying Hours
0x03  0x018  4            1558  ---  Head Load Events
0x03  0x020  4               0  ---  Number of Reallocated Logical Sectors
0x03  0x028  4               0  ---  Read Recovery Attempts
0x03  0x030  4               0  ---  Number of Mechanical Start Failures
0x04  =====  =               =  ===  == General Errors Statistics (rev 1) ==
0x04  0x008  4               0  ---  Number of Reported Uncorrectable Errors
0x04  0x010  4               8  ---  Resets Between Cmd Acceptance and Completion
                                |||_ C monitored condition met
                                ||__ D supports DSN
                                |___ N normalized value

Pending Defects log (GP Log 0x0c) not supported

SATA Phy Event Counters (GP Log 0x11)
ID      Size     Value  Description
0x000a  2           24  Device-to-host register FISes sent due to a COMRESET
0x0001  2            0  Command failed due to ICRC error
0x0003  2            0  R_ERR response for device-to-host data FIS
0x0004  2            0  R_ERR response for host-to-device data FIS
0x0006  2            0  R_ERR response for device-to-host non-data FIS
0x0007  2            0  R_ERR response for host-to-device non-data FIS

