smartctl 7.2 2020-12-30 r5155 [Darwin 18.7.0 x86_64] (local build)
Copyright (C) 2002-20, Bruce Allen, Christian Franke, www.smartmontools.org

=== START OF INFORMATION SECTION ===
Device Model:     WDC WD80EDAZ-11TA3A0
Firmware Version: 81.00A81
User Capacity:    8,001,563,222,016 bytes [8.00 TB]
Sector Sizes:     512 bytes logical, 4096 bytes physical
Rotation Rate:    5400 rpm
Form Factor:      3.5 inches
Device is:        Not in smartctl database [for details use: -P showall]
ATA Version is:   ACS-2, ATA8-ACS T13/1699-D revision 4
SATA Version is:  SATA 3.2, 6.0 Gb/s (current: 6.0 Gb/s)
Local Time is:    Sun Feb 28 09:56:25 2021 EST
SMART support is: Available - device has SMART capability.
SMART support is: Enabled
AAM feature is:   Unavailable
APM feature is:   Disabled
Rd look-ahead is: Enabled
Write cache is:   Enabled
DSN feature is:   Unavailable
ATA Security is:  Disabled, NOT FROZEN [SEC1]
Wt Cache Reorder: Unknown

=== START OF READ SMART DATA SECTION ===
SMART overall-health self-assessment test result: PASSED

General SMART Values:
Offline data collection status:  (0x80)	Offline data collection activity
					was never started.
					Auto Offline Data Collection: Enabled.
Self-test execution status:      (   0)	The previous self-test routine completed
					without error or no self-test has ever 
					been run.
Total time to complete Offline 
data collection: 		(   87) seconds.
Offline data collection
capabilities: 			 (0x5b) SMART execute Offline immediate.
					Auto Offline data collection on/off support.
					Suspend Offline collection upon new
					command.
					Offline surface scan supported.
					Self-test supported.
					No Conveyance Self-test supported.
					Selective Self-test supported.
SMART capabilities:            (0x0003)	Saves SMART data before entering
					power-saving mode.
					Supports SMART auto save timer.
Error logging capability:        (0x01)	Error logging supported.
					General Purpose Logging supported.
Short self-test routine 
recommended polling time: 	 (   2) minutes.
Extended self-test routine
recommended polling time: 	 ( 890) minutes.
SCT capabilities: 	       (0x003d)	SCT Status supported.
					SCT Error Recovery Control supported.
					SCT Feature Control supported.
					SCT Data Table supported.

SMART Attributes Data Structure revision number: 16
Vendor Specific SMART Attributes with Thresholds:
ID# ATTRIBUTE_NAME          FLAGS    VALUE WORST THRESH FAIL RAW_VALUE
  1 Raw_Read_Error_Rate     PO-R--   100   100   016    -    0
  2 Throughput_Performance  --S---   128   128   054    -    108
  3 Spin_Up_Time            POS---   167   167   024    -    453 (Average 520)
  4 Start_Stop_Count        -O--C-   100   100   000    -    394
  5 Reallocated_Sector_Ct   PO--CK   100   100   005    -    0
  7 Seek_Error_Rate         -O-R--   100   100   067    -    0
  8 Seek_Time_Performance   --S---   128   128   020    -    18
  9 Power_On_Hours          -O--C-   100   100   000    -    98
 10 Spin_Retry_Count        -O--C-   100   100   060    -    0
 12 Power_Cycle_Count       -O--CK   100   100   000    -    394
192 Power-Off_Retract_Count -O--CK   100   100   000    -    395
193 Load_Cycle_Count        -O--C-   100   100   000    -    395
194 Temperature_Celsius     -O----   114   114   000    -    57 (Min/Max 20/61)
196 Reallocated_Event_Count -O--CK   100   100   000    -    0
197 Current_Pending_Sector  -O---K   100   100   000    -    0
198 Offline_Uncorrectable   ---R--   100   100   000    -    0
199 UDMA_CRC_Error_Count    -O-R--   200   200   000    -    0
                            ||||||_ K auto-keep
                            |||||__ C event count
                            ||||___ R error rate
                            |||____ S speed/performance
                            ||_____ O updated online
                            |______ P prefailure warning

ATA_READ_LOG_EXT (addr=0x00:0x00, page=0, n=1) failed: 48-bit ATA commands not implemented
Read GP Log Directory failed

SMART Log Directory Version 1 [multi-sector log support]
Address    Access  R/W   Size  Description
0x00           SL  R/O      1  Log Directory
0x01           SL  R/O      1  Summary SMART error log
0x02           SL  R/O      1  Comprehensive SMART error log
0x04           SL  R/O    255  Device Statistics log
0x06           SL  R/O      1  SMART self-test log
0x09           SL  R/W      1  Selective self-test log
0x30           SL  R/O      9  IDENTIFY DEVICE data log
0x80-0x9f      SL  R/W     16  Host vendor specific log
0xe0           SL  R/W      1  SCT Command/Status
0xe1           SL  R/W      1  SCT Data Transfer

SMART Extended Comprehensive Error Log (GP Log 0x03) not supported

SMART Error Log Version: 1
No Errors Logged

SMART Extended Self-test Log (GP Log 0x07) not supported

SMART Self-test log structure revision number 1
Num  Test_Description    Status                  Remaining  LifeTime(hours)  LBA_of_first_error
# 1  Short offline       Completed without error       00%        98         -
# 2  Short offline       Completed without error       00%        78         -
# 3  Short offline       Completed without error       00%        73         -
# 4  Short offline       Completed without error       00%        39         -

SMART Selective self-test log data structure revision number 1
 SPAN  MIN_LBA  MAX_LBA  CURRENT_TEST_STATUS
    1        0        0  Not_testing
    2        0        0  Not_testing
    3        0        0  Not_testing
    4        0        0  Not_testing
    5        0        0  Not_testing
Selective self-test flags (0x0):
  After scanning selected spans, do NOT read-scan remainder of disk.
If Selective self-test is pending on power-up, resume after 0 minute delay.

SCT Status Version:                  3
SCT Version (vendor specific):       256 (0x0100)
Device State:                        Active (0)
Current Temperature:                    57 Celsius
Power Cycle Min/Max Temperature:     55/57 Celsius
Lifetime    Min/Max Temperature:     20/61 Celsius
Under/Over Temperature Limit Count:   0/0

SCT Temperature History Version:     2
Temperature Sampling Period:         1 minute
Temperature Logging Interval:        1 minute
Min/Max recommended Temperature:      0/65 Celsius
Min/Max Temperature Limit:           -40/70 Celsius
Temperature History Size (Index):    128 (13)

Index    Estimated Time   Temperature Celsius
  14    2021-02-28 07:49    51  ********************************
  15    2021-02-28 07:50    51  ********************************
  16    2021-02-28 07:51    52  *********************************
 ...    ..(  5 skipped).    ..  *********************************
  22    2021-02-28 07:57    52  *********************************
  23    2021-02-28 07:58    53  **********************************
 ...    ..(  7 skipped).    ..  **********************************
  31    2021-02-28 08:06    53  **********************************
  32    2021-02-28 08:07    54  ***********************************
 ...    ..(  6 skipped).    ..  ***********************************
  39    2021-02-28 08:14    54  ***********************************
  40    2021-02-28 08:15    55  ************************************
 ...    ..(  9 skipped).    ..  ************************************
  50    2021-02-28 08:25    55  ************************************
  51    2021-02-28 08:26    56  *************************************
 ...    ..( 10 skipped).    ..  *************************************
  62    2021-02-28 08:37    56  *************************************
  63    2021-02-28 08:38    57  **************************************
 ...    ..(  2 skipped).    ..  **************************************
  66    2021-02-28 08:41    57  **************************************
  67    2021-02-28 08:42    42  ***********************
  68    2021-02-28 08:43    35  ****************
  69    2021-02-28 08:44    28  *********
  70    2021-02-28 08:45    29  **********
  71    2021-02-28 08:46    30  ***********
  72    2021-02-28 08:47    30  ***********
  73    2021-02-28 08:48    53  **********************************
 ...    ..(  2 skipped).    ..  **********************************
  76    2021-02-28 08:51    53  **********************************
  77    2021-02-28 08:52    54  ***********************************
 ...    ..(  8 skipped).    ..  ***********************************
  86    2021-02-28 09:01    54  ***********************************
  87    2021-02-28 09:02    55  ************************************
 ...    ..( 15 skipped).    ..  ************************************
 103    2021-02-28 09:18    55  ************************************
 104    2021-02-28 09:19    56  *************************************
 ...    ..(  8 skipped).    ..  *************************************
 113    2021-02-28 09:28    56  *************************************
 114    2021-02-28 09:29    55  ************************************
 ...    ..(  5 skipped).    ..  ************************************
 120    2021-02-28 09:35    55  ************************************
 121    2021-02-28 09:36    56  *************************************
 ...    ..( 13 skipped).    ..  *************************************
   7    2021-02-28 09:50    56  *************************************
   8    2021-02-28 09:51    57  **************************************
 ...    ..(  3 skipped).    ..  **************************************
  12    2021-02-28 09:55    57  **************************************
  13    2021-02-28 09:56    51  ********************************

SMART WRITE LOG does not return COUNT and LBA_LOW register
SCT (Get) Error Recovery Control command failed

Device Statistics (SMART Log 0x04)
Page  Offset Size        Value Flags Description
ATA_SMART_READ_LOG failed: Undefined error: 0
Read Device Statistics pages 0x00-0x06 failed

Pending Defects log (GP Log 0x0c) not supported

ATA_READ_LOG_EXT (addr=0x11:0x00, page=0, n=1) failed: 48-bit ATA commands not implemented
Read SATA Phy Event Counters failed

