smartctl 7.4 2023-08-01 r5530 [x86_64-linux-6.8.9-arch1-2] (local build)
Copyright (C) 2002-23, Bruce Allen, Christian Franke, www.smartmontools.org

=== START OF INFORMATION SECTION ===
Device Model:     TOSHIBA MQ04UBB400
Serial Number:    83TDT0QOT
LU WWN Device Id: 0 000000 000000000
Firmware Version: JS0B0U
User Capacity:    4,000,787,030,016 bytes [4.00 TB]
Sector Sizes:     512 bytes logical, 4096 bytes physical
Rotation Rate:    5400 rpm
Form Factor:      2.5 inches
Zoned Device:     Device managed zones
Device is:        Not in smartctl database 7.3/5610
ATA Version is:   ACS-3 T13/2161-D revision 5
SATA Version is:  SATA 3.3, 3.0 Gb/s (current: 3.0 Gb/s)
Local Time is:    Mon May 13 18:08:50 2024 CEST
SMART support is: Available - device has SMART capability.
SMART support is: Enabled
AAM feature is:   Unavailable
APM level is:     128 (minimum power consumption without standby)
Rd look-ahead is: Enabled
Write cache is:   Enabled
DSN feature is:   Disabled
ATA Security is:  Disabled, NOT FROZEN [SEC1]
Wt Cache Reorder: Unknown

=== START OF READ SMART DATA SECTION ===
SMART Status not supported: Incomplete response, ATA output registers missing
SMART overall-health self-assessment test result: PASSED
Warning: This result is based on an Attribute check.

General SMART Values:
Offline data collection status:  (0x00)	Offline data collection activity
					was never started.
					Auto Offline Data Collection: Disabled.
Self-test execution status:      (   0)	The previous self-test routine completed
					without error or no self-test has ever 
					been run.
Total time to complete Offline 
data collection: 		(  120) seconds.
Offline data collection
capabilities: 			 (0x5b) SMART execute Offline immediate.
					Auto Offline data collection on/off support.
					Suspend Offline collection upon new
					command.
					Offline surface scan supported.
					Self-test supported.
					No Conveyance Self-test supported.
					Selective Self-test supported.
SMART capabilities:            (0x0003)	Saves SMART data before entering
					power-saving mode.
					Supports SMART auto save timer.
Error logging capability:        (0x01)	Error logging supported.
					General Purpose Logging supported.
Short self-test routine 
recommended polling time: 	 (   2) minutes.
Extended self-test routine
recommended polling time: 	 ( 671) minutes.
SCT capabilities: 	       (0x003d)	SCT Status supported.
					SCT Error Recovery Control supported.
					SCT Feature Control supported.
					SCT Data Table supported.

SMART Attributes Data Structure revision number: 16
Vendor Specific SMART Attributes with Thresholds:
ID# ATTRIBUTE_NAME          FLAGS    VALUE WORST THRESH FAIL RAW_VALUE
  1 Raw_Read_Error_Rate     PO-R--   100   100   050    -    0
  2 Throughput_Performance  P-S---   100   100   050    -    0
  3 Spin_Up_Time            POS--K   100   100   001    -    2420
  4 Start_Stop_Count        -O--CK   100   100   000    -    33
  5 Reallocated_Sector_Ct   PO--CK   100   100   050    -    0
  7 Seek_Error_Rate         PO-R--   100   100   050    -    0
  8 Seek_Time_Performance   P-S---   100   100   050    -    0
  9 Power_On_Hours          -O--CK   100   100   000    -    11
 10 Spin_Retry_Count        PO--CK   100   100   030    -    0
 12 Power_Cycle_Count       -O--CK   100   100   000    -    20
191 G-Sense_Error_Rate      -O--CK   100   100   000    -    0
192 Power-Off_Retract_Count -O--CK   100   100   000    -    8
193 Load_Cycle_Count        -O--CK   100   100   000    -    52
194 Temperature_Celsius     -O---K   100   100   000    -    29 (Min/Max 19/38)
196 Reallocated_Event_Count -O--CK   100   100   000    -    0
197 Current_Pending_Sector  -O--CK   100   100   000    -    0
198 Offline_Uncorrectable   ----CK   100   100   000    -    0
199 UDMA_CRC_Error_Count    -O--CK   200   253   000    -    0
220 Disk_Shift              -O----   100   100   000    -    0
222 Loaded_Hours            -O--CK   100   100   000    -    7
223 Load_Retry_Count        -O--CK   100   100   000    -    0
224 Load_Friction           -O---K   100   100   000    -    0
226 Load-in_Time            -OS--K   100   100   000    -    277
240 Head_Flying_Hours       P-----   100   100   001    -    0
                            ||||||_ K auto-keep
                            |||||__ C event count
                            ||||___ R error rate
                            |||____ S speed/performance
                            ||_____ O updated online
                            |______ P prefailure warning

General Purpose Log Directory Version 1
SMART           Log Directory Version 1 [multi-sector log support]
Address    Access  R/W   Size  Description
0x00       GPL,SL  R/O      1  Log Directory
0x01           SL  R/O      1  Summary SMART error log
0x02           SL  R/O     51  Comprehensive SMART error log
0x03       GPL     R/O     64  Ext. Comprehensive SMART error log
0x04       GPL,SL  R/O      8  Device Statistics log
0x06           SL  R/O      1  SMART self-test log
0x07       GPL     R/O      1  Extended self-test log
0x09           SL  R/W      1  Selective self-test log
0x0a       GPL     R/W      2  Device Statistics Notification
0x10       GPL     R/O      1  NCQ Command Error log
0x11       GPL     R/O      1  SATA Phy Event Counters log
0x24       GPL     R/O  32768  Current Device Internal Status Data log
0x30       GPL,SL  R/O      9  IDENTIFY DEVICE data log
0x80-0x9f  GPL,SL  R/W     16  Host vendor specific log
0xa7       GPL     VS       8  Device vendor specific log
0xe0       GPL,SL  R/W      1  SCT Command/Status
0xe1       GPL,SL  R/W      1  SCT Data Transfer

SMART Extended Comprehensive Error Log Version: 1 (64 sectors)
No Errors Logged

SMART Extended Self-test Log Version: 1 (1 sectors)
Num  Test_Description    Status                  Remaining  LifeTime(hours)  LBA_of_first_error
# 1  Short offline       Completed without error       00%        10         -
# 2  Short offline       Completed without error       00%         6         -
# 3  Short offline       Completed without error       00%         5         -

SMART Selective self-test log data structure revision number 1
 SPAN  MIN_LBA  MAX_LBA  CURRENT_TEST_STATUS
    1        0        0  Not_testing
    2        0        0  Not_testing
    3        0        0  Not_testing
    4        0        0  Not_testing
    5        0        0  Not_testing
Selective self-test flags (0x0):
  After scanning selected spans, do NOT read-scan remainder of disk.
If Selective self-test is pending on power-up, resume after 0 minute delay.

SCT Status Version:                  3
SCT Version (vendor specific):       1 (0x0001)
Device State:                        Active (0)
Current Temperature:                    29 Celsius
Power Cycle Min/Max Temperature:     25/30 Celsius
Lifetime    Min/Max Temperature:     19/38 Celsius
Under/Over Temperature Limit Count:   0/0

SCT Temperature History Version:     2
Temperature Sampling Period:         1 minute
Temperature Logging Interval:        1 minute
Min/Max recommended Temperature:      0/60 Celsius
Min/Max Temperature Limit:            0/60 Celsius
Temperature History Size (Index):    478 (116)

Index    Estimated Time   Temperature Celsius
 117    2024-05-13 10:11     ?  -
 ...    ..(363 skipped).    ..  -
   3    2024-05-13 16:15     ?  -
   4    2024-05-13 16:16    23  ****
   5    2024-05-13 16:17    23  ****
   6    2024-05-13 16:18    24  *****
   7    2024-05-13 16:19    24  *****
   8    2024-05-13 16:20     ?  -
   9    2024-05-13 16:21    24  *****
  10    2024-05-13 16:22    36  *****************
  11    2024-05-13 16:23    36  *****************
  12    2024-05-13 16:24     ?  -
  13    2024-05-13 16:25    20  *
  14    2024-05-13 16:26    20  *
  15    2024-05-13 16:27    23  ****
  16    2024-05-13 16:28    23  ****
  17    2024-05-13 16:29     ?  -
  18    2024-05-13 16:30    24  *****
 ...    ..(  3 skipped).    ..  *****
  22    2024-05-13 16:34    24  *****
  23    2024-05-13 16:35     ?  -
  24    2024-05-13 16:36    24  *****
  25    2024-05-13 16:37     ?  -
 ...    ..(  2 skipped).    ..  -
  28    2024-05-13 16:40     ?  -
  29    2024-05-13 16:41    25  ******
  30    2024-05-13 16:42    25  ******
  31    2024-05-13 16:43    27  ********
  32    2024-05-13 16:44    36  *****************
  33    2024-05-13 16:45    36  *****************
  34    2024-05-13 16:46    36  *****************
  35    2024-05-13 16:47     ?  -
  36    2024-05-13 16:48    24  *****
  37    2024-05-13 16:49    25  ******
  38    2024-05-13 16:50    25  ******
  39    2024-05-13 16:51    25  ******
  40    2024-05-13 16:52     ?  -
  41    2024-05-13 16:53    26  *******
  42    2024-05-13 16:54    26  *******
  43    2024-05-13 16:55    26  *******
  44    2024-05-13 16:56    28  *********
  45    2024-05-13 16:57     ?  -
  46    2024-05-13 16:58     ?  -
  47    2024-05-13 16:59    22  ***
  48    2024-05-13 17:00    22  ***
  49    2024-05-13 17:01    23  ****
  50    2024-05-13 17:02     ?  -
  51    2024-05-13 17:03    24  *****
  52    2024-05-13 17:04    25  ******
  53    2024-05-13 17:05    27  ********
  54    2024-05-13 17:06    28  *********
  55    2024-05-13 17:07     ?  -
  56    2024-05-13 17:08    28  *********
  57    2024-05-13 17:09     ?  -
  58    2024-05-13 17:10    29  **********
  59    2024-05-13 17:11    29  **********
  60    2024-05-13 17:12    29  **********
  61    2024-05-13 17:13     ?  -
  62    2024-05-13 17:14    29  **********
  63    2024-05-13 17:15     ?  -
  64    2024-05-13 17:16    24  *****
  65    2024-05-13 17:17    25  ******
  66    2024-05-13 17:18    26  *******
  67    2024-05-13 17:19    27  ********
  68    2024-05-13 17:20    29  **********
  69    2024-05-13 17:21    30  ***********
  70    2024-05-13 17:22    31  ************
  71    2024-05-13 17:23    31  ************
  72    2024-05-13 17:24    37  ******************
  73    2024-05-13 17:25    37  ******************
  74    2024-05-13 17:26    37  ******************
  75    2024-05-13 17:27     ?  -
  76    2024-05-13 17:28    23  ****
  77    2024-05-13 17:29    24  *****
  78    2024-05-13 17:30    25  ******
  79    2024-05-13 17:31    26  *******
  80    2024-05-13 17:32    28  *********
  81    2024-05-13 17:33    29  **********
  82    2024-05-13 17:34    31  ************
  83    2024-05-13 17:35     ?  -
  84    2024-05-13 17:36    23  ****
  85    2024-05-13 17:37    26  *******
  86    2024-05-13 17:38    27  ********
  87    2024-05-13 17:39    28  *********
  88    2024-05-13 17:40    29  **********
  89    2024-05-13 17:41    30  ***********
  90    2024-05-13 17:42    30  ***********
  91    2024-05-13 17:43    31  ************
  92    2024-05-13 17:44    32  *************
  93    2024-05-13 17:45    32  *************
  94    2024-05-13 17:46    33  **************
  95    2024-05-13 17:47    34  ***************
  96    2024-05-13 17:48    34  ***************
  97    2024-05-13 17:49    34  ***************
  98    2024-05-13 17:50    35  ****************
  99    2024-05-13 17:51    35  ****************
 100    2024-05-13 17:52    36  *****************
 101    2024-05-13 17:53    37  ******************
 ...    ..(  2 skipped).    ..  ******************
 104    2024-05-13 17:56    37  ******************
 105    2024-05-13 17:57     ?  -
 106    2024-05-13 17:58    34  ***************
 107    2024-05-13 17:59     ?  -
 108    2024-05-13 18:00    26  *******
 109    2024-05-13 18:01    28  *********
 110    2024-05-13 18:02    29  **********
 111    2024-05-13 18:03     ?  -
 112    2024-05-13 18:04    29  **********
 113    2024-05-13 18:05    29  **********
 114    2024-05-13 18:06    30  ***********
 115    2024-05-13 18:07     ?  -
 116    2024-05-13 18:08    29  **********

SMART WRITE LOG does not return COUNT and LBA_LOW register
SCT (Get) Error Recovery Control command failed

Device Statistics (GP Log 0x04)
Page  Offset Size        Value Flags Description
0x01  =====  =               =  ===  == General Statistics (rev 1) ==
0x01  0x008  4              20  ---  Lifetime Power-On Resets
0x01  0x010  4              11  ---  Power-on Hours
0x01  0x018  6      3176885781  ---  Logical Sectors Written
0x01  0x020  6         1935053  ---  Number of Write Commands
0x01  0x028  6        36967565  ---  Logical Sectors Read
0x01  0x030  6          959058  ---  Number of Read Commands
0x01  0x038  6        40162523  ---  Date and Time TimeStamp
0x02  =====  =               =  ===  == Free-Fall Statistics (rev 1) ==
0x02  0x010  4               0  ---  Overlimit Shock Events
0x03  =====  =               =  ===  == Rotating Media Statistics (rev 1) ==
0x03  0x008  4               8  ---  Spindle Motor Power-on Hours
0x03  0x010  4               7  ---  Head Flying Hours
0x03  0x018  4              53  ---  Head Load Events
0x03  0x020  4               0  -D-  Number of Reallocated Logical Sectors
0x03  0x028  4               6  ---  Read Recovery Attempts
0x03  0x030  4               0  ---  Number of Mechanical Start Failures
0x03  0x038  4               0  ---  Number of Realloc. Candidate Logical Sectors
0x03  0x040  4               8  ---  Number of High Priority Unload Events
0x04  =====  =               =  ===  == General Errors Statistics (rev 1) ==
0x04  0x008  4               0  ---  Number of Reported Uncorrectable Errors
0x04  0x010  4               0  ---  Resets Between Cmd Acceptance and Completion
0x05  =====  =               =  ===  == Temperature Statistics (rev 1) ==
0x05  0x008  1              29  ---  Current Temperature
0x05  0x010  1               -  N--  Average Short Term Temperature
0x05  0x018  1               -  N--  Average Long Term Temperature
0x05  0x020  1              38  ---  Highest Temperature
0x05  0x028  1              19  ---  Lowest Temperature
0x05  0x030  1               -  N--  Highest Average Short Term Temperature
0x05  0x038  1               -  N--  Lowest Average Short Term Temperature
0x05  0x040  1               -  N--  Highest Average Long Term Temperature
0x05  0x048  1               -  N--  Lowest Average Long Term Temperature
0x05  0x050  4               0  ---  Time in Over-Temperature
0x05  0x058  1              60  ---  Specified Maximum Operating Temperature
0x05  0x060  4               0  ---  Time in Under-Temperature
0x05  0x068  1               0  ---  Specified Minimum Operating Temperature
0x06  =====  =               =  ===  == Transport Statistics (rev 1) ==
0x06  0x008  4              15  ---  Number of Hardware Resets
0x06  0x010  4              22  ---  Number of ASR Events
0x06  0x018  4               0  ---  Number of Interface CRC Errors
0x07  =====  =               =  ===  == Solid State Device Statistics (rev 1) ==
                                |||_ C monitored condition met
                                ||__ D supports DSN
                                |___ N normalized value

Pending Defects log (GP Log 0x0c) not supported

SATA Phy Event Counters (GP Log 0x11)
ID      Size     Value  Description
0x0001  4            0  Command failed due to ICRC error
0x0002  4            0  R_ERR response for data FIS
0x0003  4            0  R_ERR response for device-to-host data FIS
0x0004  4            0  R_ERR response for host-to-device data FIS
0x0005  4            0  R_ERR response for non-data FIS
0x0006  4            0  R_ERR response for device-to-host non-data FIS
0x0007  4            0  R_ERR response for host-to-device non-data FIS
0x0008  4            0  Device-to-host non-data FIS retries
0x0009  4            7  Transition from drive PhyRdy to drive PhyNRdy
0x000a  4            3  Device-to-host register FISes sent due to a COMRESET
0x000b  4            0  CRC errors within host-to-device FIS
0x000d  4            0  Non-CRC errors within host-to-device FIS
0x000f  4            0  R_ERR response for host-to-device data FIS, CRC
0x0010  4            0  R_ERR response for host-to-device data FIS, non-CRC
0x0012  4            0  R_ERR response for host-to-device non-data FIS, CRC
0x0013  4            0  R_ERR response for host-to-device non-data FIS, non-CRC

