smartctl 6.6 2017-11-05 r4594 [x86_64-linux-3.10.0-693.21.1.el7.x86_64] (local build)
Copyright (C) 2002-17, Bruce Allen, Christian Franke, www.smartmontools.org

=== START OF INFORMATION SECTION ===
Device Model:     TOSHIBA MG07ACA14TE
Serial Number:    18J0A00KF94G
LU WWN Device Id: 5 000039 868c828c8
Firmware Version: 0101
User Capacity:    14,000,519,643,136 bytes [14.0 TB]
Sector Sizes:     512 bytes logical, 4096 bytes physical
Rotation Rate:    7200 rpm
Form Factor:      3.5 inches
Device is:        Not in smartctl database [for details use: -P showall]
ATA Version is:   ACS-3 T13/2161-D revision 5
SATA Version is:  SATA 3.3, 6.0 Gb/s (current: 6.0 Gb/s)
Local Time is:    Tue Apr 10 16:27:39 2018 MSK
SMART support is: Available - device has SMART capability.
SMART support is: Enabled
AAM feature is:   Unavailable
APM level is:     128 (minimum power consumption without standby)
Rd look-ahead is: Enabled
Write cache is:   Enabled
DSN feature is:   Unavailable
ATA Security is:  Disabled, NOT FROZEN [SEC1]
Wt Cache Reorder: Unknown

=== START OF READ SMART DATA SECTION ===
SMART overall-health self-assessment test result: PASSED

General SMART Values:
Offline data collection status:  (0x80)	Offline data collection activity
					was never started.
					Auto Offline Data Collection: Enabled.
Self-test execution status:      (   0)	The previous self-test routine completed
					without error or no self-test has ever 
					been run.
Total time to complete Offline 
data collection: 		(  120) seconds.
Offline data collection
capabilities: 			 (0x5b) SMART execute Offline immediate.
					Auto Offline data collection on/off support.
					Suspend Offline collection upon new
					command.
					Offline surface scan supported.
					Self-test supported.
					No Conveyance Self-test supported.
					Selective Self-test supported.
SMART capabilities:            (0x0003)	Saves SMART data before entering
					power-saving mode.
					Supports SMART auto save timer.
Error logging capability:        (0x01)	Error logging supported.
					General Purpose Logging supported.
Short self-test routine 
recommended polling time: 	 (   2) minutes.
Extended self-test routine
recommended polling time: 	 (1376) minutes.
SCT capabilities: 	       (0x003d)	SCT Status supported.
					SCT Error Recovery Control supported.
					SCT Feature Control supported.
					SCT Data Table supported.

SMART Attributes Data Structure revision number: 16
Vendor Specific SMART Attributes with Thresholds:
ID# ATTRIBUTE_NAME          FLAGS    VALUE WORST THRESH FAIL RAW_VALUE
  1 Raw_Read_Error_Rate     PO-R--   100   100   050    -    0
  2 Throughput_Performance  P-S---   100   100   050    -    0
  3 Spin_Up_Time            POS--K   100   100   001    -    8033
  4 Start_Stop_Count        -O--CK   100   100   000    -    1
  5 Reallocated_Sector_Ct   PO--CK   100   100   010    -    0
  7 Seek_Error_Rate         PO-R--   100   100   050    -    0
  8 Seek_Time_Performance   P-S---   100   100   050    -    0
  9 Power_On_Hours          -O--CK   100   100   000    -    4
 10 Spin_Retry_Count        PO--CK   100   100   030    -    0
 12 Power_Cycle_Count       -O--CK   100   100   000    -    1
 23 Unknown_Attribute       PO---K   100   100   075    -    0
 24 Unknown_Attribute       PO---K   100   100   075    -    0
191 G-Sense_Error_Rate      -O--CK   100   100   000    -    0
192 Power-Off_Retract_Count -O--CK   100   100   000    -    0
193 Load_Cycle_Count        -O--CK   100   100   000    -    3
194 Temperature_Celsius     -O---K   100   100   000    -    41 (Min/Max 25/43)
196 Reallocated_Event_Count -O--CK   100   100   000    -    0
197 Current_Pending_Sector  -O--CK   100   100   000    -    0
198 Offline_Uncorrectable   ----CK   100   100   000    -    0
199 UDMA_CRC_Error_Count    -O--CK   200   200   000    -    0
220 Disk_Shift              -O----   100   100   000    -    1310720
222 Loaded_Hours            -O--CK   100   100   000    -    3
223 Load_Retry_Count        -O--CK   100   100   000    -    0
224 Load_Friction           -O---K   100   100   000    -    0
226 Load-in_Time            -OS--K   100   100   000    -    531
240 Head_Flying_Hours       P-----   100   100   001    -    0
                            ||||||_ K auto-keep
                            |||||__ C event count
                            ||||___ R error rate
                            |||____ S speed/performance
                            ||_____ O updated online
                            |______ P prefailure warning

General Purpose Log Directory Version 1
SMART           Log Directory Version 1 [multi-sector log support]
Address    Access  R/W   Size  Description
0x00       GPL,SL  R/O      1  Log Directory
0x01           SL  R/O      1  Summary SMART error log
0x02           SL  R/O     51  Comprehensive SMART error log
0x03       GPL     R/O      5  Ext. Comprehensive SMART error log
0x04       GPL,SL  R/O      8  Device Statistics log
0x06           SL  R/O      1  SMART self-test log
0x07       GPL     R/O      1  Extended self-test log
0x08       GPL     R/O      2  Power Conditions log
0x09           SL  R/W      1  Selective self-test log
0x0c       GPL     R/O    513  Pending Defects log
0x10       GPL     R/O      1  NCQ Command Error log
0x11       GPL     R/O      1  SATA Phy Event Counters log
0x24       GPL     R/O  53248  Current Device Internal Status Data log
0x25       GPL     R/O  53248  Saved Device Internal Status Data log
0x30       GPL,SL  R/O      9  IDENTIFY DEVICE data log
0x80-0x9f  GPL,SL  R/W     16  Host vendor specific log
0xe0       GPL,SL  R/W      1  SCT Command/Status
0xe1       GPL,SL  R/W      1  SCT Data Transfer

SMART Extended Comprehensive Error Log Version: 1 (5 sectors)
No Errors Logged

SMART Extended Self-test Log Version: 1 (1 sectors)
Num  Test_Description    Status                  Remaining  LifeTime(hours)  LBA_of_first_error
# 1  Short offline       Completed without error       00%         4         -

SMART Selective self-test log data structure revision number 1
 SPAN  MIN_LBA  MAX_LBA  CURRENT_TEST_STATUS
    1        0        0  Not_testing
    2        0        0  Not_testing
    3        0        0  Not_testing
    4        0        0  Not_testing
    5        0        0  Not_testing
Selective self-test flags (0x0):
  After scanning selected spans, do NOT read-scan remainder of disk.
If Selective self-test is pending on power-up, resume after 0 minute delay.

SCT Status Version:                  3
SCT Version (vendor specific):       1 (0x0001)
SCT Support Level:                   1
Device State:                        Active (0)
Current Temperature:                    41 Celsius
Power Cycle Min/Max Temperature:     25/43 Celsius
Lifetime    Min/Max Temperature:     25/43 Celsius
Under/Over Temperature Limit Count:   0/0

SCT Temperature History Version:     2
Temperature Sampling Period:         1 minute
Temperature Logging Interval:        1 minute
Min/Max recommended Temperature:      5/55 Celsius
Min/Max Temperature Limit:           -40/70 Celsius
Temperature History Size (Index):    478 (280)

Index    Estimated Time   Temperature Celsius
 281    2018-04-10 08:30     ?  -
 ...    ..(196 skipped).    ..  -
   0    2018-04-10 11:47     ?  -
   1    2018-04-10 11:48    25  ******
   2    2018-04-10 11:49    25  ******
   3    2018-04-10 11:50    26  *******
   4    2018-04-10 11:51    27  ********
   5    2018-04-10 11:52    28  *********
   6    2018-04-10 11:53    28  *********
   7    2018-04-10 11:54    29  **********
   8    2018-04-10 11:55    29  **********
   9    2018-04-10 11:56    30  ***********
  10    2018-04-10 11:57    30  ***********
  11    2018-04-10 11:58    31  ************
  12    2018-04-10 11:59    31  ************
  13    2018-04-10 12:00    32  *************
  14    2018-04-10 12:01    32  *************
  15    2018-04-10 12:02    33  **************
  16    2018-04-10 12:03    33  **************
  17    2018-04-10 12:04    33  **************
  18    2018-04-10 12:05    34  ***************
  19    2018-04-10 12:06    34  ***************
  20    2018-04-10 12:07    34  ***************
  21    2018-04-10 12:08    35  ****************
  22    2018-04-10 12:09    35  ****************
  23    2018-04-10 12:10    35  ****************
  24    2018-04-10 12:11    36  *****************
  25    2018-04-10 12:12    36  *****************
  26    2018-04-10 12:13    37  ******************
  27    2018-04-10 12:14    37  ******************
  28    2018-04-10 12:15    38  *******************
 ...    ..(  3 skipped).    ..  *******************
  32    2018-04-10 12:19    38  *******************
  33    2018-04-10 12:20    39  ********************
 ...    ..(  4 skipped).    ..  ********************
  38    2018-04-10 12:25    39  ********************
  39    2018-04-10 12:26    40  *********************
  40    2018-04-10 12:27    40  *********************
  41    2018-04-10 12:28    39  ********************
  42    2018-04-10 12:29    39  ********************
  43    2018-04-10 12:30    40  *********************
 ...    ..(  3 skipped).    ..  *********************
  47    2018-04-10 12:34    40  *********************
  48    2018-04-10 12:35    41  **********************
 ...    ..(  8 skipped).    ..  **********************
  57    2018-04-10 12:44    41  **********************
  58    2018-04-10 12:45    42  ***********************
 ...    ..( 25 skipped).    ..  ***********************
  84    2018-04-10 13:11    42  ***********************
  85    2018-04-10 13:12    43  ************************
 ...    ..(  3 skipped).    ..  ************************
  89    2018-04-10 13:16    43  ************************
  90    2018-04-10 13:17    42  ***********************
  91    2018-04-10 13:18    43  ************************
 ...    ..( 79 skipped).    ..  ************************
 171    2018-04-10 14:38    43  ************************
 172    2018-04-10 14:39    42  ***********************
 ...    ..(  5 skipped).    ..  ***********************
 178    2018-04-10 14:45    42  ***********************
 179    2018-04-10 14:46    41  **********************
 ...    ..(  9 skipped).    ..  **********************
 189    2018-04-10 14:56    41  **********************
 190    2018-04-10 14:57    40  *********************
 191    2018-04-10 14:58    41  **********************
 192    2018-04-10 14:59    40  *********************
 ...    ..( 51 skipped).    ..  *********************
 244    2018-04-10 15:51    40  *********************
 245    2018-04-10 15:52    39  ********************
 246    2018-04-10 15:53    40  *********************
 ...    ..(  2 skipped).    ..  *********************
 249    2018-04-10 15:56    40  *********************
 250    2018-04-10 15:57    39  ********************
 251    2018-04-10 15:58    39  ********************
 252    2018-04-10 15:59    39  ********************
 253    2018-04-10 16:00    40  *********************
 254    2018-04-10 16:01    39  ********************
 255    2018-04-10 16:02    39  ********************
 256    2018-04-10 16:03    40  *********************
 257    2018-04-10 16:04    39  ********************
 258    2018-04-10 16:05    40  *********************
 259    2018-04-10 16:06    39  ********************
 ...    ..(  3 skipped).    ..  ********************
 263    2018-04-10 16:10    39  ********************
 264    2018-04-10 16:11    40  *********************
 265    2018-04-10 16:12    39  ********************
 266    2018-04-10 16:13    39  ********************
 267    2018-04-10 16:14    40  *********************
 ...    ..( 10 skipped).    ..  *********************
 278    2018-04-10 16:25    40  *********************
 279    2018-04-10 16:26    41  **********************
 280    2018-04-10 16:27    41  **********************

SCT Error Recovery Control:
           Read: Disabled
          Write: Disabled

Device Statistics (GP Log 0x04)
Page  Offset Size        Value Flags Description
0x01  =====  =               =  ===  == General Statistics (rev 3) ==
0x01  0x008  4               1  ---  Lifetime Power-On Resets
0x01  0x010  4               4  ---  Power-on Hours
0x01  0x018  6               0  ---  Logical Sectors Written
0x01  0x020  6               0  ---  Number of Write Commands
0x01  0x028  6      3572609576  ---  Logical Sectors Read
0x01  0x030  6        13955543  ---  Number of Read Commands
0x01  0x038  6        14400000  ---  Date and Time TimeStamp
0x02  =====  =               =  ===  == Free-Fall Statistics (rev 1) ==
0x02  0x010  4               0  ---  Overlimit Shock Events
0x03  =====  =               =  ===  == Rotating Media Statistics (rev 1) ==
0x03  0x008  4               4  ---  Spindle Motor Power-on Hours
0x03  0x010  4               3  ---  Head Flying Hours
0x03  0x018  4               3  ---  Head Load Events
0x03  0x020  4               0  ---  Number of Reallocated Logical Sectors
0x03  0x028  4               0  ---  Read Recovery Attempts
0x03  0x030  4               0  ---  Number of Mechanical Start Failures
0x03  0x038  4               0  ---  Number of Realloc. Candidate Logical Sectors
0x03  0x040  4               0  ---  Number of High Priority Unload Events
0x04  =====  =               =  ===  == General Errors Statistics (rev 1) ==
0x04  0x008  4               0  ---  Number of Reported Uncorrectable Errors
0x04  0x010  4               0  ---  Resets Between Cmd Acceptance and Completion
0x05  =====  =               =  ===  == Temperature Statistics (rev 1) ==
0x05  0x008  1              41  ---  Current Temperature
0x05  0x010  1               -  N--  Average Short Term Temperature
0x05  0x018  1               -  N--  Average Long Term Temperature
0x05  0x020  1              43  ---  Highest Temperature
0x05  0x028  1              25  ---  Lowest Temperature
0x05  0x030  1               -  N--  Highest Average Short Term Temperature
0x05  0x038  1               -  N--  Lowest Average Short Term Temperature
0x05  0x040  1               -  N--  Highest Average Long Term Temperature
0x05  0x048  1               -  N--  Lowest Average Long Term Temperature
0x05  0x050  4               0  ---  Time in Over-Temperature
0x05  0x058  1              55  ---  Specified Maximum Operating Temperature
0x05  0x060  4               0  ---  Time in Under-Temperature
0x05  0x068  1               5  ---  Specified Minimum Operating Temperature
0x06  =====  =               =  ===  == Transport Statistics (rev 1) ==
0x06  0x008  4               0  ---  Number of Hardware Resets
0x06  0x010  4               0  ---  Number of ASR Events
0x06  0x018  4               0  ---  Number of Interface CRC Errors
0x07  =====  =               =  ===  == Solid State Device Statistics (rev 1) ==
                                |||_ C monitored condition met
                                ||__ D supports DSN
                                |___ N normalized value

Pending Defects log (GP Log 0x0c) supported [please try: '-l defects']

SATA Phy Event Counters (GP Log 0x11)
ID      Size     Value  Description
0x0001  4            0  Command failed due to ICRC error
0x0002  4            0  R_ERR response for data FIS
0x0003  4            0  R_ERR response for device-to-host data FIS
0x0004  4            0  R_ERR response for host-to-device data FIS
0x0005  4            0  R_ERR response for non-data FIS
0x0006  4            0  R_ERR response for device-to-host non-data FIS
0x0007  4            0  R_ERR response for host-to-device non-data FIS
0x0008  4            0  Device-to-host non-data FIS retries
0x0009  4            0  Transition from drive PhyRdy to drive PhyNRdy
0x000a  4            0  Device-to-host register FISes sent due to a COMRESET
0x000b  4            0  CRC errors within host-to-device FIS
0x000d  4            0  Non-CRC errors within host-to-device FIS
0x000f  4            0  R_ERR response for host-to-device data FIS, CRC
0x0010  4            0  R_ERR response for host-to-device data FIS, non-CRC
0x0012  4            0  R_ERR response for host-to-device non-data FIS, CRC
0x0013  4            0  R_ERR response for host-to-device non-data FIS, non-CRC

