smartctl 6.6 2017-11-05 r4594 [x86_64-linux-3.10.0-693.21.1.el7.x86_64] (local build)
Copyright (C) 2002-17, Bruce Allen, Christian Franke, www.smartmontools.org

=== START OF INFORMATION SECTION ===
Device Model:     TOSHIBA MG06ACA10TE
Serial Number:    X7P0A013FKQE
LU WWN Device Id: 5 000039 838c80a7b
Firmware Version: 0103
User Capacity:    10,000,831,348,736 bytes [10.0 TB]
Sector Sizes:     512 bytes logical, 4096 bytes physical
Rotation Rate:    7200 rpm
Form Factor:      3.5 inches
Device is:        Not in smartctl database [for details use: -P showall]
ATA Version is:   ACS-3 T13/2161-D revision 5
SATA Version is:  SATA 3.3, 6.0 Gb/s (current: 6.0 Gb/s)
Local Time is:    Tue Apr 10 16:27:06 2018 MSK
SMART support is: Available - device has SMART capability.
SMART support is: Enabled
AAM feature is:   Unavailable
APM level is:     128 (minimum power consumption without standby)
Rd look-ahead is: Enabled
Write cache is:   Enabled
DSN feature is:   Unavailable
ATA Security is:  Disabled, NOT FROZEN [SEC1]
Wt Cache Reorder: Unknown

=== START OF READ SMART DATA SECTION ===
SMART overall-health self-assessment test result: PASSED

General SMART Values:
Offline data collection status:  (0x80)	Offline data collection activity
					was never started.
					Auto Offline Data Collection: Enabled.
Self-test execution status:      (   0)	The previous self-test routine completed
					without error or no self-test has ever 
					been run.
Total time to complete Offline 
data collection: 		(  120) seconds.
Offline data collection
capabilities: 			 (0x5b) SMART execute Offline immediate.
					Auto Offline data collection on/off support.
					Suspend Offline collection upon new
					command.
					Offline surface scan supported.
					Self-test supported.
					No Conveyance Self-test supported.
					Selective Self-test supported.
SMART capabilities:            (0x0003)	Saves SMART data before entering
					power-saving mode.
					Supports SMART auto save timer.
Error logging capability:        (0x01)	Error logging supported.
					General Purpose Logging supported.
Short self-test routine 
recommended polling time: 	 (   2) minutes.
Extended self-test routine
recommended polling time: 	 (1042) minutes.
SCT capabilities: 	       (0x003d)	SCT Status supported.
					SCT Error Recovery Control supported.
					SCT Feature Control supported.
					SCT Data Table supported.

SMART Attributes Data Structure revision number: 16
Vendor Specific SMART Attributes with Thresholds:
ID# ATTRIBUTE_NAME          FLAGS    VALUE WORST THRESH FAIL RAW_VALUE
  1 Raw_Read_Error_Rate     PO-R--   100   100   050    -    0
  2 Throughput_Performance  P-S---   100   100   050    -    0
  3 Spin_Up_Time            POS--K   100   100   001    -    9392
  4 Start_Stop_Count        -O--CK   100   100   000    -    1
  5 Reallocated_Sector_Ct   PO--CK   100   100   010    -    0
  7 Seek_Error_Rate         PO-R--   100   100   050    -    0
  8 Seek_Time_Performance   P-S---   100   100   050    -    0
  9 Power_On_Hours          -O--CK   100   100   000    -    4
 10 Spin_Retry_Count        PO--CK   100   100   030    -    0
 12 Power_Cycle_Count       -O--CK   100   100   000    -    1
191 G-Sense_Error_Rate      -O--CK   100   100   000    -    0
192 Power-Off_Retract_Count -O--CK   100   100   000    -    0
193 Load_Cycle_Count        -O--CK   100   100   000    -    2
194 Temperature_Celsius     -O---K   100   100   000    -    43 (Min/Max 26/44)
196 Reallocated_Event_Count -O--CK   100   100   000    -    0
197 Current_Pending_Sector  -O--CK   100   100   000    -    0
198 Offline_Uncorrectable   ----CK   100   100   000    -    0
199 UDMA_CRC_Error_Count    -O--CK   200   200   000    -    0
220 Disk_Shift              -O----   100   100   000    -    169345027
222 Loaded_Hours            -O--CK   100   100   000    -    1
223 Load_Retry_Count        -O--CK   100   100   000    -    0
224 Load_Friction           -O---K   100   100   000    -    0
226 Load-in_Time            -OS--K   100   100   000    -    523
240 Head_Flying_Hours       P-----   100   100   001    -    0
                            ||||||_ K auto-keep
                            |||||__ C event count
                            ||||___ R error rate
                            |||____ S speed/performance
                            ||_____ O updated online
                            |______ P prefailure warning

General Purpose Log Directory Version 1
SMART           Log Directory Version 1 [multi-sector log support]
Address    Access  R/W   Size  Description
0x00       GPL,SL  R/O      1  Log Directory
0x01           SL  R/O      1  Summary SMART error log
0x02           SL  R/O     51  Comprehensive SMART error log
0x03       GPL     R/O      5  Ext. Comprehensive SMART error log
0x04       GPL,SL  R/O      8  Device Statistics log
0x06           SL  R/O      1  SMART self-test log
0x07       GPL     R/O      1  Extended self-test log
0x08       GPL     R/O      2  Power Conditions log
0x09           SL  R/W      1  Selective self-test log
0x0c       GPL     R/O    513  Pending Defects log
0x10       GPL     R/O      1  NCQ Command Error log
0x11       GPL     R/O      1  SATA Phy Event Counters log
0x24       GPL     R/O  49152  Current Device Internal Status Data log
0x25       GPL     R/O  49152  Saved Device Internal Status Data log
0x30       GPL,SL  R/O      9  IDENTIFY DEVICE data log
0x80-0x9f  GPL,SL  R/W     16  Host vendor specific log
0xe0       GPL,SL  R/W      1  SCT Command/Status
0xe1       GPL,SL  R/W      1  SCT Data Transfer

SMART Extended Comprehensive Error Log Version: 1 (5 sectors)
No Errors Logged

SMART Extended Self-test Log Version: 1 (1 sectors)
Num  Test_Description    Status                  Remaining  LifeTime(hours)  LBA_of_first_error
# 1  Short offline       Completed without error       00%         4         -

SMART Selective self-test log data structure revision number 1
 SPAN  MIN_LBA  MAX_LBA  CURRENT_TEST_STATUS
    1        0        0  Not_testing
    2        0        0  Not_testing
    3        0        0  Not_testing
    4        0        0  Not_testing
    5        0        0  Not_testing
Selective self-test flags (0x0):
  After scanning selected spans, do NOT read-scan remainder of disk.
If Selective self-test is pending on power-up, resume after 0 minute delay.

SCT Status Version:                  3
SCT Version (vendor specific):       1 (0x0001)
SCT Support Level:                   1
Device State:                        Active (0)
Current Temperature:                    43 Celsius
Power Cycle Min/Max Temperature:     26/44 Celsius
Lifetime    Min/Max Temperature:     26/44 Celsius
Under/Over Temperature Limit Count:   0/0

SCT Temperature History Version:     2
Temperature Sampling Period:         1 minute
Temperature Logging Interval:        1 minute
Min/Max recommended Temperature:      5/55 Celsius
Min/Max Temperature Limit:           -40/70 Celsius
Temperature History Size (Index):    478 (276)

Index    Estimated Time   Temperature Celsius
 277    2018-04-10 08:30     ?  -
 ...    ..(200 skipped).    ..  -
   0    2018-04-10 11:51     ?  -
   1    2018-04-10 11:52    27  ********
   2    2018-04-10 11:53    27  ********
   3    2018-04-10 11:54    27  ********
   4    2018-04-10 11:55    28  *********
   5    2018-04-10 11:56    29  **********
   6    2018-04-10 11:57    30  ***********
   7    2018-04-10 11:58    31  ************
   8    2018-04-10 11:59    32  *************
   9    2018-04-10 12:00    33  **************
  10    2018-04-10 12:01    33  **************
  11    2018-04-10 12:02    34  ***************
  12    2018-04-10 12:03    34  ***************
  13    2018-04-10 12:04    35  ****************
  14    2018-04-10 12:05    35  ****************
  15    2018-04-10 12:06    36  *****************
  16    2018-04-10 12:07    36  *****************
  17    2018-04-10 12:08    36  *****************
  18    2018-04-10 12:09    37  ******************
  19    2018-04-10 12:10    36  *****************
  20    2018-04-10 12:11    37  ******************
 ...    ..(  9 skipped).    ..  ******************
  30    2018-04-10 12:21    37  ******************
  31    2018-04-10 12:22    38  *******************
 ...    ..(  6 skipped).    ..  *******************
  38    2018-04-10 12:29    38  *******************
  39    2018-04-10 12:30    39  ********************
 ...    ..( 12 skipped).    ..  ********************
  52    2018-04-10 12:43    39  ********************
  53    2018-04-10 12:44    40  *********************
 ...    ..( 32 skipped).    ..  *********************
  86    2018-04-10 13:17    40  *********************
  87    2018-04-10 13:18    41  **********************
  88    2018-04-10 13:19    40  *********************
  89    2018-04-10 13:20    41  **********************
  90    2018-04-10 13:21    41  **********************
  91    2018-04-10 13:22    40  *********************
  92    2018-04-10 13:23    41  **********************
 ...    ..(  2 skipped).    ..  **********************
  95    2018-04-10 13:26    41  **********************
  96    2018-04-10 13:27    40  *********************
  97    2018-04-10 13:28    41  **********************
  98    2018-04-10 13:29    41  **********************
  99    2018-04-10 13:30    41  **********************
 100    2018-04-10 13:31    40  *********************
 101    2018-04-10 13:32    41  **********************
 102    2018-04-10 13:33    41  **********************
 103    2018-04-10 13:34    40  *********************
 104    2018-04-10 13:35    41  **********************
 ...    ..(  2 skipped).    ..  **********************
 107    2018-04-10 13:38    41  **********************
 108    2018-04-10 13:39    40  *********************
 109    2018-04-10 13:40    41  **********************
 ...    ..( 64 skipped).    ..  **********************
 174    2018-04-10 14:45    41  **********************
 175    2018-04-10 14:46    42  ***********************
 ...    ..(  4 skipped).    ..  ***********************
 180    2018-04-10 14:51    42  ***********************
 181    2018-04-10 14:52    43  ************************
 ...    ..(  5 skipped).    ..  ************************
 187    2018-04-10 14:58    43  ************************
 188    2018-04-10 14:59    44  *************************
 ...    ..( 51 skipped).    ..  *************************
 240    2018-04-10 15:51    44  *************************
 241    2018-04-10 15:52    43  ************************
 ...    ..(  2 skipped).    ..  ************************
 244    2018-04-10 15:55    43  ************************
 245    2018-04-10 15:56    44  *************************
 246    2018-04-10 15:57    43  ************************
 ...    ..(  3 skipped).    ..  ************************
 250    2018-04-10 16:01    43  ************************
 251    2018-04-10 16:02    44  *************************
 ...    ..(  3 skipped).    ..  *************************
 255    2018-04-10 16:06    44  *************************
 256    2018-04-10 16:07    43  ************************
 257    2018-04-10 16:08    44  *************************
 ...    ..( 12 skipped).    ..  *************************
 270    2018-04-10 16:21    44  *************************
 271    2018-04-10 16:22    43  ************************
 ...    ..(  4 skipped).    ..  ************************
 276    2018-04-10 16:27    43  ************************

SCT Error Recovery Control:
           Read: Disabled
          Write: Disabled

Device Statistics (GP Log 0x04)
Page  Offset Size        Value Flags Description
0x01  =====  =               =  ===  == General Statistics (rev 3) ==
0x01  0x008  4               1  ---  Lifetime Power-On Resets
0x01  0x010  4               4  ---  Power-on Hours
0x01  0x018  6               0  ---  Logical Sectors Written
0x01  0x020  6               0  ---  Number of Write Commands
0x01  0x028  6      2170554408  ---  Logical Sectors Read
0x01  0x030  6         8478765  ---  Number of Read Commands
0x01  0x038  6        14400000  ---  Date and Time TimeStamp
0x02  =====  =               =  ===  == Free-Fall Statistics (rev 1) ==
0x02  0x010  4               0  ---  Overlimit Shock Events
0x03  =====  =               =  ===  == Rotating Media Statistics (rev 1) ==
0x03  0x008  4               4  ---  Spindle Motor Power-on Hours
0x03  0x010  4               1  ---  Head Flying Hours
0x03  0x018  4               2  ---  Head Load Events
0x03  0x020  4               0  ---  Number of Reallocated Logical Sectors
0x03  0x028  4               0  ---  Read Recovery Attempts
0x03  0x030  4               0  ---  Number of Mechanical Start Failures
0x03  0x038  4               0  ---  Number of Realloc. Candidate Logical Sectors
0x03  0x040  4               0  ---  Number of High Priority Unload Events
0x04  =====  =               =  ===  == General Errors Statistics (rev 1) ==
0x04  0x008  4               0  ---  Number of Reported Uncorrectable Errors
0x04  0x010  4               0  ---  Resets Between Cmd Acceptance and Completion
0x05  =====  =               =  ===  == Temperature Statistics (rev 1) ==
0x05  0x008  1              43  ---  Current Temperature
0x05  0x010  1               -  N--  Average Short Term Temperature
0x05  0x018  1               -  N--  Average Long Term Temperature
0x05  0x020  1              44  ---  Highest Temperature
0x05  0x028  1              26  ---  Lowest Temperature
0x05  0x030  1               -  N--  Highest Average Short Term Temperature
0x05  0x038  1               -  N--  Lowest Average Short Term Temperature
0x05  0x040  1               -  N--  Highest Average Long Term Temperature
0x05  0x048  1               -  N--  Lowest Average Long Term Temperature
0x05  0x050  4               0  ---  Time in Over-Temperature
0x05  0x058  1              55  ---  Specified Maximum Operating Temperature
0x05  0x060  4               0  ---  Time in Under-Temperature
0x05  0x068  1               5  ---  Specified Minimum Operating Temperature
0x06  =====  =               =  ===  == Transport Statistics (rev 1) ==
0x06  0x008  4               0  ---  Number of Hardware Resets
0x06  0x010  4               0  ---  Number of ASR Events
0x06  0x018  4               0  ---  Number of Interface CRC Errors
0x07  =====  =               =  ===  == Solid State Device Statistics (rev 1) ==
                                |||_ C monitored condition met
                                ||__ D supports DSN
                                |___ N normalized value

Pending Defects log (GP Log 0x0c) supported [please try: '-l defects']

SATA Phy Event Counters (GP Log 0x11)
ID      Size     Value  Description
0x0001  4            0  Command failed due to ICRC error
0x0002  4            0  R_ERR response for data FIS
0x0003  4            0  R_ERR response for device-to-host data FIS
0x0004  4            0  R_ERR response for host-to-device data FIS
0x0005  4            0  R_ERR response for non-data FIS
0x0006  4            0  R_ERR response for device-to-host non-data FIS
0x0007  4            0  R_ERR response for host-to-device non-data FIS
0x0008  4            0  Device-to-host non-data FIS retries
0x0009  4            0  Transition from drive PhyRdy to drive PhyNRdy
0x000a  4            0  Device-to-host register FISes sent due to a COMRESET
0x000b  4            0  CRC errors within host-to-device FIS
0x000d  4            0  Non-CRC errors within host-to-device FIS
0x000f  4            0  R_ERR response for host-to-device data FIS, CRC
0x0010  4            0  R_ERR response for host-to-device data FIS, non-CRC
0x0012  4            0  R_ERR response for host-to-device non-data FIS, CRC
0x0013  4            0  R_ERR response for host-to-device non-data FIS, non-CRC

