smartctl 6.5 2016-01-24 r4214 [x86_64-linux-5.3.0-24-generic] (local build)
Copyright (C) 2002-16, Bruce Allen, Christian Franke, www.smartmontools.org

=== START OF INFORMATION SECTION ===
Device Model:     WDC  WSH722020ALE6L0
Serial Number:    3HG06ERF
LU WWN Device Id: 5 000cca 29dc0182f
Firmware Version: PCGMT421
User Capacity:    20,000,588,955,648 bytes [20.0 TB]
Sector Sizes:     512 bytes logical, 4096 bytes physical
Rotation Rate:    7200 rpm
Form Factor:      3.5 inches
Device is:        Not in smartctl database [for details use: -P showall]
ATA Version is:   Unknown(0x0ffc) (unknown minor revision code: 0x009c)
SATA Version is:  SATA >3.2 (0x1ff), 6.0 Gb/s (current: 3.0 Gb/s)
Local Time is:    Wed Nov 17 16:52:53 2021 CST
SMART support is: Available - device has SMART capability.
SMART support is: Enabled
AAM feature is:   Unavailable
APM level is:     254 (maximum performance)
Rd look-ahead is: Enabled
Write cache is:   Enabled
ATA Security is:  Disabled, NOT FROZEN [SEC1]
Wt Cache Reorder: Enabled

=== START OF READ SMART DATA SECTION ===
SMART overall-health self-assessment test result: PASSED

General SMART Values:
Offline data collection status:  (0x80)	Offline data collection activity
					was never started.
					Auto Offline Data Collection: Enabled.
Self-test execution status:      (   0)	The previous self-test routine completed
					without error or no self-test has ever 
					been run.
Total time to complete Offline 
data collection: 		(  101) seconds.
Offline data collection
capabilities: 			 (0x5b) SMART execute Offline immediate.
					Auto Offline data collection on/off support.
					Suspend Offline collection upon new
					command.
					Offline surface scan supported.
					Self-test supported.
					No Conveyance Self-test supported.
					Selective Self-test supported.
SMART capabilities:            (0x0003)	Saves SMART data before entering
					power-saving mode.
					Supports SMART auto save timer.
Error logging capability:        (0x01)	Error logging supported.
					General Purpose Logging supported.
Short self-test routine 
recommended polling time: 	 (   2) minutes.
Extended self-test routine
recommended polling time: 	 (2340) minutes.
SCT capabilities: 	       (0x003d)	SCT Status supported.
					SCT Error Recovery Control supported.
					SCT Feature Control supported.
					SCT Data Table supported.

SMART Attributes Data Structure revision number: 16
Vendor Specific SMART Attributes with Thresholds:
ID# ATTRIBUTE_NAME          FLAGS    VALUE WORST THRESH FAIL RAW_VALUE
  1 Raw_Read_Error_Rate     PO-R--   100   100   001    -    0
  2 Throughput_Performance  P-S---   155   155   054    -    20
  3 Spin_Up_Time            POS---   084   084   001    -    329 (Average 330)
  4 Start_Stop_Count        -O--C-   100   100   000    -    4
  5 Reallocated_Sector_Ct   PO--CK   100   100   001    -    0
  7 Seek_Error_Rate         PO-R--   100   100   001    -    0
  8 Seek_Time_Performance   P-S---   140   140   020    -    15
  9 Power_On_Hours          -O--C-   100   100   000    -    539
 10 Spin_Retry_Count        PO--C-   100   100   001    -    0
 12 Power_Cycle_Count       -O--CK   100   100   000    -    4
 22 Unknown_Attribute       PO---K   100   100   025    -    100
192 Power-Off_Retract_Count -O--CK   100   100   000    -    443
193 Load_Cycle_Count        -O--C-   100   100   000    -    443
194 Temperature_Celsius     -O----   066   066   000    -    29 (Min/Max 21/34)
196 Reallocated_Event_Count -O--CK   100   100   000    -    0
197 Current_Pending_Sector  -O---K   100   100   000    -    0
198 Offline_Uncorrectable   ---R--   100   100   000    -    0
199 UDMA_CRC_Error_Count    -O-R--   100   100   000    -    0
                            ||||||_ K auto-keep
                            |||||__ C event count
                            ||||___ R error rate
                            |||____ S speed/performance
                            ||_____ O updated online
                            |______ P prefailure warning

General Purpose Log Directory Version 1
SMART           Log Directory Version 1 [multi-sector log support]
Address    Access  R/W   Size  Description
0x00       GPL,SL  R/O      1  Log Directory
0x01           SL  R/O      1  Summary SMART error log
0x02           SL  R/O      1  Comprehensive SMART error log
0x03       GPL     R/O      1  Ext. Comprehensive SMART error log
0x04       GPL     R/O    256  Device Statistics log
0x04       SL      R/O    255  Device Statistics log
0x06           SL  R/O      1  SMART self-test log
0x07       GPL     R/O      1  Extended self-test log
0x08       GPL     R/O      2  Power Conditions log
0x09           SL  R/W      1  Selective self-test log
0x0c       GPL     R/O  30001  Pending Defects log
0x10       GPL     R/O      2  SATA NCQ Queued Error log
0x11       GPL     R/O      1  SATA Phy Event Counters log
0x12       GPL     R/O      1  SATA NCQ NON-DATA log
0x13       GPL     R/O      1  SATA NCQ Send and Receive log
0x15       GPL     R/W      1  SATA Rebuild Assist log
0x24       GPL     R/O    256  Current Device Internal Status Data log
0x25       GPL     R/O    256  Saved Device Internal Status Data log
0x2f       GPL     -        1  Reserved
0x30       GPL,SL  R/O     10  IDENTIFY DEVICE data log
0x80-0x9f  GPL,SL  R/W     16  Host vendor specific log
0xe0       GPL,SL  R/W      1  SCT Command/Status
0xe1       GPL,SL  R/W      1  SCT Data Transfer

SMART Extended Comprehensive Error Log Version: 1 (1 sectors)
No Errors Logged

SMART Extended Self-test Log Version: 1 (1 sectors)
Num  Test_Description    Status                  Remaining  LifeTime(hours)  LBA_of_first_error
# 1  Short offline       Completed without error       00%       538         -

SMART Selective self-test log data structure revision number 1
 SPAN  MIN_LBA  MAX_LBA  CURRENT_TEST_STATUS
    1        0        0  Not_testing
    2        0        0  Not_testing
    3        0        0  Not_testing
    4        0        0  Not_testing
    5        0        0  Not_testing
Selective self-test flags (0x0):
  After scanning selected spans, do NOT read-scan remainder of disk.
If Selective self-test is pending on power-up, resume after 0 minute delay.

SCT Status Version:                  3
SCT Version (vendor specific):       256 (0x0100)
SCT Support Level:                   0
Device State:                        Active (0)
Current Temperature:                    29 Celsius
Power Cycle Min/Max Temperature:     23/29 Celsius
Lifetime    Min/Max Temperature:     21/34 Celsius
Under/Over Temperature Limit Count:   0/0
SMART Status:                        0xc24f (PASSED)

SCT Temperature History Version:     2
Temperature Sampling Period:         1 minute
Temperature Logging Interval:        1 minute
Min/Max recommended Temperature:      0/60 Celsius
Min/Max Temperature Limit:           -40/70 Celsius
Temperature History Size (Index):    128 (105)

Index    Estimated Time   Temperature Celsius
 106    2021-11-17 14:45    29  **********
 ...    ..(  4 skipped).    ..  **********
 111    2021-11-17 14:50    29  **********
 112    2021-11-17 14:51    28  *********
 113    2021-11-17 14:52    28  *********
 114    2021-11-17 14:53    29  **********
 ...    ..(  2 skipped).    ..  **********
 117    2021-11-17 14:56    29  **********
 118    2021-11-17 14:57    30  ***********
 ...    ..(  7 skipped).    ..  ***********
 126    2021-11-17 15:05    30  ***********
 127    2021-11-17 15:06    29  **********
 ...    ..( 13 skipped).    ..  **********
  13    2021-11-17 15:20    29  **********
  14    2021-11-17 15:21    28  *********
  15    2021-11-17 15:22    28  *********
  16    2021-11-17 15:23    29  **********
 ...    ..(  2 skipped).    ..  **********
  19    2021-11-17 15:26    29  **********
  20    2021-11-17 15:27    30  ***********
 ...    ..(  7 skipped).    ..  ***********
  28    2021-11-17 15:35    30  ***********
  29    2021-11-17 15:36    29  **********
 ...    ..( 19 skipped).    ..  **********
  49    2021-11-17 15:56    29  **********
  50    2021-11-17 15:57    30  ***********
 ...    ..(  8 skipped).    ..  ***********
  59    2021-11-17 16:06    30  ***********
  60    2021-11-17 16:07    29  **********
 ...    ..( 17 skipped).    ..  **********
  78    2021-11-17 16:25    29  **********
  79    2021-11-17 16:26    30  ***********
 ...    ..(  4 skipped).    ..  ***********
  84    2021-11-17 16:31    30  ***********
  85    2021-11-17 16:32    23  ****
  86    2021-11-17 16:33    24  *****
  87    2021-11-17 16:34    25  ******
  88    2021-11-17 16:35    25  ******
  89    2021-11-17 16:36    26  *******
  90    2021-11-17 16:37    26  *******
  91    2021-11-17 16:38    26  *******
  92    2021-11-17 16:39    27  ********
 ...    ..(  2 skipped).    ..  ********
  95    2021-11-17 16:42    27  ********
  96    2021-11-17 16:43    28  *********
  97    2021-11-17 16:44    28  *********
  98    2021-11-17 16:45    29  **********
 ...    ..(  6 skipped).    ..  **********
 105    2021-11-17 16:52    29  **********

SCT Error Recovery Control:
           Read: Disabled
          Write: Disabled

Device Statistics (GP/SMART Log 0x04) not supported

SATA Phy Event Counters (GP Log 0x11)
ID      Size     Value  Description
0x0001  2            0  Command failed due to ICRC error
0x0002  2            0  R_ERR response for data FIS
0x0003  2            0  R_ERR response for device-to-host data FIS
0x0004  2            0  R_ERR response for host-to-device data FIS
0x0005  2            0  R_ERR response for non-data FIS
0x0006  2            0  R_ERR response for device-to-host non-data FIS
0x0007  2            0  R_ERR response for host-to-device non-data FIS
0x0008  2            0  Device-to-host non-data FIS retries
0x0009  2            2  Transition from drive PhyRdy to drive PhyNRdy
0x000a  2            1  Device-to-host register FISes sent due to a COMRESET
0x000b  2            0  CRC errors within host-to-device FIS
0x000d  2            0  Non-CRC errors within host-to-device FIS

