smartctl 6.5 2016-05-07 r4318 [x86_64-w64-mingw32-win7-sp1] (sf-6.5-1)
Copyright (C) 2002-16, Bruce Allen, Christian Franke, www.smartmontools.org

=== START OF INFORMATION SECTION ===
Model Family:     Hitachi CinemaStar 5K1000
Device Model:     Hitachi HCS5C1010CLA382
Firmware Version: JC4OA3EA
User Capacity:    1 000 204 886 016 bytes [1,00 TB]
Sector Size:      512 bytes logical/physical
Rotation Rate:    5700 rpm
Form Factor:      3.5 inches
Device is:        In smartctl database [for details use: -P show]
ATA Version is:   ATA8-ACS T13/1699-D revision 4
SATA Version is:  SATA 2.6, 3.0 Gb/s
Local Time is:    Sat Oct 29 11:31:19 2016 PM
SMART support is: Available - device has SMART capability.
SMART support is: Enabled
AAM feature is:   Unavailable
APM feature is:   Disabled
Rd look-ahead is: Enabled
Write cache is:   Enabled
ATA Security is:  Disabled, frozen [SEC2]
Wt Cache Reorder: Enabled

=== START OF READ SMART DATA SECTION ===
SMART overall-health self-assessment test result: PASSED

General SMART Values:
Offline data collection status:  (0x82)	Offline data collection activity
					was completed without error.
					Auto Offline Data Collection: Enabled.
Self-test execution status:      (   0)	The previous self-test routine completed
					without error or no self-test has ever 
					been run.
Total time to complete Offline 
data collection: 		(12382) seconds.
Offline data collection
capabilities: 			 (0x5b) SMART execute Offline immediate.
					Auto Offline data collection on/off support.
					Suspend Offline collection upon new
					command.
					Offline surface scan supported.
					Self-test supported.
					No Conveyance Self-test supported.
					Selective Self-test supported.
SMART capabilities:            (0x0003)	Saves SMART data before entering
					power-saving mode.
					Supports SMART auto save timer.
Error logging capability:        (0x01)	Error logging supported.
					General Purpose Logging supported.
Short self-test routine 
recommended polling time: 	 (   1) minutes.
Extended self-test routine
recommended polling time: 	 ( 206) minutes.
SCT capabilities: 	       (0x003d)	SCT Status supported.
					SCT Error Recovery Control supported.
					SCT Feature Control supported.
					SCT Data Table supported.

SMART Attributes Data Structure revision number: 16
Vendor Specific SMART Attributes with Thresholds:
ID# ATTRIBUTE_NAME          FLAGS    VALUE WORST THRESH FAIL RAW_VALUE
  1 Raw_Read_Error_Rate     PO-R--   100   100   016    -    0
  2 Throughput_Performance  P-S---   136   136   054    -    113
  3 Spin_Up_Time            POS---   130   130   024    -    272 (Average 263)
  4 Start_Stop_Count        -O--C-   100   100   000    -    3099
  5 Reallocated_Sector_Ct   PO--CK   100   100   005    -    0
  7 Seek_Error_Rate         PO-R--   100   100   067    -    0
  8 Seek_Time_Performance   P-S---   131   131   020    -    38
  9 Power_On_Hours          -O--C-   095   095   000    -    39685
 10 Spin_Retry_Count        PO--C-   100   100   060    -    0
 12 Power_Cycle_Count       -O--CK   100   100   000    -    583
192 Power-Off_Retract_Count -O--CK   098   098   000    -    3101
193 Load_Cycle_Count        -O--C-   098   098   000    -    3101
194 Temperature_Celsius     -O----   153   153   000    -    39 (Min/Max 18/50)
196 Reallocated_Event_Count -O--CK   100   100   000    -    0
197 Current_Pending_Sector  -O---K   100   100   000    -    0
198 Offline_Uncorrectable   ---R--   100   100   000    -    0
199 UDMA_CRC_Error_Count    -O-R--   200   200   000    -    10
                            ||||||_ K auto-keep
                            |||||__ C event count
                            ||||___ R error rate
                            |||____ S speed/performance
                            ||_____ O updated online
                            |______ P prefailure warning

General Purpose Log Directory Version 1
SMART           Log Directory Version 1 [multi-sector log support]
Address    Access  R/W   Size  Description
0x00       GPL,SL  R/O      1  Log Directory
0x01           SL  R/O      1  Summary SMART error log
0x03       GPL     R/O      1  Ext. Comprehensive SMART error log
0x04       GPL     R/O      7  Device Statistics log
0x06           SL  R/O      1  SMART self-test log
0x07       GPL     R/O      1  Extended self-test log
0x09           SL  R/W      1  Selective self-test log
0x10       GPL     R/O      1  SATA NCQ Queued Error log
0x11       GPL     R/O      1  SATA Phy Event Counters log
0x20       GPL     R/O      1  Streaming performance log [OBS-8]
0x21       GPL     R/O      1  Write stream error log
0x22       GPL     R/O      1  Read stream error log
0x80-0x9f  GPL,SL  R/W     16  Host vendor specific log
0xe0       GPL,SL  R/W      1  SCT Command/Status
0xe1       GPL,SL  R/W      1  SCT Data Transfer

SMART Extended Comprehensive Error Log Version: 0 (1 sectors)
No Errors Logged

SMART Extended Self-test Log Version: 1 (1 sectors)
Num  Test_Description    Status                  Remaining  LifeTime(hours)  LBA_of_first_error
# 1  Short offline       Completed without error       00%     39685         -
# 2  Extended offline    Completed without error       00%     39229         -
# 3  Short offline       Completed without error       00%     39225         -
# 4  Short offline       Completed without error       00%      1407         -
# 5  Short offline       Completed without error       00%       593         -

SMART Selective self-test log data structure revision number 1
 SPAN  MIN_LBA  MAX_LBA  CURRENT_TEST_STATUS
    1        0        0  Not_testing
    2        0        0  Not_testing
    3        0        0  Not_testing
    4        0        0  Not_testing
    5        0        0  Not_testing
Selective self-test flags (0x0):
  After scanning selected spans, do NOT read-scan remainder of disk.
If Selective self-test is pending on power-up, resume after 0 minute delay.

SCT Status Version:                  3
SCT Version (vendor specific):       256 (0x0100)
SCT Support Level:                   1
Device State:                        Active (0)
Current Temperature:                    39 Celsius
Power Cycle Min/Max Temperature:     28/48 Celsius
Lifetime    Min/Max Temperature:     18/50 Celsius
Under/Over Temperature Limit Count:   0/0

SCT Temperature History Version:     2
Temperature Sampling Period:         1 minute
Temperature Logging Interval:        1 minute
Min/Max recommended Temperature:      0/60 Celsius
Min/Max Temperature Limit:           -40/70 Celsius
Temperature History Size (Index):    128 (0)

Index    Estimated Time   Temperature Celsius
   1    2016-10-29 09:24    47  ****************************
 ...    ..( 16 skipped).    ..  ****************************
  18    2016-10-29 09:41    47  ****************************
  19    2016-10-29 09:42    46  ***************************
 ...    ..(  2 skipped).    ..  ***************************
  22    2016-10-29 09:45    46  ***************************
  23    2016-10-29 09:46    45  **************************
 ...    ..(  7 skipped).    ..  **************************
  31    2016-10-29 09:54    45  **************************
  32    2016-10-29 09:55    44  *************************
  33    2016-10-29 09:56    45  **************************
 ...    ..(  7 skipped).    ..  **************************
  41    2016-10-29 10:04    45  **************************
  42    2016-10-29 10:05    46  ***************************
 ...    ..( 24 skipped).    ..  ***************************
  67    2016-10-29 10:30    46  ***************************
  68    2016-10-29 10:31    47  ****************************
 ...    ..(  3 skipped).    ..  ****************************
  72    2016-10-29 10:35    47  ****************************
  73    2016-10-29 10:36    46  ***************************
  74    2016-10-29 10:37    46  ***************************
  75    2016-10-29 10:38    46  ***************************
  76    2016-10-29 10:39    45  **************************
 ...    ..(  8 skipped).    ..  **************************
  85    2016-10-29 10:48    45  **************************
  86    2016-10-29 10:49    44  *************************
 ...    ..(  8 skipped).    ..  *************************
  95    2016-10-29 10:58    44  *************************
  96    2016-10-29 10:59    43  ************************
 ...    ..(  2 skipped).    ..  ************************
  99    2016-10-29 11:02    43  ************************
 100    2016-10-29 11:03    42  ***********************
 ...    ..(  2 skipped).    ..  ***********************
 103    2016-10-29 11:06    42  ***********************
 104    2016-10-29 11:07    41  **********************
 ...    ..(  4 skipped).    ..  **********************
 109    2016-10-29 11:12    41  **********************
 110    2016-10-29 11:13    40  *********************
 ...    ..(  8 skipped).    ..  *********************
 119    2016-10-29 11:22    40  *********************
 120    2016-10-29 11:23    39  ********************
 ...    ..(  7 skipped).    ..  ********************
   0    2016-10-29 11:31    39  ********************

SCT Error Recovery Control:
           Read: Disabled
          Write: Disabled

Device Statistics (GP Log 0x04)
Page  Offset Size        Value Flags Description
0x01  =====  =               =  ===  == General Statistics (rev 1) ==
0x01  0x008  4             583  ---  Lifetime Power-On Resets
0x01  0x010  4           39685  ---  Power-on Hours
0x01  0x018  6     19307587043  ---  Logical Sectors Written
0x01  0x020  6       150839389  ---  Number of Write Commands
0x01  0x028  6     59800477949  ---  Logical Sectors Read
0x01  0x030  6       249090489  ---  Number of Read Commands
0x03  =====  =               =  ===  == Rotating Media Statistics (rev 1) ==
0x03  0x008  4           37084  ---  Spindle Motor Power-on Hours
0x03  0x010  4           37092  ---  Head Flying Hours
0x03  0x018  4            3101  ---  Head Load Events
0x03  0x020  4               0  ---  Number of Reallocated Logical Sectors
0x03  0x028  4              10  ---  Read Recovery Attempts
0x03  0x030  4               3  ---  Number of Mechanical Start Failures
0x04  =====  =               =  ===  == General Errors Statistics (rev 1) ==
0x04  0x008  4               0  ---  Number of Reported Uncorrectable Errors
0x04  0x010  4            1021  ---  Resets Between Cmd Acceptance and Completion
0x05  =====  =               =  ===  == Temperature Statistics (rev 1) ==
0x05  0x008  1              39  ---  Current Temperature
0x05  0x010  1              36  N--  Average Short Term Temperature
0x05  0x018  1              33  N--  Average Long Term Temperature
0x05  0x020  1              50  ---  Highest Temperature
0x05  0x028  1              18  ---  Lowest Temperature
0x05  0x030  1              46  N--  Highest Average Short Term Temperature
0x05  0x038  1               0  N--  Lowest Average Short Term Temperature
0x05  0x040  1              42  N--  Highest Average Long Term Temperature
0x05  0x048  1               0  N--  Lowest Average Long Term Temperature
0x05  0x050  4               0  ---  Time in Over-Temperature
0x05  0x058  1              60  ---  Specified Maximum Operating Temperature
0x05  0x060  4               0  ---  Time in Under-Temperature
0x05  0x068  1               0  ---  Specified Minimum Operating Temperature
0x06  =====  =               =  ===  == Transport Statistics (rev 1) ==
0x06  0x008  4            2054  ---  Number of Hardware Resets
0x06  0x010  4            1221  ---  Number of ASR Events
0x06  0x018  4              10  ---  Number of Interface CRC Errors
                                |||_ C monitored condition met
                                ||__ D supports DSN
                                |___ N normalized value

SATA Phy Event Counters (GP Log 0x11)
ID      Size     Value  Description
0x0001  2            0  Command failed due to ICRC error
0x0002  2            0  R_ERR response for data FIS
0x0005  2            0  R_ERR response for non-data FIS
0x0009  2            9  Transition from drive PhyRdy to drive PhyNRdy
0x000a  2            8  Device-to-host register FISes sent due to a COMRESET
0x000b  2            0  CRC errors within host-to-device FIS
0x000d  2            0  Non-CRC errors within host-to-device FIS

