smartctl 7.0 2018-12-30 r4883 [x86_64-linux-4.19.44] (local build)
Copyright (C) 2002-18, Bruce Allen, Christian Franke, www.smartmontools.org

=== START OF INFORMATION SECTION ===
Device Model:     ADATA SU900
Firmware Version: Q0710B
User Capacity:    256 060 514 304 bytes [256 GB]
Sector Sizes:     512 bytes logical, 4096 bytes physical
Rotation Rate:    Solid State Device
Form Factor:      2.5 inches
Device is:        Not in smartctl database [for details use: -P showall]
ATA Version is:   ACS-2 (minor revision not indicated)
SATA Version is:  SATA 3.1, 6.0 Gb/s (current: 3.0 Gb/s)
Local Time is:    Mon May 20 12:20:10 2019 CEST
SMART support is: Available - device has SMART capability.
SMART support is: Enabled
AAM feature is:   Unavailable
APM feature is:   Unavailable
Rd look-ahead is: Enabled
Write cache is:   Enabled
DSN feature is:   Unavailable
ATA Security is:  Disabled, frozen [SEC2]
Wt Cache Reorder: Unknown (0xe000)

=== START OF READ SMART DATA SECTION ===
SMART overall-health self-assessment test result: PASSED

General SMART Values:
Offline data collection status:  (0x82)	Offline data collection activity
					was completed without error.
					Auto Offline Data Collection: Enabled.
Self-test execution status:      (   0)	The previous self-test routine completed
					without error or no self-test has ever 
					been run.
Total time to complete Offline 
data collection: 		(    0) seconds.
Offline data collection
capabilities: 			 (0x71) SMART execute Offline immediate.
					No Auto Offline data collection support.
					Suspend Offline collection upon new
					command.
					No Offline surface scan supported.
					Self-test supported.
					Conveyance Self-test supported.
					Selective Self-test supported.
SMART capabilities:            (0x0002)	Does not save SMART data before
					entering power-saving mode.
					Supports SMART auto save timer.
Error logging capability:        (0x01)	Error logging supported.
					General Purpose Logging supported.
Short self-test routine 
recommended polling time: 	 (   2) minutes.
Extended self-test routine
recommended polling time: 	 (  10) minutes.
Conveyance self-test routine
recommended polling time: 	 (   2) minutes.
SCT capabilities: 	       (0x003d)	SCT Status supported.
					SCT Error Recovery Control supported.
					SCT Feature Control supported.
					SCT Data Table supported.

SMART Attributes Data Structure revision number: 1
Vendor Specific SMART Attributes with Thresholds:
ID# ATTRIBUTE_NAME          FLAGS    VALUE WORST THRESH FAIL RAW_VALUE
  1 Raw_Read_Error_Rate     ------   100   100   000    -    0
  5 Reallocated_Sector_Ct   ------   100   100   000    -    0
  9 Power_On_Hours          ------   100   100   000    -    1330
 12 Power_Cycle_Count       ------   100   100   000    -    215
148 Unknown_Attribute       ------   100   100   000    -    269
149 Unknown_Attribute       ------   100   100   000    -    37
150 Unknown_Attribute       ------   100   100   000    -    0
151 Unknown_Attribute       ------   100   100   000    -    16
159 Unknown_Attribute       ------   100   100   000    -    0
160 Unknown_Attribute       ------   100   100   000    -    0
161 Unknown_Attribute       ------   100   100   000    -    29
163 Unknown_Attribute       ------   100   100   000    -    8
164 Unknown_Attribute       ------   100   100   000    -    10734
165 Unknown_Attribute       ------   100   100   000    -    81
166 Unknown_Attribute       ------   100   100   000    -    4
167 Unknown_Attribute       ------   100   100   000    -    20
168 Unknown_Attribute       ------   100   100   000    -    3000
169 Unknown_Attribute       ------   100   100   000    -    100
177 Wear_Leveling_Count     ------   100   100   050    -    0
181 Program_Fail_Cnt_Total  ------   100   100   000    -    0
182 Erase_Fail_Count_Total  ------   100   100   000    -    0
187 Reported_Uncorrect      ------   100   100   000    -    0
192 Power-Off_Retract_Count ------   100   100   000    -    10
194 Temperature_Celsius     ------   100   100   000    -    52
196 Reallocated_Event_Count ------   100   100   016    -    0
199 UDMA_CRC_Error_Count    ------   100   100   050    -    1
232 Available_Reservd_Space ------   100   100   000    -    100
241 Total_LBAs_Written      ------   100   100   000    -    39808
242 Total_LBAs_Read         ------   100   100   000    -    18834
245 Unknown_Attribute       ------   100   100   000    -    171744
                            ||||||_ K auto-keep
                            |||||__ C event count
                            ||||___ R error rate
                            |||____ S speed/performance
                            ||_____ O updated online
                            |______ P prefailure warning

General Purpose Log Directory Version 1
SMART           Log Directory Version 1 [multi-sector log support]
Address    Access  R/W   Size  Description
0x00       GPL,SL  R/O      1  Log Directory
0x01           SL  R/O      1  Summary SMART error log
0x02           SL  R/O      1  Comprehensive SMART error log
0x03       GPL     R/O      1  Ext. Comprehensive SMART error log
0x04       GPL,SL  R/O      8  Device Statistics log
0x06           SL  R/O      1  SMART self-test log
0x07       GPL     R/O      1  Extended self-test log
0x09           SL  R/W      1  Selective self-test log
0x10       GPL     R/O      1  NCQ Command Error log
0x11       GPL     R/O      1  SATA Phy Event Counters log
0x24       GPL     R/O     88  Current Device Internal Status Data log
0x25       GPL     R/O    128  Saved Device Internal Status Data log
0x30       GPL,SL  R/O      9  IDENTIFY DEVICE data log
0x80-0x9f  GPL,SL  R/W     16  Host vendor specific log
0xe0       GPL,SL  R/W      1  SCT Command/Status
0xe1       GPL,SL  R/W      1  SCT Data Transfer

SMART Extended Comprehensive Error Log Version: 1 (1 sectors)
No Errors Logged

SMART Extended Self-test Log Version: 1 (1 sectors)
Num  Test_Description    Status                  Remaining  LifeTime(hours)  LBA_of_first_error
# 1  Short offline       Completed without error       00%      1330         -
# 2  Extended offline    Completed without error       00%      1269         -
# 3  Extended offline    Completed without error       00%       616         -
# 4  Extended offline    Completed without error       00%         4         -
# 5  Short offline       Completed without error       00%         0         -

SMART Selective self-test log data structure revision number 1
 SPAN  MIN_LBA  MAX_LBA  CURRENT_TEST_STATUS
    1        0        0  Not_testing
    2        0        0  Not_testing
    3        0        0  Not_testing
    4        0        0  Not_testing
    5        0        0  Not_testing
Selective self-test flags (0x0):
  After scanning selected spans, do NOT read-scan remainder of disk.
If Selective self-test is pending on power-up, resume after 0 minute delay.

SCT Status Version:                  3
SCT Version (vendor specific):       0 (0x0000)
Device State:                        Active (0)
Current Temperature:                     0 Celsius
Power Cycle Min/Max Temperature:     30/53 Celsius
Lifetime    Min/Max Temperature:      0/61 Celsius
Under/Over Temperature Limit Count:   0/0

SCT Temperature History Version:     2
Temperature Sampling Period:         1 minute
Temperature Logging Interval:        1 minute
Min/Max recommended Temperature:      0/100 Celsius
Min/Max Temperature Limit:            0/100 Celsius
Temperature History Size (Index):    128 (75)

Index    Estimated Time   Temperature Celsius
  76    2019-05-20 10:13    52  *********************************
 ...    ..( 46 skipped).    ..  *********************************
 123    2019-05-20 11:00    52  *********************************
 124    2019-05-20 11:01    53  **********************************
 125    2019-05-20 11:02    53  **********************************
 126    2019-05-20 11:03    52  *********************************
 ...    ..( 76 skipped).    ..  *********************************
  75    2019-05-20 12:20    52  *********************************

SCT Error Recovery Control:
           Read: Disabled
          Write: Disabled

Device Statistics (GP Log 0x04)
Page  Offset Size        Value Flags Description
0x01  =====  =               =  ===  == General Statistics (rev 2) ==
0x01  0x008  4             215  ---  Lifetime Power-On Resets
0x01  0x010  4            1330  ---  Power-on Hours
0x01  0x018  6      2608876357  ---  Logical Sectors Written
0x01  0x020  6        32383674  ---  Number of Write Commands
0x01  0x028  6      1234351220  ---  Logical Sectors Read
0x01  0x030  6        22558519  ---  Number of Read Commands
0x04  =====  =               =  ===  == General Errors Statistics (rev 1) ==
0x04  0x008  4               0  ---  Number of Reported Uncorrectable Errors
0x04  0x010  4              10  ---  Resets Between Cmd Acceptance and Completion
0x05  =====  =               =  ===  == Temperature Statistics (rev 1) ==
0x05  0x008  1              52  ---  Current Temperature
0x05  0x020  1              61  ---  Highest Temperature
0x05  0x028  1               0  ---  Lowest Temperature
0x05  0x058  1              85  ---  Specified Maximum Operating Temperature
0x06  =====  =               =  ===  == Transport Statistics (rev 1) ==
0x06  0x008  4            1212  ---  Number of Hardware Resets
0x06  0x010  4               0  ---  Number of ASR Events
0x06  0x018  4               0  ---  Number of Interface CRC Errors
0x07  =====  =               =  ===  == Solid State Device Statistics (rev 1) ==
0x07  0x008  1               0  ---  Percentage Used Endurance Indicator
                                |||_ C monitored condition met
                                ||__ D supports DSN
                                |___ N normalized value

Pending Defects log (GP Log 0x0c) not supported

SATA Phy Event Counters (GP Log 0x11)
ID      Size     Value  Description
0x0001  2            0  Command failed due to ICRC error
0x0002  2            0  R_ERR response for data FIS
0x0003  2            0  R_ERR response for device-to-host data FIS
0x0004  2            0  R_ERR response for host-to-device data FIS
0x0005  2            0  R_ERR response for non-data FIS
0x0006  2            0  R_ERR response for device-to-host non-data FIS
0x0007  2            0  R_ERR response for host-to-device non-data FIS
0x0008  2            0  Device-to-host non-data FIS retries
0x0009  2            0  Transition from drive PhyRdy to drive PhyNRdy
0x000a  2           10  Device-to-host register FISes sent due to a COMRESET
0x000b  2            0  CRC errors within host-to-device FIS
0x000d  2            0  Non-CRC errors within host-to-device FIS
0x000f  2            0  R_ERR response for host-to-device data FIS, CRC
0x0010  2            0  R_ERR response for host-to-device data FIS, non-CRC
0x0012  2            0  R_ERR response for host-to-device non-data FIS, CRC
0x0013  2            0  R_ERR response for host-to-device non-data FIS, non-CRC

