smartctl 6.6 2016-05-31 r4324 [x86_64-linux-5.0.0-29-generic] (local build)
Copyright (C) 2002-16, Bruce Allen, Christian Franke, www.smartmontools.org

=== START OF INFORMATION SECTION ===
Device Model:     CT1000MX500SSD4
Serial Number:    1923E20A3BA2
LU WWN Device Id: 5 00a075 1e20a3ba2
Firmware Version: M3CR023
User Capacity:    1,000,204,886,016 bytes [1.00 TB]
Sector Sizes:     512 bytes logical, 4096 bytes physical
Rotation Rate:    Solid State Device
Form Factor:      M.2
Device is:        Not in smartctl database [for details use: -P showall]
ATA Version is:   ACS-3 T13/2161-D revision 5
SATA Version is:  SATA >3.2 (0x1ff), 6.0 Gb/s (current: 6.0 Gb/s)
Local Time is:    Sat Sep 28 10:10:24 2019 EDT
SMART support is: Available - device has SMART capability.
SMART support is: Enabled
AAM feature is:   Unavailable
APM level is:     254 (maximum performance)
Rd look-ahead is: Enabled
Write cache is:   Enabled
ATA Security is:  Disabled, frozen [SEC2]
Wt Cache Reorder: Unknown

=== START OF READ SMART DATA SECTION ===
SMART overall-health self-assessment test result: PASSED

General SMART Values:
Offline data collection status:  (0x82)	Offline data collection activity
					was completed without error.
					Auto Offline Data Collection: Enabled.
Self-test execution status:      (   0)	The previous self-test routine completed
					without error or no self-test has ever 
					been run.
Total time to complete Offline 
data collection: 		(    0) seconds.
Offline data collection
capabilities: 			 (0x7b) SMART execute Offline immediate.
					Auto Offline data collection on/off support.
					Suspend Offline collection upon new
					command.
					Offline surface scan supported.
					Self-test supported.
					Conveyance Self-test supported.
					Selective Self-test supported.
SMART capabilities:            (0x0003)	Saves SMART data before entering
					power-saving mode.
					Supports SMART auto save timer.
Error logging capability:        (0x01)	Error logging supported.
					General Purpose Logging supported.
Short self-test routine 
recommended polling time: 	 (   2) minutes.
Extended self-test routine
recommended polling time: 	 (  30) minutes.
Conveyance self-test routine
recommended polling time: 	 (   2) minutes.
SCT capabilities: 	       (0x0031)	SCT Status supported.
					SCT Feature Control supported.
					SCT Data Table supported.

SMART Attributes Data Structure revision number: 16
Vendor Specific SMART Attributes with Thresholds:
ID# ATTRIBUTE_NAME          FLAGS    VALUE WORST THRESH FAIL RAW_VALUE
  1 Raw_Read_Error_Rate     POSR-K   100   100   000    -    0
  5 Reallocated_Sector_Ct   -O--CK   100   100   010    -    0
  9 Power_On_Hours          -O--CK   100   100   000    -    3
 12 Power_Cycle_Count       -O--CK   100   100   000    -    17
171 Unknown_Attribute       -O--CK   100   100   000    -    0
172 Unknown_Attribute       -O--CK   100   100   000    -    0
173 Unknown_Attribute       -O--CK   100   100   000    -    0
174 Unknown_Attribute       -O--CK   100   100   000    -    3
180 Unused_Rsvd_Blk_Cnt_Tot PO--CK   000   000   000    -    50
183 Runtime_Bad_Block       -O--CK   100   100   000    -    0
184 End-to-End_Error        -O--CK   100   100   000    -    0
187 Reported_Uncorrect      -O--CK   100   100   000    -    0
194 Temperature_Celsius     -O---K   059   030   000    -    41 (Min/Max 0/70)
196 Reallocated_Event_Count -O--CK   100   100   000    -    0
197 Current_Pending_Sector  -O--CK   100   100   000    -    0
198 Offline_Uncorrectable   ----CK   100   100   000    -    0
199 UDMA_CRC_Error_Count    -O--CK   100   100   000    -    0
202 Unknown_SSD_Attribute   ----CK   100   100   001    -    0
206 Unknown_SSD_Attribute   -OSR--   100   100   000    -    0
210 Unknown_Attribute       -O--CK   100   100   000    -    0
246 Unknown_Attribute       -O--CK   100   100   000    -    1008675856
247 Unknown_Attribute       -O--CK   100   100   000    -    16028466
248 Unknown_Attribute       -O--CK   100   100   000    -    732796
                            ||||||_ K auto-keep
                            |||||__ C event count
                            ||||___ R error rate
                            |||____ S speed/performance
                            ||_____ O updated online
                            |______ P prefailure warning

General Purpose Log Directory Version 1
SMART           Log Directory Version 1 [multi-sector log support]
Address    Access  R/W   Size  Description
0x00       GPL,SL  R/O      1  Log Directory
0x01           SL  R/O      1  Summary SMART error log
0x02           SL  R/O      1  Comprehensive SMART error log
0x03       GPL     R/O      1  Ext. Comprehensive SMART error log
0x04       GPL,SL  R/O      8  Device Statistics log
0x06           SL  R/O      1  SMART self-test log
0x07       GPL     R/O      1  Extended self-test log
0x09           SL  R/W      1  Selective self-test log
0x10       GPL     R/O      1  SATA NCQ Queued Error log
0x11       GPL     R/O      1  SATA Phy Event Counters log
0x24       GPL     R/O     88  Current Device Internal Status Data log
0x25       GPL     R/O     64  Saved Device Internal Status Data log
0x30       GPL,SL  R/O      9  IDENTIFY DEVICE data log
0x80-0x9f  GPL,SL  R/W     16  Host vendor specific log
0xe0       GPL,SL  R/W      1  SCT Command/Status
0xe1       GPL,SL  R/W      1  SCT Data Transfer

SMART Extended Comprehensive Error Log Version: 1 (1 sectors)
No Errors Logged

SMART Extended Self-test Log Version: 1 (1 sectors)
Num  Test_Description    Status                  Remaining  LifeTime(hours)  LBA_of_first_error
# 1  Short offline       Completed without error       00%         3         -

SMART Selective self-test log data structure revision number 1
 SPAN  MIN_LBA  MAX_LBA  CURRENT_TEST_STATUS
    1        0        0  Not_testing
    2        0        0  Not_testing
    3        0        0  Not_testing
    4        0        0  Not_testing
    5        0        0  Not_testing
Selective self-test flags (0x0):
  After scanning selected spans, do NOT read-scan remainder of disk.
If Selective self-test is pending on power-up, resume after 0 minute delay.

SCT Status Version:                  3
SCT Version (vendor specific):       1 (0x0001)
SCT Support Level:                   0
Device State:                        Active (0)
Current Temperature:                    41 Celsius
Power Cycle Min/Max Temperature:     33/48 Celsius
Lifetime    Min/Max Temperature:      0/70 Celsius
Under/Over Temperature Limit Count:   0/0

SCT Temperature History Version:     2
Temperature Sampling Period:         1 minute
Temperature Logging Interval:        1 minute
Min/Max recommended Temperature:      0/100 Celsius
Min/Max Temperature Limit:            0/100 Celsius
Temperature History Size (Index):    128 (47)

Index    Estimated Time   Temperature Celsius
  48    2019-09-28 08:03    40  *********************
 ...    ..( 10 skipped).    ..  *********************
  59    2019-09-28 08:14    40  *********************
  60    2019-09-28 08:15    38  *******************
  61    2019-09-28 08:16    38  *******************
  62    2019-09-28 08:17    38  *******************
  63    2019-09-28 08:18    40  *********************
  64    2019-09-28 08:19    38  *******************
 ...    ..(  2 skipped).    ..  *******************
  67    2019-09-28 08:22    38  *******************
  68    2019-09-28 08:23    40  *********************
  69    2019-09-28 08:24    38  *******************
 ...    ..(  6 skipped).    ..  *******************
  76    2019-09-28 08:31    38  *******************
  77    2019-09-28 08:32    40  *********************
  78    2019-09-28 08:33    40  *********************
  79    2019-09-28 08:34    38  *******************
  80    2019-09-28 08:35    43  ************************
  81    2019-09-28 08:36    43  ************************
  82    2019-09-28 08:37    45  **************************
  83    2019-09-28 08:38    41  **********************
  84    2019-09-28 08:39    41  **********************
  85    2019-09-28 08:40    41  **********************
  86    2019-09-28 08:41    38  *******************
 ...    ..(  2 skipped).    ..  *******************
  89    2019-09-28 08:44    38  *******************
  90    2019-09-28 08:45    45  **************************
  91    2019-09-28 08:46    45  **************************
  92    2019-09-28 08:47    38  *******************
 ...    ..(  2 skipped).    ..  *******************
  95    2019-09-28 08:50    38  *******************
  96    2019-09-28 08:51    40  *********************
  97    2019-09-28 08:52    38  *******************
  98    2019-09-28 08:53    40  *********************
  99    2019-09-28 08:54    40  *********************
 100    2019-09-28 08:55    38  *******************
 101    2019-09-28 08:56    40  *********************
 102    2019-09-28 08:57    38  *******************
 ...    ..(  4 skipped).    ..  *******************
 107    2019-09-28 09:02    38  *******************
 108    2019-09-28 09:03    41  **********************
 109    2019-09-28 09:04    41  **********************
 110    2019-09-28 09:05    38  *******************
 111    2019-09-28 09:06    38  *******************
 112    2019-09-28 09:07    38  *******************
 113    2019-09-28 09:08    40  *********************
 114    2019-09-28 09:09    38  *******************
 115    2019-09-28 09:10    40  *********************
 ...    ..(  5 skipped).    ..  *********************
 121    2019-09-28 09:16    40  *********************
 122    2019-09-28 09:17    43  ************************
 123    2019-09-28 09:18    45  **************************
 124    2019-09-28 09:19    41  **********************
 125    2019-09-28 09:20    43  ************************
 126    2019-09-28 09:21    38  *******************
 127    2019-09-28 09:22    36  *****************
   0    2019-09-28 09:23    38  *******************
   1    2019-09-28 09:24    35  ****************
   2    2019-09-28 09:25    35  ****************
   3    2019-09-28 09:26    38  *******************
   4    2019-09-28 09:27    35  ****************
   5    2019-09-28 09:28    41  **********************
   6    2019-09-28 09:29    33  **************
   7    2019-09-28 09:30    33  **************
   8    2019-09-28 09:31    33  **************
   9    2019-09-28 09:32    38  *******************
  10    2019-09-28 09:33    33  **************
  11    2019-09-28 09:34    33  **************
  12    2019-09-28 09:35    33  **************
  13    2019-09-28 09:36    36  *****************
  14    2019-09-28 09:37    33  **************
 ...    ..(  2 skipped).    ..  **************
  17    2019-09-28 09:40    33  **************
  18    2019-09-28 09:41    31  ************
  19    2019-09-28 09:42     ?  -
  20    2019-09-28 09:43     ?  -
  21    2019-09-28 09:44    36  *****************
  22    2019-09-28 09:45    38  *******************
  23    2019-09-28 09:46    38  *******************
  24    2019-09-28 09:47     ?  -
  25    2019-09-28 09:48     ?  -
  26    2019-09-28 09:49    38  *******************
  27    2019-09-28 09:50    40  *********************
  28    2019-09-28 09:51    41  **********************
 ...    ..(  8 skipped).    ..  **********************
  37    2019-09-28 10:00    41  **********************
  38    2019-09-28 10:01    43  ************************
  39    2019-09-28 10:02    41  **********************
 ...    ..(  3 skipped).    ..  **********************
  43    2019-09-28 10:06    41  **********************
  44    2019-09-28 10:07    48  *****************************
  45    2019-09-28 10:08    43  ************************
  46    2019-09-28 10:09    41  **********************
  47    2019-09-28 10:10    41  **********************

SCT Error Recovery Control command not supported

Device Statistics (GP Log 0x04)
Page  Offset Size        Value Flags Description
0x01  =====  =               =  ===  == General Statistics (rev 1) ==
0x01  0x008  4              17  ---  Lifetime Power-On Resets
0x01  0x010  4               3  ---  Power-on Hours
0x01  0x018  6      1008675856  ---  Logical Sectors Written
0x01  0x020  6          899772  ---  Number of Write Commands
0x01  0x028  6        39154511  ---  Logical Sectors Read
0x01  0x030  6          721605  ---  Number of Read Commands
0x01  0x038  6               1  ---  Date and Time TimeStamp
0x04  =====  =               =  ===  == General Errors Statistics (rev 1) ==
0x04  0x008  4               0  ---  Number of Reported Uncorrectable Errors
0x04  0x010  4               3  ---  Resets Between Cmd Acceptance and Completion
0x05  =====  =               =  ===  == Temperature Statistics (rev 1) ==
0x05  0x008  1              41  ---  Current Temperature
0x05  0x010  1              41  ---  Average Short Term Temperature
0x05  0x018  1              44  ---  Average Long Term Temperature
0x05  0x020  1              70  ---  Highest Temperature
0x05  0x028  1               0  ---  Lowest Temperature
0x05  0x030  1              68  ---  Highest Average Short Term Temperature
0x05  0x038  1               0  ---  Lowest Average Short Term Temperature
0x05  0x040  1              68  ---  Highest Average Long Term Temperature
0x05  0x048  1               0  ---  Lowest Average Long Term Temperature
0x05  0x050  4               0  ---  Time in Over-Temperature
0x05  0x058  1              70  ---  Specified Maximum Operating Temperature
0x05  0x060  4               0  ---  Time in Under-Temperature
0x05  0x068  1               0  ---  Specified Minimum Operating Temperature
0x06  =====  =               =  ===  == Transport Statistics (rev 1) ==
0x06  0x008  4             102  ---  Number of Hardware Resets
0x06  0x010  4              15  ---  Number of ASR Events
0x06  0x018  4               0  ---  Number of Interface CRC Errors
0x07  =====  =               =  ===  == Solid State Device Statistics (rev 1) ==
0x07  0x008  1               0  ---  Percentage Used Endurance Indicator
                                |||_ C monitored condition met
                                ||__ D supports DSN
                                |___ N normalized value

SATA Phy Event Counters (GP Log 0x11)
ID      Size     Value  Description
0x0001  2            0  Command failed due to ICRC error
0x0002  2            0  R_ERR response for data FIS
0x0003  2            0  R_ERR response for device-to-host data FIS
0x0004  2            0  R_ERR response for host-to-device data FIS
0x0005  2            0  R_ERR response for non-data FIS
0x0006  2            0  R_ERR response for device-to-host non-data FIS
0x0007  2            0  R_ERR response for host-to-device non-data FIS
0x0008  2            0  Device-to-host non-data FIS retries
0x0009  2            0  Transition from drive PhyRdy to drive PhyNRdy
0x000a  2            6  Device-to-host register FISes sent due to a COMRESET
0x000b  2            0  CRC errors within host-to-device FIS
0x000d  2            0  Non-CRC errors within host-to-device FIS
0x000f  2            0  R_ERR response for host-to-device data FIS, CRC
0x0010  2            0  R_ERR response for host-to-device data FIS, non-CRC
0x0012  2            0  R_ERR response for host-to-device non-data FIS, CRC
0x0013  2            0  R_ERR response for host-to-device non-data FIS, non-CRC

