smartctl 6.2 2017-02-27 r4394 [x86_64-linux-3.10.0-693.11.1.el7.x86_64] (local build)
Copyright (C) 2002-13, Bruce Allen, Christian Franke, www.smartmontools.org

=== START OF INFORMATION SECTION ===
Device Model:     ST12000VN0007-2GS116
Serial Number:    ZCH07JLE
LU WWN Device Id: 5 000c50 0a468b723
Firmware Version: SC60
User Capacity:    12'000'138'625'024 bytes [12.0 TB]
Sector Sizes:     512 bytes logical, 4096 bytes physical
Rotation Rate:    7200 rpm
Device is:        Not in smartctl database [for details use: -P showall]
ATA Version is:   ACS-3 (unknown minor revision code: 0x006d)
SATA Version is:  SATA 3.1, 6.0 Gb/s (current: 6.0 Gb/s)
Local Time is:    Sun Dec 17 14:35:04 2017 CET
SMART support is: Available - device has SMART capability.
SMART support is: Enabled
AAM feature is:   Unavailable
APM feature is:   Unavailable
Rd look-ahead is: Enabled
Write cache is:   Enabled
ATA Security is:  Disabled, frozen [SEC2]
Wt Cache Reorder: Enabled

=== START OF READ SMART DATA SECTION ===
SMART overall-health self-assessment test result: PASSED

General SMART Values:
Offline data collection status:  (0x82)	Offline data collection activity
					was completed without error.
					Auto Offline Data Collection: Enabled.
Self-test execution status:      (   0)	The previous self-test routine completed
					without error or no self-test has ever 
					been run.
Total time to complete Offline 
data collection: 		(  567) seconds.
Offline data collection
capabilities: 			 (0x7b) SMART execute Offline immediate.
					Auto Offline data collection on/off support.
					Suspend Offline collection upon new
					command.
					Offline surface scan supported.
					Self-test supported.
					Conveyance Self-test supported.
					Selective Self-test supported.
SMART capabilities:            (0x0003)	Saves SMART data before entering
					power-saving mode.
					Supports SMART auto save timer.
Error logging capability:        (0x01)	Error logging supported.
					General Purpose Logging supported.
Short self-test routine 
recommended polling time: 	 (   1) minutes.
Extended self-test routine
recommended polling time: 	 (1107) minutes.
Conveyance self-test routine
recommended polling time: 	 (   2) minutes.
SCT capabilities: 	       (0x50bd)	SCT Status supported.
					SCT Error Recovery Control supported.
					SCT Feature Control supported.
					SCT Data Table supported.

SMART Attributes Data Structure revision number: 10
Vendor Specific SMART Attributes with Thresholds:
ID# ATTRIBUTE_NAME          FLAGS    VALUE WORST THRESH FAIL RAW_VALUE
  1 Raw_Read_Error_Rate     POSR--   072   066   044    -    15109544
  3 Spin_Up_Time            PO----   088   087   000    -    0
  4 Start_Stop_Count        -O--CK   100   100   020    -    15
  5 Reallocated_Sector_Ct   PO--CK   100   100   010    -    0
  7 Seek_Error_Rate         POSR--   100   253   045    -    31429
  9 Power_On_Hours          -O--CK   100   100   000    -    17
 10 Spin_Retry_Count        PO--C-   100   100   097    -    0
 12 Power_Cycle_Count       -O--CK   100   100   020    -    15
187 Reported_Uncorrect      -O--CK   100   100   000    -    0
188 Command_Timeout         -O--CK   100   100   000    -    0
190 Airflow_Temperature_Cel -O---K   070   068   040    -    30 (Min/Max 18/30)
192 Power-Off_Retract_Count -O--CK   100   100   000    -    14
193 Load_Cycle_Count        -O--CK   100   100   000    -    15
194 Temperature_Celsius     -O---K   030   040   000    -    30 (0 18 0 0 0)
195 Hardware_ECC_Recovered  -O-RC-   021   017   000    -    15109544
197 Current_Pending_Sector  -O--C-   100   100   000    -    0
198 Offline_Uncorrectable   ----C-   100   100   000    -    0
199 UDMA_CRC_Error_Count    -OSRCK   200   200   000    -    0
200 Multi_Zone_Error_Rate   PO---K   100   100   001    -    0
240 Head_Flying_Hours       ------   100   253   000    -    29493540421647
241 Total_LBAs_Written      ------   100   253   000    -    14801777
242 Total_LBAs_Read         ------   100   253   000    -    307767
                            ||||||_ K auto-keep
                            |||||__ C event count
                            ||||___ R error rate
                            |||____ S speed/performance
                            ||_____ O updated online
                            |______ P prefailure warning

General Purpose Log Directory Version 1
SMART           Log Directory Version 1 [multi-sector log support]
Address    Access  R/W   Size  Description
0x00       GPL,SL  R/O      1  Log Directory
0x01           SL  R/O      1  Summary SMART error log
0x02           SL  R/O      5  Comprehensive SMART error log
0x03       GPL     R/O      5  Ext. Comprehensive SMART error log
0x04       GPL     R/O    256  Device Statistics log
0x04       SL      R/O      8  Device Statistics log
0x06           SL  R/O      1  SMART self-test log
0x07       GPL     R/O      1  Extended self-test log
0x08       GPL     R/O      2  Power Conditions log
0x09           SL  R/W      1  Selective self-test log
0x0c       GPL     -     2048  Reserved
0x10       GPL     R/O      1  NCQ Command Error log
0x11       GPL     R/O      1  SATA Phy Event Counters
0x13       GPL     R/O      1  SATA NCQ Send and Receive log
0x15       GPL     -        1  Reserved for Serial ATA
0x21       GPL     R/O      1  Write stream error log
0x22       GPL     R/O      1  Read stream error log
0x24       GPL     R/O    768  Current Device Internal Status Data log
0x30       GPL,SL  R/O      9  IDENTIFY DEVICE data log
0x80-0x9f  GPL,SL  R/W     16  Host vendor specific log
0xa1       GPL,SL  VS      24  Device vendor specific log
0xa2       GPL     VS   16320  Device vendor specific log
0xa4       GPL,SL  VS     160  Device vendor specific log
0xa6       GPL     VS     192  Device vendor specific log
0xa8-0xa9  GPL,SL  VS     136  Device vendor specific log
0xab       GPL     VS       1  Device vendor specific log
0xad       GPL     VS      16  Device vendor specific log
0xbe-0xbf  GPL     VS   65535  Device vendor specific log
0xc1       GPL,SL  VS       8  Device vendor specific log
0xc3       GPL,SL  VS      32  Device vendor specific log
0xc9       GPL,SL  VS       8  Device vendor specific log
0xca       GPL,SL  VS      16  Device vendor specific log
0xd1       GPL     VS     336  Device vendor specific log
0xd2       GPL     VS   10000  Device vendor specific log
0xd4       GPL     VS    2048  Device vendor specific log
0xda       GPL,SL  VS       1  Device vendor specific log
0xe0       GPL,SL  R/W      1  SCT Command/Status
0xe1       GPL,SL  R/W      1  SCT Data Transfer

SMART Extended Comprehensive Error Log Version: 1 (5 sectors)
No Errors Logged

SMART Extended Self-test Log Version: 1 (1 sectors)
Num  Test_Description    Status                  Remaining  LifeTime(hours)  LBA_of_first_error
# 1  Short offline       Completed without error       00%        17         -

SMART Selective self-test log data structure revision number 1
 SPAN  MIN_LBA  MAX_LBA  CURRENT_TEST_STATUS
    1        0        0  Not_testing
    2        0        0  Not_testing
    3        0        0  Not_testing
    4        0        0  Not_testing
    5        0        0  Not_testing
Selective self-test flags (0x0):
  After scanning selected spans, do NOT read-scan remainder of disk.
If Selective self-test is pending on power-up, resume after 0 minute delay.

SCT Status Version:                  3
SCT Version (vendor specific):       522 (0x020a)
SCT Support Level:                   1
Device State:                        Active (0)
Current Temperature:                    30 Celsius
Power Cycle Min/Max Temperature:     18/30 Celsius
Lifetime    Min/Max Temperature:     18/32 Celsius
Under/Over Temperature Limit Count:   0/5
SCT Temperature History Version:     2
Temperature Sampling Period:         3 minutes
Temperature Logging Interval:        59 minutes
Min/Max recommended Temperature:     10/25 Celsius
Min/Max Temperature Limit:            0/70 Celsius
Temperature History Size (Index):    128 (43)

Index    Estimated Time   Temperature Celsius
  44    2017-12-12 09:20     ?  -
 ...    ..( 82 skipped).    ..  -
 127    2017-12-15 18:57     ?  -
   0    2017-12-15 19:56    29  **********
   1    2017-12-15 20:55     ?  -
   2    2017-12-15 21:54    23  ****
   3    2017-12-15 22:53     ?  -
   4    2017-12-15 23:52    20  *
   5    2017-12-16 00:51     ?  -
   6    2017-12-16 01:50    20  *
   7    2017-12-16 02:49     ?  -
   8    2017-12-16 03:48    24  *****
   9    2017-12-16 04:47     ?  -
  10    2017-12-16 05:46    26  *******
  11    2017-12-16 06:45     ?  -
  12    2017-12-16 07:44    27  ********
  13    2017-12-16 08:43     ?  -
  14    2017-12-16 09:42    20  *
  15    2017-12-16 10:41    28  *********
  16    2017-12-16 11:40     ?  -
  17    2017-12-16 12:39    28  *********
  18    2017-12-16 13:38     ?  -
  19    2017-12-16 14:37    26  *******
  20    2017-12-16 15:36     ?  -
  21    2017-12-16 16:35    29  **********
  22    2017-12-16 17:34     ?  -
  23    2017-12-16 18:33    29  **********
  24    2017-12-16 19:32    31  ************
  25    2017-12-16 20:31    32  *************
  26    2017-12-16 21:30     ?  -
  27    2017-12-16 22:29    20  *
  28    2017-12-16 23:28    30  ***********
  29    2017-12-17 00:27     ?  -
  30    2017-12-17 01:26    31  ************
  31    2017-12-17 02:25    32  *************
  32    2017-12-17 03:24    30  ***********
  33    2017-12-17 04:23    30  ***********
  34    2017-12-17 05:22     ?  -
  35    2017-12-17 06:21    30  ***********
  36    2017-12-17 07:20    30  ***********
  37    2017-12-17 08:19     ?  -
  38    2017-12-17 09:18    18  -
  39    2017-12-17 10:17    27  ********
  40    2017-12-17 11:16    29  **********
  41    2017-12-17 12:15    29  **********
  42    2017-12-17 13:14    29  **********
  43    2017-12-17 14:13    30  ***********

SCT Error Recovery Control:
           Read:     70 (7.0 seconds)
          Write:     70 (7.0 seconds)

Device Statistics (GP Log 0x04)
Page Offset Size         Value  Description
  1  =====  =                =  == General Statistics (rev 1) ==
  1  0x008  4               15  Lifetime Power-On Resets
  1  0x010  4               17  Power-on Hours
  1  0x018  6         13645201  Logical Sectors Written
  1  0x020  6            26990  Number of Write Commands
  1  0x028  6           304585  Logical Sectors Read
  1  0x030  6            13089  Number of Read Commands
  1  0x038  6                -  Date and Time TimeStamp
  3  =====  =                =  == Rotating Media Statistics (rev 1) ==
  3  0x008  4       2337644227~ Spindle Motor Power-on Hours
  3  0x010  4       2337644227~ Head Flying Hours
  3  0x018  4               15  Head Load Events
  3  0x020  4                0  Number of Reallocated Logical Sectors
  3  0x028  4                0  Read Recovery Attempts
  3  0x030  4                0  Number of Mechanical Start Failures
  3  0x038  4                0  Number of Realloc. Candidate Logical Sectors
  3  0x040  7               14  Unknown
  4  =====  =                =  == General Errors Statistics (rev 1) ==
  4  0x008  4                0  Number of Reported Uncorrectable Errors
  4  0x010  4                0  Resets Between Cmd Acceptance and Completion
  5  =====  =                =  == Temperature Statistics (rev 1) ==
  5  0x008  1               30  Current Temperature
  5  0x010  1                -  Average Short Term Temperature
  5  0x018  1                -  Average Long Term Temperature
  5  0x020  1               32  Highest Temperature
  5  0x028  1               22  Lowest Temperature
  5  0x030  1                -  Highest Average Short Term Temperature
  5  0x038  1                -  Lowest Average Short Term Temperature
  5  0x040  1                -  Highest Average Long Term Temperature
  5  0x048  1                -  Lowest Average Long Term Temperature
  5  0x050  4                0  Time in Over-Temperature
  5  0x058  1               70  Specified Maximum Operating Temperature
  5  0x060  4                0  Time in Under-Temperature
  5  0x068  1                0  Specified Minimum Operating Temperature
  6  =====  =                =  == Transport Statistics (rev 1) ==
  6  0x008  4               38  Number of Hardware Resets
  6  0x010  4               17  Number of ASR Events
  6  0x018  4                0  Number of Interface CRC Errors
255  =====  =                =  == Unknown Statistics (rev 1) ==
255  0x008  7                0  Unknown
255  0x018  7                0  Unknown
                              |_ ~ normalized value

SATA Phy Event Counters (GP Log 0x11)
ID      Size     Value  Description
0x000a  2           18  Device-to-host register FISes sent due to a COMRESET
0x0001  2            0  Command failed due to ICRC error
0x0003  2            0  R_ERR response for device-to-host data FIS
0x0004  2            0  R_ERR response for host-to-device data FIS
0x0006  2            0  R_ERR response for device-to-host non-data FIS
0x0007  2            0  R_ERR response for host-to-device non-data FIS

