smartctl 7.1 2019-12-30 r5022 [x86_64-linux-5.13.0-30-generic] (local build)
Copyright (C) 2002-19, Bruce Allen, Christian Franke, www.smartmontools.org

=== START OF INFORMATION SECTION ===
Device Model:     INTEL SSDSCKKF180G8L
Serial Number:    BTLA8243064X180M
LU WWN Device Id: 5 5cd2e4 14f7ca3dc
Firmware Version: LHFL05P
User Capacity:    180.045.766.656 bytes [180 GB]
Sector Size:      512 bytes logical/physical
Rotation Rate:    Solid State Device
Form Factor:      M.2
Device is:        Not in smartctl database [for details use: -P showall]
ATA Version is:   ACS-3 (minor revision not indicated)
SATA Version is:  SATA 3.2, 6.0 Gb/s (current: 6.0 Gb/s)
Local Time is:    Sat Mar  5 20:59:19 2022 CET
SMART support is: Available - device has SMART capability.
SMART support is: Enabled
AAM feature is:   Unavailable
APM level is:     254 (maximum performance)
Rd look-ahead is: Enabled
Write cache is:   Enabled
DSN feature is:   Unavailable
ATA Security is:  Disabled, frozen [SEC2]
Write SCT (Get) Feature Control Command failed: scsi error badly formed scsi parameters
Wt Cache Reorder: Unknown (SCT Feature Control command failed)

=== START OF READ SMART DATA SECTION ===
SMART overall-health self-assessment test result: PASSED

General SMART Values:
Offline data collection status:  (0x02)	Offline data collection activity
					was completed without error.
					Auto Offline Data Collection: Disabled.
Self-test execution status:      (   0)	The previous self-test routine completed
					without error or no self-test has ever 
					been run.
Total time to complete Offline 
data collection: 		(    0) seconds.
Offline data collection
capabilities: 			 (0x53) SMART execute Offline immediate.
					Auto Offline data collection on/off support.
					Suspend Offline collection upon new
					command.
					No Offline surface scan supported.
					Self-test supported.
					No Conveyance Self-test supported.
					Selective Self-test supported.
SMART capabilities:            (0x0003)	Saves SMART data before entering
					power-saving mode.
					Supports SMART auto save timer.
Error logging capability:        (0x01)	Error logging supported.
					General Purpose Logging supported.
Short self-test routine 
recommended polling time: 	 (   2) minutes.
Extended self-test routine
recommended polling time: 	 (  15) minutes.
SCT capabilities: 	       (0x003d)	SCT Status supported.
					SCT Error Recovery Control supported.
					SCT Feature Control supported.
					SCT Data Table supported.

SMART Attributes Data Structure revision number: 1
Vendor Specific SMART Attributes with Thresholds:
ID# ATTRIBUTE_NAME          FLAGS    VALUE WORST THRESH FAIL RAW_VALUE
  5 Reallocated_Sector_Ct   -O--CK   100   100   000    -    0
  9 Power_On_Hours          -O--CK   100   100   000    -    2021
 12 Power_Cycle_Count       -O--CK   100   100   000    -    1113
170 Unknown_Attribute       PO--CK   100   100   010    -    0
171 Unknown_Attribute       -O--CK   100   100   000    -    0
172 Unknown_Attribute       -O--CK   100   100   000    -    0
173 Unknown_Attribute       -O--CK   100   100   000    -    20
183 Runtime_Bad_Block       -O--CK   100   100   000    -    1
184 End-to-End_Error        PO--CK   100   100   097    -    0
187 Reported_Uncorrect      -O--CK   100   100   000    -    0
194 Temperature_Celsius     -O--CK   028   051   000    -    28 (Min/Max 14/51)
199 UDMA_CRC_Error_Count    -O--CK   100   100   000    -    0
225 Unknown_SSD_Attribute   -O--CK   100   100   000    -    5424
226 Unknown_SSD_Attribute   -O--CK   100   100   000    -    0
227 Unknown_SSD_Attribute   -O--CK   100   100   000    -    0
228 Power-off_Retract_Count -O--CK   100   100   000    -    0
232 Available_Reservd_Space PO--CK   100   100   010    -    0
233 Media_Wearout_Indicator PO--CK   098   098   001    -    0
236 Unknown_Attribute       PO--CK   098   098   001    -    0
241 Total_LBAs_Written      -O--CK   100   100   000    -    5424
242 Total_LBAs_Read         -O--CK   100   100   000    -    8100
249 Unknown_Attribute       -O--CK   100   100   000    -    3734
                            ||||||_ K auto-keep
                            |||||__ C event count
                            ||||___ R error rate
                            |||____ S speed/performance
                            ||_____ O updated online
                            |______ P prefailure warning

General Purpose Log Directory Version 1
SMART           Log Directory Version 1 [multi-sector log support]
Address    Access  R/W   Size  Description
0x00       GPL,SL  R/O      1  Log Directory
0x01       GPL,SL  R/O      1  Summary SMART error log
0x02       GPL,SL  R/O      1  Comprehensive SMART error log
0x03       GPL,SL  R/O      1  Ext. Comprehensive SMART error log
0x04       GPL,SL  R/O      8  Device Statistics log
0x06       GPL,SL  R/O      1  SMART self-test log
0x07       GPL,SL  R/O      1  Extended self-test log
0x09       GPL,SL  R/W      1  Selective self-test log
0x10       GPL,SL  R/O      1  NCQ Command Error log
0x11       GPL,SL  R/O      1  SATA Phy Event Counters log
0x30       GPL,SL  R/O      9  IDENTIFY DEVICE data log
0x80-0x9f  GPL,SL  R/W     16  Host vendor specific log
0xdf       GPL,SL  VS       1  Device vendor specific log
0xe0       GPL,SL  R/W      1  SCT Command/Status
0xe1       GPL,SL  R/W      1  SCT Data Transfer

SMART Extended Comprehensive Error Log Version: 1 (1 sectors)
No Errors Logged

SMART Extended Self-test Log Version: 1 (1 sectors)
Num  Test_Description    Status                  Remaining  LifeTime(hours)  LBA_of_first_error
# 1  Short offline       Completed without error       00%      2021         -

SMART Selective self-test log data structure revision number 1
 SPAN  MIN_LBA  MAX_LBA  CURRENT_TEST_STATUS
    1        0        0  Not_testing
    2        0        0  Not_testing
    3        0        0  Not_testing
    4        0        0  Not_testing
    5        0        0  Not_testing
Selective self-test flags (0x0):
  After scanning selected spans, do NOT read-scan remainder of disk.
If Selective self-test is pending on power-up, resume after 0 minute delay.

SCT Status Version:                  3
SCT Version (vendor specific):       0 (0x0000)
Device State:                        Active (0)
Current Temperature:                    36 Celsius
Power Cycle Min/Max Temperature:     23/64 Celsius
Lifetime    Min/Max Temperature:     20/64 Celsius
Under/Over Temperature Limit Count:   0/0

SCT Temperature History Version:     2
Temperature Sampling Period:         1 minute
Temperature Logging Interval:        1 minute
Min/Max recommended Temperature:      0/100 Celsius
Min/Max Temperature Limit:            0/100 Celsius
Temperature History Size (Index):    128 (5)

Index    Estimated Time   Temperature Celsius
   6    2022-03-05 18:52    37  ******************
 ...    ..( 11 skipped).    ..  ******************
  18    2022-03-05 19:04    37  ******************
  19    2022-03-05 19:05    38  *******************
  20    2022-03-05 19:06    39  ********************
  21    2022-03-05 19:07    37  ******************
  22    2022-03-05 19:08    37  ******************
  23    2022-03-05 19:09    38  *******************
  24    2022-03-05 19:10    38  *******************
  25    2022-03-05 19:11    38  *******************
  26    2022-03-05 19:12    39  ********************
  27    2022-03-05 19:13    38  *******************
  28    2022-03-05 19:14    37  ******************
  29    2022-03-05 19:15    24  *****
  30    2022-03-05 19:16    39  ********************
  31    2022-03-05 19:17    25  ******
  32    2022-03-05 19:18    27  ********
  33    2022-03-05 19:19    25  ******
 ...    ..( 10 skipped).    ..  ******
  44    2022-03-05 19:30    25  ******
  45    2022-03-05 19:31    23  ****
  46    2022-03-05 19:32    26  *******
  47    2022-03-05 19:33    25  ******
  48    2022-03-05 19:34    28  *********
  49    2022-03-05 19:35    26  *******
  50    2022-03-05 19:36    26  *******
  51    2022-03-05 19:37    28  *********
  52    2022-03-05 19:38    27  ********
  53    2022-03-05 19:39    25  ******
 ...    ..(  5 skipped).    ..  ******
  59    2022-03-05 19:45    25  ******
  60    2022-03-05 19:46    24  *****
  61    2022-03-05 19:47    27  ********
  62    2022-03-05 19:48    25  ******
 ...    ..(  2 skipped).    ..  ******
  65    2022-03-05 19:51    25  ******
  66    2022-03-05 19:52    23  ****
  67    2022-03-05 19:53    26  *******
  68    2022-03-05 19:54    29  **********
  69    2022-03-05 19:55    26  *******
  70    2022-03-05 19:56    26  *******
  71    2022-03-05 19:57    25  ******
  72    2022-03-05 19:58    27  ********
  73    2022-03-05 19:59    25  ******
 ...    ..(  2 skipped).    ..  ******
  76    2022-03-05 20:02    25  ******
  77    2022-03-05 20:03    26  *******
  78    2022-03-05 20:04    27  ********
  79    2022-03-05 20:05    25  ******
  80    2022-03-05 20:06    28  *********
  81    2022-03-05 20:07    27  ********
  82    2022-03-05 20:08    25  ******
  83    2022-03-05 20:09    25  ******
  84    2022-03-05 20:10    26  *******
  85    2022-03-05 20:11    23  ****
  86    2022-03-05 20:12    34  ***************
  87    2022-03-05 20:13    34  ***************
  88    2022-03-05 20:14    37  ******************
  89    2022-03-05 20:15    40  *********************
  90    2022-03-05 20:16    37  ******************
  91    2022-03-05 20:17    36  *****************
  92    2022-03-05 20:18    36  *****************
  93    2022-03-05 20:19    42  ***********************
  94    2022-03-05 20:20    36  *****************
  95    2022-03-05 20:21    36  *****************
  96    2022-03-05 20:22    46  ***************************
  97    2022-03-05 20:23    46  ***************************
  98    2022-03-05 20:24    47  ****************************
  99    2022-03-05 20:25    36  *****************
 ...    ..(  6 skipped).    ..  *****************
 106    2022-03-05 20:32    36  *****************
 107    2022-03-05 20:33    35  ****************
 108    2022-03-05 20:34    35  ****************
 109    2022-03-05 20:35    36  *****************
 110    2022-03-05 20:36    35  ****************
 111    2022-03-05 20:37    36  *****************
 112    2022-03-05 20:38    36  *****************
 113    2022-03-05 20:39    35  ****************
 ...    ..(  3 skipped).    ..  ****************
 117    2022-03-05 20:43    35  ****************
 118    2022-03-05 20:44    36  *****************
 ...    ..(  2 skipped).    ..  *****************
 121    2022-03-05 20:47    36  *****************
 122    2022-03-05 20:48    37  ******************
 123    2022-03-05 20:49    36  *****************
 124    2022-03-05 20:50    35  ****************
 125    2022-03-05 20:51    37  ******************
 126    2022-03-05 20:52    35  ****************
 127    2022-03-05 20:53    36  *****************
   0    2022-03-05 20:54    64  ***************************************+
   1    2022-03-05 20:55    37  ******************
   2    2022-03-05 20:56    36  *****************
   3    2022-03-05 20:57    36  *****************
   4    2022-03-05 20:58    36  *****************
   5    2022-03-05 20:59    37  ******************

SCT Error Recovery Control:
           Read: Disabled
          Write: Disabled

Device Statistics (GP Log 0x04)
Page  Offset Size        Value Flags Description
0x01  =====  =               =  ===  == General Statistics (rev 1) ==
0x01  0x008  4            1113  ---  Lifetime Power-On Resets
0x01  0x010  4            2021  ---  Power-on Hours
0x01  0x018  6     11375094234  ---  Logical Sectors Written
0x01  0x020  6       193295746  ---  Number of Write Commands
0x01  0x028  6     16988142461  ---  Logical Sectors Read
0x01  0x030  6       246434234  ---  Number of Read Commands
0x04  =====  =               =  ===  == General Errors Statistics (rev 1) ==
0x04  0x008  4               0  ---  Number of Reported Uncorrectable Errors
0x04  0x010  4             119  ---  Resets Between Cmd Acceptance and Completion
0x05  =====  =               =  ===  == Temperature Statistics (rev 1) ==
0x05  0x008  1              37  ---  Current Temperature
0x05  0x010  1              28  ---  Average Short Term Temperature
0x05  0x018  1               -  ---  Average Long Term Temperature
0x05  0x020  1              50  ---  Highest Temperature
0x05  0x028  1              23  ---  Lowest Temperature
0x05  0x030  1              29  ---  Highest Average Short Term Temperature
0x05  0x038  1              27  ---  Lowest Average Short Term Temperature
0x05  0x040  1               -  ---  Highest Average Long Term Temperature
0x05  0x048  1               -  ---  Lowest Average Long Term Temperature
0x05  0x050  4               0  ---  Time in Over-Temperature
0x05  0x058  1              85  ---  Specified Maximum Operating Temperature
0x05  0x060  4               0  ---  Time in Under-Temperature
0x05  0x068  1               0  ---  Specified Minimum Operating Temperature
0x06  =====  =               =  ===  == Transport Statistics (rev 1) ==
0x06  0x008  4           10018  ---  Number of Hardware Resets
0x06  0x018  4               0  ---  Number of Interface CRC Errors
0x07  =====  =               =  ===  == Solid State Device Statistics (rev 1) ==
0x07  0x008  1               1  ---  Percentage Used Endurance Indicator
                                |||_ C monitored condition met
                                ||__ D supports DSN
                                |___ N normalized value

Pending Defects log (GP Log 0x0c) not supported

SATA Phy Event Counters (GP Log 0x11)
ID      Size     Value  Description
0x0001  2            0  Command failed due to ICRC error
0x0005  2            0  R_ERR response for non-data FIS
0x000a  2           12  Device-to-host register FISes sent due to a COMRESET

