smartctl 6.6 2017-11-05 r4594 [FreeBSD 11.2-RELEASE amd64] (local build)
Copyright (C) 2002-17, Bruce Allen, Christian Franke, www.smartmontools.org

=== START OF INFORMATION SECTION ===
Device Model:     SAMSUNG MZ7KM960HMJP-00005
Serial Number:    S3F3NX0K809758
LU WWN Device Id: 5 002538 c40b56d29
Firmware Version: GXM5304Q
User Capacity:    960,197,124,096 bytes [960 GB]
Sector Size:      512 bytes logical/physical
Rotation Rate:    Solid State Device
Form Factor:      2.5 inches
Device is:        Not in smartctl database [for details use: -P showall]
ATA Version is:   ACS-2, ATA8-ACS T13/1699-D revision 4c
SATA Version is:  SATA 3.1, 6.0 Gb/s (current: 3.0 Gb/s)
Local Time is:    Fri Oct 12 10:56:09 2018 UTC
SMART support is: Available - device has SMART capability.
SMART support is: Enabled
AAM feature is:   Unavailable
APM level is:     224 (intermediate level without standby)
Rd look-ahead is: Enabled
Write cache is:   Enabled
DSN feature is:   Unavailable
ATA Security is:  Disabled, frozen [SEC2]
Wt Cache Reorder: Enabled

=== START OF READ SMART DATA SECTION ===
SMART overall-health self-assessment test result: PASSED

General SMART Values:
Offline data collection status:  (0x02)	Offline data collection activity
					was completed without error.
					Auto Offline Data Collection: Disabled.
Self-test execution status:      (   0)	The previous self-test routine completed
					without error or no self-test has ever 
					been run.
Total time to complete Offline 
data collection: 		( 3600) seconds.
Offline data collection
capabilities: 			 (0x53) SMART execute Offline immediate.
					Auto Offline data collection on/off support.
					Suspend Offline collection upon new
					command.
					No Offline surface scan supported.
					Self-test supported.
					No Conveyance Self-test supported.
					Selective Self-test supported.
SMART capabilities:            (0x0003)	Saves SMART data before entering
					power-saving mode.
					Supports SMART auto save timer.
Error logging capability:        (0x01)	Error logging supported.
					General Purpose Logging supported.
Short self-test routine 
recommended polling time: 	 (   2) minutes.
Extended self-test routine
recommended polling time: 	 (  60) minutes.
SCT capabilities: 	       (0x003d)	SCT Status supported.
					SCT Error Recovery Control supported.
					SCT Feature Control supported.
					SCT Data Table supported.

SMART Attributes Data Structure revision number: 1
Vendor Specific SMART Attributes with Thresholds:
ID# ATTRIBUTE_NAME          FLAGS    VALUE WORST THRESH FAIL RAW_VALUE
  5 Reallocated_Sector_Ct   PO--CK   100   100   010    -    0
  9 Power_On_Hours          -O--CK   099   099   000    -    14
 12 Power_Cycle_Count       -O--CK   099   099   000    -    48
177 Wear_Leveling_Count     PO--C-   100   099   005    -    0
179 Used_Rsvd_Blk_Cnt_Tot   PO--C-   100   100   010    -    0
180 Unused_Rsvd_Blk_Cnt_Tot PO--C-   100   100   010    -    5506
181 Program_Fail_Cnt_Total  -O--CK   100   100   010    -    0
182 Erase_Fail_Count_Total  -O--CK   100   100   010    -    0
183 Runtime_Bad_Block       PO--C-   100   100   010    -    0
184 End-to-End_Error        PO--CK   100   100   097    -    0
187 Reported_Uncorrect      -O--CK   100   100   000    -    0
190 Airflow_Temperature_Cel -O--CK   067   066   000    -    33
194 Temperature_Celsius     -O---K   067   066   000    -    33 (Min/Max 21/35)
195 Hardware_ECC_Recovered  -O-RC-   200   200   000    -    0
197 Current_Pending_Sector  -O--CK   100   100   000    -    0
199 UDMA_CRC_Error_Count    -OSRCK   100   100   000    -    0
202 Unknown_SSD_Attribute   PO--CK   100   100   010    -    0
235 Unknown_Attribute       -O--C-   099   099   000    -    29
241 Total_LBAs_Written      -O--CK   099   099   000    -    37040290
242 Total_LBAs_Read         -O--CK   099   099   000    -    1732715557
243 Unknown_Attribute       -O--CK   099   099   000    -    30
244 Unknown_Attribute       -O--CK   100   100   000    -    0
245 Unknown_Attribute       -O--CK   100   100   000    -    65535
246 Unknown_Attribute       -O--CK   100   100   000    -    65535
247 Unknown_Attribute       -O--CK   100   100   000    -    65535
251 Unknown_Attribute       -O--CK   100   100   000    -    47420416
                            ||||||_ K auto-keep
                            |||||__ C event count
                            ||||___ R error rate
                            |||____ S speed/performance
                            ||_____ O updated online
                            |______ P prefailure warning

General Purpose Log Directory Version 1
SMART           Log Directory Version 1 [multi-sector log support]
Address    Access  R/W   Size  Description
0x00       GPL,SL  R/O      1  Log Directory
0x01           SL  R/O      1  Summary SMART error log
0x02           SL  R/O      1  Comprehensive SMART error log
0x03       GPL     R/O      1  Ext. Comprehensive SMART error log
0x04       GPL,SL  R/O      8  Device Statistics log
0x06           SL  R/O      1  SMART self-test log
0x07       GPL     R/O      1  Extended self-test log
0x08       GPL     R/O      2  Power Conditions log
0x09           SL  R/W      1  Selective self-test log
0x10       GPL     R/O      1  NCQ Command Error log
0x11       GPL     R/O      1  SATA Phy Event Counters log
0x13       GPL     R/O      1  SATA NCQ Send and Receive log
0x30       GPL,SL  R/O      9  IDENTIFY DEVICE data log
0x80-0x9f  GPL,SL  R/W     16  Host vendor specific log
0xce           SL  VS      16  Device vendor specific log
0xe0       GPL,SL  R/W      1  SCT Command/Status
0xe1       GPL,SL  R/W      1  SCT Data Transfer

SMART Extended Comprehensive Error Log Version: 1 (1 sectors)
No Errors Logged

SMART Extended Self-test Log Version: 1 (1 sectors)
Num  Test_Description    Status                  Remaining  LifeTime(hours)  LBA_of_first_error
# 1  Short offline       Completed without error       00%        14         -

SMART Selective self-test log data structure revision number 1
 SPAN  MIN_LBA  MAX_LBA  CURRENT_TEST_STATUS
    1        0        0  Not_testing
    2        0        0  Not_testing
    3        0        0  Not_testing
    4        0        0  Not_testing
    5        0        0  Not_testing
  255        0    65535  Read_scanning was completed without error
Selective self-test flags (0x0):
  After scanning selected spans, do NOT read-scan remainder of disk.
If Selective self-test is pending on power-up, resume after 0 minute delay.

SCT Status Version:                  3
SCT Version (vendor specific):       256 (0x0100)
SCT Support Level:                   1
Device State:                        SCT command executing in background (5)
Current Temperature:                    33 Celsius
Power Cycle Min/Max Temperature:     27/34 Celsius
Lifetime    Min/Max Temperature:     21/35 Celsius
Under/Over Temperature Limit Count:   0/0

SCT Temperature History Version:     2
Temperature Sampling Period:         1 minute
Temperature Logging Interval:        1 minute
Min/Max recommended Temperature:      0/70 Celsius
Min/Max Temperature Limit:            0/70 Celsius
Temperature History Size (Index):    128 (78)

Index    Estimated Time   Temperature Celsius
  79    2018-10-12 08:49    33  **************
 ...    ..(  3 skipped).    ..  **************
  83    2018-10-12 08:53    33  **************
  84    2018-10-12 08:54     ?  -
  85    2018-10-12 08:55    31  ************
  86    2018-10-12 08:56    32  *************
  87    2018-10-12 08:57    32  *************
  88    2018-10-12 08:58    32  *************
  89    2018-10-12 08:59    33  **************
 ...    ..(  5 skipped).    ..  **************
  95    2018-10-12 09:05    33  **************
  96    2018-10-12 09:06     ?  -
  97    2018-10-12 09:07    31  ************
  98    2018-10-12 09:08    32  *************
 ...    ..(  3 skipped).    ..  *************
 102    2018-10-12 09:12    32  *************
 103    2018-10-12 09:13    33  **************
 104    2018-10-12 09:14     ?  -
 105    2018-10-12 09:15    32  *************
 ...    ..( 10 skipped).    ..  *************
 116    2018-10-12 09:26    32  *************
 117    2018-10-12 09:27     ?  -
 118    2018-10-12 09:28    31  ************
 119    2018-10-12 09:29    32  *************
 120    2018-10-12 09:30     ?  -
 121    2018-10-12 09:31    32  *************
 ...    ..(  3 skipped).    ..  *************
 125    2018-10-12 09:35    32  *************
 126    2018-10-12 09:36    33  **************
 127    2018-10-12 09:37    33  **************
   0    2018-10-12 09:38    32  *************
 ...    ..(  2 skipped).    ..  *************
   3    2018-10-12 09:41    32  *************
   4    2018-10-12 09:42     ?  -
   5    2018-10-12 09:43    31  ************
   6    2018-10-12 09:44    32  *************
   7    2018-10-12 09:45    32  *************
   8    2018-10-12 09:46    32  *************
   9    2018-10-12 09:47     ?  -
  10    2018-10-12 09:48    32  *************
 ...    ..( 27 skipped).    ..  *************
  38    2018-10-12 10:16    32  *************
  39    2018-10-12 10:17     ?  -
  40    2018-10-12 10:18    31  ************
  41    2018-10-12 10:19    32  *************
  42    2018-10-12 10:20    32  *************
  43    2018-10-12 10:21     ?  -
  44    2018-10-12 10:22    30  ***********
  45    2018-10-12 10:23    31  ************
  46    2018-10-12 10:24    32  *************
 ...    ..( 23 skipped).    ..  *************
  70    2018-10-12 10:48    32  *************
  71    2018-10-12 10:49     ?  -
  72    2018-10-12 10:50    32  *************
  73    2018-10-12 10:51    32  *************
  74    2018-10-12 10:52    33  **************
  75    2018-10-12 10:53    33  **************
  76    2018-10-12 10:54    34  ***************
  77    2018-10-12 10:55    33  **************
  78    2018-10-12 10:56    33  **************

SCT Error Recovery Control:
           Read: Disabled
          Write: Disabled

Device Statistics (GP Log 0x04)
Page  Offset Size        Value Flags Description
0x01  =====  =               =  ===  == General Statistics (rev 1) ==
0x01  0x008  4              48  ---  Lifetime Power-On Resets
0x01  0x010  4              14  ---  Power-on Hours
0x01  0x018  6        37040290  ---  Logical Sectors Written
0x01  0x020  6             189  ---  Number of Write Commands
0x01  0x028  6      1732715557  ---  Logical Sectors Read
0x01  0x030  6           16241  ---  Number of Read Commands
0x01  0x038  6          246000  ---  Date and Time TimeStamp
0x04  =====  =               =  ===  == General Errors Statistics (rev 1) ==
0x04  0x008  4               0  ---  Number of Reported Uncorrectable Errors
0x04  0x010  4               0  ---  Resets Between Cmd Acceptance and Completion
0x05  =====  =               =  ===  == Temperature Statistics (rev 1) ==
0x05  0x008  1              33  ---  Current Temperature
0x05  0x020  1              35  ---  Highest Temperature
0x05  0x028  1              21  ---  Lowest Temperature
0x05  0x058  1              70  ---  Specified Maximum Operating Temperature
0x06  =====  =               =  ===  == Transport Statistics (rev 1) ==
0x06  0x008  4               4  ---  Number of Hardware Resets
0x06  0x010  4               0  ---  Number of ASR Events
0x06  0x018  4               0  ---  Number of Interface CRC Errors
0x07  =====  =               =  ===  == Solid State Device Statistics (rev 1) ==
0x07  0x008  1               0  N--  Percentage Used Endurance Indicator
                                |||_ C monitored condition met
                                ||__ D supports DSN
                                |___ N normalized value

Pending Defects log (GP Log 0x0c) not supported

SATA Phy Event Counters (GP Log 0x11)
ID      Size     Value  Description
0x0001  2            0  Command failed due to ICRC error
0x0002  2            0  R_ERR response for data FIS
0x0003  2            0  R_ERR response for device-to-host data FIS
0x0004  2            0  R_ERR response for host-to-device data FIS
0x0005  2            0  R_ERR response for non-data FIS
0x0006  2            0  R_ERR response for device-to-host non-data FIS
0x0007  2            0  R_ERR response for host-to-device non-data FIS
0x0008  2            0  Device-to-host non-data FIS retries
0x0009  2            4  Transition from drive PhyRdy to drive PhyNRdy
0x000a  2            4  Device-to-host register FISes sent due to a COMRESET
0x000b  2            0  CRC errors within host-to-device FIS
0x000d  2            0  Non-CRC errors within host-to-device FIS
0x000f  2            0  R_ERR response for host-to-device data FIS, CRC
0x0010  2            0  R_ERR response for host-to-device data FIS, non-CRC
0x0012  2            0  R_ERR response for host-to-device non-data FIS, CRC
0x0013  2            0  R_ERR response for host-to-device non-data FIS, non-CRC

