smartctl 6.2 2013-07-26 r3841 [x86_64-linux-3.19.0-64-generic] (local build)
Copyright (C) 2002-13, Bruce Allen, Christian Franke, www.smartmontools.org

=== START OF INFORMATION SECTION ===
Device Model:     TOSHIBA THNSFJ256GCSU
Serial Number:    25IS10YCT8LW
LU WWN Device Id: 5 00080d 910327e43
Firmware Version: JULA1102
User Capacity:    256.060.514.304 bytes [256 GB]
Sector Size:      512 bytes logical/physical
Rotation Rate:    Solid State Device
Device is:        Not in smartctl database [for details use: -P showall]
ATA Version is:   ACS-2 (minor revision not indicated)
SATA Version is:  SATA 3.1, 6.0 Gb/s (current: 6.0 Gb/s)
Local Time is:    Thu Jul 14 10:44:32 2016 CEST
SMART support is: Available - device has SMART capability.
SMART support is: Enabled
AAM feature is:   Unavailable
APM level is:     254 (maximum performance)
Rd look-ahead is: Enabled
Write cache is:   Enabled
ATA Security is:  ENABLED, PW level MAX, not locked, not frozen [SEC5]
Wt Cache Reorder: Enabled

=== START OF READ SMART DATA SECTION ===
SMART overall-health self-assessment test result: PASSED

General SMART Values:
Offline data collection status:  (0x00)	Offline data collection activity
					was never started.
					Auto Offline Data Collection: Disabled.
Self-test execution status:      (   0)	The previous self-test routine completed
					without error or no self-test has ever 
					been run.
Total time to complete Offline 
data collection: 		(  120) seconds.
Offline data collection
capabilities: 			 (0x5b) SMART execute Offline immediate.
					Auto Offline data collection on/off support.
					Suspend Offline collection upon new
					command.
					Offline surface scan supported.
					Self-test supported.
					No Conveyance Self-test supported.
					Selective Self-test supported.
SMART capabilities:            (0x0003)	Saves SMART data before entering
					power-saving mode.
					Supports SMART auto save timer.
Error logging capability:        (0x01)	Error logging supported.
					General Purpose Logging supported.
Short self-test routine 
recommended polling time: 	 (   2) minutes.
Extended self-test routine
recommended polling time: 	 (  10) minutes.
SCT capabilities: 	       (0x003d)	SCT Status supported.
					SCT Error Recovery Control supported.
					SCT Feature Control supported.
					SCT Data Table supported.

SMART Attributes Data Structure revision number: 16
Vendor Specific SMART Attributes with Thresholds:
ID# ATTRIBUTE_NAME          FLAGS    VALUE WORST THRESH FAIL RAW_VALUE
  1 Raw_Read_Error_Rate     -O-R--   100   100   000    -    0
  2 Throughput_Performance  P-S---   100   100   050    -    0
  3 Spin_Up_Time            POS---   100   100   050    -    0
  5 Reallocated_Sector_Ct   PO--C-   100   100   050    -    0
  7 Unknown_SSD_Attribute   PO-R--   100   100   050    -    0
  8 Unknown_SSD_Attribute   P-S---   100   100   050    -    0
  9 Power_On_Hours          -O--C-   100   100   000    -    1917
 10 Unknown_SSD_Attribute   PO--C-   100   100   050    -    0
 12 Power_Cycle_Count       -O--C-   100   100   000    -    344
167 Unknown_Attribute       -O---K   100   100   000    -    0
168 Unknown_Attribute       -O--C-   100   100   000    -    0
169 Unknown_Attribute       PO--C-   100   100   010    -    100
170 Unknown_Attribute       PO--C-   100   100   010    -    0
173 Unknown_Attribute       -O--C-   199   199   000    -    0
175 Program_Fail_Count_Chip PO--C-   100   100   010    -    0
192 Power-Off_Retract_Count -O--C-   100   100   000    -    24
194 Temperature_Celsius     -O---K   061   058   000    -    39 (Min/Max 20/42)
197 Current_Pending_Sector  -O--C-   100   100   000    -    0
240 Unknown_SSD_Attribute   PO--C-   100   100   050    -    0
                            ||||||_ K auto-keep
                            |||||__ C event count
                            ||||___ R error rate
                            |||____ S speed/performance
                            ||_____ O updated online
                            |______ P prefailure warning

General Purpose Log Directory Version 1
SMART           Log Directory Version 1 [multi-sector log support]
Address    Access  R/W   Size  Description
0x00       GPL,SL  R/O      1  Log Directory
0x01           SL  R/O      1  Summary SMART error log
0x02           SL  R/O     51  Comprehensive SMART error log
0x03       GPL     R/O     64  Ext. Comprehensive SMART error log
0x04       GPL,SL  R/O      8  Device Statistics log
0x06           SL  R/O      1  SMART self-test log
0x07       GPL     R/O      1  Extended self-test log
0x09           SL  R/W      1  Selective self-test log
0x10       GPL     R/O      1  NCQ Command Error log
0x11       GPL     R/O      1  SATA Phy Event Counters
0x30       GPL,SL  R/O      9  IDENTIFY DEVICE data log
0x80-0x9f  GPL,SL  R/W     16  Host vendor specific log
0xdf       GPL,SL  VS       1  Device vendor specific log
0xe0       GPL,SL  R/W      1  SCT Command/Status
0xe1       GPL,SL  R/W      1  SCT Data Transfer

SMART Extended Comprehensive Error Log Version: 1 (64 sectors)
No Errors Logged

SMART Extended Self-test Log Version: 1 (1 sectors)
Num  Test_Description    Status                  Remaining  LifeTime(hours)  LBA_of_first_error
# 1  Short offline       Completed without error       00%      1917         -

SMART Selective self-test log data structure revision number 1
 SPAN  MIN_LBA  MAX_LBA  CURRENT_TEST_STATUS
    1        0        0  Not_testing
    2        0        0  Not_testing
    3        0        0  Not_testing
    4        0        0  Not_testing
    5        0        0  Not_testing
Selective self-test flags (0x0):
  After scanning selected spans, do NOT read-scan remainder of disk.
If Selective self-test is pending on power-up, resume after 0 minute delay.

SCT Status Version:                  3
SCT Version (vendor specific):       3 (0x0003)
SCT Support Level:                   0
Device State:                        Active (0)
Current Temperature:                    39 Celsius
Power Cycle Min/Max Temperature:     24/41 Celsius
Lifetime    Min/Max Temperature:     20/42 Celsius
Under/Over Temperature Limit Count:   0/1
SCT Temperature History Version:     2
Temperature Sampling Period:         1 minute
Temperature Logging Interval:        1 minute
Min/Max recommended Temperature:      5/40 Celsius
Min/Max Temperature Limit:            0/80 Celsius
Temperature History Size (Index):    128 (56)

Index    Estimated Time   Temperature Celsius
  57    2016-07-14 08:37    38  *******************
 ...    ..( 18 skipped).    ..  *******************
  76    2016-07-14 08:56    38  *******************
  77    2016-07-14 08:57     ?  -
  78    2016-07-14 08:58    25  ******
  79    2016-07-14 08:59    25  ******
  80    2016-07-14 09:00    26  *******
  81    2016-07-14 09:01    27  ********
  82    2016-07-14 09:02    27  ********
  83    2016-07-14 09:03    28  *********
  84    2016-07-14 09:04    28  *********
  85    2016-07-14 09:05    29  **********
  86    2016-07-14 09:06    29  **********
  87    2016-07-14 09:07    30  ***********
  88    2016-07-14 09:08    30  ***********
  89    2016-07-14 09:09    30  ***********
  90    2016-07-14 09:10    31  ************
  91    2016-07-14 09:11    31  ************
  92    2016-07-14 09:12    31  ************
  93    2016-07-14 09:13    32  *************
 ...    ..(  2 skipped).    ..  *************
  96    2016-07-14 09:16    32  *************
  97    2016-07-14 09:17    33  **************
 ...    ..(  3 skipped).    ..  **************
 101    2016-07-14 09:21    33  **************
 102    2016-07-14 09:22    34  ***************
 ...    ..(  3 skipped).    ..  ***************
 106    2016-07-14 09:26    34  ***************
 107    2016-07-14 09:27    35  ****************
 ...    ..(  9 skipped).    ..  ****************
 117    2016-07-14 09:37    35  ****************
 118    2016-07-14 09:38    36  *****************
 ...    ..( 14 skipped).    ..  *****************
   5    2016-07-14 09:53    36  *****************
   6    2016-07-14 09:54    37  ******************
 ...    ..(  7 skipped).    ..  ******************
  14    2016-07-14 10:02    37  ******************
  15    2016-07-14 10:03    38  *******************
 ...    ..( 31 skipped).    ..  *******************
  47    2016-07-14 10:35    38  *******************
  48    2016-07-14 10:36    40  *********************
  49    2016-07-14 10:37    41  **********************
  50    2016-07-14 10:38    40  *********************
  51    2016-07-14 10:39    40  *********************
  52    2016-07-14 10:40    39  ********************
 ...    ..(  3 skipped).    ..  ********************
  56    2016-07-14 10:44    39  ********************

SCT Error Recovery Control:
           Read:    600 (60,0 seconds)
          Write:    600 (60,0 seconds)

Device Statistics (GP Log 0x04)
Page Offset Size         Value  Description
  1  =====  =                =  == General Statistics (rev 2) ==
  1  0x008  4              344  Lifetime Power-On Resets
  1  0x018  6       5086366784  Logical Sectors Written
  1  0x020  6         55237725  Number of Write Commands
  1  0x028  6       2070000364  Logical Sectors Read
  1  0x030  6         81182924  Number of Read Commands
  4  =====  =                =  == General Errors Statistics (rev 1) ==
  4  0x008  4                0  Number of Reported Uncorrectable Errors
  4  0x010  4                0  Resets Between Cmd Acceptance and Completion
  5  =====  =                =  == Temperature Statistics (rev 1) ==
  5  0x008  1               39  Current Temperature
  5  0x010  1               37  Average Short Term Temperature
  5  0x018  1               35  Average Long Term Temperature
  5  0x020  1               41  Highest Temperature
  5  0x028  1               27  Lowest Temperature
  5  0x030  1               38  Highest Average Short Term Temperature
  5  0x038  1               32  Lowest Average Short Term Temperature
  5  0x040  1               35  Highest Average Long Term Temperature
  5  0x048  1               35  Lowest Average Long Term Temperature
  5  0x050  4              560  Time in Over-Temperature
  5  0x058  1               40  Specified Maximum Operating Temperature
  5  0x060  4                0  Time in Under-Temperature
  5  0x068  1                5  Specified Minimum Operating Temperature
  6  =====  =                =  == Transport Statistics (rev 1) ==
  6  0x008  4             3017  Number of Hardware Resets
  6  0x018  4                0  Number of Interface CRC Errors
  7  =====  =                =  == Solid State Device Statistics (rev 1) ==
  7  0x008  1                1~ Percentage Used Endurance Indicator
                              |_ ~ normalized value

SATA Phy Event Counters (GP Log 0x11)
ID      Size     Value  Description
0x0001  2            0  Command failed due to ICRC error
0x0002  4            0  R_ERR response for data FIS
0x0003  2            0  R_ERR response for device-to-host data FIS
0x0004  2            0  R_ERR response for host-to-device data FIS
0x0005  4            0  R_ERR response for non-data FIS
0x0006  2            0  R_ERR response for device-to-host non-data FIS
0x0007  2            0  R_ERR response for host-to-device non-data FIS
0x0008  2            0  Device-to-host non-data FIS retries
0x0009  4            5  Transition from drive PhyRdy to drive PhyNRdy
0x000a  4            5  Device-to-host register FISes sent due to a COMRESET
0x000b  4            0  CRC errors within host-to-device FIS
0x000d  4            0  Non-CRC errors within host-to-device FIS
0x000f  2            0  R_ERR response for host-to-device data FIS, CRC
0x0010  2            0  R_ERR response for host-to-device data FIS, non-CRC
0x0012  2            0  R_ERR response for host-to-device non-data FIS, CRC
0x0013  2            0  R_ERR response for host-to-device non-data FIS, non-CRC

