smartctl 7.2 2020-12-30 r5155 [x86_64-linux-5.10.0-32-amd64] (local build)
Copyright (C) 2002-20, Bruce Allen, Christian Franke, www.smartmontools.org

=== START OF INFORMATION SECTION ===
Device Model:     WDC WD8005FFBX-68CAKN0
Serial Number:    
LU WWN Device Id: 5 0014ee 2c0e4baa2
Firmware Version: 83.00A83
User Capacity:    8,001,563,222,016 bytes [8.00 TB]
Sector Sizes:     512 bytes logical, 4096 bytes physical
Rotation Rate:    7200 rpm
Form Factor:      3.5 inches
Device is:        Not in smartctl database [for details use: -P showall]
ATA Version is:   ACS-4 published, ANSI INCITS 529-2018
SATA Version is:  SATA 3.2, 6.0 Gb/s (current: 6.0 Gb/s)
Local Time is:    Tue Sep 24 18:32:27 2024 EDT
SMART support is: Available - device has SMART capability.
SMART support is: Enabled
AAM feature is:   Unavailable
APM level is:     128 (minimum power consumption without standby)
Rd look-ahead is: Enabled
Write cache is:   Enabled
DSN feature is:   Disabled
ATA Security is:  Disabled, NOT FROZEN [SEC1]
Wt Cache Reorder: Enabled

Warning! SMART Attribute Thresholds Structure error: invalid SMART checksum.
=== START OF READ SMART DATA SECTION ===
SMART overall-health self-assessment test result: PASSED

General SMART Values:
Offline data collection status:  (0x00)	Offline data collection activity
					was never started.
					Auto Offline Data Collection: Disabled.
Self-test execution status:      (   0)	The previous self-test routine completed
					without error or no self-test has ever 
					been run.
Total time to complete Offline 
data collection: 		(61920) seconds.
Offline data collection
capabilities: 			 (0x71) SMART execute Offline immediate.
					No Auto Offline data collection support.
					Suspend Offline collection upon new
					command.
					No Offline surface scan supported.
					Self-test supported.
					Conveyance Self-test supported.
					Selective Self-test supported.
SMART capabilities:            (0x0003)	Saves SMART data before entering
					power-saving mode.
					Supports SMART auto save timer.
Error logging capability:        (0x01)	Error logging supported.
					General Purpose Logging supported.
Short self-test routine 
recommended polling time: 	 (   2) minutes.
Extended self-test routine
recommended polling time: 	 ( 618) minutes.
Conveyance self-test routine
recommended polling time: 	 (   5) minutes.
SCT capabilities: 	       (0x003d)	SCT Status supported.
					SCT Error Recovery Control supported.
					SCT Feature Control supported.
					SCT Data Table supported.

SMART Attributes Data Structure revision number: 16
Vendor Specific SMART Attributes with Thresholds:
ID# ATTRIBUTE_NAME          FLAGS    VALUE WORST THRESH FAIL RAW_VALUE
  1 Raw_Read_Error_Rate     POSR-K   200   200   051    -    0
  2 Throughput_Performance  --S--K   100   100   000    -    0
  3 Spin_Up_Time            POS--K   162   162   021    -    8866
  4 Start_Stop_Count        -O--CK   100   100   000    -    20
  5 Reallocated_Sector_Ct   PO--CK   200   200   140    -    0
  7 Seek_Error_Rate         -OSR-K   200   200   000    -    0
  8 Seek_Time_Performance   --S--K   100   100   000    -    0
  9 Power_On_Hours          -O--CK   100   100   000    -    92
 10 Spin_Retry_Count        -O--CK   100   100   000    -    0
 11 Calibration_Retry_Count -O--CK   100   100   000    -    0
 12 Power_Cycle_Count       -O--CK   100   100   000    -    6
192 Power-Off_Retract_Count -O--CK   200   200   000    -    1
193 Load_Cycle_Count        -O--CK   200   200   000    -    29
194 Temperature_Celsius     -O---K   127   100   000    -    25
196 Reallocated_Event_Count -O--CK   200   200   000    -    0
197 Current_Pending_Sector  -O--CK   200   200   000    -    0
198 Offline_Uncorrectable   ----CK   100   100   000    -    0
199 UDMA_CRC_Error_Count    -O--CK   200   200   000    -    0
200 Multi_Zone_Error_Rate   ---R--   200   100   000    -    0
                            ||||||_ K auto-keep
                            |||||__ C event count
                            ||||___ R error rate
                            |||____ S speed/performance
                            ||_____ O updated online
                            |______ P prefailure warning

General Purpose Log Directory Version 1
SMART           Log Directory Version 1 [multi-sector log support]
Address    Access  R/W   Size  Description
0x00       GPL,SL  R/O      1  Log Directory
0x01           SL  R/O      1  Summary SMART error log
0x02           SL  R/O      5  Comprehensive SMART error log
0x03       GPL     R/O      6  Ext. Comprehensive SMART error log
0x04       GPL     R/O    256  Device Statistics log
0x04       SL      R/O    255  Device Statistics log
0x06           SL  R/O      1  SMART self-test log
0x07       GPL     R/O      1  Extended self-test log
0x08       GPL     R/O      2  Power Conditions log
0x09           SL  R/W      1  Selective self-test log
0x0a       GPL     R/W    256  Device Statistics Notification
0x0c       GPL     R/O   2048  Pending Defects log
0x0f       GPL     R/O      2  Sense Data for Successful NCQ Cmds log
0x10       GPL     R/O      1  NCQ Command Error log
0x11       GPL     R/O      1  SATA Phy Event Counters log
0x12       GPL     R/O      1  SATA NCQ Non-Data log
0x13       GPL     R/O      1  SATA NCQ Send and Receive log
0x15       GPL     R/W      1  Rebuild Assist log
0x24       GPL     R/O    312  Current Device Internal Status Data log
0x30       GPL,SL  R/O      9  IDENTIFY DEVICE data log
0x53       GPL     -        1  Reserved
0x80-0x9f  GPL,SL  R/W     16  Host vendor specific log
0xa0-0xa1  GPL,SL  VS      16  Device vendor specific log
0xa3-0xa7  GPL,SL  VS      16  Device vendor specific log
0xa8-0xb1  GPL,SL  VS       1  Device vendor specific log
0xb2       GPL     VS   65535  Device vendor specific log
0xb3-0xb6  GPL,SL  VS       1  Device vendor specific log
0xb9           SL  VS       1  Device vendor specific log
0xba       GPL,SL  VS      80  Device vendor specific log
0xbd       GPL,SL  VS       1  Device vendor specific log
0xc0       GPL,SL  VS       1  Device vendor specific log
0xc1       GPL     VS      93  Device vendor specific log
0xd2           SL  VS       1  Device vendor specific log
0xe0       GPL,SL  R/W      1  SCT Command/Status
0xe1       GPL,SL  R/W      1  SCT Data Transfer

SMART Extended Comprehensive Error Log Version: 1 (6 sectors)
No Errors Logged

SMART Error Log Version: 1
No Errors Logged

SMART Extended Self-test Log Version: 1 (1 sectors)
Num  Test_Description    Status                  Remaining  LifeTime(hours)  LBA_of_first_error
# 1  Short offline       Completed without error       00%        40         -
# 2  Extended offline    Completed without error       00%        33         -
# 3  Short offline       Completed without error       00%         0         -
# 4  Conveyance offline  Completed without error       00%         0         -

SMART Self-test log structure revision number 1
Num  Test_Description    Status                  Remaining  LifeTime(hours)  LBA_of_first_error
# 1  Short offline       Completed without error       00%        40         -
# 2  Extended offline    Completed without error       00%        33         -
# 3  Short offline       Completed without error       00%         0         -
# 4  Conveyance offline  Completed without error       00%         0         -

SMART Selective self-test log data structure revision number 1
 SPAN  MIN_LBA  MAX_LBA  CURRENT_TEST_STATUS
    1        0        0  Not_testing
    2        0        0  Not_testing
    3        0        0  Not_testing
    4        0        0  Not_testing
    5        0        0  Not_testing
Selective self-test flags (0x0):
  After scanning selected spans, do NOT read-scan remainder of disk.
If Selective self-test is pending on power-up, resume after 0 minute delay.

SCT Status Version:                  3
SCT Version (vendor specific):       258 (0x0102)
Device State:                        Active (0)
Current Temperature:                    25 Celsius
Power Cycle Min/Max Temperature:     25/25 Celsius
Lifetime    Min/Max Temperature:     24/52 Celsius
Under/Over Temperature Limit Count:   0/0
Minimum supported ERC Time Limit:    65 (6.5 seconds)
Vendor specific:
01 00 00 00 00 00 00 00 00 00 00 00 00 00 00 00
00 00 00 00 00 00 00 00 00 00 00 00 00 00 00 00

SCT Temperature History Version:     2
Temperature Sampling Period:         1 minute
Temperature Logging Interval:        1 minute
Min/Max recommended Temperature:      0/65 Celsius
Min/Max Temperature Limit:           -41/85 Celsius
Temperature History Size (Index):    478 (347)

Index    Estimated Time   Temperature Celsius
 348    2024-09-24 10:35    29  **********
 ...    ..(406 skipped).    ..  **********
 277    2024-09-24 17:22    29  **********
 278    2024-09-24 17:23    28  *********
 ...    ..( 12 skipped).    ..  *********
 291    2024-09-24 17:36    28  *********
 292    2024-09-24 17:37    29  **********
 293    2024-09-24 17:38    28  *********
 ...    ..( 21 skipped).    ..  *********
 315    2024-09-24 18:00    28  *********
 316    2024-09-24 18:01     ?  -
 317    2024-09-24 18:02    28  *********
 318    2024-09-24 18:03    28  *********
 319    2024-09-24 18:04    28  *********
 320    2024-09-24 18:05    29  **********
 321    2024-09-24 18:06    29  **********
 322    2024-09-24 18:07    30  ***********
 323    2024-09-24 18:08    31  ************
 324    2024-09-24 18:09    32  *************
 325    2024-09-24 18:10    32  *************
 326    2024-09-24 18:11    32  *************
 327    2024-09-24 18:12    33  **************
 ...    ..(  2 skipped).    ..  **************
 330    2024-09-24 18:15    33  **************
 331    2024-09-24 18:16    34  ***************
 ...    ..(  3 skipped).    ..  ***************
 335    2024-09-24 18:20    34  ***************
 336    2024-09-24 18:21    35  ****************
 337    2024-09-24 18:22    35  ****************
 338    2024-09-24 18:23    35  ****************
 339    2024-09-24 18:24    36  *****************
 340    2024-09-24 18:25    36  *****************
 341    2024-09-24 18:26    37  ******************
 ...    ..(  2 skipped).    ..  ******************
 344    2024-09-24 18:29    37  ******************
 345    2024-09-24 18:30    38  *******************
 346    2024-09-24 18:31     ?  -
 347    2024-09-24 18:32    25  ******

SCT Error Recovery Control:
           Read:     70 (7.0 seconds)
          Write:     70 (7.0 seconds)

Device Statistics (GP Log 0x04)
Page  Offset Size        Value Flags Description
0x01  =====  =               =  ===  == General Statistics (rev 3) ==
0x01  0x008  4               6  -D-  Lifetime Power-On Resets
0x01  0x010  4              92  -D-  Power-on Hours
0x01  0x018  6      3959672648  -D-  Logical Sectors Written
0x01  0x020  6         4654494  -D-  Number of Write Commands
0x01  0x028  6       684086069  -D-  Logical Sectors Read
0x01  0x030  6         2639069  -D-  Number of Read Commands
0x01  0x038  6       331200000  -D-  Date and Time TimeStamp
0x02  =====  =               =  ===  == Free-Fall Statistics (rev 1) ==
0x02  0x010  4               0  -D-  Overlimit Shock Events
0x03  =====  =               =  ===  == Rotating Media Statistics (rev 1) ==
0x03  0x008  4              20  -D-  Spindle Motor Power-on Hours
0x03  0x010  4              19  -D-  Head Flying Hours
0x03  0x018  4              31  -D-  Head Load Events
0x03  0x020  4               0  -D-  Number of Reallocated Logical Sectors
0x03  0x028  4               0  -D-  Read Recovery Attempts
0x03  0x030  4               0  -D-  Number of Mechanical Start Failures
0x03  0x038  4               0  -D-  Number of Realloc. Candidate Logical Sectors
0x03  0x040  4               1  -D-  Number of High Priority Unload Events
0x04  =====  =               =  ===  == General Errors Statistics (rev 1) ==
0x04  0x008  4               0  -D-  Number of Reported Uncorrectable Errors
0x04  0x010  4               0  -D-  Resets Between Cmd Acceptance and Completion
0x05  =====  =               =  ===  == Temperature Statistics (rev 1) ==
0x05  0x008  1              25  ---  Current Temperature
0x05  0x010  1              29  -D-  Average Short Term Temperature
0x05  0x018  1               -  -D-  Average Long Term Temperature
0x05  0x020  1              52  -D-  Highest Temperature
0x05  0x028  1              24  -D-  Lowest Temperature
0x05  0x030  1              34  -D-  Highest Average Short Term Temperature
0x05  0x038  1              24  -D-  Lowest Average Short Term Temperature
0x05  0x040  1               -  -D-  Highest Average Long Term Temperature
0x05  0x048  1               -  -D-  Lowest Average Long Term Temperature
0x05  0x050  4               0  -D-  Time in Over-Temperature
0x05  0x058  1              65  ---  Specified Maximum Operating Temperature
0x05  0x060  4               0  -D-  Time in Under-Temperature
0x05  0x068  1               0  ---  Specified Minimum Operating Temperature
0x06  =====  =               =  ===  == Transport Statistics (rev 1) ==
0x06  0x008  4               6  -D-  Number of Hardware Resets
0x06  0x010  4               0  -D-  Number of ASR Events
0x06  0x018  4               0  -D-  Number of Interface CRC Errors
0xff  =====  =               =  ===  == Vendor Specific Statistics (rev 1) ==
0xff  0x008  7               0  -D-  Vendor Specific
0xff  0x010  7               0  -D-  Vendor Specific
0xff  0x018  7               0  -D-  Vendor Specific
0xff  0x040  7               6  -D-  Vendor Specific
0xff  0x048  7               4  -D-  Vendor Specific
0xff  0x050  7               0  -D-  Vendor Specific
0xff  0x058  7               0  -D-  Vendor Specific
0xff  0x060  7               0  -D-  Vendor Specific
0xff  0x068  7               0  -D-  Vendor Specific
0xff  0x070  7               0  -D-  Vendor Specific
0xff  0x078  7               0  -D-  Vendor Specific
0xff  0x080  7               2  -D-  Vendor Specific
0xff  0x088  7               0  -D-  Vendor Specific
0xff  0x090  7            5016  -D-  Vendor Specific
0xff  0x098  7           12074  -D-  Vendor Specific
0xff  0x0a0  7             100  -D-  Vendor Specific
                                |||_ C monitored condition met
                                ||__ D supports DSN
                                |___ N normalized value

Pending Defects log (GP Log 0x0c)
No Defects Logged

SATA Phy Event Counters (GP Log 0x11)
ID      Size     Value  Description
0x0001  2            0  Command failed due to ICRC error
0x0002  2            0  R_ERR response for data FIS
0x0003  2            0  R_ERR response for device-to-host data FIS
0x0004  2            0  R_ERR response for host-to-device data FIS
0x0005  2            0  R_ERR response for non-data FIS
0x0006  2            0  R_ERR response for device-to-host non-data FIS
0x0007  2            0  R_ERR response for host-to-device non-data FIS
0x0008  2            0  Device-to-host non-data FIS retries
0x0009  2            0  Transition from drive PhyRdy to drive PhyNRdy
0x000a  2            1  Device-to-host register FISes sent due to a COMRESET
0x000b  2            0  CRC errors within host-to-device FIS
0x000d  2            0  Non-CRC errors within host-to-device FIS
0x000f  2            0  R_ERR response for host-to-device data FIS, CRC
0x0012  2            0  R_ERR response for host-to-device non-data FIS, CRC
0x8000  4           57  Vendor specific

