smartctl 6.6 2017-08-08 r4433 [x86_64-w64-mingw32-win7-sp1] (daily-20170808)
Copyright (C) 2002-17, Bruce Allen, Christian Franke, www.smartmontools.org

=== START OF INFORMATION SECTION ===
Model Family:     SKhynix SATA Client SC308 Series
Device Model:     HFS500G32TND-N1A2A
Serial Number:    FI63Q046810104704
Firmware Version: 30000P10
User Capacity:    500,107,862,016 bytes [500 GB]
Sector Sizes:     512 bytes logical, 4096 bytes physical
Rotation Rate:    Solid State Device
Form Factor:      2.5 inches
Device is:        In smartctl database [for details use: -P show]
ATA Version is:   ACS-2 (minor revision not indicated)
SATA Version is:  SATA 3.1, 6.0 Gb/s (current: 3.0 Gb/s)
Local Time is:    Mon Sep 18 10:00:38 2017 PDT
SMART support is: Available - device has SMART capability.
SMART support is: Enabled

=== START OF READ SMART DATA SECTION ===
SMART overall-health self-assessment test result: PASSED

General SMART Values:
Offline data collection status:  (0x02)	Offline data collection activity
					was completed without error.
					Auto Offline Data Collection: Disabled.
Self-test execution status:      (  36)	The self-test routine was interrupted
					by the host with a hard or soft reset.
Total time to complete Offline 
data collection: 		(  105) seconds.
Offline data collection
capabilities: 			 (0x19) SMART execute Offline immediate.
					No Auto Offline data collection support.
					Suspend Offline collection upon new
					command.
					Offline surface scan supported.
					Self-test supported.
					No Conveyance Self-test supported.
					No Selective Self-test supported.
SMART capabilities:            (0x0002)	Does not save SMART data before
					entering power-saving mode.
					Supports SMART auto save timer.
Error logging capability:        (0x01)	Error logging supported.
					General Purpose Logging supported.
Short self-test routine 
recommended polling time: 	 (   2) minutes.
Extended self-test routine
recommended polling time: 	 (  60) minutes.

SMART Attributes Data Structure revision number: 0
Vendor Specific SMART Attributes with Thresholds:
ID# ATTRIBUTE_NAME          FLAG     VALUE WORST THRESH TYPE      UPDATED  WHEN_FAILED RAW_VALUE
  1 Raw_Read_Error_Rate     0x000f   166   166   006    Pre-fail  Always       -       0
  5 Retired_Block_Count     0x0032   253   100   036    Old_age   Always       -       0
  9 Power_On_Hours          0x0032   253   100   000    Old_age   Always       -       0
 12 Power_Cycle_Count       0x0032   100   100   020    Old_age   Always       -       5
100 Total_Erase_Count       0x0032   100   100   000    Old_age   Always       -       1054151
168 Min_Erase_Count         0x0032   253   100   000    Old_age   Always       -       0
169 Max_Erase_Count         0x0032   099   099   000    Old_age   Always       -       20
171 Program_Fail_Count      0x0032   253   253   000    Old_age   Always       -       0
172 Erase_Fail_Count        0x0032   253   253   000    Old_age   Always       -       0
174 Unexpect_Power_Loss_Cnt 0x0030   253   100   000    Old_age   Offline      -       0
175 Program_Fail_Count_Chip 0x0032   253   253   000    Old_age   Always       -       0
176 Unused_Rsvd_Blk_Cnt_Tot 0x0032   253   253   000    Old_age   Always       -       0
177 Wear_Leveling_Count     0x0032   253   100   000    Old_age   Always       -       0
178 Used_Rsvd_Blk_Cnt_Chip  0x0032   100   100   000    Old_age   Always       -       33
179 Used_Rsvd_Blk_Cnt_Tot   0x0032   100   100   000    Old_age   Always       -       502
180 Erase_Fail_Count        0x0032   100   100   000    Old_age   Always       -       13386
184 End-to-End_Error        0x0032   253   253   000    Old_age   Always       -       0
187 Reported_Uncorrect      0x0032   253   253   000    Old_age   Always       -       0
188 Command_Timeout         0x0032   253   253   000    Old_age   Always       -       0
194 Temperature_Celsius     0x0002   026   000   000    Old_age   Always       -       26 (Min/Max 22/29)
195 Hardware_ECC_Recovered  0x0032   253   253   000    Old_age   Always       -       0
196 Reallocated_Event_Count 0x0032   253   100   036    Old_age   Always       -       0
198 Offline_Uncorrectable   0x0032   253   253   000    Old_age   Always       -       0
199 UDMA_CRC_Error_Count    0x0032   253   253   000    Old_age   Always       -       0
204 Soft_ECC_Correction     0x000e   100   100   000    Old_age   Always       -       0
212 Phy_Error_Count         0x0032   253   253   000    Old_age   Always       -       0
234 Unknown_Attribute       0x0032   253   100   000    Old_age   Always       -       0
241 Total_LBAs_Written      0x0032   253   100   000    Old_age   Always       -       0
242 Total_LBAs_Read         0x0032   253   100   000    Old_age   Always       -       0
250 NAND_Reads_Retry        0x0032   100   100   000    Old_age   Always       -       12

SMART Error Log Version: 0
No Errors Logged

SMART Self-test log structure revision number 1
Num  Test_Description    Status                  Remaining  LifeTime(hours)  LBA_of_first_error
# 1  Short offline       Completed without error       00%         0         -
# 2  Short offline       Completed without error       90%         7         -

Selective Self-tests/Logging not supported

