smartctl 6.5 2016-05-07 r4318 [x86_64-w64-mingw32-win7-sp1] (sf-6.5-1)
Copyright (C) 2002-16, Bruce Allen, Christian Franke, www.smartmontools.org

=== START OF INFORMATION SECTION ===
Model Family:     SKhynix
Device Model:     SK hynix SC313 HFS256G32TNF-N3A0A
Serial Number:    EI77Q1098101A8G1D
LU WWN Device Id: 5 ace42e 0201b55f7
Firmware Version: 70000P10
User Capacity:    256,060,514,304 bytes [256 GB]
Sector Sizes:     512 bytes logical, 4096 bytes physical
Rotation Rate:    Solid State Device
Form Factor:      2.5 inches
Device is:        In smartctl database [for details use: -P show]
ATA Version is:   ACS-3 (minor revision not indicated)
SATA Version is:  SATA >3.2 (0x1ff), 6.0 Gb/s (current: 3.0 Gb/s)
Local Time is:    Mon Sep 11 18:02:08 2017 PDT
SMART support is: Available - device has SMART capability.
SMART support is: Enabled
AAM feature is:   Unavailable
APM feature is:   Disabled
Rd look-ahead is: Enabled
Write cache is:   Enabled
ATA Security is:  Disabled, NOT FROZEN [SEC1]
Wt Cache Reorder: Unknown

=== START OF READ SMART DATA SECTION ===
SMART Status not supported: Incomplete response, ATA output registers missing
SMART overall-health self-assessment test result: PASSED
Warning: This result is based on an Attribute check.

General SMART Values:
Offline data collection status:  (0x03)	Offline data collection activity
					is in progress.
					Auto Offline Data Collection: Disabled.
Self-test execution status:      ( 241)	Self-test routine in progress...
					10% of test remaining.
Total time to complete Offline 
data collection: 		(    0) seconds.
Offline data collection
capabilities: 			 (0x5b) SMART execute Offline immediate.
					Auto Offline data collection on/off support.
					Suspend Offline collection upon new
					command.
					Offline surface scan supported.
					Self-test supported.
					No Conveyance Self-test supported.
					Selective Self-test supported.
SMART capabilities:            (0x0003)	Saves SMART data before entering
					power-saving mode.
					Supports SMART auto save timer.
Error logging capability:        (0x01)	Error logging supported.
					General Purpose Logging supported.
Short self-test routine 
recommended polling time: 	 (   2) minutes.
Extended self-test routine
recommended polling time: 	 (  40) minutes.
SCT capabilities: 	       (0x003d)	SCT Status supported.
					SCT Error Recovery Control supported.
					SCT Feature Control supported.
					SCT Data Table supported.

SMART Attributes Data Structure revision number: 32
Vendor Specific SMART Attributes with Thresholds:
ID# ATTRIBUTE_NAME          FLAGS    VALUE WORST THRESH FAIL RAW_VALUE
  1 Raw_Read_Error_Rate     POSR-K   100   100   050    -    0
  5 Reallocated_Sector_Ct   PO--CK   100   100   005    -    0
  9 Power_On_Hours          -O--CK   100   100   000    -    2
 12 Power_Cycle_Count       -O--CK   100   100   000    -    3
100 Total_Erase_Count       -O--CK   100   100   000    -    0
168 Min_Erase_Count         -O--CK   100   100   000    -    0
169 Max_Erase_Count         -O--CK   100   099   000    -    0
171 Program_Fail_Count      -O--CK   100   100   000    -    0
172 Erase_Fail_Count        -O--CK   100   100   000    -    0
173 Wear_Leveling_Count     -O--CK   100   100   005    -    0
174 Unexpect_Power_Loss_Cnt -O--CK   100   100   000    -    0
175 Program_Fail_Count_Chip -O--CK   100   100   000    -    0
176 Unused_Rsvd_Blk_Cnt_Tot -O---K   100   100   000    -    780
178 Used_Rsvd_Blk_Cnt_Chip  -O--CK   100   100   000    -    0
179 Used_Rsvd_Blk_Cnt_Tot   -O--CK   100   100   000    -    0
180 Erase_Fail_Count        -O--CK   100   100   000    -    0
181 Non4k_Aligned_Access    -O---K   100   100   000    -    0
183 SATA_Downshift_Count    -O--CK   100   100   000    -    0
184 End-to-End_Error        PO-RCK   100   100   097    -    0
187 Reported_Uncorrect      -O--CK   100   100   000    -    0
188 Command_Timeout         -O--CK   100   100   000    -    0
194 Temperature_Celsius     -O---K   029   000   000    -    29 (Min/Max 27/33)
196 Reallocated_Event_Count -O--CK   100   100   036    -    0
198 Offline_Uncorrectable   ----CK   100   100   000    -    0
199 UDMA_CRC_Error_Count    -O--CK   100   100   000    -    0
201 Percent_Lifetime_Remain PO---K   100   100   005    -    0
212 Phy_Error_Count         -O--CK   100   100   000    -    2
241 Total_LBAs_Written      -O--CK   100   100   000    -    0
242 Total_LBAs_Read         -O--CK   100   100   000    -    0
243 Total_Media_Writes      -O--CK   100   100   000    -    0
                            ||||||_ K auto-keep
                            |||||__ C event count
                            ||||___ R error rate
                            |||____ S speed/performance
                            ||_____ O updated online
                            |______ P prefailure warning

General Purpose Log Directory Version 1
SMART           Log Directory Version 1 [multi-sector log support]
Address    Access  R/W   Size  Description
0x00       GPL,SL  R/O      1  Log Directory
0x01           SL  R/O      1  Summary SMART error log
0x02           SL  R/O      4  Comprehensive SMART error log
0x03       GPL     R/O      5  Ext. Comprehensive SMART error log
0x04       GPL,SL  R/O      8  Device Statistics log
0x06           SL  R/O      1  SMART self-test log
0x07       GPL     R/O      1  Extended self-test log
0x09           SL  R/W      1  Selective self-test log
0x0a       GPL     R/W      3  Device Statistics Notification
0x0d       GPL     R/O      8  LPS Mis-alignment log
0x10       GPL     R/O      1  SATA NCQ Queued Error log
0x11       GPL     R/O      1  SATA Phy Event Counters log
0x30       GPL     R/O      8  IDENTIFY DEVICE data log
0x80-0x9f  GPL,SL  R/W     16  Host vendor specific log
0xe0       GPL,SL  R/W      1  SCT Command/Status
0xe1       GPL,SL  R/W      1  SCT Data Transfer

SMART Extended Comprehensive Error Log Version: 1 (5 sectors)
No Errors Logged

SMART Extended Self-test Log Version: 1 (1 sectors)
Num  Test_Description    Status                  Remaining  LifeTime(hours)  LBA_of_first_error
# 1  Short offline       Completed without error       00%         2         -
# 2  Short offline       Completed without error       00%         5         -

Warning! SMART Selective Self-Test Log Structure error: invalid SMART checksum.
SMART Selective self-test log data structure revision number 0
Note: revision number not 1 implies that no selective self-test has ever been run
 SPAN  MIN_LBA  MAX_LBA  CURRENT_TEST_STATUS
    1        0        0  Not_testing
    2        0        0  Not_testing
    3        0        0  Not_testing
    4        0        0  Not_testing
    5        0        0  Not_testing
Selective self-test flags (0x0):
  After scanning selected spans, do NOT read-scan remainder of disk.
If Selective self-test is pending on power-up, resume after 0 minute delay.

SCT Status Version:                  3
SCT Version (vendor specific):       1 (0x0001)
SCT Support Level:                   0
Device State:                        Active (0)
Current Temperature:                    29 Celsius
Power Cycle Min/Max Temperature:     27/29 Celsius
Lifetime    Min/Max Temperature:     27/33 Celsius
Under/Over Temperature Limit Count:  11/0

SCT Temperature History Version:     2
Temperature Sampling Period:         1 minute
Temperature Logging Interval:        1 minute
Min/Max recommended Temperature:     -20/80 Celsius
Min/Max Temperature Limit:           -20/125 Celsius
Temperature History Size (Index):    192 (75)

Index    Estimated Time   Temperature Celsius
  76    2017-09-11 14:51    46  ***************************
  77    2017-09-11 14:52    48  *****************************
  78    2017-09-11 14:53    46  ***************************
  79    2017-09-11 14:54    47  ****************************
  80    2017-09-11 14:55    47  ****************************
  81    2017-09-11 14:56    46  ***************************
  82    2017-09-11 14:57    48  *****************************
  83    2017-09-11 14:58    45  **************************
  84    2017-09-11 14:59    47  ****************************
  85    2017-09-11 15:00    46  ***************************
  86    2017-09-11 15:01    46  ***************************
  87    2017-09-11 15:02    47  ****************************
  88    2017-09-11 15:03    45  **************************
  89    2017-09-11 15:04    47  ****************************
  90    2017-09-11 15:05    46  ***************************
  91    2017-09-11 15:06    46  ***************************
  92    2017-09-11 15:07    47  ****************************
  93    2017-09-11 15:08    45  **************************
  94    2017-09-11 15:09    47  ****************************
  95    2017-09-11 15:10    46  ***************************
  96    2017-09-11 15:11    46  ***************************
  97    2017-09-11 15:12    47  ****************************
  98    2017-09-11 15:13    45  **************************
  99    2017-09-11 15:14    47  ****************************
 100    2017-09-11 15:15    46  ***************************
 101    2017-09-11 15:16    47  ****************************
 102    2017-09-11 15:17    46  ***************************
 103    2017-09-11 15:18    46  ***************************
 104    2017-09-11 15:19    46  ***************************
 105    2017-09-11 15:20    45  **************************
 106    2017-09-11 15:21    47  ****************************
 107    2017-09-11 15:22    45  **************************
 108    2017-09-11 15:23    46  ***************************
 109    2017-09-11 15:24    46  ***************************
 110    2017-09-11 15:25    45  **************************
 111    2017-09-11 15:26    47  ****************************
 112    2017-09-11 15:27    44  *************************
 113    2017-09-11 15:28    46  ***************************
 114    2017-09-11 15:29    45  **************************
 115    2017-09-11 15:30    45  **************************
 116    2017-09-11 15:31    46  ***************************
 117    2017-09-11 15:32    45  **************************
 118    2017-09-11 15:33    47  ****************************
 119    2017-09-11 15:34    45  **************************
 120    2017-09-11 15:35    46  ***************************
 121    2017-09-11 15:36    45  **************************
 122    2017-09-11 15:37    47  ****************************
 123    2017-09-11 15:38    46  ***************************
 124    2017-09-11 15:39    43  ************************
 125    2017-09-11 15:40    39  ********************
 126    2017-09-11 15:41    37  ******************
 127    2017-09-11 15:42    36  *****************
 128    2017-09-11 15:43    36  *****************
 129    2017-09-11 15:44    36  *****************
 130    2017-09-11 15:45    35  ****************
 ...    ..(  5 skipped).    ..  ****************
 136    2017-09-11 15:51    35  ****************
 137    2017-09-11 15:52    37  ******************
 138    2017-09-11 15:53    42  ***********************
 139    2017-09-11 15:54    46  ***************************
 140    2017-09-11 15:55    48  *****************************
 141    2017-09-11 15:56    49  ******************************
 ...    ..(  3 skipped).    ..  ******************************
 145    2017-09-11 16:00    49  ******************************
 146    2017-09-11 16:01    50  *******************************
 ...    ..(  3 skipped).    ..  *******************************
 150    2017-09-11 16:05    50  *******************************
 151    2017-09-11 16:06    49  ******************************
 152    2017-09-11 16:07    50  *******************************
 ...    ..( 11 skipped).    ..  *******************************
 164    2017-09-11 16:19    50  *******************************
 165    2017-09-11 16:20    47  ****************************
 166    2017-09-11 16:21    49  ******************************
 167    2017-09-11 16:22    50  *******************************
 168    2017-09-11 16:23    51  ********************************
 169    2017-09-11 16:24    50  *******************************
 ...    ..(  3 skipped).    ..  *******************************
 173    2017-09-11 16:28    50  *******************************
 174    2017-09-11 16:29    51  ********************************
 175    2017-09-11 16:30    50  *******************************
 176    2017-09-11 16:31    50  *******************************
 177    2017-09-11 16:32    51  ********************************
 ...    ..(  2 skipped).    ..  ********************************
 180    2017-09-11 16:35    51  ********************************
 181    2017-09-11 16:36    50  *******************************
 182    2017-09-11 16:37    49  ******************************
 183    2017-09-11 16:38    50  *******************************
 184    2017-09-11 16:39    49  ******************************
 185    2017-09-11 16:40    51  ********************************
 186    2017-09-11 16:41    50  *******************************
 187    2017-09-11 16:42    50  *******************************
 188    2017-09-11 16:43    49  ******************************
 189    2017-09-11 16:44    50  *******************************
 190    2017-09-11 16:45    50  *******************************
 191    2017-09-11 16:46    50  *******************************
   0    2017-09-11 16:47    51  ********************************
   1    2017-09-11 16:48    47  ****************************
   2    2017-09-11 16:49    49  ******************************
   3    2017-09-11 16:50    50  *******************************
   4    2017-09-11 16:51    51  ********************************
   5    2017-09-11 16:52    50  *******************************
   6    2017-09-11 16:53    51  ********************************
   7    2017-09-11 16:54    50  *******************************
   8    2017-09-11 16:55    51  ********************************
   9    2017-09-11 16:56    51  ********************************
  10    2017-09-11 16:57    50  *******************************
  11    2017-09-11 16:58    50  *******************************
  12    2017-09-11 16:59    50  *******************************
  13    2017-09-11 17:00    49  ******************************
  14    2017-09-11 17:01    50  *******************************
  15    2017-09-11 17:02    49  ******************************
  16    2017-09-11 17:03    49  ******************************
  17    2017-09-11 17:04    50  *******************************
  18    2017-09-11 17:05    51  ********************************
  19    2017-09-11 17:06    50  *******************************
 ...    ..(  4 skipped).    ..  *******************************
  24    2017-09-11 17:11    50  *******************************
  25    2017-09-11 17:12    51  ********************************
  26    2017-09-11 17:13    51  ********************************
  27    2017-09-11 17:14    50  *******************************
  28    2017-09-11 17:15    50  *******************************
  29    2017-09-11 17:16    46  ***************************
  30    2017-09-11 17:17    49  ******************************
  31    2017-09-11 17:18    50  *******************************
  32    2017-09-11 17:19    50  *******************************
  33    2017-09-11 17:20    50  *******************************
  34    2017-09-11 17:21    51  ********************************
  35    2017-09-11 17:22    50  *******************************
 ...    ..(  3 skipped).    ..  *******************************
  39    2017-09-11 17:26    50  *******************************
  40    2017-09-11 17:27    49  ******************************
  41    2017-09-11 17:28    50  *******************************
  42    2017-09-11 17:29    48  *****************************
  43    2017-09-11 17:30    44  *************************
  44    2017-09-11 17:31     ?  -
  45    2017-09-11 17:32    36  *****************
  46    2017-09-11 17:33     ?  -
  47    2017-09-11 17:34    32  *************
  48    2017-09-11 17:35     ?  -
  49    2017-09-11 17:36    32  *************
  50    2017-09-11 17:37    34  ***************
  51    2017-09-11 17:38     ?  -
 ...    ..(  3 skipped).    ..  -
  55    2017-09-11 17:42     ?  -
  56    2017-09-11 17:43    29  **********
  57    2017-09-11 17:44     ?  -
  58    2017-09-11 17:45    28  *********
  59    2017-09-11 17:46     ?  -
  60    2017-09-11 17:47    28  *********
  61    2017-09-11 17:48     ?  -
  62    2017-09-11 17:49    27  ********
  63    2017-09-11 17:50    27  ********
  64    2017-09-11 17:51     ?  -
  65    2017-09-11 17:52     ?  -
  66    2017-09-11 17:53    27  ********
  67    2017-09-11 17:54     ?  -
  68    2017-09-11 17:55    27  ********
  69    2017-09-11 17:56     ?  -
  70    2017-09-11 17:57    27  ********
  71    2017-09-11 17:58     ?  -
  72    2017-09-11 17:59    27  ********
  73    2017-09-11 18:00     ?  -
  74    2017-09-11 18:01    27  ********
  75    2017-09-11 18:02    29  **********

SMART WRITE LOG does not return COUNT and LBA_LOW register
SCT (Get) Error Recovery Control command failed

Device Statistics (GP Log 0x04)
Page  Offset Size        Value Flags Description
0x01  =====  =               =  ===  == General Statistics (rev 2) ==
0x01  0x008  4               3  -D-  Lifetime Power-On Resets
0x01  0x010  4               2  -D-  Power-on Hours
0x01  0x018  6               0  ---  Logical Sectors Written
0x01  0x020  6               0  ---  Number of Write Commands
0x01  0x028  6               0  ---  Logical Sectors Read
0x01  0x030  6               0  ---  Number of Read Commands
0x04  =====  =               =  ===  == General Errors Statistics (rev 1) ==
0x04  0x008  4               0  -D-  Number of Reported Uncorrectable Errors
0x04  0x010  4               0  -D-  Resets Between Cmd Acceptance and Completion
0x05  =====  =               =  ===  == Temperature Statistics (rev 1) ==
0x05  0x008  1              29  -D-  Current Temperature
0x05  0x020  1              33  -D-  Highest Temperature
0x05  0x028  1              27  -D-  Lowest Temperature
0x05  0x038  1               0  -D-  Lowest Average Short Term Temperature
0x05  0x058  1              80  ---  Specified Maximum Operating Temperature
0x06  =====  =               =  ===  == Transport Statistics (rev 1) ==
0x06  0x008  4               4  -D-  Number of Hardware Resets
0x06  0x010  4               1  -D-  Number of ASR Events
0x06  0x018  4               0  -D-  Number of Interface CRC Errors
0x07  =====  =               =  ===  == Solid State Device Statistics (rev 1) ==
0x07  0x008  1               0  -D-  Percentage Used Endurance Indicator
                                |||_ C monitored condition met
                                ||__ D supports DSN
                                |___ N normalized value

SATA Phy Event Counters (GP Log 0x11)
ID      Size     Value  Description
0x0001  2            0  Command failed due to ICRC error
0x0002  2            0  R_ERR response for data FIS
0x0005  2            0  R_ERR response for non-data FIS
0x000a  2            2  Device-to-host register FISes sent due to a COMRESET

