smartctl 6.6 2017-11-05 r4594 [x86_64-linux-4.18.0-193.14.2.el8_2.x86_64] (local build)
Copyright (C) 2002-17, Bruce Allen, Christian Franke, www.smartmontools.org

=== START OF INFORMATION SECTION ===
Device Model:     MTFDDAK2T0TDL
Serial Number:    20072694092E
LU WWN Device Id: 5 00a075 12694092e
Firmware Version: M5MU030
User Capacity:    2.048.408.248.320 bytes [2,04 TB]
Sector Size:      512 bytes logical/physical
Rotation Rate:    Solid State Device
Form Factor:      2.5 inches
Device is:        Not in smartctl database [for details use: -P showall]
ATA Version is:   ACS-4 T13/BSR INCITS 529 revision 5
SATA Version is:  SATA 3.3, 6.0 Gb/s (current: 6.0 Gb/s)
Local Time is:    Wed Sep 16 12:52:08 2020 CEST
SMART support is: Available - device has SMART capability.
SMART support is: Enabled
AAM feature is:   Unavailable
APM feature is:   Unavailable
Rd look-ahead is: Enabled
Write cache is:   Enabled
DSN feature is:   Unavailable
ATA Security is:  Disabled, NOT FROZEN [SEC1]
Wt Cache Reorder: Enabled

=== START OF READ SMART DATA SECTION ===
SMART overall-health self-assessment test result: PASSED

General SMART Values:
Offline data collection status:  (0x00)	Offline data collection activity
					was never started.
					Auto Offline Data Collection: Disabled.
Self-test execution status:      (   0)	The previous self-test routine completed
					without error or no self-test has ever 
					been run.
Total time to complete Offline 
data collection: 		( 4069) seconds.
Offline data collection
capabilities: 			 (0x7b) SMART execute Offline immediate.
					Auto Offline data collection on/off support.
					Suspend Offline collection upon new
					command.
					Offline surface scan supported.
					Self-test supported.
					Conveyance Self-test supported.
					Selective Self-test supported.
SMART capabilities:            (0x0003)	Saves SMART data before entering
					power-saving mode.
					Supports SMART auto save timer.
Error logging capability:        (0x01)	Error logging supported.
					General Purpose Logging supported.
Short self-test routine 
recommended polling time: 	 (   2) minutes.
Extended self-test routine
recommended polling time: 	 (  18) minutes.
Conveyance self-test routine
recommended polling time: 	 (   3) minutes.
SCT capabilities: 	       (0x0035)	SCT Status supported.
					SCT Feature Control supported.
					SCT Data Table supported.

SMART Attributes Data Structure revision number: 16
Vendor Specific SMART Attributes with Thresholds:
ID# ATTRIBUTE_NAME          FLAGS    VALUE WORST THRESH FAIL RAW_VALUE
  1 Raw_Read_Error_Rate     POSR-K   100   100   000    -    0
  5 Reallocated_Sector_Ct   -O--CK   100   100   010    -    0
  9 Power_On_Hours          -O--CK   100   100   000    -    2
 12 Power_Cycle_Count       -O--CK   100   100   000    -    2
171 Unknown_Attribute       -O--CK   100   100   000    -    0
172 Unknown_Attribute       -O--CK   100   100   000    -    0
173 Unknown_Attribute       -O--CK   100   100   000    -    1
174 Unknown_Attribute       -O--CK   100   100   000    -    1
183 Runtime_Bad_Block       -O--CK   100   100   000    -    0
184 End-to-End_Error        -O--CK   100   100   000    -    0
187 Reported_Uncorrect      -O--CK   100   100   000    -    0
194 Temperature_Celsius     -O---K   069   062   000    -    31 (Min/Max 21/38)
196 Reallocated_Event_Count -O--CK   100   100   000    -    0
197 Current_Pending_Sector  -O--CK   100   100   000    -    0
198 Offline_Uncorrectable   ----CK   100   100   000    -    0
199 UDMA_CRC_Error_Count    -O--CK   100   100   000    -    0
202 Unknown_SSD_Attribute   ----CK   100   100   001    -    0
206 Unknown_SSD_Attribute   -OSR--   100   100   000    -    0
246 Unknown_Attribute       -O--CK   100   100   000    -    4000945562
247 Unknown_Attribute       -O--CK   100   100   000    -    125030537
248 Unknown_Attribute       -O--CK   100   100   000    -    41720823
180 Unused_Rsvd_Blk_Cnt_Tot PO--CK   000   000   000    -    4084
210 Unknown_Attribute       -O--CK   100   100   000    -    0
                            ||||||_ K auto-keep
                            |||||__ C event count
                            ||||___ R error rate
                            |||____ S speed/performance
                            ||_____ O updated online
                            |______ P prefailure warning

General Purpose Log Directory Version 1
SMART           Log Directory Version 1 [multi-sector log support]
Address    Access  R/W   Size  Description
0x00       GPL,SL  R/O      1  Log Directory
0x01           SL  R/O      1  Summary SMART error log
0x02           SL  R/O     51  Comprehensive SMART error log
0x03       GPL     R/O  16383  Ext. Comprehensive SMART error log
0x04       GPL,SL  R/O      8  Device Statistics log
0x06           SL  R/O      1  SMART self-test log
0x07       GPL     R/O      1  Extended self-test log
0x09           SL  R/W      1  Selective self-test log
0x10       GPL     R/O      1  NCQ Command Error log
0x11       GPL     R/O      1  SATA Phy Event Counters log
0x13       GPL     R/O      1  SATA NCQ Send and Receive log
0x24       GPL     R/O   8000  Current Device Internal Status Data log
0x25       GPL     R/O   8000  Saved Device Internal Status Data log
0x30       GPL,SL  R/O      9  IDENTIFY DEVICE data log
0x80-0x9f  GPL,SL  R/W     16  Host vendor specific log
0xa0       GPL     VS   35328  Device vendor specific log
0xa0       SL      VS     255  Device vendor specific log
0xa1       GPL,SL  VS       4  Device vendor specific log
0xa2       GPL,SL  VS       1  Device vendor specific log
0xa3       GPL     VS   38400  Device vendor specific log
0xa3       SL      VS     255  Device vendor specific log
0xa4       GPL     VS   16477  Device vendor specific log
0xa4       SL      VS     255  Device vendor specific log
0xa5       GPL     VS    8000  Device vendor specific log
0xa5       SL      VS     255  Device vendor specific log
0xa6       GPL     VS    8000  Device vendor specific log
0xa6       SL      VS     255  Device vendor specific log
0xa7       GPL     VS   32768  Device vendor specific log
0xa7       SL      VS     255  Device vendor specific log
0xa8-0xdf  GPL,SL  VS       1  Device vendor specific log
0xe0       GPL,SL  R/W      1  SCT Command/Status
0xe1       GPL,SL  R/W      1  SCT Data Transfer

SMART Extended Comprehensive Error Log Version: 1 (16383 sectors)
No Errors Logged

SMART Extended Self-test Log Version: 1 (1 sectors)
Num  Test_Description    Status                  Remaining  LifeTime(hours)  LBA_of_first_error
# 1  Short offline       Completed without error       00%         2         -

SMART Selective self-test log data structure revision number 1
 SPAN  MIN_LBA  MAX_LBA  CURRENT_TEST_STATUS
    1        0        0  Not_testing
    2        0        0  Not_testing
    3        0        0  Completed [00% left] (57881389-57946924)
    4        0        0  Not_testing
    5        0        0  Not_testing
Selective self-test flags (0x0):
  After scanning selected spans, do NOT read-scan remainder of disk.
If Selective self-test is pending on power-up, resume after 0 minute delay.

SCT Status Version:                  3
SCT Version (vendor specific):       1 (0x0001)
SCT Support Level:                   0
Device State:                        Active (0)
Current Temperature:                    31 Celsius
Power Cycle Min/Max Temperature:     24/38 Celsius
Lifetime    Min/Max Temperature:     21/38 Celsius
Under/Over Temperature Limit Count:   0/0
SMART Status:                        0xc24f (PASSED)
Minimum supported ERC Time Limit:    50 (5,0 seconds)

SCT Temperature History Version:     2
Temperature Sampling Period:         1 minute
Temperature Logging Interval:        1 minute
Min/Max recommended Temperature:      0/70 Celsius
Min/Max Temperature Limit:           -1/71 Celsius
Temperature History Size (Index):    478 (92)

Index    Estimated Time   Temperature Celsius
  93    2020-09-16 04:55     ?  -
 ...    ..(386 skipped).    ..  -
   2    2020-09-16 11:22     ?  -
   3    2020-09-16 11:23     0  -
   4    2020-09-16 11:24     0  -
   5    2020-09-16 11:25     ?  -
   6    2020-09-16 11:26     ?  -
   7    2020-09-16 11:27    28  *********
 ...    ..(  2 skipped).    ..  *********
  10    2020-09-16 11:30    28  *********
  11    2020-09-16 11:31    34  ***************
  12    2020-09-16 11:32    35  ****************
  13    2020-09-16 11:33    36  *****************
 ...    ..( 19 skipped).    ..  *****************
  33    2020-09-16 11:53    36  *****************
  34    2020-09-16 11:54    37  ******************
  35    2020-09-16 11:55    38  *******************
 ...    ..(  2 skipped).    ..  *******************
  38    2020-09-16 11:58    38  *******************
  39    2020-09-16 11:59    37  ******************
  40    2020-09-16 12:00    38  *******************
  41    2020-09-16 12:01    37  ******************
  42    2020-09-16 12:02    36  *****************
  43    2020-09-16 12:03    36  *****************
  44    2020-09-16 12:04    33  **************
  45    2020-09-16 12:05    31  ************
  46    2020-09-16 12:06    31  ************
  47    2020-09-16 12:07    31  ************
  48    2020-09-16 12:08    30  ***********
  49    2020-09-16 12:09    31  ************
  50    2020-09-16 12:10    30  ***********
  51    2020-09-16 12:11    31  ************
  52    2020-09-16 12:12    30  ***********
 ...    ..( 18 skipped).    ..  ***********
  71    2020-09-16 12:31    30  ***********
  72    2020-09-16 12:32    31  ************
 ...    ..( 13 skipped).    ..  ************
  86    2020-09-16 12:46    31  ************
  87    2020-09-16 12:47    33  **************
  88    2020-09-16 12:48    33  **************
  89    2020-09-16 12:49    31  ************
 ...    ..(  2 skipped).    ..  ************
  92    2020-09-16 12:52    31  ************

SCT Error Recovery Control command not supported

Device Statistics (GP Log 0x04)
Page  Offset Size        Value Flags Description
0x01  =====  =               =  ===  == General Statistics (rev 3) ==
0x01  0x008  4               2  ---  Lifetime Power-On Resets
0x01  0x010  4               2  ---  Power-on Hours
0x01  0x018  6      4000945562  ---  Logical Sectors Written
0x01  0x020  6         4302811  ---  Number of Write Commands
0x01  0x028  6           25554  ---  Logical Sectors Read
0x01  0x030  6             537  ---  Number of Read Commands
0x04  =====  =               =  ===  == General Errors Statistics (rev 1) ==
0x04  0x008  4               0  ---  Number of Reported Uncorrectable Errors
0x04  0x010  4               4  ---  Resets Between Cmd Acceptance and Completion
0x05  =====  =               =  ===  == Temperature Statistics (rev 1) ==
0x05  0x008  1              31  ---  Current Temperature
0x05  0x010  1               -  ---  Average Short Term Temperature
0x05  0x018  1               -  ---  Average Long Term Temperature
0x05  0x020  1              38  ---  Highest Temperature
0x05  0x028  1              21  ---  Lowest Temperature
0x05  0x030  1               -  ---  Highest Average Short Term Temperature
0x05  0x038  1               -  ---  Lowest Average Short Term Temperature
0x05  0x040  1               -  ---  Highest Average Long Term Temperature
0x05  0x048  1               -  ---  Lowest Average Long Term Temperature
0x05  0x050  4               0  ---  Time in Over-Temperature
0x05  0x058  1              70  ---  Specified Maximum Operating Temperature
0x05  0x060  4               0  ---  Time in Under-Temperature
0x05  0x068  1               0  ---  Specified Minimum Operating Temperature
0x06  =====  =               =  ===  == Transport Statistics (rev 1) ==
0x06  0x008  4               6  ---  Number of Hardware Resets
0x06  0x010  4               2  ---  Number of ASR Events
0x06  0x018  4               0  ---  Number of Interface CRC Errors
0x07  =====  =               =  ===  == Solid State Device Statistics (rev 1) ==
0x07  0x008  1               0  ---  Percentage Used Endurance Indicator
                                |||_ C monitored condition met
                                ||__ D supports DSN
                                |___ N normalized value

Pending Defects log (GP Log 0x0c) not supported

SATA Phy Event Counters (GP Log 0x11)
ID      Size     Value  Description
0x0001  4            0  Command failed due to ICRC error
0x000a  4            1  Device-to-host register FISes sent due to a COMRESET

