[root@localhost smartmontools-7.4]# ./smartctl -a /dev/sdc
smartctl 7.4 2024-04-06 r5611 [x86_64-linux-4.18.0-348.el8.x86_64] (local build)
Copyright (C) 2002-23, Bruce Allen, Christian Franke, www.smartmontools.org

=== START OF INFORMATION SECTION ===
Device Model:     SOLIDIGM SSDSC2KB960GZ
Serial Number:    BTYI405207RG960CGN
LU WWN Device Id: 5 c8d6b7 00f496e90
Firmware Version: 7CV10130
User Capacity:    960,197,124,096 bytes [960 GB]
Sector Sizes:     512 bytes logical, 4096 bytes physical
Rotation Rate:    Solid State Device
Form Factor:      2.5 inches
TRIM Command:     Available, deterministic, zeroed
Device is:        Not in smartctl database 7.3/5610
ATA Version is:   ACS-3 T13/2161-D revision 5
SATA Version is:  SATA 3.2, 6.0 Gb/s (current: 6.0 Gb/s)
Local Time is:    Tue Aug  6 06:04:38 2024 EDT
SMART support is: Available - device has SMART capability.
SMART support is: Enabled

=== START OF READ SMART DATA SECTION ===
SMART overall-health self-assessment test result: PASSED

General SMART Values:
Offline data collection status:  (0x00) Offline data collection activity
                                        was never started.
                                        Auto Offline Data Collection: Disabled.
Self-test execution status:      (   0) The previous self-test routine completed
                                        without error or no self-test has ever
                                        been run.
Total time to complete Offline
data collection:                (    0) seconds.
Offline data collection
capabilities:                    (0x79) SMART execute Offline immediate.
                                        No Auto Offline data collection support.
                                        Suspend Offline collection upon new
                                        command.
                                        Offline surface scan supported.
                                        Self-test supported.
                                        Conveyance Self-test supported.
                                        Selective Self-test supported.
SMART capabilities:            (0x0003) Saves SMART data before entering
                                        power-saving mode.
                                        Supports SMART auto save timer.
Error logging capability:        (0x01) Error logging supported.
                                        General Purpose Logging supported.
Short self-test routine
recommended polling time:        (   1) minutes.
Extended self-test routine
recommended polling time:        (   2) minutes.
Conveyance self-test routine
recommended polling time:        (   2) minutes.
SCT capabilities:              (0x003d) SCT Status supported.
                                        SCT Error Recovery Control supported.
                                        SCT Feature Control supported.
                                        SCT Data Table supported.

SMART Attributes Data Structure revision number: 1
Vendor Specific SMART Attributes with Thresholds:
ID# ATTRIBUTE_NAME          FLAG     VALUE WORST THRESH TYPE      UPDATED  WHEN_FAILED RAW_VALUE
  5 Reallocated_Sector_Ct   0x0032   037   037   000    Old_age   Always       -       0
  9 Power_On_Hours          0x0032   100   100   000    Old_age   Always       -       232
 12 Power_Cycle_Count       0x0032   100   100   000    Old_age   Always       -       54
170 Unknown_Attribute       0x0033   100   100   010    Pre-fail  Always       -       0
171 Unknown_Attribute       0x0032   100   100   000    Old_age   Always       -       0
172 Unknown_Attribute       0x0032   100   100   000    Old_age   Always       -       0
174 Unknown_Attribute       0x0032   100   100   000    Old_age   Always       -       32
175 Program_Fail_Count_Chip 0x0033   100   100   010    Pre-fail  Always       -       236223137913
183 Runtime_Bad_Block       0x0032   100   100   000    Old_age   Always       -       0
184 End-to-End_Error        0x0033   100   100   090    Pre-fail  Always       -       0
187 Reported_Uncorrect      0x0032   100   100   000    Old_age   Always       -       0
190 Airflow_Temperature_Cel 0x0022   070   070   000    Old_age   Always       -       30 (Min/Max 29/30)
192 Power-Off_Retract_Count 0x0032   100   100   000    Old_age   Always       -       32
194 Temperature_Celsius     0x0022   100   100   000    Old_age   Always       -       30
197 Current_Pending_Sector  0x0012   100   100   000    Old_age   Always       -       0
199 UDMA_CRC_Error_Count    0x003e   100   100   000    Old_age   Always       -       0
225 Unknown_SSD_Attribute   0x0032   100   100   000    Old_age   Always       -       90630
226 Unknown_SSD_Attribute   0x0032   100   100   000    Old_age   Always       -       30
227 Unknown_SSD_Attribute   0x0032   100   100   000    Old_age   Always       -       6
228 Power-off_Retract_Count 0x0032   100   100   000    Old_age   Always       -       13516
229 Unknown_Attribute       0x0032   100   100   000    Old_age   Always       -       0
230 Unknown_SSD_Attribute   0x0032   100   100   000    Old_age   Always       -       0
232 Available_Reservd_Space 0x0033   100   100   010    Pre-fail  Always       -       0
233 Media_Wearout_Indicator 0x0032   100   100   000    Old_age   Always       -       0
234 Unknown_Attribute       0x0032   100   100   000    Old_age   Always       -       0
235 Unknown_Attribute       0x0033   100   100   010    Pre-fail  Always       -       236223137913
241 Total_LBAs_Written      0x0032   100   100   000    Old_age   Always       -       90630
242 Total_LBAs_Read         0x0032   100   100   000    Old_age   Always       -       6408
243 Unknown_Attribute       0x0032   100   100   000    Old_age   Always       -       148810
246 Unknown_Attribute       0x0032   100   100   000    Old_age   Always       -       0

SMART Error Log Version: 1
No Errors Logged

SMART Self-test log structure revision number 1
No self-tests have been logged.  [To run self-tests, use: smartctl -t]

SMART Selective self-test log data structure revision number 1
 SPAN  MIN_LBA  MAX_LBA  CURRENT_TEST_STATUS
    1        0        0  Not_testing
    2        0        0  Not_testing
    3        0        0  Not_testing
    4        0        0  Not_testing
    5        0        0  Not_testing
Selective self-test flags (0x0):
  After scanning selected spans, do NOT read-scan remainder of disk.
If Selective self-test is pending on power-up, resume after 0 minute delay.

The above only provides legacy SMART information - try 'smartctl -x' for more

