smartctl 7.2 2020-12-30 r5155 [x86_64-w64-mingw32-win7-sp1] (sf-7.2-1)
Copyright (C) 2002-20, Bruce Allen, Christian Franke, www.smartmontools.org

=== START OF INFORMATION SECTION ===
Device Model:     ADATA SSD DP900 256GB-DL3
Firmware Version: 5.8.2
User Capacity:    256.060.514.304 bytes [256 GB]
Sector Size:      512 bytes logical/physical
Rotation Rate:    Solid State Device
TRIM Command:     Available
Device is:        Not in smartctl database [for details use: -P showall]
ATA Version is:   ATA8-ACS, ACS-2 T13/2015-D revision 3
SATA Version is:  SATA 3.0, 6.0 Gb/s (current: 6.0 Gb/s)
Local Time is:    Fri Feb 21 05:46:13 2025 HGMT
SMART support is: Available - device has SMART capability.
SMART support is: Enabled
AAM feature is:   Unavailable
APM level is:     254 (maximum performance)
Rd look-ahead is: Unavailable
Write cache is:   Enabled
DSN feature is:   Unavailable
ATA Security is:  Disabled, NOT FROZEN [SEC1]

=== START OF READ SMART DATA SECTION ===
SMART overall-health self-assessment test result: PASSED

General SMART Values:
Offline data collection status:  (0x02)	Offline data collection activity
					was completed without error.
					Auto Offline Data Collection: Disabled.
Self-test execution status:      (   0)	The previous self-test routine completed
					without error or no self-test has ever 
					been run.
Total time to complete Offline 
data collection: 		(    0) seconds.
Offline data collection
capabilities: 			 (0x7d) SMART execute Offline immediate.
					No Auto Offline data collection support.
					Abort Offline collection upon new
					command.
					Offline surface scan supported.
					Self-test supported.
					Conveyance Self-test supported.
					Selective Self-test supported.
SMART capabilities:            (0x0003)	Saves SMART data before entering
					power-saving mode.
					Supports SMART auto save timer.
Error logging capability:        (0x01)	Error logging supported.
					General Purpose Logging supported.
Short self-test routine 
recommended polling time: 	 (   1) minutes.
Extended self-test routine
recommended polling time: 	 (  48) minutes.
Conveyance self-test routine
recommended polling time: 	 (   2) minutes.
SCT capabilities: 	       (0x0025)	SCT Status supported.
					SCT Data Table supported.

SMART Attributes Data Structure revision number: 10
Vendor Specific SMART Attributes with Thresholds:
ID# ATTRIBUTE_NAME          FLAGS    VALUE WORST THRESH FAIL RAW_VALUE
  1 Raw_Read_Error_Rate     -O--CK   120   120   050    -    8589934592
  5 Reallocated_Sector_Ct   PO--CK   100   100   003    -    0
  9 Power_On_Hours          -O--CK   033   033   000    -    59168 (187 112 0)
 12 Power_Cycle_Count       -O--CK   099   099   000    -    1128
171 Unknown_Attribute       -O-R--   100   100   000    -    0
172 Unknown_Attribute       -O--CK   100   100   000    -    0
174 Unknown_Attribute       ----CK   000   000   000    -    220
177 Wear_Leveling_Count     ------   000   000   000    -    92
181 Program_Fail_Cnt_Total  -O-R--   100   100   000    -    0
182 Erase_Fail_Count_Total  -O--CK   100   100   000    -    0
187 Reported_Uncorrect      -O--C-   100   100   000    -    0
194 Temperature_Celsius     -O---K   019   050   000    -    19 (Min/Max -22/50)
195 Hardware_ECC_Recovered  --SRC-   120   120   000    -    8589934592
196 Reallocated_Event_Count PO--CK   100   100   003    -    0
201 Unknown_SSD_Attribute   --SRC-   120   120   000    -    8589934592
204 Soft_ECC_Correction     --SRC-   120   120   000    -    8589934592
230 Unknown_SSD_Attribute   PO--C-   100   100   000    -    100
231 Unknown_SSD_Attribute   PO--C-   090   090   010    -    17179869184
233 Media_Wearout_Indicator -O--CK   000   000   000    -    95332
234 Unknown_Attribute       -O--CK   000   000   000    -    47220
241 Total_LBAs_Written      -O--CK   000   000   000    -    47220
242 Total_LBAs_Read         -O--CK   000   000   000    -    31947
                            ||||||_ K auto-keep
                            |||||__ C event count
                            ||||___ R error rate
                            |||____ S speed/performance
                            ||_____ O updated online
                            |______ P prefailure warning

General Purpose Log Directory Version 1
SMART           Log Directory Version 1 [multi-sector log support]
Address    Access  R/W   Size  Description
0x00       GPL,SL  R/O      1  Log Directory
0x04       GPL,SL  R/O     16  Device Statistics log
0x06           SL  R/O      1  SMART self-test log
0x07       GPL     R/O      1  Extended self-test log
0x09           SL  R/W      1  Selective self-test log
0x10       GPL     R/O      1  NCQ Command Error log
0x11       GPL     R/O      1  SATA Phy Event Counters log
0x80-0x9f  GPL,SL  R/W     16  Host vendor specific log
0xb7       GPL,SL  VS      16  Device vendor specific log
0xe0       GPL,SL  R/W      1  SCT Command/Status
0xe1       GPL,SL  R/W      1  SCT Data Transfer

SMART Extended Comprehensive Error Log (GP Log 0x03) not supported

SMART Error Log not supported

SMART Extended Self-test Log Version: 1 (1 sectors)
Num  Test_Description    Status                  Remaining  LifeTime(hours)  LBA_of_first_error
# 1  Short offline       Completed without error       00%      7941         -
# 2  Short offline       Completed without error       00%         0         -

SMART Selective self-test log data structure revision number 1
 SPAN  MIN_LBA  MAX_LBA  CURRENT_TEST_STATUS
    1        0        0  Not_testing
    2        0        0  Not_testing
    3        0        0  Not_testing
    4        0        0  Not_testing
    5        0        0  Not_testing
Selective self-test flags (0x0):
  After scanning selected spans, do NOT read-scan remainder of disk.
If Selective self-test is pending on power-up, resume after 0 minute delay.

SCT Status Version:                  3
SCT Version (vendor specific):       0 (0x0000)
Device State:                        Active (0)
Current Temperature:                    19 Celsius
Power Cycle Min/Max Temperature:     -22/50 Celsius
Lifetime    Min/Max Temperature:     -22/50 Celsius
Under/Over Temperature Limit Count:   0/0

SCT Temperature History Version:     2
Temperature Sampling Period:         1 minute
Temperature Logging Interval:        10 minutes
Min/Max recommended Temperature:      0/65 Celsius
Min/Max Temperature Limit:            0/70 Celsius
Temperature History Size (Index):    478 (363)

Index    Estimated Time   Temperature Celsius
 364    2025-02-17 22:10    36  *****************
 ...    ..(  5 skipped).    ..  *****************
 370    2025-02-17 23:10    36  *****************
 371    2025-02-17 23:20    35  ****************
 ...    ..( 56 skipped).    ..  ****************
 428    2025-02-18 08:50    35  ****************
 429    2025-02-18 09:00    34  ***************
 430    2025-02-18 09:10    34  ***************
 431    2025-02-18 09:20    33  **************
 ...    ..(  2 skipped).    ..  **************
 434    2025-02-18 09:50    33  **************
 435    2025-02-18 10:00    35  ****************
 436    2025-02-18 10:10    34  ***************
 437    2025-02-18 10:20    34  ***************
 438    2025-02-18 10:30    33  **************
 439    2025-02-18 10:40    33  **************
 440    2025-02-18 10:50    33  **************
 441    2025-02-18 11:00    34  ***************
 ...    ..( 49 skipped).    ..  ***************
  13    2025-02-18 19:20    34  ***************
  14    2025-02-18 19:30    33  **************
 ...    ..(  2 skipped).    ..  **************
  17    2025-02-18 20:00    33  **************
  18    2025-02-18 20:10    34  ***************
  19    2025-02-18 20:20    34  ***************
  20    2025-02-18 20:30    34  ***************
  21    2025-02-18 20:40    35  ****************
 ...    ..( 19 skipped).    ..  ****************
  41    2025-02-19 00:00    35  ****************
  42    2025-02-19 00:10    36  *****************
  43    2025-02-19 00:20    36  *****************
  44    2025-02-19 00:30    35  ****************
 ...    ..(  2 skipped).    ..  ****************
  47    2025-02-19 01:00    35  ****************
  48    2025-02-19 01:10    36  *****************
  49    2025-02-19 01:20    35  ****************
 ...    ..( 42 skipped).    ..  ****************
  92    2025-02-19 08:30    35  ****************
  93    2025-02-19 08:40    34  ***************
 ...    ..(  3 skipped).    ..  ***************
  97    2025-02-19 09:20    34  ***************
  98    2025-02-19 09:30    33  **************
 ...    ..(  2 skipped).    ..  **************
 101    2025-02-19 10:00    33  **************
 102    2025-02-19 10:10    37  ******************
 103    2025-02-19 10:20    35  ****************
 104    2025-02-19 10:30    34  ***************
 ...    ..( 13 skipped).    ..  ***************
 118    2025-02-19 12:50    34  ***************
 119    2025-02-19 13:00    33  **************
 120    2025-02-19 13:10    33  **************
 121    2025-02-19 13:20    34  ***************
 ...    ..(  4 skipped).    ..  ***************
 126    2025-02-19 14:10    34  ***************
 127    2025-02-19 14:20    33  **************
 ...    ..(  3 skipped).    ..  **************
 131    2025-02-19 15:00    33  **************
 132    2025-02-19 15:10    34  ***************
 ...    ..(  4 skipped).    ..  ***************
 137    2025-02-19 16:00    34  ***************
 138    2025-02-19 16:10    33  **************
 139    2025-02-19 16:20    34  ***************
 140    2025-02-19 16:30    33  **************
 ...    ..( 21 skipped).    ..  **************
 162    2025-02-19 20:10    33  **************
 163    2025-02-19 20:20    34  ***************
 ...    ..(  8 skipped).    ..  ***************
 172    2025-02-19 21:50    34  ***************
 173    2025-02-19 22:00    35  ****************
 ...    ..( 59 skipped).    ..  ****************
 233    2025-02-20 08:00    35  ****************
 234    2025-02-20 08:10    36  *****************
 235    2025-02-20 08:20    35  ****************
 236    2025-02-20 08:30    34  ***************
 ...    ..(  3 skipped).    ..  ***************
 240    2025-02-20 09:10    34  ***************
 241    2025-02-20 09:20    33  **************
 242    2025-02-20 09:30    33  **************
 243    2025-02-20 09:40    33  **************
 244    2025-02-20 09:50     ?  -
 245    2025-02-20 10:00    27  ********
 246    2025-02-20 10:10    29  **********
 247    2025-02-20 10:20    30  ***********
 248    2025-02-20 10:30    31  ************
 249    2025-02-20 10:40    31  ************
 250    2025-02-20 10:50    29  **********
 251    2025-02-20 11:00    30  ***********
 252    2025-02-20 11:10    31  ************
 253    2025-02-20 11:20    29  **********
 254    2025-02-20 11:30    31  ************
 255    2025-02-20 11:40    32  *************
 256    2025-02-20 11:50    32  *************
 257    2025-02-20 12:00    31  ************
 258    2025-02-20 12:10    32  *************
 259    2025-02-20 12:20    32  *************
 260    2025-02-20 12:30    31  ************
 261    2025-02-20 12:40    32  *************
 262    2025-02-20 12:50    32  *************
 263    2025-02-20 13:00    31  ************
 264    2025-02-20 13:10    32  *************
 265    2025-02-20 13:20    32  *************
 266    2025-02-20 13:30    31  ************
 267    2025-02-20 13:40    32  *************
 268    2025-02-20 13:50    32  *************
 269    2025-02-20 14:00    31  ************
 270    2025-02-20 14:10    32  *************
 271    2025-02-20 14:20    32  *************
 272    2025-02-20 14:30    31  ************
 273    2025-02-20 14:40    32  *************
 274    2025-02-20 14:50    32  *************
 275    2025-02-20 15:00    31  ************
 276    2025-02-20 15:10    32  *************
 277    2025-02-20 15:20    32  *************
 278    2025-02-20 15:30    31  ************
 279    2025-02-20 15:40    32  *************
 280    2025-02-20 15:50    32  *************
 281    2025-02-20 16:00    33  **************
 282    2025-02-20 16:10    32  *************
 283    2025-02-20 16:20    32  *************
 284    2025-02-20 16:30    33  **************
 285    2025-02-20 16:40    32  *************
 286    2025-02-20 16:50    32  *************
 287    2025-02-20 17:00    32  *************
 288    2025-02-20 17:10    31  ************
 289    2025-02-20 17:20    32  *************
 290    2025-02-20 17:30    33  **************
 291    2025-02-20 17:40    31  ************
 292    2025-02-20 17:50    32  *************
 293    2025-02-20 18:00    32  *************
 294    2025-02-20 18:10    31  ************
 295    2025-02-20 18:20    32  *************
 296    2025-02-20 18:30    33  **************
 297    2025-02-20 18:40    31  ************
 298    2025-02-20 18:50    32  *************
 299    2025-02-20 19:00    32  *************
 300    2025-02-20 19:10    31  ************
 301    2025-02-20 19:20    32  *************
 302    2025-02-20 19:30    32  *************
 303    2025-02-20 19:40    31  ************
 304    2025-02-20 19:50    32  *************
 305    2025-02-20 20:00    32  *************
 306    2025-02-20 20:10    33  **************
 307    2025-02-20 20:20    32  *************
 308    2025-02-20 20:30    32  *************
 309    2025-02-20 20:40    33  **************
 310    2025-02-20 20:50    32  *************
 311    2025-02-20 21:00    32  *************
 312    2025-02-20 21:10    33  **************
 313    2025-02-20 21:20    31  ************
 314    2025-02-20 21:30    32  *************
 315    2025-02-20 21:40    33  **************
 316    2025-02-20 21:50    31  ************
 317    2025-02-20 22:00    32  *************
 318    2025-02-20 22:10    33  **************
 319    2025-02-20 22:20    31  ************
 320    2025-02-20 22:30    32  *************
 321    2025-02-20 22:40    33  **************
 322    2025-02-20 22:50    31  ************
 323    2025-02-20 23:00    32  *************
 324    2025-02-20 23:10    32  *************
 325    2025-02-20 23:20    30  ***********
 326    2025-02-20 23:30    32  *************
 327    2025-02-20 23:40    32  *************
 328    2025-02-20 23:50    30  ***********
 329    2025-02-21 00:00    31  ************
 330    2025-02-21 00:10    32  *************
 331    2025-02-21 00:20    32  *************
 332    2025-02-21 00:30    30  ***********
 333    2025-02-21 00:40    31  ************
 334    2025-02-21 00:50    31  ************
 335    2025-02-21 01:00    30  ***********
 336    2025-02-21 01:10    31  ************
 337    2025-02-21 01:20    31  ************
 338    2025-02-21 01:30    29  **********
 339    2025-02-21 01:40    31  ************
 340    2025-02-21 01:50    31  ************
 341    2025-02-21 02:00    29  **********
 342    2025-02-21 02:10    31  ************
 343    2025-02-21 02:20    31  ************
 344    2025-02-21 02:30     ?  -
 345    2025-02-21 02:40    26  *******
 346    2025-02-21 02:50    29  **********
 347    2025-02-21 03:00     ?  -
 348    2025-02-21 03:10    28  *********
 349    2025-02-21 03:20    30  ***********
 350    2025-02-21 03:30    31  ************
 351    2025-02-21 03:40     ?  -
 ...    ..(  2 skipped).    ..  -
 354    2025-02-21 04:10     ?  -
 355    2025-02-21 04:20    31  ************
 356    2025-02-21 04:30    32  *************
 357    2025-02-21 04:40     ?  -
 ...    ..(  2 skipped).    ..  -
 360    2025-02-21 05:10     ?  -
 361    2025-02-21 05:20    28  *********
 362    2025-02-21 05:30     ?  -
 363    2025-02-21 05:40     ?  -

SCT Error Recovery Control command not supported

Device Statistics (GP Log 0x04)
Page  Offset Size        Value Flags Description
0x01  =====  =               =  ===  == General Statistics (rev 2) ==
0x01  0x008  4            1128  ---  Lifetime Power-On Resets
0x01  0x010  4           59168  ---  Power-on Hours
0x01  0x018  6    100029915161  ---  Logical Sectors Written
0x01  0x028  6     68000074390  ---  Logical Sectors Read
0x04  =====  =               =  ===  == General Errors Statistics (rev 1) ==
0x04  0x008  4             335  ---  Number of Reported Uncorrectable Errors
0x04  0x010  4               6  ---  Resets Between Cmd Acceptance and Completion
0x05  =====  =               =  ===  == Temperature Statistics (rev 1) ==
0x05  0x008  1              19  ---  Current Temperature
0x05  0x010  1              34  ---  Average Short Term Temperature
0x05  0x018  1              37  ---  Average Long Term Temperature
0x05  0x020  1              49  ---  Highest Temperature
0x05  0x028  1              21  ---  Lowest Temperature
0x05  0x030  1              42  ---  Highest Average Short Term Temperature
0x05  0x038  1              22  ---  Lowest Average Short Term Temperature
0x05  0x040  1              37  ---  Highest Average Long Term Temperature
0x05  0x048  1              26  ---  Lowest Average Long Term Temperature
0x05  0x050  4               0  ---  Time in Over-Temperature
0x05  0x058  1              65  ---  Specified Maximum Operating Temperature
0x05  0x060  4               0  ---  Time in Under-Temperature
0x05  0x068  1               0  ---  Specified Minimum Operating Temperature
0x06  =====  =               =  ===  == Transport Statistics (rev 1) ==
0x06  0x008  4            2017  ---  Number of Hardware Resets
0x06  0x010  4            3087  ---  Number of ASR Events
0x06  0x018  4            5932  ---  Number of Interface CRC Errors
0x07  =====  =               =  ===  == Solid State Device Statistics (rev 1) ==
0x07  0x008  1              12  ---  Percentage Used Endurance Indicator
                                |||_ C monitored condition met
                                ||__ D supports DSN
                                |___ N normalized value

SATA Phy Event Counters (GP Log 0x11)
ID      Size     Value  Description
0x0001  2            0  Command failed due to ICRC error
0x0003  2            0  R_ERR response for device-to-host data FIS
0x0004  2            0  R_ERR response for host-to-device data FIS
0x0006  2            0  R_ERR response for device-to-host non-data FIS
0x0007  2            0  R_ERR response for host-to-device non-data FIS
0x0008  2            0  Device-to-host non-data FIS retries
0x0009  2            0  Transition from drive PhyRdy to drive PhyNRdy
0x000a  2            1  Device-to-host register FISes sent due to a COMRESET
0x000f  2            0  R_ERR response for host-to-device data FIS, CRC
0x0010  2            0  R_ERR response for host-to-device data FIS, non-CRC
0x0012  2            0  R_ERR response for host-to-device non-data FIS, CRC
0x0013  2            0  R_ERR response for host-to-device non-data FIS, non-CRC
0x0002  2            0  R_ERR response for data FIS
0x0005  2            0  R_ERR response for non-data FIS
0x000b  2            0  CRC errors within host-to-device FIS
0x000d  2            0  Non-CRC errors within host-to-device FIS