smartctl 7.3 2022-02-28 r5338 [aarch64-linux-6.1.0-rpi7-rpi-v8] (local build)
Copyright (C) 2002-22, Bruce Allen, Christian Franke, www.smartmontools.org

=== START OF INFORMATION SECTION ===
Device Model:     HS-SSD-E100N 1024G
Serial Number:    30104104136
LU WWN Device Id: 5 000000 000002eb5
Firmware Version: 030fAA20
User Capacity:    1,024,209,543,168 bytes [1.02 TB]
Sector Size:      512 bytes logical/physical
Rotation Rate:    Solid State Device
Form Factor:      2.5 inches
TRIM Command:     Available, deterministic, zeroed
Device is:        Not in smartctl database 7.3/5577
ATA Version is:   ACS-4 (minor revision not indicated)
SATA Version is:  SATA 3.2, 6.0 Gb/s (current: 6.0 Gb/s)
Local Time is:    Thu Jan 18 13:38:29 2024 MSK
SMART support is: Available - device has SMART capability.
SMART support is: Enabled
AAM feature is:   Unavailable
APM feature is:   Unavailable
Rd look-ahead is: Enabled
Write cache is:   Enabled
DSN feature is:   Unavailable
ATA Security is:  Disabled, NOT FROZEN [SEC1]
Wt Cache Reorder: Enabled

=== START OF READ SMART DATA SECTION ===
SMART overall-health self-assessment test result: PASSED

General SMART Values:
Offline data collection status:  (0x00)	Offline data collection activity
					was never started.
					Auto Offline Data Collection: Disabled.
Self-test execution status:      (   0)	The previous self-test routine completed
					without error or no self-test has ever 
					been run.
Total time to complete Offline 
data collection: 		(   33) seconds.
Offline data collection
capabilities: 			 (0x7b) SMART execute Offline immediate.
					Auto Offline data collection on/off support.
					Suspend Offline collection upon new
					command.
					Offline surface scan supported.
					Self-test supported.
					Conveyance Self-test supported.
					Selective Self-test supported.
SMART capabilities:            (0x0003)	Saves SMART data before entering
					power-saving mode.
					Supports SMART auto save timer.
Error logging capability:        (0x01)	Error logging supported.
					General Purpose Logging supported.
Short self-test routine 
recommended polling time: 	 (   2) minutes.
Extended self-test routine
recommended polling time: 	 (   2) minutes.
Conveyance self-test routine
recommended polling time: 	 (   2) minutes.
SCT capabilities: 	       (0x0031)	SCT Status supported.
					SCT Feature Control supported.
					SCT Data Table supported.

SMART Attributes Data Structure revision number: 20
Vendor Specific SMART Attributes with Thresholds:
ID# ATTRIBUTE_NAME          FLAGS    VALUE WORST THRESH FAIL RAW_VALUE
  5 Reallocated_Sector_Ct   -O--CK   100   100   050    -    0
  9 Power_On_Hours          -O--C-   100   100   000    -    1
 12 Power_Cycle_Count       -O--C-   100   100   000    -    5
167 Unknown_Attribute       -O---K   100   100   000    -    0
168 Unknown_Attribute       -O--C-   100   100   000    -    0
169 Unknown_Attribute       PO--C-   100   100   010    -    0
170 Unknown_Attribute       PO--CK   100   100   010    -    231
171 Unknown_Attribute       -O--CK   100   100   000    -    0
172 Unknown_Attribute       -O--CK   100   100   000    -    0
174 Unknown_Attribute       -O---K   100   100   000    -    0
175 Program_Fail_Count_Chip PO--CK   100   100   010    -    0
177 Wear_Leveling_Count     -O--C-   100   100   000    -    0
180 Unused_Rsvd_Blk_Cnt_Tot PO--CK   100   100   000    -    231
183 Runtime_Bad_Block       -O--CK   100   100   000    -    0
184 End-to-End_Error        PO--CK   100   100   090    -    0
187 Reported_Uncorrect      -O--CK   100   000   000    -    0
192 Power-Off_Retract_Count -O--C-   100   100   000    -    5
194 Temperature_Celsius     -O---K   048   048   000    -    48 (Min/Max 30/57)
196 Reallocated_Event_Count -O--C-   100   100   000    -    0
197 Current_Pending_Sector  -O--C-   100   100   000    -    0
199 UDMA_CRC_Error_Count    -OSRCK   100   100   000    -    0
206 Unknown_SSD_Attribute   -O--CK   200   200   000    -    1
207 Unknown_SSD_Attribute   -O--CK   200   200   000    -    2
208 Unknown_SSD_Attribute   -O--CK   200   200   000    -    1
231 Unknown_SSD_Attribute   PO---K   100   100   005    -    0
233 Media_Wearout_Indicator -O--CK   100   100   000    -    0
234 Unknown_Attribute       -O--CK   100   100   000    -    2
241 Total_LBAs_Written      -O--CK   100   100   000    -    23
242 Total_LBAs_Read         -O--CK   100   100   000    -    2
243 Unknown_Attribute       -O--CK   050   050   000    -    50
                            ||||||_ K auto-keep
                            |||||__ C event count
                            ||||___ R error rate
                            |||____ S speed/performance
                            ||_____ O updated online
                            |______ P prefailure warning

General Purpose Log Directory Version 1
SMART           Log Directory Version 1 [multi-sector log support]
Address    Access  R/W   Size  Description
0x00       GPL,SL  R/O      1  Log Directory
0x01           SL  R/O      1  Summary SMART error log
0x02           SL  R/O     51  Comprehensive SMART error log
0x03       GPL     R/O     64  Ext. Comprehensive SMART error log
0x04       GPL,SL  R/O      8  Device Statistics log
0x06           SL  R/O      1  SMART self-test log
0x07       GPL     R/O      1  Extended self-test log
0x09           SL  R/W      1  Selective self-test log
0x10       GPL     R/O      1  NCQ Command Error log
0x11       GPL     R/O      1  SATA Phy Event Counters log
0x30       GPL,SL  R/O      9  IDENTIFY DEVICE data log
0x80-0x9f  GPL,SL  R/W     16  Host vendor specific log
0xe0       GPL,SL  R/W      1  SCT Command/Status
0xe1       GPL,SL  R/W      1  SCT Data Transfer

SMART Extended Comprehensive Error Log Version: 1 (64 sectors)
No Errors Logged

SMART Extended Self-test Log Version: 1 (1 sectors)
Num  Test_Description    Status                  Remaining  LifeTime(hours)  LBA_of_first_error
# 1  Extended offline    Completed without error       00%         1         -

SMART Selective self-test log data structure revision number 1
 SPAN  MIN_LBA  MAX_LBA  CURRENT_TEST_STATUS
    1        0        0  Not_testing
    2        0        0  Not_testing
    3        0        0  Not_testing
    4        0        0  Not_testing
    5        0        0  Not_testing
Selective self-test flags (0x0):
  After scanning selected spans, do NOT read-scan remainder of disk.
If Selective self-test is pending on power-up, resume after 0 minute delay.

SCT Status Version:                  3
SCT Version (vendor specific):       1 (0x0001)
Device State:                        Active (0)
Current Temperature:                    48 Celsius
Power Cycle Min/Max Temperature:      ?/48 Celsius
Lifetime    Min/Max Temperature:      ?/ ? Celsius
Under/Over Temperature Limit Count:   0/0

SCT Temperature History Version:     2
Temperature Sampling Period:         1 minute
Temperature Logging Interval:        1 minute
Min/Max recommended Temperature:     -127/127 Celsius
Min/Max Temperature Limit:           -127/127 Celsius
Temperature History Size (Index):    478 (86)

Index    Estimated Time   Temperature Celsius
  87    2024-01-18 05:41     ?  -
 ...    ..(392 skipped).    ..  -
   2    2024-01-18 12:14     ?  -
   3    2024-01-18 12:15    30  ***********
   4    2024-01-18 12:16     ?  -
   5    2024-01-18 12:17    34  ***************
   6    2024-01-18 12:18    32  *************
   7    2024-01-18 12:19    36  *****************
   8    2024-01-18 12:20     ?  -
   9    2024-01-18 12:21    32  *************
  10    2024-01-18 12:22    34  ***************
  11    2024-01-18 12:23    34  ***************
  12    2024-01-18 12:24    36  *****************
  13    2024-01-18 12:25    36  *****************
  14    2024-01-18 12:26    35  ****************
  15    2024-01-18 12:27    43  ************************
  16    2024-01-18 12:28    34  ***************
  17    2024-01-18 12:29    47  ****************************
  18    2024-01-18 12:30    47  ****************************
  19    2024-01-18 12:31    48  *****************************
  20    2024-01-18 12:32     ?  -
  21    2024-01-18 12:33    45  **************************
  22    2024-01-18 12:34    45  **************************
  23    2024-01-18 12:35    47  ****************************
  24    2024-01-18 12:36    47  ****************************
  25    2024-01-18 12:37    48  *****************************
 ...    ..( 29 skipped).    ..  *****************************
  55    2024-01-18 13:07    48  *****************************
  56    2024-01-18 13:08     ?  -
  57    2024-01-18 13:09    34  ***************
  58    2024-01-18 13:10    36  *****************
  59    2024-01-18 13:11    38  *******************
  60    2024-01-18 13:12    38  *******************
  61    2024-01-18 13:13    37  ******************
  62    2024-01-18 13:14    40  *********************
  63    2024-01-18 13:15    42  ***********************
  64    2024-01-18 13:16    42  ***********************
  65    2024-01-18 13:17    43  ************************
  66    2024-01-18 13:18    43  ************************
  67    2024-01-18 13:19    43  ************************
  68    2024-01-18 13:20    45  **************************
 ...    ..(  3 skipped).    ..  **************************
  72    2024-01-18 13:24    45  **************************
  73    2024-01-18 13:25    47  ****************************
  74    2024-01-18 13:26    47  ****************************
  75    2024-01-18 13:27    47  ****************************
  76    2024-01-18 13:28    46  ***************************
  77    2024-01-18 13:29    47  ****************************
  78    2024-01-18 13:30    47  ****************************
  79    2024-01-18 13:31    46  ***************************
  80    2024-01-18 13:32    48  *****************************
  81    2024-01-18 13:33    47  ****************************
  82    2024-01-18 13:34    47  ****************************
  83    2024-01-18 13:35    48  *****************************
 ...    ..(  2 skipped).    ..  *****************************
  86    2024-01-18 13:38    48  *****************************

SCT Error Recovery Control command not supported

Device Statistics (GP Log 0x04)
Page  Offset Size        Value Flags Description
0x01  =====  =               =  ===  == General Statistics (rev 1) ==
0x01  0x008  4               5  ---  Lifetime Power-On Resets
0x01  0x010  4               1  ---  Power-on Hours
0x01  0x018  6        48421050  ---  Logical Sectors Written
0x01  0x020  6           79698  ---  Number of Write Commands
0x01  0x028  6         4834327  ---  Logical Sectors Read
0x01  0x030  6           40148  ---  Number of Read Commands
0x01  0x038  6         1813900  ---  Date and Time TimeStamp
0x07  =====  =               =  ===  == Solid State Device Statistics (rev 1) ==
0x07  0x008  1               0  N--  Percentage Used Endurance Indicator
                                |||_ C monitored condition met
                                ||__ D supports DSN
                                |___ N normalized value

Pending Defects log (GP Log 0x0c) not supported

SATA Phy Event Counters (GP Log 0x11)
ID      Size     Value  Description
0x0001  2            0  Command failed due to ICRC error
0x0003  2            0  R_ERR response for device-to-host data FIS
0x0004  2            0  R_ERR response for host-to-device data FIS
0x0006  2            0  R_ERR response for device-to-host non-data FIS
0x0007  2            0  R_ERR response for host-to-device non-data FIS
0x0008  2            0  Device-to-host non-data FIS retries
0x0009  4            0  Transition from drive PhyRdy to drive PhyNRdy
0x000a  4            1  Device-to-host register FISes sent due to a COMRESET
0x000f  2            0  R_ERR response for host-to-device data FIS, CRC
0x0010  2            0  R_ERR response for host-to-device data FIS, non-CRC
0x0012  2            0  R_ERR response for host-to-device non-data FIS, CRC
0x0013  2            0  R_ERR response for host-to-device non-data FIS, non-CRC

