smartctl 7.5 2025-04-30 r5714 [x86_64-linux-4.18.0-553.137.1.el8_10.x86_64] (local build)
Copyright (C) 2002-25, Bruce Allen, Christian Franke, www.smartmontools.org

=== START OF INFORMATION SECTION ===
Device Model:     OOS12000G
Serial Number:    0000HKV0
LU WWN Device Id: 5 000c50 0b04b70f7
Firmware Version: OOS1
User Capacity:    12,000,138,625,024 bytes [12.0 TB]
Sector Sizes:     512 bytes logical, 4096 bytes physical
Rotation Rate:    7200 rpm
Form Factor:      3.5 inches
Device is:        Not in smartctl database 7.5/5706
ATA Version is:   ACS-3 T13/2161-D revision 5
SATA Version is:  SATA 3.1, 6.0 Gb/s (current: 6.0 Gb/s)
Local Time is:    Sun Jul 26 08:43:33 2026 CDT
SMART support is: Available - device has SMART capability.
SMART support is: Enabled
AAM feature is:   Unavailable
APM feature is:   Unavailable
Rd look-ahead is: Enabled
Write cache is:   Enabled
DSN feature is:   Unavailable
ATA Security is:  Disabled, NOT FROZEN [SEC1]

=== START OF READ SMART DATA SECTION ===
SMART overall-health self-assessment test result: PASSED

General SMART Values:
Offline data collection status:  (0x82)	Offline data collection activity
					was completed without error.
					Auto Offline Data Collection: Enabled.
Self-test execution status:      (   0)	The previous self-test routine completed
					without error or no self-test has ever 
					been run.
Total time to complete Offline 
data collection: 		(  567) seconds.
Offline data collection
capabilities: 			 (0x7b) SMART execute Offline immediate.
					Auto Offline data collection on/off support.
					Suspend Offline collection upon new
					command.
					Offline surface scan supported.
					Self-test supported.
					Conveyance Self-test supported.
					Selective Self-test supported.
SMART capabilities:            (0x0003)	Saves SMART data before entering
					power-saving mode.
					Supports SMART auto save timer.
Error logging capability:        (0x01)	Error logging supported.
					General Purpose Logging supported.
Short self-test routine 
recommended polling time: 	 (   1) minutes.
Extended self-test routine
recommended polling time: 	 (1104) minutes.
Conveyance self-test routine
recommended polling time: 	 (   2) minutes.
SCT capabilities: 	       (0x50bd)	SCT Status supported.
					SCT Error Recovery Control supported.
					SCT Feature Control supported.
					SCT Data Table supported.

SMART Attributes Data Structure revision number: 10
Vendor Specific SMART Attributes with Thresholds:
ID# ATTRIBUTE_NAME          FLAGS    VALUE WORST THRESH FAIL RAW_VALUE
  1 Raw_Read_Error_Rate     POSR--   080   066   044    -    110295810
  3 Spin_Up_Time            PO----   090   089   000    -    0
  4 Start_Stop_Count        -O--CK   100   100   020    -    11
  5 Reallocated_Sector_Ct   PO--CK   100   100   010    -    0
  7 Seek_Error_Rate         POSR--   071   060   045    -    13721209
  9 Power_On_Hours          -O--CK   100   100   000    -    73
 10 Spin_Retry_Count        PO--C-   100   100   097    -    0
 12 Power_Cycle_Count       -O--CK   100   100   020    -    10
187 Reported_Uncorrect      -O--CK   100   100   000    -    0
188 Command_Timeout         -O--CK   100   100   000    -    0
190 Airflow_Temperature_Cel -O---K   066   048   040    -    34 (Min/Max 23/34)
192 Power-Off_Retract_Count -O--CK   100   100   000    -    9
193 Load_Cycle_Count        -O--CK   100   100   000    -    18
194 Temperature_Celsius     -O---K   034   052   000    -    34 (0 18 0 0 0)
195 Hardware_ECC_Recovered  -O-RC-   009   009   000    -    110295810
197 Current_Pending_Sector  -O--C-   100   100   000    -    0
198 Offline_Uncorrectable   ----C-   100   100   000    -    0
199 UDMA_CRC_Error_Count    -OSRCK   200   200   000    -    0
200 Multi_Zone_Error_Rate   PO---K   100   100   001    -    0
240 Head_Flying_Hours       ------   100   253   000    -    50 (157 2 0)
241 Total_LBAs_Written      ------   100   253   000    -    23438758776
242 Total_LBAs_Read         ------   100   253   000    -    22697312727
                            ||||||_ K auto-keep
                            |||||__ C event count
                            ||||___ R error rate
                            |||____ S speed/performance
                            ||_____ O updated online
                            |______ P prefailure warning

General Purpose Log Directory Version 1
SMART           Log Directory Version 1 [multi-sector log support]
Address    Access  R/W   Size  Description
0x00       GPL,SL  R/O      1  Log Directory
0x01           SL  R/O      1  Summary SMART error log
0x02           SL  R/O      5  Comprehensive SMART error log
0x03       GPL     R/O      5  Ext. Comprehensive SMART error log
0x04       GPL     R/O    256  Device Statistics log
0x04       SL      R/O      8  Device Statistics log
0x06           SL  R/O      1  SMART self-test log
0x07       GPL     R/O      1  Extended self-test log
0x08       GPL     R/O      2  Power Conditions log
0x09           SL  R/W      1  Selective self-test log
0x0c       GPL     R/O   2048  Pending Defects log
0x10       GPL     R/O      1  NCQ Command Error log
0x11       GPL     R/O      1  SATA Phy Event Counters log
0x13       GPL     R/O      1  SATA NCQ Send and Receive log
0x15       GPL     R/W      1  Rebuild Assist log
0x21       GPL     R/O      1  Write stream error log
0x22       GPL     R/O      1  Read stream error log
0x24       GPL     R/O    768  Current Device Internal Status Data log
0x30       GPL,SL  R/O      9  IDENTIFY DEVICE data log
0x80-0x9f  GPL,SL  R/W     16  Host vendor specific log
0xa1       GPL,SL  VS      24  Device vendor specific log
0xa2       GPL     VS   16320  Device vendor specific log
0xa4       GPL,SL  VS     160  Device vendor specific log
0xa6       GPL     VS     192  Device vendor specific log
0xa8-0xa9  GPL,SL  VS     136  Device vendor specific log
0xab       GPL     VS       1  Device vendor specific log
0xad       GPL     VS      16  Device vendor specific log
0xbe-0xbf  GPL     VS   65535  Device vendor specific log
0xc1       GPL,SL  VS       8  Device vendor specific log
0xc3       GPL,SL  VS      32  Device vendor specific log
0xc9       GPL,SL  VS       8  Device vendor specific log
0xca       GPL,SL  VS      16  Device vendor specific log
0xd1       GPL     VS     336  Device vendor specific log
0xd2       GPL     VS   10000  Device vendor specific log
0xd4       GPL     VS    2048  Device vendor specific log
0xda       GPL,SL  VS       1  Device vendor specific log
0xe0       GPL,SL  R/W      1  SCT Command/Status
0xe1       GPL,SL  R/W      1  SCT Data Transfer

SMART Extended Comprehensive Error Log Version: 1 (5 sectors)
No Errors Logged

SMART Extended Self-test Log Version: 1 (1 sectors)
No self-tests have been logged.  [To run self-tests, use: smartctl -t]

SMART Selective self-test log data structure revision number 1
 SPAN  MIN_LBA  MAX_LBA  CURRENT_TEST_STATUS
    1        0        0  Not_testing
    2        0        0  Not_testing
    3        0        0  Not_testing
    4        0        0  Not_testing
    5        0        0  Not_testing
Selective self-test flags (0x0):
  After scanning selected spans, do NOT read-scan remainder of disk.
If Selective self-test is pending on power-up, resume after 0 minute delay.

SCT Status Version:                  3
SCT Version (vendor specific):       522 (0x020a)
Device State:                        Active (0)
Current Temperature:                    33 Celsius
Power Cycle Min/Max Temperature:     23/33 Celsius
Lifetime    Min/Max Temperature:     17/52 Celsius
Under/Over Temperature Limit Count:   0/0

SCT Temperature History Version:     2
Temperature Sampling Period:         3 minutes
Temperature Logging Interval:        59 minutes
Min/Max recommended Temperature:     10/40 Celsius
Min/Max Temperature Limit:            5/60 Celsius
Temperature History Size (Index):    128 (94)

Index    Estimated Time   Temperature Celsius
  95    2026-07-21 03:49     ?  -
 ...    ..( 31 skipped).    ..  -
 127    2026-07-22 11:17     ?  -
   0    2026-07-22 12:16    34  ***************
   1    2026-07-22 13:15     ?  -
   2    2026-07-22 14:14    34  ***************
   3    2026-07-22 15:13     ?  -
   4    2026-07-22 16:12    34  ***************
   5    2026-07-22 17:11     ?  -
   6    2026-07-22 18:10    34  ***************
   7    2026-07-22 19:09     ?  -
   8    2026-07-22 20:08    34  ***************
   9    2026-07-22 21:07     ?  -
  10    2026-07-22 22:06    34  ***************
  11    2026-07-22 23:05     ?  -
  12    2026-07-23 00:04    33  **************
  13    2026-07-23 01:03     ?  -
  14    2026-07-23 02:02    17  -
  15    2026-07-23 03:01     ?  -
  16    2026-07-23 04:00    17  -
  17    2026-07-23 04:59     ?  -
  18    2026-07-23 05:58    23  ****
  19    2026-07-23 06:57    47  ****************************
  20    2026-07-23 07:56    51  ********************************
  21    2026-07-23 08:55    52  *********************************
  22    2026-07-23 09:54    52  *********************************
  23    2026-07-23 10:53    50  *******************************
  24    2026-07-23 11:52    47  ****************************
  25    2026-07-23 12:51    46  ***************************
  26    2026-07-23 13:50    46  ***************************
  27    2026-07-23 14:49    45  **************************
 ...    ..(  3 skipped).    ..  **************************
  31    2026-07-23 18:45    45  **************************
  32    2026-07-23 19:44    44  *************************
 ...    ..(  3 skipped).    ..  *************************
  36    2026-07-23 23:40    44  *************************
  37    2026-07-24 00:39    45  **************************
  38    2026-07-24 01:38    48  *****************************
  39    2026-07-24 02:37    49  ******************************
  40    2026-07-24 03:36    50  *******************************
  41    2026-07-24 04:35    50  *******************************
  42    2026-07-24 05:34    51  ********************************
  43    2026-07-24 06:33    50  *******************************
  44    2026-07-24 07:32    49  ******************************
  45    2026-07-24 08:31    47  ****************************
  46    2026-07-24 09:30    48  *****************************
  47    2026-07-24 10:29    47  ****************************
  48    2026-07-24 11:28    47  ****************************
  49    2026-07-24 12:27    46  ***************************
  50    2026-07-24 13:26    46  ***************************
  51    2026-07-24 14:25    46  ***************************
  52    2026-07-24 15:24    39  ********************
  53    2026-07-24 16:23    34  ***************
  54    2026-07-24 17:22    33  **************
 ...    ..(  6 skipped).    ..  **************
  61    2026-07-25 00:15    33  **************
  62    2026-07-25 01:14    34  ***************
  63    2026-07-25 02:13     ?  -
  64    2026-07-25 03:12    35  ****************
  65    2026-07-25 04:11    48  *****************************
  66    2026-07-25 05:10    51  ********************************
  67    2026-07-25 06:09    52  *********************************
  68    2026-07-25 07:08    46  ***************************
  69    2026-07-25 08:07    47  ****************************
  70    2026-07-25 09:06    49  ******************************
 ...    ..(  2 skipped).    ..  ******************************
  73    2026-07-25 12:03    49  ******************************
  74    2026-07-25 13:02    50  *******************************
 ...    ..(  2 skipped).    ..  *******************************
  77    2026-07-25 15:59    50  *******************************
  78    2026-07-25 16:58    49  ******************************
 ...    ..(  2 skipped).    ..  ******************************
  81    2026-07-25 19:55    49  ******************************
  82    2026-07-25 20:54    50  *******************************
  83    2026-07-25 21:53    47  ****************************
  84    2026-07-25 22:52    37  ******************
  85    2026-07-25 23:51    35  ****************
  86    2026-07-26 00:50    34  ***************
  87    2026-07-26 01:49    34  ***************
  88    2026-07-26 02:48    34  ***************
  89    2026-07-26 03:47    35  ****************
 ...    ..(  2 skipped).    ..  ****************
  92    2026-07-26 06:44    35  ****************
  93    2026-07-26 07:43     ?  -
  94    2026-07-26 08:42    23  ****

SCT Error Recovery Control:
           Read:    100 (10.0 seconds)
          Write:    100 (10.0 seconds)

Device Statistics (GP Log 0x04)
Page  Offset Size        Value Flags Description
0x01  =====  =               =  ===  == General Statistics (rev 1) ==
0x01  0x008  4              10  ---  Lifetime Power-On Resets
0x01  0x010  4              73  ---  Power-on Hours
0x01  0x018  6     23437864962  ---  Logical Sectors Written
0x01  0x020  6        11447559  ---  Number of Write Commands
0x01  0x028  6     22682890118  ---  Logical Sectors Read
0x01  0x030  6        88609803  ---  Number of Read Commands
0x01  0x038  6               -  ---  Date and Time TimeStamp
0x03  =====  =               =  ===  == Rotating Media Statistics (rev 1) ==
0x03  0x008  4      4113468628  N--  Spindle Motor Power-on Hours
0x03  0x010  4      4113468607  N--  Head Flying Hours
0x03  0x018  4              18  ---  Head Load Events
0x03  0x020  4               0  ---  Number of Reallocated Logical Sectors
0x03  0x028  4               0  ---  Read Recovery Attempts
0x03  0x030  4               0  ---  Number of Mechanical Start Failures
0x03  0x038  4               0  ---  Number of Realloc. Candidate Logical Sectors
0x03  0x040  4               9  ---  Number of High Priority Unload Events
0x04  =====  =               =  ===  == General Errors Statistics (rev 1) ==
0x04  0x008  4               0  ---  Number of Reported Uncorrectable Errors
0x04  0x010  4               0  ---  Resets Between Cmd Acceptance and Completion
0x05  =====  =               =  ===  == Temperature Statistics (rev 1) ==
0x05  0x008  1              33  ---  Current Temperature
0x05  0x010  1              44  ---  Average Short Term Temperature
0x05  0x018  1               -  ---  Average Long Term Temperature
0x05  0x020  1              52  ---  Highest Temperature
0x05  0x028  1               0  ---  Lowest Temperature
0x05  0x030  1              47  ---  Highest Average Short Term Temperature
0x05  0x038  1              42  ---  Lowest Average Short Term Temperature
0x05  0x040  1               -  ---  Highest Average Long Term Temperature
0x05  0x048  1               -  ---  Lowest Average Long Term Temperature
0x05  0x050  4               0  ---  Time in Over-Temperature
0x05  0x058  1              60  ---  Specified Maximum Operating Temperature
0x05  0x060  4              30  ---  Time in Under-Temperature
0x05  0x068  1               5  ---  Specified Minimum Operating Temperature
0x06  =====  =               =  ===  == Transport Statistics (rev 1) ==
0x06  0x008  4               0  ---  Number of Hardware Resets
0x06  0x010  4               1  ---  Number of ASR Events
0x06  0x018  4               0  ---  Number of Interface CRC Errors
0xff  =====  =               =  ===  == Vendor Specific Statistics (rev 1) ==
0xff  0x008  7               0  ---  Vendor Specific
0xff  0x018  7               0  ---  Vendor Specific
                                |||_ C monitored condition met
                                ||__ D supports DSN
                                |___ N normalized value

Pending Defects log (GP Log 0x0c)
No Defects Logged

SATA Phy Event Counters (GP Log 0x11)
ID      Size     Value  Description
0x000a  2            1  Device-to-host register FISes sent due to a COMRESET
0x0001  2            0  Command failed due to ICRC error
0x0003  2            0  R_ERR response for device-to-host data FIS
0x0004  2            0  R_ERR response for host-to-device data FIS
0x0006  2            0  R_ERR response for device-to-host non-data FIS
0x0007  2            0  R_ERR response for host-to-device non-data FIS

Seagate Field Access Reliability Metrics log (FARM) (GP Log 0xa6)
	FARM Log Page 0: Log Header
		FARM Log Version: 2.8
		Pages Supported: 6
		Log Size: 98304
		Page Size: 16384
		Heads Supported: 24
		Number of Copies: 0
		Reason for Frame Capture: 0
	FARM Log Page 1: Drive Information
		Serial Number: 0000HKV0
		World Wide Name: 0x5000c500b04b70f7
		Device Interface: SATA
		Device Capacity in Sectors: 23437770752
		Physical Sector Size: 4096
		Logical Sector Size: 512
		Device Buffer Size: 268435456
		Number of Heads: 16
		Device Form Factor: 3.5 inches
		Rotation Rate: 7200 rpm
		Firmware Rev: OOS1    
		ATA Security State (ID Word 128): 0x01621
		ATA Features Supported (ID Word 78): 0x0168cc
		ATA Features Enabled (ID Word 79): 0x0000000000000040
		Power on Hours: 73
		Spindle Power on Hours: 515214576852
		Head Flight Hours: 515214576831
		Head Load Events: 18
		Power Cycle Count: 11
		Hardware Reset Count: 0
		Spin-up Time: 13 ms
		Time to ready of the last power cycle: 0 ms
		Time drive is held in staggered spin: 0 ms
		Model Number: 
		Drive Recording Type: UNKNOWN
		Max Number of Available Sectors for Reassignment: 0
		Assembly Date (YYWW): 
		Depopulation Head Mask: 0
	FARM Log Page 2: Workload Statistics
		Total Number of Read Commands: 88664472
		Total Number of Write Commands: 11448529
		Total Number of Random Read Commands: 6735
		Total Number of Random Write Commands: 829107
		Total Number Of Other Commands: 90
		Logical Sectors Written: 23438758776
		Logical Sectors Read: 22697312727
		Number of dither events during current power cycle: 0
		Number of times dither was held off during random workloads: 0
		Number of times dither was held off during sequential workloads: 0
		Number of Read commands from 0-3.125% of LBA space for last 3 SMART Summary Frames: 0
		Number of Read commands from 3.125-25% of LBA space for last 3 SMART Summary Frames: 0
		Number of Read commands from 25-75% of LBA space for last 3 SMART Summary Frames: 0
		Number of Read commands from 75-100% of LBA space for last 3 SMART Summary Frames: 0
		Number of Write commands from 0-3.125% of LBA space for last 3 SMART Summary Frames: 0
		Number of Write commands from 3.125-25% of LBA space for last 3 SMART Summary Frames: 0
		Number of Write commands from 25-75% of LBA space for last 3 SMART Summary Frames: 0
		Number of Write commands from 75-100% of LBA space for last 3 SMART Summary Frames: 0
	FARM Log Page 3: Error Statistics
		Unrecoverable Read Errors: 0
		Unrecoverable Write Errors: 0
		Number of Reallocated Sectors: 0
		Number of Read Recovery Attempts: 0
		Number of Mechanical Start Failures: 0
		Number of Reallocated Candidate Sectors: 0
		Number of ASR Events: 1
		Number of Interface CRC Errors: 0
		Spin Retry Count: 0
		Spin Retry Count Normalized: 100
		Spin Retry Count Worst: 100
		Number of IOEDC Errors (Raw): 0
		CTO Count Total: 0
		CTO Count Over 5s: 0
		CTO Count Over 7.5s: 0
		Total Flash LED (Assert) Events: 0
		Index of the last Flash LED: 0
		Flash LED Event 0:
			Event Information: 0x0000000000000000
			Timestamp of Event 0 (hours): 0
			Power Cycle Event 0: 0
		Flash LED Event 1:
			Event Information: 0x0000000000000000
			Timestamp of Event 1 (hours): 0
			Power Cycle Event 1: 0
		Flash LED Event 2:
			Event Information: 0x0000000000000000
			Timestamp of Event 2 (hours): 0
			Power Cycle Event 2: 0
		Flash LED Event 3:
			Event Information: 0x0000000000000000
			Timestamp of Event 3 (hours): 0
			Power Cycle Event 3: 0
		Flash LED Event 4:
			Event Information: 0x0000000000000000
			Timestamp of Event 4 (hours): 0
			Power Cycle Event 4: 0
		Flash LED Event 5:
			Event Information: 0x0000000000000000
			Timestamp of Event 5 (hours): 0
			Power Cycle Event 5: 0
		Flash LED Event 6:
			Event Information: 0x0000000000000000
			Timestamp of Event 6 (hours): 0
			Power Cycle Event 6: 0
		Flash LED Event 7:
			Event Information: 0x0000000000000000
			Timestamp of Event 7 (hours): 0
			Power Cycle Event 7: 0
		Uncorrectable errors: 0
		Cumulative Lifetime Unrecoverable Read errors due to ERC: 0
		Cum Lifetime Unrecoverable by head 0:
			Cumulative Lifetime Unrecoverable Read Repeating: 0
			Cumulative Lifetime Unrecoverable Read Unique: 0
		Cum Lifetime Unrecoverable by head 1:
			Cumulative Lifetime Unrecoverable Read Repeating: 0
			Cumulative Lifetime Unrecoverable Read Unique: 0
		Cum Lifetime Unrecoverable by head 2:
			Cumulative Lifetime Unrecoverable Read Repeating: 0
			Cumulative Lifetime Unrecoverable Read Unique: 0
		Cum Lifetime Unrecoverable by head 3:
			Cumulative Lifetime Unrecoverable Read Repeating: 0
			Cumulative Lifetime Unrecoverable Read Unique: 0
		Cum Lifetime Unrecoverable by head 4:
			Cumulative Lifetime Unrecoverable Read Repeating: 0
			Cumulative Lifetime Unrecoverable Read Unique: 0
		Cum Lifetime Unrecoverable by head 5:
			Cumulative Lifetime Unrecoverable Read Repeating: 0
			Cumulative Lifetime Unrecoverable Read Unique: 0
		Cum Lifetime Unrecoverable by head 6:
			Cumulative Lifetime Unrecoverable Read Repeating: 0
			Cumulative Lifetime Unrecoverable Read Unique: 0
		Cum Lifetime Unrecoverable by head 7:
			Cumulative Lifetime Unrecoverable Read Repeating: 0
			Cumulative Lifetime Unrecoverable Read Unique: 0
		Cum Lifetime Unrecoverable by head 8:
			Cumulative Lifetime Unrecoverable Read Repeating: 0
			Cumulative Lifetime Unrecoverable Read Unique: 0
		Cum Lifetime Unrecoverable by head 9:
			Cumulative Lifetime Unrecoverable Read Repeating: 0
			Cumulative Lifetime Unrecoverable Read Unique: 0
		Cum Lifetime Unrecoverable by head 10:
			Cumulative Lifetime Unrecoverable Read Repeating: 0
			Cumulative Lifetime Unrecoverable Read Unique: 0
		Cum Lifetime Unrecoverable by head 11:
			Cumulative Lifetime Unrecoverable Read Repeating: 0
			Cumulative Lifetime Unrecoverable Read Unique: 0
		Cum Lifetime Unrecoverable by head 12:
			Cumulative Lifetime Unrecoverable Read Repeating: 0
			Cumulative Lifetime Unrecoverable Read Unique: 0
		Cum Lifetime Unrecoverable by head 13:
			Cumulative Lifetime Unrecoverable Read Repeating: 0
			Cumulative Lifetime Unrecoverable Read Unique: 0
		Cum Lifetime Unrecoverable by head 14:
			Cumulative Lifetime Unrecoverable Read Repeating: 0
			Cumulative Lifetime Unrecoverable Read Unique: 0
		Cum Lifetime Unrecoverable by head 15:
			Cumulative Lifetime Unrecoverable Read Repeating: 0
			Cumulative Lifetime Unrecoverable Read Unique: 0
	FARM Log Page 4: Environment Statistics
		Current Temperature (Celsius): 33
		Highest Temperature: 52
		Lowest Temperature: 0
		Average Short Term Temperature: 44
		Average Long Term Temperature: 0
		Highest Average Short Term Temperature: 47
		Lowest Average Short Term Temperature: 42
		Highest Average Long Term Temperature: 0
		Lowest Average Long Term Temperature: 0
		Time In Over Temperature (minutes): 0
		Time In Under Temperature (minutes): 30
		Specified Max Operating Temperature: 60
		Specified Min Operating Temperature: 5
		Current Relative Humidity: 87
		Current Motor Power: 2364
		Current 12 volts: 0.000
		Minimum 12 volts: 0.000
		Maximum 12 volts: 0.000
		Current 5 volts: 0.000
		Minimum 5 volts: 0.000
		Maximum 5 volts: 0.000
		12V Power Average: 0.000
		12V Power Minimum: 0.000
		12V Power Maximum: 0.000
		5V Power Average: 0.000
		5V Power Minimum: 0.000
		5V Power Maximum: 0.000
	FARM Log Page 5: Reliability Statistics
		Error Rate (SMART Attribute 1 Raw): 0x000000000692fb02
		Error Rate (SMART Attribute 1 Normalized): 80
		Error Rate (SMART Attribute 1 Worst): 66
		Seek Error Rate (SMART Attr 7 Raw): 0x0000000000d15eab
		Seek Error Rate (SMART Attr 7 Normalized): 71
		Seek Error Rate (SMART Attr 7 Worst): 60
		High Priority Unload Events: 9
		Helium Pressure Threshold Tripped: 0
		LBAs Corrected By Parity Sector: 0
		DVGA Skip Write Detect by Head 0: 0
		DVGA Skip Write Detect by Head 1: 0
		DVGA Skip Write Detect by Head 2: 0
		DVGA Skip Write Detect by Head 3: 0
		DVGA Skip Write Detect by Head 4: 0
		DVGA Skip Write Detect by Head 5: 0
		DVGA Skip Write Detect by Head 6: 0
		DVGA Skip Write Detect by Head 7: 0
		DVGA Skip Write Detect by Head 8: 0
		DVGA Skip Write Detect by Head 9: 0
		DVGA Skip Write Detect by Head 10: 0
		DVGA Skip Write Detect by Head 11: 0
		DVGA Skip Write Detect by Head 12: 0
		DVGA Skip Write Detect by Head 13: 0
		DVGA Skip Write Detect by Head 14: 0
		DVGA Skip Write Detect by Head 15: 0
		RVGA Skip Write Detect by Head 0: 0
		RVGA Skip Write Detect by Head 1: 0
		RVGA Skip Write Detect by Head 2: 0
		RVGA Skip Write Detect by Head 3: 0
		RVGA Skip Write Detect by Head 4: 0
		RVGA Skip Write Detect by Head 5: 0
		RVGA Skip Write Detect by Head 6: 0
		RVGA Skip Write Detect by Head 7: 0
		RVGA Skip Write Detect by Head 8: 0
		RVGA Skip Write Detect by Head 9: 0
		RVGA Skip Write Detect by Head 10: 0
		RVGA Skip Write Detect by Head 11: 0
		RVGA Skip Write Detect by Head 12: 0
		RVGA Skip Write Detect by Head 13: 0
		RVGA Skip Write Detect by Head 14: 0
		RVGA Skip Write Detect by Head 15: 0
		FVGA Skip Write Detect by Head 0: 0
		FVGA Skip Write Detect by Head 1: 0
		FVGA Skip Write Detect by Head 2: 0
		FVGA Skip Write Detect by Head 3: 0
		FVGA Skip Write Detect by Head 4: 0
		FVGA Skip Write Detect by Head 5: 0
		FVGA Skip Write Detect by Head 6: 0
		FVGA Skip Write Detect by Head 7: 0
		FVGA Skip Write Detect by Head 8: 0
		FVGA Skip Write Detect by Head 9: 0
		FVGA Skip Write Detect by Head 10: 0
		FVGA Skip Write Detect by Head 11: 0
		FVGA Skip Write Detect by Head 12: 0
		FVGA Skip Write Detect by Head 13: 0
		FVGA Skip Write Detect by Head 14: 0
		FVGA Skip Write Detect by Head 15: 0
		Skip Write Detect Threshold Exceeded by Head 0: 0
		Skip Write Detect Threshold Exceeded by Head 1: 0
		Skip Write Detect Threshold Exceeded by Head 2: 0
		Skip Write Detect Threshold Exceeded by Head 3: 0
		Skip Write Detect Threshold Exceeded by Head 4: 0
		Skip Write Detect Threshold Exceeded by Head 5: 0
		Skip Write Detect Threshold Exceeded by Head 6: 0
		Skip Write Detect Threshold Exceeded by Head 7: 0
		Skip Write Detect Threshold Exceeded by Head 8: 0
		Skip Write Detect Threshold Exceeded by Head 9: 0
		Skip Write Detect Threshold Exceeded by Head 10: 0
		Skip Write Detect Threshold Exceeded by Head 11: 0
		Skip Write Detect Threshold Exceeded by Head 12: 0
		Skip Write Detect Threshold Exceeded by Head 13: 0
		Skip Write Detect Threshold Exceeded by Head 14: 0
		Skip Write Detect Threshold Exceeded by Head 15: 0
		Write Power On (sec) by Head 0: 3663649857809
		Write Power On (sec) by Head 1: 3508235934010
		Write Power On (sec) by Head 2: 3654979275499
		Write Power On (sec) by Head 3: 3381254005511
		Write Power On (sec) by Head 4: 3721842927178
		Write Power On (sec) by Head 5: 3508174783163
		Write Power On (sec) by Head 6: 3627173477704
		Write Power On (sec) by Head 7: 3353859767351
		Write Power On (sec) by Head 8: 3422852906889
		Write Power On (sec) by Head 9: 3476600131558
		Write Power On (sec) by Head 10: 3380233536605
		Write Power On (sec) by Head 11: 3481859052107
		Write Power On (sec) by Head 12: 3309744789193
		Write Power On (sec) by Head 13: 3591815709340
		Write Power On (sec) by Head 14: 3345956327662
		Write Power On (sec) by Head 15: 3704624805803
		MR Head Resistance from Head 0: 0
		MR Head Resistance from Head 1: 0
		MR Head Resistance from Head 2: 0
		MR Head Resistance from Head 3: 0
		MR Head Resistance from Head 4: 0
		MR Head Resistance from Head 5: 0
		MR Head Resistance from Head 6: 0
		MR Head Resistance from Head 7: 0
		MR Head Resistance from Head 8: 0
		MR Head Resistance from Head 9: 0
		MR Head Resistance from Head 10: 0
		MR Head Resistance from Head 11: 0
		MR Head Resistance from Head 12: 0
		MR Head Resistance from Head 13: 0
		MR Head Resistance from Head 14: 0
		MR Head Resistance from Head 15: 0
		Second MR Head Resistance by Head 0: 0
		Second MR Head Resistance by Head 1: 0
		Second MR Head Resistance by Head 2: 0
		Second MR Head Resistance by Head 3: 0
		Second MR Head Resistance by Head 4: 0
		Second MR Head Resistance by Head 5: 0
		Second MR Head Resistance by Head 6: 0
		Second MR Head Resistance by Head 7: 0
		Second MR Head Resistance by Head 8: 0
		Second MR Head Resistance by Head 9: 0
		Second MR Head Resistance by Head 10: 0
		Second MR Head Resistance by Head 11: 0
		Second MR Head Resistance by Head 12: 0
		Second MR Head Resistance by Head 13: 0
		Second MR Head Resistance by Head 14: 0
		Second MR Head Resistance by Head 15: 0
		Number of Reallocated Sectors by Head 0: 0
		Number of Reallocated Sectors by Head 1: 0
		Number of Reallocated Sectors by Head 2: 0
		Number of Reallocated Sectors by Head 3: 0
		Number of Reallocated Sectors by Head 4: 0
		Number of Reallocated Sectors by Head 5: 0
		Number of Reallocated Sectors by Head 6: 0
		Number of Reallocated Sectors by Head 7: 0
		Number of Reallocated Sectors by Head 8: 0
		Number of Reallocated Sectors by Head 9: 0
		Number of Reallocated Sectors by Head 10: 0
		Number of Reallocated Sectors by Head 11: 0
		Number of Reallocated Sectors by Head 12: 0
		Number of Reallocated Sectors by Head 13: 0
		Number of Reallocated Sectors by Head 14: 0
		Number of Reallocated Sectors by Head 15: 0
		Number of Reallocation Candidate Sectors by Head 0: 0
		Number of Reallocation Candidate Sectors by Head 1: 0
		Number of Reallocation Candidate Sectors by Head 2: 0
		Number of Reallocation Candidate Sectors by Head 3: 0
		Number of Reallocation Candidate Sectors by Head 4: 0
		Number of Reallocation Candidate Sectors by Head 5: 0
		Number of Reallocation Candidate Sectors by Head 6: 0
		Number of Reallocation Candidate Sectors by Head 7: 0
		Number of Reallocation Candidate Sectors by Head 8: 0
		Number of Reallocation Candidate Sectors by Head 9: 0
		Number of Reallocation Candidate Sectors by Head 10: 0
		Number of Reallocation Candidate Sectors by Head 11: 0
		Number of Reallocation Candidate Sectors by Head 12: 0
		Number of Reallocation Candidate Sectors by Head 13: 0
		Number of Reallocation Candidate Sectors by Head 14: 0
		Number of Reallocation Candidate Sectors by Head 15: 0

