smartctl 6.4 2014-10-07 r4002 [x86_64-linux-4.9.0-0.bpo.1-amd64] (local build)
Copyright (C) 2002-14, Bruce Allen, Christian Franke, www.smartmontools.org

=== START OF INFORMATION SECTION ===
Device Model:     Crucial_CT275MX300SSD4
Serial Number:    164714C198E7
LU WWN Device Id: 5 00a075 114c198e7
Firmware Version: M0CR040
User Capacity:    275 064 201 216 bytes [275 GB]
Sector Size:      512 bytes logical/physical
Rotation Rate:    Solid State Device
Form Factor:      < 1.8 inches
Device is:        Not in smartctl database [for details use: -P showall]
ATA Version is:   ACS-3 T13/2161-D revision 5
SATA Version is:  SATA 3.2, 6.0 Gb/s (current: 6.0 Gb/s)
Local Time is:    Fri Feb 10 22:59:37 2017 MSK
SMART support is: Available - device has SMART capability.
SMART support is: Enabled
AAM feature is:   Unavailable
APM level is:     128 (minimum power consumption without standby)
Rd look-ahead is: Enabled
Write cache is:   Enabled
ATA Security is:  Disabled, frozen [SEC2]
Wt Cache Reorder: Enabled

=== START OF READ SMART DATA SECTION ===
SMART overall-health self-assessment test result: PASSED

General SMART Values:
Offline data collection status:  (0x00)	Offline data collection activity
					was never started.
					Auto Offline Data Collection: Disabled.
Self-test execution status:      (   0)	The previous self-test routine completed
					without error or no self-test has ever 
					been run.
Total time to complete Offline 
data collection: 		(  728) seconds.
Offline data collection
capabilities: 			 (0x7b) SMART execute Offline immediate.
					Auto Offline data collection on/off support.
					Suspend Offline collection upon new
					command.
					Offline surface scan supported.
					Self-test supported.
					Conveyance Self-test supported.
					Selective Self-test supported.
SMART capabilities:            (0x0003)	Saves SMART data before entering
					power-saving mode.
					Supports SMART auto save timer.
Error logging capability:        (0x01)	Error logging supported.
					General Purpose Logging supported.
Short self-test routine 
recommended polling time: 	 (   2) minutes.
Extended self-test routine
recommended polling time: 	 (   5) minutes.
Conveyance self-test routine
recommended polling time: 	 (   3) minutes.
SCT capabilities: 	       (0x0035)	SCT Status supported.
					SCT Feature Control supported.
					SCT Data Table supported.

SMART Attributes Data Structure revision number: 16
Vendor Specific SMART Attributes with Thresholds:
ID# ATTRIBUTE_NAME          FLAGS    VALUE WORST THRESH FAIL RAW_VALUE
  1 Raw_Read_Error_Rate     POSR-K   100   100   000    -    0
  5 Reallocated_Sector_Ct   -O--CK   100   100   010    -    0
  9 Power_On_Hours          -O--CK   100   100   000    -    20
 12 Power_Cycle_Count       -O--CK   100   100   000    -    8
171 Unknown_Attribute       -O--CK   100   100   000    -    0
172 Unknown_Attribute       -O--CK   100   100   000    -    0
173 Unknown_Attribute       -O--CK   100   100   000    -    1
174 Unknown_Attribute       -O--CK   100   100   000    -    3
183 Runtime_Bad_Block       -O--CK   100   100   000    -    0
184 End-to-End_Error        -O--CK   100   100   000    -    0
187 Reported_Uncorrect      -O--CK   100   100   000    -    0
194 Temperature_Celsius     -O---K   063   043   000    -    37 (Min/Max 18/57)
196 Reallocated_Event_Count -O--CK   100   100   000    -    0
197 Current_Pending_Sector  -O--CK   100   100   000    -    0
198 Offline_Uncorrectable   ----CK   100   100   000    -    0
199 UDMA_CRC_Error_Count    -O--CK   100   100   000    -    0
202 Unknown_SSD_Attribute   ----CK   100   100   001    -    0
206 Unknown_SSD_Attribute   -OSR--   100   100   000    -    0
246 Unknown_Attribute       -O--CK   100   100   000    -    147713596
247 Unknown_Attribute       -O--CK   100   100   000    -    4616076
248 Unknown_Attribute       -O--CK   100   100   000    -    364901
180 Unused_Rsvd_Blk_Cnt_Tot PO--CK   000   000   000    -    1256
210 Unknown_Attribute       -O--CK   100   100   000    -    0
                            ||||||_ K auto-keep
                            |||||__ C event count
                            ||||___ R error rate
                            |||____ S speed/performance
                            ||_____ O updated online
                            |______ P prefailure warning

General Purpose Log Directory Version 1
SMART           Log Directory Version 1 [multi-sector log support]
Address    Access  R/W   Size  Description
0x00       GPL,SL  R/O      1  Log Directory
0x01           SL  R/O      1  Summary SMART error log
0x02           SL  R/O     51  Comprehensive SMART error log
0x03       GPL     R/O  16383  Ext. Comprehensive SMART error log
0x04       GPL,SL  R/O      8  Device Statistics log
0x06           SL  R/O      1  SMART self-test log
0x07       GPL     R/O      1  Extended self-test log
0x09           SL  R/W      1  Selective self-test log
0x10       GPL     R/O      1  SATA NCQ Queued Error log
0x11       GPL     R/O      1  SATA Phy Event Counters log
0x13       GPL     R/O      1  SATA NCQ Send and Receive log
0x24       GPL     R/O   8000  Current Device Internal Status Data log
0x25       GPL     R/O   8000  Saved Device Internal Status Data log
0x30       GPL,SL  R/O      9  IDENTIFY DEVICE data log
0x80-0x9f  GPL,SL  R/W     16  Host vendor specific log
0xa0       GPL     VS   35328  Device vendor specific log
0xa1       GPL,SL  VS       3  Device vendor specific log
0xa2       GPL,SL  VS       1  Device vendor specific log
0xa3       GPL     VS   13824  Device vendor specific log
0xa4       GPL     VS     354  Device vendor specific log
0xa4       SL      VS      98  Device vendor specific log
0xa5       GPL     VS    8000  Device vendor specific log
0xa5       SL      VS      64  Device vendor specific log
0xa6       GPL     VS    8000  Device vendor specific log
0xa6       SL      VS      64  Device vendor specific log
0xa7-0xdf  GPL,SL  VS       1  Device vendor specific log
0xe0       GPL,SL  R/W      1  SCT Command/Status
0xe1       GPL,SL  R/W      1  SCT Data Transfer

SMART Extended Comprehensive Error Log size 16383 not supported

SMART Error Log Version: 1
No Errors Logged

SMART Extended Self-test Log Version: 1 (1 sectors)
No self-tests have been logged.  [To run self-tests, use: smartctl -t]

SMART Selective self-test log data structure revision number 1
 SPAN  MIN_LBA  MAX_LBA  CURRENT_TEST_STATUS
    1        0        0  Not_testing
    2        0        0  Not_testing
    3        0        0  Not_testing
    4        0        0  Not_testing
    5        0        0  Not_testing
Selective self-test flags (0x0):
  After scanning selected spans, do NOT read-scan remainder of disk.
If Selective self-test is pending on power-up, resume after 0 minute delay.

SCT Status Version:                  3
SCT Version (vendor specific):       1 (0x0001)
SCT Support Level:                   0
Device State:                        Active (0)
Current Temperature:                    37 Celsius
Power Cycle Min/Max Temperature:     23/38 Celsius
Lifetime    Min/Max Temperature:     18/57 Celsius
Under/Over Temperature Limit Count:   0/0

SCT Temperature History Version:     2
Temperature Sampling Period:         1 minute
Temperature Logging Interval:        1 minute
Min/Max recommended Temperature:      0/70 Celsius
Min/Max Temperature Limit:           -5/75 Celsius
Temperature History Size (Index):    478 (288)

Index    Estimated Time   Temperature Celsius
 289    2017-02-10 15:02    39  ********************
 ...    ..( 20 skipped).    ..  ********************
 310    2017-02-10 15:23    39  ********************
 311    2017-02-10 15:24    43  ************************
 312    2017-02-10 15:25    41  **********************
 313    2017-02-10 15:26    40  *********************
 314    2017-02-10 15:27    40  *********************
 315    2017-02-10 15:28    40  *********************
 316    2017-02-10 15:29    43  ************************
 317    2017-02-10 15:30    43  ************************
 318    2017-02-10 15:31    41  **********************
 ...    ..(  2 skipped).    ..  **********************
 321    2017-02-10 15:34    41  **********************
 322    2017-02-10 15:35    40  *********************
 ...    ..(  2 skipped).    ..  *********************
 325    2017-02-10 15:38    40  *********************
 326    2017-02-10 15:39    41  **********************
 327    2017-02-10 15:40    40  *********************
 ...    ..(  3 skipped).    ..  *********************
 331    2017-02-10 15:44    40  *********************
 332    2017-02-10 15:45    42  ***********************
 333    2017-02-10 15:46    42  ***********************
 334    2017-02-10 15:47    41  **********************
 335    2017-02-10 15:48    41  **********************
 336    2017-02-10 15:49    40  *********************
 337    2017-02-10 15:50    41  **********************
 338    2017-02-10 15:51    41  **********************
 339    2017-02-10 15:52    41  **********************
 340    2017-02-10 15:53    40  *********************
 341    2017-02-10 15:54    41  **********************
 342    2017-02-10 15:55    43  ************************
 343    2017-02-10 15:56    43  ************************
 344    2017-02-10 15:57    42  ***********************
 345    2017-02-10 15:58    45  **************************
 346    2017-02-10 15:59    42  ***********************
 347    2017-02-10 16:00    43  ************************
 348    2017-02-10 16:01    43  ************************
 349    2017-02-10 16:02    43  ************************
 350    2017-02-10 16:03    46  ***************************
 351    2017-02-10 16:04    43  ************************
 352    2017-02-10 16:05    42  ***********************
 353    2017-02-10 16:06    42  ***********************
 354    2017-02-10 16:07    42  ***********************
 355    2017-02-10 16:08    41  **********************
 356    2017-02-10 16:09    41  **********************
 357    2017-02-10 16:10    41  **********************
 358    2017-02-10 16:11    43  ************************
 359    2017-02-10 16:12    43  ************************
 360    2017-02-10 16:13    42  ***********************
 361    2017-02-10 16:14    41  **********************
 362    2017-02-10 16:15    44  *************************
 363    2017-02-10 16:16    44  *************************
 364    2017-02-10 16:17    43  ************************
 365    2017-02-10 16:18    42  ***********************
 ...    ..( 21 skipped).    ..  ***********************
 387    2017-02-10 16:40    42  ***********************
 388    2017-02-10 16:41    44  *************************
 ...    ..(  7 skipped).    ..  *************************
 396    2017-02-10 16:49    44  *************************
 397    2017-02-10 16:50    43  ************************
 ...    ..(  8 skipped).    ..  ************************
 406    2017-02-10 16:59    43  ************************
 407    2017-02-10 17:00    42  ***********************
 ...    ..(  6 skipped).    ..  ***********************
 414    2017-02-10 17:07    42  ***********************
 415    2017-02-10 17:08     ?  -
 416    2017-02-10 17:09     ?  -
 417    2017-02-10 17:10    42  ***********************
 ...    ..(  3 skipped).    ..  ***********************
 421    2017-02-10 17:14    42  ***********************
 422    2017-02-10 17:15    41  **********************
 ...    ..( 13 skipped).    ..  **********************
 436    2017-02-10 17:29    41  **********************
 437    2017-02-10 17:30     ?  -
 438    2017-02-10 17:31    25  ******
 439    2017-02-10 17:32    28  *********
 440    2017-02-10 17:33    30  ***********
 441    2017-02-10 17:34    32  *************
 442    2017-02-10 17:35    31  ************
 443    2017-02-10 17:36    32  *************
 444    2017-02-10 17:37    32  *************
 445    2017-02-10 17:38    32  *************
 446    2017-02-10 17:39    34  ***************
 447    2017-02-10 17:40    33  **************
 448    2017-02-10 17:41    33  **************
 449    2017-02-10 17:42    34  ***************
 ...    ..(  3 skipped).    ..  ***************
 453    2017-02-10 17:46    34  ***************
 454    2017-02-10 17:47    35  ****************
 455    2017-02-10 17:48    35  ****************
 456    2017-02-10 17:49    36  *****************
 457    2017-02-10 17:50    38  *******************
 458    2017-02-10 17:51    37  ******************
 ...    ..(  2 skipped).    ..  ******************
 461    2017-02-10 17:54    37  ******************
 462    2017-02-10 17:55    38  *******************
 463    2017-02-10 17:56    38  *******************
 464    2017-02-10 17:57    38  *******************
 465    2017-02-10 17:58    39  ********************
 466    2017-02-10 17:59    39  ********************
 467    2017-02-10 18:00    38  *******************
 468    2017-02-10 18:01     ?  -
 ...    ..(  4 skipped).    ..  -
 473    2017-02-10 18:06     ?  -
 474    2017-02-10 18:07    36  *****************
 475    2017-02-10 18:08    34  ***************
 476    2017-02-10 18:09    37  ******************
 477    2017-02-10 18:10    36  *****************
   0    2017-02-10 18:11    40  *********************
 ...    ..( 47 skipped).    ..  *********************
  48    2017-02-10 18:59    40  *********************
  49    2017-02-10 19:00    39  ********************
  50    2017-02-10 19:01    39  ********************
  51    2017-02-10 19:02    39  ********************
  52    2017-02-10 19:03    40  *********************
  53    2017-02-10 19:04    39  ********************
 ...    ..(  3 skipped).    ..  ********************
  57    2017-02-10 19:08    39  ********************
  58    2017-02-10 19:09    40  *********************
  59    2017-02-10 19:10    39  ********************
 ...    ..( 25 skipped).    ..  ********************
  85    2017-02-10 19:36    39  ********************
  86    2017-02-10 19:37    43  ************************
  87    2017-02-10 19:38    52  *********************************
  88    2017-02-10 19:39    56  *************************************
  89    2017-02-10 19:40    52  *********************************
  90    2017-02-10 19:41    46  ***************************
  91    2017-02-10 19:42    44  *************************
  92    2017-02-10 19:43    42  ***********************
  93    2017-02-10 19:44    41  **********************
  94    2017-02-10 19:45    41  **********************
  95    2017-02-10 19:46    41  **********************
  96    2017-02-10 19:47    40  *********************
 ...    ..(  9 skipped).    ..  *********************
 106    2017-02-10 19:57    40  *********************
 107    2017-02-10 19:58    39  ********************
 108    2017-02-10 19:59    40  *********************
 109    2017-02-10 20:00    39  ********************
 ...    ..(178 skipped).    ..  ********************
 288    2017-02-10 22:59    39  ********************

SCT Error Recovery Control command not supported

Device Statistics (GP Log 0x04)
Page Offset Size         Value  Description
  1  =====  =                =  == General Statistics (rev 1) ==
  1  0x008  4                8  Lifetime Power-On Resets
  1  0x010  4               20  Power-on Hours
  1  0x018  6        147713596  Logical Sectors Written
  1  0x020  6           253201  Number of Write Commands
  1  0x028  6        563577312  Logical Sectors Read
  1  0x030  6          2633847  Number of Read Commands
  4  =====  =                =  == General Errors Statistics (rev 1) ==
  4  0x008  4                0  Number of Reported Uncorrectable Errors
  4  0x010  4               14  Resets Between Cmd Acceptance and Completion
  5  =====  =                =  == Temperature Statistics (rev 1) ==
  5  0x008  1               37  Current Temperature
  5  0x010  1                -  Average Short Term Temperature
  5  0x018  1                -  Average Long Term Temperature
  5  0x020  1               57  Highest Temperature
  5  0x028  1               18  Lowest Temperature
  5  0x030  1                -  Highest Average Short Term Temperature
  5  0x038  1                -  Lowest Average Short Term Temperature
  5  0x040  1                -  Highest Average Long Term Temperature
  5  0x048  1                -  Lowest Average Long Term Temperature
  5  0x050  4                0  Time in Over-Temperature
  5  0x058  1               70  Specified Maximum Operating Temperature
  5  0x060  4                0  Time in Under-Temperature
  5  0x068  1                0  Specified Minimum Operating Temperature
  6  =====  =                =  == Transport Statistics (rev 1) ==
  6  0x008  4               64  Number of Hardware Resets
  6  0x010  4                9  Number of ASR Events
  6  0x018  4                0  Number of Interface CRC Errors
  7  =====  =                =  == Solid State Device Statistics (rev 1) ==
  7  0x008  1                0~ Percentage Used Endurance Indicator
                              |_ ~ normalized value

SATA Phy Event Counters (GP Log 0x11)
ID      Size     Value  Description
0x0001  4            0  Command failed due to ICRC error
0x000a  4            4  Device-to-host register FISes sent due to a COMRESET

