smartctl 6.4 2015-06-04 r4109 [x86_64-linux-4.4.3-gentoo] (local build)
Copyright (C) 2002-15, Bruce Allen, Christian Franke, www.smartmontools.org

=== START OF INFORMATION SECTION ===
Device Model:     CT250BX100SSD1
Firmware Version: MU02
User Capacity:    250,059,350,016 bytes [250 GB]
Sector Size:      512 bytes logical/physical
Rotation Rate:    Solid State Device
Device is:        Not in smartctl database [for details use: -P showall]
ATA Version is:   ACS-2 (minor revision not indicated)
SATA Version is:  SATA 3.1, 6.0 Gb/s (current: 3.0 Gb/s)
Local Time is:    Mon Mar 14 11:12:33 2016 CET
SMART support is: Available - device has SMART capability.
SMART support is: Enabled
AAM feature is:   Unavailable
APM feature is:   Unavailable
Rd look-ahead is: Enabled
Write cache is:   Enabled
ATA Security is:  Disabled, NOT FROZEN [SEC1]
Write SCT (Get) Feature Control Command failed: scsi error badly formed scsi parameters
Wt Cache Reorder: Unknown (SCT Feature Control command failed)

=== START OF READ SMART DATA SECTION ===
SMART overall-health self-assessment test result: PASSED

General SMART Values:
Offline data collection status:  (0x00)	Offline data collection activity
					was never started.
					Auto Offline Data Collection: Disabled.
Self-test execution status:      (   0)	The previous self-test routine completed
					without error or no self-test has ever 
					been run.
Total time to complete Offline 
data collection: 		(    0) seconds.
Offline data collection
capabilities: 			 (0x71) SMART execute Offline immediate.
					No Auto Offline data collection support.
					Suspend Offline collection upon new
					command.
					No Offline surface scan supported.
					Self-test supported.
					Conveyance Self-test supported.
					Selective Self-test supported.
SMART capabilities:            (0x0002)	Does not save SMART data before
					entering power-saving mode.
					Supports SMART auto save timer.
Error logging capability:        (0x01)	Error logging supported.
					General Purpose Logging supported.
Short self-test routine 
recommended polling time: 	 (   2) minutes.
Extended self-test routine
recommended polling time: 	 (  10) minutes.
Conveyance self-test routine
recommended polling time: 	 (   2) minutes.
SCT capabilities: 	       (0x0035)	SCT Status supported.
					SCT Feature Control supported.
					SCT Data Table supported.

SMART Attributes Data Structure revision number: 1
Vendor Specific SMART Attributes with Thresholds:
ID# ATTRIBUTE_NAME          FLAGS    VALUE WORST THRESH FAIL RAW_VALUE
  1 Raw_Read_Error_Rate     ------   100   100   000    -    0
  5 Reallocated_Sector_Ct   ------   100   100   000    -    0
  9 Power_On_Hours          ------   100   100   000    -    36
 12 Power_Cycle_Count       ------   100   100   000    -    13
160 Unknown_Attribute       ------   100   100   000    -    0
161 Unknown_Attribute       ------   100   100   000    -    69
163 Unknown_Attribute       ------   100   100   000    -    22
164 Unknown_Attribute       ------   100   100   000    -    4816
165 Unknown_Attribute       ------   100   100   000    -    10
166 Unknown_Attribute       ------   100   100   000    -    1
167 Unknown_Attribute       ------   100   100   000    -    2
168 Unknown_Attribute       ------   100   100   000    -    2000
169 Unknown_Attribute       ------   100   100   000    -    100
175 Program_Fail_Count_Chip ------   100   100   000    -    0
176 Erase_Fail_Count_Chip   ------   100   100   000    -    0
177 Wear_Leveling_Count     ------   100   100   000    -    0
178 Used_Rsvd_Blk_Cnt_Chip  ------   100   100   000    -    0
181 Program_Fail_Cnt_Total  ------   100   100   000    -    0
182 Erase_Fail_Count_Total  ------   100   100   000    -    0
192 Power-Off_Retract_Count ------   100   100   000    -    2
194 Temperature_Celsius     ------   100   100   000    -    25
195 Hardware_ECC_Recovered  ------   100   100   000    -    28
196 Reallocated_Event_Count ------   100   100   000    -    0
197 Current_Pending_Sector  ------   100   100   000    -    0
198 Offline_Uncorrectable   ------   100   100   000    -    0
199 UDMA_CRC_Error_Count    ------   100   100   000    -    0
232 Available_Reservd_Space ------   100   100   000    -    100
241 Total_LBAs_Written      ------   100   100   000    -    28789
242 Total_LBAs_Read         ------   100   100   000    -    2997
245 Unknown_Attribute       ------   100   100   000    -    38528
                            ||||||_ K auto-keep
                            |||||__ C event count
                            ||||___ R error rate
                            |||____ S speed/performance
                            ||_____ O updated online
                            |______ P prefailure warning

General Purpose Log Directory Version 1
SMART           Log Directory Version 1 [multi-sector log support]
Address    Access  R/W   Size  Description
0x00       GPL,SL  R/O      1  Log Directory
0x04       GPL,SL  R/O      8  Device Statistics log
0x06           SL  R/O      1  SMART self-test log
0x07       GPL,SL  R/O      1  Extended self-test log
0x09           SL  R/W      1  Selective self-test log
0x10       GPL,SL  R/O      1  SATA NCQ Queued Error log
0x11       GPL,SL  R/O      1  SATA Phy Event Counters log
0x24       GPL     R/O     64  Current Device Internal Status Data log
0x25       GPL     R/O     64  Saved Device Internal Status Data log
0x30       GPL,SL  R/O      9  IDENTIFY DEVICE data log
0x80-0x9f  GPL,SL  R/W     16  Host vendor specific log
0xe0       GPL,SL  R/W      1  SCT Command/Status
0xe1       GPL,SL  R/W      1  SCT Data Transfer

SMART Extended Comprehensive Error Log (GP Log 0x03) not supported

SMART Error Log not supported

SMART Extended Self-test Log Version: 1 (1 sectors)
No self-tests have been logged.  [To run self-tests, use: smartctl -t]

SMART Selective self-test log data structure revision number 1
 SPAN  MIN_LBA  MAX_LBA  CURRENT_TEST_STATUS
    1        0        0  Not_testing
    2        0        0  Not_testing
    3        0        0  Not_testing
    4        0        0  Not_testing
    5        0        0  Not_testing
Selective self-test flags (0x0):
  After scanning selected spans, do NOT read-scan remainder of disk.
If Selective self-test is pending on power-up, resume after 0 minute delay.

SCT Status Version:                  3
SCT Version (vendor specific):       0 (0x0000)
SCT Support Level:                   0
Device State:                        Active (0)
Current Temperature:                     0 Celsius
Power Cycle Min/Max Temperature:     22/25 Celsius
Lifetime    Min/Max Temperature:      0/31 Celsius
Under/Over Temperature Limit Count:   0/0

SCT Temperature History Version:     2
Temperature Sampling Period:         1 minute
Temperature Logging Interval:        0 minutes
Min/Max recommended Temperature:      0/100 Celsius
Min/Max Temperature Limit:            0/100 Celsius
Temperature History Size (Index):    128 (35)

Index    Estimated Time   Temperature Celsius
  36    2016-03-14 09:05    24  *****
  37    2016-03-14 09:06    22  ***
  38    2016-03-14 09:07    23  ****
  39    2016-03-14 09:08    23  ****
  40    2016-03-14 09:09    25  ******
  41    2016-03-14 09:10    25  ******
  42    2016-03-14 09:11    25  ******
  43    2016-03-14 09:12    26  *******
  44    2016-03-14 09:13    25  ******
  45    2016-03-14 09:14    22  ***
  46    2016-03-14 09:15    22  ***
  47    2016-03-14 09:16    23  ****
  48    2016-03-14 09:17    24  *****
  49    2016-03-14 09:18    23  ****
  50    2016-03-14 09:19    24  *****
 ...    ..( 20 skipped).    ..  *****
  71    2016-03-14 09:40    24  *****
  72    2016-03-14 09:41    25  ******
 ...    ..(  3 skipped).    ..  ******
  76    2016-03-14 09:45    25  ******
  77    2016-03-14 09:46    24  *****
  78    2016-03-14 09:47    24  *****
  79    2016-03-14 09:48    25  ******
 ...    ..(  6 skipped).    ..  ******
  86    2016-03-14 09:55    25  ******
  87    2016-03-14 09:56    23  ****
  88    2016-03-14 09:57    23  ****
  89    2016-03-14 09:58    24  *****
  90    2016-03-14 09:59    25  ******
 ...    ..(  9 skipped).    ..  ******
 100    2016-03-14 10:09    25  ******
 101    2016-03-14 10:10    22  ***
 102    2016-03-14 10:11    23  ****
 103    2016-03-14 10:12    23  ****
 104    2016-03-14 10:13    25  ******
 105    2016-03-14 10:14    24  *****
 ...    ..(  3 skipped).    ..  *****
 109    2016-03-14 10:18    24  *****
 110    2016-03-14 10:19    25  ******
 ...    ..( 14 skipped).    ..  ******
 125    2016-03-14 10:34    25  ******
 126    2016-03-14 10:35    26  *******
 127    2016-03-14 10:36    25  ******
 ...    ..( 10 skipped).    ..  ******
  10    2016-03-14 10:47    25  ******
  11    2016-03-14 10:48    22  ***
  12    2016-03-14 10:49    23  ****
  13    2016-03-14 10:50    23  ****
  14    2016-03-14 10:51    24  *****
 ...    ..(  2 skipped).    ..  *****
  17    2016-03-14 10:54    24  *****
  18    2016-03-14 10:55    25  ******
  19    2016-03-14 10:56    24  *****
  20    2016-03-14 10:57    24  *****
  21    2016-03-14 10:58    25  ******
 ...    ..( 12 skipped).    ..  ******
  34    2016-03-14 11:11    25  ******
  35    2016-03-14 11:12    24  *****

SCT Error Recovery Control command not supported

Device Statistics (GP Log 0x04)
Page  Offset Size        Value Flags Description
0x01  =====  =               =  ===  == General Statistics (rev 2) ==
0x01  0x008  4              13  ---  Lifetime Power-On Resets
0x01  0x010  4              36  ---  Power-on Hours
0x01  0x018  6      1886756936  ---  Logical Sectors Written
0x01  0x020  6       138629658  ---  Number of Write Commands
0x01  0x028  6       196438985  ---  Logical Sectors Read
0x01  0x030  6         6401850  ---  Number of Read Commands
0x04  =====  =               =  ===  == General Errors Statistics (rev 1) ==
0x04  0x008  4               0  ---  Number of Reported Uncorrectable Errors
0x04  0x010  4               2  ---  Resets Between Cmd Acceptance and Completion
0x06  =====  =               =  ===  == Transport Statistics (rev 1) ==
0x06  0x008  4             207  ---  Number of Hardware Resets
0x06  0x018  4               0  ---  Number of Interface CRC Errors
0x07  =====  =               =  ===  == Solid State Device Statistics (rev 1) ==
0x07  0x008  1               0  ---  Percentage Used Endurance Indicator
                                |||_ C monitored condition met
                                ||__ D supports DSN
                                |___ N normalized value

SATA Phy Event Counters (GP Log 0x11)
ID      Size     Value  Description
0x0001  2            0  Command failed due to ICRC error
0x0002  2            0  R_ERR response for data FIS
0x0003  2            0  R_ERR response for device-to-host data FIS
0x0004  2            0  R_ERR response for host-to-device data FIS
0x0005  2            0  R_ERR response for non-data FIS
0x0006  2            0  R_ERR response for device-to-host non-data FIS
0x0007  2            0  R_ERR response for host-to-device non-data FIS
0x0008  2            0  Device-to-host non-data FIS retries
0x0009  2            0  Transition from drive PhyRdy to drive PhyNRdy
0x000a  2            5  Device-to-host register FISes sent due to a COMRESET
0x000b  2            0  CRC errors within host-to-device FIS
0x000d  2            0  Non-CRC errors within host-to-device FIS
0x000f  2            0  R_ERR response for host-to-device data FIS, CRC
0x0010  2            0  R_ERR response for host-to-device data FIS, non-CRC
0x0012  2            0  R_ERR response for host-to-device non-data FIS, CRC
0x0013  2            0  R_ERR response for host-to-device non-data FIS, non-CRC

