smartctl 7.1 2019-12-30 r5022 [x86_64-linux-5.4.51-ck1] (local build)
Copyright (C) 2002-19, Bruce Allen, Christian Franke, www.smartmontools.org

=== START OF INFORMATION SECTION ===
Device Model:     Corsair Force LE SSD
Firmware Version: SAFC11.0
User Capacity:    240.057.409.536 bytes [240 GB]
Sector Size:      512 bytes logical/physical
Rotation Rate:    Solid State Device
Form Factor:      2.5 inches
Device is:        Not in smartctl database [for details use: -P showall]
ATA Version is:   ACS-2 (minor revision not indicated)
SATA Version is:  SATA 3.1, 6.0 Gb/s (current: 3.0 Gb/s)
Local Time is:    Wed Jul 15 12:27:57 2020 -03
SMART support is: Available - device has SMART capability.
SMART support is: Enabled
AAM feature is:   Unavailable
APM level is:     254 (maximum performance)
Rd look-ahead is: Enabled
Write cache is:   Enabled
DSN feature is:   Unavailable
ATA Security is:  Disabled, NOT FROZEN [SEC1]
Wt Cache Reorder: Unavailable

=== START OF READ SMART DATA SECTION ===
SMART overall-health self-assessment test result: PASSED

General SMART Values:
Offline data collection status:  (0x00)	Offline data collection activity
					was never started.
					Auto Offline Data Collection: Disabled.
Self-test execution status:      (   0)	The previous self-test routine completed
					without error or no self-test has ever 
					been run.
Total time to complete Offline 
data collection: 		(   30) seconds.
Offline data collection
capabilities: 			 (0x79) SMART execute Offline immediate.
					No Auto Offline data collection support.
					Suspend Offline collection upon new
					command.
					Offline surface scan supported.
					Self-test supported.
					Conveyance Self-test supported.
					Selective Self-test supported.
SMART capabilities:            (0x0003)	Saves SMART data before entering
					power-saving mode.
					Supports SMART auto save timer.
Error logging capability:        (0x01)	Error logging supported.
					General Purpose Logging supported.
Short self-test routine 
recommended polling time: 	 (   1) minutes.
Extended self-test routine
recommended polling time: 	 (   2) minutes.
Conveyance self-test routine
recommended polling time: 	 (   3) minutes.

SMART Attributes Data Structure revision number: 16
Vendor Specific SMART Attributes with Thresholds:
ID# ATTRIBUTE_NAME          FLAGS    VALUE WORST THRESH FAIL RAW_VALUE
  1 Raw_Read_Error_Rate     PO-R--   100   100   050    -    203
  5 Reallocated_Sector_Ct   PO--C-   100   100   050    -    0
  9 Power_On_Hours          -O--C-   100   100   000    -    12792
 12 Power_Cycle_Count       -O--C-   100   100   000    -    4648
162 Unknown_Attribute       PO----   100   100   000    -    290
170 Unknown_Attribute       -O----   100   100   000    -    0
173 Unknown_Attribute       -O--C-   100   100   000    -    1310812
174 Unknown_Attribute       -O--C-   100   100   000    -    76
181 Program_Fail_Cnt_Total  -O--C-   100   100   000    -    0
187 Reported_Uncorrect      -O--C-   100   100   000    -    203
192 Power-Off_Retract_Count -O--C-   100   100   000    -    76
194 Temperature_Celsius     PO---K   070   070   030    -    30 (Min/Max 30/30)
196 Reallocated_Event_Count -O----   100   100   010    -    0
218 Unknown_Attribute       PO-R--   100   100   050    -    0
231 Temperature_Celsius     PO--C-   100   100   000    -    100
241 Total_LBAs_Written      -O--C-   100   100   000    -    6517
242 Total_LBAs_Read         -O--C-   100   100   000    -    26915
                            ||||||_ K auto-keep
                            |||||__ C event count
                            ||||___ R error rate
                            |||____ S speed/performance
                            ||_____ O updated online
                            |______ P prefailure warning

General Purpose Log Directory Version 1
SMART           Log Directory Version 1 [multi-sector log support]
Address    Access  R/W   Size  Description
0x00       GPL,SL  R/O      1  Log Directory
0x01           SL  R/O      1  Summary SMART error log
0x02           SL  R/O     51  Comprehensive SMART error log
0x03       GPL     R/O     64  Ext. Comprehensive SMART error log
0x04       GPL,SL  R/O      6  Device Statistics log
0x06           SL  R/O      1  SMART self-test log
0x07       GPL     R/O      1  Extended self-test log
0x09           SL  R/W      1  Selective self-test log
0x10       GPL     R/O      1  NCQ Command Error log
0x11       GPL     R/O      1  SATA Phy Event Counters log
0x30       GPL,SL  R/O      8  IDENTIFY DEVICE data log
0x80-0x9f  GPL,SL  R/W     16  Host vendor specific log
0xe0       GPL,SL  R/W      1  SCT Command/Status
0xe1       GPL,SL  R/W      1  SCT Data Transfer

SMART Extended Comprehensive Error Log Version: 1 (64 sectors)
Device Error Count: 203
	CR     = Command Register
	FEATR  = Features Register
	COUNT  = Count (was: Sector Count) Register
	LBA_48 = Upper bytes of LBA High/Mid/Low Registers ]  ATA-8
	LH     = LBA High (was: Cylinder High) Register    ]   LBA
	LM     = LBA Mid (was: Cylinder Low) Register      ] Register
	LL     = LBA Low (was: Sector Number) Register     ]
	DV     = Device (was: Device/Head) Register
	DC     = Device Control Register
	ER     = Error register
	ST     = Status register
Powered_Up_Time is measured from power on, and printed as
DDd+hh:mm:SS.sss where DD=days, hh=hours, mm=minutes,
SS=sec, and sss=millisec. It "wraps" after 49.710 days.

Error 203 [202] occurred at disk power-on lifetime: 12627 hours (526 days + 3 hours)
  When the command that caused the error occurred, the device was active or idle.

  After command completion occurred, registers were:
  ER -- ST COUNT  LBA_48  LH LM LL DV DC
  -- -- -- == -- == == == -- -- -- -- --
  40 -- 41 00 a8 00 00 0e d1 3b f9 40 00  Error: UNC at LBA = 0x0ed13bf9 = 248593401

  Commands leading to the command that caused the error were:
  CR FEATR COUNT  LBA_48  LH LM LL DV DC  Powered_Up_Time  Command/Feature_Name
  -- == -- == -- == == == -- -- -- -- --  ---------------  --------------------
  60 00 10 00 a8 00 00 0e d1 3b f9 40 08     00:00:07.703  READ FPDMA QUEUED
  60 00 a8 00 a0 00 00 03 08 1d 07 40 08     00:00:05.957  READ FPDMA QUEUED
  60 00 79 00 98 00 00 03 08 1b f6 40 08     00:00:05.956  READ FPDMA QUEUED
  60 00 98 00 90 00 00 03 08 1c 6f 40 08     00:00:05.955  READ FPDMA QUEUED
  60 00 b1 00 88 00 00 03 08 1e 51 40 08     00:00:05.955  READ FPDMA QUEUED

Error 202 [201] occurred at disk power-on lifetime: 12614 hours (525 days + 14 hours)
  When the command that caused the error occurred, the device was active or idle.

  After command completion occurred, registers were:
  ER -- ST COUNT  LBA_48  LH LM LL DV DC
  -- -- -- == -- == == == -- -- -- -- --
  40 -- 41 00 48 00 00 03 ca 2d dc 40 00  Error: UNC at LBA = 0x03ca2ddc = 63581660

  Commands leading to the command that caused the error were:
  CR FEATR COUNT  LBA_48  LH LM LL DV DC  Powered_Up_Time  Command/Feature_Name
  -- == -- == -- == == == -- -- -- -- --  ---------------  --------------------
  60 00 04 00 48 00 00 03 ca 2d dc 40 08     00:01:54.395  READ FPDMA QUEUED
  60 00 3a 00 40 00 00 03 c9 d7 dd 40 08     00:01:53.443  READ FPDMA QUEUED
  60 00 1d 00 38 00 00 03 c9 d7 c0 40 08     00:01:53.442  READ FPDMA QUEUED
  60 00 1d 00 30 00 00 03 c9 d7 a3 40 08     00:01:53.442  READ FPDMA QUEUED
  60 00 1d 00 28 00 00 03 c9 d7 86 40 08     00:01:53.442  READ FPDMA QUEUED

Error 201 [200] occurred at disk power-on lifetime: 12581 hours (524 days + 5 hours)
  When the command that caused the error occurred, the device was active or idle.

  After command completion occurred, registers were:
  ER -- ST COUNT  LBA_48  LH LM LL DV DC
  -- -- -- == -- == == == -- -- -- -- --
  40 -- 41 00 40 00 00 02 12 d5 fb 40 00  Error: UNC at LBA = 0x0212d5fb = 34788859

  Commands leading to the command that caused the error were:
  CR FEATR COUNT  LBA_48  LH LM LL DV DC  Powered_Up_Time  Command/Feature_Name
  -- == -- == -- == == == -- -- -- -- --  ---------------  --------------------
  60 00 08 00 40 00 00 02 12 d5 fb 40 08     01:00:50.702  READ FPDMA QUEUED
  60 00 08 00 38 00 00 02 12 d6 03 40 08     01:00:50.702  READ FPDMA QUEUED
  60 00 09 00 30 00 00 02 18 2b 7b 40 08     01:00:50.693  READ FPDMA QUEUED
  ea 00 00 00 00 00 00 00 00 00 00 a0 08     01:00:47.914  FLUSH CACHE EXT
  61 00 08 00 20 00 00 02 1d 94 fc 40 08     01:00:47.914  WRITE FPDMA QUEUED

Error 200 [199] occurred at disk power-on lifetime: 12221 hours (509 days + 5 hours)
  When the command that caused the error occurred, the device was active or idle.

  After command completion occurred, registers were:
  ER -- ST COUNT  LBA_48  LH LM LL DV DC
  -- -- -- == -- == == == -- -- -- -- --
  40 -- 41 00 e0 00 00 15 f3 44 76 40 00  Error: UNC at LBA = 0x15f34476 = 368264310

  Commands leading to the command that caused the error were:
  CR FEATR COUNT  LBA_48  LH LM LL DV DC  Powered_Up_Time  Command/Feature_Name
  -- == -- == -- == == == -- -- -- -- --  ---------------  --------------------
  60 00 0c 00 e0 00 00 15 f3 44 76 40 08     04:04:14.402  READ FPDMA QUEUED
  ea 00 00 00 00 00 00 00 00 00 00 a0 08     04:04:13.490  FLUSH CACHE EXT
  61 00 02 00 d0 00 00 1b f2 43 92 40 08     04:04:13.490  WRITE FPDMA QUEUED
  61 00 02 00 c8 00 00 1b f2 41 92 40 08     04:04:13.490  WRITE FPDMA QUEUED
  61 00 02 00 c0 00 00 00 10 0b 92 40 08     04:04:13.490  WRITE FPDMA QUEUED

Error 199 [198] occurred at disk power-on lifetime: 12179 hours (507 days + 11 hours)
  When the command that caused the error occurred, the device was active or idle.

  After command completion occurred, registers were:
  ER -- ST COUNT  LBA_48  LH LM LL DV DC
  -- -- -- == -- == == == -- -- -- -- --
  40 -- 41 00 10 00 00 11 ea fb 51 40 00  Error: UNC at LBA = 0x11eafb51 = 300612433

  Commands leading to the command that caused the error were:
  CR FEATR COUNT  LBA_48  LH LM LL DV DC  Powered_Up_Time  Command/Feature_Name
  -- == -- == -- == == == -- -- -- -- --  ---------------  --------------------
  60 00 02 00 10 00 00 11 ea fb 51 40 08     06:21:46.842  READ FPDMA QUEUED
  ea 00 00 00 00 00 00 00 00 00 00 a0 08     06:21:45.686  FLUSH CACHE EXT
  61 00 02 00 00 00 00 1b f2 43 e4 40 08     06:21:45.686  WRITE FPDMA QUEUED
  61 00 02 00 f0 00 00 1b f2 41 e4 40 08     06:21:45.686  WRITE FPDMA QUEUED
  61 00 02 00 e8 00 00 00 10 0b e4 40 08     06:21:45.686  WRITE FPDMA QUEUED

Error 198 [197] occurred at disk power-on lifetime: 12124 hours (505 days + 4 hours)
  When the command that caused the error occurred, the device was active or idle.

  After command completion occurred, registers were:
  ER -- ST COUNT  LBA_48  LH LM LL DV DC
  -- -- -- == -- == == == -- -- -- -- --
  40 -- 41 00 38 00 00 0f 72 2d 9a 40 00  Error: UNC at LBA = 0x0f722d9a = 259141018

  Commands leading to the command that caused the error were:
  CR FEATR COUNT  LBA_48  LH LM LL DV DC  Powered_Up_Time  Command/Feature_Name
  -- == -- == -- == == == -- -- -- -- --  ---------------  --------------------
  60 00 0f 00 38 00 00 0f 72 2d 9a 40 08     00:19:23.930  READ FPDMA QUEUED
  ea 00 00 00 00 00 00 00 00 00 00 a0 08     00:19:22.621  FLUSH CACHE EXT
  61 00 08 00 28 00 00 0f 55 5d e5 40 08     00:19:22.621  WRITE FPDMA QUEUED
  ea 00 00 00 00 00 00 00 00 00 00 a0 08     00:19:22.619  FLUSH CACHE EXT
  61 00 30 00 18 00 00 0f 55 5d 9d 40 08     00:19:22.619  WRITE FPDMA QUEUED

Error 197 [196] occurred at disk power-on lifetime: 12072 hours (503 days + 0 hours)
  When the command that caused the error occurred, the device was active or idle.

  After command completion occurred, registers were:
  ER -- ST COUNT  LBA_48  LH LM LL DV DC
  -- -- -- == -- == == == -- -- -- -- --
  40 -- 41 00 b8 00 00 0c 6d 4e 9b 40 00  Error: UNC at LBA = 0x0c6d4e9b = 208490139

  Commands leading to the command that caused the error were:
  CR FEATR COUNT  LBA_48  LH LM LL DV DC  Powered_Up_Time  Command/Feature_Name
  -- == -- == -- == == == -- -- -- -- --  ---------------  --------------------
  60 00 0f 00 b8 00 00 0c 6d 4e 9b 40 08     01:43:01.987  READ FPDMA QUEUED
  60 00 99 00 b0 00 00 07 28 a6 3e 40 08     01:42:58.574  READ FPDMA QUEUED
  ea 00 00 00 00 00 00 00 00 00 00 a0 08     01:42:57.662  FLUSH CACHE EXT
  61 00 02 00 a0 00 00 1b f2 43 3c 40 08     01:42:57.662  WRITE FPDMA QUEUED
  61 00 02 00 98 00 00 1b f2 41 3c 40 08     01:42:57.662  WRITE FPDMA QUEUED

Error 196 [195] occurred at disk power-on lifetime: 12061 hours (502 days + 13 hours)
  When the command that caused the error occurred, the device was active or idle.

  After command completion occurred, registers were:
  ER -- ST COUNT  LBA_48  LH LM LL DV DC
  -- -- -- == -- == == == -- -- -- -- --
  40 -- 41 00 78 00 00 0b 7e a0 0c 40 00  Error: UNC at LBA = 0x0b7ea00c = 192847884

  Commands leading to the command that caused the error were:
  CR FEATR COUNT  LBA_48  LH LM LL DV DC  Powered_Up_Time  Command/Feature_Name
  -- == -- == -- == == == -- -- -- -- --  ---------------  --------------------
  60 00 02 00 78 00 00 0b 7e a0 0c 40 08     00:17:48.148  READ FPDMA QUEUED
  60 00 c1 00 70 00 00 03 14 96 42 40 08     00:17:47.231  READ FPDMA QUEUED
  60 00 02 00 68 00 00 03 14 97 0b 40 08     00:17:47.231  READ FPDMA QUEUED
  60 00 02 00 60 00 00 03 14 80 35 40 08     00:17:47.228  READ FPDMA QUEUED
  60 00 a3 00 58 00 00 07 56 78 02 40 08     00:17:47.223  READ FPDMA QUEUED

SMART Extended Self-test Log Version: 1 (1 sectors)
Num  Test_Description    Status                  Remaining  LifeTime(hours)  LBA_of_first_error
# 1  Short offline       Completed without error       00%     12792         -
# 2  Short offline       Completed without error       00%      7990         -

SMART Selective self-test log data structure revision number 1
 SPAN  MIN_LBA  MAX_LBA  CURRENT_TEST_STATUS
    1        0        0  Not_testing
    2        0        0  Not_testing
    3        0        0  Not_testing
    4        0        0  Not_testing
    5        0        0  Not_testing
Selective self-test flags (0x0):
  After scanning selected spans, do NOT read-scan remainder of disk.
If Selective self-test is pending on power-up, resume after 0 minute delay.

SCT Commands not supported

Device Statistics (GP Log 0x04)
Page  Offset Size        Value Flags Description
0x01  =====  =               =  ===  == General Statistics (rev 2) ==
0x01  0x008  4            4648  ---  Lifetime Power-On Resets
0x01  0x010  4           12792  ---  Power-on Hours
0x01  0x018  6     13669114069  ---  Logical Sectors Written
0x01  0x020  6       253277446  ---  Number of Write Commands
0x01  0x028  6     56445533223  ---  Logical Sectors Read
0x01  0x030  6       938738618  ---  Number of Read Commands
0x01  0x038  6     46052054171  ---  Date and Time TimeStamp
0x04  =====  =               =  ===  == General Errors Statistics (rev 1) ==
0x04  0x008  4          118198  ---  Number of Reported Uncorrectable Errors
0x04  0x010  4              22  ---  Resets Between Cmd Acceptance and Completion
0x05  =====  =               =  ===  == Temperature Statistics (rev 1) ==
0x05  0x008  1              32  ---  Current Temperature
0x05  0x010  1              32  ---  Average Short Term Temperature
0x05  0x018  1              32  ---  Average Long Term Temperature
0x05  0x020  1              50  ---  Highest Temperature
0x05  0x028  1               5  ---  Lowest Temperature
0x05  0x030  1              50  ---  Highest Average Short Term Temperature
0x05  0x038  1              16  ---  Lowest Average Short Term Temperature
0x05  0x040  1              50  ---  Highest Average Long Term Temperature
0x05  0x048  1              16  ---  Lowest Average Long Term Temperature
0x05  0x050  4               0  ---  Time in Over-Temperature
0x05  0x058  1              50  ---  Specified Maximum Operating Temperature
0x05  0x060  4               0  ---  Time in Under-Temperature
0x05  0x068  1               5  ---  Specified Minimum Operating Temperature
0x06  =====  =               =  ===  == Transport Statistics (rev 1) ==
0x06  0x008  4           11686  ---  Number of Hardware Resets
0x06  0x018  4               0  ---  Number of Interface CRC Errors
0x07  =====  =               =  ===  == Solid State Device Statistics (rev 1) ==
0x07  0x008  1               3  ---  Percentage Used Endurance Indicator
                                |||_ C monitored condition met
                                ||__ D supports DSN
                                |___ N normalized value

Pending Defects log (GP Log 0x0c) not supported

SATA Phy Event Counters (GP Log 0x11)
ID      Size     Value  Description
0x0001  2            0  Command failed due to ICRC error
0x0003  2            0  R_ERR response for device-to-host data FIS
0x0004  2            0  R_ERR response for host-to-device data FIS
0x0006  2            0  R_ERR response for device-to-host non-data FIS
0x0007  2            0  R_ERR response for host-to-device non-data FIS
0x0008  2            0  Device-to-host non-data FIS retries
0x0009  4     48136592  Transition from drive PhyRdy to drive PhyNRdy
0x000a  4        16010  Device-to-host register FISes sent due to a COMRESET
0x000f  2            0  R_ERR response for host-to-device data FIS, CRC
0x0010  2            0  R_ERR response for host-to-device data FIS, non-CRC
0x0012  2            0  R_ERR response for host-to-device non-data FIS, CRC
0x0013  2            0  R_ERR response for host-to-device non-data FIS, non-CRC

