smartctl 6.5 2016-05-07 r4318 [x86_64-linux-3.10.0-862.11.6.el7.x86_64] (local build)
Copyright (C) 2002-16, Bruce Allen, Christian Franke, www.smartmontools.org

=== START OF INFORMATION SECTION ===
Device Model:     ST8000NE0004-1ZF11G
Firmware Version: EN01
User Capacity:    8.001.563.222.016 bytes [8,00 TB]
Sector Sizes:     512 bytes logical, 4096 bytes physical
Rotation Rate:    7200 rpm
Form Factor:      3.5 inches
Device is:        Not in smartctl database [for details use: -P showall]
ATA Version is:   ACS-3 T13/2161-D revision 5
SATA Version is:  SATA 3.1, 6.0 Gb/s (current: 6.0 Gb/s)
Local Time is:    Thu Aug 23 10:23:57 2018 CEST
SMART support is: Available - device has SMART capability.
SMART support is: Enabled
AAM feature is:   Unavailable
APM feature is:   Unavailable
Rd look-ahead is: Enabled
Write cache is:   Enabled
ATA Security is:  Disabled, frozen [SEC2]
Wt Cache Reorder: Enabled

=== START OF READ SMART DATA SECTION ===
SMART overall-health self-assessment test result: PASSED

General SMART Values:
Offline data collection status:  (0x82)	Offline data collection activity
					was completed without error.
					Auto Offline Data Collection: Enabled.
Self-test execution status:      (   0)	The previous self-test routine completed
					without error or no self-test has ever 
					been run.
Total time to complete Offline 
data collection: 		(  575) seconds.
Offline data collection
capabilities: 			 (0x7b) SMART execute Offline immediate.
					Auto Offline data collection on/off support.
					Suspend Offline collection upon new
					command.
					Offline surface scan supported.
					Self-test supported.
					Conveyance Self-test supported.
					Selective Self-test supported.
SMART capabilities:            (0x0003)	Saves SMART data before entering
					power-saving mode.
					Supports SMART auto save timer.
Error logging capability:        (0x01)	Error logging supported.
					General Purpose Logging supported.
Short self-test routine 
recommended polling time: 	 (   1) minutes.
Extended self-test routine
recommended polling time: 	 ( 703) minutes.
Conveyance self-test routine
recommended polling time: 	 (   2) minutes.
SCT capabilities: 	       (0x70bd)	SCT Status supported.
					SCT Error Recovery Control supported.
					SCT Feature Control supported.
					SCT Data Table supported.

SMART Attributes Data Structure revision number: 10
Vendor Specific SMART Attributes with Thresholds:
ID# ATTRIBUTE_NAME          FLAGS    VALUE WORST THRESH FAIL RAW_VALUE
  1 Raw_Read_Error_Rate     POSR--   084   064   044    -    225228888
  3 Spin_Up_Time            PO----   090   088   000    -    0
  4 Start_Stop_Count        -O--CK   100   100   020    -    66
  5 Reallocated_Sector_Ct   PO--CK   100   100   010    -    552
  7 Seek_Error_Rate         POSR--   075   060   045    -    34912052
  9 Power_On_Hours          -O--CK   100   100   000    -    147 (96 82 0)
 10 Spin_Retry_Count        PO--C-   100   100   097    -    0
 12 Power_Cycle_Count       -O--CK   100   100   020    -    69
184 End-to-End_Error        -O--CK   100   100   099    -    0
187 Reported_Uncorrect      -O--CK   100   100   000    -    0
188 Command_Timeout         -O--CK   100   100   000    -    0
189 High_Fly_Writes         -O-RCK   099   099   000    -    1
190 Airflow_Temperature_Cel -O---K   067   062   040    -    33 (Min/Max 32/34)
191 G-Sense_Error_Rate      -O--CK   100   100   000    -    1836
192 Power-Off_Retract_Count -O--CK   100   100   000    -    32
193 Load_Cycle_Count        -O--CK   100   100   000    -    153
194 Temperature_Celsius     -O---K   033   040   000    -    33 (0 26 0 0 0)
195 Hardware_ECC_Recovered  -O-RC-   084   064   000    -    225228888
197 Current_Pending_Sector  -O--C-   100   100   000    -    0
198 Offline_Uncorrectable   ----C-   100   100   000    -    0
199 UDMA_CRC_Error_Count    -OSRCK   200   200   000    -    0
200 Multi_Zone_Error_Rate   PO---K   100   100   001    -    0
240 Head_Flying_Hours       ------   100   253   000    -    121 (225 196 0)
241 Total_LBAs_Written      ------   100   253   000    -    15658814344
242 Total_LBAs_Read         ------   100   253   000    -    2184386474
                            ||||||_ K auto-keep
                            |||||__ C event count
                            ||||___ R error rate
                            |||____ S speed/performance
                            ||_____ O updated online
                            |______ P prefailure warning

General Purpose Log Directory Version 1
SMART           Log Directory Version 1 [multi-sector log support]
Address    Access  R/W   Size  Description
0x00       GPL,SL  R/O      1  Log Directory
0x01           SL  R/O      1  Summary SMART error log
0x02           SL  R/O      5  Comprehensive SMART error log
0x03       GPL     R/O      5  Ext. Comprehensive SMART error log
0x04       GPL     R/O    256  Device Statistics log
0x04       SL      R/O      8  Device Statistics log
0x06           SL  R/O      1  SMART self-test log
0x07       GPL     R/O      1  Extended self-test log
0x08       GPL     R/O      2  Power Conditions log
0x09           SL  R/W      1  Selective self-test log
0x0c       GPL     R/O   2048  Pending Defects log
0x10       GPL     R/O      1  SATA NCQ Queued Error log
0x11       GPL     R/O      1  SATA Phy Event Counters log
0x13       GPL     R/O      1  SATA NCQ Send and Receive log
0x15       GPL     R/W      1  SATA Rebuild Assist log
0x21       GPL     R/O      1  Write stream error log
0x22       GPL     R/O      1  Read stream error log
0x24       GPL     R/O    768  Current Device Internal Status Data log
0x30       GPL,SL  R/O      9  IDENTIFY DEVICE data log
0x80-0x9f  GPL,SL  R/W     16  Host vendor specific log
0xa1       GPL,SL  VS      24  Device vendor specific log
0xa2       GPL     VS   16320  Device vendor specific log
0xa6       GPL     VS     192  Device vendor specific log
0xa8-0xa9  GPL,SL  VS     136  Device vendor specific log
0xab       GPL     VS       1  Device vendor specific log
0xad       GPL     VS      16  Device vendor specific log
0xb0       GPL     VS   17208  Device vendor specific log
0xbe-0xbf  GPL     VS   65535  Device vendor specific log
0xc1       GPL,SL  VS      16  Device vendor specific log
0xc3       GPL,SL  VS      56  Device vendor specific log
0xc9       GPL,SL  VS       8  Device vendor specific log
0xca       GPL,SL  VS      16  Device vendor specific log
0xd1       GPL     VS     304  Device vendor specific log
0xd2       GPL     VS   10000  Device vendor specific log
0xd4       GPL     VS    2048  Device vendor specific log
0xe0       GPL,SL  R/W      1  SCT Command/Status
0xe1       GPL,SL  R/W      1  SCT Data Transfer

SMART Extended Comprehensive Error Log Version: 1 (5 sectors)
No Errors Logged

SMART Extended Self-test Log Version: 1 (1 sectors)
Num  Test_Description    Status                  Remaining  LifeTime(hours)  LBA_of_first_error
# 1  Short offline       Completed without error       00%       147         -

SMART Selective self-test log data structure revision number 1
 SPAN  MIN_LBA  MAX_LBA  CURRENT_TEST_STATUS
    1        0        0  Not_testing
    2        0        0  Not_testing
    3        0        0  Not_testing
    4        0        0  Not_testing
    5        0        0  Not_testing
Selective self-test flags (0x0):
  After scanning selected spans, do NOT read-scan remainder of disk.
If Selective self-test is pending on power-up, resume after 0 minute delay.

SCT Status Version:                  3
SCT Version (vendor specific):       522 (0x020a)
SCT Support Level:                   1
Device State:                        Active (0)
Current Temperature:                    33 Celsius
Power Cycle Min/Max Temperature:     32/34 Celsius
Lifetime    Min/Max Temperature:     25/38 Celsius
Under/Over Temperature Limit Count:   0/16

SCT Temperature History Version:     2
Temperature Sampling Period:         3 minutes
Temperature Logging Interval:        59 minutes
Min/Max recommended Temperature:      0/ 0 Celsius
Min/Max Temperature Limit:            0/ 0 Celsius
Temperature History Size (Index):    128 (98)

Index    Estimated Time   Temperature Celsius
  99    2018-08-18 05:08     ?  -
 100    2018-08-18 06:07    36  *****************
 101    2018-08-18 07:06     ?  -
 102    2018-08-18 08:05    36  *****************
 103    2018-08-18 09:04     ?  -
 104    2018-08-18 10:03    36  *****************
 105    2018-08-18 11:02     ?  -
 106    2018-08-18 12:01    36  *****************
 107    2018-08-18 13:00     ?  -
 108    2018-08-18 13:59    35  ****************
 109    2018-08-18 14:58     ?  -
 110    2018-08-18 15:57    35  ****************
 111    2018-08-18 16:56     ?  -
 112    2018-08-18 17:55    35  ****************
 113    2018-08-18 18:54     ?  -
 114    2018-08-18 19:53    35  ****************
 115    2018-08-18 20:52     ?  -
 116    2018-08-18 21:51    36  *****************
 117    2018-08-18 22:50     ?  -
 118    2018-08-18 23:49    36  *****************
 119    2018-08-19 00:48     ?  -
 120    2018-08-19 01:47    36  *****************
 121    2018-08-19 02:46     ?  -
 122    2018-08-19 03:45    36  *****************
 123    2018-08-19 04:44     ?  -
 124    2018-08-19 05:43    36  *****************
 125    2018-08-19 06:42     ?  -
 126    2018-08-19 07:41    35  ****************
 127    2018-08-19 08:40     ?  -
   0    2018-08-19 09:39    35  ****************
   1    2018-08-19 10:38     ?  -
   2    2018-08-19 11:37    36  *****************
   3    2018-08-19 12:36     ?  -
   4    2018-08-19 13:35    36  *****************
   5    2018-08-19 14:34    38  *******************
   6    2018-08-19 15:33     ?  -
   7    2018-08-19 16:32    34  ***************
   8    2018-08-19 17:31     ?  -
   9    2018-08-19 18:30    34  ***************
  10    2018-08-19 19:29     ?  -
  11    2018-08-19 20:28    33  **************
  12    2018-08-19 21:27     ?  -
  13    2018-08-19 22:26    34  ***************
  14    2018-08-19 23:25    33  **************
  15    2018-08-20 00:24    32  *************
  16    2018-08-20 01:23    33  **************
  17    2018-08-20 02:22    33  **************
  18    2018-08-20 03:21    34  ***************
  19    2018-08-20 04:20    34  ***************
  20    2018-08-20 05:19    33  **************
 ...    ..(  3 skipped).    ..  **************
  24    2018-08-20 09:15    33  **************
  25    2018-08-20 10:14    34  ***************
 ...    ..(  2 skipped).    ..  ***************
  28    2018-08-20 13:11    34  ***************
  29    2018-08-20 14:10    32  *************
  30    2018-08-20 15:09    34  ***************
 ...    ..(  6 skipped).    ..  ***************
  37    2018-08-20 22:02    34  ***************
  38    2018-08-20 23:01    33  **************
 ...    ..(  2 skipped).    ..  **************
  41    2018-08-21 01:58    33  **************
  42    2018-08-21 02:57    32  *************
 ...    ..(  5 skipped).    ..  *************
  48    2018-08-21 08:51    32  *************
  49    2018-08-21 09:50    33  **************
 ...    ..(  2 skipped).    ..  **************
  52    2018-08-21 12:47    33  **************
  53    2018-08-21 13:46    34  ***************
  54    2018-08-21 14:45    34  ***************
  55    2018-08-21 15:44    35  ****************
  56    2018-08-21 16:43    34  ***************
 ...    ..(  2 skipped).    ..  ***************
  59    2018-08-21 19:40    34  ***************
  60    2018-08-21 20:39    33  **************
 ...    ..(  2 skipped).    ..  **************
  63    2018-08-21 23:36    33  **************
  64    2018-08-22 00:35    32  *************
  65    2018-08-22 01:34    32  *************
  66    2018-08-22 02:33    31  ************
 ...    ..(  2 skipped).    ..  ************
  69    2018-08-22 05:30    31  ************
  70    2018-08-22 06:29    32  *************
  71    2018-08-22 07:28    32  *************
  72    2018-08-22 08:27    32  *************
  73    2018-08-22 09:26    33  **************
  74    2018-08-22 10:25     ?  -
  75    2018-08-22 11:24    30  ***********
  76    2018-08-22 12:23     ?  -
  77    2018-08-22 13:22    30  ***********
  78    2018-08-22 14:21     ?  -
  79    2018-08-22 15:20    32  *************
  80    2018-08-22 16:19     ?  -
  81    2018-08-22 17:18    33  **************
  82    2018-08-22 18:17     ?  -
  83    2018-08-22 19:16    34  ***************
  84    2018-08-22 20:15    34  ***************
  85    2018-08-22 21:14    34  ***************
  86    2018-08-22 22:13    33  **************
 ...    ..(  4 skipped).    ..  **************
  91    2018-08-23 03:08    33  **************
  92    2018-08-23 04:07    32  *************
 ...    ..(  4 skipped).    ..  *************
  97    2018-08-23 09:02    32  *************
  98    2018-08-23 10:01    33  **************

SCT Error Recovery Control:
           Read:    100 (10,0 seconds)
          Write:    100 (10,0 seconds)

Device Statistics (GP/SMART Log 0x04) not supported

SATA Phy Event Counters (GP Log 0x11)
ID      Size     Value  Description
0x000a  2           50  Device-to-host register FISes sent due to a COMRESET
0x0001  2            0  Command failed due to ICRC error
0x0003  2            0  R_ERR response for device-to-host data FIS
0x0004  2            0  R_ERR response for host-to-device data FIS
0x0006  2            0  R_ERR response for device-to-host non-data FIS
0x0007  2            0  R_ERR response for host-to-device non-data FIS

