=== START OF INFORMATION SECTION ===
Device Model:     2GB SATA Flash Drive
Serial Number:    00101082267000105015
Firmware Version: SFI2101D
User Capacity:    1,982,324,736 bytes [1.98 GB]
Sector Size:      512 bytes logical/physical
Rotation Rate:    Solid State Device
Device is:        Not in smartctl database [for details use: -P showall]
ATA Version is:   ATA8-ACS, ATA/ATAPI-4 published, ANSI NCITS 317-1998
SATA Version is:  SATA 2.6, 3.0 Gb/s
Local Time is:    Fri Jun 28 08:05:51 2013 GMT
SMART support is: Available - device has SMART capability.
SMART support is: Enabled
AAM feature is:   Unavailable
APM feature is:   Unavailable
Rd look-ahead is: Enabled
Write cache is:   Enabled
ATA Security is:  Disabled, NOT FROZEN [SEC1]

=== START OF READ SMART DATA SECTION ===
SMART overall-health self-assessment test result: PASSED

General SMART Values:
Offline data collection status:  (0x00)	Offline data collection activity
					was never started.
					Auto Offline Data Collection: Disabled.
Self-test execution status:      (   0)	The previous self-test routine completed
					without error or no self-test has ever 
					been run.
Total time to complete Offline 
data collection: 		(    1) seconds.
Offline data collection
capabilities: 			 (0x75) SMART execute Offline immediate.
					No Auto Offline data collection support.
					Abort Offline collection upon new
					command.
					No Offline surface scan supported.
					Self-test supported.
					Conveyance Self-test supported.
					Selective Self-test supported.
SMART capabilities:            (0x0003)	Saves SMART data before entering
					power-saving mode.
					Supports SMART auto save timer.
Error logging capability:        (0x01)	Error logging supported.
					No General Purpose Logging support.
Short self-test routine 
recommended polling time: 	 (   1) minutes.
Extended self-test routine
recommended polling time: 	 (   1) minutes.
Conveyance self-test routine
recommended polling time: 	 (   1) minutes.

SMART Attributes Data Structure revision number: 7
Vendor Specific SMART Attributes with Thresholds:
ID# ATTRIBUTE_NAME          FLAGS    VALUE WORST THRESH FAIL RAW_VALUE
 12 Power_Cycle_Count       ------+  100   100   000    -    11
160 Unknown_Attribute       ------+  100   100   000    -    0
161 Unknown_Attribute       ------+  100   100   000    -    0
162 Unknown_Attribute       ------+  100   100   000    -    151
163 Unknown_Attribute       ------+  100   100   000    -    11
164 Unknown_Attribute       ------+  100   100   000    -    7
165 Unknown_Attribute       ------+  100   100   000    -    7
241 Total_LBAs_Written      ------+  100   100   000    -    18185602
                            ||||||_ K auto-keep
                            |||||__ C event count
                            ||||___ R error rate
                            |||____ S speed/performance
                            ||_____ O updated online
                            |______ P prefailure warning

ATA_READ_LOG_EXT (addr=0x00:0x00, page=0, n=1) failed: 48-bit ATA commands not implemented for legacy controllers
Read GP Log Directory failed

SMART Log Directory Version 1 [multi-sector log support]
Address    Access  R/W   Size  Description
0x00           SL  R/O      1  Log Directory
0x80-0x9f      SL  R/W     16  Host vendor specific log
0xa0-0xbf      SL  VS      16  Device vendor specific log

SMART Extended Comprehensive Error Log (GP Log 0x03) not supported

SMART Error Log not supported

SMART Extended Self-test Log (GP Log 0x07) not supported

SMART Self-test Log not supported

Read SMART Selective Self-test Log failed: request failed, error code 0x05

SCT Commands not supported

Device Statistics (GP Log 0x04) not supported

SATA Phy Event Counters (GP Log 0x11) not supported
