smartctl 7.1 2020-04-05 r5049 [x86_64-linux-5.15.8-1.el8.elrepo.x86_64] (local build)
Copyright (C) 2002-19, Bruce Allen, Christian Franke, www.smartmontools.org

=== START OF INFORMATION SECTION ===
Model Family:     Western Digital Ultrastar DC HC550
Device Model:     WUH721818ALE6L4
Serial Number:    5DG7W4MJ
LU WWN Device Id: 5 000cca 2b9c39483
Add. Product Id:  202211
Firmware Version: PCGAW660
User Capacity:    18,000,207,937,536 bytes [18.0 TB]
Sector Size:      4096 bytes logical/physical
Rotation Rate:    7200 rpm
Form Factor:      3.5 inches
Device is:        In smartctl database [for details use: -P show]
ATA Version is:   ACS-4 published, ANSI INCITS 529-2018
SATA Version is:  SATA 3.3, 6.0 Gb/s (current: 3.0 Gb/s)
Local Time is:    Tue Oct 11 16:42:02 2022 CEST
SMART support is: Available - device has SMART capability.
SMART support is: Enabled

=== START OF READ SMART DATA SECTION ===
SMART overall-health self-assessment test result: PASSED

General SMART Values:
Offline data collection status:  (0x80)	Offline data collection activity
					was never started.
					Auto Offline Data Collection: Enabled.
Self-test execution status:      (   0)	The previous self-test routine completed
					without error or no self-test has ever 
					been run.
Total time to complete Offline 
data collection: 		(  101) seconds.
Offline data collection
capabilities: 			 (0x5b) SMART execute Offline immediate.
					Auto Offline data collection on/off support.
					Suspend Offline collection upon new
					command.
					Offline surface scan supported.
					Self-test supported.
					No Conveyance Self-test supported.
					Selective Self-test supported.
SMART capabilities:            (0x0003)	Saves SMART data before entering
					power-saving mode.
					Supports SMART auto save timer.
Error logging capability:        (0x01)	Error logging supported.
					General Purpose Logging supported.
Short self-test routine 
recommended polling time: 	 (   2) minutes.
Extended self-test routine
recommended polling time: 	 (1927) minutes.
SCT capabilities: 	       (0x003d)	SCT Status supported.
					SCT Error Recovery Control supported.
					SCT Feature Control supported.
					SCT Data Table supported.

SMART Attributes Data Structure revision number: 16
Vendor Specific SMART Attributes with Thresholds:
ID# ATTRIBUTE_NAME          FLAG     VALUE WORST THRESH TYPE      UPDATED  WHEN_FAILED RAW_VALUE
  1 Raw_Read_Error_Rate     0x000b   100   100   001    Pre-fail  Always       -       0
  2 Throughput_Performance  0x0005   100   100   054    Pre-fail  Offline      -       0
  3 Spin_Up_Time            0x0007   082   082   001    Pre-fail  Always       -       358 (Average 359)
  4 Start_Stop_Count        0x0012   100   100   000    Old_age   Always       -       13
  5 Reallocated_Sector_Ct   0x0033   100   100   001    Pre-fail  Always       -       0
  7 Seek_Error_Rate         0x000b   100   100   001    Pre-fail  Always       -       0
  8 Seek_Time_Performance   0x0005   100   100   020    Pre-fail  Offline      -       0
  9 Power_On_Hours          0x0012   100   100   000    Old_age   Always       -       26
 10 Spin_Retry_Count        0x0013   100   100   001    Pre-fail  Always       -       0
 12 Power_Cycle_Count       0x0032   100   100   000    Old_age   Always       -       10
 22 Helium_Level            0x0023   100   100   025    Pre-fail  Always       -       100
 82 Unknown_Attribute       0x0022   100   100   000    Old_age   Always       -       255
184 End-to-End_Error        0x0033   100   100   097    Pre-fail  Always       -       0
188 Command_Timeout         0x0032   096   096   000    Old_age   Always       -       4
192 Power-Off_Retract_Count 0x0032   100   100   000    Old_age   Always       -       20
193 Load_Cycle_Count        0x0012   100   100   000    Old_age   Always       -       20
194 Temperature_Celsius     0x0002   064   064   000    Old_age   Always       -       31 (Min/Max 23/47)
196 Reallocated_Event_Count 0x0032   100   100   000    Old_age   Always       -       0
197 Current_Pending_Sector  0x0022   100   100   000    Old_age   Always       -       0
198 Offline_Uncorrectable   0x0008   100   100   000    Old_age   Offline      -       0
199 UDMA_CRC_Error_Count    0x000a   100   100   000    Old_age   Always       -       1
241 Total_LBAs_Written      0x0012   100   100   000    Old_age   Always       -       258361234
242 Total_LBAs_Read         0x0012   100   100   000    Old_age   Always       -       16261

SMART Error Log Version: 1
ATA Error Count: 1
	CR = Command Register [HEX]
	FR = Features Register [HEX]
	SC = Sector Count Register [HEX]
	SN = Sector Number Register [HEX]
	CL = Cylinder Low Register [HEX]
	CH = Cylinder High Register [HEX]
	DH = Device/Head Register [HEX]
	DC = Device Command Register [HEX]
	ER = Error register [HEX]
	ST = Status register [HEX]
Powered_Up_Time is measured from power on, and printed as
DDd+hh:mm:SS.sss where DD=days, hh=hours, mm=minutes,
SS=sec, and sss=millisec. It "wraps" after 49.710 days.

Error 1 occurred at disk power-on lifetime: 8 hours (0 days + 8 hours)
  When the command that caused the error occurred, the device was active or idle.

  After command completion occurred, registers were:
  ER ST SC SN CL CH DH
  -- -- -- -- -- -- --
  84 43 00 00 00 00 00  Error: ICRC, ABRT at LBA = 0x00000000 = 0

  Commands leading to the command that caused the error were:
  CR FR SC SN CL CH DH DC   Powered_Up_Time  Command/Feature_Name
  -- -- -- -- -- -- -- --  ----------------  --------------------
  60 00 60 00 00 00 40 08      00:01:39.962  READ FPDMA QUEUED
  ec 00 01 00 00 00 00 08      00:01:34.025  IDENTIFY DEVICE
  ec 00 01 00 00 00 00 08      00:01:34.025  IDENTIFY DEVICE
  2f 00 01 2f 00 00 e0 08      00:01:18.152  READ LOG EXT
  2f 00 01 00 00 00 e0 08      00:01:18.152  READ LOG EXT

SMART Self-test log structure revision number 1
No self-tests have been logged.  [To run self-tests, use: smartctl -t]

SMART Selective self-test log data structure revision number 1
 SPAN  MIN_LBA  MAX_LBA  CURRENT_TEST_STATUS
    1        0        0  Not_testing
    2        0        0  Not_testing
    3        0        0  Not_testing
    4        0        0  Not_testing
    5        0        0  Not_testing
Selective self-test flags (0x0):
  After scanning selected spans, do NOT read-scan remainder of disk.
If Selective self-test is pending on power-up, resume after 0 minute delay.

