smartctl 7.2 2020-12-30 r5155 [x86_64-linux-5.19.0-32-generic] (local build)
Copyright (C) 2002-20, Bruce Allen, Christian Franke, www.smartmontools.org

=== START OF INFORMATION SECTION ===
Device Model:     SAMSUNG HD322GJ
Firmware Version: 1AR10001
User Capacity:    320 072 933 376 bytes [320 GB]
Sector Size:      512 bytes logical/physical
Rotation Rate:    7200 rpm
Form Factor:      3.5 inches
Device is:        Not in smartctl database [for details use: -P showall]
ATA Version is:   ATA8-ACS T13/1699-D revision 6
SATA Version is:  SATA 2.6, 3.0 Gb/s
Local Time is:    Wed Sep 13 01:29:49 2023 CEST
SMART support is: Available - device has SMART capability.
SMART support is: Enabled
AAM feature is:   Disabled
APM feature is:   Disabled
Rd look-ahead is: Enabled
Write cache is:   Enabled
DSN feature is:   Unavailable
ATA Security is:  Disabled, NOT FROZEN [SEC1]
Write SCT (Get) Feature Control Command failed: Read of ATA output registers not implemented [JMicron]
Wt Cache Reorder: Unknown (SCT Feature Control command failed)

=== START OF READ SMART DATA SECTION ===
SMART overall-health self-assessment test result: PASSED

General SMART Values:
Offline data collection status:  (0x00)	Offline data collection activity
					was never started.
					Auto Offline Data Collection: Disabled.
Self-test execution status:      (   0)	The previous self-test routine completed
					without error or no self-test has ever 
					been run.
Total time to complete Offline 
data collection: 		( 2880) seconds.
Offline data collection
capabilities: 			 (0x5b) SMART execute Offline immediate.
					Auto Offline data collection on/off support.
					Suspend Offline collection upon new
					command.
					Offline surface scan supported.
					Self-test supported.
					No Conveyance Self-test supported.
					Selective Self-test supported.
SMART capabilities:            (0x0003)	Saves SMART data before entering
					power-saving mode.
					Supports SMART auto save timer.
Error logging capability:        (0x01)	Error logging supported.
					General Purpose Logging supported.
Short self-test routine 
recommended polling time: 	 (   2) minutes.
Extended self-test routine
recommended polling time: 	 (  48) minutes.
SCT capabilities: 	       (0x003f)	SCT Status supported.
					SCT Error Recovery Control supported.
					SCT Feature Control supported.
					SCT Data Table supported.

SMART Attributes Data Structure revision number: 16
Vendor Specific SMART Attributes with Thresholds:
ID# ATTRIBUTE_NAME          FLAGS    VALUE WORST THRESH FAIL RAW_VALUE
  1 Raw_Read_Error_Rate     POSR-K   100   100   051    -    104
  2 Throughput_Performance  -OS--K   053   053   000    -    2808
  3 Spin_Up_Time            PO---K   074   073   025    -    8042
  4 Start_Stop_Count        -O--CK   096   096   000    -    4807
  5 Reallocated_Sector_Ct   PO--CK   252   252   010    -    0
  7 Seek_Error_Rate         -OSR-K   252   252   051    -    0
  8 Seek_Time_Performance   --S--K   252   252   015    -    0
  9 Power_On_Hours          -O--CK   100   100   000    -    80863
 10 Spin_Retry_Count        -O--CK   252   252   051    -    0
 11 Calibration_Retry_Count -O--CK   252   252   000    -    0
 12 Power_Cycle_Count       -O--CK   100   100   000    -    759
191 G-Sense_Error_Rate      -O---K   100   100   000    -    6660
192 Power-Off_Retract_Count -O---K   252   252   000    -    0
194 Temperature_Celsius     -O----   064   055   000    -    35 (Min/Max -3/45)
195 Hardware_ECC_Recovered  -O-RCK   100   100   000    -    0
196 Reallocated_Event_Count -O--CK   252   252   000    -    0
197 Current_Pending_Sector  -O--CK   252   100   000    -    0
198 Offline_Uncorrectable   ----CK   252   252   000    -    0
199 UDMA_CRC_Error_Count    -OS-CK   100   100   000    -    1
200 Multi_Zone_Error_Rate   -O-R-K   100   100   000    -    46
223 Load_Retry_Count        -O--CK   252   252   000    -    0
225 Load_Cycle_Count        -O--CK   100   100   000    -    4955
                            ||||||_ K auto-keep
                            |||||__ C event count
                            ||||___ R error rate
                            |||____ S speed/performance
                            ||_____ O updated online
                            |______ P prefailure warning

ATA_READ_LOG_EXT (addr=0x00:0x00, page=0, n=1) failed: 48-bit ATA commands not implemented [JMicron]
Read GP Log Directory failed

SMART Log Directory Version 1 [multi-sector log support]
Address    Access  R/W   Size  Description
0x00           SL  R/O      1  Log Directory
0x01           SL  R/O      1  Summary SMART error log
0x02           SL  R/O      2  Comprehensive SMART error log
0x06           SL  R/O      1  SMART self-test log
0x09           SL  R/W      1  Selective self-test log
0x80-0x9f      SL  R/W     16  Host vendor specific log
0xe0           SL  R/W      1  SCT Command/Status
0xe1           SL  R/W      1  SCT Data Transfer

SMART Extended Comprehensive Error Log (GP Log 0x03) not supported

SMART Error Log Version: 1
ATA Error Count: 9 (device log contains only the most recent five errors)
	CR = Command Register [HEX]
	FR = Features Register [HEX]
	SC = Sector Count Register [HEX]
	SN = Sector Number Register [HEX]
	CL = Cylinder Low Register [HEX]
	CH = Cylinder High Register [HEX]
	DH = Device/Head Register [HEX]
	DC = Device Command Register [HEX]
	ER = Error register [HEX]
	ST = Status register [HEX]
Powered_Up_Time is measured from power on, and printed as
DDd+hh:mm:SS.sss where DD=days, hh=hours, mm=minutes,
SS=sec, and sss=millisec. It "wraps" after 49.710 days.

Error 9 occurred at disk power-on lifetime: 33869 hours (1411 days + 5 hours)
  When the command that caused the error occurred, the device was active or idle.

  After command completion occurred, registers were:
  ER ST SC SN CL CH DH
  -- -- -- -- -- -- --
  40 51 06 ca 16 27 e3  Error: UNC 6 sectors at LBA = 0x032716ca = 52893386

  Commands leading to the command that caused the error were:
  CR FR SC SN CL CH DH DC   Powered_Up_Time  Command/Feature_Name
  -- -- -- -- -- -- -- --  ----------------  --------------------
  c8 00 08 c8 16 27 e3 00      00:00:00.688  READ DMA
  27 00 00 00 00 00 e0 00      00:00:00.688  READ NATIVE MAX ADDRESS EXT [OBS-ACS-3]
  ec 00 00 00 00 00 a0 00      00:00:00.688  IDENTIFY DEVICE
  ef 03 42 00 00 00 a0 00      00:00:00.688  SET FEATURES [Set transfer mode]
  27 00 00 00 00 00 e0 00      00:00:00.688  READ NATIVE MAX ADDRESS EXT [OBS-ACS-3]

Error 8 occurred at disk power-on lifetime: 33869 hours (1411 days + 5 hours)
  When the command that caused the error occurred, the device was active or idle.

  After command completion occurred, registers were:
  ER ST SC SN CL CH DH
  -- -- -- -- -- -- --
  40 51 06 ca 16 27 e3  Error: UNC 6 sectors at LBA = 0x032716ca = 52893386

  Commands leading to the command that caused the error were:
  CR FR SC SN CL CH DH DC   Powered_Up_Time  Command/Feature_Name
  -- -- -- -- -- -- -- --  ----------------  --------------------
  c8 00 08 c8 16 27 e3 00      00:00:00.686  READ DMA
  c8 00 00 00 17 27 e3 00      00:00:00.686  READ DMA
  27 00 00 00 00 00 e0 00      00:00:00.686  READ NATIVE MAX ADDRESS EXT [OBS-ACS-3]
  ec 00 00 00 00 00 a0 00      00:00:00.686  IDENTIFY DEVICE
  ef 03 42 00 00 00 a0 00      00:00:00.686  SET FEATURES [Set transfer mode]

Error 7 occurred at disk power-on lifetime: 33869 hours (1411 days + 5 hours)
  When the command that caused the error occurred, the device was active or idle.

  After command completion occurred, registers were:
  ER ST SC SN CL CH DH
  -- -- -- -- -- -- --
  40 51 36 ca 16 27 e3  Error: UNC 54 sectors at LBA = 0x032716ca = 52893386

  Commands leading to the command that caused the error were:
  CR FR SC SN CL CH DH DC   Powered_Up_Time  Command/Feature_Name
  -- -- -- -- -- -- -- --  ----------------  --------------------
  c8 00 00 00 16 27 e3 00      00:00:00.684  READ DMA
  c8 00 00 00 15 27 e3 00      00:00:00.684  READ DMA
  c8 00 00 00 14 27 e3 00      00:00:00.684  READ DMA
  c8 00 00 00 13 27 e3 00      00:00:00.684  READ DMA
  c8 00 00 00 12 27 e3 00      00:00:00.684  READ DMA

Error 6 occurred at disk power-on lifetime: 33571 hours (1398 days + 19 hours)
  When the command that caused the error occurred, the device was active or idle.

  After command completion occurred, registers were:
  ER ST SC SN CL CH DH
  -- -- -- -- -- -- --
  40 51 01 ca 16 27 e3  Error: UNC 1 sectors at LBA = 0x032716ca = 52893386

  Commands leading to the command that caused the error were:
  CR FR SC SN CL CH DH DC   Powered_Up_Time  Command/Feature_Name
  -- -- -- -- -- -- -- --  ----------------  --------------------
  c8 00 01 ca 16 27 e3 00      00:01:25.539  READ DMA
  27 00 00 00 00 00 e0 00      00:01:25.539  READ NATIVE MAX ADDRESS EXT [OBS-ACS-3]
  ec 00 00 00 00 00 a0 00      00:01:25.539  IDENTIFY DEVICE
  ef 03 42 00 00 00 a0 00      00:01:25.539  SET FEATURES [Set transfer mode]
  27 00 00 00 00 00 e0 00      00:01:25.539  READ NATIVE MAX ADDRESS EXT [OBS-ACS-3]

Error 5 occurred at disk power-on lifetime: 33571 hours (1398 days + 19 hours)
  When the command that caused the error occurred, the device was active or idle.

  After command completion occurred, registers were:
  ER ST SC SN CL CH DH
  -- -- -- -- -- -- --
  40 51 06 ca 16 27 e3  Error: UNC 6 sectors at LBA = 0x032716ca = 52893386

  Commands leading to the command that caused the error were:
  CR FR SC SN CL CH DH DC   Powered_Up_Time  Command/Feature_Name
  -- -- -- -- -- -- -- --  ----------------  --------------------
  c8 00 06 ca 16 27 e3 00      00:01:25.538  READ DMA
  c8 00 01 c9 16 27 e3 00      00:01:25.538  READ DMA
  c8 00 01 c8 16 27 e3 00      00:01:25.537  READ DMA
  c8 00 06 c2 16 27 e3 00      00:01:25.537  READ DMA
  c8 00 01 c1 16 27 e3 00      00:01:25.537  READ DMA

SMART Extended Self-test Log (GP Log 0x07) not supported

SMART Self-test log structure revision number 1
Num  Test_Description    Status                  Remaining  LifeTime(hours)  LBA_of_first_error
# 1  Short offline       Completed without error       00%     15327         -
# 2  Extended offline    Completed without error       00%     15327         -

SMART Selective self-test log data structure revision number 0
Note: revision number not 1 implies that no selective self-test has ever been run
 SPAN  MIN_LBA  MAX_LBA  CURRENT_TEST_STATUS
    1        0        0  Completed [00% left] (0-65535)
    2        0        0  Not_testing
    3        0        0  Not_testing
    4        0        0  Not_testing
    5        0        0  Not_testing
Selective self-test flags (0x0):
  After scanning selected spans, do NOT read-scan remainder of disk.
If Selective self-test is pending on power-up, resume after 0 minute delay.

SCT Status Version:                  2
SCT Version (vendor specific):       256 (0x0100)
Device State:                        Active (0)
Current Temperature:                    35 Celsius
Power Cycle Min/Max Temperature:     20/35 Celsius
Lifetime    Min/Max Temperature:     -2/45 Celsius
Specified Max Operating Temperature:    80 Celsius
Under/Over Temperature Limit Count:   0/0

SCT Temperature History Version:     2
Temperature Sampling Period:         5 minutes
Temperature Logging Interval:        5 minutes
Min/Max recommended Temperature:     -5/80 Celsius
Min/Max Temperature Limit:           -10/85 Celsius
Temperature History Size (Index):    128 (34)

Index    Estimated Time   Temperature Celsius
  35    2023-09-12 14:50    35  ****************
  36    2023-09-12 14:55    32  *************
 ...    ..( 34 skipped).    ..  *************
  71    2023-09-12 17:50    32  *************
  72    2023-09-12 17:55    31  ************
  73    2023-09-12 18:00    31  ************
  74    2023-09-12 18:05    31  ************
  75    2023-09-12 18:10    32  *************
 ...    ..( 64 skipped).    ..  *************
  12    2023-09-12 23:35    32  *************
  13    2023-09-12 23:40    33  **************
  14    2023-09-12 23:45    33  **************
  15    2023-09-12 23:50    36  *****************
  16    2023-09-12 23:55    35  ****************
  17    2023-09-13 00:00    34  ***************
  18    2023-09-13 00:05    23  ****
  19    2023-09-13 00:10    25  ******
  20    2023-09-13 00:15    27  ********
  21    2023-09-13 00:20    29  **********
  22    2023-09-13 00:25    30  ***********
  23    2023-09-13 00:30    32  *************
  24    2023-09-13 00:35    33  **************
  25    2023-09-13 00:40    34  ***************
  26    2023-09-13 00:45    34  ***************
  27    2023-09-13 00:50    35  ****************
 ...    ..(  2 skipped).    ..  ****************
  30    2023-09-13 01:05    35  ****************
  31    2023-09-13 01:10    34  ***************
  32    2023-09-13 01:15    34  ***************
  33    2023-09-13 01:20    33  **************
  34    2023-09-13 01:25    35  ****************

Write SCT (Get) Error Recovery Control Command failed: Read of ATA output registers not implemented [JMicron]
SCT (Get) Error Recovery Control command failed

Device Statistics (GP/SMART Log 0x04) not supported

Pending Defects log (GP Log 0x0c) not supported

ATA_READ_LOG_EXT (addr=0x11:0x00, page=0, n=1) failed: 48-bit ATA commands not implemented [JMicron]
Read SATA Phy Event Counters failed

