C:\>smartctl -a /dev/sdb
smartctl 7.4 2023-08-01 r5530 [x86_64-w64-mingw32-w11-22H2] (sf-7.4-1)
Copyright (C) 2002-23, Bruce Allen, Christian Franke, www.smartmontools.org

=== START OF INFORMATION SECTION ===
Model Family:     Swissbit X-8x Family SATA SSD
Device Model:     SFSA010GM1AO1TO-I-5S-11P-STD
Serial Number:    000099005146EF000000
Firmware Version: AOR20008
User Capacity:    10'012'778'496 bytes [10.0 GB]
Sector Size:      512 bytes logical/physical
Rotation Rate:    Solid State Device
TRIM Command:     Available, deterministic, zeroed
Device is:        In smartctl database 7.3/5528
ATA Version is:   ACS-4 (minor revision not indicated)
SATA Version is:  SATA 3.3, 6.0 Gb/s (current: 6.0 Gb/s)
Local Time is:    Tue Apr 09 10:25:59 2024 MS
SMART support is: Available - device has SMART capability.
SMART support is: Enabled

=== START OF READ SMART DATA SECTION ===
SMART overall-health self-assessment test result: PASSED

General SMART Values:
Offline data collection status:  (0x00) Offline data collection activity
                                        was never started.
                                        Auto Offline Data Collection: Disabled.
Total time to complete Offline
data collection:                (    0) seconds.
Offline data collection
capabilities:                    (0x00)         Offline data collection not supported.
SMART capabilities:            (0x0003) Saves SMART data before entering
                                        power-saving mode.
                                        Supports SMART auto save timer.
Error logging capability:        (0x00) Error logging supported.
                                        General Purpose Logging supported.

SMART Attributes Data Structure revision number: 16
Vendor Specific SMART Attributes with Thresholds:
ID# ATTRIBUTE_NAME          FLAG     VALUE WORST THRESH TYPE      UPDATED  WHEN_FAILED RAW_VALUE
196 Total_Spare_Block_Cnt   0x0013   100   100   025    Pre-fail  Always       -       9026142746
213 Spare_Block_Cnt_Worst   0x0013   100   100   025    Pre-fail  Always       -       9026142746
229 Total_Flash_Block_Erases0x0012   100   100   001    Old_age   Always       -       0
248 Remaining_Life          0x0002   100   100   000    Old_age   Always       -       100
  9 Power_On_Hours          0x0002   100   100   000    Old_age   Always       -       0
198 Offline_Uncorrectable   0x001a   100   100   000    Old_age   Always       -       0
169 Power_On_Data_Repairs   0x001a   100   100   000    Old_age   Always       -       0
195 Hardware_ECC_Recovered  0x0012   100   100   000    Old_age   Always       -       0
200 SATA_COM_Reset          0x0012   100   100   000    Old_age   Always       -       7
168 Rated_Erase_Count       0x0000   100   100   000    Old_age   Offline      -       20000
167 Average_Erase_Count     0x0012   100   100   000    Old_age   Always       -       0
165 Maximum_Erase_Count     0x0012   100   100   000    Old_age   Always       -       1
199 UDMA_CRC_Error_Count    0x001a   100   100   000    Old_age   Always       -       0
232 Total_Read_Cnt          0x0012   100   100   000    Old_age   Always       -       1980
 12 Power_Cycle_Count       0x0012   100   100   000    Old_age   Always       -       8
241 Total_Host_LBA_Written  0x0012   100   100   000    Old_age   Always       -       0
242 Total_Host_LBA_Read     0x0012   100   100   000    Old_age   Always       -       0
215 Trim_Status             0x0002   100   100   000    Old_age   Always       -       0
194 Temperature_Celsius     0x0002   028   035   000    Old_age   Always       -       28 (Min/Max 26/35)
184 End-to-End_Error        0x001a   100   100   000    Old_age   Always       -       0
185 E2E_ErrCnt_SATA-Flash   0x001a   100   100   000    Old_age   Always       -       0

SMART Error Log Version: 1
No Errors Logged

SMART Self-test Log not supported

Selective Self-tests/Logging not supported

The above only provides legacy SMART information - try 'smartctl -x' for more