smartctl 7.2 2021-09-14 r5236 [FreeBSD 13.1-RELEASE-p9 amd64] (local build)
Copyright (C) 2002-20, Bruce Allen, Christian Franke, www.smartmontools.org

=== START OF INFORMATION SECTION ===
Model Number:                       KIOXIA KCD81RUG1T92
Serial Number:                      13B0A04TTLXJ
Firmware Version:                   0103
PCI Vendor/Subsystem ID:            0x1e0f
IEEE OUI Identifier:                0x8ce38e
Total NVM Capacity:                 1,920,383,410,176 [1.92 TB]
Unallocated NVM Capacity:           0
Controller ID:                      1
NVMe Version:                       1.4
Number of Namespaces:               64
Local Time is:                      Wed Nov 29 13:00:26 2023 CET
Firmware Updates (0x16):            3 Slots, no Reset required
Optional Admin Commands (0x025f):   Security Format Frmw_DL NS_Mngmt Self_Test MI_Snd/Rec Get_LBA_Sts
Optional NVM Commands (0x00ff):     Comp Wr_Unc DS_Mngmt Wr_Zero Sav/Sel_Feat Resv Timestmp Verify
Log Page Attributes (0x1e):         Cmd_Eff_Lg Ext_Get_Lg Telmtry_Lg Pers_Ev_Lg
Maximum Data Transfer Size:         1024 Pages
Warning  Comp. Temp. Threshold:     77 Celsius
Critical Comp. Temp. Threshold:     85 Celsius

Supported Power States
St Op     Max   Active     Idle   RL RT WL WT  Ent_Lat  Ex_Lat
 0 +    25.00W   25.00W       -    0  0  0  0   500000  500000
 1 +    12.00W   12.00W       -    1  1  1  1   500000  500000

=== START OF SMART DATA SECTION ===
SMART overall-health self-assessment test result: PASSED

SMART/Health Information (NVMe Log 0x02)
Critical Warning:                   0x00
Temperature:                        38 Celsius
Available Spare:                    100%
Available Spare Threshold:          8%
Percentage Used:                    0%
Data Units Read:                    11,947,984 [6.11 TB]
Data Units Written:                 44,824,848 [22.9 TB]
Host Read Commands:                 686,226,565
Host Write Commands:                2,623,358,929
Controller Busy Time:               2,068
Power Cycles:                       42
Power On Hours:                     738
Unsafe Shutdowns:                   34
Media and Data Integrity Errors:    0
Error Information Log Entries:      0
Warning  Comp. Temperature Time:    0
Critical Comp. Temperature Time:    0

Error Information (NVMe Log 0x01, 16 of 256 entries)
No Errors Logged

