smartctl 5.43 2012-06-30 r3573 [x86_64-linux-2.6.32-431.20.3.el6.x86_64] (local
build)
Copyright (C) 2002-12 by Bruce Allen, http://smartmontools.sourceforge.net

=== START OF INFORMATION SECTION ===
Device Model:     WDC WD1005VBYZ-02RRWB2
Serial Number:    WD-WMC6M0HAK2F3
LU WWN Device Id: 5 0014ee 059b08df6
Firmware Version: RR07
User Capacity:    1,000,204,886,016 bytes [1.00 TB]
Sector Size:      512 bytes logical/physical
Device is:        Not in smartctl database [for details use: -P showall]
ATA Version is:   8
ATA Standard is:  ACS-3 (unknown minor revision code: 0x006d)
Local Time is:    Wed Sep 27 23:26:02 2017 HKT
SMART support is: Available - device has SMART capability.
SMART support is: Enabled
AAM feature is:   Unavailable
APM level is:     96 (intermediate level with standby)
Rd look-ahead is: Enabled
Write cache is:   Enabled
ATA Security is:  Disabled, NOT FROZEN [SEC1]

=== START OF READ SMART DATA SECTION ===
SMART overall-health self-assessment test result: PASSED

General SMART Values:
Offline data collection status:  (0x00) Offline data collection activity
                                        was never started.
                                        Auto Offline Data Collection: Disabled.
Self-test execution status:      (   0) The previous self-test routine completed
                                        without error or no self-test has ever
                                        been run.
Total time to complete Offline
data collection:                (    0) seconds.
Offline data collection
capabilities:                    (0x7b) SMART execute Offline immediate.
                                        Auto Offline data collection on/off supp
ort.
                                        Suspend Offline collection upon new
                                        command.
                                        Offline surface scan supported.
                                        Self-test supported.
                                        Conveyance Self-test supported.
                                        Selective Self-test supported.
SMART capabilities:            (0x0003) Saves SMART data before entering
                                        power-saving mode.
                                        Supports SMART auto save timer.
Error logging capability:        (0x01) Error logging supported.
                                        General Purpose Logging supported.
Short self-test routine
recommended polling time:        (   2) minutes.
Extended self-test routine
recommended polling time:        ( 106) minutes.
Conveyance self-test routine
recommended polling time:        (   5) minutes.
SCT capabilities:              (0x203d) SCT Status supported.
                                        SCT Error Recovery Control supported.
                                        SCT Feature Control supported.
                                        SCT Data Table supported.

SMART Attributes Data Structure revision number: 16
Vendor Specific SMART Attributes with Thresholds:
ID# ATTRIBUTE_NAME          FLAGS    VALUE WORST THRESH FAIL RAW_VALUE
  1 Raw_Read_Error_Rate     POSR-K   100   253   051    -    0
  3 Spin_Up_Time            POS--K   100   253   021    -    0
  4 Start_Stop_Count        -O--CK   100   100   000    -    1
  5 Reallocated_Sector_Ct   PO--CK   200   200   140    -    0
  7 Seek_Error_Rate         -OSR-K   100   200   000    -    0
  9 Power_On_Hours          -O--CK   100   100   000    -    5
 10 Spin_Retry_Count        -O--CK   100   253   000    -    0
 11 Calibration_Retry_Count -O--CK   100   253   000    -    0
 12 Power_Cycle_Count       -O--CK   100   100   000    -    1
 16 Unknown_Attribute       -O---K   000   200   000    -    1954236630
183 Runtime_Bad_Block       -O--CK   100   100   000    -    0
192 Power-Off_Retract_Count -O--CK   200   200   000    -    0
193 Load_Cycle_Count        -O--CK   200   200   000    -    1
194 Temperature_Celsius     -O---K   113   113   000    -    30
196 Reallocated_Event_Count -O--CK   200   200   000    -    0
197 Current_Pending_Sector  -O--CK   200   200   000    -    0
198 Offline_Uncorrectable   ----CK   100   253   000    -    0
199 UDMA_CRC_Error_Count    -O--CK   200   200   000    -    0
200 Multi_Zone_Error_Rate   ---R--   100   253   000    -    0
                            ||||||_ K auto-keep
                            |||||__ C event count
                            ||||___ R error rate
                            |||____ S speed/performance
                            ||_____ O updated online
                            |______ P prefailure warning

General Purpose Log Directory Version 1
SMART           Log Directory Version 1 [multi-sector log support]
GP/S  Log at address 0x00 has    1 sectors [Log Directory]
SMART Log at address 0x01 has    1 sectors [Summary SMART error log]
SMART Log at address 0x02 has    5 sectors [Comprehensive SMART error log]
GP    Log at address 0x03 has    6 sectors [Ext. Comprehensive SMART error log]
GP/S  Log at address 0x04 has    8 sectors [Device Statistics log]
SMART Log at address 0x06 has    1 sectors [SMART self-test log]
GP    Log at address 0x07 has    1 sectors [Extended self-test log]
GP    Log at address 0x08 has    2 sectors [Power Conditions log]
SMART Log at address 0x09 has    1 sectors [Selective self-test log]
GP    Log at address 0x0a has    8 sectors [Reserved]
GP    Log at address 0x0c has  113 sectors [Reserved]
GP/S  Log at address 0x0d has    8 sectors [LPS Mis-alignment log]
GP    Log at address 0x10 has    1 sectors [NCQ Command Error log]
GP    Log at address 0x11 has    1 sectors [SATA Phy Event Counters]
GP    Log at address 0x13 has    1 sectors [SATA NCQ Send and Receive log]
GP    Log at address 0x24 has  192 sectors [Current Device Internal Status Data
log]
GP/S  Log at address 0x30 has    9 sectors [IDENTIFY DEVICE data log]
GP/S  Log at address 0x80 has   16 sectors [Host vendor specific log]
GP/S  Log at address 0x81 has   16 sectors [Host vendor specific log]
GP/S  Log at address 0x82 has   16 sectors [Host vendor specific log]
GP/S  Log at address 0x83 has   16 sectors [Host vendor specific log]
GP/S  Log at address 0x84 has   16 sectors [Host vendor specific log]
GP/S  Log at address 0x85 has   16 sectors [Host vendor specific log]
GP/S  Log at address 0x86 has   16 sectors [Host vendor specific log]
GP/S  Log at address 0x87 has   16 sectors [Host vendor specific log]
GP/S  Log at address 0x88 has   16 sectors [Host vendor specific log]
GP/S  Log at address 0x89 has   16 sectors [Host vendor specific log]
GP/S  Log at address 0x8a has   16 sectors [Host vendor specific log]
GP/S  Log at address 0x8b has   16 sectors [Host vendor specific log]
GP/S  Log at address 0x8c has   16 sectors [Host vendor specific log]
GP/S  Log at address 0x8d has   16 sectors [Host vendor specific log]
GP/S  Log at address 0x8e has   16 sectors [Host vendor specific log]
GP/S  Log at address 0x8f has   16 sectors [Host vendor specific log]
GP/S  Log at address 0x90 has   16 sectors [Host vendor specific log]
GP/S  Log at address 0x91 has   16 sectors [Host vendor specific log]
GP/S  Log at address 0x92 has   16 sectors [Host vendor specific log]
GP/S  Log at address 0x93 has   16 sectors [Host vendor specific log]
GP/S  Log at address 0x94 has   16 sectors [Host vendor specific log]
GP/S  Log at address 0x95 has   16 sectors [Host vendor specific log]
GP/S  Log at address 0x96 has   16 sectors [Host vendor specific log]
GP/S  Log at address 0x97 has   16 sectors [Host vendor specific log]
GP/S  Log at address 0x98 has   16 sectors [Host vendor specific log]
GP/S  Log at address 0x99 has   16 sectors [Host vendor specific log]
GP/S  Log at address 0x9a has   16 sectors [Host vendor specific log]
GP/S  Log at address 0x9b has   16 sectors [Host vendor specific log]
GP/S  Log at address 0x9c has   16 sectors [Host vendor specific log]
GP/S  Log at address 0x9d has   16 sectors [Host vendor specific log]
GP/S  Log at address 0x9e has   16 sectors [Host vendor specific log]
GP/S  Log at address 0x9f has   16 sectors [Host vendor specific log]
GP/S  Log at address 0xa0 has   16 sectors [Device vendor specific log]
GP/S  Log at address 0xa1 has   16 sectors [Device vendor specific log]
GP/S  Log at address 0xa2 has   16 sectors [Device vendor specific log]
GP/S  Log at address 0xa3 has   16 sectors [Device vendor specific log]
GP/S  Log at address 0xa4 has   16 sectors [Device vendor specific log]
GP/S  Log at address 0xa5 has   16 sectors [Device vendor specific log]
GP/S  Log at address 0xa6 has   16 sectors [Device vendor specific log]
GP/S  Log at address 0xa7 has   16 sectors [Device vendor specific log]
GP/S  Log at address 0xa8 has   16 sectors [Device vendor specific log]
GP/S  Log at address 0xa9 has   16 sectors [Device vendor specific log]
GP/S  Log at address 0xaa has   16 sectors [Device vendor specific log]
GP/S  Log at address 0xab has   16 sectors [Device vendor specific log]
GP/S  Log at address 0xac has   16 sectors [Device vendor specific log]
GP/S  Log at address 0xad has   16 sectors [Device vendor specific log]
GP/S  Log at address 0xae has   16 sectors [Device vendor specific log]
GP/S  Log at address 0xaf has   16 sectors [Device vendor specific log]
GP/S  Log at address 0xb0 has   16 sectors [Device vendor specific log]
GP/S  Log at address 0xb1 has   16 sectors [Device vendor specific log]
GP/S  Log at address 0xb2 has   16 sectors [Device vendor specific log]
GP/S  Log at address 0xb3 has   16 sectors [Device vendor specific log]
GP/S  Log at address 0xb4 has   16 sectors [Device vendor specific log]
GP/S  Log at address 0xb5 has   16 sectors [Device vendor specific log]
GP/S  Log at address 0xb6 has   16 sectors [Device vendor specific log]
GP/S  Log at address 0xb7 has   39 sectors [Device vendor specific log]
GP/S  Log at address 0xc0 has    1 sectors [Device vendor specific log]
GP/S  Log at address 0xe0 has    1 sectors [SCT Command/Status]
GP/S  Log at address 0xe1 has    1 sectors [SCT Data Transfer]

SMART Extended Comprehensive Error Log Version: 1 (6 sectors)
No Errors Logged

SMART Extended Self-test Log Version: 1 (1 sectors)
Num  Test_Description    Status                  Remaining  LifeTime(hours)  LBA
_of_first_error
# 1  Short offline       Completed without error       00%         5         -

SMART Selective self-test log data structure revision number 1
 SPAN  MIN_LBA  MAX_LBA  CURRENT_TEST_STATUS
    1        0        0  Not_testing
    2        0        0  Not_testing
    3        0        0  Not_testing
    4        0        0  Not_testing
    5        0        0  Not_testing
Selective self-test flags (0x0):
  After scanning selected spans, do NOT read-scan remainder of disk.
If Selective self-test is pending on power-up, resume after 0 minute delay.

SCT Status Version:                  3
SCT Version (vendor specific):       258 (0x0102)
SCT Support Level:                   1
Device State:                        Active (0)
Current Temperature:                    30 Celsius
Power Cycle Min/Max Temperature:     25/30 Celsius
Lifetime    Min/Max Temperature:     25/30 Celsius
Under/Over Temperature Limit Count:   0/0
SCT Temperature History Version:     2
Temperature Sampling Period:         1 minute
Temperature Logging Interval:        1 minute
Min/Max recommended Temperature:      0/60 Celsius
Min/Max Temperature Limit:           -41/85 Celsius
Temperature History Size (Index):    478 (305)

Index    Estimated Time   Temperature Celsius
 306    2017-09-27 15:29     ?  -
 ...    ..(171 skipped).    ..  -
   0    2017-09-27 18:21     ?  -
   1    2017-09-27 18:22    25  ******
   2    2017-09-27 18:23    25  ******
   3    2017-09-27 18:24    25  ******
   4    2017-09-27 18:25    26  *******
   5    2017-09-27 18:26    27  ********
   6    2017-09-27 18:27    27  ********
   7    2017-09-27 18:28    28  *********
   8    2017-09-27 18:29    28  *********
   9    2017-09-27 18:30    28  *********
  10    2017-09-27 18:31    29  **********
 ...    ..(  3 skipped).    ..  **********
  14    2017-09-27 18:35    29  **********
  15    2017-09-27 18:36    30  ***********
 ...    ..(289 skipped).    ..  ***********
 305    2017-09-27 23:26    30  ***********

SCT Error Recovery Control:
           Read:     70 (7.0 seconds)
          Write:     70 (7.0 seconds)

SATA Phy Event Counters (GP Log 0x11)
ID      Size     Value  Description
0x0001  2            0  Command failed due to ICRC error
0x0002  2            0  R_ERR response for data FIS
0x0003  2            0  R_ERR response for device-to-host data FIS
0x0004  2            0  R_ERR response for host-to-device data FIS
0x0005  2            0  R_ERR response for non-data FIS
0x0006  2            0  R_ERR response for device-to-host non-data FIS
0x0007  2            0  R_ERR response for host-to-device non-data FIS
0x0008  2            0  Device-to-host non-data FIS retries
0x0009  2            0  Transition from drive PhyRdy to drive PhyNRdy
0x000a  2            1  Device-to-host register FISes sent due to a COMRESET
0x000b  2            0  CRC errors within host-to-device FIS
0x000d  2            0  Non-CRC errors within host-to-device FIS
0x000f  2            0  R_ERR response for host-to-device data FIS, CRC
0x0012  2            0  R_ERR response for host-to-device non-data FIS, CRC
0x8000  4            0  Vendor specific