smartctl 7.1 2020-04-05 r5049 [aarch64-linux-4.18.0-305.3.1.el8.aarch64] (local build)
Copyright (C) 2002-19, Bruce Allen, Christian Franke, www.smartmontools.org

=== START OF INFORMATION SECTION ===
Device Model:     SK HYNIX SE5110 480GB ZIRCON LITE 3DTLC
Serial Number:    1_5-COM55-1220
LU WWN Device Id: 5 142304 631354132
Firmware Version: 41093Z00
User Capacity:    480,103,981,056 bytes [480 GB]
Sector Sizes:     512 bytes logical, 4096 bytes physical
Rotation Rate:    Solid State Device
Form Factor:      2.5 inches
Device is:        Not in smartctl database [for details use: -P showall]
ATA Version is:   ACS-4 (minor revision not indicated)
SATA Version is:  SATA 3.3, 6.0 Gb/s (current: 6.0 Gb/s)
Local Time is:    Mon Nov 27 20:25:53 2023 EST
SMART support is: Available - device has SMART capability.
SMART support is: Enabled
AAM feature is:   Unavailable
APM feature is:   Unavailable
Rd look-ahead is: Enabled
Write cache is:   Enabled
DSN feature is:   Unavailable
ATA Security is:  Disabled, NOT FROZEN [SEC1]
Wt Cache Reorder: Enabled

=== START OF READ SMART DATA SECTION ===
SMART overall-health self-assessment test result: PASSED

General SMART Values:
Offline data collection status:  (0x02)	Offline data collection activity
					was completed without error.
					Auto Offline Data Collection: Disabled.
Self-test execution status:      (   0)	The previous self-test routine completed
					without error or no self-test has ever 
					been run.
Total time to complete Offline 
data collection: 		(  110) seconds.
Offline data collection
capabilities: 			 (0x59) SMART execute Offline immediate.
					No Auto Offline data collection support.
					Suspend Offline collection upon new
					command.
					Offline surface scan supported.
					Self-test supported.
					No Conveyance Self-test supported.
					Selective Self-test supported.
SMART capabilities:            (0x0002)	Does not save SMART data before
					entering power-saving mode.
					Supports SMART auto save timer.
Error logging capability:        (0x01)	Error logging supported.
					General Purpose Logging supported.
Short self-test routine 
recommended polling time: 	 (   2) minutes.
Extended self-test routine
recommended polling time: 	 (  16) minutes.
SCT capabilities: 	       (0x003d)	SCT Status supported.
					SCT Error Recovery Control supported.
					SCT Feature Control supported.
					SCT Data Table supported.

SMART Attributes Data Structure revision number: 0
Vendor Specific SMART Attributes with Thresholds:
ID# ATTRIBUTE_NAME          FLAGS    VALUE WORST THRESH FAIL RAW_VALUE
  1 Raw_Read_Error_Rate     POSR--   100   100   006    -    0
  5 Reallocated_Sector_Ct   -O--CK   100   100   036    -    0
  9 Power_On_Hours          -O--CK   100   100   000    -    691
 12 Power_Cycle_Count       -O--CK   098   098   020    -    28882
171 Unknown_Attribute       PO--CK   100   100   050    -    0
172 Unknown_Attribute       -O--CK   100   100   000    -    0
174 Unknown_Attribute       ----CK   100   100   000    -    28882
175 Program_Fail_Count_Chip PO--CK   100   100   050    -    0
176 Erase_Fail_Count_Chip   -O--CK   100   100   000    -    0
177 Wear_Leveling_Count     -O--CK   099   099   000    -    99
178 Used_Rsvd_Blk_Cnt_Chip  -O--CK   100   100   000    -    0
179 Used_Rsvd_Blk_Cnt_Tot   -O--CK   100   100   000    -    0
180 Unused_Rsvd_Blk_Cnt_Tot PO-RCK   100   100   006    -    0
181 Program_Fail_Cnt_Total  -O--CK   100   100   000    -    0
182 Erase_Fail_Count_Total  -O--CK   100   100   000    -    0
183 Runtime_Bad_Block       -O--CK   100   100   000    -    0
184 End-to-End_Error        -O--CK   100   100   000    -    0
187 Reported_Uncorrect      -O--CK   100   100   000    -    0
188 Command_Timeout         -O--CK   100   100   000    -    41
194 Temperature_Celsius     -O----   061   055   000    -    39 (Min/Max 30/45)
195 Hardware_ECC_Recovered  -O--CK   100   100   000    -    0
199 UDMA_CRC_Error_Count    -OSRCK   100   100   000    -    0
201 Unknown_SSD_Attribute   -OSR--   100   100   000    -    0
204 Soft_ECC_Correction     -OSR--   100   100   000    -    0
231 Temperature_Celsius     PO--CK   099   099   001    -    99
234 Unknown_Attribute       -O--CK   100   100   000    -    62960
241 Total_LBAs_Written      -O--CK   100   100   000    -    50389
242 Total_LBAs_Read         -O--CK   100   100   000    -    83193
245 Unknown_Attribute       PO--CK   100   100   001    -    100
250 Read_Error_Retry_Rate   -O--CK   100   100   000    -    1516865
                            ||||||_ K auto-keep
                            |||||__ C event count
                            ||||___ R error rate
                            |||____ S speed/performance
                            ||_____ O updated online
                            |______ P prefailure warning

General Purpose Log Directory Version 1
SMART           Log Directory Version 1 [multi-sector log support]
Address    Access  R/W   Size  Description
0x00       GPL,SL  R/O      1  Log Directory
0x01           SL  R/O      1  Summary SMART error log
0x03       GPL     R/O      5  Ext. Comprehensive SMART error log
0x04       GPL,SL  R/O      8  Device Statistics log
0x06           SL  R/O      1  SMART self-test log
0x07       GPL     R/O      2  Extended self-test log
0x09           SL  R/W      1  Selective self-test log
0x10       GPL     R/O      1  NCQ Command Error log
0x11       GPL     R/O      1  SATA Phy Event Counters log
0x24       GPL     R/O   6144  Current Device Internal Status Data log
0x25       GPL     R/O   6144  Saved Device Internal Status Data log
0x30       GPL,SL  R/O      9  IDENTIFY DEVICE data log
0x80-0x9f  GPL,SL  R/W     16  Host vendor specific log
0xe0       GPL,SL  R/W      1  SCT Command/Status
0xe1       GPL,SL  R/W      1  SCT Data Transfer

SMART Extended Comprehensive Error Log Version: 1 (5 sectors)
No Errors Logged

SMART Extended Self-test Log Version: 1 (2 sectors)
Num  Test_Description    Status                  Remaining  LifeTime(hours)  LBA_of_first_error
# 1  Short offline       Completed without error       00%       691         -

SMART Selective self-test log data structure revision number 1
 SPAN  MIN_LBA  MAX_LBA  CURRENT_TEST_STATUS
    1        0        0  Not_testing
    2        0        0  Not_testing
    3        0        0  Not_testing
    4        0        0  Not_testing
    5        0        0  Not_testing
Selective self-test flags (0x0):
  After scanning selected spans, do NOT read-scan remainder of disk.
If Selective self-test is pending on power-up, resume after 0 minute delay.

SCT Status Version:                  3
SCT Version (vendor specific):       1 (0x0001)
Device State:                        Active (0)
Current Temperature:                    39 Celsius
Power Cycle Min/Max Temperature:     38/39 Celsius
Lifetime    Min/Max Temperature:     30/45 Celsius
Specified Max Operating Temperature:    65 Celsius
Under/Over Temperature Limit Count:   0/0
SMART Status:                        0xc24f (PASSED)

SCT Temperature History Version:     2
Temperature Sampling Period:         1 minute
Temperature Logging Interval:        1 minute
Min/Max recommended Temperature:     -20/65 Celsius
Min/Max Temperature Limit:           -20/125 Celsius
Temperature History Size (Index):    192 (42)

Index    Estimated Time   Temperature Celsius
  43    2023-11-27 17:14    31  ************
 ...    ..(  9 skipped).    ..  ************
  53    2023-11-27 17:24    31  ************
  54    2023-11-27 17:25    32  *************
  55    2023-11-27 17:26    32  *************
  56    2023-11-27 17:27    31  ************
 ...    ..( 17 skipped).    ..  ************
  74    2023-11-27 17:45    31  ************
  75    2023-11-27 17:46    32  *************
  76    2023-11-27 17:47    31  ************
 ...    ..(  9 skipped).    ..  ************
  86    2023-11-27 17:57    31  ************
  87    2023-11-27 17:58    32  *************
  88    2023-11-27 17:59    31  ************
 ...    ..( 14 skipped).    ..  ************
 103    2023-11-27 18:14    31  ************
 104    2023-11-27 18:15    32  *************
 105    2023-11-27 18:16    31  ************
 106    2023-11-27 18:17    31  ************
 107    2023-11-27 18:18    31  ************
 108    2023-11-27 18:19    32  *************
 109    2023-11-27 18:20    31  ************
 ...    ..(  2 skipped).    ..  ************
 112    2023-11-27 18:23    31  ************
 113    2023-11-27 18:24    32  *************
 114    2023-11-27 18:25    31  ************
 ...    ..(  7 skipped).    ..  ************
 122    2023-11-27 18:33    31  ************
 123    2023-11-27 18:34    32  *************
 124    2023-11-27 18:35    31  ************
 ...    ..(  6 skipped).    ..  ************
 131    2023-11-27 18:42    31  ************
 132    2023-11-27 18:43    32  *************
 133    2023-11-27 18:44    32  *************
 134    2023-11-27 18:45    31  ************
 ...    ..(  6 skipped).    ..  ************
 141    2023-11-27 18:52    31  ************
 142    2023-11-27 18:53    32  *************
 143    2023-11-27 18:54    31  ************
 144    2023-11-27 18:55    31  ************
 145    2023-11-27 18:56    31  ************
 146    2023-11-27 18:57    32  *************
 147    2023-11-27 18:58    31  ************
 ...    ..(  3 skipped).    ..  ************
 151    2023-11-27 19:02    31  ************
 152    2023-11-27 19:03    32  *************
 153    2023-11-27 19:04    31  ************
 ...    ..( 11 skipped).    ..  ************
 165    2023-11-27 19:16    31  ************
 166    2023-11-27 19:17    32  *************
 167    2023-11-27 19:18    31  ************
 168    2023-11-27 19:19    31  ************
 169    2023-11-27 19:20    31  ************
 170    2023-11-27 19:21    32  *************
 171    2023-11-27 19:22    31  ************
 ...    ..(  2 skipped).    ..  ************
 174    2023-11-27 19:25    31  ************
 175    2023-11-27 19:26    32  *************
 176    2023-11-27 19:27    31  ************
 177    2023-11-27 19:28    31  ************
 178    2023-11-27 19:29    31  ************
 179    2023-11-27 19:30    32  *************
 180    2023-11-27 19:31    32  *************
 181    2023-11-27 19:32    31  ************
 ...    ..(  7 skipped).    ..  ************
 189    2023-11-27 19:40    31  ************
 190    2023-11-27 19:41    32  *************
 191    2023-11-27 19:42    32  *************
   0    2023-11-27 19:43    31  ************
 ...    ..( 14 skipped).    ..  ************
  15    2023-11-27 19:58    31  ************
  16    2023-11-27 19:59    32  *************
  17    2023-11-27 20:00     ?  -
  18    2023-11-27 20:01     ?  -
  19    2023-11-27 20:02    35  ****************
  20    2023-11-27 20:03    37  ******************
 ...    ..(  2 skipped).    ..  ******************
  23    2023-11-27 20:06    37  ******************
  24    2023-11-27 20:07     ?  -
  25    2023-11-27 20:08    37  ******************
  26    2023-11-27 20:09    38  *******************
  27    2023-11-27 20:10    37  ******************
 ...    ..( 10 skipped).    ..  ******************
  38    2023-11-27 20:21    37  ******************
  39    2023-11-27 20:22     ?  -
  40    2023-11-27 20:23    38  *******************
  41    2023-11-27 20:24    39  ********************
  42    2023-11-27 20:25    39  ********************

SCT Error Recovery Control:
           Read:     80 (8.0 seconds)
          Write:     80 (8.0 seconds)

Device Statistics (GP Log 0x04)
Page  Offset Size        Value Flags Description
0x01  =====  =               =  ===  == General Statistics (rev 1) ==
0x01  0x008  4           28882  ---  Lifetime Power-On Resets
0x01  0x010  4             691  ---  Power-on Hours
0x01  0x018  6    105673411890  ---  Logical Sectors Written
0x01  0x020  6       812006758  ---  Number of Write Commands
0x01  0x028  6    174468509217  ---  Logical Sectors Read
0x01  0x030  6      1016157404  ---  Number of Read Commands
0x01  0x038  6      2487600000  ---  Date and Time TimeStamp
0x04  =====  =               =  ===  == General Errors Statistics (rev 1) ==
0x04  0x008  4               0  ---  Number of Reported Uncorrectable Errors
0x04  0x010  4               6  ---  Resets Between Cmd Acceptance and Completion
0x05  =====  =               =  ===  == Temperature Statistics (rev 1) ==
0x05  0x008  1              39  ---  Current Temperature
0x05  0x010  1               -  ---  Average Short Term Temperature
0x05  0x018  1               -  ---  Average Long Term Temperature
0x05  0x020  1              45  ---  Highest Temperature
0x05  0x028  1              30  ---  Lowest Temperature
0x05  0x030  1              36  ---  Highest Average Short Term Temperature
0x05  0x038  1              31  ---  Lowest Average Short Term Temperature
0x05  0x040  1               -  ---  Highest Average Long Term Temperature
0x05  0x048  1               -  ---  Lowest Average Long Term Temperature
0x05  0x050  4               0  ---  Time in Over-Temperature
0x05  0x058  1              65  ---  Specified Maximum Operating Temperature
0x05  0x060  4               0  ---  Time in Under-Temperature
0x05  0x068  1             -20  ---  Specified Minimum Operating Temperature
0x06  =====  =               =  ===  == Transport Statistics (rev 1) ==
0x06  0x008  4           59134  ---  Number of Hardware Resets
0x06  0x018  4               0  ---  Number of Interface CRC Errors
0x07  =====  =               =  ===  == Solid State Device Statistics (rev 1) ==
0x07  0x008  1               1  ---  Percentage Used Endurance Indicator
                                |||_ C monitored condition met
                                ||__ D supports DSN
                                |___ N normalized value

Pending Defects log (GP Log 0x0c) not supported

SATA Phy Event Counters (GP Log 0x11)
ID      Size     Value  Description
0x0001  2            0  Command failed due to ICRC error
0x0003  2            0  R_ERR response for device-to-host data FIS
0x0004  2            0  R_ERR response for host-to-device data FIS
0x0006  2            0  R_ERR response for device-to-host non-data FIS
0x000a  2            0  Device-to-host register FISes sent due to a COMRESET
0x000b  2            0  CRC errors within host-to-device FIS
0x000d  2            0  Non-CRC errors within host-to-device FIS

