smartctl 7.2 2020-12-30 r5155 [x86_64-linux-5.10.0-21-amd64] (local build)
Copyright (C) 2002-20, Bruce Allen, Christian Franke, www.smartmontools.org

=== START OF INFORMATION SECTION ===
Device Model:     SAMSUNG HD082GJ
Serial Number:    S0VPJ9AQ402566
LU WWN Device Id: 5 0000f0 09b402566
Firmware Version: GE100-07
User Capacity:    80,026,361,856 bytes [80.0 GB]
Sector Size:      512 bytes logical/physical
Device is:        Not in smartctl database [for details use: -P showall]
ATA Version is:   ATA8-ACS T13/1699-D revision 3b
SATA Version is:  SATA 2.5, 3.0 Gb/s
Local Time is:    Thu Apr 13 18:31:02 2023 CEST
SMART support is: Available - device has SMART capability.
SMART support is: Enabled
AAM feature is:   Disabled
APM feature is:   Disabled
Rd look-ahead is: Enabled
Write cache is:   Enabled
DSN feature is:   Unavailable
ATA Security is:  Disabled, NOT FROZEN [SEC1]
Wt Cache Reorder: Enabled

=== START OF READ SMART DATA SECTION ===
SMART overall-health self-assessment test result: PASSED

General SMART Values:
Offline data collection status:  (0x00)	Offline data collection activity
					was never started.
					Auto Offline Data Collection: Disabled.
Self-test execution status:      (   0)	The previous self-test routine completed
					without error or no self-test has ever 
					been run.
Total time to complete Offline 
data collection: 		( 1320) seconds.
Offline data collection
capabilities: 			 (0x5b) SMART execute Offline immediate.
					Auto Offline data collection on/off support.
					Suspend Offline collection upon new
					command.
					Offline surface scan supported.
					Self-test supported.
					No Conveyance Self-test supported.
					Selective Self-test supported.
SMART capabilities:            (0x0003)	Saves SMART data before entering
					power-saving mode.
					Supports SMART auto save timer.
Error logging capability:        (0x01)	Error logging supported.
					General Purpose Logging supported.
Short self-test routine 
recommended polling time: 	 (   2) minutes.
Extended self-test routine
recommended polling time: 	 (  22) minutes.
SCT capabilities: 	       (0x003f)	SCT Status supported.
					SCT Error Recovery Control supported.
					SCT Feature Control supported.
					SCT Data Table supported.

SMART Attributes Data Structure revision number: 18
Vendor Specific SMART Attributes with Thresholds:
ID# ATTRIBUTE_NAME          FLAGS    VALUE WORST THRESH FAIL RAW_VALUE
  1 Raw_Read_Error_Rate     POSR--   100   100   051    -    0
  3 Spin_Up_Time            POS---   073   073   011    -    4000
  4 Start_Stop_Count        -O--CK   089   089   000    -    10249
  5 Reallocated_Sector_Ct   PO--CK   252   252   010    -    0
  7 Seek_Error_Rate         POSR--   252   252   051    -    0
  8 Seek_Time_Performance   P-S--K   252   252   015    -    0
  9 Power_On_Hours          -O--CK   099   099   000    -    462713
 10 Spin_Retry_Count        PO--CK   252   252   051    -    0
 11 Calibration_Retry_Count -O--C-   252   252   000    -    0
 12 Power_Cycle_Count       -O--CK   095   095   000    -    4795
184 End-to-End_Error        -O--CK   252   252   000    -    0
187 Reported_Uncorrect      -O--CK   252   252   000    -    0
188 Command_Timeout         -O--CK   252   252   000    -    0
190 Airflow_Temperature_Cel -O---K   160   106   000    -    31
194 Temperature_Celsius     -O---K   160   106   000    -    31
195 Hardware_ECC_Recovered  -O-RC-   100   100   000    -    0
196 Reallocated_Event_Count -O--CK   252   252   000    -    0
197 Current_Pending_Sector  -O--C-   252   252   000    -    0
198 Offline_Uncorrectable   ----CK   252   252   000    -    0
199 UDMA_CRC_Error_Count    -OS-CK   200   200   000    -    1
200 Multi_Zone_Error_Rate   -O-R--   100   100   000    -    0
201 Soft_Read_Error_Rate    -O-R--   252   252   000    -    0
                            ||||||_ K auto-keep
                            |||||__ C event count
                            ||||___ R error rate
                            |||____ S speed/performance
                            ||_____ O updated online
                            |______ P prefailure warning

General Purpose Log Directory Version 1
SMART           Log Directory Version 1 [multi-sector log support]
Address    Access  R/W   Size  Description
0x00       GPL,SL  R/O      1  Log Directory
0x01           SL  R/O      1  Summary SMART error log
0x02           SL  R/O      2  Comprehensive SMART error log
0x03       GPL     R/O      2  Ext. Comprehensive SMART error log
0x06           SL  R/O      1  SMART self-test log
0x07       GPL     R/O      1  Extended self-test log
0x09           SL  R/W      1  Selective self-test log
0x10       GPL     R/O      1  NCQ Command Error log
0x11       GPL     R/O      1  SATA Phy Event Counters log
0x80-0x9f  GPL,SL  R/W     16  Host vendor specific log
0xe0       GPL,SL  R/W      1  SCT Command/Status
0xe1       GPL,SL  R/W      1  SCT Data Transfer

SMART Extended Comprehensive Error Log Version: 1 (2 sectors)
Device Error Count: 25 (device log contains only the most recent 8 errors)
	CR     = Command Register
	FEATR  = Features Register
	COUNT  = Count (was: Sector Count) Register
	LBA_48 = Upper bytes of LBA High/Mid/Low Registers ]  ATA-8
	LH     = LBA High (was: Cylinder High) Register    ]   LBA
	LM     = LBA Mid (was: Cylinder Low) Register      ] Register
	LL     = LBA Low (was: Sector Number) Register     ]
	DV     = Device (was: Device/Head) Register
	DC     = Device Control Register
	ER     = Error register
	ST     = Status register
Powered_Up_Time is measured from power on, and printed as
DDd+hh:mm:SS.sss where DD=days, hh=hours, mm=minutes,
SS=sec, and sss=millisec. It "wraps" after 49.710 days.

Error 25 [0] occurred at disk power-on lifetime: 3854 hours (160 days + 14 hours)
  When the command that caused the error occurred, the device was active or idle.

  After command completion occurred, registers were:
  ER -- ST COUNT  LBA_48  LH LM LL DV DC
  -- -- -- == -- == == == -- -- -- -- --
  84 -- 51 00 80 00 00 00 c2 4f 09 40 00  Error: ICRC, ABRT at LBA = 0x00c24f09 = 12734217

  Commands leading to the command that caused the error were:
  CR FEATR COUNT  LBA_48  LH LM LL DV DC  Powered_Up_Time  Command/Feature_Name
  -- == -- == -- == == == -- -- -- -- --  ---------------  --------------------
  61 00 80 00 80 00 00 00 c2 4f 09 40 ff     00:41:06.000  WRITE FPDMA QUEUED
  61 00 80 00 80 00 00 00 c2 4f 09 40 00     00:41:06.000  WRITE FPDMA QUEUED
  61 00 80 00 80 00 00 00 c2 4f 09 40 00     00:41:06.000  WRITE FPDMA QUEUED
  61 00 80 00 80 00 00 00 c2 4f 09 40 00     00:41:06.000  WRITE FPDMA QUEUED
  61 00 80 00 80 00 00 00 c2 4f 09 40 00     00:41:06.000  WRITE FPDMA QUEUED

Error 24 [7] occurred at disk power-on lifetime: 3852 hours (160 days + 12 hours)
  When the command that caused the error occurred, the device was active or idle.

  After command completion occurred, registers were:
  ER -- ST COUNT  LBA_48  LH LM LL DV DC
  -- -- -- == -- == == == -- -- -- -- --
  04 -- 51 00 00 00 00 00 c2 4f 00 e0 00  Error: ABRT

  Commands leading to the command that caused the error were:
  CR FEATR COUNT  LBA_48  LH LM LL DV DC  Powered_Up_Time  Command/Feature_Name
  -- == -- == -- == == == -- -- -- -- --  ---------------  --------------------
  b0 00 da 00 00 00 00 00 c2 4f 00 e0 04     00:01:59.000  SMART RETURN STATUS
  c6 00 00 00 10 00 00 00 00 00 00 a0 04     00:00:26.000  SET MULTIPLE MODE
  ef 00 03 00 45 00 00 00 00 00 00 a0 04     00:00:26.000  SET FEATURES [Set transfer mode]
  ef 00 03 00 0c 00 00 00 00 00 00 a0 04     00:00:26.000  SET FEATURES [Set transfer mode]
  ec 00 00 00 00 00 00 00 00 00 00 a0 00     00:00:26.000  IDENTIFY DEVICE

Error 23 [6] occurred at disk power-on lifetime: 3851 hours (160 days + 11 hours)
  When the command that caused the error occurred, the device was active or idle.

  After command completion occurred, registers were:
  ER -- ST COUNT  LBA_48  LH LM LL DV DC
  -- -- -- == -- == == == -- -- -- -- --
  04 -- 51 00 00 00 00 00 c2 4f 00 e0 00  Error: ABRT

  Commands leading to the command that caused the error were:
  CR FEATR COUNT  LBA_48  LH LM LL DV DC  Powered_Up_Time  Command/Feature_Name
  -- == -- == -- == == == -- -- -- -- --  ---------------  --------------------
  b0 00 d0 00 00 00 00 00 c2 4f 00 e0 00     00:00:26.000  SMART READ DATA
  ca 00 00 00 08 00 00 00 5e 6d 60 e0 00     00:00:26.000  WRITE DMA

Error 22 [5] occurred at disk power-on lifetime: 3851 hours (160 days + 11 hours)
  When the command that caused the error occurred, the device was active or idle.

  After command completion occurred, registers were:
  ER -- ST COUNT  LBA_48  LH LM LL DV DC
  -- -- -- == -- == == == -- -- -- -- --
  04 -- 51 00 00 00 00 00 c2 4f 00 e0 00  Error: ABRT

  Commands leading to the command that caused the error were:
  CR FEATR COUNT  LBA_48  LH LM LL DV DC  Powered_Up_Time  Command/Feature_Name
  -- == -- == -- == == == -- -- -- -- --  ---------------  --------------------
  b0 00 da 00 00 00 00 00 c2 4f 00 e0 04     00:00:26.000  SMART RETURN STATUS
  c6 00 00 00 10 00 00 00 00 00 00 a0 04     00:00:25.000  SET MULTIPLE MODE
  ef 00 03 00 45 00 00 00 00 00 00 a0 04     00:00:25.000  SET FEATURES [Set transfer mode]
  ef 00 03 00 0c 00 00 00 00 00 00 a0 04     00:00:25.000  SET FEATURES [Set transfer mode]
  ec 00 00 00 00 00 00 00 00 00 00 a0 00     00:00:25.000  IDENTIFY DEVICE

Error 21 [4] occurred at disk power-on lifetime: 3854 hours (160 days + 14 hours)
  When the command that caused the error occurred, the device was active or idle.

  After command completion occurred, registers were:
  ER -- ST COUNT  LBA_48  LH LM LL DV DC
  -- -- -- == -- == == == -- -- -- -- --
  84 -- 51 00 80 00 00 00 c2 4f 09 40 00  Error: ICRC, ABRT at LBA = 0x00c24f09 = 12734217

  Commands leading to the command that caused the error were:
  CR FEATR COUNT  LBA_48  LH LM LL DV DC  Powered_Up_Time  Command/Feature_Name
  -- == -- == -- == == == -- -- -- -- --  ---------------  --------------------
  61 00 80 00 80 00 00 00 c2 4f 09 40 ff     00:41:06.000  WRITE FPDMA QUEUED
  61 00 80 00 80 00 00 00 c2 4f 09 40 00     00:41:06.000  WRITE FPDMA QUEUED
  61 00 80 00 80 00 00 00 c2 4f 09 40 00     00:41:06.000  WRITE FPDMA QUEUED
  61 00 80 00 80 00 00 00 c2 4f 09 40 00     00:41:06.000  WRITE FPDMA QUEUED
  61 00 80 00 80 00 00 00 c2 4f 09 40 00     00:41:06.000  WRITE FPDMA QUEUED

Error 20 [3] occurred at disk power-on lifetime: 3852 hours (160 days + 12 hours)
  When the command that caused the error occurred, the device was active or idle.

  After command completion occurred, registers were:
  ER -- ST COUNT  LBA_48  LH LM LL DV DC
  -- -- -- == -- == == == -- -- -- -- --
  04 -- 51 00 00 00 00 00 c2 4f 00 e0 00  Error: ABRT

  Commands leading to the command that caused the error were:
  CR FEATR COUNT  LBA_48  LH LM LL DV DC  Powered_Up_Time  Command/Feature_Name
  -- == -- == -- == == == -- -- -- -- --  ---------------  --------------------
  b0 00 da 00 00 00 00 00 c2 4f 00 e0 04     00:01:59.000  SMART RETURN STATUS
  c6 00 00 00 10 00 00 00 00 00 00 a0 04     00:00:26.000  SET MULTIPLE MODE
  ef 00 03 00 45 00 00 00 00 00 00 a0 04     00:00:26.000  SET FEATURES [Set transfer mode]
  ef 00 03 00 0c 00 00 00 00 00 00 a0 04     00:00:26.000  SET FEATURES [Set transfer mode]
  ec 00 00 00 00 00 00 00 00 00 00 a0 00     00:00:26.000  IDENTIFY DEVICE

Error 19 [2] occurred at disk power-on lifetime: 3851 hours (160 days + 11 hours)
  When the command that caused the error occurred, the device was active or idle.

  After command completion occurred, registers were:
  ER -- ST COUNT  LBA_48  LH LM LL DV DC
  -- -- -- == -- == == == -- -- -- -- --
  04 -- 51 00 00 00 00 00 c2 4f 00 e0 00  Error: ABRT

  Commands leading to the command that caused the error were:
  CR FEATR COUNT  LBA_48  LH LM LL DV DC  Powered_Up_Time  Command/Feature_Name
  -- == -- == -- == == == -- -- -- -- --  ---------------  --------------------
  b0 00 d0 00 00 00 00 00 c2 4f 00 e0 00     00:00:26.000  SMART READ DATA
  ca 00 00 00 08 00 00 00 5e 6d 60 e0 00     00:00:26.000  WRITE DMA

Error 18 [1] occurred at disk power-on lifetime: 3851 hours (160 days + 11 hours)
  When the command that caused the error occurred, the device was active or idle.

  After command completion occurred, registers were:
  ER -- ST COUNT  LBA_48  LH LM LL DV DC
  -- -- -- == -- == == == -- -- -- -- --
  04 -- 51 00 00 00 00 00 c2 4f 00 e0 00  Error: ABRT

  Commands leading to the command that caused the error were:
  CR FEATR COUNT  LBA_48  LH LM LL DV DC  Powered_Up_Time  Command/Feature_Name
  -- == -- == -- == == == -- -- -- -- --  ---------------  --------------------
  b0 00 da 00 00 00 00 00 c2 4f 00 e0 04     00:00:26.000  SMART RETURN STATUS
  c6 00 00 00 10 00 00 00 00 00 00 a0 04     00:00:25.000  SET MULTIPLE MODE
  ef 00 03 00 45 00 00 00 00 00 00 a0 04     00:00:25.000  SET FEATURES [Set transfer mode]
  ef 00 03 00 0c 00 00 00 00 00 00 a0 04     00:00:25.000  SET FEATURES [Set transfer mode]
  ec 00 00 00 00 00 00 00 00 00 00 a0 00     00:00:25.000  IDENTIFY DEVICE

Warning! SMART Extended Self-test Log Structure error: invalid SMART checksum.
SMART Extended Self-test Log Version: 0 (1 sectors)
Num  Test_Description    Status                  Remaining  LifeTime(hours)  LBA_of_first_error
# 1  Reserved (0x0e)     Completed without error       150%         0         -
# 2  Offline             Completed without error       00%         0         -
# 3  Offline             Completed without error       00%         0         -

SMART Selective self-test log data structure revision number 0
Note: revision number not 1 implies that no selective self-test has ever been run
 SPAN  MIN_LBA  MAX_LBA  CURRENT_TEST_STATUS
    1        0        0  Not_testing
    2        0        0  Not_testing
    3        0        0  Not_testing
    4        0        0  Not_testing
    5        0        0  Not_testing
Selective self-test flags (0x0):
  After scanning selected spans, do NOT read-scan remainder of disk.
If Selective self-test is pending on power-up, resume after 0 minute delay.

SCT Status Version:                  2
SCT Version (vendor specific):       256 (0x0100)
Device State:                        Active (0)
Current Temperature:                    31 Celsius
Power Cycle Min/Max Temperature:     --/40 Celsius
Lifetime    Min/Max Temperature:     --/40 Celsius

SCT Temperature History Version:     2
Temperature Sampling Period:         1 minute
Temperature Logging Interval:        1 minute
Min/Max recommended Temperature:     10/105 Celsius
Min/Max Temperature Limit:            5/110 Celsius
Temperature History Size (Index):    128 (11)

Index    Estimated Time   Temperature Celsius
  12    2023-04-13 16:24    47  ****************************
 ...    ..( 43 skipped).    ..  ****************************
  56    2023-04-13 17:08    47  ****************************
  57    2023-04-13 17:09    48  *****************************
  58    2023-04-13 17:10    48  *****************************
  59    2023-04-13 17:11    48  *****************************
  60    2023-04-13 17:12     ?  -
  61    2023-04-13 17:13    24  *****
  62    2023-04-13 17:14     ?  -
  63    2023-04-13 17:15     ?  -
  64    2023-04-13 17:16    21  **
  65    2023-04-13 17:17     ?  -
  66    2023-04-13 17:18    22  ***
  67    2023-04-13 17:19    40  *********************
 ...    ..( 10 skipped).    ..  *********************
  78    2023-04-13 17:30    40  *********************
  79    2023-04-13 17:31     ?  -
  80    2023-04-13 17:32    36  *****************
  81    2023-04-13 17:33    36  *****************
  82    2023-04-13 17:34    35  ****************
  83    2023-04-13 17:35    35  ****************
  84    2023-04-13 17:36    35  ****************
  85    2023-04-13 17:37    34  ***************
 ...    ..(  3 skipped).    ..  ***************
  89    2023-04-13 17:41    34  ***************
  90    2023-04-13 17:42    33  **************
  91    2023-04-13 17:43    32  *************
 ...    ..(  4 skipped).    ..  *************
  96    2023-04-13 17:48    32  *************
  97    2023-04-13 17:49    31  ************
  98    2023-04-13 17:50    31  ************
  99    2023-04-13 17:51    32  *************
 ...    ..(  5 skipped).    ..  *************
 105    2023-04-13 17:57    32  *************
 106    2023-04-13 17:58    31  ************
 ...    ..( 10 skipped).    ..  ************
 117    2023-04-13 18:09    31  ************
 118    2023-04-13 18:10    30  ***********
 ...    ..( 15 skipped).    ..  ***********
   6    2023-04-13 18:26    30  ***********
   7    2023-04-13 18:27    31  ************
 ...    ..(  3 skipped).    ..  ************
  11    2023-04-13 18:31    31  ************

SCT Error Recovery Control:
           Read: Disabled
          Write: Disabled

Device Statistics (GP/SMART Log 0x04) not supported

Pending Defects log (GP Log 0x0c) not supported

SATA Phy Event Counters (GP Log 0x11)
ID      Size     Value  Description
0x0001  2            1  Command failed due to ICRC error
0x0002  2            1  R_ERR response for data FIS
0x0003  2            0  R_ERR response for device-to-host data FIS
0x0004  2            1  R_ERR response for host-to-device data FIS
0x0005  2            0  R_ERR response for non-data FIS
0x0006  2            0  R_ERR response for device-to-host non-data FIS
0x0007  2            0  R_ERR response for host-to-device non-data FIS
0x0008  2            0  Device-to-host non-data FIS retries
0x0009  2            4  Transition from drive PhyRdy to drive PhyNRdy
0x000a  2            3  Device-to-host register FISes sent due to a COMRESET
0x000b  2            1  CRC errors within host-to-device FIS
0x000d  2            0  Non-CRC errors within host-to-device FIS
0x000f  2            1  R_ERR response for host-to-device data FIS, CRC
0x0010  2            0  R_ERR response for host-to-device data FIS, non-CRC
0x0012  2            0  R_ERR response for host-to-device non-data FIS, CRC
0x0013  2            0  R_ERR response for host-to-device non-data FIS, non-CRC

