smartctl 7.4 2023-08-01 r5530 [x86_64-linux-6.1.106-Unraid] (local build)
Copyright (C) 2002-23, Bruce Allen, Christian Franke, www.smartmontools.org

=== START OF INFORMATION SECTION ===
Device Model:     ST18000NM002J-2TV133
Add. Product Id:  DELL(tm)
Firmware Version: PAL7
User Capacity:    18,000,207,937,536 bytes [18.0 TB]
Sector Sizes:     512 bytes logical, 4096 bytes physical
Rotation Rate:    7200 rpm
Form Factor:      3.5 inches
Device is:        Not in smartctl database 7.3/5610
ATA Version is:   ACS-4 (minor revision not indicated)
SATA Version is:  SATA 3.3, 6.0 Gb/s (current: 6.0 Gb/s)
Local Time is:    Tue Sep  3 11:57:50 2024 CDT
SMART support is: Available - device has SMART capability.
SMART support is: Enabled
AAM feature is:   Unavailable
APM feature is:   Unavailable
Rd look-ahead is: Enabled
Write cache is:   Enabled
DSN feature is:   Disabled
ATA Security is:  Disabled, NOT FROZEN [SEC1]
Write SCT (Get) Feature Control Command failed: scsi error aborted command
Wt Cache Reorder: Unknown (SCT Feature Control command failed)

=== START OF READ SMART DATA SECTION ===
SMART overall-health self-assessment test result: PASSED

General SMART Values:
Offline data collection status:  (0x00)	Offline data collection activity
					was never started.
					Auto Offline Data Collection: Disabled.
Self-test execution status:      (   0)	The previous self-test routine completed
					without error or no self-test has ever 
					been run.
Total time to complete Offline 
data collection: 		(   90) seconds.
Offline data collection
capabilities: 			 (0x71) SMART execute Offline immediate.
					No Auto Offline data collection support.
					Suspend Offline collection upon new
					command.
					No Offline surface scan supported.
					Self-test supported.
					Conveyance Self-test supported.
					Selective Self-test supported.
SMART capabilities:            (0x0003)	Saves SMART data before entering
					power-saving mode.
					Supports SMART auto save timer.
Error logging capability:        (0x01)	Error logging supported.
					General Purpose Logging supported.
Short self-test routine 
recommended polling time: 	 (   1) minutes.
Extended self-test routine
recommended polling time: 	 (1524) minutes.
Conveyance self-test routine
recommended polling time: 	 (   2) minutes.
SCT capabilities: 	       (0x70bd)	SCT Status supported.
					SCT Error Recovery Control supported.
					SCT Feature Control supported.
					SCT Data Table supported.

SMART Attributes Data Structure revision number: 10
Vendor Specific SMART Attributes with Thresholds:
ID# ATTRIBUTE_NAME          FLAGS    VALUE WORST THRESH FAIL RAW_VALUE
  1 Raw_Read_Error_Rate     POSR--+  082   064   044    -    177785032
  3 Spin_Up_Time            PO----+  089   081   000    -    0
  4 Start_Stop_Count        -O--CK   100   100   020    -    182
  5 Reallocated_Sector_Ct   PO--CK+  100   100   010    -    0
  7 Seek_Error_Rate         POSR--   082   060   045    -    169793332
  9 Power_On_Hours          -O--CK   094   094   000    -    5500
 10 Spin_Retry_Count        PO--C-   100   100   097    -    0
 12 Power_Cycle_Count       -O--CK   100   100   020    -    38
 18 Unknown_Attribute       PO-R--   100   100   050    -    0
187 Reported_Uncorrect      -O--CK   100   100   000    -    0
188 Command_Timeout         -O--CK   100   001   000    -    720
190 Airflow_Temperature_Cel -O---K   065   049   000    -    35 (Min/Max 28/35)
192 Power-Off_Retract_Count -O--CK   100   100   000    -    34
193 Load_Cycle_Count        -O--CK   097   097   000    -    7598
194 Temperature_Celsius     -O---K   035   051   000    -    35 (0 11 0 0 0)
197 Current_Pending_Sector  -O--C-   100   100   000    -    0
198 Offline_Uncorrectable   ----C-   100   100   000    -    0
199 UDMA_CRC_Error_Count    -OSRCK   200   200   000    -    0
200 Multi_Zone_Error_Rate   PO---K   100   100   001    -    0
240 Head_Flying_Hours       ------   100   253   000    -    2664 (159 179 0)
241 Total_LBAs_Written      ------   100   253   000    -    62959044924
242 Total_LBAs_Read         ------   100   253   000    -    1143561114272
                            ||||||_ K auto-keep
                            |||||__ C event count
                            ||||___ R error rate
                            |||____ S speed/performance
                            ||_____ O updated online
                            |______ P prefailure warning

General Purpose Log Directory Version 1
SMART           Log Directory Version 1 [multi-sector log support]
Address    Access  R/W   Size  Description
0x00       GPL,SL  R/O      1  Log Directory
0x01           SL  R/O      1  Summary SMART error log
0x02           SL  R/O      5  Comprehensive SMART error log
0x03       GPL     R/O      5  Ext. Comprehensive SMART error log
0x04       GPL     R/O    256  Device Statistics log
0x04       SL      R/O      8  Device Statistics log
0x06           SL  R/O      1  SMART self-test log
0x07       GPL     R/O      1  Extended self-test log
0x08       GPL     R/O      2  Power Conditions log
0x09           SL  R/W      1  Selective self-test log
0x0a       GPL     R/W      8  Device Statistics Notification
0x0c       GPL     R/O   2048  Pending Defects log
0x10       GPL     R/O      1  NCQ Command Error log
0x11       GPL     R/O      1  SATA Phy Event Counters log
0x13       GPL     R/O      1  SATA NCQ Send and Receive log
0x21       GPL     R/O      1  Write stream error log
0x22       GPL     R/O      1  Read stream error log
0x24       GPL     R/O    768  Current Device Internal Status Data log
0x2f       GPL     R/O      1  Set Sector Configuration
0x30       GPL,SL  R/O      9  IDENTIFY DEVICE data log
0x80-0x9f  GPL,SL  R/W     16  Host vendor specific log
0xa1       GPL,SL  VS     160  Device vendor specific log
0xa2       GPL     VS   16320  Device vendor specific log
0xa4       GPL,SL  VS     160  Device vendor specific log
0xa6       GPL     VS     192  Device vendor specific log
0xa8-0xa9  GPL,SL  VS     136  Device vendor specific log
0xab       GPL     VS       1  Device vendor specific log
0xad       GPL     VS      16  Device vendor specific log
0xb1       GPL,SL  VS     160  Device vendor specific log
0xb6       GPL     VS    1920  Device vendor specific log
0xbe-0xbf  GPL     VS   65535  Device vendor specific log
0xc1       GPL,SL  VS       8  Device vendor specific log
0xc3       GPL,SL  VS      24  Device vendor specific log
0xc6       GPL     VS    5184  Device vendor specific log
0xc7       GPL,SL  VS       8  Device vendor specific log
0xc9       GPL,SL  VS       8  Device vendor specific log
0xca       GPL,SL  VS      16  Device vendor specific log
0xcd       GPL,SL  VS       1  Device vendor specific log
0xce       GPL     VS       1  Device vendor specific log
0xcf       GPL     VS     512  Device vendor specific log
0xd1       GPL     VS     656  Device vendor specific log
0xd2       GPL     VS   10256  Device vendor specific log
0xd4       GPL     VS    2048  Device vendor specific log
0xda       GPL,SL  VS       1  Device vendor specific log
0xdf       GPL,SL  VS       1  Device vendor specific log
0xe0       GPL,SL  R/W      1  SCT Command/Status
0xe1       GPL,SL  R/W      1  SCT Data Transfer

SMART Extended Comprehensive Error Log Version: 1 (5 sectors)
No Errors Logged

SMART Extended Self-test Log Version: 1 (1 sectors)
Num  Test_Description    Status                  Remaining  LifeTime(hours)  LBA_of_first_error
# 1  Short offline       Completed without error       00%      5500         -
# 2  Short offline       Completed without error       00%      5499         -
# 3  Short offline       Completed without error       00%         5         -
# 4  Vendor (0xdf)       Completed without error       00%         3         -
# 5  Short offline       Completed without error       00%         1         -

SMART Selective self-test log data structure revision number 1
 SPAN  MIN_LBA  MAX_LBA  CURRENT_TEST_STATUS
    1        0        0  Not_testing
    2        0        0  Not_testing
    3        0        0  Not_testing
    4        0        0  Not_testing
    5        0        0  Not_testing
Selective self-test flags (0x0):
  After scanning selected spans, do NOT read-scan remainder of disk.
If Selective self-test is pending on power-up, resume after 0 minute delay.

SCT Status Version:                  3
SCT Version (vendor specific):       522 (0x020a)
Device State:                        Active (0)
Current Temperature:                    35 Celsius
Power Cycle Min/Max Temperature:     28/35 Celsius
Lifetime    Min/Max Temperature:     10/51 Celsius
Under/Over Temperature Limit Count:   0/0
SMART Status:                        0xc24f (PASSED)
Vendor specific:
00 00 00 00 00 00 00 00 00 00 00 00 00 00 00 00
00 00 00 00 01 00 00 00 00 00 00 00 00 00 00 00

SCT Temperature History Version:     2
Temperature Sampling Period:         4 minutes
Temperature Logging Interval:        59 minutes
Min/Max recommended Temperature:     10/40 Celsius
Min/Max Temperature Limit:            5/60 Celsius
Temperature History Size (Index):    128 (116)

Index    Estimated Time   Temperature Celsius
 117    2024-08-29 06:51    32  *************
 118    2024-08-29 07:50    32  *************
 119    2024-08-29 08:49    31  ************
 120    2024-08-29 09:48    30  ***********
 121    2024-08-29 10:47    31  ************
 122    2024-08-29 11:46    30  ***********
 123    2024-08-29 12:45    28  *********
 124    2024-08-29 13:44    27  ********
 125    2024-08-29 14:43    27  ********
 126    2024-08-29 15:42    26  *******
 127    2024-08-29 16:41    26  *******
   0    2024-08-29 17:40    26  *******
   1    2024-08-29 18:39    25  ******
   2    2024-08-29 19:38    28  *********
   3    2024-08-29 20:37    31  ************
   4    2024-08-29 21:36    30  ***********
   5    2024-08-29 22:35    30  ***********
   6    2024-08-29 23:34    31  ************
   7    2024-08-30 00:33    27  ********
   8    2024-08-30 01:32    24  *****
   9    2024-08-30 02:31    24  *****
  10    2024-08-30 03:30    24  *****
  11    2024-08-30 04:29    23  ****
  12    2024-08-30 05:28    23  ****
  13    2024-08-30 06:27    28  *********
  14    2024-08-30 07:26    26  *******
  15    2024-08-30 08:25    27  ********
  16    2024-08-30 09:24    30  ***********
  17    2024-08-30 10:23    31  ************
  18    2024-08-30 11:22    32  *************
  19    2024-08-30 12:21    29  **********
  20    2024-08-30 13:20    29  **********
  21    2024-08-30 14:19    30  ***********
  22    2024-08-30 15:18    30  ***********
  23    2024-08-30 16:17    28  *********
  24    2024-08-30 17:16    28  *********
  25    2024-08-30 18:15    26  *******
  26    2024-08-30 19:14    26  *******
  27    2024-08-30 20:13    26  *******
  28    2024-08-30 21:12    29  **********
  29    2024-08-30 22:11    31  ************
  30    2024-08-30 23:10    30  ***********
  31    2024-08-31 00:09    32  *************
  32    2024-08-31 01:08    31  ************
  33    2024-08-31 02:07    30  ***********
  34    2024-08-31 03:06    28  *********
 ...    ..(  2 skipped).    ..  *********
  37    2024-08-31 06:03    28  *********
  38    2024-08-31 07:02    29  **********
  39    2024-08-31 08:01    27  ********
  40    2024-08-31 09:00    27  ********
  41    2024-08-31 09:59    28  *********
  42    2024-08-31 10:58    29  **********
  43    2024-08-31 11:57    29  **********
  44    2024-08-31 12:56    29  **********
  45    2024-08-31 13:55    28  *********
  46    2024-08-31 14:54    28  *********
  47    2024-08-31 15:53    26  *******
  48    2024-08-31 16:52    26  *******
  49    2024-08-31 17:51    29  **********
  50    2024-08-31 18:50    36  *****************
  51    2024-08-31 19:49    37  ******************
 ...    ..(  2 skipped).    ..  ******************
  54    2024-08-31 22:46    37  ******************
  55    2024-08-31 23:45    38  *******************
  56    2024-09-01 00:44    38  *******************
  57    2024-09-01 01:43    38  *******************
  58    2024-09-01 02:42    37  ******************
  59    2024-09-01 03:41    38  *******************
  60    2024-09-01 04:40    38  *******************
  61    2024-09-01 05:39    37  ******************
 ...    ..(  2 skipped).    ..  ******************
  64    2024-09-01 08:36    37  ******************
  65    2024-09-01 09:35    36  *****************
  66    2024-09-01 10:34    35  ****************
 ...    ..(  4 skipped).    ..  ****************
  71    2024-09-01 15:29    35  ****************
  72    2024-09-01 16:28    34  ***************
  73    2024-09-01 17:27    33  **************
 ...    ..(  2 skipped).    ..  **************
  76    2024-09-01 20:24    33  **************
  77    2024-09-01 21:23    34  ***************
  78    2024-09-01 22:22    34  ***************
  79    2024-09-01 23:21    34  ***************
  80    2024-09-02 00:20     ?  -
  81    2024-09-02 01:19    24  *****
  82    2024-09-02 02:18     ?  -
  83    2024-09-02 03:17    33  **************
  84    2024-09-02 04:16     ?  -
  85    2024-09-02 05:15    32  *************
  86    2024-09-02 06:14     ?  -
  87    2024-09-02 07:13    32  *************
  88    2024-09-02 08:12     ?  -
  89    2024-09-02 09:11    34  ***************
  90    2024-09-02 10:10     ?  -
  91    2024-09-02 11:09    35  ****************
  92    2024-09-02 12:08     ?  -
  93    2024-09-02 13:07    37  ******************
  94    2024-09-02 14:06    48  *****************************
  95    2024-09-02 15:05     ?  -
  96    2024-09-02 16:04    49  ******************************
  97    2024-09-02 17:03     ?  -
  98    2024-09-02 18:02    50  *******************************
  99    2024-09-02 19:01     ?  -
 100    2024-09-02 20:00    51  ********************************
 101    2024-09-02 20:59    33  **************
 102    2024-09-02 21:58    31  ************
 103    2024-09-02 22:57    28  *********
 104    2024-09-02 23:56     ?  -
 105    2024-09-03 00:55    28  *********
 106    2024-09-03 01:54    34  ***************
 107    2024-09-03 02:53    34  ***************
 108    2024-09-03 03:52    34  ***************
 109    2024-09-03 04:51    35  ****************
 110    2024-09-03 05:50    34  ***************
 111    2024-09-03 06:49    35  ****************
 ...    ..(  4 skipped).    ..  ****************
 116    2024-09-03 11:44    35  ****************

SCT Error Recovery Control:
           Read:     80 (8.0 seconds)
          Write:     80 (8.0 seconds)

Device Statistics (GP Log 0x04)
Page  Offset Size        Value Flags Description
0x01  =====  =               =  ===  == General Statistics (rev 1) ==
0x01  0x008  4              38  ---  Lifetime Power-On Resets
0x01  0x010  4            5500  ---  Power-on Hours
0x01  0x018  6     62959044636  ---  Logical Sectors Written
0x01  0x020  6        68566481  ---  Number of Write Commands
0x01  0x028  6   1143477439655  ---  Logical Sectors Read
0x01  0x030  6       661652963  ---  Number of Read Commands
0x01  0x038  6               -  ---  Date and Time TimeStamp
0x03  =====  =               =  ===  == Rotating Media Statistics (rev 1) ==
0x03  0x008  4            5240  ---  Spindle Motor Power-on Hours
0x03  0x010  4            3379  ---  Head Flying Hours
0x03  0x018  4            7598  ---  Head Load Events
0x03  0x020  4               0  ---  Number of Reallocated Logical Sectors
0x03  0x028  4               0  ---  Read Recovery Attempts
0x03  0x030  4               0  ---  Number of Mechanical Start Failures
0x03  0x038  4               0  ---  Number of Realloc. Candidate Logical Sectors
0x03  0x040  4              34  ---  Number of High Priority Unload Events
0x04  =====  =               =  ===  == General Errors Statistics (rev 1) ==
0x04  0x008  4               0  ---  Number of Reported Uncorrectable Errors
0x04  0x010  4             556  ---  Resets Between Cmd Acceptance and Completion
0x04  0x018  4               0  -D-  Physical Element Status Changed
0x05  =====  =               =  ===  == Temperature Statistics (rev 1) ==
0x05  0x008  1              35  ---  Current Temperature
0x05  0x010  1              34  ---  Average Short Term Temperature
0x05  0x018  1              34  ---  Average Long Term Temperature
0x05  0x020  1              51  ---  Highest Temperature
0x05  0x028  1              17  ---  Lowest Temperature
0x05  0x030  1              44  ---  Highest Average Short Term Temperature
0x05  0x038  1              26  ---  Lowest Average Short Term Temperature
0x05  0x040  1              36  ---  Highest Average Long Term Temperature
0x05  0x048  1              31  ---  Lowest Average Long Term Temperature
0x05  0x050  4               0  ---  Time in Over-Temperature
0x05  0x058  1              60  ---  Specified Maximum Operating Temperature
0x05  0x060  4               0  ---  Time in Under-Temperature
0x05  0x068  1               5  ---  Specified Minimum Operating Temperature
0x06  =====  =               =  ===  == Transport Statistics (rev 1) ==
0x06  0x008  4            1937  ---  Number of Hardware Resets
0x06  0x010  4               0  ---  Number of ASR Events
0x06  0x018  4               0  ---  Number of Interface CRC Errors
0xff  =====  =               =  ===  == Vendor Specific Statistics (rev 1) ==
0xff  0x008  7               0  ---  Vendor Specific
0xff  0x010  7               0  ---  Vendor Specific
0xff  0x018  7               0  ---  Vendor Specific
                                |||_ C monitored condition met
                                ||__ D supports DSN
                                |___ N normalized value

Pending Defects log (GP Log 0x0c)
No Defects Logged

SATA Phy Event Counters (GP Log 0x11)
ID      Size     Value  Description
0x000a  2            1  Device-to-host register FISes sent due to a COMRESET
0x0001  2            0  Command failed due to ICRC error
0x0003  2            0  R_ERR response for device-to-host data FIS
0x0004  2            0  R_ERR response for host-to-device data FIS
0x0006  2            0  R_ERR response for device-to-host non-data FIS
0x0007  2            0  R_ERR response for host-to-device non-data FIS
0x000b  2            0  CRC errors within host-to-device FIS
0x000d  2            0  Non-CRC errors within host-to-device FIS

Seagate FARM log (GP Log 0xa6) supported [try: -l farm]

