smartctl 6.6 2017-11-05 r4594 [x86_64-linux-4.19.0-13-amd64] (local build)
Copyright (C) 2002-17, Bruce Allen, Christian Franke, www.smartmontools.org

=== START OF INFORMATION SECTION ===
Device Model:     WDC WD40EDAZ-11SLVB0
Serial Number:    WD-WX62D60C4UL7
LU WWN Device Id: 5 0014ee 2bd97578e
Firmware Version: 80.00A80
User Capacity:    4,000,787,030,016 bytes [4.00 TB]
Sector Sizes:     512 bytes logical, 4096 bytes physical
Rotation Rate:    5400 rpm
Form Factor:      3.5 inches
Device is:        Not in smartctl database [for details use: -P showall]
ATA Version is:   ACS-3 T13/2161-D revision 5
SATA Version is:  SATA 3.1, 6.0 Gb/s (current: 6.0 Gb/s)
Local Time is:    Sat Dec 12 07:43:07 2020 PST
SMART support is: Available - device has SMART capability.
SMART support is: Enabled
AAM feature is:   Unavailable
APM feature is:   Unavailable
Rd look-ahead is: Enabled
Write cache is:   Enabled
DSN feature is:   Unavailable
ATA Security is:  Disabled, NOT FROZEN [SEC1]
Wt Cache Reorder: Enabled

=== START OF READ SMART DATA SECTION ===
SMART overall-health self-assessment test result: PASSED

General SMART Values:
Offline data collection status:  (0x00)	Offline data collection activity
					was never started.
					Auto Offline Data Collection: Disabled.
Self-test execution status:      (   0)	The previous self-test routine completed
					without error or no self-test has ever 
					been run.
Total time to complete Offline 
data collection: 		(27540) seconds.
Offline data collection
capabilities: 			 (0x7b) SMART execute Offline immediate.
					Auto Offline data collection on/off support.
					Suspend Offline collection upon new
					command.
					Offline surface scan supported.
					Self-test supported.
					Conveyance Self-test supported.
					Selective Self-test supported.
SMART capabilities:            (0x0003)	Saves SMART data before entering
					power-saving mode.
					Supports SMART auto save timer.
Error logging capability:        (0x01)	Error logging supported.
					General Purpose Logging supported.
Short self-test routine 
recommended polling time: 	 (   2) minutes.
Extended self-test routine
recommended polling time: 	 (  59) minutes.
Conveyance self-test routine
recommended polling time: 	 (   2) minutes.
SCT capabilities: 	       (0x3031)	SCT Status supported.
					SCT Feature Control supported.
					SCT Data Table supported.

SMART Attributes Data Structure revision number: 16
Vendor Specific SMART Attributes with Thresholds:
ID# ATTRIBUTE_NAME          FLAGS    VALUE WORST THRESH FAIL RAW_VALUE
  1 Raw_Read_Error_Rate     POSR-K   200   200   051    -    0
  3 Spin_Up_Time            POS--K   205   203   021    -    2725
  4 Start_Stop_Count        -O--CK   100   100   000    -    62
  5 Reallocated_Sector_Ct   PO--CK   200   200   140    -    0
  7 Seek_Error_Rate         -OSR-K   200   200   000    -    0
  9 Power_On_Hours          -O--CK   100   100   000    -    190
 10 Spin_Retry_Count        -O--CK   100   253   000    -    0
 11 Calibration_Retry_Count -O--CK   100   253   000    -    0
 12 Power_Cycle_Count       -O--CK   100   100   000    -    60
192 Power-Off_Retract_Count -O--CK   200   200   000    -    0
193 Load_Cycle_Count        -O--CK   200   200   000    -    177
194 Temperature_Celsius     -O---K   116   107   000    -    31
196 Reallocated_Event_Count -O--CK   200   200   000    -    0
197 Current_Pending_Sector  -O--CK   200   200   000    -    0
198 Offline_Uncorrectable   ----CK   100   253   000    -    0
199 UDMA_CRC_Error_Count    -O--CK   200   200   000    -    0
200 Multi_Zone_Error_Rate   ---R--   100   253   000    -    0
                            ||||||_ K auto-keep
                            |||||__ C event count
                            ||||___ R error rate
                            |||____ S speed/performance
                            ||_____ O updated online
                            |______ P prefailure warning

General Purpose Log Directory Version 1
SMART           Log Directory Version 1 [multi-sector log support]
Address    Access  R/W   Size  Description
0x00       GPL,SL  R/O      1  Log Directory
0x01           SL  R/O      1  Summary SMART error log
0x02           SL  R/O      5  Comprehensive SMART error log
0x03       GPL     R/O      6  Ext. Comprehensive SMART error log
0x04       GPL     R/O    256  Device Statistics log
0x04       SL      R/O      8  Device Statistics log
0x06           SL  R/O      1  SMART self-test log
0x07       GPL     R/O      1  Extended self-test log
0x09           SL  R/W      1  Selective self-test log
0x0c       GPL     R/O   2048  Pending Defects log
0x10       GPL     R/O      1  NCQ Command Error log
0x11       GPL     R/O      1  SATA Phy Event Counters log
0x24       GPL     R/O    294  Current Device Internal Status Data log
0x30       GPL,SL  R/O      9  IDENTIFY DEVICE data log
0x80-0x9f  GPL,SL  R/W     16  Host vendor specific log
0xa0-0xa7  GPL,SL  VS      16  Device vendor specific log
0xa8-0xb6  GPL,SL  VS       1  Device vendor specific log
0xb7       GPL,SL  VS      78  Device vendor specific log
0xb9       GPL,SL  VS       4  Device vendor specific log
0xbd       GPL,SL  VS       1  Device vendor specific log
0xc0       GPL,SL  VS       1  Device vendor specific log
0xc1       GPL     VS      93  Device vendor specific log
0xe0       GPL,SL  R/W      1  SCT Command/Status
0xe1       GPL,SL  R/W      1  SCT Data Transfer

SMART Extended Comprehensive Error Log Version: 1 (6 sectors)
No Errors Logged

SMART Extended Self-test Log Version: 1 (1 sectors)
Num  Test_Description    Status                  Remaining  LifeTime(hours)  LBA_of_first_error
# 1  Short offline       Completed without error       00%       190         -

SMART Selective self-test log data structure revision number 1
 SPAN  MIN_LBA  MAX_LBA  CURRENT_TEST_STATUS
    1        0        0  Not_testing
    2        0        0  Not_testing
    3        0        0  Not_testing
    4        0        0  Not_testing
    5        0        0  Not_testing
Selective self-test flags (0x0):
  After scanning selected spans, do NOT read-scan remainder of disk.
If Selective self-test is pending on power-up, resume after 0 minute delay.

SCT Status Version:                  3
SCT Version (vendor specific):       258 (0x0102)
SCT Support Level:                   1
Device State:                        Active (0)
Current Temperature:                    31 Celsius
Power Cycle Min/Max Temperature:     20/31 Celsius
Lifetime    Min/Max Temperature:     16/40 Celsius
Under/Over Temperature Limit Count:   0/0
Vendor specific:
01 00 00 00 00 00 00 00 00 00 00 00 00 00 00 00
00 00 00 00 00 00 00 00 00 00 00 00 00 00 00 00

SCT Temperature History Version:     2
Temperature Sampling Period:         1 minute
Temperature Logging Interval:        1 minute
Min/Max recommended Temperature:      0/65 Celsius
Min/Max Temperature Limit:           -41/85 Celsius
Temperature History Size (Index):    478 (56)

Index    Estimated Time   Temperature Celsius
  57    2020-12-11 23:46    33  **************
 ...    ..( 30 skipped).    ..  **************
  88    2020-12-12 00:17    33  **************
  89    2020-12-12 00:18    34  ***************
 ...    ..( 61 skipped).    ..  ***************
 151    2020-12-12 01:20    34  ***************
 152    2020-12-12 01:21    35  ****************
 153    2020-12-12 01:22    34  ***************
 154    2020-12-12 01:23    34  ***************
 155    2020-12-12 01:24    35  ****************
 156    2020-12-12 01:25    34  ***************
 157    2020-12-12 01:26    34  ***************
 158    2020-12-12 01:27    35  ****************
 ...    ..( 86 skipped).    ..  ****************
 245    2020-12-12 02:54    35  ****************
 246    2020-12-12 02:55     ?  -
 247    2020-12-12 02:56    24  *****
 248    2020-12-12 02:57    24  *****
 249    2020-12-12 02:58    24  *****
 250    2020-12-12 02:59    25  ******
 251    2020-12-12 03:00    25  ******
 252    2020-12-12 03:01    26  *******
 253    2020-12-12 03:02    27  ********
 ...    ..(  3 skipped).    ..  ********
 257    2020-12-12 03:06    27  ********
 258    2020-12-12 03:07    28  *********
 ...    ..(  4 skipped).    ..  *********
 263    2020-12-12 03:12    28  *********
 264    2020-12-12 03:13    29  **********
 ...    ..(  2 skipped).    ..  **********
 267    2020-12-12 03:16    29  **********
 268    2020-12-12 03:17     ?  -
 269    2020-12-12 03:18    27  ********
 ...    ..(  2 skipped).    ..  ********
 272    2020-12-12 03:21    27  ********
 273    2020-12-12 03:22    28  *********
 274    2020-12-12 03:23    28  *********
 275    2020-12-12 03:24    29  **********
 ...    ..(  3 skipped).    ..  **********
 279    2020-12-12 03:28    29  **********
 280    2020-12-12 03:29    30  ***********
 ...    ..(  6 skipped).    ..  ***********
 287    2020-12-12 03:36    30  ***********
 288    2020-12-12 03:37    31  ************
 ...    ..( 11 skipped).    ..  ************
 300    2020-12-12 03:49    31  ************
 301    2020-12-12 03:50    32  *************
 ...    ..( 21 skipped).    ..  *************
 323    2020-12-12 04:12    32  *************
 324    2020-12-12 04:13    33  **************
 ...    ..( 57 skipped).    ..  **************
 382    2020-12-12 05:11    33  **************
 383    2020-12-12 05:12    34  ***************
 ...    ..( 51 skipped).    ..  ***************
 435    2020-12-12 06:04    34  ***************
 436    2020-12-12 06:05    33  **************
 437    2020-12-12 06:06    33  **************
 438    2020-12-12 06:07    34  ***************
 439    2020-12-12 06:08    33  **************
 ...    ..( 12 skipped).    ..  **************
 452    2020-12-12 06:21    33  **************
 453    2020-12-12 06:22    34  ***************
 454    2020-12-12 06:23    33  **************
 ...    ..( 31 skipped).    ..  **************
   8    2020-12-12 06:55    33  **************
   9    2020-12-12 06:56     ?  -
  10    2020-12-12 06:57    20  *
  11    2020-12-12 06:58    20  *
  12    2020-12-12 06:59    20  *
  13    2020-12-12 07:00    21  **
  14    2020-12-12 07:01    21  **
  15    2020-12-12 07:02    22  ***
  16    2020-12-12 07:03    23  ****
  17    2020-12-12 07:04    23  ****
  18    2020-12-12 07:05    23  ****
  19    2020-12-12 07:06    24  *****
  20    2020-12-12 07:07    24  *****
  21    2020-12-12 07:08    24  *****
  22    2020-12-12 07:09    25  ******
 ...    ..(  3 skipped).    ..  ******
  26    2020-12-12 07:13    25  ******
  27    2020-12-12 07:14    26  *******
 ...    ..(  2 skipped).    ..  *******
  30    2020-12-12 07:17    26  *******
  31    2020-12-12 07:18    27  ********
 ...    ..(  4 skipped).    ..  ********
  36    2020-12-12 07:23    27  ********
  37    2020-12-12 07:24    28  *********
 ...    ..(  4 skipped).    ..  *********
  42    2020-12-12 07:29    28  *********
  43    2020-12-12 07:30    29  **********
 ...    ..(  7 skipped).    ..  **********
  51    2020-12-12 07:38    29  **********
  52    2020-12-12 07:39    30  ***********
 ...    ..(  2 skipped).    ..  ***********
  55    2020-12-12 07:42    30  ***********
  56    2020-12-12 07:43    31  ************

SCT Error Recovery Control command not supported

Device Statistics (GP/SMART Log 0x04) not supported

Pending Defects log (GP Log 0x0c) supported [please try: '-l defects']

SATA Phy Event Counters (GP Log 0x11)
ID      Size     Value  Description
0x0001  2            0  Command failed due to ICRC error
0x0002  2            0  R_ERR response for data FIS
0x0003  2            0  R_ERR response for device-to-host data FIS
0x0004  2            0  R_ERR response for host-to-device data FIS
0x0005  2            0  R_ERR response for non-data FIS
0x0006  2            0  R_ERR response for device-to-host non-data FIS
0x0007  2            0  R_ERR response for host-to-device non-data FIS
0x0008  2            0  Device-to-host non-data FIS retries
0x0009  2            0  Transition from drive PhyRdy to drive PhyNRdy
0x000a  2            1  Device-to-host register FISes sent due to a COMRESET
0x000b  2            0  CRC errors within host-to-device FIS
0x000d  2            0  Non-CRC errors within host-to-device FIS
0x000f  2            0  R_ERR response for host-to-device data FIS, CRC
0x0012  2            0  R_ERR response for host-to-device non-data FIS, CRC
0x8000  4         2762  Vendor specific

