smartctl 7.2 2020-12-30 r5155 [x86_64-linux-5.13.0-40-generic] (local build)
Copyright (C) 2002-20, Bruce Allen, Christian Franke, www.smartmontools.org

=== START OF INFORMATION SECTION ===
Device Model:     CT4000MX500SSD1
Firmware Version: M3CR044
User Capacity:    4.000.787.030.016 bytes [4,00 TB]
Sector Sizes:     512 bytes logical, 4096 bytes physical
Rotation Rate:    Solid State Device
Form Factor:      2.5 inches
TRIM Command:     Available
Device is:        Not in smartctl database [for details use: -P showall]
ATA Version is:   ACS-3 T13/2161-D revision 5
SATA Version is:  SATA 3.3, 6.0 Gb/s (current: 3.0 Gb/s)
Local Time is:    Wed May  4 13:36:20 2022 CEST
SMART support is: Available - device has SMART capability.
SMART support is: Enabled
AAM feature is:   Unavailable
APM level is:     254 (maximum performance)
Rd look-ahead is: Enabled
Write cache is:   Enabled
DSN feature is:   Unavailable
ATA Security is:  Disabled, NOT FROZEN [SEC1]
Wt Cache Reorder: Unknown

=== START OF READ SMART DATA SECTION ===
SMART overall-health self-assessment test result: PASSED

General SMART Values:
Offline data collection status:  (0x82)	Offline data collection activity
					was completed without error.
					Auto Offline Data Collection: Enabled.
Self-test execution status:      (   0)	The previous self-test routine completed
					without error or no self-test has ever 
					been run.
Total time to complete Offline 
data collection: 		(    0) seconds.
Offline data collection
capabilities: 			 (0x7b) SMART execute Offline immediate.
					Auto Offline data collection on/off support.
					Suspend Offline collection upon new
					command.
					Offline surface scan supported.
					Self-test supported.
					Conveyance Self-test supported.
					Selective Self-test supported.
SMART capabilities:            (0x0003)	Saves SMART data before entering
					power-saving mode.
					Supports SMART auto save timer.
Error logging capability:        (0x01)	Error logging supported.
					General Purpose Logging supported.
Short self-test routine 
recommended polling time: 	 (   2) minutes.
Extended self-test routine
recommended polling time: 	 (  30) minutes.
Conveyance self-test routine
recommended polling time: 	 (   2) minutes.
SCT capabilities: 	       (0x0031)	SCT Status supported.
					SCT Feature Control supported.
					SCT Data Table supported.

SMART Attributes Data Structure revision number: 16
Vendor Specific SMART Attributes with Thresholds:
ID# ATTRIBUTE_NAME          FLAGS    VALUE WORST THRESH FAIL RAW_VALUE
  1 Raw_Read_Error_Rate     POSR-K   100   100   000    -    0
  5 Reallocated_Sector_Ct   -O--CK   100   100   010    -    0
  9 Power_On_Hours          -O--CK   100   100   000    -    3031
 12 Power_Cycle_Count       -O--CK   100   100   000    -    12
171 Unknown_Attribute       -O--CK   100   100   000    -    0
172 Unknown_Attribute       -O--CK   100   100   000    -    0
173 Unknown_Attribute       -O--CK   099   099   000    -    21
174 Unknown_Attribute       -O--CK   100   100   000    -    1
180 Unused_Rsvd_Blk_Cnt_Tot PO--CK   000   000   000    -    223
183 Runtime_Bad_Block       -O--CK   100   100   000    -    0
184 End-to-End_Error        -O--CK   100   100   000    -    0
187 Reported_Uncorrect      -O--CK   100   100   000    -    0
194 Temperature_Celsius     -O---K   061   051   000    -    39 (Min/Max 0/49)
196 Reallocated_Event_Count -O--CK   100   100   000    -    0
197 Current_Pending_Sector  -O--CK   100   100   000    -    0
198 Offline_Uncorrectable   ----CK   100   100   000    -    0
199 UDMA_CRC_Error_Count    -O--CK   100   100   000    -    0
202 Unknown_SSD_Attribute   ----CK   099   099   001    -    1
206 Unknown_SSD_Attribute   -OSR--   100   100   000    -    0
210 Unknown_Attribute       -O--CK   100   100   000    -    0
246 Unknown_Attribute       -O--CK   100   100   000    -    46622228632
247 Unknown_Attribute       -O--CK   100   100   000    -    372523386
248 Unknown_Attribute       -O--CK   100   100   000    -    418886301
                            ||||||_ K auto-keep
                            |||||__ C event count
                            ||||___ R error rate
                            |||____ S speed/performance
                            ||_____ O updated online
                            |______ P prefailure warning

General Purpose Log Directory Version 1
SMART           Log Directory Version 1 [multi-sector log support]
Address    Access  R/W   Size  Description
0x00       GPL,SL  R/O      1  Log Directory
0x01           SL  R/O      1  Summary SMART error log
0x02           SL  R/O      1  Comprehensive SMART error log
0x03       GPL     R/O      1  Ext. Comprehensive SMART error log
0x04       GPL,SL  R/O      8  Device Statistics log
0x06           SL  R/O      1  SMART self-test log
0x07       GPL     R/O      1  Extended self-test log
0x09           SL  R/W      1  Selective self-test log
0x10       GPL     R/O      1  NCQ Command Error log
0x11       GPL     R/O      1  SATA Phy Event Counters log
0x24       GPL     R/O     88  Current Device Internal Status Data log
0x25       GPL     R/O    128  Saved Device Internal Status Data log
0x30       GPL,SL  R/O      9  IDENTIFY DEVICE data log
0x80-0x9f  GPL,SL  R/W     16  Host vendor specific log
0xe0       GPL,SL  R/W      1  SCT Command/Status
0xe1       GPL,SL  R/W      1  SCT Data Transfer

SMART Extended Comprehensive Error Log Version: 1 (1 sectors)
No Errors Logged

SMART Extended Self-test Log Version: 1 (1 sectors)
Num  Test_Description    Status                  Remaining  LifeTime(hours)  LBA_of_first_error
# 1  Short offline       Completed without error       00%      3030         -
# 2  Short offline       Completed without error       00%      2859         -
# 3  Short offline       Completed without error       00%      2312         -
# 4  Short offline       Completed without error       00%      1642         -
# 5  Short offline       Completed without error       00%      1583         -
# 6  Short offline       Completed without error       00%       909         -
# 7  Short offline       Completed without error       00%       234         -

SMART Selective self-test log data structure revision number 1
 SPAN  MIN_LBA  MAX_LBA  CURRENT_TEST_STATUS
    1        0        0  Not_testing
    2        0        0  Not_testing
    3        0        0  Not_testing
    4        0        0  Not_testing
    5        0        0  Not_testing
Selective self-test flags (0x0):
  After scanning selected spans, do NOT read-scan remainder of disk.
If Selective self-test is pending on power-up, resume after 0 minute delay.

SCT Status Version:                  3
SCT Version (vendor specific):       1 (0x0001)
Device State:                        Active (0)
Current Temperature:                    39 Celsius
Power Cycle Min/Max Temperature:     25/49 Celsius
Lifetime    Min/Max Temperature:      0/49 Celsius
Under/Over Temperature Limit Count:   0/0

SCT Temperature History Version:     2
Temperature Sampling Period:         1 minute
Temperature Logging Interval:        1 minute
Min/Max recommended Temperature:      0/100 Celsius
Min/Max Temperature Limit:            0/100 Celsius
Temperature History Size (Index):    128 (42)

Index    Estimated Time   Temperature Celsius
  43    2022-05-04 11:29    46  ***************************
  44    2022-05-04 11:30    46  ***************************
  45    2022-05-04 11:31    45  **************************
  46    2022-05-04 11:32    45  **************************
  47    2022-05-04 11:33    46  ***************************
  48    2022-05-04 11:34    46  ***************************
  49    2022-05-04 11:35    45  **************************
  50    2022-05-04 11:36    46  ***************************
  51    2022-05-04 11:37    46  ***************************
  52    2022-05-04 11:38    45  **************************
 ...    ..(  2 skipped).    ..  **************************
  55    2022-05-04 11:41    45  **************************
  56    2022-05-04 11:42    46  ***************************
  57    2022-05-04 11:43    45  **************************
 ...    ..(  4 skipped).    ..  **************************
  62    2022-05-04 11:48    45  **************************
  63    2022-05-04 11:49    46  ***************************
  64    2022-05-04 11:50    45  **************************
  65    2022-05-04 11:51    45  **************************
  66    2022-05-04 11:52    45  **************************
  67    2022-05-04 11:53    46  ***************************
  68    2022-05-04 11:54    45  **************************
 ...    ..(  6 skipped).    ..  **************************
  75    2022-05-04 12:01    45  **************************
  76    2022-05-04 12:02    44  *************************
  77    2022-05-04 12:03    45  **************************
  78    2022-05-04 12:04    45  **************************
  79    2022-05-04 12:05    45  **************************
  80    2022-05-04 12:06    44  *************************
  81    2022-05-04 12:07    45  **************************
  82    2022-05-04 12:08    45  **************************
  83    2022-05-04 12:09    45  **************************
  84    2022-05-04 12:10    44  *************************
  85    2022-05-04 12:11    45  **************************
  86    2022-05-04 12:12    45  **************************
  87    2022-05-04 12:13    44  *************************
  88    2022-05-04 12:14    45  **************************
  89    2022-05-04 12:15    44  *************************
  90    2022-05-04 12:16    45  **************************
  91    2022-05-04 12:17    44  *************************
  92    2022-05-04 12:18    45  **************************
  93    2022-05-04 12:19    44  *************************
  94    2022-05-04 12:20    45  **************************
 ...    ..(  2 skipped).    ..  **************************
  97    2022-05-04 12:23    45  **************************
  98    2022-05-04 12:24    44  *************************
  99    2022-05-04 12:25    44  *************************
 100    2022-05-04 12:26    44  *************************
 101    2022-05-04 12:27    45  **************************
 102    2022-05-04 12:28    45  **************************
 103    2022-05-04 12:29    44  *************************
 104    2022-05-04 12:30    44  *************************
 105    2022-05-04 12:31    45  **************************
 106    2022-05-04 12:32    45  **************************
 107    2022-05-04 12:33    44  *************************
 108    2022-05-04 12:34    45  **************************
 109    2022-05-04 12:35    44  *************************
 ...    ..(  3 skipped).    ..  *************************
 113    2022-05-04 12:39    44  *************************
 114    2022-05-04 12:40    45  **************************
 115    2022-05-04 12:41    44  *************************
 116    2022-05-04 12:42    44  *************************
 117    2022-05-04 12:43    45  **************************
 118    2022-05-04 12:44    44  *************************
 ...    ..(  4 skipped).    ..  *************************
 123    2022-05-04 12:49    44  *************************
 124    2022-05-04 12:50    45  **************************
 125    2022-05-04 12:51    44  *************************
 ...    ..(  6 skipped).    ..  *************************
   4    2022-05-04 12:58    44  *************************
   5    2022-05-04 12:59    45  **************************
   6    2022-05-04 13:00    44  *************************
 ...    ..(  4 skipped).    ..  *************************
  11    2022-05-04 13:05    44  *************************
  12    2022-05-04 13:06    45  **************************
  13    2022-05-04 13:07    44  *************************
  14    2022-05-04 13:08    45  **************************
  15    2022-05-04 13:09    44  *************************
  16    2022-05-04 13:10    45  **************************
 ...    ..(  2 skipped).    ..  **************************
  19    2022-05-04 13:13    45  **************************
  20    2022-05-04 13:14    44  *************************
  21    2022-05-04 13:15    44  *************************
  22    2022-05-04 13:16    44  *************************
  23    2022-05-04 13:17    45  **************************
  24    2022-05-04 13:18    44  *************************
 ...    ..(  2 skipped).    ..  *************************
  27    2022-05-04 13:21    44  *************************
  28    2022-05-04 13:22    43  ************************
  29    2022-05-04 13:23    45  **************************
  30    2022-05-04 13:24    44  *************************
  31    2022-05-04 13:25    43  ************************
  32    2022-05-04 13:26    45  **************************
  33    2022-05-04 13:27    46  ***************************
  34    2022-05-04 13:28    43  ************************
  35    2022-05-04 13:29    41  **********************
  36    2022-05-04 13:30    41  **********************
  37    2022-05-04 13:31    40  *********************
  38    2022-05-04 13:32    39  ********************
 ...    ..(  3 skipped).    ..  ********************
  42    2022-05-04 13:36    39  ********************

SCT Error Recovery Control command not supported

Device Statistics (GP Log 0x04)
Page  Offset Size        Value Flags Description
0x01  =====  =               =  ===  == General Statistics (rev 1) ==
0x01  0x008  4              12  ---  Lifetime Power-On Resets
0x01  0x010  4            3031  ---  Power-on Hours
0x01  0x018  6      3672555672  ---  Logical Sectors Written
0x01  0x020  6       133793582  ---  Number of Write Commands
0x01  0x028  6      3805393189  ---  Logical Sectors Read
0x01  0x030  6       169856058  ---  Number of Read Commands
0x01  0x038  6      2322238553  ---  Date and Time TimeStamp
0x04  =====  =               =  ===  == General Errors Statistics (rev 1) ==
0x04  0x008  4               0  ---  Number of Reported Uncorrectable Errors
0x04  0x010  4               1  ---  Resets Between Cmd Acceptance and Completion
0x05  =====  =               =  ===  == Temperature Statistics (rev 1) ==
0x05  0x008  1              39  ---  Current Temperature
0x05  0x010  1              37  ---  Average Short Term Temperature
0x05  0x018  1              36  ---  Average Long Term Temperature
0x05  0x020  1              49  ---  Highest Temperature
0x05  0x028  1               0  ---  Lowest Temperature
0x05  0x030  1              41  ---  Highest Average Short Term Temperature
0x05  0x038  1               0  ---  Lowest Average Short Term Temperature
0x05  0x040  1              40  ---  Highest Average Long Term Temperature
0x05  0x048  1               0  ---  Lowest Average Long Term Temperature
0x05  0x050  4               0  ---  Time in Over-Temperature
0x05  0x058  1              70  ---  Specified Maximum Operating Temperature
0x05  0x060  4               0  ---  Time in Under-Temperature
0x05  0x068  1               0  ---  Specified Minimum Operating Temperature
0x06  =====  =               =  ===  == Transport Statistics (rev 1) ==
0x06  0x008  4              71  ---  Number of Hardware Resets
0x06  0x010  4              14  ---  Number of ASR Events
0x06  0x018  4               0  ---  Number of Interface CRC Errors
0x07  =====  =               =  ===  == Solid State Device Statistics (rev 1) ==
0x07  0x008  1               1  ---  Percentage Used Endurance Indicator
                                |||_ C monitored condition met
                                ||__ D supports DSN
                                |___ N normalized value

Pending Defects log (GP Log 0x0c) not supported

SATA Phy Event Counters (GP Log 0x11)
ID      Size     Value  Description
0x0001  2            0  Command failed due to ICRC error
0x0002  2            0  R_ERR response for data FIS
0x0003  2            0  R_ERR response for device-to-host data FIS
0x0004  2            0  R_ERR response for host-to-device data FIS
0x0005  2            0  R_ERR response for non-data FIS
0x0006  2            0  R_ERR response for device-to-host non-data FIS
0x0007  2            0  R_ERR response for host-to-device non-data FIS
0x0008  2            0  Device-to-host non-data FIS retries
0x0009  2            0  Transition from drive PhyRdy to drive PhyNRdy
0x000a  2           12  Device-to-host register FISes sent due to a COMRESET
0x000b  2            0  CRC errors within host-to-device FIS
0x000d  2            0  Non-CRC errors within host-to-device FIS
0x000f  2            0  R_ERR response for host-to-device data FIS, CRC
0x0010  2            0  R_ERR response for host-to-device data FIS, non-CRC
0x0012  2            0  R_ERR response for host-to-device non-data FIS, CRC
0x0013  2            0  R_ERR response for host-to-device non-data FIS, non-CRC

