smartctl 6.4 2014-10-07 r4002 [i686-linux-4.1.0-0.bpo.1-586] (local build)
Copyright (C) 2002-14, Bruce Allen, Christian Franke, www.smartmontools.org

=== START OF INFORMATION SECTION ===
Device Model:     ST2000DM008-2FR102
Serial Number:    WFL1NEJY
LU WWN Device Id: 5 000c50 0bf4ba06a
Firmware Version: 0001
User Capacity:    2.000.398.934.016 bytes [2,00 TB]
Sector Sizes:     512 bytes logical, 4096 bytes physical
Rotation Rate:    7200 rpm
Form Factor:      3.5 inches
Device is:        Not in smartctl database [for details use: -P showall]
ATA Version is:   ACS-3 T13/2161-D revision 5
SATA Version is:  SATA 3.1, 6.0 Gb/s (current: 3.0 Gb/s)
Local Time is:    Thu Mar 28 09:09:25 2019 CET
SMART support is: Available - device has SMART capability.
SMART support is: Enabled
AAM feature is:   Unavailable
APM level is:     254 (maximum performance)
Rd look-ahead is: Enabled
Write cache is:   Enabled
ATA Security is:  Disabled, NOT FROZEN [SEC1]
Wt Cache Reorder: Unavailable

=== START OF READ SMART DATA SECTION ===
SMART overall-health self-assessment test result: PASSED

General SMART Values:
Offline data collection status:  (0x00)	Offline data collection activity
					was never started.
					Auto Offline Data Collection: Disabled.
Self-test execution status:      (   0)	The previous self-test routine completed
					without error or no self-test has ever 
					been run.
Total time to complete Offline 
data collection: 		(    0) seconds.
Offline data collection
capabilities: 			 (0x73) SMART execute Offline immediate.
					Auto Offline data collection on/off support.
					Suspend Offline collection upon new
					command.
					No Offline surface scan supported.
					Self-test supported.
					Conveyance Self-test supported.
					Selective Self-test supported.
SMART capabilities:            (0x0003)	Saves SMART data before entering
					power-saving mode.
					Supports SMART auto save timer.
Error logging capability:        (0x01)	Error logging supported.
					General Purpose Logging supported.
Short self-test routine 
recommended polling time: 	 (   1) minutes.
Extended self-test routine
recommended polling time: 	 ( 195) minutes.
Conveyance self-test routine
recommended polling time: 	 (   2) minutes.
SCT capabilities: 	       (0x30a5)	SCT Status supported.
					SCT Data Table supported.

SMART Attributes Data Structure revision number: 10
Vendor Specific SMART Attributes with Thresholds:
ID# ATTRIBUTE_NAME          FLAGS    VALUE WORST THRESH FAIL RAW_VALUE
  1 Raw_Read_Error_Rate     POSR--   100   071   006    -    86350
  3 Spin_Up_Time            PO----   100   100   000    -    0
  4 Start_Stop_Count        -O--CK   100   100   020    -    2
  5 Reallocated_Sector_Ct   PO--CK   100   100   010    -    0
  7 Seek_Error_Rate         POSR--   061   060   045    -    1335262
  9 Power_On_Hours          -O--CK   100   100   000    -    87 (19 149 0)
 10 Spin_Retry_Count        PO--C-   100   100   097    -    0
 12 Power_Cycle_Count       -O--CK   100   100   020    -    3
183 Runtime_Bad_Block       -O--CK   100   100   000    -    0
184 End-to-End_Error        -O--CK   100   100   099    -    0
187 Reported_Uncorrect      -O--CK   100   100   000    -    0
188 Command_Timeout         -O--CK   100   100   000    -    17180131332
189 High_Fly_Writes         -O-RCK   100   100   000    -    0
190 Airflow_Temperature_Cel -O---K   068   065   040    -    32 (Min/Max 31/35)
191 G-Sense_Error_Rate      -O--CK   100   100   000    -    0
192 Power-Off_Retract_Count -O--CK   100   100   000    -    5
193 Load_Cycle_Count        -O--CK   100   100   000    -    6
194 Temperature_Celsius     -O---K   032   040   000    -    32 (0 28 0 0 0)
195 Hardware_ECC_Recovered  -O-RC-   100   071   000    -    86350
197 Current_Pending_Sector  -O--C-   100   100   000    -    0
198 Offline_Uncorrectable   ----C-   100   100   000    -    0
199 UDMA_CRC_Error_Count    -OSRCK   200   200   000    -    7
240 Head_Flying_Hours       ------   100   253   000    -    87 (38 84 0)
241 Total_LBAs_Written      ------   100   253   000    -    3908316286
242 Total_LBAs_Read         ------   100   253   000    -    83966
                            ||||||_ K auto-keep
                            |||||__ C event count
                            ||||___ R error rate
                            |||____ S speed/performance
                            ||_____ O updated online
                            |______ P prefailure warning

General Purpose Log Directory Version 1
SMART           Log Directory Version 1 [multi-sector log support]
Address    Access  R/W   Size  Description
0x00       GPL,SL  R/O      1  Log Directory
0x01           SL  R/O      1  Summary SMART error log
0x02           SL  R/O      5  Comprehensive SMART error log
0x03       GPL     R/O      5  Ext. Comprehensive SMART error log
0x04       GPL,SL  R/O      8  Device Statistics log
0x06           SL  R/O      1  SMART self-test log
0x07       GPL     R/O      1  Extended self-test log
0x09           SL  R/W      1  Selective self-test log
0x0c       GPL     R/O   2048  Pending Defects log
0x10       GPL     R/O      1  SATA NCQ Queued Error log
0x11       GPL     R/O      1  SATA Phy Event Counters log
0x21       GPL     R/O      1  Write stream error log
0x22       GPL     R/O      1  Read stream error log
0x24       GPL     R/O    512  Current Device Internal Status Data log
0x30       GPL,SL  R/O      9  IDENTIFY DEVICE data log
0x80-0x9f  GPL,SL  R/W     16  Host vendor specific log
0xa1       GPL,SL  VS      24  Device vendor specific log
0xa2       GPL     VS    8160  Device vendor specific log
0xa6       GPL     VS     192  Device vendor specific log
0xa8-0xa9  GPL,SL  VS     136  Device vendor specific log
0xab       GPL     VS       1  Device vendor specific log
0xb0       GPL     VS    9048  Device vendor specific log
0xbd       GPL     VS       8  Device vendor specific log
0xbe-0xbf  GPL     VS   65535  Device vendor specific log
0xc0       GPL,SL  VS       1  Device vendor specific log
0xc1       GPL,SL  VS      16  Device vendor specific log
0xc3       GPL,SL  VS       8  Device vendor specific log
0xc4       GPL,SL  VS      24  Device vendor specific log
0xd1       GPL     VS     264  Device vendor specific log
0xd3       GPL     VS    1920  Device vendor specific log
0xe0       GPL,SL  R/W      1  SCT Command/Status
0xe1       GPL,SL  R/W      1  SCT Data Transfer

SMART Extended Comprehensive Error Log Version: 1 (5 sectors)
No Errors Logged

SMART Extended Self-test Log Version: 1 (1 sectors)
Num  Test_Description    Status                  Remaining  LifeTime(hours)  LBA_of_first_error
# 1  Short offline       Completed without error       00%        87         -
# 2  Short offline       Completed without error       00%        81         -
# 3  Short offline       Completed without error       00%        57         -
# 4  Short offline       Completed without error       00%        33         -
# 5  Short offline       Completed without error       00%         9         -

SMART Selective self-test log data structure revision number 1
 SPAN  MIN_LBA  MAX_LBA  CURRENT_TEST_STATUS
    1        0        0  Not_testing
    2        0        0  Not_testing
    3        0        0  Not_testing
    4        0        0  Not_testing
    5        0        0  Not_testing
Selective self-test flags (0x0):
  After scanning selected spans, do NOT read-scan remainder of disk.
If Selective self-test is pending on power-up, resume after 0 minute delay.

SCT Status Version:                  3
SCT Version (vendor specific):       522 (0x020a)
SCT Support Level:                   1
Device State:                        Active (0)
Current Temperature:                    32 Celsius
Power Cycle Min/Max Temperature:     31/35 Celsius
Lifetime    Min/Max Temperature:     28/35 Celsius
Under/Over Temperature Limit Count:   0/0

SCT Temperature History Version:     2
Temperature Sampling Period:         3 minutes
Temperature Logging Interval:        59 minutes
Min/Max recommended Temperature:     14/55 Celsius
Min/Max Temperature Limit:           10/60 Celsius
Temperature History Size (Index):    128 (94)

Index    Estimated Time   Temperature Celsius
  95    2019-03-23 03:52     ?  -
 ...    ..( 31 skipped).    ..  -
 127    2019-03-24 11:20     ?  -
   0    2019-03-24 12:19    29  **********
   1    2019-03-24 13:18     ?  -
   2    2019-03-24 14:17    28  *********
   3    2019-03-24 15:16    32  *************
   4    2019-03-24 16:15     ?  -
   5    2019-03-24 17:14    31  ************
   6    2019-03-24 18:13     ?  -
   7    2019-03-24 19:12    31  ************
   8    2019-03-24 20:11    35  ****************
   9    2019-03-24 21:10    35  ****************
  10    2019-03-24 22:09    35  ****************
  11    2019-03-24 23:08    34  ***************
 ...    ..(  2 skipped).    ..  ***************
  14    2019-03-25 02:05    34  ***************
  15    2019-03-25 03:04    35  ****************
  16    2019-03-25 04:03    33  **************
  17    2019-03-25 05:02    33  **************
  18    2019-03-25 06:01    33  **************
  19    2019-03-25 07:00    32  *************
 ...    ..(  9 skipped).    ..  *************
  29    2019-03-25 16:50    32  *************
  30    2019-03-25 17:49    33  **************
 ...    ..( 13 skipped).    ..  **************
  44    2019-03-26 07:35    33  **************
  45    2019-03-26 08:34    32  *************
 ...    ..( 48 skipped).    ..  *************
  94    2019-03-28 08:45    32  *************

SCT Error Recovery Control command not supported

Device Statistics (GP Log 0x04)
Page Offset Size         Value  Description
  1  =====  =                =  == General Statistics (rev 1) ==
  1  0x008  4                3  Lifetime Power-On Resets
  1  0x010  4               87  Power-on Hours
  1  0x018  6       3908316286  Logical Sectors Written
  1  0x020  6          4032825  Number of Write Commands
  1  0x028  6            83966  Logical Sectors Read
  1  0x030  6             1517  Number of Read Commands
  1  0x038  6                -  Date and Time TimeStamp
  3  =====  =                =  == Rotating Media Statistics (rev 1) ==
  3  0x008  4       2337644294~ Spindle Motor Power-on Hours
  3  0x010  4       2337644294~ Head Flying Hours
  3  0x018  4                6  Head Load Events
  3  0x020  4                0  Number of Reallocated Logical Sectors
  3  0x028  4                0  Read Recovery Attempts
  3  0x030  4                0  Number of Mechanical Start Failures
  3  0x038  4                0  Number of Realloc. Candidate Logical Sectors
  3  0x040  7                5  Unknown
  4  =====  =                =  == General Errors Statistics (rev 1) ==
  4  0x008  4                0  Number of Reported Uncorrectable Errors
  4  0x010  4                4  Resets Between Cmd Acceptance and Completion
  5  =====  =                =  == Temperature Statistics (rev 1) ==
  5  0x008  1               32  Current Temperature
  5  0x010  1               32  Average Short Term Temperature
  5  0x018  1                -  Average Long Term Temperature
  5  0x020  1               35  Highest Temperature
  5  0x028  1               32  Lowest Temperature
  5  0x030  1               32  Highest Average Short Term Temperature
  5  0x038  1               32  Lowest Average Short Term Temperature
  5  0x040  1                -  Highest Average Long Term Temperature
  5  0x048  1                -  Lowest Average Long Term Temperature
  5  0x050  4                0  Time in Over-Temperature
  5  0x058  1               55  Specified Maximum Operating Temperature
  5  0x060  4                0  Time in Under-Temperature
  5  0x068  1               13  Specified Minimum Operating Temperature
  6  =====  =                =  == Transport Statistics (rev 1) ==
  6  0x008  4                0  Number of Hardware Resets
  6  0x010  4                0  Number of ASR Events
  6  0x018  4               11  Number of Interface CRC Errors
                              |_ ~ normalized value

SATA Phy Event Counters (GP Log 0x11)
ID      Size     Value  Description
0x000a  2            1  Device-to-host register FISes sent due to a COMRESET
0x0001  2            0  Command failed due to ICRC error
0x0003  2            0  R_ERR response for device-to-host data FIS
0x0004  2            0  R_ERR response for host-to-device data FIS
0x0006  2            0  R_ERR response for device-to-host non-data FIS
0x0007  2            0  R_ERR response for host-to-device non-data FIS

