smartctl 7.2 2020-12-30 r5155 [x86_64-linux-5.9.0-0.bpo.5-amd64] (local build)
Copyright (C) 2002-20, Bruce Allen, Christian Franke, www.smartmontools.org

=== START OF INFORMATION SECTION ===
Device Model:     ST33000650NS         81Y9799 81Y3865IBM
Firmware Version: BB3A
User Capacity:    3,000,592,982,016 bytes [3.00 TB]
Sector Size:      512 bytes logical/physical
Rotation Rate:    7200 rpm
Form Factor:      3.5 inches
Device is:        Not in smartctl database [for details use: -P showall]
ATA Version is:   ATA8-ACS T13/1699-D revision 4
SATA Version is:  SATA 3.0, 6.0 Gb/s (current: 6.0 Gb/s)
Local Time is:    Sat Jan 23 12:14:03 2021 CET
SMART support is: Available - device has SMART capability.
SMART support is: Enabled
AAM feature is:   Unavailable
APM feature is:   Unavailable
Rd look-ahead is: Enabled
Write cache is:   Enabled
DSN feature is:   Unavailable
ATA Security is:  Disabled, NOT FROZEN [SEC1]
Wt Cache Reorder: Enabled

=== START OF READ SMART DATA SECTION ===
SMART overall-health self-assessment test result: PASSED

General SMART Values:
Offline data collection status:  (0x82)	Offline data collection activity
					was completed without error.
					Auto Offline Data Collection: Enabled.
Self-test execution status:      (   0)	The previous self-test routine completed
					without error or no self-test has ever 
					been run.
Total time to complete Offline 
data collection: 		(  600) seconds.
Offline data collection
capabilities: 			 (0x7b) SMART execute Offline immediate.
					Auto Offline data collection on/off support.
					Suspend Offline collection upon new
					command.
					Offline surface scan supported.
					Self-test supported.
					Conveyance Self-test supported.
					Selective Self-test supported.
SMART capabilities:            (0x0003)	Saves SMART data before entering
					power-saving mode.
					Supports SMART auto save timer.
Error logging capability:        (0x01)	Error logging supported.
					General Purpose Logging supported.
Short self-test routine 
recommended polling time: 	 (   1) minutes.
Extended self-test routine
recommended polling time: 	 ( 449) minutes.
Conveyance self-test routine
recommended polling time: 	 (   2) minutes.
SCT capabilities: 	       (0x10bd)	SCT Status supported.
					SCT Error Recovery Control supported.
					SCT Feature Control supported.
					SCT Data Table supported.

SMART Attributes Data Structure revision number: 10
Vendor Specific SMART Attributes with Thresholds:
ID# ATTRIBUTE_NAME          FLAGS    VALUE WORST THRESH FAIL RAW_VALUE
  1 Raw_Read_Error_Rate     POSR--   083   063   044    -    215501638
  3 Spin_Up_Time            PO----   092   091   000    -    0
  4 Start_Stop_Count        -O--CK   100   100   020    -    107
  5 Reallocated_Sector_Ct   PO--CK   100   100   036    -    0
  7 Seek_Error_Rate         POSR--   082   060   030    -    4491419574
  9 Power_On_Hours          -O--CK   025   025   000    -    66216
 10 Spin_Retry_Count        PO--C-   100   100   097    -    0
 12 Power_Cycle_Count       -O--CK   100   100   020    -    107
184 End-to-End_Error        -O--CK   100   100   099    -    0
187 Reported_Uncorrect      -O--CK   087   087   000    -    13
188 Command_Timeout         -O--CK   100   099   000    -    4295032833
189 High_Fly_Writes         -O-RCK   100   100   000    -    0
190 Airflow_Temperature_Cel -O---K   067   046   045    -    33 (Min/Max 30/35)
191 G-Sense_Error_Rate      -O--CK   100   100   000    -    0
192 Power-Off_Retract_Count -O--CK   100   100   000    -    105
193 Load_Cycle_Count        -O--CK   099   099   000    -    2845
194 Temperature_Celsius     -O---K   033   054   000    -    33 (0 24 0 0 0)
195 Hardware_ECC_Recovered  -O-RC-   023   004   000    -    215501638
197 Current_Pending_Sector  -O--C-   100   100   000    -    0
198 Offline_Uncorrectable   ----C-   100   100   000    -    0
199 UDMA_CRC_Error_Count    -OSRCK   200   200   000    -    0
                            ||||||_ K auto-keep
                            |||||__ C event count
                            ||||___ R error rate
                            |||____ S speed/performance
                            ||_____ O updated online
                            |______ P prefailure warning

General Purpose Log Directory Version 1
SMART           Log Directory Version 1 [multi-sector log support]
Address    Access  R/W   Size  Description
0x00       GPL,SL  R/O      1  Log Directory
0x01           SL  R/O      1  Summary SMART error log
0x02           SL  R/O      5  Comprehensive SMART error log
0x03       GPL     R/O      5  Ext. Comprehensive SMART error log
0x06           SL  R/O      1  SMART self-test log
0x07       GPL     R/O      1  Extended self-test log
0x08       GPL,SL  R/O      2  Power Conditions log
0x09           SL  R/W      1  Selective self-test log
0x10       GPL     R/O      1  NCQ Command Error log
0x11       GPL     R/O      1  SATA Phy Event Counters log
0x21       GPL     R/O      1  Write stream error log
0x22       GPL     R/O      1  Read stream error log
0x80-0x9f  GPL,SL  R/W     16  Host vendor specific log
0xa1       GPL,SL  VS      20  Device vendor specific log
0xa2       GPL     VS    4496  Device vendor specific log
0xa8       GPL,SL  VS     129  Device vendor specific log
0xa9       GPL,SL  VS       1  Device vendor specific log
0xb0       GPL,SL  VS       1  Device vendor specific log
0xbd       GPL     VS     252  Device vendor specific log
0xbe-0xbf  GPL     VS   65535  Device vendor specific log
0xe0       GPL,SL  R/W      1  SCT Command/Status
0xe1       GPL,SL  R/W      1  SCT Data Transfer

SMART Extended Comprehensive Error Log Version: 1 (5 sectors)
Device Error Count: 23 (device log contains only the most recent 20 errors)
	CR     = Command Register
	FEATR  = Features Register
	COUNT  = Count (was: Sector Count) Register
	LBA_48 = Upper bytes of LBA High/Mid/Low Registers ]  ATA-8
	LH     = LBA High (was: Cylinder High) Register    ]   LBA
	LM     = LBA Mid (was: Cylinder Low) Register      ] Register
	LL     = LBA Low (was: Sector Number) Register     ]
	DV     = Device (was: Device/Head) Register
	DC     = Device Control Register
	ER     = Error register
	ST     = Status register
Powered_Up_Time is measured from power on, and printed as
DDd+hh:mm:SS.sss where DD=days, hh=hours, mm=minutes,
SS=sec, and sss=millisec. It "wraps" after 49.710 days.

Error 23 [2] occurred at disk power-on lifetime: 57246 hours (2385 days + 6 hours)
  When the command that caused the error occurred, the device was active or idle.

  After command completion occurred, registers were:
  ER -- ST COUNT  LBA_48  LH LM LL DV DC
  -- -- -- == -- == == == -- -- -- -- --
  40 -- 51 00 00 00 00 6c 24 18 14 00 00  Error: UNC at LBA = 0x6c241814 = 1814304788

  Commands leading to the command that caused the error were:
  CR FEATR COUNT  LBA_48  LH LM LL DV DC  Powered_Up_Time  Command/Feature_Name
  -- == -- == -- == == == -- -- -- -- --  ---------------  --------------------
  60 00 00 01 00 00 00 6c 23 e3 00 40 00 41d+20:04:47.822  READ FPDMA QUEUED
  60 00 00 01 00 00 00 6c 23 e2 00 40 00 41d+20:04:47.814  READ FPDMA QUEUED
  60 00 00 01 00 00 00 6c 23 e1 00 40 00 41d+20:04:47.813  READ FPDMA QUEUED
  42 00 00 01 00 00 00 6c 23 e0 00 40 00 41d+20:04:47.804  READ VERIFY SECTOR(S) EXT
  61 00 00 01 00 00 00 6c 23 e0 00 40 00 41d+20:04:47.680  WRITE FPDMA QUEUED

Error 22 [1] occurred at disk power-on lifetime: 57246 hours (2385 days + 6 hours)
  When the command that caused the error occurred, the device was active or idle.

  After command completion occurred, registers were:
  ER -- ST COUNT  LBA_48  LH LM LL DV DC
  -- -- -- == -- == == == -- -- -- -- --
  40 -- 51 00 00 00 00 6c 23 e0 0a 00 00  Error: UNC at LBA = 0x6c23e00a = 1814290442

  Commands leading to the command that caused the error were:
  CR FEATR COUNT  LBA_48  LH LM LL DV DC  Powered_Up_Time  Command/Feature_Name
  -- == -- == -- == == == -- -- -- -- --  ---------------  --------------------
  60 00 00 01 00 00 00 6c 18 d5 00 40 00 41d+20:04:42.288  READ FPDMA QUEUED
  60 00 00 01 00 00 00 6c 18 d4 00 40 00 41d+20:04:42.275  READ FPDMA QUEUED
  60 00 00 01 00 00 00 6c 18 d3 00 40 00 41d+20:04:42.274  READ FPDMA QUEUED
  60 00 00 01 00 00 00 6c 18 d2 00 40 00 41d+20:04:42.273  READ FPDMA QUEUED
  60 00 00 01 00 00 00 63 cc 47 00 40 00 41d+20:04:42.191  READ FPDMA QUEUED

Error 21 [0] occurred at disk power-on lifetime: 57245 hours (2385 days + 5 hours)
  When the command that caused the error occurred, the device was active or idle.

  After command completion occurred, registers were:
  ER -- ST COUNT  LBA_48  LH LM LL DV DC
  -- -- -- == -- == == == -- -- -- -- --
  40 -- 51 00 00 00 00 6c 24 3d 0b 00 00  Error: UNC at LBA = 0x6c243d0b = 1814314251

  Commands leading to the command that caused the error were:
  CR FEATR COUNT  LBA_48  LH LM LL DV DC  Powered_Up_Time  Command/Feature_Name
  -- == -- == -- == == == -- -- -- -- --  ---------------  --------------------
  60 00 00 00 28 00 00 6c 24 3d 00 40 00 41d+19:05:39.226  READ FPDMA QUEUED
  60 00 00 01 00 00 00 4a 83 a5 00 40 00 41d+19:05:39.225  READ FPDMA QUEUED
  60 00 00 01 00 00 00 6c 24 3f 00 40 00 41d+19:05:39.199  READ FPDMA QUEUED
  60 00 00 01 00 00 00 6c 24 3e 00 40 00 41d+19:05:39.190  READ FPDMA QUEUED
  60 00 00 00 0b 00 00 6c 24 3d 00 40 00 41d+19:05:39.137  READ FPDMA QUEUED

Error 20 [19] occurred at disk power-on lifetime: 57245 hours (2385 days + 5 hours)
  When the command that caused the error occurred, the device was active or idle.

  After command completion occurred, registers were:
  ER -- ST COUNT  LBA_48  LH LM LL DV DC
  -- -- -- == -- == == == -- -- -- -- --
  40 -- 51 00 00 00 00 6c 24 3d 0b 00 00  Error: UNC at LBA = 0x6c243d0b = 1814314251

  Commands leading to the command that caused the error were:
  CR FEATR COUNT  LBA_48  LH LM LL DV DC  Powered_Up_Time  Command/Feature_Name
  -- == -- == -- == == == -- -- -- -- --  ---------------  --------------------
  60 00 00 01 00 00 00 6c 24 3d 00 40 00 41d+19:05:36.482  READ FPDMA QUEUED
  60 00 00 01 00 00 00 6c 24 3c 00 40 00 41d+19:05:36.477  READ FPDMA QUEUED
  60 00 00 01 00 00 00 6c 24 3a 00 40 00 41d+19:05:36.465  READ FPDMA QUEUED
  60 00 00 01 00 00 00 6c 24 39 00 40 00 41d+19:05:36.458  READ FPDMA QUEUED
  60 00 00 01 00 00 00 6c 24 38 00 40 00 41d+19:05:36.452  READ FPDMA QUEUED

Error 19 [18] occurred at disk power-on lifetime: 57245 hours (2385 days + 5 hours)
  When the command that caused the error occurred, the device was active or idle.

  After command completion occurred, registers were:
  ER -- ST COUNT  LBA_48  LH LM LL DV DC
  -- -- -- == -- == == == -- -- -- -- --
  40 -- 51 00 00 00 00 6c 24 33 ce 00 00  Error: UNC at LBA = 0x6c2433ce = 1814311886

  Commands leading to the command that caused the error were:
  CR FEATR COUNT  LBA_48  LH LM LL DV DC  Powered_Up_Time  Command/Feature_Name
  -- == -- == -- == == == -- -- -- -- --  ---------------  --------------------
  60 00 00 00 32 00 00 6c 24 33 ce 40 00 41d+19:05:33.120  READ FPDMA QUEUED
  60 00 00 01 00 00 00 4a 83 a3 00 40 00 41d+19:05:33.119  READ FPDMA QUEUED
  60 00 00 00 a5 00 00 6c 24 33 28 40 00 41d+19:05:33.103  READ FPDMA QUEUED
  2f 00 00 00 01 00 00 00 00 00 10 00 00 41d+19:05:33.058  READ LOG EXT
  60 00 00 01 00 00 00 6c 24 37 00 40 00 41d+19:05:30.478  READ FPDMA QUEUED

Error 18 [17] occurred at disk power-on lifetime: 57245 hours (2385 days + 5 hours)
  When the command that caused the error occurred, the device was active or idle.

  After command completion occurred, registers were:
  ER -- ST COUNT  LBA_48  LH LM LL DV DC
  -- -- -- == -- == == == -- -- -- -- --
  40 -- 51 00 00 00 00 6c 24 33 cd 00 00  Error: UNC at LBA = 0x6c2433cd = 1814311885

  Commands leading to the command that caused the error were:
  CR FEATR COUNT  LBA_48  LH LM LL DV DC  Powered_Up_Time  Command/Feature_Name
  -- == -- == -- == == == -- -- -- -- --  ---------------  --------------------
  60 00 00 01 00 00 00 6c 24 37 00 40 00 41d+19:05:30.478  READ FPDMA QUEUED
  60 00 00 00 d8 00 00 6c 24 33 28 40 00 41d+19:05:30.478  READ FPDMA QUEUED
  60 00 00 00 28 00 00 6c 24 33 00 40 00 41d+19:05:30.478  READ FPDMA QUEUED
  60 00 00 01 00 00 00 4a 83 a2 00 40 00 41d+19:05:30.477  READ FPDMA QUEUED
  60 00 00 01 00 00 00 4a 83 a1 00 40 00 41d+19:05:30.476  READ FPDMA QUEUED

Error 17 [16] occurred at disk power-on lifetime: 57245 hours (2385 days + 5 hours)
  When the command that caused the error occurred, the device was active or idle.

  After command completion occurred, registers were:
  ER -- ST COUNT  LBA_48  LH LM LL DV DC
  -- -- -- == -- == == == -- -- -- -- --
  40 -- 51 00 00 00 00 6c 24 33 cd 00 00  Error: UNC at LBA = 0x6c2433cd = 1814311885

  Commands leading to the command that caused the error were:
  CR FEATR COUNT  LBA_48  LH LM LL DV DC  Powered_Up_Time  Command/Feature_Name
  -- == -- == -- == == == -- -- -- -- --  ---------------  --------------------
  60 00 00 01 00 00 00 6c 24 33 00 40 00 41d+19:05:27.787  READ FPDMA QUEUED
  60 00 00 01 00 00 00 6c 24 32 00 40 00 41d+19:05:27.782  READ FPDMA QUEUED
  60 00 00 01 00 00 00 6c 24 31 00 40 00 41d+19:05:27.776  READ FPDMA QUEUED
  60 00 00 01 00 00 00 6c 24 30 00 40 00 41d+19:05:27.771  READ FPDMA QUEUED
  60 00 00 01 00 00 00 6c 24 2f 00 40 00 41d+19:05:27.764  READ FPDMA QUEUED

Error 16 [15] occurred at disk power-on lifetime: 57245 hours (2385 days + 5 hours)
  When the command that caused the error occurred, the device was active or idle.

  After command completion occurred, registers were:
  ER -- ST COUNT  LBA_48  LH LM LL DV DC
  -- -- -- == -- == == == -- -- -- -- --
  40 -- 51 00 00 00 00 6c 24 2a 90 00 00  Error: UNC at LBA = 0x6c242a90 = 1814309520

  Commands leading to the command that caused the error were:
  CR FEATR COUNT  LBA_48  LH LM LL DV DC  Powered_Up_Time  Command/Feature_Name
  -- == -- == -- == == == -- -- -- -- --  ---------------  --------------------
  60 00 00 00 d8 00 00 6c 24 2a 28 40 00 41d+19:05:24.834  READ FPDMA QUEUED
  60 00 00 01 00 00 00 4a 83 9b 00 40 00 41d+19:05:24.834  READ FPDMA QUEUED
  60 00 00 00 28 00 00 6c 24 2a 00 40 00 41d+19:05:24.824  READ FPDMA QUEUED
  60 00 00 01 00 00 00 4a 83 9a 00 40 00 41d+19:05:24.819  READ FPDMA QUEUED
  60 00 00 01 00 00 00 6c 24 2c 00 40 00 41d+19:05:24.818  READ FPDMA QUEUED

SMART Extended Self-test Log Version: 1 (1 sectors)
Num  Test_Description    Status                  Remaining  LifeTime(hours)  LBA_of_first_error
# 1  Short offline       Completed without error       00%       680         -
# 2  Extended offline    Completed without error       00%       671         -

SMART Selective self-test log data structure revision number 1
 SPAN  MIN_LBA  MAX_LBA  CURRENT_TEST_STATUS
    1        0        0  Not_testing
    2        0        0  Not_testing
    3        0        0  Not_testing
    4        0        0  Not_testing
    5        0        0  Not_testing
Selective self-test flags (0x0):
  After scanning selected spans, do NOT read-scan remainder of disk.
If Selective self-test is pending on power-up, resume after 0 minute delay.

SCT Status Version:                  3
SCT Version (vendor specific):       522 (0x020a)
Device State:                        Active (0)
Current Temperature:                    33 Celsius
Power Cycle Min/Max Temperature:     30/35 Celsius
Lifetime    Min/Max Temperature:     23/54 Celsius
Under/Over Temperature Limit Count:   0/151

SCT Temperature History Version:     2
Temperature Sampling Period:         1 minute
Temperature Logging Interval:        10 minutes
Min/Max recommended Temperature:      0/ 0 Celsius
Min/Max Temperature Limit:            0/ 0 Celsius
Temperature History Size (Index):    128 (79)

Index    Estimated Time   Temperature Celsius
  80    2021-01-22 15:00    33  **************
 ...    ..( 21 skipped).    ..  **************
 102    2021-01-22 18:40    33  **************
 103    2021-01-22 18:50    32  *************
 104    2021-01-22 19:00    33  **************
 ...    ..(  4 skipped).    ..  **************
 109    2021-01-22 19:50    33  **************
 110    2021-01-22 20:00    32  *************
 111    2021-01-22 20:10    33  **************
 112    2021-01-22 20:20    32  *************
 113    2021-01-22 20:30    33  **************
 114    2021-01-22 20:40    33  **************
 115    2021-01-22 20:50    34  ***************
 116    2021-01-22 21:00    34  ***************
 117    2021-01-22 21:10    34  ***************
 118    2021-01-22 21:20    35  ****************
 119    2021-01-22 21:30    34  ***************
 120    2021-01-22 21:40    35  ****************
 121    2021-01-22 21:50    34  ***************
 ...    ..(  4 skipped).    ..  ***************
 126    2021-01-22 22:40    34  ***************
 127    2021-01-22 22:50    35  ****************
   0    2021-01-22 23:00    34  ***************
 ...    ..( 26 skipped).    ..  ***************
  27    2021-01-23 03:30    34  ***************
  28    2021-01-23 03:40    33  **************
 ...    ..(  2 skipped).    ..  **************
  31    2021-01-23 04:10    33  **************
  32    2021-01-23 04:20    32  *************
  33    2021-01-23 04:30    33  **************
  34    2021-01-23 04:40    32  *************
  35    2021-01-23 04:50    33  **************
  36    2021-01-23 05:00    32  *************
  37    2021-01-23 05:10    33  **************
  38    2021-01-23 05:20    32  *************
  39    2021-01-23 05:30    33  **************
  40    2021-01-23 05:40    32  *************
  41    2021-01-23 05:50    33  **************
  42    2021-01-23 06:00    32  *************
  43    2021-01-23 06:10    33  **************
  44    2021-01-23 06:20    32  *************
  45    2021-01-23 06:30    33  **************
  46    2021-01-23 06:40    32  *************
  47    2021-01-23 06:50    32  *************
  48    2021-01-23 07:00    33  **************
  49    2021-01-23 07:10    32  *************
  50    2021-01-23 07:20    33  **************
  51    2021-01-23 07:30    32  *************
  52    2021-01-23 07:40    33  **************
  53    2021-01-23 07:50    32  *************
  54    2021-01-23 08:00    33  **************
  55    2021-01-23 08:10    34  ***************
  56    2021-01-23 08:20    33  **************
  57    2021-01-23 08:30    32  *************
  58    2021-01-23 08:40    33  **************
 ...    ..(  4 skipped).    ..  **************
  63    2021-01-23 09:30    33  **************
  64    2021-01-23 09:40    32  *************
  65    2021-01-23 09:50    33  **************
  66    2021-01-23 10:00    32  *************
  67    2021-01-23 10:10    33  **************
  68    2021-01-23 10:20    32  *************
  69    2021-01-23 10:30    33  **************
  70    2021-01-23 10:40    32  *************
  71    2021-01-23 10:50    33  **************
  72    2021-01-23 11:00    32  *************
  73    2021-01-23 11:10    33  **************
  74    2021-01-23 11:20    32  *************
  75    2021-01-23 11:30    33  **************
 ...    ..(  3 skipped).    ..  **************
  79    2021-01-23 12:10    33  **************

SCT Error Recovery Control:
           Read:    300 (30.0 seconds)
          Write:    300 (30.0 seconds)

Device Statistics (GP/SMART Log 0x04) not supported

Pending Defects log (GP Log 0x0c) not supported

SATA Phy Event Counters (GP Log 0x11)
ID      Size     Value  Description
0x000a  2            2  Device-to-host register FISes sent due to a COMRESET
0x0001  2            0  Command failed due to ICRC error
0x0003  2            0  R_ERR response for device-to-host data FIS
0x0004  2            0  R_ERR response for host-to-device data FIS
0x0006  2            0  R_ERR response for device-to-host non-data FIS
0x0007  2            0  R_ERR response for host-to-device non-data FIS

