smartctl 7.0 2019-03-31 r4903 [x86_64-linux-5.1.12-300.fc30.x86_64] (local build)
Copyright (C) 2002-18, Bruce Allen, Christian Franke, www.smartmontools.org

=== START OF INFORMATION SECTION ===
Device Model:     WDC WD60EFAX-68SHWN0
Firmware Version: 82.00A82
User Capacity:    6,001,175,126,016 bytes [6.00 TB]
Sector Sizes:     512 bytes logical, 4096 bytes physical
Rotation Rate:    5400 rpm
Form Factor:      3.5 inches
Device is:        Not in smartctl database [for details use: -P showall]
ATA Version is:   ACS-3 T13/2161-D revision 5
SATA Version is:  SATA 3.1, 6.0 Gb/s (current: 6.0 Gb/s)
Local Time is:    Thu Jun 27 13:58:47 2019 CEST
SMART support is: Available - device has SMART capability.
SMART support is: Enabled
AAM feature is:   Unavailable
APM feature is:   Unavailable
Rd look-ahead is: Enabled
Write cache is:   Enabled
DSN feature is:   Unavailable
ATA Security is:  Disabled, frozen [SEC2]
Wt Cache Reorder: Enabled

=== START OF READ SMART DATA SECTION ===
SMART overall-health self-assessment test result: PASSED

General SMART Values:
Offline data collection status:  (0x00)	Offline data collection activity
					was never started.
					Auto Offline Data Collection: Disabled.
Self-test execution status:      (   0)	The previous self-test routine completed
					without error or no self-test has ever 
					been run.
Total time to complete Offline 
data collection: 		(   60) seconds.
Offline data collection
capabilities: 			 (0x7b) SMART execute Offline immediate.
					Auto Offline data collection on/off support.
					Suspend Offline collection upon new
					command.
					Offline surface scan supported.
					Self-test supported.
					Conveyance Self-test supported.
					Selective Self-test supported.
SMART capabilities:            (0x0003)	Saves SMART data before entering
					power-saving mode.
					Supports SMART auto save timer.
Error logging capability:        (0x01)	Error logging supported.
					General Purpose Logging supported.
Short self-test routine 
recommended polling time: 	 (   2) minutes.
Extended self-test routine
recommended polling time: 	 (   7) minutes.
Conveyance self-test routine
recommended polling time: 	 (   2) minutes.
SCT capabilities: 	       (0x303d)	SCT Status supported.
					SCT Error Recovery Control supported.
					SCT Feature Control supported.
					SCT Data Table supported.

SMART Attributes Data Structure revision number: 16
Vendor Specific SMART Attributes with Thresholds:
ID# ATTRIBUTE_NAME          FLAGS    VALUE WORST THRESH FAIL RAW_VALUE
  1 Raw_Read_Error_Rate     POSR-K   100   253   051    -    0
  3 Spin_Up_Time            POS--K   226   226   021    -    3666
  4 Start_Stop_Count        -O--CK   100   100   000    -    6
  5 Reallocated_Sector_Ct   PO--CK   200   200   140    -    0
  7 Seek_Error_Rate         -OSR-K   100   253   000    -    0
  9 Power_On_Hours          -O--CK   100   100   000    -    7
 10 Spin_Retry_Count        -O--CK   100   253   000    -    0
 11 Calibration_Retry_Count -O--CK   100   253   000    -    0
 12 Power_Cycle_Count       -O--CK   100   100   000    -    6
192 Power-Off_Retract_Count -O--CK   200   200   000    -    0
193 Load_Cycle_Count        -O--CK   200   200   000    -    6
194 Temperature_Celsius     -O---K   122   111   000    -    28
196 Reallocated_Event_Count -O--CK   200   200   000    -    0
197 Current_Pending_Sector  -O--CK   200   200   000    -    0
198 Offline_Uncorrectable   ----CK   100   253   000    -    0
199 UDMA_CRC_Error_Count    -O--CK   200   200   000    -    0
200 Multi_Zone_Error_Rate   ---R--   200   200   000    -    0
                            ||||||_ K auto-keep
                            |||||__ C event count
                            ||||___ R error rate
                            |||____ S speed/performance
                            ||_____ O updated online
                            |______ P prefailure warning

General Purpose Log Directory Version 1
SMART           Log Directory Version 1 [multi-sector log support]
Address    Access  R/W   Size  Description
0x00       GPL,SL  R/O      1  Log Directory
0x01           SL  R/O      1  Summary SMART error log
0x02           SL  R/O      5  Comprehensive SMART error log
0x03       GPL     R/O      6  Ext. Comprehensive SMART error log
0x04       GPL     R/O    256  Device Statistics log
0x04       SL      R/O      8  Device Statistics log
0x06           SL  R/O      1  SMART self-test log
0x07       GPL     R/O      1  Extended self-test log
0x09           SL  R/W      1  Selective self-test log
0x0c       GPL     R/O   2048  Pending Defects log
0x10       GPL     R/O      1  NCQ Command Error log
0x11       GPL     R/O      1  SATA Phy Event Counters log
0x24       GPL     R/O    291  Current Device Internal Status Data log
0x30       GPL,SL  R/O      9  IDENTIFY DEVICE data log
0x80-0x9f  GPL,SL  R/W     16  Host vendor specific log
0xa0-0xa7  GPL,SL  VS      16  Device vendor specific log
0xa8-0xb6  GPL,SL  VS       1  Device vendor specific log
0xb7       GPL,SL  VS      78  Device vendor specific log
0xb9       GPL,SL  VS       4  Device vendor specific log
0xbd       GPL,SL  VS       1  Device vendor specific log
0xc0       GPL,SL  VS       1  Device vendor specific log
0xc1       GPL     VS      93  Device vendor specific log
0xe0       GPL,SL  R/W      1  SCT Command/Status
0xe1       GPL,SL  R/W      1  SCT Data Transfer

SMART Extended Comprehensive Error Log Version: 1 (6 sectors)
No Errors Logged

SMART Extended Self-test Log Version: 1 (1 sectors)
Num  Test_Description    Status                  Remaining  LifeTime(hours)  LBA_of_first_error
# 1  Extended offline    Completed without error       00%         0         -
# 2  Conveyance offline  Completed without error       00%         0         -

SMART Selective self-test log data structure revision number 1
 SPAN  MIN_LBA  MAX_LBA  CURRENT_TEST_STATUS
    1        0        0  Not_testing
    2        0        0  Not_testing
    3        0        0  Not_testing
    4        0        0  Not_testing
    5        0        0  Not_testing
Selective self-test flags (0x0):
  After scanning selected spans, do NOT read-scan remainder of disk.
If Selective self-test is pending on power-up, resume after 0 minute delay.

SCT Status Version:                  3
SCT Version (vendor specific):       258 (0x0102)
Device State:                        Active (0)
Current Temperature:                    28 Celsius
Power Cycle Min/Max Temperature:     23/28 Celsius
Lifetime    Min/Max Temperature:     23/39 Celsius
Under/Over Temperature Limit Count:   0/0
Vendor specific:
01 00 00 00 00 00 00 00 00 00 00 00 00 00 00 00
00 00 00 00 00 00 00 00 00 00 00 00 00 00 00 00

SCT Temperature History Version:     2
Temperature Sampling Period:         1 minute
Temperature Logging Interval:        1 minute
Min/Max recommended Temperature:      0/65 Celsius
Min/Max Temperature Limit:           -41/85 Celsius
Temperature History Size (Index):    478 (445)

Index    Estimated Time   Temperature Celsius
 446    2019-06-27 06:01     ?  -
 ...    ..( 31 skipped).    ..  -
   0    2019-06-27 06:33     ?  -
   1    2019-06-27 06:34    27  ********
   2    2019-06-27 06:35    27  ********
   3    2019-06-27 06:36    27  ********
   4    2019-06-27 06:37    28  *********
   5    2019-06-27 06:38    28  *********
   6    2019-06-27 06:39    29  **********
   7    2019-06-27 06:40    29  **********
   8    2019-06-27 06:41    30  ***********
   9    2019-06-27 06:42    30  ***********
  10    2019-06-27 06:43    30  ***********
  11    2019-06-27 06:44    31  ************
 ...    ..(  2 skipped).    ..  ************
  14    2019-06-27 06:47    31  ************
  15    2019-06-27 06:48    32  *************
 ...    ..(  3 skipped).    ..  *************
  19    2019-06-27 06:52    32  *************
  20    2019-06-27 06:53    33  **************
 ...    ..(  5 skipped).    ..  **************
  26    2019-06-27 06:59    33  **************
  27    2019-06-27 07:00    34  ***************
 ...    ..( 11 skipped).    ..  ***************
  39    2019-06-27 07:12    34  ***************
  40    2019-06-27 07:13    35  ****************
  41    2019-06-27 07:14     ?  -
  42    2019-06-27 07:15    27  ********
 ...    ..(  2 skipped).    ..  ********
  45    2019-06-27 07:18    27  ********
  46    2019-06-27 07:19    28  *********
  47    2019-06-27 07:20    28  *********
  48    2019-06-27 07:21    28  *********
  49    2019-06-27 07:22    29  **********
  50    2019-06-27 07:23    29  **********
  51    2019-06-27 07:24    29  **********
  52    2019-06-27 07:25    30  ***********
  53    2019-06-27 07:26    30  ***********
  54    2019-06-27 07:27    31  ************
 ...    ..(  2 skipped).    ..  ************
  57    2019-06-27 07:30    31  ************
  58    2019-06-27 07:31    32  *************
 ...    ..(  9 skipped).    ..  *************
  68    2019-06-27 07:41    32  *************
  69    2019-06-27 07:42    33  **************
 ...    ..(  8 skipped).    ..  **************
  78    2019-06-27 07:51    33  **************
  79    2019-06-27 07:52     ?  -
  80    2019-06-27 07:53    24  *****
 ...    ..(  2 skipped).    ..  *****
  83    2019-06-27 07:56    24  *****
  84    2019-06-27 07:57    25  ******
  85    2019-06-27 07:58    25  ******
  86    2019-06-27 07:59    25  ******
  87    2019-06-27 08:00    26  *******
  88    2019-06-27 08:01    26  *******
  89    2019-06-27 08:02    26  *******
  90    2019-06-27 08:03    27  ********
 ...    ..(  2 skipped).    ..  ********
  93    2019-06-27 08:06    27  ********
  94    2019-06-27 08:07    28  *********
 ...    ..(  4 skipped).    ..  *********
  99    2019-06-27 08:12    28  *********
 100    2019-06-27 08:13    29  **********
 ...    ..(  6 skipped).    ..  **********
 107    2019-06-27 08:20    29  **********
 108    2019-06-27 08:21    30  ***********
 ...    ..(  8 skipped).    ..  ***********
 117    2019-06-27 08:30    30  ***********
 118    2019-06-27 08:31    31  ************
 ...    ..(  5 skipped).    ..  ************
 124    2019-06-27 08:37    31  ************
 125    2019-06-27 08:38     ?  -
 126    2019-06-27 08:39    24  *****
 127    2019-06-27 08:40    24  *****
 128    2019-06-27 08:41    24  *****
 129    2019-06-27 08:42    25  ******
 130    2019-06-27 08:43    25  ******
 131    2019-06-27 08:44    26  *******
 132    2019-06-27 08:45    26  *******
 133    2019-06-27 08:46    27  ********
 134    2019-06-27 08:47    27  ********
 135    2019-06-27 08:48    27  ********
 136    2019-06-27 08:49    28  *********
 137    2019-06-27 08:50    28  *********
 138    2019-06-27 08:51     ?  -
 139    2019-06-27 08:52    29  **********
 ...    ..(  2 skipped).    ..  **********
 142    2019-06-27 08:55    29  **********
 143    2019-06-27 08:56    30  ***********
 144    2019-06-27 08:57    30  ***********
 145    2019-06-27 08:58    30  ***********
 146    2019-06-27 08:59    31  ************
 ...    ..(  2 skipped).    ..  ************
 149    2019-06-27 09:02    31  ************
 150    2019-06-27 09:03    32  *************
 ...    ..(  3 skipped).    ..  *************
 154    2019-06-27 09:07    32  *************
 155    2019-06-27 09:08    33  **************
 ...    ..(  3 skipped).    ..  **************
 159    2019-06-27 09:12    33  **************
 160    2019-06-27 09:13    34  ***************
 ...    ..(  3 skipped).    ..  ***************
 164    2019-06-27 09:17    34  ***************
 165    2019-06-27 09:18    35  ****************
 ...    ..(  6 skipped).    ..  ****************
 172    2019-06-27 09:25    35  ****************
 173    2019-06-27 09:26    36  *****************
 ...    ..(  8 skipped).    ..  *****************
 182    2019-06-27 09:35    36  *****************
 183    2019-06-27 09:36    37  ******************
 ...    ..( 15 skipped).    ..  ******************
 199    2019-06-27 09:52    37  ******************
 200    2019-06-27 09:53    38  *******************
 ...    ..( 24 skipped).    ..  *******************
 225    2019-06-27 10:18    38  *******************
 226    2019-06-27 10:19    39  ********************
 ...    ..(205 skipped).    ..  ********************
 432    2019-06-27 13:45    39  ********************
 433    2019-06-27 13:46     ?  -
 434    2019-06-27 13:47    23  ****
 435    2019-06-27 13:48    23  ****
 436    2019-06-27 13:49    24  *****
 437    2019-06-27 13:50    24  *****
 438    2019-06-27 13:51    25  ******
 439    2019-06-27 13:52    25  ******
 440    2019-06-27 13:53    26  *******
 441    2019-06-27 13:54    26  *******
 442    2019-06-27 13:55    27  ********
 443    2019-06-27 13:56    27  ********
 444    2019-06-27 13:57    27  ********
 445    2019-06-27 13:58    28  *********

SCT Error Recovery Control:
           Read:     70 (7.0 seconds)
          Write:     70 (7.0 seconds)

Device Statistics (GP Log 0x04)
Page  Offset Size        Value Flags Description
0x01  =====  =               =  ===  == General Statistics (rev 1) ==
0x01  0x008  4               6  ---  Lifetime Power-On Resets
0x01  0x010  4               7  ---  Power-on Hours
0x01  0x018  6            2301  ---  Logical Sectors Written
0x01  0x020  6              11  ---  Number of Write Commands
0x01  0x028  6     11721284557  ---  Logical Sectors Read
0x01  0x030  6        45788458  ---  Number of Read Commands
0x01  0x038  6        25200000  ---  Date and Time TimeStamp
0x03  =====  =               =  ===  == Rotating Media Statistics (rev 1) ==
0x03  0x008  4               7  ---  Spindle Motor Power-on Hours
0x03  0x010  4               7  ---  Head Flying Hours
0x03  0x018  4               6  ---  Head Load Events
0x03  0x020  4               0  ---  Number of Reallocated Logical Sectors
0x03  0x028  4               0  ---  Read Recovery Attempts
0x03  0x030  4               0  ---  Number of Mechanical Start Failures
0x03  0x038  4               0  ---  Number of Realloc. Candidate Logical Sectors
0x03  0x040  4               0  ---  Number of High Priority Unload Events
0x04  =====  =               =  ===  == General Errors Statistics (rev 1) ==
0x04  0x008  4               0  ---  Number of Reported Uncorrectable Errors
0x04  0x010  4               0  ---  Resets Between Cmd Acceptance and Completion
0x05  =====  =               =  ===  == Temperature Statistics (rev 1) ==
0x05  0x008  1              28  ---  Current Temperature
0x05  0x010  1               -  ---  Average Short Term Temperature
0x05  0x018  1               -  ---  Average Long Term Temperature
0x05  0x020  1              39  ---  Highest Temperature
0x05  0x028  1              27  ---  Lowest Temperature
0x05  0x030  1               -  ---  Highest Average Short Term Temperature
0x05  0x038  1               -  ---  Lowest Average Short Term Temperature
0x05  0x040  1               -  ---  Highest Average Long Term Temperature
0x05  0x048  1               -  ---  Lowest Average Long Term Temperature
0x05  0x050  4               0  ---  Time in Over-Temperature
0x05  0x058  1              65  ---  Specified Maximum Operating Temperature
0x05  0x060  4               0  ---  Time in Under-Temperature
0x05  0x068  1               0  ---  Specified Minimum Operating Temperature
0x06  =====  =               =  ===  == Transport Statistics (rev 1) ==
0x06  0x008  4              22  ---  Number of Hardware Resets
0x06  0x010  4              12  ---  Number of ASR Events
0x06  0x018  4               0  ---  Number of Interface CRC Errors
0xff  =====  =               =  ===  == Vendor Specific Statistics (rev 1) ==
0xff  0x008  7               0  ---  Vendor Specific
0xff  0x010  7               0  ---  Vendor Specific
0xff  0x018  7               0  ---  Vendor Specific
                                |||_ C monitored condition met
                                ||__ D supports DSN
                                |___ N normalized value

Pending Defects log (GP Log 0x0c)
No Defects Logged

SATA Phy Event Counters (GP Log 0x11)
ID      Size     Value  Description
0x0001  2            0  Command failed due to ICRC error
0x0002  2            0  R_ERR response for data FIS
0x0003  2            0  R_ERR response for device-to-host data FIS
0x0004  2            0  R_ERR response for host-to-device data FIS
0x0005  2            0  R_ERR response for non-data FIS
0x0006  2            0  R_ERR response for device-to-host non-data FIS
0x0007  2            0  R_ERR response for host-to-device non-data FIS
0x0008  2            0  Device-to-host non-data FIS retries
0x0009  2            3  Transition from drive PhyRdy to drive PhyNRdy
0x000a  2            5  Device-to-host register FISes sent due to a COMRESET
0x000b  2            0  CRC errors within host-to-device FIS
0x000d  2            0  Non-CRC errors within host-to-device FIS
0x000f  2            0  R_ERR response for host-to-device data FIS, CRC
0x0012  2            0  R_ERR response for host-to-device non-data FIS, CRC
0x8000  4          732  Vendor specific

