smartctl 6.6 2016-05-31 r4324 [x86_64-linux-4.15.0-22-generic] (local build)
Copyright (C) 2002-16, Bruce Allen, Christian Franke, www.smartmontools.org

=== START OF INFORMATION SECTION ===
Device Model:     WDC WD5000AZRX-00A8LB0
Firmware Version: 01.01A01
User Capacity:    500 107 862 016 bytes [500 GB]
Sector Sizes:     512 bytes logical, 4096 bytes physical
Device is:        Not in smartctl database [for details use: -P showall]
ATA Version is:   ATA8-ACS (minor revision not indicated)
SATA Version is:  SATA 3.0, 6.0 Gb/s (current: 3.0 Gb/s)
Local Time is:    Mon Jun 11 20:18:40 2018 MSK
SMART support is: Available - device has SMART capability.
SMART support is: Enabled
AAM feature is:   Unavailable
APM feature is:   Unavailable
Rd look-ahead is: Enabled
Write cache is:   Enabled
ATA Security is:  Disabled, NOT FROZEN [SEC1]
Wt Cache Reorder: Enabled

=== START OF READ SMART DATA SECTION ===
SMART overall-health self-assessment test result: PASSED

General SMART Values:
Offline data collection status:  (0x82)	Offline data collection activity
					was completed without error.
					Auto Offline Data Collection: Enabled.
Self-test execution status:      (   0)	The previous self-test routine completed
					without error or no self-test has ever 
					been run.
Total time to complete Offline 
data collection: 		( 8160) seconds.
Offline data collection
capabilities: 			 (0x7b) SMART execute Offline immediate.
					Auto Offline data collection on/off support.
					Suspend Offline collection upon new
					command.
					Offline surface scan supported.
					Self-test supported.
					Conveyance Self-test supported.
					Selective Self-test supported.
SMART capabilities:            (0x0003)	Saves SMART data before entering
					power-saving mode.
					Supports SMART auto save timer.
Error logging capability:        (0x01)	Error logging supported.
					General Purpose Logging supported.
Short self-test routine 
recommended polling time: 	 (   2) minutes.
Extended self-test routine
recommended polling time: 	 (  95) minutes.
Conveyance self-test routine
recommended polling time: 	 (   5) minutes.
SCT capabilities: 	       (0x30b5)	SCT Status supported.
					SCT Feature Control supported.
					SCT Data Table supported.

SMART Attributes Data Structure revision number: 16
Vendor Specific SMART Attributes with Thresholds:
ID# ATTRIBUTE_NAME          FLAGS    VALUE WORST THRESH FAIL RAW_VALUE
  1 Raw_Read_Error_Rate     POSR-K   200   200   051    -    0
  3 Spin_Up_Time            POS--K   139   137   021    -    4033
  4 Start_Stop_Count        -O--CK   100   100   000    -    59
  5 Reallocated_Sector_Ct   PO--CK   200   200   140    -    0
  7 Seek_Error_Rate         -OSR-K   200   200   000    -    0
  9 Power_On_Hours          -O--CK   098   098   000    -    1713
 10 Spin_Retry_Count        -O--CK   100   253   000    -    0
 11 Calibration_Retry_Count -O--CK   100   253   000    -    0
 12 Power_Cycle_Count       -O--CK   100   100   000    -    59
192 Power-Off_Retract_Count -O--CK   200   200   000    -    99
193 Load_Cycle_Count        -O--CK   198   198   000    -    7701
194 Temperature_Celsius     -O---K   115   107   000    -    28
196 Reallocated_Event_Count -O--CK   200   200   000    -    0
197 Current_Pending_Sector  -O--CK   200   200   000    -    0
198 Offline_Uncorrectable   ----CK   200   200   000    -    0
199 UDMA_CRC_Error_Count    -O--CK   200   200   000    -    0
200 Multi_Zone_Error_Rate   ---R--   200   200   000    -    0
                            ||||||_ K auto-keep
                            |||||__ C event count
                            ||||___ R error rate
                            |||____ S speed/performance
                            ||_____ O updated online
                            |______ P prefailure warning

General Purpose Log Directory Version 1
SMART           Log Directory Version 1 [multi-sector log support]
Address    Access  R/W   Size  Description
0x00       GPL,SL  R/O      1  Log Directory
0x01           SL  R/O      1  Summary SMART error log
0x02           SL  R/O      5  Comprehensive SMART error log
0x03       GPL     R/O      6  Ext. Comprehensive SMART error log
0x06           SL  R/O      1  SMART self-test log
0x07       GPL     R/O      1  Extended self-test log
0x09           SL  R/W      1  Selective self-test log
0x10       GPL     R/O      1  SATA NCQ Queued Error log
0x11       GPL     R/O      1  SATA Phy Event Counters log
0x80-0x9f  GPL,SL  R/W     16  Host vendor specific log
0xa0-0xa7  GPL,SL  VS      16  Device vendor specific log
0xa8-0xb7  GPL,SL  VS       1  Device vendor specific log
0xbd       GPL,SL  VS       1  Device vendor specific log
0xc0       GPL,SL  VS       1  Device vendor specific log
0xc1       GPL     VS      93  Device vendor specific log
0xe0       GPL,SL  R/W      1  SCT Command/Status
0xe1       GPL,SL  R/W      1  SCT Data Transfer

SMART Extended Comprehensive Error Log Version: 1 (6 sectors)
No Errors Logged

SMART Extended Self-test Log Version: 1 (1 sectors)
No self-tests have been logged.  [To run self-tests, use: smartctl -t]

SMART Selective self-test log data structure revision number 1
 SPAN  MIN_LBA  MAX_LBA  CURRENT_TEST_STATUS
    1        0        0  Not_testing
    2        0        0  Not_testing
    3        0        0  Not_testing
    4        0        0  Not_testing
    5        0        0  Not_testing
Selective self-test flags (0x0):
  After scanning selected spans, do NOT read-scan remainder of disk.
If Selective self-test is pending on power-up, resume after 0 minute delay.

SCT Status Version:                  3
SCT Version (vendor specific):       258 (0x0102)
SCT Support Level:                   1
Device State:                        DST executing in background (3)
Current Temperature:                    27 Celsius
Power Cycle Min/Max Temperature:     18/28 Celsius
Lifetime    Min/Max Temperature:     18/36 Celsius
Under/Over Temperature Limit Count:   0/0
Vendor specific:
01 00 00 00 00 00 00 00 00 00 00 00 00 00 00 00
00 00 00 00 00 00 00 00 00 00 00 00 00 00 00 00

SCT Temperature History Version:     2
Temperature Sampling Period:         1 minute
Temperature Logging Interval:        1 minute
Min/Max recommended Temperature:      0/60 Celsius
Min/Max Temperature Limit:           -41/85 Celsius
Temperature History Size (Index):    478 (263)

Index    Estimated Time   Temperature Celsius
 264    2018-06-11 12:21    27  ********
 ...    ..(  5 skipped).    ..  ********
 270    2018-06-11 12:27    27  ********
 271    2018-06-11 12:28    28  *********
 272    2018-06-11 12:29    27  ********
 273    2018-06-11 12:30    28  *********
 ...    ..( 20 skipped).    ..  *********
 294    2018-06-11 12:51    28  *********
 295    2018-06-11 12:52    27  ********
 ...    ..(  4 skipped).    ..  ********
 300    2018-06-11 12:57    27  ********
 301    2018-06-11 12:58    28  *********
 302    2018-06-11 12:59    27  ********
 ...    ..(  7 skipped).    ..  ********
 310    2018-06-11 13:07    27  ********
 311    2018-06-11 13:08    28  *********
 312    2018-06-11 13:09    27  ********
 313    2018-06-11 13:10    27  ********
 314    2018-06-11 13:11    29  **********
 ...    ..( 31 skipped).    ..  **********
 346    2018-06-11 13:43    29  **********
 347    2018-06-11 13:44    30  ***********
 348    2018-06-11 13:45    30  ***********
 349    2018-06-11 13:46    30  ***********
 350    2018-06-11 13:47    29  **********
 ...    ..(  5 skipped).    ..  **********
 356    2018-06-11 13:53    29  **********
 357    2018-06-11 13:54    30  ***********
 ...    ..(257 skipped).    ..  ***********
 137    2018-06-11 18:12    30  ***********
 138    2018-06-11 18:13    31  ************
 139    2018-06-11 18:14    30  ***********
 ...    ..(  7 skipped).    ..  ***********
 147    2018-06-11 18:22    30  ***********
 148    2018-06-11 18:23    31  ************
 149    2018-06-11 18:24    30  ***********
 ...    ..(  7 skipped).    ..  ***********
 157    2018-06-11 18:32    30  ***********
 158    2018-06-11 18:33    31  ************
 159    2018-06-11 18:34    30  ***********
 ...    ..(  7 skipped).    ..  ***********
 167    2018-06-11 18:42    30  ***********
 168    2018-06-11 18:43    31  ************
 169    2018-06-11 18:44    30  ***********
 ...    ..(  7 skipped).    ..  ***********
 177    2018-06-11 18:52    30  ***********
 178    2018-06-11 18:53     ?  -
 179    2018-06-11 18:54    31  ************
 180    2018-06-11 18:55     ?  -
 181    2018-06-11 18:56    31  ************
 182    2018-06-11 18:57     ?  -
 183    2018-06-11 18:58    27  ********
 184    2018-06-11 18:59    27  ********
 185    2018-06-11 19:00    28  *********
 ...    ..(  2 skipped).    ..  *********
 188    2018-06-11 19:03    28  *********
 189    2018-06-11 19:04    29  **********
 190    2018-06-11 19:05    29  **********
 191    2018-06-11 19:06    30  ***********
 ...    ..(  2 skipped).    ..  ***********
 194    2018-06-11 19:09    30  ***********
 195    2018-06-11 19:10     ?  -
 196    2018-06-11 19:11    22  ***
 197    2018-06-11 19:12     ?  -
 198    2018-06-11 19:13    25  ******
 199    2018-06-11 19:14    26  *******
 ...    ..(  3 skipped).    ..  *******
 203    2018-06-11 19:18    26  *******
 204    2018-06-11 19:19    27  ********
 205    2018-06-11 19:20    28  *********
 ...    ..(  2 skipped).    ..  *********
 208    2018-06-11 19:23    28  *********
 209    2018-06-11 19:24     ?  -
 210    2018-06-11 19:25    18  -
 211    2018-06-11 19:26    18  -
 212    2018-06-11 19:27    20  *
 213    2018-06-11 19:28    20  *
 214    2018-06-11 19:29    21  **
 215    2018-06-11 19:30    21  **
 216    2018-06-11 19:31    23  ****
 217    2018-06-11 19:32    24  *****
 ...    ..(  2 skipped).    ..  *****
 220    2018-06-11 19:35    24  *****
 221    2018-06-11 19:36    25  ******
 ...    ..(  2 skipped).    ..  ******
 224    2018-06-11 19:39    25  ******
 225    2018-06-11 19:40    26  *******
 226    2018-06-11 19:41    26  *******
 227    2018-06-11 19:42    26  *******
 228    2018-06-11 19:43    27  ********
 ...    ..(  5 skipped).    ..  ********
 234    2018-06-11 19:49    27  ********
 235    2018-06-11 19:50    28  *********
 236    2018-06-11 19:51    27  ********
 ...    ..( 26 skipped).    ..  ********
 263    2018-06-11 20:18    27  ********

SCT Error Recovery Control command not supported

Device Statistics (GP/SMART Log 0x04) not supported

SATA Phy Event Counters (GP Log 0x11)
ID      Size     Value  Description
0x0001  2            0  Command failed due to ICRC error
0x0002  2            0  R_ERR response for data FIS
0x0003  2            0  R_ERR response for device-to-host data FIS
0x0004  2            0  R_ERR response for host-to-device data FIS
0x0005  2            0  R_ERR response for non-data FIS
0x0006  2            0  R_ERR response for device-to-host non-data FIS
0x0007  2            0  R_ERR response for host-to-device non-data FIS
0x0008  2            0  Device-to-host non-data FIS retries
0x0009  2            2  Transition from drive PhyRdy to drive PhyNRdy
0x000a  2            1  Device-to-host register FISes sent due to a COMRESET
0x000b  2            0  CRC errors within host-to-device FIS
0x000f  2            0  R_ERR response for host-to-device data FIS, CRC
0x0012  2            0  R_ERR response for host-to-device non-data FIS, CRC
0x8000  4         6205  Vendor specific

