smartctl 6.6 2017-09-20 r4440 [x86_64-linux-4.9.0-0.bpo.3-amd64] (daily-20170920)
Copyright (C) 2002-17, Bruce Allen, Christian Franke, www.smartmontools.org

=== START OF INFORMATION SECTION ===
Device Model:     TOSHIBA MQ03ABB300
Firmware Version: JP050U
User Capacity:    3,000,592,982,016 bytes [3.00 TB]
Sector Sizes:     512 bytes logical, 4096 bytes physical
Rotation Rate:    5400 rpm
Form Factor:      2.5 inches
Device is:        Not in smartctl database [for details use: -P showall]
ATA Version is:   ATA8-ACS (minor revision not indicated)
SATA Version is:  SATA 3.0, 6.0 Gb/s (current: 6.0 Gb/s)
Local Time is:    Sat Sep 23 00:55:58 2017 CEST
SMART support is: Available - device has SMART capability.
SMART support is: Enabled
AAM feature is:   Unavailable
APM level is:     254 (maximum performance)
Rd look-ahead is: Enabled
Write cache is:   Enabled
DSN feature is:   Unavailable
ATA Security is:  Disabled, frozen [SEC2]
Wt Cache Reorder: Enabled

=== START OF READ SMART DATA SECTION ===
SMART overall-health self-assessment test result: PASSED

General SMART Values:
Offline data collection status:  (0x00)	Offline data collection activity
					was never started.
					Auto Offline Data Collection: Disabled.
Self-test execution status:      (   0)	The previous self-test routine completed
					without error or no self-test has ever 
					been run.
Total time to complete Offline 
data collection: 		(  120) seconds.
Offline data collection
capabilities: 			 (0x5b) SMART execute Offline immediate.
					Auto Offline data collection on/off support.
					Suspend Offline collection upon new
					command.
					Offline surface scan supported.
					Self-test supported.
					No Conveyance Self-test supported.
					Selective Self-test supported.
SMART capabilities:            (0x0003)	Saves SMART data before entering
					power-saving mode.
					Supports SMART auto save timer.
Error logging capability:        (0x01)	Error logging supported.
					General Purpose Logging supported.
Short self-test routine 
recommended polling time: 	 (   2) minutes.
Extended self-test routine
recommended polling time: 	 ( 501) minutes.
SCT capabilities: 	       (0x003d)	SCT Status supported.
					SCT Error Recovery Control supported.
					SCT Feature Control supported.
					SCT Data Table supported.

SMART Attributes Data Structure revision number: 16
Vendor Specific SMART Attributes with Thresholds:
ID# ATTRIBUTE_NAME          FLAGS    VALUE WORST THRESH FAIL RAW_VALUE
  1 Raw_Read_Error_Rate     PO-R--   100   100   050    -    0
  2 Throughput_Performance  P-S---   100   100   050    -    0
  3 Spin_Up_Time            POS--K   100   100   001    -    5048
  4 Start_Stop_Count        -O--CK   100   100   000    -    26
  5 Reallocated_Sector_Ct   PO--CK   100   100   050    -    0
  7 Seek_Error_Rate         PO-R--   100   100   050    -    0
  8 Seek_Time_Performance   P-S---   100   100   050    -    0
  9 Power_On_Hours          -O--CK   095   095   000    -    2070
 10 Spin_Retry_Count        PO--CK   100   100   030    -    0
 12 Power_Cycle_Count       -O--CK   100   100   000    -    26
191 G-Sense_Error_Rate      -O--CK   100   100   000    -    0
192 Power-Off_Retract_Count -O--CK   100   100   000    -    6
193 Load_Cycle_Count        -O--CK   100   100   000    -    495
194 Temperature_Celsius     -O---K   100   100   000    -    34 (Min/Max 27/45)
196 Reallocated_Event_Count -O--CK   100   100   000    -    0
197 Current_Pending_Sector  -O--CK   100   100   000    -    0
198 Offline_Uncorrectable   ----CK   100   100   000    -    0
199 UDMA_CRC_Error_Count    -O--CK   200   253   000    -    0
220 Disk_Shift              -O----   100   100   000    -    0
222 Loaded_Hours            -O--CK   100   100   000    -    74
223 Load_Retry_Count        -O--CK   100   100   000    -    0
224 Load_Friction           -O---K   100   100   000    -    0
226 Load-in_Time            -OS--K   100   100   000    -    268
240 Head_Flying_Hours       P-----   100   100   001    -    0
                            ||||||_ K auto-keep
                            |||||__ C event count
                            ||||___ R error rate
                            |||____ S speed/performance
                            ||_____ O updated online
                            |______ P prefailure warning

General Purpose Log Directory Version 1
SMART           Log Directory Version 1 [multi-sector log support]
Address    Access  R/W   Size  Description
0x00       GPL,SL  R/O      1  Log Directory
0x01           SL  R/O      1  Summary SMART error log
0x02           SL  R/O     51  Comprehensive SMART error log
0x03       GPL     R/O     64  Ext. Comprehensive SMART error log
0x04       GPL,SL  R/O      8  Device Statistics log
0x06           SL  R/O      1  SMART self-test log
0x07       GPL     R/O      1  Extended self-test log
0x09           SL  R/W      1  Selective self-test log
0x10       GPL     R/O      1  NCQ Command Error log
0x11       GPL     R/O      1  SATA Phy Event Counters log
0x24       GPL     R/O  12288  Current Device Internal Status Data log
0x25       GPL     R/O  12288  Saved Device Internal Status Data log
0x30       GPL,SL  R/O      9  IDENTIFY DEVICE data log
0x80-0x9f  GPL,SL  R/W     16  Host vendor specific log
0xa7       GPL     VS       8  Device vendor specific log
0xe0       GPL,SL  R/W      1  SCT Command/Status
0xe1       GPL,SL  R/W      1  SCT Data Transfer

SMART Extended Comprehensive Error Log Version: 1 (64 sectors)
No Errors Logged

SMART Extended Self-test Log Version: 1 (1 sectors)
Num  Test_Description    Status                  Remaining  LifeTime(hours)  LBA_of_first_error
# 1  Short offline       Completed without error       00%      2070         -
# 2  Extended offline    Completed without error       00%        32         -
# 3  Short offline       Completed without error       00%         0         -

SMART Selective self-test log data structure revision number 1
 SPAN  MIN_LBA  MAX_LBA  CURRENT_TEST_STATUS
    1        0        0  Not_testing
    2        0        0  Not_testing
    3        0        0  Not_testing
    4        0        0  Not_testing
    5        0        0  Not_testing
Selective self-test flags (0x0):
  After scanning selected spans, do NOT read-scan remainder of disk.
If Selective self-test is pending on power-up, resume after 0 minute delay.

SCT Status Version:                  3
SCT Version (vendor specific):       1 (0x0001)
SCT Support Level:                   1
Device State:                        Active (0)
Current Temperature:                    34 Celsius
Power Cycle Min/Max Temperature:     28/45 Celsius
Lifetime    Min/Max Temperature:     27/45 Celsius
Under/Over Temperature Limit Count:   0/0

SCT Temperature History Version:     2
Temperature Sampling Period:         1 minute
Temperature Logging Interval:        1 minute
Min/Max recommended Temperature:      0/60 Celsius
Min/Max Temperature Limit:            0/60 Celsius
Temperature History Size (Index):    478 (398)

Index    Estimated Time   Temperature Celsius
 399    2017-09-22 16:58    34  ***************
 ...    ..( 39 skipped).    ..  ***************
 439    2017-09-22 17:38    34  ***************
 440    2017-09-22 17:39    35  ****************
 ...    ..(136 skipped).    ..  ****************
  99    2017-09-22 19:56    35  ****************
 100    2017-09-22 19:57    34  ***************
 101    2017-09-22 19:58    34  ***************
 102    2017-09-22 19:59    34  ***************
 103    2017-09-22 20:00    35  ****************
 104    2017-09-22 20:01    34  ***************
 ...    ..(125 skipped).    ..  ***************
 230    2017-09-22 22:07    34  ***************
 231    2017-09-22 22:08    33  **************
 232    2017-09-22 22:09    34  ***************
 233    2017-09-22 22:10    34  ***************
 234    2017-09-22 22:11    34  ***************
 235    2017-09-22 22:12    33  **************
 236    2017-09-22 22:13    33  **************
 237    2017-09-22 22:14    33  **************
 238    2017-09-22 22:15    34  ***************
 239    2017-09-22 22:16    33  **************
 240    2017-09-22 22:17    34  ***************
 241    2017-09-22 22:18    33  **************
 242    2017-09-22 22:19    33  **************
 243    2017-09-22 22:20    34  ***************
 244    2017-09-22 22:21    33  **************
 245    2017-09-22 22:22    34  ***************
 ...    ..(  5 skipped).    ..  ***************
 251    2017-09-22 22:28    34  ***************
 252    2017-09-22 22:29    33  **************
 253    2017-09-22 22:30    34  ***************
 ...    ..(  4 skipped).    ..  ***************
 258    2017-09-22 22:35    34  ***************
 259    2017-09-22 22:36    33  **************
 ...    ..(  4 skipped).    ..  **************
 264    2017-09-22 22:41    33  **************
 265    2017-09-22 22:42    34  ***************
 266    2017-09-22 22:43    34  ***************
 267    2017-09-22 22:44    33  **************
 268    2017-09-22 22:45    33  **************
 269    2017-09-22 22:46    33  **************
 270    2017-09-22 22:47    34  ***************
 271    2017-09-22 22:48    33  **************
 272    2017-09-22 22:49    34  ***************
 273    2017-09-22 22:50    33  **************
 ...    ..(  9 skipped).    ..  **************
 283    2017-09-22 23:00    33  **************
 284    2017-09-22 23:01    34  ***************
 285    2017-09-22 23:02    33  **************
 286    2017-09-22 23:03    33  **************
 287    2017-09-22 23:04    33  **************
 288    2017-09-22 23:05    34  ***************
 289    2017-09-22 23:06    33  **************
 ...    ..( 61 skipped).    ..  **************
 351    2017-09-23 00:08    33  **************
 352    2017-09-23 00:09    34  ***************
 ...    ..(  2 skipped).    ..  ***************
 355    2017-09-23 00:12    34  ***************
 356    2017-09-23 00:13    33  **************
 ...    ..( 28 skipped).    ..  **************
 385    2017-09-23 00:42    33  **************
 386    2017-09-23 00:43    34  ***************
 ...    ..( 11 skipped).    ..  ***************
 398    2017-09-23 00:55    34  ***************

SCT Error Recovery Control:
           Read: Disabled
          Write: Disabled

Device Statistics (GP Log 0x04)
Page  Offset Size        Value Flags Description
0x01  =====  =               =  ===  == General Statistics (rev 2) ==
0x01  0x008  4              26  ---  Lifetime Power-On Resets
0x01  0x010  4            2070  ---  Power-on Hours
0x01  0x018  6      3158239483  ---  Logical Sectors Written
0x01  0x020  6         2788946  ---  Number of Write Commands
0x01  0x028  6        48173940  ---  Logical Sectors Read
0x01  0x030  6          324302  ---  Number of Read Commands
0x02  =====  =               =  ===  == Free-Fall Statistics (rev 1) ==
0x02  0x010  4               0  ---  Overlimit Shock Events
0x03  =====  =               =  ===  == Rotating Media Statistics (rev 1) ==
0x03  0x008  4            2070  ---  Spindle Motor Power-on Hours
0x03  0x010  4              74  ---  Head Flying Hours
0x03  0x018  4             495  ---  Head Load Events
0x03  0x020  4               0  ---  Number of Reallocated Logical Sectors
0x03  0x028  4               0  ---  Read Recovery Attempts
0x03  0x030  4               0  ---  Number of Mechanical Start Failures
0x04  =====  =               =  ===  == General Errors Statistics (rev 1) ==
0x04  0x008  4               0  ---  Number of Reported Uncorrectable Errors
0x04  0x010  4               0  ---  Resets Between Cmd Acceptance and Completion
0x05  =====  =               =  ===  == Temperature Statistics (rev 1) ==
0x05  0x008  1              34  ---  Current Temperature
0x05  0x010  1              31  N--  Average Short Term Temperature
0x05  0x018  1              33  N--  Average Long Term Temperature
0x05  0x020  1              45  ---  Highest Temperature
0x05  0x028  1              27  ---  Lowest Temperature
0x05  0x030  1              38  N--  Highest Average Short Term Temperature
0x05  0x038  1              30  N--  Lowest Average Short Term Temperature
0x05  0x040  1              35  N--  Highest Average Long Term Temperature
0x05  0x048  1              33  N--  Lowest Average Long Term Temperature
0x05  0x050  4               0  ---  Time in Over-Temperature
0x05  0x058  1              60  ---  Specified Maximum Operating Temperature
0x05  0x060  4               0  ---  Time in Under-Temperature
0x05  0x068  1               0  ---  Specified Minimum Operating Temperature
0x06  =====  =               =  ===  == Transport Statistics (rev 1) ==
0x06  0x008  4             166  ---  Number of Hardware Resets
0x06  0x018  4               0  ---  Number of Interface CRC Errors
0x07  =====  =               =  ===  == Solid State Device Statistics (rev 1) ==
                                |||_ C monitored condition met
                                ||__ D supports DSN
                                |___ N normalized value

SATA Phy Event Counters (GP Log 0x11)
ID      Size     Value  Description
0x0001  4            0  Command failed due to ICRC error
0x0002  4            0  R_ERR response for data FIS
0x0003  4            0  R_ERR response for device-to-host data FIS
0x0004  4            0  R_ERR response for host-to-device data FIS
0x0005  4            0  R_ERR response for non-data FIS
0x0006  4            0  R_ERR response for device-to-host non-data FIS
0x0007  4            0  R_ERR response for host-to-device non-data FIS
0x0008  4            0  Device-to-host non-data FIS retries
0x0009  4            3  Transition from drive PhyRdy to drive PhyNRdy
0x000a  4            2  Device-to-host register FISes sent due to a COMRESET
0x000b  4            0  CRC errors within host-to-device FIS
0x000d  4            0  Non-CRC errors within host-to-device FIS
0x000f  4            0  R_ERR response for host-to-device data FIS, CRC
0x0010  4            0  R_ERR response for host-to-device data FIS, non-CRC
0x0012  4            0  R_ERR response for host-to-device non-data FIS, CRC
0x0013  4            0  R_ERR response for host-to-device non-data FIS, non-CRC

