root@aaa-C7Z370-CG-L:~# smartctl -a /dev/sdb
smartctl 7.2 2020-12-30 r5155 [x86_64-linux-6.5.0-35-generic] (local build)
Copyright (C) 2002-20, Bruce Allen, Christian Franke, www.smartmontools.org

=== START OF INFORMATION SECTION ===
Model Family:     Innodisk 3ME4/3SE4/3IE4 SSDs
Device Model:     M.2 (S42) 3IE4
Serial Number:    YCA12012040030026
LU WWN Device Id: 5 24693e 17800754a
Firmware Version: L20B02i
User Capacity:    32,017,047,552 bytes [32.0 GB]
Sector Size:      512 bytes logical/physical
Rotation Rate:    Solid State Device
TRIM Command:     Available, deterministic, zeroed
Device is:        In smartctl database [for details use: -P show]
ATA Version is:   ACS-3 T13/2161-D revision 4
SATA Version is:  SATA 3.2, 6.0 Gb/s (current: 6.0 Gb/s)
Local Time is:    Mon May 20 15:45:43 2024 CST
SMART support is: Available - device has SMART capability.
SMART support is: Enabled

=== START OF READ SMART DATA SECTION ===
SMART overall-health self-assessment test result: PASSED

General SMART Values:
Offline data collection status:  (0x02)	Offline data collection activity
					was completed without error.
					Auto Offline Data Collection: Disabled.
Total time to complete Offline 
data collection: 		(   32) seconds.
Offline data collection
capabilities: 			 (0x00) 	Offline data collection not supported.
SMART capabilities:            (0x0002)	Does not save SMART data before
					entering power-saving mode.
					Supports SMART auto save timer.
Error logging capability:        (0x00)	Error logging NOT supported.
					General Purpose Logging supported.

SMART Attributes Data Structure revision number: 16
Vendor Specific SMART Attributes with Thresholds:
ID# ATTRIBUTE_NAME          FLAG     VALUE WORST THRESH TYPE      UPDATED  WHEN_FAILED RAW_VALUE
  1 Raw_Read_Error_Rate     0x0000   000   000   000    Old_age   Offline      -       0
  2 Not_in_use              0x0000   000   000   000    Old_age   Offline      -       0
  5 Later_Bad_Block         0x0012   100   100   001    Old_age   Always       -       0
  7 Not_in_use              0x0000   000   000   000    Old_age   Offline      -       0
  8 Not_in_use              0x0000   000   000   000    Old_age   Offline      -       0
  9 Power_On_Hours          0x0012   003   000   000    Old_age   Always       -       3
 10 Not_in_use              0x0000   000   000   000    Old_age   Offline      -       0
 12 Power_Cycle_Count       0x0012   024   000   000    Old_age   Always       -       24
163 Total_Bad_Block_Count   0x0000   000   000   000    Old_age   Offline      -       8
168 Not_in_use              0x0000   000   000   000    Old_age   Offline      -       0
169 Device_Life             0x0000   100   000   000    Old_age   Offline      -       100
175 Not_in_use              0x0000   000   000   000    Old_age   Offline      -       0
192 Unexpected_Power_Loss   0x0012   010   000   000    Old_age   Always       -       10
194 Temperature_Celsius     0x0002   023   100   000    Old_age   Always       -       30 (3 30 0 29 0)
197 Not_in_use              0x0000   000   000   000    Old_age   Offline      -       0
225 Not_in_use              0x0000   000   000   000    Old_age   Offline      -       0
240 Not_in_use              0x0000   000   000   000    Old_age   Offline      -       0
165 Max_Erase_Count         0x0012   013   000   000    Old_age   Always       -       13
167 Average_Erase_Count     0x0012   012   000   000    Old_age   Always       -       12
170 Spare_Block_Count       0x0013   100   100   001    Pre-fail  Always       -       143
171 Program_Fail_Count      0x0012   000   100   000    Old_age   Always       -       0
172 Erase_Fail_Count        0x0012   000   100   000    Old_age   Always       -       0
176 Not_in_use              0x0000   000   000   000    Old_age   Offline      -       0
184 Not_in_use              0x0012   000   000   000    Old_age   Always       -       0
187 Not_in_use              0x0012   000   000   000    Old_age   Always       -       0
229 Flash_ID                0x0000   100   100   000    Old_age   Offline      -       0x517693943a98
232 Not_in_use              0x0013   000   000   000    Pre-fail  Always       -       0
235 Later_Bad_Blk_Inf_R/W/E 0x0002   000   000   000    Old_age   Always       -       0 0 0
241 Host_Writes_32MiB       0x0002   100   100   000    Old_age   Always       -       11358
242 Host_Reads_32MiB        0x0002   100   100   000    Old_age   Always       -       9472

SMART Error Log not supported

SMART Self-test Log not supported

Selective Self-tests/Logging not supported

root@aaa-C7Z370-CG-L:~# 
