root@aaa-C7Z370-CG-L:~# smartctl -a /dev/sdb
smartctl 7.2 2020-12-30 r5155 [x86_64-linux-6.5.0-35-generic] (local build)
Copyright (C) 2002-20, Bruce Allen, Christian Franke, www.smartmontools.org

=== START OF INFORMATION SECTION ===
Model Family:     Innodisk 3TE7/3IE7/3TO7 SSDs
Device Model:     M.2 (S42) 3IE7
Serial Number:    YCA12302140200001
LU WWN Device Id: 5 24693e 001125422
Firmware Version: S22831i
User Capacity:    40,018,599,936 bytes [40.0 GB]
Sector Size:      512 bytes logical/physical
Rotation Rate:    Solid State Device
Form Factor:      2.5 inches
TRIM Command:     Available, deterministic, zeroed
Device is:        In smartctl database [for details use: -P show]
ATA Version is:   ACS-2 (minor revision not indicated)
SATA Version is:  SATA 3.2, 6.0 Gb/s (current: 6.0 Gb/s)
Local Time is:    Mon May 20 15:47:02 2024 CST
SMART support is: Available - device has SMART capability.
SMART support is: Enabled

=== START OF READ SMART DATA SECTION ===
SMART overall-health self-assessment test result: PASSED

General SMART Values:
Offline data collection status:  (0x00)	Offline data collection activity
					was never started.
					Auto Offline Data Collection: Disabled.
Self-test execution status:      (   0)	The previous self-test routine completed
					without error or no self-test has ever 
					been run.
Total time to complete Offline 
data collection: 		(   33) seconds.
Offline data collection
capabilities: 			 (0x7b) SMART execute Offline immediate.
					Auto Offline data collection on/off support.
					Suspend Offline collection upon new
					command.
					Offline surface scan supported.
					Self-test supported.
					Conveyance Self-test supported.
					Selective Self-test supported.
SMART capabilities:            (0x0003)	Saves SMART data before entering
					power-saving mode.
					Supports SMART auto save timer.
Error logging capability:        (0x01)	Error logging supported.
					General Purpose Logging supported.
Short self-test routine 
recommended polling time: 	 (   2) minutes.
Extended self-test routine
recommended polling time: 	 (   2) minutes.
Conveyance self-test routine
recommended polling time: 	 (   2) minutes.
SCT capabilities: 	       (0x0039)	SCT Status supported.
					SCT Error Recovery Control supported.
					SCT Feature Control supported.
					SCT Data Table supported.

SMART Attributes Data Structure revision number: 16
Vendor Specific SMART Attributes with Thresholds:
ID# ATTRIBUTE_NAME          FLAG     VALUE WORST THRESH TYPE      UPDATED  WHEN_FAILED RAW_VALUE
  5 Later_Bad_Block         0x0012   100   100   000    Old_age   Always       -       0
  9 Power_On_Hours          0x0012   000   100   000    Old_age   Always       -       0
 12 Drive_Power_Cycle_Count 0x0012   003   000   000    Old_age   Always       -       3
163 Total_Bad_Block_Count   0x0012   023   000   000    Old_age   Always       -       23
165 Max_Erase_Count         0x0012   002   000   000    Old_age   Always       -       2
167 Average_Erase_Count     0x0012   001   000   000    Old_age   Always       -       1
169 Device_Life             0x0000   100   000   000    Old_age   Offline      -       100
170 Spare_Block_Count       0x0013   100   100   001    Pre-fail  Always       -       1159
171 Program_Fail_Count      0x0012   000   100   000    Old_age   Always       -       0
172 Erase_Fail_Count        0x0012   000   100   000    Old_age   Always       -       0
192 Unexpected_Power_Loss   0x0012   003   000   000    Old_age   Always       -       3
194 Temperature             0x0002   029   100   000    Old_age   Always       -       29 (3 29 0 23 0)
229 Flash_ID                0x0000   100   100   000    Old_age   Offline      -       110458029227589
235 Later_Bad_Block_Info    0x0002   000   000   000    Old_age   Always       -       0
241 Total_LBA_Written_32MiB 0x0012   100   100   000    Old_age   Always       -       0
242 Total_LBA_Read_32MiB    0x0012   100   100   000    Old_age   Always       -       0

SMART Error Log Version: 1
No Errors Logged

SMART Self-test log structure revision number 1
No self-tests have been logged.  [To run self-tests, use: smartctl -t]

SMART Selective self-test log data structure revision number 1
 SPAN  MIN_LBA  MAX_LBA  CURRENT_TEST_STATUS
    1        0        0  Not_testing
    2        0        0  Not_testing
    3        0        0  Not_testing
    4        0        0  Not_testing
    5        0        0  Not_testing
Selective self-test flags (0x0):
  After scanning selected spans, do NOT read-scan remainder of disk.
If Selective self-test is pending on power-up, resume after 0 minute delay.

root@aaa-C7Z370-CG-L:~# 
