smartctl 7.2 2020-12-30 r5155 [armv7l-linux-5.4.0-1028-raspi] (local build)
Copyright (C) 2002-20, Bruce Allen, Christian Franke, www.smartmontools.org

=== START OF INFORMATION SECTION ===
Model Family:     SAMSUNG SpinPoint T166
Device Model:     SAMSUNG HD501LJ
Serial Number:    S0MUJ1FPB87260
LU WWN Device Id: 5 0000f0 01bb87260
Firmware Version: CR100-12
User Capacity:    500'107'862'016 bytes [500 GB]
Sector Size:      512 bytes logical/physical
Device is:        In smartctl database [for details use: -P show]
ATA Version is:   ATA8-ACS T13/1699-D revision 3b
SATA Version is:  SATA 2.5, 3.0 Gb/s
Local Time is:    Thu Feb 11 10:39:38 2021 CET
SMART support is: Available - device has SMART capability.
SMART support is: Enabled
AAM feature is:   Disabled
APM feature is:   Unavailable
Rd look-ahead is: Enabled
Write cache is:   Enabled
DSN feature is:   Unavailable
ATA Security is:  Disabled, NOT FROZEN [SEC1]
Wt Cache Reorder: Unknown

=== START OF READ SMART DATA SECTION ===
SMART Status not supported: Incomplete response, ATA output registers missing
SMART overall-health self-assessment test result: PASSED
Warning: This result is based on an Attribute check.

General SMART Values:
Offline data collection status:  (0x00)	Offline data collection activity
					was never started.
					Auto Offline Data Collection: Disabled.
Self-test execution status:      (   0)	The previous self-test routine completed
					without error or no self-test has ever 
					been run.
Total time to complete Offline 
data collection: 		( 9069) seconds.
Offline data collection
capabilities: 			 (0x5b) SMART execute Offline immediate.
					Auto Offline data collection on/off support.
					Suspend Offline collection upon new
					command.
					Offline surface scan supported.
					Self-test supported.
					No Conveyance Self-test supported.
					Selective Self-test supported.
SMART capabilities:            (0x0003)	Saves SMART data before entering
					power-saving mode.
					Supports SMART auto save timer.
Error logging capability:        (0x01)	Error logging supported.
					General Purpose Logging supported.
Short self-test routine 
recommended polling time: 	 (   2) minutes.
Extended self-test routine
recommended polling time: 	 ( 155) minutes.
SCT capabilities: 	       (0x003f)	SCT Status supported.
					SCT Error Recovery Control supported.
					SCT Feature Control supported.
					SCT Data Table supported.

SMART Attributes Data Structure revision number: 16
Vendor Specific SMART Attributes with Thresholds:
ID# ATTRIBUTE_NAME          FLAGS    VALUE WORST THRESH FAIL RAW_VALUE
  1 Raw_Read_Error_Rate     POSR--   100   100   051    -    0
  3 Spin_Up_Time            POS---   100   100   015    -    7552
  4 Start_Stop_Count        -O--CK   084   084   000    -    17112
  5 Reallocated_Sector_Ct   PO--CK   100   100   010    -    1
  7 Seek_Error_Rate         POSR--   253   253   051    -    0
  8 Seek_Time_Performance   P-S--K   253   253   015    -    0
  9 Power_On_Hours          -O--CK   100   100   000    -    15684
 10 Spin_Retry_Count        PO--CK   253   253   051    -    0
 11 Calibration_Retry_Count -O--C-   253   253   000    -    0
 12 Power_Cycle_Count       -O--CK   096   096   000    -    4766
 13 Read_Soft_Error_Rate    -OSR--   100   100   000    -    3071758
187 Reported_Uncorrect      -O--CK   253   253   000    -    0
188 Command_Timeout         -O--CK   253   253   000    -    0
190 Airflow_Temperature_Cel -O---K   060   049   000    -    40
194 Temperature_Celsius     -O---K   118   082   000    -    40
195 Hardware_ECC_Recovered  -O-RC-   100   100   000    -    3071758
196 Reallocated_Event_Count -O--CK   100   100   000    -    1
197 Total_Pending_Sectors   -O--C-   253   253   000    -    0
198 Offline_Uncorrectable   ----CK   253   253   000    -    0
199 UDMA_CRC_Error_Count    -OSRCK   200   200   000    -    0
200 Multi_Zone_Error_Rate   -O-R--   100   100   000    -    0
201 Soft_Read_Error_Rate    -O-R--   253   100   000    -    0
202 Data_Address_Mark_Errs  -O--CK   100   100   000    -    34
                            ||||||_ K auto-keep
                            |||||__ C event count
                            ||||___ R error rate
                            |||____ S speed/performance
                            ||_____ O updated online
                            |______ P prefailure warning

General Purpose Log Directory Version 1
SMART           Log Directory Version 1 [multi-sector log support]
Address    Access  R/W   Size  Description
0x00       GPL,SL  R/O      1  Log Directory
0x01           SL  R/O      1  Summary SMART error log
0x02           SL  R/O      2  Comprehensive SMART error log
0x03       GPL     R/O      2  Ext. Comprehensive SMART error log
0x06           SL  R/O      1  SMART self-test log
0x09       GPL,SL  R/W      1  Selective self-test log
0x10       GPL     R/O      1  NCQ Command Error log
0x11       GPL     R/O      1  SATA Phy Event Counters log
0x80-0x9f  GPL,SL  R/W     16  Host vendor specific log
0xe0       GPL,SL  R/W      1  SCT Command/Status
0xe1       GPL,SL  R/W      1  SCT Data Transfer

SMART Extended Comprehensive Error Log Version: 1 (2 sectors)
No Errors Logged

SMART Extended Self-test Log (GP Log 0x07) not supported

SMART Self-test log structure revision number 1
Num  Test_Description    Status                  Remaining  LifeTime(hours)  LBA_of_first_error
# 1  Extended offline    Completed without error       00%     14018         -
# 2  Short offline       Completed without error       00%     13932         -
# 3  Extended offline    Completed without error       00%     13911         -
# 4  Short offline       Completed without error       00%         9         -

SMART Selective self-test log data structure revision number 0
Note: revision number not 1 implies that no selective self-test has ever been run
 SPAN  MIN_LBA  MAX_LBA  CURRENT_TEST_STATUS
    1        0        0  Not_testing
    2        0        0  Not_testing
    3        0        0  Not_testing
    4        0        0  Not_testing
    5        0        0  Not_testing
Selective self-test flags (0x0):
  After scanning selected spans, do NOT read-scan remainder of disk.
If Selective self-test is pending on power-up, resume after 0 minute delay.

SCT Status Version:                  2
SCT Version (vendor specific):       256 (0x0100)
Device State:                        Active (0)
Current Temperature:                    40 Celsius
Power Cycle Min/Max Temperature:     14/41 Celsius
Lifetime    Min/Max Temperature:      6/52 Celsius
Under/Over Temperature Limit Count:   0/0

SCT Temperature History Version:     2
Temperature Sampling Period:         1 minute
Temperature Logging Interval:        1 minute
Min/Max recommended Temperature:     -4/72 Celsius
Min/Max Temperature Limit:           -9/77 Celsius
Temperature History Size (Index):    128 (66)

Index    Estimated Time   Temperature Celsius
  67    2021-02-11 08:32    20  *
  68    2021-02-11 08:33    20  *
  69    2021-02-11 08:34    21  **
  70    2021-02-11 08:35    22  ***
  71    2021-02-11 08:36    23  ****
  72    2021-02-11 08:37    23  ****
  73    2021-02-11 08:38    24  *****
  74    2021-02-11 08:39    24  *****
  75    2021-02-11 08:40    25  ******
  76    2021-02-11 08:41    26  *******
  77    2021-02-11 08:42    26  *******
  78    2021-02-11 08:43    27  ********
  79    2021-02-11 08:44    27  ********
  80    2021-02-11 08:45    28  *********
  81    2021-02-11 08:46    28  *********
  82    2021-02-11 08:47    28  *********
  83    2021-02-11 08:48    29  **********
  84    2021-02-11 08:49    29  **********
  85    2021-02-11 08:50    29  **********
  86    2021-02-11 08:51    30  ***********
  87    2021-02-11 08:52    30  ***********
  88    2021-02-11 08:53    30  ***********
  89    2021-02-11 08:54    31  ************
  90    2021-02-11 08:55    31  ************
  91    2021-02-11 08:56    31  ************
  92    2021-02-11 08:57    32  *************
 ...    ..(  2 skipped).    ..  *************
  95    2021-02-11 09:00    32  *************
  96    2021-02-11 09:01    33  **************
  97    2021-02-11 09:02    33  **************
  98    2021-02-11 09:03    33  **************
  99    2021-02-11 09:04    35  ****************
 ...    ..(  4 skipped).    ..  ****************
 104    2021-02-11 09:09    35  ****************
 105    2021-02-11 09:10    36  *****************
 ...    ..(  4 skipped).    ..  *****************
 110    2021-02-11 09:15    36  *****************
 111    2021-02-11 09:16    37  ******************
 ...    ..(  7 skipped).    ..  ******************
 119    2021-02-11 09:24    37  ******************
 120    2021-02-11 09:25    38  *******************
 ...    ..(  9 skipped).    ..  *******************
   2    2021-02-11 09:35    38  *******************
   3    2021-02-11 09:36    39  ********************
 ...    ..( 39 skipped).    ..  ********************
  43    2021-02-11 10:16    39  ********************
  44    2021-02-11 10:17    40  *********************
 ...    ..( 17 skipped).    ..  *********************
  62    2021-02-11 10:35    40  *********************
  63    2021-02-11 10:36    41  **********************
  64    2021-02-11 10:37    40  *********************
  65    2021-02-11 10:38    40  *********************
  66    2021-02-11 10:39    19  -

SMART WRITE LOG does not return COUNT and LBA_LOW register
SCT (Get) Error Recovery Control command failed

Device Statistics (GP/SMART Log 0x04) not supported

Pending Defects log (GP Log 0x0c) not supported

SATA Phy Event Counters (GP Log 0x11)
ID      Size     Value  Description
0x0001  2            0  Command failed due to ICRC error
0x0002  2            0  R_ERR response for data FIS
0x0003  2            0  R_ERR response for device-to-host data FIS
0x0004  2            0  R_ERR response for host-to-device data FIS
0x0005  2            0  R_ERR response for non-data FIS
0x0006  2            0  R_ERR response for device-to-host non-data FIS
0x0007  2            0  R_ERR response for host-to-device non-data FIS
0x0008  2            0  Device-to-host non-data FIS retries
0x0009  2            0  Transition from drive PhyRdy to drive PhyNRdy
0x000a  2            2  Device-to-host register FISes sent due to a COMRESET
0x000b  2            0  CRC errors within host-to-device FIS
0x000d  2            0  Non-CRC errors within host-to-device FIS
0x000f  2            0  R_ERR response for host-to-device data FIS, CRC
0x0010  2            0  R_ERR response for host-to-device data FIS, non-CRC
0x0012  2            0  R_ERR response for host-to-device non-data FIS, CRC
0x0013  2            0  R_ERR response for host-to-device non-data FIS, non-CRC
0x8001  2            0  Vendor specific

