smartctl 6.5 2016-05-07 r4318 [x86_64-linux-4.16.1-1.el7.elrepo.x86_64] (local build)
Copyright (C) 2002-16, Bruce Allen, Christian Franke, www.smartmontools.org

=== START OF INFORMATION SECTION ===
Device Model:     WDC WD2005FBYZ-01YCBB2
Firmware Version: RR07
User Capacity:    2,000,398,934,016 bytes [2.00 TB]
Sector Size:      512 bytes logical/physical
Rotation Rate:    7200 rpm
Form Factor:      3.5 inches
Device is:        Not in smartctl database [for details use: -P showall]
ATA Version is:   ACS-3 T13/2161-D revision 5
SATA Version is:  SATA 3.1, 6.0 Gb/s (current: 3.0 Gb/s)
Local Time is:    Mon Jul  2 18:16:37 2018 EEST
SMART support is: Available - device has SMART capability.
SMART support is: Enabled
AAM feature is:   Unavailable
APM level is:     96 (intermediate level with standby)
Rd look-ahead is: Enabled
Write cache is:   Enabled
ATA Security is:  Disabled, NOT FROZEN [SEC1]
Wt Cache Reorder: Enabled

=== START OF READ SMART DATA SECTION ===
SMART overall-health self-assessment test result: PASSED

General SMART Values:
Offline data collection status:  (0x00)	Offline data collection activity
					was never started.
					Auto Offline Data Collection: Disabled.
Self-test execution status:      (   0)	The previous self-test routine completed
					without error or no self-test has ever 
					been run.
Total time to complete Offline 
data collection: 		(    0) seconds.
Offline data collection
capabilities: 			 (0x7b) SMART execute Offline immediate.
					Auto Offline data collection on/off support.
					Suspend Offline collection upon new
					command.
					Offline surface scan supported.
					Self-test supported.
					Conveyance Self-test supported.
					Selective Self-test supported.
SMART capabilities:            (0x0003)	Saves SMART data before entering
					power-saving mode.
					Supports SMART auto save timer.
Error logging capability:        (0x01)	Error logging supported.
					General Purpose Logging supported.
Short self-test routine 
recommended polling time: 	 (   2) minutes.
Extended self-test routine
recommended polling time: 	 ( 215) minutes.
Conveyance self-test routine
recommended polling time: 	 (   5) minutes.
SCT capabilities: 	       (0x203d)	SCT Status supported.
					SCT Error Recovery Control supported.
					SCT Feature Control supported.
					SCT Data Table supported.

SMART Attributes Data Structure revision number: 16
Vendor Specific SMART Attributes with Thresholds:
ID# ATTRIBUTE_NAME          FLAGS    VALUE WORST THRESH FAIL RAW_VALUE
  1 Raw_Read_Error_Rate     POSR-K   100   253   051    -    0
  3 Spin_Up_Time            POS--K   100   253   021    -    0
  4 Start_Stop_Count        -O--CK   100   100   000    -    4
  5 Reallocated_Sector_Ct   PO--CK   200   200   140    -    0
  7 Seek_Error_Rate         -OSR-K   200   200   000    -    0
  9 Power_On_Hours          -O--CK   100   100   000    -    4
 10 Spin_Retry_Count        -O--CK   100   253   000    -    0
 11 Calibration_Retry_Count -O--CK   100   253   000    -    0
 12 Power_Cycle_Count       -O--CK   100   100   000    -    3
 16 Unknown_Attribute       -O---K   000   200   000    -    654619336
183 Runtime_Bad_Block       -O--CK   100   100   000    -    0
192 Power-Off_Retract_Count -O--CK   200   200   000    -    0
193 Load_Cycle_Count        -O--CK   200   200   000    -    3
194 Temperature_Celsius     -O---K   115   107   000    -    32
196 Reallocated_Event_Count -O--CK   200   200   000    -    0
197 Current_Pending_Sector  -O--CK   200   200   000    -    0
198 Offline_Uncorrectable   ----CK   100   253   000    -    0
199 UDMA_CRC_Error_Count    -O--CK   200   200   000    -    0
200 Multi_Zone_Error_Rate   ---R--   100   253   000    -    0
                            ||||||_ K auto-keep
                            |||||__ C event count
                            ||||___ R error rate
                            |||____ S speed/performance
                            ||_____ O updated online
                            |______ P prefailure warning

General Purpose Log Directory Version 1
SMART           Log Directory Version 1 [multi-sector log support]
Address    Access  R/W   Size  Description
0x00       GPL,SL  R/O      1  Log Directory
0x01           SL  R/O      1  Summary SMART error log
0x02           SL  R/O      5  Comprehensive SMART error log
0x03       GPL     R/O      6  Ext. Comprehensive SMART error log
0x04       GPL,SL  R/O      8  Device Statistics log
0x06           SL  R/O      1  SMART self-test log
0x07       GPL     R/O      1  Extended self-test log
0x08       GPL     R/O      2  Power Conditions log
0x09           SL  R/W      1  Selective self-test log
0x0a       GPL     R/W      8  Device Statistics Notification
0x0c       GPL     R/O    113  Pending Defects log
0x0d       GPL,SL  R/O      8  LPS Mis-alignment log
0x10       GPL     R/O      1  SATA NCQ Queued Error log
0x11       GPL     R/O      1  SATA Phy Event Counters log
0x13       GPL     R/O      1  SATA NCQ Send and Receive log
0x24       GPL     R/O    192  Current Device Internal Status Data log
0x30       GPL,SL  R/O      9  IDENTIFY DEVICE data log
0x80-0x9f  GPL,SL  R/W     16  Host vendor specific log
0xa0-0xb6  GPL,SL  VS      16  Device vendor specific log
0xb7       GPL,SL  VS      39  Device vendor specific log
0xc0       GPL,SL  VS       1  Device vendor specific log
0xe0       GPL,SL  R/W      1  SCT Command/Status
0xe1       GPL,SL  R/W      1  SCT Data Transfer

SMART Extended Comprehensive Error Log Version: 1 (6 sectors)
No Errors Logged

SMART Extended Self-test Log Version: 1 (1 sectors)
Num  Test_Description    Status                  Remaining  LifeTime(hours)  LBA_of_first_error
# 1  Conveyance offline  Completed without error       00%         0         -
# 2  Short offline       Completed without error       00%         0         -

SMART Selective self-test log data structure revision number 1
 SPAN  MIN_LBA  MAX_LBA  CURRENT_TEST_STATUS
    1        0        0  Not_testing
    2        0        0  Not_testing
    3        0        0  Not_testing
    4        0        0  Not_testing
    5        0        0  Not_testing
Selective self-test flags (0x0):
  After scanning selected spans, do NOT read-scan remainder of disk.
If Selective self-test is pending on power-up, resume after 0 minute delay.

SCT Status Version:                  3
SCT Version (vendor specific):       258 (0x0102)
SCT Support Level:                   1
Device State:                        Active (0)
Current Temperature:                    32 Celsius
Power Cycle Min/Max Temperature:     29/32 Celsius
Lifetime    Min/Max Temperature:     25/40 Celsius
Under/Over Temperature Limit Count:   0/0
Vendor specific:
01 00 00 00 00 00 00 00 00 00 00 00 00 00 00 00
00 00 00 00 00 00 00 00 00 00 00 00 00 00 00 00

SCT Temperature History Version:     2
Temperature Sampling Period:         1 minute
Temperature Logging Interval:        1 minute
Min/Max recommended Temperature:      0/60 Celsius
Min/Max Temperature Limit:           -41/85 Celsius
Temperature History Size (Index):    478 (249)

Index    Estimated Time   Temperature Celsius
 250    2018-07-02 10:19     ?  -
 ...    ..(227 skipped).    ..  -
   0    2018-07-02 14:07     ?  -
   1    2018-07-02 14:08    25  ******
   2    2018-07-02 14:09    25  ******
   3    2018-07-02 14:10    25  ******
   4    2018-07-02 14:11    26  *******
   5    2018-07-02 14:12    28  *********
   6    2018-07-02 14:13    28  *********
   7    2018-07-02 14:14    28  *********
   8    2018-07-02 14:15    29  **********
   9    2018-07-02 14:16    29  **********
  10    2018-07-02 14:17    30  ***********
  11    2018-07-02 14:18    30  ***********
  12    2018-07-02 14:19    31  ************
 ...    ..(  2 skipped).    ..  ************
  15    2018-07-02 14:22    31  ************
  16    2018-07-02 14:23    32  *************
 ...    ..(  3 skipped).    ..  *************
  20    2018-07-02 14:27    32  *************
  21    2018-07-02 14:28    33  **************
  22    2018-07-02 14:29    33  **************
  23    2018-07-02 14:30    33  **************
  24    2018-07-02 14:31     ?  -
  25    2018-07-02 14:32    33  **************
 ...    ..(  3 skipped).    ..  **************
  29    2018-07-02 14:36    33  **************
  30    2018-07-02 14:37    34  ***************
  31    2018-07-02 14:38    34  ***************
  32    2018-07-02 14:39    34  ***************
  33    2018-07-02 14:40    35  ****************
 ...    ..(  2 skipped).    ..  ****************
  36    2018-07-02 14:43    35  ****************
  37    2018-07-02 14:44    36  *****************
 ...    ..(  3 skipped).    ..  *****************
  41    2018-07-02 14:48    36  *****************
  42    2018-07-02 14:49    37  ******************
 ...    ..(  7 skipped).    ..  ******************
  50    2018-07-02 14:57    37  ******************
  51    2018-07-02 14:58    38  *******************
 ...    ..(  8 skipped).    ..  *******************
  60    2018-07-02 15:07    38  *******************
  61    2018-07-02 15:08    39  ********************
 ...    ..(  8 skipped).    ..  ********************
  70    2018-07-02 15:17    39  ********************
  71    2018-07-02 15:18    40  *********************
 ...    ..(  8 skipped).    ..  *********************
  80    2018-07-02 15:27    40  *********************
  81    2018-07-02 15:28     ?  -
  82    2018-07-02 15:29    29  **********
  83    2018-07-02 15:30    29  **********
  84    2018-07-02 15:31    29  **********
  85    2018-07-02 15:32    30  ***********
 ...    ..( 16 skipped).    ..  ***********
 102    2018-07-02 15:49    30  ***********
 103    2018-07-02 15:50    31  ************
 ...    ..(131 skipped).    ..  ************
 235    2018-07-02 18:02    31  ************
 236    2018-07-02 18:03    32  *************
 ...    ..( 12 skipped).    ..  *************
 249    2018-07-02 18:16    32  *************

SCT Error Recovery Control:
           Read:     70 (7.0 seconds)
          Write:     70 (7.0 seconds)

Device Statistics (GP Log 0x04)
Page  Offset Size        Value Flags Description
0x01  =====  =               =  ===  == General Statistics (rev 1) ==
0x01  0x008  4               3  -D-  Lifetime Power-On Resets
0x01  0x010  4               4  -D-  Power-on Hours
0x01  0x018  6       654671216  -D-  Logical Sectors Written
0x01  0x020  6         4240856  -D-  Number of Write Commands
0x01  0x028  6           13056  -D-  Logical Sectors Read
0x01  0x030  6             252  -D-  Number of Read Commands
0x01  0x038  6        14400000  -D-  Date and Time TimeStamp
0x01  0x048  2               1  ND-  Workload Utilization
0x03  =====  =               =  ===  == Rotating Media Statistics (rev 1) ==
0x03  0x008  4               4  -D-  Spindle Motor Power-on Hours
0x03  0x010  4               4  -D-  Head Flying Hours
0x03  0x018  4               4  -D-  Head Load Events
0x03  0x020  4               0  -D-  Number of Reallocated Logical Sectors
0x03  0x028  4               0  -D-  Read Recovery Attempts
0x03  0x030  4               0  -D-  Number of Mechanical Start Failures
0x03  0x038  4               0  -D-  Number of Realloc. Candidate Logical Sectors
0x03  0x040  4               0  -D-  Number of High Priority Unload Events
0x04  =====  =               =  ===  == General Errors Statistics (rev 1) ==
0x04  0x008  4               0  -D-  Number of Reported Uncorrectable Errors
0x04  0x010  4               0  -D-  Resets Between Cmd Acceptance and Completion
0x05  =====  =               =  ===  == Temperature Statistics (rev 1) ==
0x05  0x008  1              32  -D-  Current Temperature
0x05  0x010  1               -  -D-  Average Short Term Temperature
0x05  0x018  1               -  -D-  Average Long Term Temperature
0x05  0x020  1              41  -D-  Highest Temperature
0x05  0x028  1              30  -D-  Lowest Temperature
0x05  0x030  1               -  -D-  Highest Average Short Term Temperature
0x05  0x038  1               -  -D-  Lowest Average Short Term Temperature
0x05  0x040  1               -  -D-  Highest Average Long Term Temperature
0x05  0x048  1               -  -D-  Lowest Average Long Term Temperature
0x05  0x050  4               0  -D-  Time in Over-Temperature
0x05  0x058  1              60  -D-  Specified Maximum Operating Temperature
0x05  0x060  4               0  -D-  Time in Under-Temperature
0x05  0x068  1               0  -D-  Specified Minimum Operating Temperature
0x06  =====  =               =  ===  == Transport Statistics (rev 1) ==
0x06  0x008  4               1  -D-  Number of Hardware Resets
0x06  0x010  4               1  -D-  Number of ASR Events
0x06  0x018  4               0  -D-  Number of Interface CRC Errors
                                |||_ C monitored condition met
                                ||__ D supports DSN
                                |___ N normalized value

SATA Phy Event Counters (GP Log 0x11)
ID      Size     Value  Description
0x0001  2            0  Command failed due to ICRC error
0x0002  2            0  R_ERR response for data FIS
0x0003  2            0  R_ERR response for device-to-host data FIS
0x0004  2            0  R_ERR response for host-to-device data FIS
0x0005  2            0  R_ERR response for non-data FIS
0x0006  2            0  R_ERR response for device-to-host non-data FIS
0x0007  2            0  R_ERR response for host-to-device non-data FIS
0x0008  2            0  Device-to-host non-data FIS retries
0x0009  2            1  Transition from drive PhyRdy to drive PhyNRdy
0x000a  2            2  Device-to-host register FISes sent due to a COMRESET
0x000b  2            0  CRC errors within host-to-device FIS
0x000d  2            0  Non-CRC errors within host-to-device FIS
0x000f  2            0  R_ERR response for host-to-device data FIS, CRC
0x0012  2            0  R_ERR response for host-to-device non-data FIS, CRC
0x8000  4            0  Vendor specific

