smartctl 6.6 2016-05-31 r4324 [x86_64-linux-4.13.4-1-pve] (local build)
Copyright (C) 2002-16, Bruce Allen, Christian Franke, www.smartmontools.org

=== START OF INFORMATION SECTION ===
Device Model:     SAMSUNG MZ7LM1T9HMJP-00005
Serial Number:    S2TVNXRJ900050
LU WWN Device Id: 5 002538 c6002a152
Firmware Version: GXT5204Q
User Capacity:    1,920,383,410,176 bytes [1.92 TB]
Sector Size:      512 bytes logical/physical
Rotation Rate:    Solid State Device
Form Factor:      2.5 inches
Device is:        Not in smartctl database [for details use: -P showall]
ATA Version is:   ACS-2, ATA8-ACS T13/1699-D revision 4c
SATA Version is:  SATA 3.1, 6.0 Gb/s (current: 6.0 Gb/s)
Local Time is:    Thu Jan  4 10:31:24 2018 CET
SMART support is: Available - device has SMART capability.
SMART support is: Enabled
AAM feature is:   Unavailable
APM level is:     254 (maximum performance)
Rd look-ahead is: Enabled
Write cache is:   Enabled
ATA Security is:  Disabled, frozen [SEC2]
Wt Cache Reorder: Enabled

=== START OF READ SMART DATA SECTION ===
SMART overall-health self-assessment test result: PASSED

General SMART Values:
Offline data collection status:  (0x02)	Offline data collection activity
					was completed without error.
					Auto Offline Data Collection: Disabled.
Self-test execution status:      (   0)	The previous self-test routine completed
					without error or no self-test has ever 
					been run.
Total time to complete Offline 
data collection: 		( 6000) seconds.
Offline data collection
capabilities: 			 (0x53) SMART execute Offline immediate.
					Auto Offline data collection on/off support.
					Suspend Offline collection upon new
					command.
					No Offline surface scan supported.
					Self-test supported.
					No Conveyance Self-test supported.
					Selective Self-test supported.
SMART capabilities:            (0x0003)	Saves SMART data before entering
					power-saving mode.
					Supports SMART auto save timer.
Error logging capability:        (0x01)	Error logging supported.
					General Purpose Logging supported.
Short self-test routine 
recommended polling time: 	 (   2) minutes.
Extended self-test routine
recommended polling time: 	 ( 100) minutes.
SCT capabilities: 	       (0x003d)	SCT Status supported.
					SCT Error Recovery Control supported.
					SCT Feature Control supported.
					SCT Data Table supported.

SMART Attributes Data Structure revision number: 1
Vendor Specific SMART Attributes with Thresholds:
ID# ATTRIBUTE_NAME          FLAGS    VALUE WORST THRESH FAIL RAW_VALUE
  5 Reallocated_Sector_Ct   PO--CK   100   100   010    -    0
  9 Power_On_Hours          -O--CK   099   099   000    -    786
 12 Power_Cycle_Count       -O--CK   099   099   000    -    17
177 Wear_Leveling_Count     PO--C-   099   099   005    -    3
179 Used_Rsvd_Blk_Cnt_Tot   PO--C-   100   100   010    -    0
180 Unused_Rsvd_Blk_Cnt_Tot PO--C-   100   100   010    -    6567
181 Program_Fail_Cnt_Total  -O--CK   100   100   010    -    0
182 Erase_Fail_Count_Total  -O--CK   100   100   010    -    0
183 Runtime_Bad_Block       PO--C-   100   100   010    -    0
184 End-to-End_Error        PO--CK   100   100   097    -    0
187 Reported_Uncorrect      -O--CK   100   100   000    -    0
190 Airflow_Temperature_Cel -O--CK   068   065   000    -    32
194 Temperature_Celsius     -O---K   068   065   000    -    32 (Min/Max 22/36)
195 Hardware_ECC_Recovered  -O-RC-   200   200   000    -    0
197 Current_Pending_Sector  -O--CK   100   100   000    -    0
199 UDMA_CRC_Error_Count    -OSRCK   100   100   000    -    0
202 Unknown_SSD_Attribute   PO--CK   100   100   010    -    0
235 Unknown_Attribute       -O--C-   099   099   000    -    10
241 Total_LBAs_Written      -O--CK   099   099   000    -    9654419640
242 Total_LBAs_Read         -O--CK   099   099   000    -    16116839416
243 Unknown_Attribute       -O--CK   100   100   000    -    0
244 Unknown_Attribute       -O--CK   100   100   000    -    0
245 Unknown_Attribute       -O--CK   100   100   000    -    65535
246 Unknown_Attribute       -O--CK   100   100   000    -    65535
247 Unknown_Attribute       -O--CK   100   100   000    -    65535
251 Unknown_Attribute       -O--CK   100   100   000    -    16625273856
                            ||||||_ K auto-keep
                            |||||__ C event count
                            ||||___ R error rate
                            |||____ S speed/performance
                            ||_____ O updated online
                            |______ P prefailure warning

General Purpose Log Directory Version 1
SMART           Log Directory Version 1 [multi-sector log support]
Address    Access  R/W   Size  Description
0x00       GPL,SL  R/O      1  Log Directory
0x01           SL  R/O      1  Summary SMART error log
0x02           SL  R/O      1  Comprehensive SMART error log
0x03       GPL     R/O      1  Ext. Comprehensive SMART error log
0x04       GPL,SL  R/O      8  Device Statistics log
0x06           SL  R/O      1  SMART self-test log
0x07       GPL     R/O      1  Extended self-test log
0x08       GPL     R/O      2  Power Conditions log
0x09           SL  R/W      1  Selective self-test log
0x10       GPL     R/O      1  SATA NCQ Queued Error log
0x11       GPL     R/O      1  SATA Phy Event Counters log
0x13       GPL     R/O      1  SATA NCQ Send and Receive log
0x30       GPL,SL  R/O      9  IDENTIFY DEVICE data log
0x80-0x9f  GPL,SL  R/W     16  Host vendor specific log
0xa0       GPL     VS      16  Device vendor specific log
0xce           SL  VS      16  Device vendor specific log
0xe0       GPL,SL  R/W      1  SCT Command/Status
0xe1       GPL,SL  R/W      1  SCT Data Transfer

SMART Extended Comprehensive Error Log Version: 1 (1 sectors)
No Errors Logged

SMART Extended Self-test Log Version: 1 (1 sectors)
Num  Test_Description    Status                  Remaining  LifeTime(hours)  LBA_of_first_error
# 1  Short offline       Completed without error       00%       786         -
# 2  Short offline       Completed without error       00%        11         -
# 3  Short offline       Completed without error       00%         5         -

SMART Selective self-test log data structure revision number 1
 SPAN  MIN_LBA  MAX_LBA  CURRENT_TEST_STATUS
    1        0        0  Not_testing
    2        0        0  Not_testing
    3        0        0  Not_testing
    4        0        0  Not_testing
    5        0        0  Not_testing
  255        0    65535  Read_scanning was completed without error
Selective self-test flags (0x0):
  After scanning selected spans, do NOT read-scan remainder of disk.
If Selective self-test is pending on power-up, resume after 0 minute delay.

SCT Status Version:                  3
SCT Version (vendor specific):       256 (0x0100)
SCT Support Level:                   1
Device State:                        SCT command executing in background (5)
Current Temperature:                    32 Celsius
Power Cycle Min/Max Temperature:     25/35 Celsius
Lifetime    Min/Max Temperature:     22/36 Celsius
Under/Over Temperature Limit Count:   0/0

SCT Temperature History Version:     2
Temperature Sampling Period:         1 minute
Temperature Logging Interval:        10 minutes
Min/Max recommended Temperature:      0/70 Celsius
Min/Max Temperature Limit:            0/70 Celsius
Temperature History Size (Index):    128 (116)

Index    Estimated Time   Temperature Celsius
 117    2018-01-03 13:20    33  **************
 ...    ..(  4 skipped).    ..  **************
 122    2018-01-03 14:10    33  **************
 123    2018-01-03 14:20    34  ***************
 124    2018-01-03 14:30    33  **************
 ...    ..( 19 skipped).    ..  **************
  16    2018-01-03 17:50    33  **************
  17    2018-01-03 18:00    34  ***************
  18    2018-01-03 18:10    33  **************
 ...    ..(  3 skipped).    ..  **************
  22    2018-01-03 18:50    33  **************
  23    2018-01-03 19:00    32  *************
  24    2018-01-03 19:10    33  **************
  25    2018-01-03 19:20    32  *************
  26    2018-01-03 19:30    33  **************
 ...    ..(  7 skipped).    ..  **************
  34    2018-01-03 20:50    33  **************
  35    2018-01-03 21:00    32  *************
 ...    ..(  2 skipped).    ..  *************
  38    2018-01-03 21:30    32  *************
  39    2018-01-03 21:40    34  ***************
  40    2018-01-03 21:50    33  **************
  41    2018-01-03 22:00    34  ***************
  42    2018-01-03 22:10    35  ****************
  43    2018-01-03 22:20    34  ***************
  44    2018-01-03 22:30    33  **************
  45    2018-01-03 22:40    33  **************
  46    2018-01-03 22:50    34  ***************
  47    2018-01-03 23:00    33  **************
  48    2018-01-03 23:10    34  ***************
  49    2018-01-03 23:20    33  **************
  50    2018-01-03 23:30    35  ****************
  51    2018-01-03 23:40    34  ***************
  52    2018-01-03 23:50    33  **************
  53    2018-01-04 00:00    33  **************
  54    2018-01-04 00:10    33  **************
  55    2018-01-04 00:20    34  ***************
  56    2018-01-04 00:30    32  *************
  57    2018-01-04 00:40    33  **************
  58    2018-01-04 00:50    33  **************
  59    2018-01-04 01:00    32  *************
  60    2018-01-04 01:10    33  **************
  61    2018-01-04 01:20    32  *************
  62    2018-01-04 01:30    33  **************
 ...    ..(  3 skipped).    ..  **************
  66    2018-01-04 02:10    33  **************
  67    2018-01-04 02:20    32  *************
  68    2018-01-04 02:30    32  *************
  69    2018-01-04 02:40    32  *************
  70    2018-01-04 02:50    33  **************
  71    2018-01-04 03:00    32  *************
  72    2018-01-04 03:10    33  **************
  73    2018-01-04 03:20    33  **************
  74    2018-01-04 03:30    32  *************
 ...    ..(  2 skipped).    ..  *************
  77    2018-01-04 04:00    32  *************
  78    2018-01-04 04:10    33  **************
 ...    ..(  3 skipped).    ..  **************
  82    2018-01-04 04:50    33  **************
  83    2018-01-04 05:00    32  *************
  84    2018-01-04 05:10    33  **************
 ...    ..(  3 skipped).    ..  **************
  88    2018-01-04 05:50    33  **************
  89    2018-01-04 06:00    32  *************
  90    2018-01-04 06:10    33  **************
  91    2018-01-04 06:20    32  *************
  92    2018-01-04 06:30    33  **************
  93    2018-01-04 06:40    32  *************
  94    2018-01-04 06:50    32  *************
  95    2018-01-04 07:00    32  *************
  96    2018-01-04 07:10    33  **************
  97    2018-01-04 07:20    32  *************
  98    2018-01-04 07:30    32  *************
  99    2018-01-04 07:40    33  **************
 100    2018-01-04 07:50    32  *************
 101    2018-01-04 08:00    33  **************
 102    2018-01-04 08:10    32  *************
 103    2018-01-04 08:20    32  *************
 104    2018-01-04 08:30    33  **************
 105    2018-01-04 08:40    33  **************
 106    2018-01-04 08:50    33  **************
 107    2018-01-04 09:00    32  *************
 108    2018-01-04 09:10    33  **************
 109    2018-01-04 09:20    32  *************
 110    2018-01-04 09:30    33  **************
 111    2018-01-04 09:40    32  *************
 112    2018-01-04 09:50    33  **************
 113    2018-01-04 10:00    33  **************
 114    2018-01-04 10:10    33  **************
 115    2018-01-04 10:20    32  *************
 116    2018-01-04 10:30    32  *************

SCT Error Recovery Control:
           Read: Disabled
          Write: Disabled

Device Statistics (GP Log 0x04)
Page  Offset Size        Value Flags Description
0x01  =====  =               =  ===  == General Statistics (rev 1) ==
0x01  0x008  4              17  ---  Lifetime Power-On Resets
0x01  0x010  4             786  ---  Power-on Hours
0x01  0x018  6      9654419640  ---  Logical Sectors Written
0x01  0x020  6       230077161  ---  Number of Write Commands
0x01  0x028  6     16116839416  ---  Logical Sectors Read
0x01  0x030  6       224259118  ---  Number of Read Commands
0x01  0x038  6         3463000  ---  Date and Time TimeStamp
0x04  =====  =               =  ===  == General Errors Statistics (rev 1) ==
0x04  0x008  4               0  ---  Number of Reported Uncorrectable Errors
0x04  0x010  4               0  ---  Resets Between Cmd Acceptance and Completion
0x05  =====  =               =  ===  == Temperature Statistics (rev 1) ==
0x05  0x008  1              32  ---  Current Temperature
0x05  0x020  1              36  ---  Highest Temperature
0x05  0x028  1              22  ---  Lowest Temperature
0x05  0x058  1              55  ---  Specified Maximum Operating Temperature
0x06  =====  =               =  ===  == Transport Statistics (rev 1) ==
0x06  0x008  4              67  ---  Number of Hardware Resets
0x06  0x010  4               0  ---  Number of ASR Events
0x06  0x018  4               0  ---  Number of Interface CRC Errors
0x07  =====  =               =  ===  == Solid State Device Statistics (rev 1) ==
0x07  0x008  1               0  N--  Percentage Used Endurance Indicator
                                |||_ C monitored condition met
                                ||__ D supports DSN
                                |___ N normalized value

SATA Phy Event Counters (GP Log 0x11)
ID      Size     Value  Description
0x0001  2            0  Command failed due to ICRC error
0x0002  2            0  R_ERR response for data FIS
0x0003  2            0  R_ERR response for device-to-host data FIS
0x0004  2            0  R_ERR response for host-to-device data FIS
0x0005  2            0  R_ERR response for non-data FIS
0x0006  2            0  R_ERR response for device-to-host non-data FIS
0x0007  2            0  R_ERR response for host-to-device non-data FIS
0x0008  2            0  Device-to-host non-data FIS retries
0x0009  2            3  Transition from drive PhyRdy to drive PhyNRdy
0x000a  2            3  Device-to-host register FISes sent due to a COMRESET
0x000b  2            0  CRC errors within host-to-device FIS
0x000d  2            0  Non-CRC errors within host-to-device FIS
0x000f  2            0  R_ERR response for host-to-device data FIS, CRC
0x0010  2            0  R_ERR response for host-to-device data FIS, non-CRC
0x0012  2            0  R_ERR response for host-to-device non-data FIS, CRC
0x0013  2            0  R_ERR response for host-to-device non-data FIS, non-CRC

