smartctl 5.43 2012-05-25 r3545 [x86_64-linux-3.3.7-1.fc17.x86_64] (local build)
Copyright (C) 2002-12 by Bruce Allen, http://smartmontools.sourceforge.net

=== START OF INFORMATION SECTION ===
Device Model:     INTEL SSDSC2CT180A3
Firmware Version: 300i
User Capacity:    180,045,766,656 bytes [180 GB]
Sector Size:      512 bytes logical/physical
Device is:        Not in smartctl database [for details use: -P showall]
ATA Version is:   8
ATA Standard is:  ACS-2 revision 3
Local Time is:    Mon May 28 01:41:20 2012 CEST
SMART support is: Available - device has SMART capability.
SMART support is: Enabled

=== START OF READ SMART DATA SECTION ===
SMART Attributes Data Structure revision number: 10
Vendor Specific SMART Attributes with Thresholds:
ID# ATTRIBUTE_NAME          FLAG     VALUE WORST THRESH TYPE      UPDATED  WHEN_FAILED RAW_VALUE
  5 Reallocated_Sector_Ct   0x0032   100   100   000    Old_age   Always       -       0
  9 Power_On_Hours          0x0032   000   000   000    Old_age   Always       -       894844 (221 142 0)
 12 Power_Cycle_Count       0x0032   100   100   000    Old_age   Always       -       4
181 Program_Fail_Cnt_Total  0x0032   000   000   000    Old_age   Always       -       0
182 Erase_Fail_Count_Total  0x0032   000   000   000    Old_age   Always       -       0
192 Power-Off_Retract_Count 0x0032   100   100   000    Old_age   Always       -       4
225 Load_Cycle_Count        0x0032   100   100   000    Old_age   Always       -       850
232 Available_Reservd_Space 0x0033   100   100   010    Pre-fail  Always       -       0
233 Media_Wearout_Indicator 0x0032   100   100   000    Old_age   Always       -       0
241 Total_LBAs_Written      0x0032   100   100   000    Old_age   Always       -       850
242 Total_LBAs_Read         0x0032   100   100   000    Old_age   Always       -       283
249 Unknown_Attribute       0x0013   100   100   000    Pre-fail  Always       -       35

Device Statistics (GP Log 0x04)
Page Offset Size         Value  Description
  1  =====  =                =  == General Statistics (rev 2) ==
  1  0x008  4               11  Lifetime Power-On Resets
  1  0x010  4               50  Power-on Hours
  1  0x018  6        260057498  Logical Sectors Written
  1  0x028  6        203330138  Logical Sectors Read
  4  =====  =                =  == General Errors Statistics (rev 1) ==
  4  0x008  4                0  Number of Reported Uncorrectable Errors
  4  0x010  4              144  Resets Between Cmd Acceptance and Completion
  6  =====  =                =  == Transport Statistics (rev 1) ==
  6  0x008  4              144  Number of Hardware Resets
  6  0x010  4              120  Number of ASR Events
  6  0x018  4                0  Number of Interface CRC Errors
  7  =====  =                =  == Solid State Device Statistics (rev 1) ==
  7  0x008  1              255  Percentage Used Endurance Indicator

