smartctl 6.6 2017-11-05 r4594 [x86_64-linux-4.14.19-1-lts] (local build)
Copyright (C) 2002-17, Bruce Allen, Christian Franke, www.smartmontools.org

=== START OF INFORMATION SECTION ===
Device Model:     INTEL SSDSC2KW512G8
Firmware Version: LHF002C
User Capacity:    512,110,190,592 bytes [512 GB]
Sector Size:      512 bytes logical/physical
Rotation Rate:    Solid State Device
Form Factor:      2.5 inches
Device is:        Not in smartctl database [for details use: -P showall]
ATA Version is:   ACS-3 (minor revision not indicated)
SATA Version is:  SATA 3.2, 6.0 Gb/s (current: 6.0 Gb/s)
Local Time is:    Sat Feb 17 14:07:20 2018 CET
SMART support is: Available - device has SMART capability.
SMART support is: Enabled
AAM feature is:   Unavailable
APM level is:     254 (maximum performance)
Rd look-ahead is: Enabled
Write cache is:   Enabled
DSN feature is:   Unavailable
ATA Security is:  Disabled, frozen [SEC2]
Write SCT (Get) Feature Control Command failed: scsi error badly formed scsi parameters
Wt Cache Reorder: Unknown (SCT Feature Control command failed)

=== START OF READ SMART DATA SECTION ===
SMART overall-health self-assessment test result: PASSED

General SMART Values:
Offline data collection status:  (0x00)	Offline data collection activity
					was never started.
					Auto Offline Data Collection: Disabled.
Self-test execution status:      (   0)	The previous self-test routine completed
					without error or no self-test has ever 
					been run.
Total time to complete Offline 
data collection: 		(    0) seconds.
Offline data collection
capabilities: 			 (0x53) SMART execute Offline immediate.
					Auto Offline data collection on/off support.
					Suspend Offline collection upon new
					command.
					No Offline surface scan supported.
					Self-test supported.
					No Conveyance Self-test supported.
					Selective Self-test supported.
SMART capabilities:            (0x0003)	Saves SMART data before entering
					power-saving mode.
					Supports SMART auto save timer.
Error logging capability:        (0x01)	Error logging supported.
					General Purpose Logging supported.
Short self-test routine 
recommended polling time: 	 (   2) minutes.
Extended self-test routine
recommended polling time: 	 (  30) minutes.
SCT capabilities: 	       (0x003d)	SCT Status supported.
					SCT Error Recovery Control supported.
					SCT Feature Control supported.
					SCT Data Table supported.

SMART Attributes Data Structure revision number: 1
Vendor Specific SMART Attributes with Thresholds:
ID# ATTRIBUTE_NAME          FLAGS    VALUE WORST THRESH FAIL RAW_VALUE
  5 Reallocated_Sector_Ct   -O--CK   100   100   000    -    0
  9 Power_On_Hours          -O--CK   100   100   000    -    21
 12 Power_Cycle_Count       -O--CK   100   100   000    -    22
170 Unknown_Attribute       PO--CK   100   100   010    -    0
171 Unknown_Attribute       -O--CK   100   100   000    -    0
172 Unknown_Attribute       -O--CK   100   100   000    -    0
173 Unknown_Attribute       PO--CK   100   100   005    -    196608
174 Unknown_Attribute       -O--CK   100   100   000    -    2
183 Runtime_Bad_Block       -O--CK   100   100   000    -    0
184 End-to-End_Error        PO--CK   100   100   090    -    0
187 Reported_Uncorrect      -O--CK   100   100   000    -    0
190 Airflow_Temperature_Cel -O--CK   033   049   000    -    33 (Min/Max 19/49)
192 Power-Off_Retract_Count -O--CK   100   100   000    -    2
199 UDMA_CRC_Error_Count    -O--CK   100   100   000    -    0
225 Unknown_SSD_Attribute   -O--CK   100   100   000    -    16272
226 Unknown_SSD_Attribute   -O--CK   100   100   000    -    0
227 Unknown_SSD_Attribute   -O--CK   100   100   000    -    0
228 Power-off_Retract_Count -O--CK   100   100   000    -    0
232 Available_Reservd_Space PO--CK   100   100   010    -    0
233 Media_Wearout_Indicator -O--CK   100   100   000    -    0
236 Unknown_Attribute       -O--CK   100   100   000    -    0
241 Total_LBAs_Written      -O--CK   100   100   000    -    16272
242 Total_LBAs_Read         -O--CK   100   100   000    -    1714
249 Unknown_Attribute       -O--CK   100   100   000    -    459
252 Unknown_Attribute       -O--CK   100   100   000    -    0
                            ||||||_ K auto-keep
                            |||||__ C event count
                            ||||___ R error rate
                            |||____ S speed/performance
                            ||_____ O updated online
                            |______ P prefailure warning

General Purpose Log Directory Version 1
SMART           Log Directory Version 1 [multi-sector log support]
Address    Access  R/W   Size  Description
0x00       GPL,SL  R/O      1  Log Directory
0x01       GPL,SL  R/O      1  Summary SMART error log
0x02       GPL,SL  R/O      1  Comprehensive SMART error log
0x03       GPL,SL  R/O      1  Ext. Comprehensive SMART error log
0x04       GPL,SL  R/O      8  Device Statistics log
0x06       GPL,SL  R/O      1  SMART self-test log
0x07       GPL,SL  R/O      1  Extended self-test log
0x09       GPL,SL  R/W      1  Selective self-test log
0x10       GPL,SL  R/O      1  NCQ Command Error log
0x11       GPL,SL  R/O      1  SATA Phy Event Counters log
0x30       GPL,SL  R/O      9  IDENTIFY DEVICE data log
0x80-0x9f  GPL,SL  R/W     16  Host vendor specific log
0xdf       GPL,SL  VS       1  Device vendor specific log
0xe0       GPL,SL  R/W      1  SCT Command/Status
0xe1       GPL,SL  R/W      1  SCT Data Transfer

SMART Extended Comprehensive Error Log Version: 1 (1 sectors)
No Errors Logged

SMART Extended Self-test Log Version: 1 (1 sectors)
Num  Test_Description    Status                  Remaining  LifeTime(hours)  LBA_of_first_error
# 1  Short offline       Completed without error       00%        21         -
# 2  Extended offline    Completed without error       00%         0         -
# 3  Short offline       Completed without error       00%         0         -

SMART Selective self-test log data structure revision number 1
 SPAN  MIN_LBA  MAX_LBA  CURRENT_TEST_STATUS
    1        0        0  Not_testing
    2        0        0  Not_testing
    3        0        0  Not_testing
    4        0        0  Not_testing
    5        0        0  Not_testing
Selective self-test flags (0x0):
  After scanning selected spans, do NOT read-scan remainder of disk.
If Selective self-test is pending on power-up, resume after 0 minute delay.

SCT Status Version:                  3
SCT Version (vendor specific):       0 (0x0000)
SCT Support Level:                   0
Device State:                        Active (0)
Current Temperature:                    41 Celsius
Power Cycle Min/Max Temperature:     35/49 Celsius
Lifetime    Min/Max Temperature:     25/58 Celsius
Under/Over Temperature Limit Count:   0/0

SCT Temperature History Version:     2
Temperature Sampling Period:         1 minute
Temperature Logging Interval:        1 minute
Min/Max recommended Temperature:      0/100 Celsius
Min/Max Temperature Limit:            0/100 Celsius
Temperature History Size (Index):    128 (109)

Index    Estimated Time   Temperature Celsius
 110    2018-02-17 12:00    31  ************
 111    2018-02-17 12:01    35  ****************
 112    2018-02-17 12:02    38  *******************
 113    2018-02-17 12:03    39  ********************
 114    2018-02-17 12:04    38  *******************
 ...    ..(  2 skipped).    ..  *******************
 117    2018-02-17 12:07    38  *******************
 118    2018-02-17 12:08    27  ********
 119    2018-02-17 12:09    34  ***************
 120    2018-02-17 12:10    37  ******************
 121    2018-02-17 12:11    37  ******************
 122    2018-02-17 12:12    39  ********************
 123    2018-02-17 12:13    41  **********************
 124    2018-02-17 12:14    40  *********************
 125    2018-02-17 12:15    41  **********************
 ...    ..(  3 skipped).    ..  **********************
   1    2018-02-17 12:19    41  **********************
   2    2018-02-17 12:20    40  *********************
   3    2018-02-17 12:21    40  *********************
   4    2018-02-17 12:22    40  *********************
   5    2018-02-17 12:23    41  **********************
   6    2018-02-17 12:24    41  **********************
   7    2018-02-17 12:25    41  **********************
   8    2018-02-17 12:26    43  ************************
   9    2018-02-17 12:27    42  ***********************
  10    2018-02-17 12:28    41  **********************
  11    2018-02-17 12:29    40  *********************
  12    2018-02-17 12:30    41  **********************
 ...    ..(  2 skipped).    ..  **********************
  15    2018-02-17 12:33    41  **********************
  16    2018-02-17 12:34    42  ***********************
  17    2018-02-17 12:35    47  ****************************
  18    2018-02-17 12:36    41  **********************
 ...    ..(  8 skipped).    ..  **********************
  27    2018-02-17 12:45    41  **********************
  28    2018-02-17 12:46    40  *********************
  29    2018-02-17 12:47    40  *********************
  30    2018-02-17 12:48    41  **********************
 ...    ..(  3 skipped).    ..  **********************
  34    2018-02-17 12:52    41  **********************
  35    2018-02-17 12:53    40  *********************
 ...    ..(  3 skipped).    ..  *********************
  39    2018-02-17 12:57    40  *********************
  40    2018-02-17 12:58    41  **********************
  41    2018-02-17 12:59    41  **********************
  42    2018-02-17 13:00    41  **********************
  43    2018-02-17 13:01    42  ***********************
  44    2018-02-17 13:02    42  ***********************
  45    2018-02-17 13:03    41  **********************
  46    2018-02-17 13:04    55  ************************************
  47    2018-02-17 13:05    43  ************************
  48    2018-02-17 13:06    42  ***********************
  49    2018-02-17 13:07    42  ***********************
  50    2018-02-17 13:08    43  ************************
  51    2018-02-17 13:09    42  ***********************
  52    2018-02-17 13:10    41  **********************
  53    2018-02-17 13:11    40  *********************
 ...    ..(  3 skipped).    ..  *********************
  57    2018-02-17 13:15    40  *********************
  58    2018-02-17 13:16    41  **********************
 ...    ..(  2 skipped).    ..  **********************
  61    2018-02-17 13:19    41  **********************
  62    2018-02-17 13:20    40  *********************
  63    2018-02-17 13:21    40  *********************
  64    2018-02-17 13:22    40  *********************
  65    2018-02-17 13:23    42  ***********************
  66    2018-02-17 13:24    43  ************************
  67    2018-02-17 13:25    26  *******
  68    2018-02-17 13:26    35  ****************
  69    2018-02-17 13:27    39  ********************
  70    2018-02-17 13:28    39  ********************
  71    2018-02-17 13:29    40  *********************
  72    2018-02-17 13:30    41  **********************
  73    2018-02-17 13:31    41  **********************
  74    2018-02-17 13:32    42  ***********************
  75    2018-02-17 13:33    39  ********************
  76    2018-02-17 13:34    39  ********************
  77    2018-02-17 13:35    39  ********************
  78    2018-02-17 13:36    40  *********************
  79    2018-02-17 13:37    41  **********************
  80    2018-02-17 13:38    42  ***********************
  81    2018-02-17 13:39    42  ***********************
  82    2018-02-17 13:40    44  *************************
  83    2018-02-17 13:41    44  *************************
  84    2018-02-17 13:42    49  ******************************
  85    2018-02-17 13:43    46  ***************************
  86    2018-02-17 13:44    42  ***********************
  87    2018-02-17 13:45    42  ***********************
  88    2018-02-17 13:46    45  **************************
  89    2018-02-17 13:47    45  **************************
  90    2018-02-17 13:48    45  **************************
  91    2018-02-17 13:49    42  ***********************
  92    2018-02-17 13:50    41  **********************
  93    2018-02-17 13:51    42  ***********************
  94    2018-02-17 13:52    42  ***********************
  95    2018-02-17 13:53    42  ***********************
  96    2018-02-17 13:54    43  ************************
  97    2018-02-17 13:55    43  ************************
  98    2018-02-17 13:56    42  ***********************
  99    2018-02-17 13:57    42  ***********************
 100    2018-02-17 13:58    41  **********************
 101    2018-02-17 13:59    43  ************************
 102    2018-02-17 14:00    40  *********************
 103    2018-02-17 14:01    41  **********************
 ...    ..(  4 skipped).    ..  **********************
 108    2018-02-17 14:06    41  **********************
 109    2018-02-17 14:07    30  ***********

SCT Error Recovery Control:
           Read: Disabled
          Write: Disabled

Device Statistics (GP Log 0x04)
Page  Offset Size        Value Flags Description
0x01  =====  =               =  ===  == General Statistics (rev 1) ==
0x01  0x008  4              22  ---  Lifetime Power-On Resets
0x01  0x010  4              21  ---  Power-on Hours
0x01  0x018  6      1066466772  ---  Logical Sectors Written
0x01  0x020  6         2782547  ---  Number of Write Commands
0x01  0x028  6       112330979  ---  Logical Sectors Read
0x01  0x030  6         2099754  ---  Number of Read Commands
0x04  =====  =               =  ===  == General Errors Statistics (rev 1) ==
0x04  0x008  4               0  ---  Number of Reported Uncorrectable Errors
0x04  0x010  4               2  ---  Resets Between Cmd Acceptance and Completion
0x05  =====  =               =  ===  == Temperature Statistics (rev 1) ==
0x05  0x008  1              41  ---  Current Temperature
0x05  0x010  1               -  ---  Average Short Term Temperature
0x05  0x018  1               -  ---  Average Long Term Temperature
0x05  0x020  1              33  ---  Highest Temperature
0x05  0x028  1              33  ---  Lowest Temperature
0x05  0x030  1               -  ---  Highest Average Short Term Temperature
0x05  0x038  1               -  ---  Lowest Average Short Term Temperature
0x05  0x040  1               -  ---  Highest Average Long Term Temperature
0x05  0x048  1               -  ---  Lowest Average Long Term Temperature
0x05  0x050  4               0  ---  Time in Over-Temperature
0x05  0x058  1              85  ---  Specified Maximum Operating Temperature
0x05  0x060  4               0  ---  Time in Under-Temperature
0x05  0x068  1               0  ---  Specified Minimum Operating Temperature
0x06  =====  =               =  ===  == Transport Statistics (rev 1) ==
0x06  0x008  4              92  ---  Number of Hardware Resets
0x06  0x018  4               0  ---  Number of Interface CRC Errors
0x07  =====  =               =  ===  == Solid State Device Statistics (rev 1) ==
0x07  0x008  1               0  ---  Percentage Used Endurance Indicator
                                |||_ C monitored condition met
                                ||__ D supports DSN
                                |___ N normalized value

Pending Defects log (GP Log 0x0c) not supported

SATA Phy Event Counters (GP Log 0x11)
ID      Size     Value  Description
0x0001  2            0  Command failed due to ICRC error
0x0005  2            0  R_ERR response for non-data FIS
0x000a  2           21  Device-to-host register FISes sent due to a COMRESET

