smartctl 6.6 2016-05-31 r4324 [x86_64-linux-4.9.0-8-amd64] (local build)
Copyright (C) 2002-16, Bruce Allen, Christian Franke, www.smartmontools.org

=== START OF INFORMATION SECTION ===
Device Model:     INTEL SSDSC2KW256G8
Serial Number:    BTLA822401U7256CGN
LU WWN Device Id: 5 5cd2e4 14f71dfc9
Firmware Version: LHF002C
User Capacity:    256.060.514.304 bytes [256 GB]
Sector Size:      512 bytes logical/physical
Rotation Rate:    Solid State Device
Form Factor:      2.5 inches
Device is:        Not in smartctl database [for details use: -P showall]
ATA Version is:   ACS-3 (minor revision not indicated)
SATA Version is:  SATA 3.2, 6.0 Gb/s (current: 6.0 Gb/s)
Local Time is:    Fri Sep 21 23:33:40 2018 CEST
SMART support is: Available - device has SMART capability.
SMART support is: Enabled
AAM feature is:   Unavailable
APM level is:     254 (maximum performance)
Rd look-ahead is: Enabled
Write cache is:   Disabled
ATA Security is:  Disabled, frozen [SEC2]
Write SCT (Get) Feature Control Command failed: scsi error badly formed scsi parameters
Wt Cache Reorder: Unknown (SCT Feature Control command failed)

=== START OF READ SMART DATA SECTION ===
SMART overall-health self-assessment test result: PASSED

General SMART Values:
Offline data collection status:  (0x02)	Offline data collection activity
					was completed without error.
					Auto Offline Data Collection: Disabled.
Self-test execution status:      (   0)	The previous self-test routine completed
					without error or no self-test has ever 
					been run.
Total time to complete Offline 
data collection: 		(    0) seconds.
Offline data collection
capabilities: 			 (0x53) SMART execute Offline immediate.
					Auto Offline data collection on/off support.
					Suspend Offline collection upon new
					command.
					No Offline surface scan supported.
					Self-test supported.
					No Conveyance Self-test supported.
					Selective Self-test supported.
SMART capabilities:            (0x0003)	Saves SMART data before entering
					power-saving mode.
					Supports SMART auto save timer.
Error logging capability:        (0x01)	Error logging supported.
					General Purpose Logging supported.
Short self-test routine 
recommended polling time: 	 (   2) minutes.
Extended self-test routine
recommended polling time: 	 (  15) minutes.
SCT capabilities: 	       (0x003d)	SCT Status supported.
					SCT Error Recovery Control supported.
					SCT Feature Control supported.
					SCT Data Table supported.

SMART Attributes Data Structure revision number: 1
Vendor Specific SMART Attributes with Thresholds:
ID# ATTRIBUTE_NAME          FLAGS    VALUE WORST THRESH FAIL RAW_VALUE
  5 Reallocated_Sector_Ct   -O--CK   100   100   000    -    0
  9 Power_On_Hours          -O--CK   100   100   000    -    1
 12 Power_Cycle_Count       -O--CK   100   100   000    -    21
170 Unknown_Attribute       PO--CK   100   100   010    -    0
171 Unknown_Attribute       -O--CK   100   100   000    -    0
172 Unknown_Attribute       -O--CK   100   100   000    -    0
173 Unknown_Attribute       PO--CK   100   100   005    -    65536
174 Unknown_Attribute       -O--CK   100   100   000    -    15
183 Runtime_Bad_Block       -O--CK   100   100   000    -    0
184 End-to-End_Error        PO--CK   100   100   090    -    0
187 Reported_Uncorrect      -O--CK   100   100   000    -    0
190 Airflow_Temperature_Cel -O--CK   027   037   000    -    27 (Min/Max 21/37)
192 Power-Off_Retract_Count -O--CK   100   100   000    -    15
199 UDMA_CRC_Error_Count    -O--CK   100   100   000    -    0
225 Unknown_SSD_Attribute   -O--CK   100   100   000    -    1769
226 Unknown_SSD_Attribute   -O--CK   100   100   000    -    0
227 Unknown_SSD_Attribute   -O--CK   100   100   000    -    0
228 Power-off_Retract_Count -O--CK   100   100   000    -    0
232 Available_Reservd_Space PO--CK   100   100   010    -    0
233 Media_Wearout_Indicator -O--CK   100   100   000    -    0
236 Unknown_Attribute       -O--CK   100   100   000    -    0
241 Total_LBAs_Written      -O--CK   100   100   000    -    1769
242 Total_LBAs_Read         -O--CK   100   100   000    -    98
249 Unknown_Attribute       -O--CK   100   100   000    -    80
252 Unknown_Attribute       -O--CK   100   100   000    -    0
                            ||||||_ K auto-keep
                            |||||__ C event count
                            ||||___ R error rate
                            |||____ S speed/performance
                            ||_____ O updated online
                            |______ P prefailure warning

General Purpose Log Directory Version 1
SMART           Log Directory Version 1 [multi-sector log support]
Address    Access  R/W   Size  Description
0x00       GPL,SL  R/O      1  Log Directory
0x01       GPL,SL  R/O      1  Summary SMART error log
0x02       GPL,SL  R/O      1  Comprehensive SMART error log
0x03       GPL,SL  R/O      1  Ext. Comprehensive SMART error log
0x04       GPL,SL  R/O      8  Device Statistics log
0x06       GPL,SL  R/O      1  SMART self-test log
0x07       GPL,SL  R/O      1  Extended self-test log
0x09       GPL,SL  R/W      1  Selective self-test log
0x10       GPL,SL  R/O      1  SATA NCQ Queued Error log
0x11       GPL,SL  R/O      1  SATA Phy Event Counters log
0x30       GPL,SL  R/O      9  IDENTIFY DEVICE data log
0x80-0x9f  GPL,SL  R/W     16  Host vendor specific log
0xdf       GPL,SL  VS       1  Device vendor specific log
0xe0       GPL,SL  R/W      1  SCT Command/Status
0xe1       GPL,SL  R/W      1  SCT Data Transfer

SMART Extended Comprehensive Error Log Version: 1 (1 sectors)
No Errors Logged

SMART Extended Self-test Log Version: 1 (1 sectors)
Num  Test_Description    Status                  Remaining  LifeTime(hours)  LBA_of_first_error
# 1  Short offline       Completed without error       00%         1         -
# 2  Short offline       Completed without error       00%         1         -

SMART Selective self-test log data structure revision number 1
 SPAN  MIN_LBA  MAX_LBA  CURRENT_TEST_STATUS
    1        0        0  Not_testing
    2        0        0  Not_testing
    3        0        0  Not_testing
    4        0        0  Not_testing
    5        0        0  Not_testing
Selective self-test flags (0x0):
  After scanning selected spans, do NOT read-scan remainder of disk.
If Selective self-test is pending on power-up, resume after 0 minute delay.

SCT Status Version:                  3
SCT Version (vendor specific):       0 (0x0000)
SCT Support Level:                   0
Device State:                        Active (0)
Current Temperature:                    34 Celsius
Power Cycle Min/Max Temperature:     31/45 Celsius
Lifetime    Min/Max Temperature:     27/45 Celsius
Under/Over Temperature Limit Count:   0/0

SCT Temperature History Version:     2
Temperature Sampling Period:         1 minute
Temperature Logging Interval:        1 minute
Min/Max recommended Temperature:      0/100 Celsius
Min/Max Temperature Limit:            0/100 Celsius
Temperature History Size (Index):    128 (28)

Index    Estimated Time   Temperature Celsius
  29    2018-09-21 21:26    31  ************
  30    2018-09-21 21:27    33  **************
  31    2018-09-21 21:28    32  *************
  32    2018-09-21 21:29    36  *****************
  33    2018-09-21 21:30    36  *****************
  34    2018-09-21 21:31    38  *******************
  35    2018-09-21 21:32    35  ****************
  36    2018-09-21 21:33    30  ***********
  37    2018-09-21 21:34    33  **************
  38    2018-09-21 21:35    36  *****************
  39    2018-09-21 21:36    35  ****************
  40    2018-09-21 21:37    37  ******************
  41    2018-09-21 21:38    34  ***************
  42    2018-09-21 21:39    34  ***************
  43    2018-09-21 21:40    33  **************
  44    2018-09-21 21:41    33  **************
  45    2018-09-21 21:42    33  **************
  46    2018-09-21 21:43    32  *************
  47    2018-09-21 21:44    33  **************
  48    2018-09-21 21:45    33  **************
  49    2018-09-21 21:46    33  **************
  50    2018-09-21 21:47    32  *************
  51    2018-09-21 21:48    32  *************
  52    2018-09-21 21:49    33  **************
  53    2018-09-21 21:50    32  *************
  54    2018-09-21 21:51    32  *************
  55    2018-09-21 21:52    33  **************
  56    2018-09-21 21:53    33  **************
  57    2018-09-21 21:54    32  *************
 ...    ..( 20 skipped).    ..  *************
  78    2018-09-21 22:15    32  *************
  79    2018-09-21 22:16    33  **************
  80    2018-09-21 22:17    32  *************
 ...    ..(  3 skipped).    ..  *************
  84    2018-09-21 22:21    32  *************
  85    2018-09-21 22:22    33  **************
  86    2018-09-21 22:23    32  *************
 ...    ..( 14 skipped).    ..  *************
 101    2018-09-21 22:38    32  *************
 102    2018-09-21 22:39    33  **************
 103    2018-09-21 22:40    33  **************
 104    2018-09-21 22:41    32  *************
 105    2018-09-21 22:42    32  *************
 106    2018-09-21 22:43    33  **************
 107    2018-09-21 22:44    32  *************
 108    2018-09-21 22:45    32  *************
 109    2018-09-21 22:46    29  **********
 110    2018-09-21 22:47    31  ************
 111    2018-09-21 22:48    35  ****************
 112    2018-09-21 22:49    34  ***************
 113    2018-09-21 22:50    36  *****************
 114    2018-09-21 22:51    34  ***************
 115    2018-09-21 22:52    34  ***************
 116    2018-09-21 22:53    32  *************
 117    2018-09-21 22:54    33  **************
 118    2018-09-21 22:55    32  *************
 119    2018-09-21 22:56    33  **************
 120    2018-09-21 22:57    32  *************
 121    2018-09-21 22:58    32  *************
 122    2018-09-21 22:59    33  **************
 123    2018-09-21 23:00    33  **************
 124    2018-09-21 23:01    33  **************
 125    2018-09-21 23:02    32  *************
 126    2018-09-21 23:03    32  *************
 127    2018-09-21 23:04    33  **************
   0    2018-09-21 23:05    33  **************
   1    2018-09-21 23:06    32  *************
   2    2018-09-21 23:07    32  *************
   3    2018-09-21 23:08    33  **************
   4    2018-09-21 23:09    32  *************
   5    2018-09-21 23:10    32  *************
   6    2018-09-21 23:11    32  *************
   7    2018-09-21 23:12    33  **************
   8    2018-09-21 23:13    32  *************
   9    2018-09-21 23:14    45  **************************
  10    2018-09-21 23:15    40  *********************
  11    2018-09-21 23:16    34  ***************
  12    2018-09-21 23:17    34  ***************
  13    2018-09-21 23:18    34  ***************
  14    2018-09-21 23:19    33  **************
 ...    ..(  7 skipped).    ..  **************
  22    2018-09-21 23:27    33  **************
  23    2018-09-21 23:28    40  *********************
  24    2018-09-21 23:29    42  ***********************
  25    2018-09-21 23:30    35  ****************
  26    2018-09-21 23:31    34  ***************
  27    2018-09-21 23:32    34  ***************
  28    2018-09-21 23:33    31  ************

SCT Error Recovery Control:
           Read: Disabled
          Write: Disabled

Device Statistics (GP Log 0x04)
Page  Offset Size        Value Flags Description
0x01  =====  =               =  ===  == General Statistics (rev 1) ==
0x01  0x008  4              21  ---  Lifetime Power-On Resets
0x01  0x010  4               1  ---  Power-on Hours
0x01  0x018  6       115977728  ---  Logical Sectors Written
0x01  0x020  6          213314  ---  Number of Write Commands
0x01  0x028  6         6468301  ---  Logical Sectors Read
0x01  0x030  6           63755  ---  Number of Read Commands
0x04  =====  =               =  ===  == General Errors Statistics (rev 1) ==
0x04  0x008  4               0  ---  Number of Reported Uncorrectable Errors
0x04  0x010  4              15  ---  Resets Between Cmd Acceptance and Completion
0x05  =====  =               =  ===  == Temperature Statistics (rev 1) ==
0x05  0x008  1              35  ---  Current Temperature
0x05  0x010  1               -  ---  Average Short Term Temperature
0x05  0x018  1               -  ---  Average Long Term Temperature
0x05  0x020  1              37  ---  Highest Temperature
0x05  0x028  1              32  ---  Lowest Temperature
0x05  0x030  1               -  ---  Highest Average Short Term Temperature
0x05  0x038  1               -  ---  Lowest Average Short Term Temperature
0x05  0x040  1               -  ---  Highest Average Long Term Temperature
0x05  0x048  1               -  ---  Lowest Average Long Term Temperature
0x05  0x050  4               0  ---  Time in Over-Temperature
0x05  0x058  1              85  ---  Specified Maximum Operating Temperature
0x05  0x060  4               0  ---  Time in Under-Temperature
0x05  0x068  1               0  ---  Specified Minimum Operating Temperature
0x06  =====  =               =  ===  == Transport Statistics (rev 1) ==
0x06  0x008  4              61  ---  Number of Hardware Resets
0x06  0x018  4               0  ---  Number of Interface CRC Errors
0x07  =====  =               =  ===  == Solid State Device Statistics (rev 1) ==
0x07  0x008  1               0  ---  Percentage Used Endurance Indicator
                                |||_ C monitored condition met
                                ||__ D supports DSN
                                |___ N normalized value

SATA Phy Event Counters (GP Log 0x11)
ID      Size     Value  Description
0x0001  2            0  Command failed due to ICRC error
0x0005  2            0  R_ERR response for non-data FIS
0x000a  2            6  Device-to-host register FISes sent due to a COMRESET

