smartctl 7.0 2018-12-30 r4883 [x86_64-linux-3.10.0-1062.4.1.el7.x86_64] (local build)
Copyright (C) 2002-18, Bruce Allen, Christian Franke, www.smartmontools.org

=== START OF INFORMATION SECTION ===
Device Model:     MB004000GWKGV
Serial Number:    V6GZ4EGS
LU WWN Device Id: 5 000cca 097cdb3c7
Firmware Version: HPG1
User Capacity:    4,000,787,030,016 bytes [4.00 TB]
Sector Size:      512 bytes logical/physical
Rotation Rate:    7200 rpm
Form Factor:      3.5 inches
Device is:        Not in smartctl database [for details use: -P showall]
ATA Version is:   ACS-4, ACS-3 T13/2161-D revision 5
SATA Version is:  SATA 3.2, 6.0 Gb/s (current: 6.0 Gb/s)
Local Time is:    Tue Aug 10 08:51:10 2021 CEST
SMART support is: Available - device has SMART capability.
SMART support is: Enabled
AAM feature is:   Unavailable
APM feature is:   Unavailable
Rd look-ahead is: Enabled
Write cache is:   Disabled
DSN feature is:   Unavailable
ATA Security is:  Unavailable
Wt Cache Reorder: Unavailable

=== START OF READ SMART DATA SECTION ===
SMART overall-health self-assessment test result: PASSED

General SMART Values:
Offline data collection status:  (0x82)	Offline data collection activity
					was completed without error.
					Auto Offline Data Collection: Enabled.
Self-test execution status:      ( 241)	Self-test routine in progress...
					10% of test remaining.
Total time to complete Offline 
data collection: 		(   87) seconds.
Offline data collection
capabilities: 			 (0x5b) SMART execute Offline immediate.
					Auto Offline data collection on/off support.
					Suspend Offline collection upon new
					command.
					Offline surface scan supported.
					Self-test supported.
					No Conveyance Self-test supported.
					Selective Self-test supported.
SMART capabilities:            (0x0003)	Saves SMART data before entering
					power-saving mode.
					Supports SMART auto save timer.
Error logging capability:        (0x01)	Error logging supported.
					General Purpose Logging supported.
Short self-test routine 
recommended polling time: 	 (   2) minutes.
Extended self-test routine
recommended polling time: 	 ( 539) minutes.
SCT capabilities: 	       (0x0025)	SCT Status supported.
					SCT Data Table supported.

SMART Attributes Data Structure revision number: 16
Vendor Specific SMART Attributes with Thresholds:
ID# ATTRIBUTE_NAME          FLAGS    VALUE WORST THRESH FAIL RAW_VALUE
  1 Raw_Read_Error_Rate     POSR--   100   100   016    -    0
  2 Throughput_Performance  POS---   129   100   054    -    105
  3 Spin_Up_Time            PO----   140   100   024    -    301 (Average 303)
  5 Reallocated_Sector_Ct   PO--CK   100   100   005    -    0
  7 Seek_Error_Rate         POSR--   100   100   067    -    0
  8 Seek_Time_Performance   P-S---   128   100   020    -    18
  9 Power_On_Hours          -O--CK   098   098   000    -    18753
 10 Spin_Retry_Count        PO--C-   100   100   060    -    0
169 Unknown_Attribute       PO--CK   100   100   099    -    0
180 Unknown_HDD_Attribute   PO-RCK   100   100   098    -    0
194 Temperature_Celsius     -O---K   181   166   000    -    33 (Min/Max 22/36)
196 Reallocated_Event_Count PO--CK   100   100   000    -    0
                            ||||||_ K auto-keep
                            |||||__ C event count
                            ||||___ R error rate
                            |||____ S speed/performance
                            ||_____ O updated online
                            |______ P prefailure warning

General Purpose Log Directory Version 1
SMART           Log Directory Version 1 [multi-sector log support]
Address    Access  R/W   Size  Description
0x00       GPL,SL  R/O      1  Log Directory
0x03       GPL     R/O      1  Ext. Comprehensive SMART error log
0x04       GPL,SL  R/O      7  Device Statistics log
0x07       GPL     R/O      1  Extended self-test log
0x08       GPL     R/O      2  Power Conditions log
0x09           SL  R/W      1  Selective self-test log
0x0c       GPL     R/O    688  Pending Defects log
0x10       GPL     R/O      1  NCQ Command Error log
0x11       GPL     R/O      1  SATA Phy Event Counters log
0x30       GPL     R/O      9  IDENTIFY DEVICE data log
0x80       GPL     R/W     16  Host vendor specific log
0x81-0x9f  GPL,SL  R/W     16  Host vendor specific log
0xb5           SL  VS       1  Device vendor specific log
0xb6       GPL     VS     127  Device vendor specific log
0xbb       GPL     VS       1  Device vendor specific log
0xd0       GPL     VS       1  Device vendor specific log
0xd7       GPL     VS       1  Device vendor specific log
0xe0       GPL,SL  R/W      1  SCT Command/Status
0xe1       GPL,SL  R/W      1  SCT Data Transfer

SMART Extended Comprehensive Error Log Version: 1 (1 sectors)
No Errors Logged

SMART Extended Self-test Log Version: 1 (1 sectors)
No self-tests have been logged.  [To run self-tests, use: smartctl -t]

SMART Selective self-test log data structure revision number 1
 SPAN  MIN_LBA  MAX_LBA  CURRENT_TEST_STATUS
    1        0        0  Not_testing
    2        0        0  Not_testing
    3        0        0  Not_testing
    4        0        0  Not_testing
    5        0        0  Not_testing
Selective self-test flags (0x0):
  After scanning selected spans, do NOT read-scan remainder of disk.
If Selective self-test is pending on power-up, resume after 0 minute delay.

SCT Status Version:                  3
SCT Version (vendor specific):       256 (0x0100)
Device State:                        DST executing in background (3)
Current Temperature:                    33 Celsius
Power Cycle Min/Max Temperature:     28/33 Celsius
Lifetime    Min/Max Temperature:     22/36 Celsius
Specified Max Operating Temperature:    60 Celsius
Under/Over Temperature Limit Count:   0/0

SCT Temperature History Version:     2
Temperature Sampling Period:         1 minute
Temperature Logging Interval:        1 minute
Min/Max recommended Temperature:      0/60 Celsius
Min/Max Temperature Limit:           -40/70 Celsius
Temperature History Size (Index):    128 (120)

Index    Estimated Time   Temperature Celsius
 121    2021-08-10 06:44    33  **************
 122    2021-08-10 06:45    32  *************
 123    2021-08-10 06:46    33  **************
 ...    ..(  2 skipped).    ..  **************
 126    2021-08-10 06:49    33  **************
 127    2021-08-10 06:50    32  *************
 ...    ..(  6 skipped).    ..  *************
   6    2021-08-10 06:57    32  *************
   7    2021-08-10 06:58    33  **************
   8    2021-08-10 06:59    32  *************
   9    2021-08-10 07:00    33  **************
  10    2021-08-10 07:01    32  *************
 ...    ..(  9 skipped).    ..  *************
  20    2021-08-10 07:11    32  *************
  21    2021-08-10 07:12    33  **************
 ...    ..( 12 skipped).    ..  **************
  34    2021-08-10 07:25    33  **************
  35    2021-08-10 07:26    32  *************
  36    2021-08-10 07:27    32  *************
  37    2021-08-10 07:28    33  **************
  38    2021-08-10 07:29    32  *************
  39    2021-08-10 07:30    33  **************
 ...    ..(  3 skipped).    ..  **************
  43    2021-08-10 07:34    33  **************
  44    2021-08-10 07:35    32  *************
  45    2021-08-10 07:36    33  **************
 ...    ..(  8 skipped).    ..  **************
  54    2021-08-10 07:45    33  **************
  55    2021-08-10 07:46    32  *************
  56    2021-08-10 07:47    33  **************
  57    2021-08-10 07:48    33  **************
  58    2021-08-10 07:49    33  **************
  59    2021-08-10 07:50    32  *************
  60    2021-08-10 07:51    33  **************
  61    2021-08-10 07:52    32  *************
 ...    ..(  5 skipped).    ..  *************
  67    2021-08-10 07:58    32  *************
  68    2021-08-10 07:59    33  **************
  69    2021-08-10 08:00    32  *************
 ...    ..( 11 skipped).    ..  *************
  81    2021-08-10 08:12    32  *************
  82    2021-08-10 08:13    33  **************
  83    2021-08-10 08:14    32  *************
 ...    ..(  4 skipped).    ..  *************
  88    2021-08-10 08:19    32  *************
  89    2021-08-10 08:20    33  **************
  90    2021-08-10 08:21    32  *************
  91    2021-08-10 08:22    32  *************
  92    2021-08-10 08:23    33  **************
  93    2021-08-10 08:24    32  *************
  94    2021-08-10 08:25    33  **************
  95    2021-08-10 08:26    33  **************
  96    2021-08-10 08:27    33  **************
  97    2021-08-10 08:28    32  *************
  98    2021-08-10 08:29    32  *************
  99    2021-08-10 08:30    33  **************
 100    2021-08-10 08:31    32  *************
 101    2021-08-10 08:32    32  *************
 102    2021-08-10 08:33    32  *************
 103    2021-08-10 08:34    33  **************
 104    2021-08-10 08:35    32  *************
 ...    ..( 13 skipped).    ..  *************
 118    2021-08-10 08:49    32  *************
 119    2021-08-10 08:50    33  **************
 120    2021-08-10 08:51    33  **************

SCT Error Recovery Control command not supported

Device Statistics (GP Log 0x04)
Page  Offset Size        Value Flags Description
0x01  =====  =               =  ===  == General Statistics (rev 1) ==
0x01  0x008  4             132  ---  Lifetime Power-On Resets
0x01  0x010  4           18753  ---  Power-on Hours
0x01  0x018  6           59265  ---  Logical Sectors Written
0x01  0x020  6              60  ---  Number of Write Commands
0x01  0x028  6      1458750440  ---  Logical Sectors Read
0x01  0x030  6         2900107  ---  Number of Read Commands
0x01  0x038  6     67514261800  ---  Date and Time TimeStamp
0x03  =====  =               =  ===  == Rotating Media Statistics (rev 1) ==
0x03  0x008  4           18744  ---  Spindle Motor Power-on Hours
0x03  0x010  4           18744  ---  Head Flying Hours
0x03  0x018  4             931  ---  Head Load Events
0x03  0x020  4               0  ---  Number of Reallocated Logical Sectors
0x03  0x028  4               0  ---  Read Recovery Attempts
0x03  0x030  4               0  ---  Number of Mechanical Start Failures
0x04  =====  =               =  ===  == General Errors Statistics (rev 1) ==
0x04  0x008  4               0  ---  Number of Reported Uncorrectable Errors
0x04  0x010  4               1  ---  Resets Between Cmd Acceptance and Completion
0x05  =====  =               =  ===  == Temperature Statistics (rev 1) ==
0x05  0x008  1              33  ---  Current Temperature
0x05  0x010  1              32  N--  Average Short Term Temperature
0x05  0x018  1              27  N--  Average Long Term Temperature
0x05  0x020  1              36  ---  Highest Temperature
0x05  0x028  1              22  ---  Lowest Temperature
0x05  0x030  1              35  N--  Highest Average Short Term Temperature
0x05  0x038  1              25  N--  Lowest Average Short Term Temperature
0x05  0x040  1              32  N--  Highest Average Long Term Temperature
0x05  0x048  1              25  N--  Lowest Average Long Term Temperature
0x05  0x050  4               0  ---  Time in Over-Temperature
0x05  0x058  1              60  ---  Specified Maximum Operating Temperature
0x05  0x060  4               0  ---  Time in Under-Temperature
0x05  0x068  1               0  ---  Specified Minimum Operating Temperature
0x06  =====  =               =  ===  == Transport Statistics (rev 1) ==
0x06  0x008  4            1520  ---  Number of Hardware Resets
0x06  0x010  4            1314  ---  Number of ASR Events
0x06  0x018  4               0  ---  Number of Interface CRC Errors
                                |||_ C monitored condition met
                                ||__ D supports DSN
                                |___ N normalized value

Pending Defects log (GP Log 0x0c)
No Defects Logged

SATA Phy Event Counters (GP Log 0x11)
ID      Size     Value  Description
0x0001  2            0  Command failed due to ICRC error
0x0002  2            0  R_ERR response for data FIS
0x0003  2            0  R_ERR response for device-to-host data FIS
0x0004  2            0  R_ERR response for host-to-device data FIS
0x0005  2            0  R_ERR response for non-data FIS
0x0006  2            0  R_ERR response for device-to-host non-data FIS
0x0007  2            0  R_ERR response for host-to-device non-data FIS
0x0008  2            0  Device-to-host non-data FIS retries
0x0009  2            3  Transition from drive PhyRdy to drive PhyNRdy
0x000a  2            3  Device-to-host register FISes sent due to a COMRESET
0x000b  2            0  CRC errors within host-to-device FIS
0x000d  2            0  Non-CRC errors within host-to-device FIS

