smartctl 6.6 2017-11-05 r4594 [x86_64-linux-4.19.0-17-amd64] (local build)
Copyright (C) 2002-17, Bruce Allen, Christian Franke, www.smartmontools.org

=== START OF INFORMATION SECTION ===
Device Model:     TOSHIBA MQ04UBB400
Firmware Version: JS000U
User Capacity:    4 000 787 030 016 bytes [4,00 TB]
Sector Sizes:     512 bytes logical, 4096 bytes physical
Rotation Rate:    5400 rpm
Form Factor:      2.5 inches
Device is:        Not in smartctl database [for details use: -P showall]
ATA Version is:   ACS-3 T13/2161-D revision 5
SATA Version is:  SATA 3.3, 3.0 Gb/s (current: 3.0 Gb/s)
Local Time is:    Fri Jul  9 04:46:21 2021 CEST
SMART support is: Available - device has SMART capability.
SMART support is: Enabled
AAM feature is:   Unavailable
APM level is:     128 (minimum power consumption without standby)
Rd look-ahead is: Enabled
Write cache is:   Enabled
DSN feature is:   Disabled
ATA Security is:  Disabled, NOT FROZEN [SEC1]
Wt Cache Reorder: Unknown

=== START OF READ SMART DATA SECTION ===
SMART Status not supported: Incomplete response, ATA output registers missing
SMART overall-health self-assessment test result: PASSED
Warning: This result is based on an Attribute check.

General SMART Values:
Offline data collection status:  (0x00)	Offline data collection activity
					was never started.
					Auto Offline Data Collection: Disabled.
Self-test execution status:      (  25)	The self-test routine was aborted by
					the host.
Total time to complete Offline 
data collection: 		(  120) seconds.
Offline data collection
capabilities: 			 (0x5b) SMART execute Offline immediate.
					Auto Offline data collection on/off support.
					Suspend Offline collection upon new
					command.
					Offline surface scan supported.
					Self-test supported.
					No Conveyance Self-test supported.
					Selective Self-test supported.
SMART capabilities:            (0x0003)	Saves SMART data before entering
					power-saving mode.
					Supports SMART auto save timer.
Error logging capability:        (0x01)	Error logging supported.
					General Purpose Logging supported.
Short self-test routine 
recommended polling time: 	 (   2) minutes.
Extended self-test routine
recommended polling time: 	 ( 665) minutes.
SCT capabilities: 	       (0x003d)	SCT Status supported.
					SCT Error Recovery Control supported.
					SCT Feature Control supported.
					SCT Data Table supported.

SMART Attributes Data Structure revision number: 16
Vendor Specific SMART Attributes with Thresholds:
ID# ATTRIBUTE_NAME          FLAGS    VALUE WORST THRESH FAIL RAW_VALUE
  1 Raw_Read_Error_Rate     PO-R--   100   100   050    -    0
  2 Throughput_Performance  P-S---   100   100   050    -    0
  3 Spin_Up_Time            POS--K   100   100   001    -    5157
  4 Start_Stop_Count        -O--CK   100   100   000    -    441
  5 Reallocated_Sector_Ct   PO--CK   100   100   050    -    0
  7 Seek_Error_Rate         PO-R--   100   100   050    -    0
  8 Seek_Time_Performance   P-S---   100   100   050    -    0
  9 Power_On_Hours          -O--CK   100   100   000    -    286
 10 Spin_Retry_Count        PO--CK   108   100   030    -    0
 12 Power_Cycle_Count       -O--CK   100   100   000    -    149
191 G-Sense_Error_Rate      -O--CK   100   100   000    -    20
192 Power-Off_Retract_Count -O--CK   100   100   000    -    22
193 Load_Cycle_Count        -O--CK   100   100   000    -    2580
194 Temperature_Celsius     -O---K   100   100   000    -    30 (Min/Max 8/52)
196 Reallocated_Event_Count -O--CK   100   100   000    -    0
197 Current_Pending_Sector  -O--CK   100   100   000    -    0
198 Offline_Uncorrectable   ----CK   100   100   000    -    0
199 UDMA_CRC_Error_Count    -O--CK   200   200   000    -    0
220 Disk_Shift              -O----   100   100   000    -    0
222 Loaded_Hours            -O--CK   100   100   000    -    157
223 Load_Retry_Count        -O--CK   100   100   000    -    0
224 Load_Friction           -O---K   100   100   000    -    0
226 Load-in_Time            -OS--K   100   100   000    -    274
240 Head_Flying_Hours       P-----   100   100   001    -    0
                            ||||||_ K auto-keep
                            |||||__ C event count
                            ||||___ R error rate
                            |||____ S speed/performance
                            ||_____ O updated online
                            |______ P prefailure warning

General Purpose Log Directory Version 1
SMART           Log Directory Version 1 [multi-sector log support]
Address    Access  R/W   Size  Description
0x00       GPL,SL  R/O      1  Log Directory
0x01           SL  R/O      1  Summary SMART error log
0x02           SL  R/O     51  Comprehensive SMART error log
0x03       GPL     R/O     64  Ext. Comprehensive SMART error log
0x04       GPL,SL  R/O      8  Device Statistics log
0x06           SL  R/O      1  SMART self-test log
0x07       GPL     R/O      1  Extended self-test log
0x09           SL  R/W      1  Selective self-test log
0x0a       GPL     R/W      2  Device Statistics Notification
0x10       GPL     R/O      1  NCQ Command Error log
0x11       GPL     R/O      1  SATA Phy Event Counters log
0x24       GPL     R/O  32768  Current Device Internal Status Data log
0x30       GPL,SL  R/O      9  IDENTIFY DEVICE data log
0x80-0x9f  GPL,SL  R/W     16  Host vendor specific log
0xa7       GPL     VS       8  Device vendor specific log
0xe0       GPL,SL  R/W      1  SCT Command/Status
0xe1       GPL,SL  R/W      1  SCT Data Transfer

SMART Extended Comprehensive Error Log Version: 1 (64 sectors)
No Errors Logged

SMART Extended Self-test Log Version: 1 (1 sectors)
Num  Test_Description    Status                  Remaining  LifeTime(hours)  LBA_of_first_error
# 1  Extended offline    Aborted by host               90%       285         -
# 2  Short offline       Completed without error       00%       285         -

SMART Selective self-test log data structure revision number 1
 SPAN  MIN_LBA  MAX_LBA  CURRENT_TEST_STATUS
    1        0        0  Not_testing
    2        0        0  Not_testing
    3        0        0  Not_testing
    4        0        0  Not_testing
    5        0        0  Not_testing
Selective self-test flags (0x0):
  After scanning selected spans, do NOT read-scan remainder of disk.
If Selective self-test is pending on power-up, resume after 0 minute delay.

SCT Status Version:                  3
SCT Version (vendor specific):       1 (0x0001)
SCT Support Level:                   1
Device State:                        Active (0)
Current Temperature:                    29 Celsius
Power Cycle Min/Max Temperature:     29/38 Celsius
Lifetime    Min/Max Temperature:      8/52 Celsius
Under/Over Temperature Limit Count:   0/0

SCT Temperature History Version:     2
Temperature Sampling Period:         1 minute
Temperature Logging Interval:        1 minute
Min/Max recommended Temperature:      0/60 Celsius
Min/Max Temperature Limit:            0/60 Celsius
Temperature History Size (Index):    478 (167)

Index    Estimated Time   Temperature Celsius
 168    2021-07-08 20:49    34  ***************
 ...    ..( 46 skipped).    ..  ***************
 215    2021-07-08 21:36    34  ***************
 216    2021-07-08 21:37     ?  -
 217    2021-07-08 21:38    31  ************
 218    2021-07-08 21:39    31  ************
 219    2021-07-08 21:40    31  ************
 220    2021-07-08 21:41    32  *************
 ...    ..(  9 skipped).    ..  *************
 230    2021-07-08 21:51    32  *************
 231    2021-07-08 21:52    33  **************
 ...    ..( 13 skipped).    ..  **************
 245    2021-07-08 22:06    33  **************
 246    2021-07-08 22:07    34  ***************
 ...    ..( 28 skipped).    ..  ***************
 275    2021-07-08 22:36    34  ***************
 276    2021-07-08 22:37     ?  -
 277    2021-07-08 22:38    32  *************
 278    2021-07-08 22:39     ?  -
 279    2021-07-08 22:40    24  *****
 280    2021-07-08 22:41    24  *****
 281    2021-07-08 22:42    25  ******
 282    2021-07-08 22:43    26  *******
 283    2021-07-08 22:44    27  ********
 284    2021-07-08 22:45    28  *********
 285    2021-07-08 22:46    28  *********
 286    2021-07-08 22:47    29  **********
 287    2021-07-08 22:48    30  ***********
 288    2021-07-08 22:49    30  ***********
 289    2021-07-08 22:50    31  ************
 290    2021-07-08 22:51    31  ************
 291    2021-07-08 22:52    31  ************
 292    2021-07-08 22:53    32  *************
 293    2021-07-08 22:54    32  *************
 294    2021-07-08 22:55    33  **************
 295    2021-07-08 22:56    33  **************
 296    2021-07-08 22:57    33  **************
 297    2021-07-08 22:58    34  ***************
 ...    ..(  3 skipped).    ..  ***************
 301    2021-07-08 23:02    34  ***************
 302    2021-07-08 23:03    35  ****************
 ...    ..(  6 skipped).    ..  ****************
 309    2021-07-08 23:10    35  ****************
 310    2021-07-08 23:11    36  *****************
 ...    ..(  4 skipped).    ..  *****************
 315    2021-07-08 23:16    36  *****************
 316    2021-07-08 23:17    35  ****************
 317    2021-07-08 23:18     ?  -
 318    2021-07-08 23:19    35  ****************
 319    2021-07-08 23:20    35  ****************
 320    2021-07-08 23:21    34  ***************
 321    2021-07-08 23:22     ?  -
 322    2021-07-08 23:23    21  **
 323    2021-07-08 23:24    22  ***
 324    2021-07-08 23:25    22  ***
 325    2021-07-08 23:26     ?  -
 326    2021-07-08 23:27    24  *****
 327    2021-07-08 23:28    25  ******
 328    2021-07-08 23:29    25  ******
 329    2021-07-08 23:30    26  *******
 330    2021-07-08 23:31    27  ********
 331    2021-07-08 23:32    28  *********
 332    2021-07-08 23:33    29  **********
 333    2021-07-08 23:34    29  **********
 334    2021-07-08 23:35    30  ***********
 335    2021-07-08 23:36    31  ************
 336    2021-07-08 23:37    31  ************
 337    2021-07-08 23:38    32  *************
 338    2021-07-08 23:39    31  ************
 339    2021-07-08 23:40    31  ************
 340    2021-07-08 23:41     ?  -
 341    2021-07-08 23:42    31  ************
 ...    ..(  2 skipped).    ..  ************
 344    2021-07-08 23:45    31  ************
 345    2021-07-08 23:46    32  *************
 ...    ..( 12 skipped).    ..  *************
 358    2021-07-08 23:59    32  *************
 359    2021-07-09 00:00    33  **************
 ...    ..(  2 skipped).    ..  **************
 362    2021-07-09 00:03    33  **************
 363    2021-07-09 00:04     ?  -
 364    2021-07-09 00:05    32  *************
 ...    ..(  9 skipped).    ..  *************
 374    2021-07-09 00:15    32  *************
 375    2021-07-09 00:16    33  **************
 376    2021-07-09 00:17    33  **************
 377    2021-07-09 00:18    34  ***************
 378    2021-07-09 00:19    35  ****************
 ...    ..(  8 skipped).    ..  ****************
 387    2021-07-09 00:28    35  ****************
 388    2021-07-09 00:29     ?  -
 389    2021-07-09 00:30     ?  -
 390    2021-07-09 00:31    35  ****************
 391    2021-07-09 00:32    35  ****************
 392    2021-07-09 00:33     ?  -
 393    2021-07-09 00:34    35  ****************
 394    2021-07-09 00:35     ?  -
 395    2021-07-09 00:36    36  *****************
 ...    ..(  9 skipped).    ..  *****************
 405    2021-07-09 00:46    36  *****************
 406    2021-07-09 00:47    37  ******************
 ...    ..(  2 skipped).    ..  ******************
 409    2021-07-09 00:50    37  ******************
 410    2021-07-09 00:51    36  *****************
 ...    ..(  7 skipped).    ..  *****************
 418    2021-07-09 00:59    36  *****************
 419    2021-07-09 01:00    37  ******************
 ...    ..( 26 skipped).    ..  ******************
 446    2021-07-09 01:27    37  ******************
 447    2021-07-09 01:28    38  *******************
 448    2021-07-09 01:29    38  *******************
 449    2021-07-09 01:30    38  *******************
 450    2021-07-09 01:31    39  ********************
 451    2021-07-09 01:32    38  *******************
 ...    ..(  7 skipped).    ..  *******************
 459    2021-07-09 01:40    38  *******************
 460    2021-07-09 01:41    39  ********************
 ...    ..(  2 skipped).    ..  ********************
 463    2021-07-09 01:44    39  ********************
 464    2021-07-09 01:45    40  *********************
 ...    ..(  4 skipped).    ..  *********************
 469    2021-07-09 01:50    40  *********************
 470    2021-07-09 01:51    41  **********************
 471    2021-07-09 01:52    41  **********************
 472    2021-07-09 01:53    40  *********************
 473    2021-07-09 01:54    40  *********************
 474    2021-07-09 01:55    40  *********************
 475    2021-07-09 01:56    41  **********************
 ...    ..(  4 skipped).    ..  **********************
   2    2021-07-09 02:01    41  **********************
   3    2021-07-09 02:02    40  *********************
   4    2021-07-09 02:03    40  *********************
   5    2021-07-09 02:04    41  **********************
   6    2021-07-09 02:05    40  *********************
   7    2021-07-09 02:06    41  **********************
   8    2021-07-09 02:07    41  **********************
   9    2021-07-09 02:08    40  *********************
 ...    ..(  2 skipped).    ..  *********************
  12    2021-07-09 02:11    40  *********************
  13    2021-07-09 02:12    41  **********************
  14    2021-07-09 02:13    41  **********************
  15    2021-07-09 02:14    40  *********************
  16    2021-07-09 02:15    40  *********************
  17    2021-07-09 02:16    40  *********************
  18    2021-07-09 02:17    39  ********************
 ...    ..(  4 skipped).    ..  ********************
  23    2021-07-09 02:22    39  ********************
  24    2021-07-09 02:23    38  *******************
 ...    ..(  3 skipped).    ..  *******************
  28    2021-07-09 02:27    38  *******************
  29    2021-07-09 02:28    37  ******************
 ...    ..( 12 skipped).    ..  ******************
  42    2021-07-09 02:41    37  ******************
  43    2021-07-09 02:42    36  *****************
 ...    ..(  4 skipped).    ..  *****************
  48    2021-07-09 02:47    36  *****************
  49    2021-07-09 02:48    35  ****************
 ...    ..(  6 skipped).    ..  ****************
  56    2021-07-09 02:55    35  ****************
  57    2021-07-09 02:56    36  *****************
  58    2021-07-09 02:57    35  ****************
  59    2021-07-09 02:58    36  *****************
  60    2021-07-09 02:59    36  *****************
  61    2021-07-09 03:00    35  ****************
  62    2021-07-09 03:01    35  ****************
  63    2021-07-09 03:02    36  *****************
 ...    ..( 11 skipped).    ..  *****************
  75    2021-07-09 03:14    36  *****************
  76    2021-07-09 03:15    37  ******************
 ...    ..(  7 skipped).    ..  ******************
  84    2021-07-09 03:23    37  ******************
  85    2021-07-09 03:24    38  *******************
  86    2021-07-09 03:25    38  *******************
  87    2021-07-09 03:26    37  ******************
  88    2021-07-09 03:27    38  *******************
  89    2021-07-09 03:28    38  *******************
  90    2021-07-09 03:29    38  *******************
  91    2021-07-09 03:30     ?  -
  92    2021-07-09 03:31    37  ******************
  93    2021-07-09 03:32    37  ******************
  94    2021-07-09 03:33    36  *****************
 ...    ..(  2 skipped).    ..  *****************
  97    2021-07-09 03:36    36  *****************
  98    2021-07-09 03:37    35  ****************
 ...    ..(  5 skipped).    ..  ****************
 104    2021-07-09 03:43    35  ****************
 105    2021-07-09 03:44    34  ***************
 106    2021-07-09 03:45    34  ***************
 107    2021-07-09 03:46    34  ***************
 108    2021-07-09 03:47     ?  -
 109    2021-07-09 03:48    33  **************
 ...    ..(  6 skipped).    ..  **************
 116    2021-07-09 03:55    33  **************
 117    2021-07-09 03:56    32  *************
 118    2021-07-09 03:57    33  **************
 119    2021-07-09 03:58    33  **************
 120    2021-07-09 03:59    32  *************
 ...    ..( 24 skipped).    ..  *************
 145    2021-07-09 04:24    32  *************
 146    2021-07-09 04:25     ?  -
 147    2021-07-09 04:26    31  ************
 148    2021-07-09 04:27    31  ************
 149    2021-07-09 04:28    31  ************
 150    2021-07-09 04:29     ?  -
 151    2021-07-09 04:30    30  ***********
 152    2021-07-09 04:31    32  *************
 153    2021-07-09 04:32    32  *************
 154    2021-07-09 04:33    32  *************
 155    2021-07-09 04:34     ?  -
 156    2021-07-09 04:35    32  *************
 157    2021-07-09 04:36    32  *************
 158    2021-07-09 04:37    32  *************
 159    2021-07-09 04:38    31  ************
 160    2021-07-09 04:39     ?  -
 161    2021-07-09 04:40    32  *************
 162    2021-07-09 04:41     ?  -
 163    2021-07-09 04:42    34  ***************
 164    2021-07-09 04:43    34  ***************
 165    2021-07-09 04:44    34  ***************
 166    2021-07-09 04:45     ?  -
 167    2021-07-09 04:46    30  ***********

SMART WRITE LOG does not return COUNT and LBA_LOW register
SCT (Get) Error Recovery Control command failed

Device Statistics (GP Log 0x04)
Page  Offset Size        Value Flags Description
0x01  =====  =               =  ===  == General Statistics (rev 1) ==
0x01  0x008  4             149  ---  Lifetime Power-On Resets
0x01  0x010  4             286  ---  Power-on Hours
0x01  0x018  6      6631879435  ---  Logical Sectors Written
0x01  0x020  6        29474848  ---  Number of Write Commands
0x01  0x028  6      2366515178  ---  Logical Sectors Read
0x01  0x030  6        17474077  ---  Number of Read Commands
0x01  0x038  6      1030804063  ---  Date and Time TimeStamp
0x02  =====  =               =  ===  == Free-Fall Statistics (rev 1) ==
0x02  0x010  4              20  ---  Overlimit Shock Events
0x03  =====  =               =  ===  == Rotating Media Statistics (rev 1) ==
0x03  0x008  4             182  ---  Spindle Motor Power-on Hours
0x03  0x010  4             157  ---  Head Flying Hours
0x03  0x018  4            2581  ---  Head Load Events
0x03  0x020  4               0  -D-  Number of Reallocated Logical Sectors
0x03  0x028  4               8  ---  Read Recovery Attempts
0x03  0x030  4               0  ---  Number of Mechanical Start Failures
0x03  0x038  4               0  ---  Number of Realloc. Candidate Logical Sectors
0x03  0x040  4              22  ---  Number of High Priority Unload Events
0x04  =====  =               =  ===  == General Errors Statistics (rev 1) ==
0x04  0x008  4               0  ---  Number of Reported Uncorrectable Errors
0x04  0x010  4              24  ---  Resets Between Cmd Acceptance and Completion
0x05  =====  =               =  ===  == Temperature Statistics (rev 1) ==
0x05  0x008  1              30  ---  Current Temperature
0x05  0x010  1              32  N--  Average Short Term Temperature
0x05  0x018  1               -  N--  Average Long Term Temperature
0x05  0x020  1              52  ---  Highest Temperature
0x05  0x028  1               8  ---  Lowest Temperature
0x05  0x030  1              36  N--  Highest Average Short Term Temperature
0x05  0x038  1              23  N--  Lowest Average Short Term Temperature
0x05  0x040  1               -  N--  Highest Average Long Term Temperature
0x05  0x048  1               -  N--  Lowest Average Long Term Temperature
0x05  0x050  4               0  ---  Time in Over-Temperature
0x05  0x058  1              60  ---  Specified Maximum Operating Temperature
0x05  0x060  4               0  ---  Time in Under-Temperature
0x05  0x068  1               0  ---  Specified Minimum Operating Temperature
0x06  =====  =               =  ===  == Transport Statistics (rev 1) ==
0x06  0x008  4             157  ---  Number of Hardware Resets
0x06  0x010  4             220  ---  Number of ASR Events
0x06  0x018  4               0  ---  Number of Interface CRC Errors
0x07  =====  =               =  ===  == Solid State Device Statistics (rev 1) ==
                                |||_ C monitored condition met
                                ||__ D supports DSN
                                |___ N normalized value

Pending Defects log (GP Log 0x0c) not supported

SATA Phy Event Counters (GP Log 0x11)
ID      Size     Value  Description
0x0001  4            0  Command failed due to ICRC error
0x0002  4            0  R_ERR response for data FIS
0x0003  4            0  R_ERR response for device-to-host data FIS
0x0004  4            0  R_ERR response for host-to-device data FIS
0x0005  4            0  R_ERR response for non-data FIS
0x0006  4            0  R_ERR response for device-to-host non-data FIS
0x0007  4            0  R_ERR response for host-to-device non-data FIS
0x0008  4            0  Device-to-host non-data FIS retries
0x0009  4            5  Transition from drive PhyRdy to drive PhyNRdy
0x000a  4            0  Device-to-host register FISes sent due to a COMRESET
0x000b  4            0  CRC errors within host-to-device FIS
0x000d  4            0  Non-CRC errors within host-to-device FIS
0x000f  4            0  R_ERR response for host-to-device data FIS, CRC
0x0010  4            0  R_ERR response for host-to-device data FIS, non-CRC
0x0012  4            0  R_ERR response for host-to-device non-data FIS, CRC
0x0013  4            0  R_ERR response for host-to-device non-data FIS, non-CRC

