smartctl 7.2 2020-12-30 r5155 [x86_64-linux-5.4.80-gentoo-r1-test6] (local build)
Copyright (C) 2002-20, Bruce Allen, Christian Franke, www.smartmontools.org

=== START OF INFORMATION SECTION ===
Device Model:     MTFDDAK2T0TDL
Serial Number:    1945250C44CF
LU WWN Device Id: 5 00a075 1250c44cf
Firmware Version: M5MU030
User Capacity:    2,048,408,248,320 bytes [2.04 TB]
Sector Size:      512 bytes logical/physical
Rotation Rate:    Solid State Device
Form Factor:      2.5 inches
TRIM Command:     Available, deterministic, zeroed
Device is:        Not in smartctl database [for details use: -P showall]
ATA Version is:   ACS-4 T13/BSR INCITS 529 revision 5
SATA Version is:  SATA 3.3, 6.0 Gb/s (current: 6.0 Gb/s)
Local Time is:    Mon Dec 13 10:30:37 2021 CST
SMART support is: Available - device has SMART capability.
SMART support is: Enabled
AAM feature is:   Unavailable
APM feature is:   Unavailable
Rd look-ahead is: Enabled
Write cache is:   Enabled
DSN feature is:   Unavailable
ATA Security is:  Disabled, NOT FROZEN [SEC1]
Wt Cache Reorder: Enabled

=== START OF READ SMART DATA SECTION ===
SMART overall-health self-assessment test result: PASSED

General SMART Values:
Offline data collection status:  (0x00)	Offline data collection activity
					was never started.
					Auto Offline Data Collection: Disabled.
Self-test execution status:      (   0)	The previous self-test routine completed
					without error or no self-test has ever 
					been run.
Total time to complete Offline 
data collection: 		( 4141) seconds.
Offline data collection
capabilities: 			 (0x7b) SMART execute Offline immediate.
					Auto Offline data collection on/off support.
					Suspend Offline collection upon new
					command.
					Offline surface scan supported.
					Self-test supported.
					Conveyance Self-test supported.
					Selective Self-test supported.
SMART capabilities:            (0x0003)	Saves SMART data before entering
					power-saving mode.
					Supports SMART auto save timer.
Error logging capability:        (0x01)	Error logging supported.
					General Purpose Logging supported.
Short self-test routine 
recommended polling time: 	 (   2) minutes.
Extended self-test routine
recommended polling time: 	 (  19) minutes.
Conveyance self-test routine
recommended polling time: 	 (   3) minutes.
SCT capabilities: 	       (0x0035)	SCT Status supported.
					SCT Feature Control supported.
					SCT Data Table supported.

SMART Attributes Data Structure revision number: 16
Vendor Specific SMART Attributes with Thresholds:
ID# ATTRIBUTE_NAME          FLAGS    VALUE WORST THRESH FAIL RAW_VALUE
  1 Raw_Read_Error_Rate     POSR-K   100   100   000    -    0
  5 Reallocated_Sector_Ct   -O--CK   100   100   010    -    0
  9 Power_On_Hours          -O--CK   100   100   000    -    651
 12 Power_Cycle_Count       -O--CK   100   100   000    -    29
171 Unknown_Attribute       -O--CK   100   100   000    -    0
172 Unknown_Attribute       -O--CK   100   100   000    -    0
173 Unknown_Attribute       -O--CK   099   099   000    -    10
174 Unknown_Attribute       -O--CK   100   100   000    -    16
183 Runtime_Bad_Block       -O--CK   100   100   000    -    0
184 End-to-End_Error        -O--CK   100   100   000    -    0
187 Reported_Uncorrect      -O--CK   100   100   000    -    0
194 Temperature_Celsius     -O---K   061   035   000    -    39 (Min/Max 14/65)
196 Reallocated_Event_Count -O--CK   100   100   000    -    0
197 Current_Pending_Sector  -O--CK   100   100   000    -    0
198 Offline_Uncorrectable   ----CK   100   100   000    -    0
199 UDMA_CRC_Error_Count    -O--CK   100   100   000    -    0
202 Unknown_SSD_Attribute   ----CK   099   099   001    -    1
206 Unknown_SSD_Attribute   -OSR--   100   100   000    -    0
246 Unknown_Attribute       -O--CK   100   100   000    -    18242766620
247 Unknown_Attribute       -O--CK   100   100   000    -    570086542
248 Unknown_Attribute       -O--CK   100   100   000    -    603377048
180 Unused_Rsvd_Blk_Cnt_Tot PO--CK   000   000   000    -    4084
210 Unknown_Attribute       -O--CK   100   100   000    -    0
                            ||||||_ K auto-keep
                            |||||__ C event count
                            ||||___ R error rate
                            |||____ S speed/performance
                            ||_____ O updated online
                            |______ P prefailure warning

General Purpose Log Directory Version 1
SMART           Log Directory Version 1 [multi-sector log support]
Address    Access  R/W   Size  Description
0x00       GPL,SL  R/O      1  Log Directory
0x01           SL  R/O      1  Summary SMART error log
0x02           SL  R/O     51  Comprehensive SMART error log
0x03       GPL     R/O  16383  Ext. Comprehensive SMART error log
0x04       GPL,SL  R/O      8  Device Statistics log
0x06           SL  R/O      1  SMART self-test log
0x07       GPL     R/O      1  Extended self-test log
0x09           SL  R/W      1  Selective self-test log
0x10       GPL     R/O      1  NCQ Command Error log
0x11       GPL     R/O      1  SATA Phy Event Counters log
0x13       GPL     R/O      1  SATA NCQ Send and Receive log
0x24       GPL     R/O   8000  Current Device Internal Status Data log
0x25       GPL     R/O   8000  Saved Device Internal Status Data log
0x30       GPL,SL  R/O      9  IDENTIFY DEVICE data log
0x80-0x9f  GPL,SL  R/W     16  Host vendor specific log
0xa0       GPL     VS   35328  Device vendor specific log
0xa0       SL      VS     255  Device vendor specific log
0xa1       GPL,SL  VS       4  Device vendor specific log
0xa2       GPL,SL  VS       1  Device vendor specific log
0xa3       GPL     VS   38400  Device vendor specific log
0xa3       SL      VS     255  Device vendor specific log
0xa4       GPL     VS   16477  Device vendor specific log
0xa4       SL      VS     255  Device vendor specific log
0xa5       GPL     VS    8000  Device vendor specific log
0xa5       SL      VS     255  Device vendor specific log
0xa6       GPL     VS    8000  Device vendor specific log
0xa6       SL      VS     255  Device vendor specific log
0xa7       GPL     VS   32768  Device vendor specific log
0xa7       SL      VS     255  Device vendor specific log
0xa8-0xdf  GPL,SL  VS       1  Device vendor specific log
0xe0       GPL,SL  R/W      1  SCT Command/Status
0xe1       GPL,SL  R/W      1  SCT Data Transfer

SMART Extended Comprehensive Error Log Version: 1 (16383 sectors)
No Errors Logged

SMART Extended Self-test Log Version: 1 (1 sectors)
Num  Test_Description    Status                  Remaining  LifeTime(hours)  LBA_of_first_error
# 1  Short offline       Completed without error       00%       651         -
# 2  Vendor (0xff)       Completed without error       00%       650         -
# 3  Vendor (0xff)       Completed without error       00%       535         -
# 4  Vendor (0xff)       Completed without error       00%       408         -
# 5  Vendor (0xff)       Completed without error       00%       231         -
# 6  Vendor (0xff)       Completed without error       00%       128         -

SMART Selective self-test log data structure revision number 1
 SPAN  MIN_LBA  MAX_LBA  CURRENT_TEST_STATUS
    1        0        0  Not_testing
    2        0        0  Not_testing
    3        0        0  Completed [00% left] (57881389-57946924)
    4        0        0  Not_testing
    5        0        0  Not_testing
Selective self-test flags (0x0):
  After scanning selected spans, do NOT read-scan remainder of disk.
If Selective self-test is pending on power-up, resume after 0 minute delay.

SCT Status Version:                  3
SCT Version (vendor specific):       1 (0x0001)
Device State:                        Active (0)
Current Temperature:                    39 Celsius
Power Cycle Min/Max Temperature:     36/41 Celsius
Lifetime    Min/Max Temperature:     14/65 Celsius
Specified Max Operating Temperature:    70 Celsius
Under/Over Temperature Limit Count:   0/0
SMART Status:                        0xc24f (PASSED)
Minimum supported ERC Time Limit:    50 (5.0 seconds)

SCT Temperature History Version:     2
Temperature Sampling Period:         1 minute
Temperature Logging Interval:        1 minute
Min/Max recommended Temperature:      0/70 Celsius
Min/Max Temperature Limit:           -1/71 Celsius
Temperature History Size (Index):    478 (148)

Index    Estimated Time   Temperature Celsius
 149    2021-12-13 02:33    32  *************
 ...    ..(120 skipped).    ..  *************
 270    2021-12-13 04:34    32  *************
 271    2021-12-13 04:35    33  **************
 ...    ..(  2 skipped).    ..  **************
 274    2021-12-13 04:38    33  **************
 275    2021-12-13 04:39    34  ***************
 276    2021-12-13 04:40    33  **************
 277    2021-12-13 04:41    33  **************
 278    2021-12-13 04:42    33  **************
 279    2021-12-13 04:43    32  *************
 ...    ..( 44 skipped).    ..  *************
 324    2021-12-13 05:28    32  *************
 325    2021-12-13 05:29    33  **************
 ...    ..( 13 skipped).    ..  **************
 339    2021-12-13 05:43    33  **************
 340    2021-12-13 05:44    34  ***************
 ...    ..( 32 skipped).    ..  ***************
 373    2021-12-13 06:17    34  ***************
 374    2021-12-13 06:18    35  ****************
 ...    ..( 19 skipped).    ..  ****************
 394    2021-12-13 06:38    35  ****************
 395    2021-12-13 06:39    34  ***************
 ...    ..(  8 skipped).    ..  ***************
 404    2021-12-13 06:48    34  ***************
 405    2021-12-13 06:49    35  ****************
 406    2021-12-13 06:50    34  ***************
 ...    ..( 22 skipped).    ..  ***************
 429    2021-12-13 07:13    34  ***************
 430    2021-12-13 07:14    32  *************
 ...    ..( 19 skipped).    ..  *************
 450    2021-12-13 07:34    32  *************
 451    2021-12-13 07:35     ?  -
 452    2021-12-13 07:36    33  **************
 453    2021-12-13 07:37    35  ****************
 454    2021-12-13 07:38     ?  -
 455    2021-12-13 07:39     ?  -
 456    2021-12-13 07:40    31  ************
 457    2021-12-13 07:41    33  **************
 458    2021-12-13 07:42    34  ***************
 459    2021-12-13 07:43    35  ****************
 460    2021-12-13 07:44    36  *****************
 461    2021-12-13 07:45    37  ******************
 462    2021-12-13 07:46    37  ******************
 463    2021-12-13 07:47     ?  -
 464    2021-12-13 07:48    32  *************
 ...    ..(  6 skipped).    ..  *************
 471    2021-12-13 07:55    32  *************
 472    2021-12-13 07:56     ?  -
 473    2021-12-13 07:57    39  ********************
 474    2021-12-13 07:58    41  **********************
 475    2021-12-13 07:59    39  ********************
 476    2021-12-13 08:00    39  ********************
 477    2021-12-13 08:01    39  ********************
   0    2021-12-13 08:02    32  *************
 ...    ..(147 skipped).    ..  *************
 148    2021-12-13 10:30    32  *************

SCT Error Recovery Control command not supported

Device Statistics (GP Log 0x04)
Page  Offset Size        Value Flags Description
0x01  =====  =               =  ===  == General Statistics (rev 3) ==
0x01  0x008  4              29  ---  Lifetime Power-On Resets
0x01  0x010  4             651  ---  Power-on Hours
0x01  0x018  6     18242766620  ---  Logical Sectors Written
0x01  0x020  6        24445805  ---  Number of Write Commands
0x01  0x028  6      4863807154  ---  Logical Sectors Read
0x01  0x030  6        52457770  ---  Number of Read Commands
0x04  =====  =               =  ===  == General Errors Statistics (rev 1) ==
0x04  0x008  4               0  ---  Number of Reported Uncorrectable Errors
0x04  0x010  4              26  ---  Resets Between Cmd Acceptance and Completion
0x05  =====  =               =  ===  == Temperature Statistics (rev 1) ==
0x05  0x008  1              39  ---  Current Temperature
0x05  0x010  1              32  ---  Average Short Term Temperature
0x05  0x018  1               -  ---  Average Long Term Temperature
0x05  0x020  1              65  ---  Highest Temperature
0x05  0x028  1              14  ---  Lowest Temperature
0x05  0x030  1              51  ---  Highest Average Short Term Temperature
0x05  0x038  1              32  ---  Lowest Average Short Term Temperature
0x05  0x040  1               -  ---  Highest Average Long Term Temperature
0x05  0x048  1               -  ---  Lowest Average Long Term Temperature
0x05  0x050  4               0  ---  Time in Over-Temperature
0x05  0x058  1              70  ---  Specified Maximum Operating Temperature
0x05  0x060  4               0  ---  Time in Under-Temperature
0x05  0x068  1               0  ---  Specified Minimum Operating Temperature
0x06  =====  =               =  ===  == Transport Statistics (rev 1) ==
0x06  0x008  4              32  ---  Number of Hardware Resets
0x06  0x010  4               2  ---  Number of ASR Events
0x06  0x018  4               0  ---  Number of Interface CRC Errors
0x07  =====  =               =  ===  == Solid State Device Statistics (rev 1) ==
0x07  0x008  1               1  ---  Percentage Used Endurance Indicator
                                |||_ C monitored condition met
                                ||__ D supports DSN
                                |___ N normalized value

Pending Defects log (GP Log 0x0c) not supported

SATA Phy Event Counters (GP Log 0x11)
ID      Size     Value  Description
0x0001  4            0  Command failed due to ICRC error
0x000a  4            1  Device-to-host register FISes sent due to a COMRESET

