smartctl 7.3 2022-02-28 r5338 [x86_64-linux-5.15.32-gentoo-r1] (local build)
Copyright (C) 2002-22, Bruce Allen, Christian Franke, www.smartmontools.org

=== START OF INFORMATION SECTION ===
Device Model:     MK0400GCTZA
Serial Number:    BTTV319202XS400HGN
LU WWN Device Id: 5 001517 8f361caff
Firmware Version: 5DV1HPG4
User Capacity:    400.088.457.216 bytes [400 GB]
Sector Size:      512 bytes logical/physical
Rotation Rate:    Solid State Device
Form Factor:      2.5 inches
TRIM Command:     Available, deterministic, zeroed
Device is:        Not in smartctl database 7.3/5360
ATA Version is:   ATA8-ACS T13/1699-D revision 4
SATA Version is:  SATA 2.6, 6.0 Gb/s (current: 6.0 Gb/s)
Local Time is:    Fri Apr 29 09:47:13 2022 CEST
SMART support is: Available - device has SMART capability.
SMART support is: Enabled
AAM feature is:   Unavailable
APM feature is:   Unavailable
Rd look-ahead is: Enabled
Write cache is:   Disabled
DSN feature is:   Unavailable
ATA Security is:  Unavailable
Wt Cache Reorder: Enabled

=== START OF READ SMART DATA SECTION ===
SMART overall-health self-assessment test result: PASSED

General SMART Values:
Offline data collection status:  (0x02)	Offline data collection activity
					was completed without error.
					Auto Offline Data Collection: Disabled.
Self-test execution status:      (   0)	The previous self-test routine completed
					without error or no self-test has ever 
					been run.
Total time to complete Offline 
data collection: 		(    2) seconds.
Offline data collection
capabilities: 			 (0x79) SMART execute Offline immediate.
					No Auto Offline data collection support.
					Suspend Offline collection upon new
					command.
					Offline surface scan supported.
					Self-test supported.
					Conveyance Self-test supported.
					Selective Self-test supported.
SMART capabilities:            (0x0003)	Saves SMART data before entering
					power-saving mode.
					Supports SMART auto save timer.
Error logging capability:        (0x01)	Error logging supported.
					General Purpose Logging supported.
Short self-test routine 
recommended polling time: 	 (   1) minutes.
Extended self-test routine
recommended polling time: 	 (  19) minutes.
Conveyance self-test routine
recommended polling time: 	 (  19) minutes.
SCT capabilities: 	       (0x0039)	SCT Status supported.
					SCT Error Recovery Control supported.
					SCT Feature Control supported.
					SCT Data Table supported.

SMART Attributes Data Structure revision number: 1
Vendor Specific SMART Attributes with Thresholds:
ID# ATTRIBUTE_NAME          FLAGS    VALUE WORST THRESH FAIL RAW_VALUE
  1 Raw_Read_Error_Rate     POSR--   130   130   039    -    11795351
  5 Reallocated_Sector_Ct   PO--CK   100   100   001    -    0
  9 Power_On_Hours          -O--CK   100   100   000    -    23458
173 Unknown_Attribute       PO--CK   100   100   001    -    0
175 Program_Fail_Count_Chip PO--CK   100   100   010    -    377967542887
180 Unused_Rsvd_Blk_Cnt_Tot PO-RCK   130   130   039    -    11795351
194 Temperature_Celsius     -O---K   100   100   000    -    21
196 Reallocated_Event_Count PO--CK   100   100   010    -    0
                            ||||||_ K auto-keep
                            |||||__ C event count
                            ||||___ R error rate
                            |||____ S speed/performance
                            ||_____ O updated online
                            |______ P prefailure warning

General Purpose Log Directory Version 1
SMART           Log Directory Version 1 [multi-sector log support]
Address    Access  R/W   Size  Description
0x00       GPL,SL  R/O      1  Log Directory
0x01       GPL,SL  R/O      1  Summary SMART error log
0x02       GPL,SL  R/O      8  Comprehensive SMART error log
0x03       GPL,SL  R/O     20  Ext. Comprehensive SMART error log
0x04       GPL,SL  R/O      8  Device Statistics log
0x06       GPL,SL  R/O      1  SMART self-test log
0x07       GPL,SL  R/O      2  Extended self-test log
0x09       GPL,SL  R/W      1  Selective self-test log
0x10       GPL,SL  R/O      1  NCQ Command Error log
0x11       GPL,SL  R/O      1  SATA Phy Event Counters log
0x80-0x9f  GPL,SL  R/W     16  Host vendor specific log
0xb0       GPL,SL  VS       1  Device vendor specific log
0xb1       GPL,SL  VS      33  Device vendor specific log
0xb5       GPL,SL  VS       1  Device vendor specific log
0xb6       GPL,SL  VS     127  Device vendor specific log
0xd0       GPL,SL  VS       1  Device vendor specific log
0xd1       GPL     VS   13056  Device vendor specific log
0xdf       GPL     VS    1152  Device vendor specific log
0xdf       SL      VS     128  Device vendor specific log
0xe0       GPL,SL  R/W      1  SCT Command/Status
0xe1       GPL,SL  R/W      1  SCT Data Transfer

SMART Extended Comprehensive Error Log Version: 1 (20 sectors)
Device Error Count: 3
	CR     = Command Register
	FEATR  = Features Register
	COUNT  = Count (was: Sector Count) Register
	LBA_48 = Upper bytes of LBA High/Mid/Low Registers ]  ATA-8
	LH     = LBA High (was: Cylinder High) Register    ]   LBA
	LM     = LBA Mid (was: Cylinder Low) Register      ] Register
	LL     = LBA Low (was: Sector Number) Register     ]
	DV     = Device (was: Device/Head) Register
	DC     = Device Control Register
	ER     = Error register
	ST     = Status register
Powered_Up_Time is measured from power on, and printed as
DDd+hh:mm:SS.sss where DD=days, hh=hours, mm=minutes,
SS=sec, and sss=millisec. It "wraps" after 49.710 days.

Error 3 [2] occurred at disk power-on lifetime: 16382 hours (682 days + 14 hours)
  When the command that caused the error occurred, the device was active or idle.

  After command completion occurred, registers were:
  ER -- ST COUNT  LBA_48  LH LM LL DV DC
  -- -- -- == -- == == == -- -- -- -- --
  00 -- 51 01 00 00 11 cc 00 c3 e0 40 00  Error:  at LBA = 0x11cc00c3e0 = 76437046240

  Commands leading to the command that caused the error were:
  CR FEATR COUNT  LBA_48  LH LM LL DV DC  Powered_Up_Time  Command/Feature_Name
  -- == -- == -- == == == -- -- -- -- --  ---------------  --------------------
  60 00 00 01 00 00 11 cc 00 c3 e0 40 00     01:07:52.861  READ FPDMA QUEUED
  60 00 00 01 00 00 11 cb 00 c3 e0 40 00     01:07:52.860  READ FPDMA QUEUED
  60 00 00 01 00 00 11 ca 00 c3 e0 40 00     01:07:52.860  READ FPDMA QUEUED
  60 00 00 01 00 00 11 c9 00 c3 e0 40 00     01:07:52.851  READ FPDMA QUEUED
  60 00 00 01 00 00 11 c8 00 c3 e0 40 00     01:07:52.851  READ FPDMA QUEUED

Error 2 [1] occurred at disk power-on lifetime: 16125 hours (671 days + 21 hours)
  When the command that caused the error occurred, the device was active or idle.

  After command completion occurred, registers were:
  ER -- ST COUNT  LBA_48  LH LM LL DV DC
  -- -- -- == -- == == == -- -- -- -- --
  84 -- 51 00 f0 00 18 c0 00 02 88 48 00  Error: ICRC, ABRT 240 sectors at LBA = 0x18c8000288 = 106434658952

  Commands leading to the command that caused the error were:
  CR FEATR COUNT  LBA_48  LH LM LL DV DC  Powered_Up_Time  Command/Feature_Name
  -- == -- == -- == == == -- -- -- -- --  ---------------  --------------------
  25 00 00 00 f0 00 18 c0 00 02 88 48 00     02:17:09.113  READ DMA EXT
  25 00 00 00 20 00 18 c0 00 02 68 48 00     02:17:09.107  READ DMA EXT
  25 00 00 00 f0 00 18 bf 00 02 78 48 00     02:17:09.107  READ DMA EXT
  25 00 00 00 f0 00 18 be 00 02 88 48 00     02:17:09.104  READ DMA EXT
  25 00 00 00 d8 00 18 bd 00 02 b0 48 00     02:17:09.097  READ DMA EXT

Error 1 [0] occurred at disk power-on lifetime: 15598 hours (649 days + 22 hours)
  When the command that caused the error occurred, the device was active or idle.

  After command completion occurred, registers were:
  ER -- ST COUNT  LBA_48  LH LM LL DV DC
  -- -- -- == -- == == == -- -- -- -- --
  00 -- 51 01 00 00 0f e6 00 5e 00 40 00  Error:  at LBA = 0xfe6005e00 = 68283293184

  Commands leading to the command that caused the error were:
  CR FEATR COUNT  LBA_48  LH LM LL DV DC  Powered_Up_Time  Command/Feature_Name
  -- == -- == -- == == == -- -- -- -- --  ---------------  --------------------
  60 00 00 01 00 00 0f e6 00 5e 00 40 00     00:03:18.482  READ FPDMA QUEUED
  60 00 00 00 08 00 0f c8 00 5e e0 40 00     00:03:18.481  READ FPDMA QUEUED
  60 00 00 00 08 00 0f c8 00 5e f0 40 00     00:03:18.481  READ FPDMA QUEUED
  60 00 00 01 00 00 0f e5 00 5e 00 40 00     00:03:18.481  READ FPDMA QUEUED
  60 00 00 00 08 00 06 41 00 88 88 40 00     00:03:18.480  READ FPDMA QUEUED

SMART Extended Self-test Log Version: 1 (2 sectors)
Num  Test_Description    Status                  Remaining  LifeTime(hours)  LBA_of_first_error
# 1  Short offline       Completed without error       00%     23458         -

SMART Selective self-test log data structure revision number 1
 SPAN  MIN_LBA  MAX_LBA  CURRENT_TEST_STATUS
    1        0        0  Not_testing
    2        0        0  Not_testing
    3        0        0  Not_testing
    4        0        0  Not_testing
    5        0        0  Not_testing
Selective self-test flags (0x0):
  After scanning selected spans, do NOT read-scan remainder of disk.
If Selective self-test is pending on power-up, resume after 0 minute delay.

SCT Status Version:                  3
SCT Version (vendor specific):       1 (0x0001)
Device State:                        Active (0)
Current Temperature:                    21 Celsius
Power Cycle Min/Max Temperature:      9/22 Celsius
Lifetime    Min/Max Temperature:      7/49 Celsius
Specified Max Operating Temperature:    55 Celsius
Under/Over Temperature Limit Count:   0/0

SCT Temperature History Version:     2
Temperature Sampling Period:         1 minute
Temperature Logging Interval:        1 minute
Min/Max recommended Temperature:      0/55 Celsius
Min/Max Temperature Limit:            0/55 Celsius
Temperature History Size (Index):    478 (125)

Index    Estimated Time   Temperature Celsius
 126    2022-04-29 01:50    21  **
 ...    ..(145 skipped).    ..  **
 272    2022-04-29 04:16    21  **
 273    2022-04-29 04:17    20  *
 274    2022-04-29 04:18    20  *
 275    2022-04-29 04:19    21  **
 276    2022-04-29 04:20    20  *
 ...    ..(  2 skipped).    ..  *
 279    2022-04-29 04:23    20  *
 280    2022-04-29 04:24    21  **
 ...    ..( 14 skipped).    ..  **
 295    2022-04-29 04:39    21  **
 296    2022-04-29 04:40     ?  -
 297    2022-04-29 04:41    12  -
 298    2022-04-29 04:42    13  -
 299    2022-04-29 04:43    14  -
 300    2022-04-29 04:44    15  -
 301    2022-04-29 04:45    15  -
 302    2022-04-29 04:46    16  -
 303    2022-04-29 04:47    16  -
 304    2022-04-29 04:48    17  -
 305    2022-04-29 04:49    17  -
 306    2022-04-29 04:50    17  -
 307    2022-04-29 04:51    18  -
 ...    ..(  2 skipped).    ..  -
 310    2022-04-29 04:54    18  -
 311    2022-04-29 04:55    19  -
 ...    ..(  4 skipped).    ..  -
 316    2022-04-29 05:00    19  -
 317    2022-04-29 05:01    20  *
 ...    ..(  8 skipped).    ..  *
 326    2022-04-29 05:10    20  *
 327    2022-04-29 05:11    21  **
 ...    ..( 30 skipped).    ..  **
 358    2022-04-29 05:42    21  **
 359    2022-04-29 05:43     ?  -
 360    2022-04-29 05:44    21  **
 ...    ..(  7 skipped).    ..  **
 368    2022-04-29 05:52    21  **
 369    2022-04-29 05:53     ?  -
 370    2022-04-29 05:54    12  -
 371    2022-04-29 05:55    13  -
 372    2022-04-29 05:56    14  -
 373    2022-04-29 05:57     ?  -
 374    2022-04-29 05:58    14  -
 375    2022-04-29 05:59    15  -
 376    2022-04-29 06:00    16  -
 377    2022-04-29 06:01    16  -
 378    2022-04-29 06:02    16  -
 379    2022-04-29 06:03    17  -
 380    2022-04-29 06:04    17  -
 381    2022-04-29 06:05    17  -
 382    2022-04-29 06:06    18  -
 ...    ..(  5 skipped).    ..  -
 388    2022-04-29 06:12    18  -
 389    2022-04-29 06:13    19  -
 ...    ..( 16 skipped).    ..  -
 406    2022-04-29 06:30    19  -
 407    2022-04-29 06:31     ?  -
 408    2022-04-29 06:32    18  -
 409    2022-04-29 06:33    18  -
 410    2022-04-29 06:34     ?  -
 411    2022-04-29 06:35    12  -
 412    2022-04-29 06:36    13  -
 413    2022-04-29 06:37    14  -
 414    2022-04-29 06:38    15  -
 415    2022-04-29 06:39    15  -
 416    2022-04-29 06:40    16  -
 417    2022-04-29 06:41    16  -
 418    2022-04-29 06:42    17  -
 419    2022-04-29 06:43    17  -
 420    2022-04-29 06:44    17  -
 421    2022-04-29 06:45    18  -
 ...    ..(  2 skipped).    ..  -
 424    2022-04-29 06:48    18  -
 425    2022-04-29 06:49    19  -
 ...    ..(  3 skipped).    ..  -
 429    2022-04-29 06:53    19  -
 430    2022-04-29 06:54    20  *
 ...    ..(  9 skipped).    ..  *
 440    2022-04-29 07:04    20  *
 441    2022-04-29 07:05     ?  -
 442    2022-04-29 07:06    15  -
 443    2022-04-29 07:07    16  -
 444    2022-04-29 07:08     ?  -
 445    2022-04-29 07:09    12  -
 446    2022-04-29 07:10    13  -
 447    2022-04-29 07:11    14  -
 448    2022-04-29 07:12    14  -
 449    2022-04-29 07:13    15  -
 450    2022-04-29 07:14    15  -
 451    2022-04-29 07:15    16  -
 452    2022-04-29 07:16    16  -
 453    2022-04-29 07:17    17  -
 454    2022-04-29 07:18    17  -
 455    2022-04-29 07:19    18  -
 ...    ..(  2 skipped).    ..  -
 458    2022-04-29 07:22    18  -
 459    2022-04-29 07:23    19  -
 ...    ..(  3 skipped).    ..  -
 463    2022-04-29 07:27    19  -
 464    2022-04-29 07:28    20  *
 ...    ..(  9 skipped).    ..  *
 474    2022-04-29 07:38    20  *
 475    2022-04-29 07:39    21  **
 ...    ..(111 skipped).    ..  **
 109    2022-04-29 09:31    21  **
 110    2022-04-29 09:32    22  ***
 111    2022-04-29 09:33    22  ***
 112    2022-04-29 09:34    21  **
 ...    ..( 12 skipped).    ..  **
 125    2022-04-29 09:47    21  **

SCT Error Recovery Control:
           Read: Disabled
          Write: Disabled

Device Statistics (GP Log 0x04)
Page  Offset Size        Value Flags Description
0x01  =====  =               =  ===  == General Statistics (rev 1) ==
0x01  0x008  4            8306  ---  Lifetime Power-On Resets
0x01  0x018  6     84208602178  ---  Logical Sectors Written
0x01  0x020  6      1653303821  ---  Number of Write Commands
0x01  0x028  6     68205022035  ---  Logical Sectors Read
0x01  0x030  6      1069923055  ---  Number of Read Commands
0x04  =====  =               =  ===  == General Errors Statistics (rev 1) ==
0x04  0x008  4               0  ---  Number of Reported Uncorrectable Errors
0x04  0x010  4               0  ---  Resets Between Cmd Acceptance and Completion
0x05  =====  =               =  ===  == Temperature Statistics (rev 1) ==
0x05  0x008  1              21  ---  Current Temperature
0x05  0x010  1              20  ---  Average Short Term Temperature
0x05  0x018  1              20  ---  Average Long Term Temperature
0x05  0x020  1              48  ---  Highest Temperature
0x05  0x028  1              10  ---  Lowest Temperature
0x05  0x030  1              31  ---  Highest Average Short Term Temperature
0x05  0x038  1              12  ---  Lowest Average Short Term Temperature
0x05  0x040  1              24  ---  Highest Average Long Term Temperature
0x05  0x048  1              13  ---  Lowest Average Long Term Temperature
0x05  0x050  4               0  ---  Time in Over-Temperature
0x05  0x058  1              55  ---  Specified Maximum Operating Temperature
0x05  0x060  4               0  ---  Time in Under-Temperature
0x05  0x068  1               0  ---  Specified Minimum Operating Temperature
0x06  =====  =               =  ===  == Transport Statistics (rev 1) ==
0x06  0x008  4          144476  ---  Number of Hardware Resets
0x06  0x010  4           15907  ---  Number of ASR Events
0x06  0x018  4               5  ---  Number of Interface CRC Errors
0x07  =====  =               =  ===  == Solid State Device Statistics (rev 1) ==
0x07  0x008  1               0  ---  Percentage Used Endurance Indicator
                                |||_ C monitored condition met
                                ||__ D supports DSN
                                |___ N normalized value

Pending Defects log (GP Log 0x0c) not supported

SATA Phy Event Counters (GP Log 0x11)
ID      Size     Value  Description
0x0001  4            0  Command failed due to ICRC error
0x0003  4            0  R_ERR response for device-to-host data FIS
0x0004  4            0  R_ERR response for host-to-device data FIS
0x0006  4            0  R_ERR response for device-to-host non-data FIS
0x000a  4            1  Device-to-host register FISes sent due to a COMRESET
0x000b  4            0  CRC errors within host-to-device FIS
0x000d  4            0  Non-CRC errors within host-to-device FIS

