smartctl 7.4 2023-08-01 r5530 [x86_64-linux-6.12.30+bpo-amd64] (local build)
Copyright (C) 2002-23, Bruce Allen, Christian Franke, www.smartmontools.org

=== START OF INFORMATION SECTION ===
Device Model:     ST14000NM0121
Serial Number:    ZKL2R90L
LU WWN Device Id: 5 000c50 0e793ae4f
Firmware Version: SN01
User Capacity:    14,000,519,643,136 bytes [14.0 TB]
Sector Sizes:     512 bytes logical, 4096 bytes physical
Rotation Rate:    7200 rpm
Form Factor:      3.5 inches
Device is:        Not in smartctl database 7.3/5770
ATA Version is:   ACS-4 (minor revision not indicated)
SATA Version is:  SATA 3.3, 6.0 Gb/s (current: 6.0 Gb/s)
Local Time is:    Thu Jun 26 21:24:32 2025 CEST
SMART support is: Available - device has SMART capability.
SMART support is: Enabled
AAM feature is:   Unavailable
APM feature is:   Unavailable
Rd look-ahead is: Enabled
Write cache is:   Enabled
DSN feature is:   Disabled
ATA Security is:  Disabled, frozen [SEC2]
Write SCT (Get) Feature Control Command failed: scsi error unsupported field in scsi command
Wt Cache Reorder: Unknown (SCT Feature Control command failed)

=== START OF READ SMART DATA SECTION ===
SMART overall-health self-assessment test result: PASSED

General SMART Values:
Offline data collection status:  (0x82)	Offline data collection activity
					was completed without error.
					Auto Offline Data Collection: Enabled.
Self-test execution status:      (   0)	The previous self-test routine completed
					without error or no self-test has ever 
					been run.
Total time to complete Offline 
data collection: 		(  567) seconds.
Offline data collection
capabilities: 			 (0x1b) SMART execute Offline immediate.
					Auto Offline data collection on/off support.
					Suspend Offline collection upon new
					command.
					Offline surface scan supported.
					Self-test supported.
					No Conveyance Self-test supported.
					No Selective Self-test supported.
SMART capabilities:            (0x0003)	Saves SMART data before entering
					power-saving mode.
					Supports SMART auto save timer.
Error logging capability:        (0x01)	Error logging supported.
					General Purpose Logging supported.
Short self-test routine 
recommended polling time: 	 (   2) minutes.
Extended self-test routine
recommended polling time: 	 ( 612) minutes.
SCT capabilities: 	       (0x50bd)	SCT Status supported.
					SCT Error Recovery Control supported.
					SCT Feature Control supported.
					SCT Data Table supported.

SMART Attributes Data Structure revision number: 10
Vendor Specific SMART Attributes with Thresholds:
ID# ATTRIBUTE_NAME          FLAGS    VALUE WORST THRESH FAIL RAW_VALUE
  1 Raw_Read_Error_Rate     POSR--   080   066   044    -    105925848
  3 Spin_Up_Time            PO----   095   094   000    -    0
  4 Start_Stop_Count        -O--CK   100   100   020    -    11
  5 Reallocated_Sector_Ct   PO--CK   100   100   010    -    0
  7 Seek_Error_Rate         POSR--   067   060   030    -    5569073
  9 Power_On_Hours          -O--CK   100   100   000    -    22
 10 Spin_Retry_Count        PO--C-   100   100   097    -    0
 12 Power_Cycle_Count       -O--CK   100   100   020    -    10
 18 Unknown_Attribute       PO-R--   100   100   050    -    0
187 Reported_Uncorrect      -O--CK   100   100   000    -    0
188 Command_Timeout         -O--CK   100   099   000    -    2
190 Airflow_Temperature_Cel -O---K   062   047   000    -    38 (Min/Max 28/40)
192 Power-Off_Retract_Count -O--CK   100   100   000    -    8
193 Load_Cycle_Count        -O--CK   100   100   000    -    12
194 Temperature_Celsius     -O---K   038   046   000    -    38 (0 24 0 0 0)
197 Current_Pending_Sector  -O--C-   100   100   000    -    0
198 Offline_Uncorrectable   ----C-   100   100   000    -    0
199 UDMA_CRC_Error_Count    -OSRCK   200   200   000    -    0
200 Multi_Zone_Error_Rate   PO---K   100   100   001    -    0
240 Head_Flying_Hours       ------   100   100   000    -    22 (144 72 0)
241 Total_LBAs_Written      ------   100   253   000    -    1376
242 Total_LBAs_Read         ------   100   253   000    -    350067381
                            ||||||_ K auto-keep
                            |||||__ C event count
                            ||||___ R error rate
                            |||____ S speed/performance
                            ||_____ O updated online
                            |______ P prefailure warning

General Purpose Log Directory Version 1
SMART           Log Directory Version 1 [multi-sector log support]
Address    Access  R/W   Size  Description
0x00       GPL,SL  R/O      1  Log Directory
0x01           SL  R/O      1  Summary SMART error log
0x02           SL  R/O      5  Comprehensive SMART error log
0x03       GPL     R/O      5  Ext. Comprehensive SMART error log
0x04       GPL     R/O    256  Device Statistics log
0x04       SL      R/O      8  Device Statistics log
0x06           SL  R/O      1  SMART self-test log
0x07       GPL     R/O      1  Extended self-test log
0x08       GPL     R/O      2  Power Conditions log
0x0a       GPL     R/W      8  Device Statistics Notification
0x0c       GPL     R/O   4096  Pending Defects log
0x10       GPL     R/O      1  NCQ Command Error log
0x11       GPL     R/O      1  SATA Phy Event Counters log
0x13       GPL     R/O      1  SATA NCQ Send and Receive log
0x21       GPL     R/O      1  Write stream error log
0x22       GPL     R/O      1  Read stream error log
0x24       GPL     R/O      1  Current Device Internal Status Data log
0x2f       GPL     R/O      1  Set Sector Configuration
0x30       GPL,SL  R/O      9  IDENTIFY DEVICE data log
0x47       GPL     R/O      1  Concurrent Positioning Ranges log
0x80-0x9f  GPL,SL  R/W     16  Host vendor specific log
0xa1       GPL,SL  VS      40  Device vendor specific log
0xa2       GPL     VS   16320  Device vendor specific log
0xa4       GPL,SL  VS     160  Device vendor specific log
0xa6       GPL     VS     192  Device vendor specific log
0xa8-0xa9  GPL     VS     272  Device vendor specific log
0xab       GPL     VS       1  Device vendor specific log
0xad       GPL     VS      16  Device vendor specific log
0xb1       GPL,SL  VS      40  Device vendor specific log
0xb6       GPL     VS    1920  Device vendor specific log
0xbe-0xbf  GPL     VS   65535  Device vendor specific log
0xc1       GPL,SL  VS      16  Device vendor specific log
0xc3       GPL,SL  VS      32  Device vendor specific log
0xc7       GPL,SL  VS       8  Device vendor specific log
0xc9       GPL,SL  VS       8  Device vendor specific log
0xca       GPL,SL  VS      16  Device vendor specific log
0xd1       GPL     VS     656  Device vendor specific log
0xd2       GPL     VS   10000  Device vendor specific log
0xd4       GPL     VS    2048  Device vendor specific log
0xda       GPL,SL  VS       1  Device vendor specific log
0xe0       GPL,SL  R/W      1  SCT Command/Status
0xe1       GPL,SL  R/W      1  SCT Data Transfer

SMART Extended Comprehensive Error Log Version: 1 (5 sectors)
No Errors Logged

SMART Extended Self-test Log Version: 1 (1 sectors)
Num  Test_Description    Status                  Remaining  LifeTime(hours)  LBA_of_first_error
# 1  Short offline       Completed without error       00%        22         -
# 2  Short offline       Interrupted (host reset)      00%        10         -
# 3  Extended offline    Completed without error       00%        10         -
# 4  Short offline       Completed without error       00%         0         -

Selective Self-tests/Logging not supported

SCT Status Version:                  3
SCT Version (vendor specific):       522 (0x020a)
Device State:                        Active (0)
Current Temperature:                    38 Celsius
Power Cycle Min/Max Temperature:     28/40 Celsius
Lifetime    Min/Max Temperature:     24/53 Celsius
Specified Max Operating Temperature:    70 Celsius
Under/Over Temperature Limit Count:   0/0
SMART Status:                        0xc24f (PASSED)
Vendor specific:
00 00 00 00 00 00 00 00 00 00 00 00 00 00 00 00
00 00 00 00 03 00 00 00 00 00 00 00 00 00 00 00

SCT Temperature History Version:     2
Temperature Sampling Period:         5 minutes
Temperature Logging Interval:        59 minutes
Min/Max recommended Temperature:     10/40 Celsius
Min/Max Temperature Limit:            5/70 Celsius
Temperature History Size (Index):    128 (40)

Index    Estimated Time   Temperature Celsius
  41    2025-06-21 16:24     ?  -
 ...    ..( 85 skipped).    ..  -
 127    2025-06-25 04:58     ?  -
   0    2025-06-25 05:57    53  **********************************
   1    2025-06-25 06:56     ?  -
   2    2025-06-25 07:55    53  **********************************
   3    2025-06-25 08:54     ?  -
   4    2025-06-25 09:53    52  *********************************
   5    2025-06-25 10:52     ?  -
   6    2025-06-25 11:51    46  ***************************
   7    2025-06-25 12:50     ?  -
   8    2025-06-25 13:49    26  *******
   9    2025-06-25 14:48    40  *********************
  10    2025-06-25 15:47    42  ***********************
 ...    ..(  2 skipped).    ..  ***********************
  13    2025-06-25 18:44    42  ***********************
  14    2025-06-25 19:43    41  **********************
  15    2025-06-25 20:42    41  **********************
  16    2025-06-25 21:41    41  **********************
  17    2025-06-25 22:40    40  *********************
  18    2025-06-25 23:39    40  *********************
  19    2025-06-26 00:38     ?  -
  20    2025-06-26 01:37    24  *****
  21    2025-06-26 02:36     ?  -
  22    2025-06-26 03:35    24  *****
  23    2025-06-26 04:34     ?  -
  24    2025-06-26 05:33    26  *******
  25    2025-06-26 06:32     ?  -
  26    2025-06-26 07:31    36  *****************
  27    2025-06-26 08:30    38  *******************
  28    2025-06-26 09:29    38  *******************
  29    2025-06-26 10:28     ?  -
  30    2025-06-26 11:27    26  *******
  31    2025-06-26 12:26     ?  -
  32    2025-06-26 13:25    28  *********
  33    2025-06-26 14:24    39  ********************
  34    2025-06-26 15:23    39  ********************
  35    2025-06-26 16:22    38  *******************
  36    2025-06-26 17:21    39  ********************
  37    2025-06-26 18:20    38  *******************
 ...    ..(  2 skipped).    ..  *******************
  40    2025-06-26 21:17    38  *******************

SCT Error Recovery Control:
           Read:    100 (10.0 seconds)
          Write:    100 (10.0 seconds)

Device Statistics (GP Log 0x04)
Page  Offset Size        Value Flags Description
0x01  =====  =               =  ===  == General Statistics (rev 1) ==
0x01  0x008  4              10  ---  Lifetime Power-On Resets
0x01  0x010  4              22  ---  Power-on Hours
0x01  0x018  6            1376  ---  Logical Sectors Written
0x01  0x020  6             160  ---  Number of Write Commands
0x01  0x028  6       350063210  ---  Logical Sectors Read
0x01  0x030  6          168959  ---  Number of Read Commands
0x01  0x038  6               -  ---  Date and Time TimeStamp
0x03  =====  =               =  ===  == Rotating Media Statistics (rev 1) ==
0x03  0x008  4              22  ---  Spindle Motor Power-on Hours
0x03  0x010  4              22  ---  Head Flying Hours
0x03  0x018  4              12  ---  Head Load Events
0x03  0x030  4               0  ---  Number of Mechanical Start Failures
0x03  0x040  4               8  ---  Number of High Priority Unload Events
0x04  =====  =               =  ===  == General Errors Statistics (rev 1) ==
0x04  0x010  4               2  ---  Resets Between Cmd Acceptance and Completion
0x04  0x018  4               0  -D-  Physical Element Status Changed
0x05  =====  =               =  ===  == Temperature Statistics (rev 1) ==
0x05  0x008  1              38  ---  Current Temperature
0x05  0x010  1               -  ---  Average Short Term Temperature
0x05  0x018  1               -  ---  Average Long Term Temperature
0x05  0x020  1              42  ---  Highest Temperature
0x05  0x028  1              27  ---  Lowest Temperature
0x05  0x030  1               -  ---  Highest Average Short Term Temperature
0x05  0x038  1               -  ---  Lowest Average Short Term Temperature
0x05  0x040  1               -  ---  Highest Average Long Term Temperature
0x05  0x048  1               -  ---  Lowest Average Long Term Temperature
0x05  0x050  4               0  ---  Time in Over-Temperature
0x05  0x058  1              70  ---  Specified Maximum Operating Temperature
0x05  0x060  4               0  ---  Time in Under-Temperature
0x05  0x068  1               5  ---  Specified Minimum Operating Temperature
0x06  =====  =               =  ===  == Transport Statistics (rev 1) ==
0x06  0x008  4               9  ---  Number of Hardware Resets
0x06  0x010  4               4  ---  Number of ASR Events
0x06  0x018  4               0  ---  Number of Interface CRC Errors
0xff  =====  =               =  ===  == Vendor Specific Statistics (rev 1) ==
0xff  0x008  7               0  ---  Vendor Specific
0xff  0x010  7               0  ---  Vendor Specific
0xff  0x018  7               0  ---  Vendor Specific
                                |||_ C monitored condition met
                                ||__ D supports DSN
                                |___ N normalized value

Pending Defects log (GP Log 0x0c)
No Defects Logged

SATA Phy Event Counters (GP Log 0x11)
ID      Size     Value  Description
0x000a  2            5  Device-to-host register FISes sent due to a COMRESET
0x0001  2            0  Command failed due to ICRC error
0x0003  2            0  R_ERR response for device-to-host data FIS
0x0004  2            0  R_ERR response for host-to-device data FIS
0x0006  2            0  R_ERR response for device-to-host non-data FIS
0x0007  2            0  R_ERR response for host-to-device non-data FIS

Seagate FARM log (GP Log 0xa6) supported [try: -l farm]

