smartctl 6.4 2014-10-07 r4002 [armv7l-linux-4.9.47-odroidxu4] (local build)
Copyright (C) 2002-14, Bruce Allen, Christian Franke, www.smartmontools.org

=== START OF INFORMATION SECTION ===
Device Model:     ST8000DM004-2CX188
LU WWN Device Id: 5 000c50 0aa1a8e30
Firmware Version: 0001
User Capacity:    8'001'563'222'016 bytes [8.00 TB]
Sector Sizes:     512 bytes logical, 4096 bytes physical
Rotation Rate:    5425 rpm
Device is:        Not in smartctl database [for details use: -P showall]
ATA Version is:   ACS-3 T13/2161-D revision 5
SATA Version is:  SATA 3.1, 6.0 Gb/s (current: 3.0 Gb/s)
Local Time is:    Thu Oct 12 17:42:14 2017 CEST
SMART support is: Available - device has SMART capability.
SMART support is: Enabled
AAM feature is:   Unavailable
APM feature is:   Unavailable
Rd look-ahead is: Enabled
Write cache is:   Enabled
ATA Security is:  Disabled, NOT FROZEN [SEC1]
Wt Cache Reorder: Unavailable

=== START OF READ SMART DATA SECTION ===
SMART overall-health self-assessment test result: PASSED

General SMART Values:
Offline data collection status:  (0x82)	Offline data collection activity
					was completed without error.
					Auto Offline Data Collection: Enabled.
Self-test execution status:      (   0)	The previous self-test routine completed
					without error or no self-test has ever 
					been run.
Total time to complete Offline 
data collection: 		(    0) seconds.
Offline data collection
capabilities: 			 (0x7b) SMART execute Offline immediate.
					Auto Offline data collection on/off support.
					Suspend Offline collection upon new
					command.
					Offline surface scan supported.
					Self-test supported.
					Conveyance Self-test supported.
					Selective Self-test supported.
SMART capabilities:            (0x0003)	Saves SMART data before entering
					power-saving mode.
					Supports SMART auto save timer.
Error logging capability:        (0x01)	Error logging supported.
					General Purpose Logging supported.
Short self-test routine 
recommended polling time: 	 (   1) minutes.
Extended self-test routine
recommended polling time: 	 ( 954) minutes.
Conveyance self-test routine
recommended polling time: 	 (   2) minutes.
SCT capabilities: 	       (0x30a5)	SCT Status supported.
					SCT Data Table supported.

SMART Attributes Data Structure revision number: 10
Vendor Specific SMART Attributes with Thresholds:
ID# ATTRIBUTE_NAME          FLAGS    VALUE WORST THRESH FAIL RAW_VALUE
  1 Raw_Read_Error_Rate     POSR--   077   064   006    -    50801048
  3 Spin_Up_Time            PO----   092   091   000    -    0
  4 Start_Stop_Count        -O--CK   100   100   020    -    139
  5 Reallocated_Sector_Ct   PO--CK   100   100   010    -    0
  7 Seek_Error_Rate         POSR--   072   060   045    -    14966772
  9 Power_On_Hours          -O--CK   100   100   000    -    463 (169 168 0)
 10 Spin_Retry_Count        PO--C-   100   100   097    -    0
 12 Power_Cycle_Count       -O--CK   100   100   020    -    85
183 Runtime_Bad_Block       -O--CK   100   100   000    -    0
184 End-to-End_Error        -O--CK   100   100   099    -    0
187 Reported_Uncorrect      -O--CK   100   100   000    -    0
188 Command_Timeout         -O--CK   100   089   000    -    111670853658
189 High_Fly_Writes         -O-RCK   100   100   000    -    0
190 Airflow_Temperature_Cel -O---K   063   042   040    -    37 (Min/Max 37/37)
191 G-Sense_Error_Rate      -O--CK   100   100   000    -    0
192 Power-Off_Retract_Count -O--CK   100   100   000    -    43
193 Load_Cycle_Count        -O--CK   100   100   000    -    199
194 Temperature_Celsius     -O---K   037   058   000    -    37 (0 22 0 0 0)
195 Hardware_ECC_Recovered  -O-RC-   077   064   000    -    50801048
197 Current_Pending_Sector  -O--C-   100   100   000    -    0
198 Offline_Uncorrectable   ----C-   100   100   000    -    0
199 UDMA_CRC_Error_Count    -OSRCK   200   200   000    -    0
240 Head_Flying_Hours       ------   100   253   000    -    377 (102 228 0)
241 Total_LBAs_Written      ------   100   253   000    -    30582325328
242 Total_LBAs_Read         ------   100   253   000    -    8322961736
                            ||||||_ K auto-keep
                            |||||__ C event count
                            ||||___ R error rate
                            |||____ S speed/performance
                            ||_____ O updated online
                            |______ P prefailure warning

ATA_READ_LOG_EXT (addr=0x00:0x00, page=0, n=1) failed: Connection timed out
Read GP Log Directory failed

SMART Log Directory Version 1 [multi-sector log support]
Address    Access  R/W   Size  Description
0x00           SL  R/O      1  Log Directory
0x01           SL  R/O      1  Summary SMART error log
0x02           SL  R/O      5  Comprehensive SMART error log
0x04           SL  R/O      8  Device Statistics log
0x06           SL  R/O      1  SMART self-test log
0x09           SL  R/W      1  Selective self-test log
0x30           SL  R/O      9  IDENTIFY DEVICE data log
0x80-0x9f      SL  R/W     16  Host vendor specific log
0xa1           SL  VS      24  Device vendor specific log
0xa8-0xa9      SL  VS     136  Device vendor specific log
0xc0           SL  VS       1  Device vendor specific log
0xc1           SL  VS      16  Device vendor specific log
0xc3           SL  VS       8  Device vendor specific log
0xc4           SL  VS      24  Device vendor specific log
0xe0           SL  R/W      1  SCT Command/Status
0xe1           SL  R/W      1  SCT Data Transfer

SMART Extended Comprehensive Error Log (GP Log 0x03) not supported

SMART Error Log Version: 1
No Errors Logged

SMART Extended Self-test Log (GP Log 0x07) not supported

SMART Self-test log structure revision number 1
Num  Test_Description    Status                  Remaining  LifeTime(hours)  LBA_of_first_error
# 1  Short offline       Completed without error       00%         9         -

SMART Selective self-test log data structure revision number 1
 SPAN  MIN_LBA  MAX_LBA  CURRENT_TEST_STATUS
    1        0        0  Not_testing
    2        0        0  Not_testing
    3        0        0  Not_testing
    4        0        0  Not_testing
    5        0        0  Not_testing
Selective self-test flags (0x0):
  After scanning selected spans, do NOT read-scan remainder of disk.
If Selective self-test is pending on power-up, resume after 0 minute delay.

SCT Status Version:                  3
SCT Version (vendor specific):       522 (0x020a)
SCT Support Level:                   1
Device State:                        Active (0)
Current Temperature:                    37 Celsius
Power Cycle Min/Max Temperature:     37/37 Celsius
Lifetime    Min/Max Temperature:     23/58 Celsius
Under/Over Temperature Limit Count:   0/0

Write SCT Data Table failed: Connection timed out
Read SCT Temperature History failed

SCT Error Recovery Control command not supported

Device Statistics (SMART Log 0x04)
Page Offset Size         Value  Description
  1  =====  =                =  == General Statistics (invalid page 183 in header) ==
  3  =====  =                =  == Rotating Media Statistics (invalid page 230 in header) ==
  4  =====  =                =  == General Errors Statistics (invalid page 179 in header) ==
  5  =====  =                =  == Temperature Statistics (invalid page 179 in header) ==
  6  =====  =                =  == Transport Statistics (invalid page 188 in header) ==

ATA_READ_LOG_EXT (addr=0x11:0x00, page=0, n=1) failed: Connection timed out
Read SATA Phy Event Counters failed

