smartctl 7.3 2021-09-14 r5236 [i686-w64-mingw32-w10-21H1(64)] (CircleCI)
Copyright (C) 2002-21, Bruce Allen, Christian Franke, www.smartmontools.org

=== START OF INFORMATION SECTION ===
Device Model:     SanDisk SD7SB3Q-256G-1006
Serial Number:    152099401201
LU WWN Device Id: 5 001b44 e7569a9f1
Firmware Version: X2180006
User Capacity:    256,060,514,304 bytes [256 GB]
Sector Sizes:     512 bytes logical, 4096 bytes physical
Rotation Rate:    Solid State Device
Form Factor:      2.5 inches
TRIM Command:     Available, deterministic, zeroed
Device is:        Not in smartctl database 7.2/5236
ATA Version is:   ACS-2 T13/2015-D revision 3
SATA Version is:  SATA 3.2, 6.0 Gb/s (current: 6.0 Gb/s)
Local Time is:    Mon Oct 11 09:46:45 2021 EDT
SMART support is: Available - device has SMART capability.
SMART support is: Enabled
AAM feature is:   Unavailable
APM level is:     128 (minimum power consumption without standby)
Rd look-ahead is: Enabled
Write cache is:   Enabled
DSN feature is:   Unavailable
ATA Security is:  Disabled, frozen [SEC2]
Wt Cache Reorder: Enabled

=== START OF READ SMART DATA SECTION ===
SMART overall-health self-assessment test result: PASSED
See vendor-specific Attribute list for marginal Attributes.

General SMART Values:
Offline data collection status:  (0x82)	Offline data collection activity
					was completed without error.
					Auto Offline Data Collection: Enabled.
Self-test execution status:      (   0)	The previous self-test routine completed
					without error or no self-test has ever 
					been run.
Total time to complete Offline 
data collection: 		(  120) seconds.
Offline data collection
capabilities: 			 (0x5b) SMART execute Offline immediate.
					Auto Offline data collection on/off support.
					Suspend Offline collection upon new
					command.
					Offline surface scan supported.
					Self-test supported.
					No Conveyance Self-test supported.
					Selective Self-test supported.
SMART capabilities:            (0x0003)	Saves SMART data before entering
					power-saving mode.
					Supports SMART auto save timer.
Error logging capability:        (0x01)	Error logging supported.
					General Purpose Logging supported.
Short self-test routine 
recommended polling time: 	 (   2) minutes.
Extended self-test routine
recommended polling time: 	 (  17) minutes.
SCT capabilities: 	       (0x003d)	SCT Status supported.
					SCT Error Recovery Control supported.
					SCT Feature Control supported.
					SCT Data Table supported.

SMART Attributes Data Structure revision number: 16
Vendor Specific SMART Attributes with Thresholds:
ID# ATTRIBUTE_NAME          FLAGS    VALUE WORST THRESH FAIL RAW_VALUE
  1 Raw_Read_Error_Rate     POSR-K   252   252   002    -    0
  5 Reallocated_Sector_Ct   PO--CK   252   252   005    -    0
  9 Power_On_Hours          -O--CK   045   045   ---    -    24272
 12 Power_Cycle_Count       -O--CK   252   252   ---    -    841
170 Unknown_Attribute       PO--CK   100   100   010    -    0
171 Unknown_Attribute       -O---K   100   100   ---    -    0
172 Unknown_Attribute       -O--CK   100   100   ---    -    0
173 Unknown_Attribute       PO--CK   095   095   005    -    751639003137
174 Unknown_Attribute       -O--CK   252   252   ---    -    89
183 Runtime_Bad_Block       -O--CK   100   100   000    -    0
184 End-to-End_Error        PO--CK   100   100   097    -    0
187 Reported_Uncorrect      -O--CK   100   100   ---    -    0
188 Command_Timeout         -O--CK   100   099   ---    -    1
190 Airflow_Temperature_Cel -O---K   054   027   045    Past 46
196 Reallocated_Event_Count -O--CK   252   252   ---    -    0
199 UDMA_CRC_Error_Count    -O---K   100   100   ---    -    0
244 Unknown_Attribute       -O--CK   000   100   ---    -    0
                            ||||||_ K auto-keep
                            |||||__ C event count
                            ||||___ R error rate
                            |||____ S speed/performance
                            ||_____ O updated online
                            |______ P prefailure warning

General Purpose Log Directory Version 1
SMART           Log Directory Version 1 [multi-sector log support]
Address    Access  R/W   Size  Description
0x00       GPL,SL  R/O      1  Log Directory
0x01           SL  R/O      1  Summary SMART error log
0x02           SL  R/O      2  Comprehensive SMART error log
0x03       GPL     R/O      1  Ext. Comprehensive SMART error log
0x04       GPL,SL  R/O      8  Device Statistics log
0x06           SL  R/O      1  SMART self-test log
0x07       GPL     R/O      1  Extended self-test log
0x09           SL  R/W      1  Selective self-test log
0x10       GPL     R/O      1  NCQ Command Error log
0x11       GPL     R/O      1  SATA Phy Event Counters log
0x30       GPL,SL  R/O      9  IDENTIFY DEVICE data log
0x80-0x9f  GPL,SL  R/W     16  Host vendor specific log
0xb6       GPL     VS     127  Device vendor specific log
0xde       GPL     VS       8  Device vendor specific log
0xe0       GPL,SL  R/W      1  SCT Command/Status
0xe1       GPL,SL  R/W      1  SCT Data Transfer

SMART Extended Comprehensive Error Log Version: 1 (1 sectors)
No Errors Logged

SMART Extended Self-test Log Version: 1 (1 sectors)
Num  Test_Description    Status                  Remaining  LifeTime(hours)  LBA_of_first_error
# 1  Short offline       Completed without error       00%     24272         -
# 2  Short offline       Completed without error       00%         2         -

SMART Selective self-test log data structure revision number 1
 SPAN  MIN_LBA  MAX_LBA  CURRENT_TEST_STATUS
    1        0        0  Not_testing
    2        0        0  Not_testing
    3        0        0  Not_testing
    4        0        0  Not_testing
    5        0        0  Not_testing
Selective self-test flags (0x0):
  After scanning selected spans, do NOT read-scan remainder of disk.
If Selective self-test is pending on power-up, resume after 0 minute delay.

SCT Status Version:                  3
SCT Version (vendor specific):       257 (0x0101)
Device State:                        Active (0)
Current Temperature:                    47 Celsius
Power Cycle Min/Max Temperature:     33/50 Celsius
Lifetime    Min/Max Temperature:     33/50 Celsius
Specified Max Operating Temperature:    47 Celsius
Under/Over Temperature Limit Count:   0/0
Vendor specific:
00 00 00 00 00 00 00 00 00 00 00 00 00 00 00 00
01 00 01 00 01 00 00 00 00 00 00 00 00 00 00 00

SCT Temperature History Version:     2
Temperature Sampling Period:         1 minute
Temperature Logging Interval:        1 minute
Min/Max recommended Temperature:     -10/70 Celsius
Min/Max Temperature Limit:           -15/90 Celsius
Temperature History Size (Index):    256 (143)

Index    Estimated Time   Temperature Celsius
 144    2021-10-11 05:31    45  **************************
 ...    ..( 12 skipped).    ..  **************************
 157    2021-10-11 05:44    45  **************************
 158    2021-10-11 05:45    44  *************************
 159    2021-10-11 05:46    45  **************************
 ...    ..( 10 skipped).    ..  **************************
 170    2021-10-11 05:57    45  **************************
 171    2021-10-11 05:58    43  ************************
 172    2021-10-11 05:59    43  ************************
 173    2021-10-11 06:00    42  ***********************
 174    2021-10-11 06:01    42  ***********************
 175    2021-10-11 06:02    41  **********************
 ...    ..(  2 skipped).    ..  **********************
 178    2021-10-11 06:05    41  **********************
 179    2021-10-11 06:06    40  *********************
 ...    ..( 69 skipped).    ..  *********************
 249    2021-10-11 07:16    40  *********************
 250    2021-10-11 07:17    42  ***********************
 251    2021-10-11 07:18    41  **********************
 252    2021-10-11 07:19    40  *********************
 ...    ..( 32 skipped).    ..  *********************
  29    2021-10-11 07:52    40  *********************
  30    2021-10-11 07:53    41  **********************
  31    2021-10-11 07:54    42  ***********************
  32    2021-10-11 07:55    40  *********************
  33    2021-10-11 07:56    41  **********************
  34    2021-10-11 07:57    41  **********************
  35    2021-10-11 07:58    40  *********************
 ...    ..( 15 skipped).    ..  *********************
  51    2021-10-11 08:14    40  *********************
  52    2021-10-11 08:15    41  **********************
  53    2021-10-11 08:16    41  **********************
  54    2021-10-11 08:17    41  **********************
  55    2021-10-11 08:18    40  *********************
 ...    ..( 20 skipped).    ..  *********************
  76    2021-10-11 08:39    40  *********************
  77    2021-10-11 08:40    41  **********************
  78    2021-10-11 08:41    42  ***********************
  79    2021-10-11 08:42    42  ***********************
  80    2021-10-11 08:43    44  *************************
  81    2021-10-11 08:44    44  *************************
  82    2021-10-11 08:45    44  *************************
  83    2021-10-11 08:46    45  **************************
  84    2021-10-11 08:47    45  **************************
  85    2021-10-11 08:48    44  *************************
  86    2021-10-11 08:49    44  *************************
  87    2021-10-11 08:50    45  **************************
  88    2021-10-11 08:51    44  *************************
  89    2021-10-11 08:52    44  *************************
  90    2021-10-11 08:53    45  **************************
  91    2021-10-11 08:54    45  **************************
  92    2021-10-11 08:55    45  **************************
  93    2021-10-11 08:56    46  ***************************
  94    2021-10-11 08:57    46  ***************************
  95    2021-10-11 08:58    45  **************************
 ...    ..(  6 skipped).    ..  **************************
 102    2021-10-11 09:05    45  **************************
 103    2021-10-11 09:06    46  ***************************
 104    2021-10-11 09:07    46  ***************************
 105    2021-10-11 09:08    45  **************************
 ...    ..(  4 skipped).    ..  **************************
 110    2021-10-11 09:13    45  **************************
 111    2021-10-11 09:14    46  ***************************
 ...    ..(  2 skipped).    ..  ***************************
 114    2021-10-11 09:17    46  ***************************
 115    2021-10-11 09:18    45  **************************
 116    2021-10-11 09:19    44  *************************
 117    2021-10-11 09:20    44  *************************
 118    2021-10-11 09:21    45  **************************
 119    2021-10-11 09:22    44  *************************
 120    2021-10-11 09:23    44  *************************
 121    2021-10-11 09:24    45  **************************
 ...    ..(  9 skipped).    ..  **************************
 131    2021-10-11 09:34    45  **************************
 132    2021-10-11 09:35    46  ***************************
 ...    ..(  2 skipped).    ..  ***************************
 135    2021-10-11 09:38    46  ***************************
 136    2021-10-11 09:39    45  **************************
 137    2021-10-11 09:40    45  **************************
 138    2021-10-11 09:41    46  ***************************
 139    2021-10-11 09:42    45  **************************
 140    2021-10-11 09:43    45  **************************
 141    2021-10-11 09:44    47  ****************************
 142    2021-10-11 09:45    47  ****************************
 143    2021-10-11 09:46    47  ****************************

SCT Error Recovery Control:
           Read: Disabled
          Write: Disabled

Device Statistics (GP Log 0x04)
Page  Offset Size        Value Flags Description
0x01  =====  =               =  ===  == General Statistics (rev 2) ==
0x01  0x008  4             841  ---  Lifetime Power-On Resets
0x01  0x018  6  10255167638513  ---  Logical Sectors Written
0x01  0x020  6       298941672  ---  Number of Write Commands
0x01  0x028  6  10007433034228  ---  Logical Sectors Read
0x01  0x030  6       337967286  ---  Number of Read Commands
0x07  =====  =               =  ===  == Solid State Device Statistics (rev 1) ==
0x07  0x008  1               5  ---  Percentage Used Endurance Indicator
                                |||_ C monitored condition met
                                ||__ D supports DSN
                                |___ N normalized value

Pending Defects log (GP Log 0x0c) not supported

SATA Phy Event Counters (GP Log 0x11)
ID      Size     Value  Description
0x0001  4            0  Command failed due to ICRC error
0x0002  4            0  R_ERR response for data FIS
0x0005  4            0  R_ERR response for non-data FIS
0x000a  4          122  Device-to-host register FISes sent due to a COMRESET

