smartctl 6.6 2016-05-31 r4324 [i686-linux-4.9.0-4-686-pae] (local build)
Copyright (C) 2002-16, Bruce Allen, Christian Franke, www.smartmontools.org

=== START OF INFORMATION SECTION ===
Model Family:     Swissbit C440 Industrial CompactFlash Card
Device Model:     SFCF4096H2BU4TO-I-MS-527-STD
Firmware Version: 120822
User Capacity:    4,110,188,544 bytes [4.11 GB]
Sector Size:      512 bytes logical/physical
Rotation Rate:    Solid State Device
Device is:        In smartctl database [for details use: -P show]
ATA Version is:   ATA8-ACS (minor revision not indicated)
Local Time is:    Sun Oct 29 20:13:30 2017 CET
SMART support is: Available - device has SMART capability.
SMART support is: Enabled
AAM feature is:   Unavailable
APM feature is:   Unavailable
Rd look-ahead is: Unavailable
Write cache is:   Disabled
ATA Security is:  Disabled, frozen [SEC2]
Wt Cache Reorder: Unavailable

=== START OF READ SMART DATA SECTION ===
SMART overall-health self-assessment test result: PASSED

General SMART Values:
Offline data collection status:  (0x00)	Offline data collection activity
					was never started.
					Auto Offline Data Collection: Disabled.
Total time to complete Offline 
data collection: 		(    0) seconds.
Offline data collection
capabilities: 			 (0x00) 	Offline data collection not supported.
SMART capabilities:            (0x0003)	Saves SMART data before entering
					power-saving mode.
					Supports SMART auto save timer.
Error logging capability:        (0x00)	Error logging NOT supported.
					General Purpose Logging supported.

SMART Attributes Data Structure revision number: 16
Vendor Specific SMART Attributes with Thresholds:
ID# ATTRIBUTE_NAME          FLAGS    VALUE WORST THRESH FAIL RAW_VALUE
196 Spare_Blocks            PO----   100   100   025    -    146/146
213 Spare_Blocks_Worst_Chip -O----   100   100   000    -    71/71
229 Erase_Count             PO----   100   100   001    -    65777
203 Total_ECC_Errors        -O----   100   100   000    -    4688
204 Soft_ECC_Correction     -O----   100   100   000    -    4688
199 UDMA_CRC_Error_Count    -O----   100   100   000    -    0
232 Total_Number_of_Reads   -O----   100   100   000    -    91438404
 12 Power_Cycle_Count       -O----   100   100   000    -    41
241 Total_LBAs_Written      -O----   100   100   000    -    1685
242 Total_LBAs_Read         -O----   100   100   000    -    1384
214 Reserved_Attribute      -O----   100   100   000    -    0
215 Current_TRIM_Percent    -O----   003   001   000    -    0
                            ||||||_ K auto-keep
                            |||||__ C event count
                            ||||___ R error rate
                            |||____ S speed/performance
                            ||_____ O updated online
                            |______ P prefailure warning

General Purpose Log Directory Version 1
SMART           Log Directory Version 1 [multi-sector log support]
Address    Access  R/W   Size  Description
0x00       GPL,SL  R/O      1  Log Directory
0x80-0x9f  GPL,SL  R/W     16  Host vendor specific log
0xa0       GPL,SL  VS       4  Device vendor specific log
0xa1-0xa3  GPL,SL  VS       1  Device vendor specific log

SMART Extended Comprehensive Error Log (GP Log 0x03) not supported

SMART Error Log not supported

SMART Extended Self-test Log (GP Log 0x07) not supported

SMART Self-test Log not supported

Selective Self-tests/Logging not supported

SCT Commands not supported

Device Statistics (GP/SMART Log 0x04) not supported

SATA Phy Event Counters (GP Log 0x11) not supported

