smartctl 7.3 2022-02-28 r5338 [x86_64-w64-mingw32-w10-21H2] (sf-7.3-1)
Copyright (C) 2002-22, Bruce Allen, Christian Franke, www.smartmontools.org

=== START OF INFORMATION SECTION ===
Model Family:     Hitachi/HGST Travelstar Z7K500
Device Model:     HGST HTS725050A7E630
Serial Number:    RC250FCB1DGU7K
LU WWN Device Id: 5 000cca 7a5d3c391
Firmware Version: GS2OA340
User Capacity:    500,107,862,016 bytes [500 GB]
Sector Sizes:     512 bytes logical, 4096 bytes physical
Rotation Rate:    7200 rpm
Form Factor:      2.5 inches
Device is:        In smartctl database 7.3/5364
ATA Version is:   ACS-2, ATA8-ACS T13/1699-D revision 6
SATA Version is:  SATA 3.0, 6.0 Gb/s (current: 6.0 Gb/s)
Local Time is:    Wed May 18 06:29:12 2022 NZST
SMART support is: Available - device has SMART capability.
SMART support is: Enabled
AAM feature is:   Unavailable
APM level is:     128 (minimum power consumption without standby)
Rd look-ahead is: Enabled
Write cache is:   Enabled
DSN feature is:   Unavailable
ATA Security is:  Disabled, NOT FROZEN [SEC1]
Wt Cache Reorder: Unknown

=== START OF READ SMART DATA SECTION ===
SMART Status not supported: Incomplete response, ATA output registers missing
SMART overall-health self-assessment test result: PASSED
Warning: This result is based on an Attribute check.

General SMART Values:
Offline data collection status:  (0x85)	Offline data collection activity
					was aborted by an interrupting command from host.
					Auto Offline Data Collection: Enabled.
Self-test execution status:      ( 121)	The previous self-test completed having
					the read element of the test failed.
Total time to complete Offline 
data collection: 		( 5314) seconds.
Offline data collection
capabilities: 			 (0x5b) SMART execute Offline immediate.
					Auto Offline data collection on/off support.
					Suspend Offline collection upon new
					command.
					Offline surface scan supported.
					Self-test supported.
					No Conveyance Self-test supported.
					Selective Self-test supported.
SMART capabilities:            (0x0003)	Saves SMART data before entering
					power-saving mode.
					Supports SMART auto save timer.
Error logging capability:        (0x01)	Error logging supported.
					General Purpose Logging supported.
Short self-test routine 
recommended polling time: 	 (   2) minutes.
Extended self-test routine
recommended polling time: 	 (  90) minutes.
SCT capabilities: 	       (0x003d)	SCT Status supported.
					SCT Error Recovery Control supported.
					SCT Feature Control supported.
					SCT Data Table supported.

SMART Attributes Data Structure revision number: 16
Vendor Specific SMART Attributes with Thresholds:
ID# ATTRIBUTE_NAME          FLAGS    VALUE WORST THRESH FAIL RAW_VALUE
  1 Raw_Read_Error_Rate     POSR-K   088   064   062    -    2621481
  2 Throughput_Performance  P-S--K   198   100   040    -    100
  3 Spin_Up_Time            PO---K   248   100   033    -    1
  4 Start_Stop_Count        -O--CK   100   100   000    -    269
  5 Reallocated_Sector_Ct   PO--CK   100   100   005    -    64 (0 7)
  7 Seek_Error_Rate         POSR-K   099   099   067    -    1
  8 Seek_Time_Performance   P-S--K   152   100   040    -    33
  9 Power_On_Hours          -O--CK   028   028   000    -    31927
 10 Spin_Retry_Count        PO--CK   100   100   060    -    0
 12 Power_Cycle_Count       -O--CK   100   100   000    -    265
183 Runtime_Bad_Block       -O--CK   100   100   000    -    0
184 End-to-End_Error        PO--CK   100   100   097    -    0
187 Reported_Uncorrect      -O--CK   001   001   000    -    112137301134501
188 Command_Timeout         -O--CK   100   100   000    -    4295032832
190 Airflow_Temperature_Cel -O---K   076   058   045    -    24 (Min/Max 19/24)
191 G-Sense_Error_Rate      -O--CK   100   100   000    -    27
192 Power-Off_Retract_Count -O--CK   100   100   000    -    4587590
193 Load_Cycle_Count        -O--CK   020   020   000    -    809389
196 Reallocated_Event_Count -O--CK   100   100   000    -    8
197 Current_Pending_Sector  -O--CK   039   039   000    -    1600
198 Offline_Uncorrectable   ----CK   100   057   000    -    26
199 UDMA_CRC_Error_Count    -OS-CK   100   100   000    -    0
223 Load_Retry_Count        -O-R-K   100   100   000    -    0
                            ||||||_ K auto-keep
                            |||||__ C event count
                            ||||___ R error rate
                            |||____ S speed/performance
                            ||_____ O updated online
                            |______ P prefailure warning

General Purpose Log Directory Version 1
SMART           Log Directory Version 1 [multi-sector log support]
Address    Access  R/W   Size  Description
0x00       GPL,SL  R/O      1  Log Directory
0x01           SL  R/O      1  Summary SMART error log
0x02           SL  R/O      1  Comprehensive SMART error log
0x03       GPL     R/O      1  Ext. Comprehensive SMART error log
0x06           SL  R/O      1  SMART self-test log
0x07       GPL     R/O      1  Extended self-test log
0x09           SL  R/W      1  Selective self-test log
0x10       GPL     R/O      1  NCQ Command Error log
0x11       GPL     R/O      1  SATA Phy Event Counters log
0x80-0x9f  GPL,SL  R/W     16  Host vendor specific log
0xe0       GPL,SL  R/W      1  SCT Command/Status
0xe1       GPL,SL  R/W      1  SCT Data Transfer

SMART Extended Comprehensive Error Log Version: 1 (1 sectors)
Device Error Count: 3237 (device log contains only the most recent 4 errors)
	CR     = Command Register
	FEATR  = Features Register
	COUNT  = Count (was: Sector Count) Register
	LBA_48 = Upper bytes of LBA High/Mid/Low Registers ]  ATA-8
	LH     = LBA High (was: Cylinder High) Register    ]   LBA
	LM     = LBA Mid (was: Cylinder Low) Register      ] Register
	LL     = LBA Low (was: Sector Number) Register     ]
	DV     = Device (was: Device/Head) Register
	DC     = Device Control Register
	ER     = Error register
	ST     = Status register
Powered_Up_Time is measured from power on, and printed as
DDd+hh:mm:SS.sss where DD=days, hh=hours, mm=minutes,
SS=sec, and sss=millisec. It "wraps" after 49.710 days.

Error 3237 [0] occurred at disk power-on lifetime: 31927 hours (1330 days + 7 hours)
  When the command that caused the error occurred, the device was active or idle.

  After command completion occurred, registers were:
  ER -- ST COUNT  LBA_48  LH LM LL DV DC
  -- -- -- == -- == == == -- -- -- -- --
  40 -- 51 00 08 00 00 00 10 a2 a0 00 00  Error: UNC 8 sectors at LBA = 0x0010a2a0 = 1090208

  Commands leading to the command that caused the error were:
  CR FEATR COUNT  LBA_48  LH LM LL DV DC  Powered_Up_Time  Command/Feature_Name
  -- == -- == -- == == == -- -- -- -- --  ---------------  --------------------
  25 00 00 00 08 00 00 00 10 a2 a0 40 00     00:04:51.850  READ DMA EXT
  25 00 00 00 08 00 00 03 47 4d 28 40 00     00:04:51.850  READ DMA EXT
  25 00 00 00 08 00 00 03 47 4d 10 40 00     00:04:51.846  READ DMA EXT
  25 00 00 00 08 00 00 00 70 bc 60 40 00     00:04:51.832  READ DMA EXT
  25 00 00 00 01 00 00 03 14 26 c8 40 00     00:04:51.823  READ DMA EXT

Error 3236 [3] occurred at disk power-on lifetime: 31927 hours (1330 days + 7 hours)
  When the command that caused the error occurred, the device was active or idle.

  After command completion occurred, registers were:
  ER -- ST COUNT  LBA_48  LH LM LL DV DC
  -- -- -- == -- == == == -- -- -- -- --
  40 -- 51 00 08 00 00 00 10 a2 a0 00 00  Error: UNC 8 sectors at LBA = 0x0010a2a0 = 1090208

  Commands leading to the command that caused the error were:
  CR FEATR COUNT  LBA_48  LH LM LL DV DC  Powered_Up_Time  Command/Feature_Name
  -- == -- == -- == == == -- -- -- -- --  ---------------  --------------------
  25 00 00 00 08 00 00 00 10 a2 a0 40 00     00:04:48.675  READ DMA EXT
  25 00 00 00 08 00 00 03 47 4d 28 40 00     00:04:48.675  READ DMA EXT
  25 00 00 00 08 00 00 03 47 4d 10 40 00     00:04:48.670  READ DMA EXT
  25 00 00 00 08 00 00 00 70 bc 60 40 00     00:04:48.657  READ DMA EXT
  25 00 00 00 01 00 00 03 14 26 c8 40 00     00:04:48.648  READ DMA EXT

Error 3235 [2] occurred at disk power-on lifetime: 31927 hours (1330 days + 7 hours)
  When the command that caused the error occurred, the device was active or idle.

  After command completion occurred, registers were:
  ER -- ST COUNT  LBA_48  LH LM LL DV DC
  -- -- -- == -- == == == -- -- -- -- --
  40 -- 51 00 08 00 00 00 10 a2 a0 00 00  Error: UNC 8 sectors at LBA = 0x0010a2a0 = 1090208

  Commands leading to the command that caused the error were:
  CR FEATR COUNT  LBA_48  LH LM LL DV DC  Powered_Up_Time  Command/Feature_Name
  -- == -- == -- == == == -- -- -- -- --  ---------------  --------------------
  25 00 00 00 08 00 00 00 10 a2 a0 40 00     00:04:45.475  READ DMA EXT
  25 00 00 00 08 00 00 03 47 4d 28 40 00     00:04:45.475  READ DMA EXT
  25 00 00 00 08 00 00 03 47 4d 10 40 00     00:04:45.470  READ DMA EXT
  25 00 00 00 08 00 00 00 70 bc 60 40 00     00:04:45.456  READ DMA EXT
  25 00 00 00 01 00 00 03 14 26 c8 40 00     00:04:45.447  READ DMA EXT

Error 3234 [1] occurred at disk power-on lifetime: 31927 hours (1330 days + 7 hours)
  When the command that caused the error occurred, the device was active or idle.

  After command completion occurred, registers were:
  ER -- ST COUNT  LBA_48  LH LM LL DV DC
  -- -- -- == -- == == == -- -- -- -- --
  40 -- 51 00 08 00 00 00 10 a2 a0 00 00  Error: UNC 8 sectors at LBA = 0x0010a2a0 = 1090208

  Commands leading to the command that caused the error were:
  CR FEATR COUNT  LBA_48  LH LM LL DV DC  Powered_Up_Time  Command/Feature_Name
  -- == -- == -- == == == -- -- -- -- --  ---------------  --------------------
  25 00 00 00 08 00 00 00 10 a2 a0 40 00     00:04:42.291  READ DMA EXT
  25 00 00 00 08 00 00 03 47 4d 28 40 00     00:04:42.291  READ DMA EXT
  25 00 00 00 08 00 00 03 47 4d 10 40 00     00:04:42.286  READ DMA EXT
  25 00 00 00 08 00 00 00 70 bc 60 40 00     00:04:42.273  READ DMA EXT
  25 00 00 00 01 00 00 03 14 26 c8 40 00     00:04:42.264  READ DMA EXT

SMART Extended Self-test Log Version: 1 (1 sectors)
Num  Test_Description    Status                  Remaining  LifeTime(hours)  LBA_of_first_error
# 1  Short offline       Completed: read failure       90%     31927         1090208
# 2  Short offline       Completed without error       00%       116         -

SMART Selective self-test log data structure revision number 1
 SPAN  MIN_LBA  MAX_LBA  CURRENT_TEST_STATUS
    1        0        0  Not_testing
    2        0        0  Not_testing
    3        0        0  Not_testing
    4        0        0  Not_testing
    5        0        0  Not_testing
Selective self-test flags (0x0):
  After scanning selected spans, do NOT read-scan remainder of disk.
If Selective self-test is pending on power-up, resume after 0 minute delay.

SCT Status Version:                  3
SCT Version (vendor specific):       256 (0x0100)
Device State:                        Active (0)
Current Temperature:                    24 Celsius
Power Cycle Min/Max Temperature:     19/24 Celsius
Lifetime    Min/Max Temperature:      5/42 Celsius
Specified Max Operating Temperature:    25 Celsius
Under/Over Temperature Limit Count:   0/0

SCT Temperature History Version:     2
Temperature Sampling Period:         1 minute
Temperature Logging Interval:        1 minute
Min/Max recommended Temperature:      0/60 Celsius
Min/Max Temperature Limit:           -40/65 Celsius
Temperature History Size (Index):    128 (67)

Index    Estimated Time   Temperature Celsius
  68    2022-05-18 04:22    23  ****
 ...    ..(  4 skipped).    ..  ****
  73    2022-05-18 04:27    23  ****
  74    2022-05-18 04:28    24  *****
  75    2022-05-18 04:29    24  *****
  76    2022-05-18 04:30    23  ****
  77    2022-05-18 04:31    24  *****
 ...    ..( 11 skipped).    ..  *****
  89    2022-05-18 04:43    24  *****
  90    2022-05-18 04:44    23  ****
  91    2022-05-18 04:45    24  *****
 ...    ..(  6 skipped).    ..  *****
  98    2022-05-18 04:52    24  *****
  99    2022-05-18 04:53    23  ****
 100    2022-05-18 04:54    23  ****
 101    2022-05-18 04:55    23  ****
 102    2022-05-18 04:56    24  *****
 ...    ..(  2 skipped).    ..  *****
 105    2022-05-18 04:59    24  *****
 106    2022-05-18 05:00    23  ****
 107    2022-05-18 05:01    24  *****
 108    2022-05-18 05:02    24  *****
 109    2022-05-18 05:03    24  *****
 110    2022-05-18 05:04    23  ****
 111    2022-05-18 05:05    23  ****
 112    2022-05-18 05:06    24  *****
 113    2022-05-18 05:07    23  ****
 ...    ..(  2 skipped).    ..  ****
 116    2022-05-18 05:10    23  ****
 117    2022-05-18 05:11    24  *****
 118    2022-05-18 05:12    24  *****
 119    2022-05-18 05:13    24  *****
 120    2022-05-18 05:14    23  ****
 121    2022-05-18 05:15    24  *****
 122    2022-05-18 05:16    24  *****
 123    2022-05-18 05:17    23  ****
 ...    ..( 52 skipped).    ..  ****
  48    2022-05-18 06:10    23  ****
  49    2022-05-18 06:11     ?  -
  50    2022-05-18 06:12    22  ***
  51    2022-05-18 06:13    24  *****
  52    2022-05-18 06:14    24  *****
  53    2022-05-18 06:15    25  ******
  54    2022-05-18 06:16    25  ******
  55    2022-05-18 06:17    26  *******
  56    2022-05-18 06:18     ?  -
  57    2022-05-18 06:19     ?  -
  58    2022-05-18 06:20     ?  -
  59    2022-05-18 06:21    22  ***
  60    2022-05-18 06:22    23  ****
  61    2022-05-18 06:23    24  *****
  62    2022-05-18 06:24    25  ******
  63    2022-05-18 06:25     ?  -
  64    2022-05-18 06:26    20  *
  65    2022-05-18 06:27    22  ***
  66    2022-05-18 06:28    22  ***
  67    2022-05-18 06:29    23  ****

SMART WRITE LOG does not return COUNT and LBA_LOW register
SCT (Get) Error Recovery Control command failed

Device Statistics (GP/SMART Log 0x04) not supported

Pending Defects log (GP Log 0x0c) not supported

SATA Phy Event Counters (GP Log 0x11)
ID      Size     Value  Description
0x0001  2            0  Command failed due to ICRC error
0x0002  2            0  R_ERR response for data FIS
0x0003  2            0  R_ERR response for device-to-host data FIS
0x0004  2            0  R_ERR response for host-to-device data FIS
0x0005  2            0  R_ERR response for non-data FIS
0x0006  2            0  R_ERR response for device-to-host non-data FIS
0x0007  2            0  R_ERR response for host-to-device non-data FIS
0x0009  2            1  Transition from drive PhyRdy to drive PhyNRdy
0x000a  2            0  Device-to-host register FISes sent due to a COMRESET
0x000b  2            0  CRC errors within host-to-device FIS
0x000d  2            0  Non-CRC errors within host-to-device FIS

