
    =========================== USB Port4 ===========================

Connection Status        : 0x01 (Device is connected)
Port Chain               : 7-4
Properties               : 0x01
 IsUserConnectable       : yes
 PortIsDebugCapable      : no
 PortHasMultiCompanions  : no
 PortConnectorIsTypeC    : no
ConnectionIndex          : 0x04 (Port 4)
CompanionIndex           : 0
 CompanionHubSymLnk      : USB#ROOT_HUB30#5&18580509&0&0#{f18a0e88-c30c-11d0-8815-00a0c906bed8}
 CompanionPortNumber     : 0x02 (Port 2)
 -> CompanionPortChain   : 7-2

      ========================== Summary =========================
Vendor ID                : 0x125F (ADATA Technology Co., Ltd.)
Product ID               : 0xA76A
USB Version              : 3.0
Port maximum Speed       : SuperSpeed
Device maximum Speed     : SuperSpeed
Device Connection Speed  : SuperSpeed
Self powered             : no
Demanded Current         : 896 mA
Used Endpoints           : 3

      ======================== USB Device ========================

        +++++++++++++++++ Device Information ++++++++++++++++++
Device Description       : USB Mass Storage Device
Device Path              : \\?\USB#VID_125F&PID_A76A#00000000054F#{a5dcbf10-6530-11d2-901f-00c04fb951ed} (GUID_DEVINTERFACE_USB_DEVICE)
Kernel Name              : \Device\USBPDO-13
Device ID                : USB\VID_125F&PID_A76A\00000000054F
Hardware IDs             : USB\VID_125F&PID_A76A&REV_0204 USB\VID_125F&PID_A76A
Driver KeyName           : {36fc9e60-c465-11cf-8056-444553540000}\0027 (GUID_DEVCLASS_USB)
Driver                   : \SystemRoot\System32\drivers\USBSTOR.SYS (Version: 10.0.19041.1682  Date: 2022-05-13)
Driver Inf               : C:\WINDOWS\inf\usbstor.inf
Legacy BusType           : PNPBus
Class                    : USB
Class GUID               : {36fc9e60-c465-11cf-8056-444553540000} (GUID_DEVCLASS_USB)
Service                  : USBSTOR
Enumerator               : USB
Location Info            : Port_#0004.Hub_#0010
Location IDs             : PCIROOT(0)#PCI(1501)#PCI(0000)#USBROOT(0)#USB(4), ACPI(_SB_)#ACPI(PCI0)#ACPI(PE21)#PCI(0000)#USBROOT(0)#USB(4)
Container ID             : {3e01c9c1-3c68-58ca-9d6f-255f9c3ef09d}
Manufacturer Info        : Compatible USB storage device
Capabilities             : 0x94 (Removable, UniqueID, SurpriseRemovalOK)
Status                   : 0x0180600A (DN_DRIVER_LOADED, DN_STARTED, DN_DISABLEABLE, DN_REMOVABLE, DN_NT_ENUMERATOR, DN_NT_DRIVER)
Problem Code             : 0
Address                  : 4
HcDisableSelectiveSuspend: 0
EnableSelectiveSuspend   : 0
SelectiveSuspendEnabled  : 0
EnhancedPowerMgmtEnabled : 0
IdleInWorkingState       : 0
WakeFromSleepState       : 0
Power State              : D0 (supported: D0, D2, D3, wake from D0, wake from D2)
 Child Device 1          : ADATA ED600 USB Device (Disk drive) (Disk5)
  Device Path            : \\?\USBSTOR#Disk&Ven_ADATA&Prod_ED600&Rev_0204#00000000054F&0#{53f56307-b6bf-11d0-94f2-00a0c91efb8b} (GUID_DEVINTERFACE_DISK)
  Kernel Name            : \Device\000000a1
  Device ID              : USBSTOR\DISK&VEN_ADATA&PROD_ED600&REV_0204\00000000054F&0
  Class                  : DiskDrive
  Driver KeyName         : {4d36e967-e325-11ce-bfc1-08002be10318}\0007 (GUID_DEVCLASS_DISKDRIVE)
  Service                : disk
   Volume 1              : \\?\Volume{471e7292-b8d6-4e58-83d2-0a623ac4329e}\
   Kernel Name           : \Device\HarddiskVolume14
   Mountpoint            : -
   Volume 2              : \\?\Volume{6c273949-2d9e-4b38-b9c2-1939c2ac4a69}\
   Kernel Name           : \Device\HarddiskVolume15
   Mountpoint            : -
   Volume 3              : \\?\Volume{8e6cbac8-127e-489b-947b-5d1384b628ae}\
   Kernel Name           : \Device\HarddiskVolume17
   Mountpoint            : D:\
   Volume 4              : \\?\Volume{de3a37ec-5620-4f33-b696-18a5016962a5}\
   Kernel Name           : \Device\HarddiskVolume18
   Mountpoint            : -

        +++++++++++++++++ Registry USB Flags +++++++++++++++++
HKEY_LOCAL_MACHINE\SYSTEM\CurrentControlSet\Control\usbflags\125FA76A0204
 osvc                    : REG_BINARY 00 00

        ---------------- Connection Information ---------------
Connection Index         : 0x04 (Port 4)
Connection Status        : 0x01 (DeviceConnected)
Current Config Value     : 0x01 (Configuration 1)
Device Address           : 0x01 (1)
Is Hub                   : 0x00 (no)
Device Bus Speed         : 0x02 (High-Speed) -> not true, see below in Connection Information V2
Number Of Open Pipes     : 0x02 (2 pipes to data endpoints)
Pipe[0]                  : EndpointID=1  Direction=IN   ScheduleOffset=0  Type=Bulk  wMaxPacketSize=1024  bInterval=0
Pipe[1]                  : EndpointID=2  Direction=OUT  ScheduleOffset=0  Type=Bulk  wMaxPacketSize=1024  bInterval=0
Data (HexDump)           : 04 00 00 00 12 01 00 03 00 00 00 09 5F 12 6A A7   ............_.j.
                           04 02 01 02 03 01 01 02 00 01 00 02 00 00 00 01   ................
                           00 00 00 07 05 81 02 00 04 00 00 00 00 00 07 05   ................
                           02 02 00 04 00 00 00 00 00                        .........

        --------------- Connection Information V2 -------------
Connection Index         : 0x04 (4)
Length                   : 0x10 (16 bytes)
SupportedUsbProtocols    : 0x04
 Usb110                  : 0 (no, port not supports USB 1.1) -> but Companion Port 7-2 does
 Usb200                  : 0 (no, port not supports USB 2.0) -> but Companion Port 7-2 does
 Usb300                  : 1 (yes, port supports USB 3.0)
 ReservedMBZ             : 0x00
Flags                    : 0x03
 DevIsOpAtSsOrHigher     : 1 (Device is operating at SuperSpeed or higher)
 DevIsSsCapOrHigher      : 1 (Device is SuperSpeed capable or higher)
 DevIsOpAtSsPlusOrHigher : 0 (Device is not operating at SuperSpeedPlus or higher)
 DevIsSsPlusCapOrHigher  : 0 (Device is not SuperSpeedPlus capable or higher)
 ReservedMBZ             : 0x00
Data (HexDump)           : 04 00 00 00 10 00 00 00 04 00 00 00 03 00 00 00   ................

    ---------------------- Device Descriptor ----------------------
bLength                  : 0x12 (18 bytes)
bDescriptorType          : 0x01 (Device Descriptor)
bcdUSB                   : 0x300 (USB Version 3.00)
bDeviceClass             : 0x00 (defined by the interface descriptors)
bDeviceSubClass          : 0x00
bDeviceProtocol          : 0x00
bMaxPacketSize0          : 0x09 (9 bytes)
idVendor                 : 0x125F (ADATA Technology Co., Ltd.)
idProduct                : 0xA76A
bcdDevice                : 0x0204
iManufacturer            : 0x01 (String Descriptor 1)
 Language 0x0409         : "ADATA"
iProduct                 : 0x02 (String Descriptor 2)
 Language 0x0409         : "ADATA ED600 USB Device"
iSerialNumber            : 0x03 (String Descriptor 3)
 Language 0x0409         : "00000000054F"
bNumConfigurations       : 0x01 (1 Configuration)
Data (HexDump)           : 12 01 00 03 00 00 00 09 5F 12 6A A7 04 02 01 02   ........_.j.....
                           03 01                                             ..

    ------------------ Configuration Descriptor -------------------
bLength                  : 0x09 (9 bytes)
bDescriptorType          : 0x02 (Configuration Descriptor)
wTotalLength             : 0x0079 (121 bytes)
bNumInterfaces           : 0x01 (1 Interface)
bConfigurationValue      : 0x01 (Configuration 1)
iConfiguration           : 0x00 (No String Descriptor)
bmAttributes             : 0x80
 D7: Reserved, set 1     : 0x01
 D6: Self Powered        : 0x00 (no)
 D5: Remote Wakeup       : 0x00 (no)
 D4..0: Reserved, set 0  : 0x00
MaxPower                 : 0x70 (224 mA)
Data (HexDump)           : 09 02 79 00 01 01 00 80 70 09 04 00 00 02 08 06   ..y.....p.......
                           50 00 07 05 81 02 00 04 00 06 30 0F 00 00 00 07   P.........0.....
                           05 02 02 00 04 00 06 30 0F 00 00 00 09 04 00 01   .......0........
                           04 08 06 62 00 07 05 01 02 00 04 00 06 30 00 00   ...b.........0..
                           00 00 04 24 01 00 07 05 82 02 00 04 00 06 30 00   ...$..........0.
                           05 00 00 04 24 02 00 07 05 83 02 00 04 00 06 30   ....$..........0
                           0F 05 00 00 04 24 03 00 07 05 04 02 00 04 00 06   .....$..........
                           30 07 05 00 00 04 24 04 00                        0.....$..

        ---------------- Interface Descriptor -----------------
bLength                  : 0x09 (9 bytes)
bDescriptorType          : 0x04 (Interface Descriptor)
bInterfaceNumber         : 0x00 (Interface 0)
bAlternateSetting        : 0x00
bNumEndpoints            : 0x02 (2 Endpoints)
bInterfaceClass          : 0x08 (Mass Storage)
bInterfaceSubClass       : 0x06 (SCSI transparent command set)
bInterfaceProtocol       : 0x50 (Bulk-Only Transport)
iInterface               : 0x00 (No String Descriptor)
Data (HexDump)           : 09 04 00 00 02 08 06 50 00                        .......P.

        ----------------- Endpoint Descriptor -----------------
bLength                  : 0x07 (7 bytes)
bDescriptorType          : 0x05 (Endpoint Descriptor)
bEndpointAddress         : 0x81 (Direction=IN EndpointID=1)
bmAttributes             : 0x02 (TransferType=Bulk)
wMaxPacketSize           : 0x0400 (max 1024 bytes)
bInterval                : 0x00 (never NAKs)
Data (HexDump)           : 07 05 81 02 00 04 00                              .......

        ------ SuperSpeed Endpoint Companion Descriptor -------
bLength                  : 0x06 (6 bytes)
bDescriptorType          : 0x30 (SuperSpeed Endpoint Companion Descriptor)
bMaxBurst                : 0x0F (up to 16 packets per burst)
bmAttributes             : 0x00 (The bulk endpoint does not define streams)
wBytesPerInterval        : 0x0000
Data (HexDump)           : 06 30 0F 00 00 00                                 .0....

        ----------------- Endpoint Descriptor -----------------
bLength                  : 0x07 (7 bytes)
bDescriptorType          : 0x05 (Endpoint Descriptor)
bEndpointAddress         : 0x02 (Direction=OUT EndpointID=2)
bmAttributes             : 0x02 (TransferType=Bulk)
wMaxPacketSize           : 0x0400 (max 1024 bytes)
bInterval                : 0x00 (never NAKs)
Data (HexDump)           : 07 05 02 02 00 04 00                              .......

        ------ SuperSpeed Endpoint Companion Descriptor -------
bLength                  : 0x06 (6 bytes)
bDescriptorType          : 0x30 (SuperSpeed Endpoint Companion Descriptor)
bMaxBurst                : 0x0F (up to 16 packets per burst)
bmAttributes             : 0x00 (The bulk endpoint does not define streams)
wBytesPerInterval        : 0x0000
Data (HexDump)           : 06 30 0F 00 00 00                                 .0....

        ---------------- Interface Descriptor -----------------
bLength                  : 0x09 (9 bytes)
bDescriptorType          : 0x04 (Interface Descriptor)
bInterfaceNumber         : 0x00 (Interface 0)
bAlternateSetting        : 0x01
bNumEndpoints            : 0x04 (4 Endpoints)
bInterfaceClass          : 0x08 (Mass Storage)
bInterfaceSubClass       : 0x06 (SCSI transparent command set)
bInterfaceProtocol       : 0x62 (USB Attached SCSI - UAS)
iInterface               : 0x00 (No String Descriptor)
Data (HexDump)           : 09 04 00 01 04 08 06 62 00                        .......b.

        ----------------- Endpoint Descriptor -----------------
bLength                  : 0x07 (7 bytes)
bDescriptorType          : 0x05 (Endpoint Descriptor)
bEndpointAddress         : 0x01 (Direction=OUT EndpointID=1)
bmAttributes             : 0x02 (TransferType=Bulk)
wMaxPacketSize           : 0x0400 (max 1024 bytes)
bInterval                : 0x00 (never NAKs)
Data (HexDump)           : 07 05 01 02 00 04 00                              .......

        ------ SuperSpeed Endpoint Companion Descriptor -------
bLength                  : 0x06 (6 bytes)
bDescriptorType          : 0x30 (SuperSpeed Endpoint Companion Descriptor)
bMaxBurst                : 0x00 (up to 1 packets per burst)
bmAttributes             : 0x00 (The bulk endpoint does not define streams)
wBytesPerInterval        : 0x0000
Data (HexDump)           : 06 30 00 00 00 00                                 .0....

        ------------- UAS Pipe Usage Descriptor ---------------
bLength                  : 0x04 (4 bytes)
bDescriptorType          : 0x24 (UAS Pipe Usage Descriptor)
bPipeID                  : 0x01 (Pipe ID=1)
bReserved                : 0x00
Data (HexDump)           : 04 24 01 00                                       .$..

        ----------------- Endpoint Descriptor -----------------
bLength                  : 0x07 (7 bytes)
bDescriptorType          : 0x05 (Endpoint Descriptor)
bEndpointAddress         : 0x82 (Direction=IN EndpointID=2)
bmAttributes             : 0x02 (TransferType=Bulk)
wMaxPacketSize           : 0x0400 (max 1024 bytes)
bInterval                : 0x00 (never NAKs)
Data (HexDump)           : 07 05 82 02 00 04 00                              .......

        ------ SuperSpeed Endpoint Companion Descriptor -------
bLength                  : 0x06 (6 bytes)
bDescriptorType          : 0x30 (SuperSpeed Endpoint Companion Descriptor)
bMaxBurst                : 0x00 (up to 1 packets per burst)
bmAttributes             : 0x05 (32 streams supported)
wBytesPerInterval        : 0x0000
Data (HexDump)           : 06 30 00 05 00 00                                 .0....

        ------------- UAS Pipe Usage Descriptor ---------------
bLength                  : 0x04 (4 bytes)
bDescriptorType          : 0x24 (UAS Pipe Usage Descriptor)
bPipeID                  : 0x02 (Pipe ID=2)
bReserved                : 0x00
Data (HexDump)           : 04 24 02 00                                       .$..

        ----------------- Endpoint Descriptor -----------------
bLength                  : 0x07 (7 bytes)
bDescriptorType          : 0x05 (Endpoint Descriptor)
bEndpointAddress         : 0x83 (Direction=IN EndpointID=3)
bmAttributes             : 0x02 (TransferType=Bulk)
wMaxPacketSize           : 0x0400 (max 1024 bytes)
bInterval                : 0x00 (never NAKs)
Data (HexDump)           : 07 05 83 02 00 04 00                              .......

        ------ SuperSpeed Endpoint Companion Descriptor -------
bLength                  : 0x06 (6 bytes)
bDescriptorType          : 0x30 (SuperSpeed Endpoint Companion Descriptor)
bMaxBurst                : 0x0F (up to 16 packets per burst)
bmAttributes             : 0x05 (32 streams supported)
wBytesPerInterval        : 0x0000
Data (HexDump)           : 06 30 0F 05 00 00                                 .0....

        ------------- UAS Pipe Usage Descriptor ---------------
bLength                  : 0x04 (4 bytes)
bDescriptorType          : 0x24 (UAS Pipe Usage Descriptor)
bPipeID                  : 0x03 (Pipe ID=3)
bReserved                : 0x00
Data (HexDump)           : 04 24 03 00                                       .$..

        ----------------- Endpoint Descriptor -----------------
bLength                  : 0x07 (7 bytes)
bDescriptorType          : 0x05 (Endpoint Descriptor)
bEndpointAddress         : 0x04 (Direction=OUT EndpointID=4)
bmAttributes             : 0x02 (TransferType=Bulk)
wMaxPacketSize           : 0x0400 (max 1024 bytes)
bInterval                : 0x00 (never NAKs)
Data (HexDump)           : 07 05 04 02 00 04 00                              .......

        ------ SuperSpeed Endpoint Companion Descriptor -------
bLength                  : 0x06 (6 bytes)
bDescriptorType          : 0x30 (SuperSpeed Endpoint Companion Descriptor)
bMaxBurst                : 0x07 (up to 8 packets per burst)
bmAttributes             : 0x05 (32 streams supported)
wBytesPerInterval        : 0x0000
Data (HexDump)           : 06 30 07 05 00 00                                 .0....

        ------------- UAS Pipe Usage Descriptor ---------------
bLength                  : 0x04 (4 bytes)
bDescriptorType          : 0x24 (UAS Pipe Usage Descriptor)
bPipeID                  : 0x04 (Pipe ID=4)
bReserved                : 0x00
Data (HexDump)           : 04 24 04 00                                       .$..

      ---------- Binary Object Store (BOS) Descriptor -----------
bLength                  : 0x05 (5 bytes)
bDescriptorType          : 0x0F (Binary Object Store)
wTotalLength             : 0x0016 (22 bytes)
bNumDeviceCaps           : 0x02
Data (HexDump)           : 05 0F 16 00 02                                    .....

        ------------- USB 2.0 Extension Descriptor ------------
bLength                  : 0x07 (7 bytes)
bDescriptorType          : 0x10 (Device Capability Descriptor)
bDevCapabilityType       : 0x02 (USB 2.0 Extension)
bmAttributes             : 0xF0E
 LPMCapable              : 1 (Link Power Management protocol is supported)
 BESLAndAlternateHIRD    : 1 (BESL & Alternate HIRD definitions are supported)
 BaselineBESLValid       : 1 (valid)
 DeepBESLValid           : 0 (not valid)
 BaselineBESL            : 15 (10000 µs)
 DeepBESL                : 0
Data (HexDump)           : 07 10 02 0E 0F 00 00                              .......

        ----- SuperSpeed USB Device Capability Descriptor -----
bLength                  : 0x0A (10 bytes)
bDescriptorType          : 0x10 (Device Capability Descriptor)
bDevCapabilityType       : 0x03 (SuperSpeed USB Device Capability)
bmAttributes             : 0x00
 Bit 0 Reserved          : 0x00
 Bit 1 LTM Capable       : 0x00 (no)
 Bit 7:2 Reserved        : 0x00
wSpeedsSupported         : 0x0E (Full-Speed, High-Speed, SuperSpeed)
bFunctionalitySupport    : 0x01 (lowest speed with all the functionality is 'Full-Speed')
bU1DevExitLat            : 0x0A   (less than 10 µs)
wU2DevExitLat            : 0x0020 (less than 32 µs)
Data (HexDump)           : 0A 10 03 00 0E 00 01 0A 20 00                     ........ .

      -------------------- String Descriptors -------------------
             ------ String Descriptor 0 ------
bLength                  : 0x04 (4 bytes)
bDescriptorType          : 0x03 (String Descriptor)
Language ID[0]           : 0x0409 (English - United States)
Data (HexDump)           : 04 03 09 04                                       ....
             ------ String Descriptor 1 ------
bLength                  : 0x0C (12 bytes)
bDescriptorType          : 0x03 (String Descriptor)
Language 0x0409          : "ADATA"
Data (HexDump)           : 0C 03 41 00 44 00 41 00 54 00 41 00               ..A.D.A.T.A.
             ------ String Descriptor 2 ------
bLength                  : 0x2E (46 bytes)
bDescriptorType          : 0x03 (String Descriptor)
Language 0x0409          : "ADATA ED600 USB Device"
Data (HexDump)           : 2E 03 41 00 44 00 41 00 54 00 41 00 20 00 45 00   ..A.D.A.T.A. .E.
                           44 00 36 00 30 00 30 00 20 00 55 00 53 00 42 00   D.6.0.0. .U.S.B.
                           20 00 44 00 65 00 76 00 69 00 63 00 65 00          .D.e.v.i.c.e.
             ------ String Descriptor 3 ------
bLength                  : 0x1A (26 bytes)
bDescriptorType          : 0x03 (String Descriptor)
Language 0x0409          : "00000000054F"
Data (HexDump)           : 1A 03 30 00 30 00 30 00 30 00 30 00 30 00 30 00   ..0.0.0.0.0.0.0.
                           30 00 30 00 35 00 34 00 46 00                     0.0.5.4.F.
