/dev/sda:

ATA device, with non-removable media
        Model Number:       WDC WD15EARS-00Z5B1
        Serial Number:      WD-WMAVU1578316
        Firmware Revision:  80.00A80
        Transport:          Serial, SATA 1.0a, SATA II Extensions, SATA Rev 2.5, SATA Rev 2.6
Standards:
        Supported: 8 7 6 5
        Likely used: 8
Configuration:
        Logical         max     current
        cylinders       16383   16383
        heads           16      16
        sectors/track   63      63
        --
        CHS current addressable sectors:   16514064
        LBA    user addressable sectors:  268435455
        LBA48  user addressable sectors: 2930277168
        Logical/Physical Sector size:           512 bytes
        device size with M = 1024*1024:     1430799 MBytes
        device size with M = 1000*1000:     1500301 MBytes (1500 GB)
        cache/buffer size  = unknown
Capabilities:
        LBA, IORDY(can be disabled)
        Queue depth: 32
        Standby timer values: spec'd by Standard, with device specific minimum
        R/W multiple sector transfer: Max = 16  Current = 0
        Recommended acoustic management value: 128, current value: 254
        DMA: mdma0 mdma1 mdma2 udma0 udma1 udma2 udma3 udma4 udma5 *udma6
             Cycle time: min=120ns recommended=120ns
        PIO: pio0 pio1 pio2 pio3 pio4
             Cycle time: no flow control=120ns  IORDY flow control=120ns
Commands/features:
        Enabled Supported:
           *    SMART feature set
                Security Mode feature set
           *    Power Management feature set
           *    Write cache
           *    Look-ahead
           *    Host Protected Area feature set
           *    WRITE_BUFFER command
           *    READ_BUFFER command
           *    NOP cmd
           *    DOWNLOAD_MICROCODE
                Power-Up In Standby feature set
           *    SET_FEATURES required to spinup after power up
                SET_MAX security extension
           *    Automatic Acoustic Management feature set
           *    48-bit Address feature set
           *    Device Configuration Overlay feature set
           *    Mandatory FLUSH_CACHE
           *    FLUSH_CACHE_EXT
           *    SMART error logging
           *    SMART self-test
           *    General Purpose Logging feature set
           *    64-bit World wide name
           *    {READ,WRITE}_DMA_EXT_GPL commands
           *    Segmented DOWNLOAD_MICROCODE
           *    Gen1 signaling speed (1.5Gb/s)
           *    Gen2 signaling speed (3.0Gb/s)
           *    Native Command Queueing (NCQ)
           *    Host-initiated interface power management
           *    Phy event counters
           *    NCQ priority information
           *    DMA Setup Auto-Activate optimization
           *    Software settings preservation
           *    SMART Command Transport (SCT) feature set
           *    SCT Features Control (AC4)
           *    SCT Data Tables (AC5)
                unknown 206[12] (vendor specific)
                unknown 206[13] (vendor specific)
Security:
        Master password revision code = 65534
                supported
        not     enabled
        not     locked
        not     frozen
        not     expired: security count
                supported: enhanced erase
        330min for SECURITY ERASE UNIT. 330min for ENHANCED SECURITY ERASE UNIT.
Logical Unit WWN Device Identifier: 50014ee001eed98b
        NAA             : 5
        IEEE OUI        : 0014ee
        Unique ID       : 001eed98b
Checksum: correct

/dev/sdb:

ATA device, with non-removable media
        Model Number:       WDC WD10EADS-00M2B0
        Serial Number:      WD-WCAV51020987
        Firmware Revision:  01.00A01
        Transport:          Serial, SATA 1.0a, SATA II Extensions, SATA Rev 2.5, SATA Rev 2.6
Standards:
        Supported: 8 7 6 5
        Likely used: 8
Configuration:
        Logical         max     current
        cylinders       16383   16383
        heads           16      16
        sectors/track   63      63
        --
        CHS current addressable sectors:   16514064
        LBA    user addressable sectors:  268435455
        LBA48  user addressable sectors: 1953525168
        Logical/Physical Sector size:           512 bytes
        device size with M = 1024*1024:      953869 MBytes
        device size with M = 1000*1000:     1000204 MBytes (1000 GB)
        cache/buffer size  = unknown
Capabilities:
        LBA, IORDY(can be disabled)
        Queue depth: 32
        Standby timer values: spec'd by Standard, with device specific minimum
        R/W multiple sector transfer: Max = 16  Current = 0
        Recommended acoustic management value: 128, current value: 254
        DMA: mdma0 mdma1 mdma2 udma0 udma1 udma2 udma3 udma4 udma5 *udma6
             Cycle time: min=120ns recommended=120ns
        PIO: pio0 pio1 pio2 pio3 pio4
             Cycle time: no flow control=120ns  IORDY flow control=120ns
Commands/features:
        Enabled Supported:
           *    SMART feature set
                Security Mode feature set
           *    Power Management feature set
           *    Write cache
           *    Look-ahead
           *    Host Protected Area feature set
           *    WRITE_BUFFER command
           *    READ_BUFFER command
           *    NOP cmd
           *    DOWNLOAD_MICROCODE
                Power-Up In Standby feature set
           *    SET_FEATURES required to spinup after power up
                SET_MAX security extension
                Automatic Acoustic Management feature set
           *    48-bit Address feature set
           *    Device Configuration Overlay feature set
           *    Mandatory FLUSH_CACHE
           *    FLUSH_CACHE_EXT
           *    SMART error logging
           *    SMART self-test
           *    General Purpose Logging feature set
           *    64-bit World wide name
           *    WRITE_UNCORRECTABLE_EXT command
           *    {READ,WRITE}_DMA_EXT_GPL commands
           *    Segmented DOWNLOAD_MICROCODE
           *    Gen1 signaling speed (1.5Gb/s)
           *    Gen2 signaling speed (3.0Gb/s)
           *    Native Command Queueing (NCQ)
           *    Host-initiated interface power management
           *    Phy event counters
           *    NCQ priority information
           *    DMA Setup Auto-Activate optimization
           *    Software settings preservation
           *    SMART Command Transport (SCT) feature set
           *    SCT Long Sector Access (AC1)
           *    SCT LBA Segment Access (AC2)
           *    SCT Error Recovery Control (AC3)
           *    SCT Features Control (AC4)
           *    SCT Data Tables (AC5)
                unknown 206[12] (vendor specific)
                unknown 206[13] (vendor specific)
Security:
        Master password revision code = 65534
                supported
        not     enabled
        not     locked
        not     frozen
        not     expired: security count
                supported: enhanced erase
        198min for SECURITY ERASE UNIT. 198min for ENHANCED SECURITY ERASE UNIT.
Logical Unit WWN Device Identifier: 50014ee25881840c
        NAA             : 5
        IEEE OUI        : 0014ee
        Unique ID       : 25881840c
Checksum: correct

/dev/sdc:

ATA device, with non-removable media
        Model Number:       WDC WD10EADS-65L5B1
        Serial Number:      WD-WCAU49389498
        Firmware Revision:  01.01A01
        Transport:          Serial, SATA 1.0a, SATA II Extensions, SATA Rev 2.5
Standards:
        Supported: 8 7 6 5
        Likely used: 8
Configuration:
        Logical         max     current
        cylinders       16383   16383
        heads           16      16
        sectors/track   63      63
        --
        CHS current addressable sectors:   16514064
        LBA    user addressable sectors:  268435455
        LBA48  user addressable sectors: 1953525168
        Logical/Physical Sector size:           512 bytes
        device size with M = 1024*1024:      953869 MBytes
        device size with M = 1000*1000:     1000204 MBytes (1000 GB)
        cache/buffer size  = unknown
Capabilities:
        LBA, IORDY(can be disabled)
        Queue depth: 32
        Standby timer values: spec'd by Standard, with device specific minimum
        R/W multiple sector transfer: Max = 16  Current = 0
        Recommended acoustic management value: 128, current value: 128
        DMA: mdma0 mdma1 mdma2 udma0 udma1 udma2 udma3 udma4 udma5 *udma6
             Cycle time: min=120ns recommended=120ns
        PIO: pio0 pio1 pio2 pio3 pio4
             Cycle time: no flow control=120ns  IORDY flow control=120ns
Commands/features:
        Enabled Supported:
           *    SMART feature set
           *    Power Management feature set
           *    Write cache
           *    Look-ahead
           *    WRITE_BUFFER command
           *    READ_BUFFER command
           *    NOP cmd
           *    DOWNLOAD_MICROCODE
                Power-Up In Standby feature set
           *    SET_FEATURES required to spinup after power up
                Automatic Acoustic Management feature set
           *    48-bit Address feature set
           *    Device Configuration Overlay feature set
           *    Mandatory FLUSH_CACHE
           *    FLUSH_CACHE_EXT
           *    SMART error logging
           *    SMART self-test
           *    General Purpose Logging feature set
           *    64-bit World wide name
           *    Segmented DOWNLOAD_MICROCODE
           *    Gen1 signaling speed (1.5Gb/s)
           *    Gen2 signaling speed (3.0Gb/s)
           *    Native Command Queueing (NCQ)
           *    Phy event counters
           *    DMA Setup Auto-Activate optimization
                Device-initiated interface power management
           *    Software settings preservation
           *    SMART Command Transport (SCT) feature set
           *    SCT Long Sector Access (AC1)
           *    SCT LBA Segment Access (AC2)
           *    SCT Error Recovery Control (AC3)
           *    SCT Features Control (AC4)
           *    SCT Data Tables (AC5)
                unknown 206[12] (vendor specific)
                unknown 206[13] (vendor specific)
Security:
        232min for SECURITY ERASE UNIT.
Logical Unit WWN Device Identifier: 50014ee25809f5f1
        NAA             : 5
        IEEE OUI        : 0014ee
        Unique ID       : 25809f5f1
Checksum: correct

/dev/sdd:

ATA device, with non-removable media
        Model Number:       WDC WD3000JS-00PDB0
        Serial Number:      WD-WCAPD2588589
        Firmware Revision:  21.00M21
Standards:
        Supported: 7 6 5 4
        Likely used: 8
Configuration:
        Logical         max     current
        cylinders       16383   16383
        heads           16      16
        sectors/track   63      63
        --
        CHS current addressable sectors:   16514064
        LBA    user addressable sectors:  268435455
        LBA48  user addressable sectors:  586070255
        Logical/Physical Sector size:           512 bytes
        device size with M = 1024*1024:      286167 MBytes
        device size with M = 1000*1000:      300067 MBytes (300 GB)
        cache/buffer size  = 8192 KBytes
Capabilities:
        LBA, IORDY(can be disabled)
        Queue depth: 1
        Standby timer values: spec'd by Standard, with device specific minimum
        R/W multiple sector transfer: Max = 16  Current = 0
        Recommended acoustic management value: 128, current value: 254
        DMA: mdma0 mdma1 mdma2 udma0 udma1 udma2 udma3 udma4 udma5 *udma6
             Cycle time: min=120ns recommended=120ns
        PIO: pio0 pio1 pio2 pio3 pio4
             Cycle time: no flow control=120ns  IORDY flow control=120ns
Commands/features:
        Enabled Supported:
           *    SMART feature set
                Security Mode feature set
           *    Power Management feature set
           *    Write cache
           *    Look-ahead
           *    Host Protected Area feature set
           *    WRITE_BUFFER command
           *    READ_BUFFER command
           *    NOP cmd
           *    DOWNLOAD_MICROCODE
                Power-Up In Standby feature set
           *    SET_FEATURES required to spinup after power up
                SET_MAX security extension
           *    Automatic Acoustic Management feature set
           *    48-bit Address feature set
           *    Device Configuration Overlay feature set
           *    Mandatory FLUSH_CACHE
           *    FLUSH_CACHE_EXT
           *    SMART error logging
           *    SMART self-test
           *    General Purpose Logging feature set
           *    Gen1 signaling speed (1.5Gb/s)
           *    Gen2 signaling speed (3.0Gb/s)
           *    Native Command Queueing (NCQ)
           *    Host-initiated interface power management
           *    Phy event counters
           *    DMA Setup Auto-Activate optimization
           *    Software settings preservation
           *    SMART Command Transport (SCT) feature set
           *    SCT Long Sector Access (AC1)
           *    SCT LBA Segment Access (AC2)
           *    SCT Error Recovery Control (AC3)
           *    SCT Features Control (AC4)
           *    SCT Data Tables (AC5)
                unknown 206[12] (vendor specific)
Security:
        Master password revision code = 65534
                supported
        not     enabled
        not     locked
        not     frozen
        not     expired: security count
        not     supported: enhanced erase
Checksum: correct

/dev/sde:

ATA device, with non-removable media
        Model Number:       WDC WD2500AAJS-00VTA0
        Serial Number:      WD-WMART0626341
        Firmware Revision:  01.01B01
Standards:
        Supported: 8 7 6 5
        Likely used: 8
Configuration:
        Logical         max     current
        cylinders       16383   16383
        heads           16      16
        sectors/track   63      63
        --
        CHS current addressable sectors:   16514064
        LBA    user addressable sectors:  268435455
        LBA48  user addressable sectors:  488395055
        Logical/Physical Sector size:           512 bytes
        device size with M = 1024*1024:      238474 MBytes
        device size with M = 1000*1000:      250058 MBytes (250 GB)
        cache/buffer size  = 8192 KBytes
Capabilities:
        LBA, IORDY(can be disabled)
        Queue depth: 32
        Standby timer values: spec'd by Standard, with device specific minimum
        R/W multiple sector transfer: Max = 16  Current = 0
        Recommended acoustic management value: 128, current value: 254
        DMA: mdma0 mdma1 mdma2 udma0 udma1 udma2 udma3 udma4 udma5 *udma6
             Cycle time: min=120ns recommended=120ns
        PIO: pio0 pio1 pio2 pio3 pio4
             Cycle time: no flow control=120ns  IORDY flow control=120ns
Commands/features:
        Enabled Supported:
           *    SMART feature set
                Security Mode feature set
           *    Power Management feature set
           *    Write cache
           *    Look-ahead
           *    Host Protected Area feature set
           *    WRITE_BUFFER command
           *    READ_BUFFER command
           *    NOP cmd
           *    DOWNLOAD_MICROCODE
                Power-Up In Standby feature set
           *    SET_FEATURES required to spinup after power up
                SET_MAX security extension
           *    Automatic Acoustic Management feature set
           *    48-bit Address feature set
           *    Device Configuration Overlay feature set
           *    Mandatory FLUSH_CACHE
           *    FLUSH_CACHE_EXT
           *    SMART error logging
           *    SMART self-test
           *    General Purpose Logging feature set
           *    64-bit World wide name
           *    Segmented DOWNLOAD_MICROCODE
           *    Gen1 signaling speed (1.5Gb/s)
           *    Gen2 signaling speed (3.0Gb/s)
           *    Native Command Queueing (NCQ)
           *    Host-initiated interface power management
           *    Phy event counters
           *    DMA Setup Auto-Activate optimization
           *    Software settings preservation
           *    SMART Command Transport (SCT) feature set
           *    SCT Long Sector Access (AC1)
           *    SCT LBA Segment Access (AC2)
           *    SCT Error Recovery Control (AC3)
           *    SCT Features Control (AC4)
           *    SCT Data Tables (AC5)
                unknown 206[12] (vendor specific)
                unknown 206[13] (vendor specific)
Security:
        Master password revision code = 65534
                supported
        not     enabled
        not     locked
        not     frozen
        not     expired: security count
                supported: enhanced erase
        50min for SECURITY ERASE UNIT. 50min for ENHANCED SECURITY ERASE UNIT.
Logical Unit WWN Device Identifier: 50014ee0ab0d3f61
        NAA             : 5
        IEEE OUI        : 0014ee
        Unique ID       : 0ab0d3f61
Checksum: correct
