smartctl 7.4 2023-08-01 r5530 [x86_64-linux-6.9.12-amd64] (local build)
Copyright (C) 2002-23, Bruce Allen, Christian Franke, www.smartmontools.org

=== START OF INFORMATION SECTION ===
Device Model:     WD Red SA500 2.5 4TB
Serial Number:    [redacted]
LU WWN Device Id: 5 001b44 4a550ec5e
Firmware Version: 540400WD
User Capacity:    4,000,787,030,016 bytes [4.00 TB]
Sector Size:      512 bytes logical/physical
Rotation Rate:    Solid State Device
Form Factor:      2.5 inches
TRIM Command:     Available, deterministic, zeroed
Device is:        Not in smartctl database 7.3/5528
ATA Version is:   ACS-3 T13/2161-D revision 5
SATA Version is:  SATA 3.3, 6.0 Gb/s (current: 6.0 Gb/s)
Local Time is:    Mon Sep 23 17:36:29 2024 PDT
SMART support is: Available - device has SMART capability.
SMART support is: Enabled
AAM feature is:   Unavailable
APM level is:     254 (maximum performance)
Rd look-ahead is: Enabled
Write cache is:   Enabled
DSN feature is:   Unavailable
ATA Security is:  Disabled, NOT FROZEN [SEC1]
Wt Cache Reorder: Unknown

=== START OF READ SMART DATA SECTION ===
SMART overall-health self-assessment test result: PASSED

General SMART Values:
Offline data collection status:  (0x80)	Offline data collection activity
					was never started.
					Auto Offline Data Collection: Enabled.
Self-test execution status:      (   0)	The previous self-test routine completed
					without error or no self-test has ever 
					been run.
Total time to complete Offline 
data collection: 		(    0) seconds.
Offline data collection
capabilities: 			 (0x7b) SMART execute Offline immediate.
					Auto Offline data collection on/off support.
					Suspend Offline collection upon new
					command.
					Offline surface scan supported.
					Self-test supported.
					Conveyance Self-test supported.
					Selective Self-test supported.
SMART capabilities:            (0x0002)	Does not save SMART data before
					entering power-saving mode.
					Supports SMART auto save timer.
Error logging capability:        (0x01)	Error logging supported.
					General Purpose Logging supported.
Short self-test routine 
recommended polling time: 	 (   2) minutes.
Extended self-test routine
recommended polling time: 	 (   2) minutes.
Conveyance self-test routine
recommended polling time: 	 (   6) minutes.
SCT capabilities: 	       (0x0035)	SCT Status supported.
					SCT Feature Control supported.
					SCT Data Table supported.

SMART Attributes Data Structure revision number: 16
Vendor Specific SMART Attributes with Thresholds:
ID# ATTRIBUTE_NAME          FLAGS    VALUE WORST THRESH FAIL RAW_VALUE
  5 Reallocated_Sector_Ct   -O--CK   100   100   000    -    0
  9 Power_On_Hours          -O--CK   100   100   000    -    82
 12 Power_Cycle_Count       -O--CK   100   100   000    -    2
165 Unknown_Attribute       -O--CK   100   100   000    -    80
166 Unknown_Attribute       -O--CK   100   100   000    -    1
167 Unknown_Attribute       -O--CK   100   100   000    -    55
168 Unknown_Attribute       -O--CK   100   100   000    -    3
170 Unknown_Attribute       -O--CK   100   100   000    -    0
171 Unknown_Attribute       -O--CK   100   100   000    -    0
172 Unknown_Attribute       -O--CK   100   100   000    -    0
173 Unknown_Attribute       -O--CK   100   100   000    -    1
174 Unknown_Attribute       -O--CK   100   100   000    -    1
187 Reported_Uncorrect      -O--CK   100   100   000    -    0
188 Command_Timeout         -O--CK   100   100   000    -    0
194 Temperature_Celsius     -O--CK   100   100   000    -    38 (Min/Max 23/51)
199 UDMA_CRC_Error_Count    -O--CK   100   100   000    -    0
230 Unknown_SSD_Attribute   -O--CK   100   100   000    -    0
232 Available_Reservd_Space PO--CK   100   100   001    -    100
233 Media_Wearout_Indicator -O--CK   100   100   000    -    7544
234 Unknown_Attribute       -O--CK   100   100   000    -    1362
241 Total_LBAs_Written      -O--CK   100   100   000    -    2157
242 Total_LBAs_Read         -O--CK   100   100   000    -    53
244 Unknown_Attribute       -O--CK   100   100   000    -    0
                            ||||||_ K auto-keep
                            |||||__ C event count
                            ||||___ R error rate
                            |||____ S speed/performance
                            ||_____ O updated online
                            |______ P prefailure warning

General Purpose Log Directory Version 1
SMART           Log Directory Version 1 [multi-sector log support]
Address    Access  R/W   Size  Description
0x00       GPL,SL  R/O      1  Log Directory
0x01           SL  R/O      1  Summary SMART error log
0x03       GPL     R/O      1  Ext. Comprehensive SMART error log
0x04       GPL,SL  R/O      8  Device Statistics log
0x06           SL  R/O      1  SMART self-test log
0x07       GPL     R/O      1  Extended self-test log
0x09           SL  R/W      1  Selective self-test log
0x10       GPL     R/O      1  NCQ Command Error log
0x11       GPL     R/O      1  SATA Phy Event Counters log
0x24       GPL     R/O     88  Current Device Internal Status Data log
0x25       GPL     R/O     64  Saved Device Internal Status Data log
0x30       GPL,SL  R/O      9  IDENTIFY DEVICE data log
0x80-0x9f  GPL,SL  R/W     16  Host vendor specific log
0xe0       GPL,SL  R/W      1  SCT Command/Status
0xe1       GPL,SL  R/W      1  SCT Data Transfer

SMART Extended Comprehensive Error Log Version: 1 (1 sectors)
No Errors Logged

SMART Error Log Version: 1
No Errors Logged

SMART Extended Self-test Log Version: 1 (1 sectors)
No self-tests have been logged.  [To run self-tests, use: smartctl -t]

SMART Self-test log structure revision number 1
No self-tests have been logged.  [To run self-tests, use: smartctl -t]

SMART Selective self-test log data structure revision number 1
 SPAN  MIN_LBA  MAX_LBA  CURRENT_TEST_STATUS
    1        0        0  Not_testing
    2        0        0  Not_testing
    3        0        0  Not_testing
    4        0        0  Not_testing
    5        0        0  Completed [00% left] (0-65535)
Selective self-test flags (0x0):
  After scanning selected spans, do NOT read-scan remainder of disk.
If Selective self-test is pending on power-up, resume after 0 minute delay.

SCT Status Version:                  3
SCT Version (vendor specific):       1 (0x0001)
Device State:                        Active (0)
Current Temperature:                    38 Celsius
Power Cycle Min/Max Temperature:     23/46 Celsius
Lifetime    Min/Max Temperature:     23/51 Celsius
Under/Over Temperature Limit Count:   0/0

SCT Temperature History Version:     2
Temperature Sampling Period:         1 minute
Temperature Logging Interval:        1 minute
Min/Max recommended Temperature:      0/100 Celsius
Min/Max Temperature Limit:            0/100 Celsius
Temperature History Size (Index):    128 (52)

Index    Estimated Time   Temperature Celsius
  53    2024-09-23 15:29    39  ********************
  54    2024-09-23 15:30    38  *******************
  55    2024-09-23 15:31    38  *******************
  56    2024-09-23 15:32    39  ********************
  57    2024-09-23 15:33    39  ********************
  58    2024-09-23 15:34    37  ******************
  59    2024-09-23 15:35    37  ******************
  60    2024-09-23 15:36    38  *******************
  61    2024-09-23 15:37    39  ********************
  62    2024-09-23 15:38    39  ********************
  63    2024-09-23 15:39    38  *******************
  64    2024-09-23 15:40    38  *******************
  65    2024-09-23 15:41    38  *******************
  66    2024-09-23 15:42    37  ******************
  67    2024-09-23 15:43    39  ********************
  68    2024-09-23 15:44    38  *******************
  69    2024-09-23 15:45    38  *******************
  70    2024-09-23 15:46    39  ********************
  71    2024-09-23 15:47    37  ******************
  72    2024-09-23 15:48    38  *******************
  73    2024-09-23 15:49    38  *******************
  74    2024-09-23 15:50    39  ********************
 ...    ..(  3 skipped).    ..  ********************
  78    2024-09-23 15:54    39  ********************
  79    2024-09-23 15:55    38  *******************
  80    2024-09-23 15:56    39  ********************
 ...    ..(  3 skipped).    ..  ********************
  84    2024-09-23 16:00    39  ********************
  85    2024-09-23 16:01    38  *******************
 ...    ..(  2 skipped).    ..  *******************
  88    2024-09-23 16:04    38  *******************
  89    2024-09-23 16:05    39  ********************
  90    2024-09-23 16:06    39  ********************
  91    2024-09-23 16:07    38  *******************
  92    2024-09-23 16:08    38  *******************
  93    2024-09-23 16:09    37  ******************
  94    2024-09-23 16:10    38  *******************
  95    2024-09-23 16:11    37  ******************
  96    2024-09-23 16:12    38  *******************
  97    2024-09-23 16:13    38  *******************
  98    2024-09-23 16:14    38  *******************
  99    2024-09-23 16:15    37  ******************
 100    2024-09-23 16:16    38  *******************
 101    2024-09-23 16:17    36  *****************
 102    2024-09-23 16:18    38  *******************
 103    2024-09-23 16:19    36  *****************
 104    2024-09-23 16:20    35  ****************
 105    2024-09-23 16:21    38  *******************
 106    2024-09-23 16:22    38  *******************
 107    2024-09-23 16:23    38  *******************
 108    2024-09-23 16:24    37  ******************
 109    2024-09-23 16:25    35  ****************
 110    2024-09-23 16:26    38  *******************
 ...    ..(  2 skipped).    ..  *******************
 113    2024-09-23 16:29    38  *******************
 114    2024-09-23 16:30    39  ********************
 115    2024-09-23 16:31    38  *******************
 116    2024-09-23 16:32    38  *******************
 117    2024-09-23 16:33    39  ********************
 118    2024-09-23 16:34    38  *******************
 119    2024-09-23 16:35    38  *******************
 120    2024-09-23 16:36    38  *******************
 121    2024-09-23 16:37    37  ******************
 122    2024-09-23 16:38    38  *******************
 123    2024-09-23 16:39    39  ********************
 124    2024-09-23 16:40    38  *******************
 125    2024-09-23 16:41    38  *******************
 126    2024-09-23 16:42    37  ******************
 127    2024-09-23 16:43    38  *******************
   0    2024-09-23 16:44    38  *******************
   1    2024-09-23 16:45    37  ******************
   2    2024-09-23 16:46    38  *******************
 ...    ..(  2 skipped).    ..  *******************
   5    2024-09-23 16:49    38  *******************
   6    2024-09-23 16:50    39  ********************
   7    2024-09-23 16:51    38  *******************
   8    2024-09-23 16:52    36  *****************
   9    2024-09-23 16:53    37  ******************
  10    2024-09-23 16:54    39  ********************
  11    2024-09-23 16:55    39  ********************
  12    2024-09-23 16:56    37  ******************
  13    2024-09-23 16:57    39  ********************
  14    2024-09-23 16:58    38  *******************
  15    2024-09-23 16:59    39  ********************
  16    2024-09-23 17:00    38  *******************
 ...    ..(  2 skipped).    ..  *******************
  19    2024-09-23 17:03    38  *******************
  20    2024-09-23 17:04    37  ******************
  21    2024-09-23 17:05    38  *******************
  22    2024-09-23 17:06    39  ********************
  23    2024-09-23 17:07    37  ******************
  24    2024-09-23 17:08    38  *******************
 ...    ..(  5 skipped).    ..  *******************
  30    2024-09-23 17:14    38  *******************
  31    2024-09-23 17:15    37  ******************
  32    2024-09-23 17:16    38  *******************
  33    2024-09-23 17:17    38  *******************
  34    2024-09-23 17:18    38  *******************
  35    2024-09-23 17:19    37  ******************
  36    2024-09-23 17:20    36  *****************
  37    2024-09-23 17:21    35  ****************
  38    2024-09-23 17:22    38  *******************
  39    2024-09-23 17:23    38  *******************
  40    2024-09-23 17:24    38  *******************
  41    2024-09-23 17:25    39  ********************
  42    2024-09-23 17:26    38  *******************
  43    2024-09-23 17:27    38  *******************
  44    2024-09-23 17:28    39  ********************
  45    2024-09-23 17:29    39  ********************
  46    2024-09-23 17:30    39  ********************
  47    2024-09-23 17:31    38  *******************
  48    2024-09-23 17:32    38  *******************
  49    2024-09-23 17:33    38  *******************
  50    2024-09-23 17:34    39  ********************
  51    2024-09-23 17:35    36  *****************
  52    2024-09-23 17:36    37  ******************

SCT Error Recovery Control command not supported

Device Statistics (GP Log 0x04)
Page  Offset Size        Value Flags Description
0x01  =====  =               =  ===  == General Statistics (rev 1) ==
0x01  0x008  4               2  ---  Lifetime Power-On Resets
0x01  0x010  4              82  ---  Power-on Hours
0x01  0x018  6       230471979  ---  Logical Sectors Written
0x01  0x020  6        21967044  ---  Number of Write Commands
0x01  0x028  6       113155057  ---  Logical Sectors Read
0x01  0x030  6         5437248  ---  Number of Read Commands
0x01  0x038  6       296605146  ---  Date and Time TimeStamp
0x04  =====  =               =  ===  == General Errors Statistics (rev 1) ==
0x04  0x008  4               0  ---  Number of Reported Uncorrectable Errors
0x04  0x010  4               1  ---  Resets Between Cmd Acceptance and Completion
0x05  =====  =               =  ===  == Temperature Statistics (rev 1) ==
0x05  0x008  1              38  ---  Current Temperature
0x05  0x010  1              37  ---  Average Short Term Temperature
0x05  0x018  1              37  ---  Average Long Term Temperature
0x05  0x020  1              51  ---  Highest Temperature
0x05  0x028  1              23  ---  Lowest Temperature
0x05  0x030  1              51  ---  Highest Average Short Term Temperature
0x05  0x038  1               0  ---  Lowest Average Short Term Temperature
0x05  0x040  1              51  ---  Highest Average Long Term Temperature
0x05  0x048  1               0  ---  Lowest Average Long Term Temperature
0x05  0x050  4               0  ---  Time in Over-Temperature
0x05  0x058  1              65  ---  Specified Maximum Operating Temperature
0x05  0x060  4               0  ---  Time in Under-Temperature
0x05  0x068  1               0  ---  Specified Minimum Operating Temperature
0x06  =====  =               =  ===  == Transport Statistics (rev 1) ==
0x06  0x008  4               1  ---  Number of Hardware Resets
0x06  0x010  4               0  ---  Number of ASR Events
0x06  0x018  4               0  ---  Number of Interface CRC Errors
0x07  =====  =               =  ===  == Solid State Device Statistics (rev 1) ==
0x07  0x008  1               0  ---  Percentage Used Endurance Indicator
                                |||_ C monitored condition met
                                ||__ D supports DSN
                                |___ N normalized value

Pending Defects log (GP Log 0x0c) not supported

SATA Phy Event Counters (GP Log 0x11)
ID      Size     Value  Description
0x0001  2            0  Command failed due to ICRC error
0x0002  2            0  R_ERR response for data FIS
0x0003  2            0  R_ERR response for device-to-host data FIS
0x0004  2            0  R_ERR response for host-to-device data FIS
0x0005  2            0  R_ERR response for non-data FIS
0x0006  2            0  R_ERR response for device-to-host non-data FIS
0x0007  2            0  R_ERR response for host-to-device non-data FIS
0x0008  2            0  Device-to-host non-data FIS retries
0x0009  2            0  Transition from drive PhyRdy to drive PhyNRdy
0x000a  2            0  Device-to-host register FISes sent due to a COMRESET
0x000b  2            0  CRC errors within host-to-device FIS
0x000d  2            0  Non-CRC errors within host-to-device FIS
0x000f  2            0  R_ERR response for host-to-device data FIS, CRC
0x0010  2            0  R_ERR response for host-to-device data FIS, non-CRC
0x0012  2            0  R_ERR response for host-to-device non-data FIS, CRC
0x0013  2            0  R_ERR response for host-to-device non-data FIS, non-CRC

