smartctl 6.5 2016-05-07 r4318 [x86_64-linux-4.4.88] (local build)
Copyright (C) 2002-16, Bruce Allen, Christian Franke, www.smartmontools.org

=== START OF INFORMATION SECTION ===
Device Model:     ADATA SU800
Serial Number:    2H4320069880
LU WWN Device Id: 5 707c18 1005bd539
Firmware Version: Q0913A
User Capacity:    128,035,676,160 bytes [128 GB]
Sector Size:      512 bytes logical/physical
Rotation Rate:    Solid State Device
Form Factor:      2.5 inches
Device is:        Not in smartctl database [for details use: -P showall]
ATA Version is:   ACS-3 T13/2161-D revision 5
SATA Version is:  SATA >3.2 (0x1ff), 6.0 Gb/s (current: 6.0 Gb/s)
Local Time is:    Sat Dec  9 05:17:44 2017 EET
SMART support is: Available - device has SMART capability.
SMART support is: Enabled

=== START OF READ SMART DATA SECTION ===
SMART overall-health self-assessment test result: PASSED

General SMART Values:
Offline data collection status:  (0x80) Offline data collection activity
                                        was never started.
                                        Auto Offline Data Collection: Enabled.
Self-test execution status:      (   0) The previous self-test routine completed
                                        without error or no self-test has ever 
                                        been run.
Total time to complete Offline 
data collection:                (    0) seconds.
Offline data collection
capabilities:                    (0x7b) SMART execute Offline immediate.
                                        Auto Offline data collection on/off support.
                                        Suspend Offline collection upon new
                                        command.
                                        Offline surface scan supported.
                                        Self-test supported.
                                        Conveyance Self-test supported.
                                        Selective Self-test supported.
SMART capabilities:            (0x0002) Does not save SMART data before
                                        entering power-saving mode.
                                        Supports SMART auto save timer.
Error logging capability:        (0x01) Error logging supported.
                                        General Purpose Logging supported.
Short self-test routine 
recommended polling time:        (   2) minutes.
Extended self-test routine
recommended polling time:        (  30) minutes.
Conveyance self-test routine
recommended polling time:        (   2) minutes.
SCT capabilities:              (0x0035) SCT Status supported.
                                        SCT Feature Control supported.
                                        SCT Data Table supported.

SMART Attributes Data Structure revision number: 16
Vendor Specific SMART Attributes with Thresholds:
ID# ATTRIBUTE_NAME          FLAG     VALUE WORST THRESH TYPE      UPDATED  WHEN_FAILED RAW_VALUE
  1 Raw_Read_Error_Rate     0x0000   100   100   000    Old_age   Offline      -       0
  5 Reallocated_Sector_Ct   0x0000   100   100   000    Old_age   Offline      -       1
  9 Power_On_Hours          0x0000   100   100   000    Old_age   Offline      -       9
 12 Power_Cycle_Count       0x0000   100   100   000    Old_age   Offline      -       10
148 Unknown_Attribute       0x0000   100   100   000    Old_age   Offline      -       64
149 Unknown_Attribute       0x0000   100   100   000    Old_age   Offline      -       8
150 Unknown_Attribute       0x0000   100   100   000    Old_age   Offline      -       2
151 Unknown_Attribute       0x0000   100   100   000    Old_age   Offline      -       4
159 Unknown_Attribute       0x0000   100   100   000    Old_age   Offline      -       0
160 Unknown_Attribute       0x0000   100   100   000    Old_age   Offline      -       0
161 Unknown_Attribute       0x0000   100   100   000    Old_age   Offline      -       25
163 Unknown_Attribute       0x0000   100   100   000    Old_age   Offline      -       31
164 Unknown_Attribute       0x0000   100   100   000    Old_age   Offline      -       3409
165 Unknown_Attribute       0x0000   100   100   000    Old_age   Offline      -       11
166 Unknown_Attribute       0x0000   100   100   000    Old_age   Offline      -       5
167 Unknown_Attribute       0x0000   100   100   000    Old_age   Offline      -       7
169 Unknown_Attribute       0x0000   100   100   000    Old_age   Offline      -       100
177 Wear_Leveling_Count     0x0000   100   100   050    Old_age   Offline      -       0
181 Program_Fail_Cnt_Total  0x0000   100   100   000    Old_age   Offline      -       0
182 Erase_Fail_Count_Total  0x0000   100   100   000    Old_age   Offline      -       0
192 Power-Off_Retract_Count 0x0000   100   100   000    Old_age   Offline      -       2
194 Temperature_Celsius     0x0000   100   100   000    Old_age   Offline      -       32
196 Reallocated_Event_Count 0x0000   100   100   016    Old_age   Offline      -       65
199 UDMA_CRC_Error_Count    0x0000   100   100   050    Old_age   Offline      -       0
232 Available_Reservd_Space 0x0000   100   100   000    Old_age   Offline      -       100
241 Total_LBAs_Written      0x0000   100   100   000    Old_age   Offline      -       11293
242 Total_LBAs_Read         0x0000   100   100   000    Old_age   Offline      -       8447
245 Unknown_Attribute       0x0000   100   100   000    Old_age   Offline      -       30681
250 Read_Error_Retry_Rate   0x0000   100   100   000    Old_age   Offline      -       0
251 Unknown_Attribute       0x0000   100   100   000    Old_age   Offline      -       0

SMART Error Log Version: 1
No Errors Logged

SMART Self-test log structure revision number 1
No self-tests have been logged.  [To run self-tests, use: smartctl -t]

SMART Selective self-test log data structure revision number 1
 SPAN  MIN_LBA  MAX_LBA  CURRENT_TEST_STATUS
    1        0        0  Not_testing
    2        0        0  Not_testing
    3        0        0  Not_testing
    4        0        0  Not_testing
    5        0        0  Completed [00% left] (0-65535)
Selective self-test flags (0x0):
  After scanning selected spans, do NOT read-scan remainder of disk.
If Selective self-test is pending on power-up, resume after 0 minute delay.