smartctl 7.4 2023-08-01 r5530 [x86_64-linux-6.5.5-200.fc38.x86_64] (local build)
Copyright (C) 2002-23, Bruce Allen, Christian Franke, www.smartmontools.org

=== START OF INFORMATION SECTION ===
Device Model:     ST4000DX005-3GH101
Firmware Version: FC01
User Capacity:    4,000,787,030,016 bytes [4.00 TB]
Sector Sizes:     512 bytes logical, 4096 bytes physical
Rotation Rate:    7200 rpm
Form Factor:      3.5 inches
Device is:        Not in smartctl database 7.3/5528
ATA Version is:   ACS-4 (minor revision not indicated)
SATA Version is:  SATA 3.3, 6.0 Gb/s (current: 6.0 Gb/s)
Local Time is:    Tue Oct 10 17:35:00 2023 MDT
SMART support is: Available - device has SMART capability.
SMART support is: Enabled
AAM feature is:   Unavailable
APM feature is:   Unavailable
Rd look-ahead is: Enabled
Write cache is:   Enabled
DSN feature is:   Disabled
ATA Security is:  Disabled, frozen [SEC2]
Write SCT (Get) Feature Control Command failed: scsi error badly formed scsi parameters
Wt Cache Reorder: Unknown (SCT Feature Control command failed)

=== START OF READ SMART DATA SECTION ===
SMART overall-health self-assessment test result: PASSED

General SMART Values:
Offline data collection status:  (0x82)	Offline data collection activity
					was completed without error.
					Auto Offline Data Collection: Enabled.
Self-test execution status:      (   0)	The previous self-test routine completed
					without error or no self-test has ever 
					been run.
Total time to complete Offline 
data collection: 		(  559) seconds.
Offline data collection
capabilities: 			 (0x7b) SMART execute Offline immediate.
					Auto Offline data collection on/off support.
					Suspend Offline collection upon new
					command.
					Offline surface scan supported.
					Self-test supported.
					Conveyance Self-test supported.
					Selective Self-test supported.
SMART capabilities:            (0x0003)	Saves SMART data before entering
					power-saving mode.
					Supports SMART auto save timer.
Error logging capability:        (0x01)	Error logging supported.
					General Purpose Logging supported.
Short self-test routine 
recommended polling time: 	 (   1) minutes.
Extended self-test routine
recommended polling time: 	 ( 346) minutes.
Conveyance self-test routine
recommended polling time: 	 (   2) minutes.
SCT capabilities: 	       (0x70bd)	SCT Status supported.
					SCT Error Recovery Control supported.
					SCT Feature Control supported.
					SCT Data Table supported.

SMART Attributes Data Structure revision number: 10
Vendor Specific SMART Attributes with Thresholds:
ID# ATTRIBUTE_NAME          FLAGS    VALUE WORST THRESH FAIL RAW_VALUE
  1 Raw_Read_Error_Rate     POSR--   080   064   044    -    107174622
  3 Spin_Up_Time            PO----   097   097   000    -    0
  4 Start_Stop_Count        -O--CK   100   100   020    -    6
  5 Reallocated_Sector_Ct   PO--CK   100   100   010    -    0
  7 Seek_Error_Rate         POSR--   072   060   045    -    17682892
  9 Power_On_Hours          -O--CK   100   100   000    -    413
 10 Spin_Retry_Count        PO--C-   100   100   097    -    0
 12 Power_Cycle_Count       -O--CK   100   100   020    -    6
 18 Unknown_Attribute       PO-R--   100   100   050    -    0
187 Reported_Uncorrect      -O--CK   100   100   000    -    0
188 Command_Timeout         -O--CK   100   100   000    -    0
190 Airflow_Temperature_Cel -O---K   062   048   000    -    38 (Min/Max 34/43)
192 Power-Off_Retract_Count -O--CK   100   100   000    -    2
193 Load_Cycle_Count        -O--CK   100   100   000    -    907
194 Temperature_Celsius     -O---K   038   052   000    -    38 (0 22 0 0 0)
197 Current_Pending_Sector  -O--C-   100   100   000    -    0
198 Offline_Uncorrectable   ----C-   100   100   000    -    0
199 UDMA_CRC_Error_Count    -OSRCK   200   200   000    -    0
240 Head_Flying_Hours       ------   100   253   000    -    265 (162 211 0)
241 Total_LBAs_Written      ------   100   253   000    -    4409247349
242 Total_LBAs_Read         ------   100   253   000    -    109460507849
                            ||||||_ K auto-keep
                            |||||__ C event count
                            ||||___ R error rate
                            |||____ S speed/performance
                            ||_____ O updated online
                            |______ P prefailure warning

General Purpose Log Directory Version 1
SMART           Log Directory Version 1 [multi-sector log support]
Address    Access  R/W   Size  Description
0x00       GPL,SL  R/O      1  Log Directory
0x01           SL  R/O      1  Summary SMART error log
0x02           SL  R/O      5  Comprehensive SMART error log
0x03       GPL     R/O      5  Ext. Comprehensive SMART error log
0x04       GPL     R/O    256  Device Statistics log
0x04       SL      R/O      8  Device Statistics log
0x06           SL  R/O      1  SMART self-test log
0x07       GPL     R/O      1  Extended self-test log
0x08       GPL     R/O      2  Power Conditions log
0x09           SL  R/W      1  Selective self-test log
0x0a       GPL     R/W      8  Device Statistics Notification
0x0c       GPL     R/O   2048  Pending Defects log
0x10       GPL     R/O      1  NCQ Command Error log
0x11       GPL     R/O      1  SATA Phy Event Counters log
0x13       GPL     R/O      1  SATA NCQ Send and Receive log
0x21       GPL     R/O      1  Write stream error log
0x22       GPL     R/O      1  Read stream error log
0x24       GPL     R/O    768  Current Device Internal Status Data log
0x2f       GPL     R/O      1  Set Sector Configuration
0x30       GPL,SL  R/O      9  IDENTIFY DEVICE data log
0x80-0x9f  GPL,SL  R/W     16  Host vendor specific log
0xa1       GPL,SL  VS     160  Device vendor specific log
0xa2       GPL     VS   16320  Device vendor specific log
0xa4       GPL,SL  VS     160  Device vendor specific log
0xa6       GPL     VS     192  Device vendor specific log
0xa8-0xa9  GPL,SL  VS     136  Device vendor specific log
0xab       GPL     VS       1  Device vendor specific log
0xad       GPL     VS      16  Device vendor specific log
0xb1       GPL,SL  VS     160  Device vendor specific log
0xb6       GPL     VS    1920  Device vendor specific log
0xbe-0xbf  GPL     VS   65535  Device vendor specific log
0xc1       GPL,SL  VS       8  Device vendor specific log
0xc3       GPL,SL  VS      24  Device vendor specific log
0xc6       GPL     VS    5184  Device vendor specific log
0xc7       GPL,SL  VS       8  Device vendor specific log
0xc9       GPL,SL  VS       8  Device vendor specific log
0xca       GPL,SL  VS      16  Device vendor specific log
0xcd       GPL,SL  VS       1  Device vendor specific log
0xce       GPL     VS       1  Device vendor specific log
0xcf       GPL     VS     512  Device vendor specific log
0xd1       GPL     VS     656  Device vendor specific log
0xd2       GPL     VS   10256  Device vendor specific log
0xd4       GPL     VS    2048  Device vendor specific log
0xda       GPL,SL  VS       1  Device vendor specific log
0xe0       GPL,SL  R/W      1  SCT Command/Status
0xe1       GPL,SL  R/W      1  SCT Data Transfer

SMART Extended Comprehensive Error Log Version: 1 (5 sectors)
No Errors Logged

SMART Extended Self-test Log Version: 1 (1 sectors)
Num  Test_Description    Status                  Remaining  LifeTime(hours)  LBA_of_first_error
# 1  Short offline       Completed without error       00%       413         -
# 2  Short offline       Completed without error       00%       398         -
# 3  Short offline       Completed without error       00%       374         -
# 4  Short offline       Completed without error       00%       350         -
# 5  Extended offline    Completed without error       00%       333         -
# 6  Short offline       Completed without error       00%       326         -
# 7  Short offline       Completed without error       00%       302         -
# 8  Short offline       Completed without error       00%       278         -
# 9  Short offline       Completed without error       00%       254         -
#10  Short offline       Completed without error       00%       230         -
#11  Short offline       Completed without error       00%       206         -
#12  Short offline       Completed without error       00%       182         -
#13  Extended offline    Completed without error       00%       164         -
#14  Short offline       Completed without error       00%       158         -
#15  Short offline       Completed without error       00%       134         -
#16  Extended offline    Completed without error       00%       124         -
#17  Short offline       Completed without error       00%       110         -
#18  Short offline       Completed without error       00%        98         -

SMART Selective self-test log data structure revision number 1
 SPAN  MIN_LBA  MAX_LBA  CURRENT_TEST_STATUS
    1        0        0  Not_testing
    2        0        0  Not_testing
    3        0        0  Not_testing
    4        0        0  Not_testing
    5        0        0  Not_testing
Selective self-test flags (0x0):
  After scanning selected spans, do NOT read-scan remainder of disk.
If Selective self-test is pending on power-up, resume after 0 minute delay.

SCT Status Version:                  3
SCT Version (vendor specific):       522 (0x020a)
Device State:                        Active (0)
Current Temperature:                    38 Celsius
Power Cycle Min/Max Temperature:     34/43 Celsius
Lifetime    Min/Max Temperature:     22/52 Celsius
Under/Over Temperature Limit Count:   0/22
SMART Status:                        0xc24f (PASSED)
Vendor specific:
00 00 00 00 00 00 00 00 00 00 00 00 00 00 00 00
00 00 00 00 02 00 00 00 00 00 00 00 00 00 00 00

SCT Temperature History Version:     2
Temperature Sampling Period:         4 minutes
Temperature Logging Interval:        59 minutes
Min/Max recommended Temperature:     10/40 Celsius
Min/Max Temperature Limit:            5/60 Celsius
Temperature History Size (Index):    128 (40)

Index    Estimated Time   Temperature Celsius
  41    2023-10-05 12:34    37  ******************
  42    2023-10-05 13:33    38  *******************
  43    2023-10-05 14:32    37  ******************
  44    2023-10-05 15:31    37  ******************
  45    2023-10-05 16:30    38  *******************
 ...    ..(  5 skipped).    ..  *******************
  51    2023-10-05 22:24    38  *******************
  52    2023-10-05 23:23    37  ******************
  53    2023-10-06 00:22    37  ******************
  54    2023-10-06 01:21    38  *******************
  55    2023-10-06 02:20    37  ******************
  56    2023-10-06 03:19    36  *****************
  57    2023-10-06 04:18    35  ****************
  58    2023-10-06 05:17    35  ****************
  59    2023-10-06 06:16    36  *****************
  60    2023-10-06 07:15    36  *****************
  61    2023-10-06 08:14    36  *****************
  62    2023-10-06 09:13    37  ******************
 ...    ..(  5 skipped).    ..  ******************
  68    2023-10-06 15:07    37  ******************
  69    2023-10-06 16:06    36  *****************
  70    2023-10-06 17:05    37  ******************
 ...    ..(  5 skipped).    ..  ******************
  76    2023-10-06 22:59    37  ******************
  77    2023-10-06 23:58    38  *******************
 ...    ..(  4 skipped).    ..  *******************
  82    2023-10-07 04:53    38  *******************
  83    2023-10-07 05:52    42  ***********************
  84    2023-10-07 06:51    43  ************************
  85    2023-10-07 07:50    43  ************************
  86    2023-10-07 08:49    42  ***********************
  87    2023-10-07 09:48    42  ***********************
  88    2023-10-07 10:47    42  ***********************
  89    2023-10-07 11:46    39  ********************
  90    2023-10-07 12:45    38  *******************
 ...    ..(  2 skipped).    ..  *******************
  93    2023-10-07 15:42    38  *******************
  94    2023-10-07 16:41    37  ******************
  95    2023-10-07 17:40    38  *******************
  96    2023-10-07 18:39    37  ******************
  97    2023-10-07 19:38    38  *******************
 ...    ..(  4 skipped).    ..  *******************
 102    2023-10-08 00:33    38  *******************
 103    2023-10-08 01:32    37  ******************
 104    2023-10-08 02:31    36  *****************
 105    2023-10-08 03:30    42  ***********************
 106    2023-10-08 04:29    42  ***********************
 107    2023-10-08 05:28    43  ************************
 108    2023-10-08 06:27    43  ************************
 109    2023-10-08 07:26    43  ************************
 110    2023-10-08 08:25    42  ***********************
 111    2023-10-08 09:24    37  ******************
 112    2023-10-08 10:23    37  ******************
 113    2023-10-08 11:22    38  *******************
 ...    ..( 11 skipped).    ..  *******************
 125    2023-10-08 23:10    38  *******************
 126    2023-10-09 00:09    37  ******************
 127    2023-10-09 01:08    36  *****************
   0    2023-10-09 02:07    36  *****************
   1    2023-10-09 03:06    36  *****************
   2    2023-10-09 04:05    35  ****************
   3    2023-10-09 05:04    35  ****************
   4    2023-10-09 06:03    35  ****************
   5    2023-10-09 07:02    36  *****************
   6    2023-10-09 08:01    37  ******************
 ...    ..(  3 skipped).    ..  ******************
  10    2023-10-09 11:57    37  ******************
  11    2023-10-09 12:56    38  *******************
  12    2023-10-09 13:55    37  ******************
  13    2023-10-09 14:54    37  ******************
  14    2023-10-09 15:53    38  *******************
 ...    ..(  5 skipped).    ..  *******************
  20    2023-10-09 21:47    38  *******************
  21    2023-10-09 22:46    37  ******************
 ...    ..(  2 skipped).    ..  ******************
  24    2023-10-10 01:43    37  ******************
  25    2023-10-10 02:42    36  *****************
  26    2023-10-10 03:41    35  ****************
  27    2023-10-10 04:40    36  *****************
  28    2023-10-10 05:39    36  *****************
  29    2023-10-10 06:38    36  *****************
  30    2023-10-10 07:37    37  ******************
  31    2023-10-10 08:36    38  *******************
  32    2023-10-10 09:35    38  *******************
  33    2023-10-10 10:34    37  ******************
  34    2023-10-10 11:33    38  *******************
 ...    ..(  5 skipped).    ..  *******************
  40    2023-10-10 17:27    38  *******************

SCT Error Recovery Control:
           Read:    100 (10.0 seconds)
          Write:    100 (10.0 seconds)

Device Statistics (GP Log 0x04)
Page  Offset Size        Value Flags Description
0x01  =====  =               =  ===  == General Statistics (rev 1) ==
0x01  0x008  4               6  ---  Lifetime Power-On Resets
0x01  0x010  4             413  ---  Power-on Hours
0x01  0x018  6      4409247358  ---  Logical Sectors Written
0x01  0x020  6         7236189  ---  Number of Write Commands
0x01  0x028  6    109460502961  ---  Logical Sectors Read
0x01  0x030  6        19963464  ---  Number of Read Commands
0x01  0x038  6               -  ---  Date and Time TimeStamp
0x03  =====  =               =  ===  == Rotating Media Statistics (rev 1) ==
0x03  0x008  4             413  ---  Spindle Motor Power-on Hours
0x03  0x010  4             328  ---  Head Flying Hours
0x03  0x018  4             907  ---  Head Load Events
0x03  0x020  4               0  ---  Number of Reallocated Logical Sectors
0x03  0x028  4               0  ---  Read Recovery Attempts
0x03  0x030  4               0  ---  Number of Mechanical Start Failures
0x03  0x038  4               0  ---  Number of Realloc. Candidate Logical Sectors
0x03  0x040  4               2  ---  Number of High Priority Unload Events
0x04  =====  =               =  ===  == General Errors Statistics (rev 1) ==
0x04  0x008  4               0  ---  Number of Reported Uncorrectable Errors
0x04  0x010  4               0  ---  Resets Between Cmd Acceptance and Completion
0x04  0x018  4               0  -D-  Physical Element Status Changed
0x05  =====  =               =  ===  == Temperature Statistics (rev 1) ==
0x05  0x008  1              38  ---  Current Temperature
0x05  0x010  1              37  ---  Average Short Term Temperature
0x05  0x018  1               -  ---  Average Long Term Temperature
0x05  0x020  1              52  ---  Highest Temperature
0x05  0x028  1              29  ---  Lowest Temperature
0x05  0x030  1              46  ---  Highest Average Short Term Temperature
0x05  0x038  1              36  ---  Lowest Average Short Term Temperature
0x05  0x040  1               -  ---  Highest Average Long Term Temperature
0x05  0x048  1               -  ---  Lowest Average Long Term Temperature
0x05  0x050  4               0  ---  Time in Over-Temperature
0x05  0x058  1              60  ---  Specified Maximum Operating Temperature
0x05  0x060  4               0  ---  Time in Under-Temperature
0x05  0x068  1               5  ---  Specified Minimum Operating Temperature
0x06  =====  =               =  ===  == Transport Statistics (rev 1) ==
0x06  0x008  4              66  ---  Number of Hardware Resets
0x06  0x010  4              31  ---  Number of ASR Events
0x06  0x018  4               0  ---  Number of Interface CRC Errors
0xff  =====  =               =  ===  == Vendor Specific Statistics (rev 1) ==
0xff  0x010  7               0  ---  Vendor Specific
0xff  0x018  7               0  ---  Vendor Specific
                                |||_ C monitored condition met
                                ||__ D supports DSN
                                |___ N normalized value

Pending Defects log (GP Log 0x0c)
No Defects Logged

SATA Phy Event Counters (GP Log 0x11)
ID      Size     Value  Description
0x000a  2           18  Device-to-host register FISes sent due to a COMRESET
0x0001  2            0  Command failed due to ICRC error
0x0003  2            0  R_ERR response for device-to-host data FIS
0x0004  2            0  R_ERR response for host-to-device data FIS
0x0006  2            0  R_ERR response for device-to-host non-data FIS
0x0007  2            0  R_ERR response for host-to-device non-data FIS

Seagate FARM log (GP Log 0xa6) supported [try: -l farm]

