smartctl 7.2 2020-12-30 r5155 [aarch64-linux-5.10.0-153.12.0.92.oe2203sp2.aarch64] (local build)
Copyright (C) 2002-20, Bruce Allen, Christian Franke, www.smartmontools.org

=== START OF INFORMATION SECTION ===
Device Model:     RSYE3836B-480G
Serial Number:    PDBH072400130
LU WWN Device Id: 5 3a5a27 0720d004b
Firmware Version: SX300023
User Capacity:    480,103,981,056 bytes [480 GB]
Sector Sizes:     512 bytes logical, 4096 bytes physical
Rotation Rate:    Solid State Device
Form Factor:      2.5 inches
TRIM Command:     Available, deterministic, zeroed
Device is:        Not in smartctl database [for details use: -P showall]
ATA Version is:   ACS-4 (minor revision not indicated)
SATA Version is:  SATA 3.2, 6.0 Gb/s (current: 6.0 Gb/s)
Local Time is:    Tue Aug 20 19:38:30 2024 CST
SMART support is: Available - device has SMART capability.
SMART support is: Enabled
AAM feature is:   Unavailable
APM level is:     254 (maximum performance)
Rd look-ahead is: Enabled
Write cache is:   Enabled
DSN feature is:   Unavailable
ATA Security is:  Disabled, NOT FROZEN [SEC1]
Wt Cache Reorder: Enabled

=== START OF READ SMART DATA SECTION ===
SMART overall-health self-assessment test result: PASSED

General SMART Values:
Offline data collection status:  (0x00)	Offline data collection activity
					was never started.
					Auto Offline Data Collection: Disabled.
Self-test execution status:      (   0)	The previous self-test routine completed
					without error or no self-test has ever 
					been run.
Total time to complete Offline 
data collection: 		(   33) seconds.
Offline data collection
capabilities: 			 (0x7b) SMART execute Offline immediate.
					Auto Offline data collection on/off support.
					Suspend Offline collection upon new
					command.
					Offline surface scan supported.
					Self-test supported.
					Conveyance Self-test supported.
					Selective Self-test supported.
SMART capabilities:            (0x0003)	Saves SMART data before entering
					power-saving mode.
					Supports SMART auto save timer.
Error logging capability:        (0x01)	Error logging supported.
					General Purpose Logging supported.
Short self-test routine 
recommended polling time: 	 (   2) minutes.
Extended self-test routine
recommended polling time: 	 (   3) minutes.
Conveyance self-test routine
recommended polling time: 	 (   3) minutes.
SCT capabilities: 	       (0x0035)	SCT Status supported.
					SCT Feature Control supported.
					SCT Data Table supported.

SMART Attributes Data Structure revision number: 0
Vendor Specific SMART Attributes with Thresholds:
ID# ATTRIBUTE_NAME          FLAGS    VALUE WORST THRESH FAIL RAW_VALUE
  1 Raw_Read_Error_Rate     POSR-K   100   100   050    -    0
  5 Reallocated_Sector_Ct   -O--CK   100   100   001    -    0
  9 Power_On_Hours          -O--CK   100   100   000    -    3
 12 Power_Cycle_Count       -O--CK   100   100   001    -    1
170 Unknown_Attribute       PO--CK   100   100   010    -    0
171 Unknown_Attribute       -O--CK   100   100   000    -    0
172 Unknown_Attribute       -O--CK   100   100   001    -    0
173 Unknown_Attribute       -O--CK   100   100   000    -    44
174 Unknown_Attribute       -O--CK   100   100   000    -    1
175 Program_Fail_Count_Chip P-----   100   100   001    -    0
180 Unused_Rsvd_Blk_Cnt_Tot PO--CK   100   100   000    -    1819
183 Runtime_Bad_Block       -O--CK   100   100   000    -    0
184 End-to-End_Error        -O--CK   100   100   000    -    0
187 Reported_Uncorrect      -O--CK   100   100   000    -    0
188 Command_Timeout         -O--CK   100   100   000    -    0
194 Temperature_Celsius     -O---K   064   064   000    -    36 (Min/Max 31/36)
195 Hardware_ECC_Recovered  -O--CK   100   100   000    -    0
198 Offline_Uncorrectable   ----CK   100   100   000    -    0
199 UDMA_CRC_Error_Count    -O--CK   100   100   000    -    0
202 Unknown_SSD_Attribute   ----CK   100   100   001    -    0
210 Unknown_Attribute       -O--CK   100   100   000    -    0
241 Total_LBAs_Written      -OS--K   100   100   000    -    0
242 Total_LBAs_Read         -OS--K   100   100   000    -    134
248 Unknown_Attribute       -O--CK   100   100   000    -    0
                            ||||||_ K auto-keep
                            |||||__ C event count
                            ||||___ R error rate
                            |||____ S speed/performance
                            ||_____ O updated online
                            |______ P prefailure warning

General Purpose Log Directory Version 1
SMART           Log Directory Version 1 [multi-sector log support]
Address    Access  R/W   Size  Description
0x00       GPL,SL  R/O      1  Log Directory
0x01           SL  R/O      1  Summary SMART error log
0x02           SL  R/O      8  Comprehensive SMART error log
0x03       GPL     R/O      8  Ext. Comprehensive SMART error log
0x04       GPL,SL  R/O      8  Device Statistics log
0x06           SL  R/O      1  SMART self-test log
0x07       GPL     R/O      1  Extended self-test log
0x09           SL  R/W      1  Selective self-test log
0x10       GPL     R/O      1  NCQ Command Error log
0x11       GPL     R/O      1  SATA Phy Event Counters log
0x30       GPL,SL  R/O      9  IDENTIFY DEVICE data log
0x80-0x9f  GPL,SL  R/W     16  Host vendor specific log
0xe0       GPL,SL  R/W      1  SCT Command/Status
0xe1       GPL,SL  R/W      1  SCT Data Transfer

SMART Extended Comprehensive Error Log Version: 1 (8 sectors)
No Errors Logged

SMART Extended Self-test Log Version: 1 (1 sectors)
No self-tests have been logged.  [To run self-tests, use: smartctl -t]

SMART Selective self-test log data structure revision number 1
 SPAN  MIN_LBA  MAX_LBA  CURRENT_TEST_STATUS
    1        0        0  Not_testing
    2        0        0  Not_testing
    3        0        0  Not_testing
    4        0        0  Not_testing
    5        0        0  Not_testing
Selective self-test flags (0x0):
  After scanning selected spans, do NOT read-scan remainder of disk.
If Selective self-test is pending on power-up, resume after 0 minute delay.

SCT Status Version:                  3
SCT Version (vendor specific):       1 (0x0001)
Device State:                        Active (0)
Current Temperature:                    36 Celsius
Power Cycle Min/Max Temperature:     31/36 Celsius
Lifetime    Min/Max Temperature:     31/36 Celsius
Under/Over Temperature Limit Count:   0/0

SCT Temperature History Version:     2
Temperature Sampling Period:         1 minute
Temperature Logging Interval:        1 minute
Min/Max recommended Temperature:      0/75 Celsius
Min/Max Temperature Limit:           -40/80 Celsius
Temperature History Size (Index):    478 (187)

Index    Estimated Time   Temperature Celsius
 188    2024-08-20 11:41     ?  -
 ...    ..(288 skipped).    ..  -
 477    2024-08-20 16:30     ?  -
   0    2024-08-20 16:31    35  ****************
   1    2024-08-20 16:32     ?  -
   2    2024-08-20 16:33    31  ************
   3    2024-08-20 16:34    34  ***************
   4    2024-08-20 16:35    34  ***************
   5    2024-08-20 16:36    35  ****************
   6    2024-08-20 16:37    35  ****************
   7    2024-08-20 16:38    35  ****************
   8    2024-08-20 16:39    36  *****************
 ...    ..(  2 skipped).    ..  *****************
  11    2024-08-20 16:42    36  *****************
  12    2024-08-20 16:43    35  ****************
  13    2024-08-20 16:44    36  *****************
 ...    ..( 54 skipped).    ..  *****************
  68    2024-08-20 17:39    36  *****************
  69    2024-08-20 17:40    35  ****************
  70    2024-08-20 17:41    35  ****************
  71    2024-08-20 17:42    36  *****************
  72    2024-08-20 17:43    35  ****************
  73    2024-08-20 17:44    35  ****************
  74    2024-08-20 17:45    36  *****************
  75    2024-08-20 17:46    35  ****************
 ...    ..(  2 skipped).    ..  ****************
  78    2024-08-20 17:49    35  ****************
  79    2024-08-20 17:50    36  *****************
  80    2024-08-20 17:51    35  ****************
 ...    ..(  7 skipped).    ..  ****************
  88    2024-08-20 17:59    35  ****************
  89    2024-08-20 18:00    36  *****************
  90    2024-08-20 18:01    35  ****************
 ...    ..(  7 skipped).    ..  ****************
  98    2024-08-20 18:09    35  ****************
  99    2024-08-20 18:10    36  *****************
 100    2024-08-20 18:11    36  *****************
 101    2024-08-20 18:12    35  ****************
 102    2024-08-20 18:13    35  ****************
 103    2024-08-20 18:14    36  *****************
 104    2024-08-20 18:15    36  *****************
 105    2024-08-20 18:16    35  ****************
 106    2024-08-20 18:17    35  ****************
 107    2024-08-20 18:18    36  *****************
 108    2024-08-20 18:19    36  *****************
 109    2024-08-20 18:20    36  *****************
 110    2024-08-20 18:21    35  ****************
 111    2024-08-20 18:22    36  *****************
 112    2024-08-20 18:23    36  *****************
 113    2024-08-20 18:24    35  ****************
 ...    ..(  5 skipped).    ..  ****************
 119    2024-08-20 18:30    35  ****************
 120    2024-08-20 18:31    36  *****************
 121    2024-08-20 18:32    36  *****************
 122    2024-08-20 18:33    35  ****************
 123    2024-08-20 18:34    36  *****************
 124    2024-08-20 18:35    35  ****************
 ...    ..(  2 skipped).    ..  ****************
 127    2024-08-20 18:38    35  ****************
 128    2024-08-20 18:39    36  *****************
 129    2024-08-20 18:40    35  ****************
 130    2024-08-20 18:41    35  ****************
 131    2024-08-20 18:42    36  *****************
 132    2024-08-20 18:43    35  ****************
 133    2024-08-20 18:44    35  ****************
 134    2024-08-20 18:45    36  *****************
 135    2024-08-20 18:46    36  *****************
 136    2024-08-20 18:47    35  ****************
 137    2024-08-20 18:48    36  *****************
 ...    ..(  4 skipped).    ..  *****************
 142    2024-08-20 18:53    36  *****************
 143    2024-08-20 18:54    35  ****************
 144    2024-08-20 18:55    35  ****************
 145    2024-08-20 18:56    36  *****************
 146    2024-08-20 18:57    35  ****************
 147    2024-08-20 18:58    35  ****************
 148    2024-08-20 18:59    36  *****************
 ...    ..( 15 skipped).    ..  *****************
 164    2024-08-20 19:15    36  *****************
 165    2024-08-20 19:16    35  ****************
 166    2024-08-20 19:17    36  *****************
 ...    ..(  2 skipped).    ..  *****************
 169    2024-08-20 19:20    36  *****************
 170    2024-08-20 19:21    35  ****************
 171    2024-08-20 19:22    35  ****************
 172    2024-08-20 19:23    35  ****************
 173    2024-08-20 19:24    36  *****************
 174    2024-08-20 19:25    35  ****************
 175    2024-08-20 19:26    36  *****************
 ...    ..(  2 skipped).    ..  *****************
 178    2024-08-20 19:29    36  *****************
 179    2024-08-20 19:30    35  ****************
 180    2024-08-20 19:31    36  *****************
 ...    ..(  2 skipped).    ..  *****************
 183    2024-08-20 19:34    36  *****************
 184    2024-08-20 19:35    35  ****************
 185    2024-08-20 19:36    36  *****************
 186    2024-08-20 19:37    35  ****************
 187    2024-08-20 19:38    36  *****************

SCT Error Recovery Control command not supported

Device Statistics (GP Log 0x04)
Page  Offset Size        Value Flags Description
0x01  =====  =               =  ===  == General Statistics (rev 1) ==
0x01  0x008  4               1  ---  Lifetime Power-On Resets
0x01  0x010  4               3  ---  Power-on Hours
0x01  0x018  6               0  ---  Logical Sectors Written
0x01  0x020  6               0  ---  Number of Write Commands
0x01  0x028  6            4280  ---  Logical Sectors Read
0x01  0x030  6              97  ---  Number of Read Commands
0x01  0x038  6        10800000  ---  Date and Time TimeStamp
0x04  =====  =               =  ===  == General Errors Statistics (rev 1) ==
0x04  0x008  4               0  ---  Number of Reported Uncorrectable Errors
0x04  0x010  4               0  ---  Resets Between Cmd Acceptance and Completion
0x05  =====  =               =  ===  == Temperature Statistics (rev 1) ==
0x05  0x008  1              36  ---  Current Temperature
0x05  0x010  1               -  ---  Average Short Term Temperature
0x05  0x018  1               -  ---  Average Long Term Temperature
0x05  0x020  1              36  ---  Highest Temperature
0x05  0x028  1              31  ---  Lowest Temperature
0x05  0x030  1               -  ---  Highest Average Short Term Temperature
0x05  0x038  1               -  ---  Lowest Average Short Term Temperature
0x05  0x040  1               -  ---  Highest Average Long Term Temperature
0x05  0x048  1               -  ---  Lowest Average Long Term Temperature
0x05  0x050  4               0  ---  Time in Over-Temperature
0x05  0x058  1              75  ---  Specified Maximum Operating Temperature
0x05  0x060  4               0  ---  Time in Under-Temperature
0x05  0x068  1               0  ---  Specified Minimum Operating Temperature
0x06  =====  =               =  ===  == Transport Statistics (rev 1) ==
0x06  0x008  4               2  ---  Number of Hardware Resets
0x06  0x018  4               0  ---  Number of Interface CRC Errors
0x07  =====  =               =  ===  == Solid State Device Statistics (rev 1) ==
0x07  0x008  1               0  ---  Percentage Used Endurance Indicator
                                |||_ C monitored condition met
                                ||__ D supports DSN
                                |___ N normalized value

Pending Defects log (GP Log 0x0c) not supported

SATA Phy Event Counters (GP Log 0x11)
ID      Size     Value  Description
0x0001  2            0  Command failed due to ICRC error
0x000a  4            2  Device-to-host register FISes sent due to a COMRESET

