smartctl 6.6 2016-05-31 r4324 [x86_64-linux-4.9.0-8-amd64] (local build)
Copyright (C) 2002-16, Bruce Allen, Christian Franke, www.smartmontools.org

=== START OF INFORMATION SECTION ===
Device Model:     SFSA480GM1AA4TO-I-OC-616-STD
Firmware Version: SBR11015
User Capacity:    480,103,981,056 bytes [480 GB]
Sector Size:      512 bytes logical/physical
Rotation Rate:    Solid State Device
Device is:        Not in smartctl database [for details use: -P showall]
ATA Version is:   ACS-2 (minor revision not indicated)
SATA Version is:  SATA 3.1, 6.0 Gb/s (current: 6.0 Gb/s)
Local Time is:    Fri Apr 26 09:40:38 2019 CEST
SMART support is: Available - device has SMART capability.
SMART support is: Enabled
AAM feature is:   Disabled
APM feature is:   Unavailable
Rd look-ahead is: Enabled
Write cache is:   Enabled
ATA Security is:  Disabled, NOT FROZEN [SEC1]
Wt Cache Reorder: Unavailable

=== START OF READ SMART DATA SECTION ===
SMART overall-health self-assessment test result: PASSED

General SMART Values:
Offline data collection status:  (0x02)	Offline data collection activity
					was completed without error.
					Auto Offline Data Collection: Disabled.
Self-test execution status:      (   0)	The previous self-test routine completed
					without error or no self-test has ever 
					been run.
Total time to complete Offline 
data collection: 		(   57) seconds.
Offline data collection
capabilities: 			 (0x71) SMART execute Offline immediate.
					No Auto Offline data collection support.
					Suspend Offline collection upon new
					command.
					No Offline surface scan supported.
					Self-test supported.
					Conveyance Self-test supported.
					Selective Self-test supported.
SMART capabilities:            (0x0002)	Does not save SMART data before
					entering power-saving mode.
					Supports SMART auto save timer.
Error logging capability:        (0x01)	Error logging supported.
					General Purpose Logging supported.
Short self-test routine 
recommended polling time: 	 (   1) minutes.
Extended self-test routine
recommended polling time: 	 (   1) minutes.
Conveyance self-test routine
recommended polling time: 	 (   1) minutes.

SMART Attributes Data Structure revision number: 1
Vendor Specific SMART Attributes with Thresholds:
ID# ATTRIBUTE_NAME          FLAGS    VALUE WORST THRESH FAIL RAW_VALUE
  1 Raw_Read_Error_Rate     PO-R--   100   100   000    -    0
  5 Reallocated_Sector_Ct   PO--C-   100   100   000    -    0
  9 Power_On_Hours          -O--C-   100   100   000    -    148
 12 Power_Cycle_Count       -O--C-   100   100   000    -    59
160 Unknown_Attribute       -O----   100   100   000    -    0
161 Unknown_Attribute       -O--C-   100   100   025    -    245
163 Unknown_Attribute       PO----   100   100   000    -    39
164 Unknown_Attribute       ------   100   100   000    -    6479
165 Unknown_Attribute       ------   100   100   000    -    5
166 Unknown_Attribute       ------   100   100   000    -    0
167 Unknown_Attribute       -O--C-   100   100   001    -    3
168 Unknown_Attribute       -O--C-   100   100   000    -    3000
169 Unknown_Attribute       PO----   100   100   000    -    6
192 Power-Off_Retract_Count ------   100   100   000    -    245
193 Unknown_SSD_Attribute   -O--C-   100   100   000    -    2
194 Temperature_Celsius     PO---K   100   100   000    -    44 (Min/Max -1/88)
195 Hardware_ECC_Recovered  -O--C-   100   100   000    -    10630
196 Reallocated_Event_Count ------   000   000   000    -    0
198 Offline_Uncorrectable   -O--C-   100   100   000    -    0
199 UDMA_CRC_Error_Count    -O--C-   100   100   000    -    15
215 Unknown_Attribute       -O--C-   100   100   000    -    200319
235 Unknown_Attribute       -O--C-   100   100   000    -    50138970
237 Unknown_Attribute       -O--C-   100   100   000    -    0
241 Total_LBAs_Written      -O--C-   100   100   000    -    3170228752
242 Total_LBAs_Read         -O--C-   100   100   000    -    29252346094
243 Unknown_Attribute       -O--C-   100   100   000    -    0
244 Unknown_Attribute       -O--C-   100   100   000    -    0
248 Unknown_Attribute       -O--C-   100   100   000    -    100
249 Unknown_Attribute       PO--C-   100   100   000    -    100
                            ||||||_ K auto-keep
                            |||||__ C event count
                            ||||___ R error rate
                            |||____ S speed/performance
                            ||_____ O updated online
                            |______ P prefailure warning

General Purpose Log Directory Version 1
SMART           Log Directory Version 1 [multi-sector log support]
Address    Access  R/W   Size  Description
0x00       GPL,SL  R/O      1  Log Directory
0x01       GPL,SL  R/O      1  Summary SMART error log
0x02       GPL,SL  R/O      1  Comprehensive SMART error log
0x03       GPL,SL  R/O      1  Ext. Comprehensive SMART error log
0x04       GPL,SL  R/O      8  Device Statistics log
0x06       GPL,SL  R/O      1  SMART self-test log
0x07       GPL,SL  R/O      1  Extended self-test log
0x09       GPL,SL  R/W      1  Selective self-test log
0x10       GPL,SL  R/O      1  SATA NCQ Queued Error log
0x30       GPL,SL  R/O      9  IDENTIFY DEVICE data log
0x31       GPL,SL  -        4  Reserved
0x80-0x9f  GPL,SL  R/W     16  Host vendor specific log

SMART Extended Comprehensive Error Log Version: 1 (1 sectors)
No Errors Logged

SMART Extended Self-test Log Version: 1 (1 sectors)
No self-tests have been logged.  [To run self-tests, use: smartctl -t]

SMART Selective self-test log data structure revision number 1
 SPAN  MIN_LBA  MAX_LBA  CURRENT_TEST_STATUS
    1        0        0  Not_testing
    2        0        0  Not_testing
    3        0        0  Not_testing
    4        0        0  Not_testing
    5        0        0  Not_testing
    7        0    65535  Read_scanning was completed without error
Selective self-test flags (0x0):
  After scanning selected spans, do NOT read-scan remainder of disk.
If Selective self-test is pending on power-up, resume after 0 minute delay.

SCT Commands not supported

Device Statistics (GP Log 0x04)
Page  Offset Size        Value Flags Description
0x01  =====  =               =  ===  == General Statistics (rev 2) ==
0x01  0x008  4              59  ---  Lifetime Power-On Resets
0x01  0x010  4             148  ---  Power-on Hours
0x01  0x018  6      3170228752  ---  Logical Sectors Written
0x01  0x020  6         6191855  ---  Number of Write Commands
0x01  0x028  6      3482542312  ---  Logical Sectors Read
0x01  0x030  6       513415304  ---  Number of Read Commands
0x02  =====  =               =  ===  == Free-Fall Statistics (empty) ==
0x03  =====  =               =  ===  == Rotating Media Statistics (empty) ==
0x04  =====  =               =  ===  == General Errors Statistics (rev 1) ==
0x04  0x008  4               0  ---  Number of Reported Uncorrectable Errors
0x04  0x010  4               6  ---  Resets Between Cmd Acceptance and Completion
0x05  =====  =               =  ===  == Temperature Statistics (empty) ==
0x06  =====  =               =  ===  == Transport Statistics (rev 1) ==
0x06  0x008  4            5234  ---  Number of Hardware Resets
0x06  0x018  4              15  ---  Number of Interface CRC Errors
0x07  =====  =               =  ===  == Solid State Device Statistics (rev 1) ==
0x07  0x008  1               0  ---  Percentage Used Endurance Indicator
                                |||_ C monitored condition met
                                ||__ D supports DSN
                                |___ N normalized value

SATA Phy Event Counters (GP Log 0x11) not supported

