smartctl 7.4 2023-08-01 r5530 [x86_64-w64-mingw32-w11-22H2] (sf-7.4-1)
Copyright (C) 2002-23, Bruce Allen, Christian Franke, www.smartmontools.org

=== START OF INFORMATION SECTION ===
Model Family:     Swissbit X-78 Series m.2 SATA SSD
Device Model:     SFSA320GM2AK2TA-I-8C-21P-STD
Serial Number:    00006020921297000002
Firmware Version: SBR15103
User Capacity:    320'072'933'376 bytes [320 GB]
Sector Size:      512 bytes logical/physical
Rotation Rate:    Solid State Device
Form Factor:      2.5 inches
TRIM Command:     Available, deterministic, zeroed
Device is:        In smartctl database 7.3/5528
ATA Version is:   ACS-3 (minor revision not indicated)
SATA Version is:  SATA 3.2, 6.0 Gb/s (current: 6.0 Gb/s)
Local Time is:    Wed Jan 17 14:37:56 2024 MZ
SMART support is: Available - device has SMART capability.
SMART support is: Enabled
AAM feature is:   Unavailable
APM feature is:   Unavailable
Rd look-ahead is: Enabled
Write cache is:   Enabled
DSN feature is:   Unavailable
ATA Security is:  Disabled, frozen [SEC2]
Write SCT (Get) Feature Control Command failed: Input/output error
Wt Cache Reorder: Unknown (SCT Feature Control command failed)

=== START OF READ SMART DATA SECTION ===
SMART overall-health self-assessment test result: PASSED

General SMART Values:
Offline data collection status:  (0x00) Offline data collection activity
                                        was never started.
                                        Auto Offline Data Collection: Disabled.
Self-test execution status:      (   0) The previous self-test routine completed
                                        without error or no self-test has ever
                                        been run.
Total time to complete Offline
data collection:                (    0) seconds.
Offline data collection
capabilities:                    (0x53) SMART execute Offline immediate.
                                        Auto Offline data collection on/off support.
                                        Suspend Offline collection upon new
                                        command.
                                        No Offline surface scan supported.
                                        Self-test supported.
                                        No Conveyance Self-test supported.
                                        Selective Self-test supported.
SMART capabilities:            (0x0003) Saves SMART data before entering
                                        power-saving mode.
                                        Supports SMART auto save timer.
Error logging capability:        (0x01) Error logging supported.
                                        General Purpose Logging supported.
Short self-test routine
recommended polling time:        (   2) minutes.
Extended self-test routine
recommended polling time:        (  15) minutes.
SCT capabilities:              (0x0031) SCT Status supported.
                                        SCT Feature Control supported.
                                        SCT Data Table supported.

SMART Attributes Data Structure revision number: 1
Vendor Specific SMART Attributes with Thresholds:
ID# ATTRIBUTE_NAME          FLAGS    VALUE WORST THRESH FAIL RAW_VALUE
  1 Read_Error_Rate         PO-R--   100   100   000    -    0
  5 Reallocated_Sectors_Ct  PO--C-   100   100   000    -    0
  9 Power_On_Hours          -O--C-   100   100   000    -    1
 12 Power_On_Counter        -O--C-   100   100   000    -    23
 16 Average_Erase_Count_pSLC-O--C-+  100   100   001    -    3
 17 Rated_Erase_Count_pSLC  -O--C-   100   100   000    -    80000
160 Uncorrectable_ECC_Erros -O----   100   100   000    -    0
161 Spare_Block_Count       -O--C-   100   100   000    -    20971840
163 Initial_Bad_Block_Count PO----   100   100   000    -    29
164 Total_Flash_Block_Erases-O--C-   100   100   000    -    6011
165 Maximum_Erase_Count     -O----   100   100   000    -    10
166 Minimum_Erase_Count     -O--C-   100   100   000    -    0
167 Average_Erase_Count     -O--C-   100   100   000    -    3
168 Rated_Erase_Count       -O--C-   100   100   000    -    80000
169 Power_On_Data_Repairs   PO----   100   100   000    -    0
193 Dynamic_Remaps          -O--C-   100   100   000    -    0
194 Temperature_Celsius     PO---K   100   100   000    -    2758947
195 Refresh_Based_on_ECC    -O--C-   100   100   000    -    0
196 Reallocation_Event_Count-O--C-   000   000   000    -    0
198 Reported_UECC_Offline   -O--C-   100   100   000    -    0
199 Communication_Errors    PO-R--   100   100   000    -    0
215 Number_of_TRIM_Commands -O--C-   100   100   000    -    1500
231 Reamining_Erase_Life_TimePO--C-+  100   100   025    -    100
235 Total_Flash_LBAs_Written-O--C-   100   100   000    -    1873841664
237 Flash_LBAs_Written_Exp  -O--C-   100   100   000    -    0
241 Total_Host_LBA_Written  -O--C-   100   100   000    -    1859018638
242 Total_Host_LBA_Read     -O--C-   100   100   000    -    1839988173
243 Host_LBA_Write_Exp      -O--C-   100   100   000    -    0
244 Host_LBA_Read_Exp       -O--C-   100   100   000    -    0
248 SSD_Remaining_Life      -O--C-+  100   100   001    -    100
                            ||||||_ K auto-keep
                            |||||__ C event count
                            ||||___ R error rate
                            |||____ S speed/performance
                            ||_____ O updated online
                            |______ P prefailure warning

General Purpose Log Directory Version 1
SMART           Log Directory Version 1 [multi-sector log support]
Address    Access  R/W   Size  Description
0x00       GPL,SL  R/O      1  Log Directory
0x01       GPL,SL  R/O      1  Summary SMART error log
0x02       GPL,SL  R/O      1  Comprehensive SMART error log
0x03       GPL,SL  R/O      1  Ext. Comprehensive SMART error log
0x04       GPL,SL  R/O      8  Device Statistics log
0x06       GPL,SL  R/O      1  SMART self-test log
0x07       GPL,SL  R/O      1  Extended self-test log
0x09       GPL,SL  R/W      1  Selective self-test log
0x10       GPL,SL  R/O      1  NCQ Command Error log
0x11       GPL,SL  R/O      1  SATA Phy Event Counters log
0x30       GPL,SL  R/O      9  IDENTIFY DEVICE data log
0x80-0x9f  GPL,SL  R/W     16  Host vendor specific log
0xdf       GPL,SL  VS       1  Device vendor specific log
0xe0       GPL,SL  R/W      1  SCT Command/Status
0xe1       GPL,SL  R/W      1  SCT Data Transfer

SMART Extended Comprehensive Error Log Version: 1 (1 sectors)
No Errors Logged

SMART Extended Self-test Log Version: 1 (1 sectors)
No self-tests have been logged.  [To run self-tests, use: smartctl -t]

SMART Selective self-test log data structure revision number 1
 SPAN  MIN_LBA  MAX_LBA  CURRENT_TEST_STATUS
    1        0        0  Not_testing
    2        0        0  Not_testing
    3        0        0  Not_testing
    4        0        0  Not_testing
    5        0        0  Not_testing
Selective self-test flags (0x0):
  After scanning selected spans, do NOT read-scan remainder of disk.
If Selective self-test is pending on power-up, resume after 0 minute delay.

SCT Status Version:                  3
SCT Version (vendor specific):       0 (0x0000)
Device State:                        Active (0)
Current Temperature:                    36 Celsius
Power Cycle Min/Max Temperature:     25/36 Celsius
Lifetime    Min/Max Temperature:     25/42 Celsius
Under/Over Temperature Limit Count:   0/0

SCT Temperature History Version:     2
Temperature Sampling Period:         1 minute
Temperature Logging Interval:        1 minute
Min/Max recommended Temperature:      0/100 Celsius
Min/Max Temperature Limit:            0/100 Celsius
Temperature History Size (Index):    128 (66)

Index    Estimated Time   Temperature Celsius
  67    2024-01-17 12:30    47  ****************************
  68    2024-01-17 12:31    49  ******************************
  69    2024-01-17 12:32    45  **************************
  70    2024-01-17 12:33    46  ***************************
  71    2024-01-17 12:34    46  ***************************
  72    2024-01-17 12:35    47  ****************************
  73    2024-01-17 12:36    47  ****************************
  74    2024-01-17 12:37    47  ****************************
  75    2024-01-17 12:38    43  ************************
  76    2024-01-17 12:39    47  ****************************
  77    2024-01-17 12:40    47  ****************************
  78    2024-01-17 12:41    47  ****************************
  79    2024-01-17 12:42    45  **************************
 ...    ..(  6 skipped).    ..  **************************
  86    2024-01-17 12:49    45  **************************
  87    2024-01-17 12:50    40  *********************
  88    2024-01-17 12:51    42  ***********************
  89    2024-01-17 12:52    41  **********************
  90    2024-01-17 12:53    41  **********************
  91    2024-01-17 12:54    41  **********************
  92    2024-01-17 12:55    42  ***********************
  93    2024-01-17 12:56    42  ***********************
  94    2024-01-17 12:57    43  ************************
  95    2024-01-17 12:58    41  **********************
 ...    ..(  3 skipped).    ..  **********************
  99    2024-01-17 13:02    41  **********************
 100    2024-01-17 13:03    42  ***********************
 101    2024-01-17 13:04    42  ***********************
 102    2024-01-17 13:05    27  ********
 ...    ..(  3 skipped).    ..  ********
 106    2024-01-17 13:09    27  ********
 107    2024-01-17 13:10    25  ******
 108    2024-01-17 13:11    27  ********
 109    2024-01-17 13:12    25  ******
 ...    ..(  3 skipped).    ..  ******
 113    2024-01-17 13:16    25  ******
 114    2024-01-17 13:17    26  *******
 115    2024-01-17 13:18    25  ******
 116    2024-01-17 13:19    26  *******
 117    2024-01-17 13:20    26  *******
 118    2024-01-17 13:21    28  *********
 ...    ..(  3 skipped).    ..  *********
 122    2024-01-17 13:25    28  *********
 123    2024-01-17 13:26    25  ******
 124    2024-01-17 13:27    26  *******
 125    2024-01-17 13:28    26  *******
 126    2024-01-17 13:29    26  *******
 127    2024-01-17 13:30    28  *********
   0    2024-01-17 13:31    27  ********
   1    2024-01-17 13:32    28  *********
   2    2024-01-17 13:33    27  ********
   3    2024-01-17 13:34    28  *********
   4    2024-01-17 13:35    28  *********
   5    2024-01-17 13:36    29  **********
 ...    ..(  2 skipped).    ..  **********
   8    2024-01-17 13:39    29  **********
   9    2024-01-17 13:40    30  ***********
  10    2024-01-17 13:41    29  **********
  11    2024-01-17 13:42    29  **********
  12    2024-01-17 13:43    29  **********
  13    2024-01-17 13:44    30  ***********
  14    2024-01-17 13:45    29  **********
  15    2024-01-17 13:46    29  **********
  16    2024-01-17 13:47    30  ***********
  17    2024-01-17 13:48    29  **********
 ...    ..(  2 skipped).    ..  **********
  20    2024-01-17 13:51    29  **********
  21    2024-01-17 13:52    31  ************
  22    2024-01-17 13:53    34  ***************
  23    2024-01-17 13:54    32  *************
  24    2024-01-17 13:55    33  **************
  25    2024-01-17 13:56    34  ***************
 ...    ..(  3 skipped).    ..  ***************
  29    2024-01-17 14:00    34  ***************
  30    2024-01-17 14:01    35  ****************
 ...    ..(  4 skipped).    ..  ****************
  35    2024-01-17 14:06    35  ****************
  36    2024-01-17 14:07    36  *****************
  37    2024-01-17 14:08    35  ****************
 ...    ..(  3 skipped).    ..  ****************
  41    2024-01-17 14:12    35  ****************
  42    2024-01-17 14:13    36  *****************
  43    2024-01-17 14:14    36  *****************
  44    2024-01-17 14:15    36  *****************
  45    2024-01-17 14:16    34  ***************
 ...    ..(  7 skipped).    ..  ***************
  53    2024-01-17 14:24    34  ***************
  54    2024-01-17 14:25    35  ****************
  55    2024-01-17 14:26    35  ****************
  56    2024-01-17 14:27    34  ***************
  57    2024-01-17 14:28    35  ****************
 ...    ..(  2 skipped).    ..  ****************
  60    2024-01-17 14:31    35  ****************
  61    2024-01-17 14:32    36  *****************
  62    2024-01-17 14:33    35  ****************
  63    2024-01-17 14:34    36  *****************
  64    2024-01-17 14:35    36  *****************
  65    2024-01-17 14:36    36  *****************
  66    2024-01-17 14:37    55  ************************************

SCT Error Recovery Control command not supported

Device Statistics (GP Log 0x04)
Page  Offset Size        Value Flags Description
0x01  =====  =               =  ===  == General Statistics (rev 1) ==
0x01  0x008  4              23  ---  Lifetime Power-On Resets
0x01  0x010  4               1  ---  Power-on Hours
0x01  0x018  6      1859018638  ---  Logical Sectors Written
0x01  0x020  6         7262019  ---  Number of Write Commands
0x01  0x028  6      1839988173  ---  Logical Sectors Read
0x01  0x030  6         7271603  ---  Number of Read Commands
0x04  =====  =               =  ===  == General Errors Statistics (rev 1) ==
0x04  0x008  4               0  ---  Number of Reported Uncorrectable Errors
0x04  0x010  4               0  ---  Resets Between Cmd Acceptance and Completion
0x05  =====  =               =  ===  == Temperature Statistics (rev 1) ==
0x05  0x008  1              36  ---  Current Temperature
0x05  0x010  1               -  ---  Average Short Term Temperature
0x05  0x018  1               -  ---  Average Long Term Temperature
0x05  0x020  1              73  ---  Highest Temperature
0x05  0x028  1             -19  ---  Lowest Temperature
0x05  0x030  1               -  ---  Highest Average Short Term Temperature
0x05  0x038  1               -  ---  Lowest Average Short Term Temperature
0x05  0x040  1               -  ---  Highest Average Long Term Temperature
0x05  0x048  1               -  ---  Lowest Average Long Term Temperature
0x05  0x050  4               0  ---  Time in Over-Temperature
0x05  0x058  1              85  ---  Specified Maximum Operating Temperature
0x05  0x060  4              20  ---  Time in Under-Temperature
0x05  0x068  1               0  ---  Specified Minimum Operating Temperature
0x06  =====  =               =  ===  == Transport Statistics (rev 1) ==
0x06  0x008  4               2  ---  Number of Hardware Resets
0x06  0x018  4               0  ---  Number of Interface CRC Errors
0x07  =====  =               =  ===  == Solid State Device Statistics (rev 1) ==
0x07  0x008  1             103  ---  Percentage Used Endurance Indicator
                                |||_ C monitored condition met
                                ||__ D supports DSN
                                |___ N normalized value

Pending Defects log (GP Log 0x0c) not supported

SATA Phy Event Counters (GP Log 0x11)
ID      Size     Value  Description
0x0001  2            0  Command failed due to ICRC error
0x0005  2            0  R_ERR response for non-data FIS
0x000a  2            2  Device-to-host register FISes sent due to a COMRESET