smartctl 6.5 2016-01-24 r4214 [x86_64-linux-4.15.0-29-generic] (local build)
Copyright (C) 2002-16, Bruce Allen, Christian Franke, www.smartmontools.org

=== START OF INFORMATION SECTION ===
Device Model:     LITEON CV8-8E256-11 SATA 256GB
Serial Number:    TW0WJT50LOH0093500SV
LU WWN Device Id: 5 002303 110245493
Firmware Version: C28110B
User Capacity:    256,060,514,304 bytes [256 GB]
Sector Size:      512 bytes logical/physical
Rotation Rate:    Solid State Device
Form Factor:      M.2
Device is:        Not in smartctl database [for details use: -P showall]
ATA Version is:   ACS-2 (minor revision not indicated)
SATA Version is:  SATA 3.1, 6.0 Gb/s (current: 6.0 Gb/s)
Local Time is:    Tue Nov  8 23:36:09 2022 UTC
SMART support is: Available - device has SMART capability.
SMART support is: Enabled
AAM feature is:   Disabled
APM feature is:   Unavailable
Rd look-ahead is: Enabled
Write cache is:   Enabled
ATA Security is:  Disabled, NOT FROZEN [SEC1]
Wt Cache Reorder: Unknown

=== START OF READ SMART DATA SECTION ===
SMART overall-health self-assessment test result: PASSED

General SMART Values:
Offline data collection status:  (0x80)	Offline data collection activity
					was never started.
					Auto Offline Data Collection: Enabled.
Self-test execution status:      ( 244)	Self-test routine in progress...
					40% of test remaining.
Total time to complete Offline 
data collection: 		(  480) seconds.
Offline data collection
capabilities: 			 (0x11) SMART execute Offline immediate.
					No Auto Offline data collection support.
					Suspend Offline collection upon new
					command.
					No Offline surface scan supported.
					Self-test supported.
					No Conveyance Self-test supported.
					No Selective Self-test supported.
SMART capabilities:            (0x0003)	Saves SMART data before entering
					power-saving mode.
					Supports SMART auto save timer.
Error logging capability:        (0x01)	Error logging supported.
					General Purpose Logging supported.
Short self-test routine 
recommended polling time: 	 (   1) minutes.
Extended self-test routine
recommended polling time: 	 (   8) minutes.
SCT capabilities: 	       (0x003d)	SCT Status supported.
					SCT Error Recovery Control supported.
					SCT Feature Control supported.
					SCT Data Table supported.

SMART Attributes Data Structure revision number: 1
Vendor Specific SMART Attributes with Thresholds:
ID# ATTRIBUTE_NAME          FLAGS    VALUE WORST THRESH FAIL RAW_VALUE
  5 Reallocated_Sector_Ct   PO----   100   100   000    -    0
  9 Power_On_Hours          -O----   100   100   000    -    183
 12 Power_Cycle_Count       PO----   100   100   000    -    688
175 Program_Fail_Count_Chip PO----   100   100   000    -    0
176 Erase_Fail_Count_Chip   PO----   100   100   000    -    0
177 Wear_Leveling_Count     PO----   100   100   000    -    15
178 Used_Rsvd_Blk_Cnt_Chip  PO----   100   100   000    -    0
179 Used_Rsvd_Blk_Cnt_Tot   PO----   100   100   000    -    0
180 Unused_Rsvd_Blk_Cnt_Tot PO----   100   100   005    -    86
181 Program_Fail_Cnt_Total  PO----   100   100   000    -    0
182 Erase_Fail_Count_Total  PO----   100   100   000    -    0
187 Reported_Uncorrect      PO----   100   100   000    -    0
194 Temperature_Celsius     -O----   100   100   000    -    44
195 Hardware_ECC_Recovered  PO----   100   100   000    -    0
199 UDMA_CRC_Error_Count    PO----   100   100   000    -    0
238 Unknown_Attribute       PO----   100   100   000    -    100
241 Total_LBAs_Written      PO----   100   100   000    -    3890189244
242 Total_LBAs_Read         PO----   100   100   000    -    3912940048
                            ||||||_ K auto-keep
                            |||||__ C event count
                            ||||___ R error rate
                            |||____ S speed/performance
                            ||_____ O updated online
                            |______ P prefailure warning

General Purpose Log Directory Version 1
SMART           Log Directory Version 1 [multi-sector log support]
Address    Access  R/W   Size  Description
0x00       GPL,SL  R/O      1  Log Directory
0x01       GPL,SL  R/O      1  Summary SMART error log
0x02       GPL,SL  R/O      1  Comprehensive SMART error log
0x03       GPL,SL  R/O      1  Ext. Comprehensive SMART error log
0x04       GPL,SL  R/O      8  Device Statistics log
0x06       GPL,SL  R/O      1  SMART self-test log
0x07       GPL,SL  R/O      1  Extended self-test log
0x09       GPL,SL  R/W      1  Selective self-test log
0x10       GPL,SL  R/O      1  SATA NCQ Queued Error log
0x11       GPL,SL  R/O      1  SATA Phy Event Counters log
0x30       GPL,SL  R/O      9  IDENTIFY DEVICE data log
0x80-0x9f  GPL,SL  R/W     16  Host vendor specific log
0xe0       GPL,SL  R/W      1  SCT Command/Status
0xe1       GPL,SL  R/W      1  SCT Data Transfer

SMART Extended Comprehensive Error Log Version: 1 (1 sectors)
No Errors Logged

SMART Extended Self-test Log Version: 1 (1 sectors)
Num  Test_Description    Status                  Remaining  LifeTime(hours)  LBA_of_first_error
# 1  Short offline       Completed without error       00%       183         -
# 2  Extended offline    Completed without error       00%       159         -
# 3  Short offline       Completed without error       00%       159         -
# 4  Extended offline    Completed without error       00%       155         -
# 5  Short offline       Completed without error       00%       155         -
# 6  Extended offline    Completed without error       00%       151         -
# 7  Extended offline    Completed without error       00%       151         -
# 8  Short offline       Completed without error       00%       150         -
# 9  Short offline       Completed without error       00%       150         -
#10  Short offline       Completed without error       00%        52         -

Selective Self-tests/Logging not supported

SCT Status Version:                  3
SCT Version (vendor specific):       0 (0x0000)
SCT Support Level:                   0
Device State:                        Active (0)
Current Temperature:                    41 Celsius
Power Cycle Min/Max Temperature:     26/41 Celsius
Lifetime    Min/Max Temperature:      0/56 Celsius
Under/Over Temperature Limit Count:   0/0

SCT Temperature History Version:     2
Temperature Sampling Period:         1 minute
Temperature Logging Interval:        1 minute
Min/Max recommended Temperature:      0/100 Celsius
Min/Max Temperature Limit:            0/100 Celsius
Temperature History Size (Index):    128 (3)

Index    Estimated Time   Temperature Celsius
   4    2022-11-08 21:29    34  ***************
 ...    ..( 11 skipped).    ..  ***************
  16    2022-11-08 21:41    34  ***************
  17    2022-11-08 21:42    33  **************
  18    2022-11-08 21:43    25  ******
  19    2022-11-08 21:44    25  ******
  20    2022-11-08 21:45     ?  -
  21    2022-11-08 21:46    46  ***************************
  22    2022-11-08 21:47    38  *******************
  23    2022-11-08 21:48    46  ***************************
  24    2022-11-08 21:49    33  **************
  25    2022-11-08 21:50    34  ***************
  26    2022-11-08 21:51    25  ******
  27    2022-11-08 21:52    36  *****************
  28    2022-11-08 21:53    34  ***************
  29    2022-11-08 21:54    25  ******
  30    2022-11-08 21:55    25  ******
  31    2022-11-08 21:56    25  ******
  32    2022-11-08 21:57     ?  -
  33    2022-11-08 21:58    36  *****************
  34    2022-11-08 21:59    38  *******************
  35    2022-11-08 22:00    25  ******
  36    2022-11-08 22:01    34  ***************
  37    2022-11-08 22:02    34  ***************
  38    2022-11-08 22:03    25  ******
  39    2022-11-08 22:04    25  ******
  40    2022-11-08 22:05    34  ***************
  41    2022-11-08 22:06    25  ******
  42    2022-11-08 22:07    25  ******
  43    2022-11-08 22:08    34  ***************
  44    2022-11-08 22:09    34  ***************
  45    2022-11-08 22:10    25  ******
  46    2022-11-08 22:11    34  ***************
 ...    ..(  3 skipped).    ..  ***************
  50    2022-11-08 22:15    34  ***************
  51    2022-11-08 22:16    28  *********
  52    2022-11-08 22:17    25  ******
  53    2022-11-08 22:18    25  ******
  54    2022-11-08 22:19    32  *************
  55    2022-11-08 22:20    25  ******
 ...    ..(  2 skipped).    ..  ******
  58    2022-11-08 22:23    25  ******
  59    2022-11-08 22:24    34  ***************
  60    2022-11-08 22:25    25  ******
  61    2022-11-08 22:26    25  ******
  62    2022-11-08 22:27    34  ***************
  63    2022-11-08 22:28    34  ***************
  64    2022-11-08 22:29    34  ***************
  65    2022-11-08 22:30    25  ******
 ...    ..(  6 skipped).    ..  ******
  72    2022-11-08 22:37    25  ******
  73    2022-11-08 22:38    34  ***************
 ...    ..(  2 skipped).    ..  ***************
  76    2022-11-08 22:41    34  ***************
  77    2022-11-08 22:42    25  ******
  78    2022-11-08 22:43    29  **********
  79    2022-11-08 22:44    34  ***************
  80    2022-11-08 22:45    34  ***************
  81    2022-11-08 22:46    36  *****************
  82    2022-11-08 22:47    33  **************
  83    2022-11-08 22:48    28  *********
  84    2022-11-08 22:49    29  **********
  85    2022-11-08 22:50    36  *****************
  86    2022-11-08 22:51    25  ******
  87    2022-11-08 22:52    28  *********
  88    2022-11-08 22:53    34  ***************
  89    2022-11-08 22:54    25  ******
  90    2022-11-08 22:55    34  ***************
  91    2022-11-08 22:56    33  **************
  92    2022-11-08 22:57    25  ******
  93    2022-11-08 22:58    34  ***************
  94    2022-11-08 22:59    34  ***************
  95    2022-11-08 23:00     ?  -
  96    2022-11-08 23:01    33  **************
  97    2022-11-08 23:02    33  **************
  98    2022-11-08 23:03    34  ***************
  99    2022-11-08 23:04    34  ***************
 100    2022-11-08 23:05     ?  -
 101    2022-11-08 23:06    33  **************
 102    2022-11-08 23:07     ?  -
 103    2022-11-08 23:08    32  *************
 104    2022-11-08 23:09     ?  -
 105    2022-11-08 23:10    32  *************
 106    2022-11-08 23:11     ?  -
 107    2022-11-08 23:12    29  **********
 108    2022-11-08 23:13     ?  -
 109    2022-11-08 23:14    32  *************
 110    2022-11-08 23:15     ?  -
 111    2022-11-08 23:16    32  *************
 112    2022-11-08 23:17     ?  -
 113    2022-11-08 23:18    29  **********
 114    2022-11-08 23:19     ?  -
 115    2022-11-08 23:20    29  **********
 116    2022-11-08 23:21     ?  -
 117    2022-11-08 23:22    29  **********
 118    2022-11-08 23:23     ?  -
 119    2022-11-08 23:24    29  **********
 120    2022-11-08 23:25     ?  -
 121    2022-11-08 23:26    29  **********
 122    2022-11-08 23:27     ?  -
 123    2022-11-08 23:28    29  **********
 124    2022-11-08 23:29     ?  -
 125    2022-11-08 23:30    29  **********
 126    2022-11-08 23:31    29  **********
 127    2022-11-08 23:32    36  *****************
   0    2022-11-08 23:33     ?  -
   1    2022-11-08 23:34    40  *********************
   2    2022-11-08 23:35    41  **********************
   3    2022-11-08 23:36    41  **********************

SCT Error Recovery Control:
           Read: Disabled
          Write: Disabled

Device Statistics (GP Log 0x04)
Page  Offset Size        Value Flags Description
0x01  =====  =               =  ===  == General Statistics (rev 1) ==
0x01  0x008  4             688  ---  Lifetime Power-On Resets
0x01  0x010  4             183  ---  Power-on Hours
0x01  0x018  6      3890189244  ---  Logical Sectors Written
0x01  0x020  6        51489122  ---  Number of Write Commands
0x01  0x028  6      3912940048  ---  Logical Sectors Read
0x01  0x030  6        74385415  ---  Number of Read Commands
0x04  =====  =               =  ===  == General Errors Statistics (rev 1) ==
0x04  0x008  4               0  ---  Number of Reported Uncorrectable Errors
0x04  0x010  4           72120  ---  Resets Between Cmd Acceptance and Completion
0x05  =====  =               =  ===  == Temperature Statistics (invalid page 0x2c in header) ==
0x06  =====  =               =  ===  == Transport Statistics (rev 1) ==
0x06  0x008  4           29403  ---  Number of Hardware Resets
0x06  0x018  4               0  ---  Number of Interface CRC Errors
0x07  =====  =               =  ===  == Solid State Device Statistics (rev 1) ==
0x07  0x008  1               0  ---  Percentage Used Endurance Indicator
                                |||_ C monitored condition met
                                ||__ D supports DSN
                                |___ N normalized value

SATA Phy Event Counters (GP Log 0x11)
ID      Size     Value  Description
0x0001  2            0  Command failed due to ICRC error
0x0002  2            0  R_ERR response for data FIS
0x0003  2            0  R_ERR response for device-to-host data FIS
0x0004  2            0  R_ERR response for host-to-device data FIS
0x0005  2            0  R_ERR response for non-data FIS
0x0006  2            0  R_ERR response for device-to-host non-data FIS
0x0007  2            0  R_ERR response for host-to-device non-data FIS
0x0008  2            0  Device-to-host non-data FIS retries
0x0009  2            0  Transition from drive PhyRdy to drive PhyNRdy
0x000a  2            3  Device-to-host register FISes sent due to a COMRESET
0x000b  2            0  CRC errors within host-to-device FIS
0x000d  2            0  Non-CRC errors within host-to-device FIS
0x000f  2            0  R_ERR response for host-to-device data FIS, CRC
0x0010  2            0  R_ERR response for host-to-device data FIS, non-CRC
0x0012  2            0  R_ERR response for host-to-device non-data FIS, CRC
0x0013  2            0  R_ERR response for host-to-device non-data FIS, non-CRC

