smartctl 6.6 2016-05-31 r4324 [x86_64-linux-4.18.0-10-generic] (local build)
Copyright (C) 2002-16, Bruce Allen, Christian Franke, www.smartmontools.org

Warning: DEFAULT entry missing in drive database file(s)
=== START OF INFORMATION SECTION ===
Device Model:     CT500MX500SSD1
Serial Number:    1826E1466CB5
LU WWN Device Id: 5 00a075 1e1466cb5
Firmware Version: M3CR020
User Capacity:    500.107.862.016 bytes [500 GB]
Sector Sizes:     512 bytes logical, 4096 bytes physical
Rotation Rate:    Solid State Device
Form Factor:      2.5 inches
Device is:        Not in smartctl database [for details use: -P showall]
ATA Version is:   ACS-3 T13/2161-D revision 5
SATA Version is:  SATA >3.2 (0x1ff), 6.0 Gb/s (current: 3.0 Gb/s)
Local Time is:    Wed Nov 14 11:16:11 2018 CET
SMART support is: Available - device has SMART capability.
SMART support is: Enabled
AAM feature is:   Unavailable
APM level is:     254 (maximum performance)
Rd look-ahead is: Enabled
Write cache is:   Enabled
ATA Security is:  Disabled, NOT FROZEN [SEC1]
Wt Cache Reorder: Unknown

=== START OF READ SMART DATA SECTION ===
SMART overall-health self-assessment test result: PASSED

General SMART Values:
Offline data collection status:  (0x82)	Offline data collection activity
					was completed without error.
					Auto Offline Data Collection: Enabled.
Self-test execution status:      (   0)	The previous self-test routine completed
					without error or no self-test has ever 
					been run.
Total time to complete Offline 
data collection: 		(    0) seconds.
Offline data collection
capabilities: 			 (0x7b) SMART execute Offline immediate.
					Auto Offline data collection on/off support.
					Suspend Offline collection upon new
					command.
					Offline surface scan supported.
					Self-test supported.
					Conveyance Self-test supported.
					Selective Self-test supported.
SMART capabilities:            (0x0003)	Saves SMART data before entering
					power-saving mode.
					Supports SMART auto save timer.
Error logging capability:        (0x01)	Error logging supported.
					General Purpose Logging supported.
Short self-test routine 
recommended polling time: 	 (   2) minutes.
Extended self-test routine
recommended polling time: 	 (  30) minutes.
Conveyance self-test routine
recommended polling time: 	 (   2) minutes.
SCT capabilities: 	       (0x0031)	SCT Status supported.
					SCT Feature Control supported.
					SCT Data Table supported.

SMART Attributes Data Structure revision number: 16
Vendor Specific SMART Attributes with Thresholds:
ID# ATTRIBUTE_NAME          FLAGS    VALUE WORST THRESH FAIL RAW_VALUE
  1 Raw_Read_Error_Rate     POSR-K   100   100   000    -    0
  5 Reallocated_Sector_Ct   -O--CK   100   100   010    -    0
  9 Power_On_Hours          -O--CK   100   100   000    -    85
 12 Power_Cycle_Count       -O--CK   100   100   000    -    115
171 Unknown_Attribute       -O--CK   100   100   000    -    0
172 Unknown_Attribute       -O--CK   100   100   000    -    0
173 Unknown_Attribute       -O--CK   100   100   000    -    2
174 Unknown_Attribute       -O--CK   100   100   000    -    3
180 Unused_Rsvd_Blk_Cnt_Tot PO--CK   000   000   000    -    45
183 Runtime_Bad_Block       -O--CK   100   100   000    -    115
184 End-to-End_Error        -O--CK   100   100   000    -    0
187 Reported_Uncorrect      -O--CK   100   100   000    -    0
194 Temperature_Celsius     -O---K   069   041   000    -    31 (Min/Max 0/59)
196 Reallocated_Event_Count -O--CK   100   100   000    -    0
197 Current_Pending_Sector  -O--CK   100   100   000    -    0
198 Offline_Uncorrectable   ----CK   100   100   000    -    0
199 UDMA_CRC_Error_Count    -O--CK   100   100   000    -    0
202 Unknown_SSD_Attribute   ----CK   100   100   001    -    0
206 Unknown_SSD_Attribute   -OSR--   100   100   000    -    0
210 Unknown_Attribute       -O--CK   100   100   000    -    0
246 Unknown_Attribute       -O--CK   100   100   000    -    700891796
247 Unknown_Attribute       -O--CK   100   100   000    -    12191194
248 Unknown_Attribute       -O--CK   100   100   000    -    10203030
                            ||||||_ K auto-keep
                            |||||__ C event count
                            ||||___ R error rate
                            |||____ S speed/performance
                            ||_____ O updated online
                            |______ P prefailure warning

General Purpose Log Directory Version 1
SMART           Log Directory Version 1 [multi-sector log support]
Address    Access  R/W   Size  Description
0x00       GPL,SL  R/O      1  Log Directory
0x01           SL  R/O      1  Summary SMART error log
0x02           SL  R/O      1  Comprehensive SMART error log
0x03       GPL     R/O      1  Ext. Comprehensive SMART error log
0x04       GPL,SL  R/O      8  Device Statistics log
0x06           SL  R/O      1  SMART self-test log
0x07       GPL     R/O      1  Extended self-test log
0x09           SL  R/W      1  Selective self-test log
0x10       GPL     R/O      1  SATA NCQ Queued Error log
0x11       GPL     R/O      1  SATA Phy Event Counters log
0x24       GPL     R/O     88  Current Device Internal Status Data log
0x25       GPL     R/O     64  Saved Device Internal Status Data log
0x30       GPL,SL  R/O      9  IDENTIFY DEVICE data log
0x80-0x9f  GPL,SL  R/W     16  Host vendor specific log
0xe0       GPL,SL  R/W      1  SCT Command/Status
0xe1       GPL,SL  R/W      1  SCT Data Transfer

SMART Extended Comprehensive Error Log Version: 1 (1 sectors)
No Errors Logged

SMART Extended Self-test Log Version: 1 (1 sectors)
Num  Test_Description    Status                  Remaining  LifeTime(hours)  LBA_of_first_error
# 1  Short offline       Completed without error       00%        85         -

SMART Selective self-test log data structure revision number 1
 SPAN  MIN_LBA  MAX_LBA  CURRENT_TEST_STATUS
    1        0        0  Not_testing
    2        0        0  Not_testing
    3        0        0  Not_testing
    4        0        0  Not_testing
    5        0        0  Not_testing
Selective self-test flags (0x0):
  After scanning selected spans, do NOT read-scan remainder of disk.
If Selective self-test is pending on power-up, resume after 0 minute delay.

SCT Status Version:                  3
SCT Version (vendor specific):       1 (0x0001)
SCT Support Level:                   0
Device State:                        Active (0)
Current Temperature:                    33 Celsius
Power Cycle Min/Max Temperature:     26/43 Celsius
Lifetime    Min/Max Temperature:      0/59 Celsius
Under/Over Temperature Limit Count:   0/0

SCT Temperature History Version:     2
Temperature Sampling Period:         1 minute
Temperature Logging Interval:        1 minute
Min/Max recommended Temperature:      0/100 Celsius
Min/Max Temperature Limit:            0/100 Celsius
Temperature History Size (Index):    128 (39)

Index    Estimated Time   Temperature Celsius
  40    2018-11-14 09:09    26  *******
 ...    ..(  4 skipped).    ..  *******
  45    2018-11-14 09:14    26  *******
  46    2018-11-14 09:15    28  *********
  47    2018-11-14 09:16    26  *******
  48    2018-11-14 09:17    26  *******
  49    2018-11-14 09:18    28  *********
  50    2018-11-14 09:19    28  *********
  51    2018-11-14 09:20    28  *********
  52    2018-11-14 09:21    33  **************
  53    2018-11-14 09:22    28  *********
  54    2018-11-14 09:23    28  *********
  55    2018-11-14 09:24    28  *********
  56    2018-11-14 09:25    29  **********
 ...    ..(  9 skipped).    ..  **********
  66    2018-11-14 09:35    29  **********
  67    2018-11-14 09:36    40  *********************
  68    2018-11-14 09:37    31  ************
  69    2018-11-14 09:38    29  **********
 ...    ..(  2 skipped).    ..  **********
  72    2018-11-14 09:41    29  **********
  73    2018-11-14 09:42    31  ************
  74    2018-11-14 09:43    31  ************
  75    2018-11-14 09:44    31  ************
  76    2018-11-14 09:45    38  *******************
  77    2018-11-14 09:46    31  ************
  78    2018-11-14 09:47    31  ************
  79    2018-11-14 09:48    31  ************
  80    2018-11-14 09:49    40  *********************
  81    2018-11-14 09:50    41  **********************
  82    2018-11-14 09:51    43  ************************
  83    2018-11-14 09:52    43  ************************
  84    2018-11-14 09:53    33  **************
 ...    ..(  2 skipped).    ..  **************
  87    2018-11-14 09:56    33  **************
  88    2018-11-14 09:57    31  ************
 ...    ..(  7 skipped).    ..  ************
  96    2018-11-14 10:05    31  ************
  97    2018-11-14 10:06    33  **************
 ...    ..( 18 skipped).    ..  **************
 116    2018-11-14 10:25    33  **************
 117    2018-11-14 10:26    41  **********************
 118    2018-11-14 10:27    40  *********************
 119    2018-11-14 10:28    33  **************
 120    2018-11-14 10:29    33  **************
 121    2018-11-14 10:30    33  **************
 122    2018-11-14 10:31    43  ************************
 123    2018-11-14 10:32    33  **************
 124    2018-11-14 10:33    31  ************
 125    2018-11-14 10:34    31  ************
 126    2018-11-14 10:35    29  **********
 ...    ..(  5 skipped).    ..  **********
   4    2018-11-14 10:41    29  **********
   5    2018-11-14 10:42    28  *********
   6    2018-11-14 10:43     ?  -
   7    2018-11-14 10:44     ?  -
   8    2018-11-14 10:45    21  **
   9    2018-11-14 10:46    21  **
  10    2018-11-14 10:47    29  **********
  11    2018-11-14 10:48    33  **************
  12    2018-11-14 10:49    33  **************
  13    2018-11-14 10:50    24  *****
  14    2018-11-14 10:51     ?  -
  15    2018-11-14 10:52     ?  -
  16    2018-11-14 10:53    29  **********
  17    2018-11-14 10:54    26  *******
  18    2018-11-14 10:55    26  *******
  19    2018-11-14 10:56    33  **************
  20    2018-11-14 10:57    36  *****************
  21    2018-11-14 10:58    29  **********
  22    2018-11-14 10:59    28  *********
  23    2018-11-14 11:00    28  *********
  24    2018-11-14 11:01    29  **********
  25    2018-11-14 11:02    28  *********
  26    2018-11-14 11:03    28  *********
  27    2018-11-14 11:04    28  *********
  28    2018-11-14 11:05    29  **********
 ...    ..(  2 skipped).    ..  **********
  31    2018-11-14 11:08    29  **********
  32    2018-11-14 11:09    31  ************
  33    2018-11-14 11:10    29  **********
  34    2018-11-14 11:11    29  **********
  35    2018-11-14 11:12    29  **********
  36    2018-11-14 11:13    41  **********************
  37    2018-11-14 11:14    31  ************
  38    2018-11-14 11:15    31  ************
  39    2018-11-14 11:16    31  ************

SCT Error Recovery Control command not supported

Device Statistics (GP Log 0x04)
Page  Offset Size        Value Flags Description
0x01  =====  =               =  ===  == General Statistics (rev 1) ==
0x01  0x008  4             115  ---  Lifetime Power-On Resets
0x01  0x010  4              85  ---  Power-on Hours
0x01  0x018  6       700891796  ---  Logical Sectors Written
0x01  0x020  6         6898374  ---  Number of Write Commands
0x01  0x028  6       395715312  ---  Logical Sectors Read
0x01  0x030  6         4953908  ---  Number of Read Commands
0x01  0x038  6      4294967296  ---  Date and Time TimeStamp
0x04  =====  =               =  ===  == General Errors Statistics (rev 1) ==
0x04  0x008  4               0  ---  Number of Reported Uncorrectable Errors
0x04  0x010  4               3  ---  Resets Between Cmd Acceptance and Completion
0x05  =====  =               =  ===  == Temperature Statistics (rev 1) ==
0x05  0x008  1              33  ---  Current Temperature
0x05  0x010  1              30  ---  Average Short Term Temperature
0x05  0x018  1              30  ---  Average Long Term Temperature
0x05  0x020  1              59  ---  Highest Temperature
0x05  0x028  1               0  ---  Lowest Temperature
0x05  0x030  1              48  ---  Highest Average Short Term Temperature
0x05  0x038  1               0  ---  Lowest Average Short Term Temperature
0x05  0x040  1              43  ---  Highest Average Long Term Temperature
0x05  0x048  1               0  ---  Lowest Average Long Term Temperature
0x05  0x050  4               0  ---  Time in Over-Temperature
0x05  0x058  1              70  ---  Specified Maximum Operating Temperature
0x05  0x060  4               0  ---  Time in Under-Temperature
0x05  0x068  1               0  ---  Specified Minimum Operating Temperature
0x06  =====  =               =  ===  == Transport Statistics (rev 1) ==
0x06  0x008  4             737  ---  Number of Hardware Resets
0x06  0x010  4              76  ---  Number of ASR Events
0x06  0x018  4               0  ---  Number of Interface CRC Errors
0x07  =====  =               =  ===  == Solid State Device Statistics (rev 1) ==
0x07  0x008  1               0  ---  Percentage Used Endurance Indicator
                                |||_ C monitored condition met
                                ||__ D supports DSN
                                |___ N normalized value

SATA Phy Event Counters (GP Log 0x11)
ID      Size     Value  Description
0x0001  2            0  Command failed due to ICRC error
0x0002  2            0  R_ERR response for data FIS
0x0003  2            0  R_ERR response for device-to-host data FIS
0x0004  2            0  R_ERR response for host-to-device data FIS
0x0005  2            0  R_ERR response for non-data FIS
0x0006  2            0  R_ERR response for device-to-host non-data FIS
0x0007  2            0  R_ERR response for host-to-device non-data FIS
0x0008  2            0  Device-to-host non-data FIS retries
0x0009  2            0  Transition from drive PhyRdy to drive PhyNRdy
0x000a  2            4  Device-to-host register FISes sent due to a COMRESET
0x000b  2            0  CRC errors within host-to-device FIS
0x000d  2            0  Non-CRC errors within host-to-device FIS
0x000f  2            0  R_ERR response for host-to-device data FIS, CRC
0x0010  2            0  R_ERR response for host-to-device data FIS, non-CRC
0x0012  2            0  R_ERR response for host-to-device non-data FIS, CRC
0x0013  2            0  R_ERR response for host-to-device non-data FIS, non-CRC

