smartctl 7.1 2019-12-30 r5022 [x86_64-w64-mingw32-w10-1909] (sf-7.1-1)
Copyright (C) 2002-19, Bruce Allen, Christian Franke, www.smartmontools.org

=== START OF INFORMATION SECTION ===
Device Model:     MTFDDAK256MBF-1AN1ZABHA
Firmware Version: M603
User Capacity:    256 060 514 304 bytes [256 GB]
Sector Size:      512 bytes logical/physical
Rotation Rate:    Solid State Device
Form Factor:      2.5 inches
Device is:        Not in smartctl database [for details use: -P showall]
ATA Version is:   ACS-3 T13/2161-D revision 4
SATA Version is:  SATA 3.2, 6.0 Gb/s (current: 6.0 Gb/s)
Local Time is:    Tue Dec 31 07:42:58 2019 WEST
SMART support is: Available - device has SMART capability.
SMART support is: Enabled
AAM feature is:   Unavailable
APM level is:     254 (maximum performance)
Rd look-ahead is: Enabled
Write cache is:   Enabled
DSN feature is:   Unavailable
ATA Security is:  Disabled, frozen [SEC2]
Wt Cache Reorder: Enabled

=== START OF READ SMART DATA SECTION ===
SMART overall-health self-assessment test result: PASSED

General SMART Values:
Offline data collection status:  (0x80)	Offline data collection activity
					was never started.
					Auto Offline Data Collection: Enabled.
Self-test execution status:      (   0)	The previous self-test routine completed
					without error or no self-test has ever 
					been run.
Total time to complete Offline 
data collection: 		(  550) seconds.
Offline data collection
capabilities: 			 (0x5b) SMART execute Offline immediate.
					Auto Offline data collection on/off support.
					Suspend Offline collection upon new
					command.
					Offline surface scan supported.
					Self-test supported.
					No Conveyance Self-test supported.
					Selective Self-test supported.
SMART capabilities:            (0x0003)	Saves SMART data before entering
					power-saving mode.
					Supports SMART auto save timer.
Error logging capability:        (0x01)	Error logging supported.
					General Purpose Logging supported.
Short self-test routine 
recommended polling time: 	 (   2) minutes.
Extended self-test routine
recommended polling time: 	 (  12) minutes.
SCT capabilities: 	       (0x0035)	SCT Status supported.
					SCT Feature Control supported.
					SCT Data Table supported.

SMART Attributes Data Structure revision number: 32
Vendor Specific SMART Attributes with Thresholds:
ID# ATTRIBUTE_NAME          FLAGS    VALUE WORST THRESH FAIL RAW_VALUE
  1 Raw_Read_Error_Rate     POSR-K   100   100   050    -    0
  5 Reallocated_Sector_Ct   PO--CK   100   100   010    -    0
  9 Power_On_Hours          -O--CK   100   100   000    -    1334
 11 Unknown_SSD_Attribute   -O---K   100   100   000    -    17
 12 Power_Cycle_Count       -O--CK   100   100   000    -    764
171 Unknown_Attribute       -O---K   100   100   000    -    0
172 Unknown_Attribute       -O--CK   100   100   000    -    0
173 Unknown_Attribute       PO--CK   094   094   010    -    208
174 Unknown_Attribute       -O--CK   100   100   000    -    17
181 Program_Fail_Cnt_Total  -O---K   100   100   000    -    8126136583144
183 Runtime_Bad_Block       -O--CK   100   100   000    -    0
184 End-to-End_Error        PO--CK   100   100   097    -    0
187 Reported_Uncorrect      -O--CK   100   100   000    -    0
188 Command_Timeout         -O--CK   100   100   000    -    749
194 Temperature_Celsius     -O---K   068   057   000    -    32 (Min/Max 9/43)
196 Reallocated_Event_Count -O--CK   100   100   000    -    0
198 Offline_Uncorrectable   ----CK   100   100   000    -    0
199 UDMA_CRC_Error_Count    -O---K   100   100   000    -    0
                            ||||||_ K auto-keep
                            |||||__ C event count
                            ||||___ R error rate
                            |||____ S speed/performance
                            ||_____ O updated online
                            |______ P prefailure warning

General Purpose Log Directory Version 1
SMART           Log Directory Version 1 [multi-sector log support]
Address    Access  R/W   Size  Description
0x00       GPL,SL  R/O      1  Log Directory
0x01           SL  R/O      1  Summary SMART error log
0x02           SL  R/O     51  Comprehensive SMART error log
0x03       GPL     R/O  16383  Ext. Comprehensive SMART error log
0x04       GPL,SL  R/O      8  Device Statistics log
0x06           SL  R/O      1  SMART self-test log
0x07       GPL     R/O      1  Extended self-test log
0x09           SL  R/W      1  Selective self-test log
0x10       GPL     R/O      1  NCQ Command Error log
0x11       GPL     R/O      1  SATA Phy Event Counters log
0x13       GPL     R/O      1  SATA NCQ Send and Receive log
0x24       GPL     R/O  16000  Current Device Internal Status Data log
0x25       GPL     R/O  16000  Saved Device Internal Status Data log
0x30       GPL,SL  R/O      9  IDENTIFY DEVICE data log
0x80-0x9f  GPL,SL  R/W     16  Host vendor specific log
0xa0       GPL     VS    2000  Device vendor specific log
0xa0       SL      VS     208  Device vendor specific log
0xa1-0xb5  GPL,SL  VS       1  Device vendor specific log
0xb6       GPL     VS    8193  Device vendor specific log
0xb7-0xbf  GPL,SL  VS       1  Device vendor specific log
0xc0       GPL,SL  VS      80  Device vendor specific log
0xc1-0xdf  GPL,SL  VS       1  Device vendor specific log
0xe0       GPL,SL  R/W      1  SCT Command/Status
0xe1       GPL,SL  R/W      1  SCT Data Transfer

SMART Extended Comprehensive Error Log Version: 1 (16383 sectors)
No Errors Logged

SMART Extended Self-test Log Version: 1 (1 sectors)
Num  Test_Description    Status                  Remaining  LifeTime(hours)  LBA_of_first_error
# 1  Short offline       Completed without error       00%      1334         -
# 2  Vendor (0xff)       Completed without error       00%      1324         -
# 3  Vendor (0xff)       Completed without error       00%      1259         -
# 4  Vendor (0xff)       Completed without error       00%      1226         -
# 5  Vendor (0xff)       Completed without error       00%      1176         -
# 6  Vendor (0xff)       Completed without error       00%      1135         -
# 7  Vendor (0xff)       Completed without error       00%      1040         -
# 8  Vendor (0xff)       Completed without error       00%      1025         -
# 9  Vendor (0xff)       Completed without error       00%       998         -
#10  Vendor (0xff)       Completed without error       00%       984         -
#11  Vendor (0xff)       Completed without error       00%       969         -

SMART Selective self-test log data structure revision number 1
 SPAN  MIN_LBA  MAX_LBA  CURRENT_TEST_STATUS
    1        0        0  Not_testing
    2        0        0  Not_testing
    3        0        0  Completed [00% left] (57881389-57946924)
    4        0        0  Not_testing
    5        0        0  Not_testing
Selective self-test flags (0x0):
  After scanning selected spans, do NOT read-scan remainder of disk.
If Selective self-test is pending on power-up, resume after 0 minute delay.

SCT Status Version:                  3
SCT Version (vendor specific):       1 (0x0001)
Device State:                        Active (0)
Current Temperature:                    32 Celsius
Power Cycle Min/Max Temperature:     23/33 Celsius
Lifetime    Min/Max Temperature:      9/43 Celsius
Specified Max Operating Temperature:    70 Celsius
Under/Over Temperature Limit Count:   0/0

SCT Temperature History Version:     2
Temperature Sampling Period:         1 minute
Temperature Logging Interval:        1 minute
Min/Max recommended Temperature:      0/70 Celsius
Min/Max Temperature Limit:           -5/75 Celsius
Temperature History Size (Index):    478 (252)

Index    Estimated Time   Temperature Celsius
 253    2019-12-30 23:45    35  ****************
 ...    ..(  4 skipped).    ..  ****************
 258    2019-12-30 23:50    35  ****************
 259    2019-12-30 23:51     ?  -
 260    2019-12-30 23:52    34  ***************
 ...    ..(  4 skipped).    ..  ***************
 265    2019-12-30 23:57    34  ***************
 266    2019-12-30 23:58     ?  -
 267    2019-12-30 23:59     ?  -
 268    2019-12-31 00:00    24  *****
 269    2019-12-31 00:01    25  ******
 270    2019-12-31 00:02    28  *********
 271    2019-12-31 00:03    31  ************
 272    2019-12-31 00:04    32  *************
 273    2019-12-31 00:05    32  *************
 274    2019-12-31 00:06    31  ************
 275    2019-12-31 00:07    32  *************
 276    2019-12-31 00:08    31  ************
 277    2019-12-31 00:09    31  ************
 278    2019-12-31 00:10    30  ***********
 ...    ..(  4 skipped).    ..  ***********
 283    2019-12-31 00:15    30  ***********
 284    2019-12-31 00:16    31  ************
 ...    ..(  5 skipped).    ..  ************
 290    2019-12-31 00:22    31  ************
 291    2019-12-31 00:23    32  *************
 ...    ..(  8 skipped).    ..  *************
 300    2019-12-31 00:32    32  *************
 301    2019-12-31 00:33     ?  -
 302    2019-12-31 00:34    31  ************
 ...    ..(  6 skipped).    ..  ************
 309    2019-12-31 00:41    31  ************
 310    2019-12-31 00:42    32  *************
 ...    ..(  9 skipped).    ..  *************
 320    2019-12-31 00:52    32  *************
 321    2019-12-31 00:53    33  **************
 ...    ..( 11 skipped).    ..  **************
 333    2019-12-31 01:05    33  **************
 334    2019-12-31 01:06    34  ***************
 ...    ..(  4 skipped).    ..  ***************
 339    2019-12-31 01:11    34  ***************
 340    2019-12-31 01:12     ?  -
 341    2019-12-31 01:13    31  ************
 ...    ..( 11 skipped).    ..  ************
 353    2019-12-31 01:25    31  ************
 354    2019-12-31 01:26    32  *************
 ...    ..(  9 skipped).    ..  *************
 364    2019-12-31 01:36    32  *************
 365    2019-12-31 01:37    33  **************
 ...    ..(  4 skipped).    ..  **************
 370    2019-12-31 01:42    33  **************
 371    2019-12-31 01:43     ?  -
 372    2019-12-31 01:44    30  ***********
 ...    ..(  8 skipped).    ..  ***********
 381    2019-12-31 01:53    30  ***********
 382    2019-12-31 01:54    31  ************
 ...    ..(  6 skipped).    ..  ************
 389    2019-12-31 02:01    31  ************
 390    2019-12-31 02:02    32  *************
 ...    ..(  7 skipped).    ..  *************
 398    2019-12-31 02:10    32  *************
 399    2019-12-31 02:11    33  **************
 400    2019-12-31 02:12    33  **************
 401    2019-12-31 02:13     ?  -
 402    2019-12-31 02:14    32  *************
 403    2019-12-31 02:15     ?  -
 404    2019-12-31 02:16     ?  -
 405    2019-12-31 02:17    24  *****
 406    2019-12-31 02:18    26  *******
 407    2019-12-31 02:19    26  *******
 408    2019-12-31 02:20    27  ********
 409    2019-12-31 02:21    27  ********
 410    2019-12-31 02:22    28  *********
 411    2019-12-31 02:23    28  *********
 412    2019-12-31 02:24    28  *********
 413    2019-12-31 02:25    29  **********
 ...    ..(  2 skipped).    ..  **********
 416    2019-12-31 02:28    29  **********
 417    2019-12-31 02:29    30  ***********
 ...    ..(  4 skipped).    ..  ***********
 422    2019-12-31 02:34    30  ***********
 423    2019-12-31 02:35    31  ************
 ...    ..(  5 skipped).    ..  ************
 429    2019-12-31 02:41    31  ************
 430    2019-12-31 02:42    32  *************
 ...    ..(  9 skipped).    ..  *************
 440    2019-12-31 02:52    32  *************
 441    2019-12-31 02:53    35  ****************
 442    2019-12-31 02:54    36  *****************
 443    2019-12-31 02:55    38  *******************
 444    2019-12-31 02:56    38  *******************
 445    2019-12-31 02:57    36  *****************
 446    2019-12-31 02:58    35  ****************
 447    2019-12-31 02:59    35  ****************
 448    2019-12-31 03:00    34  ***************
 ...    ..(  7 skipped).    ..  ***************
 456    2019-12-31 03:08    34  ***************
 457    2019-12-31 03:09     ?  -
 458    2019-12-31 03:10     ?  -
 459    2019-12-31 03:11    23  ****
 460    2019-12-31 03:12    25  ******
 461    2019-12-31 03:13    28  *********
 462    2019-12-31 03:14    30  ***********
 463    2019-12-31 03:15    32  *************
 464    2019-12-31 03:16    33  **************
 465    2019-12-31 03:17    31  ************
 466    2019-12-31 03:18    31  ************
 467    2019-12-31 03:19    30  ***********
 ...    ..(  6 skipped).    ..  ***********
 474    2019-12-31 03:26    30  ***********
 475    2019-12-31 03:27    31  ************
 476    2019-12-31 03:28    32  *************
 477    2019-12-31 03:29    32  *************
   0    2019-12-31 03:30    24  *****
   1    2019-12-31 03:31    25  ******
   2    2019-12-31 03:32    28  *********
   3    2019-12-31 03:33    29  **********
   4    2019-12-31 03:34    29  **********
   5    2019-12-31 03:35    32  *************
   6    2019-12-31 03:36    33  **************
   7    2019-12-31 03:37    32  *************
   8    2019-12-31 03:38    31  ************
 ...    ..( 11 skipped).    ..  ************
  20    2019-12-31 03:50    31  ************
  21    2019-12-31 03:51    32  *************
 ...    ..(  7 skipped).    ..  *************
  29    2019-12-31 03:59    32  *************
  30    2019-12-31 04:00    33  **************
 ...    ..(  9 skipped).    ..  **************
  40    2019-12-31 04:10    33  **************
  41    2019-12-31 04:11    34  ***************
 ...    ..( 33 skipped).    ..  ***************
  75    2019-12-31 04:45    34  ***************
  76    2019-12-31 04:46    35  ****************
 ...    ..( 20 skipped).    ..  ****************
  97    2019-12-31 05:07    35  ****************
  98    2019-12-31 05:08     ?  -
  99    2019-12-31 05:09    35  ****************
 ...    ..( 32 skipped).    ..  ****************
 132    2019-12-31 05:42    35  ****************
 133    2019-12-31 05:43    34  ***************
 ...    ..(  9 skipped).    ..  ***************
 143    2019-12-31 05:53    34  ***************
 144    2019-12-31 05:54     ?  -
 145    2019-12-31 05:55    32  *************
 ...    ..( 12 skipped).    ..  *************
 158    2019-12-31 06:08    32  *************
 159    2019-12-31 06:09    33  **************
 ...    ..(  7 skipped).    ..  **************
 167    2019-12-31 06:17    33  **************
 168    2019-12-31 06:18     ?  -
 169    2019-12-31 06:19    32  *************
 170    2019-12-31 06:20    32  *************
 171    2019-12-31 06:21    35  ****************
 172    2019-12-31 06:22    36  *****************
 173    2019-12-31 06:23    37  ******************
 174    2019-12-31 06:24    37  ******************
 175    2019-12-31 06:25    35  ****************
 176    2019-12-31 06:26    35  ****************
 177    2019-12-31 06:27    34  ***************
 178    2019-12-31 06:28    34  ***************
 179    2019-12-31 06:29    34  ***************
 180    2019-12-31 06:30    33  **************
 ...    ..(  7 skipped).    ..  **************
 188    2019-12-31 06:38    33  **************
 189    2019-12-31 06:39    34  ***************
 190    2019-12-31 06:40    34  ***************
 191    2019-12-31 06:41    34  ***************
 192    2019-12-31 06:42     ?  -
 193    2019-12-31 06:43    33  **************
 ...    ..( 18 skipped).    ..  **************
 212    2019-12-31 07:02    33  **************
 213    2019-12-31 07:03    34  ***************
 214    2019-12-31 07:04    34  ***************
 215    2019-12-31 07:05    34  ***************
 216    2019-12-31 07:06     ?  -
 217    2019-12-31 07:07    34  ***************
 ...    ..( 28 skipped).    ..  ***************
 246    2019-12-31 07:36    34  ***************
 247    2019-12-31 07:37    35  ****************
 ...    ..(  4 skipped).    ..  ****************
 252    2019-12-31 07:42    35  ****************

SCT Error Recovery Control command not supported

Device Statistics (GP Log 0x04)
Page  Offset Size        Value Flags Description
0x01  =====  =               =  ===  == General Statistics (rev 2) ==
0x01  0x008  4             764  ---  Lifetime Power-On Resets
0x01  0x010  4            1334  ---  Power-on Hours
0x01  0x018  6     30338715564  ---  Logical Sectors Written
0x01  0x020  6       493154934  ---  Number of Write Commands
0x01  0x028  6     21562540631  ---  Logical Sectors Read
0x01  0x030  6       420021319  ---  Number of Read Commands
0x04  =====  =               =  ===  == General Errors Statistics (rev 1) ==
0x04  0x008  4               0  ---  Number of Reported Uncorrectable Errors
0x04  0x010  4             749  ---  Resets Between Cmd Acceptance and Completion
0x05  =====  =               =  ===  == Temperature Statistics (rev 1) ==
0x05  0x008  1              32  ---  Current Temperature
0x05  0x010  1              34  ---  Average Short Term Temperature
0x05  0x018  1               -  ---  Average Long Term Temperature
0x05  0x020  1              43  ---  Highest Temperature
0x05  0x028  1               9  ---  Lowest Temperature
0x05  0x030  1              34  ---  Highest Average Short Term Temperature
0x05  0x038  1              25  ---  Lowest Average Short Term Temperature
0x05  0x040  1               -  ---  Highest Average Long Term Temperature
0x05  0x048  1               -  ---  Lowest Average Long Term Temperature
0x05  0x050  4               0  ---  Time in Over-Temperature
0x05  0x058  1              70  ---  Specified Maximum Operating Temperature
0x05  0x060  4               0  ---  Time in Under-Temperature
0x05  0x068  1               0  ---  Specified Minimum Operating Temperature
0x06  =====  =               =  ===  == Transport Statistics (rev 1) ==
0x06  0x008  4            2800  ---  Number of Hardware Resets
0x06  0x010  4              18  ---  Number of ASR Events
0x06  0x018  4               0  ---  Number of Interface CRC Errors
0x07  =====  =               =  ===  == Solid State Device Statistics (rev 1) ==
0x07  0x008  1               6  N--  Percentage Used Endurance Indicator
                                |||_ C monitored condition met
                                ||__ D supports DSN
                                |___ N normalized value

Pending Defects log (GP Log 0x0c) not supported

SATA Phy Event Counters (GP Log 0x11)
ID      Size     Value  Description
0x0001  4            0  Command failed due to ICRC error
0x000a  4            2  Device-to-host register FISes sent due to a COMRESET

