smartctl 7.1 2019-12-30 r5022 [x86_64-linux-5.8.0-44-generic] (local build)
Copyright (C) 2002-19, Bruce Allen, Christian Franke, www.smartmontools.org

=== START OF INFORMATION SECTION ===
Model Family:     Western Digital Ultrastar DC HC550
Device Model:     WDC  WUH721818ALE6L4
Serial Number:    2BG01BHE
LU WWN Device Id: 5 000cca 295c00525
Firmware Version: PCGNW110
User Capacity:    16,000,900,657,152 bytes [16.0 TB]
Sector Size:      4096 bytes logical/physical
Rotation Rate:    7200 rpm
Form Factor:      3.5 inches
Device is:        In smartctl database [for details use: -P show]
ATA Version is:   ACS-4 published, ANSI INCITS 529-2018
SATA Version is:  SATA 3.3, 6.0 Gb/s (current: 3.0 Gb/s)
Local Time is:    Thu Mar 11 11:02:59 2021 CST
SMART support is: Available - device has SMART capability.
SMART support is: Enabled
AAM feature is:   Unavailable
APM level is:     254 (maximum performance)
Rd look-ahead is: Enabled
Write cache is:   Enabled
DSN feature is:   Unavailable
ATA Security is:  Disabled, NOT FROZEN [SEC1]
Wt Cache Reorder: Enabled

=== START OF READ SMART DATA SECTION ===
SMART overall-health self-assessment test result: PASSED

General SMART Values:
Offline data collection status:  (0x80)	Offline data collection activity
					was never started.
					Auto Offline Data Collection: Enabled.
Self-test execution status:      (   0)	The previous self-test routine completed
					without error or no self-test has ever 
					been run.
Total time to complete Offline 
data collection: 		(  101) seconds.
Offline data collection
capabilities: 			 (0x5b) SMART execute Offline immediate.
					Auto Offline data collection on/off support.
					Suspend Offline collection upon new
					command.
					Offline surface scan supported.
					Self-test supported.
					No Conveyance Self-test supported.
					Selective Self-test supported.
SMART capabilities:            (0x0003)	Saves SMART data before entering
					power-saving mode.
					Supports SMART auto save timer.
Error logging capability:        (0x01)	Error logging supported.
					General Purpose Logging supported.
Short self-test routine 
recommended polling time: 	 (   2) minutes.
Extended self-test routine
recommended polling time: 	 (1724) minutes.
SCT capabilities: 	       (0x003d)	SCT Status supported.
					SCT Error Recovery Control supported.
					SCT Feature Control supported.
					SCT Data Table supported.

SMART Attributes Data Structure revision number: 16
Vendor Specific SMART Attributes with Thresholds:
ID# ATTRIBUTE_NAME          FLAGS    VALUE WORST THRESH FAIL RAW_VALUE
  1 Raw_Read_Error_Rate     PO-R--   100   100   001    -    0
  2 Throughput_Performance  P-S---   136   136   054    -    96
  3 Spin_Up_Time            POS---   093   093   001    -    211 (Average 90)
  4 Start_Stop_Count        -O--C-   100   100   000    -    166
  5 Reallocated_Sector_Ct   PO--CK   100   100   001    -    0
  7 Seek_Error_Rate         PO-R--   100   100   001    -    0
  8 Seek_Time_Performance   P-S---   140   140   020    -    15
  9 Power_On_Hours          -O--C-   100   100   000    -    1256
 10 Spin_Retry_Count        PO--C-   100   100   001    -    0
 12 Power_Cycle_Count       -O--CK   099   099   000    -    72
 22 Helium_Level            PO---K   100   100   025    -    100
192 Power-Off_Retract_Count -O--CK   100   100   000    -    340
193 Load_Cycle_Count        -O--C-   100   100   000    -    340
194 Temperature_Celsius     -O----   068   068   000    -    28 (Min/Max 20/48)
196 Reallocated_Event_Count -O--CK   100   100   000    -    0
197 Current_Pending_Sector  -O---K   100   100   000    -    0
198 Offline_Uncorrectable   ---R--   100   100   000    -    0
199 UDMA_CRC_Error_Count    -O-R--   100   100   000    -    0
                            ||||||_ K auto-keep
                            |||||__ C event count
                            ||||___ R error rate
                            |||____ S speed/performance
                            ||_____ O updated online
                            |______ P prefailure warning

General Purpose Log Directory Version 1
SMART           Log Directory Version 1 [multi-sector log support]
Address    Access  R/W   Size  Description
0x00       GPL,SL  R/O      1  Log Directory
0x01           SL  R/O      1  Summary SMART error log
0x02           SL  R/O      1  Comprehensive SMART error log
0x03       GPL     R/O      1  Ext. Comprehensive SMART error log
0x04       GPL     R/O    256  Device Statistics log
0x04       SL      R/O    255  Device Statistics log
0x06           SL  R/O      1  SMART self-test log
0x07       GPL     R/O      1  Extended self-test log
0x08       GPL     R/O      2  Power Conditions log
0x09           SL  R/W      1  Selective self-test log
0x0c       GPL     R/O    938  Pending Defects log
0x10       GPL     R/O      1  NCQ Command Error log
0x11       GPL     R/O      1  SATA Phy Event Counters log
0x12       GPL     R/O      1  SATA NCQ Non-Data log
0x13       GPL     R/O      1  SATA NCQ Send and Receive log
0x15       GPL     R/W      1  Rebuild Assist log
0x21       GPL     R/O      1  Write stream error log
0x22       GPL     R/O      1  Read stream error log
0x24       GPL     R/O    256  Current Device Internal Status Data log
0x25       GPL     R/O    256  Saved Device Internal Status Data log
0x2f       GPL     -        1  Set Sector Configuration
0x30       GPL,SL  R/O      9  IDENTIFY DEVICE data log
0x80-0x9f  GPL,SL  R/W     16  Host vendor specific log
0xe0       GPL,SL  R/W      1  SCT Command/Status
0xe1       GPL,SL  R/W      1  SCT Data Transfer

SMART Extended Comprehensive Error Log Version: 1 (1 sectors)
Device Error Count: 13 (device log contains only the most recent 4 errors)
	CR     = Command Register
	FEATR  = Features Register
	COUNT  = Count (was: Sector Count) Register
	LBA_48 = Upper bytes of LBA High/Mid/Low Registers ]  ATA-8
	LH     = LBA High (was: Cylinder High) Register    ]   LBA
	LM     = LBA Mid (was: Cylinder Low) Register      ] Register
	LL     = LBA Low (was: Sector Number) Register     ]
	DV     = Device (was: Device/Head) Register
	DC     = Device Control Register
	ER     = Error register
	ST     = Status register
Powered_Up_Time is measured from power on, and printed as
DDd+hh:mm:SS.sss where DD=days, hh=hours, mm=minutes,
SS=sec, and sss=millisec. It "wraps" after 49.710 days.

Error 13 [0] occurred at disk power-on lifetime: 1251 hours (52 days + 3 hours)
  When the command that caused the error occurred, the device was active or idle.

  After command completion occurred, registers were:
  ER -- ST COUNT  LBA_48  LH LM LL DV DC
  -- -- -- == -- == == == -- -- -- -- --
  40 -- 43 00 00 00 00 00 00 00 00 00 00  Error: UNC at LBA = 0x00000000 = 0

  Commands leading to the command that caused the error were:
  CR FEATR COUNT  LBA_48  LH LM LL DV DC  Powered_Up_Time  Command/Feature_Name
  -- == -- == -- == == == -- -- -- -- --  ---------------  --------------------
  60 00 01 00 18 00 00 e8 d7 ff e0 40 08     00:00:16.774  READ FPDMA QUEUED
  47 00 00 00 01 00 00 00 00 00 12 a0 08     00:00:16.774  READ LOG DMA EXT
  47 00 00 00 01 00 00 00 00 00 00 a0 08     00:00:16.773  READ LOG DMA EXT
  47 00 00 00 01 00 00 00 00 00 13 a0 08     00:00:16.773  READ LOG DMA EXT
  47 00 00 00 01 00 00 00 00 00 00 a0 08     00:00:16.773  READ LOG DMA EXT

Error 12 [3] occurred at disk power-on lifetime: 1251 hours (52 days + 3 hours)
  When the command that caused the error occurred, the device was active or idle.

  After command completion occurred, registers were:
  ER -- ST COUNT  LBA_48  LH LM LL DV DC
  -- -- -- == -- == == == -- -- -- -- --
  40 -- 43 00 00 00 00 00 00 00 00 00 00  Error: UNC at LBA = 0x00000000 = 0

  Commands leading to the command that caused the error were:
  CR FEATR COUNT  LBA_48  LH LM LL DV DC  Powered_Up_Time  Command/Feature_Name
  -- == -- == -- == == == -- -- -- -- --  ---------------  --------------------
  60 00 01 00 40 00 00 e8 d7 ff e0 40 08     00:00:16.732  READ FPDMA QUEUED
  ec 00 00 00 01 00 00 00 00 00 00 00 08     00:00:16.731  IDENTIFY DEVICE
  47 00 00 00 01 00 00 00 00 00 12 a0 08     00:00:16.725  READ LOG DMA EXT
  47 00 00 00 01 00 00 00 00 00 00 a0 08     00:00:16.725  READ LOG DMA EXT
  47 00 00 00 01 00 00 00 00 00 13 a0 08     00:00:16.725  READ LOG DMA EXT

Error 11 [2] occurred at disk power-on lifetime: 1251 hours (52 days + 3 hours)
  When the command that caused the error occurred, the device was active or idle.

  After command completion occurred, registers were:
  ER -- ST COUNT  LBA_48  LH LM LL DV DC
  -- -- -- == -- == == == -- -- -- -- --
  40 -- 43 00 00 00 00 00 00 00 00 00 00  Error: UNC at LBA = 0x00000000 = 0

  Commands leading to the command that caused the error were:
  CR FEATR COUNT  LBA_48  LH LM LL DV DC  Powered_Up_Time  Command/Feature_Name
  -- == -- == -- == == == -- -- -- -- --  ---------------  --------------------
  60 00 01 00 48 00 00 00 00 00 00 40 08     00:00:16.582  READ FPDMA QUEUED
  47 00 00 00 01 00 00 00 00 00 12 a0 08     00:00:16.582  READ LOG DMA EXT
  47 00 00 00 01 00 00 00 00 00 00 a0 08     00:00:16.582  READ LOG DMA EXT
  47 00 00 00 01 00 00 00 00 00 13 a0 08     00:00:16.581  READ LOG DMA EXT
  47 00 00 00 01 00 00 00 00 00 00 a0 08     00:00:16.581  READ LOG DMA EXT

Error 10 [1] occurred at disk power-on lifetime: 1251 hours (52 days + 3 hours)
  When the command that caused the error occurred, the device was active or idle.

  After command completion occurred, registers were:
  ER -- ST COUNT  LBA_48  LH LM LL DV DC
  -- -- -- == -- == == == -- -- -- -- --
  40 -- 43 00 00 00 00 00 00 00 00 00 00  Error: UNC at LBA = 0x00000000 = 0

  Commands leading to the command that caused the error were:
  CR FEATR COUNT  LBA_48  LH LM LL DV DC  Powered_Up_Time  Command/Feature_Name
  -- == -- == -- == == == -- -- -- -- --  ---------------  --------------------
  60 00 01 00 40 00 00 00 00 00 00 40 08     00:00:16.543  READ FPDMA QUEUED
  47 00 00 00 01 00 00 00 00 00 12 a0 08     00:00:16.542  READ LOG DMA EXT
  47 00 00 00 01 00 00 00 00 00 00 a0 08     00:00:16.542  READ LOG DMA EXT
  47 00 00 00 01 00 00 00 00 00 13 a0 08     00:00:16.541  READ LOG DMA EXT
  47 00 00 00 01 00 00 00 00 00 00 a0 08     00:00:16.541  READ LOG DMA EXT

SMART Extended Self-test Log Version: 1 (1 sectors)
Num  Test_Description    Status                  Remaining  LifeTime(hours)  LBA_of_first_error
# 1  Short offline       Completed without error       00%      1255         -
# 2  Short offline       Completed without error       00%       335         -
# 3  Short offline       Completed without error       00%       335         -
# 4  Short offline       Completed without error       00%       335         -
# 5  Extended offline    Aborted by host               10%       187         -
# 6  Short offline       Aborted by host               90%       161         -
# 7  Short offline       Completed without error       00%       161         -
# 8  Short offline       Aborted by host               70%       161         -
# 9  Extended offline    Completed without error       00%       144         -
#10  Short offline       Completed without error       00%       116         -

SMART Selective self-test log data structure revision number 1
 SPAN  MIN_LBA  MAX_LBA  CURRENT_TEST_STATUS
    1        0        0  Not_testing
    2        0        0  Not_testing
    3        0        0  Not_testing
    4        0        0  Not_testing
    5        0        0  Not_testing
Selective self-test flags (0x0):
  After scanning selected spans, do NOT read-scan remainder of disk.
If Selective self-test is pending on power-up, resume after 0 minute delay.

SCT Status Version:                  3
SCT Version (vendor specific):       256 (0x0100)
Device State:                        Active (0)
Current Temperature:                    28 Celsius
Power Cycle Min/Max Temperature:     22/28 Celsius
Lifetime    Min/Max Temperature:     20/48 Celsius
Under/Over Temperature Limit Count:   0/0
SMART Status:                        0xc24f (PASSED)
Minimum supported ERC Time Limit:    65 (6.5 seconds)

SCT Temperature History Version:     2
Temperature Sampling Period:         1 minute
Temperature Logging Interval:        1 minute
Min/Max recommended Temperature:      0/60 Celsius
Min/Max Temperature Limit:           -40/70 Celsius
Temperature History Size (Index):    128 (83)

Index    Estimated Time   Temperature Celsius
  84    2021-03-11 08:55    32  *************
 ...    ..( 12 skipped).    ..  *************
  97    2021-03-11 09:08    32  *************
  98    2021-03-11 09:09    33  **************
 ...    ..( 85 skipped).    ..  **************
  56    2021-03-11 10:35    33  **************
  57    2021-03-11 10:36    30  ***********
  58    2021-03-11 10:37    30  ***********
  59    2021-03-11 10:38    30  ***********
  60    2021-03-11 10:39    21  **
  61    2021-03-11 10:40    23  ****
  62    2021-03-11 10:41    24  *****
  63    2021-03-11 10:42    25  ******
  64    2021-03-11 10:43    25  ******
  65    2021-03-11 10:44    26  *******
  66    2021-03-11 10:45    26  *******
  67    2021-03-11 10:46    27  ********
 ...    ..(  2 skipped).    ..  ********
  70    2021-03-11 10:49    27  ********
  71    2021-03-11 10:50    21  **
  72    2021-03-11 10:51    22  ***
  73    2021-03-11 10:52    22  ***
  74    2021-03-11 10:53    23  ****
  75    2021-03-11 10:54    24  *****
  76    2021-03-11 10:55    25  ******
  77    2021-03-11 10:56    25  ******
  78    2021-03-11 10:57    26  *******
  79    2021-03-11 10:58    27  ********
  80    2021-03-11 10:59    27  ********
  81    2021-03-11 11:00    28  *********
  82    2021-03-11 11:01    28  *********
  83    2021-03-11 11:02    32  *************

SCT Error Recovery Control:
           Read: Disabled
          Write: Disabled

Device Statistics (GP Log 0x04)
Page  Offset Size        Value Flags Description
0x01  =====  =               =  ===  == General Statistics (rev 1) ==
0x01  0x008  4              72  ---  Lifetime Power-On Resets
0x01  0x010  4            1256  ---  Power-on Hours
0x01  0x018  6         2785262  ---  Logical Sectors Written
0x01  0x020  6           98905  ---  Number of Write Commands
0x01  0x028  6         5154334  ---  Logical Sectors Read
0x01  0x030  6          700237  ---  Number of Read Commands
0x01  0x038  6      4521779100  ---  Date and Time TimeStamp
0x03  =====  =               =  ===  == Rotating Media Statistics (rev 1) ==
0x03  0x008  4            1022  ---  Spindle Motor Power-on Hours
0x03  0x010  4            1022  ---  Head Flying Hours
0x03  0x018  4             340  ---  Head Load Events
0x03  0x020  4               0  ---  Number of Reallocated Logical Sectors
0x03  0x028  4               0  ---  Read Recovery Attempts
0x03  0x030  4               1  ---  Number of Mechanical Start Failures
0x04  =====  =               =  ===  == General Errors Statistics (rev 1) ==
0x04  0x008  4              13  ---  Number of Reported Uncorrectable Errors
0x04  0x010  4               0  ---  Resets Between Cmd Acceptance and Completion
0x04  0x018  4               0  ---  Physical Element Status Changed
0x05  =====  =               =  ===  == Temperature Statistics (rev 1) ==
0x05  0x008  1              28  ---  Current Temperature
0x05  0x010  1              27  N--  Average Short Term Temperature
0x05  0x018  1              26  N--  Average Long Term Temperature
0x05  0x020  1              48  ---  Highest Temperature
0x05  0x028  1              20  ---  Lowest Temperature
0x05  0x030  1              48  N--  Highest Average Short Term Temperature
0x05  0x038  1              20  N--  Lowest Average Short Term Temperature
0x05  0x040  1              31  N--  Highest Average Long Term Temperature
0x05  0x048  1              22  N--  Lowest Average Long Term Temperature
0x05  0x050  4               0  ---  Time in Over-Temperature
0x05  0x058  1              60  ---  Specified Maximum Operating Temperature
0x05  0x060  4               0  ---  Time in Under-Temperature
0x05  0x068  1               0  ---  Specified Minimum Operating Temperature
0x06  =====  =               =  ===  == Transport Statistics (rev 1) ==
0x06  0x008  4             282  ---  Number of Hardware Resets
0x06  0x010  4              49  ---  Number of ASR Events
0x06  0x018  4               0  ---  Number of Interface CRC Errors
0xff  =====  =               =  ===  == Vendor Specific Statistics (rev 1) ==
                                |||_ C monitored condition met
                                ||__ D supports DSN
                                |___ N normalized value

Pending Defects log (GP Log 0x0c)
No Defects Logged

SATA Phy Event Counters (GP Log 0x11)
ID      Size     Value  Description
0x0001  2            0  Command failed due to ICRC error
0x0002  2            0  R_ERR response for data FIS
0x0003  2            0  R_ERR response for device-to-host data FIS
0x0004  2            0  R_ERR response for host-to-device data FIS
0x0005  2            0  R_ERR response for non-data FIS
0x0006  2            0  R_ERR response for device-to-host non-data FIS
0x0007  2            0  R_ERR response for host-to-device non-data FIS
0x0008  2            0  Device-to-host non-data FIS retries
0x0009  2            1  Transition from drive PhyRdy to drive PhyNRdy
0x000a  2            2  Device-to-host register FISes sent due to a COMRESET
0x000b  2            0  CRC errors within host-to-device FIS
0x000d  2            0  Non-CRC errors within host-to-device FIS

