sudo smartctl -d sat -x -a /dev/sde
smartctl 7.4 2023-08-01 r5530 [x86_64-linux-6.11.0-17-generic] (local build)
Copyright (C) 2002-23, Bruce Allen, Christian Franke, www.smartmontools.org

=== START OF INFORMATION SECTION ===
Model Family:     Fujitsu MJA BH
Device Model:     FUJITSU MJA2500BH G2
Serial Number:    K94AT9425JYF
LU WWN Device Id: 5 00000e 0438040b0
Firmware Version: 00000018
User Capacity:    500,107,862,016 bytes [500 GB]
Sector Size:      512 bytes logical/physical
Device is:        In smartctl database 7.3/5528
ATA Version is:   ATA8-ACS T13/1699-D revision 3f
SATA Version is:  SATA 2.6, 3.0 Gb/s
Local Time is:    Sat Mar  1 14:21:59 2025 MSK
SMART support is: Available - device has SMART capability.
SMART support is: Enabled
AAM level is:     254 (maximum performance), recommended: 254
APM level is:     128 (minimum power consumption without standby)
Rd look-ahead is: Enabled
Write cache is:   Enabled
DSN feature is:   Unavailable
ATA Security is:  Disabled, NOT FROZEN [SEC1]
Wt Cache Reorder: Enabled

=== START OF READ SMART DATA SECTION ===
SMART overall-health self-assessment test result: PASSED

General SMART Values:
Offline data collection status:  (0x00) Offline data collection activity
                                        was never started.
                                        Auto Offline Data Collection: Disabled.
Self-test execution status:      ( 243) Self-test routine in progress...
                                        30% of test remaining.
Total time to complete Offline
data collection:                ( 1574) seconds.
Offline data collection
capabilities:                    (0x7b) SMART execute Offline immediate.
                                        Auto Offline data collection on/off support.
                                        Suspend Offline collection upon new
                                        command.
                                        Offline surface scan supported.
                                        Self-test supported.
                                        Conveyance Self-test supported.
                                        Selective Self-test supported.
SMART capabilities:            (0x0003) Saves SMART data before entering
                                        power-saving mode.
                                        Supports SMART auto save timer.
Error logging capability:        (0x01) Error logging supported.
                                        General Purpose Logging supported.
Short self-test routine
recommended polling time:        (   2) minutes.
Extended self-test routine
recommended polling time:        ( 223) minutes.
Conveyance self-test routine
recommended polling time:        (   2) minutes.
SCT capabilities:              (0x003d) SCT Status supported.
                                        SCT Error Recovery Control supported.
                                        SCT Feature Control supported.
                                        SCT Data Table supported.

SMART Attributes Data Structure revision number: 16
Vendor Specific SMART Attributes with Thresholds:
ID# ATTRIBUTE_NAME          FLAGS    VALUE WORST THRESH FAIL RAW_VALUE
  1 Raw_Read_Error_Rate     POSR--   100   100   046    -    101553
  2 Throughput_Performance  P-S---   100   100   030    -    70254592
  3 Spin_Up_Time            PO----   100   100   025    -    2
  4 Start_Stop_Count        -O--CK   095   095   000    -    22401
  5 Reallocated_Sector_Ct   PO--CK   100   100   024    -    1 (1999 1)
  7 Seek_Error_Rate         POSR--   100   100   047    -    2250
  8 Seek_Time_Performance   P-S---   100   100   019    -    0
  9 Power_On_Hours          -O--CK   001   001   000    -    52237
 10 Spin_Retry_Count        PO--C-   100   100   020    -    0
 12 Power_Cycle_Count       -O--CK   100   100   000    -    1660
192 Power-Off_Retract_Count -O--CK   098   098   000    -    615
193 Load_Cycle_Count        -O--CK   096   096   000    -    87168
194 Temperature_Celsius     -O---K   100   080   000    -    43 (Min/Max 4/64)
195 Hardware_ECC_Recovered  -O-RC-   100   100   000    -    50214
196 Reallocated_Event_Count -O--CK   100   100   000    -    1 (25 15745)
197 Current_Pending_Sector  -O--C-   100   100   000    -    0
198 Offline_Uncorrectable   ----C-   100   100   000    -    0
199 UDMA_CRC_Error_Count    -OSRCK   200   253   000    -    330
200 Multi_Zone_Error_Rate   POSR--   100   100   060    -    6674
203 Run_Out_Cancel          -O----   100   100   000    -    433669341832
240 Head_Flying_Hours       -OSRCK   200   200   000    -    0
                            ||||||_ K auto-keep
                            |||||__ C event count
                            ||||___ R error rate
                            |||____ S speed/performance
                            ||_____ O updated online
                            |______ P prefailure warning

General Purpose Log Directory Version 1
SMART           Log Directory Version 1 [multi-sector log support]
Address    Access  R/W   Size  Description
0x00       GPL,SL  R/O      1  Log Directory
0x01       GPL,SL  R/O      1  Summary SMART error log
0x02       GPL,SL  R/O     51  Comprehensive SMART error log
0x03       GPL,SL  R/O     64  Ext. Comprehensive SMART error log
0x06       GPL,SL  R/O      1  SMART self-test log
0x07       GPL,SL  R/O      2  Extended self-test log
0x09       GPL,SL  R/W      1  Selective self-test log
0x10       GPL,SL  R/O      1  NCQ Command Error log
0x11       GPL,SL  R/O      1  SATA Phy Event Counters log
0x23       GPL,SL  R/O      1  Delayed sector log
0x80-0x9f  GPL,SL  R/W     16  Host vendor specific log
0xa1       GPL,SL  VS       1  Device vendor specific log

SMART Extended Comprehensive Error Log Version: 1 (64 sectors)
No Errors Logged

SMART Error Log Version: 1
No Errors Logged

SMART Extended Self-test Log Version: 1 (2 sectors)
No self-tests have been logged.  [To run self-tests, use: smartctl -t]

SMART Self-test log structure revision number 1
No self-tests have been logged.  [To run self-tests, use: smartctl -t]

SMART Selective self-test log data structure revision number 1
 SPAN  MIN_LBA  MAX_LBA  CURRENT_TEST_STATUS
    1        0        0  Not_testing
    2        0        0  Not_testing
    3        0        0  Not_testing
    4        0        0  Not_testing
    5        0        0  Not_testing
Selective self-test flags (0x0):
  After scanning selected spans, do NOT read-scan remainder of disk.
If Selective self-test is pending on power-up, resume after 0 minute delay.

SCT Status Version:                  2
SCT Version (vendor specific):       0 (0x0000)
Device State:                        DST executing in background (3)
Current Temperature:                    43 Celsius
Power Cycle Min/Max Temperature:     35/43 Celsius
Lifetime    Min/Max Temperature:      4/64 Celsius
Under/Over Temperature Limit Count:   0/0

SCT Temperature History Version:     2
Temperature Sampling Period:         1 minute
Temperature Logging Interval:        1 minute
Min/Max recommended Temperature:      5/60 Celsius
Min/Max Temperature Limit:           -40/65 Celsius
Temperature History Size (Index):    478 (330)

Index    Estimated Time   Temperature Celsius
 331    2025-03-01 06:25     ?  -
 332    2025-03-01 06:26    33  **************
 333    2025-03-01 06:27    33  **************
 334    2025-03-01 06:28     ?  -
 335    2025-03-01 06:29    33  **************
 336    2025-03-01 06:30    33  **************
 337    2025-03-01 06:31     ?  -
 338    2025-03-01 06:32    33  **************
 339    2025-03-01 06:33    33  **************
 340    2025-03-01 06:34     ?  -
 341    2025-03-01 06:35    33  **************
 342    2025-03-01 06:36    33  **************
 343    2025-03-01 06:37     ?  -
 344    2025-03-01 06:38    33  **************
 345    2025-03-01 06:39    33  **************
 346    2025-03-01 06:40     ?  -
 347    2025-03-01 06:41    33  **************
 348    2025-03-01 06:42    33  **************
 349    2025-03-01 06:43     ?  -
 350    2025-03-01 06:44    33  **************
 ...    ..(  2 skipped).    ..  **************
 353    2025-03-01 06:47    33  **************
 354    2025-03-01 06:48     ?  -
 355    2025-03-01 06:49    33  **************
 356    2025-03-01 06:50    33  **************
 357    2025-03-01 06:51     ?  -
 358    2025-03-01 06:52    33  **************
 359    2025-03-01 06:53    33  **************
 360    2025-03-01 06:54     ?  -
 361    2025-03-01 06:55    33  **************
 362    2025-03-01 06:56    33  **************
 363    2025-03-01 06:57     ?  -
 364    2025-03-01 06:58    33  **************
 365    2025-03-01 06:59    33  **************
 366    2025-03-01 07:00     ?  -
 367    2025-03-01 07:01    33  **************
 368    2025-03-01 07:02    33  **************
 369    2025-03-01 07:03    33  **************
 370    2025-03-01 07:04     ?  -
 371    2025-03-01 07:05    30  ***********
 372    2025-03-01 07:06     ?  -
 373    2025-03-01 07:07    30  ***********
 374    2025-03-01 07:08    30  ***********
 375    2025-03-01 07:09     ?  -
 376    2025-03-01 07:10    32  *************
 377    2025-03-01 07:11    32  *************
 378    2025-03-01 07:12    32  *************
 379    2025-03-01 07:13    33  **************
 380    2025-03-01 07:14    33  **************
 381    2025-03-01 07:15    33  **************
 382    2025-03-01 07:16    34  ***************
 383    2025-03-01 07:17    35  ****************
 ...    ..(  2 skipped).    ..  ****************
 386    2025-03-01 07:20    35  ****************
 387    2025-03-01 07:21    36  *****************
 388    2025-03-01 07:22    36  *****************
 389    2025-03-01 07:23    36  *****************
 390    2025-03-01 07:24    37  ******************
 ...    ..(  6 skipped).    ..  ******************
 397    2025-03-01 07:31    37  ******************
 398    2025-03-01 07:32    38  *******************
 ...    ..(  3 skipped).    ..  *******************
 402    2025-03-01 07:36    38  *******************
 403    2025-03-01 07:37    39  ********************
 ...    ..( 18 skipped).    ..  ********************
 422    2025-03-01 07:56    39  ********************
 423    2025-03-01 07:57     ?  -
 424    2025-03-01 07:58    38  *******************
 425    2025-03-01 07:59    37  ******************
 426    2025-03-01 08:00    37  ******************
 427    2025-03-01 08:01     ?  -
 428    2025-03-01 08:02    36  *****************
 429    2025-03-01 08:03    36  *****************
 430    2025-03-01 08:04     ?  -
 431    2025-03-01 08:05    35  ****************
 432    2025-03-01 08:06    35  ****************
 433    2025-03-01 08:07     ?  -
 434    2025-03-01 08:08    35  ****************
 435    2025-03-01 08:09    35  ****************
 436    2025-03-01 08:10     ?  -
 437    2025-03-01 08:11    35  ****************
 ...    ..(  3 skipped).    ..  ****************
 441    2025-03-01 08:15    35  ****************
 442    2025-03-01 08:16    36  *****************
 443    2025-03-01 08:17    36  *****************
 444    2025-03-01 08:18    35  ****************
 ...    ..( 21 skipped).    ..  ****************
 466    2025-03-01 08:40    35  ****************
 467    2025-03-01 08:41    34  ***************
 ...    ..(  3 skipped).    ..  ***************
 471    2025-03-01 08:45    34  ***************
 472    2025-03-01 08:46    33  **************
 ...    ..( 31 skipped).    ..  **************
  26    2025-03-01 09:18    33  **************
  27    2025-03-01 09:19     ?  -
  28    2025-03-01 09:20    34  ***************
 ...    ..(  5 skipped).    ..  ***************
  34    2025-03-01 09:26    34  ***************
  35    2025-03-01 09:27    35  ****************
 ...    ..( 10 skipped).    ..  ****************
  46    2025-03-01 09:38    35  ****************
  47    2025-03-01 09:39    36  *****************
 ...    ..( 10 skipped).    ..  *****************
  58    2025-03-01 09:50    36  *****************
  59    2025-03-01 09:51    37  ******************
 ...    ..( 20 skipped).    ..  ******************
  80    2025-03-01 10:12    37  ******************
  81    2025-03-01 10:13    36  *****************
  82    2025-03-01 10:14    37  ******************
  83    2025-03-01 10:15    36  *****************
  84    2025-03-01 10:16    36  *****************
  85    2025-03-01 10:17    37  ******************
 ...    ..(  2 skipped).    ..  ******************
  88    2025-03-01 10:20    37  ******************
  89    2025-03-01 10:21    36  *****************
 ...    ..(  6 skipped).    ..  *****************
  96    2025-03-01 10:28    36  *****************
  97    2025-03-01 10:29    37  ******************
  98    2025-03-01 10:30    37  ******************
  99    2025-03-01 10:31    37  ******************
 100    2025-03-01 10:32    36  *****************
 ...    ..( 31 skipped).    ..  *****************
 132    2025-03-01 11:04    36  *****************
 133    2025-03-01 11:05    35  ****************
 ...    ..( 17 skipped).    ..  ****************
 151    2025-03-01 11:23    35  ****************
 152    2025-03-01 11:24    34  ***************
 ...    ..(  7 skipped).    ..  ***************
 160    2025-03-01 11:32    34  ***************
 161    2025-03-01 11:33    35  ****************
 ...    ..( 14 skipped).    ..  ****************
 176    2025-03-01 11:48    35  ****************
 177    2025-03-01 11:49    36  *****************
 178    2025-03-01 11:50    36  *****************
 179    2025-03-01 11:51    36  *****************
 180    2025-03-01 11:52     ?  -
 181    2025-03-01 11:53    36  *****************
 182    2025-03-01 11:54     ?  -
 183    2025-03-01 11:55    36  *****************
 184    2025-03-01 11:56    35  ****************
 ...    ..(  2 skipped).    ..  ****************
 187    2025-03-01 11:59    35  ****************
 188    2025-03-01 12:00    36  *****************
 189    2025-03-01 12:01    37  ******************
 ...    ..(  2 skipped).    ..  ******************
 192    2025-03-01 12:04    37  ******************
 193    2025-03-01 12:05    38  *******************
 194    2025-03-01 12:06    38  *******************
 195    2025-03-01 12:07    39  ********************
 ...    ..(  4 skipped).    ..  ********************
 200    2025-03-01 12:12    39  ********************
 201    2025-03-01 12:13    40  *********************
 ...    ..(  3 skipped).    ..  *********************
 205    2025-03-01 12:17    40  *********************
 206    2025-03-01 12:18    41  **********************
 ...    ..(  6 skipped).    ..  **********************
 213    2025-03-01 12:25    41  **********************
 214    2025-03-01 12:26    42  ***********************
 ...    ..( 16 skipped).    ..  ***********************
 231    2025-03-01 12:43    42  ***********************
 232    2025-03-01 12:44    43  ************************
 ...    ..( 97 skipped).    ..  ************************
 330    2025-03-01 14:22    43  ************************

SCT Error Recovery Control:
           Read: Disabled
          Write: Disabled

Device Statistics (GP/SMART Log 0x04) not supported

Pending Defects log (GP Log 0x0c) not supported

SATA Phy Event Counters (GP Log 0x11)
ID      Size     Value  Description
0x0001  4            0  Command failed due to ICRC error
0x0002  4            0  R_ERR response for data FIS
0x0003  4            0  R_ERR response for device-to-host data FIS
0x0004  4            0  R_ERR response for host-to-device data FIS
0x0005  4            0  R_ERR response for non-data FIS
0x0006  4            0  R_ERR response for device-to-host non-data FIS
0x0008  4            0  Device-to-host non-data FIS retries
0x0009  4            0  Transition from drive PhyRdy to drive PhyNRdy
0x000a  4            1  Device-to-host register FISes sent due to a COMRESET
0x000b  4            0  CRC errors within host-to-device FIS
0x000d  4            0  Non-CRC errors within host-to-device FIS
0x000f  4            0  R_ERR response for host-to-device data FIS, CRC
0x0010  4            0  R_ERR response for host-to-device data FIS, non-CRC
