smartctl pre-7.5 2024-05-08 r5613 [x86_64-w64-mingw32-w10-22H2] (CircleCI)
Copyright (C) 2002-24, Bruce Allen, Christian Franke, www.smartmontools.org

=== START OF INFORMATION SECTION ===
Device Model:     WDC WD180EDGZ-11B2DA0
Firmware Version: 85.00A85
User Capacity:    18,000,207,937,536 bytes [18.0 TB]
Sector Sizes:     512 bytes logical, 4096 bytes physical
Rotation Rate:    7200 rpm
Form Factor:      3.5 inches
Device is:        Not in smartctl database 7.3/5610
ATA Version is:   ACS-4 published, ANSI INCITS 529-2018
SATA Version is:  SATA 3.3, 6.0 Gb/s (current: 6.0 Gb/s)
Local Time is:    Wed Aug 21 01:37:41 2024 GMTST
SMART support is: Available - device has SMART capability.
SMART support is: Enabled
AAM feature is:   Unavailable
APM feature is:   Disabled
Rd look-ahead is: Enabled
Write cache is:   Enabled
DSN feature is:   Unavailable
ATA Security is:  Disabled, NOT FROZEN [SEC1], Master PW ID: 0xbbbb
Wt Cache Reorder: Enabled

=== START OF READ SMART DATA SECTION ===
SMART overall-health self-assessment test result: PASSED

General SMART Values:
Offline data collection status:  (0x80)	Offline data collection activity
					was never started.
					Auto Offline Data Collection: Enabled.
Self-test execution status:      (   0)	The previous self-test routine completed
					without error or no self-test has ever 
					been run.
Total time to complete Offline 
data collection: 		(  101) seconds.
Offline data collection
capabilities: 			 (0x5b) SMART execute Offline immediate.
					Auto Offline data collection on/off support.
					Suspend Offline collection upon new
					command.
					Offline surface scan supported.
					Self-test supported.
					No Conveyance Self-test supported.
					Selective Self-test supported.
SMART capabilities:            (0x0003)	Saves SMART data before entering
					power-saving mode.
					Supports SMART auto save timer.
Error logging capability:        (0x01)	Error logging supported.
					General Purpose Logging supported.
Short self-test routine 
recommended polling time: 	 (   2) minutes.
Extended self-test routine
recommended polling time: 	 (1969) minutes.
SCT capabilities: 	       (0x003d)	SCT Status supported.
					SCT Error Recovery Control supported.
					SCT Feature Control supported.
					SCT Data Table supported.

SMART Attributes Data Structure revision number: 16
Vendor Specific SMART Attributes with Thresholds:
ID# ATTRIBUTE_NAME          FLAGS    VALUE WORST THRESH FAIL RAW_VALUE
  1 Raw_Read_Error_Rate     PO-R--   100   100   001    -    0
  2 Throughput_Performance  --S---   133   133   054    -    108
  3 Spin_Up_Time            POS---   082   082   001    -    359 (Average 364)
  4 Start_Stop_Count        -O--C-   087   087   000    -    5413
  5 Reallocated_Sector_Ct   PO--CK   100   100   001    -    0
  7 Seek_Error_Rate         -O-R--   100   100   001    -    0
  8 Seek_Time_Performance   --S---   140   140   020    -    15
  9 Power_On_Hours          -O--C-   097   097   000    -    21431
 10 Spin_Retry_Count        -O--C-   100   100   001    -    0
 12 Power_Cycle_Count       -O--CK   088   088   000    -    873
 22 Helium_Level            PO---K   100   100   025    -    100
192 Power-Off_Retract_Count -O--CK   098   098   000    -    13791
193 Load_Cycle_Count        -O--C-   098   098   000    -    13791
194 Temperature_Celsius     -O----   059   059   000    -    27 (Min/Max 11/51)
196 Reallocated_Event_Count -O--CK   100   100   000    -    0
197 Current_Pending_Sector  -O---K   100   100   000    -    0
198 Offline_Uncorrectable   ---R--   100   100   000    -    0
199 UDMA_CRC_Error_Count    -O-R--   100   100   000    -    0
                            ||||||_ K auto-keep
                            |||||__ C event count
                            ||||___ R error rate
                            |||____ S speed/performance
                            ||_____ O updated online
                            |______ P prefailure warning

General Purpose Log Directory Version 1
SMART           Log Directory Version 1 [multi-sector log support]
Address    Access  R/W   Size  Description
0x00       GPL,SL  R/O      1  Log Directory
0x01           SL  R/O      1  Summary SMART error log
0x02           SL  R/O      1  Comprehensive SMART error log
0x03       GPL     R/O      1  Ext. Comprehensive SMART error log
0x04       GPL     R/O    256  Device Statistics log
0x04       SL      R/O    255  Device Statistics log
0x06           SL  R/O      1  SMART self-test log
0x07       GPL     R/O      1  Extended self-test log
0x08       GPL     R/O      2  Power Conditions log
0x09           SL  R/W      1  Selective self-test log
0x0c       GPL     R/O  30001  Pending Defects log
0x10       GPL     R/O      1  NCQ Command Error log
0x11       GPL     R/O      1  SATA Phy Event Counters log
0x12       GPL     R/O      1  SATA NCQ Non-Data log
0x13       GPL     R/O      1  SATA NCQ Send and Receive log
0x15       GPL     R/W      1  Rebuild Assist log
0x21       GPL     R/O      1  Write stream error log
0x22       GPL     R/O      1  Read stream error log
0x24       GPL     R/O    256  Current Device Internal Status Data log
0x25       GPL     R/O    256  Saved Device Internal Status Data log
0x2f       GPL     R/O      1  Set Sector Configuration
0x30       GPL,SL  R/O      9  IDENTIFY DEVICE data log
0x80-0x9f  GPL,SL  R/W     16  Host vendor specific log
0xe0       GPL,SL  R/W      1  SCT Command/Status
0xe1       GPL,SL  R/W      1  SCT Data Transfer

SMART Extended Comprehensive Error Log Version: 1 (1 sectors)
No Errors Logged

SMART Extended Self-test Log Version: 1 (1 sectors)
Num  Test_Description    Status                  Remaining  LifeTime(hours)  LBA_of_first_error
# 1  Short offline       Completed without error       00%     21431         -

SMART Selective self-test log data structure revision number 1
 SPAN  MIN_LBA  MAX_LBA  CURRENT_TEST_STATUS
    1        0        0  Not_testing
    2        0        0  Not_testing
    3        0        0  Not_testing
    4        0        0  Not_testing
    5        0        0  Not_testing
Selective self-test flags (0x0):
  After scanning selected spans, do NOT read-scan remainder of disk.
If Selective self-test is pending on power-up, resume after 0 minute delay.

SCT Status Version:                  3
SCT Version (vendor specific):       256 (0x0100)
Device State:                        Active (0)
Current Temperature:                    27 Celsius
Power Cycle Min/Max Temperature:     22/31 Celsius
Lifetime    Min/Max Temperature:     11/51 Celsius
Under/Over Temperature Limit Count:   0/0
SMART Status:                        0xc24f (PASSED)
Minimum supported ERC Time Limit:    65 (6.5 seconds)

SCT Temperature History Version:     2
Temperature Sampling Period:         1 minute
Temperature Logging Interval:        1 minute
Min/Max recommended Temperature:      0/65 Celsius
Min/Max Temperature Limit:           -40/70 Celsius
Temperature History Size (Index):    128 (100)

Index    Estimated Time   Temperature Celsius
 101    2024-08-20 23:30    22  ***
 ...    ..( 27 skipped).    ..  ***
   1    2024-08-20 23:58    22  ***
   2    2024-08-20 23:59    23  ****
 ...    ..( 23 skipped).    ..  ****
  26    2024-08-21 00:23    23  ****
  27    2024-08-21 00:24    24  *****
  28    2024-08-21 00:25    24  *****
  29    2024-08-21 00:26    25  ******
  30    2024-08-21 00:27    25  ******
  31    2024-08-21 00:28    26  *******
  32    2024-08-21 00:29    26  *******
  33    2024-08-21 00:30    26  *******
  34    2024-08-21 00:31    27  ********
 ...    ..(  7 skipped).    ..  ********
  42    2024-08-21 00:39    27  ********
  43    2024-08-21 00:40    28  *********
  44    2024-08-21 00:41    27  ********
  45    2024-08-21 00:42    27  ********
  46    2024-08-21 00:43    27  ********
  47    2024-08-21 00:44    26  *******
 ...    ..(  4 skipped).    ..  *******
  52    2024-08-21 00:49    26  *******
  53    2024-08-21 00:50    25  ******
 ...    ..(  7 skipped).    ..  ******
  61    2024-08-21 00:58    25  ******
  62    2024-08-21 00:59    26  *******
  63    2024-08-21 01:00    26  *******
  64    2024-08-21 01:01    26  *******
  65    2024-08-21 01:02    27  ********
 ...    ..(  2 skipped).    ..  ********
  68    2024-08-21 01:05    27  ********
  69    2024-08-21 01:06    28  *********
  70    2024-08-21 01:07    28  *********
  71    2024-08-21 01:08    27  ********
 ...    ..(  4 skipped).    ..  ********
  76    2024-08-21 01:13    27  ********
  77    2024-08-21 01:14    28  *********
  78    2024-08-21 01:15    27  ********
  79    2024-08-21 01:16    27  ********
  80    2024-08-21 01:17    26  *******
 ...    ..(  2 skipped).    ..  *******
  83    2024-08-21 01:20    26  *******
  84    2024-08-21 01:21    25  ******
 ...    ..(  3 skipped).    ..  ******
  88    2024-08-21 01:25    25  ******
  89    2024-08-21 01:26    24  *****
  90    2024-08-21 01:27    24  *****
  91    2024-08-21 01:28    24  *****
  92    2024-08-21 01:29    25  ******
  93    2024-08-21 01:30    25  ******
  94    2024-08-21 01:31    25  ******
  95    2024-08-21 01:32    26  *******
  96    2024-08-21 01:33    26  *******
  97    2024-08-21 01:34    26  *******
  98    2024-08-21 01:35    27  ********
  99    2024-08-21 01:36    27  ********
 100    2024-08-21 01:37    22  ***

SCT Error Recovery Control:
           Read: Disabled
          Write: Disabled

Device Statistics (GP Log 0x04)
Page  Offset Size        Value Flags Description
0x01  =====  =               =  ===  == General Statistics (rev 1) ==
0x01  0x008  4             873  ---  Lifetime Power-On Resets
0x01  0x010  4           21431  ---  Power-on Hours
0x01  0x018  6     63202816409  ---  Logical Sectors Written
0x01  0x020  6       236706805  ---  Number of Write Commands
0x01  0x028  6     62624104303  ---  Logical Sectors Read
0x01  0x030  6       249267981  ---  Number of Read Commands
0x01  0x038  6     77153755800  ---  Date and Time TimeStamp
0x03  =====  =               =  ===  == Rotating Media Statistics (rev 1) ==
0x03  0x008  4           10066  ---  Spindle Motor Power-on Hours
0x03  0x010  4           10066  ---  Head Flying Hours
0x03  0x018  4           13791  ---  Head Load Events
0x03  0x020  4               0  ---  Number of Reallocated Logical Sectors
0x03  0x028  4               0  ---  Read Recovery Attempts
0x03  0x030  4               0  ---  Number of Mechanical Start Failures
0x04  =====  =               =  ===  == General Errors Statistics (rev 1) ==
0x04  0x008  4               0  ---  Number of Reported Uncorrectable Errors
0x04  0x010  4               0  ---  Resets Between Cmd Acceptance and Completion
0x05  =====  =               =  ===  == Temperature Statistics (rev 1) ==
0x05  0x008  1              27  ---  Current Temperature
0x05  0x010  1              24  N--  Average Short Term Temperature
0x05  0x018  1              26  N--  Average Long Term Temperature
0x05  0x020  1              51  ---  Highest Temperature
0x05  0x028  1              11  ---  Lowest Temperature
0x05  0x030  1              46  N--  Highest Average Short Term Temperature
0x05  0x038  1              14  N--  Lowest Average Short Term Temperature
0x05  0x040  1              40  N--  Highest Average Long Term Temperature
0x05  0x048  1              20  N--  Lowest Average Long Term Temperature
0x05  0x050  4               0  ---  Time in Over-Temperature
0x05  0x058  1              65  ---  Specified Maximum Operating Temperature
0x05  0x060  4               0  ---  Time in Under-Temperature
0x05  0x068  1               0  ---  Specified Minimum Operating Temperature
0x06  =====  =               =  ===  == Transport Statistics (rev 1) ==
0x06  0x008  4            4751  ---  Number of Hardware Resets
0x06  0x010  4             928  ---  Number of ASR Events
0x06  0x018  4               0  ---  Number of Interface CRC Errors
0xff  =====  =               =  ===  == Vendor Specific Statistics (rev 1) ==
                                |||_ C monitored condition met
                                ||__ D supports DSN
                                |___ N normalized value

Pending Defects log (GP Log 0x0c)
No Defects Logged

SATA Phy Event Counters (GP Log 0x11)
ID      Size     Value  Description
0x0001  2            0  Command failed due to ICRC error
0x0002  2            0  R_ERR response for data FIS
0x0003  2            0  R_ERR response for device-to-host data FIS
0x0004  2            0  R_ERR response for host-to-device data FIS
0x0005  2            0  R_ERR response for non-data FIS
0x0006  2            0  R_ERR response for device-to-host non-data FIS
0x0007  2            0  R_ERR response for host-to-device non-data FIS
0x0008  2            0  Device-to-host non-data FIS retries
0x0009  2            3  Transition from drive PhyRdy to drive PhyNRdy
0x000a  2            4  Device-to-host register FISes sent due to a COMRESET
0x000b  2            0  CRC errors within host-to-device FIS
0x000d  2            0  Non-CRC errors within host-to-device FIS

