smartctl 6.6 2017-11-05 r4594 [x86_64-linux-4.18.0-193.14.2.el8_2.x86_64] (local build)
Copyright (C) 2002-17, Bruce Allen, Christian Franke, www.smartmontools.org

=== START OF INFORMATION SECTION ===
Device Model:     Samsung SSD 883 DCT 480GB
Firmware Version: HXT7404Q
User Capacity:    480,103,981,056 bytes [480 GB]
Sector Sizes:     512 bytes logical, 4096 bytes physical
Rotation Rate:    Solid State Device
Form Factor:      2.5 inches
Device is:        Not in smartctl database [for details use: -P showall]
ATA Version is:   ACS-4 T13/BSR INCITS 529 revision 5
SATA Version is:  SATA 3.2, 6.0 Gb/s (current: 6.0 Gb/s)
Local Time is:    Thu Oct  1 11:53:52 2020 CEST
SMART support is: Available - device has SMART capability.
SMART support is: Enabled
AAM feature is:   Unavailable
APM feature is:   Unavailable
Rd look-ahead is: Enabled
Write cache is:   Enabled
DSN feature is:   Unavailable
ATA Security is:  Disabled, frozen [SEC2]
Wt Cache Reorder: Enabled

=== START OF READ SMART DATA SECTION ===
SMART overall-health self-assessment test result: PASSED

General SMART Values:
Offline data collection status:  (0x00) Offline data collection activity
                                        was never started.
                                        Auto Offline Data Collection: Disabled.
Self-test execution status:      (   0) The previous self-test routine completed
                                        without error or no self-test has ever 
                                        been run.
Total time to complete Offline 
data collection:                (    0) seconds.
Offline data collection
capabilities:                    (0x53) SMART execute Offline immediate.
                                        Auto Offline data collection on/off support.
                                        Suspend Offline collection upon new
                                        command.
                                        No Offline surface scan supported.
                                        Self-test supported.
                                        No Conveyance Self-test supported.
                                        Selective Self-test supported.
SMART capabilities:            (0x0003) Saves SMART data before entering
                                        power-saving mode.
                                        Supports SMART auto save timer.
Error logging capability:        (0x01) Error logging supported.
                                        General Purpose Logging supported.
Short self-test routine 
recommended polling time:        (   2) minutes.
Extended self-test routine
recommended polling time:        (  35) minutes.
SCT capabilities:              (0x003d) SCT Status supported.
                                        SCT Error Recovery Control supported.
                                        SCT Feature Control supported.
                                        SCT Data Table supported.

SMART Attributes Data Structure revision number: 1
Vendor Specific SMART Attributes with Thresholds:
ID# ATTRIBUTE_NAME          FLAGS    VALUE WORST THRESH FAIL RAW_VALUE
  5 Reallocated_Sector_Ct   PO--CK   100   100   010    -    0
  9 Power_On_Hours          -O--CK   098   098   000    -    5135
 12 Power_Cycle_Count       -O--CK   099   099   000    -    9
177 Wear_Leveling_Count     PO--C-   099   099   005    -    19
179 Used_Rsvd_Blk_Cnt_Tot   PO--C-   100   100   010    -    0
180 Unused_Rsvd_Blk_Cnt_Tot PO--C-   100   100   010    -    1413
181 Program_Fail_Cnt_Total  -O--CK   100   100   010    -    0
182 Erase_Fail_Count_Total  -O--CK   100   100   010    -    0
183 Runtime_Bad_Block       PO--C-   100   100   010    -    0
184 End-to-End_Error        PO--CK   100   100   097    -    0
187 Reported_Uncorrect      -O--CK   100   100   000    -    0
190 Airflow_Temperature_Cel -O--CK   079   064   000    -    21
194 Temperature_Celsius     -O---K   079   060   000    -    21 (Min/Max 20/38)
195 Hardware_ECC_Recovered  -O-RC-   200   200   000    -    0
197 Current_Pending_Sector  -O--CK   100   100   000    -    0
199 UDMA_CRC_Error_Count    -OSRCK   100   100   000    -    0
202 Unknown_SSD_Attribute   PO--CK   100   100   010    -    0
235 Unknown_Attribute       -O--C-   099   099   000    -    4
241 Total_LBAs_Written      -O--CK   099   099   000    -    14232984171
242 Total_LBAs_Read         -O--CK   099   099   000    -    13457360765
243 Unknown_Attribute       -O--CK   100   100   000    -    0
244 Unknown_Attribute       -O--CK   100   100   000    -    0
245 Unknown_Attribute       -O--CK   100   100   000    -    65535
246 Unknown_Attribute       -O--CK   100   100   000    -    65535
247 Unknown_Attribute       -O--CK   100   100   000    -    65535
251 Unknown_Attribute       -O--CK   100   100   000    -    15204055360
                            ||||||_ K auto-keep
                            |||||__ C event count
                            ||||___ R error rate
                            |||____ S speed/performance
                            ||_____ O updated online
                            |______ P prefailure warning

General Purpose Log Directory Version 1
SMART           Log Directory Version 1 [multi-sector log support]
Address    Access  R/W   Size  Description
0x00       GPL,SL  R/O      1  Log Directory
0x01           SL  R/O      1  Summary SMART error log
0x02           SL  R/O      1  Comprehensive SMART error log
0x03       GPL     R/O      1  Ext. Comprehensive SMART error log
0x04       GPL,SL  R/O      8  Device Statistics log
0x06           SL  R/O      1  SMART self-test log
0x07       GPL     R/O      1  Extended self-test log
0x09           SL  R/W      1  Selective self-test log
0x10       GPL     R/O      1  NCQ Command Error log
0x11       GPL     R/O      1  SATA Phy Event Counters log
0x12       GPL     R/O      1  SATA NCQ Non-Data log
0x13       GPL     R/O      1  SATA NCQ Send and Receive log
0x30       GPL,SL  R/O      9  IDENTIFY DEVICE data log
0x80-0x9f  GPL,SL  R/W     16  Host vendor specific log
0xa5           SL  VS      16  Device vendor specific log
0xce           SL  VS      16  Device vendor specific log
0xe0       GPL,SL  R/W      1  SCT Command/Status
0xe1       GPL,SL  R/W      1  SCT Data Transfer

SMART Extended Comprehensive Error Log Version: 1 (1 sectors)
No Errors Logged

SMART Extended Self-test Log Version: 1 (1 sectors)
Num  Test_Description    Status                  Remaining  LifeTime(hours)  LBA_of_first_error
# 1  Short offline       Completed without error       00%      5112         -
# 2  Short offline       Completed without error       00%      4482         -

SMART Selective self-test log data structure revision number 1
 SPAN  MIN_LBA  MAX_LBA  CURRENT_TEST_STATUS
    1        0        0  Not_testing
    2        0        0  Not_testing
    3        0        0  Not_testing
    4        0        0  Not_testing
    5        0        0  Not_testing
Selective self-test flags (0x0):
  After scanning selected spans, do NOT read-scan remainder of disk.
If Selective self-test is pending on power-up, resume after 0 minute delay.

SCT Status Version:                  3
SCT Version (vendor specific):       256 (0x0100)
SCT Support Level:                   1
Device State:                        Active (0)
Current Temperature:                    21 Celsius
Power Cycle Min/Max Temperature:     20/28 Celsius
Lifetime    Min/Max Temperature:     20/38 Celsius
Under/Over Temperature Limit Count:   0/0

SCT Temperature History Version:     2
Temperature Sampling Period:         1 minute
Temperature Logging Interval:        10 minutes
Min/Max recommended Temperature:      0/70 Celsius
Min/Max Temperature Limit:            0/70 Celsius
Temperature History Size (Index):    128 (98)

Index    Estimated Time   Temperature Celsius
  99    2020-09-30 14:40    21  **
 100    2020-09-30 14:50    22  ***
 101    2020-09-30 15:00    21  **
 102    2020-09-30 15:10    22  ***
 103    2020-09-30 15:20    22  ***
 104    2020-09-30 15:30    22  ***
 105    2020-09-30 15:40    21  **
 ...    ..(  6 skipped).    ..  **
 112    2020-09-30 16:50    21  **
 113    2020-09-30 17:00    22  ***
 114    2020-09-30 17:10    21  **
 115    2020-09-30 17:20    22  ***
 116    2020-09-30 17:30    21  **
 117    2020-09-30 17:40    21  **
 118    2020-09-30 17:50    22  ***
 119    2020-09-30 18:00    21  **
 ...    ..(  2 skipped).    ..  **
 122    2020-09-30 18:30    21  **
 123    2020-09-30 18:40    22  ***
 124    2020-09-30 18:50    21  **
 ...    ..(  3 skipped).    ..  **
   0    2020-09-30 19:30    21  **
   1    2020-09-30 19:40    22  ***
   2    2020-09-30 19:50    22  ***
   3    2020-09-30 20:00    21  **
   4    2020-09-30 20:10    22  ***
   5    2020-09-30 20:20    22  ***
   6    2020-09-30 20:30    21  **
   7    2020-09-30 20:40    21  **
   8    2020-09-30 20:50    22  ***
   9    2020-09-30 21:00    21  **
 ...    ..( 11 skipped).    ..  **
  21    2020-09-30 23:00    21  **
  22    2020-09-30 23:10    22  ***
  23    2020-09-30 23:20    22  ***
  24    2020-09-30 23:30    21  **
  25    2020-09-30 23:40    22  ***
  26    2020-09-30 23:50    21  **
  27    2020-10-01 00:00    21  **
  28    2020-10-01 00:10    21  **
  29    2020-10-01 00:20    23  ****
  30    2020-10-01 00:30    21  **
  31    2020-10-01 00:40    23  ****
  32    2020-10-01 00:50    22  ***
  33    2020-10-01 01:00    22  ***
  34    2020-10-01 01:10    21  **
  35    2020-10-01 01:20    21  **
  36    2020-10-01 01:30    22  ***
 ...    ..(  2 skipped).    ..  ***
  39    2020-10-01 02:00    22  ***
  40    2020-10-01 02:10    21  **
  41    2020-10-01 02:20    21  **
  42    2020-10-01 02:30    21  **
  43    2020-10-01 02:40    22  ***
  44    2020-10-01 02:50    21  **
  45    2020-10-01 03:00    22  ***
  46    2020-10-01 03:10    21  **
  47    2020-10-01 03:20    22  ***
  48    2020-10-01 03:30    22  ***
  49    2020-10-01 03:40    21  **
 ...    ..(  2 skipped).    ..  **
  52    2020-10-01 04:10    21  **
  53    2020-10-01 04:20    22  ***
  54    2020-10-01 04:30    21  **
  55    2020-10-01 04:40    21  **
  56    2020-10-01 04:50    22  ***
  57    2020-10-01 05:00    22  ***
  58    2020-10-01 05:10    22  ***
  59    2020-10-01 05:20    21  **
  60    2020-10-01 05:30    22  ***
 ...    ..(  2 skipped).    ..  ***
  63    2020-10-01 06:00    22  ***
  64    2020-10-01 06:10    21  **
  65    2020-10-01 06:20    21  **
  66    2020-10-01 06:30    22  ***
  67    2020-10-01 06:40    21  **
  68    2020-10-01 06:50    22  ***
  69    2020-10-01 07:00    21  **
  70    2020-10-01 07:10    21  **
  71    2020-10-01 07:20    21  **
  72    2020-10-01 07:30    22  ***
  73    2020-10-01 07:40    21  **
  74    2020-10-01 07:50    22  ***
 ...    ..(  2 skipped).    ..  ***
  77    2020-10-01 08:20    22  ***
  78    2020-10-01 08:30    21  **
  79    2020-10-01 08:40    22  ***
 ...    ..(  2 skipped).    ..  ***
  82    2020-10-01 09:10    22  ***
  83    2020-10-01 09:20    21  **
 ...    ..(  3 skipped).    ..  **
  87    2020-10-01 10:00    21  **
  88    2020-10-01 10:10    22  ***
  89    2020-10-01 10:20    21  **
  90    2020-10-01 10:30    21  **
  91    2020-10-01 10:40    22  ***
  92    2020-10-01 10:50    21  **
 ...    ..(  4 skipped).    ..  **
  97    2020-10-01 11:40    21  **
  98    2020-10-01 11:50    22  ***

SCT Error Recovery Control:
           Read: Disabled
          Write: Disabled

Device Statistics (GP Log 0x04)
Page  Offset Size        Value Flags Description
0x01  =====  =               =  ===  == General Statistics (rev 1) ==
0x01  0x008  4               9  ---  Lifetime Power-On Resets
0x01  0x010  4            5135  ---  Power-on Hours
0x01  0x018  6     14232984171  ---  Logical Sectors Written
0x01  0x020  6       451077925  ---  Number of Write Commands
0x01  0x028  6     13457360765  ---  Logical Sectors Read
0x01  0x030  6        54354715  ---  Number of Read Commands
0x01  0x038  6          762000  ---  Date and Time TimeStamp
0x04  =====  =               =  ===  == General Errors Statistics (rev 1) ==
0x04  0x008  4               0  ---  Number of Reported Uncorrectable Errors
0x04  0x010  4               0  ---  Resets Between Cmd Acceptance and Completion
0x05  =====  =               =  ===  == Temperature Statistics (rev 1) ==
0x05  0x008  1              21  ---  Current Temperature
0x05  0x020  1              38  ---  Highest Temperature
0x05  0x028  1              20  ---  Lowest Temperature
0x05  0x058  1              70  ---  Specified Maximum Operating Temperature
0x06  =====  =               =  ===  == Transport Statistics (rev 1) ==
0x06  0x008  4              81  ---  Number of Hardware Resets
0x06  0x010  4               0  ---  Number of ASR Events
0x06  0x018  4               0  ---  Number of Interface CRC Errors
0x07  =====  =               =  ===  == Solid State Device Statistics (rev 1) ==
0x07  0x008  1               0  N--  Percentage Used Endurance Indicator
                                |||_ C monitored condition met
                                ||__ D supports DSN
                                |___ N normalized value

Pending Defects log (GP Log 0x0c) not supported

SATA Phy Event Counters (GP Log 0x11)
ID      Size     Value  Description
0x0001  2            0  Command failed due to ICRC error
0x0002  2            0  R_ERR response for data FIS
0x0003  2            0  R_ERR response for device-to-host data FIS
0x0004  2            0  R_ERR response for host-to-device data FIS
0x0005  2            0  R_ERR response for non-data FIS
0x0006  2            0  R_ERR response for device-to-host non-data FIS
0x0007  2            0  R_ERR response for host-to-device non-data FIS
0x0008  2            0  Device-to-host non-data FIS retries
0x0009  2            6  Transition from drive PhyRdy to drive PhyNRdy
0x000a  2            6  Device-to-host register FISes sent due to a COMRESET
0x000b  2            0  CRC errors within host-to-device FIS
0x000d  2            0  Non-CRC errors within host-to-device FIS
0x000f  2            0  R_ERR response for host-to-device data FIS, CRC
0x0010  2            0  R_ERR response for host-to-device data FIS, non-CRC
0x0012  2            0  R_ERR response for host-to-device non-data FIS, CRC
0x0013  2            0  R_ERR response for host-to-device non-data FIS, non-CRC

