smartctl pre-7.4 2023-02-05 r5450 [x86_64-linux-3.10.0-1160.el7.x86_64] (local build)
Copyright (C) 2002-23, Bruce Allen, Christian Franke, www.smartmontools.org

=== START OF INFORMATION SECTION ===
Model Family:     Samsung based SSDs
Device Model:     SAMSUNG MZ7L3960HBLT-00B7C
Serial Number:    S6KPNE0T108628
LU WWN Device Id: 5 002538 f0211ceac
Firmware Version: JXTE204Q
User Capacity:    960,197,124,096 bytes [960 GB]
Sector Sizes:     512 bytes logical, 4096 bytes physical
Rotation Rate:    Solid State Device
Form Factor:      2.5 inches
TRIM Command:     Available, deterministic, zeroed
Device is:        In smartctl database 7.3/5440
ATA Version is:   ACS-4 T13/BSR INCITS 529 revision 5
SATA Version is:  SATA 3.2, 6.0 Gb/s (current: 6.0 Gb/s)
Local Time is:    Mon Feb  6 19:17:15 2023 CST
SMART support is: Available - device has SMART capability.
SMART support is: Enabled
AAM feature is:   Unavailable
APM feature is:   Unavailable
Rd look-ahead is: Enabled
Write cache is:   Enabled
DSN feature is:   Unavailable
ATA Security is:  Disabled, NOT FROZEN [SEC1]
Wt Cache Reorder: Enabled

=== START OF READ SMART DATA SECTION ===
SMART overall-health self-assessment test result: PASSED

General SMART Values:
Offline data collection status:  (0x00)	Offline data collection activity
					was never started.
					Auto Offline Data Collection: Disabled.
Self-test execution status:      (   0)	The previous self-test routine completed
					without error or no self-test has ever 
					been run.
Total time to complete Offline 
data collection: 		(    0) seconds.
Offline data collection
capabilities: 			 (0x53) SMART execute Offline immediate.
					Auto Offline data collection on/off support.
					Suspend Offline collection upon new
					command.
					No Offline surface scan supported.
					Self-test supported.
					No Conveyance Self-test supported.
					Selective Self-test supported.
SMART capabilities:            (0x0003)	Saves SMART data before entering
					power-saving mode.
					Supports SMART auto save timer.
Error logging capability:        (0x01)	Error logging supported.
					General Purpose Logging supported.
Short self-test routine 
recommended polling time: 	 (   2) minutes.
Extended self-test routine
recommended polling time: 	 (  60) minutes.
SCT capabilities: 	       (0x003d)	SCT Status supported.
					SCT Error Recovery Control supported.
					SCT Feature Control supported.
					SCT Data Table supported.

SMART Attributes Data Structure revision number: 1
Vendor Specific SMART Attributes with Thresholds:
ID# ATTRIBUTE_NAME          FLAGS    VALUE WORST THRESH FAIL RAW_VALUE
  5 Reallocated_Sector_Ct   PO--CK   100   100   010    -    0
  9 Power_On_Hours          -O--CK   099   099   000    -    1944
 12 Power_Cycle_Count       -O--CK   099   099   000    -    98
177 Wear_Leveling_Count     PO--C-   099   099   005    -    1
179 Used_Rsvd_Blk_Cnt_Tot   PO--C-   100   100   010    -    0
180 Unused_Rsvd_Blk_Cnt_Tot PO--C-   100   100   010    -    1762
181 Program_Fail_Cnt_Total  -O--CK   100   100   010    -    0
182 Erase_Fail_Count_Total  -O--CK   100   100   010    -    0
183 Runtime_Bad_Block       PO--C-   100   100   010    -    0
184 End-to-End_Error        PO--CK   100   100   097    -    0
187 Uncorrectable_Error_Cnt -O--CK   100   100   000    -    0
190 Airflow_Temperature_Cel -O--CK   059   045   000    -    41
194 Temperature_Celsius     -O---K   059   044   000    -    41 (Min/Max 29/56)
195 ECC_Error_Rate          -O-RC-   200   200   000    -    0
197 Current_Pending_Sector  -O--CK   100   100   000    -    0
199 CRC_Error_Count         -OSRCK   100   100   000    -    0
202 Exception_Mode_Status   PO--CK   100   100   010    -    0
235 POR_Recovery_Count      -O--C-   099   099   000    -    80
241 Total_LBAs_Written      -O--CK   099   099   000    -    2195469664
242 Total_LBAs_Read         -O--CK   099   099   000    -    2258781225
243 SATA_Downshift_Ct       -O--CK   100   100   000    -    0
244 Thermal_Throttle_St     -O--CK   100   100   000    -    0
245 Timed_Workld_Media_Wear -O--CK   100   100   000    -    65535
246 Timed_Workld_RdWr_Ratio -O--CK   100   100   000    -    65535
247 Timed_Workld_Timer      -O--CK   100   100   000    -    65535
251 NAND_Writes             -O--CK   100   100   000    -    2196900864
                            ||||||_ K auto-keep
                            |||||__ C event count
                            ||||___ R error rate
                            |||____ S speed/performance
                            ||_____ O updated online
                            |______ P prefailure warning

General Purpose Log Directory Version 1
SMART           Log Directory Version 1 [multi-sector log support]
Address    Access  R/W   Size  Description
0x00       GPL,SL  R/O      1  Log Directory
0x01           SL  R/O      1  Summary SMART error log
0x02           SL  R/O      1  Comprehensive SMART error log
0x03       GPL     R/O      1  Ext. Comprehensive SMART error log
0x04       GPL,SL  R/O      8  Device Statistics log
0x06           SL  R/O      1  SMART self-test log
0x07       GPL     R/O      1  Extended self-test log
0x09           SL  R/W      1  Selective self-test log
0x10       GPL     R/O      1  NCQ Command Error log
0x11       GPL     R/O      1  SATA Phy Event Counters log
0x12       GPL     R/O      1  SATA NCQ Non-Data log
0x13       GPL     R/O      1  SATA NCQ Send and Receive log
0x30       GPL,SL  R/O      9  IDENTIFY DEVICE data log
0x80-0x9f  GPL,SL  R/W     16  Host vendor specific log
0xa5           SL  VS      16  Device vendor specific log
0xce           SL  VS      16  Device vendor specific log
0xe0       GPL,SL  R/W      1  SCT Command/Status
0xe1       GPL,SL  R/W      1  SCT Data Transfer

SMART Extended Comprehensive Error Log Version: 1 (1 sectors)
No Errors Logged

SMART Extended Self-test Log Version: 1 (1 sectors)
Num  Test_Description    Status                  Remaining  LifeTime(hours)  LBA_of_first_error
# 1  Extended offline    Completed without error       00%        16         -
# 2  Short offline       Completed without error       00%        16         -

SMART Selective self-test log data structure revision number 1
 SPAN  MIN_LBA  MAX_LBA  CURRENT_TEST_STATUS
    1        0        0  Not_testing
    2        0        0  Not_testing
    3        0        0  Not_testing
    4        0        0  Not_testing
    5        0        0  Not_testing
  256        0    65535  Read_scanning was never started
Selective self-test flags (0x0):
  After scanning selected spans, do NOT read-scan remainder of disk.
If Selective self-test is pending on power-up, resume after 0 minute delay.

SCT Status Version:                  3
SCT Version (vendor specific):       256 (0x0100)
Device State:                        Active (0)
Current Temperature:                    41 Celsius
Power Cycle Min/Max Temperature:     29/46 Celsius
Lifetime    Min/Max Temperature:     29/56 Celsius
Specified Max Operating Temperature:    70 Celsius
Under/Over Temperature Limit Count:   0/0
SMART Status:                        0xc24f (PASSED)

SCT Temperature History Version:     2
Temperature Sampling Period:         10 minutes
Temperature Logging Interval:        10 minutes
Min/Max recommended Temperature:      0/70 Celsius
Min/Max Temperature Limit:            0/70 Celsius
Temperature History Size (Index):    128 (16)

Index    Estimated Time   Temperature Celsius
  17    2023-02-05 22:00    44  *************************
 ...    ..(  8 skipped).    ..  *************************
  26    2023-02-05 23:30    44  *************************
  27    2023-02-05 23:40    43  ************************
 ...    ..(  2 skipped).    ..  ************************
  30    2023-02-06 00:10    43  ************************
  31    2023-02-06 00:20    44  *************************
 ...    ..( 53 skipped).    ..  *************************
  85    2023-02-06 09:20    44  *************************
  86    2023-02-06 09:30    43  ************************
  87    2023-02-06 09:40    43  ************************
  88    2023-02-06 09:50    42  ***********************
 ...    ..(  2 skipped).    ..  ***********************
  91    2023-02-06 10:20    42  ***********************
  92    2023-02-06 10:30    43  ************************
 ...    ..(  3 skipped).    ..  ************************
  96    2023-02-06 11:10    43  ************************
  97    2023-02-06 11:20    44  *************************
  98    2023-02-06 11:30    43  ************************
  99    2023-02-06 11:40    43  ************************
 100    2023-02-06 11:50    44  *************************
 ...    ..( 17 skipped).    ..  *************************
 118    2023-02-06 14:50    44  *************************
 119    2023-02-06 15:00    45  **************************
 120    2023-02-06 15:10    44  *************************
 121    2023-02-06 15:20    44  *************************
 122    2023-02-06 15:30    43  ************************
 ...    ..(  3 skipped).    ..  ************************
 126    2023-02-06 16:10    43  ************************
 127    2023-02-06 16:20    44  *************************
 ...    ..(  6 skipped).    ..  *************************
   6    2023-02-06 17:30    44  *************************
   7    2023-02-06 17:40    45  **************************
 ...    ..(  2 skipped).    ..  **************************
  10    2023-02-06 18:10    45  **************************
  11    2023-02-06 18:20    44  *************************
  12    2023-02-06 18:30    43  ************************
  13    2023-02-06 18:40    40  *********************
  14    2023-02-06 18:50    40  *********************
  15    2023-02-06 19:00    40  *********************
  16    2023-02-06 19:10    41  **********************

SCT Error Recovery Control:
           Read: Disabled
          Write: Disabled

Device Statistics (GP Log 0x04)
Page  Offset Size        Value Flags Description
0x01  =====  =               =  ===  == General Statistics (rev 1) ==
0x01  0x008  4              98  ---  Lifetime Power-On Resets
0x01  0x010  4            1944  ---  Power-on Hours
0x01  0x018  6      2195471088  ---  Logical Sectors Written
0x01  0x020  6       271072915  ---  Number of Write Commands
0x01  0x028  6      2258781225  ---  Logical Sectors Read
0x01  0x030  6       272191073  ---  Number of Read Commands
0x01  0x038  6         3059000  ---  Date and Time TimeStamp
0x04  =====  =               =  ===  == General Errors Statistics (rev 1) ==
0x04  0x008  4               0  ---  Number of Reported Uncorrectable Errors
0x04  0x010  4               0  ---  Resets Between Cmd Acceptance and Completion
0x05  =====  =               =  ===  == Temperature Statistics (rev 1) ==
0x05  0x008  1              41  ---  Current Temperature
0x05  0x020  1              56  ---  Highest Temperature
0x05  0x028  1              29  ---  Lowest Temperature
0x05  0x058  1              70  ---  Specified Maximum Operating Temperature
0x06  =====  =               =  ===  == Transport Statistics (rev 1) ==
0x06  0x008  4             583  ---  Number of Hardware Resets
0x06  0x010  4               0  ---  Number of ASR Events
0x06  0x018  4               0  ---  Number of Interface CRC Errors
0x07  =====  =               =  ===  == Solid State Device Statistics (rev 1) ==
0x07  0x008  1               0  N--  Percentage Used Endurance Indicator
                                |||_ C monitored condition met
                                ||__ D supports DSN
                                |___ N normalized value

Pending Defects log (GP Log 0x0c) not supported

SATA Phy Event Counters (GP Log 0x11)
ID      Size     Value  Description
0x0001  2            0  Command failed due to ICRC error
0x0002  2            0  R_ERR response for data FIS
0x0003  2            0  R_ERR response for device-to-host data FIS
0x0004  2            0  R_ERR response for host-to-device data FIS
0x0005  2            0  R_ERR response for non-data FIS
0x0006  2            0  R_ERR response for device-to-host non-data FIS
0x0007  2            0  R_ERR response for host-to-device non-data FIS
0x0008  2            0  Device-to-host non-data FIS retries
0x0009  2            3  Transition from drive PhyRdy to drive PhyNRdy
0x000a  2            3  Device-to-host register FISes sent due to a COMRESET
0x000b  2            0  CRC errors within host-to-device FIS
0x000d  2            0  Non-CRC errors within host-to-device FIS
0x000f  2            0  R_ERR response for host-to-device data FIS, CRC
0x0010  2            0  R_ERR response for host-to-device data FIS, non-CRC
0x0012  2            0  R_ERR response for host-to-device non-data FIS, CRC
0x0013  2            0  R_ERR response for host-to-device non-data FIS, non-CRC

