smartctl 7.1 2019-12-30 r5022 [x86_64-linux-5.15.0-76-generic] (local build)
Copyright (C) 2002-19, Bruce Allen, Christian Franke, www.smartmontools.org

=== START OF INFORMATION SECTION ===
Model Family:     LONGSYS UNICA 3836 Enterprise SSD
Device Model:     RSYE3836N-480G
Serial Number:    NC8T788400368
LU WWN Device Id: 5 3a5a27 7880e0095
Firmware Version: SX00006C
User Capacity:    480,103,981,056 bytes [480 GB]
Sector Sizes:     512 bytes logical, 4096 bytes physical
Rotation Rate:    Solid State Device
Form Factor:      2.5 inches
Device is:        In smartctl database [for details use: -P show]
ATA Version is:   ACS-4 (minor revision not indicated)
SATA Version is:  SATA 3.2, 6.0 Gb/s (current: 6.0 Gb/s)
Local Time is:    Sun Oct  8 13:21:02 2023 CST
SMART support is: Available - device has SMART capability.
SMART support is: Enabled
AAM feature is:   Unavailable
APM level is:     254 (maximum performance)
Rd look-ahead is: Enabled
Write cache is:   Enabled
DSN feature is:   Unavailable
ATA Security is:  Disabled, NOT FROZEN [SEC1]
Wt Cache Reorder: Enabled

=== START OF READ SMART DATA SECTION ===
SMART overall-health self-assessment test result: PASSED

General SMART Values:
Offline data collection status:  (0x00)	Offline data collection activity
					was never started.
					Auto Offline Data Collection: Disabled.
Self-test execution status:      (   0)	The previous self-test routine completed
					without error or no self-test has ever 
					been run.
Total time to complete Offline 
data collection: 		(   33) seconds.
Offline data collection
capabilities: 			 (0x7b) SMART execute Offline immediate.
					Auto Offline data collection on/off support.
					Suspend Offline collection upon new
					command.
					Offline surface scan supported.
					Self-test supported.
					Conveyance Self-test supported.
					Selective Self-test supported.
SMART capabilities:            (0x0003)	Saves SMART data before entering
					power-saving mode.
					Supports SMART auto save timer.
Error logging capability:        (0x01)	Error logging supported.
					General Purpose Logging supported.
Short self-test routine 
recommended polling time: 	 (   2) minutes.
Extended self-test routine
recommended polling time: 	 (   3) minutes.
Conveyance self-test routine
recommended polling time: 	 (   3) minutes.
SCT capabilities: 	       (0x0035)	SCT Status supported.
					SCT Feature Control supported.
					SCT Data Table supported.

SMART Attributes Data Structure revision number: 0
Vendor Specific SMART Attributes with Thresholds:
ID# ATTRIBUTE_NAME          FLAGS    VALUE WORST THRESH FAIL RAW_VALUE
  1 Raw_Read_Error_Rate     POSR-K   100   100   050    -    0
  5 Number_of_New_Bad_Block -O--CK   100   100   001    -    0
  9 Power_On_Hours          -O--CK   100   100   000    -    2
 12 Power_Cycle_Count       -O--CK   100   100   001    -    5
170 Available_Rsved_Space   PO--CK   100   100   010    -    0
171 Program_Fail_Cnt        -O--CK   100   100   000    -    0
172 Erase_Fail_Cnt          -O--CK   100   100   001    -    0
173 Avg_Block_Erase_Cnt     -O--CK   100   100   000    -    0
174 Unexpect_Power_Loss_Cnt -O--CK   100   100   000    -    4
175 PLP_Failure             P-----   100   100   001    -    0
180 Unused_Rsvd_Blk_Cnt_Tot PO--CK   100   100   000    -    1796
183 SATA_Downshift_Cnt      -O--CK   100   100   000    -    0
184 End-to-End_Error        -O--CK   100   100   000    -    0
187 Reported_Uncorrect      -O--CK   100   100   000    -    0
188 Command_Timeout         -O--CK   100   100   000    -    0
194 Temperature_Celsius     -O---K   063   063   000    -    37 (Min/Max 23/37)
195 ECC_Recovered_Cnt       -O--CK   100   100   000    -    0
198 Offline_Uncorrectable   ----CK   100   100   000    -    0
199 UDMA_CRC_Error_Count    -O--CK   100   100   000    -    0
202 Perc_Rated_Life_Remain  ----CK   100   100   001    -    0
210 RAID_Recovered_Cnt      -O--CK   100   100   000    -    0
241 Total_Pages_Written     -OS--K   100   100   000    -    0
242 Total_Pages_Read        -OS--K   100   100   000    -    404
248 Internal_Pages_Written  -O--CK   100   100   000    -    0
                            ||||||_ K auto-keep
                            |||||__ C event count
                            ||||___ R error rate
                            |||____ S speed/performance
                            ||_____ O updated online
                            |______ P prefailure warning

General Purpose Log Directory Version 1
SMART           Log Directory Version 1 [multi-sector log support]
Address    Access  R/W   Size  Description
0x00       GPL,SL  R/O      1  Log Directory
0x01           SL  R/O      1  Summary SMART error log
0x02           SL  R/O      8  Comprehensive SMART error log
0x03       GPL     R/O      8  Ext. Comprehensive SMART error log
0x04       GPL,SL  R/O      8  Device Statistics log
0x06           SL  R/O      1  SMART self-test log
0x07       GPL     R/O      1  Extended self-test log
0x09           SL  R/W      1  Selective self-test log
0x10       GPL     R/O      1  NCQ Command Error log
0x11       GPL     R/O      1  SATA Phy Event Counters log
0x30       GPL,SL  R/O      9  IDENTIFY DEVICE data log
0x80-0x9f  GPL,SL  R/W     16  Host vendor specific log
0xe0       GPL,SL  R/W      1  SCT Command/Status
0xe1       GPL,SL  R/W      1  SCT Data Transfer

SMART Extended Comprehensive Error Log Version: 1 (8 sectors)
No Errors Logged

SMART Extended Self-test Log Version: 1 (1 sectors)
Num  Test_Description    Status                  Remaining  LifeTime(hours)  LBA_of_first_error
# 1  Short offline       Completed without error       00%         1         -

SMART Selective self-test log data structure revision number 1
 SPAN  MIN_LBA  MAX_LBA  CURRENT_TEST_STATUS
    1        0        0  Not_testing
    2        0        0  Not_testing
    3        0        0  Not_testing
    4        0        0  Not_testing
    5        0        0  Not_testing
Selective self-test flags (0x0):
  After scanning selected spans, do NOT read-scan remainder of disk.
If Selective self-test is pending on power-up, resume after 0 minute delay.

SCT Status Version:                  3
SCT Version (vendor specific):       1 (0x0001)
Device State:                        Active (0)
Current Temperature:                    37 Celsius
Power Cycle Min/Max Temperature:     27/37 Celsius
Lifetime    Min/Max Temperature:     23/37 Celsius
Under/Over Temperature Limit Count:   0/0

SCT Temperature History Version:     2
Temperature Sampling Period:         1 minute
Temperature Logging Interval:        1 minute
Min/Max recommended Temperature:      0/70 Celsius
Min/Max Temperature Limit:           -40/85 Celsius
Temperature History Size (Index):    478 (134)

Index    Estimated Time   Temperature Celsius
 135    2023-10-08 05:24     ?  -
 ...    ..(341 skipped).    ..  -
 477    2023-10-08 11:06     ?  -
   0    2023-10-08 11:07    30  ***********
   1    2023-10-08 11:08     ?  -
   2    2023-10-08 11:09     ?  -
   3    2023-10-08 11:10    29  **********
   4    2023-10-08 11:11    31  ************
   5    2023-10-08 11:12    32  *************
   6    2023-10-08 11:13    33  **************
   7    2023-10-08 11:14     ?  -
   8    2023-10-08 11:15    33  **************
   9    2023-10-08 11:16    34  ***************
  10    2023-10-08 11:17    35  ****************
  11    2023-10-08 11:18    35  ****************
  12    2023-10-08 11:19    36  *****************
  13    2023-10-08 11:20    36  *****************
  14    2023-10-08 11:21    36  *****************
  15    2023-10-08 11:22    37  ******************
  16    2023-10-08 11:23    36  *****************
  17    2023-10-08 11:24    36  *****************
  18    2023-10-08 11:25    37  ******************
  19    2023-10-08 11:26    37  ******************
  20    2023-10-08 11:27    36  *****************
  21    2023-10-08 11:28    37  ******************
 ...    ..( 15 skipped).    ..  ******************
  37    2023-10-08 11:44    37  ******************
  38    2023-10-08 11:45     ?  -
  39    2023-10-08 11:46    27  ********
  40    2023-10-08 11:47     ?  -
  41    2023-10-08 11:48    27  ********
  42    2023-10-08 11:49    30  ***********
  43    2023-10-08 11:50    31  ************
  44    2023-10-08 11:51    33  **************
  45    2023-10-08 11:52    33  **************
  46    2023-10-08 11:53    34  ***************
  47    2023-10-08 11:54    35  ****************
  48    2023-10-08 11:55    35  ****************
  49    2023-10-08 11:56    36  *****************
 ...    ..(  6 skipped).    ..  *****************
  56    2023-10-08 12:03    36  *****************
  57    2023-10-08 12:04    37  ******************
  58    2023-10-08 12:05    37  ******************
  59    2023-10-08 12:06    36  *****************
  60    2023-10-08 12:07    37  ******************
 ...    ..(  8 skipped).    ..  ******************
  69    2023-10-08 12:16    37  ******************
  70    2023-10-08 12:17    36  *****************
  71    2023-10-08 12:18    36  *****************
  72    2023-10-08 12:19    37  ******************
  73    2023-10-08 12:20    37  ******************
  74    2023-10-08 12:21    37  ******************
  75    2023-10-08 12:22    36  *****************
  76    2023-10-08 12:23    37  ******************
 ...    ..( 14 skipped).    ..  ******************
  91    2023-10-08 12:38    37  ******************
  92    2023-10-08 12:39    36  *****************
  93    2023-10-08 12:40    36  *****************
  94    2023-10-08 12:41    37  ******************
 ...    ..(  6 skipped).    ..  ******************
 101    2023-10-08 12:48    37  ******************
 102    2023-10-08 12:49    36  *****************
 103    2023-10-08 12:50    37  ******************
 ...    ..( 30 skipped).    ..  ******************
 134    2023-10-08 13:21    37  ******************

SCT Error Recovery Control command not supported

Device Statistics (GP Log 0x04)
Page  Offset Size        Value Flags Description
0x01  =====  =               =  ===  == General Statistics (rev 1) ==
0x01  0x008  4               5  ---  Lifetime Power-On Resets
0x01  0x010  4               2  ---  Power-on Hours
0x01  0x018  6               0  ---  Logical Sectors Written
0x01  0x020  6               0  ---  Number of Write Commands
0x01  0x028  6           12898  ---  Logical Sectors Read
0x01  0x030  6             298  ---  Number of Read Commands
0x01  0x038  6         7200000  ---  Date and Time TimeStamp
0x05  =====  =               =  ===  == Temperature Statistics (rev 1) ==
0x05  0x008  1              37  ---  Current Temperature
0x05  0x020  1              37  ---  Highest Temperature
0x05  0x028  1              23  ---  Lowest Temperature
0x07  =====  =               =  ===  == Solid State Device Statistics (rev 1) ==
0x07  0x008  1               0  ---  Percentage Used Endurance Indicator
                                |||_ C monitored condition met
                                ||__ D supports DSN
                                |___ N normalized value

Pending Defects log (GP Log 0x0c) not supported

SATA Phy Event Counters (GP Log 0x11)
ID      Size     Value  Description
0x0001  2            0  Command failed due to ICRC error
0x000a  4            1  Device-to-host register FISes sent due to a COMRESET

