smartctl 6.6 2017-11-05 r4594 [armv7l-linux-4.9.80-1-ARCH] (local build)
Copyright (C) 2002-17, Bruce Allen, Christian Franke, www.smartmontools.org

=== START OF INFORMATION SECTION ===
Device Model:     WDC WD10S21X-24R1BT0-SSHD-8GB
Serial Number:    WD-WX51A65KXNF2
LU WWN Device Id: 5 0014ee 65b386553
Firmware Version: 03.01A02
User Capacity:    1,000,204,886,016 bytes [1,00 TB]
Sector Sizes:     512 bytes logical, 4096 bytes physical
Rotation Rate:    5400 rpm
Device is:        Not in smartctl database [for details use: -P showall]
ATA Version is:   ACS-2 (minor revision not indicated)
SATA Version is:  SATA 3.0, 6.0 Gb/s (current: 6.0 Gb/s)
Local Time is:    Thu Feb 15 21:49:35 2018 CET
SMART support is: Available - device has SMART capability.
SMART support is: Enabled
AAM feature is:   Unavailable
APM level is:     88 (intermediate level with standby)
Rd look-ahead is: Enabled
Write cache is:   Enabled
DSN feature is:   Unavailable
ATA Security is:  Disabled, NOT FROZEN [SEC1]
Wt Cache Reorder: Unknown

=== START OF READ SMART DATA SECTION ===
SMART Status not supported: Incomplete response, ATA output registers missing
SMART overall-health self-assessment test result: PASSED
Warning: This result is based on an Attribute check.

General SMART Values:
Offline data collection status:  (0x00)	Offline data collection activity
					was never started.
					Auto Offline Data Collection: Disabled.
Self-test execution status:      (   0)	The previous self-test routine completed
					without error or no self-test has ever 
					been run.
Total time to complete Offline 
data collection: 		(17820) seconds.
Offline data collection
capabilities: 			 (0x7b) SMART execute Offline immediate.
					Auto Offline data collection on/off support.
					Suspend Offline collection upon new
					command.
					Offline surface scan supported.
					Self-test supported.
					Conveyance Self-test supported.
					Selective Self-test supported.
SMART capabilities:            (0x0003)	Saves SMART data before entering
					power-saving mode.
					Supports SMART auto save timer.
Error logging capability:        (0x01)	Error logging supported.
					General Purpose Logging supported.
Short self-test routine 
recommended polling time: 	 (   2) minutes.
Extended self-test routine
recommended polling time: 	 ( 198) minutes.
Conveyance self-test routine
recommended polling time: 	 (   5) minutes.
SCT capabilities: 	       (0x7035)	SCT Status supported.
					SCT Feature Control supported.
					SCT Data Table supported.

SMART Attributes Data Structure revision number: 16
Vendor Specific SMART Attributes with Thresholds:
ID# ATTRIBUTE_NAME          FLAGS    VALUE WORST THRESH FAIL RAW_VALUE
  1 Raw_Read_Error_Rate     POSR-K   200   200   051    -    0
  3 Spin_Up_Time            POS--K   190   187   021    -    1491
  4 Start_Stop_Count        -O--CK   097   097   000    -    3007
  5 Reallocated_Sector_Ct   PO--CK   200   200   140    -    0
  7 Seek_Error_Rate         POSR-K   200   200   051    -    0
  9 Power_On_Hours          -O--CK   100   100   000    -    161
 10 Spin_Retry_Count        -O--CK   100   100   000    -    0
 11 Calibration_Retry_Count -O--CK   100   253   000    -    0
 12 Power_Cycle_Count       -O--CK   100   100   000    -    16
192 Power-Off_Retract_Count -O--CK   200   200   000    -    12
193 Load_Cycle_Count        -O--CK   199   199   000    -    4969
194 Temperature_Celsius     -O---K   105   095   000    -    42
196 Reallocated_Event_Count -O--CK   200   200   000    -    0
197 Current_Pending_Sector  -O--CK   200   200   000    -    0
198 Offline_Uncorrectable   ----CK   100   253   000    -    0
199 UDMA_CRC_Error_Count    -O--CK   200   200   000    -    0
200 Multi_Zone_Error_Rate   ---R--   100   253   000    -    0
240 Head_Flying_Hours       -O--CK   100   100   000    -    28
                            ||||||_ K auto-keep
                            |||||__ C event count
                            ||||___ R error rate
                            |||____ S speed/performance
                            ||_____ O updated online
                            |______ P prefailure warning

General Purpose Log Directory Version 1
SMART           Log Directory Version 1 [multi-sector log support]
Address    Access  R/W   Size  Description
0x00       GPL,SL  R/O      1  Log Directory
0x01           SL  R/O      1  Summary SMART error log
0x02           SL  R/O      5  Comprehensive SMART error log
0x03       GPL     R/O      6  Ext. Comprehensive SMART error log
0x06           SL  R/O      1  SMART self-test log
0x07       GPL     R/O      1  Extended self-test log
0x09           SL  R/W      1  Selective self-test log
0x10       GPL     R/O      1  NCQ Command Error log
0x11       GPL     R/O      1  SATA Phy Event Counters log
0x12       GPL     R/O      1  SATA NCQ Non-Data log
0x13       GPL     R/O      1  SATA NCQ Send and Receive log
0x14       GPL     R/O      1  Hybrid Information log
0x80-0x9f  GPL,SL  R/W     16  Host vendor specific log
0xa0-0xa7  GPL,SL  VS      16  Device vendor specific log
0xa8-0xb6  GPL,SL  VS       1  Device vendor specific log
0xb7       GPL,SL  VS      38  Device vendor specific log
0xbd       GPL,SL  VS       1  Device vendor specific log
0xc0       GPL,SL  VS       1  Device vendor specific log
0xc1       GPL     VS      93  Device vendor specific log
0xe0       GPL,SL  R/W      1  SCT Command/Status
0xe1       GPL,SL  R/W      1  SCT Data Transfer

SMART Extended Comprehensive Error Log Version: 1 (6 sectors)
No Errors Logged

SMART Extended Self-test Log Version: 1 (1 sectors)
No self-tests have been logged.  [To run self-tests, use: smartctl -t]

SMART Selective self-test log data structure revision number 1
 SPAN  MIN_LBA  MAX_LBA  CURRENT_TEST_STATUS
    1        0        0  Not_testing
    2        0        0  Not_testing
    3        0        0  Not_testing
    4        0        0  Not_testing
    5        0        0  Not_testing
Selective self-test flags (0x0):
  After scanning selected spans, do NOT read-scan remainder of disk.
If Selective self-test is pending on power-up, resume after 0 minute delay.

SCT Status Version:                  3
SCT Version (vendor specific):       258 (0x0102)
SCT Support Level:                   1
Device State:                        Active (0)
Current Temperature:                    42 Celsius
Power Cycle Min/Max Temperature:     24/51 Celsius
Lifetime    Min/Max Temperature:     24/52 Celsius
Lifetime    Average Temperature:        36 Celsius
Under/Over Temperature Limit Count:   0/0
Vendor specific:
01 00 00 00 00 00 00 00 00 00 00 00 00 00 00 00
00 00 00 00 00 00 00 00 00 00 00 00 00 00 00 00

SCT Temperature History Version:     2
Temperature Sampling Period:         1 minute
Temperature Logging Interval:        1 minute
Min/Max recommended Temperature:      0/60 Celsius
Min/Max Temperature Limit:           -41/85 Celsius
Temperature History Size (Index):    128 (104)

Index    Estimated Time   Temperature Celsius
 105    2018-02-15 19:42    27  ********
 ...    ..(  2 skipped).    ..  ********
 108    2018-02-15 19:45    27  ********
 109    2018-02-15 19:46    26  *******
 ...    ..(  7 skipped).    ..  *******
 117    2018-02-15 19:54    26  *******
 118    2018-02-15 19:55    25  ******
 ...    ..(  8 skipped).    ..  ******
 127    2018-02-15 20:04    25  ******
   0    2018-02-15 20:05    24  *****
 ...    ..( 23 skipped).    ..  *****
  24    2018-02-15 20:29    24  *****
  25    2018-02-15 20:30     ?  -
  26    2018-02-15 20:31    24  *****
  27    2018-02-15 20:32    24  *****
  28    2018-02-15 20:33     ?  -
  29    2018-02-15 20:34    24  *****
 ...    ..(  9 skipped).    ..  *****
  39    2018-02-15 20:44    24  *****
  40    2018-02-15 20:45    25  ******
 ...    ..(  3 skipped).    ..  ******
  44    2018-02-15 20:49    25  ******
  45    2018-02-15 20:50    26  *******
 ...    ..(  7 skipped).    ..  *******
  53    2018-02-15 20:58    26  *******
  54    2018-02-15 20:59    27  ********
 ...    ..( 10 skipped).    ..  ********
  65    2018-02-15 21:10    27  ********
  66    2018-02-15 21:11    28  *********
  67    2018-02-15 21:12    28  *********
  68    2018-02-15 21:13     ?  -
  69    2018-02-15 21:14    28  *********
  70    2018-02-15 21:15    28  *********
  71    2018-02-15 21:16    30  ***********
  72    2018-02-15 21:17    30  ***********
  73    2018-02-15 21:18     ?  -
  74    2018-02-15 21:19    30  ***********
  75    2018-02-15 21:20    30  ***********
  76    2018-02-15 21:21    30  ***********
  77    2018-02-15 21:22    31  ************
  78    2018-02-15 21:23    32  *************
  79    2018-02-15 21:24    32  *************
  80    2018-02-15 21:25    35  ****************
  81    2018-02-15 21:26    35  ****************
  82    2018-02-15 21:27    36  *****************
  83    2018-02-15 21:28    37  ******************
  84    2018-02-15 21:29    37  ******************
  85    2018-02-15 21:30    36  *****************
  86    2018-02-15 21:31    36  *****************
  87    2018-02-15 21:32    37  ******************
  88    2018-02-15 21:33    38  *******************
  89    2018-02-15 21:34    38  *******************
  90    2018-02-15 21:35    38  *******************
  91    2018-02-15 21:36    39  ********************
  92    2018-02-15 21:37    39  ********************
  93    2018-02-15 21:38    40  *********************
 ...    ..(  4 skipped).    ..  *********************
  98    2018-02-15 21:43    40  *********************
  99    2018-02-15 21:44    41  **********************
 100    2018-02-15 21:45    41  **********************
 101    2018-02-15 21:46    41  **********************
 102    2018-02-15 21:47    42  ***********************
 103    2018-02-15 21:48    42  ***********************
 104    2018-02-15 21:49    42  ***********************

SCT Error Recovery Control command not supported

Device Statistics (GP/SMART Log 0x04) not supported

Pending Defects log (GP Log 0x0c) not supported

SATA Phy Event Counters (GP Log 0x11)
ID      Size     Value  Description
0x0001  2            0  Command failed due to ICRC error
0x0002  2            0  R_ERR response for data FIS
0x0003  2            0  R_ERR response for device-to-host data FIS
0x0004  2            0  R_ERR response for host-to-device data FIS
0x0005  2            0  R_ERR response for non-data FIS
0x0006  2            0  R_ERR response for device-to-host non-data FIS
0x0007  2            0  R_ERR response for host-to-device non-data FIS
0x0008  2            0  Device-to-host non-data FIS retries
0x0009  2            3  Transition from drive PhyRdy to drive PhyNRdy
0x000a  2            3  Device-to-host register FISes sent due to a COMRESET
0x000b  2            0  CRC errors within host-to-device FIS
0x000f  2            0  R_ERR response for host-to-device data FIS, CRC
0x0012  2            0  R_ERR response for host-to-device non-data FIS, CRC
0x8000  4       371390  Vendor specific

