smartctl 6.5 (build date Jan 26 2017) [x86_64-linux-3.10.102] (local build)
Copyright (C) 2002-16, Bruce Allen, Christian Franke, www.smartmontools.org

=== START OF INFORMATION SECTION ===
Device Model:     ST3000DM008-2DM166
Firmware Version: CC26
User Capacity:    3,000,592,982,016 bytes [3.00 TB]
Sector Sizes:     512 bytes logical, 4096 bytes physical
Rotation Rate:    7200 rpm
Form Factor:      3.5 inches
Device is:        Not in smartctl database [for details use: -P showall]
ATA Version is:   ACS-2, ACS-3 T13/2161-D revision 3b
SATA Version is:  SATA 3.1, 6.0 Gb/s (current: 6.0 Gb/s)
Local Time is:    Mon Mar  6 20:46:09 2017 CST
SMART support is: Available - device has SMART capability.
SMART support is: Enabled
AAM feature is:   Unavailable
APM feature is:   Disabled
Rd look-ahead is: Enabled
Write cache is:   Enabled
ATA Security is:  Disabled, NOT FROZEN [SEC1]
Wt Cache Reorder: Unavailable

=== START OF READ SMART DATA SECTION ===
SMART overall-health self-assessment test result: PASSED

General SMART Values:
Offline data collection status:  (0x82)	Offline data collection activity
					was completed without error.
					Auto Offline Data Collection: Enabled.
Self-test execution status:      ( 248)	Self-test routine in progress...
					80% of test remaining.
Total time to complete Offline 
data collection: 		(   97) seconds.
Offline data collection
capabilities: 			 (0x7b) SMART execute Offline immediate.
					Auto Offline data collection on/off support.
					Suspend Offline collection upon new
					command.
					Offline surface scan supported.
					Self-test supported.
					Conveyance Self-test supported.
					Selective Self-test supported.
SMART capabilities:            (0x0003)	Saves SMART data before entering
					power-saving mode.
					Supports SMART auto save timer.
Error logging capability:        (0x01)	Error logging supported.
					General Purpose Logging supported.
Short self-test routine 
recommended polling time: 	 (   1) minutes.
Extended self-test routine
recommended polling time: 	 ( 335) minutes.
Conveyance self-test routine
recommended polling time: 	 (   2) minutes.
SCT capabilities: 	       (0x1085)	SCT Status supported.

SMART Attributes Data Structure revision number: 10
Vendor Specific SMART Attributes with Thresholds:
ID# ATTRIBUTE_NAME                                                   FLAGS    VALUE WORST THRESH FAIL RAW_VALUE
  1 Raw_Read_Error_Rate                                              POSR--   114   100   006    -    64073976
  3 Spin_Up_Time                                                     PO----   100   100   000    -    0
  4 Start_Stop_Count                                                 -O--CK   100   100   020    -    1
  5 Reallocated_Sector_Ct                                            PO--CK   100   100   010    -    0
  7 Seek_Error_Rate                                                  POSR--   100   253   030    -    69896
  9 Power_On_Hours                                                   -O--CK   100   100   000    -    1
 10 Spin_Retry_Count                                                 PO--C-   100   100   097    -    0
 12 Power_Cycle_Count                                                -O--CK   100   100   020    -    1
183 Runtime_Bad_Block                                                -O--CK   100   100   000    -    0
184 End-to-End_Error                                                 -O--CK   100   100   099    -    0
187 Reported_Uncorrect                                               -O--CK   100   100   000    -    0
188 Command_Timeout                                                  -O--CK   100   100   000    -    0
189 High_Fly_Writes                                                  -O-RCK   100   100   000    -    0
190 Airflow_Temperature_Cel                                          -O---K   067   067   045    -    33 (Min/Max 13/33)
191 G-Sense_Error_Rate                                               -O--CK   100   100   000    -    0
192 Power-Off_Retract_Count                                          -O--CK   100   100   000    -    1
193 Load_Cycle_Count                                                 -O--CK   100   100   000    -    1
194 Temperature_Celsius                                              -O---K   033   040   000    -    33 (0 13 0 0 0)
197 Current_Pending_Sector                                           -O--C-   100   100   000    -    0
198 Offline_Uncorrectable                                            ----C-   100   100   000    -    0
199 UDMA_CRC_Error_Count                                             -OSRCK   200   200   000    -    0
240 Head_Flying_Hours                                                ------   100   253   000    -    1 (244 219 0)
241 Total_LBAs_Written                                               ------   100   253   000    -    63122520
242 Total_LBAs_Read                                                  ------   100   253   000    -    63834952
                            ||||||_ K auto-keep
                            |||||__ C event count
                            ||||___ R error rate
                            |||____ S speed/performance
                            ||_____ O updated online
                            |______ P prefailure warning

General Purpose Log Directory Version 1
SMART           Log Directory Version 1 [multi-sector log support]
Address    Access  R/W   Size  Description
0x00       GPL,SL  R/O      1  Log Directory
0x01           SL  R/O      1  Summary SMART error log
0x02           SL  R/O      5  Comprehensive SMART error log
0x03       GPL     R/O      5  Ext. Comprehensive SMART error log
0x06           SL  R/O      1  SMART self-test log
0x07       GPL     R/O      1  Extended self-test log
0x09           SL  R/W      1  Selective self-test log
0x10       GPL     R/O      1  SATA NCQ Queued Error log
0x11       GPL     R/O      1  SATA Phy Event Counters log
0x21       GPL     R/O      1  Write stream error log
0x22       GPL     R/O      1  Read stream error log
0x30       GPL,SL  R/O      9  IDENTIFY DEVICE data log
0x80-0x9f  GPL,SL  R/W     16  Host vendor specific log
0xa1       GPL,SL  VS      20  Device vendor specific log
0xa2       GPL     VS    4496  Device vendor specific log
0xa8       GPL,SL  VS     129  Device vendor specific log
0xa9       GPL,SL  VS       1  Device vendor specific log
0xab       GPL     VS       1  Device vendor specific log
0xb0       GPL     VS    5176  Device vendor specific log
0xbe-0xbf  GPL     VS   65535  Device vendor specific log
0xc0       GPL,SL  VS       1  Device vendor specific log
0xc1       GPL,SL  VS      10  Device vendor specific log
0xc3       GPL,SL  VS       8  Device vendor specific log
0xe0       GPL,SL  R/W      1  SCT Command/Status
0xe1       GPL,SL  R/W      1  SCT Data Transfer

SMART Extended Comprehensive Error Log Version: 1 (5 sectors)
No Errors Logged

SMART Extended Self-test Log Version: 1 (1 sectors)
Num  Test_Description    Status                  Remaining  LifeTime(hours)  LBA_of_first_error
# 1  Extended offline    Self-test routine in progress 80%         1         -
# 2  Short offline       Completed without error       00%         0         -

SMART Selective self-test log data structure revision number 1
 SPAN  MIN_LBA  MAX_LBA  CURRENT_TEST_STATUS
    1        0        0  Not_testing
    2        0        0  Not_testing
    3        0        0  Not_testing
    4        0        0  Not_testing
    5        0        0  Not_testing
Selective self-test flags (0x0):
  After scanning selected spans, do NOT read-scan remainder of disk.
If Selective self-test is pending on power-up, resume after 0 minute delay.

SCT Status Version:                  3
SCT Version (vendor specific):       522 (0x020a)
SCT Support Level:                   1
Device State:                        Active (0)
Current Temperature:                    33 Celsius
Power Cycle Min/Max Temperature:     13/33 Celsius
Lifetime    Min/Max Temperature:     13/33 Celsius
Under/Over Temperature Limit Count:   1/0

SCT Data Table command not supported

SCT Error Recovery Control command not supported

Device Statistics (GP/SMART Log 0x04) not supported

SATA Phy Event Counters (GP Log 0x11)
ID      Size     Value  Description
0x000a  2            1  Device-to-host register FISes sent due to a COMRESET
0x0001  2            0  Command failed due to ICRC error
0x0003  2            0  R_ERR response for device-to-host data FIS
0x0004  2            0  R_ERR response for host-to-device data FIS
0x0006  2            0  R_ERR response for device-to-host non-data FIS
0x0007  2            0  R_ERR response for host-to-device non-data FIS

