smartctl 5.41 2011-06-09 r3365 [i686-linux-2.6.19-1.2948PAE] (local build)
Copyright (C) 2002-11 by Bruce Allen, http://smartmontools.sourceforge.net

=== START OF INFORMATION SECTION ===
Device Model:     ST4000NM0035-1V4107
Serial Number:    ZC12S5M9
LU WWN Device Id: 5 000c50 0a3f740a3
Firmware Version: TNC3
User Capacity:    4,000,787,030,016 bytes [4.00 TB]
Sector Size:      512 bytes logical/physical
Device is:        Not in smartctl database [for details use: -P showall]
ATA Version is:   10
ATA Standard is:  Not recognized. Minor revision code: 0x006d
Local Time is:    Mon Oct  9 12:17:17 2017 IST
SMART support is: Available - device has SMART capability.
SMART support is: Enabled

=== START OF READ SMART DATA SECTION ===
SMART overall-health self-assessment test result: PASSED

General SMART Values:
Offline data collection status:  (0x82)	Offline data collection activity
					was completed without error.
					Auto Offline Data Collection: Enabled.
Self-test execution status:      (   0)	The previous self-test routine completed
					without error or no self-test has ever 
					been run.
Total time to complete Offline 
data collection: 		(  584) seconds.
Offline data collection
capabilities: 			 (0x7b) SMART execute Offline immediate.
					Auto Offline data collection on/off support.
					Suspend Offline collection upon new
					command.
					Offline surface scan supported.
					Self-test supported.
					Conveyance Self-test supported.
					Selective Self-test supported.
SMART capabilities:            (0x0003)	Saves SMART data before entering
					power-saving mode.
					Supports SMART auto save timer.
Error logging capability:        (0x01)	Error logging supported.
					General Purpose Logging supported.
Short self-test routine 
recommended polling time: 	 (   1) minutes.
Extended self-test routine
recommended polling time: 	 ( 255) minutes.
Conveyance self-test routine
recommended polling time: 	 (   2) minutes.
SCT capabilities: 	       (0x50bd)	SCT Status supported.
					SCT Error Recovery Control supported.
					SCT Feature Control supported.
					SCT Data Table supported.

SMART Attributes Data Structure revision number: 10
Vendor Specific SMART Attributes with Thresholds:
ID# ATTRIBUTE_NAME          FLAGS    VALUE WORST THRESH FAIL RAW_VALUE
  1 Raw_Read_Error_Rate     POSR--   100   100   044    -    9694
  3 Spin_Up_Time            PO----   097   097   000    -    0
  4 Start_Stop_Count        -O--CK   100   100   020    -    13
  5 Reallocated_Sector_Ct   PO--CK   100   100   010    -    0
  7 Seek_Error_Rate         POSR--   100   253   045    -    796646
  9 Power_On_Hours          -O--CK   100   100   000    -    144727512973380
 10 Spin_Retry_Count        PO--C-   100   100   097    -    0
 12 Power_Cycle_Count       -O--CK   100   100   020    -    12
184 End-to-End_Error        -O--CK   100   100   099    -    0
187 Reported_Uncorrect      -O--CK   100   100   000    -    0
188 Command_Timeout         -O--CK   100   100   000    -    0
189 High_Fly_Writes         -O-RCK   100   100   000    -    0
190 Airflow_Temperature_Cel -O---K   073   063   040    -    27 (Min/Max 22/37)
191 G-Sense_Error_Rate      -O--CK   100   100   000    -    0
192 Power-Off_Retract_Count -O--CK   100   100   000    -    5
193 Load_Cycle_Count        -O--CK   100   100   000    -    84
194 Temperature_Celsius     -O---K   027   040   000    -    27 (0 22 0 0)
195 Hardware_ECC_Recovered  -O-RC-   100   100   000    -    9694
197 Current_Pending_Sector  -O--C-   100   100   000    -    0
198 Offline_Uncorrectable   ----C-   100   100   000    -    0
199 UDMA_CRC_Error_Count    -OSRCK   200   253   000    -    0
240 Head_Flying_Hours       ------   100   253   000    -    35643933589506
241 Total_LBAs_Written      ------   100   253   000    -    0
242 Total_LBAs_Read         ------   100   253   000    -    9694
                            ||||||_ K auto-keep
                            |||||__ C event count
                            ||||___ R error rate
                            |||____ S speed/performance
                            ||_____ O updated online
                            |______ P prefailure warning

General Purpose Log Directory Version 1
SMART           Log Directory Version 1 [multi-sector log support]
GP/S  Log at address 0x00 has    1 sectors [Log Directory]
SMART Log at address 0x01 has    1 sectors [Summary SMART error log]
SMART Log at address 0x02 has    5 sectors [Comprehensive SMART error log]
GP    Log at address 0x03 has    5 sectors [Ext. Comprehensive SMART error log]
GP/S  Log at address 0x04 has    8 sectors [Device Statistics]
SMART Log at address 0x06 has    1 sectors [SMART self-test log]
GP    Log at address 0x07 has    1 sectors [Extended self-test log]
GP    Log at address 0x08 has    2 sectors [Power Conditions]
SMART Log at address 0x09 has    1 sectors [Selective self-test log]
GP    Log at address 0x0c has 2048 sectors [Reserved]
GP    Log at address 0x10 has    1 sectors [NCQ Command Error]
GP    Log at address 0x11 has    1 sectors [SATA Phy Event Counters]
GP    Log at address 0x13 has    1 sectors [Reserved for Serial ATA]
GP    Log at address 0x15 has    1 sectors [Reserved for Serial ATA]
GP    Log at address 0x21 has    1 sectors [Write stream error log]
GP    Log at address 0x22 has    1 sectors [Read stream error log]
GP    Log at address 0x24 has  512 sectors [Reserved]
GP/S  Log at address 0x30 has    9 sectors [Reserved]
GP/S  Log at address 0x80 has   16 sectors [Host vendor specific log]
GP/S  Log at address 0x81 has   16 sectors [Host vendor specific log]
GP/S  Log at address 0x82 has   16 sectors [Host vendor specific log]
GP/S  Log at address 0x83 has   16 sectors [Host vendor specific log]
GP/S  Log at address 0x84 has   16 sectors [Host vendor specific log]
GP/S  Log at address 0x85 has   16 sectors [Host vendor specific log]
GP/S  Log at address 0x86 has   16 sectors [Host vendor specific log]
GP/S  Log at address 0x87 has   16 sectors [Host vendor specific log]
GP/S  Log at address 0x88 has   16 sectors [Host vendor specific log]
GP/S  Log at address 0x89 has   16 sectors [Host vendor specific log]
GP/S  Log at address 0x8a has   16 sectors [Host vendor specific log]
GP/S  Log at address 0x8b has   16 sectors [Host vendor specific log]
GP/S  Log at address 0x8c has   16 sectors [Host vendor specific log]
GP/S  Log at address 0x8d has   16 sectors [Host vendor specific log]
GP/S  Log at address 0x8e has   16 sectors [Host vendor specific log]
GP/S  Log at address 0x8f has   16 sectors [Host vendor specific log]
GP/S  Log at address 0x90 has   16 sectors [Host vendor specific log]
GP/S  Log at address 0x91 has   16 sectors [Host vendor specific log]
GP/S  Log at address 0x92 has   16 sectors [Host vendor specific log]
GP/S  Log at address 0x93 has   16 sectors [Host vendor specific log]
GP/S  Log at address 0x94 has   16 sectors [Host vendor specific log]
GP/S  Log at address 0x95 has   16 sectors [Host vendor specific log]
GP/S  Log at address 0x96 has   16 sectors [Host vendor specific log]
GP/S  Log at address 0x97 has   16 sectors [Host vendor specific log]
GP/S  Log at address 0x98 has   16 sectors [Host vendor specific log]
GP/S  Log at address 0x99 has   16 sectors [Host vendor specific log]
GP/S  Log at address 0x9a has   16 sectors [Host vendor specific log]
GP/S  Log at address 0x9b has   16 sectors [Host vendor specific log]
GP/S  Log at address 0x9c has   16 sectors [Host vendor specific log]
GP/S  Log at address 0x9d has   16 sectors [Host vendor specific log]
GP/S  Log at address 0x9e has   16 sectors [Host vendor specific log]
GP/S  Log at address 0x9f has   16 sectors [Host vendor specific log]
GP/S  Log at address 0xa1 has   24 sectors [Device vendor specific log]
GP    Log at address 0xa2 has 8160 sectors [Device vendor specific log]
GP    Log at address 0xa6 has  192 sectors [Device vendor specific log]
GP/S  Log at address 0xa8 has  136 sectors [Device vendor specific log]
GP/S  Log at address 0xa9 has  136 sectors [Device vendor specific log]
GP    Log at address 0xad has   16 sectors [Device vendor specific log]
GP    Log at address 0xb0 has 9048 sectors [Device vendor specific log]
GP    Log at address 0xbe has 65535 sectors [Device vendor specific log]
GP    Log at address 0xbf has 65535 sectors [Device vendor specific log]
GP/S  Log at address 0xc1 has   16 sectors [Device vendor specific log]
GP/S  Log at address 0xc3 has    8 sectors [Device vendor specific log]
GP    Log at address 0xd1 has  264 sectors [Device vendor specific log]
GP    Log at address 0xd2 has 10000 sectors [Device vendor specific log]
GP    Log at address 0xd4 has 2048 sectors [Device vendor specific log]
GP/S  Log at address 0xda has    1 sectors [Device vendor specific log]
GP/S  Log at address 0xe0 has    1 sectors [SCT Command/Status]
GP/S  Log at address 0xe1 has    1 sectors [SCT Data Transfer]

SMART Extended Comprehensive Error Log Version: 1 (5 sectors)
No Errors Logged

SMART Extended Self-test Log Version: 1 (1 sectors)
Num  Test_Description    Status                  Remaining  LifeTime(hours)  LBA_of_first_error
# 1  Short offline       Completed without error       00%        68         -
# 2  Short offline       Aborted by host               90%        68         -

SMART Selective self-test log data structure revision number 1
 SPAN  MIN_LBA  MAX_LBA  CURRENT_TEST_STATUS
    1        0        0  Not_testing
    2        0        0  Not_testing
    3        0        0  Not_testing
    4        0        0  Not_testing
    5        0        0  Not_testing
Selective self-test flags (0x0):
  After scanning selected spans, do NOT read-scan remainder of disk.
If Selective self-test is pending on power-up, resume after 0 minute delay.

SCT Status Version:                  3
SCT Version (vendor specific):       522 (0x020a)
SCT Support Level:                   1
Device State:                        Active (0)
Current Temperature:                    27 Celsius
Power Cycle Min/Max Temperature:     22/39 Celsius
Lifetime    Min/Max Temperature:     22/39 Celsius
Under/Over Temperature Limit Count:   0/65
SCT Temperature History Version:     2
Temperature Sampling Period:         3 minutes
Temperature Logging Interval:        59 minutes
Min/Max recommended Temperature:      0/ 0 Celsius
Min/Max Temperature Limit:            0/ 0 Celsius
Temperature History Size (Index):    128 (95)

Index    Estimated Time   Temperature Celsius
  96    2017-10-04 07:01     ?  -
 ...    ..( 31 skipped).    ..  -
   0    2017-10-05 14:29     ?  -
   1    2017-10-05 15:28    25  ******
   2    2017-10-05 16:27     ?  -
   3    2017-10-05 17:26    30  ***********
   4    2017-10-05 18:25     ?  -
   5    2017-10-05 19:24    30  ***********
   6    2017-10-05 20:23     ?  -
   7    2017-10-05 21:22    30  ***********
   8    2017-10-05 22:21     ?  -
   9    2017-10-05 23:20    27  ********
  10    2017-10-06 00:19     ?  -
  11    2017-10-06 01:18    27  ********
  12    2017-10-06 02:17     ?  -
  13    2017-10-06 03:16    30  ***********
  14    2017-10-06 04:15     ?  -
  15    2017-10-06 05:14    30  ***********
  16    2017-10-06 06:13     ?  -
  17    2017-10-06 07:12    31  ************
  18    2017-10-06 08:11     ?  -
  19    2017-10-06 09:10    31  ************
  20    2017-10-06 10:09     ?  -
  21    2017-10-06 11:08    31  ************
  22    2017-10-06 12:07     ?  -
  23    2017-10-06 13:06    31  ************
  24    2017-10-06 14:05     ?  -
  25    2017-10-06 15:04    27  ********
  26    2017-10-06 16:03     ?  -
  27    2017-10-06 17:02    26  *******
  28    2017-10-06 18:01     ?  -
  29    2017-10-06 19:00    33  **************
  30    2017-10-06 19:59     ?  -
  31    2017-10-06 20:58    34  ***************
  32    2017-10-06 21:57    36  *****************
  33    2017-10-06 22:56    36  *****************
  34    2017-10-06 23:55    35  ****************
 ...    ..( 10 skipped).    ..  ****************
  45    2017-10-07 10:44    35  ****************
  46    2017-10-07 11:43    34  ***************
  47    2017-10-07 12:42    34  ***************
  48    2017-10-07 13:41    28  *********
  49    2017-10-07 14:40    36  *****************
  50    2017-10-07 15:39    24  *****
  51    2017-10-07 16:38    23  ****
  52    2017-10-07 17:37    24  *****
  53    2017-10-07 18:36    23  ****
  54    2017-10-07 19:35    23  ****
  55    2017-10-07 20:34    23  ****
  56    2017-10-07 21:33    22  ***
  57    2017-10-07 22:32    36  *****************
  58    2017-10-07 23:31    37  ******************
 ...    ..(  5 skipped).    ..  ******************
  64    2017-10-08 05:25    37  ******************
  65    2017-10-08 06:24    36  *****************
 ...    ..(  2 skipped).    ..  *****************
  68    2017-10-08 09:21    36  *****************
  69    2017-10-08 10:20    32  *************
  70    2017-10-08 11:19    30  ***********
  71    2017-10-08 12:18    27  ********
  72    2017-10-08 13:17    28  *********
 ...    ..(  6 skipped).    ..  *********
  79    2017-10-08 20:10    28  *********
  80    2017-10-08 21:09    32  *************
  81    2017-10-08 22:08    38  *******************
  82    2017-10-08 23:07    38  *******************
  83    2017-10-09 00:06    37  ******************
 ...    ..(  2 skipped).    ..  ******************
  86    2017-10-09 03:03    37  ******************
  87    2017-10-09 04:02    36  *****************
 ...    ..(  2 skipped).    ..  *****************
  90    2017-10-09 06:59    36  *****************
  91    2017-10-09 07:58    37  ******************
  92    2017-10-09 08:57    37  ******************
  93    2017-10-09 09:56    33  **************
  94    2017-10-09 10:55    33  **************
  95    2017-10-09 11:54    35  ****************

SCT Error Recovery Control:
           Read:    100 (10.0 seconds)
          Write:    100 (10.0 seconds)

SATA Phy Event Counters (GP Log 0x11)
ID      Size     Value  Description
0x000a  2            4  Device-to-host register FISes sent due to a COMRESET
0x0001  2            0  Command failed due to ICRC error
0x0003  2            0  R_ERR response for device-to-host data FIS
0x0004  2            0  R_ERR response for host-to-device data FIS
0x0006  2            0  R_ERR response for device-to-host non-data FIS
0x0007  2            0  R_ERR response for host-to-device non-data FIS

