smartctl 7.4 2023-08-01 r5530 [x86_64-linux-6.5.11-1-MANJARO] (local build)
Copyright (C) 2002-23, Bruce Allen, Christian Franke, www.smartmontools.org

=== START OF INFORMATION SECTION ===
Device Model:     INTEL SSDSCKHB340G4M           118000041
Firmware Version: G201EM05
User Capacity:    340,076,814,336 bytes [340 GB]
Sector Sizes:     512 bytes logical, 4096 bytes physical
Rotation Rate:    Solid State Device
Form Factor:      2.5 inches
TRIM Command:     Available, deterministic, zeroed
Device is:        Not in smartctl database 7.3/5533
ATA Version is:   ACS-2 T13/2015-D revision 3
SATA Version is:  SATA 2.6, 6.0 Gb/s (current: 6.0 Gb/s)
Local Time is:    Tue Dec  5 21:13:23 2023 CST
SMART support is: Available - device has SMART capability.
SMART support is: Enabled
AAM feature is:   Unavailable
APM feature is:   Unavailable
Rd look-ahead is: Enabled
Write cache is:   Enabled
DSN feature is:   Unavailable
ATA Security is:  Disabled, frozen [SEC2]
Wt Cache Reorder: Enabled

=== START OF READ SMART DATA SECTION ===
SMART overall-health self-assessment test result: PASSED

General SMART Values:
Offline data collection status:  (0x02)	Offline data collection activity
					was completed without error.
					Auto Offline Data Collection: Disabled.
Self-test execution status:      (   0)	The previous self-test routine completed
					without error or no self-test has ever 
					been run.
Total time to complete Offline 
data collection: 		(    2) seconds.
Offline data collection
capabilities: 			 (0x79) SMART execute Offline immediate.
					No Auto Offline data collection support.
					Suspend Offline collection upon new
					command.
					Offline surface scan supported.
					Self-test supported.
					Conveyance Self-test supported.
					Selective Self-test supported.
SMART capabilities:            (0x0003)	Saves SMART data before entering
					power-saving mode.
					Supports SMART auto save timer.
Error logging capability:        (0x01)	Error logging supported.
					General Purpose Logging supported.
Short self-test routine 
recommended polling time: 	 (   1) minutes.
Extended self-test routine
recommended polling time: 	 (   2) minutes.
Conveyance self-test routine
recommended polling time: 	 (   2) minutes.
SCT capabilities: 	       (0x003d)	SCT Status supported.
					SCT Error Recovery Control supported.
					SCT Feature Control supported.
					SCT Data Table supported.

SMART Attributes Data Structure revision number: 1
Vendor Specific SMART Attributes with Thresholds:
ID# ATTRIBUTE_NAME          FLAGS    VALUE WORST THRESH FAIL RAW_VALUE
  1 Raw_Read_Error_Rate     PO-R--   100   100   050    -    0
  5 Reallocated_Sector_Ct   PO--C-   100   100   050    -    0
  9 Power_On_Hours          -O--C-   100   100   000    -    22864
 12 Power_Cycle_Count       -O--C-   100   100   000    -    2105
 14 Unknown_Attribute       -O--C-   100   100   000    -    412
 15 Unknown_Attribute       -O--C-   100   100   000    -    340
 16 Unknown_Attribute       -O--C-   100   100   000    -    6350
 17 Unknown_Attribute       -O--C-   100   100   050    -    6350
172 Unknown_Attribute       -O--C-   100   100   000    -    0
173 Unknown_Attribute       -O--C-   092   092   000    -    253
174 Unknown_Attribute       -O--C-   100   100   000    -    533
175 Program_Fail_Count_Chip -O--C-   100   100   010    -    240
176 Erase_Fail_Count_Chip   PO--CK   100   100   010    -    317925167988
181 Program_Fail_Cnt_Total  -O--C-   100   100   000    -    0
184 End-to-End_Error        PO--CK   100   100   090    -    0
187 Reported_Uncorrect      -O--C-   100   100   000    -    0
194 Temperature_Celsius     PO---K   100   100   030    -    38
197 Current_Pending_Sector  -O--CK   100   100   000    -    0
198 Offline_Uncorrectable   -O--C-   100   100   000    -    0
199 UDMA_CRC_Error_Count    PO-R--   100   100   050    -    0
202 Unknown_SSD_Attribute   -O--C-   100   100   000    -    8
226 Unknown_SSD_Attribute   -O--CK   100   100   000    -    7825
227 Unknown_SSD_Attribute   -O--CK   100   100   000    -    65
228 Power-off_Retract_Count -O--CK   100   100   000    -    1358410
234 Unknown_Attribute       PO-R--   100   100   000    -    3309041
235 Unknown_Attribute       PO-R--   100   100   000    -    1778095
241 Total_LBAs_Written      -O--C-   100   100   000    -    2893081
                            ||||||_ K auto-keep
                            |||||__ C event count
                            ||||___ R error rate
                            |||____ S speed/performance
                            ||_____ O updated online
                            |______ P prefailure warning

General Purpose Log Directory Version 1
SMART           Log Directory Version 1 [multi-sector log support]
Address    Access  R/W   Size  Description
0x00       GPL,SL  R/O      1  Log Directory
0x01       GPL,SL  R/O      1  Summary SMART error log
0x02       GPL,SL  R/O      8  Comprehensive SMART error log
0x03       GPL,SL  R/O     20  Ext. Comprehensive SMART error log
0x04       GPL,SL  R/O      8  Device Statistics log
0x06       GPL,SL  R/O      1  SMART self-test log
0x07       GPL,SL  R/O      2  Extended self-test log
0x09       GPL,SL  R/W      1  Selective self-test log
0x10       GPL,SL  R/O      1  NCQ Command Error log
0x11       GPL,SL  R/O      1  SATA Phy Event Counters log
0x80-0x9f  GPL,SL  R/W     16  Host vendor specific log
0xb0       GPL,SL  VS       1  Device vendor specific log
0xb1       GPL,SL  VS      33  Device vendor specific log
0xb8       GPL,SL  VS       1  Device vendor specific log
0xb9       GPL     VS    1544  Device vendor specific log
0xb9       SL      VS       8  Device vendor specific log
0xba       GPL     VS    1280  Device vendor specific log
0xdf       GPL,SL  VS       1  Device vendor specific log
0xe0       GPL,SL  R/W      1  SCT Command/Status
0xe1       GPL,SL  R/W      1  SCT Data Transfer

SMART Extended Comprehensive Error Log Version: 1 (20 sectors)
No Errors Logged

SMART Extended Self-test Log Version: 1 (2 sectors)
Num  Test_Description    Status                  Remaining  LifeTime(hours)  LBA_of_first_error
# 1  Short offline       Completed without error       00%     22864         -
# 2  Short offline       Completed without error       00%       641         -
# 3  Short offline       Completed without error       00%       634         -
# 4  Short offline       Completed without error       00%       631         -
# 5  Short offline       Completed without error       00%       624         -
# 6  Short offline       Completed without error       00%       619         -
# 7  Short offline       Completed without error       00%       612         -
# 8  Extended offline    Completed without error       00%       610         -
# 9  Short offline       Completed without error       00%       604         -
#10  Short offline       Completed without error       00%       595         -
#11  Short offline       Completed without error       00%       591         -
#12  Short offline       Completed without error       00%       588         -
#13  Short offline       Completed without error       00%       579         -
#14  Short offline       Completed without error       00%       574         -
#15  Short offline       Completed without error       00%       565         -
#16  Short offline       Completed without error       00%       563         -
#17  Short offline       Completed without error       00%       556         -
#18  Short offline       Completed without error       00%       549         -
#19  Short offline       Completed without error       00%       538         -
#20  Short offline       Completed without error       00%       531         -
#21  Short offline       Completed without error       00%       523         -
#22  Short offline       Completed without error       00%       517         -
#23  Short offline       Completed without error       00%       509         -
#24  Short offline       Completed without error       00%       498         -
#25  Short offline       Completed without error       00%       483         -

SMART Selective self-test log data structure revision number 1
 SPAN  MIN_LBA  MAX_LBA  CURRENT_TEST_STATUS
    1        0        0  Not_testing
    2        0        0  Not_testing
    3        0        0  Not_testing
    4        0        0  Not_testing
    5        0        0  Not_testing
Selective self-test flags (0x0):
  After scanning selected spans, do NOT read-scan remainder of disk.
If Selective self-test is pending on power-up, resume after 0 minute delay.

SCT Status Version:                  3
SCT Version (vendor specific):       1 (0x0001)
Device State:                        Active (0)
Current Temperature:                    38 Celsius
Power Cycle Min/Max Temperature:     36/39 Celsius
Lifetime    Min/Max Temperature:      9/74 Celsius
Specified Max Operating Temperature:    70 Celsius
Under/Over Temperature Limit Count:   0/0
Vendor specific:
00 00 64 00 00 00 00 00 00 00 00 00 00 00 00 00
00 00 00 00 00 00 00 00 00 00 00 00 00 00 00 00

SCT Temperature History Version:     2
Temperature Sampling Period:         1 minute
Temperature Logging Interval:        1 minute
Min/Max recommended Temperature:      0/70 Celsius
Min/Max Temperature Limit:            0/70 Celsius
Temperature History Size (Index):    478 (342)

Index    Estimated Time   Temperature Celsius
 343    2023-12-05 13:16    37  ******************
 ...    ..( 31 skipped).    ..  ******************
 375    2023-12-05 13:48    37  ******************
 376    2023-12-05 13:49    36  *****************
 ...    ..(  6 skipped).    ..  *****************
 383    2023-12-05 13:56    36  *****************
 384    2023-12-05 13:57    37  ******************
 ...    ..(  5 skipped).    ..  ******************
 390    2023-12-05 14:03    37  ******************
 391    2023-12-05 14:04    36  *****************
 ...    ..( 20 skipped).    ..  *****************
 412    2023-12-05 14:25    36  *****************
 413    2023-12-05 14:26    37  ******************
 414    2023-12-05 14:27    36  *****************
 ...    ..( 16 skipped).    ..  *****************
 431    2023-12-05 14:44    36  *****************
 432    2023-12-05 14:45    37  ******************
 433    2023-12-05 14:46    36  *****************
 ...    ..(  2 skipped).    ..  *****************
 436    2023-12-05 14:49    36  *****************
 437    2023-12-05 14:50    37  ******************
 438    2023-12-05 14:51    36  *****************
 439    2023-12-05 14:52    37  ******************
 ...    ..(  4 skipped).    ..  ******************
 444    2023-12-05 14:57    37  ******************
 445    2023-12-05 14:58    36  *****************
 ...    ..( 10 skipped).    ..  *****************
 456    2023-12-05 15:09    36  *****************
 457    2023-12-05 15:10    37  ******************
 458    2023-12-05 15:11    36  *****************
 459    2023-12-05 15:12    37  ******************
 ...    ..( 33 skipped).    ..  ******************
  15    2023-12-05 15:46    37  ******************
  16    2023-12-05 15:47    38  *******************
  17    2023-12-05 15:48    38  *******************
  18    2023-12-05 15:49    37  ******************
 ...    ..( 51 skipped).    ..  ******************
  70    2023-12-05 16:41    37  ******************
  71    2023-12-05 16:42    38  *******************
  72    2023-12-05 16:43    38  *******************
  73    2023-12-05 16:44    37  ******************
 ...    ..( 10 skipped).    ..  ******************
  84    2023-12-05 16:55    37  ******************
  85    2023-12-05 16:56    36  *****************
 ...    ..(  3 skipped).    ..  *****************
  89    2023-12-05 17:00    36  *****************
  90    2023-12-05 17:01    37  ******************
  91    2023-12-05 17:02    37  ******************
  92    2023-12-05 17:03    36  *****************
 ...    ..(  3 skipped).    ..  *****************
  96    2023-12-05 17:07    36  *****************
  97    2023-12-05 17:08    37  ******************
  98    2023-12-05 17:09    37  ******************
  99    2023-12-05 17:10    36  *****************
 100    2023-12-05 17:11    37  ******************
 ...    ..( 23 skipped).    ..  ******************
 124    2023-12-05 17:35    37  ******************
 125    2023-12-05 17:36    38  *******************
 126    2023-12-05 17:37    37  ******************
 127    2023-12-05 17:38    38  *******************
 128    2023-12-05 17:39    37  ******************
 129    2023-12-05 17:40    37  ******************
 130    2023-12-05 17:41    38  *******************
 131    2023-12-05 17:42    38  *******************
 132    2023-12-05 17:43    37  ******************
 ...    ..( 28 skipped).    ..  ******************
 161    2023-12-05 18:12    37  ******************
 162    2023-12-05 18:13    38  *******************
 163    2023-12-05 18:14    38  *******************
 164    2023-12-05 18:15    37  ******************
 165    2023-12-05 18:16    37  ******************
 166    2023-12-05 18:17    37  ******************
 167    2023-12-05 18:18    38  *******************
 168    2023-12-05 18:19    37  ******************
 ...    ..(  8 skipped).    ..  ******************
 177    2023-12-05 18:28    37  ******************
 178    2023-12-05 18:29    38  *******************
 179    2023-12-05 18:30    38  *******************
 180    2023-12-05 18:31    37  ******************
 ...    ..( 27 skipped).    ..  ******************
 208    2023-12-05 18:59    37  ******************
 209    2023-12-05 19:00    38  *******************
 ...    ..( 13 skipped).    ..  *******************
 223    2023-12-05 19:14    38  *******************
 224    2023-12-05 19:15    37  ******************
 225    2023-12-05 19:16    37  ******************
 226    2023-12-05 19:17    37  ******************
 227    2023-12-05 19:18    38  *******************
 228    2023-12-05 19:19    37  ******************
 229    2023-12-05 19:20    38  *******************
 230    2023-12-05 19:21    37  ******************
 231    2023-12-05 19:22    38  *******************
 ...    ..(  6 skipped).    ..  *******************
 238    2023-12-05 19:29    38  *******************
 239    2023-12-05 19:30    37  ******************
 ...    ..( 37 skipped).    ..  ******************
 277    2023-12-05 20:08    37  ******************
 278    2023-12-05 20:09    38  *******************
 ...    ..(  5 skipped).    ..  *******************
 284    2023-12-05 20:15    38  *******************
 285    2023-12-05 20:16    37  ******************
 286    2023-12-05 20:17    37  ******************
 287    2023-12-05 20:18    37  ******************
 288    2023-12-05 20:19    38  *******************
 ...    ..(  5 skipped).    ..  *******************
 294    2023-12-05 20:25    38  *******************
 295    2023-12-05 20:26    37  ******************
 296    2023-12-05 20:27    37  ******************
 297    2023-12-05 20:28    38  *******************
 298    2023-12-05 20:29    37  ******************
 ...    ..( 39 skipped).    ..  ******************
 338    2023-12-05 21:09    37  ******************
 339    2023-12-05 21:10    38  *******************
 340    2023-12-05 21:11    38  *******************
 341    2023-12-05 21:12    38  *******************
 342    2023-12-05 21:13    37  ******************

SCT Error Recovery Control:
           Read: Disabled
          Write: Disabled

Device Statistics (GP Log 0x04)
Page  Offset Size        Value Flags Description
0x01  =====  =               =  ===  == General Statistics (rev 2) ==
0x01  0x008  4            2105  ---  Lifetime Power-On Resets
0x01  0x018  6    116529298879  ---  Logical Sectors Written
0x01  0x020  6       935717041  ---  Number of Write Commands
0x01  0x028  6    216861373717  ---  Logical Sectors Read
0x01  0x030  6       697298972  ---  Number of Read Commands
0x04  =====  =               =  ===  == General Errors Statistics (rev 1) ==
0x04  0x008  4               0  ---  Number of Reported Uncorrectable Errors
0x04  0x010  4               0  ---  Resets Between Cmd Acceptance and Completion
0x05  =====  =               =  ===  == Temperature Statistics (rev 1) ==
0x05  0x008  1              38  ---  Current Temperature
0x05  0x010  1              36  ---  Average Short Term Temperature
0x05  0x018  1              39  ---  Average Long Term Temperature
0x05  0x020  1              73  ---  Highest Temperature
0x05  0x028  1              15  ---  Lowest Temperature
0x05  0x030  1              51  ---  Highest Average Short Term Temperature
0x05  0x038  1              16  ---  Lowest Average Short Term Temperature
0x05  0x040  1              49  ---  Highest Average Long Term Temperature
0x05  0x048  1              25  ---  Lowest Average Long Term Temperature
0x05  0x050  4              60  ---  Time in Over-Temperature
0x05  0x058  1              70  ---  Specified Maximum Operating Temperature
0x05  0x060  4               0  ---  Time in Under-Temperature
0x05  0x068  1               0  ---  Specified Minimum Operating Temperature
0x06  =====  =               =  ===  == Transport Statistics (rev 1) ==
0x06  0x008  4           15825  ---  Number of Hardware Resets
0x06  0x010  4           10448  ---  Number of ASR Events
0x06  0x018  4               0  ---  Number of Interface CRC Errors
0x07  =====  =               =  ===  == Solid State Device Statistics (rev 1) ==
0x07  0x008  1               8  ---  Percentage Used Endurance Indicator
                                |||_ C monitored condition met
                                ||__ D supports DSN
                                |___ N normalized value

Pending Defects log (GP Log 0x0c) not supported

SATA Phy Event Counters (GP Log 0x11)
ID      Size     Value  Description
0x0001  4            0  Command failed due to ICRC error
0x0003  4            0  R_ERR response for device-to-host data FIS
0x0004  4            0  R_ERR response for host-to-device data FIS
0x0006  4            0  R_ERR response for device-to-host non-data FIS
0x000a  4            7  Device-to-host register FISes sent due to a COMRESET
0x000b  4            0  CRC errors within host-to-device FIS
0x000d  4            0  Non-CRC errors within host-to-device FIS

