smartctl 7.1 2020-04-05 r5049 [aarch64-linux-4.18.0-305.3.1.el8.aarch64] (local build)
Copyright (C) 2002-19, Bruce Allen, Christian Franke, www.smartmontools.org

=== START OF INFORMATION SECTION ===
Device Model:     SK HYNIX SE5110 3840GB ZIRCON LITE 3DTLC
Serial Number:    1_5-COM55-E7A1
LU WWN Device Id: 5 936463 245303442
Firmware Version: 410A5Z00
User Capacity:    3,840,755,982,336 bytes [3.84 TB]
Sector Sizes:     512 bytes logical, 4096 bytes physical
Rotation Rate:    Solid State Device
Form Factor:      2.5 inches
Device is:        Not in smartctl database [for details use: -P showall]
ATA Version is:   ACS-4 (minor revision not indicated)
SATA Version is:  SATA 3.3, 6.0 Gb/s (current: 6.0 Gb/s)
Local Time is:    Mon Nov 27 20:15:23 2023 EST
SMART support is: Available - device has SMART capability.
SMART support is: Enabled
AAM feature is:   Unavailable
APM feature is:   Unavailable
Rd look-ahead is: Enabled
Write cache is:   Enabled
DSN feature is:   Unavailable
ATA Security is:  Disabled, NOT FROZEN [SEC1]
Wt Cache Reorder: Enabled

=== START OF READ SMART DATA SECTION ===
SMART overall-health self-assessment test result: PASSED

General SMART Values:
Offline data collection status:  (0x02)	Offline data collection activity
					was completed without error.
					Auto Offline Data Collection: Disabled.
Self-test execution status:      (   0)	The previous self-test routine completed
					without error or no self-test has ever 
					been run.
Total time to complete Offline 
data collection: 		(  110) seconds.
Offline data collection
capabilities: 			 (0x79) SMART execute Offline immediate.
					No Auto Offline data collection support.
					Suspend Offline collection upon new
					command.
					Offline surface scan supported.
					Self-test supported.
					Conveyance Self-test supported.
					Selective Self-test supported.
SMART capabilities:            (0x0002)	Does not save SMART data before
					entering power-saving mode.
					Supports SMART auto save timer.
Error logging capability:        (0x01)	Error logging supported.
					General Purpose Logging supported.
Short self-test routine 
recommended polling time: 	 (   2) minutes.
Extended self-test routine
recommended polling time: 	 (  16) minutes.
Conveyance self-test routine
recommended polling time: 	 (   2) minutes.
SCT capabilities: 	       (0x003d)	SCT Status supported.
					SCT Error Recovery Control supported.
					SCT Feature Control supported.
					SCT Data Table supported.

SMART Attributes Data Structure revision number: 0
Vendor Specific SMART Attributes with Thresholds:
ID# ATTRIBUTE_NAME          FLAGS    VALUE WORST THRESH FAIL RAW_VALUE
  1 Raw_Read_Error_Rate     -OSR--   100   100   006    -    0
  5 Reallocated_Sector_Ct   PO--CK   100   100   002    -    0
  9 Power_On_Hours          -O--CK   100   100   000    -    311
 12 Power_Cycle_Count       -O--CK   100   100   000    -    5708
 13 Read_Soft_Error_Rate    -OSR-K   100   100   000    -    0
173 Unknown_Attribute       -O--CK   099   099   000    -    110
174 Unknown_Attribute       ----CK   100   100   000    -    5336
175 Program_Fail_Count_Chip -O--CK   100   100   000    -    28
179 Used_Rsvd_Blk_Cnt_Tot   PO--CK   100   100   002    -    0
181 Program_Fail_Cnt_Total  -O--CK   100   100   000    -    0
182 Erase_Fail_Count_Total  -O--CK   100   100   000    -    0
184 End-to-End_Error        -O--CK   100   100   000    -    0
187 Reported_Uncorrect      -O--CK   100   100   000    -    0
194 Temperature_Celsius     -O----   060   053   000    -    40 (Min/Max 30/47)
195 Hardware_ECC_Recovered  -O-RC-   100   100   000    -    0
197 Current_Pending_Sector  -O--CK   100   100   000    -    0
198 Offline_Uncorrectable   ----C-   100   100   000    -    0
199 UDMA_CRC_Error_Count    -OSRCK   100   100   000    -    0
202 Unknown_SSD_Attribute   PO--CK   100   100   050    -    0
203 Run_Out_Cancel          PO--CK   100   100   050    -    0
231 Temperature_Celsius     PO--CK   100   100   001    -    100
235 Unknown_Attribute       -O--CK   100   100   000    -    51268
241 Total_LBAs_Written      -O--CK   100   100   000    -    65256
242 Total_LBAs_Read         -O--CK   100   100   000    -    114118
                            ||||||_ K auto-keep
                            |||||__ C event count
                            ||||___ R error rate
                            |||____ S speed/performance
                            ||_____ O updated online
                            |______ P prefailure warning

General Purpose Log Directory Version 1
SMART           Log Directory Version 1 [multi-sector log support]
Address    Access  R/W   Size  Description
0x00       GPL,SL  R/O      1  Log Directory
0x01           SL  R/O      1  Summary SMART error log
0x02           SL  R/O      4  Comprehensive SMART error log
0x03       GPL     R/O      5  Ext. Comprehensive SMART error log
0x04       GPL,SL  R/O      8  Device Statistics log
0x06           SL  R/O      1  SMART self-test log
0x07       GPL     R/O      2  Extended self-test log
0x09           SL  R/W      1  Selective self-test log
0x10       GPL     R/O      1  NCQ Command Error log
0x11       GPL     R/O      1  SATA Phy Event Counters log
0x30       GPL,SL  R/O      9  IDENTIFY DEVICE data log
0x80-0x9f  GPL,SL  R/W     16  Host vendor specific log
0xe0       GPL,SL  R/W      1  SCT Command/Status
0xe1       GPL,SL  R/W      1  SCT Data Transfer

SMART Extended Comprehensive Error Log Version: 1 (5 sectors)
No Errors Logged

SMART Extended Self-test Log Version: 1 (2 sectors)
Num  Test_Description    Status                  Remaining  LifeTime(hours)  LBA_of_first_error
# 1  Short offline       Completed without error       00%       311         -

SMART Selective self-test log data structure revision number 1
 SPAN  MIN_LBA  MAX_LBA  CURRENT_TEST_STATUS
    1        0        0  Not_testing
    2        0        0  Not_testing
    3        0        0  Not_testing
    4        0        0  Not_testing
    5        0        0  Not_testing
Selective self-test flags (0x0):
  After scanning selected spans, do NOT read-scan remainder of disk.
If Selective self-test is pending on power-up, resume after 0 minute delay.

SCT Status Version:                  3
SCT Version (vendor specific):       1 (0x0001)
Device State:                        Active (0)
Current Temperature:                    40 Celsius
Power Cycle Min/Max Temperature:     40/41 Celsius
Lifetime    Min/Max Temperature:     30/47 Celsius
Specified Max Operating Temperature:    65 Celsius
Under/Over Temperature Limit Count:   0/0
SMART Status:                        0xc24f (PASSED)

SCT Temperature History Version:     2
Temperature Sampling Period:         1 minute
Temperature Logging Interval:        1 minute
Min/Max recommended Temperature:     -20/65 Celsius
Min/Max Temperature Limit:           -20/125 Celsius
Temperature History Size (Index):    192 (49)

Index    Estimated Time   Temperature Celsius
  50    2023-11-27 17:04     ?  -
 ...    ..( 29 skipped).    ..  -
  80    2023-11-27 17:34     ?  -
  81    2023-11-27 17:35    36  *****************
  82    2023-11-27 17:36    35  ****************
  83    2023-11-27 17:37    35  ****************
  84    2023-11-27 17:38    35  ****************
  85    2023-11-27 17:39    36  *****************
  86    2023-11-27 17:40     ?  -
 ...    ..( 31 skipped).    ..  -
 118    2023-11-27 18:12     ?  -
 119    2023-11-27 18:13    35  ****************
 120    2023-11-27 18:14    35  ****************
 121    2023-11-27 18:15    35  ****************
 122    2023-11-27 18:16    36  *****************
 123    2023-11-27 18:17     ?  -
 ...    ..( 31 skipped).    ..  -
 155    2023-11-27 18:49     ?  -
 156    2023-11-27 18:50    36  *****************
 157    2023-11-27 18:51    35  ****************
 158    2023-11-27 18:52    35  ****************
 159    2023-11-27 18:53    35  ****************
 160    2023-11-27 18:54     ?  -
 ...    ..( 31 skipped).    ..  -
   0    2023-11-27 19:26     ?  -
   1    2023-11-27 19:27    36  *****************
   2    2023-11-27 19:28    36  *****************
   3    2023-11-27 19:29    35  ****************
   4    2023-11-27 19:30    35  ****************
   5    2023-11-27 19:31    36  *****************
   6    2023-11-27 19:32    36  *****************
   7    2023-11-27 19:33    36  *****************
   8    2023-11-27 19:34    35  ****************
   9    2023-11-27 19:35    35  ****************
  10    2023-11-27 19:36    34  ***************
  11    2023-11-27 19:37    34  ***************
  12    2023-11-27 19:38    33  **************
 ...    ..(  2 skipped).    ..  **************
  15    2023-11-27 19:41    33  **************
  16    2023-11-27 19:42    34  ***************
  17    2023-11-27 19:43    34  ***************
  18    2023-11-27 19:44    33  **************
 ...    ..(  4 skipped).    ..  **************
  23    2023-11-27 19:49    33  **************
  24    2023-11-27 19:50    34  ***************
  25    2023-11-27 19:51    34  ***************
  26    2023-11-27 19:52    34  ***************
  27    2023-11-27 19:53    33  **************
  28    2023-11-27 19:54     ?  -
  29    2023-11-27 19:55    36  *****************
  30    2023-11-27 19:56     ?  -
  31    2023-11-27 19:57    38  *******************
  32    2023-11-27 19:58    40  *********************
 ...    ..(  2 skipped).    ..  *********************
  35    2023-11-27 20:01    40  *********************
  36    2023-11-27 20:02     ?  -
  37    2023-11-27 20:03     ?  -
  38    2023-11-27 20:04     ?  -
  39    2023-11-27 20:05    40  *********************
 ...    ..(  4 skipped).    ..  *********************
  44    2023-11-27 20:10    40  *********************
  45    2023-11-27 20:11    41  **********************
  46    2023-11-27 20:12    41  **********************
  47    2023-11-27 20:13    40  *********************
  48    2023-11-27 20:14    40  *********************
  49    2023-11-27 20:15    40  *********************

SCT Error Recovery Control:
           Read:     80 (8.0 seconds)
          Write:     80 (8.0 seconds)

Device Statistics (GP Log 0x04)
Page  Offset Size        Value Flags Description
0x01  =====  =               =  ===  == General Statistics (rev 1) ==
0x01  0x008  4            5708  ---  Lifetime Power-On Resets
0x01  0x010  4             311  ---  Power-on Hours
0x01  0x018  6    107517185780  ---  Logical Sectors Written
0x01  0x020  6      3408295887  ---  Number of Write Commands
0x01  0x028  6    239324713554  ---  Logical Sectors Read
0x01  0x030  6      8357622433  ---  Number of Read Commands
0x01  0x038  6      1119600000  ---  Date and Time TimeStamp
0x04  =====  =               =  ===  == General Errors Statistics (rev 1) ==
0x04  0x008  4               0  ---  Number of Reported Uncorrectable Errors
0x04  0x010  4               0  ---  Resets Between Cmd Acceptance and Completion
0x05  =====  =               =  ===  == Temperature Statistics (rev 1) ==
0x05  0x008  1              40  ---  Current Temperature
0x05  0x010  1              34  ---  Average Short Term Temperature
0x05  0x018  1               -  ---  Average Long Term Temperature
0x05  0x020  1              47  ---  Highest Temperature
0x05  0x028  1              30  ---  Lowest Temperature
0x05  0x030  1              39  ---  Highest Average Short Term Temperature
0x05  0x038  1              34  ---  Lowest Average Short Term Temperature
0x05  0x040  1               -  ---  Highest Average Long Term Temperature
0x05  0x048  1               -  ---  Lowest Average Long Term Temperature
0x05  0x050  4               0  ---  Time in Over-Temperature
0x05  0x058  1              65  ---  Specified Maximum Operating Temperature
0x05  0x060  4               0  ---  Time in Under-Temperature
0x05  0x068  1             -20  ---  Specified Minimum Operating Temperature
0x06  =====  =               =  ===  == Transport Statistics (rev 1) ==
0x06  0x008  4         1042538  ---  Number of Hardware Resets
0x06  0x018  4               0  ---  Number of Interface CRC Errors
0x07  =====  =               =  ===  == Solid State Device Statistics (rev 1) ==
0x07  0x008  1               0  ---  Percentage Used Endurance Indicator
                                |||_ C monitored condition met
                                ||__ D supports DSN
                                |___ N normalized value

Pending Defects log (GP Log 0x0c) not supported

SATA Phy Event Counters (GP Log 0x11)
ID      Size     Value  Description
0x0001  2            0  Command failed due to ICRC error
0x0003  2            0  R_ERR response for device-to-host data FIS
0x0004  2            0  R_ERR response for host-to-device data FIS
0x0006  2            0  R_ERR response for device-to-host non-data FIS
0x000a  2            2  Device-to-host register FISes sent due to a COMRESET
0x000b  2            0  CRC errors within host-to-device FIS
0x000d  2            0  Non-CRC errors within host-to-device FIS

