smartctl 7.1 2020-04-05 r5049 [aarch64-linux-4.18.0-305.3.1.el8.aarch64] (local build)
Copyright (C) 2002-19, Bruce Allen, Christian Franke, www.smartmontools.org

=== START OF INFORMATION SECTION ===
Device Model:     SK HYNIX SE5110 960GB ZIRCON LITE 3DTLC
Serial Number:    4_1-COM81-1F88
LU WWN Device Id: 5 145323 834423544
Firmware Version: 41093Z00
User Capacity:    960,197,124,096 bytes [960 GB]
Sector Sizes:     512 bytes logical, 4096 bytes physical
Rotation Rate:    Solid State Device
Form Factor:      2.5 inches
Device is:        Not in smartctl database [for details use: -P showall]
ATA Version is:   ACS-4 (minor revision not indicated)
SATA Version is:  SATA 3.3, 6.0 Gb/s (current: 6.0 Gb/s)
Local Time is:    Mon Nov 27 20:22:19 2023 EST
SMART support is: Available - device has SMART capability.
SMART support is: Enabled
AAM feature is:   Unavailable
APM feature is:   Unavailable
Rd look-ahead is: Enabled
Write cache is:   Enabled
DSN feature is:   Unavailable
ATA Security is:  Disabled, NOT FROZEN [SEC1]
Wt Cache Reorder: Enabled

=== START OF READ SMART DATA SECTION ===
SMART overall-health self-assessment test result: PASSED

General SMART Values:
Offline data collection status:  (0x02)	Offline data collection activity
					was completed without error.
					Auto Offline Data Collection: Disabled.
Self-test execution status:      (   0)	The previous self-test routine completed
					without error or no self-test has ever 
					been run.
Total time to complete Offline 
data collection: 		(  110) seconds.
Offline data collection
capabilities: 			 (0x59) SMART execute Offline immediate.
					No Auto Offline data collection support.
					Suspend Offline collection upon new
					command.
					Offline surface scan supported.
					Self-test supported.
					No Conveyance Self-test supported.
					Selective Self-test supported.
SMART capabilities:            (0x0002)	Does not save SMART data before
					entering power-saving mode.
					Supports SMART auto save timer.
Error logging capability:        (0x01)	Error logging supported.
					General Purpose Logging supported.
Short self-test routine 
recommended polling time: 	 (   2) minutes.
Extended self-test routine
recommended polling time: 	 (  16) minutes.
SCT capabilities: 	       (0x003d)	SCT Status supported.
					SCT Error Recovery Control supported.
					SCT Feature Control supported.
					SCT Data Table supported.

SMART Attributes Data Structure revision number: 0
Vendor Specific SMART Attributes with Thresholds:
ID# ATTRIBUTE_NAME          FLAGS    VALUE WORST THRESH FAIL RAW_VALUE
  1 Raw_Read_Error_Rate     POSR--   100   100   006    -    0
  5 Reallocated_Sector_Ct   -O--CK   100   100   036    -    0
  9 Power_On_Hours          -O--CK   100   100   000    -    786
 12 Power_Cycle_Count       -O--CK   100   100   020    -    457
171 Unknown_Attribute       PO--CK   100   100   050    -    0
172 Unknown_Attribute       -O--CK   100   100   000    -    0
174 Unknown_Attribute       ----CK   100   100   000    -    306
175 Program_Fail_Count_Chip PO--CK   100   100   050    -    0
176 Erase_Fail_Count_Chip   -O--CK   100   100   000    -    0
177 Wear_Leveling_Count     -O--CK   100   100   000    -    100
178 Used_Rsvd_Blk_Cnt_Chip  -O--CK   100   100   000    -    0
179 Used_Rsvd_Blk_Cnt_Tot   -O--CK   100   100   000    -    0
180 Unused_Rsvd_Blk_Cnt_Tot PO-RCK   100   100   006    -    0
181 Program_Fail_Cnt_Total  -O--CK   100   100   000    -    0
182 Erase_Fail_Count_Total  -O--CK   100   100   000    -    0
183 Runtime_Bad_Block       -O--CK   100   100   000    -    0
184 End-to-End_Error        -O--CK   100   100   000    -    0
187 Reported_Uncorrect      -O--CK   100   100   000    -    0
188 Command_Timeout         -O--CK   100   100   000    -    0
194 Temperature_Celsius     -O----   061   060   000    -    39 (Min/Max 30/40)
195 Hardware_ECC_Recovered  -O--CK   100   100   000    -    0
199 UDMA_CRC_Error_Count    -OSRCK   100   100   000    -    0
201 Unknown_SSD_Attribute   -OSR--   100   100   000    -    0
204 Soft_ECC_Correction     -OSR--   100   100   000    -    0
231 Temperature_Celsius     PO--CK   100   100   001    -    100
234 Unknown_Attribute       -O--CK   100   100   000    -    724
241 Total_LBAs_Written      -O--CK   100   100   000    -    317
242 Total_LBAs_Read         -O--CK   100   100   000    -    556
245 Unknown_Attribute       PO--CK   100   100   001    -    100
250 Read_Error_Retry_Rate   -O--CK   100   100   000    -    1489975
                            ||||||_ K auto-keep
                            |||||__ C event count
                            ||||___ R error rate
                            |||____ S speed/performance
                            ||_____ O updated online
                            |______ P prefailure warning

General Purpose Log Directory Version 1
SMART           Log Directory Version 1 [multi-sector log support]
Address    Access  R/W   Size  Description
0x00       GPL,SL  R/O      1  Log Directory
0x01           SL  R/O      1  Summary SMART error log
0x03       GPL     R/O      5  Ext. Comprehensive SMART error log
0x04       GPL,SL  R/O      8  Device Statistics log
0x06           SL  R/O      1  SMART self-test log
0x07       GPL     R/O      2  Extended self-test log
0x09           SL  R/W      1  Selective self-test log
0x10       GPL     R/O      1  NCQ Command Error log
0x11       GPL     R/O      1  SATA Phy Event Counters log
0x24       GPL     R/O   6144  Current Device Internal Status Data log
0x25       GPL     R/O   6144  Saved Device Internal Status Data log
0x30       GPL,SL  R/O      9  IDENTIFY DEVICE data log
0x80-0x9f  GPL,SL  R/W     16  Host vendor specific log
0xe0       GPL,SL  R/W      1  SCT Command/Status
0xe1       GPL,SL  R/W      1  SCT Data Transfer

SMART Extended Comprehensive Error Log Version: 1 (5 sectors)
No Errors Logged

SMART Extended Self-test Log Version: 1 (2 sectors)
Num  Test_Description    Status                  Remaining  LifeTime(hours)  LBA_of_first_error
# 1  Short offline       Completed without error       00%       786         -

SMART Selective self-test log data structure revision number 1
 SPAN  MIN_LBA  MAX_LBA  CURRENT_TEST_STATUS
    1        0        0  Not_testing
    2        0        0  Not_testing
    3        0        0  Not_testing
    4        0        0  Not_testing
    5        0        0  Not_testing
Selective self-test flags (0x0):
  After scanning selected spans, do NOT read-scan remainder of disk.
If Selective self-test is pending on power-up, resume after 0 minute delay.

SCT Status Version:                  3
SCT Version (vendor specific):       1 (0x0001)
Device State:                        Active (0)
Current Temperature:                    39 Celsius
Power Cycle Min/Max Temperature:     39/40 Celsius
Lifetime    Min/Max Temperature:     30/40 Celsius
Specified Max Operating Temperature:    65 Celsius
Under/Over Temperature Limit Count:   0/0
SMART Status:                        0xc24f (PASSED)

SCT Temperature History Version:     2
Temperature Sampling Period:         1 minute
Temperature Logging Interval:        1 minute
Min/Max recommended Temperature:     -20/65 Celsius
Min/Max Temperature Limit:           -20/125 Celsius
Temperature History Size (Index):    192 (130)

Index    Estimated Time   Temperature Celsius
 131    2023-11-27 17:11    37  ******************
 132    2023-11-27 17:12    38  *******************
 133    2023-11-27 17:13    38  *******************
 134    2023-11-27 17:14    38  *******************
 135    2023-11-27 17:15    37  ******************
 ...    ..(  9 skipped).    ..  ******************
 145    2023-11-27 17:25    37  ******************
 146    2023-11-27 17:26    38  *******************
 147    2023-11-27 17:27    37  ******************
 ...    ..(  5 skipped).    ..  ******************
 153    2023-11-27 17:33    37  ******************
 154    2023-11-27 17:34    38  *******************
 155    2023-11-27 17:35    37  ******************
 156    2023-11-27 17:36    38  *******************
 157    2023-11-27 17:37    37  ******************
 158    2023-11-27 17:38    37  ******************
 159    2023-11-27 17:39    38  *******************
 ...    ..(  4 skipped).    ..  *******************
 164    2023-11-27 17:44    38  *******************
 165    2023-11-27 17:45    37  ******************
 ...    ..( 20 skipped).    ..  ******************
 186    2023-11-27 18:06    37  ******************
 187    2023-11-27 18:07    38  *******************
 188    2023-11-27 18:08    38  *******************
 189    2023-11-27 18:09    38  *******************
 190    2023-11-27 18:10    37  ******************
 ...    ..( 47 skipped).    ..  ******************
  46    2023-11-27 18:58    37  ******************
  47    2023-11-27 18:59    38  *******************
  48    2023-11-27 19:00    37  ******************
 ...    ..( 14 skipped).    ..  ******************
  63    2023-11-27 19:15    37  ******************
  64    2023-11-27 19:16    38  *******************
  65    2023-11-27 19:17    38  *******************
  66    2023-11-27 19:18    38  *******************
  67    2023-11-27 19:19    37  ******************
  68    2023-11-27 19:20    38  *******************
  69    2023-11-27 19:21    38  *******************
  70    2023-11-27 19:22    37  ******************
  71    2023-11-27 19:23    37  ******************
  72    2023-11-27 19:24    38  *******************
  73    2023-11-27 19:25    37  ******************
 ...    ..( 12 skipped).    ..  ******************
  86    2023-11-27 19:38    37  ******************
  87    2023-11-27 19:39    38  *******************
  88    2023-11-27 19:40    38  *******************
  89    2023-11-27 19:41    37  ******************
  90    2023-11-27 19:42    38  *******************
  91    2023-11-27 19:43    37  ******************
  92    2023-11-27 19:44    38  *******************
  93    2023-11-27 19:45    38  *******************
  94    2023-11-27 19:46    37  ******************
 ...    ..( 14 skipped).    ..  ******************
 109    2023-11-27 20:01    37  ******************
 110    2023-11-27 20:02    36  *****************
 111    2023-11-27 20:03     ?  -
 112    2023-11-27 20:04     ?  -
 113    2023-11-27 20:05    35  ****************
 114    2023-11-27 20:06    37  ******************
 115    2023-11-27 20:07    38  *******************
 ...    ..(  2 skipped).    ..  *******************
 118    2023-11-27 20:10    38  *******************
 119    2023-11-27 20:11     ?  -
 120    2023-11-27 20:12    39  ********************
 121    2023-11-27 20:13    39  ********************
 122    2023-11-27 20:14    39  ********************
 123    2023-11-27 20:15    38  *******************
 ...    ..(  3 skipped).    ..  *******************
 127    2023-11-27 20:19    38  *******************
 128    2023-11-27 20:20     ?  -
 129    2023-11-27 20:21    39  ********************
 130    2023-11-27 20:22    40  *********************

SCT Error Recovery Control:
           Read:     80 (8.0 seconds)
          Write:     80 (8.0 seconds)

Device Statistics (GP Log 0x04)
Page  Offset Size        Value Flags Description
0x01  =====  =               =  ===  == General Statistics (rev 1) ==
0x01  0x008  4             457  ---  Lifetime Power-On Resets
0x01  0x010  4             786  ---  Power-on Hours
0x01  0x018  6       666743625  ---  Logical Sectors Written
0x01  0x020  6         6546083  ---  Number of Write Commands
0x01  0x028  6      1166502167  ---  Logical Sectors Read
0x01  0x030  6        20525964  ---  Number of Read Commands
0x01  0x038  6   1675347721350  ---  Date and Time TimeStamp
0x04  =====  =               =  ===  == General Errors Statistics (rev 1) ==
0x04  0x008  4               0  ---  Number of Reported Uncorrectable Errors
0x04  0x010  4               0  ---  Resets Between Cmd Acceptance and Completion
0x05  =====  =               =  ===  == Temperature Statistics (rev 1) ==
0x05  0x008  1              39  ---  Current Temperature
0x05  0x010  1               -  ---  Average Short Term Temperature
0x05  0x018  1               -  ---  Average Long Term Temperature
0x05  0x020  1              40  ---  Highest Temperature
0x05  0x028  1              30  ---  Lowest Temperature
0x05  0x030  1              38  ---  Highest Average Short Term Temperature
0x05  0x038  1              36  ---  Lowest Average Short Term Temperature
0x05  0x040  1               -  ---  Highest Average Long Term Temperature
0x05  0x048  1               -  ---  Lowest Average Long Term Temperature
0x05  0x050  4               0  ---  Time in Over-Temperature
0x05  0x058  1              65  ---  Specified Maximum Operating Temperature
0x05  0x060  4               0  ---  Time in Under-Temperature
0x05  0x068  1             -20  ---  Specified Minimum Operating Temperature
0x06  =====  =               =  ===  == Transport Statistics (rev 1) ==
0x06  0x008  4          139008  ---  Number of Hardware Resets
0x06  0x018  4               0  ---  Number of Interface CRC Errors
0x07  =====  =               =  ===  == Solid State Device Statistics (rev 1) ==
0x07  0x008  1               0  ---  Percentage Used Endurance Indicator
                                |||_ C monitored condition met
                                ||__ D supports DSN
                                |___ N normalized value

Pending Defects log (GP Log 0x0c) not supported

SATA Phy Event Counters (GP Log 0x11)
ID      Size     Value  Description
0x0001  2            0  Command failed due to ICRC error
0x0003  2            0  R_ERR response for device-to-host data FIS
0x0004  2            0  R_ERR response for host-to-device data FIS
0x0006  2            0  R_ERR response for device-to-host non-data FIS
0x000a  2            0  Device-to-host register FISes sent due to a COMRESET
0x000b  2            0  CRC errors within host-to-device FIS
0x000d  2            0  Non-CRC errors within host-to-device FIS

